10:04:38.367606 IP 10.6.255.226.12345 > 10.0.0.2.12345: UDP, length 16
10:04:39.368025 IP 10.107.239.173.12345 > 10.0.0.2.12345: UDP, length 16
10:04:40.368372 IP 10.106.245.70.12345 > 10.0.0.2.12345: UDP, length 16
10:04:41.368571 IP 10.114.49.238.12345 > 10.0.0.2.12345: UDP, length 16
10:04:42.368879 IP 10.63.222.119.12345 > 10.0.0.2.12345: UDP, length 16
10:04:43.369239 IP 10.31.102.87.12345 > 10.0.0.2.12345: UDP, length 16
10:04:44.369582 IP 10.38.97.252.12345 > 10.0.0.2.12345: UDP, length 16
10:04:45.369980 IP 10.72.252.168.12345 > 10.0.0.2.12345: UDP, length 16
10:04:46.370341 IP 10.5.224.208.12345 > 10.0.0.2.12345: UDP, length 16
10:04:47.370623 IP 10.80.115.178.12345 > 10.0.0.2.12345: UDP, length 16
10:04:48.370998 IP 10.65.12.110.12345 > 10.0.0.2.12345: UDP, length 16
10:04:49.371301 IP 10.6.106.123.12345 > 10.0.0.2.12345: UDP, length 16
10:04:50.371636 IP 10.18.200.29.12345 > 10.0.0.2.12345: UDP, length 16
10:04:51.371955 IP 10.86.151.173.12345 > 10.0.0.2.12345: UDP, length 16
10:04:52.372268 IP 10.63.214.252.12345 > 10.0.0.2.12345: UDP, length 16
10:04:53.372479 IP 10.114.95.116.12345 > 10.0.0.2.12345: UDP, length 16
10:04:54.372764 IP 10.82.14.132.12345 > 10.0.0.2.12345: UDP, length 16
10:04:55.373086 IP 10.0.196.254.12345 > 10.0.0.2.12345: UDP, length 16
10:04:56.373424 IP 10.57.194.65.12345 > 10.0.0.2.12345: UDP, length 16
10:04:57.373790 IP 10.120.219.25.12345 > 10.0.0.2.12345: UDP, length 16
10:04:58.374122 IP 10.44.220.23.12345 > 10.0.0.2.12345: UDP, length 16
10:04:59.374489 IP 10.101.50.3.12345 > 10.0.0.2.12345: UDP, length 16
10:05:00.374844 IP 10.56.184.251.12345 > 10.0.0.2.12345: UDP, length 16
10:05:01.375200 IP 10.101.100.113.12345 > 10.0.0.2.12345: UDP, length 16
10:05:02.375605 IP 10.21.93.241.12345 > 10.0.0.2.12345: UDP, length 16
10:05:03.375956 IP 10.21.42.122.12345 > 10.0.0.2.12345: UDP, length 16
10:05:04.376307 IP 10.36.124.158.12345 > 10.0.0.2.12345: UDP, length 16
10:05:05.376627 IP 10.4.96.101.12345 > 10.0.0.2.12345: UDP, length 16
10:05:06.376903 IP 10.65.180.62.12345 > 10.0.0.2.12345: UDP, length 16
10:05:07.377248 IP 10.26.147.183.12345 > 10.0.0.2.12345: UDP, length 16
10:05:08.377585 IP 10.78.41.30.12345 > 10.0.0.2.12345: UDP, length 16
10:05:09.377962 IP 10.18.206.159.12345 > 10.0.0.2.12345: UDP, length 16
10:05:10.378307 IP 10.25.202.76.12345 > 10.0.0.2.12345: UDP, length 16
10:05:11.378691 IP 10.64.104.33.12345 > 10.0.0.2.12345: UDP, length 16
10:05:12.379068 IP 10.23.100.160.12345 > 10.0.0.2.12345: UDP, length 16
10:05:13.379404 IP 10.67.72.206.12345 > 10.0.0.2.12345: UDP, length 16
10:05:14.379752 IP 10.50.224.201.12345 > 10.0.0.2.12345: UDP, length 16
10:05:15.380017 IP 10.120.22.230.12345 > 10.0.0.2.12345: UDP, length 16
10:05:16.380375 IP 10.43.187.199.12345 > 10.0.0.2.12345: UDP, length 16
10:05:17.380709 IP 10.39.104.47.12345 > 10.0.0.2.12345: UDP, length 16
10:05:18.381042 IP 10.105.169.247.12345 > 10.0.0.2.12345: UDP, length 16
10:05:19.381393 IP 10.7.203.154.12345 > 10.0.0.2.12345: UDP, length 16
10:05:20.381750 IP 10.8.17.129.12345 > 10.0.0.2.12345: UDP, length 16
10:05:21.382064 IP 10.8.203.74.12345 > 10.0.0.2.12345: UDP, length 16
10:05:22.382351 IP 10.122.210.243.12345 > 10.0.0.2.12345: UDP, length 16
10:05:23.382634 IP 10.80.80.25.12345 > 10.0.0.2.12345: UDP, length 16
10:05:24.382966 IP 10.18.28.23.12345 > 10.0.0.2.12345: UDP, length 16
10:05:25.383233 IP 10.7.215.74.12345 > 10.0.0.2.12345: UDP, length 16
10:05:26.383561 IP 10.34.194.201.12345 > 10.0.0.2.12345: UDP, length 16
10:05:27.383940 IP 10.109.191.247.12345 > 10.0.0.2.12345: UDP, length 16
10:05:28.384413 IP 10.113.168.15.12345 > 10.0.0.2.12345: UDP, length 16
10:05:29.384777 IP 10.83.220.187.12345 > 10.0.0.2.12345: UDP, length 16
10:05:30.385059 IP 10.108.75.61.12345 > 10.0.0.2.12345: UDP, length 16
10:05:31.385427 IP 10.6.123.133.12345 > 10.0.0.2.12345: UDP, length 16
10:05:32.385708 IP 10.23.218.128.12345 > 10.0.0.2.12345: UDP, length 16
10:05:33.386028 IP 10.121.93.45.12345 > 10.0.0.2.12345: UDP, length 16
10:05:34.386369 IP 10.96.255.90.12345 > 10.0.0.2.12345: UDP, length 16
10:05:35.386681 IP 10.115.170.90.12345 > 10.0.0.2.12345: UDP, length 16
10:05:36.386969 IP 10.33.15.241.12345 > 10.0.0.2.12345: UDP, length 16
10:05:37.387214 IP 10.113.230.63.12345 > 10.0.0.2.12345: UDP, length 16
10:05:38.387555 IP 10.25.175.209.12345 > 10.0.0.2.12345: UDP, length 16
10:05:39.387910 IP 10.102.96.135.12345 > 10.0.0.2.12345: UDP, length 16
10:05:40.388153 IP 10.80.1.30.12345 > 10.0.0.2.12345: UDP, length 16
10:05:41.388438 IP 10.37.247.216.12345 > 10.0.0.2.12345: UDP, length 16
10:05:42.388704 IP 10.89.85.185.12345 > 10.0.0.2.12345: UDP, length 16
10:05:43.389033 IP 10.98.200.225.12345 > 10.0.0.2.12345: UDP, length 16
10:05:44.389286 IP 10.23.59.121.12345 > 10.0.0.2.12345: UDP, length 16
10:05:45.389544 IP 10.127.231.1.12345 > 10.0.0.2.12345: UDP, length 16
10:05:46.389846 IP 10.13.102.114.12345 > 10.0.0.2.12345: UDP, length 16
10:05:47.390107 IP 10.68.255.77.12345 > 10.0.0.2.12345: UDP, length 16
10:05:48.390345 IP 10.18.137.248.12345 > 10.0.0.2.12345: UDP, length 16
10:05:49.390593 IP 10.86.187.175.12345 > 10.0.0.2.12345: UDP, length 16
10:05:50.390866 IP 10.115.21.130.12345 > 10.0.0.2.12345: UDP, length 16
10:05:51.391193 IP 10.54.188.174.12345 > 10.0.0.2.12345: UDP, length 16
10:05:52.391452 IP 10.105.243.118.12345 > 10.0.0.2.12345: UDP, length 16
10:05:53.391758 IP 10.109.127.55.12345 > 10.0.0.2.12345: UDP, length 16
10:05:54.392009 IP 10.29.150.213.12345 > 10.0.0.2.12345: UDP, length 16
10:05:55.392265 IP 10.109.150.122.12345 > 10.0.0.2.12345: UDP, length 16
10:05:56.392530 IP 10.93.128.170.12345 > 10.0.0.2.12345: UDP, length 16
10:05:57.392773 IP 10.117.45.249.12345 > 10.0.0.2.12345: UDP, length 16
10:05:58.393071 IP 10.61.70.77.12345 > 10.0.0.2.12345: UDP, length 16
10:05:59.393350 IP 10.37.147.90.12345 > 10.0.0.2.12345: UDP, length 16
10:06:00.393602 IP 10.49.126.152.12345 > 10.0.0.2.12345: UDP, length 16
10:06:01.393874 IP 10.122.23.167.12345 > 10.0.0.2.12345: UDP, length 16
10:06:02.394086 IP 10.80.194.81.12345 > 10.0.0.2.12345: UDP, length 16
10:06:03.394248 IP 10.66.209.113.12345 > 10.0.0.2.12345: UDP, length 16
10:06:04.394507 IP 10.85.112.185.12345 > 10.0.0.2.12345: UDP, length 16
10:06:05.394791 IP 10.94.190.163.12345 > 10.0.0.2.12345: UDP, length 16
10:06:06.394977 IP 10.35.154.177.12345 > 10.0.0.2.12345: UDP, length 16
10:06:07.395275 IP 10.70.152.241.12345 > 10.0.0.2.12345: UDP, length 16
10:06:08.395560 IP 10.70.192.76.12345 > 10.0.0.2.12345: UDP, length 16
10:06:09.395836 IP 10.100.128.181.12345 > 10.0.0.2.12345: UDP, length 16
10:06:10.396176 IP 10.30.244.100.12345 > 10.0.0.2.12345: UDP, length 16
10:06:11.396493 IP 10.88.103.84.12345 > 10.0.0.2.12345: UDP, length 16
10:06:12.396837 IP 10.120.230.0.12345 > 10.0.0.2.12345: UDP, length 16
10:06:13.397194 IP 10.68.198.242.12345 > 10.0.0.2.12345: UDP, length 16
10:06:14.397563 IP 10.54.21.146.12345 > 10.0.0.2.12345: UDP, length 16
10:06:15.397897 IP 10.127.64.61.12345 > 10.0.0.2.12345: UDP, length 16
10:06:16.398210 IP 10.21.252.211.12345 > 10.0.0.2.12345: UDP, length 16
10:06:17.398574 IP 10.75.162.78.12345 > 10.0.0.2.12345: UDP, length 16
10:06:18.398934 IP 10.49.237.19.12345 > 10.0.0.2.12345: UDP, length 16
10:06:19.399326 IP 10.97.145.61.12345 > 10.0.0.2.12345: UDP, length 16
10:06:20.399656 IP 10.114.58.247.12345 > 10.0.0.2.12345: UDP, length 16
10:06:21.399963 IP 10.67.102.212.12345 > 10.0.0.2.12345: UDP, length 16
10:06:22.400236 IP 10.56.242.134.12345 > 10.0.0.2.12345: UDP, length 16
10:06:23.400574 IP 10.113.76.8.12345 > 10.0.0.2.12345: UDP, length 16
10:06:24.400930 IP 10.16.71.34.12345 > 10.0.0.2.12345: UDP, length 16
10:06:25.401300 IP 10.126.151.180.12345 > 10.0.0.2.12345: UDP, length 16
10:06:26.401635 IP 10.9.225.178.12345 > 10.0.0.2.12345: UDP, length 16
10:06:27.401910 IP 10.100.136.251.12345 > 10.0.0.2.12345: UDP, length 16
10:06:28.402237 IP 10.43.144.242.12345 > 10.0.0.2.12345: UDP, length 16
10:06:29.402542 IP 10.113.192.140.12345 > 10.0.0.2.12345: UDP, length 16
10:06:30.402830 IP 10.89.92.174.12345 > 10.0.0.2.12345: UDP, length 16
10:06:31.403114 IP 10.40.10.71.12345 > 10.0.0.2.12345: UDP, length 16
10:06:32.403359 IP 10.62.9.218.12345 > 10.0.0.2.12345: UDP, length 16
10:06:33.403799 IP 10.121.227.212.12345 > 10.0.0.2.12345: UDP, length 16
10:06:34.404133 IP 10.79.16.132.12345 > 10.0.0.2.12345: UDP, length 16
10:06:35.404427 IP 10.122.104.28.12345 > 10.0.0.2.12345: UDP, length 16
10:06:36.404673 IP 10.58.217.211.12345 > 10.0.0.2.12345: UDP, length 16
10:06:37.404992 IP 10.104.230.233.12345 > 10.0.0.2.12345: UDP, length 16
10:06:38.405287 IP 10.100.174.245.12345 > 10.0.0.2.12345: UDP, length 16
10:06:39.405502 IP 10.98.156.2.12345 > 10.0.0.2.12345: UDP, length 16
10:06:40.405773 IP 10.67.111.28.12345 > 10.0.0.2.12345: UDP, length 16
10:06:41.406076 IP 10.21.59.62.12345 > 10.0.0.2.12345: UDP, length 16
10:06:42.406327 IP 10.21.34.25.12345 > 10.0.0.2.12345: UDP, length 16
10:06:43.406575 IP 10.111.121.33.12345 > 10.0.0.2.12345: UDP, length 16
10:06:44.406806 IP 10.53.228.216.12345 > 10.0.0.2.12345: UDP, length 16
10:06:45.407130 IP 10.43.111.16.12345 > 10.0.0.2.12345: UDP, length 16
10:06:46.407472 IP 10.114.179.157.12345 > 10.0.0.2.12345: UDP, length 16
10:06:47.407797 IP 10.24.25.192.12345 > 10.0.0.2.12345: UDP, length 16
10:06:48.408123 IP 10.41.99.97.12345 > 10.0.0.2.12345: UDP, length 16
10:06:49.408414 IP 10.51.224.106.12345 > 10.0.0.2.12345: UDP, length 16
10:06:50.408733 IP 10.1.133.229.12345 > 10.0.0.2.12345: UDP, length 16
10:06:51.409118 IP 10.102.36.90.12345 > 10.0.0.2.12345: UDP, length 16
10:06:52.409506 IP 10.77.227.160.12345 > 10.0.0.2.12345: UDP, length 16
10:06:53.409844 IP 10.43.99.137.12345 > 10.0.0.2.12345: UDP, length 16
10:06:54.410208 IP 10.10.7.42.12345 > 10.0.0.2.12345: UDP, length 16
10:06:55.410610 IP 10.93.98.113.12345 > 10.0.0.2.12345: UDP, length 16
10:06:56.410973 IP 10.91.114.115.12345 > 10.0.0.2.12345: UDP, length 16
10:06:57.411338 IP 10.21.61.110.12345 > 10.0.0.2.12345: UDP, length 16
10:06:58.411773 IP 10.5.198.171.12345 > 10.0.0.2.12345: UDP, length 16
10:06:59.412158 IP 10.18.135.203.12345 > 10.0.0.2.12345: UDP, length 16
10:07:00.412553 IP 10.20.155.49.12345 > 10.0.0.2.12345: UDP, length 16
10:07:01.412932 IP 10.77.63.218.12345 > 10.0.0.2.12345: UDP, length 16
10:07:02.413257 IP 10.59.115.63.12345 > 10.0.0.2.12345: UDP, length 16
10:07:03.413479 IP 10.28.4.164.12345 > 10.0.0.2.12345: UDP, length 16
10:07:04.413803 IP 10.37.219.142.12345 > 10.0.0.2.12345: UDP, length 16
10:07:05.414124 IP 10.2.143.92.12345 > 10.0.0.2.12345: UDP, length 16
10:07:06.414480 IP 10.56.142.191.12345 > 10.0.0.2.12345: UDP, length 16
10:07:07.414840 IP 10.36.190.15.12345 > 10.0.0.2.12345: UDP, length 16
10:07:08.415194 IP 10.99.97.155.12345 > 10.0.0.2.12345: UDP, length 16
10:07:09.415421 IP 10.104.41.164.12345 > 10.0.0.2.12345: UDP, length 16
10:07:10.415763 IP 10.83.13.251.12345 > 10.0.0.2.12345: UDP, length 16
10:07:11.416001 IP 10.68.137.65.12345 > 10.0.0.2.12345: UDP, length 16
10:07:12.416342 IP 10.28.36.64.12345 > 10.0.0.2.12345: UDP, length 16
10:07:13.416690 IP 10.40.205.240.12345 > 10.0.0.2.12345: UDP, length 16
10:07:14.416968 IP 10.121.190.146.12345 > 10.0.0.2.12345: UDP, length 16
10:07:15.417202 IP 10.59.53.163.12345 > 10.0.0.2.12345: UDP, length 16
10:07:16.417548 IP 10.115.200.220.12345 > 10.0.0.2.12345: UDP, length 16
10:07:17.417871 IP 10.18.2.235.12345 > 10.0.0.2.12345: UDP, length 16
10:07:18.418204 IP 10.74.252.74.12345 > 10.0.0.2.12345: UDP, length 16
10:07:19.418543 IP 10.64.61.237.12345 > 10.0.0.2.12345: UDP, length 16
10:07:20.418869 IP 10.90.125.119.12345 > 10.0.0.2.12345: UDP, length 16
10:07:21.419170 IP 10.119.114.41.12345 > 10.0.0.2.12345: UDP, length 16
10:07:22.419558 IP 10.28.52.21.12345 > 10.0.0.2.12345: UDP, length 16
10:07:23.419863 IP 10.29.48.81.12345 > 10.0.0.2.12345: UDP, length 16
10:07:24.420161 IP 10.77.119.41.12345 > 10.0.0.2.12345: UDP, length 16
10:07:25.420465 IP 10.0.15.207.12345 > 10.0.0.2.12345: UDP, length 16
10:07:26.420783 IP 10.80.226.19.12345 > 10.0.0.2.12345: UDP, length 16
10:07:27.421104 IP 10.79.120.60.12345 > 10.0.0.2.12345: UDP, length 16
10:07:28.421430 IP 10.27.37.130.12345 > 10.0.0.2.12345: UDP, length 16
10:07:29.421785 IP 10.9.151.104.12345 > 10.0.0.2.12345: UDP, length 16
10:07:30.422147 IP 10.15.46.106.12345 > 10.0.0.2.12345: UDP, length 16
10:07:31.422464 IP 10.89.112.18.12345 > 10.0.0.2.12345: UDP, length 16
10:07:32.422758 IP 10.34.6.130.12345 > 10.0.0.2.12345: UDP, length 16
10:07:33.423069 IP 10.15.223.25.12345 > 10.0.0.2.12345: UDP, length 16
10:07:34.423327 IP 10.30.3.186.12345 > 10.0.0.2.12345: UDP, length 16
10:07:35.423616 IP 10.67.190.81.12345 > 10.0.0.2.12345: UDP, length 16
10:07:36.423819 IP 10.110.90.210.12345 > 10.0.0.2.12345: UDP, length 16
10:07:37.424057 IP 10.59.132.159.12345 > 10.0.0.2.12345: UDP, length 16
10:07:38.424312 IP 10.77.79.43.12345 > 10.0.0.2.12345: UDP, length 16
10:07:39.424637 IP 10.72.103.76.12345 > 10.0.0.2.12345: UDP, length 16
10:07:40.425018 IP 10.26.65.23.12345 > 10.0.0.2.12345: UDP, length 16
10:07:41.425282 IP 10.3.46.83.12345 > 10.0.0.2.12345: UDP, length 16
10:07:42.425595 IP 10.113.202.89.12345 > 10.0.0.2.12345: UDP, length 16
10:07:43.425947 IP 10.12.164.50.12345 > 10.0.0.2.12345: UDP, length 16
10:07:44.426269 IP 10.119.117.23.12345 > 10.0.0.2.12345: UDP, length 16
10:07:45.426550 IP 10.54.186.168.12345 > 10.0.0.2.12345: UDP, length 16
10:07:46.426797 IP 10.115.76.173.12345 > 10.0.0.2.12345: UDP, length 16
10:07:47.427102 IP 10.52.104.38.12345 > 10.0.0.2.12345: UDP, length 16
10:07:48.427433 IP 10.75.34.236.12345 > 10.0.0.2.12345: UDP, length 16
10:07:49.427792 IP 10.46.141.159.12345 > 10.0.0.2.12345: UDP, length 16
10:07:50.428089 IP 10.2.78.113.12345 > 10.0.0.2.12345: UDP, length 16
10:07:51.428432 IP 10.13.44.46.12345 > 10.0.0.2.12345: UDP, length 16
10:07:52.428785 IP 10.45.226.143.12345 > 10.0.0.2.12345: UDP, length 16
10:07:53.428993 IP 10.47.159.213.12345 > 10.0.0.2.12345: UDP, length 16
10:07:54.429194 IP 10.76.182.162.12345 > 10.0.0.2.12345: UDP, length 16
10:07:55.429523 IP 10.22.45.21.12345 > 10.0.0.2.12345: UDP, length 16
10:07:56.429872 IP 10.74.132.22.12345 > 10.0.0.2.12345: UDP, length 16
10:07:57.430164 IP 10.56.27.192.12345 > 10.0.0.2.12345: UDP, length 16
10:07:58.430444 IP 10.117.242.18.12345 > 10.0.0.2.12345: UDP, length 16
10:07:59.430670 IP 10.89.172.31.12345 > 10.0.0.2.12345: UDP, length 16
10:08:00.430986 IP 10.25.83.203.12345 > 10.0.0.2.12345: UDP, length 16
10:08:01.431283 IP 10.64.58.177.12345 > 10.0.0.2.12345: UDP, length 16
10:08:02.431593 IP 10.21.18.177.12345 > 10.0.0.2.12345: UDP, length 16
10:08:03.431892 IP 10.83.226.147.12345 > 10.0.0.2.12345: UDP, length 16
10:08:04.432188 IP 10.19.136.62.12345 > 10.0.0.2.12345: UDP, length 16
10:08:05.432471 IP 10.29.203.227.12345 > 10.0.0.2.12345: UDP, length 16
10:08:06.432774 IP 10.121.221.201.12345 > 10.0.0.2.12345: UDP, length 16
10:08:07.433052 IP 10.104.109.196.12345 > 10.0.0.2.12345: UDP, length 16
10:08:08.433337 IP 10.6.229.181.12345 > 10.0.0.2.12345: UDP, length 16
10:08:09.433615 IP 10.65.42.24.12345 > 10.0.0.2.12345: UDP, length 16
10:08:10.433936 IP 10.72.244.44.12345 > 10.0.0.2.12345: UDP, length 16
10:08:11.434225 IP 10.119.20.109.12345 > 10.0.0.2.12345: UDP, length 16
10:08:12.434526 IP 10.19.61.58.12345 > 10.0.0.2.12345: UDP, length 16
10:08:13.434798 IP 10.92.130.71.12345 > 10.0.0.2.12345: UDP, length 16
10:08:14.434982 IP 10.117.146.122.12345 > 10.0.0.2.12345: UDP, length 16
10:08:15.435260 IP 10.108.14.28.12345 > 10.0.0.2.12345: UDP, length 16
10:08:16.435531 IP 10.121.171.99.12345 > 10.0.0.2.12345: UDP, length 16
10:08:17.435781 IP 10.18.231.123.12345 > 10.0.0.2.12345: UDP, length 16
10:08:18.436050 IP 10.82.47.119.12345 > 10.0.0.2.12345: UDP, length 16
10:08:19.436382 IP 10.78.27.189.12345 > 10.0.0.2.12345: UDP, length 16
10:08:20.436723 IP 10.121.207.53.12345 > 10.0.0.2.12345: UDP, length 16
10:08:21.437081 IP 10.106.35.249.12345 > 10.0.0.2.12345: UDP, length 16
10:08:22.437424 IP 10.108.16.171.12345 > 10.0.0.2.12345: UDP, length 16
10:08:23.437744 IP 10.111.212.233.12345 > 10.0.0.2.12345: UDP, length 16
10:08:24.438121 IP 10.101.225.71.12345 > 10.0.0.2.12345: UDP, length 16
10:08:25.438473 IP 10.55.93.205.12345 > 10.0.0.2.12345: UDP, length 16
10:08:26.438781 IP 10.39.38.108.12345 > 10.0.0.2.12345: UDP, length 16
10:08:27.439134 IP 10.113.185.231.12345 > 10.0.0.2.12345: UDP, length 16
10:08:28.439496 IP 10.42.16.19.12345 > 10.0.0.2.12345: UDP, length 16
10:08:29.439838 IP 10.37.200.168.12345 > 10.0.0.2.12345: UDP, length 16
10:08:30.440158 IP 10.92.184.143.12345 > 10.0.0.2.12345: UDP, length 16
10:08:31.440473 IP 10.73.135.172.12345 > 10.0.0.2.12345: UDP, length 16
10:08:32.440802 IP 10.10.37.49.12345 > 10.0.0.2.12345: UDP, length 16
10:08:33.441138 IP 10.76.181.97.12345 > 10.0.0.2.12345: UDP, length 16
10:08:34.441452 IP 10.8.87.58.12345 > 10.0.0.2.12345: UDP, length 16
10:08:35.441735 IP 10.58.147.237.12345 > 10.0.0.2.12345: UDP, length 16
10:08:36.442033 IP 10.8.206.125.12345 > 10.0.0.2.12345: UDP, length 16
10:08:37.442324 IP 10.17.108.239.12345 > 10.0.0.2.12345: UDP, length 16
10:08:38.442616 IP 10.120.86.5.12345 > 10.0.0.2.12345: UDP, length 16
10:08:39.442935 IP 10.26.52.107.12345 > 10.0.0.2.12345: UDP, length 16
10:08:40.443315 IP 10.64.29.69.12345 > 10.0.0.2.12345: UDP, length 16
10:08:41.443653 IP 10.59.73.98.12345 > 10.0.0.2.12345: UDP, length 16
10:08:42.444036 IP 10.46.108.80.12345 > 10.0.0.2.12345: UDP, length 16
10:08:43.444404 IP 10.8.169.108.12345 > 10.0.0.2.12345: UDP, length 16
10:08:44.444751 IP 10.90.182.235.12345 > 10.0.0.2.12345: UDP, length 16
10:08:45.445110 IP 10.34.48.251.12345 > 10.0.0.2.12345: UDP, length 16
10:08:46.445468 IP 10.124.158.248.12345 > 10.0.0.2.12345: UDP, length 16
10:08:47.445785 IP 10.28.6.191.12345 > 10.0.0.2.12345: UDP, length 16
10:08:48.446125 IP 10.79.219.134.12345 > 10.0.0.2.12345: UDP, length 16
10:08:49.446454 IP 10.9.184.198.12345 > 10.0.0.2.12345: UDP, length 16
10:08:50.446745 IP 10.36.99.202.12345 > 10.0.0.2.12345: UDP, length 16
10:08:51.447112 IP 10.54.122.30.12345 > 10.0.0.2.12345: UDP, length 16
10:08:52.447463 IP 10.74.52.57.12345 > 10.0.0.2.12345: UDP, length 16
10:08:53.447754 IP 10.57.213.210.12345 > 10.0.0.2.12345: UDP, length 16
10:08:54.448077 IP 10.68.82.76.12345 > 10.0.0.2.12345: UDP, length 16
10:08:55.448438 IP 10.81.41.47.12345 > 10.0.0.2.12345: UDP, length 16
10:08:56.448729 IP 10.29.134.191.12345 > 10.0.0.2.12345: UDP, length 16
10:08:57.449044 IP 10.113.165.134.12345 > 10.0.0.2.12345: UDP, length 16
10:08:58.449400 IP 10.5.159.180.12345 > 10.0.0.2.12345: UDP, length 16
10:08:59.449749 IP 10.75.42.215.12345 > 10.0.0.2.12345: UDP, length 16
10:09:00.450104 IP 10.71.146.130.12345 > 10.0.0.2.12345: UDP, length 16
10:09:01.450467 IP 10.65.159.194.12345 > 10.0.0.2.12345: UDP, length 16
10:09:02.450796 IP 10.50.155.162.12345 > 10.0.0.2.12345: UDP, length 16
10:09:03.451157 IP 10.114.204.150.12345 > 10.0.0.2.12345: UDP, length 16
10:09:04.451513 IP 10.59.241.112.12345 > 10.0.0.2.12345: UDP, length 16
10:09:05.451875 IP 10.54.103.197.12345 > 10.0.0.2.12345: UDP, length 16
10:09:06.452216 IP 10.32.180.174.12345 > 10.0.0.2.12345: UDP, length 16
10:09:07.452500 IP 10.18.107.175.12345 > 10.0.0.2.12345: UDP, length 16
10:09:08.452865 IP 10.70.103.39.12345 > 10.0.0.2.12345: UDP, length 16
10:09:09.453158 IP 10.66.72.72.12345 > 10.0.0.2.12345: UDP, length 16
10:09:10.453482 IP 10.123.219.47.12345 > 10.0.0.2.12345: UDP, length 16
10:09:11.453794 IP 10.41.70.28.12345 > 10.0.0.2.12345: UDP, length 16
10:09:12.454089 IP 10.119.197.59.12345 > 10.0.0.2.12345: UDP, length 16
10:09:13.454468 IP 10.93.216.246.12345 > 10.0.0.2.12345: UDP, length 16
10:09:14.454786 IP 10.80.188.207.12345 > 10.0.0.2.12345: UDP, length 16
10:09:15.455086 IP 10.7.144.85.12345 > 10.0.0.2.12345: UDP, length 16
10:09:16.455440 IP 10.17.152.166.12345 > 10.0.0.2.12345: UDP, length 16
10:09:17.455826 IP 10.34.234.85.12345 > 10.0.0.2.12345: UDP, length 16
10:09:18.456174 IP 10.76.87.180.12345 > 10.0.0.2.12345: UDP, length 16
10:09:19.456460 IP 10.97.227.202.12345 > 10.0.0.2.12345: UDP, length 16
10:09:20.456744 IP 10.42.35.133.12345 > 10.0.0.2.12345: UDP, length 16
10:09:21.457088 IP 10.91.232.10.12345 > 10.0.0.2.12345: UDP, length 16
10:09:22.457443 IP 10.14.9.120.12345 > 10.0.0.2.12345: UDP, length 16
10:09:23.457798 IP 10.124.44.131.12345 > 10.0.0.2.12345: UDP, length 16
10:09:24.458185 IP 10.89.131.5.12345 > 10.0.0.2.12345: UDP, length 16
10:09:25.458590 IP 10.16.122.233.12345 > 10.0.0.2.12345: UDP, length 16
10:09:26.458957 IP 10.120.211.140.12345 > 10.0.0.2.12345: UDP, length 16
10:09:27.459258 IP 10.30.188.240.12345 > 10.0.0.2.12345: UDP, length 16
10:09:28.459597 IP 10.12.12.27.12345 > 10.0.0.2.12345: UDP, length 16
10:09:29.459843 IP 10.103.199.243.12345 > 10.0.0.2.12345: UDP, length 16
10:09:30.460127 IP 10.74.151.222.12345 > 10.0.0.2.12345: UDP, length 16
10:09:31.460502 IP 10.38.247.234.12345 > 10.0.0.2.12345: UDP, length 16
10:09:32.460852 IP 10.96.118.7.12345 > 10.0.0.2.12345: UDP, length 16
10:09:33.461236 IP 10.91.103.85.12345 > 10.0.0.2.12345: UDP, length 16
10:09:34.461542 IP 10.103.148.165.12345 > 10.0.0.2.12345: UDP, length 16
10:09:35.461837 IP 10.29.201.100.12345 > 10.0.0.2.12345: UDP, length 16
10:09:36.462165 IP 10.119.184.102.12345 > 10.0.0.2.12345: UDP, length 16
10:09:37.462522 IP 10.87.226.23.12345 > 10.0.0.2.12345: UDP, length 16

