12:46:04.975760 IP 10.58.0.197.12345 > 10.0.0.2.12345: UDP, length 16
12:46:05.774115 IP 10.116.183.220.12345 > 10.0.0.2.12345: UDP, length 16
12:46:06.575458 IP 10.51.188.148.12345 > 10.0.0.2.12345: UDP, length 16
12:46:07.376162 IP 10.7.156.20.12345 > 10.0.0.2.12345: UDP, length 16
12:46:08.177365 IP 10.62.202.56.12345 > 10.0.0.2.12345: UDP, length 16
12:46:08.977640 IP 10.12.155.168.12345 > 10.0.0.2.12345: UDP, length 16
12:46:09.776805 IP 10.62.157.98.12345 > 10.0.0.2.12345: UDP, length 16
12:46:10.577801 IP 10.38.58.122.12345 > 10.0.0.2.12345: UDP, length 16
12:46:11.377974 IP 10.21.93.130.12345 > 10.0.0.2.12345: UDP, length 16
12:46:12.178709 IP 10.40.156.219.12345 > 10.0.0.2.12345: UDP, length 16
12:46:12.980382 IP 10.82.45.153.12345 > 10.0.0.2.12345: UDP, length 16
12:46:13.778246 IP 10.29.228.151.12345 > 10.0.0.2.12345: UDP, length 16
12:46:14.579276 IP 10.9.191.21.12345 > 10.0.0.2.12345: UDP, length 16
12:46:15.380055 IP 10.125.27.3.12345 > 10.0.0.2.12345: UDP, length 16
12:46:16.179343 IP 10.115.170.137.12345 > 10.0.0.2.12345: UDP, length 16
12:46:16.979570 IP 10.121.226.197.12345 > 10.0.0.2.12345: UDP, length 16
12:46:17.778596 IP 10.64.228.16.12345 > 10.0.0.2.12345: UDP, length 16
12:46:18.580865 IP 10.94.2.242.12345 > 10.0.0.2.12345: UDP, length 16
12:46:19.381492 IP 10.123.165.73.12345 > 10.0.0.2.12345: UDP, length 16
12:46:20.181547 IP 10.65.147.133.12345 > 10.0.0.2.12345: UDP, length 16
12:46:20.982359 IP 10.86.177.195.12345 > 10.0.0.2.12345: UDP, length 16
12:46:21.782687 IP 10.95.20.50.12345 > 10.0.0.2.12345: UDP, length 16
12:46:22.582579 IP 10.49.94.233.12345 > 10.0.0.2.12345: UDP, length 16
12:46:23.382876 IP 10.74.63.155.12345 > 10.0.0.2.12345: UDP, length 16
12:46:24.182755 IP 10.64.131.0.12345 > 10.0.0.2.12345: UDP, length 16
12:46:24.983844 IP 10.123.142.144.12345 > 10.0.0.2.12345: UDP, length 16
12:46:25.784136 IP 10.88.192.49.12345 > 10.0.0.2.12345: UDP, length 16
12:46:26.585276 IP 10.126.82.23.12345 > 10.0.0.2.12345: UDP, length 16
12:46:27.383317 IP 10.121.87.49.12345 > 10.0.0.2.12345: UDP, length 16
12:46:28.183296 IP 10.60.159.189.12345 > 10.0.0.2.12345: UDP, length 16
12:46:28.985486 IP 10.80.221.95.12345 > 10.0.0.2.12345: UDP, length 16
12:46:29.785928 IP 10.71.232.210.12345 > 10.0.0.2.12345: UDP, length 16
12:46:30.585197 IP 10.40.49.106.12345 > 10.0.0.2.12345: UDP, length 16
12:46:31.386157 IP 10.69.15.22.12345 > 10.0.0.2.12345: UDP, length 16
12:46:32.186252 IP 10.55.65.242.12345 > 10.0.0.2.12345: UDP, length 16
12:46:32.988294 IP 10.102.50.126.12345 > 10.0.0.2.12345: UDP, length 16
12:46:33.788645 IP 10.40.227.31.12345 > 10.0.0.2.12345: UDP, length 16
12:46:34.586248 IP 10.111.33.53.12345 > 10.0.0.2.12345: UDP, length 16
12:46:35.387306 IP 10.113.190.89.12345 > 10.0.0.2.12345: UDP, length 16
12:46:36.186453 IP 10.47.233.40.12345 > 10.0.0.2.12345: UDP, length 16
12:46:36.988464 IP 10.52.141.224.12345 > 10.0.0.2.12345: UDP, length 16
12:46:37.788385 IP 10.42.96.147.12345 > 10.0.0.2.12345: UDP, length 16
12:46:38.588337 IP 10.35.132.238.12345 > 10.0.0.2.12345: UDP, length 16
12:46:39.389612 IP 10.19.47.122.12345 > 10.0.0.2.12345: UDP, length 16
12:46:40.188981 IP 10.7.23.187.12345 > 10.0.0.2.12345: UDP, length 16
12:46:40.989399 IP 10.15.237.203.12345 > 10.0.0.2.12345: UDP, length 16
12:46:41.790435 IP 10.61.80.212.12345 > 10.0.0.2.12345: UDP, length 16
12:46:42.588647 IP 10.84.31.28.12345 > 10.0.0.2.12345: UDP, length 16
12:46:43.391016 IP 10.102.4.160.12345 > 10.0.0.2.12345: UDP, length 16
12:46:44.190631 IP 10.114.187.142.12345 > 10.0.0.2.12345: UDP, length 16
12:46:44.991673 IP 10.122.53.123.12345 > 10.0.0.2.12345: UDP, length 16
12:46:45.789926 IP 10.90.1.95.12345 > 10.0.0.2.12345: UDP, length 16
12:46:46.591272 IP 10.46.23.175.12345 > 10.0.0.2.12345: UDP, length 16
12:46:47.392479 IP 10.95.129.168.12345 > 10.0.0.2.12345: UDP, length 16
12:46:48.191328 IP 10.53.163.73.12345 > 10.0.0.2.12345: UDP, length 16
12:46:48.993215 IP 10.90.225.186.12345 > 10.0.0.2.12345: UDP, length 16
12:46:49.793476 IP 10.9.221.156.12345 > 10.0.0.2.12345: UDP, length 16
12:46:50.594055 IP 10.101.55.71.12345 > 10.0.0.2.12345: UDP, length 16
12:46:51.395385 IP 10.114.120.114.12345 > 10.0.0.2.12345: UDP, length 16
12:46:52.193640 IP 10.83.119.19.12345 > 10.0.0.2.12345: UDP, length 16
12:46:52.995374 IP 10.112.215.50.12345 > 10.0.0.2.12345: UDP, length 16
12:46:53.795049 IP 10.56.34.85.12345 > 10.0.0.2.12345: UDP, length 16
12:46:54.595073 IP 10.115.185.37.12345 > 10.0.0.2.12345: UDP, length 16
12:46:55.395762 IP 10.32.4.39.12345 > 10.0.0.2.12345: UDP, length 16
12:46:56.195134 IP 10.16.49.234.12345 > 10.0.0.2.12345: UDP, length 16
12:46:56.996359 IP 10.2.192.53.12345 > 10.0.0.2.12345: UDP, length 16
12:46:57.797007 IP 10.68.22.2.12345 > 10.0.0.2.12345: UDP, length 16
12:46:58.596185 IP 10.56.249.35.12345 > 10.0.0.2.12345: UDP, length 16
12:46:59.397145 IP 10.48.0.202.12345 > 10.0.0.2.12345: UDP, length 16
12:47:00.195856 IP 10.120.160.148.12345 > 10.0.0.2.12345: UDP, length 16
12:47:00.997797 IP 10.40.19.166.12345 > 10.0.0.2.12345: UDP, length 16
12:47:01.798211 IP 10.7.87.253.12345 > 10.0.0.2.12345: UDP, length 16
12:47:02.598101 IP 10.18.97.229.12345 > 10.0.0.2.12345: UDP, length 16
12:47:03.398801 IP 10.54.232.226.12345 > 10.0.0.2.12345: UDP, length 16
12:47:04.198034 IP 10.56.230.125.12345 > 10.0.0.2.12345: UDP, length 16
12:47:04.997882 IP 10.102.65.12.12345 > 10.0.0.2.12345: UDP, length 16
12:47:05.801129 IP 10.74.112.24.12345 > 10.0.0.2.12345: UDP, length 16
12:47:06.599604 IP 10.58.116.214.12345 > 10.0.0.2.12345: UDP, length 16
12:47:07.398148 IP 10.56.188.20.12345 > 10.0.0.2.12345: UDP, length 16
12:47:08.198389 IP 10.54.131.1.12345 > 10.0.0.2.12345: UDP, length 16
12:47:09.000899 IP 10.56.200.3.12345 > 10.0.0.2.12345: UDP, length 16
12:47:09.798888 IP 10.66.89.225.12345 > 10.0.0.2.12345: UDP, length 16
12:47:10.599233 IP 10.88.158.246.12345 > 10.0.0.2.12345: UDP, length 16
12:47:11.401057 IP 10.61.47.32.12345 > 10.0.0.2.12345: UDP, length 16
12:47:12.199687 IP 10.106.134.143.12345 > 10.0.0.2.12345: UDP, length 16
12:47:13.001632 IP 10.34.106.118.12345 > 10.0.0.2.12345: UDP, length 16
12:47:13.802724 IP 10.48.12.218.12345 > 10.0.0.2.12345: UDP, length 16
12:47:14.602351 IP 10.57.60.75.12345 > 10.0.0.2.12345: UDP, length 16
12:47:15.403268 IP 10.15.223.218.12345 > 10.0.0.2.12345: UDP, length 16
12:47:16.203574 IP 10.78.145.232.12345 > 10.0.0.2.12345: UDP, length 16
12:47:17.003388 IP 10.94.175.89.12345 > 10.0.0.2.12345: UDP, length 16
12:47:17.804201 IP 10.102.37.156.12345 > 10.0.0.2.12345: UDP, length 16
12:47:18.604666 IP 10.92.56.65.12345 > 10.0.0.2.12345: UDP, length 16
12:47:19.405131 IP 10.32.53.36.12345 > 10.0.0.2.12345: UDP, length 16
12:47:20.205303 IP 10.33.165.12.12345 > 10.0.0.2.12345: UDP, length 16
12:47:21.005674 IP 10.8.70.51.12345 > 10.0.0.2.12345: UDP, length 16
12:47:21.806183 IP 10.32.124.11.12345 > 10.0.0.2.12345: UDP, length 16
12:47:22.605397 IP 10.60.13.208.12345 > 10.0.0.2.12345: UDP, length 16
12:47:23.406700 IP 10.1.241.98.12345 > 10.0.0.2.12345: UDP, length 16
12:47:24.207068 IP 10.96.221.99.12345 > 10.0.0.2.12345: UDP, length 16
12:47:25.007334 IP 10.69.125.28.12345 > 10.0.0.2.12345: UDP, length 16
12:47:25.807663 IP 10.79.151.15.12345 > 10.0.0.2.12345: UDP, length 16
12:47:26.606304 IP 10.32.101.251.12345 > 10.0.0.2.12345: UDP, length 16
12:47:27.408325 IP 10.40.157.183.12345 > 10.0.0.2.12345: UDP, length 16
12:47:28.208652 IP 10.4.232.221.12345 > 10.0.0.2.12345: UDP, length 16
12:47:29.007815 IP 10.84.188.47.12345 > 10.0.0.2.12345: UDP, length 16
12:47:29.809279 IP 10.61.223.243.12345 > 10.0.0.2.12345: UDP, length 16
12:47:30.608039 IP 10.6.83.152.12345 > 10.0.0.2.12345: UDP, length 16
12:47:31.409860 IP 10.47.118.9.12345 > 10.0.0.2.12345: UDP, length 16
12:47:32.209322 IP 10.115.8.202.12345 > 10.0.0.2.12345: UDP, length 16
12:47:33.009909 IP 10.113.99.207.12345 > 10.0.0.2.12345: UDP, length 16
12:47:33.809715 IP 10.13.248.83.12345 > 10.0.0.2.12345: UDP, length 16
12:47:34.608887 IP 10.12.127.12.12345 > 10.0.0.2.12345: UDP, length 16
12:47:35.410970 IP 10.37.155.221.12345 > 10.0.0.2.12345: UDP, length 16
12:47:36.211492 IP 10.99.75.239.12345 > 10.0.0.2.12345: UDP, length 16
12:47:37.011908 IP 10.58.123.16.12345 > 10.0.0.2.12345: UDP, length 16
12:47:37.812084 IP 10.65.236.171.12345 > 10.0.0.2.12345: UDP, length 16
12:47:38.610328 IP 10.84.222.221.12345 > 10.0.0.2.12345: UDP, length 16
12:47:39.412959 IP 10.41.11.37.12345 > 10.0.0.2.12345: UDP, length 16
12:47:40.213411 IP 10.78.245.151.12345 > 10.0.0.2.12345: UDP, length 16
12:47:41.012926 IP 10.83.235.67.12345 > 10.0.0.2.12345: UDP, length 16
12:47:41.813985 IP 10.73.140.234.12345 > 10.0.0.2.12345: UDP, length 16
12:47:42.612554 IP 10.87.245.89.12345 > 10.0.0.2.12345: UDP, length 16
12:47:43.414560 IP 10.55.28.150.12345 > 10.0.0.2.12345: UDP, length 16
12:47:44.214366 IP 10.105.96.122.12345 > 10.0.0.2.12345: UDP, length 16
12:47:45.014570 IP 10.70.126.73.12345 > 10.0.0.2.12345: UDP, length 16
12:47:45.815333 IP 10.21.78.210.12345 > 10.0.0.2.12345: UDP, length 16
12:47:46.614925 IP 10.21.113.232.12345 > 10.0.0.2.12345: UDP, length 16
12:47:47.415516 IP 10.123.21.155.12345 > 10.0.0.2.12345: UDP, length 16
12:47:48.216212 IP 10.96.110.217.12345 > 10.0.0.2.12345: UDP, length 16
12:47:49.015883 IP 10.35.73.104.12345 > 10.0.0.2.12345: UDP, length 16
12:47:49.816004 IP 10.113.247.248.12345 > 10.0.0.2.12345: UDP, length 16
12:47:50.615038 IP 10.44.24.142.12345 > 10.0.0.2.12345: UDP, length 16
12:47:51.417816 IP 10.110.55.146.12345 > 10.0.0.2.12345: UDP, length 16
12:47:52.217836 IP 10.13.111.22.12345 > 10.0.0.2.12345: UDP, length 16
12:47:53.017708 IP 10.116.1.12.12345 > 10.0.0.2.12345: UDP, length 16
12:47:53.818648 IP 10.119.19.113.12345 > 10.0.0.2.12345: UDP, length 16
12:47:54.617960 IP 10.76.77.223.12345 > 10.0.0.2.12345: UDP, length 16
12:47:55.420192 IP 10.117.90.16.12345 > 10.0.0.2.12345: UDP, length 16
12:47:56.218590 IP 10.119.71.20.12345 > 10.0.0.2.12345: UDP, length 16
12:47:57.019516 IP 10.58.173.146.12345 > 10.0.0.2.12345: UDP, length 16
12:47:57.820357 IP 10.83.95.75.12345 > 10.0.0.2.12345: UDP, length 16
12:47:58.620681 IP 10.17.175.50.12345 > 10.0.0.2.12345: UDP, length 16
12:47:59.419249 IP 10.57.42.247.12345 > 10.0.0.2.12345: UDP, length 16
12:48:00.221666 IP 10.50.0.156.12345 > 10.0.0.2.12345: UDP, length 16
12:48:01.020647 IP 10.20.127.39.12345 > 10.0.0.2.12345: UDP, length 16
12:48:01.819544 IP 10.0.99.137.12345 > 10.0.0.2.12345: UDP, length 16
12:48:02.620303 IP 10.71.181.11.12345 > 10.0.0.2.12345: UDP, length 16
12:48:03.421597 IP 10.93.142.182.12345 > 10.0.0.2.12345: UDP, length 16
12:48:04.222675 IP 10.124.138.234.12345 > 10.0.0.2.12345: UDP, length 16
12:48:05.022849 IP 10.92.21.160.12345 > 10.0.0.2.12345: UDP, length 16
12:48:05.820867 IP 10.41.73.163.12345 > 10.0.0.2.12345: UDP, length 16
12:48:06.621177 IP 10.3.186.68.12345 > 10.0.0.2.12345: UDP, length 16
12:48:07.423031 IP 10.113.127.139.12345 > 10.0.0.2.12345: UDP, length 16
12:48:08.223924 IP 10.103.141.191.12345 > 10.0.0.2.12345: UDP, length 16
12:48:09.023430 IP 10.21.31.151.12345 > 10.0.0.2.12345: UDP, length 16
12:48:09.824506 IP 10.84.108.96.12345 > 10.0.0.2.12345: UDP, length 16
12:48:10.624169 IP 10.126.20.202.12345 > 10.0.0.2.12345: UDP, length 16
12:48:11.425284 IP 10.99.165.28.12345 > 10.0.0.2.12345: UDP, length 16
12:48:12.225546 IP 10.85.212.177.12345 > 10.0.0.2.12345: UDP, length 16
12:48:13.025547 IP 10.112.248.224.12345 > 10.0.0.2.12345: UDP, length 16
12:48:13.824576 IP 10.18.230.93.12345 > 10.0.0.2.12345: UDP, length 16
12:48:14.626686 IP 10.82.73.29.12345 > 10.0.0.2.12345: UDP, length 16
12:48:15.426008 IP 10.88.160.254.12345 > 10.0.0.2.12345: UDP, length 16
12:48:16.226666 IP 10.75.45.126.12345 > 10.0.0.2.12345: UDP, length 16
12:48:17.027097 IP 10.49.173.53.12345 > 10.0.0.2.12345: UDP, length 16
12:48:17.827766 IP 10.14.130.237.12345 > 10.0.0.2.12345: UDP, length 16
12:48:18.628432 IP 10.64.200.226.12345 > 10.0.0.2.12345: UDP, length 16
12:48:19.428524 IP 10.90.153.231.12345 > 10.0.0.2.12345: UDP, length 16
12:48:20.227917 IP 10.92.205.186.12345 > 10.0.0.2.12345: UDP, length 16
12:48:21.028795 IP 10.35.38.210.12345 > 10.0.0.2.12345: UDP, length 16
12:48:21.829659 IP 10.119.146.65.12345 > 10.0.0.2.12345: UDP, length 16
12:48:22.630028 IP 10.48.77.57.12345 > 10.0.0.2.12345: UDP, length 16
12:48:23.429386 IP 10.48.104.157.12345 > 10.0.0.2.12345: UDP, length 16
12:48:24.230442 IP 10.127.48.145.12345 > 10.0.0.2.12345: UDP, length 16
12:48:25.029285 IP 10.60.102.178.12345 > 10.0.0.2.12345: UDP, length 16
12:48:25.829598 IP 10.111.230.170.12345 > 10.0.0.2.12345: UDP, length 16
12:48:26.631100 IP 10.113.43.211.12345 > 10.0.0.2.12345: UDP, length 16
12:48:27.430948 IP 10.101.220.45.12345 > 10.0.0.2.12345: UDP, length 16
12:48:28.231531 IP 10.71.11.103.12345 > 10.0.0.2.12345: UDP, length 16
12:48:29.032050 IP 10.14.200.168.12345 > 10.0.0.2.12345: UDP, length 16
12:48:29.832891 IP 10.7.99.45.12345 > 10.0.0.2.12345: UDP, length 16
12:48:30.632146 IP 10.59.236.138.12345 > 10.0.0.2.12345: UDP, length 16
12:48:31.431823 IP 10.112.209.81.12345 > 10.0.0.2.12345: UDP, length 16
12:48:32.233389 IP 10.95.243.18.12345 > 10.0.0.2.12345: UDP, length 16
12:48:33.032684 IP 10.67.68.217.12345 > 10.0.0.2.12345: UDP, length 16
12:48:33.834301 IP 10.84.17.241.12345 > 10.0.0.2.12345: UDP, length 16
12:48:34.634611 IP 10.78.202.62.12345 > 10.0.0.2.12345: UDP, length 16
12:48:35.434066 IP 10.18.94.86.12345 > 10.0.0.2.12345: UDP, length 16
12:48:36.235239 IP 10.40.93.168.12345 > 10.0.0.2.12345: UDP, length 16
12:48:37.033841 IP 10.32.82.108.12345 > 10.0.0.2.12345: UDP, length 16
12:48:37.833620 IP 10.53.66.145.12345 > 10.0.0.2.12345: UDP, length 16
12:48:38.635523 IP 10.59.137.179.12345 > 10.0.0.2.12345: UDP, length 16
12:48:39.434688 IP 10.41.228.107.12345 > 10.0.0.2.12345: UDP, length 16
12:48:40.236517 IP 10.42.247.210.12345 > 10.0.0.2.12345: UDP, length 16
12:48:41.034544 IP 10.110.182.60.12345 > 10.0.0.2.12345: UDP, length 16
12:48:41.836714 IP 10.52.92.54.12345 > 10.0.0.2.12345: UDP, length 16
12:48:42.637551 IP 10.52.112.241.12345 > 10.0.0.2.12345: UDP, length 16
12:48:43.436599 IP 10.85.193.60.12345 > 10.0.0.2.12345: UDP, length 16
12:48:44.237754 IP 10.51.29.90.12345 > 10.0.0.2.12345: UDP, length 16
