10:15:38.640560 IP 10.0.0.1.12345 > 10.0.0.2.12345: UDP, length 16
10:15:39.640843 IP 10.0.0.1.12345 > 10.0.0.2.12345: UDP, length 16
10:15:40.641088 IP 10.0.0.1.12345 > 10.0.0.2.12345: UDP, length 16
10:15:41.641336 IP 10.0.0.1.12345 > 10.0.0.2.12345: UDP, length 16
10:15:42.641585 IP 10.0.0.1.12345 > 10.0.0.2.12345: UDP, length 16
10:15:43.641831 IP 10.0.0.1.12345 > 10.0.0.2.12345: UDP, length 16
10:15:44.642061 IP 10.0.0.1.12345 > 10.0.0.2.12345: UDP, length 16
10:15:45.642301 IP 10.0.0.1.12345 > 10.0.0.2.12345: UDP, length 16
10:15:46.642542 IP 10.0.0.1.12345 > 10.0.0.2.12345: UDP, length 16
10:15:47.642785 IP 10.0.0.1.12345 > 10.0.0.2.12345: UDP, length 16
10:15:48.643027 IP 10.0.0.1.12345 > 10.0.0.2.12345: UDP, length 16
10:15:49.643267 IP 10.0.0.1.12345 > 10.0.0.2.12345: UDP, length 16
10:15:50.643510 IP 10.0.0.1.12345 > 10.0.0.2.12345: UDP, length 16
10:15:51.643812 IP 10.0.0.1.12345 > 10.0.0.2.12345: UDP, length 16
10:15:52.644040 IP 10.0.0.1.12345 > 10.0.0.2.12345: UDP, length 16
10:15:53.644285 IP 10.0.0.1.12345 > 10.0.0.2.12345: UDP, length 16
10:15:54.644529 IP 10.0.0.1.12345 > 10.0.0.2.12345: UDP, length 16
10:15:55.644686 IP 10.0.0.1.12345 > 10.0.0.2.12345: UDP, length 16
10:15:56.644914 IP 10.0.0.1.12345 > 10.0.0.2.12345: UDP, length 16
10:15:57.645155 IP 10.0.0.1.12345 > 10.0.0.2.12345: UDP, length 16
10:15:58.645380 IP 10.0.0.1.12345 > 10.0.0.2.12345: UDP, length 16
10:15:59.645612 IP 10.0.0.1.12345 > 10.0.0.2.12345: UDP, length 16
10:16:00.645790 IP 10.0.0.1.12345 > 10.0.0.2.12345: UDP, length 16
10:16:01.645989 IP 10.0.0.1.12345 > 10.0.0.2.12345: UDP, length 16
10:16:02.646211 IP 10.0.0.1.12345 > 10.0.0.2.12345: UDP, length 16
10:16:03.646441 IP 10.0.0.1.12345 > 10.0.0.2.12345: UDP, length 16
10:16:04.646687 IP 10.0.0.1.12345 > 10.0.0.2.12345: UDP, length 16
10:16:05.646924 IP 10.0.0.1.12345 > 10.0.0.2.12345: UDP, length 16
10:16:06.647116 IP 10.0.0.1.12345 > 10.0.0.2.12345: UDP, length 16
10:16:07.647305 IP 10.0.0.1.12345 > 10.0.0.2.12345: UDP, length 16
10:16:08.647529 IP 10.0.0.1.12345 > 10.0.0.2.12345: UDP, length 16
10:16:09.647731 IP 10.0.0.1.12345 > 10.0.0.2.12345: UDP, length 16
10:16:10.647907 IP 10.0.0.1.12345 > 10.0.0.2.12345: UDP, length 16
10:16:11.648115 IP 10.0.0.1.12345 > 10.0.0.2.12345: UDP, length 16
10:16:12.648360 IP 10.0.0.1.12345 > 10.0.0.2.12345: UDP, length 16
10:16:13.648589 IP 10.0.0.1.12345 > 10.0.0.2.12345: UDP, length 16
10:16:14.648830 IP 10.0.0.1.12345 > 10.0.0.2.12345: UDP, length 16
10:16:15.649066 IP 10.0.0.1.12345 > 10.0.0.2.12345: UDP, length 16
10:16:16.649314 IP 10.0.0.1.12345 > 10.0.0.2.12345: UDP, length 16
10:16:17.649478 IP 10.0.0.1.12345 > 10.0.0.2.12345: UDP, length 16
10:16:18.649718 IP 10.0.0.1.12345 > 10.0.0.2.12345: UDP, length 16
10:16:19.649956 IP 10.0.0.1.12345 > 10.0.0.2.12345: UDP, length 16
10:16:20.650201 IP 10.0.0.1.12345 > 10.0.0.2.12345: UDP, length 16
10:16:21.650434 IP 10.0.0.1.12345 > 10.0.0.2.12345: UDP, length 16
10:16:22.650683 IP 10.0.0.1.12345 > 10.0.0.2.12345: UDP, length 16
10:16:23.650919 IP 10.0.0.1.12345 > 10.0.0.2.12345: UDP, length 16
10:16:24.651167 IP 10.0.0.1.12345 > 10.0.0.2.12345: UDP, length 16
10:16:25.651398 IP 10.0.0.1.12345 > 10.0.0.2.12345: UDP, length 16
10:16:26.651643 IP 10.0.0.1.12345 > 10.0.0.2.12345: UDP, length 16
10:16:27.651944 IP 10.0.0.1.12345 > 10.0.0.2.12345: UDP, length 16
10:16:28.652187 IP 10.0.0.1.12345 > 10.0.0.2.12345: UDP, length 16
10:16:29.652418 IP 10.0.0.1.12345 > 10.0.0.2.12345: UDP, length 16
10:16:30.652634 IP 10.0.0.1.12345 > 10.0.0.2.12345: UDP, length 16
10:16:31.652839 IP 10.0.0.1.12345 > 10.0.0.2.12345: UDP, length 16
10:16:32.653076 IP 10.0.0.1.12345 > 10.0.0.2.12345: UDP, length 16
10:16:33.653273 IP 10.0.0.1.12345 > 10.0.0.2.12345: UDP, length 16
10:16:34.653514 IP 10.0.0.1.12345 > 10.0.0.2.12345: UDP, length 16
10:16:35.653727 IP 10.0.0.1.12345 > 10.0.0.2.12345: UDP, length 16
10:16:36.653970 IP 10.0.0.1.12345 > 10.0.0.2.12345: UDP, length 16
10:16:37.654170 IP 10.0.0.1.12345 > 10.0.0.2.12345: UDP, length 16
10:16:38.654411 IP 10.0.0.1.12345 > 10.0.0.2.12345: UDP, length 16
10:16:39.654620 IP 10.0.0.1.12345 > 10.0.0.2.12345: UDP, length 16
10:16:40.654813 IP 10.0.0.1.12345 > 10.0.0.2.12345: UDP, length 16
10:16:41.655001 IP 10.0.0.1.12345 > 10.0.0.2.12345: UDP, length 16
10:16:42.655240 IP 10.0.0.1.12345 > 10.0.0.2.12345: UDP, length 16
10:16:43.655420 IP 10.0.0.1.12345 > 10.0.0.2.12345: UDP, length 16
10:16:44.655657 IP 10.0.0.1.12345 > 10.0.0.2.12345: UDP, length 16
10:16:45.655852 IP 10.0.0.1.12345 > 10.0.0.2.12345: UDP, length 16
10:16:46.656070 IP 10.0.0.1.12345 > 10.0.0.2.12345: UDP, length 16
10:16:47.656254 IP 10.0.0.1.12345 > 10.0.0.2.12345: UDP, length 16
10:16:48.656492 IP 10.0.0.1.12345 > 10.0.0.2.12345: UDP, length 16
10:16:49.656672 IP 10.0.0.1.12345 > 10.0.0.2.12345: UDP, length 16
10:16:50.656909 IP 10.0.0.1.12345 > 10.0.0.2.12345: UDP, length 16
10:16:51.657090 IP 10.0.0.1.12345 > 10.0.0.2.12345: UDP, length 16
10:16:52.657311 IP 10.0.0.1.12345 > 10.0.0.2.12345: UDP, length 16
10:16:53.657490 IP 10.0.0.1.12345 > 10.0.0.2.12345: UDP, length 16
10:16:54.657723 IP 10.0.0.1.12345 > 10.0.0.2.12345: UDP, length 16
10:16:55.657902 IP 10.0.0.1.12345 > 10.0.0.2.12345: UDP, length 16
10:16:56.658134 IP 10.0.0.1.12345 > 10.0.0.2.12345: UDP, length 16
10:16:57.658312 IP 10.0.0.1.12345 > 10.0.0.2.12345: UDP, length 16
10:16:58.658529 IP 10.0.0.1.12345 > 10.0.0.2.12345: UDP, length 16
10:16:59.658709 IP 10.0.0.1.12345 > 10.0.0.2.12345: UDP, length 16
10:17:00.658925 IP 10.0.0.1.12345 > 10.0.0.2.12345: UDP, length 16
10:17:01.659038 IP 10.0.0.1.12345 > 10.0.0.2.12345: UDP, length 16
10:17:02.659272 IP 10.0.0.1.12345 > 10.0.0.2.12345: UDP, length 16
10:17:03.659449 IP 10.0.0.1.12345 > 10.0.0.2.12345: UDP, length 16
10:17:04.659677 IP 10.0.0.1.12345 > 10.0.0.2.12345: UDP, length 16
10:17:05.659857 IP 10.0.0.1.12345 > 10.0.0.2.12345: UDP, length 16
10:17:06.660041 IP 10.0.0.1.12345 > 10.0.0.2.12345: UDP, length 16
10:17:07.660213 IP 10.0.0.1.12345 > 10.0.0.2.12345: UDP, length 16
10:17:08.660436 IP 10.0.0.1.12345 > 10.0.0.2.12345: UDP, length 16
10:17:09.660613 IP 10.0.0.1.12345 > 10.0.0.2.12345: UDP, length 16
10:17:10.660800 IP 10.0.0.1.12345 > 10.0.0.2.12345: UDP, length 16
10:17:11.661024 IP 10.0.0.1.12345 > 10.0.0.2.12345: UDP, length 16
10:17:12.661259 IP 10.0.0.1.12345 > 10.0.0.2.12345: UDP, length 16
10:17:13.661459 IP 10.0.0.1.12345 > 10.0.0.2.12345: UDP, length 16
10:17:14.661699 IP 10.0.0.1.12345 > 10.0.0.2.12345: UDP, length 16
10:17:15.661946 IP 10.0.0.1.12345 > 10.0.0.2.12345: UDP, length 16
10:17:16.662180 IP 10.0.0.1.12345 > 10.0.0.2.12345: UDP, length 16
10:17:17.662422 IP 10.0.0.1.12345 > 10.0.0.2.12345: UDP, length 16
10:17:18.662672 IP 10.0.0.1.12345 > 10.0.0.2.12345: UDP, length 16
10:17:19.662921 IP 10.0.0.1.12345 > 10.0.0.2.12345: UDP, length 16
10:17:20.663170 IP 10.0.0.1.12345 > 10.0.0.2.12345: UDP, length 16
10:17:21.663414 IP 10.0.0.1.12345 > 10.0.0.2.12345: UDP, length 16
10:17:22.663664 IP 10.0.0.1.12345 > 10.0.0.2.12345: UDP, length 16
10:17:23.663934 IP 10.0.0.1.12345 > 10.0.0.2.12345: UDP, length 16
10:17:24.664185 IP 10.0.0.1.12345 > 10.0.0.2.12345: UDP, length 16
10:17:25.664434 IP 10.0.0.1.12345 > 10.0.0.2.12345: UDP, length 16
10:17:26.664686 IP 10.0.0.1.12345 > 10.0.0.2.12345: UDP, length 16
10:17:27.664934 IP 10.0.0.1.12345 > 10.0.0.2.12345: UDP, length 16
10:17:28.665183 IP 10.0.0.1.12345 > 10.0.0.2.12345: UDP, length 16
10:17:29.665428 IP 10.0.0.1.12345 > 10.0.0.2.12345: UDP, length 16
10:17:30.665680 IP 10.0.0.1.12345 > 10.0.0.2.12345: UDP, length 16
10:17:31.665930 IP 10.0.0.1.12345 > 10.0.0.2.12345: UDP, length 16
10:17:32.666171 IP 10.0.0.1.12345 > 10.0.0.2.12345: UDP, length 16
10:17:33.666416 IP 10.0.0.1.12345 > 10.0.0.2.12345: UDP, length 16
10:17:34.666669 IP 10.0.0.1.12345 > 10.0.0.2.12345: UDP, length 16
10:17:35.666914 IP 10.0.0.1.12345 > 10.0.0.2.12345: UDP, length 16
10:17:36.667141 IP 10.0.0.1.12345 > 10.0.0.2.12345: UDP, length 16
10:17:37.667356 IP 10.0.0.1.12345 > 10.0.0.2.12345: UDP, length 16
10:17:38.667600 IP 10.0.0.1.12345 > 10.0.0.2.12345: UDP, length 16
10:17:39.667848 IP 10.0.0.1.12345 > 10.0.0.2.12345: UDP, length 16
10:17:40.668079 IP 10.0.0.1.12345 > 10.0.0.2.12345: UDP, length 16
10:17:41.668321 IP 10.0.0.1.12345 > 10.0.0.2.12345: UDP, length 16
10:17:42.668568 IP 10.0.0.1.12345 > 10.0.0.2.12345: UDP, length 16
10:17:43.668766 IP 10.0.0.1.12345 > 10.0.0.2.12345: UDP, length 16
10:17:44.669002 IP 10.0.0.1.12345 > 10.0.0.2.12345: UDP, length 16
10:17:45.669227 IP 10.0.0.1.12345 > 10.0.0.2.12345: UDP, length 16
10:17:46.669466 IP 10.0.0.1.12345 > 10.0.0.2.12345: UDP, length 16
10:17:47.669646 IP 10.0.0.1.12345 > 10.0.0.2.12345: UDP, length 16
10:17:48.669852 IP 10.0.0.1.12345 > 10.0.0.2.12345: UDP, length 16
10:17:49.670094 IP 10.0.0.1.12345 > 10.0.0.2.12345: UDP, length 16
10:17:50.670345 IP 10.0.0.1.12345 > 10.0.0.2.12345: UDP, length 16
10:17:51.670590 IP 10.0.0.1.12345 > 10.0.0.2.12345: UDP, length 16
10:17:52.670815 IP 10.0.0.1.12345 > 10.0.0.2.12345: UDP, length 16
10:17:53.671057 IP 10.0.0.1.12345 > 10.0.0.2.12345: UDP, length 16
10:17:54.671295 IP 10.0.0.1.12345 > 10.0.0.2.12345: UDP, length 16
10:17:55.671537 IP 10.0.0.1.12345 > 10.0.0.2.12345: UDP, length 16
10:17:56.671762 IP 10.0.0.1.12345 > 10.0.0.2.12345: UDP, length 16
10:17:57.672005 IP 10.0.0.1.12345 > 10.0.0.2.12345: UDP, length 16
10:17:58.672228 IP 10.0.0.1.12345 > 10.0.0.2.12345: UDP, length 16
10:17:59.672470 IP 10.0.0.1.12345 > 10.0.0.2.12345: UDP, length 16
10:18:00.672693 IP 10.0.0.1.12345 > 10.0.0.2.12345: UDP, length 16
10:18:01.672898 IP 10.0.0.1.12345 > 10.0.0.2.12345: UDP, length 16
10:18:02.673158 IP 10.0.0.1.12345 > 10.0.0.2.12345: UDP, length 16
10:18:03.673402 IP 10.0.0.1.12345 > 10.0.0.2.12345: UDP, length 16
10:18:04.673634 IP 10.0.0.1.12345 > 10.0.0.2.12345: UDP, length 16
10:18:05.673856 IP 10.0.0.1.12345 > 10.0.0.2.12345: UDP, length 16
10:18:06.674059 IP 10.0.0.1.12345 > 10.0.0.2.12345: UDP, length 16
10:18:07.674299 IP 10.0.0.1.12345 > 10.0.0.2.12345: UDP, length 16
10:18:08.674523 IP 10.0.0.1.12345 > 10.0.0.2.12345: UDP, length 16
10:18:09.674700 IP 10.0.0.1.12345 > 10.0.0.2.12345: UDP, length 16
10:18:10.674880 IP 10.0.0.1.12345 > 10.0.0.2.12345: UDP, length 16
10:18:11.675086 IP 10.0.0.1.12345 > 10.0.0.2.12345: UDP, length 16
10:18:12.675290 IP 10.0.0.1.12345 > 10.0.0.2.12345: UDP, length 16
10:18:13.675531 IP 10.0.0.1.12345 > 10.0.0.2.12345: UDP, length 16
10:18:14.675780 IP 10.0.0.1.12345 > 10.0.0.2.12345: UDP, length 16
10:18:15.675990 IP 10.0.0.1.12345 > 10.0.0.2.12345: UDP, length 16
10:18:16.676202 IP 10.0.0.1.12345 > 10.0.0.2.12345: UDP, length 16
10:18:17.676433 IP 10.0.0.1.12345 > 10.0.0.2.12345: UDP, length 16
10:18:18.676627 IP 10.0.0.1.12345 > 10.0.0.2.12345: UDP, length 16
10:18:19.676865 IP 10.0.0.1.12345 > 10.0.0.2.12345: UDP, length 16
10:18:20.677045 IP 10.0.0.1.12345 > 10.0.0.2.12345: UDP, length 16
10:18:21.677278 IP 10.0.0.1.12345 > 10.0.0.2.12345: UDP, length 16
10:18:22.677496 IP 10.0.0.1.12345 > 10.0.0.2.12345: UDP, length 16
10:18:23.677733 IP 10.0.0.1.12345 > 10.0.0.2.12345: UDP, length 16
10:18:24.677946 IP 10.0.0.1.12345 > 10.0.0.2.12345: UDP, length 16
10:18:25.678184 IP 10.0.0.1.12345 > 10.0.0.2.12345: UDP, length 16
10:18:26.678424 IP 10.0.0.1.12345 > 10.0.0.2.12345: UDP, length 16
10:18:27.678602 IP 10.0.0.1.12345 > 10.0.0.2.12345: UDP, length 16
10:18:28.678818 IP 10.0.0.1.12345 > 10.0.0.2.12345: UDP, length 16
10:18:29.679057 IP 10.0.0.1.12345 > 10.0.0.2.12345: UDP, length 16
10:18:30.679289 IP 10.0.0.1.12345 > 10.0.0.2.12345: UDP, length 16
10:18:31.679529 IP 10.0.0.1.12345 > 10.0.0.2.12345: UDP, length 16
10:18:32.679740 IP 10.0.0.1.12345 > 10.0.0.2.12345: UDP, length 16
10:18:33.679944 IP 10.0.0.1.12345 > 10.0.0.2.12345: UDP, length 16
10:18:34.680177 IP 10.0.0.1.12345 > 10.0.0.2.12345: UDP, length 16
10:18:35.680416 IP 10.0.0.1.12345 > 10.0.0.2.12345: UDP, length 16
10:18:36.680596 IP 10.0.0.1.12345 > 10.0.0.2.12345: UDP, length 16
10:18:37.680840 IP 10.0.0.1.12345 > 10.0.0.2.12345: UDP, length 16
10:18:38.681069 IP 10.0.0.1.12345 > 10.0.0.2.12345: UDP, length 16
10:18:39.681313 IP 10.0.0.1.12345 > 10.0.0.2.12345: UDP, length 16
10:18:40.681526 IP 10.0.0.1.12345 > 10.0.0.2.12345: UDP, length 16
10:18:41.681767 IP 10.0.0.1.12345 > 10.0.0.2.12345: UDP, length 16
10:18:42.681973 IP 10.0.0.1.12345 > 10.0.0.2.12345: UDP, length 16
10:18:43.682208 IP 10.0.0.1.12345 > 10.0.0.2.12345: UDP, length 16
10:18:44.682421 IP 10.0.0.1.12345 > 10.0.0.2.12345: UDP, length 16
10:18:45.682660 IP 10.0.0.1.12345 > 10.0.0.2.12345: UDP, length 16
10:18:46.682915 IP 10.0.0.1.12345 > 10.0.0.2.12345: UDP, length 16
10:18:47.683123 IP 10.0.0.1.12345 > 10.0.0.2.12345: UDP, length 16
10:18:48.683301 IP 10.0.0.1.12345 > 10.0.0.2.12345: UDP, length 16
10:18:49.683533 IP 10.0.0.1.12345 > 10.0.0.2.12345: UDP, length 16
10:18:50.683737 IP 10.0.0.1.12345 > 10.0.0.2.12345: UDP, length 16
10:18:51.683978 IP 10.0.0.1.12345 > 10.0.0.2.12345: UDP, length 16
10:18:52.684169 IP 10.0.0.1.12345 > 10.0.0.2.12345: UDP, length 16
10:18:53.684403 IP 10.0.0.1.12345 > 10.0.0.2.12345: UDP, length 16
10:18:54.684618 IP 10.0.0.1.12345 > 10.0.0.2.12345: UDP, length 16
10:18:55.684860 IP 10.0.0.1.12345 > 10.0.0.2.12345: UDP, length 16
10:18:56.685048 IP 10.0.0.1.12345 > 10.0.0.2.12345: UDP, length 16
10:18:57.685272 IP 10.0.0.1.12345 > 10.0.0.2.12345: UDP, length 16
10:18:58.685456 IP 10.0.0.1.12345 > 10.0.0.2.12345: UDP, length 16
10:18:59.685688 IP 10.0.0.1.12345 > 10.0.0.2.12345: UDP, length 16
10:19:00.685876 IP 10.0.0.1.12345 > 10.0.0.2.12345: UDP, length 16
10:19:01.686099 IP 10.0.0.1.12345 > 10.0.0.2.12345: UDP, length 16
10:19:02.686280 IP 10.0.0.1.12345 > 10.0.0.2.12345: UDP, length 16
10:19:03.686505 IP 10.0.0.1.12345 > 10.0.0.2.12345: UDP, length 16
10:19:04.686692 IP 10.0.0.1.12345 > 10.0.0.2.12345: UDP, length 16
10:19:05.686862 IP 10.0.0.1.12345 > 10.0.0.2.12345: UDP, length 16
10:19:06.687035 IP 10.0.0.1.12345 > 10.0.0.2.12345: UDP, length 16
10:19:07.687259 IP 10.0.0.1.12345 > 10.0.0.2.12345: UDP, length 16
10:19:08.687443 IP 10.0.0.1.12345 > 10.0.0.2.12345: UDP, length 16
10:19:09.687693 IP 10.0.0.1.12345 > 10.0.0.2.12345: UDP, length 16
10:19:10.687934 IP 10.0.0.1.12345 > 10.0.0.2.12345: UDP, length 16
10:19:11.688158 IP 10.0.0.1.12345 > 10.0.0.2.12345: UDP, length 16
10:19:12.688343 IP 10.0.0.1.12345 > 10.0.0.2.12345: UDP, length 16
10:19:13.688568 IP 10.0.0.1.12345 > 10.0.0.2.12345: UDP, length 16
10:19:14.688751 IP 10.0.0.1.12345 > 10.0.0.2.12345: UDP, length 16
10:19:15.688970 IP 10.0.0.1.12345 > 10.0.0.2.12345: UDP, length 16
10:19:16.689155 IP 10.0.0.1.12345 > 10.0.0.2.12345: UDP, length 16
10:19:17.689364 IP 10.0.0.1.12345 > 10.0.0.2.12345: UDP, length 16
10:19:18.689521 IP 10.0.0.1.12345 > 10.0.0.2.12345: UDP, length 16
10:19:19.689754 IP 10.0.0.1.12345 > 10.0.0.2.12345: UDP, length 16
10:19:20.689941 IP 10.0.0.1.12345 > 10.0.0.2.12345: UDP, length 16
10:19:21.690110 IP 10.0.0.1.12345 > 10.0.0.2.12345: UDP, length 16
10:19:22.690357 IP 10.0.0.1.12345 > 10.0.0.2.12345: UDP, length 16
10:19:23.690607 IP 10.0.0.1.12345 > 10.0.0.2.12345: UDP, length 16
10:19:24.690860 IP 10.0.0.1.12345 > 10.0.0.2.12345: UDP, length 16
10:19:25.691108 IP 10.0.0.1.12345 > 10.0.0.2.12345: UDP, length 16
10:19:26.691382 IP 10.0.0.1.12345 > 10.0.0.2.12345: UDP, length 16
10:19:27.691627 IP 10.0.0.1.12345 > 10.0.0.2.12345: UDP, length 16
10:19:28.691881 IP 10.0.0.1.12345 > 10.0.0.2.12345: UDP, length 16
10:19:29.692117 IP 10.0.0.1.12345 > 10.0.0.2.12345: UDP, length 16
10:19:30.692369 IP 10.0.0.1.12345 > 10.0.0.2.12345: UDP, length 16
10:19:31.692623 IP 10.0.0.1.12345 > 10.0.0.2.12345: UDP, length 16
10:19:32.692899 IP 10.0.0.1.12345 > 10.0.0.2.12345: UDP, length 16
10:19:33.693137 IP 10.0.0.1.12345 > 10.0.0.2.12345: UDP, length 16
10:19:34.693386 IP 10.0.0.1.12345 > 10.0.0.2.12345: UDP, length 16
10:19:35.693636 IP 10.0.0.1.12345 > 10.0.0.2.12345: UDP, length 16
10:19:36.693894 IP 10.0.0.1.12345 > 10.0.0.2.12345: UDP, length 16
10:19:37.694145 IP 10.0.0.1.12345 > 10.0.0.2.12345: UDP, length 16
10:19:38.694401 IP 10.0.0.1.12345 > 10.0.0.2.12345: UDP, length 16
10:19:39.694625 IP 10.0.0.1.12345 > 10.0.0.2.12345: UDP, length 16
10:19:40.694874 IP 10.0.0.1.12345 > 10.0.0.2.12345: UDP, length 16
10:19:41.695125 IP 10.0.0.1.12345 > 10.0.0.2.12345: UDP, length 16
10:19:42.695381 IP 10.0.0.1.12345 > 10.0.0.2.12345: UDP, length 16
10:19:43.695631 IP 10.0.0.1.12345 > 10.0.0.2.12345: UDP, length 16
10:19:44.695883 IP 10.0.0.1.12345 > 10.0.0.2.12345: UDP, length 16
10:19:45.696128 IP 10.0.0.1.12345 > 10.0.0.2.12345: UDP, length 16
10:19:46.696382 IP 10.0.0.1.12345 > 10.0.0.2.12345: UDP, length 16
10:19:47.696630 IP 10.0.0.1.12345 > 10.0.0.2.12345: UDP, length 16
10:19:48.696872 IP 10.0.0.1.12345 > 10.0.0.2.12345: UDP, length 16
10:19:49.697109 IP 10.0.0.1.12345 > 10.0.0.2.12345: UDP, length 16
10:19:50.697356 IP 10.0.0.1.12345 > 10.0.0.2.12345: UDP, length 16
10:19:51.697593 IP 10.0.0.1.12345 > 10.0.0.2.12345: UDP, length 16
10:19:52.697845 IP 10.0.0.1.12345 > 10.0.0.2.12345: UDP, length 16
10:19:53.698073 IP 10.0.0.1.12345 > 10.0.0.2.12345: UDP, length 16
10:19:54.698322 IP 10.0.0.1.12345 > 10.0.0.2.12345: UDP, length 16
10:19:55.698551 IP 10.0.0.1.12345 > 10.0.0.2.12345: UDP, length 16
10:19:56.698801 IP 10.0.0.1.12345 > 10.0.0.2.12345: UDP, length 16
10:19:57.699039 IP 10.0.0.1.12345 > 10.0.0.2.12345: UDP, length 16
10:19:58.699260 IP 10.0.0.1.12345 > 10.0.0.2.12345: UDP, length 16
10:19:59.699503 IP 10.0.0.1.12345 > 10.0.0.2.12345: UDP, length 16
10:20:00.699755 IP 10.0.0.1.12345 > 10.0.0.2.12345: UDP, length 16
10:20:01.700000 IP 10.0.0.1.12345 > 10.0.0.2.12345: UDP, length 16
10:20:02.700270 IP 10.0.0.1.12345 > 10.0.0.2.12345: UDP, length 16
10:20:03.700499 IP 10.0.0.1.12345 > 10.0.0.2.12345: UDP, length 16
10:20:04.700751 IP 10.0.0.1.12345 > 10.0.0.2.12345: UDP, length 16
10:20:05.701004 IP 10.0.0.1.12345 > 10.0.0.2.12345: UDP, length 16
10:20:06.701237 IP 10.0.0.1.12345 > 10.0.0.2.12345: UDP, length 16
10:20:07.701480 IP 10.0.0.1.12345 > 10.0.0.2.12345: UDP, length 16
10:20:08.701710 IP 10.0.0.1.12345 > 10.0.0.2.12345: UDP, length 16
10:20:09.701957 IP 10.0.0.1.12345 > 10.0.0.2.12345: UDP, length 16
10:20:10.702141 IP 10.0.0.1.12345 > 10.0.0.2.12345: UDP, length 16
10:20:11.702378 IP 10.0.0.1.12345 > 10.0.0.2.12345: UDP, length 16
10:20:12.702626 IP 10.0.0.1.12345 > 10.0.0.2.12345: UDP, length 16
10:20:13.702789 IP 10.0.0.1.12345 > 10.0.0.2.12345: UDP, length 16
10:20:14.702999 IP 10.0.0.1.12345 > 10.0.0.2.12345: UDP, length 16
10:20:15.703212 IP 10.0.0.1.12345 > 10.0.0.2.12345: UDP, length 16
10:20:16.703431 IP 10.0.0.1.12345 > 10.0.0.2.12345: UDP, length 16
10:20:17.703665 IP 10.0.0.1.12345 > 10.0.0.2.12345: UDP, length 16
10:20:18.703897 IP 10.0.0.1.12345 > 10.0.0.2.12345: UDP, length 16
10:20:19.704141 IP 10.0.0.1.12345 > 10.0.0.2.12345: UDP, length 16
10:20:20.704388 IP 10.0.0.1.12345 > 10.0.0.2.12345: UDP, length 16
10:20:21.704630 IP 10.0.0.1.12345 > 10.0.0.2.12345: UDP, length 16
10:20:22.704880 IP 10.0.0.1.12345 > 10.0.0.2.12345: UDP, length 16
10:20:23.705099 IP 10.0.0.1.12345 > 10.0.0.2.12345: UDP, length 16
10:20:24.705343 IP 10.0.0.1.12345 > 10.0.0.2.12345: UDP, length 16
10:20:25.705591 IP 10.0.0.1.12345 > 10.0.0.2.12345: UDP, length 16
10:20:26.705837 IP 10.0.0.1.12345 > 10.0.0.2.12345: UDP, length 16
10:20:27.706079 IP 10.0.0.1.12345 > 10.0.0.2.12345: UDP, length 16
10:20:28.706329 IP 10.0.0.1.12345 > 10.0.0.2.12345: UDP, length 16
10:20:29.706574 IP 10.0.0.1.12345 > 10.0.0.2.12345: UDP, length 16
10:20:30.706820 IP 10.0.0.1.12345 > 10.0.0.2.12345: UDP, length 16
10:20:31.707001 IP 10.0.0.1.12345 > 10.0.0.2.12345: UDP, length 16
10:20:32.707221 IP 10.0.0.1.12345 > 10.0.0.2.12345: UDP, length 16
10:20:33.707462 IP 10.0.0.1.12345 > 10.0.0.2.12345: UDP, length 16
10:20:34.707805 IP 10.0.0.1.12345 > 10.0.0.2.12345: UDP, length 16
10:20:35.708030 IP 10.0.0.1.12345 > 10.0.0.2.12345: UDP, length 16
10:20:36.708275 IP 10.0.0.1.12345 > 10.0.0.2.12345: UDP, length 16
10:20:37.708520 IP 10.0.0.1.12345 > 10.0.0.2.12345: UDP, length 16

