10:15:38.640792 IP 10.0.0.1.12345 > 10.0.0.2.12345: UDP, length 16
10:15:39.640854 IP 10.0.0.1.12345 > 10.0.0.2.12345: UDP, length 16
10:15:40.641102 IP 10.0.0.1.12345 > 10.0.0.2.12345: UDP, length 16
10:15:41.641349 IP 10.0.0.1.12345 > 10.0.0.2.12345: UDP, length 16
10:15:42.641599 IP 10.0.0.1.12345 > 10.0.0.2.12345: UDP, length 16
10:15:43.641842 IP 10.0.0.1.12345 > 10.0.0.2.12345: UDP, length 16
10:15:44.642072 IP 10.0.0.1.12345 > 10.0.0.2.12345: UDP, length 16
10:15:45.642314 IP 10.0.0.1.12345 > 10.0.0.2.12345: UDP, length 16
10:15:46.642556 IP 10.0.0.1.12345 > 10.0.0.2.12345: UDP, length 16
10:15:47.642798 IP 10.0.0.1.12345 > 10.0.0.2.12345: UDP, length 16
10:15:48.643039 IP 10.0.0.1.12345 > 10.0.0.2.12345: UDP, length 16
10:15:49.643279 IP 10.0.0.1.12345 > 10.0.0.2.12345: UDP, length 16
10:15:50.643524 IP 10.0.0.1.12345 > 10.0.0.2.12345: UDP, length 16
10:15:51.643831 IP 10.0.0.1.12345 > 10.0.0.2.12345: UDP, length 16
10:15:52.644053 IP 10.0.0.1.12345 > 10.0.0.2.12345: UDP, length 16
10:15:53.644299 IP 10.0.0.1.12345 > 10.0.0.2.12345: UDP, length 16
10:15:54.644543 IP 10.0.0.1.12345 > 10.0.0.2.12345: UDP, length 16
10:15:55.644697 IP 10.0.0.1.12345 > 10.0.0.2.12345: UDP, length 16
10:15:56.644925 IP 10.0.0.1.12345 > 10.0.0.2.12345: UDP, length 16
10:15:57.645168 IP 10.0.0.1.12345 > 10.0.0.2.12345: UDP, length 16
10:15:58.645390 IP 10.0.0.1.12345 > 10.0.0.2.12345: UDP, length 16
10:15:59.645624 IP 10.0.0.1.12345 > 10.0.0.2.12345: UDP, length 16
10:16:00.645802 IP 10.0.0.1.12345 > 10.0.0.2.12345: UDP, length 16
10:16:01.646001 IP 10.0.0.1.12345 > 10.0.0.2.12345: UDP, length 16
10:16:02.646221 IP 10.0.0.1.12345 > 10.0.0.2.12345: UDP, length 16
10:16:03.646452 IP 10.0.0.1.12345 > 10.0.0.2.12345: UDP, length 16
10:16:04.646701 IP 10.0.0.1.12345 > 10.0.0.2.12345: UDP, length 16
10:16:05.646935 IP 10.0.0.1.12345 > 10.0.0.2.12345: UDP, length 16
10:16:06.647124 IP 10.0.0.1.12345 > 10.0.0.2.12345: UDP, length 16
10:16:07.647312 IP 10.0.0.1.12345 > 10.0.0.2.12345: UDP, length 16
10:16:08.647540 IP 10.0.0.1.12345 > 10.0.0.2.12345: UDP, length 16
10:16:09.647740 IP 10.0.0.1.12345 > 10.0.0.2.12345: UDP, length 16
10:16:10.647913 IP 10.0.0.1.12345 > 10.0.0.2.12345: UDP, length 16
10:16:11.648125 IP 10.0.0.1.12345 > 10.0.0.2.12345: UDP, length 16
10:16:12.648374 IP 10.0.0.1.12345 > 10.0.0.2.12345: UDP, length 16
10:16:13.648600 IP 10.0.0.1.12345 > 10.0.0.2.12345: UDP, length 16
10:16:14.648844 IP 10.0.0.1.12345 > 10.0.0.2.12345: UDP, length 16
10:16:15.649078 IP 10.0.0.1.12345 > 10.0.0.2.12345: UDP, length 16
10:16:16.649329 IP 10.0.0.1.12345 > 10.0.0.2.12345: UDP, length 16
10:16:17.649488 IP 10.0.0.1.12345 > 10.0.0.2.12345: UDP, length 16
10:16:18.649733 IP 10.0.0.1.12345 > 10.0.0.2.12345: UDP, length 16
10:16:19.649968 IP 10.0.0.1.12345 > 10.0.0.2.12345: UDP, length 16
10:16:20.650214 IP 10.0.0.1.12345 > 10.0.0.2.12345: UDP, length 16
10:16:21.650446 IP 10.0.0.1.12345 > 10.0.0.2.12345: UDP, length 16
10:16:22.650698 IP 10.0.0.1.12345 > 10.0.0.2.12345: UDP, length 16
10:16:23.650931 IP 10.0.0.1.12345 > 10.0.0.2.12345: UDP, length 16
10:16:24.651182 IP 10.0.0.1.12345 > 10.0.0.2.12345: UDP, length 16
10:16:25.651409 IP 10.0.0.1.12345 > 10.0.0.2.12345: UDP, length 16
10:16:26.651657 IP 10.0.0.1.12345 > 10.0.0.2.12345: UDP, length 16
10:16:27.651953 IP 10.0.0.1.12345 > 10.0.0.2.12345: UDP, length 16
10:16:28.652201 IP 10.0.0.1.12345 > 10.0.0.2.12345: UDP, length 16
10:16:29.652428 IP 10.0.0.1.12345 > 10.0.0.2.12345: UDP, length 16
10:16:30.652645 IP 10.0.0.1.12345 > 10.0.0.2.12345: UDP, length 16
10:16:31.652848 IP 10.0.0.1.12345 > 10.0.0.2.12345: UDP, length 16
10:16:32.653088 IP 10.0.0.1.12345 > 10.0.0.2.12345: UDP, length 16
10:16:33.653280 IP 10.0.0.1.12345 > 10.0.0.2.12345: UDP, length 16
10:16:34.653528 IP 10.0.0.1.12345 > 10.0.0.2.12345: UDP, length 16
10:16:35.653736 IP 10.0.0.1.12345 > 10.0.0.2.12345: UDP, length 16
10:16:36.653983 IP 10.0.0.1.12345 > 10.0.0.2.12345: UDP, length 16
10:16:37.654178 IP 10.0.0.1.12345 > 10.0.0.2.12345: UDP, length 16
10:16:38.654425 IP 10.0.0.1.12345 > 10.0.0.2.12345: UDP, length 16
10:16:39.654629 IP 10.0.0.1.12345 > 10.0.0.2.12345: UDP, length 16
10:16:40.654821 IP 10.0.0.1.12345 > 10.0.0.2.12345: UDP, length 16
10:16:41.655009 IP 10.0.0.1.12345 > 10.0.0.2.12345: UDP, length 16
10:16:42.655253 IP 10.0.0.1.12345 > 10.0.0.2.12345: UDP, length 16
10:16:43.655427 IP 10.0.0.1.12345 > 10.0.0.2.12345: UDP, length 16
10:16:44.655682 IP 10.0.0.1.12345 > 10.0.0.2.12345: UDP, length 16
10:16:45.655859 IP 10.0.0.1.12345 > 10.0.0.2.12345: UDP, length 16
10:16:46.656085 IP 10.0.0.1.12345 > 10.0.0.2.12345: UDP, length 16
10:16:47.656261 IP 10.0.0.1.12345 > 10.0.0.2.12345: UDP, length 16
10:16:48.656505 IP 10.0.0.1.12345 > 10.0.0.2.12345: UDP, length 16
10:16:49.656679 IP 10.0.0.1.12345 > 10.0.0.2.12345: UDP, length 16
10:16:50.656924 IP 10.0.0.1.12345 > 10.0.0.2.12345: UDP, length 16
10:16:51.657097 IP 10.0.0.1.12345 > 10.0.0.2.12345: UDP, length 16
10:16:52.657323 IP 10.0.0.1.12345 > 10.0.0.2.12345: UDP, length 16
10:16:53.657496 IP 10.0.0.1.12345 > 10.0.0.2.12345: UDP, length 16
10:16:54.657735 IP 10.0.0.1.12345 > 10.0.0.2.12345: UDP, length 16
10:16:55.657908 IP 10.0.0.1.12345 > 10.0.0.2.12345: UDP, length 16
10:16:56.658145 IP 10.0.0.1.12345 > 10.0.0.2.12345: UDP, length 16
10:16:57.658318 IP 10.0.0.1.12345 > 10.0.0.2.12345: UDP, length 16
10:16:58.658539 IP 10.0.0.1.12345 > 10.0.0.2.12345: UDP, length 16
10:16:59.658715 IP 10.0.0.1.12345 > 10.0.0.2.12345: UDP, length 16
10:17:00.658936 IP 10.0.0.1.12345 > 10.0.0.2.12345: UDP, length 16
10:17:01.659045 IP 10.0.0.1.12345 > 10.0.0.2.12345: UDP, length 16
10:17:02.659284 IP 10.0.0.1.12345 > 10.0.0.2.12345: UDP, length 16
10:17:03.659455 IP 10.0.0.1.12345 > 10.0.0.2.12345: UDP, length 16
10:17:04.659688 IP 10.0.0.1.12345 > 10.0.0.2.12345: UDP, length 16
10:17:05.659863 IP 10.0.0.1.12345 > 10.0.0.2.12345: UDP, length 16
10:17:06.660048 IP 10.0.0.1.12345 > 10.0.0.2.12345: UDP, length 16
10:17:07.660219 IP 10.0.0.1.12345 > 10.0.0.2.12345: UDP, length 16
10:17:08.660447 IP 10.0.0.1.12345 > 10.0.0.2.12345: UDP, length 16
10:17:09.660620 IP 10.0.0.1.12345 > 10.0.0.2.12345: UDP, length 16
10:17:10.660808 IP 10.0.0.1.12345 > 10.0.0.2.12345: UDP, length 16
10:17:11.661036 IP 10.0.0.1.12345 > 10.0.0.2.12345: UDP, length 16
10:17:12.661270 IP 10.0.0.1.12345 > 10.0.0.2.12345: UDP, length 16
10:17:13.661469 IP 10.0.0.1.12345 > 10.0.0.2.12345: UDP, length 16
10:17:14.661711 IP 10.0.0.1.12345 > 10.0.0.2.12345: UDP, length 16
10:17:15.661959 IP 10.0.0.1.12345 > 10.0.0.2.12345: UDP, length 16
10:17:16.662191 IP 10.0.0.1.12345 > 10.0.0.2.12345: UDP, length 16
10:17:17.662434 IP 10.0.0.1.12345 > 10.0.0.2.12345: UDP, length 16
10:17:18.662684 IP 10.0.0.1.12345 > 10.0.0.2.12345: UDP, length 16
10:17:19.662934 IP 10.0.0.1.12345 > 10.0.0.2.12345: UDP, length 16
10:17:20.663183 IP 10.0.0.1.12345 > 10.0.0.2.12345: UDP, length 16
10:17:21.663428 IP 10.0.0.1.12345 > 10.0.0.2.12345: UDP, length 16
10:17:22.663694 IP 10.0.0.1.12345 > 10.0.0.2.12345: UDP, length 16
10:17:23.663948 IP 10.0.0.1.12345 > 10.0.0.2.12345: UDP, length 16
10:17:24.664197 IP 10.0.0.1.12345 > 10.0.0.2.12345: UDP, length 16
10:17:25.664447 IP 10.0.0.1.12345 > 10.0.0.2.12345: UDP, length 16
10:17:26.664700 IP 10.0.0.1.12345 > 10.0.0.2.12345: UDP, length 16
10:17:27.664948 IP 10.0.0.1.12345 > 10.0.0.2.12345: UDP, length 16
10:17:28.665195 IP 10.0.0.1.12345 > 10.0.0.2.12345: UDP, length 16
10:17:29.665442 IP 10.0.0.1.12345 > 10.0.0.2.12345: UDP, length 16
10:17:30.665694 IP 10.0.0.1.12345 > 10.0.0.2.12345: UDP, length 16
10:17:31.665944 IP 10.0.0.1.12345 > 10.0.0.2.12345: UDP, length 16
10:17:32.666182 IP 10.0.0.1.12345 > 10.0.0.2.12345: UDP, length 16
10:17:33.666429 IP 10.0.0.1.12345 > 10.0.0.2.12345: UDP, length 16
10:17:34.666681 IP 10.0.0.1.12345 > 10.0.0.2.12345: UDP, length 16
10:17:35.666926 IP 10.0.0.1.12345 > 10.0.0.2.12345: UDP, length 16
10:17:36.667151 IP 10.0.0.1.12345 > 10.0.0.2.12345: UDP, length 16
10:17:37.667366 IP 10.0.0.1.12345 > 10.0.0.2.12345: UDP, length 16
10:17:38.667612 IP 10.0.0.1.12345 > 10.0.0.2.12345: UDP, length 16
10:17:39.667862 IP 10.0.0.1.12345 > 10.0.0.2.12345: UDP, length 16
10:17:40.668090 IP 10.0.0.1.12345 > 10.0.0.2.12345: UDP, length 16
10:17:41.668333 IP 10.0.0.1.12345 > 10.0.0.2.12345: UDP, length 16
10:17:42.668580 IP 10.0.0.1.12345 > 10.0.0.2.12345: UDP, length 16
10:17:43.668774 IP 10.0.0.1.12345 > 10.0.0.2.12345: UDP, length 16
10:17:44.669014 IP 10.0.0.1.12345 > 10.0.0.2.12345: UDP, length 16
10:17:45.669238 IP 10.0.0.1.12345 > 10.0.0.2.12345: UDP, length 16
10:17:46.669478 IP 10.0.0.1.12345 > 10.0.0.2.12345: UDP, length 16
10:17:47.669653 IP 10.0.0.1.12345 > 10.0.0.2.12345: UDP, length 16
10:17:48.669862 IP 10.0.0.1.12345 > 10.0.0.2.12345: UDP, length 16
10:17:49.670107 IP 10.0.0.1.12345 > 10.0.0.2.12345: UDP, length 16
10:17:50.670359 IP 10.0.0.1.12345 > 10.0.0.2.12345: UDP, length 16
10:17:51.670604 IP 10.0.0.1.12345 > 10.0.0.2.12345: UDP, length 16
10:17:52.670825 IP 10.0.0.1.12345 > 10.0.0.2.12345: UDP, length 16
10:17:53.671071 IP 10.0.0.1.12345 > 10.0.0.2.12345: UDP, length 16
10:17:54.671306 IP 10.0.0.1.12345 > 10.0.0.2.12345: UDP, length 16
10:17:55.671550 IP 10.0.0.1.12345 > 10.0.0.2.12345: UDP, length 16
10:17:56.671772 IP 10.0.0.1.12345 > 10.0.0.2.12345: UDP, length 16
10:17:57.672018 IP 10.0.0.1.12345 > 10.0.0.2.12345: UDP, length 16
10:17:58.672239 IP 10.0.0.1.12345 > 10.0.0.2.12345: UDP, length 16
10:17:59.672484 IP 10.0.0.1.12345 > 10.0.0.2.12345: UDP, length 16
10:18:00.672704 IP 10.0.0.1.12345 > 10.0.0.2.12345: UDP, length 16
10:18:01.672907 IP 10.0.0.1.12345 > 10.0.0.2.12345: UDP, length 16
10:18:02.673171 IP 10.0.0.1.12345 > 10.0.0.2.12345: UDP, length 16
10:18:03.673415 IP 10.0.0.1.12345 > 10.0.0.2.12345: UDP, length 16
10:18:04.673644 IP 10.0.0.1.12345 > 10.0.0.2.12345: UDP, length 16
10:18:05.673867 IP 10.0.0.1.12345 > 10.0.0.2.12345: UDP, length 16
10:18:06.674068 IP 10.0.0.1.12345 > 10.0.0.2.12345: UDP, length 16
10:18:07.674313 IP 10.0.0.1.12345 > 10.0.0.2.12345: UDP, length 16
10:18:08.674534 IP 10.0.0.1.12345 > 10.0.0.2.12345: UDP, length 16
10:18:09.674707 IP 10.0.0.1.12345 > 10.0.0.2.12345: UDP, length 16
10:18:10.674891 IP 10.0.0.1.12345 > 10.0.0.2.12345: UDP, length 16
10:18:11.675096 IP 10.0.0.1.12345 > 10.0.0.2.12345: UDP, length 16
10:18:12.675300 IP 10.0.0.1.12345 > 10.0.0.2.12345: UDP, length 16
10:18:13.675546 IP 10.0.0.1.12345 > 10.0.0.2.12345: UDP, length 16
10:18:14.675794 IP 10.0.0.1.12345 > 10.0.0.2.12345: UDP, length 16
10:18:15.676004 IP 10.0.0.1.12345 > 10.0.0.2.12345: UDP, length 16
10:18:16.676212 IP 10.0.0.1.12345 > 10.0.0.2.12345: UDP, length 16
10:18:17.676445 IP 10.0.0.1.12345 > 10.0.0.2.12345: UDP, length 16
10:18:18.676638 IP 10.0.0.1.12345 > 10.0.0.2.12345: UDP, length 16
10:18:19.676878 IP 10.0.0.1.12345 > 10.0.0.2.12345: UDP, length 16
10:18:20.677052 IP 10.0.0.1.12345 > 10.0.0.2.12345: UDP, length 16
10:18:21.677290 IP 10.0.0.1.12345 > 10.0.0.2.12345: UDP, length 16
10:18:22.677506 IP 10.0.0.1.12345 > 10.0.0.2.12345: UDP, length 16
10:18:23.677747 IP 10.0.0.1.12345 > 10.0.0.2.12345: UDP, length 16
10:18:24.677955 IP 10.0.0.1.12345 > 10.0.0.2.12345: UDP, length 16
10:18:25.678198 IP 10.0.0.1.12345 > 10.0.0.2.12345: UDP, length 16
10:18:26.678435 IP 10.0.0.1.12345 > 10.0.0.2.12345: UDP, length 16
10:18:27.678608 IP 10.0.0.1.12345 > 10.0.0.2.12345: UDP, length 16
10:18:28.678829 IP 10.0.0.1.12345 > 10.0.0.2.12345: UDP, length 16
10:18:29.679070 IP 10.0.0.1.12345 > 10.0.0.2.12345: UDP, length 16
10:18:30.679300 IP 10.0.0.1.12345 > 10.0.0.2.12345: UDP, length 16
10:18:31.679542 IP 10.0.0.1.12345 > 10.0.0.2.12345: UDP, length 16
10:18:32.679749 IP 10.0.0.1.12345 > 10.0.0.2.12345: UDP, length 16
10:18:33.679957 IP 10.0.0.1.12345 > 10.0.0.2.12345: UDP, length 16
10:18:34.680188 IP 10.0.0.1.12345 > 10.0.0.2.12345: UDP, length 16
10:18:35.680428 IP 10.0.0.1.12345 > 10.0.0.2.12345: UDP, length 16
10:18:36.680606 IP 10.0.0.1.12345 > 10.0.0.2.12345: UDP, length 16
10:18:37.680853 IP 10.0.0.1.12345 > 10.0.0.2.12345: UDP, length 16
10:18:38.681080 IP 10.0.0.1.12345 > 10.0.0.2.12345: UDP, length 16
10:18:39.681327 IP 10.0.0.1.12345 > 10.0.0.2.12345: UDP, length 16
10:18:40.681534 IP 10.0.0.1.12345 > 10.0.0.2.12345: UDP, length 16
10:18:41.681780 IP 10.0.0.1.12345 > 10.0.0.2.12345: UDP, length 16
10:18:42.681980 IP 10.0.0.1.12345 > 10.0.0.2.12345: UDP, length 16
10:18:43.682221 IP 10.0.0.1.12345 > 10.0.0.2.12345: UDP, length 16
10:18:44.682430 IP 10.0.0.1.12345 > 10.0.0.2.12345: UDP, length 16
10:18:45.682674 IP 10.0.0.1.12345 > 10.0.0.2.12345: UDP, length 16
10:18:46.682928 IP 10.0.0.1.12345 > 10.0.0.2.12345: UDP, length 16
10:18:47.683131 IP 10.0.0.1.12345 > 10.0.0.2.12345: UDP, length 16
10:18:48.683307 IP 10.0.0.1.12345 > 10.0.0.2.12345: UDP, length 16
10:18:49.683545 IP 10.0.0.1.12345 > 10.0.0.2.12345: UDP, length 16
10:18:50.683745 IP 10.0.0.1.12345 > 10.0.0.2.12345: UDP, length 16
10:18:51.683992 IP 10.0.0.1.12345 > 10.0.0.2.12345: UDP, length 16
10:18:52.684175 IP 10.0.0.1.12345 > 10.0.0.2.12345: UDP, length 16
10:18:53.684415 IP 10.0.0.1.12345 > 10.0.0.2.12345: UDP, length 16
10:18:54.684628 IP 10.0.0.1.12345 > 10.0.0.2.12345: UDP, length 16
10:18:55.684874 IP 10.0.0.1.12345 > 10.0.0.2.12345: UDP, length 16
10:18:56.685054 IP 10.0.0.1.12345 > 10.0.0.2.12345: UDP, length 16
10:18:57.685283 IP 10.0.0.1.12345 > 10.0.0.2.12345: UDP, length 16
10:18:58.685462 IP 10.0.0.1.12345 > 10.0.0.2.12345: UDP, length 16
10:18:59.685700 IP 10.0.0.1.12345 > 10.0.0.2.12345: UDP, length 16
10:19:00.685882 IP 10.0.0.1.12345 > 10.0.0.2.12345: UDP, length 16
10:19:01.686110 IP 10.0.0.1.12345 > 10.0.0.2.12345: UDP, length 16
10:19:02.686287 IP 10.0.0.1.12345 > 10.0.0.2.12345: UDP, length 16
10:19:03.686517 IP 10.0.0.1.12345 > 10.0.0.2.12345: UDP, length 16
10:19:04.686698 IP 10.0.0.1.12345 > 10.0.0.2.12345: UDP, length 16
10:19:05.686868 IP 10.0.0.1.12345 > 10.0.0.2.12345: UDP, length 16
10:19:06.687042 IP 10.0.0.1.12345 > 10.0.0.2.12345: UDP, length 16
10:19:07.687270 IP 10.0.0.1.12345 > 10.0.0.2.12345: UDP, length 16
10:19:08.687449 IP 10.0.0.1.12345 > 10.0.0.2.12345: UDP, length 16
10:19:09.687705 IP 10.0.0.1.12345 > 10.0.0.2.12345: UDP, length 16
10:19:10.687940 IP 10.0.0.1.12345 > 10.0.0.2.12345: UDP, length 16
10:19:11.688169 IP 10.0.0.1.12345 > 10.0.0.2.12345: UDP, length 16
10:19:12.688349 IP 10.0.0.1.12345 > 10.0.0.2.12345: UDP, length 16
10:19:13.688580 IP 10.0.0.1.12345 > 10.0.0.2.12345: UDP, length 16
10:19:14.688757 IP 10.0.0.1.12345 > 10.0.0.2.12345: UDP, length 16
10:19:15.688981 IP 10.0.0.1.12345 > 10.0.0.2.12345: UDP, length 16
10:19:16.689161 IP 10.0.0.1.12345 > 10.0.0.2.12345: UDP, length 16
10:19:17.689374 IP 10.0.0.1.12345 > 10.0.0.2.12345: UDP, length 16
10:19:18.689527 IP 10.0.0.1.12345 > 10.0.0.2.12345: UDP, length 16
10:19:19.689766 IP 10.0.0.1.12345 > 10.0.0.2.12345: UDP, length 16
10:19:20.689947 IP 10.0.0.1.12345 > 10.0.0.2.12345: UDP, length 16
10:19:21.690116 IP 10.0.0.1.12345 > 10.0.0.2.12345: UDP, length 16
10:19:22.690369 IP 10.0.0.1.12345 > 10.0.0.2.12345: UDP, length 16
10:19:23.690619 IP 10.0.0.1.12345 > 10.0.0.2.12345: UDP, length 16
10:19:24.690874 IP 10.0.0.1.12345 > 10.0.0.2.12345: UDP, length 16
10:19:25.691120 IP 10.0.0.1.12345 > 10.0.0.2.12345: UDP, length 16
10:19:26.691396 IP 10.0.0.1.12345 > 10.0.0.2.12345: UDP, length 16
10:19:27.691639 IP 10.0.0.1.12345 > 10.0.0.2.12345: UDP, length 16
10:19:28.691894 IP 10.0.0.1.12345 > 10.0.0.2.12345: UDP, length 16
10:19:29.692129 IP 10.0.0.1.12345 > 10.0.0.2.12345: UDP, length 16
10:19:30.692384 IP 10.0.0.1.12345 > 10.0.0.2.12345: UDP, length 16
10:19:31.692637 IP 10.0.0.1.12345 > 10.0.0.2.12345: UDP, length 16
10:19:32.692914 IP 10.0.0.1.12345 > 10.0.0.2.12345: UDP, length 16
10:19:33.693150 IP 10.0.0.1.12345 > 10.0.0.2.12345: UDP, length 16
10:19:34.693400 IP 10.0.0.1.12345 > 10.0.0.2.12345: UDP, length 16
10:19:35.693651 IP 10.0.0.1.12345 > 10.0.0.2.12345: UDP, length 16
10:19:36.693908 IP 10.0.0.1.12345 > 10.0.0.2.12345: UDP, length 16
10:19:37.694159 IP 10.0.0.1.12345 > 10.0.0.2.12345: UDP, length 16
10:19:38.694416 IP 10.0.0.1.12345 > 10.0.0.2.12345: UDP, length 16
10:19:39.694635 IP 10.0.0.1.12345 > 10.0.0.2.12345: UDP, length 16
10:19:40.694888 IP 10.0.0.1.12345 > 10.0.0.2.12345: UDP, length 16
10:19:41.695139 IP 10.0.0.1.12345 > 10.0.0.2.12345: UDP, length 16
10:19:42.695394 IP 10.0.0.1.12345 > 10.0.0.2.12345: UDP, length 16
10:19:43.695644 IP 10.0.0.1.12345 > 10.0.0.2.12345: UDP, length 16
10:19:44.695895 IP 10.0.0.1.12345 > 10.0.0.2.12345: UDP, length 16
10:19:45.696142 IP 10.0.0.1.12345 > 10.0.0.2.12345: UDP, length 16
10:19:46.696396 IP 10.0.0.1.12345 > 10.0.0.2.12345: UDP, length 16
10:19:47.696642 IP 10.0.0.1.12345 > 10.0.0.2.12345: UDP, length 16
10:19:48.696884 IP 10.0.0.1.12345 > 10.0.0.2.12345: UDP, length 16
10:19:49.697120 IP 10.0.0.1.12345 > 10.0.0.2.12345: UDP, length 16
10:19:50.697370 IP 10.0.0.1.12345 > 10.0.0.2.12345: UDP, length 16
10:19:51.697605 IP 10.0.0.1.12345 > 10.0.0.2.12345: UDP, length 16
10:19:52.697858 IP 10.0.0.1.12345 > 10.0.0.2.12345: UDP, length 16
10:19:53.698084 IP 10.0.0.1.12345 > 10.0.0.2.12345: UDP, length 16
10:19:54.698335 IP 10.0.0.1.12345 > 10.0.0.2.12345: UDP, length 16
10:19:55.698562 IP 10.0.0.1.12345 > 10.0.0.2.12345: UDP, length 16
10:19:56.698815 IP 10.0.0.1.12345 > 10.0.0.2.12345: UDP, length 16
10:19:57.699050 IP 10.0.0.1.12345 > 10.0.0.2.12345: UDP, length 16
10:19:58.699270 IP 10.0.0.1.12345 > 10.0.0.2.12345: UDP, length 16
10:19:59.699515 IP 10.0.0.1.12345 > 10.0.0.2.12345: UDP, length 16
10:20:00.699767 IP 10.0.0.1.12345 > 10.0.0.2.12345: UDP, length 16
10:20:01.700012 IP 10.0.0.1.12345 > 10.0.0.2.12345: UDP, length 16
10:20:02.700283 IP 10.0.0.1.12345 > 10.0.0.2.12345: UDP, length 16
10:20:03.700509 IP 10.0.0.1.12345 > 10.0.0.2.12345: UDP, length 16
10:20:04.700764 IP 10.0.0.1.12345 > 10.0.0.2.12345: UDP, length 16
10:20:05.701018 IP 10.0.0.1.12345 > 10.0.0.2.12345: UDP, length 16
10:20:06.701248 IP 10.0.0.1.12345 > 10.0.0.2.12345: UDP, length 16
10:20:07.701492 IP 10.0.0.1.12345 > 10.0.0.2.12345: UDP, length 16
10:20:08.701721 IP 10.0.0.1.12345 > 10.0.0.2.12345: UDP, length 16
10:20:09.701970 IP 10.0.0.1.12345 > 10.0.0.2.12345: UDP, length 16
10:20:10.702148 IP 10.0.0.1.12345 > 10.0.0.2.12345: UDP, length 16
10:20:11.702390 IP 10.0.0.1.12345 > 10.0.0.2.12345: UDP, length 16
10:20:12.702639 IP 10.0.0.1.12345 > 10.0.0.2.12345: UDP, length 16
10:20:13.702798 IP 10.0.0.1.12345 > 10.0.0.2.12345: UDP, length 16
10:20:14.703013 IP 10.0.0.1.12345 > 10.0.0.2.12345: UDP, length 16
10:20:15.703226 IP 10.0.0.1.12345 > 10.0.0.2.12345: UDP, length 16
10:20:16.703444 IP 10.0.0.1.12345 > 10.0.0.2.12345: UDP, length 16
10:20:17.703688 IP 10.0.0.1.12345 > 10.0.0.2.12345: UDP, length 16
10:20:18.703910 IP 10.0.0.1.12345 > 10.0.0.2.12345: UDP, length 16
10:20:19.704154 IP 10.0.0.1.12345 > 10.0.0.2.12345: UDP, length 16
10:20:20.704400 IP 10.0.0.1.12345 > 10.0.0.2.12345: UDP, length 16
10:20:21.704644 IP 10.0.0.1.12345 > 10.0.0.2.12345: UDP, length 16
10:20:22.704893 IP 10.0.0.1.12345 > 10.0.0.2.12345: UDP, length 16
10:20:23.705109 IP 10.0.0.1.12345 > 10.0.0.2.12345: UDP, length 16
10:20:24.705356 IP 10.0.0.1.12345 > 10.0.0.2.12345: UDP, length 16
10:20:25.705605 IP 10.0.0.1.12345 > 10.0.0.2.12345: UDP, length 16
10:20:26.705849 IP 10.0.0.1.12345 > 10.0.0.2.12345: UDP, length 16
10:20:27.706093 IP 10.0.0.1.12345 > 10.0.0.2.12345: UDP, length 16
10:20:28.706343 IP 10.0.0.1.12345 > 10.0.0.2.12345: UDP, length 16
10:20:29.706585 IP 10.0.0.1.12345 > 10.0.0.2.12345: UDP, length 16
10:20:30.706834 IP 10.0.0.1.12345 > 10.0.0.2.12345: UDP, length 16
10:20:31.707011 IP 10.0.0.1.12345 > 10.0.0.2.12345: UDP, length 16
10:20:32.707232 IP 10.0.0.1.12345 > 10.0.0.2.12345: UDP, length 16
10:20:33.707475 IP 10.0.0.1.12345 > 10.0.0.2.12345: UDP, length 16
10:20:34.707818 IP 10.0.0.1.12345 > 10.0.0.2.12345: UDP, length 16
10:20:35.708042 IP 10.0.0.1.12345 > 10.0.0.2.12345: UDP, length 16
10:20:36.708289 IP 10.0.0.1.12345 > 10.0.0.2.12345: UDP, length 16
10:20:37.708533 IP 10.0.0.1.12345 > 10.0.0.2.12345: UDP, length 16
