11:45:02.026040 IP 10.49.182.127.12345 > 10.0.0.2.12345: UDP, length 16
11:45:02.825872 IP 10.33.118.55.12345 > 10.0.0.2.12345: UDP, length 16
11:45:03.626441 IP 10.77.38.11.12345 > 10.0.0.2.12345: UDP, length 16
11:45:04.428056 IP 10.108.179.188.12345 > 10.0.0.2.12345: UDP, length 16
11:45:05.227224 IP 10.119.139.255.12345 > 10.0.0.2.12345: UDP, length 16
11:45:06.028790 IP 10.112.1.193.12345 > 10.0.0.2.12345: UDP, length 16
11:45:06.827904 IP 10.23.55.113.12345 > 10.0.0.2.12345: UDP, length 16
11:45:07.627391 IP 10.71.181.154.12345 > 10.0.0.2.12345: UDP, length 16
11:45:08.429638 IP 10.101.76.99.12345 > 10.0.0.2.12345: UDP, length 16
11:45:09.227914 IP 10.75.120.225.12345 > 10.0.0.2.12345: UDP, length 16
11:45:10.028727 IP 10.24.188.63.12345 > 10.0.0.2.12345: UDP, length 16
11:45:10.829149 IP 10.27.220.114.12345 > 10.0.0.2.12345: UDP, length 16
11:45:11.630952 IP 10.56.204.112.12345 > 10.0.0.2.12345: UDP, length 16
11:45:12.430130 IP 10.59.179.109.12345 > 10.0.0.2.12345: UDP, length 16
11:45:13.231749 IP 10.83.48.195.12345 > 10.0.0.2.12345: UDP, length 16
11:45:14.030980 IP 10.60.34.160.12345 > 10.0.0.2.12345: UDP, length 16
11:45:14.829945 IP 10.35.57.238.12345 > 10.0.0.2.12345: UDP, length 16
11:45:15.632401 IP 10.92.40.102.12345 > 10.0.0.2.12345: UDP, length 16
11:45:16.430809 IP 10.4.143.213.12345 > 10.0.0.2.12345: UDP, length 16
11:45:17.232882 IP 10.15.46.126.12345 > 10.0.0.2.12345: UDP, length 16
11:45:18.032293 IP 10.5.43.9.12345 > 10.0.0.2.12345: UDP, length 16
11:45:18.832198 IP 10.20.83.202.12345 > 10.0.0.2.12345: UDP, length 16
11:45:19.633161 IP 10.105.167.89.12345 > 10.0.0.2.12345: UDP, length 16
11:45:20.433873 IP 10.77.171.79.12345 > 10.0.0.2.12345: UDP, length 16
11:45:21.233918 IP 10.27.56.15.12345 > 10.0.0.2.12345: UDP, length 16
11:45:22.033157 IP 10.31.114.6.12345 > 10.0.0.2.12345: UDP, length 16
11:45:22.833578 IP 10.37.82.249.12345 > 10.0.0.2.12345: UDP, length 16
11:45:23.634831 IP 10.94.42.25.12345 > 10.0.0.2.12345: UDP, length 16
11:45:24.436514 IP 10.18.198.237.12345 > 10.0.0.2.12345: UDP, length 16
11:45:25.234341 IP 10.92.237.92.12345 > 10.0.0.2.12345: UDP, length 16
11:45:26.035222 IP 10.115.59.193.12345 > 10.0.0.2.12345: UDP, length 16
11:45:26.834851 IP 10.19.113.90.12345 > 10.0.0.2.12345: UDP, length 16
11:45:27.634477 IP 10.43.218.41.12345 > 10.0.0.2.12345: UDP, length 16
11:45:28.435913 IP 10.9.222.131.12345 > 10.0.0.2.12345: UDP, length 16
11:45:29.235298 IP 10.93.218.58.12345 > 10.0.0.2.12345: UDP, length 16
11:45:30.036492 IP 10.35.150.194.12345 > 10.0.0.2.12345: UDP, length 16
11:45:30.835524 IP 10.11.75.20.12345 > 10.0.0.2.12345: UDP, length 16
11:45:31.637603 IP 10.28.114.13.12345 > 10.0.0.2.12345: UDP, length 16
11:45:32.436987 IP 10.76.98.138.12345 > 10.0.0.2.12345: UDP, length 16
11:45:33.236310 IP 10.122.233.200.12345 > 10.0.0.2.12345: UDP, length 16
11:45:34.037828 IP 10.19.90.235.12345 > 10.0.0.2.12345: UDP, length 16
11:45:34.836763 IP 10.92.143.128.12345 > 10.0.0.2.12345: UDP, length 16
11:45:35.638459 IP 10.12.252.193.12345 > 10.0.0.2.12345: UDP, length 16
11:45:36.438247 IP 10.68.207.74.12345 > 10.0.0.2.12345: UDP, length 16
11:45:37.238591 IP 10.21.8.186.12345 > 10.0.0.2.12345: UDP, length 16
11:45:38.038645 IP 10.35.111.99.12345 > 10.0.0.2.12345: UDP, length 16
11:45:38.841438 IP 10.127.213.231.12345 > 10.0.0.2.12345: UDP, length 16
11:45:39.639969 IP 10.52.125.238.12345 > 10.0.0.2.12345: UDP, length 16
11:45:40.439452 IP 10.20.157.121.12345 > 10.0.0.2.12345: UDP, length 16
11:45:41.240617 IP 10.126.109.114.12345 > 10.0.0.2.12345: UDP, length 16
11:45:42.040363 IP 10.53.155.22.12345 > 10.0.0.2.12345: UDP, length 16
11:45:42.841311 IP 10.39.209.105.12345 > 10.0.0.2.12345: UDP, length 16
11:45:43.640694 IP 10.33.158.78.12345 > 10.0.0.2.12345: UDP, length 16
11:45:44.442491 IP 10.36.13.207.12345 > 10.0.0.2.12345: UDP, length 16
11:45:45.242935 IP 10.94.187.47.12345 > 10.0.0.2.12345: UDP, length 16
11:45:46.043082 IP 10.95.192.68.12345 > 10.0.0.2.12345: UDP, length 16
11:45:46.841881 IP 10.73.14.226.12345 > 10.0.0.2.12345: UDP, length 16
11:45:47.641581 IP 10.86.115.223.12345 > 10.0.0.2.12345: UDP, length 16
11:45:48.442810 IP 10.32.242.96.12345 > 10.0.0.2.12345: UDP, length 16
11:45:49.242110 IP 10.100.169.175.12345 > 10.0.0.2.12345: UDP, length 16
11:45:50.043589 IP 10.113.34.144.12345 > 10.0.0.2.12345: UDP, length 16
11:45:50.842537 IP 10.67.110.39.12345 > 10.0.0.2.12345: UDP, length 16
11:45:51.644508 IP 10.8.164.76.12345 > 10.0.0.2.12345: UDP, length 16
11:45:52.444188 IP 10.111.112.93.12345 > 10.0.0.2.12345: UDP, length 16
11:45:53.243423 IP 10.44.135.20.12345 > 10.0.0.2.12345: UDP, length 16
11:45:54.044382 IP 10.89.213.170.12345 > 10.0.0.2.12345: UDP, length 16
11:45:54.843769 IP 10.126.224.153.12345 > 10.0.0.2.12345: UDP, length 16
11:45:55.645519 IP 10.120.158.254.12345 > 10.0.0.2.12345: UDP, length 16
11:45:56.444650 IP 10.5.34.96.12345 > 10.0.0.2.12345: UDP, length 16
11:45:57.246003 IP 10.74.244.34.12345 > 10.0.0.2.12345: UDP, length 16
11:45:58.045945 IP 10.105.210.69.12345 > 10.0.0.2.12345: UDP, length 16
11:45:58.844747 IP 10.95.80.29.12345 > 10.0.0.2.12345: UDP, length 16
11:45:59.645887 IP 10.88.155.105.12345 > 10.0.0.2.12345: UDP, length 16
11:46:00.445479 IP 10.115.193.153.12345 > 10.0.0.2.12345: UDP, length 16
11:46:01.246493 IP 10.37.251.70.12345 > 10.0.0.2.12345: UDP, length 16
11:46:02.046638 IP 10.36.217.117.12345 > 10.0.0.2.12345: UDP, length 16
11:46:02.849252 IP 10.81.204.2.12345 > 10.0.0.2.12345: UDP, length 16
11:46:03.647363 IP 10.89.131.106.12345 > 10.0.0.2.12345: UDP, length 16
11:46:04.448020 IP 10.88.184.231.12345 > 10.0.0.2.12345: UDP, length 16
11:46:05.247379 IP 10.106.125.74.12345 > 10.0.0.2.12345: UDP, length 16
11:46:06.048982 IP 10.30.20.180.12345 > 10.0.0.2.12345: UDP, length 16
11:46:06.848811 IP 10.47.86.104.12345 > 10.0.0.2.12345: UDP, length 16
11:46:07.647780 IP 10.17.126.215.12345 > 10.0.0.2.12345: UDP, length 16
11:46:08.449637 IP 10.38.191.32.12345 > 10.0.0.2.12345: UDP, length 16
11:46:09.248578 IP 10.14.220.168.12345 > 10.0.0.2.12345: UDP, length 16
11:46:10.049394 IP 10.127.205.15.12345 > 10.0.0.2.12345: UDP, length 16
11:46:10.847585 IP 10.12.252.193.12345 > 10.0.0.2.12345: UDP, length 16
11:46:11.648977 IP 10.102.84.244.12345 > 10.0.0.2.12345: UDP, length 16
11:46:12.450603 IP 10.123.165.192.12345 > 10.0.0.2.12345: UDP, length 16
11:46:13.250047 IP 10.47.154.219.12345 > 10.0.0.2.12345: UDP, length 16
11:46:14.051858 IP 10.31.77.151.12345 > 10.0.0.2.12345: UDP, length 16
11:46:14.851154 IP 10.94.249.93.12345 > 10.0.0.2.12345: UDP, length 16
11:46:15.650454 IP 10.8.235.147.12345 > 10.0.0.2.12345: UDP, length 16
11:46:16.451216 IP 10.35.185.129.12345 > 10.0.0.2.12345: UDP, length 16
11:46:17.252355 IP 10.98.6.130.12345 > 10.0.0.2.12345: UDP, length 16
11:46:18.053355 IP 10.63.48.80.12345 > 10.0.0.2.12345: UDP, length 16
11:46:18.853107 IP 10.98.237.123.12345 > 10.0.0.2.12345: UDP, length 16
11:46:19.654105 IP 10.80.22.64.12345 > 10.0.0.2.12345: UDP, length 16
11:46:20.453542 IP 10.15.199.28.12345 > 10.0.0.2.12345: UDP, length 16
11:46:21.252649 IP 10.119.251.49.12345 > 10.0.0.2.12345: UDP, length 16

