10:35:01.812587 IP 10.0.0.1.12345 > 10.0.0.2.12345: UDP, length 16
10:35:02.812871 IP 10.0.0.1.12345 > 10.0.0.2.12345: UDP, length 16
10:35:03.813126 IP 10.0.0.1.12345 > 10.0.0.2.12345: UDP, length 16
10:35:04.813349 IP 10.0.0.1.12345 > 10.0.0.2.12345: UDP, length 16
10:35:05.813601 IP 10.0.0.1.12345 > 10.0.0.2.12345: UDP, length 16
10:35:06.813824 IP 10.0.0.1.12345 > 10.0.0.2.12345: UDP, length 16
10:35:07.814074 IP 10.0.0.1.12345 > 10.0.0.2.12345: UDP, length 16
10:35:08.814317 IP 10.0.0.1.12345 > 10.0.0.2.12345: UDP, length 16
10:35:09.814574 IP 10.0.0.1.12345 > 10.0.0.2.12345: UDP, length 16
10:35:10.814784 IP 10.0.0.1.12345 > 10.0.0.2.12345: UDP, length 16
10:35:11.815028 IP 10.0.0.1.12345 > 10.0.0.2.12345: UDP, length 16
10:35:12.815275 IP 10.0.0.1.12345 > 10.0.0.2.12345: UDP, length 16
10:35:13.815512 IP 10.0.0.1.12345 > 10.0.0.2.12345: UDP, length 16
10:35:14.815767 IP 10.0.0.1.12345 > 10.0.0.2.12345: UDP, length 16
10:35:15.816031 IP 10.0.0.1.12345 > 10.0.0.2.12345: UDP, length 16
10:35:16.816281 IP 10.0.0.1.12345 > 10.0.0.2.12345: UDP, length 16
10:35:17.816536 IP 10.0.0.1.12345 > 10.0.0.2.12345: UDP, length 16
10:35:18.816793 IP 10.0.0.1.12345 > 10.0.0.2.12345: UDP, length 16
10:35:19.817055 IP 10.0.0.1.12345 > 10.0.0.2.12345: UDP, length 16
10:35:20.817294 IP 10.0.0.1.12345 > 10.0.0.2.12345: UDP, length 16
10:35:21.817546 IP 10.0.0.1.12345 > 10.0.0.2.12345: UDP, length 16
10:35:22.817775 IP 10.0.0.1.12345 > 10.0.0.2.12345: UDP, length 16
10:35:23.818030 IP 10.0.0.1.12345 > 10.0.0.2.12345: UDP, length 16
10:35:24.818263 IP 10.0.0.1.12345 > 10.0.0.2.12345: UDP, length 16
10:35:25.818517 IP 10.0.0.1.12345 > 10.0.0.2.12345: UDP, length 16
10:35:26.818766 IP 10.0.0.1.12345 > 10.0.0.2.12345: UDP, length 16
10:35:27.819024 IP 10.0.0.1.12345 > 10.0.0.2.12345: UDP, length 16
10:35:28.819257 IP 10.0.0.1.12345 > 10.0.0.2.12345: UDP, length 16
10:35:29.819513 IP 10.0.0.1.12345 > 10.0.0.2.12345: UDP, length 16
10:35:30.819753 IP 10.0.0.1.12345 > 10.0.0.2.12345: UDP, length 16
10:35:31.820008 IP 10.0.0.1.12345 > 10.0.0.2.12345: UDP, length 16
10:35:32.820238 IP 10.0.0.1.12345 > 10.0.0.2.12345: UDP, length 16
10:35:33.820492 IP 10.0.0.1.12345 > 10.0.0.2.12345: UDP, length 16
10:35:34.820741 IP 10.0.0.1.12345 > 10.0.0.2.12345: UDP, length 16
10:35:35.820995 IP 10.0.0.1.12345 > 10.0.0.2.12345: UDP, length 16
10:35:36.821240 IP 10.0.0.1.12345 > 10.0.0.2.12345: UDP, length 16
10:35:37.821498 IP 10.0.0.1.12345 > 10.0.0.2.12345: UDP, length 16
10:35:38.821725 IP 10.0.0.1.12345 > 10.0.0.2.12345: UDP, length 16
10:35:39.821979 IP 10.0.0.1.12345 > 10.0.0.2.12345: UDP, length 16
10:35:40.822222 IP 10.0.0.1.12345 > 10.0.0.2.12345: UDP, length 16
10:35:41.822479 IP 10.0.0.1.12345 > 10.0.0.2.12345: UDP, length 16
10:35:42.822724 IP 10.0.0.1.12345 > 10.0.0.2.12345: UDP, length 16
10:35:43.822982 IP 10.0.0.1.12345 > 10.0.0.2.12345: UDP, length 16
10:35:44.823233 IP 10.0.0.1.12345 > 10.0.0.2.12345: UDP, length 16
10:35:45.823490 IP 10.0.0.1.12345 > 10.0.0.2.12345: UDP, length 16
10:35:46.823811 IP 10.0.0.1.12345 > 10.0.0.2.12345: UDP, length 16
10:35:47.824052 IP 10.0.0.1.12345 > 10.0.0.2.12345: UDP, length 16
10:35:48.824266 IP 10.0.0.1.12345 > 10.0.0.2.12345: UDP, length 16
10:35:49.824516 IP 10.0.0.1.12345 > 10.0.0.2.12345: UDP, length 16
10:35:50.824739 IP 10.0.0.1.12345 > 10.0.0.2.12345: UDP, length 16
10:35:51.824987 IP 10.0.0.1.12345 > 10.0.0.2.12345: UDP, length 16
10:35:52.825207 IP 10.0.0.1.12345 > 10.0.0.2.12345: UDP, length 16
10:35:53.825459 IP 10.0.0.1.12345 > 10.0.0.2.12345: UDP, length 16
10:35:54.825683 IP 10.0.0.1.12345 > 10.0.0.2.12345: UDP, length 16
10:35:55.825932 IP 10.0.0.1.12345 > 10.0.0.2.12345: UDP, length 16
10:35:56.826177 IP 10.0.0.1.12345 > 10.0.0.2.12345: UDP, length 16
10:35:57.826435 IP 10.0.0.1.12345 > 10.0.0.2.12345: UDP, length 16
10:35:58.826671 IP 10.0.0.1.12345 > 10.0.0.2.12345: UDP, length 16
10:35:59.826925 IP 10.0.0.1.12345 > 10.0.0.2.12345: UDP, length 16
10:36:00.827168 IP 10.0.0.1.12345 > 10.0.0.2.12345: UDP, length 16
10:36:01.827424 IP 10.0.0.1.12345 > 10.0.0.2.12345: UDP, length 16
10:36:02.827654 IP 10.0.0.1.12345 > 10.0.0.2.12345: UDP, length 16
10:36:03.827914 IP 10.0.0.1.12345 > 10.0.0.2.12345: UDP, length 16
10:36:04.828149 IP 10.0.0.1.12345 > 10.0.0.2.12345: UDP, length 16
10:36:05.828406 IP 10.0.0.1.12345 > 10.0.0.2.12345: UDP, length 16
10:36:06.828645 IP 10.0.0.1.12345 > 10.0.0.2.12345: UDP, length 16
10:36:07.828904 IP 10.0.0.1.12345 > 10.0.0.2.12345: UDP, length 16
10:36:08.829143 IP 10.0.0.1.12345 > 10.0.0.2.12345: UDP, length 16
10:36:09.829399 IP 10.0.0.1.12345 > 10.0.0.2.12345: UDP, length 16
10:36:10.829609 IP 10.0.0.1.12345 > 10.0.0.2.12345: UDP, length 16
10:36:11.829854 IP 10.0.0.1.12345 > 10.0.0.2.12345: UDP, length 16
10:36:12.830048 IP 10.0.0.1.12345 > 10.0.0.2.12345: UDP, length 16
10:36:13.830248 IP 10.0.0.1.12345 > 10.0.0.2.12345: UDP, length 16
10:36:14.830440 IP 10.0.0.1.12345 > 10.0.0.2.12345: UDP, length 16
10:36:15.830682 IP 10.0.0.1.12345 > 10.0.0.2.12345: UDP, length 16
10:36:16.830875 IP 10.0.0.1.12345 > 10.0.0.2.12345: UDP, length 16
10:36:17.831118 IP 10.0.0.1.12345 > 10.0.0.2.12345: UDP, length 16
10:36:18.831317 IP 10.0.0.1.12345 > 10.0.0.2.12345: UDP, length 16
10:36:19.831563 IP 10.0.0.1.12345 > 10.0.0.2.12345: UDP, length 16
10:36:20.831761 IP 10.0.0.1.12345 > 10.0.0.2.12345: UDP, length 16
10:36:21.832005 IP 10.0.0.1.12345 > 10.0.0.2.12345: UDP, length 16
10:36:22.832201 IP 10.0.0.1.12345 > 10.0.0.2.12345: UDP, length 16
10:36:23.832398 IP 10.0.0.1.12345 > 10.0.0.2.12345: UDP, length 16
10:36:24.832588 IP 10.0.0.1.12345 > 10.0.0.2.12345: UDP, length 16
10:36:25.832834 IP 10.0.0.1.12345 > 10.0.0.2.12345: UDP, length 16
10:36:26.833030 IP 10.0.0.1.12345 > 10.0.0.2.12345: UDP, length 16
10:36:27.833278 IP 10.0.0.1.12345 > 10.0.0.2.12345: UDP, length 16
10:36:28.833533 IP 10.0.0.1.12345 > 10.0.0.2.12345: UDP, length 16
10:36:29.833794 IP 10.0.0.1.12345 > 10.0.0.2.12345: UDP, length 16
10:36:30.834052 IP 10.0.0.1.12345 > 10.0.0.2.12345: UDP, length 16
10:36:31.834315 IP 10.0.0.1.12345 > 10.0.0.2.12345: UDP, length 16
10:36:32.834577 IP 10.0.0.1.12345 > 10.0.0.2.12345: UDP, length 16
10:36:33.834836 IP 10.0.0.1.12345 > 10.0.0.2.12345: UDP, length 16
10:36:34.835093 IP 10.0.0.1.12345 > 10.0.0.2.12345: UDP, length 16
10:36:35.835354 IP 10.0.0.1.12345 > 10.0.0.2.12345: UDP, length 16
10:36:36.835616 IP 10.0.0.1.12345 > 10.0.0.2.12345: UDP, length 16
10:36:37.835851 IP 10.0.0.1.12345 > 10.0.0.2.12345: UDP, length 16
10:36:38.836113 IP 10.0.0.1.12345 > 10.0.0.2.12345: UDP, length 16
10:36:39.836288 IP 10.0.0.1.12345 > 10.0.0.2.12345: UDP, length 16
10:36:40.836545 IP 10.0.0.1.12345 > 10.0.0.2.12345: UDP, length 16
10:36:41.836799 IP 10.0.0.1.12345 > 10.0.0.2.12345: UDP, length 16
10:36:42.837058 IP 10.0.0.1.12345 > 10.0.0.2.12345: UDP, length 16
10:36:43.837307 IP 10.0.0.1.12345 > 10.0.0.2.12345: UDP, length 16
10:36:44.837561 IP 10.0.0.1.12345 > 10.0.0.2.12345: UDP, length 16
10:36:45.837822 IP 10.0.0.1.12345 > 10.0.0.2.12345: UDP, length 16
10:36:46.838077 IP 10.0.0.1.12345 > 10.0.0.2.12345: UDP, length 16
10:36:47.838337 IP 10.0.0.1.12345 > 10.0.0.2.12345: UDP, length 16
10:36:48.838592 IP 10.0.0.1.12345 > 10.0.0.2.12345: UDP, length 16
10:36:49.838854 IP 10.0.0.1.12345 > 10.0.0.2.12345: UDP, length 16
10:36:50.839108 IP 10.0.0.1.12345 > 10.0.0.2.12345: UDP, length 16
10:36:51.839363 IP 10.0.0.1.12345 > 10.0.0.2.12345: UDP, length 16
10:36:52.839622 IP 10.0.0.1.12345 > 10.0.0.2.12345: UDP, length 16
10:36:53.839883 IP 10.0.0.1.12345 > 10.0.0.2.12345: UDP, length 16
10:36:54.840142 IP 10.0.0.1.12345 > 10.0.0.2.12345: UDP, length 16
10:36:55.840400 IP 10.0.0.1.12345 > 10.0.0.2.12345: UDP, length 16
10:36:56.840659 IP 10.0.0.1.12345 > 10.0.0.2.12345: UDP, length 16
10:36:57.840923 IP 10.0.0.1.12345 > 10.0.0.2.12345: UDP, length 16
10:36:58.841156 IP 10.0.0.1.12345 > 10.0.0.2.12345: UDP, length 16
10:36:59.841407 IP 10.0.0.1.12345 > 10.0.0.2.12345: UDP, length 16
10:37:00.841640 IP 10.0.0.1.12345 > 10.0.0.2.12345: UDP, length 16
10:37:01.841891 IP 10.0.0.1.12345 > 10.0.0.2.12345: UDP, length 16
10:37:02.842140 IP 10.0.0.1.12345 > 10.0.0.2.12345: UDP, length 16
10:37:03.842395 IP 10.0.0.1.12345 > 10.0.0.2.12345: UDP, length 16
10:37:04.842651 IP 10.0.0.1.12345 > 10.0.0.2.12345: UDP, length 16
10:37:05.842912 IP 10.0.0.1.12345 > 10.0.0.2.12345: UDP, length 16
10:37:06.843142 IP 10.0.0.1.12345 > 10.0.0.2.12345: UDP, length 16
10:37:07.843397 IP 10.0.0.1.12345 > 10.0.0.2.12345: UDP, length 16
10:37:08.843654 IP 10.0.0.1.12345 > 10.0.0.2.12345: UDP, length 16
10:37:09.843917 IP 10.0.0.1.12345 > 10.0.0.2.12345: UDP, length 16
10:37:10.844130 IP 10.0.0.1.12345 > 10.0.0.2.12345: UDP, length 16
10:37:11.844358 IP 10.0.0.1.12345 > 10.0.0.2.12345: UDP, length 16
10:37:12.844611 IP 10.0.0.1.12345 > 10.0.0.2.12345: UDP, length 16
10:37:13.844854 IP 10.0.0.1.12345 > 10.0.0.2.12345: UDP, length 16
10:37:14.845106 IP 10.0.0.1.12345 > 10.0.0.2.12345: UDP, length 16
10:37:15.845343 IP 10.0.0.1.12345 > 10.0.0.2.12345: UDP, length 16
10:37:16.845594 IP 10.0.0.1.12345 > 10.0.0.2.12345: UDP, length 16
10:37:17.845832 IP 10.0.0.1.12345 > 10.0.0.2.12345: UDP, length 16
10:37:18.846087 IP 10.0.0.1.12345 > 10.0.0.2.12345: UDP, length 16
10:37:19.846327 IP 10.0.0.1.12345 > 10.0.0.2.12345: UDP, length 16
10:37:20.846579 IP 10.0.0.1.12345 > 10.0.0.2.12345: UDP, length 16
10:37:21.846822 IP 10.0.0.1.12345 > 10.0.0.2.12345: UDP, length 16
10:37:22.847076 IP 10.0.0.1.12345 > 10.0.0.2.12345: UDP, length 16
10:37:23.847317 IP 10.0.0.1.12345 > 10.0.0.2.12345: UDP, length 16
10:37:24.847568 IP 10.0.0.1.12345 > 10.0.0.2.12345: UDP, length 16
10:37:25.847810 IP 10.0.0.1.12345 > 10.0.0.2.12345: UDP, length 16
10:37:26.848062 IP 10.0.0.1.12345 > 10.0.0.2.12345: UDP, length 16
10:37:27.848301 IP 10.0.0.1.12345 > 10.0.0.2.12345: UDP, length 16
10:37:28.848559 IP 10.0.0.1.12345 > 10.0.0.2.12345: UDP, length 16
10:37:29.848804 IP 10.0.0.1.12345 > 10.0.0.2.12345: UDP, length 16
10:37:30.849054 IP 10.0.0.1.12345 > 10.0.0.2.12345: UDP, length 16
10:37:31.849295 IP 10.0.0.1.12345 > 10.0.0.2.12345: UDP, length 16
10:37:32.849540 IP 10.0.0.1.12345 > 10.0.0.2.12345: UDP, length 16
10:37:33.849780 IP 10.0.0.1.12345 > 10.0.0.2.12345: UDP, length 16
10:37:34.850032 IP 10.0.0.1.12345 > 10.0.0.2.12345: UDP, length 16
10:37:35.850275 IP 10.0.0.1.12345 > 10.0.0.2.12345: UDP, length 16
10:37:36.850526 IP 10.0.0.1.12345 > 10.0.0.2.12345: UDP, length 16
10:37:37.850764 IP 10.0.0.1.12345 > 10.0.0.2.12345: UDP, length 16
10:37:38.851004 IP 10.0.0.1.12345 > 10.0.0.2.12345: UDP, length 16
10:37:39.851237 IP 10.0.0.1.12345 > 10.0.0.2.12345: UDP, length 16
10:37:40.851486 IP 10.0.0.1.12345 > 10.0.0.2.12345: UDP, length 16
10:37:41.851808 IP 10.0.0.1.12345 > 10.0.0.2.12345: UDP, length 16
10:37:42.852045 IP 10.0.0.1.12345 > 10.0.0.2.12345: UDP, length 16
10:37:43.852206 IP 10.0.0.1.12345 > 10.0.0.2.12345: UDP, length 16
10:37:44.852448 IP 10.0.0.1.12345 > 10.0.0.2.12345: UDP, length 16
10:37:45.852668 IP 10.0.0.1.12345 > 10.0.0.2.12345: UDP, length 16
10:37:46.852883 IP 10.0.0.1.12345 > 10.0.0.2.12345: UDP, length 16
10:37:47.853072 IP 10.0.0.1.12345 > 10.0.0.2.12345: UDP, length 16
10:37:48.853312 IP 10.0.0.1.12345 > 10.0.0.2.12345: UDP, length 16
10:37:49.853474 IP 10.0.0.1.12345 > 10.0.0.2.12345: UDP, length 16
10:37:50.853665 IP 10.0.0.1.12345 > 10.0.0.2.12345: UDP, length 16
10:37:51.853881 IP 10.0.0.1.12345 > 10.0.0.2.12345: UDP, length 16
10:37:52.854126 IP 10.0.0.1.12345 > 10.0.0.2.12345: UDP, length 16
10:37:53.854340 IP 10.0.0.1.12345 > 10.0.0.2.12345: UDP, length 16
10:37:54.854585 IP 10.0.0.1.12345 > 10.0.0.2.12345: UDP, length 16
10:37:55.854797 IP 10.0.0.1.12345 > 10.0.0.2.12345: UDP, length 16
10:37:56.855042 IP 10.0.0.1.12345 > 10.0.0.2.12345: UDP, length 16
10:37:57.855257 IP 10.0.0.1.12345 > 10.0.0.2.12345: UDP, length 16
10:37:58.855477 IP 10.0.0.1.12345 > 10.0.0.2.12345: UDP, length 16
10:37:59.855759 IP 10.0.0.1.12345 > 10.0.0.2.12345: UDP, length 16
10:38:00.855999 IP 10.0.0.1.12345 > 10.0.0.2.12345: UDP, length 16
10:38:01.856212 IP 10.0.0.1.12345 > 10.0.0.2.12345: UDP, length 16
10:38:02.856426 IP 10.0.0.1.12345 > 10.0.0.2.12345: UDP, length 16
10:38:03.856639 IP 10.0.0.1.12345 > 10.0.0.2.12345: UDP, length 16
10:38:04.856848 IP 10.0.0.1.12345 > 10.0.0.2.12345: UDP, length 16
10:38:05.857081 IP 10.0.0.1.12345 > 10.0.0.2.12345: UDP, length 16
10:38:06.857316 IP 10.0.0.1.12345 > 10.0.0.2.12345: UDP, length 16
10:38:07.857561 IP 10.0.0.1.12345 > 10.0.0.2.12345: UDP, length 16
10:38:08.857818 IP 10.0.0.1.12345 > 10.0.0.2.12345: UDP, length 16
10:38:09.858054 IP 10.0.0.1.12345 > 10.0.0.2.12345: UDP, length 16
10:38:10.858263 IP 10.0.0.1.12345 > 10.0.0.2.12345: UDP, length 16
10:38:11.858502 IP 10.0.0.1.12345 > 10.0.0.2.12345: UDP, length 16
10:38:12.858761 IP 10.0.0.1.12345 > 10.0.0.2.12345: UDP, length 16
10:38:13.859007 IP 10.0.0.1.12345 > 10.0.0.2.12345: UDP, length 16
10:38:14.859264 IP 10.0.0.1.12345 > 10.0.0.2.12345: UDP, length 16
10:38:15.859500 IP 10.0.0.1.12345 > 10.0.0.2.12345: UDP, length 16
10:38:16.859855 IP 10.0.0.1.12345 > 10.0.0.2.12345: UDP, length 16
10:38:17.860069 IP 10.0.0.1.12345 > 10.0.0.2.12345: UDP, length 16
10:38:18.860318 IP 10.0.0.1.12345 > 10.0.0.2.12345: UDP, length 16
10:38:19.860533 IP 10.0.0.1.12345 > 10.0.0.2.12345: UDP, length 16
10:38:20.860781 IP 10.0.0.1.12345 > 10.0.0.2.12345: UDP, length 16
10:38:21.860996 IP 10.0.0.1.12345 > 10.0.0.2.12345: UDP, length 16
10:38:22.861246 IP 10.0.0.1.12345 > 10.0.0.2.12345: UDP, length 16
10:38:23.861459 IP 10.0.0.1.12345 > 10.0.0.2.12345: UDP, length 16
10:38:24.861705 IP 10.0.0.1.12345 > 10.0.0.2.12345: UDP, length 16
10:38:25.861933 IP 10.0.0.1.12345 > 10.0.0.2.12345: UDP, length 16
10:38:26.862185 IP 10.0.0.1.12345 > 10.0.0.2.12345: UDP, length 16
10:38:27.862392 IP 10.0.0.1.12345 > 10.0.0.2.12345: UDP, length 16
10:38:28.862635 IP 10.0.0.1.12345 > 10.0.0.2.12345: UDP, length 16
10:38:29.862832 IP 10.0.0.1.12345 > 10.0.0.2.12345: UDP, length 16
10:38:30.863079 IP 10.0.0.1.12345 > 10.0.0.2.12345: UDP, length 16
10:38:31.863277 IP 10.0.0.1.12345 > 10.0.0.2.12345: UDP, length 16
10:38:32.863501 IP 10.0.0.1.12345 > 10.0.0.2.12345: UDP, length 16
10:38:33.863624 IP 10.0.0.1.12345 > 10.0.0.2.12345: UDP, length 16
10:38:34.863867 IP 10.0.0.1.12345 > 10.0.0.2.12345: UDP, length 16
10:38:35.864066 IP 10.0.0.1.12345 > 10.0.0.2.12345: UDP, length 16
10:38:36.864310 IP 10.0.0.1.12345 > 10.0.0.2.12345: UDP, length 16
10:38:37.864573 IP 10.0.0.1.12345 > 10.0.0.2.12345: UDP, length 16
10:38:38.864835 IP 10.0.0.1.12345 > 10.0.0.2.12345: UDP, length 16
10:38:39.865099 IP 10.0.0.1.12345 > 10.0.0.2.12345: UDP, length 16
10:38:40.865362 IP 10.0.0.1.12345 > 10.0.0.2.12345: UDP, length 16
10:38:41.865627 IP 10.0.0.1.12345 > 10.0.0.2.12345: UDP, length 16
10:38:42.865868 IP 10.0.0.1.12345 > 10.0.0.2.12345: UDP, length 16
10:38:43.866076 IP 10.0.0.1.12345 > 10.0.0.2.12345: UDP, length 16
10:38:44.866332 IP 10.0.0.1.12345 > 10.0.0.2.12345: UDP, length 16
10:38:45.866589 IP 10.0.0.1.12345 > 10.0.0.2.12345: UDP, length 16
10:38:46.866855 IP 10.0.0.1.12345 > 10.0.0.2.12345: UDP, length 16
10:38:47.867084 IP 10.0.0.1.12345 > 10.0.0.2.12345: UDP, length 16
10:38:48.867332 IP 10.0.0.1.12345 > 10.0.0.2.12345: UDP, length 16
10:38:49.867589 IP 10.0.0.1.12345 > 10.0.0.2.12345: UDP, length 16
10:38:50.867851 IP 10.0.0.1.12345 > 10.0.0.2.12345: UDP, length 16
10:38:51.868091 IP 10.0.0.1.12345 > 10.0.0.2.12345: UDP, length 16
10:38:52.868348 IP 10.0.0.1.12345 > 10.0.0.2.12345: UDP, length 16
10:38:53.868562 IP 10.0.0.1.12345 > 10.0.0.2.12345: UDP, length 16
10:38:54.868821 IP 10.0.0.1.12345 > 10.0.0.2.12345: UDP, length 16
10:38:55.869086 IP 10.0.0.1.12345 > 10.0.0.2.12345: UDP, length 16
10:38:56.869348 IP 10.0.0.1.12345 > 10.0.0.2.12345: UDP, length 16
10:38:57.869580 IP 10.0.0.1.12345 > 10.0.0.2.12345: UDP, length 16
10:38:58.869805 IP 10.0.0.1.12345 > 10.0.0.2.12345: UDP, length 16
10:38:59.870056 IP 10.0.0.1.12345 > 10.0.0.2.12345: UDP, length 16
10:39:00.870299 IP 10.0.0.1.12345 > 10.0.0.2.12345: UDP, length 16
10:39:01.870551 IP 10.0.0.1.12345 > 10.0.0.2.12345: UDP, length 16
10:39:02.870788 IP 10.0.0.1.12345 > 10.0.0.2.12345: UDP, length 16
10:39:03.871041 IP 10.0.0.1.12345 > 10.0.0.2.12345: UDP, length 16
10:39:04.871283 IP 10.0.0.1.12345 > 10.0.0.2.12345: UDP, length 16
10:39:05.871533 IP 10.0.0.1.12345 > 10.0.0.2.12345: UDP, length 16
10:39:06.871764 IP 10.0.0.1.12345 > 10.0.0.2.12345: UDP, length 16
10:39:07.872019 IP 10.0.0.1.12345 > 10.0.0.2.12345: UDP, length 16
10:39:08.872245 IP 10.0.0.1.12345 > 10.0.0.2.12345: UDP, length 16
10:39:09.872498 IP 10.0.0.1.12345 > 10.0.0.2.12345: UDP, length 16
10:39:10.872699 IP 10.0.0.1.12345 > 10.0.0.2.12345: UDP, length 16
10:39:11.872941 IP 10.0.0.1.12345 > 10.0.0.2.12345: UDP, length 16
10:39:12.873156 IP 10.0.0.1.12345 > 10.0.0.2.12345: UDP, length 16
10:39:13.873406 IP 10.0.0.1.12345 > 10.0.0.2.12345: UDP, length 16
10:39:14.873663 IP 10.0.0.1.12345 > 10.0.0.2.12345: UDP, length 16
10:39:15.873920 IP 10.0.0.1.12345 > 10.0.0.2.12345: UDP, length 16
10:39:16.874155 IP 10.0.0.1.12345 > 10.0.0.2.12345: UDP, length 16
10:39:17.874375 IP 10.0.0.1.12345 > 10.0.0.2.12345: UDP, length 16
10:39:18.874619 IP 10.0.0.1.12345 > 10.0.0.2.12345: UDP, length 16
10:39:19.874873 IP 10.0.0.1.12345 > 10.0.0.2.12345: UDP, length 16
10:39:20.875112 IP 10.0.0.1.12345 > 10.0.0.2.12345: UDP, length 16
10:39:21.875364 IP 10.0.0.1.12345 > 10.0.0.2.12345: UDP, length 16
10:39:22.875613 IP 10.0.0.1.12345 > 10.0.0.2.12345: UDP, length 16
10:39:23.875873 IP 10.0.0.1.12345 > 10.0.0.2.12345: UDP, length 16
10:39:24.876091 IP 10.0.0.1.12345 > 10.0.0.2.12345: UDP, length 16
10:39:25.876335 IP 10.0.0.1.12345 > 10.0.0.2.12345: UDP, length 16
10:39:26.876578 IP 10.0.0.1.12345 > 10.0.0.2.12345: UDP, length 16
10:39:27.876834 IP 10.0.0.1.12345 > 10.0.0.2.12345: UDP, length 16
10:39:28.877059 IP 10.0.0.1.12345 > 10.0.0.2.12345: UDP, length 16
10:39:29.877269 IP 10.0.0.1.12345 > 10.0.0.2.12345: UDP, length 16
10:39:30.877524 IP 10.0.0.1.12345 > 10.0.0.2.12345: UDP, length 16
10:39:31.877780 IP 10.0.0.1.12345 > 10.0.0.2.12345: UDP, length 16
10:39:32.877993 IP 10.0.0.1.12345 > 10.0.0.2.12345: UDP, length 16
10:39:33.878240 IP 10.0.0.1.12345 > 10.0.0.2.12345: UDP, length 16
10:39:34.878453 IP 10.0.0.1.12345 > 10.0.0.2.12345: UDP, length 16
10:39:35.878701 IP 10.0.0.1.12345 > 10.0.0.2.12345: UDP, length 16
10:39:36.878919 IP 10.0.0.1.12345 > 10.0.0.2.12345: UDP, length 16
10:39:37.879167 IP 10.0.0.1.12345 > 10.0.0.2.12345: UDP, length 16
10:39:38.879415 IP 10.0.0.1.12345 > 10.0.0.2.12345: UDP, length 16
10:39:39.879684 IP 10.0.0.1.12345 > 10.0.0.2.12345: UDP, length 16
10:39:40.879927 IP 10.0.0.1.12345 > 10.0.0.2.12345: UDP, length 16
10:39:41.880182 IP 10.0.0.1.12345 > 10.0.0.2.12345: UDP, length 16
10:39:42.880411 IP 10.0.0.1.12345 > 10.0.0.2.12345: UDP, length 16
10:39:43.880641 IP 10.0.0.1.12345 > 10.0.0.2.12345: UDP, length 16
10:39:44.880796 IP 10.0.0.1.12345 > 10.0.0.2.12345: UDP, length 16
10:39:45.881044 IP 10.0.0.1.12345 > 10.0.0.2.12345: UDP, length 16
10:39:46.881276 IP 10.0.0.1.12345 > 10.0.0.2.12345: UDP, length 16
10:39:47.881500 IP 10.0.0.1.12345 > 10.0.0.2.12345: UDP, length 16
10:39:48.881753 IP 10.0.0.1.12345 > 10.0.0.2.12345: UDP, length 16
10:39:49.882016 IP 10.0.0.1.12345 > 10.0.0.2.12345: UDP, length 16
10:39:50.882250 IP 10.0.0.1.12345 > 10.0.0.2.12345: UDP, length 16
10:39:51.882500 IP 10.0.0.1.12345 > 10.0.0.2.12345: UDP, length 16
10:39:52.882711 IP 10.0.0.1.12345 > 10.0.0.2.12345: UDP, length 16
10:39:53.882958 IP 10.0.0.1.12345 > 10.0.0.2.12345: UDP, length 16
10:39:54.883168 IP 10.0.0.1.12345 > 10.0.0.2.12345: UDP, length 16
10:39:55.883415 IP 10.0.0.1.12345 > 10.0.0.2.12345: UDP, length 16
10:39:56.883632 IP 10.0.0.1.12345 > 10.0.0.2.12345: UDP, length 16
10:39:57.883881 IP 10.0.0.1.12345 > 10.0.0.2.12345: UDP, length 16
10:39:58.884104 IP 10.0.0.1.12345 > 10.0.0.2.12345: UDP, length 16
10:39:59.884325 IP 10.0.0.1.12345 > 10.0.0.2.12345: UDP, length 16
10:40:00.884526 IP 10.0.0.1.12345 > 10.0.0.2.12345: UDP, length 16

