10:35:01.813367 IP 10.0.0.1.12345 > 10.0.0.2.12345: UDP, length 16
10:35:02.812892 IP 10.0.0.1.12345 > 10.0.0.2.12345: UDP, length 16
10:35:03.813153 IP 10.0.0.1.12345 > 10.0.0.2.12345: UDP, length 16
10:35:04.813366 IP 10.0.0.1.12345 > 10.0.0.2.12345: UDP, length 16
10:35:05.813627 IP 10.0.0.1.12345 > 10.0.0.2.12345: UDP, length 16
10:35:06.813841 IP 10.0.0.1.12345 > 10.0.0.2.12345: UDP, length 16
10:35:07.814101 IP 10.0.0.1.12345 > 10.0.0.2.12345: UDP, length 16
10:35:08.814339 IP 10.0.0.1.12345 > 10.0.0.2.12345: UDP, length 16
10:35:09.814601 IP 10.0.0.1.12345 > 10.0.0.2.12345: UDP, length 16
10:35:10.814799 IP 10.0.0.1.12345 > 10.0.0.2.12345: UDP, length 16
10:35:11.815053 IP 10.0.0.1.12345 > 10.0.0.2.12345: UDP, length 16
10:35:12.815299 IP 10.0.0.1.12345 > 10.0.0.2.12345: UDP, length 16
10:35:13.815534 IP 10.0.0.1.12345 > 10.0.0.2.12345: UDP, length 16
10:35:14.815794 IP 10.0.0.1.12345 > 10.0.0.2.12345: UDP, length 16
10:35:15.816058 IP 10.0.0.1.12345 > 10.0.0.2.12345: UDP, length 16
10:35:16.816305 IP 10.0.0.1.12345 > 10.0.0.2.12345: UDP, length 16
10:35:17.816562 IP 10.0.0.1.12345 > 10.0.0.2.12345: UDP, length 16
10:35:18.816821 IP 10.0.0.1.12345 > 10.0.0.2.12345: UDP, length 16
10:35:19.817084 IP 10.0.0.1.12345 > 10.0.0.2.12345: UDP, length 16
10:35:20.817317 IP 10.0.0.1.12345 > 10.0.0.2.12345: UDP, length 16
10:35:21.817574 IP 10.0.0.1.12345 > 10.0.0.2.12345: UDP, length 16
10:35:22.817798 IP 10.0.0.1.12345 > 10.0.0.2.12345: UDP, length 16
10:35:23.818055 IP 10.0.0.1.12345 > 10.0.0.2.12345: UDP, length 16
10:35:24.818284 IP 10.0.0.1.12345 > 10.0.0.2.12345: UDP, length 16
10:35:25.818545 IP 10.0.0.1.12345 > 10.0.0.2.12345: UDP, length 16
10:35:26.818788 IP 10.0.0.1.12345 > 10.0.0.2.12345: UDP, length 16
10:35:27.819050 IP 10.0.0.1.12345 > 10.0.0.2.12345: UDP, length 16
10:35:28.819277 IP 10.0.0.1.12345 > 10.0.0.2.12345: UDP, length 16
10:35:29.819539 IP 10.0.0.1.12345 > 10.0.0.2.12345: UDP, length 16
10:35:30.819773 IP 10.0.0.1.12345 > 10.0.0.2.12345: UDP, length 16
10:35:31.820034 IP 10.0.0.1.12345 > 10.0.0.2.12345: UDP, length 16
10:35:32.820257 IP 10.0.0.1.12345 > 10.0.0.2.12345: UDP, length 16
10:35:33.820518 IP 10.0.0.1.12345 > 10.0.0.2.12345: UDP, length 16
10:35:34.820762 IP 10.0.0.1.12345 > 10.0.0.2.12345: UDP, length 16
10:35:35.821018 IP 10.0.0.1.12345 > 10.0.0.2.12345: UDP, length 16
10:35:36.821261 IP 10.0.0.1.12345 > 10.0.0.2.12345: UDP, length 16
10:35:37.821524 IP 10.0.0.1.12345 > 10.0.0.2.12345: UDP, length 16
10:35:38.821743 IP 10.0.0.1.12345 > 10.0.0.2.12345: UDP, length 16
10:35:39.822005 IP 10.0.0.1.12345 > 10.0.0.2.12345: UDP, length 16
10:35:40.822243 IP 10.0.0.1.12345 > 10.0.0.2.12345: UDP, length 16
10:35:41.822504 IP 10.0.0.1.12345 > 10.0.0.2.12345: UDP, length 16
10:35:42.822745 IP 10.0.0.1.12345 > 10.0.0.2.12345: UDP, length 16
10:35:43.823008 IP 10.0.0.1.12345 > 10.0.0.2.12345: UDP, length 16
10:35:44.823254 IP 10.0.0.1.12345 > 10.0.0.2.12345: UDP, length 16
10:35:45.823517 IP 10.0.0.1.12345 > 10.0.0.2.12345: UDP, length 16
10:35:46.823830 IP 10.0.0.1.12345 > 10.0.0.2.12345: UDP, length 16
10:35:47.824074 IP 10.0.0.1.12345 > 10.0.0.2.12345: UDP, length 16
10:35:48.824282 IP 10.0.0.1.12345 > 10.0.0.2.12345: UDP, length 16
10:35:49.824543 IP 10.0.0.1.12345 > 10.0.0.2.12345: UDP, length 16
10:35:50.824755 IP 10.0.0.1.12345 > 10.0.0.2.12345: UDP, length 16
10:35:51.825013 IP 10.0.0.1.12345 > 10.0.0.2.12345: UDP, length 16
10:35:52.825223 IP 10.0.0.1.12345 > 10.0.0.2.12345: UDP, length 16
10:35:53.825485 IP 10.0.0.1.12345 > 10.0.0.2.12345: UDP, length 16
10:35:54.825701 IP 10.0.0.1.12345 > 10.0.0.2.12345: UDP, length 16
10:35:55.825955 IP 10.0.0.1.12345 > 10.0.0.2.12345: UDP, length 16
10:35:56.826199 IP 10.0.0.1.12345 > 10.0.0.2.12345: UDP, length 16
10:35:57.826461 IP 10.0.0.1.12345 > 10.0.0.2.12345: UDP, length 16
10:35:58.826690 IP 10.0.0.1.12345 > 10.0.0.2.12345: UDP, length 16
10:35:59.826953 IP 10.0.0.1.12345 > 10.0.0.2.12345: UDP, length 16
10:36:00.827189 IP 10.0.0.1.12345 > 10.0.0.2.12345: UDP, length 16
10:36:01.827450 IP 10.0.0.1.12345 > 10.0.0.2.12345: UDP, length 16
10:36:02.827681 IP 10.0.0.1.12345 > 10.0.0.2.12345: UDP, length 16
10:36:03.827936 IP 10.0.0.1.12345 > 10.0.0.2.12345: UDP, length 16
10:36:04.828169 IP 10.0.0.1.12345 > 10.0.0.2.12345: UDP, length 16
10:36:05.828432 IP 10.0.0.1.12345 > 10.0.0.2.12345: UDP, length 16
10:36:06.828667 IP 10.0.0.1.12345 > 10.0.0.2.12345: UDP, length 16
10:36:07.828932 IP 10.0.0.1.12345 > 10.0.0.2.12345: UDP, length 16
10:36:08.829164 IP 10.0.0.1.12345 > 10.0.0.2.12345: UDP, length 16
10:36:09.829427 IP 10.0.0.1.12345 > 10.0.0.2.12345: UDP, length 16
10:36:10.829626 IP 10.0.0.1.12345 > 10.0.0.2.12345: UDP, length 16
10:36:11.829880 IP 10.0.0.1.12345 > 10.0.0.2.12345: UDP, length 16
10:36:12.830062 IP 10.0.0.1.12345 > 10.0.0.2.12345: UDP, length 16
10:36:13.830274 IP 10.0.0.1.12345 > 10.0.0.2.12345: UDP, length 16
10:36:14.830453 IP 10.0.0.1.12345 > 10.0.0.2.12345: UDP, length 16
10:36:15.830709 IP 10.0.0.1.12345 > 10.0.0.2.12345: UDP, length 16
10:36:16.830889 IP 10.0.0.1.12345 > 10.0.0.2.12345: UDP, length 16
10:36:17.831143 IP 10.0.0.1.12345 > 10.0.0.2.12345: UDP, length 16
10:36:18.831331 IP 10.0.0.1.12345 > 10.0.0.2.12345: UDP, length 16
10:36:19.831591 IP 10.0.0.1.12345 > 10.0.0.2.12345: UDP, length 16
10:36:20.831775 IP 10.0.0.1.12345 > 10.0.0.2.12345: UDP, length 16
10:36:21.832034 IP 10.0.0.1.12345 > 10.0.0.2.12345: UDP, length 16
10:36:22.832214 IP 10.0.0.1.12345 > 10.0.0.2.12345: UDP, length 16
10:36:23.832421 IP 10.0.0.1.12345 > 10.0.0.2.12345: UDP, length 16
10:36:24.832601 IP 10.0.0.1.12345 > 10.0.0.2.12345: UDP, length 16
10:36:25.832861 IP 10.0.0.1.12345 > 10.0.0.2.12345: UDP, length 16
10:36:26.833044 IP 10.0.0.1.12345 > 10.0.0.2.12345: UDP, length 16
10:36:27.833305 IP 10.0.0.1.12345 > 10.0.0.2.12345: UDP, length 16
10:36:28.833560 IP 10.0.0.1.12345 > 10.0.0.2.12345: UDP, length 16
10:36:29.833817 IP 10.0.0.1.12345 > 10.0.0.2.12345: UDP, length 16
10:36:30.834077 IP 10.0.0.1.12345 > 10.0.0.2.12345: UDP, length 16
10:36:31.834341 IP 10.0.0.1.12345 > 10.0.0.2.12345: UDP, length 16
10:36:32.834600 IP 10.0.0.1.12345 > 10.0.0.2.12345: UDP, length 16
10:36:33.834862 IP 10.0.0.1.12345 > 10.0.0.2.12345: UDP, length 16
10:36:34.835119 IP 10.0.0.1.12345 > 10.0.0.2.12345: UDP, length 16
10:36:35.835380 IP 10.0.0.1.12345 > 10.0.0.2.12345: UDP, length 16
10:36:36.835643 IP 10.0.0.1.12345 > 10.0.0.2.12345: UDP, length 16
10:36:37.835875 IP 10.0.0.1.12345 > 10.0.0.2.12345: UDP, length 16
10:36:38.836140 IP 10.0.0.1.12345 > 10.0.0.2.12345: UDP, length 16
10:36:39.836310 IP 10.0.0.1.12345 > 10.0.0.2.12345: UDP, length 16
10:36:40.836571 IP 10.0.0.1.12345 > 10.0.0.2.12345: UDP, length 16
10:36:41.836822 IP 10.0.0.1.12345 > 10.0.0.2.12345: UDP, length 16
10:36:42.837084 IP 10.0.0.1.12345 > 10.0.0.2.12345: UDP, length 16
10:36:43.837329 IP 10.0.0.1.12345 > 10.0.0.2.12345: UDP, length 16
10:36:44.837584 IP 10.0.0.1.12345 > 10.0.0.2.12345: UDP, length 16
10:36:45.837845 IP 10.0.0.1.12345 > 10.0.0.2.12345: UDP, length 16
10:36:46.838103 IP 10.0.0.1.12345 > 10.0.0.2.12345: UDP, length 16
10:36:47.838360 IP 10.0.0.1.12345 > 10.0.0.2.12345: UDP, length 16
10:36:48.838617 IP 10.0.0.1.12345 > 10.0.0.2.12345: UDP, length 16
10:36:49.838877 IP 10.0.0.1.12345 > 10.0.0.2.12345: UDP, length 16
10:36:50.839131 IP 10.0.0.1.12345 > 10.0.0.2.12345: UDP, length 16
10:36:51.839386 IP 10.0.0.1.12345 > 10.0.0.2.12345: UDP, length 16
10:36:52.839648 IP 10.0.0.1.12345 > 10.0.0.2.12345: UDP, length 16
10:36:53.839906 IP 10.0.0.1.12345 > 10.0.0.2.12345: UDP, length 16
10:36:54.840168 IP 10.0.0.1.12345 > 10.0.0.2.12345: UDP, length 16
10:36:55.840423 IP 10.0.0.1.12345 > 10.0.0.2.12345: UDP, length 16
10:36:56.840685 IP 10.0.0.1.12345 > 10.0.0.2.12345: UDP, length 16
10:36:57.840950 IP 10.0.0.1.12345 > 10.0.0.2.12345: UDP, length 16
10:36:58.841176 IP 10.0.0.1.12345 > 10.0.0.2.12345: UDP, length 16
10:36:59.841433 IP 10.0.0.1.12345 > 10.0.0.2.12345: UDP, length 16
10:37:00.841658 IP 10.0.0.1.12345 > 10.0.0.2.12345: UDP, length 16
10:37:01.841917 IP 10.0.0.1.12345 > 10.0.0.2.12345: UDP, length 16
10:37:02.842163 IP 10.0.0.1.12345 > 10.0.0.2.12345: UDP, length 16
10:37:03.842418 IP 10.0.0.1.12345 > 10.0.0.2.12345: UDP, length 16
10:37:04.842677 IP 10.0.0.1.12345 > 10.0.0.2.12345: UDP, length 16
10:37:05.842935 IP 10.0.0.1.12345 > 10.0.0.2.12345: UDP, length 16
10:37:06.843161 IP 10.0.0.1.12345 > 10.0.0.2.12345: UDP, length 16
10:37:07.843420 IP 10.0.0.1.12345 > 10.0.0.2.12345: UDP, length 16
10:37:08.843689 IP 10.0.0.1.12345 > 10.0.0.2.12345: UDP, length 16
10:37:09.843939 IP 10.0.0.1.12345 > 10.0.0.2.12345: UDP, length 16
10:37:10.844146 IP 10.0.0.1.12345 > 10.0.0.2.12345: UDP, length 16
10:37:11.844378 IP 10.0.0.1.12345 > 10.0.0.2.12345: UDP, length 16
10:37:12.844637 IP 10.0.0.1.12345 > 10.0.0.2.12345: UDP, length 16
10:37:13.844873 IP 10.0.0.1.12345 > 10.0.0.2.12345: UDP, length 16
10:37:14.845129 IP 10.0.0.1.12345 > 10.0.0.2.12345: UDP, length 16
10:37:15.845363 IP 10.0.0.1.12345 > 10.0.0.2.12345: UDP, length 16
10:37:16.845616 IP 10.0.0.1.12345 > 10.0.0.2.12345: UDP, length 16
10:37:17.845852 IP 10.0.0.1.12345 > 10.0.0.2.12345: UDP, length 16
10:37:18.846114 IP 10.0.0.1.12345 > 10.0.0.2.12345: UDP, length 16
10:37:19.846348 IP 10.0.0.1.12345 > 10.0.0.2.12345: UDP, length 16
10:37:20.846605 IP 10.0.0.1.12345 > 10.0.0.2.12345: UDP, length 16
10:37:21.846842 IP 10.0.0.1.12345 > 10.0.0.2.12345: UDP, length 16
10:37:22.847102 IP 10.0.0.1.12345 > 10.0.0.2.12345: UDP, length 16
10:37:23.847337 IP 10.0.0.1.12345 > 10.0.0.2.12345: UDP, length 16
10:37:24.847594 IP 10.0.0.1.12345 > 10.0.0.2.12345: UDP, length 16
10:37:25.847830 IP 10.0.0.1.12345 > 10.0.0.2.12345: UDP, length 16
10:37:26.848085 IP 10.0.0.1.12345 > 10.0.0.2.12345: UDP, length 16
10:37:27.848322 IP 10.0.0.1.12345 > 10.0.0.2.12345: UDP, length 16
10:37:28.848586 IP 10.0.0.1.12345 > 10.0.0.2.12345: UDP, length 16
10:37:29.848825 IP 10.0.0.1.12345 > 10.0.0.2.12345: UDP, length 16
10:37:30.849077 IP 10.0.0.1.12345 > 10.0.0.2.12345: UDP, length 16
10:37:31.849316 IP 10.0.0.1.12345 > 10.0.0.2.12345: UDP, length 16
10:37:32.849561 IP 10.0.0.1.12345 > 10.0.0.2.12345: UDP, length 16
10:37:33.849802 IP 10.0.0.1.12345 > 10.0.0.2.12345: UDP, length 16
10:37:34.850057 IP 10.0.0.1.12345 > 10.0.0.2.12345: UDP, length 16
10:37:35.850297 IP 10.0.0.1.12345 > 10.0.0.2.12345: UDP, length 16
10:37:36.850552 IP 10.0.0.1.12345 > 10.0.0.2.12345: UDP, length 16
10:37:37.850785 IP 10.0.0.1.12345 > 10.0.0.2.12345: UDP, length 16
10:37:38.851025 IP 10.0.0.1.12345 > 10.0.0.2.12345: UDP, length 16
10:37:39.851257 IP 10.0.0.1.12345 > 10.0.0.2.12345: UDP, length 16
10:37:40.851512 IP 10.0.0.1.12345 > 10.0.0.2.12345: UDP, length 16
10:37:41.851832 IP 10.0.0.1.12345 > 10.0.0.2.12345: UDP, length 16
10:37:42.852071 IP 10.0.0.1.12345 > 10.0.0.2.12345: UDP, length 16
10:37:43.852220 IP 10.0.0.1.12345 > 10.0.0.2.12345: UDP, length 16
10:37:44.852473 IP 10.0.0.1.12345 > 10.0.0.2.12345: UDP, length 16
10:37:45.852685 IP 10.0.0.1.12345 > 10.0.0.2.12345: UDP, length 16
10:37:46.852901 IP 10.0.0.1.12345 > 10.0.0.2.12345: UDP, length 16
10:37:47.853089 IP 10.0.0.1.12345 > 10.0.0.2.12345: UDP, length 16
10:37:48.853334 IP 10.0.0.1.12345 > 10.0.0.2.12345: UDP, length 16
10:37:49.853490 IP 10.0.0.1.12345 > 10.0.0.2.12345: UDP, length 16
10:37:50.853687 IP 10.0.0.1.12345 > 10.0.0.2.12345: UDP, length 16
10:37:51.853897 IP 10.0.0.1.12345 > 10.0.0.2.12345: UDP, length 16
10:37:52.854148 IP 10.0.0.1.12345 > 10.0.0.2.12345: UDP, length 16
10:37:53.854355 IP 10.0.0.1.12345 > 10.0.0.2.12345: UDP, length 16
10:37:54.854610 IP 10.0.0.1.12345 > 10.0.0.2.12345: UDP, length 16
10:37:55.854812 IP 10.0.0.1.12345 > 10.0.0.2.12345: UDP, length 16
10:37:56.855064 IP 10.0.0.1.12345 > 10.0.0.2.12345: UDP, length 16
10:37:57.855273 IP 10.0.0.1.12345 > 10.0.0.2.12345: UDP, length 16
10:37:58.855495 IP 10.0.0.1.12345 > 10.0.0.2.12345: UDP, length 16
10:37:59.855776 IP 10.0.0.1.12345 > 10.0.0.2.12345: UDP, length 16
10:38:00.856020 IP 10.0.0.1.12345 > 10.0.0.2.12345: UDP, length 16
10:38:01.856229 IP 10.0.0.1.12345 > 10.0.0.2.12345: UDP, length 16
10:38:02.856445 IP 10.0.0.1.12345 > 10.0.0.2.12345: UDP, length 16
10:38:03.856655 IP 10.0.0.1.12345 > 10.0.0.2.12345: UDP, length 16
10:38:04.856866 IP 10.0.0.1.12345 > 10.0.0.2.12345: UDP, length 16
10:38:05.857102 IP 10.0.0.1.12345 > 10.0.0.2.12345: UDP, length 16
10:38:06.857338 IP 10.0.0.1.12345 > 10.0.0.2.12345: UDP, length 16
10:38:07.857584 IP 10.0.0.1.12345 > 10.0.0.2.12345: UDP, length 16
10:38:08.857842 IP 10.0.0.1.12345 > 10.0.0.2.12345: UDP, length 16
10:38:09.858074 IP 10.0.0.1.12345 > 10.0.0.2.12345: UDP, length 16
10:38:10.858280 IP 10.0.0.1.12345 > 10.0.0.2.12345: UDP, length 16
10:38:11.858525 IP 10.0.0.1.12345 > 10.0.0.2.12345: UDP, length 16
10:38:12.858789 IP 10.0.0.1.12345 > 10.0.0.2.12345: UDP, length 16
10:38:13.859028 IP 10.0.0.1.12345 > 10.0.0.2.12345: UDP, length 16
10:38:14.859292 IP 10.0.0.1.12345 > 10.0.0.2.12345: UDP, length 16
10:38:15.859520 IP 10.0.0.1.12345 > 10.0.0.2.12345: UDP, length 16
10:38:16.859880 IP 10.0.0.1.12345 > 10.0.0.2.12345: UDP, length 16
10:38:17.860085 IP 10.0.0.1.12345 > 10.0.0.2.12345: UDP, length 16
10:38:18.860344 IP 10.0.0.1.12345 > 10.0.0.2.12345: UDP, length 16
10:38:19.860549 IP 10.0.0.1.12345 > 10.0.0.2.12345: UDP, length 16
10:38:20.860808 IP 10.0.0.1.12345 > 10.0.0.2.12345: UDP, length 16
10:38:21.861012 IP 10.0.0.1.12345 > 10.0.0.2.12345: UDP, length 16
10:38:22.861272 IP 10.0.0.1.12345 > 10.0.0.2.12345: UDP, length 16
10:38:23.861475 IP 10.0.0.1.12345 > 10.0.0.2.12345: UDP, length 16
10:38:24.861733 IP 10.0.0.1.12345 > 10.0.0.2.12345: UDP, length 16
10:38:25.861953 IP 10.0.0.1.12345 > 10.0.0.2.12345: UDP, length 16
10:38:26.862218 IP 10.0.0.1.12345 > 10.0.0.2.12345: UDP, length 16
10:38:27.862404 IP 10.0.0.1.12345 > 10.0.0.2.12345: UDP, length 16
10:38:28.862662 IP 10.0.0.1.12345 > 10.0.0.2.12345: UDP, length 16
10:38:29.862844 IP 10.0.0.1.12345 > 10.0.0.2.12345: UDP, length 16
10:38:30.863105 IP 10.0.0.1.12345 > 10.0.0.2.12345: UDP, length 16
10:38:31.863289 IP 10.0.0.1.12345 > 10.0.0.2.12345: UDP, length 16
10:38:32.863522 IP 10.0.0.1.12345 > 10.0.0.2.12345: UDP, length 16
10:38:33.863637 IP 10.0.0.1.12345 > 10.0.0.2.12345: UDP, length 16
10:38:34.863895 IP 10.0.0.1.12345 > 10.0.0.2.12345: UDP, length 16
10:38:35.864078 IP 10.0.0.1.12345 > 10.0.0.2.12345: UDP, length 16
10:38:36.864336 IP 10.0.0.1.12345 > 10.0.0.2.12345: UDP, length 16
10:38:37.864597 IP 10.0.0.1.12345 > 10.0.0.2.12345: UDP, length 16
10:38:38.864860 IP 10.0.0.1.12345 > 10.0.0.2.12345: UDP, length 16
10:38:39.865125 IP 10.0.0.1.12345 > 10.0.0.2.12345: UDP, length 16
10:38:40.865386 IP 10.0.0.1.12345 > 10.0.0.2.12345: UDP, length 16
10:38:41.865651 IP 10.0.0.1.12345 > 10.0.0.2.12345: UDP, length 16
10:38:42.865887 IP 10.0.0.1.12345 > 10.0.0.2.12345: UDP, length 16
10:38:43.866100 IP 10.0.0.1.12345 > 10.0.0.2.12345: UDP, length 16
10:38:44.866353 IP 10.0.0.1.12345 > 10.0.0.2.12345: UDP, length 16
10:38:45.866615 IP 10.0.0.1.12345 > 10.0.0.2.12345: UDP, length 16
10:38:46.866880 IP 10.0.0.1.12345 > 10.0.0.2.12345: UDP, length 16
10:38:47.867101 IP 10.0.0.1.12345 > 10.0.0.2.12345: UDP, length 16
10:38:48.867354 IP 10.0.0.1.12345 > 10.0.0.2.12345: UDP, length 16
10:38:49.867614 IP 10.0.0.1.12345 > 10.0.0.2.12345: UDP, length 16
10:38:50.867876 IP 10.0.0.1.12345 > 10.0.0.2.12345: UDP, length 16
10:38:51.868115 IP 10.0.0.1.12345 > 10.0.0.2.12345: UDP, length 16
10:38:52.868370 IP 10.0.0.1.12345 > 10.0.0.2.12345: UDP, length 16
10:38:53.868585 IP 10.0.0.1.12345 > 10.0.0.2.12345: UDP, length 16
10:38:54.868845 IP 10.0.0.1.12345 > 10.0.0.2.12345: UDP, length 16
10:38:55.869112 IP 10.0.0.1.12345 > 10.0.0.2.12345: UDP, length 16
10:38:56.869372 IP 10.0.0.1.12345 > 10.0.0.2.12345: UDP, length 16
10:38:57.869597 IP 10.0.0.1.12345 > 10.0.0.2.12345: UDP, length 16
10:38:58.869823 IP 10.0.0.1.12345 > 10.0.0.2.12345: UDP, length 16
10:38:59.870082 IP 10.0.0.1.12345 > 10.0.0.2.12345: UDP, length 16
10:39:00.870318 IP 10.0.0.1.12345 > 10.0.0.2.12345: UDP, length 16
10:39:01.870576 IP 10.0.0.1.12345 > 10.0.0.2.12345: UDP, length 16
10:39:02.870808 IP 10.0.0.1.12345 > 10.0.0.2.12345: UDP, length 16
10:39:03.871066 IP 10.0.0.1.12345 > 10.0.0.2.12345: UDP, length 16
10:39:04.871302 IP 10.0.0.1.12345 > 10.0.0.2.12345: UDP, length 16
10:39:05.871555 IP 10.0.0.1.12345 > 10.0.0.2.12345: UDP, length 16
10:39:06.871783 IP 10.0.0.1.12345 > 10.0.0.2.12345: UDP, length 16
10:39:07.872043 IP 10.0.0.1.12345 > 10.0.0.2.12345: UDP, length 16
10:39:08.872263 IP 10.0.0.1.12345 > 10.0.0.2.12345: UDP, length 16
10:39:09.872522 IP 10.0.0.1.12345 > 10.0.0.2.12345: UDP, length 16
10:39:10.872713 IP 10.0.0.1.12345 > 10.0.0.2.12345: UDP, length 16
10:39:11.872963 IP 10.0.0.1.12345 > 10.0.0.2.12345: UDP, length 16
10:39:12.873172 IP 10.0.0.1.12345 > 10.0.0.2.12345: UDP, length 16
10:39:13.873431 IP 10.0.0.1.12345 > 10.0.0.2.12345: UDP, length 16
10:39:14.873684 IP 10.0.0.1.12345 > 10.0.0.2.12345: UDP, length 16
10:39:15.873945 IP 10.0.0.1.12345 > 10.0.0.2.12345: UDP, length 16
10:39:16.874174 IP 10.0.0.1.12345 > 10.0.0.2.12345: UDP, length 16
10:39:17.874392 IP 10.0.0.1.12345 > 10.0.0.2.12345: UDP, length 16
10:39:18.874642 IP 10.0.0.1.12345 > 10.0.0.2.12345: UDP, length 16
10:39:19.874898 IP 10.0.0.1.12345 > 10.0.0.2.12345: UDP, length 16
10:39:20.875132 IP 10.0.0.1.12345 > 10.0.0.2.12345: UDP, length 16
10:39:21.875390 IP 10.0.0.1.12345 > 10.0.0.2.12345: UDP, length 16
10:39:22.875636 IP 10.0.0.1.12345 > 10.0.0.2.12345: UDP, length 16
10:39:23.875896 IP 10.0.0.1.12345 > 10.0.0.2.12345: UDP, length 16
10:39:24.876107 IP 10.0.0.1.12345 > 10.0.0.2.12345: UDP, length 16
10:39:25.876357 IP 10.0.0.1.12345 > 10.0.0.2.12345: UDP, length 16
10:39:26.876598 IP 10.0.0.1.12345 > 10.0.0.2.12345: UDP, length 16
10:39:27.876860 IP 10.0.0.1.12345 > 10.0.0.2.12345: UDP, length 16
10:39:28.877075 IP 10.0.0.1.12345 > 10.0.0.2.12345: UDP, length 16
10:39:29.877291 IP 10.0.0.1.12345 > 10.0.0.2.12345: UDP, length 16
10:39:30.877547 IP 10.0.0.1.12345 > 10.0.0.2.12345: UDP, length 16
10:39:31.877802 IP 10.0.0.1.12345 > 10.0.0.2.12345: UDP, length 16
10:39:32.878008 IP 10.0.0.1.12345 > 10.0.0.2.12345: UDP, length 16
10:39:33.878265 IP 10.0.0.1.12345 > 10.0.0.2.12345: UDP, length 16
10:39:34.878468 IP 10.0.0.1.12345 > 10.0.0.2.12345: UDP, length 16
10:39:35.878725 IP 10.0.0.1.12345 > 10.0.0.2.12345: UDP, length 16
10:39:36.878935 IP 10.0.0.1.12345 > 10.0.0.2.12345: UDP, length 16
10:39:37.879193 IP 10.0.0.1.12345 > 10.0.0.2.12345: UDP, length 16
10:39:38.879436 IP 10.0.0.1.12345 > 10.0.0.2.12345: UDP, length 16
10:39:39.879708 IP 10.0.0.1.12345 > 10.0.0.2.12345: UDP, length 16
10:39:40.879947 IP 10.0.0.1.12345 > 10.0.0.2.12345: UDP, length 16
10:39:41.880207 IP 10.0.0.1.12345 > 10.0.0.2.12345: UDP, length 16
10:39:42.880429 IP 10.0.0.1.12345 > 10.0.0.2.12345: UDP, length 16
10:39:43.880660 IP 10.0.0.1.12345 > 10.0.0.2.12345: UDP, length 16
10:39:44.880810 IP 10.0.0.1.12345 > 10.0.0.2.12345: UDP, length 16
10:39:45.881069 IP 10.0.0.1.12345 > 10.0.0.2.12345: UDP, length 16
10:39:46.881295 IP 10.0.0.1.12345 > 10.0.0.2.12345: UDP, length 16
10:39:47.881520 IP 10.0.0.1.12345 > 10.0.0.2.12345: UDP, length 16
10:39:48.881779 IP 10.0.0.1.12345 > 10.0.0.2.12345: UDP, length 16
10:39:49.882041 IP 10.0.0.1.12345 > 10.0.0.2.12345: UDP, length 16
10:39:50.882268 IP 10.0.0.1.12345 > 10.0.0.2.12345: UDP, length 16
10:39:51.882525 IP 10.0.0.1.12345 > 10.0.0.2.12345: UDP, length 16
10:39:52.882727 IP 10.0.0.1.12345 > 10.0.0.2.12345: UDP, length 16
10:39:53.882980 IP 10.0.0.1.12345 > 10.0.0.2.12345: UDP, length 16
10:39:54.883183 IP 10.0.0.1.12345 > 10.0.0.2.12345: UDP, length 16
10:39:55.883438 IP 10.0.0.1.12345 > 10.0.0.2.12345: UDP, length 16
10:39:56.883647 IP 10.0.0.1.12345 > 10.0.0.2.12345: UDP, length 16
10:39:57.883906 IP 10.0.0.1.12345 > 10.0.0.2.12345: UDP, length 16
10:39:58.884121 IP 10.0.0.1.12345 > 10.0.0.2.12345: UDP, length 16
10:39:59.884342 IP 10.0.0.1.12345 > 10.0.0.2.12345: UDP, length 16
10:40:00.884541 IP 10.0.0.1.12345 > 10.0.0.2.12345: UDP, length 16

