16:32:26.347595 IP 10.0.0.1.12345 > 10.0.0.2.12345: UDP, length 16
16:32:26.348358 IP 10.0.0.1.12345 > 10.0.0.2.12345: UDP, length 16
16:32:26.349036 IP 10.0.0.1.12345 > 10.0.0.2.12345: UDP, length 16
16:32:26.349707 IP 10.0.0.1.12345 > 10.0.0.2.12345: UDP, length 16
16:32:26.350378 IP 10.0.0.1.12345 > 10.0.0.2.12345: UDP, length 16
16:32:26.351049 IP 10.0.0.1.12345 > 10.0.0.2.12345: UDP, length 16
16:32:26.351705 IP 10.0.0.1.12345 > 10.0.0.2.12345: UDP, length 16
16:32:26.352300 IP 10.0.0.1.12345 > 10.0.0.2.12345: UDP, length 16
16:32:26.352963 IP 10.0.0.1.12345 > 10.0.0.2.12345: UDP, length 16
16:32:26.353618 IP 10.0.0.1.12345 > 10.0.0.2.12345: UDP, length 16
16:32:26.354275 IP 10.0.0.1.12345 > 10.0.0.2.12345: UDP, length 16
16:32:26.354941 IP 10.0.0.1.12345 > 10.0.0.2.12345: UDP, length 16
16:32:26.355545 IP 10.0.0.1.12345 > 10.0.0.2.12345: UDP, length 16
16:32:26.356156 IP 10.0.0.1.12345 > 10.0.0.2.12345: UDP, length 16
16:32:26.356758 IP 10.0.0.1.12345 > 10.0.0.2.12345: UDP, length 16
16:32:26.357376 IP 10.0.0.1.12345 > 10.0.0.2.12345: UDP, length 16
16:32:26.357998 IP 10.0.0.1.12345 > 10.0.0.2.12345: UDP, length 16
16:32:26.358619 IP 10.0.0.1.12345 > 10.0.0.2.12345: UDP, length 16
16:32:26.359261 IP 10.0.0.1.12345 > 10.0.0.2.12345: UDP, length 16
16:32:26.359871 IP 10.0.0.1.12345 > 10.0.0.2.12345: UDP, length 16
16:32:26.360496 IP 10.0.0.1.12345 > 10.0.0.2.12345: UDP, length 16
16:32:26.361122 IP 10.0.0.1.12345 > 10.0.0.2.12345: UDP, length 16
16:32:26.361749 IP 10.0.0.1.12345 > 10.0.0.2.12345: UDP, length 16
16:32:26.362377 IP 10.0.0.1.12345 > 10.0.0.2.12345: UDP, length 16
16:32:26.363004 IP 10.0.0.1.12345 > 10.0.0.2.12345: UDP, length 16
16:32:26.363631 IP 10.0.0.1.12345 > 10.0.0.2.12345: UDP, length 16
16:32:26.364260 IP 10.0.0.1.12345 > 10.0.0.2.12345: UDP, length 16
16:32:26.364887 IP 10.0.0.1.12345 > 10.0.0.2.12345: UDP, length 16
16:32:26.365514 IP 10.0.0.1.12345 > 10.0.0.2.12345: UDP, length 16
16:32:26.366142 IP 10.0.0.1.12345 > 10.0.0.2.12345: UDP, length 16
16:32:26.366768 IP 10.0.0.1.12345 > 10.0.0.2.12345: UDP, length 16
16:32:26.367395 IP 10.0.0.1.12345 > 10.0.0.2.12345: UDP, length 16
16:32:26.368026 IP 10.0.0.1.12345 > 10.0.0.2.12345: UDP, length 16
16:32:26.368675 IP 10.0.0.1.12345 > 10.0.0.2.12345: UDP, length 16
16:32:26.369326 IP 10.0.0.1.12345 > 10.0.0.2.12345: UDP, length 16
16:32:26.369974 IP 10.0.0.1.12345 > 10.0.0.2.12345: UDP, length 16
16:32:26.370625 IP 10.0.0.1.12345 > 10.0.0.2.12345: UDP, length 16
16:32:26.371276 IP 10.0.0.1.12345 > 10.0.0.2.12345: UDP, length 16
16:32:26.371924 IP 10.0.0.1.12345 > 10.0.0.2.12345: UDP, length 16
16:32:26.372574 IP 10.0.0.1.12345 > 10.0.0.2.12345: UDP, length 16
16:32:26.373223 IP 10.0.0.1.12345 > 10.0.0.2.12345: UDP, length 16
16:32:26.373872 IP 10.0.0.1.12345 > 10.0.0.2.12345: UDP, length 16
16:32:26.374524 IP 10.0.0.1.12345 > 10.0.0.2.12345: UDP, length 16
16:32:26.375172 IP 10.0.0.1.12345 > 10.0.0.2.12345: UDP, length 16
16:32:26.375822 IP 10.0.0.1.12345 > 10.0.0.2.12345: UDP, length 16
16:32:26.376458 IP 10.0.0.1.12345 > 10.0.0.2.12345: UDP, length 16
16:32:26.377108 IP 10.0.0.1.12345 > 10.0.0.2.12345: UDP, length 16
16:32:26.377759 IP 10.0.0.1.12345 > 10.0.0.2.12345: UDP, length 16
16:32:26.378408 IP 10.0.0.1.12345 > 10.0.0.2.12345: UDP, length 16
16:32:26.379056 IP 10.0.0.1.12345 > 10.0.0.2.12345: UDP, length 16
16:32:26.379704 IP 10.0.0.1.12345 > 10.0.0.2.12345: UDP, length 16
16:32:26.380341 IP 10.0.0.1.12345 > 10.0.0.2.12345: UDP, length 16
16:32:26.380992 IP 10.0.0.1.12345 > 10.0.0.2.12345: UDP, length 16
16:32:26.381641 IP 10.0.0.1.12345 > 10.0.0.2.12345: UDP, length 16
16:32:26.382290 IP 10.0.0.1.12345 > 10.0.0.2.12345: UDP, length 16
16:32:26.382939 IP 10.0.0.1.12345 > 10.0.0.2.12345: UDP, length 16
16:32:26.383588 IP 10.0.0.1.12345 > 10.0.0.2.12345: UDP, length 16
16:32:26.384286 IP 10.0.0.1.12345 > 10.0.0.2.12345: UDP, length 16
16:32:26.384936 IP 10.0.0.1.12345 > 10.0.0.2.12345: UDP, length 16
16:32:26.385586 IP 10.0.0.1.12345 > 10.0.0.2.12345: UDP, length 16
16:32:26.386237 IP 10.0.0.1.12345 > 10.0.0.2.12345: UDP, length 16
16:32:26.386885 IP 10.0.0.1.12345 > 10.0.0.2.12345: UDP, length 16
16:32:26.387534 IP 10.0.0.1.12345 > 10.0.0.2.12345: UDP, length 16
16:32:26.388184 IP 10.0.0.1.12345 > 10.0.0.2.12345: UDP, length 16
16:32:26.388834 IP 10.0.0.1.12345 > 10.0.0.2.12345: UDP, length 16
16:32:26.389483 IP 10.0.0.1.12345 > 10.0.0.2.12345: UDP, length 16
16:32:26.390132 IP 10.0.0.1.12345 > 10.0.0.2.12345: UDP, length 16
16:32:26.390781 IP 10.0.0.1.12345 > 10.0.0.2.12345: UDP, length 16
16:32:26.391431 IP 10.0.0.1.12345 > 10.0.0.2.12345: UDP, length 16
16:32:26.392079 IP 10.0.0.1.12345 > 10.0.0.2.12345: UDP, length 16
16:32:26.392729 IP 10.0.0.1.12345 > 10.0.0.2.12345: UDP, length 16
16:32:26.393379 IP 10.0.0.1.12345 > 10.0.0.2.12345: UDP, length 16
16:32:26.394028 IP 10.0.0.1.12345 > 10.0.0.2.12345: UDP, length 16
16:32:26.394677 IP 10.0.0.1.12345 > 10.0.0.2.12345: UDP, length 16
16:32:26.395324 IP 10.0.0.1.12345 > 10.0.0.2.12345: UDP, length 16
16:32:26.395975 IP 10.0.0.1.12345 > 10.0.0.2.12345: UDP, length 16
16:32:26.396625 IP 10.0.0.1.12345 > 10.0.0.2.12345: UDP, length 16
16:32:26.397275 IP 10.0.0.1.12345 > 10.0.0.2.12345: UDP, length 16
16:32:26.397924 IP 10.0.0.1.12345 > 10.0.0.2.12345: UDP, length 16
16:32:26.398573 IP 10.0.0.1.12345 > 10.0.0.2.12345: UDP, length 16
16:32:26.399226 IP 10.0.0.1.12345 > 10.0.0.2.12345: UDP, length 16
16:32:26.399876 IP 10.0.0.1.12345 > 10.0.0.2.12345: UDP, length 16
16:32:26.400525 IP 10.0.0.1.12345 > 10.0.0.2.12345: UDP, length 16
16:32:26.401173 IP 10.0.0.1.12345 > 10.0.0.2.12345: UDP, length 16
16:32:26.401823 IP 10.0.0.1.12345 > 10.0.0.2.12345: UDP, length 16
16:32:26.402472 IP 10.0.0.1.12345 > 10.0.0.2.12345: UDP, length 16
16:32:26.403120 IP 10.0.0.1.12345 > 10.0.0.2.12345: UDP, length 16
16:32:26.403771 IP 10.0.0.1.12345 > 10.0.0.2.12345: UDP, length 16
16:32:26.404392 IP 10.0.0.1.12345 > 10.0.0.2.12345: UDP, length 16
16:32:26.405041 IP 10.0.0.1.12345 > 10.0.0.2.12345: UDP, length 16
16:32:26.405690 IP 10.0.0.1.12345 > 10.0.0.2.12345: UDP, length 16
16:32:26.406339 IP 10.0.0.1.12345 > 10.0.0.2.12345: UDP, length 16
16:32:26.406975 IP 10.0.0.1.12345 > 10.0.0.2.12345: UDP, length 16
16:32:26.407624 IP 10.0.0.1.12345 > 10.0.0.2.12345: UDP, length 16
16:32:26.408279 IP 10.0.0.1.12345 > 10.0.0.2.12345: UDP, length 16
16:32:26.408929 IP 10.0.0.1.12345 > 10.0.0.2.12345: UDP, length 16
16:32:26.409578 IP 10.0.0.1.12345 > 10.0.0.2.12345: UDP, length 16
16:32:26.410227 IP 10.0.0.1.12345 > 10.0.0.2.12345: UDP, length 16
16:32:26.410875 IP 10.0.0.1.12345 > 10.0.0.2.12345: UDP, length 16
16:32:26.411524 IP 10.0.0.1.12345 > 10.0.0.2.12345: UDP, length 16
16:32:26.412178 IP 10.0.0.1.12345 > 10.0.0.2.12345: UDP, length 16
16:32:26.412843 IP 10.0.0.1.12345 > 10.0.0.2.12345: UDP, length 16
16:32:26.413506 IP 10.0.0.1.12345 > 10.0.0.2.12345: UDP, length 16
16:32:26.414170 IP 10.0.0.1.12345 > 10.0.0.2.12345: UDP, length 16
16:32:26.414833 IP 10.0.0.1.12345 > 10.0.0.2.12345: UDP, length 16
16:32:26.415498 IP 10.0.0.1.12345 > 10.0.0.2.12345: UDP, length 16
16:32:26.416161 IP 10.0.0.1.12345 > 10.0.0.2.12345: UDP, length 16
16:32:26.416827 IP 10.0.0.1.12345 > 10.0.0.2.12345: UDP, length 16
16:32:26.417492 IP 10.0.0.1.12345 > 10.0.0.2.12345: UDP, length 16
16:32:26.418156 IP 10.0.0.1.12345 > 10.0.0.2.12345: UDP, length 16
16:32:26.418819 IP 10.0.0.1.12345 > 10.0.0.2.12345: UDP, length 16
16:32:26.419486 IP 10.0.0.1.12345 > 10.0.0.2.12345: UDP, length 16
16:32:26.420149 IP 10.0.0.1.12345 > 10.0.0.2.12345: UDP, length 16
16:32:26.420815 IP 10.0.0.1.12345 > 10.0.0.2.12345: UDP, length 16
16:32:26.421477 IP 10.0.0.1.12345 > 10.0.0.2.12345: UDP, length 16
16:32:26.422138 IP 10.0.0.1.12345 > 10.0.0.2.12345: UDP, length 16
16:32:26.422801 IP 10.0.0.1.12345 > 10.0.0.2.12345: UDP, length 16
16:32:26.423462 IP 10.0.0.1.12345 > 10.0.0.2.12345: UDP, length 16
16:32:26.424124 IP 10.0.0.1.12345 > 10.0.0.2.12345: UDP, length 16
16:32:26.424751 IP 10.0.0.1.12345 > 10.0.0.2.12345: UDP, length 16
16:32:26.425409 IP 10.0.0.1.12345 > 10.0.0.2.12345: UDP, length 16
16:32:26.426073 IP 10.0.0.1.12345 > 10.0.0.2.12345: UDP, length 16
16:32:26.426737 IP 10.0.0.1.12345 > 10.0.0.2.12345: UDP, length 16
16:32:26.427401 IP 10.0.0.1.12345 > 10.0.0.2.12345: UDP, length 16
16:32:26.428065 IP 10.0.0.1.12345 > 10.0.0.2.12345: UDP, length 16
16:32:26.428729 IP 10.0.0.1.12345 > 10.0.0.2.12345: UDP, length 16
16:32:26.429394 IP 10.0.0.1.12345 > 10.0.0.2.12345: UDP, length 16
16:32:26.430051 IP 10.0.0.1.12345 > 10.0.0.2.12345: UDP, length 16
16:32:26.430707 IP 10.0.0.1.12345 > 10.0.0.2.12345: UDP, length 16
16:32:26.431363 IP 10.0.0.1.12345 > 10.0.0.2.12345: UDP, length 16
16:32:26.432018 IP 10.0.0.1.12345 > 10.0.0.2.12345: UDP, length 16
16:32:26.432677 IP 10.0.0.1.12345 > 10.0.0.2.12345: UDP, length 16
16:32:26.433333 IP 10.0.0.1.12345 > 10.0.0.2.12345: UDP, length 16
16:32:26.433987 IP 10.0.0.1.12345 > 10.0.0.2.12345: UDP, length 16
16:32:26.434644 IP 10.0.0.1.12345 > 10.0.0.2.12345: UDP, length 16
16:32:26.435299 IP 10.0.0.1.12345 > 10.0.0.2.12345: UDP, length 16
16:32:26.435955 IP 10.0.0.1.12345 > 10.0.0.2.12345: UDP, length 16
16:32:26.436614 IP 10.0.0.1.12345 > 10.0.0.2.12345: UDP, length 16
16:32:26.437270 IP 10.0.0.1.12345 > 10.0.0.2.12345: UDP, length 16
16:32:26.437925 IP 10.0.0.1.12345 > 10.0.0.2.12345: UDP, length 16
16:32:26.438582 IP 10.0.0.1.12345 > 10.0.0.2.12345: UDP, length 16
16:32:26.439239 IP 10.0.0.1.12345 > 10.0.0.2.12345: UDP, length 16
16:32:26.439894 IP 10.0.0.1.12345 > 10.0.0.2.12345: UDP, length 16
16:32:26.440554 IP 10.0.0.1.12345 > 10.0.0.2.12345: UDP, length 16
16:32:26.441208 IP 10.0.0.1.12345 > 10.0.0.2.12345: UDP, length 16
16:32:26.441865 IP 10.0.0.1.12345 > 10.0.0.2.12345: UDP, length 16
16:32:26.442520 IP 10.0.0.1.12345 > 10.0.0.2.12345: UDP, length 16
16:32:26.443176 IP 10.0.0.1.12345 > 10.0.0.2.12345: UDP, length 16
16:32:26.443832 IP 10.0.0.1.12345 > 10.0.0.2.12345: UDP, length 16
16:32:26.444490 IP 10.0.0.1.12345 > 10.0.0.2.12345: UDP, length 16
16:32:26.445144 IP 10.0.0.1.12345 > 10.0.0.2.12345: UDP, length 16
16:32:26.445801 IP 10.0.0.1.12345 > 10.0.0.2.12345: UDP, length 16
16:32:26.446398 IP 10.0.0.1.12345 > 10.0.0.2.12345: UDP, length 16
16:32:26.447051 IP 10.0.0.1.12345 > 10.0.0.2.12345: UDP, length 16
16:32:26.447720 IP 10.0.0.1.12345 > 10.0.0.2.12345: UDP, length 16
16:32:26.448380 IP 10.0.0.1.12345 > 10.0.0.2.12345: UDP, length 16
16:32:26.449035 IP 10.0.0.1.12345 > 10.0.0.2.12345: UDP, length 16
16:32:26.449691 IP 10.0.0.1.12345 > 10.0.0.2.12345: UDP, length 16
16:32:26.450347 IP 10.0.0.1.12345 > 10.0.0.2.12345: UDP, length 16
16:32:26.451002 IP 10.0.0.1.12345 > 10.0.0.2.12345: UDP, length 16
16:32:26.451658 IP 10.0.0.1.12345 > 10.0.0.2.12345: UDP, length 16
16:32:26.452316 IP 10.0.0.1.12345 > 10.0.0.2.12345: UDP, length 16
16:32:26.452971 IP 10.0.0.1.12345 > 10.0.0.2.12345: UDP, length 16
16:32:26.453628 IP 10.0.0.1.12345 > 10.0.0.2.12345: UDP, length 16
16:32:26.454284 IP 10.0.0.1.12345 > 10.0.0.2.12345: UDP, length 16
16:32:26.454926 IP 10.0.0.1.12345 > 10.0.0.2.12345: UDP, length 16
16:32:26.455582 IP 10.0.0.1.12345 > 10.0.0.2.12345: UDP, length 16
16:32:26.456275 IP 10.0.0.1.12345 > 10.0.0.2.12345: UDP, length 16
16:32:26.456931 IP 10.0.0.1.12345 > 10.0.0.2.12345: UDP, length 16
16:32:26.457586 IP 10.0.0.1.12345 > 10.0.0.2.12345: UDP, length 16
16:32:26.458242 IP 10.0.0.1.12345 > 10.0.0.2.12345: UDP, length 16
16:32:26.458897 IP 10.0.0.1.12345 > 10.0.0.2.12345: UDP, length 16
16:32:26.459553 IP 10.0.0.1.12345 > 10.0.0.2.12345: UDP, length 16
16:32:26.460208 IP 10.0.0.1.12345 > 10.0.0.2.12345: UDP, length 16
16:32:26.460909 IP 10.0.0.1.12345 > 10.0.0.2.12345: UDP, length 16
16:32:26.461568 IP 10.0.0.1.12345 > 10.0.0.2.12345: UDP, length 16
16:32:26.462223 IP 10.0.0.1.12345 > 10.0.0.2.12345: UDP, length 16
16:32:26.462879 IP 10.0.0.1.12345 > 10.0.0.2.12345: UDP, length 16
16:32:26.463533 IP 10.0.0.1.12345 > 10.0.0.2.12345: UDP, length 16
16:32:26.464187 IP 10.0.0.1.12345 > 10.0.0.2.12345: UDP, length 16
16:32:26.464845 IP 10.0.0.1.12345 > 10.0.0.2.12345: UDP, length 16
16:32:26.465500 IP 10.0.0.1.12345 > 10.0.0.2.12345: UDP, length 16
16:32:26.466155 IP 10.0.0.1.12345 > 10.0.0.2.12345: UDP, length 16
16:32:26.466812 IP 10.0.0.1.12345 > 10.0.0.2.12345: UDP, length 16
16:32:26.467468 IP 10.0.0.1.12345 > 10.0.0.2.12345: UDP, length 16
16:32:26.468124 IP 10.0.0.1.12345 > 10.0.0.2.12345: UDP, length 16
16:32:26.468789 IP 10.0.0.1.12345 > 10.0.0.2.12345: UDP, length 16
16:32:26.469454 IP 10.0.0.1.12345 > 10.0.0.2.12345: UDP, length 16
16:32:26.470119 IP 10.0.0.1.12345 > 10.0.0.2.12345: UDP, length 16
16:32:26.470783 IP 10.0.0.1.12345 > 10.0.0.2.12345: UDP, length 16
16:32:26.471435 IP 10.0.0.1.12345 > 10.0.0.2.12345: UDP, length 16
16:32:26.472101 IP 10.0.0.1.12345 > 10.0.0.2.12345: UDP, length 16
16:32:26.472766 IP 10.0.0.1.12345 > 10.0.0.2.12345: UDP, length 16
16:32:26.473433 IP 10.0.0.1.12345 > 10.0.0.2.12345: UDP, length 16
16:32:26.474097 IP 10.0.0.1.12345 > 10.0.0.2.12345: UDP, length 16
16:32:26.474762 IP 10.0.0.1.12345 > 10.0.0.2.12345: UDP, length 16
16:32:26.475427 IP 10.0.0.1.12345 > 10.0.0.2.12345: UDP, length 16
16:32:26.476091 IP 10.0.0.1.12345 > 10.0.0.2.12345: UDP, length 16
16:32:26.476758 IP 10.0.0.1.12345 > 10.0.0.2.12345: UDP, length 16
16:32:26.477422 IP 10.0.0.1.12345 > 10.0.0.2.12345: UDP, length 16
16:32:26.478086 IP 10.0.0.1.12345 > 10.0.0.2.12345: UDP, length 16
16:32:26.478751 IP 10.0.0.1.12345 > 10.0.0.2.12345: UDP, length 16
16:32:26.479416 IP 10.0.0.1.12345 > 10.0.0.2.12345: UDP, length 16
16:32:26.480080 IP 10.0.0.1.12345 > 10.0.0.2.12345: UDP, length 16
16:32:26.480746 IP 10.0.0.1.12345 > 10.0.0.2.12345: UDP, length 16
16:32:26.481411 IP 10.0.0.1.12345 > 10.0.0.2.12345: UDP, length 16
16:32:26.482077 IP 10.0.0.1.12345 > 10.0.0.2.12345: UDP, length 16
16:32:26.482741 IP 10.0.0.1.12345 > 10.0.0.2.12345: UDP, length 16
16:32:26.483406 IP 10.0.0.1.12345 > 10.0.0.2.12345: UDP, length 16
16:32:26.484071 IP 10.0.0.1.12345 > 10.0.0.2.12345: UDP, length 16
16:32:26.484739 IP 10.0.0.1.12345 > 10.0.0.2.12345: UDP, length 16
16:32:26.485404 IP 10.0.0.1.12345 > 10.0.0.2.12345: UDP, length 16
16:32:26.486070 IP 10.0.0.1.12345 > 10.0.0.2.12345: UDP, length 16
16:32:26.486735 IP 10.0.0.1.12345 > 10.0.0.2.12345: UDP, length 16
16:32:26.487400 IP 10.0.0.1.12345 > 10.0.0.2.12345: UDP, length 16
16:32:26.488064 IP 10.0.0.1.12345 > 10.0.0.2.12345: UDP, length 16
16:32:26.488730 IP 10.0.0.1.12345 > 10.0.0.2.12345: UDP, length 16
16:32:26.489393 IP 10.0.0.1.12345 > 10.0.0.2.12345: UDP, length 16
16:32:26.490057 IP 10.0.0.1.12345 > 10.0.0.2.12345: UDP, length 16
16:32:26.490723 IP 10.0.0.1.12345 > 10.0.0.2.12345: UDP, length 16
16:32:26.491388 IP 10.0.0.1.12345 > 10.0.0.2.12345: UDP, length 16
16:32:26.492053 IP 10.0.0.1.12345 > 10.0.0.2.12345: UDP, length 16
16:32:26.492720 IP 10.0.0.1.12345 > 10.0.0.2.12345: UDP, length 16
16:32:26.493385 IP 10.0.0.1.12345 > 10.0.0.2.12345: UDP, length 16
16:32:26.494051 IP 10.0.0.1.12345 > 10.0.0.2.12345: UDP, length 16
16:32:26.494717 IP 10.0.0.1.12345 > 10.0.0.2.12345: UDP, length 16
16:32:26.495379 IP 10.0.0.1.12345 > 10.0.0.2.12345: UDP, length 16
16:32:26.496010 IP 10.0.0.1.12345 > 10.0.0.2.12345: UDP, length 16
16:32:26.496672 IP 10.0.0.1.12345 > 10.0.0.2.12345: UDP, length 16
16:32:26.497337 IP 10.0.0.1.12345 > 10.0.0.2.12345: UDP, length 16
16:32:26.498002 IP 10.0.0.1.12345 > 10.0.0.2.12345: UDP, length 16
16:32:26.498667 IP 10.0.0.1.12345 > 10.0.0.2.12345: UDP, length 16
16:32:26.499332 IP 10.0.0.1.12345 > 10.0.0.2.12345: UDP, length 16
16:32:26.499997 IP 10.0.0.1.12345 > 10.0.0.2.12345: UDP, length 16
16:32:26.500665 IP 10.0.0.1.12345 > 10.0.0.2.12345: UDP, length 16
16:32:26.501329 IP 10.0.0.1.12345 > 10.0.0.2.12345: UDP, length 16
16:32:26.501993 IP 10.0.0.1.12345 > 10.0.0.2.12345: UDP, length 16
16:32:26.502658 IP 10.0.0.1.12345 > 10.0.0.2.12345: UDP, length 16
16:32:26.503324 IP 10.0.0.1.12345 > 10.0.0.2.12345: UDP, length 16
16:32:26.503988 IP 10.0.0.1.12345 > 10.0.0.2.12345: UDP, length 16
16:32:26.504656 IP 10.0.0.1.12345 > 10.0.0.2.12345: UDP, length 16
16:32:26.505321 IP 10.0.0.1.12345 > 10.0.0.2.12345: UDP, length 16
16:32:26.505985 IP 10.0.0.1.12345 > 10.0.0.2.12345: UDP, length 16
16:32:26.506651 IP 10.0.0.1.12345 > 10.0.0.2.12345: UDP, length 16
16:32:26.507314 IP 10.0.0.1.12345 > 10.0.0.2.12345: UDP, length 16
16:32:26.507980 IP 10.0.0.1.12345 > 10.0.0.2.12345: UDP, length 16
16:32:26.508649 IP 10.0.0.1.12345 > 10.0.0.2.12345: UDP, length 16
16:32:26.509313 IP 10.0.0.1.12345 > 10.0.0.2.12345: UDP, length 16
16:32:26.509977 IP 10.0.0.1.12345 > 10.0.0.2.12345: UDP, length 16
16:32:26.510642 IP 10.0.0.1.12345 > 10.0.0.2.12345: UDP, length 16
16:32:26.511306 IP 10.0.0.1.12345 > 10.0.0.2.12345: UDP, length 16
16:32:26.511970 IP 10.0.0.1.12345 > 10.0.0.2.12345: UDP, length 16
16:32:26.512639 IP 10.0.0.1.12345 > 10.0.0.2.12345: UDP, length 16
16:32:26.513303 IP 10.0.0.1.12345 > 10.0.0.2.12345: UDP, length 16
16:32:26.513968 IP 10.0.0.1.12345 > 10.0.0.2.12345: UDP, length 16
16:32:26.514665 IP 10.0.0.1.12345 > 10.0.0.2.12345: UDP, length 16
16:32:26.515340 IP 10.0.0.1.12345 > 10.0.0.2.12345: UDP, length 16
16:32:26.516014 IP 10.0.0.1.12345 > 10.0.0.2.12345: UDP, length 16
16:32:26.516692 IP 10.0.0.1.12345 > 10.0.0.2.12345: UDP, length 16
16:32:26.517367 IP 10.0.0.1.12345 > 10.0.0.2.12345: UDP, length 16
16:32:26.518043 IP 10.0.0.1.12345 > 10.0.0.2.12345: UDP, length 16
16:32:26.518720 IP 10.0.0.1.12345 > 10.0.0.2.12345: UDP, length 16
16:32:26.519395 IP 10.0.0.1.12345 > 10.0.0.2.12345: UDP, length 16
16:32:26.520070 IP 10.0.0.1.12345 > 10.0.0.2.12345: UDP, length 16
16:32:26.520749 IP 10.0.0.1.12345 > 10.0.0.2.12345: UDP, length 16
16:32:26.521424 IP 10.0.0.1.12345 > 10.0.0.2.12345: UDP, length 16
16:32:26.522098 IP 10.0.0.1.12345 > 10.0.0.2.12345: UDP, length 16
16:32:26.522772 IP 10.0.0.1.12345 > 10.0.0.2.12345: UDP, length 16
16:32:26.523447 IP 10.0.0.1.12345 > 10.0.0.2.12345: UDP, length 16
16:32:26.524123 IP 10.0.0.1.12345 > 10.0.0.2.12345: UDP, length 16
16:32:26.524798 IP 10.0.0.1.12345 > 10.0.0.2.12345: UDP, length 16
16:32:26.525472 IP 10.0.0.1.12345 > 10.0.0.2.12345: UDP, length 16
16:32:26.526149 IP 10.0.0.1.12345 > 10.0.0.2.12345: UDP, length 16
16:32:26.526824 IP 10.0.0.1.12345 > 10.0.0.2.12345: UDP, length 16
16:32:26.527499 IP 10.0.0.1.12345 > 10.0.0.2.12345: UDP, length 16
16:32:26.528174 IP 10.0.0.1.12345 > 10.0.0.2.12345: UDP, length 16
16:32:26.528851 IP 10.0.0.1.12345 > 10.0.0.2.12345: UDP, length 16
16:32:26.529527 IP 10.0.0.1.12345 > 10.0.0.2.12345: UDP, length 16
16:32:26.530202 IP 10.0.0.1.12345 > 10.0.0.2.12345: UDP, length 16
16:32:26.530877 IP 10.0.0.1.12345 > 10.0.0.2.12345: UDP, length 16
16:32:26.531552 IP 10.0.0.1.12345 > 10.0.0.2.12345: UDP, length 16
16:32:26.532279 IP 10.0.0.1.12345 > 10.0.0.2.12345: UDP, length 16
16:32:26.532955 IP 10.0.0.1.12345 > 10.0.0.2.12345: UDP, length 16
16:32:26.533630 IP 10.0.0.1.12345 > 10.0.0.2.12345: UDP, length 16
16:32:26.534306 IP 10.0.0.1.12345 > 10.0.0.2.12345: UDP, length 16
16:32:26.534969 IP 10.0.0.1.12345 > 10.0.0.2.12345: UDP, length 16
16:32:26.535644 IP 10.0.0.1.12345 > 10.0.0.2.12345: UDP, length 16
16:32:26.536322 IP 10.0.0.1.12345 > 10.0.0.2.12345: UDP, length 16
16:32:26.536996 IP 10.0.0.1.12345 > 10.0.0.2.12345: UDP, length 16
16:32:26.537676 IP 10.0.0.1.12345 > 10.0.0.2.12345: UDP, length 16
16:32:26.538350 IP 10.0.0.1.12345 > 10.0.0.2.12345: UDP, length 16
16:32:26.539025 IP 10.0.0.1.12345 > 10.0.0.2.12345: UDP, length 16
16:32:26.539700 IP 10.0.0.1.12345 > 10.0.0.2.12345: UDP, length 16
16:32:26.540377 IP 10.0.0.1.12345 > 10.0.0.2.12345: UDP, length 16
16:32:26.541052 IP 10.0.0.1.12345 > 10.0.0.2.12345: UDP, length 16
16:32:26.541727 IP 10.0.0.1.12345 > 10.0.0.2.12345: UDP, length 16
16:32:26.542402 IP 10.0.0.1.12345 > 10.0.0.2.12345: UDP, length 16
16:32:26.543076 IP 10.0.0.1.12345 > 10.0.0.2.12345: UDP, length 16
16:32:26.543752 IP 10.0.0.1.12345 > 10.0.0.2.12345: UDP, length 16
16:32:26.544431 IP 10.0.0.1.12345 > 10.0.0.2.12345: UDP, length 16
16:32:26.545106 IP 10.0.0.1.12345 > 10.0.0.2.12345: UDP, length 16
16:32:26.545780 IP 10.0.0.1.12345 > 10.0.0.2.12345: UDP, length 16
16:32:26.546456 IP 10.0.0.1.12345 > 10.0.0.2.12345: UDP, length 16
16:32:26.547131 IP 10.0.0.1.12345 > 10.0.0.2.12345: UDP, length 16
16:32:26.547805 IP 10.0.0.1.12345 > 10.0.0.2.12345: UDP, length 16
16:32:26.548482 IP 10.0.0.1.12345 > 10.0.0.2.12345: UDP, length 16
16:32:26.549158 IP 10.0.0.1.12345 > 10.0.0.2.12345: UDP, length 16
16:32:26.549833 IP 10.0.0.1.12345 > 10.0.0.2.12345: UDP, length 16
16:32:26.550507 IP 10.0.0.1.12345 > 10.0.0.2.12345: UDP, length 16
16:32:26.551182 IP 10.0.0.1.12345 > 10.0.0.2.12345: UDP, length 16
16:32:26.551857 IP 10.0.0.1.12345 > 10.0.0.2.12345: UDP, length 16
16:32:26.552534 IP 10.0.0.1.12345 > 10.0.0.2.12345: UDP, length 16
16:32:26.553211 IP 10.0.0.1.12345 > 10.0.0.2.12345: UDP, length 16
16:32:26.553887 IP 10.0.0.1.12345 > 10.0.0.2.12345: UDP, length 16
16:32:26.554562 IP 10.0.0.1.12345 > 10.0.0.2.12345: UDP, length 16
16:32:26.555236 IP 10.0.0.1.12345 > 10.0.0.2.12345: UDP, length 16
16:32:26.555912 IP 10.0.0.1.12345 > 10.0.0.2.12345: UDP, length 16
16:32:26.556591 IP 10.0.0.1.12345 > 10.0.0.2.12345: UDP, length 16
16:32:26.557266 IP 10.0.0.1.12345 > 10.0.0.2.12345: UDP, length 16
16:32:26.557940 IP 10.0.0.1.12345 > 10.0.0.2.12345: UDP, length 16
16:32:26.558616 IP 10.0.0.1.12345 > 10.0.0.2.12345: UDP, length 16
16:32:26.559291 IP 10.0.0.1.12345 > 10.0.0.2.12345: UDP, length 16
16:32:26.559965 IP 10.0.0.1.12345 > 10.0.0.2.12345: UDP, length 16
16:32:26.560647 IP 10.0.0.1.12345 > 10.0.0.2.12345: UDP, length 16
16:32:26.561322 IP 10.0.0.1.12345 > 10.0.0.2.12345: UDP, length 16
16:32:26.561996 IP 10.0.0.1.12345 > 10.0.0.2.12345: UDP, length 16
16:32:26.562671 IP 10.0.0.1.12345 > 10.0.0.2.12345: UDP, length 16
16:32:26.563347 IP 10.0.0.1.12345 > 10.0.0.2.12345: UDP, length 16
16:32:26.564021 IP 10.0.0.1.12345 > 10.0.0.2.12345: UDP, length 16
16:32:26.564700 IP 10.0.0.1.12345 > 10.0.0.2.12345: UDP, length 16
16:32:26.565377 IP 10.0.0.1.12345 > 10.0.0.2.12345: UDP, length 16
16:32:26.566053 IP 10.0.0.1.12345 > 10.0.0.2.12345: UDP, length 16
16:32:26.566727 IP 10.0.0.1.12345 > 10.0.0.2.12345: UDP, length 16
16:32:26.567402 IP 10.0.0.1.12345 > 10.0.0.2.12345: UDP, length 16
16:32:26.568076 IP 10.0.0.1.12345 > 10.0.0.2.12345: UDP, length 16
16:32:26.568755 IP 10.0.0.1.12345 > 10.0.0.2.12345: UDP, length 16
16:32:26.569430 IP 10.0.0.1.12345 > 10.0.0.2.12345: UDP, length 16
16:32:26.570105 IP 10.0.0.1.12345 > 10.0.0.2.12345: UDP, length 16
16:32:26.570781 IP 10.0.0.1.12345 > 10.0.0.2.12345: UDP, length 16
16:32:26.571456 IP 10.0.0.1.12345 > 10.0.0.2.12345: UDP, length 16
16:32:26.572132 IP 10.0.0.1.12345 > 10.0.0.2.12345: UDP, length 16
16:32:26.572810 IP 10.0.0.1.12345 > 10.0.0.2.12345: UDP, length 16
16:32:26.573486 IP 10.0.0.1.12345 > 10.0.0.2.12345: UDP, length 16
16:32:26.574160 IP 10.0.0.1.12345 > 10.0.0.2.12345: UDP, length 16
16:32:26.574837 IP 10.0.0.1.12345 > 10.0.0.2.12345: UDP, length 16
16:32:26.575511 IP 10.0.0.1.12345 > 10.0.0.2.12345: UDP, length 16
16:32:26.576186 IP 10.0.0.1.12345 > 10.0.0.2.12345: UDP, length 16
16:32:26.576861 IP 10.0.0.1.12345 > 10.0.0.2.12345: UDP, length 16
16:32:26.577536 IP 10.0.0.1.12345 > 10.0.0.2.12345: UDP, length 16
16:32:26.578210 IP 10.0.0.1.12345 > 10.0.0.2.12345: UDP, length 16
16:32:26.578886 IP 10.0.0.1.12345 > 10.0.0.2.12345: UDP, length 16
16:32:26.579560 IP 10.0.0.1.12345 > 10.0.0.2.12345: UDP, length 16
16:32:26.580283 IP 10.0.0.1.12345 > 10.0.0.2.12345: UDP, length 16
16:32:26.580958 IP 10.0.0.1.12345 > 10.0.0.2.12345: UDP, length 16
16:32:26.581632 IP 10.0.0.1.12345 > 10.0.0.2.12345: UDP, length 16
16:32:26.582307 IP 10.0.0.1.12345 > 10.0.0.2.12345: UDP, length 16
16:32:26.582969 IP 10.0.0.1.12345 > 10.0.0.2.12345: UDP, length 16
16:32:26.583645 IP 10.0.0.1.12345 > 10.0.0.2.12345: UDP, length 16
16:32:26.584324 IP 10.0.0.1.12345 > 10.0.0.2.12345: UDP, length 16
16:32:26.584999 IP 10.0.0.1.12345 > 10.0.0.2.12345: UDP, length 16
16:32:26.585674 IP 10.0.0.1.12345 > 10.0.0.2.12345: UDP, length 16
16:32:26.586350 IP 10.0.0.1.12345 > 10.0.0.2.12345: UDP, length 16
16:32:26.587024 IP 10.0.0.1.12345 > 10.0.0.2.12345: UDP, length 16
16:32:26.587699 IP 10.0.0.1.12345 > 10.0.0.2.12345: UDP, length 16
16:32:26.588376 IP 10.0.0.1.12345 > 10.0.0.2.12345: UDP, length 16
16:32:26.589051 IP 10.0.0.1.12345 > 10.0.0.2.12345: UDP, length 16
16:32:26.589730 IP 10.0.0.1.12345 > 10.0.0.2.12345: UDP, length 16
16:32:26.590404 IP 10.0.0.1.12345 > 10.0.0.2.12345: UDP, length 16
16:32:26.591080 IP 10.0.0.1.12345 > 10.0.0.2.12345: UDP, length 16
16:32:26.591755 IP 10.0.0.1.12345 > 10.0.0.2.12345: UDP, length 16
16:32:26.592433 IP 10.0.0.1.12345 > 10.0.0.2.12345: UDP, length 16
16:32:26.593108 IP 10.0.0.1.12345 > 10.0.0.2.12345: UDP, length 16
16:32:26.593785 IP 10.0.0.1.12345 > 10.0.0.2.12345: UDP, length 16
16:32:26.594459 IP 10.0.0.1.12345 > 10.0.0.2.12345: UDP, length 16
16:32:26.595133 IP 10.0.0.1.12345 > 10.0.0.2.12345: UDP, length 16
16:32:26.595810 IP 10.0.0.1.12345 > 10.0.0.2.12345: UDP, length 16
16:32:26.596488 IP 10.0.0.1.12345 > 10.0.0.2.12345: UDP, length 16
16:32:26.597162 IP 10.0.0.1.12345 > 10.0.0.2.12345: UDP, length 16
16:32:26.597837 IP 10.0.0.1.12345 > 10.0.0.2.12345: UDP, length 16
16:32:26.598511 IP 10.0.0.1.12345 > 10.0.0.2.12345: UDP, length 16
16:32:26.599187 IP 10.0.0.1.12345 > 10.0.0.2.12345: UDP, length 16
16:32:26.599862 IP 10.0.0.1.12345 > 10.0.0.2.12345: UDP, length 16
16:32:26.600540 IP 10.0.0.1.12345 > 10.0.0.2.12345: UDP, length 16
16:32:26.601215 IP 10.0.0.1.12345 > 10.0.0.2.12345: UDP, length 16
16:32:26.601890 IP 10.0.0.1.12345 > 10.0.0.2.12345: UDP, length 16
16:32:26.602566 IP 10.0.0.1.12345 > 10.0.0.2.12345: UDP, length 16
16:32:26.603241 IP 10.0.0.1.12345 > 10.0.0.2.12345: UDP, length 16
16:32:26.603916 IP 10.0.0.1.12345 > 10.0.0.2.12345: UDP, length 16
16:32:26.604594 IP 10.0.0.1.12345 > 10.0.0.2.12345: UDP, length 16
16:32:26.605271 IP 10.0.0.1.12345 > 10.0.0.2.12345: UDP, length 16
16:32:26.605945 IP 10.0.0.1.12345 > 10.0.0.2.12345: UDP, length 16
16:32:26.606621 IP 10.0.0.1.12345 > 10.0.0.2.12345: UDP, length 16
16:32:26.607297 IP 10.0.0.1.12345 > 10.0.0.2.12345: UDP, length 16
16:32:26.607972 IP 10.0.0.1.12345 > 10.0.0.2.12345: UDP, length 16
16:32:26.608651 IP 10.0.0.1.12345 > 10.0.0.2.12345: UDP, length 16
16:32:26.609325 IP 10.0.0.1.12345 > 10.0.0.2.12345: UDP, length 16
16:32:26.610001 IP 10.0.0.1.12345 > 10.0.0.2.12345: UDP, length 16
16:32:26.610675 IP 10.0.0.1.12345 > 10.0.0.2.12345: UDP, length 16
16:32:26.611349 IP 10.0.0.1.12345 > 10.0.0.2.12345: UDP, length 16
16:32:26.612025 IP 10.0.0.1.12345 > 10.0.0.2.12345: UDP, length 16
16:32:26.612703 IP 10.0.0.1.12345 > 10.0.0.2.12345: UDP, length 16
16:32:26.613375 IP 10.0.0.1.12345 > 10.0.0.2.12345: UDP, length 16
16:32:26.614046 IP 10.0.0.1.12345 > 10.0.0.2.12345: UDP, length 16
16:32:26.614718 IP 10.0.0.1.12345 > 10.0.0.2.12345: UDP, length 16
16:32:26.615389 IP 10.0.0.1.12345 > 10.0.0.2.12345: UDP, length 16
16:32:26.616062 IP 10.0.0.1.12345 > 10.0.0.2.12345: UDP, length 16
16:32:26.616677 IP 10.0.0.1.12345 > 10.0.0.2.12345: UDP, length 16
16:32:26.617325 IP 10.0.0.1.12345 > 10.0.0.2.12345: UDP, length 16
16:32:26.617979 IP 10.0.0.1.12345 > 10.0.0.2.12345: UDP, length 16
16:32:26.618653 IP 10.0.0.1.12345 > 10.0.0.2.12345: UDP, length 16
16:32:26.619327 IP 10.0.0.1.12345 > 10.0.0.2.12345: UDP, length 16
16:32:26.620002 IP 10.0.0.1.12345 > 10.0.0.2.12345: UDP, length 16
16:32:26.620680 IP 10.0.0.1.12345 > 10.0.0.2.12345: UDP, length 16
16:32:26.621355 IP 10.0.0.1.12345 > 10.0.0.2.12345: UDP, length 16
16:32:26.622031 IP 10.0.0.1.12345 > 10.0.0.2.12345: UDP, length 16
16:32:26.622706 IP 10.0.0.1.12345 > 10.0.0.2.12345: UDP, length 16
16:32:26.623382 IP 10.0.0.1.12345 > 10.0.0.2.12345: UDP, length 16
16:32:26.624056 IP 10.0.0.1.12345 > 10.0.0.2.12345: UDP, length 16
16:32:26.624734 IP 10.0.0.1.12345 > 10.0.0.2.12345: UDP, length 16
16:32:26.625410 IP 10.0.0.1.12345 > 10.0.0.2.12345: UDP, length 16
16:32:26.626085 IP 10.0.0.1.12345 > 10.0.0.2.12345: UDP, length 16
16:32:26.626759 IP 10.0.0.1.12345 > 10.0.0.2.12345: UDP, length 16
16:32:26.627435 IP 10.0.0.1.12345 > 10.0.0.2.12345: UDP, length 16
16:32:26.628110 IP 10.0.0.1.12345 > 10.0.0.2.12345: UDP, length 16
16:32:26.628785 IP 10.0.0.1.12345 > 10.0.0.2.12345: UDP, length 16
16:32:26.629461 IP 10.0.0.1.12345 > 10.0.0.2.12345: UDP, length 16
16:32:26.630136 IP 10.0.0.1.12345 > 10.0.0.2.12345: UDP, length 16
16:32:26.630811 IP 10.0.0.1.12345 > 10.0.0.2.12345: UDP, length 16
16:32:26.631487 IP 10.0.0.1.12345 > 10.0.0.2.12345: UDP, length 16
16:32:26.632161 IP 10.0.0.1.12345 > 10.0.0.2.12345: UDP, length 16
16:32:26.632840 IP 10.0.0.1.12345 > 10.0.0.2.12345: UDP, length 16
16:32:26.633516 IP 10.0.0.1.12345 > 10.0.0.2.12345: UDP, length 16
16:32:26.634191 IP 10.0.0.1.12345 > 10.0.0.2.12345: UDP, length 16
16:32:26.634866 IP 10.0.0.1.12345 > 10.0.0.2.12345: UDP, length 16
16:32:26.635540 IP 10.0.0.1.12345 > 10.0.0.2.12345: UDP, length 16
16:32:26.636216 IP 10.0.0.1.12345 > 10.0.0.2.12345: UDP, length 16
16:32:26.636954 IP 10.0.0.1.12345 > 10.0.0.2.12345: UDP, length 16
16:32:26.637628 IP 10.0.0.1.12345 > 10.0.0.2.12345: UDP, length 16
16:32:26.638302 IP 10.0.0.1.12345 > 10.0.0.2.12345: UDP, length 16
16:32:26.638978 IP 10.0.0.1.12345 > 10.0.0.2.12345: UDP, length 16
16:32:26.639653 IP 10.0.0.1.12345 > 10.0.0.2.12345: UDP, length 16
16:32:26.640331 IP 10.0.0.1.12345 > 10.0.0.2.12345: UDP, length 16
16:32:26.641006 IP 10.0.0.1.12345 > 10.0.0.2.12345: UDP, length 16
16:32:26.641680 IP 10.0.0.1.12345 > 10.0.0.2.12345: UDP, length 16
16:32:26.642355 IP 10.0.0.1.12345 > 10.0.0.2.12345: UDP, length 16
16:32:26.643031 IP 10.0.0.1.12345 > 10.0.0.2.12345: UDP, length 16
16:32:26.643706 IP 10.0.0.1.12345 > 10.0.0.2.12345: UDP, length 16
16:32:26.644386 IP 10.0.0.1.12345 > 10.0.0.2.12345: UDP, length 16
16:32:26.645062 IP 10.0.0.1.12345 > 10.0.0.2.12345: UDP, length 16
16:32:26.645737 IP 10.0.0.1.12345 > 10.0.0.2.12345: UDP, length 16
16:32:26.646411 IP 10.0.0.1.12345 > 10.0.0.2.12345: UDP, length 16
16:32:26.647073 IP 10.0.0.1.12345 > 10.0.0.2.12345: UDP, length 16
16:32:26.647748 IP 10.0.0.1.12345 > 10.0.0.2.12345: UDP, length 16
16:32:26.648426 IP 10.0.0.1.12345 > 10.0.0.2.12345: UDP, length 16
16:32:26.649101 IP 10.0.0.1.12345 > 10.0.0.2.12345: UDP, length 16
16:32:26.649778 IP 10.0.0.1.12345 > 10.0.0.2.12345: UDP, length 16
16:32:26.650452 IP 10.0.0.1.12345 > 10.0.0.2.12345: UDP, length 16
16:32:26.651127 IP 10.0.0.1.12345 > 10.0.0.2.12345: UDP, length 16
16:32:26.651802 IP 10.0.0.1.12345 > 10.0.0.2.12345: UDP, length 16
16:32:26.652481 IP 10.0.0.1.12345 > 10.0.0.2.12345: UDP, length 16
16:32:26.653156 IP 10.0.0.1.12345 > 10.0.0.2.12345: UDP, length 16
16:32:26.653830 IP 10.0.0.1.12345 > 10.0.0.2.12345: UDP, length 16
16:32:26.654507 IP 10.0.0.1.12345 > 10.0.0.2.12345: UDP, length 16
16:32:26.655182 IP 10.0.0.1.12345 > 10.0.0.2.12345: UDP, length 16
16:32:26.655859 IP 10.0.0.1.12345 > 10.0.0.2.12345: UDP, length 16
16:32:26.656537 IP 10.0.0.1.12345 > 10.0.0.2.12345: UDP, length 16
16:32:26.657212 IP 10.0.0.1.12345 > 10.0.0.2.12345: UDP, length 16
16:32:26.657887 IP 10.0.0.1.12345 > 10.0.0.2.12345: UDP, length 16
16:32:26.658561 IP 10.0.0.1.12345 > 10.0.0.2.12345: UDP, length 16
16:32:26.659236 IP 10.0.0.1.12345 > 10.0.0.2.12345: UDP, length 16
16:32:26.659913 IP 10.0.0.1.12345 > 10.0.0.2.12345: UDP, length 16
16:32:26.660591 IP 10.0.0.1.12345 > 10.0.0.2.12345: UDP, length 16
16:32:26.661266 IP 10.0.0.1.12345 > 10.0.0.2.12345: UDP, length 16
16:32:26.661942 IP 10.0.0.1.12345 > 10.0.0.2.12345: UDP, length 16
16:32:26.662616 IP 10.0.0.1.12345 > 10.0.0.2.12345: UDP, length 16
16:32:26.663290 IP 10.0.0.1.12345 > 10.0.0.2.12345: UDP, length 16
16:32:26.663966 IP 10.0.0.1.12345 > 10.0.0.2.12345: UDP, length 16
16:32:26.664645 IP 10.0.0.1.12345 > 10.0.0.2.12345: UDP, length 16
16:32:26.665321 IP 10.0.0.1.12345 > 10.0.0.2.12345: UDP, length 16
16:32:26.665995 IP 10.0.0.1.12345 > 10.0.0.2.12345: UDP, length 16
16:32:26.666671 IP 10.0.0.1.12345 > 10.0.0.2.12345: UDP, length 16
16:32:26.667345 IP 10.0.0.1.12345 > 10.0.0.2.12345: UDP, length 16
16:32:26.668019 IP 10.0.0.1.12345 > 10.0.0.2.12345: UDP, length 16
16:32:26.668698 IP 10.0.0.1.12345 > 10.0.0.2.12345: UDP, length 16
16:32:26.669372 IP 10.0.0.1.12345 > 10.0.0.2.12345: UDP, length 16
16:32:26.670047 IP 10.0.0.1.12345 > 10.0.0.2.12345: UDP, length 16
16:32:26.670722 IP 10.0.0.1.12345 > 10.0.0.2.12345: UDP, length 16
16:32:26.671398 IP 10.0.0.1.12345 > 10.0.0.2.12345: UDP, length 16
16:32:26.672072 IP 10.0.0.1.12345 > 10.0.0.2.12345: UDP, length 16
16:32:26.672750 IP 10.0.0.1.12345 > 10.0.0.2.12345: UDP, length 16
16:32:26.673426 IP 10.0.0.1.12345 > 10.0.0.2.12345: UDP, length 16
16:32:26.674101 IP 10.0.0.1.12345 > 10.0.0.2.12345: UDP, length 16
16:32:26.674776 IP 10.0.0.1.12345 > 10.0.0.2.12345: UDP, length 16
16:32:26.675453 IP 10.0.0.1.12345 > 10.0.0.2.12345: UDP, length 16
16:32:26.676128 IP 10.0.0.1.12345 > 10.0.0.2.12345: UDP, length 16
16:32:26.676803 IP 10.0.0.1.12345 > 10.0.0.2.12345: UDP, length 16
16:32:26.677478 IP 10.0.0.1.12345 > 10.0.0.2.12345: UDP, length 16
16:32:26.678153 IP 10.0.0.1.12345 > 10.0.0.2.12345: UDP, length 16
16:32:26.678828 IP 10.0.0.1.12345 > 10.0.0.2.12345: UDP, length 16
16:32:26.679504 IP 10.0.0.1.12345 > 10.0.0.2.12345: UDP, length 16

