16:32:26.348021 IP 10.0.0.1.12345 > 10.0.0.2.12345: UDP, length 16
16:32:26.348372 IP 10.0.0.1.12345 > 10.0.0.2.12345: UDP, length 16
16:32:26.349046 IP 10.0.0.1.12345 > 10.0.0.2.12345: UDP, length 16
16:32:26.349717 IP 10.0.0.1.12345 > 10.0.0.2.12345: UDP, length 16
16:32:26.350388 IP 10.0.0.1.12345 > 10.0.0.2.12345: UDP, length 16
16:32:26.351059 IP 10.0.0.1.12345 > 10.0.0.2.12345: UDP, length 16
16:32:26.351715 IP 10.0.0.1.12345 > 10.0.0.2.12345: UDP, length 16
16:32:26.352307 IP 10.0.0.1.12345 > 10.0.0.2.12345: UDP, length 16
16:32:26.352973 IP 10.0.0.1.12345 > 10.0.0.2.12345: UDP, length 16
16:32:26.353628 IP 10.0.0.1.12345 > 10.0.0.2.12345: UDP, length 16
16:32:26.354285 IP 10.0.0.1.12345 > 10.0.0.2.12345: UDP, length 16
16:32:26.354946 IP 10.0.0.1.12345 > 10.0.0.2.12345: UDP, length 16
16:32:26.355551 IP 10.0.0.1.12345 > 10.0.0.2.12345: UDP, length 16
16:32:26.356162 IP 10.0.0.1.12345 > 10.0.0.2.12345: UDP, length 16
16:32:26.356762 IP 10.0.0.1.12345 > 10.0.0.2.12345: UDP, length 16
16:32:26.357382 IP 10.0.0.1.12345 > 10.0.0.2.12345: UDP, length 16
16:32:26.358003 IP 10.0.0.1.12345 > 10.0.0.2.12345: UDP, length 16
16:32:26.358625 IP 10.0.0.1.12345 > 10.0.0.2.12345: UDP, length 16
16:32:26.359267 IP 10.0.0.1.12345 > 10.0.0.2.12345: UDP, length 16
16:32:26.359875 IP 10.0.0.1.12345 > 10.0.0.2.12345: UDP, length 16
16:32:26.360501 IP 10.0.0.1.12345 > 10.0.0.2.12345: UDP, length 16
16:32:26.361128 IP 10.0.0.1.12345 > 10.0.0.2.12345: UDP, length 16
16:32:26.361755 IP 10.0.0.1.12345 > 10.0.0.2.12345: UDP, length 16
16:32:26.362382 IP 10.0.0.1.12345 > 10.0.0.2.12345: UDP, length 16
16:32:26.363010 IP 10.0.0.1.12345 > 10.0.0.2.12345: UDP, length 16
16:32:26.363636 IP 10.0.0.1.12345 > 10.0.0.2.12345: UDP, length 16
16:32:26.364266 IP 10.0.0.1.12345 > 10.0.0.2.12345: UDP, length 16
16:32:26.364892 IP 10.0.0.1.12345 > 10.0.0.2.12345: UDP, length 16
16:32:26.365520 IP 10.0.0.1.12345 > 10.0.0.2.12345: UDP, length 16
16:32:26.366147 IP 10.0.0.1.12345 > 10.0.0.2.12345: UDP, length 16
16:32:26.366774 IP 10.0.0.1.12345 > 10.0.0.2.12345: UDP, length 16
16:32:26.367401 IP 10.0.0.1.12345 > 10.0.0.2.12345: UDP, length 16
16:32:26.368031 IP 10.0.0.1.12345 > 10.0.0.2.12345: UDP, length 16
16:32:26.368683 IP 10.0.0.1.12345 > 10.0.0.2.12345: UDP, length 16
16:32:26.369334 IP 10.0.0.1.12345 > 10.0.0.2.12345: UDP, length 16
16:32:26.369982 IP 10.0.0.1.12345 > 10.0.0.2.12345: UDP, length 16
16:32:26.370633 IP 10.0.0.1.12345 > 10.0.0.2.12345: UDP, length 16
16:32:26.371284 IP 10.0.0.1.12345 > 10.0.0.2.12345: UDP, length 16
16:32:26.371932 IP 10.0.0.1.12345 > 10.0.0.2.12345: UDP, length 16
16:32:26.372582 IP 10.0.0.1.12345 > 10.0.0.2.12345: UDP, length 16
16:32:26.373231 IP 10.0.0.1.12345 > 10.0.0.2.12345: UDP, length 16
16:32:26.373880 IP 10.0.0.1.12345 > 10.0.0.2.12345: UDP, length 16
16:32:26.374531 IP 10.0.0.1.12345 > 10.0.0.2.12345: UDP, length 16
16:32:26.375180 IP 10.0.0.1.12345 > 10.0.0.2.12345: UDP, length 16
16:32:26.375829 IP 10.0.0.1.12345 > 10.0.0.2.12345: UDP, length 16
16:32:26.376466 IP 10.0.0.1.12345 > 10.0.0.2.12345: UDP, length 16
16:32:26.377116 IP 10.0.0.1.12345 > 10.0.0.2.12345: UDP, length 16
16:32:26.377767 IP 10.0.0.1.12345 > 10.0.0.2.12345: UDP, length 16
16:32:26.378415 IP 10.0.0.1.12345 > 10.0.0.2.12345: UDP, length 16
16:32:26.379064 IP 10.0.0.1.12345 > 10.0.0.2.12345: UDP, length 16
16:32:26.379712 IP 10.0.0.1.12345 > 10.0.0.2.12345: UDP, length 16
16:32:26.380348 IP 10.0.0.1.12345 > 10.0.0.2.12345: UDP, length 16
16:32:26.381000 IP 10.0.0.1.12345 > 10.0.0.2.12345: UDP, length 16
16:32:26.381649 IP 10.0.0.1.12345 > 10.0.0.2.12345: UDP, length 16
16:32:26.382298 IP 10.0.0.1.12345 > 10.0.0.2.12345: UDP, length 16
16:32:26.382946 IP 10.0.0.1.12345 > 10.0.0.2.12345: UDP, length 16
16:32:26.383595 IP 10.0.0.1.12345 > 10.0.0.2.12345: UDP, length 16
16:32:26.384293 IP 10.0.0.1.12345 > 10.0.0.2.12345: UDP, length 16
16:32:26.384944 IP 10.0.0.1.12345 > 10.0.0.2.12345: UDP, length 16
16:32:26.385593 IP 10.0.0.1.12345 > 10.0.0.2.12345: UDP, length 16
16:32:26.386245 IP 10.0.0.1.12345 > 10.0.0.2.12345: UDP, length 16
16:32:26.386893 IP 10.0.0.1.12345 > 10.0.0.2.12345: UDP, length 16
16:32:26.387542 IP 10.0.0.1.12345 > 10.0.0.2.12345: UDP, length 16
16:32:26.388192 IP 10.0.0.1.12345 > 10.0.0.2.12345: UDP, length 16
16:32:26.388841 IP 10.0.0.1.12345 > 10.0.0.2.12345: UDP, length 16
16:32:26.389491 IP 10.0.0.1.12345 > 10.0.0.2.12345: UDP, length 16
16:32:26.390140 IP 10.0.0.1.12345 > 10.0.0.2.12345: UDP, length 16
16:32:26.390788 IP 10.0.0.1.12345 > 10.0.0.2.12345: UDP, length 16
16:32:26.391439 IP 10.0.0.1.12345 > 10.0.0.2.12345: UDP, length 16
16:32:26.392087 IP 10.0.0.1.12345 > 10.0.0.2.12345: UDP, length 16
16:32:26.392736 IP 10.0.0.1.12345 > 10.0.0.2.12345: UDP, length 16
16:32:26.393387 IP 10.0.0.1.12345 > 10.0.0.2.12345: UDP, length 16
16:32:26.394036 IP 10.0.0.1.12345 > 10.0.0.2.12345: UDP, length 16
16:32:26.394684 IP 10.0.0.1.12345 > 10.0.0.2.12345: UDP, length 16
16:32:26.395332 IP 10.0.0.1.12345 > 10.0.0.2.12345: UDP, length 16
16:32:26.395982 IP 10.0.0.1.12345 > 10.0.0.2.12345: UDP, length 16
16:32:26.396632 IP 10.0.0.1.12345 > 10.0.0.2.12345: UDP, length 16
16:32:26.397283 IP 10.0.0.1.12345 > 10.0.0.2.12345: UDP, length 16
16:32:26.397932 IP 10.0.0.1.12345 > 10.0.0.2.12345: UDP, length 16
16:32:26.398584 IP 10.0.0.1.12345 > 10.0.0.2.12345: UDP, length 16
16:32:26.399234 IP 10.0.0.1.12345 > 10.0.0.2.12345: UDP, length 16
16:32:26.399883 IP 10.0.0.1.12345 > 10.0.0.2.12345: UDP, length 16
16:32:26.400533 IP 10.0.0.1.12345 > 10.0.0.2.12345: UDP, length 16
16:32:26.401181 IP 10.0.0.1.12345 > 10.0.0.2.12345: UDP, length 16
16:32:26.401830 IP 10.0.0.1.12345 > 10.0.0.2.12345: UDP, length 16
16:32:26.402480 IP 10.0.0.1.12345 > 10.0.0.2.12345: UDP, length 16
16:32:26.403128 IP 10.0.0.1.12345 > 10.0.0.2.12345: UDP, length 16
16:32:26.403779 IP 10.0.0.1.12345 > 10.0.0.2.12345: UDP, length 16
16:32:26.404400 IP 10.0.0.1.12345 > 10.0.0.2.12345: UDP, length 16
16:32:26.405048 IP 10.0.0.1.12345 > 10.0.0.2.12345: UDP, length 16
16:32:26.405697 IP 10.0.0.1.12345 > 10.0.0.2.12345: UDP, length 16
16:32:26.406347 IP 10.0.0.1.12345 > 10.0.0.2.12345: UDP, length 16
16:32:26.406982 IP 10.0.0.1.12345 > 10.0.0.2.12345: UDP, length 16
16:32:26.407631 IP 10.0.0.1.12345 > 10.0.0.2.12345: UDP, length 16
16:32:26.408287 IP 10.0.0.1.12345 > 10.0.0.2.12345: UDP, length 16
16:32:26.408936 IP 10.0.0.1.12345 > 10.0.0.2.12345: UDP, length 16
16:32:26.409586 IP 10.0.0.1.12345 > 10.0.0.2.12345: UDP, length 16
16:32:26.410234 IP 10.0.0.1.12345 > 10.0.0.2.12345: UDP, length 16
16:32:26.410883 IP 10.0.0.1.12345 > 10.0.0.2.12345: UDP, length 16
16:32:26.411532 IP 10.0.0.1.12345 > 10.0.0.2.12345: UDP, length 16
16:32:26.412188 IP 10.0.0.1.12345 > 10.0.0.2.12345: UDP, length 16
16:32:26.412852 IP 10.0.0.1.12345 > 10.0.0.2.12345: UDP, length 16
16:32:26.413516 IP 10.0.0.1.12345 > 10.0.0.2.12345: UDP, length 16
16:32:26.414179 IP 10.0.0.1.12345 > 10.0.0.2.12345: UDP, length 16
16:32:26.414843 IP 10.0.0.1.12345 > 10.0.0.2.12345: UDP, length 16
16:32:26.415507 IP 10.0.0.1.12345 > 10.0.0.2.12345: UDP, length 16
16:32:26.416171 IP 10.0.0.1.12345 > 10.0.0.2.12345: UDP, length 16
16:32:26.416836 IP 10.0.0.1.12345 > 10.0.0.2.12345: UDP, length 16
16:32:26.417502 IP 10.0.0.1.12345 > 10.0.0.2.12345: UDP, length 16
16:32:26.418165 IP 10.0.0.1.12345 > 10.0.0.2.12345: UDP, length 16
16:32:26.418828 IP 10.0.0.1.12345 > 10.0.0.2.12345: UDP, length 16
16:32:26.419495 IP 10.0.0.1.12345 > 10.0.0.2.12345: UDP, length 16
16:32:26.420159 IP 10.0.0.1.12345 > 10.0.0.2.12345: UDP, length 16
16:32:26.420824 IP 10.0.0.1.12345 > 10.0.0.2.12345: UDP, length 16
16:32:26.421486 IP 10.0.0.1.12345 > 10.0.0.2.12345: UDP, length 16
16:32:26.422147 IP 10.0.0.1.12345 > 10.0.0.2.12345: UDP, length 16
16:32:26.422810 IP 10.0.0.1.12345 > 10.0.0.2.12345: UDP, length 16
16:32:26.423471 IP 10.0.0.1.12345 > 10.0.0.2.12345: UDP, length 16
16:32:26.424133 IP 10.0.0.1.12345 > 10.0.0.2.12345: UDP, length 16
16:32:26.424757 IP 10.0.0.1.12345 > 10.0.0.2.12345: UDP, length 16
16:32:26.425418 IP 10.0.0.1.12345 > 10.0.0.2.12345: UDP, length 16
16:32:26.426083 IP 10.0.0.1.12345 > 10.0.0.2.12345: UDP, length 16
16:32:26.426746 IP 10.0.0.1.12345 > 10.0.0.2.12345: UDP, length 16
16:32:26.427410 IP 10.0.0.1.12345 > 10.0.0.2.12345: UDP, length 16
16:32:26.428074 IP 10.0.0.1.12345 > 10.0.0.2.12345: UDP, length 16
16:32:26.428738 IP 10.0.0.1.12345 > 10.0.0.2.12345: UDP, length 16
16:32:26.429403 IP 10.0.0.1.12345 > 10.0.0.2.12345: UDP, length 16
16:32:26.430059 IP 10.0.0.1.12345 > 10.0.0.2.12345: UDP, length 16
16:32:26.430716 IP 10.0.0.1.12345 > 10.0.0.2.12345: UDP, length 16
16:32:26.431371 IP 10.0.0.1.12345 > 10.0.0.2.12345: UDP, length 16
16:32:26.432027 IP 10.0.0.1.12345 > 10.0.0.2.12345: UDP, length 16
16:32:26.432686 IP 10.0.0.1.12345 > 10.0.0.2.12345: UDP, length 16
16:32:26.433341 IP 10.0.0.1.12345 > 10.0.0.2.12345: UDP, length 16
16:32:26.433996 IP 10.0.0.1.12345 > 10.0.0.2.12345: UDP, length 16
16:32:26.434652 IP 10.0.0.1.12345 > 10.0.0.2.12345: UDP, length 16
16:32:26.435307 IP 10.0.0.1.12345 > 10.0.0.2.12345: UDP, length 16
16:32:26.435963 IP 10.0.0.1.12345 > 10.0.0.2.12345: UDP, length 16
16:32:26.436622 IP 10.0.0.1.12345 > 10.0.0.2.12345: UDP, length 16
16:32:26.437279 IP 10.0.0.1.12345 > 10.0.0.2.12345: UDP, length 16
16:32:26.437933 IP 10.0.0.1.12345 > 10.0.0.2.12345: UDP, length 16
16:32:26.438591 IP 10.0.0.1.12345 > 10.0.0.2.12345: UDP, length 16
16:32:26.439248 IP 10.0.0.1.12345 > 10.0.0.2.12345: UDP, length 16
16:32:26.439902 IP 10.0.0.1.12345 > 10.0.0.2.12345: UDP, length 16
16:32:26.440562 IP 10.0.0.1.12345 > 10.0.0.2.12345: UDP, length 16
16:32:26.441217 IP 10.0.0.1.12345 > 10.0.0.2.12345: UDP, length 16
16:32:26.441873 IP 10.0.0.1.12345 > 10.0.0.2.12345: UDP, length 16
16:32:26.442528 IP 10.0.0.1.12345 > 10.0.0.2.12345: UDP, length 16
16:32:26.443184 IP 10.0.0.1.12345 > 10.0.0.2.12345: UDP, length 16
16:32:26.443840 IP 10.0.0.1.12345 > 10.0.0.2.12345: UDP, length 16
16:32:26.444498 IP 10.0.0.1.12345 > 10.0.0.2.12345: UDP, length 16
16:32:26.445153 IP 10.0.0.1.12345 > 10.0.0.2.12345: UDP, length 16
16:32:26.445809 IP 10.0.0.1.12345 > 10.0.0.2.12345: UDP, length 16
16:32:26.446404 IP 10.0.0.1.12345 > 10.0.0.2.12345: UDP, length 16
16:32:26.447059 IP 10.0.0.1.12345 > 10.0.0.2.12345: UDP, length 16
16:32:26.447729 IP 10.0.0.1.12345 > 10.0.0.2.12345: UDP, length 16
16:32:26.448388 IP 10.0.0.1.12345 > 10.0.0.2.12345: UDP, length 16
16:32:26.449043 IP 10.0.0.1.12345 > 10.0.0.2.12345: UDP, length 16
16:32:26.449700 IP 10.0.0.1.12345 > 10.0.0.2.12345: UDP, length 16
16:32:26.450355 IP 10.0.0.1.12345 > 10.0.0.2.12345: UDP, length 16
16:32:26.451010 IP 10.0.0.1.12345 > 10.0.0.2.12345: UDP, length 16
16:32:26.451666 IP 10.0.0.1.12345 > 10.0.0.2.12345: UDP, length 16
16:32:26.452325 IP 10.0.0.1.12345 > 10.0.0.2.12345: UDP, length 16
16:32:26.452980 IP 10.0.0.1.12345 > 10.0.0.2.12345: UDP, length 16
16:32:26.453636 IP 10.0.0.1.12345 > 10.0.0.2.12345: UDP, length 16
16:32:26.454292 IP 10.0.0.1.12345 > 10.0.0.2.12345: UDP, length 16
16:32:26.454935 IP 10.0.0.1.12345 > 10.0.0.2.12345: UDP, length 16
16:32:26.455590 IP 10.0.0.1.12345 > 10.0.0.2.12345: UDP, length 16
16:32:26.456284 IP 10.0.0.1.12345 > 10.0.0.2.12345: UDP, length 16
16:32:26.456940 IP 10.0.0.1.12345 > 10.0.0.2.12345: UDP, length 16
16:32:26.457594 IP 10.0.0.1.12345 > 10.0.0.2.12345: UDP, length 16
16:32:26.458250 IP 10.0.0.1.12345 > 10.0.0.2.12345: UDP, length 16
16:32:26.458906 IP 10.0.0.1.12345 > 10.0.0.2.12345: UDP, length 16
16:32:26.459561 IP 10.0.0.1.12345 > 10.0.0.2.12345: UDP, length 16
16:32:26.460226 IP 10.0.0.1.12345 > 10.0.0.2.12345: UDP, length 16
16:32:26.460918 IP 10.0.0.1.12345 > 10.0.0.2.12345: UDP, length 16
16:32:26.461576 IP 10.0.0.1.12345 > 10.0.0.2.12345: UDP, length 16
16:32:26.462231 IP 10.0.0.1.12345 > 10.0.0.2.12345: UDP, length 16
16:32:26.462887 IP 10.0.0.1.12345 > 10.0.0.2.12345: UDP, length 16
16:32:26.463541 IP 10.0.0.1.12345 > 10.0.0.2.12345: UDP, length 16
16:32:26.464196 IP 10.0.0.1.12345 > 10.0.0.2.12345: UDP, length 16
16:32:26.464853 IP 10.0.0.1.12345 > 10.0.0.2.12345: UDP, length 16
16:32:26.465508 IP 10.0.0.1.12345 > 10.0.0.2.12345: UDP, length 16
16:32:26.466164 IP 10.0.0.1.12345 > 10.0.0.2.12345: UDP, length 16
16:32:26.466820 IP 10.0.0.1.12345 > 10.0.0.2.12345: UDP, length 16
16:32:26.467476 IP 10.0.0.1.12345 > 10.0.0.2.12345: UDP, length 16
16:32:26.468132 IP 10.0.0.1.12345 > 10.0.0.2.12345: UDP, length 16
16:32:26.468797 IP 10.0.0.1.12345 > 10.0.0.2.12345: UDP, length 16
16:32:26.469463 IP 10.0.0.1.12345 > 10.0.0.2.12345: UDP, length 16
16:32:26.470128 IP 10.0.0.1.12345 > 10.0.0.2.12345: UDP, length 16
16:32:26.470793 IP 10.0.0.1.12345 > 10.0.0.2.12345: UDP, length 16
16:32:26.471444 IP 10.0.0.1.12345 > 10.0.0.2.12345: UDP, length 16
16:32:26.472110 IP 10.0.0.1.12345 > 10.0.0.2.12345: UDP, length 16
16:32:26.472775 IP 10.0.0.1.12345 > 10.0.0.2.12345: UDP, length 16
16:32:26.473443 IP 10.0.0.1.12345 > 10.0.0.2.12345: UDP, length 16
16:32:26.474107 IP 10.0.0.1.12345 > 10.0.0.2.12345: UDP, length 16
16:32:26.474771 IP 10.0.0.1.12345 > 10.0.0.2.12345: UDP, length 16
16:32:26.475436 IP 10.0.0.1.12345 > 10.0.0.2.12345: UDP, length 16
16:32:26.476100 IP 10.0.0.1.12345 > 10.0.0.2.12345: UDP, length 16
16:32:26.476767 IP 10.0.0.1.12345 > 10.0.0.2.12345: UDP, length 16
16:32:26.477431 IP 10.0.0.1.12345 > 10.0.0.2.12345: UDP, length 16
16:32:26.478095 IP 10.0.0.1.12345 > 10.0.0.2.12345: UDP, length 16
16:32:26.478760 IP 10.0.0.1.12345 > 10.0.0.2.12345: UDP, length 16
16:32:26.479425 IP 10.0.0.1.12345 > 10.0.0.2.12345: UDP, length 16
16:32:26.480090 IP 10.0.0.1.12345 > 10.0.0.2.12345: UDP, length 16
16:32:26.480755 IP 10.0.0.1.12345 > 10.0.0.2.12345: UDP, length 16
16:32:26.481420 IP 10.0.0.1.12345 > 10.0.0.2.12345: UDP, length 16
16:32:26.482086 IP 10.0.0.1.12345 > 10.0.0.2.12345: UDP, length 16
16:32:26.482750 IP 10.0.0.1.12345 > 10.0.0.2.12345: UDP, length 16
16:32:26.483415 IP 10.0.0.1.12345 > 10.0.0.2.12345: UDP, length 16
16:32:26.484081 IP 10.0.0.1.12345 > 10.0.0.2.12345: UDP, length 16
16:32:26.484748 IP 10.0.0.1.12345 > 10.0.0.2.12345: UDP, length 16
16:32:26.485413 IP 10.0.0.1.12345 > 10.0.0.2.12345: UDP, length 16
16:32:26.486079 IP 10.0.0.1.12345 > 10.0.0.2.12345: UDP, length 16
16:32:26.486744 IP 10.0.0.1.12345 > 10.0.0.2.12345: UDP, length 16
16:32:26.487409 IP 10.0.0.1.12345 > 10.0.0.2.12345: UDP, length 16
16:32:26.488073 IP 10.0.0.1.12345 > 10.0.0.2.12345: UDP, length 16
16:32:26.488739 IP 10.0.0.1.12345 > 10.0.0.2.12345: UDP, length 16
16:32:26.489402 IP 10.0.0.1.12345 > 10.0.0.2.12345: UDP, length 16
16:32:26.490066 IP 10.0.0.1.12345 > 10.0.0.2.12345: UDP, length 16
16:32:26.490732 IP 10.0.0.1.12345 > 10.0.0.2.12345: UDP, length 16
16:32:26.491398 IP 10.0.0.1.12345 > 10.0.0.2.12345: UDP, length 16
16:32:26.492063 IP 10.0.0.1.12345 > 10.0.0.2.12345: UDP, length 16
16:32:26.492729 IP 10.0.0.1.12345 > 10.0.0.2.12345: UDP, length 16
16:32:26.493394 IP 10.0.0.1.12345 > 10.0.0.2.12345: UDP, length 16
16:32:26.494060 IP 10.0.0.1.12345 > 10.0.0.2.12345: UDP, length 16
16:32:26.494728 IP 10.0.0.1.12345 > 10.0.0.2.12345: UDP, length 16
16:32:26.495388 IP 10.0.0.1.12345 > 10.0.0.2.12345: UDP, length 16
16:32:26.496016 IP 10.0.0.1.12345 > 10.0.0.2.12345: UDP, length 16
16:32:26.496681 IP 10.0.0.1.12345 > 10.0.0.2.12345: UDP, length 16
16:32:26.497346 IP 10.0.0.1.12345 > 10.0.0.2.12345: UDP, length 16
16:32:26.498011 IP 10.0.0.1.12345 > 10.0.0.2.12345: UDP, length 16
16:32:26.498676 IP 10.0.0.1.12345 > 10.0.0.2.12345: UDP, length 16
16:32:26.499341 IP 10.0.0.1.12345 > 10.0.0.2.12345: UDP, length 16
16:32:26.500006 IP 10.0.0.1.12345 > 10.0.0.2.12345: UDP, length 16
16:32:26.500674 IP 10.0.0.1.12345 > 10.0.0.2.12345: UDP, length 16
16:32:26.501338 IP 10.0.0.1.12345 > 10.0.0.2.12345: UDP, length 16
16:32:26.502002 IP 10.0.0.1.12345 > 10.0.0.2.12345: UDP, length 16
16:32:26.502668 IP 10.0.0.1.12345 > 10.0.0.2.12345: UDP, length 16
16:32:26.503333 IP 10.0.0.1.12345 > 10.0.0.2.12345: UDP, length 16
16:32:26.503998 IP 10.0.0.1.12345 > 10.0.0.2.12345: UDP, length 16
16:32:26.504665 IP 10.0.0.1.12345 > 10.0.0.2.12345: UDP, length 16
16:32:26.505330 IP 10.0.0.1.12345 > 10.0.0.2.12345: UDP, length 16
16:32:26.505994 IP 10.0.0.1.12345 > 10.0.0.2.12345: UDP, length 16
16:32:26.506660 IP 10.0.0.1.12345 > 10.0.0.2.12345: UDP, length 16
16:32:26.507323 IP 10.0.0.1.12345 > 10.0.0.2.12345: UDP, length 16
16:32:26.507989 IP 10.0.0.1.12345 > 10.0.0.2.12345: UDP, length 16
16:32:26.508658 IP 10.0.0.1.12345 > 10.0.0.2.12345: UDP, length 16
16:32:26.509322 IP 10.0.0.1.12345 > 10.0.0.2.12345: UDP, length 16
16:32:26.509986 IP 10.0.0.1.12345 > 10.0.0.2.12345: UDP, length 16
16:32:26.510651 IP 10.0.0.1.12345 > 10.0.0.2.12345: UDP, length 16
16:32:26.511315 IP 10.0.0.1.12345 > 10.0.0.2.12345: UDP, length 16
16:32:26.511979 IP 10.0.0.1.12345 > 10.0.0.2.12345: UDP, length 16
16:32:26.512648 IP 10.0.0.1.12345 > 10.0.0.2.12345: UDP, length 16
16:32:26.513312 IP 10.0.0.1.12345 > 10.0.0.2.12345: UDP, length 16
16:32:26.513977 IP 10.0.0.1.12345 > 10.0.0.2.12345: UDP, length 16
16:32:26.514675 IP 10.0.0.1.12345 > 10.0.0.2.12345: UDP, length 16
16:32:26.515350 IP 10.0.0.1.12345 > 10.0.0.2.12345: UDP, length 16
16:32:26.516024 IP 10.0.0.1.12345 > 10.0.0.2.12345: UDP, length 16
16:32:26.516702 IP 10.0.0.1.12345 > 10.0.0.2.12345: UDP, length 16
16:32:26.517377 IP 10.0.0.1.12345 > 10.0.0.2.12345: UDP, length 16
16:32:26.518053 IP 10.0.0.1.12345 > 10.0.0.2.12345: UDP, length 16
16:32:26.518730 IP 10.0.0.1.12345 > 10.0.0.2.12345: UDP, length 16
16:32:26.519405 IP 10.0.0.1.12345 > 10.0.0.2.12345: UDP, length 16
16:32:26.520080 IP 10.0.0.1.12345 > 10.0.0.2.12345: UDP, length 16
16:32:26.520759 IP 10.0.0.1.12345 > 10.0.0.2.12345: UDP, length 16
16:32:26.521434 IP 10.0.0.1.12345 > 10.0.0.2.12345: UDP, length 16
16:32:26.522108 IP 10.0.0.1.12345 > 10.0.0.2.12345: UDP, length 16
16:32:26.522782 IP 10.0.0.1.12345 > 10.0.0.2.12345: UDP, length 16
16:32:26.523458 IP 10.0.0.1.12345 > 10.0.0.2.12345: UDP, length 16
16:32:26.524133 IP 10.0.0.1.12345 > 10.0.0.2.12345: UDP, length 16
16:32:26.524808 IP 10.0.0.1.12345 > 10.0.0.2.12345: UDP, length 16
16:32:26.525482 IP 10.0.0.1.12345 > 10.0.0.2.12345: UDP, length 16
16:32:26.526160 IP 10.0.0.1.12345 > 10.0.0.2.12345: UDP, length 16
16:32:26.526834 IP 10.0.0.1.12345 > 10.0.0.2.12345: UDP, length 16
16:32:26.527510 IP 10.0.0.1.12345 > 10.0.0.2.12345: UDP, length 16
16:32:26.528184 IP 10.0.0.1.12345 > 10.0.0.2.12345: UDP, length 16
16:32:26.528862 IP 10.0.0.1.12345 > 10.0.0.2.12345: UDP, length 16
16:32:26.529537 IP 10.0.0.1.12345 > 10.0.0.2.12345: UDP, length 16
16:32:26.530212 IP 10.0.0.1.12345 > 10.0.0.2.12345: UDP, length 16
16:32:26.530887 IP 10.0.0.1.12345 > 10.0.0.2.12345: UDP, length 16
16:32:26.531562 IP 10.0.0.1.12345 > 10.0.0.2.12345: UDP, length 16
16:32:26.532289 IP 10.0.0.1.12345 > 10.0.0.2.12345: UDP, length 16
16:32:26.532965 IP 10.0.0.1.12345 > 10.0.0.2.12345: UDP, length 16
16:32:26.533641 IP 10.0.0.1.12345 > 10.0.0.2.12345: UDP, length 16
16:32:26.534316 IP 10.0.0.1.12345 > 10.0.0.2.12345: UDP, length 16
16:32:26.534979 IP 10.0.0.1.12345 > 10.0.0.2.12345: UDP, length 16
16:32:26.535654 IP 10.0.0.1.12345 > 10.0.0.2.12345: UDP, length 16
16:32:26.536332 IP 10.0.0.1.12345 > 10.0.0.2.12345: UDP, length 16
16:32:26.537006 IP 10.0.0.1.12345 > 10.0.0.2.12345: UDP, length 16
16:32:26.537686 IP 10.0.0.1.12345 > 10.0.0.2.12345: UDP, length 16
16:32:26.538360 IP 10.0.0.1.12345 > 10.0.0.2.12345: UDP, length 16
16:32:26.539035 IP 10.0.0.1.12345 > 10.0.0.2.12345: UDP, length 16
16:32:26.539710 IP 10.0.0.1.12345 > 10.0.0.2.12345: UDP, length 16
16:32:26.540388 IP 10.0.0.1.12345 > 10.0.0.2.12345: UDP, length 16
16:32:26.541062 IP 10.0.0.1.12345 > 10.0.0.2.12345: UDP, length 16
16:32:26.541737 IP 10.0.0.1.12345 > 10.0.0.2.12345: UDP, length 16
16:32:26.542412 IP 10.0.0.1.12345 > 10.0.0.2.12345: UDP, length 16
16:32:26.543087 IP 10.0.0.1.12345 > 10.0.0.2.12345: UDP, length 16
16:32:26.543762 IP 10.0.0.1.12345 > 10.0.0.2.12345: UDP, length 16
16:32:26.544441 IP 10.0.0.1.12345 > 10.0.0.2.12345: UDP, length 16
16:32:26.545116 IP 10.0.0.1.12345 > 10.0.0.2.12345: UDP, length 16
16:32:26.545791 IP 10.0.0.1.12345 > 10.0.0.2.12345: UDP, length 16
16:32:26.546466 IP 10.0.0.1.12345 > 10.0.0.2.12345: UDP, length 16
16:32:26.547141 IP 10.0.0.1.12345 > 10.0.0.2.12345: UDP, length 16
16:32:26.547815 IP 10.0.0.1.12345 > 10.0.0.2.12345: UDP, length 16
16:32:26.548493 IP 10.0.0.1.12345 > 10.0.0.2.12345: UDP, length 16
16:32:26.549168 IP 10.0.0.1.12345 > 10.0.0.2.12345: UDP, length 16
16:32:26.549844 IP 10.0.0.1.12345 > 10.0.0.2.12345: UDP, length 16
16:32:26.550518 IP 10.0.0.1.12345 > 10.0.0.2.12345: UDP, length 16
16:32:26.551192 IP 10.0.0.1.12345 > 10.0.0.2.12345: UDP, length 16
16:32:26.551867 IP 10.0.0.1.12345 > 10.0.0.2.12345: UDP, length 16
16:32:26.552544 IP 10.0.0.1.12345 > 10.0.0.2.12345: UDP, length 16
16:32:26.553221 IP 10.0.0.1.12345 > 10.0.0.2.12345: UDP, length 16
16:32:26.553898 IP 10.0.0.1.12345 > 10.0.0.2.12345: UDP, length 16
16:32:26.554573 IP 10.0.0.1.12345 > 10.0.0.2.12345: UDP, length 16
16:32:26.555247 IP 10.0.0.1.12345 > 10.0.0.2.12345: UDP, length 16
16:32:26.555922 IP 10.0.0.1.12345 > 10.0.0.2.12345: UDP, length 16
16:32:26.556601 IP 10.0.0.1.12345 > 10.0.0.2.12345: UDP, length 16
16:32:26.557277 IP 10.0.0.1.12345 > 10.0.0.2.12345: UDP, length 16
16:32:26.557951 IP 10.0.0.1.12345 > 10.0.0.2.12345: UDP, length 16
16:32:26.558626 IP 10.0.0.1.12345 > 10.0.0.2.12345: UDP, length 16
16:32:26.559301 IP 10.0.0.1.12345 > 10.0.0.2.12345: UDP, length 16
16:32:26.559975 IP 10.0.0.1.12345 > 10.0.0.2.12345: UDP, length 16
16:32:26.560657 IP 10.0.0.1.12345 > 10.0.0.2.12345: UDP, length 16
16:32:26.561332 IP 10.0.0.1.12345 > 10.0.0.2.12345: UDP, length 16
16:32:26.562006 IP 10.0.0.1.12345 > 10.0.0.2.12345: UDP, length 16
16:32:26.562681 IP 10.0.0.1.12345 > 10.0.0.2.12345: UDP, length 16
16:32:26.563357 IP 10.0.0.1.12345 > 10.0.0.2.12345: UDP, length 16
16:32:26.564031 IP 10.0.0.1.12345 > 10.0.0.2.12345: UDP, length 16
16:32:26.564711 IP 10.0.0.1.12345 > 10.0.0.2.12345: UDP, length 16
16:32:26.565388 IP 10.0.0.1.12345 > 10.0.0.2.12345: UDP, length 16
16:32:26.566063 IP 10.0.0.1.12345 > 10.0.0.2.12345: UDP, length 16
16:32:26.566737 IP 10.0.0.1.12345 > 10.0.0.2.12345: UDP, length 16
16:32:26.567412 IP 10.0.0.1.12345 > 10.0.0.2.12345: UDP, length 16
16:32:26.568087 IP 10.0.0.1.12345 > 10.0.0.2.12345: UDP, length 16
16:32:26.568765 IP 10.0.0.1.12345 > 10.0.0.2.12345: UDP, length 16
16:32:26.569440 IP 10.0.0.1.12345 > 10.0.0.2.12345: UDP, length 16
16:32:26.570115 IP 10.0.0.1.12345 > 10.0.0.2.12345: UDP, length 16
16:32:26.570791 IP 10.0.0.1.12345 > 10.0.0.2.12345: UDP, length 16
16:32:26.571467 IP 10.0.0.1.12345 > 10.0.0.2.12345: UDP, length 16
16:32:26.572142 IP 10.0.0.1.12345 > 10.0.0.2.12345: UDP, length 16
16:32:26.572820 IP 10.0.0.1.12345 > 10.0.0.2.12345: UDP, length 16
16:32:26.573496 IP 10.0.0.1.12345 > 10.0.0.2.12345: UDP, length 16
16:32:26.574170 IP 10.0.0.1.12345 > 10.0.0.2.12345: UDP, length 16
16:32:26.574847 IP 10.0.0.1.12345 > 10.0.0.2.12345: UDP, length 16
16:32:26.575521 IP 10.0.0.1.12345 > 10.0.0.2.12345: UDP, length 16
16:32:26.576196 IP 10.0.0.1.12345 > 10.0.0.2.12345: UDP, length 16
16:32:26.576871 IP 10.0.0.1.12345 > 10.0.0.2.12345: UDP, length 16
16:32:26.577546 IP 10.0.0.1.12345 > 10.0.0.2.12345: UDP, length 16
16:32:26.578221 IP 10.0.0.1.12345 > 10.0.0.2.12345: UDP, length 16
16:32:26.578896 IP 10.0.0.1.12345 > 10.0.0.2.12345: UDP, length 16
16:32:26.579570 IP 10.0.0.1.12345 > 10.0.0.2.12345: UDP, length 16
16:32:26.580293 IP 10.0.0.1.12345 > 10.0.0.2.12345: UDP, length 16
16:32:26.580968 IP 10.0.0.1.12345 > 10.0.0.2.12345: UDP, length 16
16:32:26.581643 IP 10.0.0.1.12345 > 10.0.0.2.12345: UDP, length 16
16:32:26.582317 IP 10.0.0.1.12345 > 10.0.0.2.12345: UDP, length 16
16:32:26.582980 IP 10.0.0.1.12345 > 10.0.0.2.12345: UDP, length 16
16:32:26.583655 IP 10.0.0.1.12345 > 10.0.0.2.12345: UDP, length 16
16:32:26.584334 IP 10.0.0.1.12345 > 10.0.0.2.12345: UDP, length 16
16:32:26.585009 IP 10.0.0.1.12345 > 10.0.0.2.12345: UDP, length 16
16:32:26.585684 IP 10.0.0.1.12345 > 10.0.0.2.12345: UDP, length 16
16:32:26.586360 IP 10.0.0.1.12345 > 10.0.0.2.12345: UDP, length 16
16:32:26.587034 IP 10.0.0.1.12345 > 10.0.0.2.12345: UDP, length 16
16:32:26.587709 IP 10.0.0.1.12345 > 10.0.0.2.12345: UDP, length 16
16:32:26.588387 IP 10.0.0.1.12345 > 10.0.0.2.12345: UDP, length 16
16:32:26.589061 IP 10.0.0.1.12345 > 10.0.0.2.12345: UDP, length 16
16:32:26.589740 IP 10.0.0.1.12345 > 10.0.0.2.12345: UDP, length 16
16:32:26.590414 IP 10.0.0.1.12345 > 10.0.0.2.12345: UDP, length 16
16:32:26.591090 IP 10.0.0.1.12345 > 10.0.0.2.12345: UDP, length 16
16:32:26.591765 IP 10.0.0.1.12345 > 10.0.0.2.12345: UDP, length 16
16:32:26.592443 IP 10.0.0.1.12345 > 10.0.0.2.12345: UDP, length 16
16:32:26.593118 IP 10.0.0.1.12345 > 10.0.0.2.12345: UDP, length 16
16:32:26.593795 IP 10.0.0.1.12345 > 10.0.0.2.12345: UDP, length 16
16:32:26.594469 IP 10.0.0.1.12345 > 10.0.0.2.12345: UDP, length 16
16:32:26.595143 IP 10.0.0.1.12345 > 10.0.0.2.12345: UDP, length 16
16:32:26.595820 IP 10.0.0.1.12345 > 10.0.0.2.12345: UDP, length 16
16:32:26.596498 IP 10.0.0.1.12345 > 10.0.0.2.12345: UDP, length 16
16:32:26.597172 IP 10.0.0.1.12345 > 10.0.0.2.12345: UDP, length 16
16:32:26.597847 IP 10.0.0.1.12345 > 10.0.0.2.12345: UDP, length 16
16:32:26.598521 IP 10.0.0.1.12345 > 10.0.0.2.12345: UDP, length 16
16:32:26.599197 IP 10.0.0.1.12345 > 10.0.0.2.12345: UDP, length 16
16:32:26.599873 IP 10.0.0.1.12345 > 10.0.0.2.12345: UDP, length 16
16:32:26.600550 IP 10.0.0.1.12345 > 10.0.0.2.12345: UDP, length 16
16:32:26.601225 IP 10.0.0.1.12345 > 10.0.0.2.12345: UDP, length 16
16:32:26.601900 IP 10.0.0.1.12345 > 10.0.0.2.12345: UDP, length 16
16:32:26.602576 IP 10.0.0.1.12345 > 10.0.0.2.12345: UDP, length 16
16:32:26.603251 IP 10.0.0.1.12345 > 10.0.0.2.12345: UDP, length 16
16:32:26.603926 IP 10.0.0.1.12345 > 10.0.0.2.12345: UDP, length 16
16:32:26.604605 IP 10.0.0.1.12345 > 10.0.0.2.12345: UDP, length 16
16:32:26.605281 IP 10.0.0.1.12345 > 10.0.0.2.12345: UDP, length 16
16:32:26.605955 IP 10.0.0.1.12345 > 10.0.0.2.12345: UDP, length 16
16:32:26.606631 IP 10.0.0.1.12345 > 10.0.0.2.12345: UDP, length 16
16:32:26.607307 IP 10.0.0.1.12345 > 10.0.0.2.12345: UDP, length 16
16:32:26.607983 IP 10.0.0.1.12345 > 10.0.0.2.12345: UDP, length 16
16:32:26.608661 IP 10.0.0.1.12345 > 10.0.0.2.12345: UDP, length 16
16:32:26.609336 IP 10.0.0.1.12345 > 10.0.0.2.12345: UDP, length 16
16:32:26.610011 IP 10.0.0.1.12345 > 10.0.0.2.12345: UDP, length 16
16:32:26.610685 IP 10.0.0.1.12345 > 10.0.0.2.12345: UDP, length 16
16:32:26.611359 IP 10.0.0.1.12345 > 10.0.0.2.12345: UDP, length 16
16:32:26.612035 IP 10.0.0.1.12345 > 10.0.0.2.12345: UDP, length 16
16:32:26.612714 IP 10.0.0.1.12345 > 10.0.0.2.12345: UDP, length 16
16:32:26.613385 IP 10.0.0.1.12345 > 10.0.0.2.12345: UDP, length 16
16:32:26.614056 IP 10.0.0.1.12345 > 10.0.0.2.12345: UDP, length 16
16:32:26.614728 IP 10.0.0.1.12345 > 10.0.0.2.12345: UDP, length 16
16:32:26.615400 IP 10.0.0.1.12345 > 10.0.0.2.12345: UDP, length 16
16:32:26.616072 IP 10.0.0.1.12345 > 10.0.0.2.12345: UDP, length 16
16:32:26.616684 IP 10.0.0.1.12345 > 10.0.0.2.12345: UDP, length 16
16:32:26.617334 IP 10.0.0.1.12345 > 10.0.0.2.12345: UDP, length 16
16:32:26.617988 IP 10.0.0.1.12345 > 10.0.0.2.12345: UDP, length 16
16:32:26.618663 IP 10.0.0.1.12345 > 10.0.0.2.12345: UDP, length 16
16:32:26.619337 IP 10.0.0.1.12345 > 10.0.0.2.12345: UDP, length 16
16:32:26.620013 IP 10.0.0.1.12345 > 10.0.0.2.12345: UDP, length 16
16:32:26.620690 IP 10.0.0.1.12345 > 10.0.0.2.12345: UDP, length 16
16:32:26.621365 IP 10.0.0.1.12345 > 10.0.0.2.12345: UDP, length 16
16:32:26.622041 IP 10.0.0.1.12345 > 10.0.0.2.12345: UDP, length 16
16:32:26.622716 IP 10.0.0.1.12345 > 10.0.0.2.12345: UDP, length 16
16:32:26.623392 IP 10.0.0.1.12345 > 10.0.0.2.12345: UDP, length 16
16:32:26.624067 IP 10.0.0.1.12345 > 10.0.0.2.12345: UDP, length 16
16:32:26.624744 IP 10.0.0.1.12345 > 10.0.0.2.12345: UDP, length 16
16:32:26.625420 IP 10.0.0.1.12345 > 10.0.0.2.12345: UDP, length 16
16:32:26.626095 IP 10.0.0.1.12345 > 10.0.0.2.12345: UDP, length 16
16:32:26.626770 IP 10.0.0.1.12345 > 10.0.0.2.12345: UDP, length 16
16:32:26.627446 IP 10.0.0.1.12345 > 10.0.0.2.12345: UDP, length 16
16:32:26.628120 IP 10.0.0.1.12345 > 10.0.0.2.12345: UDP, length 16
16:32:26.628796 IP 10.0.0.1.12345 > 10.0.0.2.12345: UDP, length 16
16:32:26.629471 IP 10.0.0.1.12345 > 10.0.0.2.12345: UDP, length 16
16:32:26.630146 IP 10.0.0.1.12345 > 10.0.0.2.12345: UDP, length 16
16:32:26.630821 IP 10.0.0.1.12345 > 10.0.0.2.12345: UDP, length 16
16:32:26.631497 IP 10.0.0.1.12345 > 10.0.0.2.12345: UDP, length 16
16:32:26.632171 IP 10.0.0.1.12345 > 10.0.0.2.12345: UDP, length 16
16:32:26.632850 IP 10.0.0.1.12345 > 10.0.0.2.12345: UDP, length 16
16:32:26.633526 IP 10.0.0.1.12345 > 10.0.0.2.12345: UDP, length 16
16:32:26.634201 IP 10.0.0.1.12345 > 10.0.0.2.12345: UDP, length 16
16:32:26.634876 IP 10.0.0.1.12345 > 10.0.0.2.12345: UDP, length 16
16:32:26.635551 IP 10.0.0.1.12345 > 10.0.0.2.12345: UDP, length 16
16:32:26.636238 IP 10.0.0.1.12345 > 10.0.0.2.12345: UDP, length 16
16:32:26.636964 IP 10.0.0.1.12345 > 10.0.0.2.12345: UDP, length 16
16:32:26.637638 IP 10.0.0.1.12345 > 10.0.0.2.12345: UDP, length 16
16:32:26.638312 IP 10.0.0.1.12345 > 10.0.0.2.12345: UDP, length 16
16:32:26.638988 IP 10.0.0.1.12345 > 10.0.0.2.12345: UDP, length 16
16:32:26.639663 IP 10.0.0.1.12345 > 10.0.0.2.12345: UDP, length 16
16:32:26.640341 IP 10.0.0.1.12345 > 10.0.0.2.12345: UDP, length 16
16:32:26.641017 IP 10.0.0.1.12345 > 10.0.0.2.12345: UDP, length 16
16:32:26.641690 IP 10.0.0.1.12345 > 10.0.0.2.12345: UDP, length 16
16:32:26.642365 IP 10.0.0.1.12345 > 10.0.0.2.12345: UDP, length 16
16:32:26.643041 IP 10.0.0.1.12345 > 10.0.0.2.12345: UDP, length 16
16:32:26.643716 IP 10.0.0.1.12345 > 10.0.0.2.12345: UDP, length 16
16:32:26.644396 IP 10.0.0.1.12345 > 10.0.0.2.12345: UDP, length 16
16:32:26.645073 IP 10.0.0.1.12345 > 10.0.0.2.12345: UDP, length 16
16:32:26.645747 IP 10.0.0.1.12345 > 10.0.0.2.12345: UDP, length 16
16:32:26.646422 IP 10.0.0.1.12345 > 10.0.0.2.12345: UDP, length 16
16:32:26.647083 IP 10.0.0.1.12345 > 10.0.0.2.12345: UDP, length 16
16:32:26.647758 IP 10.0.0.1.12345 > 10.0.0.2.12345: UDP, length 16
16:32:26.648437 IP 10.0.0.1.12345 > 10.0.0.2.12345: UDP, length 16
16:32:26.649111 IP 10.0.0.1.12345 > 10.0.0.2.12345: UDP, length 16
16:32:26.649788 IP 10.0.0.1.12345 > 10.0.0.2.12345: UDP, length 16
16:32:26.650462 IP 10.0.0.1.12345 > 10.0.0.2.12345: UDP, length 16
16:32:26.651137 IP 10.0.0.1.12345 > 10.0.0.2.12345: UDP, length 16
16:32:26.651812 IP 10.0.0.1.12345 > 10.0.0.2.12345: UDP, length 16
16:32:26.652491 IP 10.0.0.1.12345 > 10.0.0.2.12345: UDP, length 16
16:32:26.653166 IP 10.0.0.1.12345 > 10.0.0.2.12345: UDP, length 16
16:32:26.653841 IP 10.0.0.1.12345 > 10.0.0.2.12345: UDP, length 16
16:32:26.654518 IP 10.0.0.1.12345 > 10.0.0.2.12345: UDP, length 16
16:32:26.655192 IP 10.0.0.1.12345 > 10.0.0.2.12345: UDP, length 16
16:32:26.655869 IP 10.0.0.1.12345 > 10.0.0.2.12345: UDP, length 16
16:32:26.656547 IP 10.0.0.1.12345 > 10.0.0.2.12345: UDP, length 16
16:32:26.657222 IP 10.0.0.1.12345 > 10.0.0.2.12345: UDP, length 16
16:32:26.657897 IP 10.0.0.1.12345 > 10.0.0.2.12345: UDP, length 16
16:32:26.658571 IP 10.0.0.1.12345 > 10.0.0.2.12345: UDP, length 16
16:32:26.659246 IP 10.0.0.1.12345 > 10.0.0.2.12345: UDP, length 16
16:32:26.659923 IP 10.0.0.1.12345 > 10.0.0.2.12345: UDP, length 16
16:32:26.660601 IP 10.0.0.1.12345 > 10.0.0.2.12345: UDP, length 16
16:32:26.661276 IP 10.0.0.1.12345 > 10.0.0.2.12345: UDP, length 16
16:32:26.661952 IP 10.0.0.1.12345 > 10.0.0.2.12345: UDP, length 16
16:32:26.662626 IP 10.0.0.1.12345 > 10.0.0.2.12345: UDP, length 16
16:32:26.663301 IP 10.0.0.1.12345 > 10.0.0.2.12345: UDP, length 16
16:32:26.663976 IP 10.0.0.1.12345 > 10.0.0.2.12345: UDP, length 16
16:32:26.664655 IP 10.0.0.1.12345 > 10.0.0.2.12345: UDP, length 16
16:32:26.665331 IP 10.0.0.1.12345 > 10.0.0.2.12345: UDP, length 16
16:32:26.666006 IP 10.0.0.1.12345 > 10.0.0.2.12345: UDP, length 16
16:32:26.666681 IP 10.0.0.1.12345 > 10.0.0.2.12345: UDP, length 16
16:32:26.667355 IP 10.0.0.1.12345 > 10.0.0.2.12345: UDP, length 16
16:32:26.668030 IP 10.0.0.1.12345 > 10.0.0.2.12345: UDP, length 16
16:32:26.668708 IP 10.0.0.1.12345 > 10.0.0.2.12345: UDP, length 16
16:32:26.669383 IP 10.0.0.1.12345 > 10.0.0.2.12345: UDP, length 16
16:32:26.670057 IP 10.0.0.1.12345 > 10.0.0.2.12345: UDP, length 16
16:32:26.670732 IP 10.0.0.1.12345 > 10.0.0.2.12345: UDP, length 16
16:32:26.671408 IP 10.0.0.1.12345 > 10.0.0.2.12345: UDP, length 16
16:32:26.672082 IP 10.0.0.1.12345 > 10.0.0.2.12345: UDP, length 16
16:32:26.672760 IP 10.0.0.1.12345 > 10.0.0.2.12345: UDP, length 16
16:32:26.673436 IP 10.0.0.1.12345 > 10.0.0.2.12345: UDP, length 16
16:32:26.674111 IP 10.0.0.1.12345 > 10.0.0.2.12345: UDP, length 16
16:32:26.674786 IP 10.0.0.1.12345 > 10.0.0.2.12345: UDP, length 16
16:32:26.675463 IP 10.0.0.1.12345 > 10.0.0.2.12345: UDP, length 16
16:32:26.676138 IP 10.0.0.1.12345 > 10.0.0.2.12345: UDP, length 16
16:32:26.676814 IP 10.0.0.1.12345 > 10.0.0.2.12345: UDP, length 16
16:32:26.677488 IP 10.0.0.1.12345 > 10.0.0.2.12345: UDP, length 16
16:32:26.678163 IP 10.0.0.1.12345 > 10.0.0.2.12345: UDP, length 16
16:32:26.678838 IP 10.0.0.1.12345 > 10.0.0.2.12345: UDP, length 16
16:32:26.679514 IP 10.0.0.1.12345 > 10.0.0.2.12345: UDP, length 16

