09:16:39.540571 IP 10.0.0.1.12345 > 10.0.0.2.12345: UDP, length 16
09:16:40.540910 IP 10.0.0.1.12345 > 10.0.0.2.12345: UDP, length 16
09:16:41.541092 IP 10.0.0.1.12345 > 10.0.0.2.12345: UDP, length 16
09:16:42.541319 IP 10.0.0.1.12345 > 10.0.0.2.12345: UDP, length 16
09:16:43.541571 IP 10.0.0.1.12345 > 10.0.0.2.12345: UDP, length 16
09:16:44.541763 IP 10.0.0.1.12345 > 10.0.0.2.12345: UDP, length 16
09:16:45.541972 IP 10.0.0.1.12345 > 10.0.0.2.12345: UDP, length 16
09:16:46.542228 IP 10.0.0.1.12345 > 10.0.0.2.12345: UDP, length 16
09:16:47.542480 IP 10.0.0.1.12345 > 10.0.0.2.12345: UDP, length 16
09:16:48.542728 IP 10.0.0.1.12345 > 10.0.0.2.12345: UDP, length 16
09:16:49.542981 IP 10.0.0.1.12345 > 10.0.0.2.12345: UDP, length 16
09:16:50.543221 IP 10.0.0.1.12345 > 10.0.0.2.12345: UDP, length 16
09:16:51.543452 IP 10.0.0.1.12345 > 10.0.0.2.12345: UDP, length 16
09:16:52.543807 IP 10.0.0.1.12345 > 10.0.0.2.12345: UDP, length 16
09:16:53.544047 IP 10.0.0.1.12345 > 10.0.0.2.12345: UDP, length 16
09:16:54.544296 IP 10.0.0.1.12345 > 10.0.0.2.12345: UDP, length 16
09:16:55.544551 IP 10.0.0.1.12345 > 10.0.0.2.12345: UDP, length 16
09:16:56.544787 IP 10.0.0.1.12345 > 10.0.0.2.12345: UDP, length 16
09:16:57.545021 IP 10.0.0.1.12345 > 10.0.0.2.12345: UDP, length 16
09:16:58.545273 IP 10.0.0.1.12345 > 10.0.0.2.12345: UDP, length 16
09:16:59.545512 IP 10.0.0.1.12345 > 10.0.0.2.12345: UDP, length 16
09:17:00.545691 IP 10.0.0.1.12345 > 10.0.0.2.12345: UDP, length 16
09:17:01.545931 IP 10.0.0.1.12345 > 10.0.0.2.12345: UDP, length 16
09:17:02.546162 IP 10.0.0.1.12345 > 10.0.0.2.12345: UDP, length 16
09:17:03.546411 IP 10.0.0.1.12345 > 10.0.0.2.12345: UDP, length 16
09:17:04.546667 IP 10.0.0.1.12345 > 10.0.0.2.12345: UDP, length 16
09:17:05.546922 IP 10.0.0.1.12345 > 10.0.0.2.12345: UDP, length 16
09:17:06.547175 IP 10.0.0.1.12345 > 10.0.0.2.12345: UDP, length 16
09:17:07.547407 IP 10.0.0.1.12345 > 10.0.0.2.12345: UDP, length 16
09:17:08.547655 IP 10.0.0.1.12345 > 10.0.0.2.12345: UDP, length 16
09:17:09.547865 IP 10.0.0.1.12345 > 10.0.0.2.12345: UDP, length 16
09:17:10.548041 IP 10.0.0.1.12345 > 10.0.0.2.12345: UDP, length 16
09:17:11.548198 IP 10.0.0.1.12345 > 10.0.0.2.12345: UDP, length 16
09:17:12.548404 IP 10.0.0.1.12345 > 10.0.0.2.12345: UDP, length 16
09:17:13.548584 IP 10.0.0.1.12345 > 10.0.0.2.12345: UDP, length 16
09:17:14.548824 IP 10.0.0.1.12345 > 10.0.0.2.12345: UDP, length 16
09:17:15.549043 IP 10.0.0.1.12345 > 10.0.0.2.12345: UDP, length 16
09:17:16.549286 IP 10.0.0.1.12345 > 10.0.0.2.12345: UDP, length 16
09:17:17.549521 IP 10.0.0.1.12345 > 10.0.0.2.12345: UDP, length 16
09:17:18.549765 IP 10.0.0.1.12345 > 10.0.0.2.12345: UDP, length 16
09:17:19.550010 IP 10.0.0.1.12345 > 10.0.0.2.12345: UDP, length 16
09:17:20.550243 IP 10.0.0.1.12345 > 10.0.0.2.12345: UDP, length 16
09:17:21.550484 IP 10.0.0.1.12345 > 10.0.0.2.12345: UDP, length 16
09:17:22.550734 IP 10.0.0.1.12345 > 10.0.0.2.12345: UDP, length 16
09:17:23.550934 IP 10.0.0.1.12345 > 10.0.0.2.12345: UDP, length 16
09:17:24.551143 IP 10.0.0.1.12345 > 10.0.0.2.12345: UDP, length 16
09:17:25.551393 IP 10.0.0.1.12345 > 10.0.0.2.12345: UDP, length 16
09:17:26.551639 IP 10.0.0.1.12345 > 10.0.0.2.12345: UDP, length 16
09:17:27.551890 IP 10.0.0.1.12345 > 10.0.0.2.12345: UDP, length 16
09:17:28.552136 IP 10.0.0.1.12345 > 10.0.0.2.12345: UDP, length 16
09:17:29.552379 IP 10.0.0.1.12345 > 10.0.0.2.12345: UDP, length 16
09:17:30.552632 IP 10.0.0.1.12345 > 10.0.0.2.12345: UDP, length 16
09:17:31.552862 IP 10.0.0.1.12345 > 10.0.0.2.12345: UDP, length 16
09:17:32.553104 IP 10.0.0.1.12345 > 10.0.0.2.12345: UDP, length 16
09:17:33.553331 IP 10.0.0.1.12345 > 10.0.0.2.12345: UDP, length 16
09:17:34.553573 IP 10.0.0.1.12345 > 10.0.0.2.12345: UDP, length 16
09:17:35.553791 IP 10.0.0.1.12345 > 10.0.0.2.12345: UDP, length 16
09:17:36.554033 IP 10.0.0.1.12345 > 10.0.0.2.12345: UDP, length 16
09:17:37.554271 IP 10.0.0.1.12345 > 10.0.0.2.12345: UDP, length 16
09:17:38.554509 IP 10.0.0.1.12345 > 10.0.0.2.12345: UDP, length 16
09:17:39.554748 IP 10.0.0.1.12345 > 10.0.0.2.12345: UDP, length 16
09:17:40.554994 IP 10.0.0.1.12345 > 10.0.0.2.12345: UDP, length 16
09:17:41.555225 IP 10.0.0.1.12345 > 10.0.0.2.12345: UDP, length 16
09:17:42.555470 IP 10.0.0.1.12345 > 10.0.0.2.12345: UDP, length 16
09:17:43.555652 IP 10.0.0.1.12345 > 10.0.0.2.12345: UDP, length 16
09:17:44.555867 IP 10.0.0.1.12345 > 10.0.0.2.12345: UDP, length 16
09:17:45.556132 IP 10.0.0.1.12345 > 10.0.0.2.12345: UDP, length 16
09:17:46.556355 IP 10.0.0.1.12345 > 10.0.0.2.12345: UDP, length 16
09:17:47.556584 IP 10.0.0.1.12345 > 10.0.0.2.12345: UDP, length 16
09:17:48.556805 IP 10.0.0.1.12345 > 10.0.0.2.12345: UDP, length 16
09:17:49.557021 IP 10.0.0.1.12345 > 10.0.0.2.12345: UDP, length 16
09:17:50.557260 IP 10.0.0.1.12345 > 10.0.0.2.12345: UDP, length 16
09:17:51.557461 IP 10.0.0.1.12345 > 10.0.0.2.12345: UDP, length 16
09:17:52.557703 IP 10.0.0.1.12345 > 10.0.0.2.12345: UDP, length 16
09:17:53.557909 IP 10.0.0.1.12345 > 10.0.0.2.12345: UDP, length 16
09:17:54.558144 IP 10.0.0.1.12345 > 10.0.0.2.12345: UDP, length 16
09:17:55.558367 IP 10.0.0.1.12345 > 10.0.0.2.12345: UDP, length 16
09:17:56.558587 IP 10.0.0.1.12345 > 10.0.0.2.12345: UDP, length 16
09:17:57.558800 IP 10.0.0.1.12345 > 10.0.0.2.12345: UDP, length 16
09:17:58.559042 IP 10.0.0.1.12345 > 10.0.0.2.12345: UDP, length 16
09:17:59.559245 IP 10.0.0.1.12345 > 10.0.0.2.12345: UDP, length 16
09:18:00.559448 IP 10.0.0.1.12345 > 10.0.0.2.12345: UDP, length 16
09:18:01.559640 IP 10.0.0.1.12345 > 10.0.0.2.12345: UDP, length 16
09:18:02.559880 IP 10.0.0.1.12345 > 10.0.0.2.12345: UDP, length 16
09:18:03.560085 IP 10.0.0.1.12345 > 10.0.0.2.12345: UDP, length 16
09:18:04.560283 IP 10.0.0.1.12345 > 10.0.0.2.12345: UDP, length 16
09:18:05.560495 IP 10.0.0.1.12345 > 10.0.0.2.12345: UDP, length 16
09:18:06.560730 IP 10.0.0.1.12345 > 10.0.0.2.12345: UDP, length 16
09:18:07.560941 IP 10.0.0.1.12345 > 10.0.0.2.12345: UDP, length 16
09:18:08.561166 IP 10.0.0.1.12345 > 10.0.0.2.12345: UDP, length 16
09:18:09.561342 IP 10.0.0.1.12345 > 10.0.0.2.12345: UDP, length 16
09:18:10.561526 IP 10.0.0.1.12345 > 10.0.0.2.12345: UDP, length 16
09:18:11.561745 IP 10.0.0.1.12345 > 10.0.0.2.12345: UDP, length 16
09:18:12.561989 IP 10.0.0.1.12345 > 10.0.0.2.12345: UDP, length 16
09:18:13.562233 IP 10.0.0.1.12345 > 10.0.0.2.12345: UDP, length 16
09:18:14.562474 IP 10.0.0.1.12345 > 10.0.0.2.12345: UDP, length 16
09:18:15.562716 IP 10.0.0.1.12345 > 10.0.0.2.12345: UDP, length 16
09:18:16.562954 IP 10.0.0.1.12345 > 10.0.0.2.12345: UDP, length 16
09:18:17.563178 IP 10.0.0.1.12345 > 10.0.0.2.12345: UDP, length 16
09:18:18.563417 IP 10.0.0.1.12345 > 10.0.0.2.12345: UDP, length 16
09:18:19.563663 IP 10.0.0.1.12345 > 10.0.0.2.12345: UDP, length 16
09:18:20.563981 IP 10.0.0.1.12345 > 10.0.0.2.12345: UDP, length 16
09:18:21.564223 IP 10.0.0.1.12345 > 10.0.0.2.12345: UDP, length 16
09:18:22.564467 IP 10.0.0.1.12345 > 10.0.0.2.12345: UDP, length 16
09:18:23.564685 IP 10.0.0.1.12345 > 10.0.0.2.12345: UDP, length 16
09:18:24.564921 IP 10.0.0.1.12345 > 10.0.0.2.12345: UDP, length 16
09:18:25.565165 IP 10.0.0.1.12345 > 10.0.0.2.12345: UDP, length 16
09:18:26.565377 IP 10.0.0.1.12345 > 10.0.0.2.12345: UDP, length 16
09:18:27.565618 IP 10.0.0.1.12345 > 10.0.0.2.12345: UDP, length 16
09:18:28.565861 IP 10.0.0.1.12345 > 10.0.0.2.12345: UDP, length 16
09:18:29.566102 IP 10.0.0.1.12345 > 10.0.0.2.12345: UDP, length 16
09:18:30.566345 IP 10.0.0.1.12345 > 10.0.0.2.12345: UDP, length 16
09:18:31.566588 IP 10.0.0.1.12345 > 10.0.0.2.12345: UDP, length 16
09:18:32.566816 IP 10.0.0.1.12345 > 10.0.0.2.12345: UDP, length 16
09:18:33.567058 IP 10.0.0.1.12345 > 10.0.0.2.12345: UDP, length 16
09:18:34.567307 IP 10.0.0.1.12345 > 10.0.0.2.12345: UDP, length 16
09:18:35.567543 IP 10.0.0.1.12345 > 10.0.0.2.12345: UDP, length 16
09:18:36.567786 IP 10.0.0.1.12345 > 10.0.0.2.12345: UDP, length 16
09:18:37.568034 IP 10.0.0.1.12345 > 10.0.0.2.12345: UDP, length 16
09:18:38.568262 IP 10.0.0.1.12345 > 10.0.0.2.12345: UDP, length 16
09:18:39.568504 IP 10.0.0.1.12345 > 10.0.0.2.12345: UDP, length 16
09:18:40.568752 IP 10.0.0.1.12345 > 10.0.0.2.12345: UDP, length 16
09:18:41.568997 IP 10.0.0.1.12345 > 10.0.0.2.12345: UDP, length 16
09:18:42.569230 IP 10.0.0.1.12345 > 10.0.0.2.12345: UDP, length 16
09:18:43.569474 IP 10.0.0.1.12345 > 10.0.0.2.12345: UDP, length 16
09:18:44.569723 IP 10.0.0.1.12345 > 10.0.0.2.12345: UDP, length 16
09:18:45.569971 IP 10.0.0.1.12345 > 10.0.0.2.12345: UDP, length 16
09:18:46.570176 IP 10.0.0.1.12345 > 10.0.0.2.12345: UDP, length 16
09:18:47.570415 IP 10.0.0.1.12345 > 10.0.0.2.12345: UDP, length 16
09:18:48.570616 IP 10.0.0.1.12345 > 10.0.0.2.12345: UDP, length 16
09:18:49.570813 IP 10.0.0.1.12345 > 10.0.0.2.12345: UDP, length 16
09:18:50.571030 IP 10.0.0.1.12345 > 10.0.0.2.12345: UDP, length 16
09:18:51.571268 IP 10.0.0.1.12345 > 10.0.0.2.12345: UDP, length 16
09:18:52.571516 IP 10.0.0.1.12345 > 10.0.0.2.12345: UDP, length 16
09:18:53.571764 IP 10.0.0.1.12345 > 10.0.0.2.12345: UDP, length 16
09:18:54.572012 IP 10.0.0.1.12345 > 10.0.0.2.12345: UDP, length 16
09:18:55.572242 IP 10.0.0.1.12345 > 10.0.0.2.12345: UDP, length 16
09:18:56.572474 IP 10.0.0.1.12345 > 10.0.0.2.12345: UDP, length 16
09:18:57.572706 IP 10.0.0.1.12345 > 10.0.0.2.12345: UDP, length 16
09:18:58.572949 IP 10.0.0.1.12345 > 10.0.0.2.12345: UDP, length 16
09:18:59.573192 IP 10.0.0.1.12345 > 10.0.0.2.12345: UDP, length 16
09:19:00.573435 IP 10.0.0.1.12345 > 10.0.0.2.12345: UDP, length 16
09:19:01.573679 IP 10.0.0.1.12345 > 10.0.0.2.12345: UDP, length 16
09:19:02.573928 IP 10.0.0.1.12345 > 10.0.0.2.12345: UDP, length 16
09:19:03.574144 IP 10.0.0.1.12345 > 10.0.0.2.12345: UDP, length 16
09:19:04.574375 IP 10.0.0.1.12345 > 10.0.0.2.12345: UDP, length 16
09:19:05.574615 IP 10.0.0.1.12345 > 10.0.0.2.12345: UDP, length 16
09:19:06.574851 IP 10.0.0.1.12345 > 10.0.0.2.12345: UDP, length 16
09:19:07.575094 IP 10.0.0.1.12345 > 10.0.0.2.12345: UDP, length 16
09:19:08.575293 IP 10.0.0.1.12345 > 10.0.0.2.12345: UDP, length 16
09:19:09.575500 IP 10.0.0.1.12345 > 10.0.0.2.12345: UDP, length 16
09:19:10.575730 IP 10.0.0.1.12345 > 10.0.0.2.12345: UDP, length 16
09:19:11.575945 IP 10.0.0.1.12345 > 10.0.0.2.12345: UDP, length 16
09:19:12.576175 IP 10.0.0.1.12345 > 10.0.0.2.12345: UDP, length 16
09:19:13.576420 IP 10.0.0.1.12345 > 10.0.0.2.12345: UDP, length 16
09:19:14.576666 IP 10.0.0.1.12345 > 10.0.0.2.12345: UDP, length 16
09:19:15.576911 IP 10.0.0.1.12345 > 10.0.0.2.12345: UDP, length 16
09:19:16.577159 IP 10.0.0.1.12345 > 10.0.0.2.12345: UDP, length 16
09:19:17.577399 IP 10.0.0.1.12345 > 10.0.0.2.12345: UDP, length 16
09:19:18.577600 IP 10.0.0.1.12345 > 10.0.0.2.12345: UDP, length 16
09:19:19.577840 IP 10.0.0.1.12345 > 10.0.0.2.12345: UDP, length 16
09:19:20.578086 IP 10.0.0.1.12345 > 10.0.0.2.12345: UDP, length 16
09:19:21.578333 IP 10.0.0.1.12345 > 10.0.0.2.12345: UDP, length 16
09:19:22.578508 IP 10.0.0.1.12345 > 10.0.0.2.12345: UDP, length 16
09:19:23.578654 IP 10.0.0.1.12345 > 10.0.0.2.12345: UDP, length 16
09:19:24.578869 IP 10.0.0.1.12345 > 10.0.0.2.12345: UDP, length 16
09:19:25.579059 IP 10.0.0.1.12345 > 10.0.0.2.12345: UDP, length 16
09:19:26.579257 IP 10.0.0.1.12345 > 10.0.0.2.12345: UDP, length 16
09:19:27.579463 IP 10.0.0.1.12345 > 10.0.0.2.12345: UDP, length 16
09:19:28.579658 IP 10.0.0.1.12345 > 10.0.0.2.12345: UDP, length 16
09:19:29.579967 IP 10.0.0.1.12345 > 10.0.0.2.12345: UDP, length 16
09:19:30.580213 IP 10.0.0.1.12345 > 10.0.0.2.12345: UDP, length 16
09:19:31.580462 IP 10.0.0.1.12345 > 10.0.0.2.12345: UDP, length 16
09:19:32.580674 IP 10.0.0.1.12345 > 10.0.0.2.12345: UDP, length 16
09:19:33.580914 IP 10.0.0.1.12345 > 10.0.0.2.12345: UDP, length 16
09:19:34.581148 IP 10.0.0.1.12345 > 10.0.0.2.12345: UDP, length 16
09:19:35.581386 IP 10.0.0.1.12345 > 10.0.0.2.12345: UDP, length 16
09:19:36.581618 IP 10.0.0.1.12345 > 10.0.0.2.12345: UDP, length 16
09:19:37.581861 IP 10.0.0.1.12345 > 10.0.0.2.12345: UDP, length 16
09:19:38.582107 IP 10.0.0.1.12345 > 10.0.0.2.12345: UDP, length 16
09:19:39.582352 IP 10.0.0.1.12345 > 10.0.0.2.12345: UDP, length 16
09:19:40.582551 IP 10.0.0.1.12345 > 10.0.0.2.12345: UDP, length 16
09:19:41.582777 IP 10.0.0.1.12345 > 10.0.0.2.12345: UDP, length 16
09:19:42.583020 IP 10.0.0.1.12345 > 10.0.0.2.12345: UDP, length 16
09:19:43.583265 IP 10.0.0.1.12345 > 10.0.0.2.12345: UDP, length 16
09:19:44.583492 IP 10.0.0.1.12345 > 10.0.0.2.12345: UDP, length 16
09:19:45.583819 IP 10.0.0.1.12345 > 10.0.0.2.12345: UDP, length 16
09:19:46.584067 IP 10.0.0.1.12345 > 10.0.0.2.12345: UDP, length 16
09:19:47.584315 IP 10.0.0.1.12345 > 10.0.0.2.12345: UDP, length 16
09:19:48.584529 IP 10.0.0.1.12345 > 10.0.0.2.12345: UDP, length 16
09:19:49.584756 IP 10.0.0.1.12345 > 10.0.0.2.12345: UDP, length 16
09:19:50.584977 IP 10.0.0.1.12345 > 10.0.0.2.12345: UDP, length 16
09:19:51.585212 IP 10.0.0.1.12345 > 10.0.0.2.12345: UDP, length 16
09:19:52.585435 IP 10.0.0.1.12345 > 10.0.0.2.12345: UDP, length 16
09:19:53.585654 IP 10.0.0.1.12345 > 10.0.0.2.12345: UDP, length 16
09:19:54.585875 IP 10.0.0.1.12345 > 10.0.0.2.12345: UDP, length 16
09:19:55.586118 IP 10.0.0.1.12345 > 10.0.0.2.12345: UDP, length 16
09:19:56.586341 IP 10.0.0.1.12345 > 10.0.0.2.12345: UDP, length 16
09:19:57.586551 IP 10.0.0.1.12345 > 10.0.0.2.12345: UDP, length 16
09:19:58.586771 IP 10.0.0.1.12345 > 10.0.0.2.12345: UDP, length 16

