09:16:39.540934 IP 10.0.0.1.12345 > 10.0.0.2.12345: UDP, length 16
09:16:40.540924 IP 10.0.0.1.12345 > 10.0.0.2.12345: UDP, length 16
09:16:41.541099 IP 10.0.0.1.12345 > 10.0.0.2.12345: UDP, length 16
09:16:42.541333 IP 10.0.0.1.12345 > 10.0.0.2.12345: UDP, length 16
09:16:43.541584 IP 10.0.0.1.12345 > 10.0.0.2.12345: UDP, length 16
09:16:44.541773 IP 10.0.0.1.12345 > 10.0.0.2.12345: UDP, length 16
09:16:45.541986 IP 10.0.0.1.12345 > 10.0.0.2.12345: UDP, length 16
09:16:46.542243 IP 10.0.0.1.12345 > 10.0.0.2.12345: UDP, length 16
09:16:47.542493 IP 10.0.0.1.12345 > 10.0.0.2.12345: UDP, length 16
09:16:48.542743 IP 10.0.0.1.12345 > 10.0.0.2.12345: UDP, length 16
09:16:49.542995 IP 10.0.0.1.12345 > 10.0.0.2.12345: UDP, length 16
09:16:50.543234 IP 10.0.0.1.12345 > 10.0.0.2.12345: UDP, length 16
09:16:51.543464 IP 10.0.0.1.12345 > 10.0.0.2.12345: UDP, length 16
09:16:52.543821 IP 10.0.0.1.12345 > 10.0.0.2.12345: UDP, length 16
09:16:53.544059 IP 10.0.0.1.12345 > 10.0.0.2.12345: UDP, length 16
09:16:54.544310 IP 10.0.0.1.12345 > 10.0.0.2.12345: UDP, length 16
09:16:55.544565 IP 10.0.0.1.12345 > 10.0.0.2.12345: UDP, length 16
09:16:56.544800 IP 10.0.0.1.12345 > 10.0.0.2.12345: UDP, length 16
09:16:57.545034 IP 10.0.0.1.12345 > 10.0.0.2.12345: UDP, length 16
09:16:58.545288 IP 10.0.0.1.12345 > 10.0.0.2.12345: UDP, length 16
09:16:59.545524 IP 10.0.0.1.12345 > 10.0.0.2.12345: UDP, length 16
09:17:00.545698 IP 10.0.0.1.12345 > 10.0.0.2.12345: UDP, length 16
09:17:01.545946 IP 10.0.0.1.12345 > 10.0.0.2.12345: UDP, length 16
09:17:02.546173 IP 10.0.0.1.12345 > 10.0.0.2.12345: UDP, length 16
09:17:03.546427 IP 10.0.0.1.12345 > 10.0.0.2.12345: UDP, length 16
09:17:04.546682 IP 10.0.0.1.12345 > 10.0.0.2.12345: UDP, length 16
09:17:05.546937 IP 10.0.0.1.12345 > 10.0.0.2.12345: UDP, length 16
09:17:06.547190 IP 10.0.0.1.12345 > 10.0.0.2.12345: UDP, length 16
09:17:07.547418 IP 10.0.0.1.12345 > 10.0.0.2.12345: UDP, length 16
09:17:08.547685 IP 10.0.0.1.12345 > 10.0.0.2.12345: UDP, length 16
09:17:09.547872 IP 10.0.0.1.12345 > 10.0.0.2.12345: UDP, length 16
09:17:10.548048 IP 10.0.0.1.12345 > 10.0.0.2.12345: UDP, length 16
09:17:11.548208 IP 10.0.0.1.12345 > 10.0.0.2.12345: UDP, length 16
09:17:12.548419 IP 10.0.0.1.12345 > 10.0.0.2.12345: UDP, length 16
09:17:13.548598 IP 10.0.0.1.12345 > 10.0.0.2.12345: UDP, length 16
09:17:14.548836 IP 10.0.0.1.12345 > 10.0.0.2.12345: UDP, length 16
09:17:15.549057 IP 10.0.0.1.12345 > 10.0.0.2.12345: UDP, length 16
09:17:16.549299 IP 10.0.0.1.12345 > 10.0.0.2.12345: UDP, length 16
09:17:17.549533 IP 10.0.0.1.12345 > 10.0.0.2.12345: UDP, length 16
09:17:18.549778 IP 10.0.0.1.12345 > 10.0.0.2.12345: UDP, length 16
09:17:19.550024 IP 10.0.0.1.12345 > 10.0.0.2.12345: UDP, length 16
09:17:20.550254 IP 10.0.0.1.12345 > 10.0.0.2.12345: UDP, length 16
09:17:21.550499 IP 10.0.0.1.12345 > 10.0.0.2.12345: UDP, length 16
09:17:22.550748 IP 10.0.0.1.12345 > 10.0.0.2.12345: UDP, length 16
09:17:23.550943 IP 10.0.0.1.12345 > 10.0.0.2.12345: UDP, length 16
09:17:24.551160 IP 10.0.0.1.12345 > 10.0.0.2.12345: UDP, length 16
09:17:25.551406 IP 10.0.0.1.12345 > 10.0.0.2.12345: UDP, length 16
09:17:26.551653 IP 10.0.0.1.12345 > 10.0.0.2.12345: UDP, length 16
09:17:27.551903 IP 10.0.0.1.12345 > 10.0.0.2.12345: UDP, length 16
09:17:28.552151 IP 10.0.0.1.12345 > 10.0.0.2.12345: UDP, length 16
09:17:29.552392 IP 10.0.0.1.12345 > 10.0.0.2.12345: UDP, length 16
09:17:30.552646 IP 10.0.0.1.12345 > 10.0.0.2.12345: UDP, length 16
09:17:31.552873 IP 10.0.0.1.12345 > 10.0.0.2.12345: UDP, length 16
09:17:32.553119 IP 10.0.0.1.12345 > 10.0.0.2.12345: UDP, length 16
09:17:33.553342 IP 10.0.0.1.12345 > 10.0.0.2.12345: UDP, length 16
09:17:34.553586 IP 10.0.0.1.12345 > 10.0.0.2.12345: UDP, length 16
09:17:35.553802 IP 10.0.0.1.12345 > 10.0.0.2.12345: UDP, length 16
09:17:36.554049 IP 10.0.0.1.12345 > 10.0.0.2.12345: UDP, length 16
09:17:37.554283 IP 10.0.0.1.12345 > 10.0.0.2.12345: UDP, length 16
09:17:38.554524 IP 10.0.0.1.12345 > 10.0.0.2.12345: UDP, length 16
09:17:39.554760 IP 10.0.0.1.12345 > 10.0.0.2.12345: UDP, length 16
09:17:40.555009 IP 10.0.0.1.12345 > 10.0.0.2.12345: UDP, length 16
09:17:41.555237 IP 10.0.0.1.12345 > 10.0.0.2.12345: UDP, length 16
09:17:42.555486 IP 10.0.0.1.12345 > 10.0.0.2.12345: UDP, length 16
09:17:43.555659 IP 10.0.0.1.12345 > 10.0.0.2.12345: UDP, length 16
09:17:44.555879 IP 10.0.0.1.12345 > 10.0.0.2.12345: UDP, length 16
09:17:45.556146 IP 10.0.0.1.12345 > 10.0.0.2.12345: UDP, length 16
09:17:46.556365 IP 10.0.0.1.12345 > 10.0.0.2.12345: UDP, length 16
09:17:47.556596 IP 10.0.0.1.12345 > 10.0.0.2.12345: UDP, length 16
09:17:48.556816 IP 10.0.0.1.12345 > 10.0.0.2.12345: UDP, length 16
09:17:49.557032 IP 10.0.0.1.12345 > 10.0.0.2.12345: UDP, length 16
09:17:50.557272 IP 10.0.0.1.12345 > 10.0.0.2.12345: UDP, length 16
09:17:51.557472 IP 10.0.0.1.12345 > 10.0.0.2.12345: UDP, length 16
09:17:52.557717 IP 10.0.0.1.12345 > 10.0.0.2.12345: UDP, length 16
09:17:53.557919 IP 10.0.0.1.12345 > 10.0.0.2.12345: UDP, length 16
09:17:54.558158 IP 10.0.0.1.12345 > 10.0.0.2.12345: UDP, length 16
09:17:55.558378 IP 10.0.0.1.12345 > 10.0.0.2.12345: UDP, length 16
09:17:56.558599 IP 10.0.0.1.12345 > 10.0.0.2.12345: UDP, length 16
09:17:57.558811 IP 10.0.0.1.12345 > 10.0.0.2.12345: UDP, length 16
09:17:58.559056 IP 10.0.0.1.12345 > 10.0.0.2.12345: UDP, length 16
09:17:59.559254 IP 10.0.0.1.12345 > 10.0.0.2.12345: UDP, length 16
09:18:00.559458 IP 10.0.0.1.12345 > 10.0.0.2.12345: UDP, length 16
09:18:01.559649 IP 10.0.0.1.12345 > 10.0.0.2.12345: UDP, length 16
09:18:02.559893 IP 10.0.0.1.12345 > 10.0.0.2.12345: UDP, length 16
09:18:03.560095 IP 10.0.0.1.12345 > 10.0.0.2.12345: UDP, length 16
09:18:04.560292 IP 10.0.0.1.12345 > 10.0.0.2.12345: UDP, length 16
09:18:05.560505 IP 10.0.0.1.12345 > 10.0.0.2.12345: UDP, length 16
09:18:06.560743 IP 10.0.0.1.12345 > 10.0.0.2.12345: UDP, length 16
09:18:07.560952 IP 10.0.0.1.12345 > 10.0.0.2.12345: UDP, length 16
09:18:08.561178 IP 10.0.0.1.12345 > 10.0.0.2.12345: UDP, length 16
09:18:09.561350 IP 10.0.0.1.12345 > 10.0.0.2.12345: UDP, length 16
09:18:10.561535 IP 10.0.0.1.12345 > 10.0.0.2.12345: UDP, length 16
09:18:11.561756 IP 10.0.0.1.12345 > 10.0.0.2.12345: UDP, length 16
09:18:12.562003 IP 10.0.0.1.12345 > 10.0.0.2.12345: UDP, length 16
09:18:13.562248 IP 10.0.0.1.12345 > 10.0.0.2.12345: UDP, length 16
09:18:14.562488 IP 10.0.0.1.12345 > 10.0.0.2.12345: UDP, length 16
09:18:15.562732 IP 10.0.0.1.12345 > 10.0.0.2.12345: UDP, length 16
09:18:16.562967 IP 10.0.0.1.12345 > 10.0.0.2.12345: UDP, length 16
09:18:17.563191 IP 10.0.0.1.12345 > 10.0.0.2.12345: UDP, length 16
09:18:18.563433 IP 10.0.0.1.12345 > 10.0.0.2.12345: UDP, length 16
09:18:19.563692 IP 10.0.0.1.12345 > 10.0.0.2.12345: UDP, length 16
09:18:20.563993 IP 10.0.0.1.12345 > 10.0.0.2.12345: UDP, length 16
09:18:21.564238 IP 10.0.0.1.12345 > 10.0.0.2.12345: UDP, length 16
09:18:22.564482 IP 10.0.0.1.12345 > 10.0.0.2.12345: UDP, length 16
09:18:23.564695 IP 10.0.0.1.12345 > 10.0.0.2.12345: UDP, length 16
09:18:24.564935 IP 10.0.0.1.12345 > 10.0.0.2.12345: UDP, length 16
09:18:25.565178 IP 10.0.0.1.12345 > 10.0.0.2.12345: UDP, length 16
09:18:26.565390 IP 10.0.0.1.12345 > 10.0.0.2.12345: UDP, length 16
09:18:27.565632 IP 10.0.0.1.12345 > 10.0.0.2.12345: UDP, length 16
09:18:28.565876 IP 10.0.0.1.12345 > 10.0.0.2.12345: UDP, length 16
09:18:29.566116 IP 10.0.0.1.12345 > 10.0.0.2.12345: UDP, length 16
09:18:30.566360 IP 10.0.0.1.12345 > 10.0.0.2.12345: UDP, length 16
09:18:31.566600 IP 10.0.0.1.12345 > 10.0.0.2.12345: UDP, length 16
09:18:32.566827 IP 10.0.0.1.12345 > 10.0.0.2.12345: UDP, length 16
09:18:33.567072 IP 10.0.0.1.12345 > 10.0.0.2.12345: UDP, length 16
09:18:34.567321 IP 10.0.0.1.12345 > 10.0.0.2.12345: UDP, length 16
09:18:35.567555 IP 10.0.0.1.12345 > 10.0.0.2.12345: UDP, length 16
09:18:36.567800 IP 10.0.0.1.12345 > 10.0.0.2.12345: UDP, length 16
09:18:37.568048 IP 10.0.0.1.12345 > 10.0.0.2.12345: UDP, length 16
09:18:38.568274 IP 10.0.0.1.12345 > 10.0.0.2.12345: UDP, length 16
09:18:39.568519 IP 10.0.0.1.12345 > 10.0.0.2.12345: UDP, length 16
09:18:40.568765 IP 10.0.0.1.12345 > 10.0.0.2.12345: UDP, length 16
09:18:41.569009 IP 10.0.0.1.12345 > 10.0.0.2.12345: UDP, length 16
09:18:42.569242 IP 10.0.0.1.12345 > 10.0.0.2.12345: UDP, length 16
09:18:43.569488 IP 10.0.0.1.12345 > 10.0.0.2.12345: UDP, length 16
09:18:44.569736 IP 10.0.0.1.12345 > 10.0.0.2.12345: UDP, length 16
09:18:45.569985 IP 10.0.0.1.12345 > 10.0.0.2.12345: UDP, length 16
09:18:46.570185 IP 10.0.0.1.12345 > 10.0.0.2.12345: UDP, length 16
09:18:47.570429 IP 10.0.0.1.12345 > 10.0.0.2.12345: UDP, length 16
09:18:48.570624 IP 10.0.0.1.12345 > 10.0.0.2.12345: UDP, length 16
09:18:49.570822 IP 10.0.0.1.12345 > 10.0.0.2.12345: UDP, length 16
09:18:50.571042 IP 10.0.0.1.12345 > 10.0.0.2.12345: UDP, length 16
09:18:51.571282 IP 10.0.0.1.12345 > 10.0.0.2.12345: UDP, length 16
09:18:52.571529 IP 10.0.0.1.12345 > 10.0.0.2.12345: UDP, length 16
09:18:53.571778 IP 10.0.0.1.12345 > 10.0.0.2.12345: UDP, length 16
09:18:54.572026 IP 10.0.0.1.12345 > 10.0.0.2.12345: UDP, length 16
09:18:55.572253 IP 10.0.0.1.12345 > 10.0.0.2.12345: UDP, length 16
09:18:56.572486 IP 10.0.0.1.12345 > 10.0.0.2.12345: UDP, length 16
09:18:57.572717 IP 10.0.0.1.12345 > 10.0.0.2.12345: UDP, length 16
09:18:58.572963 IP 10.0.0.1.12345 > 10.0.0.2.12345: UDP, length 16
09:18:59.573206 IP 10.0.0.1.12345 > 10.0.0.2.12345: UDP, length 16
09:19:00.573449 IP 10.0.0.1.12345 > 10.0.0.2.12345: UDP, length 16
09:19:01.573693 IP 10.0.0.1.12345 > 10.0.0.2.12345: UDP, length 16
09:19:02.573942 IP 10.0.0.1.12345 > 10.0.0.2.12345: UDP, length 16
09:19:03.574158 IP 10.0.0.1.12345 > 10.0.0.2.12345: UDP, length 16
09:19:04.574387 IP 10.0.0.1.12345 > 10.0.0.2.12345: UDP, length 16
09:19:05.574628 IP 10.0.0.1.12345 > 10.0.0.2.12345: UDP, length 16
09:19:06.574863 IP 10.0.0.1.12345 > 10.0.0.2.12345: UDP, length 16
09:19:07.575108 IP 10.0.0.1.12345 > 10.0.0.2.12345: UDP, length 16
09:19:08.575302 IP 10.0.0.1.12345 > 10.0.0.2.12345: UDP, length 16
09:19:09.575510 IP 10.0.0.1.12345 > 10.0.0.2.12345: UDP, length 16
09:19:10.575737 IP 10.0.0.1.12345 > 10.0.0.2.12345: UDP, length 16
09:19:11.575956 IP 10.0.0.1.12345 > 10.0.0.2.12345: UDP, length 16
09:19:12.576187 IP 10.0.0.1.12345 > 10.0.0.2.12345: UDP, length 16
09:19:13.576434 IP 10.0.0.1.12345 > 10.0.0.2.12345: UDP, length 16
09:19:14.576680 IP 10.0.0.1.12345 > 10.0.0.2.12345: UDP, length 16
09:19:15.576925 IP 10.0.0.1.12345 > 10.0.0.2.12345: UDP, length 16
09:19:16.577172 IP 10.0.0.1.12345 > 10.0.0.2.12345: UDP, length 16
09:19:17.577413 IP 10.0.0.1.12345 > 10.0.0.2.12345: UDP, length 16
09:19:18.577609 IP 10.0.0.1.12345 > 10.0.0.2.12345: UDP, length 16
09:19:19.577854 IP 10.0.0.1.12345 > 10.0.0.2.12345: UDP, length 16
09:19:20.578099 IP 10.0.0.1.12345 > 10.0.0.2.12345: UDP, length 16
09:19:21.578347 IP 10.0.0.1.12345 > 10.0.0.2.12345: UDP, length 16
09:19:22.578525 IP 10.0.0.1.12345 > 10.0.0.2.12345: UDP, length 16
09:19:23.578667 IP 10.0.0.1.12345 > 10.0.0.2.12345: UDP, length 16
09:19:24.578880 IP 10.0.0.1.12345 > 10.0.0.2.12345: UDP, length 16
09:19:25.579068 IP 10.0.0.1.12345 > 10.0.0.2.12345: UDP, length 16
09:19:26.579267 IP 10.0.0.1.12345 > 10.0.0.2.12345: UDP, length 16
09:19:27.579473 IP 10.0.0.1.12345 > 10.0.0.2.12345: UDP, length 16
09:19:28.579682 IP 10.0.0.1.12345 > 10.0.0.2.12345: UDP, length 16
09:19:29.579982 IP 10.0.0.1.12345 > 10.0.0.2.12345: UDP, length 16
09:19:30.580230 IP 10.0.0.1.12345 > 10.0.0.2.12345: UDP, length 16
09:19:31.580477 IP 10.0.0.1.12345 > 10.0.0.2.12345: UDP, length 16
09:19:32.580685 IP 10.0.0.1.12345 > 10.0.0.2.12345: UDP, length 16
09:19:33.580928 IP 10.0.0.1.12345 > 10.0.0.2.12345: UDP, length 16
09:19:34.581160 IP 10.0.0.1.12345 > 10.0.0.2.12345: UDP, length 16
09:19:35.581398 IP 10.0.0.1.12345 > 10.0.0.2.12345: UDP, length 16
09:19:36.581630 IP 10.0.0.1.12345 > 10.0.0.2.12345: UDP, length 16
09:19:37.581875 IP 10.0.0.1.12345 > 10.0.0.2.12345: UDP, length 16
09:19:38.582120 IP 10.0.0.1.12345 > 10.0.0.2.12345: UDP, length 16
09:19:39.582366 IP 10.0.0.1.12345 > 10.0.0.2.12345: UDP, length 16
09:19:40.582560 IP 10.0.0.1.12345 > 10.0.0.2.12345: UDP, length 16
09:19:41.582789 IP 10.0.0.1.12345 > 10.0.0.2.12345: UDP, length 16
09:19:42.583033 IP 10.0.0.1.12345 > 10.0.0.2.12345: UDP, length 16
09:19:43.583279 IP 10.0.0.1.12345 > 10.0.0.2.12345: UDP, length 16
09:19:44.583504 IP 10.0.0.1.12345 > 10.0.0.2.12345: UDP, length 16
09:19:45.583833 IP 10.0.0.1.12345 > 10.0.0.2.12345: UDP, length 16
09:19:46.584081 IP 10.0.0.1.12345 > 10.0.0.2.12345: UDP, length 16
09:19:47.584328 IP 10.0.0.1.12345 > 10.0.0.2.12345: UDP, length 16
09:19:48.584539 IP 10.0.0.1.12345 > 10.0.0.2.12345: UDP, length 16
09:19:49.584768 IP 10.0.0.1.12345 > 10.0.0.2.12345: UDP, length 16
09:19:50.584989 IP 10.0.0.1.12345 > 10.0.0.2.12345: UDP, length 16
09:19:51.585225 IP 10.0.0.1.12345 > 10.0.0.2.12345: UDP, length 16
09:19:52.585447 IP 10.0.0.1.12345 > 10.0.0.2.12345: UDP, length 16
09:19:53.585666 IP 10.0.0.1.12345 > 10.0.0.2.12345: UDP, length 16
09:19:54.585886 IP 10.0.0.1.12345 > 10.0.0.2.12345: UDP, length 16
09:19:55.586132 IP 10.0.0.1.12345 > 10.0.0.2.12345: UDP, length 16
09:19:56.586351 IP 10.0.0.1.12345 > 10.0.0.2.12345: UDP, length 16
09:19:57.586561 IP 10.0.0.1.12345 > 10.0.0.2.12345: UDP, length 16
09:19:58.586783 IP 10.0.0.1.12345 > 10.0.0.2.12345: UDP, length 16
