15:54:54.294003 IP 10.0.0.1.12345 > 10.0.0.2.12345: UDP, length 16
15:54:54.294372 IP 10.0.0.1.12345 > 10.0.0.2.12345: UDP, length 16
15:54:54.294991 IP 10.0.0.1.12345 > 10.0.0.2.12345: UDP, length 16
15:54:54.295654 IP 10.0.0.1.12345 > 10.0.0.2.12345: UDP, length 16
15:54:54.296276 IP 10.0.0.1.12345 > 10.0.0.2.12345: UDP, length 16
15:54:54.296940 IP 10.0.0.1.12345 > 10.0.0.2.12345: UDP, length 16
15:54:54.297607 IP 10.0.0.1.12345 > 10.0.0.2.12345: UDP, length 16
15:54:54.298252 IP 10.0.0.1.12345 > 10.0.0.2.12345: UDP, length 16
15:54:54.298861 IP 10.0.0.1.12345 > 10.0.0.2.12345: UDP, length 16
15:54:54.299470 IP 10.0.0.1.12345 > 10.0.0.2.12345: UDP, length 16
15:54:54.300066 IP 10.0.0.1.12345 > 10.0.0.2.12345: UDP, length 16
15:54:54.300673 IP 10.0.0.1.12345 > 10.0.0.2.12345: UDP, length 16
15:54:54.301282 IP 10.0.0.1.12345 > 10.0.0.2.12345: UDP, length 16
15:54:54.301892 IP 10.0.0.1.12345 > 10.0.0.2.12345: UDP, length 16
15:54:54.302490 IP 10.0.0.1.12345 > 10.0.0.2.12345: UDP, length 16
15:54:54.303087 IP 10.0.0.1.12345 > 10.0.0.2.12345: UDP, length 16
15:54:54.303681 IP 10.0.0.1.12345 > 10.0.0.2.12345: UDP, length 16
15:54:54.304274 IP 10.0.0.1.12345 > 10.0.0.2.12345: UDP, length 16
15:54:54.304865 IP 10.0.0.1.12345 > 10.0.0.2.12345: UDP, length 16
15:54:54.305457 IP 10.0.0.1.12345 > 10.0.0.2.12345: UDP, length 16
15:54:54.306048 IP 10.0.0.1.12345 > 10.0.0.2.12345: UDP, length 16
15:54:54.306639 IP 10.0.0.1.12345 > 10.0.0.2.12345: UDP, length 16
15:54:54.307231 IP 10.0.0.1.12345 > 10.0.0.2.12345: UDP, length 16
15:54:54.307803 IP 10.0.0.1.12345 > 10.0.0.2.12345: UDP, length 16
15:54:54.308394 IP 10.0.0.1.12345 > 10.0.0.2.12345: UDP, length 16
15:54:54.308986 IP 10.0.0.1.12345 > 10.0.0.2.12345: UDP, length 16
15:54:54.309596 IP 10.0.0.1.12345 > 10.0.0.2.12345: UDP, length 16
15:54:54.310207 IP 10.0.0.1.12345 > 10.0.0.2.12345: UDP, length 16
15:54:54.310820 IP 10.0.0.1.12345 > 10.0.0.2.12345: UDP, length 16
15:54:54.311430 IP 10.0.0.1.12345 > 10.0.0.2.12345: UDP, length 16
15:54:54.312026 IP 10.0.0.1.12345 > 10.0.0.2.12345: UDP, length 16
15:54:54.312635 IP 10.0.0.1.12345 > 10.0.0.2.12345: UDP, length 16
15:54:54.313246 IP 10.0.0.1.12345 > 10.0.0.2.12345: UDP, length 16
15:54:54.313856 IP 10.0.0.1.12345 > 10.0.0.2.12345: UDP, length 16
15:54:54.314466 IP 10.0.0.1.12345 > 10.0.0.2.12345: UDP, length 16
15:54:54.315077 IP 10.0.0.1.12345 > 10.0.0.2.12345: UDP, length 16
15:54:54.315688 IP 10.0.0.1.12345 > 10.0.0.2.12345: UDP, length 16
15:54:54.316299 IP 10.0.0.1.12345 > 10.0.0.2.12345: UDP, length 16
15:54:54.316909 IP 10.0.0.1.12345 > 10.0.0.2.12345: UDP, length 16
15:54:54.317520 IP 10.0.0.1.12345 > 10.0.0.2.12345: UDP, length 16
15:54:54.318131 IP 10.0.0.1.12345 > 10.0.0.2.12345: UDP, length 16
15:54:54.318742 IP 10.0.0.1.12345 > 10.0.0.2.12345: UDP, length 16
15:54:54.319345 IP 10.0.0.1.12345 > 10.0.0.2.12345: UDP, length 16
15:54:54.319956 IP 10.0.0.1.12345 > 10.0.0.2.12345: UDP, length 16
15:54:54.320567 IP 10.0.0.1.12345 > 10.0.0.2.12345: UDP, length 16
15:54:54.321181 IP 10.0.0.1.12345 > 10.0.0.2.12345: UDP, length 16
15:54:54.321791 IP 10.0.0.1.12345 > 10.0.0.2.12345: UDP, length 16
15:54:54.322403 IP 10.0.0.1.12345 > 10.0.0.2.12345: UDP, length 16
15:54:54.323015 IP 10.0.0.1.12345 > 10.0.0.2.12345: UDP, length 16
15:54:54.323626 IP 10.0.0.1.12345 > 10.0.0.2.12345: UDP, length 16
15:54:54.324238 IP 10.0.0.1.12345 > 10.0.0.2.12345: UDP, length 16
15:54:54.324847 IP 10.0.0.1.12345 > 10.0.0.2.12345: UDP, length 16
15:54:54.325457 IP 10.0.0.1.12345 > 10.0.0.2.12345: UDP, length 16
15:54:54.326069 IP 10.0.0.1.12345 > 10.0.0.2.12345: UDP, length 16
15:54:54.326678 IP 10.0.0.1.12345 > 10.0.0.2.12345: UDP, length 16
15:54:54.327288 IP 10.0.0.1.12345 > 10.0.0.2.12345: UDP, length 16
15:54:54.327900 IP 10.0.0.1.12345 > 10.0.0.2.12345: UDP, length 16
15:54:54.328510 IP 10.0.0.1.12345 > 10.0.0.2.12345: UDP, length 16
15:54:54.329121 IP 10.0.0.1.12345 > 10.0.0.2.12345: UDP, length 16
15:54:54.329731 IP 10.0.0.1.12345 > 10.0.0.2.12345: UDP, length 16
15:54:54.330342 IP 10.0.0.1.12345 > 10.0.0.2.12345: UDP, length 16
15:54:54.330952 IP 10.0.0.1.12345 > 10.0.0.2.12345: UDP, length 16
15:54:54.331562 IP 10.0.0.1.12345 > 10.0.0.2.12345: UDP, length 16
15:54:54.332173 IP 10.0.0.1.12345 > 10.0.0.2.12345: UDP, length 16
15:54:54.332783 IP 10.0.0.1.12345 > 10.0.0.2.12345: UDP, length 16
15:54:54.333393 IP 10.0.0.1.12345 > 10.0.0.2.12345: UDP, length 16
15:54:54.334005 IP 10.0.0.1.12345 > 10.0.0.2.12345: UDP, length 16
15:54:54.334616 IP 10.0.0.1.12345 > 10.0.0.2.12345: UDP, length 16
15:54:54.335228 IP 10.0.0.1.12345 > 10.0.0.2.12345: UDP, length 16
15:54:54.335841 IP 10.0.0.1.12345 > 10.0.0.2.12345: UDP, length 16
15:54:54.336451 IP 10.0.0.1.12345 > 10.0.0.2.12345: UDP, length 16
15:54:54.337061 IP 10.0.0.1.12345 > 10.0.0.2.12345: UDP, length 16
15:54:54.337672 IP 10.0.0.1.12345 > 10.0.0.2.12345: UDP, length 16
15:54:54.338284 IP 10.0.0.1.12345 > 10.0.0.2.12345: UDP, length 16
15:54:54.338895 IP 10.0.0.1.12345 > 10.0.0.2.12345: UDP, length 16
15:54:54.339506 IP 10.0.0.1.12345 > 10.0.0.2.12345: UDP, length 16
15:54:54.340117 IP 10.0.0.1.12345 > 10.0.0.2.12345: UDP, length 16
15:54:54.340728 IP 10.0.0.1.12345 > 10.0.0.2.12345: UDP, length 16
15:54:54.341339 IP 10.0.0.1.12345 > 10.0.0.2.12345: UDP, length 16
15:54:54.341951 IP 10.0.0.1.12345 > 10.0.0.2.12345: UDP, length 16
15:54:54.342561 IP 10.0.0.1.12345 > 10.0.0.2.12345: UDP, length 16
15:54:54.343172 IP 10.0.0.1.12345 > 10.0.0.2.12345: UDP, length 16
15:54:54.343783 IP 10.0.0.1.12345 > 10.0.0.2.12345: UDP, length 16
15:54:54.344393 IP 10.0.0.1.12345 > 10.0.0.2.12345: UDP, length 16
15:54:54.345003 IP 10.0.0.1.12345 > 10.0.0.2.12345: UDP, length 16
15:54:54.345614 IP 10.0.0.1.12345 > 10.0.0.2.12345: UDP, length 16
15:54:54.346225 IP 10.0.0.1.12345 > 10.0.0.2.12345: UDP, length 16
15:54:54.346834 IP 10.0.0.1.12345 > 10.0.0.2.12345: UDP, length 16
15:54:54.347446 IP 10.0.0.1.12345 > 10.0.0.2.12345: UDP, length 16
15:54:54.348060 IP 10.0.0.1.12345 > 10.0.0.2.12345: UDP, length 16
15:54:54.348670 IP 10.0.0.1.12345 > 10.0.0.2.12345: UDP, length 16
15:54:54.349281 IP 10.0.0.1.12345 > 10.0.0.2.12345: UDP, length 16
15:54:54.349891 IP 10.0.0.1.12345 > 10.0.0.2.12345: UDP, length 16
15:54:54.350501 IP 10.0.0.1.12345 > 10.0.0.2.12345: UDP, length 16
15:54:54.351111 IP 10.0.0.1.12345 > 10.0.0.2.12345: UDP, length 16
15:54:54.351722 IP 10.0.0.1.12345 > 10.0.0.2.12345: UDP, length 16
15:54:54.352334 IP 10.0.0.1.12345 > 10.0.0.2.12345: UDP, length 16
15:54:54.352944 IP 10.0.0.1.12345 > 10.0.0.2.12345: UDP, length 16
15:54:54.353555 IP 10.0.0.1.12345 > 10.0.0.2.12345: UDP, length 16
15:54:54.354166 IP 10.0.0.1.12345 > 10.0.0.2.12345: UDP, length 16
15:54:54.354778 IP 10.0.0.1.12345 > 10.0.0.2.12345: UDP, length 16
15:54:54.355388 IP 10.0.0.1.12345 > 10.0.0.2.12345: UDP, length 16
15:54:54.355999 IP 10.0.0.1.12345 > 10.0.0.2.12345: UDP, length 16
15:54:54.356610 IP 10.0.0.1.12345 > 10.0.0.2.12345: UDP, length 16
15:54:54.357220 IP 10.0.0.1.12345 > 10.0.0.2.12345: UDP, length 16
15:54:54.357830 IP 10.0.0.1.12345 > 10.0.0.2.12345: UDP, length 16
15:54:54.358440 IP 10.0.0.1.12345 > 10.0.0.2.12345: UDP, length 16
15:54:54.359050 IP 10.0.0.1.12345 > 10.0.0.2.12345: UDP, length 16
15:54:54.359661 IP 10.0.0.1.12345 > 10.0.0.2.12345: UDP, length 16
15:54:54.360245 IP 10.0.0.1.12345 > 10.0.0.2.12345: UDP, length 16
15:54:54.360858 IP 10.0.0.1.12345 > 10.0.0.2.12345: UDP, length 16
15:54:54.361468 IP 10.0.0.1.12345 > 10.0.0.2.12345: UDP, length 16
15:54:54.362079 IP 10.0.0.1.12345 > 10.0.0.2.12345: UDP, length 16
15:54:54.362689 IP 10.0.0.1.12345 > 10.0.0.2.12345: UDP, length 16
15:54:54.363301 IP 10.0.0.1.12345 > 10.0.0.2.12345: UDP, length 16
15:54:54.363914 IP 10.0.0.1.12345 > 10.0.0.2.12345: UDP, length 16
15:54:54.364524 IP 10.0.0.1.12345 > 10.0.0.2.12345: UDP, length 16
15:54:54.365120 IP 10.0.0.1.12345 > 10.0.0.2.12345: UDP, length 16
15:54:54.365685 IP 10.0.0.1.12345 > 10.0.0.2.12345: UDP, length 16
15:54:54.366278 IP 10.0.0.1.12345 > 10.0.0.2.12345: UDP, length 16
15:54:54.366871 IP 10.0.0.1.12345 > 10.0.0.2.12345: UDP, length 16
15:54:54.367467 IP 10.0.0.1.12345 > 10.0.0.2.12345: UDP, length 16
15:54:54.368070 IP 10.0.0.1.12345 > 10.0.0.2.12345: UDP, length 16
15:54:54.368695 IP 10.0.0.1.12345 > 10.0.0.2.12345: UDP, length 16
15:54:54.369325 IP 10.0.0.1.12345 > 10.0.0.2.12345: UDP, length 16
15:54:54.369952 IP 10.0.0.1.12345 > 10.0.0.2.12345: UDP, length 16
15:54:54.370580 IP 10.0.0.1.12345 > 10.0.0.2.12345: UDP, length 16
15:54:54.371207 IP 10.0.0.1.12345 > 10.0.0.2.12345: UDP, length 16
15:54:54.371837 IP 10.0.0.1.12345 > 10.0.0.2.12345: UDP, length 16
15:54:54.372465 IP 10.0.0.1.12345 > 10.0.0.2.12345: UDP, length 16
15:54:54.373093 IP 10.0.0.1.12345 > 10.0.0.2.12345: UDP, length 16
15:54:54.373720 IP 10.0.0.1.12345 > 10.0.0.2.12345: UDP, length 16
15:54:54.374350 IP 10.0.0.1.12345 > 10.0.0.2.12345: UDP, length 16
15:54:54.374978 IP 10.0.0.1.12345 > 10.0.0.2.12345: UDP, length 16
15:54:54.375604 IP 10.0.0.1.12345 > 10.0.0.2.12345: UDP, length 16
15:54:54.376238 IP 10.0.0.1.12345 > 10.0.0.2.12345: UDP, length 16
15:54:54.376867 IP 10.0.0.1.12345 > 10.0.0.2.12345: UDP, length 16
15:54:54.377495 IP 10.0.0.1.12345 > 10.0.0.2.12345: UDP, length 16
15:54:54.378122 IP 10.0.0.1.12345 > 10.0.0.2.12345: UDP, length 16
15:54:54.378751 IP 10.0.0.1.12345 > 10.0.0.2.12345: UDP, length 16
15:54:54.379379 IP 10.0.0.1.12345 > 10.0.0.2.12345: UDP, length 16
15:54:54.379982 IP 10.0.0.1.12345 > 10.0.0.2.12345: UDP, length 16
15:54:54.380610 IP 10.0.0.1.12345 > 10.0.0.2.12345: UDP, length 16
15:54:54.381213 IP 10.0.0.1.12345 > 10.0.0.2.12345: UDP, length 16
15:54:54.381816 IP 10.0.0.1.12345 > 10.0.0.2.12345: UDP, length 16
15:54:54.382432 IP 10.0.0.1.12345 > 10.0.0.2.12345: UDP, length 16
15:54:54.383036 IP 10.0.0.1.12345 > 10.0.0.2.12345: UDP, length 16
15:54:54.383653 IP 10.0.0.1.12345 > 10.0.0.2.12345: UDP, length 16
15:54:54.384273 IP 10.0.0.1.12345 > 10.0.0.2.12345: UDP, length 16
15:54:54.384901 IP 10.0.0.1.12345 > 10.0.0.2.12345: UDP, length 16
15:54:54.385528 IP 10.0.0.1.12345 > 10.0.0.2.12345: UDP, length 16
15:54:54.386156 IP 10.0.0.1.12345 > 10.0.0.2.12345: UDP, length 16
15:54:54.386784 IP 10.0.0.1.12345 > 10.0.0.2.12345: UDP, length 16
15:54:54.387413 IP 10.0.0.1.12345 > 10.0.0.2.12345: UDP, length 16
15:54:54.388041 IP 10.0.0.1.12345 > 10.0.0.2.12345: UDP, length 16
15:54:54.388670 IP 10.0.0.1.12345 > 10.0.0.2.12345: UDP, length 16
15:54:54.389298 IP 10.0.0.1.12345 > 10.0.0.2.12345: UDP, length 16
15:54:54.389926 IP 10.0.0.1.12345 > 10.0.0.2.12345: UDP, length 16
15:54:54.390553 IP 10.0.0.1.12345 > 10.0.0.2.12345: UDP, length 16
15:54:54.391181 IP 10.0.0.1.12345 > 10.0.0.2.12345: UDP, length 16
15:54:54.391827 IP 10.0.0.1.12345 > 10.0.0.2.12345: UDP, length 16
15:54:54.392421 IP 10.0.0.1.12345 > 10.0.0.2.12345: UDP, length 16
15:54:54.393053 IP 10.0.0.1.12345 > 10.0.0.2.12345: UDP, length 16
15:54:54.393684 IP 10.0.0.1.12345 > 10.0.0.2.12345: UDP, length 16
15:54:54.394315 IP 10.0.0.1.12345 > 10.0.0.2.12345: UDP, length 16
15:54:54.394946 IP 10.0.0.1.12345 > 10.0.0.2.12345: UDP, length 16
15:54:54.395577 IP 10.0.0.1.12345 > 10.0.0.2.12345: UDP, length 16
15:54:54.396208 IP 10.0.0.1.12345 > 10.0.0.2.12345: UDP, length 16
15:54:54.396840 IP 10.0.0.1.12345 > 10.0.0.2.12345: UDP, length 16
15:54:54.397473 IP 10.0.0.1.12345 > 10.0.0.2.12345: UDP, length 16
15:54:54.398105 IP 10.0.0.1.12345 > 10.0.0.2.12345: UDP, length 16
15:54:54.398738 IP 10.0.0.1.12345 > 10.0.0.2.12345: UDP, length 16
15:54:54.399371 IP 10.0.0.1.12345 > 10.0.0.2.12345: UDP, length 16
15:54:54.400004 IP 10.0.0.1.12345 > 10.0.0.2.12345: UDP, length 16
15:54:54.400636 IP 10.0.0.1.12345 > 10.0.0.2.12345: UDP, length 16
15:54:54.401267 IP 10.0.0.1.12345 > 10.0.0.2.12345: UDP, length 16
15:54:54.401899 IP 10.0.0.1.12345 > 10.0.0.2.12345: UDP, length 16
15:54:54.402530 IP 10.0.0.1.12345 > 10.0.0.2.12345: UDP, length 16
15:54:54.403161 IP 10.0.0.1.12345 > 10.0.0.2.12345: UDP, length 16
15:54:54.403795 IP 10.0.0.1.12345 > 10.0.0.2.12345: UDP, length 16
15:54:54.404428 IP 10.0.0.1.12345 > 10.0.0.2.12345: UDP, length 16
15:54:54.405060 IP 10.0.0.1.12345 > 10.0.0.2.12345: UDP, length 16
15:54:54.405691 IP 10.0.0.1.12345 > 10.0.0.2.12345: UDP, length 16
15:54:54.406324 IP 10.0.0.1.12345 > 10.0.0.2.12345: UDP, length 16
15:54:54.406955 IP 10.0.0.1.12345 > 10.0.0.2.12345: UDP, length 16
15:54:54.407586 IP 10.0.0.1.12345 > 10.0.0.2.12345: UDP, length 16
15:54:54.408211 IP 10.0.0.1.12345 > 10.0.0.2.12345: UDP, length 16
15:54:54.408864 IP 10.0.0.1.12345 > 10.0.0.2.12345: UDP, length 16
15:54:54.409481 IP 10.0.0.1.12345 > 10.0.0.2.12345: UDP, length 16
15:54:54.410098 IP 10.0.0.1.12345 > 10.0.0.2.12345: UDP, length 16
15:54:54.410714 IP 10.0.0.1.12345 > 10.0.0.2.12345: UDP, length 16
15:54:54.411332 IP 10.0.0.1.12345 > 10.0.0.2.12345: UDP, length 16
15:54:54.411949 IP 10.0.0.1.12345 > 10.0.0.2.12345: UDP, length 16
15:54:54.412566 IP 10.0.0.1.12345 > 10.0.0.2.12345: UDP, length 16
15:54:54.413184 IP 10.0.0.1.12345 > 10.0.0.2.12345: UDP, length 16
15:54:54.413800 IP 10.0.0.1.12345 > 10.0.0.2.12345: UDP, length 16
15:54:54.414418 IP 10.0.0.1.12345 > 10.0.0.2.12345: UDP, length 16
15:54:54.415035 IP 10.0.0.1.12345 > 10.0.0.2.12345: UDP, length 16
15:54:54.415651 IP 10.0.0.1.12345 > 10.0.0.2.12345: UDP, length 16
15:54:54.416234 IP 10.0.0.1.12345 > 10.0.0.2.12345: UDP, length 16
15:54:54.416829 IP 10.0.0.1.12345 > 10.0.0.2.12345: UDP, length 16
15:54:54.417426 IP 10.0.0.1.12345 > 10.0.0.2.12345: UDP, length 16
15:54:54.418022 IP 10.0.0.1.12345 > 10.0.0.2.12345: UDP, length 16
15:54:54.418619 IP 10.0.0.1.12345 > 10.0.0.2.12345: UDP, length 16
15:54:54.419215 IP 10.0.0.1.12345 > 10.0.0.2.12345: UDP, length 16
15:54:54.419817 IP 10.0.0.1.12345 > 10.0.0.2.12345: UDP, length 16
15:54:54.420417 IP 10.0.0.1.12345 > 10.0.0.2.12345: UDP, length 16
15:54:54.421013 IP 10.0.0.1.12345 > 10.0.0.2.12345: UDP, length 16
15:54:54.421609 IP 10.0.0.1.12345 > 10.0.0.2.12345: UDP, length 16
15:54:54.422205 IP 10.0.0.1.12345 > 10.0.0.2.12345: UDP, length 16
15:54:54.422802 IP 10.0.0.1.12345 > 10.0.0.2.12345: UDP, length 16
15:54:54.423399 IP 10.0.0.1.12345 > 10.0.0.2.12345: UDP, length 16
15:54:54.423996 IP 10.0.0.1.12345 > 10.0.0.2.12345: UDP, length 16
15:54:54.424594 IP 10.0.0.1.12345 > 10.0.0.2.12345: UDP, length 16
15:54:54.425190 IP 10.0.0.1.12345 > 10.0.0.2.12345: UDP, length 16
15:54:54.425787 IP 10.0.0.1.12345 > 10.0.0.2.12345: UDP, length 16
15:54:54.426385 IP 10.0.0.1.12345 > 10.0.0.2.12345: UDP, length 16
15:54:54.426981 IP 10.0.0.1.12345 > 10.0.0.2.12345: UDP, length 16
15:54:54.427578 IP 10.0.0.1.12345 > 10.0.0.2.12345: UDP, length 16
15:54:54.428176 IP 10.0.0.1.12345 > 10.0.0.2.12345: UDP, length 16
15:54:54.428764 IP 10.0.0.1.12345 > 10.0.0.2.12345: UDP, length 16
15:54:54.429355 IP 10.0.0.1.12345 > 10.0.0.2.12345: UDP, length 16
15:54:54.429955 IP 10.0.0.1.12345 > 10.0.0.2.12345: UDP, length 16
15:54:54.430560 IP 10.0.0.1.12345 > 10.0.0.2.12345: UDP, length 16
15:54:54.431165 IP 10.0.0.1.12345 > 10.0.0.2.12345: UDP, length 16
15:54:54.431776 IP 10.0.0.1.12345 > 10.0.0.2.12345: UDP, length 16
15:54:54.432386 IP 10.0.0.1.12345 > 10.0.0.2.12345: UDP, length 16
15:54:54.432996 IP 10.0.0.1.12345 > 10.0.0.2.12345: UDP, length 16
15:54:54.433607 IP 10.0.0.1.12345 > 10.0.0.2.12345: UDP, length 16
15:54:54.434218 IP 10.0.0.1.12345 > 10.0.0.2.12345: UDP, length 16
15:54:54.434827 IP 10.0.0.1.12345 > 10.0.0.2.12345: UDP, length 16
15:54:54.435439 IP 10.0.0.1.12345 > 10.0.0.2.12345: UDP, length 16
15:54:54.436049 IP 10.0.0.1.12345 > 10.0.0.2.12345: UDP, length 16
15:54:54.436659 IP 10.0.0.1.12345 > 10.0.0.2.12345: UDP, length 16
15:54:54.437269 IP 10.0.0.1.12345 > 10.0.0.2.12345: UDP, length 16
15:54:54.437881 IP 10.0.0.1.12345 > 10.0.0.2.12345: UDP, length 16
15:54:54.438494 IP 10.0.0.1.12345 > 10.0.0.2.12345: UDP, length 16
15:54:54.439103 IP 10.0.0.1.12345 > 10.0.0.2.12345: UDP, length 16
15:54:54.439714 IP 10.0.0.1.12345 > 10.0.0.2.12345: UDP, length 16
15:54:54.440318 IP 10.0.0.1.12345 > 10.0.0.2.12345: UDP, length 16
15:54:54.440938 IP 10.0.0.1.12345 > 10.0.0.2.12345: UDP, length 16
15:54:54.441559 IP 10.0.0.1.12345 > 10.0.0.2.12345: UDP, length 16
15:54:54.442179 IP 10.0.0.1.12345 > 10.0.0.2.12345: UDP, length 16
15:54:54.442799 IP 10.0.0.1.12345 > 10.0.0.2.12345: UDP, length 16
15:54:54.443418 IP 10.0.0.1.12345 > 10.0.0.2.12345: UDP, length 16
15:54:54.444039 IP 10.0.0.1.12345 > 10.0.0.2.12345: UDP, length 16
15:54:54.444659 IP 10.0.0.1.12345 > 10.0.0.2.12345: UDP, length 16
15:54:54.445277 IP 10.0.0.1.12345 > 10.0.0.2.12345: UDP, length 16
15:54:54.445896 IP 10.0.0.1.12345 > 10.0.0.2.12345: UDP, length 16
15:54:54.446516 IP 10.0.0.1.12345 > 10.0.0.2.12345: UDP, length 16
15:54:54.447136 IP 10.0.0.1.12345 > 10.0.0.2.12345: UDP, length 16
15:54:54.447788 IP 10.0.0.1.12345 > 10.0.0.2.12345: UDP, length 16
15:54:54.448408 IP 10.0.0.1.12345 > 10.0.0.2.12345: UDP, length 16
15:54:54.449027 IP 10.0.0.1.12345 > 10.0.0.2.12345: UDP, length 16
15:54:54.449647 IP 10.0.0.1.12345 > 10.0.0.2.12345: UDP, length 16
15:54:54.450267 IP 10.0.0.1.12345 > 10.0.0.2.12345: UDP, length 16
15:54:54.450886 IP 10.0.0.1.12345 > 10.0.0.2.12345: UDP, length 16
15:54:54.451507 IP 10.0.0.1.12345 > 10.0.0.2.12345: UDP, length 16
15:54:54.452136 IP 10.0.0.1.12345 > 10.0.0.2.12345: UDP, length 16
15:54:54.452763 IP 10.0.0.1.12345 > 10.0.0.2.12345: UDP, length 16
15:54:54.453388 IP 10.0.0.1.12345 > 10.0.0.2.12345: UDP, length 16
15:54:54.454013 IP 10.0.0.1.12345 > 10.0.0.2.12345: UDP, length 16
15:54:54.454638 IP 10.0.0.1.12345 > 10.0.0.2.12345: UDP, length 16
15:54:54.455262 IP 10.0.0.1.12345 > 10.0.0.2.12345: UDP, length 16
15:54:54.455895 IP 10.0.0.1.12345 > 10.0.0.2.12345: UDP, length 16
15:54:54.456526 IP 10.0.0.1.12345 > 10.0.0.2.12345: UDP, length 16
15:54:54.457158 IP 10.0.0.1.12345 > 10.0.0.2.12345: UDP, length 16
15:54:54.457790 IP 10.0.0.1.12345 > 10.0.0.2.12345: UDP, length 16
15:54:54.458421 IP 10.0.0.1.12345 > 10.0.0.2.12345: UDP, length 16
15:54:54.459052 IP 10.0.0.1.12345 > 10.0.0.2.12345: UDP, length 16
15:54:54.459684 IP 10.0.0.1.12345 > 10.0.0.2.12345: UDP, length 16
15:54:54.460322 IP 10.0.0.1.12345 > 10.0.0.2.12345: UDP, length 16
15:54:54.460954 IP 10.0.0.1.12345 > 10.0.0.2.12345: UDP, length 16
15:54:54.461585 IP 10.0.0.1.12345 > 10.0.0.2.12345: UDP, length 16
15:54:54.462217 IP 10.0.0.1.12345 > 10.0.0.2.12345: UDP, length 16
15:54:54.462850 IP 10.0.0.1.12345 > 10.0.0.2.12345: UDP, length 16
15:54:54.463481 IP 10.0.0.1.12345 > 10.0.0.2.12345: UDP, length 16
15:54:54.464114 IP 10.0.0.1.12345 > 10.0.0.2.12345: UDP, length 16
15:54:54.464746 IP 10.0.0.1.12345 > 10.0.0.2.12345: UDP, length 16
15:54:54.465378 IP 10.0.0.1.12345 > 10.0.0.2.12345: UDP, length 16
15:54:54.466010 IP 10.0.0.1.12345 > 10.0.0.2.12345: UDP, length 16
15:54:54.466628 IP 10.0.0.1.12345 > 10.0.0.2.12345: UDP, length 16
15:54:54.467260 IP 10.0.0.1.12345 > 10.0.0.2.12345: UDP, length 16
15:54:54.467893 IP 10.0.0.1.12345 > 10.0.0.2.12345: UDP, length 16
15:54:54.468525 IP 10.0.0.1.12345 > 10.0.0.2.12345: UDP, length 16
15:54:54.469156 IP 10.0.0.1.12345 > 10.0.0.2.12345: UDP, length 16
15:54:54.469787 IP 10.0.0.1.12345 > 10.0.0.2.12345: UDP, length 16
15:54:54.470419 IP 10.0.0.1.12345 > 10.0.0.2.12345: UDP, length 16
15:54:54.471051 IP 10.0.0.1.12345 > 10.0.0.2.12345: UDP, length 16
15:54:54.471682 IP 10.0.0.1.12345 > 10.0.0.2.12345: UDP, length 16
15:54:54.472300 IP 10.0.0.1.12345 > 10.0.0.2.12345: UDP, length 16
15:54:54.472933 IP 10.0.0.1.12345 > 10.0.0.2.12345: UDP, length 16
15:54:54.473566 IP 10.0.0.1.12345 > 10.0.0.2.12345: UDP, length 16
15:54:54.474197 IP 10.0.0.1.12345 > 10.0.0.2.12345: UDP, length 16
15:54:54.474828 IP 10.0.0.1.12345 > 10.0.0.2.12345: UDP, length 16
15:54:54.475459 IP 10.0.0.1.12345 > 10.0.0.2.12345: UDP, length 16
15:54:54.476093 IP 10.0.0.1.12345 > 10.0.0.2.12345: UDP, length 16
15:54:54.476725 IP 10.0.0.1.12345 > 10.0.0.2.12345: UDP, length 16
15:54:54.477356 IP 10.0.0.1.12345 > 10.0.0.2.12345: UDP, length 16
15:54:54.477988 IP 10.0.0.1.12345 > 10.0.0.2.12345: UDP, length 16
15:54:54.478620 IP 10.0.0.1.12345 > 10.0.0.2.12345: UDP, length 16
15:54:54.479251 IP 10.0.0.1.12345 > 10.0.0.2.12345: UDP, length 16
15:54:54.479885 IP 10.0.0.1.12345 > 10.0.0.2.12345: UDP, length 16
15:54:54.480521 IP 10.0.0.1.12345 > 10.0.0.2.12345: UDP, length 16
15:54:54.481156 IP 10.0.0.1.12345 > 10.0.0.2.12345: UDP, length 16
15:54:54.481792 IP 10.0.0.1.12345 > 10.0.0.2.12345: UDP, length 16
15:54:54.482427 IP 10.0.0.1.12345 > 10.0.0.2.12345: UDP, length 16
15:54:54.483062 IP 10.0.0.1.12345 > 10.0.0.2.12345: UDP, length 16
15:54:54.483699 IP 10.0.0.1.12345 > 10.0.0.2.12345: UDP, length 16
15:54:54.484336 IP 10.0.0.1.12345 > 10.0.0.2.12345: UDP, length 16
15:54:54.484971 IP 10.0.0.1.12345 > 10.0.0.2.12345: UDP, length 16
15:54:54.485608 IP 10.0.0.1.12345 > 10.0.0.2.12345: UDP, length 16
15:54:54.486244 IP 10.0.0.1.12345 > 10.0.0.2.12345: UDP, length 16
15:54:54.486879 IP 10.0.0.1.12345 > 10.0.0.2.12345: UDP, length 16
15:54:54.487516 IP 10.0.0.1.12345 > 10.0.0.2.12345: UDP, length 16
15:54:54.488153 IP 10.0.0.1.12345 > 10.0.0.2.12345: UDP, length 16
15:54:54.488790 IP 10.0.0.1.12345 > 10.0.0.2.12345: UDP, length 16
15:54:54.489412 IP 10.0.0.1.12345 > 10.0.0.2.12345: UDP, length 16
15:54:54.490062 IP 10.0.0.1.12345 > 10.0.0.2.12345: UDP, length 16
15:54:54.490699 IP 10.0.0.1.12345 > 10.0.0.2.12345: UDP, length 16
15:54:54.491334 IP 10.0.0.1.12345 > 10.0.0.2.12345: UDP, length 16
15:54:54.491970 IP 10.0.0.1.12345 > 10.0.0.2.12345: UDP, length 16
15:54:54.492610 IP 10.0.0.1.12345 > 10.0.0.2.12345: UDP, length 16
15:54:54.493245 IP 10.0.0.1.12345 > 10.0.0.2.12345: UDP, length 16
15:54:54.493881 IP 10.0.0.1.12345 > 10.0.0.2.12345: UDP, length 16
15:54:54.494516 IP 10.0.0.1.12345 > 10.0.0.2.12345: UDP, length 16
15:54:54.495152 IP 10.0.0.1.12345 > 10.0.0.2.12345: UDP, length 16
15:54:54.495790 IP 10.0.0.1.12345 > 10.0.0.2.12345: UDP, length 16
15:54:54.496425 IP 10.0.0.1.12345 > 10.0.0.2.12345: UDP, length 16
15:54:54.497061 IP 10.0.0.1.12345 > 10.0.0.2.12345: UDP, length 16
15:54:54.497697 IP 10.0.0.1.12345 > 10.0.0.2.12345: UDP, length 16
15:54:54.498333 IP 10.0.0.1.12345 > 10.0.0.2.12345: UDP, length 16
15:54:54.498969 IP 10.0.0.1.12345 > 10.0.0.2.12345: UDP, length 16
15:54:54.499608 IP 10.0.0.1.12345 > 10.0.0.2.12345: UDP, length 16
15:54:54.500245 IP 10.0.0.1.12345 > 10.0.0.2.12345: UDP, length 16
15:54:54.500882 IP 10.0.0.1.12345 > 10.0.0.2.12345: UDP, length 16
15:54:54.501517 IP 10.0.0.1.12345 > 10.0.0.2.12345: UDP, length 16
15:54:54.502153 IP 10.0.0.1.12345 > 10.0.0.2.12345: UDP, length 16
15:54:54.502790 IP 10.0.0.1.12345 > 10.0.0.2.12345: UDP, length 16
15:54:54.503427 IP 10.0.0.1.12345 > 10.0.0.2.12345: UDP, length 16
15:54:54.504064 IP 10.0.0.1.12345 > 10.0.0.2.12345: UDP, length 16
15:54:54.504700 IP 10.0.0.1.12345 > 10.0.0.2.12345: UDP, length 16
15:54:54.505339 IP 10.0.0.1.12345 > 10.0.0.2.12345: UDP, length 16
15:54:54.505976 IP 10.0.0.1.12345 > 10.0.0.2.12345: UDP, length 16
15:54:54.506612 IP 10.0.0.1.12345 > 10.0.0.2.12345: UDP, length 16
15:54:54.507247 IP 10.0.0.1.12345 > 10.0.0.2.12345: UDP, length 16
15:54:54.507870 IP 10.0.0.1.12345 > 10.0.0.2.12345: UDP, length 16
15:54:54.508506 IP 10.0.0.1.12345 > 10.0.0.2.12345: UDP, length 16
15:54:54.509142 IP 10.0.0.1.12345 > 10.0.0.2.12345: UDP, length 16
15:54:54.509778 IP 10.0.0.1.12345 > 10.0.0.2.12345: UDP, length 16
15:54:54.510416 IP 10.0.0.1.12345 > 10.0.0.2.12345: UDP, length 16
15:54:54.511051 IP 10.0.0.1.12345 > 10.0.0.2.12345: UDP, length 16
15:54:54.511688 IP 10.0.0.1.12345 > 10.0.0.2.12345: UDP, length 16
15:54:54.512323 IP 10.0.0.1.12345 > 10.0.0.2.12345: UDP, length 16
15:54:54.512959 IP 10.0.0.1.12345 > 10.0.0.2.12345: UDP, length 16
15:54:54.513594 IP 10.0.0.1.12345 > 10.0.0.2.12345: UDP, length 16
15:54:54.514229 IP 10.0.0.1.12345 > 10.0.0.2.12345: UDP, length 16
15:54:54.514866 IP 10.0.0.1.12345 > 10.0.0.2.12345: UDP, length 16
15:54:54.515501 IP 10.0.0.1.12345 > 10.0.0.2.12345: UDP, length 16
15:54:54.516140 IP 10.0.0.1.12345 > 10.0.0.2.12345: UDP, length 16
15:54:54.516775 IP 10.0.0.1.12345 > 10.0.0.2.12345: UDP, length 16
15:54:54.517410 IP 10.0.0.1.12345 > 10.0.0.2.12345: UDP, length 16
15:54:54.518046 IP 10.0.0.1.12345 > 10.0.0.2.12345: UDP, length 16
15:54:54.518683 IP 10.0.0.1.12345 > 10.0.0.2.12345: UDP, length 16
15:54:54.519319 IP 10.0.0.1.12345 > 10.0.0.2.12345: UDP, length 16
15:54:54.519957 IP 10.0.0.1.12345 > 10.0.0.2.12345: UDP, length 16
15:54:54.520595 IP 10.0.0.1.12345 > 10.0.0.2.12345: UDP, length 16
15:54:54.521231 IP 10.0.0.1.12345 > 10.0.0.2.12345: UDP, length 16
15:54:54.521866 IP 10.0.0.1.12345 > 10.0.0.2.12345: UDP, length 16
15:54:54.522476 IP 10.0.0.1.12345 > 10.0.0.2.12345: UDP, length 16
15:54:54.523112 IP 10.0.0.1.12345 > 10.0.0.2.12345: UDP, length 16
15:54:54.523746 IP 10.0.0.1.12345 > 10.0.0.2.12345: UDP, length 16
15:54:54.524424 IP 10.0.0.1.12345 > 10.0.0.2.12345: UDP, length 16
15:54:54.525060 IP 10.0.0.1.12345 > 10.0.0.2.12345: UDP, length 16
15:54:54.525697 IP 10.0.0.1.12345 > 10.0.0.2.12345: UDP, length 16
15:54:54.526334 IP 10.0.0.1.12345 > 10.0.0.2.12345: UDP, length 16
15:54:54.526972 IP 10.0.0.1.12345 > 10.0.0.2.12345: UDP, length 16
15:54:54.527607 IP 10.0.0.1.12345 > 10.0.0.2.12345: UDP, length 16
15:54:54.528245 IP 10.0.0.1.12345 > 10.0.0.2.12345: UDP, length 16
15:54:54.528880 IP 10.0.0.1.12345 > 10.0.0.2.12345: UDP, length 16
15:54:54.529517 IP 10.0.0.1.12345 > 10.0.0.2.12345: UDP, length 16
15:54:54.530152 IP 10.0.0.1.12345 > 10.0.0.2.12345: UDP, length 16
15:54:54.530788 IP 10.0.0.1.12345 > 10.0.0.2.12345: UDP, length 16
15:54:54.531423 IP 10.0.0.1.12345 > 10.0.0.2.12345: UDP, length 16
15:54:54.532062 IP 10.0.0.1.12345 > 10.0.0.2.12345: UDP, length 16
15:54:54.532699 IP 10.0.0.1.12345 > 10.0.0.2.12345: UDP, length 16
15:54:54.533335 IP 10.0.0.1.12345 > 10.0.0.2.12345: UDP, length 16
15:54:54.533971 IP 10.0.0.1.12345 > 10.0.0.2.12345: UDP, length 16
15:54:54.534607 IP 10.0.0.1.12345 > 10.0.0.2.12345: UDP, length 16
15:54:54.535243 IP 10.0.0.1.12345 > 10.0.0.2.12345: UDP, length 16
15:54:54.535883 IP 10.0.0.1.12345 > 10.0.0.2.12345: UDP, length 16
15:54:54.536501 IP 10.0.0.1.12345 > 10.0.0.2.12345: UDP, length 16
15:54:54.537157 IP 10.0.0.1.12345 > 10.0.0.2.12345: UDP, length 16
15:54:54.537810 IP 10.0.0.1.12345 > 10.0.0.2.12345: UDP, length 16
15:54:54.538463 IP 10.0.0.1.12345 > 10.0.0.2.12345: UDP, length 16
15:54:54.539115 IP 10.0.0.1.12345 > 10.0.0.2.12345: UDP, length 16
15:54:54.539819 IP 10.0.0.1.12345 > 10.0.0.2.12345: UDP, length 16
15:54:54.540474 IP 10.0.0.1.12345 > 10.0.0.2.12345: UDP, length 16
15:54:54.541128 IP 10.0.0.1.12345 > 10.0.0.2.12345: UDP, length 16
15:54:54.541785 IP 10.0.0.1.12345 > 10.0.0.2.12345: UDP, length 16
15:54:54.542439 IP 10.0.0.1.12345 > 10.0.0.2.12345: UDP, length 16
15:54:54.543094 IP 10.0.0.1.12345 > 10.0.0.2.12345: UDP, length 16
15:54:54.543760 IP 10.0.0.1.12345 > 10.0.0.2.12345: UDP, length 16
15:54:54.544441 IP 10.0.0.1.12345 > 10.0.0.2.12345: UDP, length 16
15:54:54.545069 IP 10.0.0.1.12345 > 10.0.0.2.12345: UDP, length 16
15:54:54.545694 IP 10.0.0.1.12345 > 10.0.0.2.12345: UDP, length 16
15:54:54.546321 IP 10.0.0.1.12345 > 10.0.0.2.12345: UDP, length 16
15:54:54.546964 IP 10.0.0.1.12345 > 10.0.0.2.12345: UDP, length 16
15:54:54.547615 IP 10.0.0.1.12345 > 10.0.0.2.12345: UDP, length 16
15:54:54.548243 IP 10.0.0.1.12345 > 10.0.0.2.12345: UDP, length 16
15:54:54.548875 IP 10.0.0.1.12345 > 10.0.0.2.12345: UDP, length 16
15:54:54.549487 IP 10.0.0.1.12345 > 10.0.0.2.12345: UDP, length 16
15:54:54.550097 IP 10.0.0.1.12345 > 10.0.0.2.12345: UDP, length 16
15:54:54.550706 IP 10.0.0.1.12345 > 10.0.0.2.12345: UDP, length 16
15:54:54.551353 IP 10.0.0.1.12345 > 10.0.0.2.12345: UDP, length 16
15:54:54.551945 IP 10.0.0.1.12345 > 10.0.0.2.12345: UDP, length 16
15:54:54.552593 IP 10.0.0.1.12345 > 10.0.0.2.12345: UDP, length 16
15:54:54.553243 IP 10.0.0.1.12345 > 10.0.0.2.12345: UDP, length 16
15:54:54.553893 IP 10.0.0.1.12345 > 10.0.0.2.12345: UDP, length 16
15:54:54.554544 IP 10.0.0.1.12345 > 10.0.0.2.12345: UDP, length 16
15:54:54.555195 IP 10.0.0.1.12345 > 10.0.0.2.12345: UDP, length 16
15:54:54.555880 IP 10.0.0.1.12345 > 10.0.0.2.12345: UDP, length 16
15:54:54.556532 IP 10.0.0.1.12345 > 10.0.0.2.12345: UDP, length 16
15:54:54.557183 IP 10.0.0.1.12345 > 10.0.0.2.12345: UDP, length 16
15:54:54.557836 IP 10.0.0.1.12345 > 10.0.0.2.12345: UDP, length 16
15:54:54.558486 IP 10.0.0.1.12345 > 10.0.0.2.12345: UDP, length 16
15:54:54.559137 IP 10.0.0.1.12345 > 10.0.0.2.12345: UDP, length 16
15:54:54.559831 IP 10.0.0.1.12345 > 10.0.0.2.12345: UDP, length 16
15:54:54.560482 IP 10.0.0.1.12345 > 10.0.0.2.12345: UDP, length 16
15:54:54.561135 IP 10.0.0.1.12345 > 10.0.0.2.12345: UDP, length 16
15:54:54.561787 IP 10.0.0.1.12345 > 10.0.0.2.12345: UDP, length 16
15:54:54.562437 IP 10.0.0.1.12345 > 10.0.0.2.12345: UDP, length 16
15:54:54.563088 IP 10.0.0.1.12345 > 10.0.0.2.12345: UDP, length 16
15:54:54.563740 IP 10.0.0.1.12345 > 10.0.0.2.12345: UDP, length 16
15:54:54.564447 IP 10.0.0.1.12345 > 10.0.0.2.12345: UDP, length 16
15:54:54.565099 IP 10.0.0.1.12345 > 10.0.0.2.12345: UDP, length 16
15:54:54.565750 IP 10.0.0.1.12345 > 10.0.0.2.12345: UDP, length 16
15:54:54.566402 IP 10.0.0.1.12345 > 10.0.0.2.12345: UDP, length 16
15:54:54.567054 IP 10.0.0.1.12345 > 10.0.0.2.12345: UDP, length 16
15:54:54.567704 IP 10.0.0.1.12345 > 10.0.0.2.12345: UDP, length 16
15:54:54.568308 IP 10.0.0.1.12345 > 10.0.0.2.12345: UDP, length 16
15:54:54.568965 IP 10.0.0.1.12345 > 10.0.0.2.12345: UDP, length 16
15:54:54.569617 IP 10.0.0.1.12345 > 10.0.0.2.12345: UDP, length 16
15:54:54.570267 IP 10.0.0.1.12345 > 10.0.0.2.12345: UDP, length 16
15:54:54.570919 IP 10.0.0.1.12345 > 10.0.0.2.12345: UDP, length 16
15:54:54.571570 IP 10.0.0.1.12345 > 10.0.0.2.12345: UDP, length 16
15:54:54.572188 IP 10.0.0.1.12345 > 10.0.0.2.12345: UDP, length 16
15:54:54.572836 IP 10.0.0.1.12345 > 10.0.0.2.12345: UDP, length 16
15:54:54.573487 IP 10.0.0.1.12345 > 10.0.0.2.12345: UDP, length 16
15:54:54.574138 IP 10.0.0.1.12345 > 10.0.0.2.12345: UDP, length 16
15:54:54.574789 IP 10.0.0.1.12345 > 10.0.0.2.12345: UDP, length 16
15:54:54.575440 IP 10.0.0.1.12345 > 10.0.0.2.12345: UDP, length 16
15:54:54.576059 IP 10.0.0.1.12345 > 10.0.0.2.12345: UDP, length 16
15:54:54.576709 IP 10.0.0.1.12345 > 10.0.0.2.12345: UDP, length 16
15:54:54.577359 IP 10.0.0.1.12345 > 10.0.0.2.12345: UDP, length 16
15:54:54.578009 IP 10.0.0.1.12345 > 10.0.0.2.12345: UDP, length 16
15:54:54.578659 IP 10.0.0.1.12345 > 10.0.0.2.12345: UDP, length 16
15:54:54.579310 IP 10.0.0.1.12345 > 10.0.0.2.12345: UDP, length 16
15:54:54.579903 IP 10.0.0.1.12345 > 10.0.0.2.12345: UDP, length 16
15:54:54.580552 IP 10.0.0.1.12345 > 10.0.0.2.12345: UDP, length 16
15:54:54.581206 IP 10.0.0.1.12345 > 10.0.0.2.12345: UDP, length 16
15:54:54.581859 IP 10.0.0.1.12345 > 10.0.0.2.12345: UDP, length 16
15:54:54.582513 IP 10.0.0.1.12345 > 10.0.0.2.12345: UDP, length 16
15:54:54.583166 IP 10.0.0.1.12345 > 10.0.0.2.12345: UDP, length 16
15:54:54.583824 IP 10.0.0.1.12345 > 10.0.0.2.12345: UDP, length 16
15:54:54.584475 IP 10.0.0.1.12345 > 10.0.0.2.12345: UDP, length 16
15:54:54.585129 IP 10.0.0.1.12345 > 10.0.0.2.12345: UDP, length 16
15:54:54.585781 IP 10.0.0.1.12345 > 10.0.0.2.12345: UDP, length 16
15:54:54.586433 IP 10.0.0.1.12345 > 10.0.0.2.12345: UDP, length 16
15:54:54.587086 IP 10.0.0.1.12345 > 10.0.0.2.12345: UDP, length 16
15:54:54.587739 IP 10.0.0.1.12345 > 10.0.0.2.12345: UDP, length 16
15:54:54.588427 IP 10.0.0.1.12345 > 10.0.0.2.12345: UDP, length 16
15:54:54.589079 IP 10.0.0.1.12345 > 10.0.0.2.12345: UDP, length 16
15:54:54.589731 IP 10.0.0.1.12345 > 10.0.0.2.12345: UDP, length 16
15:54:54.590390 IP 10.0.0.1.12345 > 10.0.0.2.12345: UDP, length 16
15:54:54.591062 IP 10.0.0.1.12345 > 10.0.0.2.12345: UDP, length 16
15:54:54.591733 IP 10.0.0.1.12345 > 10.0.0.2.12345: UDP, length 16
15:54:54.592404 IP 10.0.0.1.12345 > 10.0.0.2.12345: UDP, length 16
15:54:54.593074 IP 10.0.0.1.12345 > 10.0.0.2.12345: UDP, length 16
15:54:54.593746 IP 10.0.0.1.12345 > 10.0.0.2.12345: UDP, length 16
15:54:54.594417 IP 10.0.0.1.12345 > 10.0.0.2.12345: UDP, length 16
15:54:54.595088 IP 10.0.0.1.12345 > 10.0.0.2.12345: UDP, length 16
15:54:54.595770 IP 10.0.0.1.12345 > 10.0.0.2.12345: UDP, length 16
15:54:54.596472 IP 10.0.0.1.12345 > 10.0.0.2.12345: UDP, length 16
15:54:54.597142 IP 10.0.0.1.12345 > 10.0.0.2.12345: UDP, length 16
15:54:54.597816 IP 10.0.0.1.12345 > 10.0.0.2.12345: UDP, length 16
15:54:54.598487 IP 10.0.0.1.12345 > 10.0.0.2.12345: UDP, length 16
15:54:54.599158 IP 10.0.0.1.12345 > 10.0.0.2.12345: UDP, length 16
15:54:54.599848 IP 10.0.0.1.12345 > 10.0.0.2.12345: UDP, length 16
15:54:54.600533 IP 10.0.0.1.12345 > 10.0.0.2.12345: UDP, length 16
15:54:54.601204 IP 10.0.0.1.12345 > 10.0.0.2.12345: UDP, length 16
15:54:54.601877 IP 10.0.0.1.12345 > 10.0.0.2.12345: UDP, length 16
15:54:54.602548 IP 10.0.0.1.12345 > 10.0.0.2.12345: UDP, length 16
15:54:54.603220 IP 10.0.0.1.12345 > 10.0.0.2.12345: UDP, length 16
15:54:54.603883 IP 10.0.0.1.12345 > 10.0.0.2.12345: UDP, length 16
15:54:54.604553 IP 10.0.0.1.12345 > 10.0.0.2.12345: UDP, length 16
15:54:54.605225 IP 10.0.0.1.12345 > 10.0.0.2.12345: UDP, length 16
15:54:54.605896 IP 10.0.0.1.12345 > 10.0.0.2.12345: UDP, length 16
15:54:54.606549 IP 10.0.0.1.12345 > 10.0.0.2.12345: UDP, length 16
15:54:54.607220 IP 10.0.0.1.12345 > 10.0.0.2.12345: UDP, length 16
15:54:54.607884 IP 10.0.0.1.12345 > 10.0.0.2.12345: UDP, length 16
15:54:54.608555 IP 10.0.0.1.12345 > 10.0.0.2.12345: UDP, length 16
15:54:54.609227 IP 10.0.0.1.12345 > 10.0.0.2.12345: UDP, length 16
15:54:54.609899 IP 10.0.0.1.12345 > 10.0.0.2.12345: UDP, length 16
15:54:54.610569 IP 10.0.0.1.12345 > 10.0.0.2.12345: UDP, length 16
15:54:54.611241 IP 10.0.0.1.12345 > 10.0.0.2.12345: UDP, length 16
15:54:54.611900 IP 10.0.0.1.12345 > 10.0.0.2.12345: UDP, length 16
15:54:54.612571 IP 10.0.0.1.12345 > 10.0.0.2.12345: UDP, length 16
15:54:54.613242 IP 10.0.0.1.12345 > 10.0.0.2.12345: UDP, length 16
15:54:54.613916 IP 10.0.0.1.12345 > 10.0.0.2.12345: UDP, length 16
15:54:54.614587 IP 10.0.0.1.12345 > 10.0.0.2.12345: UDP, length 16
15:54:54.615257 IP 10.0.0.1.12345 > 10.0.0.2.12345: UDP, length 16
15:54:54.615916 IP 10.0.0.1.12345 > 10.0.0.2.12345: UDP, length 16
15:54:54.616587 IP 10.0.0.1.12345 > 10.0.0.2.12345: UDP, length 16
15:54:54.617257 IP 10.0.0.1.12345 > 10.0.0.2.12345: UDP, length 16
15:54:54.617931 IP 10.0.0.1.12345 > 10.0.0.2.12345: UDP, length 16
15:54:54.618603 IP 10.0.0.1.12345 > 10.0.0.2.12345: UDP, length 16
15:54:54.619274 IP 10.0.0.1.12345 > 10.0.0.2.12345: UDP, length 16
15:54:54.619951 IP 10.0.0.1.12345 > 10.0.0.2.12345: UDP, length 16
15:54:54.620622 IP 10.0.0.1.12345 > 10.0.0.2.12345: UDP, length 16
15:54:54.621293 IP 10.0.0.1.12345 > 10.0.0.2.12345: UDP, length 16
15:54:54.621968 IP 10.0.0.1.12345 > 10.0.0.2.12345: UDP, length 16
15:54:54.622638 IP 10.0.0.1.12345 > 10.0.0.2.12345: UDP, length 16
15:54:54.623308 IP 10.0.0.1.12345 > 10.0.0.2.12345: UDP, length 16
15:54:54.624004 IP 10.0.0.1.12345 > 10.0.0.2.12345: UDP, length 16
15:54:54.624675 IP 10.0.0.1.12345 > 10.0.0.2.12345: UDP, length 16
15:54:54.625346 IP 10.0.0.1.12345 > 10.0.0.2.12345: UDP, length 16
15:54:54.626018 IP 10.0.0.1.12345 > 10.0.0.2.12345: UDP, length 16
15:54:54.626688 IP 10.0.0.1.12345 > 10.0.0.2.12345: UDP, length 16
15:54:54.627359 IP 10.0.0.1.12345 > 10.0.0.2.12345: UDP, length 16
15:54:54.628034 IP 10.0.0.1.12345 > 10.0.0.2.12345: UDP, length 16
15:54:54.628704 IP 10.0.0.1.12345 > 10.0.0.2.12345: UDP, length 16
15:54:54.629376 IP 10.0.0.1.12345 > 10.0.0.2.12345: UDP, length 16
15:54:54.630048 IP 10.0.0.1.12345 > 10.0.0.2.12345: UDP, length 16
15:54:54.630718 IP 10.0.0.1.12345 > 10.0.0.2.12345: UDP, length 16
15:54:54.631389 IP 10.0.0.1.12345 > 10.0.0.2.12345: UDP, length 16
15:54:54.632047 IP 10.0.0.1.12345 > 10.0.0.2.12345: UDP, length 16
15:54:54.632704 IP 10.0.0.1.12345 > 10.0.0.2.12345: UDP, length 16
15:54:54.633361 IP 10.0.0.1.12345 > 10.0.0.2.12345: UDP, length 16
15:54:54.634016 IP 10.0.0.1.12345 > 10.0.0.2.12345: UDP, length 16
15:54:54.634672 IP 10.0.0.1.12345 > 10.0.0.2.12345: UDP, length 16
15:54:54.635327 IP 10.0.0.1.12345 > 10.0.0.2.12345: UDP, length 16
15:54:54.635985 IP 10.0.0.1.12345 > 10.0.0.2.12345: UDP, length 16
15:54:54.636641 IP 10.0.0.1.12345 > 10.0.0.2.12345: UDP, length 16
15:54:54.637296 IP 10.0.0.1.12345 > 10.0.0.2.12345: UDP, length 16
15:54:54.637954 IP 10.0.0.1.12345 > 10.0.0.2.12345: UDP, length 16
15:54:54.638610 IP 10.0.0.1.12345 > 10.0.0.2.12345: UDP, length 16
15:54:54.639282 IP 10.0.0.1.12345 > 10.0.0.2.12345: UDP, length 16
15:54:54.639960 IP 10.0.0.1.12345 > 10.0.0.2.12345: UDP, length 16
15:54:54.640633 IP 10.0.0.1.12345 > 10.0.0.2.12345: UDP, length 16
15:54:54.641303 IP 10.0.0.1.12345 > 10.0.0.2.12345: UDP, length 16
15:54:54.641977 IP 10.0.0.1.12345 > 10.0.0.2.12345: UDP, length 16
15:54:54.642647 IP 10.0.0.1.12345 > 10.0.0.2.12345: UDP, length 16
15:54:54.643316 IP 10.0.0.1.12345 > 10.0.0.2.12345: UDP, length 16
15:54:54.643993 IP 10.0.0.1.12345 > 10.0.0.2.12345: UDP, length 16
15:54:54.644664 IP 10.0.0.1.12345 > 10.0.0.2.12345: UDP, length 16
15:54:54.645278 IP 10.0.0.1.12345 > 10.0.0.2.12345: UDP, length 16
15:54:54.645893 IP 10.0.0.1.12345 > 10.0.0.2.12345: UDP, length 16
15:54:54.646506 IP 10.0.0.1.12345 > 10.0.0.2.12345: UDP, length 16
15:54:54.647120 IP 10.0.0.1.12345 > 10.0.0.2.12345: UDP, length 16
15:54:54.647734 IP 10.0.0.1.12345 > 10.0.0.2.12345: UDP, length 16
15:54:54.648353 IP 10.0.0.1.12345 > 10.0.0.2.12345: UDP, length 16
15:54:54.648969 IP 10.0.0.1.12345 > 10.0.0.2.12345: UDP, length 16
15:54:54.649583 IP 10.0.0.1.12345 > 10.0.0.2.12345: UDP, length 16
15:54:54.650197 IP 10.0.0.1.12345 > 10.0.0.2.12345: UDP, length 16
15:54:54.650812 IP 10.0.0.1.12345 > 10.0.0.2.12345: UDP, length 16
15:54:54.651425 IP 10.0.0.1.12345 > 10.0.0.2.12345: UDP, length 16
15:54:54.652040 IP 10.0.0.1.12345 > 10.0.0.2.12345: UDP, length 16
15:54:54.652655 IP 10.0.0.1.12345 > 10.0.0.2.12345: UDP, length 16
15:54:54.653268 IP 10.0.0.1.12345 > 10.0.0.2.12345: UDP, length 16
15:54:54.653882 IP 10.0.0.1.12345 > 10.0.0.2.12345: UDP, length 16
15:54:54.654496 IP 10.0.0.1.12345 > 10.0.0.2.12345: UDP, length 16
15:54:54.655110 IP 10.0.0.1.12345 > 10.0.0.2.12345: UDP, length 16
15:54:54.655723 IP 10.0.0.1.12345 > 10.0.0.2.12345: UDP, length 16
15:54:54.656338 IP 10.0.0.1.12345 > 10.0.0.2.12345: UDP, length 16
15:54:54.656955 IP 10.0.0.1.12345 > 10.0.0.2.12345: UDP, length 16
15:54:54.657568 IP 10.0.0.1.12345 > 10.0.0.2.12345: UDP, length 16
15:54:54.658183 IP 10.0.0.1.12345 > 10.0.0.2.12345: UDP, length 16
15:54:54.658796 IP 10.0.0.1.12345 > 10.0.0.2.12345: UDP, length 16
15:54:54.659411 IP 10.0.0.1.12345 > 10.0.0.2.12345: UDP, length 16
15:54:54.660026 IP 10.0.0.1.12345 > 10.0.0.2.12345: UDP, length 16
15:54:54.660641 IP 10.0.0.1.12345 > 10.0.0.2.12345: UDP, length 16
15:54:54.661254 IP 10.0.0.1.12345 > 10.0.0.2.12345: UDP, length 16
15:54:54.661884 IP 10.0.0.1.12345 > 10.0.0.2.12345: UDP, length 16
15:54:54.662515 IP 10.0.0.1.12345 > 10.0.0.2.12345: UDP, length 16
15:54:54.663147 IP 10.0.0.1.12345 > 10.0.0.2.12345: UDP, length 16
15:54:54.663782 IP 10.0.0.1.12345 > 10.0.0.2.12345: UDP, length 16
15:54:54.664414 IP 10.0.0.1.12345 > 10.0.0.2.12345: UDP, length 16
15:54:54.665046 IP 10.0.0.1.12345 > 10.0.0.2.12345: UDP, length 16
15:54:54.665678 IP 10.0.0.1.12345 > 10.0.0.2.12345: UDP, length 16
15:54:54.666310 IP 10.0.0.1.12345 > 10.0.0.2.12345: UDP, length 16
15:54:54.666942 IP 10.0.0.1.12345 > 10.0.0.2.12345: UDP, length 16
15:54:54.667573 IP 10.0.0.1.12345 > 10.0.0.2.12345: UDP, length 16
15:54:54.668206 IP 10.0.0.1.12345 > 10.0.0.2.12345: UDP, length 16
15:54:54.668838 IP 10.0.0.1.12345 > 10.0.0.2.12345: UDP, length 16
15:54:54.669472 IP 10.0.0.1.12345 > 10.0.0.2.12345: UDP, length 16
15:54:54.670103 IP 10.0.0.1.12345 > 10.0.0.2.12345: UDP, length 16
