13:57:17.368973 IP 10.33.133.64.12345 > 10.0.0.2.12345: UDP, length 16
13:57:18.169290 IP 10.62.80.128.12345 > 10.0.0.2.12345: UDP, length 16
13:57:18.969499 IP 10.100.111.24.12345 > 10.0.0.2.12345: UDP, length 16
13:57:19.769754 IP 10.58.129.252.12345 > 10.0.0.2.12345: UDP, length 16
13:57:20.570045 IP 10.90.149.149.12345 > 10.0.0.2.12345: UDP, length 16
13:57:21.370394 IP 10.111.45.150.12345 > 10.0.0.2.12345: UDP, length 16
13:57:22.170708 IP 10.25.185.92.12345 > 10.0.0.2.12345: UDP, length 16
13:57:22.971013 IP 10.92.90.248.12345 > 10.0.0.2.12345: UDP, length 16
13:57:23.771347 IP 10.44.173.84.12345 > 10.0.0.2.12345: UDP, length 16
13:57:24.571694 IP 10.83.134.155.12345 > 10.0.0.2.12345: UDP, length 16
13:57:25.372042 IP 10.100.201.187.12345 > 10.0.0.2.12345: UDP, length 16
13:57:26.172372 IP 10.42.53.180.12345 > 10.0.0.2.12345: UDP, length 16
13:57:26.972727 IP 10.68.78.195.12345 > 10.0.0.2.12345: UDP, length 16
13:57:27.772961 IP 10.45.229.114.12345 > 10.0.0.2.12345: UDP, length 16
13:57:28.573288 IP 10.75.106.172.12345 > 10.0.0.2.12345: UDP, length 16
13:57:29.373673 IP 10.69.61.147.12345 > 10.0.0.2.12345: UDP, length 16
13:57:30.174011 IP 10.90.58.19.12345 > 10.0.0.2.12345: UDP, length 16
13:57:30.974352 IP 10.61.157.20.12345 > 10.0.0.2.12345: UDP, length 16
13:57:31.774618 IP 10.39.96.204.12345 > 10.0.0.2.12345: UDP, length 16
13:57:32.574845 IP 10.93.149.160.12345 > 10.0.0.2.12345: UDP, length 16
13:57:33.375176 IP 10.3.190.107.12345 > 10.0.0.2.12345: UDP, length 16
13:57:34.175509 IP 10.35.232.102.12345 > 10.0.0.2.12345: UDP, length 16
13:57:34.975817 IP 10.54.153.4.12345 > 10.0.0.2.12345: UDP, length 16
13:57:35.776077 IP 10.108.32.206.12345 > 10.0.0.2.12345: UDP, length 16
13:57:36.576414 IP 10.33.180.192.12345 > 10.0.0.2.12345: UDP, length 16
13:57:37.376767 IP 10.1.135.206.12345 > 10.0.0.2.12345: UDP, length 16
13:57:38.177113 IP 10.55.50.149.12345 > 10.0.0.2.12345: UDP, length 16
13:57:38.977463 IP 10.37.29.24.12345 > 10.0.0.2.12345: UDP, length 16
13:57:39.777740 IP 10.125.153.149.12345 > 10.0.0.2.12345: UDP, length 16
13:57:40.578023 IP 10.31.155.240.12345 > 10.0.0.2.12345: UDP, length 16
13:57:41.378367 IP 10.30.245.2.12345 > 10.0.0.2.12345: UDP, length 16
13:57:42.178687 IP 10.83.130.90.12345 > 10.0.0.2.12345: UDP, length 16
13:57:42.979027 IP 10.50.38.145.12345 > 10.0.0.2.12345: UDP, length 16
13:57:43.779304 IP 10.31.172.129.12345 > 10.0.0.2.12345: UDP, length 16
13:57:44.579610 IP 10.120.194.159.12345 > 10.0.0.2.12345: UDP, length 16
13:57:45.379953 IP 10.23.116.226.12345 > 10.0.0.2.12345: UDP, length 16
13:57:46.180368 IP 10.111.229.22.12345 > 10.0.0.2.12345: UDP, length 16
13:57:46.980707 IP 10.45.195.119.12345 > 10.0.0.2.12345: UDP, length 16
13:57:47.781060 IP 10.88.119.159.12345 > 10.0.0.2.12345: UDP, length 16
13:57:48.581409 IP 10.118.235.46.12345 > 10.0.0.2.12345: UDP, length 16
13:57:49.381771 IP 10.69.46.115.12345 > 10.0.0.2.12345: UDP, length 16
13:57:50.182090 IP 10.17.51.200.12345 > 10.0.0.2.12345: UDP, length 16
13:57:50.982419 IP 10.32.93.127.12345 > 10.0.0.2.12345: UDP, length 16
13:57:51.782796 IP 10.76.93.76.12345 > 10.0.0.2.12345: UDP, length 16
13:57:52.583152 IP 10.118.254.69.12345 > 10.0.0.2.12345: UDP, length 16
13:57:53.383463 IP 10.48.106.176.12345 > 10.0.0.2.12345: UDP, length 16
13:57:54.183755 IP 10.103.200.142.12345 > 10.0.0.2.12345: UDP, length 16
13:57:54.984082 IP 10.96.62.105.12345 > 10.0.0.2.12345: UDP, length 16
13:57:55.784404 IP 10.31.70.215.12345 > 10.0.0.2.12345: UDP, length 16
13:57:56.584694 IP 10.124.207.108.12345 > 10.0.0.2.12345: UDP, length 16
13:57:57.384980 IP 10.12.91.147.12345 > 10.0.0.2.12345: UDP, length 16
13:57:58.185306 IP 10.65.202.91.12345 > 10.0.0.2.12345: UDP, length 16
13:57:58.985634 IP 10.91.188.40.12345 > 10.0.0.2.12345: UDP, length 16
13:57:59.785970 IP 10.29.85.149.12345 > 10.0.0.2.12345: UDP, length 16
13:58:00.586184 IP 10.116.2.197.12345 > 10.0.0.2.12345: UDP, length 16
13:58:01.386479 IP 10.9.251.129.12345 > 10.0.0.2.12345: UDP, length 16
13:58:02.186753 IP 10.127.179.105.12345 > 10.0.0.2.12345: UDP, length 16
13:58:02.987069 IP 10.86.33.175.12345 > 10.0.0.2.12345: UDP, length 16
13:58:03.787419 IP 10.72.235.9.12345 > 10.0.0.2.12345: UDP, length 16
13:58:04.587744 IP 10.118.236.206.12345 > 10.0.0.2.12345: UDP, length 16
13:58:05.388082 IP 10.103.31.24.12345 > 10.0.0.2.12345: UDP, length 16
13:58:06.188355 IP 10.49.234.12.12345 > 10.0.0.2.12345: UDP, length 16
13:58:06.988637 IP 10.1.160.236.12345 > 10.0.0.2.12345: UDP, length 16
13:58:07.788976 IP 10.58.19.73.12345 > 10.0.0.2.12345: UDP, length 16
13:58:08.589291 IP 10.48.172.89.12345 > 10.0.0.2.12345: UDP, length 16
13:58:09.389592 IP 10.94.218.101.12345 > 10.0.0.2.12345: UDP, length 16
13:58:10.189793 IP 10.45.167.20.12345 > 10.0.0.2.12345: UDP, length 16
13:58:10.990022 IP 10.121.96.117.12345 > 10.0.0.2.12345: UDP, length 16
13:58:11.790324 IP 10.24.205.43.12345 > 10.0.0.2.12345: UDP, length 16
13:58:12.590650 IP 10.63.31.189.12345 > 10.0.0.2.12345: UDP, length 16
13:58:13.390991 IP 10.26.108.107.12345 > 10.0.0.2.12345: UDP, length 16
13:58:14.191265 IP 10.117.80.124.12345 > 10.0.0.2.12345: UDP, length 16
13:58:14.991558 IP 10.3.197.195.12345 > 10.0.0.2.12345: UDP, length 16
13:58:15.791918 IP 10.93.138.215.12345 > 10.0.0.2.12345: UDP, length 16
13:58:16.592293 IP 10.90.217.147.12345 > 10.0.0.2.12345: UDP, length 16
13:58:17.392567 IP 10.82.252.247.12345 > 10.0.0.2.12345: UDP, length 16
13:58:18.192884 IP 10.114.50.73.12345 > 10.0.0.2.12345: UDP, length 16
13:58:18.993208 IP 10.26.233.116.12345 > 10.0.0.2.12345: UDP, length 16
13:58:19.793550 IP 10.122.198.120.12345 > 10.0.0.2.12345: UDP, length 16
13:58:20.593871 IP 10.19.122.222.12345 > 10.0.0.2.12345: UDP, length 16
13:58:21.394201 IP 10.0.20.203.12345 > 10.0.0.2.12345: UDP, length 16
13:58:22.194463 IP 10.77.173.179.12345 > 10.0.0.2.12345: UDP, length 16
13:58:22.994733 IP 10.103.123.154.12345 > 10.0.0.2.12345: UDP, length 16
13:58:23.795065 IP 10.40.56.184.12345 > 10.0.0.2.12345: UDP, length 16
13:58:24.595359 IP 10.113.9.172.12345 > 10.0.0.2.12345: UDP, length 16
13:58:25.395682 IP 10.112.156.22.12345 > 10.0.0.2.12345: UDP, length 16
13:58:26.195941 IP 10.102.144.200.12345 > 10.0.0.2.12345: UDP, length 16
13:58:26.996320 IP 10.8.214.146.12345 > 10.0.0.2.12345: UDP, length 16
13:58:27.796674 IP 10.22.225.131.12345 > 10.0.0.2.12345: UDP, length 16
13:58:28.597000 IP 10.14.151.48.12345 > 10.0.0.2.12345: UDP, length 16
13:58:29.397268 IP 10.6.235.46.12345 > 10.0.0.2.12345: UDP, length 16
13:58:30.197522 IP 10.107.23.225.12345 > 10.0.0.2.12345: UDP, length 16
13:58:30.997820 IP 10.17.161.62.12345 > 10.0.0.2.12345: UDP, length 16
13:58:31.798148 IP 10.43.93.60.12345 > 10.0.0.2.12345: UDP, length 16
13:58:32.598454 IP 10.11.183.29.12345 > 10.0.0.2.12345: UDP, length 16
13:58:33.398784 IP 10.102.6.67.12345 > 10.0.0.2.12345: UDP, length 16
13:58:34.199052 IP 10.92.128.66.12345 > 10.0.0.2.12345: UDP, length 16
13:58:34.999329 IP 10.66.14.121.12345 > 10.0.0.2.12345: UDP, length 16
13:58:35.799674 IP 10.123.41.35.12345 > 10.0.0.2.12345: UDP, length 16
13:58:36.600048 IP 10.47.76.222.12345 > 10.0.0.2.12345: UDP, length 16
13:58:37.400397 IP 10.113.24.19.12345 > 10.0.0.2.12345: UDP, length 16
13:58:38.200689 IP 10.69.51.94.12345 > 10.0.0.2.12345: UDP, length 16
13:58:39.001017 IP 10.16.56.42.12345 > 10.0.0.2.12345: UDP, length 16
13:58:39.801372 IP 10.66.235.173.12345 > 10.0.0.2.12345: UDP, length 16
13:58:40.601702 IP 10.57.247.1.12345 > 10.0.0.2.12345: UDP, length 16
13:58:41.402037 IP 10.98.123.35.12345 > 10.0.0.2.12345: UDP, length 16
13:58:42.202291 IP 10.83.109.172.12345 > 10.0.0.2.12345: UDP, length 16
13:58:43.002576 IP 10.3.8.180.12345 > 10.0.0.2.12345: UDP, length 16
13:58:43.802867 IP 10.119.126.145.12345 > 10.0.0.2.12345: UDP, length 16
13:58:44.603119 IP 10.92.109.245.12345 > 10.0.0.2.12345: UDP, length 16
13:58:45.403365 IP 10.111.30.190.12345 > 10.0.0.2.12345: UDP, length 16
13:58:46.203587 IP 10.127.58.177.12345 > 10.0.0.2.12345: UDP, length 16
13:58:47.003743 IP 10.68.4.0.12345 > 10.0.0.2.12345: UDP, length 16
13:58:47.803925 IP 10.118.101.32.12345 > 10.0.0.2.12345: UDP, length 16
13:58:48.604094 IP 10.34.40.199.12345 > 10.0.0.2.12345: UDP, length 16
13:58:49.404270 IP 10.80.115.66.12345 > 10.0.0.2.12345: UDP, length 16
13:58:50.204409 IP 10.13.55.68.12345 > 10.0.0.2.12345: UDP, length 16
13:58:51.004650 IP 10.72.99.23.12345 > 10.0.0.2.12345: UDP, length 16
13:58:51.804939 IP 10.114.130.88.12345 > 10.0.0.2.12345: UDP, length 16
13:58:52.605229 IP 10.73.135.252.12345 > 10.0.0.2.12345: UDP, length 16
13:58:53.405502 IP 10.53.73.135.12345 > 10.0.0.2.12345: UDP, length 16
13:58:54.205770 IP 10.13.211.50.12345 > 10.0.0.2.12345: UDP, length 16
13:58:55.006056 IP 10.90.33.92.12345 > 10.0.0.2.12345: UDP, length 16
13:58:55.806316 IP 10.48.37.212.12345 > 10.0.0.2.12345: UDP, length 16
13:58:56.606560 IP 10.107.154.163.12345 > 10.0.0.2.12345: UDP, length 16
13:58:57.406775 IP 10.4.222.1.12345 > 10.0.0.2.12345: UDP, length 16
13:58:58.206969 IP 10.25.231.73.12345 > 10.0.0.2.12345: UDP, length 16
13:58:59.007263 IP 10.88.56.173.12345 > 10.0.0.2.12345: UDP, length 16
13:58:59.807594 IP 10.99.36.77.12345 > 10.0.0.2.12345: UDP, length 16
13:59:00.607916 IP 10.63.156.145.12345 > 10.0.0.2.12345: UDP, length 16
13:59:01.408334 IP 10.116.170.5.12345 > 10.0.0.2.12345: UDP, length 16
13:59:02.208662 IP 10.93.58.143.12345 > 10.0.0.2.12345: UDP, length 16
13:59:03.009001 IP 10.10.127.155.12345 > 10.0.0.2.12345: UDP, length 16
13:59:03.809311 IP 10.126.154.223.12345 > 10.0.0.2.12345: UDP, length 16
13:59:04.609583 IP 10.90.80.170.12345 > 10.0.0.2.12345: UDP, length 16
13:59:05.409899 IP 10.3.48.157.12345 > 10.0.0.2.12345: UDP, length 16
13:59:06.210079 IP 10.47.7.77.12345 > 10.0.0.2.12345: UDP, length 16
13:59:07.010329 IP 10.127.194.133.12345 > 10.0.0.2.12345: UDP, length 16
13:59:07.810602 IP 10.69.157.204.12345 > 10.0.0.2.12345: UDP, length 16
13:59:08.610916 IP 10.105.190.137.12345 > 10.0.0.2.12345: UDP, length 16
13:59:09.411249 IP 10.53.233.30.12345 > 10.0.0.2.12345: UDP, length 16
13:59:10.211563 IP 10.21.191.218.12345 > 10.0.0.2.12345: UDP, length 16
13:59:11.011882 IP 10.123.74.48.12345 > 10.0.0.2.12345: UDP, length 16
13:59:11.812077 IP 10.16.132.86.12345 > 10.0.0.2.12345: UDP, length 16
13:59:12.612358 IP 10.82.28.120.12345 > 10.0.0.2.12345: UDP, length 16
13:59:13.412693 IP 10.117.175.14.12345 > 10.0.0.2.12345: UDP, length 16
13:59:14.213015 IP 10.5.213.9.12345 > 10.0.0.2.12345: UDP, length 16
13:59:15.013336 IP 10.70.191.208.12345 > 10.0.0.2.12345: UDP, length 16
13:59:15.813680 IP 10.117.254.18.12345 > 10.0.0.2.12345: UDP, length 16
13:59:16.613988 IP 10.80.2.100.12345 > 10.0.0.2.12345: UDP, length 16

