Apr 11, 2020 17:54:41.380574410 CST    127.0.0.1 → 127.0.0.1    OpenFlow Type: OFPT_ECHO_REQUEST
Apr 11, 2020 17:54:41.381409931 CST    127.0.0.1 → 127.0.0.1    OpenFlow Type: OFPT_ECHO_REPLY
Apr 11, 2020 17:54:41.381441358 CST    127.0.0.1 → 127.0.0.1    TCP 57626 → 6653 [ACK] Seq=9 Ack=9 Win=86 Len=0 TSval=2752539675 TSecr=2752539675
Apr 11, 2020 17:54:43.977663416 CST    127.0.0.1 → 127.0.0.1    OpenFlow Type: OFPT_PACKET_IN
Apr 11, 2020 17:54:43.978045525 CST    127.0.0.1 → 127.0.0.1    OpenFlow Type: OFPT_PACKET_IN
Apr 11, 2020 17:54:43.978539376 CST    127.0.0.1 → 127.0.0.1    TCP 6653 → 57626 [ACK] Seq=9 Ack=213 Win=86 Len=0 TSval=2752542272 TSecr=2752542271
Apr 11, 2020 17:54:43.978567907 CST    127.0.0.1 → 127.0.0.1    OpenFlow Type: OFPT_PACKET_IN
Apr 11, 2020 17:54:43.979188045 CST    127.0.0.1 → 127.0.0.1    OpenFlow Type: OFPT_PACKET_IN
Apr 11, 2020 17:54:43.979506686 CST    127.0.0.1 → 127.0.0.1    TCP 6653 → 57626 [ACK] Seq=9 Ack=417 Win=86 Len=0 TSval=2752542273 TSecr=2752542272
Apr 11, 2020 17:54:43.979868438 CST    127.0.0.1 → 127.0.0.1    OpenFlow Type: OFPT_PACKET_IN
Apr 11, 2020 17:54:43.980400678 CST    127.0.0.1 → 127.0.0.1    OpenFlow Type: OFPT_PACKET_IN
Apr 11, 2020 17:54:43.980488972 CST    127.0.0.1 → 127.0.0.1    TCP 6653 → 57626 [ACK] Seq=9 Ack=621 Win=86 Len=0 TSval=2752542274 TSecr=2752542273
Apr 11, 2020 17:54:43.981044746 CST    127.0.0.1 → 127.0.0.1    OpenFlow Type: OFPT_PACKET_IN
Apr 11, 2020 17:54:43.981661251 CST    127.0.0.1 → 127.0.0.1    OpenFlow Type: OFPT_PACKET_IN
Apr 11, 2020 17:54:43.981821835 CST    127.0.0.1 → 127.0.0.1    TCP 6653 → 57626 [ACK] Seq=9 Ack=825 Win=86 Len=0 TSval=2752542275 TSecr=2752542274
Apr 11, 2020 17:54:43.982280038 CST    127.0.0.1 → 127.0.0.1    OpenFlow Type: OFPT_PACKET_IN
Apr 11, 2020 17:54:43.982912259 CST    127.0.0.1 → 127.0.0.1    OpenFlow Type: OFPT_PACKET_IN
Apr 11, 2020 17:54:43.983043362 CST    127.0.0.1 → 127.0.0.1    TCP 6653 → 57626 [ACK] Seq=9 Ack=1029 Win=86 Len=0 TSval=2752542276 TSecr=2752542276
Apr 11, 2020 17:54:43.983571573 CST    127.0.0.1 → 127.0.0.1    OpenFlow Type: OFPT_PACKET_IN
Apr 11, 2020 17:54:43.984061497 CST    127.0.0.1 → 127.0.0.1    OpenFlow Type: OFPT_PACKET_IN
Apr 11, 2020 17:54:43.984106282 CST    127.0.0.1 → 127.0.0.1    TCP 6653 → 57626 [ACK] Seq=9 Ack=1233 Win=86 Len=0 TSval=2752542277 TSecr=2752542277
Apr 11, 2020 17:54:43.984665568 CST    127.0.0.1 → 127.0.0.1    OpenFlow Type: OFPT_PACKET_IN
Apr 11, 2020 17:54:43.985269804 CST    127.0.0.1 → 127.0.0.1    OpenFlow Type: OFPT_PACKET_IN
Apr 11, 2020 17:54:43.985341812 CST    127.0.0.1 → 127.0.0.1    TCP 6653 → 57626 [ACK] Seq=9 Ack=1437 Win=86 Len=0 TSval=2752542279 TSecr=2752542278
Apr 11, 2020 17:54:43.985874086 CST    127.0.0.1 → 127.0.0.1    OpenFlow Type: OFPT_PACKET_IN
Apr 11, 2020 17:54:43.986477616 CST    127.0.0.1 → 127.0.0.1    OpenFlow Type: OFPT_PACKET_IN
Apr 11, 2020 17:54:43.986543563 CST    127.0.0.1 → 127.0.0.1    TCP 6653 → 57626 [ACK] Seq=9 Ack=1641 Win=86 Len=0 TSval=2752542280 TSecr=2752542279
Apr 11, 2020 17:54:43.987082845 CST    127.0.0.1 → 127.0.0.1    OpenFlow Type: OFPT_PACKET_IN
Apr 11, 2020 17:54:43.987687101 CST    127.0.0.1 → 127.0.0.1    OpenFlow Type: OFPT_PACKET_IN
Apr 11, 2020 17:54:43.987736479 CST    127.0.0.1 → 127.0.0.1    TCP 6653 → 57626 [ACK] Seq=9 Ack=1845 Win=86 Len=0 TSval=2752542281 TSecr=2752542280
Apr 11, 2020 17:54:43.988266489 CST    127.0.0.1 → 127.0.0.1    OpenFlow Type: OFPT_PACKET_IN
Apr 11, 2020 17:54:43.988869349 CST    127.0.0.1 → 127.0.0.1    OpenFlow Type: OFPT_PACKET_IN
Apr 11, 2020 17:54:43.988941383 CST    127.0.0.1 → 127.0.0.1    TCP 6653 → 57626 [ACK] Seq=9 Ack=2049 Win=86 Len=0 TSval=2752542282 TSecr=2752542282
Apr 11, 2020 17:54:43.989473400 CST    127.0.0.1 → 127.0.0.1    OpenFlow Type: OFPT_PACKET_IN
Apr 11, 2020 17:54:43.990078010 CST    127.0.0.1 → 127.0.0.1    OpenFlow Type: OFPT_PACKET_IN
Apr 11, 2020 17:54:43.990133083 CST    127.0.0.1 → 127.0.0.1    TCP 6653 → 57626 [ACK] Seq=9 Ack=2253 Win=86 Len=0 TSval=2752542283 TSecr=2752542283
Apr 11, 2020 17:54:43.990679546 CST    127.0.0.1 → 127.0.0.1    OpenFlow Type: OFPT_PACKET_IN
Apr 11, 2020 17:54:43.991255164 CST    127.0.0.1 → 127.0.0.1    OpenFlow Type: OFPT_PACKET_IN
Apr 11, 2020 17:54:43.991309388 CST    127.0.0.1 → 127.0.0.1    TCP 6653 → 57626 [ACK] Seq=9 Ack=2457 Win=86 Len=0 TSval=2752542285 TSecr=2752542284
Apr 11, 2020 17:54:43.991874462 CST    127.0.0.1 → 127.0.0.1    OpenFlow Type: OFPT_PACKET_IN
Apr 11, 2020 17:54:43.992478366 CST    127.0.0.1 → 127.0.0.1    OpenFlow Type: OFPT_PACKET_IN
Apr 11, 2020 17:54:43.992550882 CST    127.0.0.1 → 127.0.0.1    TCP 6653 → 57626 [ACK] Seq=9 Ack=2661 Win=86 Len=0 TSval=2752542286 TSecr=2752542285
Apr 11, 2020 17:54:43.993082357 CST    127.0.0.1 → 127.0.0.1    OpenFlow Type: OFPT_PACKET_IN
Apr 11, 2020 17:54:43.993687215 CST    127.0.0.1 → 127.0.0.1    OpenFlow Type: OFPT_PACKET_IN
Apr 11, 2020 17:54:43.993740794 CST    127.0.0.1 → 127.0.0.1    TCP 6653 → 57626 [ACK] Seq=9 Ack=2865 Win=86 Len=0 TSval=2752542287 TSecr=2752542286
Apr 11, 2020 17:54:43.994290237 CST    127.0.0.1 → 127.0.0.1    OpenFlow Type: OFPT_PACKET_IN
Apr 11, 2020 17:54:43.994892492 CST    127.0.0.1 → 127.0.0.1    OpenFlow Type: OFPT_PACKET_IN
Apr 11, 2020 17:54:43.994943219 CST    127.0.0.1 → 127.0.0.1    TCP 6653 → 57626 [ACK] Seq=9 Ack=3069 Win=86 Len=0 TSval=2752542288 TSecr=2752542288
Apr 11, 2020 17:54:43.995496755 CST    127.0.0.1 → 127.0.0.1    OpenFlow Type: OFPT_PACKET_IN
Apr 11, 2020 17:54:43.996100623 CST    127.0.0.1 → 127.0.0.1    OpenFlow Type: OFPT_PACKET_IN
Apr 11, 2020 17:54:43.996152315 CST    127.0.0.1 → 127.0.0.1    TCP 6653 → 57626 [ACK] Seq=9 Ack=3273 Win=86 Len=0 TSval=2752542289 TSecr=2752542289
Apr 11, 2020 17:54:43.996705704 CST    127.0.0.1 → 127.0.0.1    OpenFlow Type: OFPT_PACKET_IN
Apr 11, 2020 17:54:43.997307382 CST    127.0.0.1 → 127.0.0.1    OpenFlow Type: OFPT_PACKET_IN
Apr 11, 2020 17:54:43.997357618 CST    127.0.0.1 → 127.0.0.1    TCP 6653 → 57626 [ACK] Seq=9 Ack=3477 Win=86 Len=0 TSval=2752542291 TSecr=2752542290
Apr 11, 2020 17:54:43.997910140 CST    127.0.0.1 → 127.0.0.1    OpenFlow Type: OFPT_PACKET_IN
Apr 11, 2020 17:54:43.998502295 CST    127.0.0.1 → 127.0.0.1    OpenFlow Type: OFPT_PACKET_IN
Apr 11, 2020 17:54:43.998554861 CST    127.0.0.1 → 127.0.0.1    TCP 6653 → 57626 [ACK] Seq=9 Ack=3681 Win=86 Len=0 TSval=2752542292 TSecr=2752542291
Apr 11, 2020 17:54:43.999105910 CST    127.0.0.1 → 127.0.0.1    OpenFlow Type: OFPT_PACKET_IN
Apr 11, 2020 17:54:43.999706937 CST    127.0.0.1 → 127.0.0.1    OpenFlow Type: OFPT_PACKET_IN
Apr 11, 2020 17:54:43.999754006 CST    127.0.0.1 → 127.0.0.1    TCP 6653 → 57626 [ACK] Seq=9 Ack=3885 Win=86 Len=0 TSval=2752542293 TSecr=2752542292
Apr 11, 2020 17:54:44.000297599 CST    127.0.0.1 → 127.0.0.1    OpenFlow Type: OFPT_PACKET_IN
Apr 11, 2020 17:54:44.000898925 CST    127.0.0.1 → 127.0.0.1    OpenFlow Type: OFPT_PACKET_IN
Apr 11, 2020 17:54:44.000951774 CST    127.0.0.1 → 127.0.0.1    TCP 6653 → 57626 [ACK] Seq=9 Ack=4089 Win=86 Len=0 TSval=2752542294 TSecr=2752542294
Apr 11, 2020 17:54:44.001500887 CST    127.0.0.1 → 127.0.0.1    OpenFlow Type: OFPT_PACKET_IN
Apr 11, 2020 17:54:44.002105983 CST    127.0.0.1 → 127.0.0.1    OpenFlow Type: OFPT_PACKET_IN
Apr 11, 2020 17:54:44.002156684 CST    127.0.0.1 → 127.0.0.1    TCP 6653 → 57626 [ACK] Seq=9 Ack=4293 Win=86 Len=0 TSval=2752542295 TSecr=2752542295
Apr 11, 2020 17:54:44.002710310 CST    127.0.0.1 → 127.0.0.1    OpenFlow Type: OFPT_PACKET_IN
Apr 11, 2020 17:54:44.003312689 CST    127.0.0.1 → 127.0.0.1    OpenFlow Type: OFPT_PACKET_IN
Apr 11, 2020 17:54:44.003362980 CST    127.0.0.1 → 127.0.0.1    TCP 6653 → 57626 [ACK] Seq=9 Ack=4497 Win=86 Len=0 TSval=2752542297 TSecr=2752542296
Apr 11, 2020 17:54:44.003909370 CST    127.0.0.1 → 127.0.0.1    OpenFlow Type: OFPT_PACKET_IN
Apr 11, 2020 17:54:44.004516668 CST    127.0.0.1 → 127.0.0.1    OpenFlow Type: OFPT_PACKET_IN
Apr 11, 2020 17:54:44.004579830 CST    127.0.0.1 → 127.0.0.1    TCP 6653 → 57626 [ACK] Seq=9 Ack=4701 Win=86 Len=0 TSval=2752542298 TSecr=2752542297
Apr 11, 2020 17:54:44.005129167 CST    127.0.0.1 → 127.0.0.1    OpenFlow Type: OFPT_PACKET_IN
Apr 11, 2020 17:54:44.005723656 CST    127.0.0.1 → 127.0.0.1    OpenFlow Type: OFPT_PACKET_IN
Apr 11, 2020 17:54:44.005775099 CST    127.0.0.1 → 127.0.0.1    TCP 6653 → 57626 [ACK] Seq=9 Ack=4905 Win=86 Len=0 TSval=2752542299 TSecr=2752542298
Apr 11, 2020 17:54:44.006332412 CST    127.0.0.1 → 127.0.0.1    OpenFlow Type: OFPT_PACKET_IN
Apr 11, 2020 17:54:44.006944669 CST    127.0.0.1 → 127.0.0.1    OpenFlow Type: OFPT_PACKET_IN
Apr 11, 2020 17:54:44.007004180 CST    127.0.0.1 → 127.0.0.1    TCP 6653 → 57626 [ACK] Seq=9 Ack=5109 Win=86 Len=0 TSval=2752542300 TSecr=2752542300
Apr 11, 2020 17:54:44.007554238 CST    127.0.0.1 → 127.0.0.1    OpenFlow Type: OFPT_PACKET_IN
Apr 11, 2020 17:54:44.008196539 CST    127.0.0.1 → 127.0.0.1    OpenFlow Type: OFPT_PACKET_IN
Apr 11, 2020 17:54:44.008254489 CST    127.0.0.1 → 127.0.0.1    TCP 6653 → 57626 [ACK] Seq=9 Ack=5313 Win=86 Len=0 TSval=2752542302 TSecr=2752542301
Apr 11, 2020 17:54:44.008751536 CST    127.0.0.1 → 127.0.0.1    OpenFlow Type: OFPT_PACKET_IN
Apr 11, 2020 17:54:44.009336217 CST    127.0.0.1 → 127.0.0.1    OpenFlow Type: OFPT_PACKET_IN
Apr 11, 2020 17:54:44.009392492 CST    127.0.0.1 → 127.0.0.1    TCP 6653 → 57626 [ACK] Seq=9 Ack=5517 Win=86 Len=0 TSval=2752542303 TSecr=2752542302
Apr 11, 2020 17:54:44.009924993 CST    127.0.0.1 → 127.0.0.1    OpenFlow Type: OFPT_PACKET_IN
Apr 11, 2020 17:54:44.010550156 CST    127.0.0.1 → 127.0.0.1    OpenFlow Type: OFPT_PACKET_IN
Apr 11, 2020 17:54:44.010622433 CST    127.0.0.1 → 127.0.0.1    TCP 6653 → 57626 [ACK] Seq=9 Ack=5721 Win=86 Len=0 TSval=2752542304 TSecr=2752542303
Apr 11, 2020 17:54:44.011137695 CST    127.0.0.1 → 127.0.0.1    OpenFlow Type: OFPT_PACKET_IN
Apr 11, 2020 17:54:44.011705155 CST    127.0.0.1 → 127.0.0.1    OpenFlow Type: OFPT_PACKET_IN
Apr 11, 2020 17:54:44.011792732 CST    127.0.0.1 → 127.0.0.1    TCP 6653 → 57626 [ACK] Seq=9 Ack=5925 Win=86 Len=0 TSval=2752542305 TSecr=2752542304
Apr 11, 2020 17:54:44.012339974 CST    127.0.0.1 → 127.0.0.1    OpenFlow Type: OFPT_PACKET_IN
Apr 11, 2020 17:54:44.012923460 CST    127.0.0.1 → 127.0.0.1    OpenFlow Type: OFPT_PACKET_IN
Apr 11, 2020 17:54:44.012995670 CST    127.0.0.1 → 127.0.0.1    TCP 6653 → 57626 [ACK] Seq=9 Ack=6129 Win=86 Len=0 TSval=2752542306 TSecr=2752542306
Apr 11, 2020 17:54:44.013484813 CST    127.0.0.1 → 127.0.0.1    OpenFlow Type: OFPT_PACKET_IN
Apr 11, 2020 17:54:44.014047060 CST    127.0.0.1 → 127.0.0.1    OpenFlow Type: OFPT_PACKET_IN
Apr 11, 2020 17:54:44.014105063 CST    127.0.0.1 → 127.0.0.1    TCP 6653 → 57626 [ACK] Seq=9 Ack=6333 Win=86 Len=0 TSval=2752542307 TSecr=2752542307
Apr 11, 2020 17:54:44.014617433 CST    127.0.0.1 → 127.0.0.1    OpenFlow Type: OFPT_PACKET_IN
Apr 11, 2020 17:54:44.015224003 CST    127.0.0.1 → 127.0.0.1    OpenFlow Type: OFPT_PACKET_IN
Apr 11, 2020 17:54:44.015284915 CST    127.0.0.1 → 127.0.0.1    TCP 6653 → 57626 [ACK] Seq=9 Ack=6537 Win=86 Len=0 TSval=2752542309 TSecr=2752542308
Apr 11, 2020 17:54:44.015906455 CST    127.0.0.1 → 127.0.0.1    OpenFlow Type: OFPT_PACKET_IN
Apr 11, 2020 17:54:44.016463148 CST    127.0.0.1 → 127.0.0.1    OpenFlow Type: OFPT_PACKET_IN
Apr 11, 2020 17:54:44.016526009 CST    127.0.0.1 → 127.0.0.1    TCP 6653 → 57626 [ACK] Seq=9 Ack=6741 Win=86 Len=0 TSval=2752542310 TSecr=2752542309
Apr 11, 2020 17:54:44.017069071 CST    127.0.0.1 → 127.0.0.1    OpenFlow Type: OFPT_PACKET_IN
Apr 11, 2020 17:54:44.017703614 CST    127.0.0.1 → 127.0.0.1    OpenFlow Type: OFPT_PACKET_IN
Apr 11, 2020 17:54:44.017766476 CST    127.0.0.1 → 127.0.0.1    TCP 6653 → 57626 [ACK] Seq=9 Ack=6945 Win=86 Len=0 TSval=2752542311 TSecr=2752542310
Apr 11, 2020 17:54:44.018284386 CST    127.0.0.1 → 127.0.0.1    OpenFlow Type: OFPT_PACKET_IN
Apr 11, 2020 17:54:44.018823089 CST    127.0.0.1 → 127.0.0.1    OpenFlow Type: OFPT_PACKET_IN
Apr 11, 2020 17:54:44.018884149 CST    127.0.0.1 → 127.0.0.1    TCP 6653 → 57626 [ACK] Seq=9 Ack=7149 Win=86 Len=0 TSval=2752542312 TSecr=2752542312
Apr 11, 2020 17:54:44.019445132 CST    127.0.0.1 → 127.0.0.1    OpenFlow Type: OFPT_PACKET_IN
Apr 11, 2020 17:54:44.020027023 CST    127.0.0.1 → 127.0.0.1    OpenFlow Type: OFPT_PACKET_IN
Apr 11, 2020 17:54:44.020091083 CST    127.0.0.1 → 127.0.0.1    TCP 6653 → 57626 [ACK] Seq=9 Ack=7353 Win=86 Len=0 TSval=2752542313 TSecr=2752542313
Apr 11, 2020 17:54:44.020635439 CST    127.0.0.1 → 127.0.0.1    OpenFlow Type: OFPT_PACKET_IN
Apr 11, 2020 17:54:44.021242898 CST    127.0.0.1 → 127.0.0.1    OpenFlow Type: OFPT_PACKET_IN
Apr 11, 2020 17:54:44.021306208 CST    127.0.0.1 → 127.0.0.1    TCP 6653 → 57626 [ACK] Seq=9 Ack=7557 Win=86 Len=0 TSval=2752542315 TSecr=2752542314
Apr 11, 2020 17:54:44.021878583 CST    127.0.0.1 → 127.0.0.1    OpenFlow Type: OFPT_PACKET_IN
Apr 11, 2020 17:54:44.022413941 CST    127.0.0.1 → 127.0.0.1    OpenFlow Type: OFPT_PACKET_IN
Apr 11, 2020 17:54:44.022473791 CST    127.0.0.1 → 127.0.0.1    TCP 6653 → 57626 [ACK] Seq=9 Ack=7761 Win=86 Len=0 TSval=2752542316 TSecr=2752542315
Apr 11, 2020 17:54:44.023021599 CST    127.0.0.1 → 127.0.0.1    OpenFlow Type: OFPT_PACKET_IN
Apr 11, 2020 17:54:44.023628478 CST    127.0.0.1 → 127.0.0.1    OpenFlow Type: OFPT_PACKET_IN
Apr 11, 2020 17:54:44.023679232 CST    127.0.0.1 → 127.0.0.1    TCP 6653 → 57626 [ACK] Seq=9 Ack=7965 Win=86 Len=0 TSval=2752542317 TSecr=2752542316
Apr 11, 2020 17:54:44.024255573 CST    127.0.0.1 → 127.0.0.1    OpenFlow Type: OFPT_PACKET_IN
Apr 11, 2020 17:54:44.024913228 CST    127.0.0.1 → 127.0.0.1    OpenFlow Type: OFPT_PACKET_IN
Apr 11, 2020 17:54:44.024982603 CST    127.0.0.1 → 127.0.0.1    TCP 6653 → 57626 [ACK] Seq=9 Ack=8169 Win=86 Len=0 TSval=2752542318 TSecr=2752542318
Apr 11, 2020 17:54:44.025468752 CST    127.0.0.1 → 127.0.0.1    OpenFlow Type: OFPT_PACKET_IN
Apr 11, 2020 17:54:44.026034655 CST    127.0.0.1 → 127.0.0.1    OpenFlow Type: OFPT_PACKET_IN
Apr 11, 2020 17:54:44.026100886 CST    127.0.0.1 → 127.0.0.1    TCP 6653 → 57626 [ACK] Seq=9 Ack=8373 Win=86 Len=0 TSval=2752542319 TSecr=2752542319
Apr 11, 2020 17:54:44.026615486 CST    127.0.0.1 → 127.0.0.1    OpenFlow Type: OFPT_PACKET_IN
Apr 11, 2020 17:54:44.027226977 CST    127.0.0.1 → 127.0.0.1    OpenFlow Type: OFPT_PACKET_IN
Apr 11, 2020 17:54:44.027291575 CST    127.0.0.1 → 127.0.0.1    TCP 6653 → 57626 [ACK] Seq=9 Ack=8577 Win=86 Len=0 TSval=2752542321 TSecr=2752542320
Apr 11, 2020 17:54:44.027838995 CST    127.0.0.1 → 127.0.0.1    OpenFlow Type: OFPT_PACKET_IN
Apr 11, 2020 17:54:44.028443459 CST    127.0.0.1 → 127.0.0.1    OpenFlow Type: OFPT_PACKET_IN
Apr 11, 2020 17:54:44.028513207 CST    127.0.0.1 → 127.0.0.1    TCP 6653 → 57626 [ACK] Seq=9 Ack=8781 Win=86 Len=0 TSval=2752542322 TSecr=2752542321
Apr 11, 2020 17:54:44.029030863 CST    127.0.0.1 → 127.0.0.1    OpenFlow Type: OFPT_PACKET_IN
Apr 11, 2020 17:54:44.029612903 CST    127.0.0.1 → 127.0.0.1    OpenFlow Type: OFPT_PACKET_IN
Apr 11, 2020 17:54:44.029681440 CST    127.0.0.1 → 127.0.0.1    TCP 6653 → 57626 [ACK] Seq=9 Ack=8985 Win=86 Len=0 TSval=2752542323 TSecr=2752542322
Apr 11, 2020 17:54:44.030181141 CST    127.0.0.1 → 127.0.0.1    OpenFlow Type: OFPT_PACKET_IN
Apr 11, 2020 17:54:44.030790476 CST    127.0.0.1 → 127.0.0.1    OpenFlow Type: OFPT_PACKET_IN
Apr 11, 2020 17:54:44.030855892 CST    127.0.0.1 → 127.0.0.1    TCP 6653 → 57626 [ACK] Seq=9 Ack=9189 Win=86 Len=0 TSval=2752542324 TSecr=2752542323
Apr 11, 2020 17:54:44.031396034 CST    127.0.0.1 → 127.0.0.1    OpenFlow Type: OFPT_PACKET_IN
Apr 11, 2020 17:54:44.031982621 CST    127.0.0.1 → 127.0.0.1    OpenFlow Type: OFPT_PACKET_IN
Apr 11, 2020 17:54:44.032053223 CST    127.0.0.1 → 127.0.0.1    TCP 6653 → 57626 [ACK] Seq=9 Ack=9393 Win=86 Len=0 TSval=2752542325 TSecr=2752542325
Apr 11, 2020 17:54:44.032595354 CST    127.0.0.1 → 127.0.0.1    OpenFlow Type: OFPT_PACKET_IN
Apr 11, 2020 17:54:44.033151583 CST    127.0.0.1 → 127.0.0.1    OpenFlow Type: OFPT_PACKET_IN
Apr 11, 2020 17:54:44.033220780 CST    127.0.0.1 → 127.0.0.1    TCP 6653 → 57626 [ACK] Seq=9 Ack=9597 Win=86 Len=0 TSval=2752542327 TSecr=2752542326
Apr 11, 2020 17:54:44.033716118 CST    127.0.0.1 → 127.0.0.1    OpenFlow Type: OFPT_PACKET_IN
Apr 11, 2020 17:54:44.034307080 CST    127.0.0.1 → 127.0.0.1    OpenFlow Type: OFPT_PACKET_IN
Apr 11, 2020 17:54:44.034373893 CST    127.0.0.1 → 127.0.0.1    TCP 6653 → 57626 [ACK] Seq=9 Ack=9801 Win=86 Len=0 TSval=2752542328 TSecr=2752542327
Apr 11, 2020 17:54:44.034882313 CST    127.0.0.1 → 127.0.0.1    OpenFlow Type: OFPT_PACKET_IN
Apr 11, 2020 17:54:44.035504797 CST    127.0.0.1 → 127.0.0.1    OpenFlow Type: OFPT_PACKET_IN
Apr 11, 2020 17:54:44.035566324 CST    127.0.0.1 → 127.0.0.1    TCP 6653 → 57626 [ACK] Seq=9 Ack=10005 Win=86 Len=0 TSval=2752542329 TSecr=2752542328
Apr 11, 2020 17:54:44.036085634 CST    127.0.0.1 → 127.0.0.1    OpenFlow Type: OFPT_PACKET_IN
Apr 11, 2020 17:54:44.036693764 CST    127.0.0.1 → 127.0.0.1    OpenFlow Type: OFPT_PACKET_IN
Apr 11, 2020 17:54:44.036757507 CST    127.0.0.1 → 127.0.0.1    TCP 6653 → 57626 [ACK] Seq=9 Ack=10209 Win=86 Len=0 TSval=2752542330 TSecr=2752542329
Apr 11, 2020 17:54:44.037298551 CST    127.0.0.1 → 127.0.0.1    OpenFlow Type: OFPT_PACKET_IN
Apr 11, 2020 17:54:44.037837085 CST    127.0.0.1 → 127.0.0.1    OpenFlow Type: OFPT_PACKET_IN
Apr 11, 2020 17:54:44.037897872 CST    127.0.0.1 → 127.0.0.1    TCP 6653 → 57626 [ACK] Seq=9 Ack=10413 Win=86 Len=0 TSval=2752542331 TSecr=2752542331
Apr 11, 2020 17:54:44.038443949 CST    127.0.0.1 → 127.0.0.1    OpenFlow Type: OFPT_PACKET_IN
Apr 11, 2020 17:54:44.039049674 CST    127.0.0.1 → 127.0.0.1    OpenFlow Type: OFPT_PACKET_IN
Apr 11, 2020 17:54:44.039109167 CST    127.0.0.1 → 127.0.0.1    TCP 6653 → 57626 [ACK] Seq=9 Ack=10617 Win=86 Len=0 TSval=2752542332 TSecr=2752542332
Apr 11, 2020 17:54:44.039680776 CST    127.0.0.1 → 127.0.0.1    OpenFlow Type: OFPT_PACKET_IN
Apr 11, 2020 17:54:44.040286316 CST    127.0.0.1 → 127.0.0.1    OpenFlow Type: OFPT_PACKET_IN
Apr 11, 2020 17:54:44.040349505 CST    127.0.0.1 → 127.0.0.1    TCP 6653 → 57626 [ACK] Seq=9 Ack=10821 Win=86 Len=0 TSval=2752542334 TSecr=2752542333
Apr 11, 2020 17:54:44.040897009 CST    127.0.0.1 → 127.0.0.1    OpenFlow Type: OFPT_PACKET_IN
Apr 11, 2020 17:54:44.041502904 CST    127.0.0.1 → 127.0.0.1    OpenFlow Type: OFPT_PACKET_IN
Apr 11, 2020 17:54:44.041566576 CST    127.0.0.1 → 127.0.0.1    TCP 6653 → 57626 [ACK] Seq=9 Ack=11025 Win=86 Len=0 TSval=2752542335 TSecr=2752542334
Apr 11, 2020 17:54:44.042093013 CST    127.0.0.1 → 127.0.0.1    OpenFlow Type: OFPT_PACKET_IN
Apr 11, 2020 17:54:44.042699208 CST    127.0.0.1 → 127.0.0.1    OpenFlow Type: OFPT_PACKET_IN
Apr 11, 2020 17:54:44.042761207 CST    127.0.0.1 → 127.0.0.1    TCP 6653 → 57626 [ACK] Seq=9 Ack=11229 Win=86 Len=0 TSval=2752542336 TSecr=2752542335
Apr 11, 2020 17:54:44.043304762 CST    127.0.0.1 → 127.0.0.1    OpenFlow Type: OFPT_PACKET_IN
Apr 11, 2020 17:54:44.043886330 CST    127.0.0.1 → 127.0.0.1    OpenFlow Type: OFPT_PACKET_IN
Apr 11, 2020 17:54:44.043950075 CST    127.0.0.1 → 127.0.0.1    TCP 6653 → 57626 [ACK] Seq=9 Ack=11433 Win=86 Len=0 TSval=2752542337 TSecr=2752542337
Apr 11, 2020 17:54:44.044448698 CST    127.0.0.1 → 127.0.0.1    OpenFlow Type: OFPT_PACKET_IN
Apr 11, 2020 17:54:44.045057204 CST    127.0.0.1 → 127.0.0.1    OpenFlow Type: OFPT_PACKET_IN
Apr 11, 2020 17:54:44.045120007 CST    127.0.0.1 → 127.0.0.1    TCP 6653 → 57626 [ACK] Seq=9 Ack=11637 Win=86 Len=0 TSval=2752542338 TSecr=2752542338
Apr 11, 2020 17:54:44.045663976 CST    127.0.0.1 → 127.0.0.1    OpenFlow Type: OFPT_PACKET_IN
Apr 11, 2020 17:54:44.046204250 CST    127.0.0.1 → 127.0.0.1    OpenFlow Type: OFPT_PACKET_IN
Apr 11, 2020 17:54:44.046264680 CST    127.0.0.1 → 127.0.0.1    TCP 6653 → 57626 [ACK] Seq=9 Ack=11841 Win=86 Len=0 TSval=2752542340 TSecr=2752542339
Apr 11, 2020 17:54:44.046831620 CST    127.0.0.1 → 127.0.0.1    OpenFlow Type: OFPT_PACKET_IN
Apr 11, 2020 17:54:44.047426510 CST    127.0.0.1 → 127.0.0.1    OpenFlow Type: OFPT_PACKET_IN
Apr 11, 2020 17:54:44.047493513 CST    127.0.0.1 → 127.0.0.1    TCP 6653 → 57626 [ACK] Seq=9 Ack=12045 Win=86 Len=0 TSval=2752542341 TSecr=2752542340
Apr 11, 2020 17:54:44.048037343 CST    127.0.0.1 → 127.0.0.1    OpenFlow Type: OFPT_PACKET_IN
Apr 11, 2020 17:54:44.048647266 CST    127.0.0.1 → 127.0.0.1    OpenFlow Type: OFPT_PACKET_IN
Apr 11, 2020 17:54:44.048711570 CST    127.0.0.1 → 127.0.0.1    TCP 6653 → 57626 [ACK] Seq=9 Ack=12249 Win=86 Len=0 TSval=2752542342 TSecr=2752542341
Apr 11, 2020 17:54:44.049254658 CST    127.0.0.1 → 127.0.0.1    OpenFlow Type: OFPT_PACKET_IN
Apr 11, 2020 17:54:44.049853843 CST    127.0.0.1 → 127.0.0.1    OpenFlow Type: OFPT_PACKET_IN
Apr 11, 2020 17:54:44.049914430 CST    127.0.0.1 → 127.0.0.1    TCP 6653 → 57626 [ACK] Seq=9 Ack=12453 Win=86 Len=0 TSval=2752542343 TSecr=2752542343
Apr 11, 2020 17:54:44.050457720 CST    127.0.0.1 → 127.0.0.1    OpenFlow Type: OFPT_PACKET_IN
Apr 11, 2020 17:54:44.051048180 CST    127.0.0.1 → 127.0.0.1    OpenFlow Type: OFPT_PACKET_IN
Apr 11, 2020 17:54:44.051096343 CST    127.0.0.1 → 127.0.0.1    TCP 6653 → 57626 [ACK] Seq=9 Ack=12657 Win=86 Len=0 TSval=2752542344 TSecr=2752542344
Apr 11, 2020 17:54:44.051677513 CST    127.0.0.1 → 127.0.0.1    OpenFlow Type: OFPT_PACKET_IN
Apr 11, 2020 17:54:44.052283897 CST    127.0.0.1 → 127.0.0.1    OpenFlow Type: OFPT_PACKET_IN
Apr 11, 2020 17:54:44.052368810 CST    127.0.0.1 → 127.0.0.1    TCP 6653 → 57626 [ACK] Seq=9 Ack=12861 Win=86 Len=0 TSval=2752542346 TSecr=2752542345
Apr 11, 2020 17:54:44.052893055 CST    127.0.0.1 → 127.0.0.1    OpenFlow Type: OFPT_PACKET_IN
Apr 11, 2020 17:54:44.053500076 CST    127.0.0.1 → 127.0.0.1    OpenFlow Type: OFPT_PACKET_IN
Apr 11, 2020 17:54:44.053564358 CST    127.0.0.1 → 127.0.0.1    TCP 6653 → 57626 [ACK] Seq=9 Ack=13065 Win=86 Len=0 TSval=2752542347 TSecr=2752542346
Apr 11, 2020 17:54:44.054098107 CST    127.0.0.1 → 127.0.0.1    OpenFlow Type: OFPT_PACKET_IN
Apr 11, 2020 17:54:44.054702534 CST    127.0.0.1 → 127.0.0.1    OpenFlow Type: OFPT_PACKET_IN
Apr 11, 2020 17:54:44.054766246 CST    127.0.0.1 → 127.0.0.1    TCP 6653 → 57626 [ACK] Seq=9 Ack=13269 Win=86 Len=0 TSval=2752542348 TSecr=2752542347
Apr 11, 2020 17:54:44.055309223 CST    127.0.0.1 → 127.0.0.1    OpenFlow Type: OFPT_PACKET_IN
Apr 11, 2020 17:54:44.055958238 CST    127.0.0.1 → 127.0.0.1    OpenFlow Type: OFPT_PACKET_IN
Apr 11, 2020 17:54:44.056024882 CST    127.0.0.1 → 127.0.0.1    TCP 6653 → 57626 [ACK] Seq=9 Ack=13473 Win=86 Len=0 TSval=2752542349 TSecr=2752542349
Apr 11, 2020 17:54:44.056581089 CST    127.0.0.1 → 127.0.0.1    OpenFlow Type: OFPT_PACKET_IN
Apr 11, 2020 17:54:44.057213208 CST    127.0.0.1 → 127.0.0.1    OpenFlow Type: OFPT_PACKET_IN
Apr 11, 2020 17:54:44.057276576 CST    127.0.0.1 → 127.0.0.1    TCP 6653 → 57626 [ACK] Seq=9 Ack=13677 Win=86 Len=0 TSval=2752542351 TSecr=2752542350
Apr 11, 2020 17:54:44.057831021 CST    127.0.0.1 → 127.0.0.1    OpenFlow Type: OFPT_PACKET_IN
Apr 11, 2020 17:54:44.058455232 CST    127.0.0.1 → 127.0.0.1    OpenFlow Type: OFPT_PACKET_IN
Apr 11, 2020 17:54:44.058519477 CST    127.0.0.1 → 127.0.0.1    TCP 6653 → 57626 [ACK] Seq=9 Ack=13881 Win=86 Len=0 TSval=2752542352 TSecr=2752542351
Apr 11, 2020 17:54:44.059078429 CST    127.0.0.1 → 127.0.0.1    OpenFlow Type: OFPT_PACKET_IN
Apr 11, 2020 17:54:44.059714194 CST    127.0.0.1 → 127.0.0.1    OpenFlow Type: OFPT_PACKET_IN
Apr 11, 2020 17:54:44.059810720 CST    127.0.0.1 → 127.0.0.1    TCP 6653 → 57626 [ACK] Seq=9 Ack=14085 Win=86 Len=0 TSval=2752542353 TSecr=2752542352
Apr 11, 2020 17:54:44.060336551 CST    127.0.0.1 → 127.0.0.1    OpenFlow Type: OFPT_PACKET_IN
Apr 11, 2020 17:54:44.060945028 CST    127.0.0.1 → 127.0.0.1    OpenFlow Type: OFPT_PACKET_IN
Apr 11, 2020 17:54:44.061014229 CST    127.0.0.1 → 127.0.0.1    TCP 6653 → 57626 [ACK] Seq=9 Ack=14289 Win=86 Len=0 TSval=2752542354 TSecr=2752542354
Apr 11, 2020 17:54:44.061540938 CST    127.0.0.1 → 127.0.0.1    OpenFlow Type: OFPT_PACKET_IN
Apr 11, 2020 17:54:44.062148672 CST    127.0.0.1 → 127.0.0.1    OpenFlow Type: OFPT_PACKET_IN
Apr 11, 2020 17:54:44.062214454 CST    127.0.0.1 → 127.0.0.1    TCP 6653 → 57626 [ACK] Seq=9 Ack=14493 Win=86 Len=0 TSval=2752542356 TSecr=2752542355
Apr 11, 2020 17:54:44.062757996 CST    127.0.0.1 → 127.0.0.1    OpenFlow Type: OFPT_PACKET_IN
Apr 11, 2020 17:54:44.063385232 CST    127.0.0.1 → 127.0.0.1    OpenFlow Type: OFPT_PACKET_IN
Apr 11, 2020 17:54:44.063451566 CST    127.0.0.1 → 127.0.0.1    TCP 6653 → 57626 [ACK] Seq=9 Ack=14697 Win=86 Len=0 TSval=2752542357 TSecr=2752542356
Apr 11, 2020 17:54:44.063998322 CST    127.0.0.1 → 127.0.0.1    OpenFlow Type: OFPT_PACKET_IN
Apr 11, 2020 17:54:44.064610412 CST    127.0.0.1 → 127.0.0.1    OpenFlow Type: OFPT_PACKET_IN
Apr 11, 2020 17:54:44.064683805 CST    127.0.0.1 → 127.0.0.1    TCP 6653 → 57626 [ACK] Seq=9 Ack=14901 Win=86 Len=0 TSval=2752542358 TSecr=2752542357
Apr 11, 2020 17:54:44.065224162 CST    127.0.0.1 → 127.0.0.1    OpenFlow Type: OFPT_PACKET_IN
Apr 11, 2020 17:54:44.065855149 CST    127.0.0.1 → 127.0.0.1    OpenFlow Type: OFPT_PACKET_IN
Apr 11, 2020 17:54:44.065920940 CST    127.0.0.1 → 127.0.0.1    TCP 6653 → 57626 [ACK] Seq=9 Ack=15105 Win=86 Len=0 TSval=2752542359 TSecr=2752542359
Apr 11, 2020 17:54:44.066478673 CST    127.0.0.1 → 127.0.0.1    OpenFlow Type: OFPT_PACKET_IN
Apr 11, 2020 17:54:44.067104490 CST    127.0.0.1 → 127.0.0.1    OpenFlow Type: OFPT_PACKET_IN
Apr 11, 2020 17:54:44.067171356 CST    127.0.0.1 → 127.0.0.1    TCP 6653 → 57626 [ACK] Seq=9 Ack=15309 Win=86 Len=0 TSval=2752542360 TSecr=2752542360
Apr 11, 2020 17:54:44.067740607 CST    127.0.0.1 → 127.0.0.1    OpenFlow Type: OFPT_PACKET_IN
Apr 11, 2020 17:54:44.068365892 CST    127.0.0.1 → 127.0.0.1    OpenFlow Type: OFPT_PACKET_IN
Apr 11, 2020 17:54:44.068432604 CST    127.0.0.1 → 127.0.0.1    TCP 6653 → 57626 [ACK] Seq=9 Ack=15513 Win=86 Len=0 TSval=2752542362 TSecr=2752542361
Apr 11, 2020 17:54:44.068973805 CST    127.0.0.1 → 127.0.0.1    OpenFlow Type: OFPT_PACKET_IN
Apr 11, 2020 17:54:44.069607115 CST    127.0.0.1 → 127.0.0.1    OpenFlow Type: OFPT_PACKET_IN
Apr 11, 2020 17:54:44.069673467 CST    127.0.0.1 → 127.0.0.1    TCP 6653 → 57626 [ACK] Seq=9 Ack=15717 Win=86 Len=0 TSval=2752542363 TSecr=2752542362
Apr 11, 2020 17:54:44.070233642 CST    127.0.0.1 → 127.0.0.1    OpenFlow Type: OFPT_PACKET_IN
Apr 11, 2020 17:54:44.070860343 CST    127.0.0.1 → 127.0.0.1    OpenFlow Type: OFPT_PACKET_IN
Apr 11, 2020 17:54:44.070924885 CST    127.0.0.1 → 127.0.0.1    TCP 6653 → 57626 [ACK] Seq=9 Ack=15921 Win=86 Len=0 TSval=2752542364 TSecr=2752542364
Apr 11, 2020 17:54:44.071489879 CST    127.0.0.1 → 127.0.0.1    OpenFlow Type: OFPT_PACKET_IN
Apr 11, 2020 17:54:44.072126776 CST    127.0.0.1 → 127.0.0.1    OpenFlow Type: OFPT_PACKET_IN
Apr 11, 2020 17:54:44.072194587 CST    127.0.0.1 → 127.0.0.1    TCP 6653 → 57626 [ACK] Seq=9 Ack=16125 Win=86 Len=0 TSval=2752542365 TSecr=2752542365
Apr 11, 2020 17:54:44.072744606 CST    127.0.0.1 → 127.0.0.1    OpenFlow Type: OFPT_PACKET_IN
Apr 11, 2020 17:54:44.073372494 CST    127.0.0.1 → 127.0.0.1    OpenFlow Type: OFPT_PACKET_IN
Apr 11, 2020 17:54:44.073438989 CST    127.0.0.1 → 127.0.0.1    TCP 6653 → 57626 [ACK] Seq=9 Ack=16329 Win=86 Len=0 TSval=2752542367 TSecr=2752542366
Apr 11, 2020 17:54:44.073996433 CST    127.0.0.1 → 127.0.0.1    OpenFlow Type: OFPT_PACKET_IN
Apr 11, 2020 17:54:44.074619319 CST    127.0.0.1 → 127.0.0.1    OpenFlow Type: OFPT_PACKET_IN
Apr 11, 2020 17:54:44.074683145 CST    127.0.0.1 → 127.0.0.1    TCP 6653 → 57626 [ACK] Seq=9 Ack=16533 Win=86 Len=0 TSval=2752542368 TSecr=2752542367
Apr 11, 2020 17:54:44.075244381 CST    127.0.0.1 → 127.0.0.1    OpenFlow Type: OFPT_PACKET_IN
Apr 11, 2020 17:54:44.075900418 CST    127.0.0.1 → 127.0.0.1    OpenFlow Type: OFPT_PACKET_IN
Apr 11, 2020 17:54:44.075970199 CST    127.0.0.1 → 127.0.0.1    TCP 6653 → 57626 [ACK] Seq=9 Ack=16737 Win=86 Len=0 TSval=2752542369 TSecr=2752542369
Apr 11, 2020 17:54:44.076524176 CST    127.0.0.1 → 127.0.0.1    OpenFlow Type: OFPT_PACKET_IN
Apr 11, 2020 17:54:44.077151125 CST    127.0.0.1 → 127.0.0.1    OpenFlow Type: OFPT_PACKET_IN
Apr 11, 2020 17:54:44.077221419 CST    127.0.0.1 → 127.0.0.1    TCP 6653 → 57626 [ACK] Seq=9 Ack=16941 Win=86 Len=0 TSval=2752542371 TSecr=2752542370
Apr 11, 2020 17:54:44.077774060 CST    127.0.0.1 → 127.0.0.1    OpenFlow Type: OFPT_PACKET_IN
Apr 11, 2020 17:54:44.078366150 CST    127.0.0.1 → 127.0.0.1    OpenFlow Type: OFPT_PACKET_IN
Apr 11, 2020 17:54:44.078430251 CST    127.0.0.1 → 127.0.0.1    TCP 6653 → 57626 [ACK] Seq=9 Ack=17145 Win=86 Len=0 TSval=2752542372 TSecr=2752542371
Apr 11, 2020 17:54:44.078990208 CST    127.0.0.1 → 127.0.0.1    OpenFlow Type: OFPT_PACKET_IN
Apr 11, 2020 17:54:44.079622386 CST    127.0.0.1 → 127.0.0.1    OpenFlow Type: OFPT_PACKET_IN
Apr 11, 2020 17:54:44.079688272 CST    127.0.0.1 → 127.0.0.1    TCP 6653 → 57626 [ACK] Seq=9 Ack=17349 Win=86 Len=0 TSval=2752542373 TSecr=2752542372
Apr 11, 2020 17:54:44.080230440 CST    127.0.0.1 → 127.0.0.1    OpenFlow Type: OFPT_PACKET_IN
Apr 11, 2020 17:54:44.080863722 CST    127.0.0.1 → 127.0.0.1    OpenFlow Type: OFPT_PACKET_IN
Apr 11, 2020 17:54:44.080929587 CST    127.0.0.1 → 127.0.0.1    TCP 6653 → 57626 [ACK] Seq=9 Ack=17553 Win=86 Len=0 TSval=2752542374 TSecr=2752542374
Apr 11, 2020 17:54:44.081495545 CST    127.0.0.1 → 127.0.0.1    OpenFlow Type: OFPT_PACKET_IN
Apr 11, 2020 17:54:44.082120858 CST    127.0.0.1 → 127.0.0.1    OpenFlow Type: OFPT_PACKET_IN
Apr 11, 2020 17:54:44.082187210 CST    127.0.0.1 → 127.0.0.1    TCP 6653 → 57626 [ACK] Seq=9 Ack=17757 Win=86 Len=0 TSval=2752542375 TSecr=2752542375
Apr 11, 2020 17:54:44.082752113 CST    127.0.0.1 → 127.0.0.1    OpenFlow Type: OFPT_PACKET_IN
Apr 11, 2020 17:54:44.083389083 CST    127.0.0.1 → 127.0.0.1    OpenFlow Type: OFPT_PACKET_IN
Apr 11, 2020 17:54:44.083457880 CST    127.0.0.1 → 127.0.0.1    TCP 6653 → 57626 [ACK] Seq=9 Ack=17961 Win=86 Len=0 TSval=2752542377 TSecr=2752542376
Apr 11, 2020 17:54:44.084022043 CST    127.0.0.1 → 127.0.0.1    OpenFlow Type: OFPT_PACKET_IN
Apr 11, 2020 17:54:44.084632948 CST    127.0.0.1 → 127.0.0.1    OpenFlow Type: OFPT_PACKET_IN
Apr 11, 2020 17:54:44.084705482 CST    127.0.0.1 → 127.0.0.1    TCP 6653 → 57626 [ACK] Seq=9 Ack=18165 Win=86 Len=0 TSval=2752542378 TSecr=2752542377
Apr 11, 2020 17:54:44.085270838 CST    127.0.0.1 → 127.0.0.1    OpenFlow Type: OFPT_PACKET_IN
Apr 11, 2020 17:54:44.085899577 CST    127.0.0.1 → 127.0.0.1    OpenFlow Type: OFPT_PACKET_IN
Apr 11, 2020 17:54:44.085969144 CST    127.0.0.1 → 127.0.0.1    TCP 6653 → 57626 [ACK] Seq=9 Ack=18369 Win=86 Len=0 TSval=2752542379 TSecr=2752542379
Apr 11, 2020 17:54:44.086519180 CST    127.0.0.1 → 127.0.0.1    OpenFlow Type: OFPT_PACKET_IN
Apr 11, 2020 17:54:44.087120706 CST    127.0.0.1 → 127.0.0.1    OpenFlow Type: OFPT_PACKET_IN
Apr 11, 2020 17:54:44.087186181 CST    127.0.0.1 → 127.0.0.1    TCP 6653 → 57626 [ACK] Seq=9 Ack=18573 Win=86 Len=0 TSval=2752542380 TSecr=2752542380
Apr 11, 2020 17:54:44.087799631 CST    127.0.0.1 → 127.0.0.1    OpenFlow Type: OFPT_PACKET_IN
Apr 11, 2020 17:54:44.088390344 CST    127.0.0.1 → 127.0.0.1    OpenFlow Type: OFPT_PACKET_IN
Apr 11, 2020 17:54:44.088461879 CST    127.0.0.1 → 127.0.0.1    TCP 6653 → 57626 [ACK] Seq=9 Ack=18777 Win=86 Len=0 TSval=2752542382 TSecr=2752542381
Apr 11, 2020 17:54:44.089025171 CST    127.0.0.1 → 127.0.0.1    OpenFlow Type: OFPT_PACKET_IN
Apr 11, 2020 17:54:44.089628865 CST    127.0.0.1 → 127.0.0.1    OpenFlow Type: OFPT_PACKET_IN
Apr 11, 2020 17:54:44.089698024 CST    127.0.0.1 → 127.0.0.1    TCP 6653 → 57626 [ACK] Seq=9 Ack=18981 Win=86 Len=0 TSval=2752542383 TSecr=2752542382
Apr 11, 2020 17:54:44.090272998 CST    127.0.0.1 → 127.0.0.1    OpenFlow Type: OFPT_PACKET_IN
Apr 11, 2020 17:54:44.090906464 CST    127.0.0.1 → 127.0.0.1    OpenFlow Type: OFPT_PACKET_IN
Apr 11, 2020 17:54:44.090971983 CST    127.0.0.1 → 127.0.0.1    TCP 6653 → 57626 [ACK] Seq=9 Ack=19185 Win=86 Len=0 TSval=2752542384 TSecr=2752542384
Apr 11, 2020 17:54:44.091520902 CST    127.0.0.1 → 127.0.0.1    OpenFlow Type: OFPT_PACKET_IN
Apr 11, 2020 17:54:44.092158782 CST    127.0.0.1 → 127.0.0.1    OpenFlow Type: OFPT_PACKET_IN
Apr 11, 2020 17:54:44.092229054 CST    127.0.0.1 → 127.0.0.1    TCP 6653 → 57626 [ACK] Seq=9 Ack=19389 Win=86 Len=0 TSval=2752542386 TSecr=2752542385
Apr 11, 2020 17:54:44.092766188 CST    127.0.0.1 → 127.0.0.1    OpenFlow Type: OFPT_PACKET_IN
Apr 11, 2020 17:54:44.093397979 CST    127.0.0.1 → 127.0.0.1    OpenFlow Type: OFPT_PACKET_IN
Apr 11, 2020 17:54:44.093467328 CST    127.0.0.1 → 127.0.0.1    TCP 6653 → 57626 [ACK] Seq=9 Ack=19593 Win=86 Len=0 TSval=2752542387 TSecr=2752542386
Apr 11, 2020 17:54:44.093994334 CST    127.0.0.1 → 127.0.0.1    OpenFlow Type: OFPT_PACKET_IN
Apr 11, 2020 17:54:44.094633514 CST    127.0.0.1 → 127.0.0.1    OpenFlow Type: OFPT_PACKET_IN
Apr 11, 2020 17:54:44.094699832 CST    127.0.0.1 → 127.0.0.1    TCP 6653 → 57626 [ACK] Seq=9 Ack=19797 Win=86 Len=0 TSval=2752542388 TSecr=2752542387
Apr 11, 2020 17:54:44.095229304 CST    127.0.0.1 → 127.0.0.1    OpenFlow Type: OFPT_PACKET_IN
Apr 11, 2020 17:54:44.095873127 CST    127.0.0.1 → 127.0.0.1    OpenFlow Type: OFPT_PACKET_IN
Apr 11, 2020 17:54:44.095940803 CST    127.0.0.1 → 127.0.0.1    TCP 6653 → 57626 [ACK] Seq=9 Ack=20001 Win=86 Len=0 TSval=2752542389 TSecr=2752542389
Apr 11, 2020 17:54:44.096491289 CST    127.0.0.1 → 127.0.0.1    OpenFlow Type: OFPT_PACKET_IN
Apr 11, 2020 17:54:44.097123269 CST    127.0.0.1 → 127.0.0.1    OpenFlow Type: OFPT_PACKET_IN
Apr 11, 2020 17:54:44.097192415 CST    127.0.0.1 → 127.0.0.1    TCP 6653 → 57626 [ACK] Seq=9 Ack=20205 Win=86 Len=0 TSval=2752542390 TSecr=2752542390
Apr 11, 2020 17:54:44.097744851 CST    127.0.0.1 → 127.0.0.1    OpenFlow Type: OFPT_PACKET_IN
Apr 11, 2020 17:54:44.098340855 CST    127.0.0.1 → 127.0.0.1    OpenFlow Type: OFPT_PACKET_IN
Apr 11, 2020 17:54:44.098403750 CST    127.0.0.1 → 127.0.0.1    TCP 6653 → 57626 [ACK] Seq=9 Ack=20409 Win=86 Len=0 TSval=2752542392 TSecr=2752542391
Apr 11, 2020 17:54:44.098985047 CST    127.0.0.1 → 127.0.0.1    OpenFlow Type: OFPT_PACKET_IN
Apr 11, 2020 17:54:44.099596288 CST    127.0.0.1 → 127.0.0.1    OpenFlow Type: OFPT_PACKET_IN
Apr 11, 2020 17:54:44.099662475 CST    127.0.0.1 → 127.0.0.1    TCP 6653 → 57626 [ACK] Seq=9 Ack=20613 Win=86 Len=0 TSval=2752542393 TSecr=2752542392
Apr 11, 2020 17:54:44.100208447 CST    127.0.0.1 → 127.0.0.1    OpenFlow Type: OFPT_PACKET_IN
Apr 11, 2020 17:54:44.100817221 CST    127.0.0.1 → 127.0.0.1    OpenFlow Type: OFPT_PACKET_IN
Apr 11, 2020 17:54:44.100884128 CST    127.0.0.1 → 127.0.0.1    TCP 6653 → 57626 [ACK] Seq=9 Ack=20817 Win=86 Len=0 TSval=2752542394 TSecr=2752542394
Apr 11, 2020 17:54:44.101424824 CST    127.0.0.1 → 127.0.0.1    OpenFlow Type: OFPT_PACKET_IN
Apr 11, 2020 17:54:44.102023562 CST    127.0.0.1 → 127.0.0.1    OpenFlow Type: OFPT_PACKET_IN
Apr 11, 2020 17:54:44.102089860 CST    127.0.0.1 → 127.0.0.1    TCP 6653 → 57626 [ACK] Seq=9 Ack=21021 Win=86 Len=0 TSval=2752542395 TSecr=2752542395
Apr 11, 2020 17:54:44.102628879 CST    127.0.0.1 → 127.0.0.1    OpenFlow Type: OFPT_PACKET_IN
Apr 11, 2020 17:54:44.103239616 CST    127.0.0.1 → 127.0.0.1    OpenFlow Type: OFPT_PACKET_IN
Apr 11, 2020 17:54:44.103301792 CST    127.0.0.1 → 127.0.0.1    TCP 6653 → 57626 [ACK] Seq=9 Ack=21225 Win=86 Len=0 TSval=2752542397 TSecr=2752542396
Apr 11, 2020 17:54:44.103886357 CST    127.0.0.1 → 127.0.0.1    OpenFlow Type: OFPT_PACKET_IN
Apr 11, 2020 17:54:44.104480362 CST    127.0.0.1 → 127.0.0.1    OpenFlow Type: OFPT_PACKET_IN
Apr 11, 2020 17:54:44.104555622 CST    127.0.0.1 → 127.0.0.1    TCP 6653 → 57626 [ACK] Seq=9 Ack=21429 Win=86 Len=0 TSval=2752542398 TSecr=2752542397
Apr 11, 2020 17:54:44.105067121 CST    127.0.0.1 → 127.0.0.1    OpenFlow Type: OFPT_PACKET_IN
Apr 11, 2020 17:54:44.105657317 CST    127.0.0.1 → 127.0.0.1    OpenFlow Type: OFPT_PACKET_IN
Apr 11, 2020 17:54:44.105733637 CST    127.0.0.1 → 127.0.0.1    TCP 6653 → 57626 [ACK] Seq=9 Ack=21633 Win=86 Len=0 TSval=2752542399 TSecr=2752542398
Apr 11, 2020 17:54:44.106234487 CST    127.0.0.1 → 127.0.0.1    OpenFlow Type: OFPT_PACKET_IN
Apr 11, 2020 17:54:44.106822646 CST    127.0.0.1 → 127.0.0.1    OpenFlow Type: OFPT_PACKET_IN
Apr 11, 2020 17:54:44.106896369 CST    127.0.0.1 → 127.0.0.1    TCP 6653 → 57626 [ACK] Seq=9 Ack=21837 Win=86 Len=0 TSval=2752542400 TSecr=2752542400
Apr 11, 2020 17:54:44.107426229 CST    127.0.0.1 → 127.0.0.1    OpenFlow Type: OFPT_PACKET_IN
Apr 11, 2020 17:54:44.108016406 CST    127.0.0.1 → 127.0.0.1    OpenFlow Type: OFPT_PACKET_IN
Apr 11, 2020 17:54:44.108092605 CST    127.0.0.1 → 127.0.0.1    TCP 6653 → 57626 [ACK] Seq=9 Ack=22041 Win=86 Len=0 TSval=2752542401 TSecr=2752542401
Apr 11, 2020 17:54:44.108605845 CST    127.0.0.1 → 127.0.0.1    OpenFlow Type: OFPT_PACKET_IN
Apr 11, 2020 17:54:44.109195406 CST    127.0.0.1 → 127.0.0.1    OpenFlow Type: OFPT_PACKET_IN
Apr 11, 2020 17:54:44.109270909 CST    127.0.0.1 → 127.0.0.1    TCP 6653 → 57626 [ACK] Seq=9 Ack=22245 Win=86 Len=0 TSval=2752542403 TSecr=2752542402
Apr 11, 2020 17:54:44.109772063 CST    127.0.0.1 → 127.0.0.1    OpenFlow Type: OFPT_PACKET_IN
Apr 11, 2020 17:54:44.110359001 CST    127.0.0.1 → 127.0.0.1    OpenFlow Type: OFPT_PACKET_IN
Apr 11, 2020 17:54:44.110431142 CST    127.0.0.1 → 127.0.0.1    TCP 6653 → 57626 [ACK] Seq=9 Ack=22449 Win=86 Len=0 TSval=2752542404 TSecr=2752542403
Apr 11, 2020 17:54:44.110943945 CST    127.0.0.1 → 127.0.0.1    OpenFlow Type: OFPT_PACKET_IN
Apr 11, 2020 17:54:44.111550743 CST    127.0.0.1 → 127.0.0.1    OpenFlow Type: OFPT_PACKET_IN
Apr 11, 2020 17:54:44.111626158 CST    127.0.0.1 → 127.0.0.1    TCP 6653 → 57626 [ACK] Seq=9 Ack=22653 Win=86 Len=0 TSval=2752542405 TSecr=2752542404
Apr 11, 2020 17:54:44.112142604 CST    127.0.0.1 → 127.0.0.1    OpenFlow Type: OFPT_PACKET_IN
Apr 11, 2020 17:54:44.112732290 CST    127.0.0.1 → 127.0.0.1    OpenFlow Type: OFPT_PACKET_IN
Apr 11, 2020 17:54:44.112808050 CST    127.0.0.1 → 127.0.0.1    TCP 6653 → 57626 [ACK] Seq=9 Ack=22857 Win=86 Len=0 TSval=2752542406 TSecr=2752542405
Apr 11, 2020 17:54:44.113321504 CST    127.0.0.1 → 127.0.0.1    OpenFlow Type: OFPT_PACKET_IN
Apr 11, 2020 17:54:44.113901923 CST    127.0.0.1 → 127.0.0.1    OpenFlow Type: OFPT_PACKET_IN
Apr 11, 2020 17:54:44.113975559 CST    127.0.0.1 → 127.0.0.1    TCP 6653 → 57626 [ACK] Seq=9 Ack=23061 Win=86 Len=0 TSval=2752542407 TSecr=2752542407
Apr 11, 2020 17:54:44.114489475 CST    127.0.0.1 → 127.0.0.1    OpenFlow Type: OFPT_PACKET_IN
Apr 11, 2020 17:54:44.115080325 CST    127.0.0.1 → 127.0.0.1    OpenFlow Type: OFPT_PACKET_IN
Apr 11, 2020 17:54:44.115153821 CST    127.0.0.1 → 127.0.0.1    TCP 6653 → 57626 [ACK] Seq=9 Ack=23265 Win=86 Len=0 TSval=2752542408 TSecr=2752542408
Apr 11, 2020 17:54:44.115684950 CST    127.0.0.1 → 127.0.0.1    OpenFlow Type: OFPT_PACKET_IN
Apr 11, 2020 17:54:44.116248485 CST    127.0.0.1 → 127.0.0.1    OpenFlow Type: OFPT_PACKET_IN
Apr 11, 2020 17:54:44.116306903 CST    127.0.0.1 → 127.0.0.1    TCP 6653 → 57626 [ACK] Seq=9 Ack=23469 Win=86 Len=0 TSval=2752542410 TSecr=2752542409
Apr 11, 2020 17:54:44.116851597 CST    127.0.0.1 → 127.0.0.1    OpenFlow Type: OFPT_PACKET_IN
Apr 11, 2020 17:54:44.117447932 CST    127.0.0.1 → 127.0.0.1    OpenFlow Type: OFPT_PACKET_IN
Apr 11, 2020 17:54:44.117503792 CST    127.0.0.1 → 127.0.0.1    TCP 6653 → 57626 [ACK] Seq=9 Ack=23673 Win=86 Len=0 TSval=2752542411 TSecr=2752542410
Apr 11, 2020 17:54:44.118052509 CST    127.0.0.1 → 127.0.0.1    OpenFlow Type: OFPT_PACKET_IN
Apr 11, 2020 17:54:44.118658304 CST    127.0.0.1 → 127.0.0.1    OpenFlow Type: OFPT_PACKET_IN
Apr 11, 2020 17:54:44.118713772 CST    127.0.0.1 → 127.0.0.1    TCP 6653 → 57626 [ACK] Seq=9 Ack=23877 Win=86 Len=0 TSval=2752542412 TSecr=2752542411
Apr 11, 2020 17:54:44.119264528 CST    127.0.0.1 → 127.0.0.1    OpenFlow Type: OFPT_PACKET_IN
