11:01:04.036535 IP 10.0.0.1.12345 > 10.0.0.2.12345: UDP, length 16
11:01:05.036800 IP 10.0.0.1.12345 > 10.0.0.2.12345: UDP, length 16
11:01:06.037016 IP 10.0.0.1.12345 > 10.0.0.2.12345: UDP, length 16
11:01:07.037263 IP 10.0.0.1.12345 > 10.0.0.2.12345: UDP, length 16
11:01:08.037476 IP 10.0.0.1.12345 > 10.0.0.2.12345: UDP, length 16
11:01:09.037666 IP 10.0.0.1.12345 > 10.0.0.2.12345: UDP, length 16
11:01:10.037921 IP 10.0.0.1.12345 > 10.0.0.2.12345: UDP, length 16
11:01:11.038137 IP 10.0.0.1.12345 > 10.0.0.2.12345: UDP, length 16
11:01:12.038386 IP 10.0.0.1.12345 > 10.0.0.2.12345: UDP, length 16
11:01:13.038625 IP 10.0.0.1.12345 > 10.0.0.2.12345: UDP, length 16
11:01:14.038875 IP 10.0.0.1.12345 > 10.0.0.2.12345: UDP, length 16
11:01:15.039093 IP 10.0.0.1.12345 > 10.0.0.2.12345: UDP, length 16
11:01:16.039332 IP 10.0.0.1.12345 > 10.0.0.2.12345: UDP, length 16
11:01:17.039542 IP 10.0.0.1.12345 > 10.0.0.2.12345: UDP, length 16
11:01:18.039732 IP 10.0.0.1.12345 > 10.0.0.2.12345: UDP, length 16
11:01:19.039957 IP 10.0.0.1.12345 > 10.0.0.2.12345: UDP, length 16
11:01:20.040213 IP 10.0.0.1.12345 > 10.0.0.2.12345: UDP, length 16
11:01:21.040427 IP 10.0.0.1.12345 > 10.0.0.2.12345: UDP, length 16
11:01:22.040674 IP 10.0.0.1.12345 > 10.0.0.2.12345: UDP, length 16
11:01:23.040903 IP 10.0.0.1.12345 > 10.0.0.2.12345: UDP, length 16
11:01:24.041076 IP 10.0.0.1.12345 > 10.0.0.2.12345: UDP, length 16
11:01:25.041298 IP 10.0.0.1.12345 > 10.0.0.2.12345: UDP, length 16
11:01:26.041548 IP 10.0.0.1.12345 > 10.0.0.2.12345: UDP, length 16
11:01:27.041788 IP 10.0.0.1.12345 > 10.0.0.2.12345: UDP, length 16
11:01:28.042046 IP 10.0.0.1.12345 > 10.0.0.2.12345: UDP, length 16
11:01:29.042314 IP 10.0.0.1.12345 > 10.0.0.2.12345: UDP, length 16
11:01:30.042575 IP 10.0.0.1.12345 > 10.0.0.2.12345: UDP, length 16
11:01:31.042838 IP 10.0.0.1.12345 > 10.0.0.2.12345: UDP, length 16
11:01:32.043063 IP 10.0.0.1.12345 > 10.0.0.2.12345: UDP, length 16
11:01:33.043288 IP 10.0.0.1.12345 > 10.0.0.2.12345: UDP, length 16
11:01:34.043541 IP 10.0.0.1.12345 > 10.0.0.2.12345: UDP, length 16
11:01:35.043794 IP 10.0.0.1.12345 > 10.0.0.2.12345: UDP, length 16
11:01:36.044019 IP 10.0.0.1.12345 > 10.0.0.2.12345: UDP, length 16
11:01:37.044257 IP 10.0.0.1.12345 > 10.0.0.2.12345: UDP, length 16
11:01:38.044469 IP 10.0.0.1.12345 > 10.0.0.2.12345: UDP, length 16
11:01:39.044731 IP 10.0.0.1.12345 > 10.0.0.2.12345: UDP, length 16
11:01:40.044995 IP 10.0.0.1.12345 > 10.0.0.2.12345: UDP, length 16
11:01:41.045234 IP 10.0.0.1.12345 > 10.0.0.2.12345: UDP, length 16
11:01:42.045491 IP 10.0.0.1.12345 > 10.0.0.2.12345: UDP, length 16
11:01:43.045757 IP 10.0.0.1.12345 > 10.0.0.2.12345: UDP, length 16
11:01:44.045999 IP 10.0.0.1.12345 > 10.0.0.2.12345: UDP, length 16
11:01:45.046257 IP 10.0.0.1.12345 > 10.0.0.2.12345: UDP, length 16
11:01:46.046518 IP 10.0.0.1.12345 > 10.0.0.2.12345: UDP, length 16
11:01:47.046762 IP 10.0.0.1.12345 > 10.0.0.2.12345: UDP, length 16
11:01:48.046949 IP 10.0.0.1.12345 > 10.0.0.2.12345: UDP, length 16
11:01:49.047154 IP 10.0.0.1.12345 > 10.0.0.2.12345: UDP, length 16
11:01:50.047403 IP 10.0.0.1.12345 > 10.0.0.2.12345: UDP, length 16
11:01:51.047598 IP 10.0.0.1.12345 > 10.0.0.2.12345: UDP, length 16
11:01:52.047847 IP 10.0.0.1.12345 > 10.0.0.2.12345: UDP, length 16
11:01:53.048047 IP 10.0.0.1.12345 > 10.0.0.2.12345: UDP, length 16
11:01:54.048290 IP 10.0.0.1.12345 > 10.0.0.2.12345: UDP, length 16
11:01:55.048485 IP 10.0.0.1.12345 > 10.0.0.2.12345: UDP, length 16
11:01:56.048728 IP 10.0.0.1.12345 > 10.0.0.2.12345: UDP, length 16
11:01:57.048955 IP 10.0.0.1.12345 > 10.0.0.2.12345: UDP, length 16
11:01:58.049209 IP 10.0.0.1.12345 > 10.0.0.2.12345: UDP, length 16
11:01:59.049406 IP 10.0.0.1.12345 > 10.0.0.2.12345: UDP, length 16
11:02:00.049601 IP 10.0.0.1.12345 > 10.0.0.2.12345: UDP, length 16
11:02:01.049780 IP 10.0.0.1.12345 > 10.0.0.2.12345: UDP, length 16
11:02:02.050024 IP 10.0.0.1.12345 > 10.0.0.2.12345: UDP, length 16
11:02:03.050224 IP 10.0.0.1.12345 > 10.0.0.2.12345: UDP, length 16
11:02:04.050467 IP 10.0.0.1.12345 > 10.0.0.2.12345: UDP, length 16
11:02:05.050662 IP 10.0.0.1.12345 > 10.0.0.2.12345: UDP, length 16
11:02:06.050909 IP 10.0.0.1.12345 > 10.0.0.2.12345: UDP, length 16
11:02:07.051176 IP 10.0.0.1.12345 > 10.0.0.2.12345: UDP, length 16
11:02:08.051427 IP 10.0.0.1.12345 > 10.0.0.2.12345: UDP, length 16
11:02:09.051658 IP 10.0.0.1.12345 > 10.0.0.2.12345: UDP, length 16
11:02:10.051924 IP 10.0.0.1.12345 > 10.0.0.2.12345: UDP, length 16
11:02:11.052159 IP 10.0.0.1.12345 > 10.0.0.2.12345: UDP, length 16
11:02:12.052416 IP 10.0.0.1.12345 > 10.0.0.2.12345: UDP, length 16
11:02:13.052683 IP 10.0.0.1.12345 > 10.0.0.2.12345: UDP, length 16
11:02:14.052949 IP 10.0.0.1.12345 > 10.0.0.2.12345: UDP, length 16
11:02:15.053214 IP 10.0.0.1.12345 > 10.0.0.2.12345: UDP, length 16
11:02:16.053475 IP 10.0.0.1.12345 > 10.0.0.2.12345: UDP, length 16
11:02:17.053737 IP 10.0.0.1.12345 > 10.0.0.2.12345: UDP, length 16
11:02:18.053931 IP 10.0.0.1.12345 > 10.0.0.2.12345: UDP, length 16
11:02:19.054173 IP 10.0.0.1.12345 > 10.0.0.2.12345: UDP, length 16
11:02:20.054435 IP 10.0.0.1.12345 > 10.0.0.2.12345: UDP, length 16
11:02:21.054694 IP 10.0.0.1.12345 > 10.0.0.2.12345: UDP, length 16
11:02:22.054961 IP 10.0.0.1.12345 > 10.0.0.2.12345: UDP, length 16
11:02:23.055230 IP 10.0.0.1.12345 > 10.0.0.2.12345: UDP, length 16
11:02:24.055498 IP 10.0.0.1.12345 > 10.0.0.2.12345: UDP, length 16
11:02:25.055767 IP 10.0.0.1.12345 > 10.0.0.2.12345: UDP, length 16
11:02:26.056035 IP 10.0.0.1.12345 > 10.0.0.2.12345: UDP, length 16
11:02:27.056302 IP 10.0.0.1.12345 > 10.0.0.2.12345: UDP, length 16
11:02:28.056557 IP 10.0.0.1.12345 > 10.0.0.2.12345: UDP, length 16
11:02:29.056817 IP 10.0.0.1.12345 > 10.0.0.2.12345: UDP, length 16
11:02:30.057078 IP 10.0.0.1.12345 > 10.0.0.2.12345: UDP, length 16
11:02:31.057331 IP 10.0.0.1.12345 > 10.0.0.2.12345: UDP, length 16
11:02:32.057577 IP 10.0.0.1.12345 > 10.0.0.2.12345: UDP, length 16
11:02:33.057803 IP 10.0.0.1.12345 > 10.0.0.2.12345: UDP, length 16
11:02:34.058057 IP 10.0.0.1.12345 > 10.0.0.2.12345: UDP, length 16
11:02:35.058322 IP 10.0.0.1.12345 > 10.0.0.2.12345: UDP, length 16
11:02:36.058569 IP 10.0.0.1.12345 > 10.0.0.2.12345: UDP, length 16
11:02:37.058827 IP 10.0.0.1.12345 > 10.0.0.2.12345: UDP, length 16
11:02:38.059092 IP 10.0.0.1.12345 > 10.0.0.2.12345: UDP, length 16
11:02:39.059354 IP 10.0.0.1.12345 > 10.0.0.2.12345: UDP, length 16
11:02:40.059608 IP 10.0.0.1.12345 > 10.0.0.2.12345: UDP, length 16
11:02:41.059870 IP 10.0.0.1.12345 > 10.0.0.2.12345: UDP, length 16
11:02:42.060039 IP 10.0.0.1.12345 > 10.0.0.2.12345: UDP, length 16
11:02:43.060288 IP 10.0.0.1.12345 > 10.0.0.2.12345: UDP, length 16
11:02:44.060555 IP 10.0.0.1.12345 > 10.0.0.2.12345: UDP, length 16
11:02:45.060803 IP 10.0.0.1.12345 > 10.0.0.2.12345: UDP, length 16
11:02:46.061025 IP 10.0.0.1.12345 > 10.0.0.2.12345: UDP, length 16
11:02:47.061232 IP 10.0.0.1.12345 > 10.0.0.2.12345: UDP, length 16
11:02:48.061435 IP 10.0.0.1.12345 > 10.0.0.2.12345: UDP, length 16
11:02:49.061685 IP 10.0.0.1.12345 > 10.0.0.2.12345: UDP, length 16
11:02:50.061954 IP 10.0.0.1.12345 > 10.0.0.2.12345: UDP, length 16
11:02:51.062223 IP 10.0.0.1.12345 > 10.0.0.2.12345: UDP, length 16
11:02:52.062488 IP 10.0.0.1.12345 > 10.0.0.2.12345: UDP, length 16
11:02:53.062755 IP 10.0.0.1.12345 > 10.0.0.2.12345: UDP, length 16
11:02:54.063004 IP 10.0.0.1.12345 > 10.0.0.2.12345: UDP, length 16
11:02:55.063263 IP 10.0.0.1.12345 > 10.0.0.2.12345: UDP, length 16
11:02:56.063519 IP 10.0.0.1.12345 > 10.0.0.2.12345: UDP, length 16
11:02:57.063776 IP 10.0.0.1.12345 > 10.0.0.2.12345: UDP, length 16
11:02:58.064038 IP 10.0.0.1.12345 > 10.0.0.2.12345: UDP, length 16
11:02:59.064234 IP 10.0.0.1.12345 > 10.0.0.2.12345: UDP, length 16
11:03:00.064445 IP 10.0.0.1.12345 > 10.0.0.2.12345: UDP, length 16
11:03:01.064698 IP 10.0.0.1.12345 > 10.0.0.2.12345: UDP, length 16
11:03:02.064961 IP 10.0.0.1.12345 > 10.0.0.2.12345: UDP, length 16
11:03:03.065172 IP 10.0.0.1.12345 > 10.0.0.2.12345: UDP, length 16
11:03:04.065420 IP 10.0.0.1.12345 > 10.0.0.2.12345: UDP, length 16
11:03:05.065633 IP 10.0.0.1.12345 > 10.0.0.2.12345: UDP, length 16
11:03:06.065870 IP 10.0.0.1.12345 > 10.0.0.2.12345: UDP, length 16
11:03:07.066130 IP 10.0.0.1.12345 > 10.0.0.2.12345: UDP, length 16
11:03:08.066383 IP 10.0.0.1.12345 > 10.0.0.2.12345: UDP, length 16
11:03:09.066625 IP 10.0.0.1.12345 > 10.0.0.2.12345: UDP, length 16
11:03:10.066806 IP 10.0.0.1.12345 > 10.0.0.2.12345: UDP, length 16
11:03:11.067006 IP 10.0.0.1.12345 > 10.0.0.2.12345: UDP, length 16
11:03:12.067232 IP 10.0.0.1.12345 > 10.0.0.2.12345: UDP, length 16
11:03:13.067489 IP 10.0.0.1.12345 > 10.0.0.2.12345: UDP, length 16
11:03:14.067797 IP 10.0.0.1.12345 > 10.0.0.2.12345: UDP, length 16
11:03:15.068054 IP 10.0.0.1.12345 > 10.0.0.2.12345: UDP, length 16
11:03:16.068298 IP 10.0.0.1.12345 > 10.0.0.2.12345: UDP, length 16
11:03:17.068540 IP 10.0.0.1.12345 > 10.0.0.2.12345: UDP, length 16
11:03:18.068747 IP 10.0.0.1.12345 > 10.0.0.2.12345: UDP, length 16
11:03:19.068994 IP 10.0.0.1.12345 > 10.0.0.2.12345: UDP, length 16
11:03:20.069237 IP 10.0.0.1.12345 > 10.0.0.2.12345: UDP, length 16
11:03:21.069492 IP 10.0.0.1.12345 > 10.0.0.2.12345: UDP, length 16
11:03:22.069736 IP 10.0.0.1.12345 > 10.0.0.2.12345: UDP, length 16
11:03:23.069993 IP 10.0.0.1.12345 > 10.0.0.2.12345: UDP, length 16
11:03:24.070235 IP 10.0.0.1.12345 > 10.0.0.2.12345: UDP, length 16
11:03:25.070487 IP 10.0.0.1.12345 > 10.0.0.2.12345: UDP, length 16
11:03:26.070699 IP 10.0.0.1.12345 > 10.0.0.2.12345: UDP, length 16
11:03:27.070943 IP 10.0.0.1.12345 > 10.0.0.2.12345: UDP, length 16
11:03:28.071211 IP 10.0.0.1.12345 > 10.0.0.2.12345: UDP, length 16
11:03:29.071411 IP 10.0.0.1.12345 > 10.0.0.2.12345: UDP, length 16
11:03:30.071647 IP 10.0.0.1.12345 > 10.0.0.2.12345: UDP, length 16
11:03:31.071917 IP 10.0.0.1.12345 > 10.0.0.2.12345: UDP, length 16
11:03:32.072169 IP 10.0.0.1.12345 > 10.0.0.2.12345: UDP, length 16
11:03:33.072390 IP 10.0.0.1.12345 > 10.0.0.2.12345: UDP, length 16
11:03:34.072614 IP 10.0.0.1.12345 > 10.0.0.2.12345: UDP, length 16
11:03:35.072872 IP 10.0.0.1.12345 > 10.0.0.2.12345: UDP, length 16
11:03:36.073089 IP 10.0.0.1.12345 > 10.0.0.2.12345: UDP, length 16
11:03:37.073336 IP 10.0.0.1.12345 > 10.0.0.2.12345: UDP, length 16
11:03:38.073577 IP 10.0.0.1.12345 > 10.0.0.2.12345: UDP, length 16
11:03:39.073833 IP 10.0.0.1.12345 > 10.0.0.2.12345: UDP, length 16
11:03:40.074062 IP 10.0.0.1.12345 > 10.0.0.2.12345: UDP, length 16
11:03:41.074314 IP 10.0.0.1.12345 > 10.0.0.2.12345: UDP, length 16
11:03:42.074558 IP 10.0.0.1.12345 > 10.0.0.2.12345: UDP, length 16
11:03:43.074810 IP 10.0.0.1.12345 > 10.0.0.2.12345: UDP, length 16
11:03:44.075032 IP 10.0.0.1.12345 > 10.0.0.2.12345: UDP, length 16
11:03:45.075282 IP 10.0.0.1.12345 > 10.0.0.2.12345: UDP, length 16
11:03:46.075504 IP 10.0.0.1.12345 > 10.0.0.2.12345: UDP, length 16
11:03:47.075854 IP 10.0.0.1.12345 > 10.0.0.2.12345: UDP, length 16
11:03:48.076087 IP 10.0.0.1.12345 > 10.0.0.2.12345: UDP, length 16
11:03:49.076340 IP 10.0.0.1.12345 > 10.0.0.2.12345: UDP, length 16
11:03:50.076603 IP 10.0.0.1.12345 > 10.0.0.2.12345: UDP, length 16
11:03:51.076860 IP 10.0.0.1.12345 > 10.0.0.2.12345: UDP, length 16
11:03:52.077117 IP 10.0.0.1.12345 > 10.0.0.2.12345: UDP, length 16
11:03:53.077370 IP 10.0.0.1.12345 > 10.0.0.2.12345: UDP, length 16
11:03:54.077621 IP 10.0.0.1.12345 > 10.0.0.2.12345: UDP, length 16
11:03:55.077875 IP 10.0.0.1.12345 > 10.0.0.2.12345: UDP, length 16
11:03:56.078092 IP 10.0.0.1.12345 > 10.0.0.2.12345: UDP, length 16
11:03:57.078334 IP 10.0.0.1.12345 > 10.0.0.2.12345: UDP, length 16
11:03:58.078575 IP 10.0.0.1.12345 > 10.0.0.2.12345: UDP, length 16
11:03:59.078764 IP 10.0.0.1.12345 > 10.0.0.2.12345: UDP, length 16
11:04:00.078970 IP 10.0.0.1.12345 > 10.0.0.2.12345: UDP, length 16
11:04:01.079208 IP 10.0.0.1.12345 > 10.0.0.2.12345: UDP, length 16
11:04:02.079423 IP 10.0.0.1.12345 > 10.0.0.2.12345: UDP, length 16
11:04:03.079619 IP 10.0.0.1.12345 > 10.0.0.2.12345: UDP, length 16
11:04:04.079829 IP 10.0.0.1.12345 > 10.0.0.2.12345: UDP, length 16
11:04:05.080080 IP 10.0.0.1.12345 > 10.0.0.2.12345: UDP, length 16
11:04:06.080306 IP 10.0.0.1.12345 > 10.0.0.2.12345: UDP, length 16
11:04:07.080560 IP 10.0.0.1.12345 > 10.0.0.2.12345: UDP, length 16
11:04:08.080758 IP 10.0.0.1.12345 > 10.0.0.2.12345: UDP, length 16
11:04:09.080982 IP 10.0.0.1.12345 > 10.0.0.2.12345: UDP, length 16
11:04:10.081174 IP 10.0.0.1.12345 > 10.0.0.2.12345: UDP, length 16
11:04:11.081366 IP 10.0.0.1.12345 > 10.0.0.2.12345: UDP, length 16
11:04:12.081547 IP 10.0.0.1.12345 > 10.0.0.2.12345: UDP, length 16
11:04:13.081790 IP 10.0.0.1.12345 > 10.0.0.2.12345: UDP, length 16
11:04:14.081991 IP 10.0.0.1.12345 > 10.0.0.2.12345: UDP, length 16
11:04:15.082239 IP 10.0.0.1.12345 > 10.0.0.2.12345: UDP, length 16
11:04:16.082438 IP 10.0.0.1.12345 > 10.0.0.2.12345: UDP, length 16
11:04:17.082652 IP 10.0.0.1.12345 > 10.0.0.2.12345: UDP, length 16
11:04:18.082845 IP 10.0.0.1.12345 > 10.0.0.2.12345: UDP, length 16
11:04:19.083094 IP 10.0.0.1.12345 > 10.0.0.2.12345: UDP, length 16
11:04:20.083360 IP 10.0.0.1.12345 > 10.0.0.2.12345: UDP, length 16
11:04:21.083619 IP 10.0.0.1.12345 > 10.0.0.2.12345: UDP, length 16
11:04:22.083881 IP 10.0.0.1.12345 > 10.0.0.2.12345: UDP, length 16
11:04:23.084141 IP 10.0.0.1.12345 > 10.0.0.2.12345: UDP, length 16
11:04:24.084404 IP 10.0.0.1.12345 > 10.0.0.2.12345: UDP, length 16
11:04:25.084669 IP 10.0.0.1.12345 > 10.0.0.2.12345: UDP, length 16
11:04:26.084927 IP 10.0.0.1.12345 > 10.0.0.2.12345: UDP, length 16
11:04:27.085187 IP 10.0.0.1.12345 > 10.0.0.2.12345: UDP, length 16
11:04:28.085455 IP 10.0.0.1.12345 > 10.0.0.2.12345: UDP, length 16
11:04:29.085721 IP 10.0.0.1.12345 > 10.0.0.2.12345: UDP, length 16
11:04:30.085982 IP 10.0.0.1.12345 > 10.0.0.2.12345: UDP, length 16
11:04:31.086253 IP 10.0.0.1.12345 > 10.0.0.2.12345: UDP, length 16
11:04:32.086480 IP 10.0.0.1.12345 > 10.0.0.2.12345: UDP, length 16
11:04:33.086685 IP 10.0.0.1.12345 > 10.0.0.2.12345: UDP, length 16
11:04:34.086934 IP 10.0.0.1.12345 > 10.0.0.2.12345: UDP, length 16
11:04:35.087204 IP 10.0.0.1.12345 > 10.0.0.2.12345: UDP, length 16
11:04:36.087469 IP 10.0.0.1.12345 > 10.0.0.2.12345: UDP, length 16
11:04:37.087830 IP 10.0.0.1.12345 > 10.0.0.2.12345: UDP, length 16
11:04:38.088094 IP 10.0.0.1.12345 > 10.0.0.2.12345: UDP, length 16
11:04:39.088310 IP 10.0.0.1.12345 > 10.0.0.2.12345: UDP, length 16
11:04:40.088566 IP 10.0.0.1.12345 > 10.0.0.2.12345: UDP, length 16
11:04:41.088828 IP 10.0.0.1.12345 > 10.0.0.2.12345: UDP, length 16
11:04:42.089090 IP 10.0.0.1.12345 > 10.0.0.2.12345: UDP, length 16
11:04:43.089359 IP 10.0.0.1.12345 > 10.0.0.2.12345: UDP, length 16
11:04:44.089625 IP 10.0.0.1.12345 > 10.0.0.2.12345: UDP, length 16
11:04:45.089889 IP 10.0.0.1.12345 > 10.0.0.2.12345: UDP, length 16
11:04:46.090152 IP 10.0.0.1.12345 > 10.0.0.2.12345: UDP, length 16
11:04:47.090398 IP 10.0.0.1.12345 > 10.0.0.2.12345: UDP, length 16
11:04:48.090598 IP 10.0.0.1.12345 > 10.0.0.2.12345: UDP, length 16
11:04:49.090782 IP 10.0.0.1.12345 > 10.0.0.2.12345: UDP, length 16
11:04:50.090953 IP 10.0.0.1.12345 > 10.0.0.2.12345: UDP, length 16
11:04:51.091215 IP 10.0.0.1.12345 > 10.0.0.2.12345: UDP, length 16
11:04:52.091479 IP 10.0.0.1.12345 > 10.0.0.2.12345: UDP, length 16
11:04:53.091823 IP 10.0.0.1.12345 > 10.0.0.2.12345: UDP, length 16
11:04:54.092091 IP 10.0.0.1.12345 > 10.0.0.2.12345: UDP, length 16
11:04:55.092357 IP 10.0.0.1.12345 > 10.0.0.2.12345: UDP, length 16
11:04:56.092601 IP 10.0.0.1.12345 > 10.0.0.2.12345: UDP, length 16
11:04:57.092858 IP 10.0.0.1.12345 > 10.0.0.2.12345: UDP, length 16
11:04:58.093120 IP 10.0.0.1.12345 > 10.0.0.2.12345: UDP, length 16
11:04:59.093317 IP 10.0.0.1.12345 > 10.0.0.2.12345: UDP, length 16
11:05:00.093549 IP 10.0.0.1.12345 > 10.0.0.2.12345: UDP, length 16
11:05:01.093784 IP 10.0.0.1.12345 > 10.0.0.2.12345: UDP, length 16
11:05:02.094035 IP 10.0.0.1.12345 > 10.0.0.2.12345: UDP, length 16
11:05:03.094245 IP 10.0.0.1.12345 > 10.0.0.2.12345: UDP, length 16
11:05:04.094489 IP 10.0.0.1.12345 > 10.0.0.2.12345: UDP, length 16
11:05:05.094736 IP 10.0.0.1.12345 > 10.0.0.2.12345: UDP, length 16
11:05:06.094992 IP 10.0.0.1.12345 > 10.0.0.2.12345: UDP, length 16
11:05:07.095258 IP 10.0.0.1.12345 > 10.0.0.2.12345: UDP, length 16
11:05:08.095518 IP 10.0.0.1.12345 > 10.0.0.2.12345: UDP, length 16
11:05:09.095777 IP 10.0.0.1.12345 > 10.0.0.2.12345: UDP, length 16
11:05:10.096035 IP 10.0.0.1.12345 > 10.0.0.2.12345: UDP, length 16
11:05:11.096279 IP 10.0.0.1.12345 > 10.0.0.2.12345: UDP, length 16
11:05:12.096495 IP 10.0.0.1.12345 > 10.0.0.2.12345: UDP, length 16
11:05:13.096737 IP 10.0.0.1.12345 > 10.0.0.2.12345: UDP, length 16
11:05:14.096995 IP 10.0.0.1.12345 > 10.0.0.2.12345: UDP, length 16
11:05:15.097306 IP 10.0.0.1.12345 > 10.0.0.2.12345: UDP, length 16
11:05:16.097562 IP 10.0.0.1.12345 > 10.0.0.2.12345: UDP, length 16
11:05:17.097815 IP 10.0.0.1.12345 > 10.0.0.2.12345: UDP, length 16
11:05:18.098019 IP 10.0.0.1.12345 > 10.0.0.2.12345: UDP, length 16
11:05:19.098252 IP 10.0.0.1.12345 > 10.0.0.2.12345: UDP, length 16
11:05:20.098511 IP 10.0.0.1.12345 > 10.0.0.2.12345: UDP, length 16
11:05:21.098756 IP 10.0.0.1.12345 > 10.0.0.2.12345: UDP, length 16
11:05:22.099011 IP 10.0.0.1.12345 > 10.0.0.2.12345: UDP, length 16
11:05:23.099256 IP 10.0.0.1.12345 > 10.0.0.2.12345: UDP, length 16
11:05:24.099516 IP 10.0.0.1.12345 > 10.0.0.2.12345: UDP, length 16
11:05:25.099764 IP 10.0.0.1.12345 > 10.0.0.2.12345: UDP, length 16
11:05:26.100021 IP 10.0.0.1.12345 > 10.0.0.2.12345: UDP, length 16
11:05:27.100286 IP 10.0.0.1.12345 > 10.0.0.2.12345: UDP, length 16
11:05:28.100536 IP 10.0.0.1.12345 > 10.0.0.2.12345: UDP, length 16
11:05:29.100794 IP 10.0.0.1.12345 > 10.0.0.2.12345: UDP, length 16
11:05:30.101057 IP 10.0.0.1.12345 > 10.0.0.2.12345: UDP, length 16
11:05:31.101310 IP 10.0.0.1.12345 > 10.0.0.2.12345: UDP, length 16
11:05:32.101568 IP 10.0.0.1.12345 > 10.0.0.2.12345: UDP, length 16
11:05:33.101805 IP 10.0.0.1.12345 > 10.0.0.2.12345: UDP, length 16
11:05:34.102056 IP 10.0.0.1.12345 > 10.0.0.2.12345: UDP, length 16
11:05:35.102275 IP 10.0.0.1.12345 > 10.0.0.2.12345: UDP, length 16
11:05:36.102523 IP 10.0.0.1.12345 > 10.0.0.2.12345: UDP, length 16
11:05:37.102742 IP 10.0.0.1.12345 > 10.0.0.2.12345: UDP, length 16
11:05:38.102959 IP 10.0.0.1.12345 > 10.0.0.2.12345: UDP, length 16
11:05:39.103102 IP 10.0.0.1.12345 > 10.0.0.2.12345: UDP, length 16
11:05:40.103316 IP 10.0.0.1.12345 > 10.0.0.2.12345: UDP, length 16
11:05:41.103559 IP 10.0.0.1.12345 > 10.0.0.2.12345: UDP, length 16
11:05:42.103814 IP 10.0.0.1.12345 > 10.0.0.2.12345: UDP, length 16
11:05:43.104037 IP 10.0.0.1.12345 > 10.0.0.2.12345: UDP, length 16
11:05:44.104284 IP 10.0.0.1.12345 > 10.0.0.2.12345: UDP, length 16
11:05:45.104503 IP 10.0.0.1.12345 > 10.0.0.2.12345: UDP, length 16
11:05:46.104751 IP 10.0.0.1.12345 > 10.0.0.2.12345: UDP, length 16
11:05:47.104991 IP 10.0.0.1.12345 > 10.0.0.2.12345: UDP, length 16
11:05:48.105180 IP 10.0.0.1.12345 > 10.0.0.2.12345: UDP, length 16
11:05:49.105375 IP 10.0.0.1.12345 > 10.0.0.2.12345: UDP, length 16
11:05:50.105609 IP 10.0.0.1.12345 > 10.0.0.2.12345: UDP, length 16
11:05:51.105843 IP 10.0.0.1.12345 > 10.0.0.2.12345: UDP, length 16
11:05:52.106095 IP 10.0.0.1.12345 > 10.0.0.2.12345: UDP, length 16
11:05:53.106336 IP 10.0.0.1.12345 > 10.0.0.2.12345: UDP, length 16
11:05:54.106588 IP 10.0.0.1.12345 > 10.0.0.2.12345: UDP, length 16
11:05:55.106809 IP 10.0.0.1.12345 > 10.0.0.2.12345: UDP, length 16
11:05:56.106998 IP 10.0.0.1.12345 > 10.0.0.2.12345: UDP, length 16
11:05:57.107211 IP 10.0.0.1.12345 > 10.0.0.2.12345: UDP, length 16
11:05:58.107384 IP 10.0.0.1.12345 > 10.0.0.2.12345: UDP, length 16
11:05:59.107566 IP 10.0.0.1.12345 > 10.0.0.2.12345: UDP, length 16
11:06:00.107797 IP 10.0.0.1.12345 > 10.0.0.2.12345: UDP, length 16
11:06:01.107986 IP 10.0.0.1.12345 > 10.0.0.2.12345: UDP, length 16
11:06:02.108227 IP 10.0.0.1.12345 > 10.0.0.2.12345: UDP, length 16
11:06:03.108471 IP 10.0.0.1.12345 > 10.0.0.2.12345: UDP, length 16

