11:01:04.037497 IP 10.0.0.1.12345 > 10.0.0.2.12345: UDP, length 16
11:01:05.036824 IP 10.0.0.1.12345 > 10.0.0.2.12345: UDP, length 16
11:01:06.037041 IP 10.0.0.1.12345 > 10.0.0.2.12345: UDP, length 16
11:01:07.037287 IP 10.0.0.1.12345 > 10.0.0.2.12345: UDP, length 16
11:01:08.037503 IP 10.0.0.1.12345 > 10.0.0.2.12345: UDP, length 16
11:01:09.037686 IP 10.0.0.1.12345 > 10.0.0.2.12345: UDP, length 16
11:01:10.037949 IP 10.0.0.1.12345 > 10.0.0.2.12345: UDP, length 16
11:01:11.038155 IP 10.0.0.1.12345 > 10.0.0.2.12345: UDP, length 16
11:01:12.038411 IP 10.0.0.1.12345 > 10.0.0.2.12345: UDP, length 16
11:01:13.038648 IP 10.0.0.1.12345 > 10.0.0.2.12345: UDP, length 16
11:01:14.038900 IP 10.0.0.1.12345 > 10.0.0.2.12345: UDP, length 16
11:01:15.039111 IP 10.0.0.1.12345 > 10.0.0.2.12345: UDP, length 16
11:01:16.039356 IP 10.0.0.1.12345 > 10.0.0.2.12345: UDP, length 16
11:01:17.039559 IP 10.0.0.1.12345 > 10.0.0.2.12345: UDP, length 16
11:01:18.039747 IP 10.0.0.1.12345 > 10.0.0.2.12345: UDP, length 16
11:01:19.039980 IP 10.0.0.1.12345 > 10.0.0.2.12345: UDP, length 16
11:01:20.040238 IP 10.0.0.1.12345 > 10.0.0.2.12345: UDP, length 16
11:01:21.040445 IP 10.0.0.1.12345 > 10.0.0.2.12345: UDP, length 16
11:01:22.040703 IP 10.0.0.1.12345 > 10.0.0.2.12345: UDP, length 16
11:01:23.040924 IP 10.0.0.1.12345 > 10.0.0.2.12345: UDP, length 16
11:01:24.041097 IP 10.0.0.1.12345 > 10.0.0.2.12345: UDP, length 16
11:01:25.041319 IP 10.0.0.1.12345 > 10.0.0.2.12345: UDP, length 16
11:01:26.041576 IP 10.0.0.1.12345 > 10.0.0.2.12345: UDP, length 16
11:01:27.041813 IP 10.0.0.1.12345 > 10.0.0.2.12345: UDP, length 16
11:01:28.042077 IP 10.0.0.1.12345 > 10.0.0.2.12345: UDP, length 16
11:01:29.042341 IP 10.0.0.1.12345 > 10.0.0.2.12345: UDP, length 16
11:01:30.042606 IP 10.0.0.1.12345 > 10.0.0.2.12345: UDP, length 16
11:01:31.042866 IP 10.0.0.1.12345 > 10.0.0.2.12345: UDP, length 16
11:01:32.043085 IP 10.0.0.1.12345 > 10.0.0.2.12345: UDP, length 16
11:01:33.043310 IP 10.0.0.1.12345 > 10.0.0.2.12345: UDP, length 16
11:01:34.043572 IP 10.0.0.1.12345 > 10.0.0.2.12345: UDP, length 16
11:01:35.043820 IP 10.0.0.1.12345 > 10.0.0.2.12345: UDP, length 16
11:01:36.044045 IP 10.0.0.1.12345 > 10.0.0.2.12345: UDP, length 16
11:01:37.044281 IP 10.0.0.1.12345 > 10.0.0.2.12345: UDP, length 16
11:01:38.044498 IP 10.0.0.1.12345 > 10.0.0.2.12345: UDP, length 16
11:01:39.044759 IP 10.0.0.1.12345 > 10.0.0.2.12345: UDP, length 16
11:01:40.045026 IP 10.0.0.1.12345 > 10.0.0.2.12345: UDP, length 16
11:01:41.045257 IP 10.0.0.1.12345 > 10.0.0.2.12345: UDP, length 16
11:01:42.045522 IP 10.0.0.1.12345 > 10.0.0.2.12345: UDP, length 16
11:01:43.045785 IP 10.0.0.1.12345 > 10.0.0.2.12345: UDP, length 16
11:01:44.046025 IP 10.0.0.1.12345 > 10.0.0.2.12345: UDP, length 16
11:01:45.046282 IP 10.0.0.1.12345 > 10.0.0.2.12345: UDP, length 16
11:01:46.046546 IP 10.0.0.1.12345 > 10.0.0.2.12345: UDP, length 16
11:01:47.046785 IP 10.0.0.1.12345 > 10.0.0.2.12345: UDP, length 16
11:01:48.046963 IP 10.0.0.1.12345 > 10.0.0.2.12345: UDP, length 16
11:01:49.047173 IP 10.0.0.1.12345 > 10.0.0.2.12345: UDP, length 16
11:01:50.047431 IP 10.0.0.1.12345 > 10.0.0.2.12345: UDP, length 16
11:01:51.047612 IP 10.0.0.1.12345 > 10.0.0.2.12345: UDP, length 16
11:01:52.047875 IP 10.0.0.1.12345 > 10.0.0.2.12345: UDP, length 16
11:01:53.048062 IP 10.0.0.1.12345 > 10.0.0.2.12345: UDP, length 16
11:01:54.048317 IP 10.0.0.1.12345 > 10.0.0.2.12345: UDP, length 16
11:01:55.048500 IP 10.0.0.1.12345 > 10.0.0.2.12345: UDP, length 16
11:01:56.048757 IP 10.0.0.1.12345 > 10.0.0.2.12345: UDP, length 16
11:01:57.048975 IP 10.0.0.1.12345 > 10.0.0.2.12345: UDP, length 16
11:01:58.049237 IP 10.0.0.1.12345 > 10.0.0.2.12345: UDP, length 16
11:01:59.049420 IP 10.0.0.1.12345 > 10.0.0.2.12345: UDP, length 16
11:02:00.049618 IP 10.0.0.1.12345 > 10.0.0.2.12345: UDP, length 16
11:02:01.049794 IP 10.0.0.1.12345 > 10.0.0.2.12345: UDP, length 16
11:02:02.050050 IP 10.0.0.1.12345 > 10.0.0.2.12345: UDP, length 16
11:02:03.050238 IP 10.0.0.1.12345 > 10.0.0.2.12345: UDP, length 16
11:02:04.050495 IP 10.0.0.1.12345 > 10.0.0.2.12345: UDP, length 16
11:02:05.050677 IP 10.0.0.1.12345 > 10.0.0.2.12345: UDP, length 16
11:02:06.050940 IP 10.0.0.1.12345 > 10.0.0.2.12345: UDP, length 16
11:02:07.051204 IP 10.0.0.1.12345 > 10.0.0.2.12345: UDP, length 16
11:02:08.051451 IP 10.0.0.1.12345 > 10.0.0.2.12345: UDP, length 16
11:02:09.051689 IP 10.0.0.1.12345 > 10.0.0.2.12345: UDP, length 16
11:02:10.051953 IP 10.0.0.1.12345 > 10.0.0.2.12345: UDP, length 16
11:02:11.052181 IP 10.0.0.1.12345 > 10.0.0.2.12345: UDP, length 16
11:02:12.052445 IP 10.0.0.1.12345 > 10.0.0.2.12345: UDP, length 16
11:02:13.052711 IP 10.0.0.1.12345 > 10.0.0.2.12345: UDP, length 16
11:02:14.052977 IP 10.0.0.1.12345 > 10.0.0.2.12345: UDP, length 16
11:02:15.053242 IP 10.0.0.1.12345 > 10.0.0.2.12345: UDP, length 16
11:02:16.053502 IP 10.0.0.1.12345 > 10.0.0.2.12345: UDP, length 16
11:02:17.053762 IP 10.0.0.1.12345 > 10.0.0.2.12345: UDP, length 16
11:02:18.053946 IP 10.0.0.1.12345 > 10.0.0.2.12345: UDP, length 16
11:02:19.054201 IP 10.0.0.1.12345 > 10.0.0.2.12345: UDP, length 16
11:02:20.054461 IP 10.0.0.1.12345 > 10.0.0.2.12345: UDP, length 16
11:02:21.054723 IP 10.0.0.1.12345 > 10.0.0.2.12345: UDP, length 16
11:02:22.054992 IP 10.0.0.1.12345 > 10.0.0.2.12345: UDP, length 16
11:02:23.055261 IP 10.0.0.1.12345 > 10.0.0.2.12345: UDP, length 16
11:02:24.055529 IP 10.0.0.1.12345 > 10.0.0.2.12345: UDP, length 16
11:02:25.055798 IP 10.0.0.1.12345 > 10.0.0.2.12345: UDP, length 16
11:02:26.056067 IP 10.0.0.1.12345 > 10.0.0.2.12345: UDP, length 16
11:02:27.056333 IP 10.0.0.1.12345 > 10.0.0.2.12345: UDP, length 16
11:02:28.056583 IP 10.0.0.1.12345 > 10.0.0.2.12345: UDP, length 16
11:02:29.056847 IP 10.0.0.1.12345 > 10.0.0.2.12345: UDP, length 16
11:02:30.057111 IP 10.0.0.1.12345 > 10.0.0.2.12345: UDP, length 16
11:02:31.057356 IP 10.0.0.1.12345 > 10.0.0.2.12345: UDP, length 16
11:02:32.057602 IP 10.0.0.1.12345 > 10.0.0.2.12345: UDP, length 16
11:02:33.057824 IP 10.0.0.1.12345 > 10.0.0.2.12345: UDP, length 16
11:02:34.058086 IP 10.0.0.1.12345 > 10.0.0.2.12345: UDP, length 16
11:02:35.058354 IP 10.0.0.1.12345 > 10.0.0.2.12345: UDP, length 16
11:02:36.058593 IP 10.0.0.1.12345 > 10.0.0.2.12345: UDP, length 16
11:02:37.058858 IP 10.0.0.1.12345 > 10.0.0.2.12345: UDP, length 16
11:02:38.059120 IP 10.0.0.1.12345 > 10.0.0.2.12345: UDP, length 16
11:02:39.059385 IP 10.0.0.1.12345 > 10.0.0.2.12345: UDP, length 16
11:02:40.059634 IP 10.0.0.1.12345 > 10.0.0.2.12345: UDP, length 16
11:02:41.059902 IP 10.0.0.1.12345 > 10.0.0.2.12345: UDP, length 16
11:02:42.060055 IP 10.0.0.1.12345 > 10.0.0.2.12345: UDP, length 16
11:02:43.060318 IP 10.0.0.1.12345 > 10.0.0.2.12345: UDP, length 16
11:02:44.060586 IP 10.0.0.1.12345 > 10.0.0.2.12345: UDP, length 16
11:02:45.060828 IP 10.0.0.1.12345 > 10.0.0.2.12345: UDP, length 16
11:02:46.061046 IP 10.0.0.1.12345 > 10.0.0.2.12345: UDP, length 16
11:02:47.061251 IP 10.0.0.1.12345 > 10.0.0.2.12345: UDP, length 16
11:02:48.061453 IP 10.0.0.1.12345 > 10.0.0.2.12345: UDP, length 16
11:02:49.061715 IP 10.0.0.1.12345 > 10.0.0.2.12345: UDP, length 16
11:02:50.061986 IP 10.0.0.1.12345 > 10.0.0.2.12345: UDP, length 16
11:02:51.062254 IP 10.0.0.1.12345 > 10.0.0.2.12345: UDP, length 16
11:02:52.062519 IP 10.0.0.1.12345 > 10.0.0.2.12345: UDP, length 16
11:02:53.062788 IP 10.0.0.1.12345 > 10.0.0.2.12345: UDP, length 16
11:02:54.063028 IP 10.0.0.1.12345 > 10.0.0.2.12345: UDP, length 16
11:02:55.063295 IP 10.0.0.1.12345 > 10.0.0.2.12345: UDP, length 16
11:02:56.063545 IP 10.0.0.1.12345 > 10.0.0.2.12345: UDP, length 16
11:02:57.063804 IP 10.0.0.1.12345 > 10.0.0.2.12345: UDP, length 16
11:02:58.064065 IP 10.0.0.1.12345 > 10.0.0.2.12345: UDP, length 16
11:02:59.064248 IP 10.0.0.1.12345 > 10.0.0.2.12345: UDP, length 16
11:03:00.064465 IP 10.0.0.1.12345 > 10.0.0.2.12345: UDP, length 16
11:03:01.064726 IP 10.0.0.1.12345 > 10.0.0.2.12345: UDP, length 16
11:03:02.064986 IP 10.0.0.1.12345 > 10.0.0.2.12345: UDP, length 16
11:03:03.065189 IP 10.0.0.1.12345 > 10.0.0.2.12345: UDP, length 16
11:03:04.065446 IP 10.0.0.1.12345 > 10.0.0.2.12345: UDP, length 16
11:03:05.065649 IP 10.0.0.1.12345 > 10.0.0.2.12345: UDP, length 16
11:03:06.065894 IP 10.0.0.1.12345 > 10.0.0.2.12345: UDP, length 16
11:03:07.066160 IP 10.0.0.1.12345 > 10.0.0.2.12345: UDP, length 16
11:03:08.066406 IP 10.0.0.1.12345 > 10.0.0.2.12345: UDP, length 16
11:03:09.066648 IP 10.0.0.1.12345 > 10.0.0.2.12345: UDP, length 16
11:03:10.066828 IP 10.0.0.1.12345 > 10.0.0.2.12345: UDP, length 16
11:03:11.067022 IP 10.0.0.1.12345 > 10.0.0.2.12345: UDP, length 16
11:03:12.067255 IP 10.0.0.1.12345 > 10.0.0.2.12345: UDP, length 16
11:03:13.067517 IP 10.0.0.1.12345 > 10.0.0.2.12345: UDP, length 16
11:03:14.067819 IP 10.0.0.1.12345 > 10.0.0.2.12345: UDP, length 16
11:03:15.068082 IP 10.0.0.1.12345 > 10.0.0.2.12345: UDP, length 16
11:03:16.068320 IP 10.0.0.1.12345 > 10.0.0.2.12345: UDP, length 16
11:03:17.068565 IP 10.0.0.1.12345 > 10.0.0.2.12345: UDP, length 16
11:03:18.068763 IP 10.0.0.1.12345 > 10.0.0.2.12345: UDP, length 16
11:03:19.069023 IP 10.0.0.1.12345 > 10.0.0.2.12345: UDP, length 16
11:03:20.069260 IP 10.0.0.1.12345 > 10.0.0.2.12345: UDP, length 16
11:03:21.069521 IP 10.0.0.1.12345 > 10.0.0.2.12345: UDP, length 16
11:03:22.069759 IP 10.0.0.1.12345 > 10.0.0.2.12345: UDP, length 16
11:03:23.070021 IP 10.0.0.1.12345 > 10.0.0.2.12345: UDP, length 16
11:03:24.070258 IP 10.0.0.1.12345 > 10.0.0.2.12345: UDP, length 16
11:03:25.070515 IP 10.0.0.1.12345 > 10.0.0.2.12345: UDP, length 16
11:03:26.070715 IP 10.0.0.1.12345 > 10.0.0.2.12345: UDP, length 16
11:03:27.070974 IP 10.0.0.1.12345 > 10.0.0.2.12345: UDP, length 16
11:03:28.071239 IP 10.0.0.1.12345 > 10.0.0.2.12345: UDP, length 16
11:03:29.071438 IP 10.0.0.1.12345 > 10.0.0.2.12345: UDP, length 16
11:03:30.071680 IP 10.0.0.1.12345 > 10.0.0.2.12345: UDP, length 16
11:03:31.071945 IP 10.0.0.1.12345 > 10.0.0.2.12345: UDP, length 16
11:03:32.072192 IP 10.0.0.1.12345 > 10.0.0.2.12345: UDP, length 16
11:03:33.072410 IP 10.0.0.1.12345 > 10.0.0.2.12345: UDP, length 16
11:03:34.072635 IP 10.0.0.1.12345 > 10.0.0.2.12345: UDP, length 16
11:03:35.072901 IP 10.0.0.1.12345 > 10.0.0.2.12345: UDP, length 16
11:03:36.073106 IP 10.0.0.1.12345 > 10.0.0.2.12345: UDP, length 16
11:03:37.073362 IP 10.0.0.1.12345 > 10.0.0.2.12345: UDP, length 16
11:03:38.073600 IP 10.0.0.1.12345 > 10.0.0.2.12345: UDP, length 16
11:03:39.073861 IP 10.0.0.1.12345 > 10.0.0.2.12345: UDP, length 16
11:03:40.074083 IP 10.0.0.1.12345 > 10.0.0.2.12345: UDP, length 16
11:03:41.074344 IP 10.0.0.1.12345 > 10.0.0.2.12345: UDP, length 16
11:03:42.074581 IP 10.0.0.1.12345 > 10.0.0.2.12345: UDP, length 16
11:03:43.074840 IP 10.0.0.1.12345 > 10.0.0.2.12345: UDP, length 16
11:03:44.075051 IP 10.0.0.1.12345 > 10.0.0.2.12345: UDP, length 16
11:03:45.075309 IP 10.0.0.1.12345 > 10.0.0.2.12345: UDP, length 16
11:03:46.075525 IP 10.0.0.1.12345 > 10.0.0.2.12345: UDP, length 16
11:03:47.075882 IP 10.0.0.1.12345 > 10.0.0.2.12345: UDP, length 16
11:03:48.076109 IP 10.0.0.1.12345 > 10.0.0.2.12345: UDP, length 16
11:03:49.076368 IP 10.0.0.1.12345 > 10.0.0.2.12345: UDP, length 16
11:03:50.076629 IP 10.0.0.1.12345 > 10.0.0.2.12345: UDP, length 16
11:03:51.076888 IP 10.0.0.1.12345 > 10.0.0.2.12345: UDP, length 16
11:03:52.077142 IP 10.0.0.1.12345 > 10.0.0.2.12345: UDP, length 16
11:03:53.077398 IP 10.0.0.1.12345 > 10.0.0.2.12345: UDP, length 16
11:03:54.077644 IP 10.0.0.1.12345 > 10.0.0.2.12345: UDP, length 16
11:03:55.077905 IP 10.0.0.1.12345 > 10.0.0.2.12345: UDP, length 16
11:03:56.078109 IP 10.0.0.1.12345 > 10.0.0.2.12345: UDP, length 16
11:03:57.078360 IP 10.0.0.1.12345 > 10.0.0.2.12345: UDP, length 16
11:03:58.078596 IP 10.0.0.1.12345 > 10.0.0.2.12345: UDP, length 16
11:03:59.078779 IP 10.0.0.1.12345 > 10.0.0.2.12345: UDP, length 16
11:04:00.078996 IP 10.0.0.1.12345 > 10.0.0.2.12345: UDP, length 16
11:04:01.079230 IP 10.0.0.1.12345 > 10.0.0.2.12345: UDP, length 16
11:04:02.079441 IP 10.0.0.1.12345 > 10.0.0.2.12345: UDP, length 16
11:04:03.079636 IP 10.0.0.1.12345 > 10.0.0.2.12345: UDP, length 16
11:04:04.079850 IP 10.0.0.1.12345 > 10.0.0.2.12345: UDP, length 16
11:04:05.080110 IP 10.0.0.1.12345 > 10.0.0.2.12345: UDP, length 16
11:04:06.080326 IP 10.0.0.1.12345 > 10.0.0.2.12345: UDP, length 16
11:04:07.080589 IP 10.0.0.1.12345 > 10.0.0.2.12345: UDP, length 16
11:04:08.080773 IP 10.0.0.1.12345 > 10.0.0.2.12345: UDP, length 16
11:04:09.081005 IP 10.0.0.1.12345 > 10.0.0.2.12345: UDP, length 16
11:04:10.081188 IP 10.0.0.1.12345 > 10.0.0.2.12345: UDP, length 16
11:04:11.081382 IP 10.0.0.1.12345 > 10.0.0.2.12345: UDP, length 16
11:04:12.081561 IP 10.0.0.1.12345 > 10.0.0.2.12345: UDP, length 16
11:04:13.081820 IP 10.0.0.1.12345 > 10.0.0.2.12345: UDP, length 16
11:04:14.082006 IP 10.0.0.1.12345 > 10.0.0.2.12345: UDP, length 16
11:04:15.082270 IP 10.0.0.1.12345 > 10.0.0.2.12345: UDP, length 16
11:04:16.082452 IP 10.0.0.1.12345 > 10.0.0.2.12345: UDP, length 16
11:04:17.082674 IP 10.0.0.1.12345 > 10.0.0.2.12345: UDP, length 16
11:04:18.082861 IP 10.0.0.1.12345 > 10.0.0.2.12345: UDP, length 16
11:04:19.083123 IP 10.0.0.1.12345 > 10.0.0.2.12345: UDP, length 16
11:04:20.083385 IP 10.0.0.1.12345 > 10.0.0.2.12345: UDP, length 16
11:04:21.083647 IP 10.0.0.1.12345 > 10.0.0.2.12345: UDP, length 16
11:04:22.083910 IP 10.0.0.1.12345 > 10.0.0.2.12345: UDP, length 16
11:04:23.084171 IP 10.0.0.1.12345 > 10.0.0.2.12345: UDP, length 16
11:04:24.084432 IP 10.0.0.1.12345 > 10.0.0.2.12345: UDP, length 16
11:04:25.084698 IP 10.0.0.1.12345 > 10.0.0.2.12345: UDP, length 16
11:04:26.084954 IP 10.0.0.1.12345 > 10.0.0.2.12345: UDP, length 16
11:04:27.085218 IP 10.0.0.1.12345 > 10.0.0.2.12345: UDP, length 16
11:04:28.085488 IP 10.0.0.1.12345 > 10.0.0.2.12345: UDP, length 16
11:04:29.085748 IP 10.0.0.1.12345 > 10.0.0.2.12345: UDP, length 16
11:04:30.086014 IP 10.0.0.1.12345 > 10.0.0.2.12345: UDP, length 16
11:04:31.086284 IP 10.0.0.1.12345 > 10.0.0.2.12345: UDP, length 16
11:04:32.086500 IP 10.0.0.1.12345 > 10.0.0.2.12345: UDP, length 16
11:04:33.086704 IP 10.0.0.1.12345 > 10.0.0.2.12345: UDP, length 16
11:04:34.086965 IP 10.0.0.1.12345 > 10.0.0.2.12345: UDP, length 16
11:04:35.087235 IP 10.0.0.1.12345 > 10.0.0.2.12345: UDP, length 16
11:04:36.087501 IP 10.0.0.1.12345 > 10.0.0.2.12345: UDP, length 16
11:04:37.087861 IP 10.0.0.1.12345 > 10.0.0.2.12345: UDP, length 16
11:04:38.088126 IP 10.0.0.1.12345 > 10.0.0.2.12345: UDP, length 16
11:04:39.088337 IP 10.0.0.1.12345 > 10.0.0.2.12345: UDP, length 16
11:04:40.088595 IP 10.0.0.1.12345 > 10.0.0.2.12345: UDP, length 16
11:04:41.088856 IP 10.0.0.1.12345 > 10.0.0.2.12345: UDP, length 16
11:04:42.089121 IP 10.0.0.1.12345 > 10.0.0.2.12345: UDP, length 16
11:04:43.089390 IP 10.0.0.1.12345 > 10.0.0.2.12345: UDP, length 16
11:04:44.089655 IP 10.0.0.1.12345 > 10.0.0.2.12345: UDP, length 16
11:04:45.089916 IP 10.0.0.1.12345 > 10.0.0.2.12345: UDP, length 16
11:04:46.090182 IP 10.0.0.1.12345 > 10.0.0.2.12345: UDP, length 16
11:04:47.090422 IP 10.0.0.1.12345 > 10.0.0.2.12345: UDP, length 16
11:04:48.090616 IP 10.0.0.1.12345 > 10.0.0.2.12345: UDP, length 16
11:04:49.090805 IP 10.0.0.1.12345 > 10.0.0.2.12345: UDP, length 16
11:04:50.090980 IP 10.0.0.1.12345 > 10.0.0.2.12345: UDP, length 16
11:04:51.091244 IP 10.0.0.1.12345 > 10.0.0.2.12345: UDP, length 16
11:04:52.091507 IP 10.0.0.1.12345 > 10.0.0.2.12345: UDP, length 16
11:04:53.091851 IP 10.0.0.1.12345 > 10.0.0.2.12345: UDP, length 16
11:04:54.092121 IP 10.0.0.1.12345 > 10.0.0.2.12345: UDP, length 16
11:04:55.092387 IP 10.0.0.1.12345 > 10.0.0.2.12345: UDP, length 16
11:04:56.092624 IP 10.0.0.1.12345 > 10.0.0.2.12345: UDP, length 16
11:04:57.092884 IP 10.0.0.1.12345 > 10.0.0.2.12345: UDP, length 16
11:04:58.093148 IP 10.0.0.1.12345 > 10.0.0.2.12345: UDP, length 16
11:04:59.093330 IP 10.0.0.1.12345 > 10.0.0.2.12345: UDP, length 16
11:05:00.093573 IP 10.0.0.1.12345 > 10.0.0.2.12345: UDP, length 16
11:05:01.093807 IP 10.0.0.1.12345 > 10.0.0.2.12345: UDP, length 16
11:05:02.094065 IP 10.0.0.1.12345 > 10.0.0.2.12345: UDP, length 16
11:05:03.094259 IP 10.0.0.1.12345 > 10.0.0.2.12345: UDP, length 16
11:05:04.094518 IP 10.0.0.1.12345 > 10.0.0.2.12345: UDP, length 16
11:05:05.094759 IP 10.0.0.1.12345 > 10.0.0.2.12345: UDP, length 16
11:05:06.095023 IP 10.0.0.1.12345 > 10.0.0.2.12345: UDP, length 16
11:05:07.095285 IP 10.0.0.1.12345 > 10.0.0.2.12345: UDP, length 16
11:05:08.095549 IP 10.0.0.1.12345 > 10.0.0.2.12345: UDP, length 16
11:05:09.095804 IP 10.0.0.1.12345 > 10.0.0.2.12345: UDP, length 16
11:05:10.096066 IP 10.0.0.1.12345 > 10.0.0.2.12345: UDP, length 16
11:05:11.096304 IP 10.0.0.1.12345 > 10.0.0.2.12345: UDP, length 16
11:05:12.096523 IP 10.0.0.1.12345 > 10.0.0.2.12345: UDP, length 16
11:05:13.096762 IP 10.0.0.1.12345 > 10.0.0.2.12345: UDP, length 16
11:05:14.097026 IP 10.0.0.1.12345 > 10.0.0.2.12345: UDP, length 16
11:05:15.097331 IP 10.0.0.1.12345 > 10.0.0.2.12345: UDP, length 16
11:05:16.097590 IP 10.0.0.1.12345 > 10.0.0.2.12345: UDP, length 16
11:05:17.097839 IP 10.0.0.1.12345 > 10.0.0.2.12345: UDP, length 16
11:05:18.098035 IP 10.0.0.1.12345 > 10.0.0.2.12345: UDP, length 16
11:05:19.098277 IP 10.0.0.1.12345 > 10.0.0.2.12345: UDP, length 16
11:05:20.098540 IP 10.0.0.1.12345 > 10.0.0.2.12345: UDP, length 16
11:05:21.098779 IP 10.0.0.1.12345 > 10.0.0.2.12345: UDP, length 16
11:05:22.099042 IP 10.0.0.1.12345 > 10.0.0.2.12345: UDP, length 16
11:05:23.099280 IP 10.0.0.1.12345 > 10.0.0.2.12345: UDP, length 16
11:05:24.099547 IP 10.0.0.1.12345 > 10.0.0.2.12345: UDP, length 16
11:05:25.099789 IP 10.0.0.1.12345 > 10.0.0.2.12345: UDP, length 16
11:05:26.100052 IP 10.0.0.1.12345 > 10.0.0.2.12345: UDP, length 16
11:05:27.100315 IP 10.0.0.1.12345 > 10.0.0.2.12345: UDP, length 16
11:05:28.100562 IP 10.0.0.1.12345 > 10.0.0.2.12345: UDP, length 16
11:05:29.100821 IP 10.0.0.1.12345 > 10.0.0.2.12345: UDP, length 16
11:05:30.101087 IP 10.0.0.1.12345 > 10.0.0.2.12345: UDP, length 16
11:05:31.101336 IP 10.0.0.1.12345 > 10.0.0.2.12345: UDP, length 16
11:05:32.101598 IP 10.0.0.1.12345 > 10.0.0.2.12345: UDP, length 16
11:05:33.101825 IP 10.0.0.1.12345 > 10.0.0.2.12345: UDP, length 16
11:05:34.102085 IP 10.0.0.1.12345 > 10.0.0.2.12345: UDP, length 16
11:05:35.102294 IP 10.0.0.1.12345 > 10.0.0.2.12345: UDP, length 16
11:05:36.102551 IP 10.0.0.1.12345 > 10.0.0.2.12345: UDP, length 16
11:05:37.102760 IP 10.0.0.1.12345 > 10.0.0.2.12345: UDP, length 16
11:05:38.102991 IP 10.0.0.1.12345 > 10.0.0.2.12345: UDP, length 16
11:05:39.103117 IP 10.0.0.1.12345 > 10.0.0.2.12345: UDP, length 16
11:05:40.103345 IP 10.0.0.1.12345 > 10.0.0.2.12345: UDP, length 16
11:05:41.103583 IP 10.0.0.1.12345 > 10.0.0.2.12345: UDP, length 16
11:05:42.103841 IP 10.0.0.1.12345 > 10.0.0.2.12345: UDP, length 16
11:05:43.104058 IP 10.0.0.1.12345 > 10.0.0.2.12345: UDP, length 16
11:05:44.104309 IP 10.0.0.1.12345 > 10.0.0.2.12345: UDP, length 16
11:05:45.104522 IP 10.0.0.1.12345 > 10.0.0.2.12345: UDP, length 16
11:05:46.104776 IP 10.0.0.1.12345 > 10.0.0.2.12345: UDP, length 16
11:05:47.105012 IP 10.0.0.1.12345 > 10.0.0.2.12345: UDP, length 16
11:05:48.105195 IP 10.0.0.1.12345 > 10.0.0.2.12345: UDP, length 16
11:05:49.105392 IP 10.0.0.1.12345 > 10.0.0.2.12345: UDP, length 16
11:05:50.105633 IP 10.0.0.1.12345 > 10.0.0.2.12345: UDP, length 16
11:05:51.105865 IP 10.0.0.1.12345 > 10.0.0.2.12345: UDP, length 16
11:05:52.106123 IP 10.0.0.1.12345 > 10.0.0.2.12345: UDP, length 16
11:05:53.106358 IP 10.0.0.1.12345 > 10.0.0.2.12345: UDP, length 16
11:05:54.106616 IP 10.0.0.1.12345 > 10.0.0.2.12345: UDP, length 16
11:05:55.106827 IP 10.0.0.1.12345 > 10.0.0.2.12345: UDP, length 16
11:05:56.107020 IP 10.0.0.1.12345 > 10.0.0.2.12345: UDP, length 16
11:05:57.107230 IP 10.0.0.1.12345 > 10.0.0.2.12345: UDP, length 16
11:05:58.107402 IP 10.0.0.1.12345 > 10.0.0.2.12345: UDP, length 16
11:05:59.107580 IP 10.0.0.1.12345 > 10.0.0.2.12345: UDP, length 16
11:06:00.107821 IP 10.0.0.1.12345 > 10.0.0.2.12345: UDP, length 16
11:06:01.108000 IP 10.0.0.1.12345 > 10.0.0.2.12345: UDP, length 16
11:06:02.108256 IP 10.0.0.1.12345 > 10.0.0.2.12345: UDP, length 16
11:06:03.108492 IP 10.0.0.1.12345 > 10.0.0.2.12345: UDP, length 16

