08:00:08.156441 IP 10.0.0.1.12345 > 10.0.0.2.12345: UDP, length 16
08:00:09.156687 IP 10.0.0.1.12345 > 10.0.0.2.12345: UDP, length 16
08:00:10.156932 IP 10.0.0.1.12345 > 10.0.0.2.12345: UDP, length 16
08:00:11.157152 IP 10.0.0.1.12345 > 10.0.0.2.12345: UDP, length 16
08:00:12.157370 IP 10.0.0.1.12345 > 10.0.0.2.12345: UDP, length 16
08:00:13.157620 IP 10.0.0.1.12345 > 10.0.0.2.12345: UDP, length 16
08:00:14.157793 IP 10.0.0.1.12345 > 10.0.0.2.12345: UDP, length 16
08:00:15.157956 IP 10.0.0.1.12345 > 10.0.0.2.12345: UDP, length 16
08:00:16.158131 IP 10.0.0.1.12345 > 10.0.0.2.12345: UDP, length 16
08:00:17.158356 IP 10.0.0.1.12345 > 10.0.0.2.12345: UDP, length 16
08:00:18.158566 IP 10.0.0.1.12345 > 10.0.0.2.12345: UDP, length 16
08:00:19.158813 IP 10.0.0.1.12345 > 10.0.0.2.12345: UDP, length 16
08:00:20.159037 IP 10.0.0.1.12345 > 10.0.0.2.12345: UDP, length 16
08:00:21.159267 IP 10.0.0.1.12345 > 10.0.0.2.12345: UDP, length 16
08:00:22.159474 IP 10.0.0.1.12345 > 10.0.0.2.12345: UDP, length 16
08:00:23.159748 IP 10.0.0.1.12345 > 10.0.0.2.12345: UDP, length 16
08:00:24.159906 IP 10.0.0.1.12345 > 10.0.0.2.12345: UDP, length 16
08:00:25.160077 IP 10.0.0.1.12345 > 10.0.0.2.12345: UDP, length 16
08:00:26.160288 IP 10.0.0.1.12345 > 10.0.0.2.12345: UDP, length 16
08:00:27.160503 IP 10.0.0.1.12345 > 10.0.0.2.12345: UDP, length 16
08:00:28.160747 IP 10.0.0.1.12345 > 10.0.0.2.12345: UDP, length 16
08:00:29.160969 IP 10.0.0.1.12345 > 10.0.0.2.12345: UDP, length 16
08:00:30.161181 IP 10.0.0.1.12345 > 10.0.0.2.12345: UDP, length 16
08:00:31.161405 IP 10.0.0.1.12345 > 10.0.0.2.12345: UDP, length 16
08:00:32.161625 IP 10.0.0.1.12345 > 10.0.0.2.12345: UDP, length 16
08:00:33.161840 IP 10.0.0.1.12345 > 10.0.0.2.12345: UDP, length 16
08:00:34.162086 IP 10.0.0.1.12345 > 10.0.0.2.12345: UDP, length 16
08:00:35.162315 IP 10.0.0.1.12345 > 10.0.0.2.12345: UDP, length 16
08:00:36.162560 IP 10.0.0.1.12345 > 10.0.0.2.12345: UDP, length 16
08:00:37.162798 IP 10.0.0.1.12345 > 10.0.0.2.12345: UDP, length 16
08:00:38.163047 IP 10.0.0.1.12345 > 10.0.0.2.12345: UDP, length 16
08:00:39.163272 IP 10.0.0.1.12345 > 10.0.0.2.12345: UDP, length 16
08:00:40.163514 IP 10.0.0.1.12345 > 10.0.0.2.12345: UDP, length 16
08:00:41.163736 IP 10.0.0.1.12345 > 10.0.0.2.12345: UDP, length 16
08:00:42.163977 IP 10.0.0.1.12345 > 10.0.0.2.12345: UDP, length 16
08:00:43.164195 IP 10.0.0.1.12345 > 10.0.0.2.12345: UDP, length 16
08:00:44.164439 IP 10.0.0.1.12345 > 10.0.0.2.12345: UDP, length 16
08:00:45.164667 IP 10.0.0.1.12345 > 10.0.0.2.12345: UDP, length 16
08:00:46.164913 IP 10.0.0.1.12345 > 10.0.0.2.12345: UDP, length 16
08:00:47.165120 IP 10.0.0.1.12345 > 10.0.0.2.12345: UDP, length 16
08:00:48.165359 IP 10.0.0.1.12345 > 10.0.0.2.12345: UDP, length 16
08:00:49.165585 IP 10.0.0.1.12345 > 10.0.0.2.12345: UDP, length 16
08:00:50.165832 IP 10.0.0.1.12345 > 10.0.0.2.12345: UDP, length 16
08:00:51.166040 IP 10.0.0.1.12345 > 10.0.0.2.12345: UDP, length 16
08:00:52.166278 IP 10.0.0.1.12345 > 10.0.0.2.12345: UDP, length 16
08:00:53.166482 IP 10.0.0.1.12345 > 10.0.0.2.12345: UDP, length 16
08:00:54.166725 IP 10.0.0.1.12345 > 10.0.0.2.12345: UDP, length 16
08:00:55.166938 IP 10.0.0.1.12345 > 10.0.0.2.12345: UDP, length 16
08:00:56.167181 IP 10.0.0.1.12345 > 10.0.0.2.12345: UDP, length 16
08:00:57.167398 IP 10.0.0.1.12345 > 10.0.0.2.12345: UDP, length 16
08:00:58.167641 IP 10.0.0.1.12345 > 10.0.0.2.12345: UDP, length 16
08:00:59.167866 IP 10.0.0.1.12345 > 10.0.0.2.12345: UDP, length 16
08:01:00.168076 IP 10.0.0.1.12345 > 10.0.0.2.12345: UDP, length 16
08:01:01.168295 IP 10.0.0.1.12345 > 10.0.0.2.12345: UDP, length 16
08:01:02.168532 IP 10.0.0.1.12345 > 10.0.0.2.12345: UDP, length 16
08:01:03.168802 IP 10.0.0.1.12345 > 10.0.0.2.12345: UDP, length 16
08:01:04.169052 IP 10.0.0.1.12345 > 10.0.0.2.12345: UDP, length 16
08:01:05.169268 IP 10.0.0.1.12345 > 10.0.0.2.12345: UDP, length 16
08:01:06.169509 IP 10.0.0.1.12345 > 10.0.0.2.12345: UDP, length 16
08:01:07.169735 IP 10.0.0.1.12345 > 10.0.0.2.12345: UDP, length 16
08:01:08.169996 IP 10.0.0.1.12345 > 10.0.0.2.12345: UDP, length 16
08:01:09.170228 IP 10.0.0.1.12345 > 10.0.0.2.12345: UDP, length 16
08:01:10.170473 IP 10.0.0.1.12345 > 10.0.0.2.12345: UDP, length 16
08:01:11.170668 IP 10.0.0.1.12345 > 10.0.0.2.12345: UDP, length 16
08:01:12.170892 IP 10.0.0.1.12345 > 10.0.0.2.12345: UDP, length 16
08:01:13.171117 IP 10.0.0.1.12345 > 10.0.0.2.12345: UDP, length 16
08:01:14.171361 IP 10.0.0.1.12345 > 10.0.0.2.12345: UDP, length 16
08:01:15.171597 IP 10.0.0.1.12345 > 10.0.0.2.12345: UDP, length 16
08:01:16.171843 IP 10.0.0.1.12345 > 10.0.0.2.12345: UDP, length 16
08:01:17.172091 IP 10.0.0.1.12345 > 10.0.0.2.12345: UDP, length 16
08:01:18.172332 IP 10.0.0.1.12345 > 10.0.0.2.12345: UDP, length 16
08:01:19.172583 IP 10.0.0.1.12345 > 10.0.0.2.12345: UDP, length 16
08:01:20.172825 IP 10.0.0.1.12345 > 10.0.0.2.12345: UDP, length 16
08:01:21.172993 IP 10.0.0.1.12345 > 10.0.0.2.12345: UDP, length 16
08:01:22.173236 IP 10.0.0.1.12345 > 10.0.0.2.12345: UDP, length 16
08:01:23.173436 IP 10.0.0.1.12345 > 10.0.0.2.12345: UDP, length 16
08:01:24.173676 IP 10.0.0.1.12345 > 10.0.0.2.12345: UDP, length 16
08:01:25.173875 IP 10.0.0.1.12345 > 10.0.0.2.12345: UDP, length 16
08:01:26.174113 IP 10.0.0.1.12345 > 10.0.0.2.12345: UDP, length 16
08:01:27.174312 IP 10.0.0.1.12345 > 10.0.0.2.12345: UDP, length 16
08:01:28.174547 IP 10.0.0.1.12345 > 10.0.0.2.12345: UDP, length 16
08:01:29.174747 IP 10.0.0.1.12345 > 10.0.0.2.12345: UDP, length 16
08:01:30.174980 IP 10.0.0.1.12345 > 10.0.0.2.12345: UDP, length 16
08:01:31.175177 IP 10.0.0.1.12345 > 10.0.0.2.12345: UDP, length 16
08:01:32.175412 IP 10.0.0.1.12345 > 10.0.0.2.12345: UDP, length 16
08:01:33.175609 IP 10.0.0.1.12345 > 10.0.0.2.12345: UDP, length 16
08:01:34.175844 IP 10.0.0.1.12345 > 10.0.0.2.12345: UDP, length 16
08:01:35.176042 IP 10.0.0.1.12345 > 10.0.0.2.12345: UDP, length 16
08:01:36.176278 IP 10.0.0.1.12345 > 10.0.0.2.12345: UDP, length 16
08:01:37.176478 IP 10.0.0.1.12345 > 10.0.0.2.12345: UDP, length 16
08:01:38.176713 IP 10.0.0.1.12345 > 10.0.0.2.12345: UDP, length 16
08:01:39.176864 IP 10.0.0.1.12345 > 10.0.0.2.12345: UDP, length 16
08:01:40.177060 IP 10.0.0.1.12345 > 10.0.0.2.12345: UDP, length 16
08:01:41.177218 IP 10.0.0.1.12345 > 10.0.0.2.12345: UDP, length 16
08:01:42.177455 IP 10.0.0.1.12345 > 10.0.0.2.12345: UDP, length 16
08:01:43.177633 IP 10.0.0.1.12345 > 10.0.0.2.12345: UDP, length 16
08:01:44.177805 IP 10.0.0.1.12345 > 10.0.0.2.12345: UDP, length 16
08:01:45.177991 IP 10.0.0.1.12345 > 10.0.0.2.12345: UDP, length 16
08:01:46.178219 IP 10.0.0.1.12345 > 10.0.0.2.12345: UDP, length 16
08:01:47.178464 IP 10.0.0.1.12345 > 10.0.0.2.12345: UDP, length 16
