08:00:08.156571 IP 10.0.0.1.12345 > 10.0.0.2.12345: UDP, length 16
08:00:09.156698 IP 10.0.0.1.12345 > 10.0.0.2.12345: UDP, length 16
08:00:10.156945 IP 10.0.0.1.12345 > 10.0.0.2.12345: UDP, length 16
08:00:11.157162 IP 10.0.0.1.12345 > 10.0.0.2.12345: UDP, length 16
08:00:12.157383 IP 10.0.0.1.12345 > 10.0.0.2.12345: UDP, length 16
08:00:13.157633 IP 10.0.0.1.12345 > 10.0.0.2.12345: UDP, length 16
08:00:14.157802 IP 10.0.0.1.12345 > 10.0.0.2.12345: UDP, length 16
08:00:15.157966 IP 10.0.0.1.12345 > 10.0.0.2.12345: UDP, length 16
08:00:16.158142 IP 10.0.0.1.12345 > 10.0.0.2.12345: UDP, length 16
08:00:17.158367 IP 10.0.0.1.12345 > 10.0.0.2.12345: UDP, length 16
08:00:18.158580 IP 10.0.0.1.12345 > 10.0.0.2.12345: UDP, length 16
08:00:19.158825 IP 10.0.0.1.12345 > 10.0.0.2.12345: UDP, length 16
08:00:20.159050 IP 10.0.0.1.12345 > 10.0.0.2.12345: UDP, length 16
08:00:21.159278 IP 10.0.0.1.12345 > 10.0.0.2.12345: UDP, length 16
08:00:22.159482 IP 10.0.0.1.12345 > 10.0.0.2.12345: UDP, length 16
08:00:23.159757 IP 10.0.0.1.12345 > 10.0.0.2.12345: UDP, length 16
08:00:24.159914 IP 10.0.0.1.12345 > 10.0.0.2.12345: UDP, length 16
08:00:25.160084 IP 10.0.0.1.12345 > 10.0.0.2.12345: UDP, length 16
08:00:26.160298 IP 10.0.0.1.12345 > 10.0.0.2.12345: UDP, length 16
08:00:27.160513 IP 10.0.0.1.12345 > 10.0.0.2.12345: UDP, length 16
08:00:28.160760 IP 10.0.0.1.12345 > 10.0.0.2.12345: UDP, length 16
08:00:29.160979 IP 10.0.0.1.12345 > 10.0.0.2.12345: UDP, length 16
08:00:30.161191 IP 10.0.0.1.12345 > 10.0.0.2.12345: UDP, length 16
08:00:31.161415 IP 10.0.0.1.12345 > 10.0.0.2.12345: UDP, length 16
08:00:32.161635 IP 10.0.0.1.12345 > 10.0.0.2.12345: UDP, length 16
08:00:33.161850 IP 10.0.0.1.12345 > 10.0.0.2.12345: UDP, length 16
08:00:34.162099 IP 10.0.0.1.12345 > 10.0.0.2.12345: UDP, length 16
08:00:35.162325 IP 10.0.0.1.12345 > 10.0.0.2.12345: UDP, length 16
08:00:36.162573 IP 10.0.0.1.12345 > 10.0.0.2.12345: UDP, length 16
08:00:37.162810 IP 10.0.0.1.12345 > 10.0.0.2.12345: UDP, length 16
08:00:38.163060 IP 10.0.0.1.12345 > 10.0.0.2.12345: UDP, length 16
08:00:39.163281 IP 10.0.0.1.12345 > 10.0.0.2.12345: UDP, length 16
08:00:40.163527 IP 10.0.0.1.12345 > 10.0.0.2.12345: UDP, length 16
08:00:41.163746 IP 10.0.0.1.12345 > 10.0.0.2.12345: UDP, length 16
08:00:42.163989 IP 10.0.0.1.12345 > 10.0.0.2.12345: UDP, length 16
08:00:43.164205 IP 10.0.0.1.12345 > 10.0.0.2.12345: UDP, length 16
08:00:44.164452 IP 10.0.0.1.12345 > 10.0.0.2.12345: UDP, length 16
08:00:45.164678 IP 10.0.0.1.12345 > 10.0.0.2.12345: UDP, length 16
08:00:46.164925 IP 10.0.0.1.12345 > 10.0.0.2.12345: UDP, length 16
08:00:47.165128 IP 10.0.0.1.12345 > 10.0.0.2.12345: UDP, length 16
08:00:48.165371 IP 10.0.0.1.12345 > 10.0.0.2.12345: UDP, length 16
08:00:49.165596 IP 10.0.0.1.12345 > 10.0.0.2.12345: UDP, length 16
08:00:50.165844 IP 10.0.0.1.12345 > 10.0.0.2.12345: UDP, length 16
08:00:51.166048 IP 10.0.0.1.12345 > 10.0.0.2.12345: UDP, length 16
08:00:52.166290 IP 10.0.0.1.12345 > 10.0.0.2.12345: UDP, length 16
08:00:53.166491 IP 10.0.0.1.12345 > 10.0.0.2.12345: UDP, length 16
08:00:54.166738 IP 10.0.0.1.12345 > 10.0.0.2.12345: UDP, length 16
08:00:55.166948 IP 10.0.0.1.12345 > 10.0.0.2.12345: UDP, length 16
08:00:56.167192 IP 10.0.0.1.12345 > 10.0.0.2.12345: UDP, length 16
08:00:57.167407 IP 10.0.0.1.12345 > 10.0.0.2.12345: UDP, length 16
08:00:58.167654 IP 10.0.0.1.12345 > 10.0.0.2.12345: UDP, length 16
08:00:59.167877 IP 10.0.0.1.12345 > 10.0.0.2.12345: UDP, length 16
08:01:00.168086 IP 10.0.0.1.12345 > 10.0.0.2.12345: UDP, length 16
08:01:01.168306 IP 10.0.0.1.12345 > 10.0.0.2.12345: UDP, length 16
08:01:02.168543 IP 10.0.0.1.12345 > 10.0.0.2.12345: UDP, length 16
08:01:03.168815 IP 10.0.0.1.12345 > 10.0.0.2.12345: UDP, length 16
08:01:04.169065 IP 10.0.0.1.12345 > 10.0.0.2.12345: UDP, length 16
08:01:05.169278 IP 10.0.0.1.12345 > 10.0.0.2.12345: UDP, length 16
08:01:06.169521 IP 10.0.0.1.12345 > 10.0.0.2.12345: UDP, length 16
08:01:07.169745 IP 10.0.0.1.12345 > 10.0.0.2.12345: UDP, length 16
08:01:08.170011 IP 10.0.0.1.12345 > 10.0.0.2.12345: UDP, length 16
08:01:09.170239 IP 10.0.0.1.12345 > 10.0.0.2.12345: UDP, length 16
08:01:10.170486 IP 10.0.0.1.12345 > 10.0.0.2.12345: UDP, length 16
08:01:11.170675 IP 10.0.0.1.12345 > 10.0.0.2.12345: UDP, length 16
08:01:12.170903 IP 10.0.0.1.12345 > 10.0.0.2.12345: UDP, length 16
08:01:13.171128 IP 10.0.0.1.12345 > 10.0.0.2.12345: UDP, length 16
08:01:14.171374 IP 10.0.0.1.12345 > 10.0.0.2.12345: UDP, length 16
08:01:15.171608 IP 10.0.0.1.12345 > 10.0.0.2.12345: UDP, length 16
08:01:16.171856 IP 10.0.0.1.12345 > 10.0.0.2.12345: UDP, length 16
08:01:17.172102 IP 10.0.0.1.12345 > 10.0.0.2.12345: UDP, length 16
08:01:18.172346 IP 10.0.0.1.12345 > 10.0.0.2.12345: UDP, length 16
08:01:19.172595 IP 10.0.0.1.12345 > 10.0.0.2.12345: UDP, length 16
08:01:20.172838 IP 10.0.0.1.12345 > 10.0.0.2.12345: UDP, length 16
08:01:21.173004 IP 10.0.0.1.12345 > 10.0.0.2.12345: UDP, length 16
08:01:22.173249 IP 10.0.0.1.12345 > 10.0.0.2.12345: UDP, length 16
08:01:23.173443 IP 10.0.0.1.12345 > 10.0.0.2.12345: UDP, length 16
08:01:24.173688 IP 10.0.0.1.12345 > 10.0.0.2.12345: UDP, length 16
08:01:25.173883 IP 10.0.0.1.12345 > 10.0.0.2.12345: UDP, length 16
08:01:26.174126 IP 10.0.0.1.12345 > 10.0.0.2.12345: UDP, length 16
08:01:27.174320 IP 10.0.0.1.12345 > 10.0.0.2.12345: UDP, length 16
08:01:28.174560 IP 10.0.0.1.12345 > 10.0.0.2.12345: UDP, length 16
08:01:29.174755 IP 10.0.0.1.12345 > 10.0.0.2.12345: UDP, length 16
08:01:30.174992 IP 10.0.0.1.12345 > 10.0.0.2.12345: UDP, length 16
08:01:31.175184 IP 10.0.0.1.12345 > 10.0.0.2.12345: UDP, length 16
08:01:32.175424 IP 10.0.0.1.12345 > 10.0.0.2.12345: UDP, length 16
08:01:33.175617 IP 10.0.0.1.12345 > 10.0.0.2.12345: UDP, length 16
08:01:34.175856 IP 10.0.0.1.12345 > 10.0.0.2.12345: UDP, length 16
08:01:35.176049 IP 10.0.0.1.12345 > 10.0.0.2.12345: UDP, length 16
08:01:36.176289 IP 10.0.0.1.12345 > 10.0.0.2.12345: UDP, length 16
08:01:37.176485 IP 10.0.0.1.12345 > 10.0.0.2.12345: UDP, length 16
08:01:38.176726 IP 10.0.0.1.12345 > 10.0.0.2.12345: UDP, length 16
08:01:39.176874 IP 10.0.0.1.12345 > 10.0.0.2.12345: UDP, length 16
08:01:40.177070 IP 10.0.0.1.12345 > 10.0.0.2.12345: UDP, length 16
08:01:41.177229 IP 10.0.0.1.12345 > 10.0.0.2.12345: UDP, length 16
08:01:42.177468 IP 10.0.0.1.12345 > 10.0.0.2.12345: UDP, length 16
08:01:43.177639 IP 10.0.0.1.12345 > 10.0.0.2.12345: UDP, length 16
08:01:44.177822 IP 10.0.0.1.12345 > 10.0.0.2.12345: UDP, length 16
08:01:45.177997 IP 10.0.0.1.12345 > 10.0.0.2.12345: UDP, length 16
08:01:46.178232 IP 10.0.0.1.12345 > 10.0.0.2.12345: UDP, length 16
08:01:47.178477 IP 10.0.0.1.12345 > 10.0.0.2.12345: UDP, length 16
