16:16:52.238860 IP 10.0.0.1.12345 > 10.0.0.2.12345: UDP, length 16
16:16:52.239553 IP 10.0.0.1.12345 > 10.0.0.2.12345: UDP, length 16
16:16:52.240184 IP 10.0.0.1.12345 > 10.0.0.2.12345: UDP, length 16
16:16:52.240807 IP 10.0.0.1.12345 > 10.0.0.2.12345: UDP, length 16
16:16:52.241470 IP 10.0.0.1.12345 > 10.0.0.2.12345: UDP, length 16
16:16:52.242137 IP 10.0.0.1.12345 > 10.0.0.2.12345: UDP, length 16
16:16:52.242809 IP 10.0.0.1.12345 > 10.0.0.2.12345: UDP, length 16
16:16:52.243476 IP 10.0.0.1.12345 > 10.0.0.2.12345: UDP, length 16
16:16:52.244118 IP 10.0.0.1.12345 > 10.0.0.2.12345: UDP, length 16
16:16:52.244773 IP 10.0.0.1.12345 > 10.0.0.2.12345: UDP, length 16
16:16:52.245406 IP 10.0.0.1.12345 > 10.0.0.2.12345: UDP, length 16
16:16:52.246059 IP 10.0.0.1.12345 > 10.0.0.2.12345: UDP, length 16
16:16:52.246713 IP 10.0.0.1.12345 > 10.0.0.2.12345: UDP, length 16
16:16:52.247383 IP 10.0.0.1.12345 > 10.0.0.2.12345: UDP, length 16
16:16:52.248053 IP 10.0.0.1.12345 > 10.0.0.2.12345: UDP, length 16
16:16:52.248681 IP 10.0.0.1.12345 > 10.0.0.2.12345: UDP, length 16
16:16:52.249297 IP 10.0.0.1.12345 > 10.0.0.2.12345: UDP, length 16
16:16:52.249911 IP 10.0.0.1.12345 > 10.0.0.2.12345: UDP, length 16
16:16:52.250527 IP 10.0.0.1.12345 > 10.0.0.2.12345: UDP, length 16
16:16:52.251142 IP 10.0.0.1.12345 > 10.0.0.2.12345: UDP, length 16
16:16:52.251757 IP 10.0.0.1.12345 > 10.0.0.2.12345: UDP, length 16
16:16:52.252351 IP 10.0.0.1.12345 > 10.0.0.2.12345: UDP, length 16
16:16:52.252966 IP 10.0.0.1.12345 > 10.0.0.2.12345: UDP, length 16
16:16:52.253582 IP 10.0.0.1.12345 > 10.0.0.2.12345: UDP, length 16
16:16:52.254196 IP 10.0.0.1.12345 > 10.0.0.2.12345: UDP, length 16
16:16:52.254813 IP 10.0.0.1.12345 > 10.0.0.2.12345: UDP, length 16
16:16:52.255430 IP 10.0.0.1.12345 > 10.0.0.2.12345: UDP, length 16
16:16:52.256046 IP 10.0.0.1.12345 > 10.0.0.2.12345: UDP, length 16
16:16:52.256661 IP 10.0.0.1.12345 > 10.0.0.2.12345: UDP, length 16
16:16:52.257276 IP 10.0.0.1.12345 > 10.0.0.2.12345: UDP, length 16
16:16:52.257890 IP 10.0.0.1.12345 > 10.0.0.2.12345: UDP, length 16
16:16:52.258507 IP 10.0.0.1.12345 > 10.0.0.2.12345: UDP, length 16
16:16:52.259090 IP 10.0.0.1.12345 > 10.0.0.2.12345: UDP, length 16
16:16:52.259705 IP 10.0.0.1.12345 > 10.0.0.2.12345: UDP, length 16
16:16:52.260292 IP 10.0.0.1.12345 > 10.0.0.2.12345: UDP, length 16
16:16:52.260908 IP 10.0.0.1.12345 > 10.0.0.2.12345: UDP, length 16
16:16:52.261523 IP 10.0.0.1.12345 > 10.0.0.2.12345: UDP, length 16
16:16:52.262138 IP 10.0.0.1.12345 > 10.0.0.2.12345: UDP, length 16
16:16:52.262754 IP 10.0.0.1.12345 > 10.0.0.2.12345: UDP, length 16
16:16:52.263370 IP 10.0.0.1.12345 > 10.0.0.2.12345: UDP, length 16
16:16:52.263985 IP 10.0.0.1.12345 > 10.0.0.2.12345: UDP, length 16
16:16:52.264600 IP 10.0.0.1.12345 > 10.0.0.2.12345: UDP, length 16
16:16:52.265217 IP 10.0.0.1.12345 > 10.0.0.2.12345: UDP, length 16
16:16:52.265832 IP 10.0.0.1.12345 > 10.0.0.2.12345: UDP, length 16
16:16:52.266450 IP 10.0.0.1.12345 > 10.0.0.2.12345: UDP, length 16
16:16:52.267066 IP 10.0.0.1.12345 > 10.0.0.2.12345: UDP, length 16
16:16:52.267682 IP 10.0.0.1.12345 > 10.0.0.2.12345: UDP, length 16
16:16:52.268281 IP 10.0.0.1.12345 > 10.0.0.2.12345: UDP, length 16
16:16:52.268899 IP 10.0.0.1.12345 > 10.0.0.2.12345: UDP, length 16
16:16:52.269515 IP 10.0.0.1.12345 > 10.0.0.2.12345: UDP, length 16
16:16:52.270130 IP 10.0.0.1.12345 > 10.0.0.2.12345: UDP, length 16
16:16:52.270745 IP 10.0.0.1.12345 > 10.0.0.2.12345: UDP, length 16
16:16:52.271361 IP 10.0.0.1.12345 > 10.0.0.2.12345: UDP, length 16
16:16:52.271975 IP 10.0.0.1.12345 > 10.0.0.2.12345: UDP, length 16
16:16:52.272590 IP 10.0.0.1.12345 > 10.0.0.2.12345: UDP, length 16
16:16:52.273205 IP 10.0.0.1.12345 > 10.0.0.2.12345: UDP, length 16
16:16:52.273820 IP 10.0.0.1.12345 > 10.0.0.2.12345: UDP, length 16
16:16:52.274435 IP 10.0.0.1.12345 > 10.0.0.2.12345: UDP, length 16
16:16:52.275050 IP 10.0.0.1.12345 > 10.0.0.2.12345: UDP, length 16
16:16:52.275659 IP 10.0.0.1.12345 > 10.0.0.2.12345: UDP, length 16
16:16:52.276278 IP 10.0.0.1.12345 > 10.0.0.2.12345: UDP, length 16
16:16:52.276896 IP 10.0.0.1.12345 > 10.0.0.2.12345: UDP, length 16
16:16:52.277514 IP 10.0.0.1.12345 > 10.0.0.2.12345: UDP, length 16
16:16:52.278129 IP 10.0.0.1.12345 > 10.0.0.2.12345: UDP, length 16
16:16:52.278745 IP 10.0.0.1.12345 > 10.0.0.2.12345: UDP, length 16
16:16:52.279360 IP 10.0.0.1.12345 > 10.0.0.2.12345: UDP, length 16
16:16:52.279975 IP 10.0.0.1.12345 > 10.0.0.2.12345: UDP, length 16
16:16:52.280591 IP 10.0.0.1.12345 > 10.0.0.2.12345: UDP, length 16
16:16:52.281206 IP 10.0.0.1.12345 > 10.0.0.2.12345: UDP, length 16
16:16:52.281821 IP 10.0.0.1.12345 > 10.0.0.2.12345: UDP, length 16
16:16:52.282436 IP 10.0.0.1.12345 > 10.0.0.2.12345: UDP, length 16
16:16:52.283051 IP 10.0.0.1.12345 > 10.0.0.2.12345: UDP, length 16
16:16:52.283667 IP 10.0.0.1.12345 > 10.0.0.2.12345: UDP, length 16
16:16:52.284278 IP 10.0.0.1.12345 > 10.0.0.2.12345: UDP, length 16
16:16:52.284896 IP 10.0.0.1.12345 > 10.0.0.2.12345: UDP, length 16
16:16:52.285515 IP 10.0.0.1.12345 > 10.0.0.2.12345: UDP, length 16
16:16:52.286131 IP 10.0.0.1.12345 > 10.0.0.2.12345: UDP, length 16
16:16:52.286745 IP 10.0.0.1.12345 > 10.0.0.2.12345: UDP, length 16
16:16:52.287360 IP 10.0.0.1.12345 > 10.0.0.2.12345: UDP, length 16
16:16:52.287975 IP 10.0.0.1.12345 > 10.0.0.2.12345: UDP, length 16
16:16:52.288592 IP 10.0.0.1.12345 > 10.0.0.2.12345: UDP, length 16
16:16:52.289206 IP 10.0.0.1.12345 > 10.0.0.2.12345: UDP, length 16
16:16:52.289821 IP 10.0.0.1.12345 > 10.0.0.2.12345: UDP, length 16
16:16:52.290436 IP 10.0.0.1.12345 > 10.0.0.2.12345: UDP, length 16
16:16:52.291051 IP 10.0.0.1.12345 > 10.0.0.2.12345: UDP, length 16
16:16:52.291665 IP 10.0.0.1.12345 > 10.0.0.2.12345: UDP, length 16
16:16:52.292278 IP 10.0.0.1.12345 > 10.0.0.2.12345: UDP, length 16
16:16:52.292897 IP 10.0.0.1.12345 > 10.0.0.2.12345: UDP, length 16
16:16:52.293513 IP 10.0.0.1.12345 > 10.0.0.2.12345: UDP, length 16
16:16:52.294129 IP 10.0.0.1.12345 > 10.0.0.2.12345: UDP, length 16
16:16:52.294744 IP 10.0.0.1.12345 > 10.0.0.2.12345: UDP, length 16
16:16:52.295360 IP 10.0.0.1.12345 > 10.0.0.2.12345: UDP, length 16
16:16:52.295975 IP 10.0.0.1.12345 > 10.0.0.2.12345: UDP, length 16
16:16:52.296594 IP 10.0.0.1.12345 > 10.0.0.2.12345: UDP, length 16
16:16:52.297209 IP 10.0.0.1.12345 > 10.0.0.2.12345: UDP, length 16
16:16:52.297824 IP 10.0.0.1.12345 > 10.0.0.2.12345: UDP, length 16
16:16:52.298440 IP 10.0.0.1.12345 > 10.0.0.2.12345: UDP, length 16
16:16:52.299055 IP 10.0.0.1.12345 > 10.0.0.2.12345: UDP, length 16
16:16:52.299671 IP 10.0.0.1.12345 > 10.0.0.2.12345: UDP, length 16
16:16:52.300278 IP 10.0.0.1.12345 > 10.0.0.2.12345: UDP, length 16
16:16:52.300897 IP 10.0.0.1.12345 > 10.0.0.2.12345: UDP, length 16
16:16:52.301511 IP 10.0.0.1.12345 > 10.0.0.2.12345: UDP, length 16
16:16:52.302128 IP 10.0.0.1.12345 > 10.0.0.2.12345: UDP, length 16
16:16:52.302743 IP 10.0.0.1.12345 > 10.0.0.2.12345: UDP, length 16
16:16:52.303359 IP 10.0.0.1.12345 > 10.0.0.2.12345: UDP, length 16
16:16:52.303974 IP 10.0.0.1.12345 > 10.0.0.2.12345: UDP, length 16
16:16:52.304590 IP 10.0.0.1.12345 > 10.0.0.2.12345: UDP, length 16
16:16:52.305206 IP 10.0.0.1.12345 > 10.0.0.2.12345: UDP, length 16
16:16:52.305821 IP 10.0.0.1.12345 > 10.0.0.2.12345: UDP, length 16
16:16:52.306436 IP 10.0.0.1.12345 > 10.0.0.2.12345: UDP, length 16
16:16:52.307052 IP 10.0.0.1.12345 > 10.0.0.2.12345: UDP, length 16
16:16:52.307667 IP 10.0.0.1.12345 > 10.0.0.2.12345: UDP, length 16
16:16:52.308283 IP 10.0.0.1.12345 > 10.0.0.2.12345: UDP, length 16
16:16:52.308899 IP 10.0.0.1.12345 > 10.0.0.2.12345: UDP, length 16
16:16:52.309513 IP 10.0.0.1.12345 > 10.0.0.2.12345: UDP, length 16
16:16:52.310128 IP 10.0.0.1.12345 > 10.0.0.2.12345: UDP, length 16
16:16:52.310743 IP 10.0.0.1.12345 > 10.0.0.2.12345: UDP, length 16
16:16:52.311359 IP 10.0.0.1.12345 > 10.0.0.2.12345: UDP, length 16
16:16:52.311973 IP 10.0.0.1.12345 > 10.0.0.2.12345: UDP, length 16
16:16:52.312593 IP 10.0.0.1.12345 > 10.0.0.2.12345: UDP, length 16
16:16:52.313207 IP 10.0.0.1.12345 > 10.0.0.2.12345: UDP, length 16
16:16:52.313823 IP 10.0.0.1.12345 > 10.0.0.2.12345: UDP, length 16
16:16:52.314439 IP 10.0.0.1.12345 > 10.0.0.2.12345: UDP, length 16
16:16:52.315055 IP 10.0.0.1.12345 > 10.0.0.2.12345: UDP, length 16
16:16:52.315670 IP 10.0.0.1.12345 > 10.0.0.2.12345: UDP, length 16
16:16:52.316288 IP 10.0.0.1.12345 > 10.0.0.2.12345: UDP, length 16
16:16:52.316903 IP 10.0.0.1.12345 > 10.0.0.2.12345: UDP, length 16
16:16:52.317518 IP 10.0.0.1.12345 > 10.0.0.2.12345: UDP, length 16
16:16:52.318133 IP 10.0.0.1.12345 > 10.0.0.2.12345: UDP, length 16
16:16:52.318749 IP 10.0.0.1.12345 > 10.0.0.2.12345: UDP, length 16
16:16:52.319364 IP 10.0.0.1.12345 > 10.0.0.2.12345: UDP, length 16
16:16:52.319979 IP 10.0.0.1.12345 > 10.0.0.2.12345: UDP, length 16
16:16:52.320599 IP 10.0.0.1.12345 > 10.0.0.2.12345: UDP, length 16
16:16:52.321214 IP 10.0.0.1.12345 > 10.0.0.2.12345: UDP, length 16
16:16:52.321828 IP 10.0.0.1.12345 > 10.0.0.2.12345: UDP, length 16
16:16:52.322443 IP 10.0.0.1.12345 > 10.0.0.2.12345: UDP, length 16
16:16:52.323058 IP 10.0.0.1.12345 > 10.0.0.2.12345: UDP, length 16
16:16:52.323676 IP 10.0.0.1.12345 > 10.0.0.2.12345: UDP, length 16
16:16:52.324293 IP 10.0.0.1.12345 > 10.0.0.2.12345: UDP, length 16
16:16:52.324909 IP 10.0.0.1.12345 > 10.0.0.2.12345: UDP, length 16
16:16:52.325523 IP 10.0.0.1.12345 > 10.0.0.2.12345: UDP, length 16
16:16:52.326138 IP 10.0.0.1.12345 > 10.0.0.2.12345: UDP, length 16
16:16:52.326753 IP 10.0.0.1.12345 > 10.0.0.2.12345: UDP, length 16
16:16:52.327367 IP 10.0.0.1.12345 > 10.0.0.2.12345: UDP, length 16
16:16:52.327963 IP 10.0.0.1.12345 > 10.0.0.2.12345: UDP, length 16
16:16:52.328582 IP 10.0.0.1.12345 > 10.0.0.2.12345: UDP, length 16
16:16:52.329198 IP 10.0.0.1.12345 > 10.0.0.2.12345: UDP, length 16
16:16:52.329814 IP 10.0.0.1.12345 > 10.0.0.2.12345: UDP, length 16
16:16:52.330429 IP 10.0.0.1.12345 > 10.0.0.2.12345: UDP, length 16
16:16:52.331045 IP 10.0.0.1.12345 > 10.0.0.2.12345: UDP, length 16
16:16:52.331663 IP 10.0.0.1.12345 > 10.0.0.2.12345: UDP, length 16
16:16:52.332279 IP 10.0.0.1.12345 > 10.0.0.2.12345: UDP, length 16
16:16:52.332894 IP 10.0.0.1.12345 > 10.0.0.2.12345: UDP, length 16
16:16:52.333509 IP 10.0.0.1.12345 > 10.0.0.2.12345: UDP, length 16
16:16:52.334124 IP 10.0.0.1.12345 > 10.0.0.2.12345: UDP, length 16
16:16:52.334739 IP 10.0.0.1.12345 > 10.0.0.2.12345: UDP, length 16
16:16:52.335354 IP 10.0.0.1.12345 > 10.0.0.2.12345: UDP, length 16
16:16:52.335969 IP 10.0.0.1.12345 > 10.0.0.2.12345: UDP, length 16
16:16:52.336585 IP 10.0.0.1.12345 > 10.0.0.2.12345: UDP, length 16
16:16:52.337201 IP 10.0.0.1.12345 > 10.0.0.2.12345: UDP, length 16
16:16:52.337816 IP 10.0.0.1.12345 > 10.0.0.2.12345: UDP, length 16
16:16:52.338432 IP 10.0.0.1.12345 > 10.0.0.2.12345: UDP, length 16
16:16:52.339047 IP 10.0.0.1.12345 > 10.0.0.2.12345: UDP, length 16
16:16:52.339665 IP 10.0.0.1.12345 > 10.0.0.2.12345: UDP, length 16
16:16:52.340282 IP 10.0.0.1.12345 > 10.0.0.2.12345: UDP, length 16
16:16:52.340897 IP 10.0.0.1.12345 > 10.0.0.2.12345: UDP, length 16
16:16:52.341513 IP 10.0.0.1.12345 > 10.0.0.2.12345: UDP, length 16
16:16:52.342128 IP 10.0.0.1.12345 > 10.0.0.2.12345: UDP, length 16
16:16:52.342744 IP 10.0.0.1.12345 > 10.0.0.2.12345: UDP, length 16
16:16:52.343359 IP 10.0.0.1.12345 > 10.0.0.2.12345: UDP, length 16
16:16:52.343974 IP 10.0.0.1.12345 > 10.0.0.2.12345: UDP, length 16
16:16:52.344590 IP 10.0.0.1.12345 > 10.0.0.2.12345: UDP, length 16
16:16:52.345205 IP 10.0.0.1.12345 > 10.0.0.2.12345: UDP, length 16
16:16:52.345820 IP 10.0.0.1.12345 > 10.0.0.2.12345: UDP, length 16
16:16:52.346435 IP 10.0.0.1.12345 > 10.0.0.2.12345: UDP, length 16
16:16:52.347051 IP 10.0.0.1.12345 > 10.0.0.2.12345: UDP, length 16
16:16:52.347665 IP 10.0.0.1.12345 > 10.0.0.2.12345: UDP, length 16
16:16:52.348281 IP 10.0.0.1.12345 > 10.0.0.2.12345: UDP, length 16
16:16:52.348897 IP 10.0.0.1.12345 > 10.0.0.2.12345: UDP, length 16
16:16:52.349512 IP 10.0.0.1.12345 > 10.0.0.2.12345: UDP, length 16
16:16:52.350127 IP 10.0.0.1.12345 > 10.0.0.2.12345: UDP, length 16
16:16:52.350743 IP 10.0.0.1.12345 > 10.0.0.2.12345: UDP, length 16
16:16:52.351358 IP 10.0.0.1.12345 > 10.0.0.2.12345: UDP, length 16
16:16:52.351975 IP 10.0.0.1.12345 > 10.0.0.2.12345: UDP, length 16
16:16:52.352591 IP 10.0.0.1.12345 > 10.0.0.2.12345: UDP, length 16
16:16:52.353206 IP 10.0.0.1.12345 > 10.0.0.2.12345: UDP, length 16
16:16:52.353821 IP 10.0.0.1.12345 > 10.0.0.2.12345: UDP, length 16
16:16:52.354436 IP 10.0.0.1.12345 > 10.0.0.2.12345: UDP, length 16
16:16:52.355051 IP 10.0.0.1.12345 > 10.0.0.2.12345: UDP, length 16
16:16:52.355669 IP 10.0.0.1.12345 > 10.0.0.2.12345: UDP, length 16
16:16:52.356286 IP 10.0.0.1.12345 > 10.0.0.2.12345: UDP, length 16
16:16:52.356901 IP 10.0.0.1.12345 > 10.0.0.2.12345: UDP, length 16
16:16:52.357515 IP 10.0.0.1.12345 > 10.0.0.2.12345: UDP, length 16
16:16:52.358131 IP 10.0.0.1.12345 > 10.0.0.2.12345: UDP, length 16
16:16:52.358746 IP 10.0.0.1.12345 > 10.0.0.2.12345: UDP, length 16
16:16:52.359361 IP 10.0.0.1.12345 > 10.0.0.2.12345: UDP, length 16
16:16:52.359977 IP 10.0.0.1.12345 > 10.0.0.2.12345: UDP, length 16
16:16:52.360593 IP 10.0.0.1.12345 > 10.0.0.2.12345: UDP, length 16
16:16:52.361208 IP 10.0.0.1.12345 > 10.0.0.2.12345: UDP, length 16
16:16:52.361822 IP 10.0.0.1.12345 > 10.0.0.2.12345: UDP, length 16
16:16:52.362437 IP 10.0.0.1.12345 > 10.0.0.2.12345: UDP, length 16
16:16:52.363052 IP 10.0.0.1.12345 > 10.0.0.2.12345: UDP, length 16
16:16:52.363669 IP 10.0.0.1.12345 > 10.0.0.2.12345: UDP, length 16
16:16:52.364285 IP 10.0.0.1.12345 > 10.0.0.2.12345: UDP, length 16
16:16:52.364900 IP 10.0.0.1.12345 > 10.0.0.2.12345: UDP, length 16
16:16:52.365515 IP 10.0.0.1.12345 > 10.0.0.2.12345: UDP, length 16
16:16:52.366130 IP 10.0.0.1.12345 > 10.0.0.2.12345: UDP, length 16
16:16:52.366746 IP 10.0.0.1.12345 > 10.0.0.2.12345: UDP, length 16
16:16:52.367361 IP 10.0.0.1.12345 > 10.0.0.2.12345: UDP, length 16
16:16:52.367977 IP 10.0.0.1.12345 > 10.0.0.2.12345: UDP, length 16
16:16:52.368593 IP 10.0.0.1.12345 > 10.0.0.2.12345: UDP, length 16
16:16:52.369208 IP 10.0.0.1.12345 > 10.0.0.2.12345: UDP, length 16
16:16:52.369824 IP 10.0.0.1.12345 > 10.0.0.2.12345: UDP, length 16
16:16:52.370439 IP 10.0.0.1.12345 > 10.0.0.2.12345: UDP, length 16
16:16:52.371054 IP 10.0.0.1.12345 > 10.0.0.2.12345: UDP, length 16
16:16:52.371668 IP 10.0.0.1.12345 > 10.0.0.2.12345: UDP, length 16
16:16:52.372284 IP 10.0.0.1.12345 > 10.0.0.2.12345: UDP, length 16
16:16:52.372900 IP 10.0.0.1.12345 > 10.0.0.2.12345: UDP, length 16
16:16:52.373515 IP 10.0.0.1.12345 > 10.0.0.2.12345: UDP, length 16
16:16:52.374131 IP 10.0.0.1.12345 > 10.0.0.2.12345: UDP, length 16
16:16:52.374746 IP 10.0.0.1.12345 > 10.0.0.2.12345: UDP, length 16
16:16:52.375360 IP 10.0.0.1.12345 > 10.0.0.2.12345: UDP, length 16
16:16:52.375976 IP 10.0.0.1.12345 > 10.0.0.2.12345: UDP, length 16
16:16:52.376593 IP 10.0.0.1.12345 > 10.0.0.2.12345: UDP, length 16
16:16:52.377208 IP 10.0.0.1.12345 > 10.0.0.2.12345: UDP, length 16
16:16:52.377825 IP 10.0.0.1.12345 > 10.0.0.2.12345: UDP, length 16
16:16:52.378439 IP 10.0.0.1.12345 > 10.0.0.2.12345: UDP, length 16
16:16:52.379054 IP 10.0.0.1.12345 > 10.0.0.2.12345: UDP, length 16
16:16:52.379669 IP 10.0.0.1.12345 > 10.0.0.2.12345: UDP, length 16
16:16:52.380286 IP 10.0.0.1.12345 > 10.0.0.2.12345: UDP, length 16
16:16:52.380903 IP 10.0.0.1.12345 > 10.0.0.2.12345: UDP, length 16
16:16:52.381518 IP 10.0.0.1.12345 > 10.0.0.2.12345: UDP, length 16
16:16:52.382132 IP 10.0.0.1.12345 > 10.0.0.2.12345: UDP, length 16
16:16:52.382748 IP 10.0.0.1.12345 > 10.0.0.2.12345: UDP, length 16
16:16:52.383365 IP 10.0.0.1.12345 > 10.0.0.2.12345: UDP, length 16
16:16:52.383980 IP 10.0.0.1.12345 > 10.0.0.2.12345: UDP, length 16
16:16:52.384596 IP 10.0.0.1.12345 > 10.0.0.2.12345: UDP, length 16
16:16:52.385210 IP 10.0.0.1.12345 > 10.0.0.2.12345: UDP, length 16
16:16:52.385825 IP 10.0.0.1.12345 > 10.0.0.2.12345: UDP, length 16
16:16:52.386439 IP 10.0.0.1.12345 > 10.0.0.2.12345: UDP, length 16
16:16:52.387054 IP 10.0.0.1.12345 > 10.0.0.2.12345: UDP, length 16
16:16:52.387670 IP 10.0.0.1.12345 > 10.0.0.2.12345: UDP, length 16
16:16:52.388286 IP 10.0.0.1.12345 > 10.0.0.2.12345: UDP, length 16
16:16:52.388902 IP 10.0.0.1.12345 > 10.0.0.2.12345: UDP, length 16
16:16:52.389518 IP 10.0.0.1.12345 > 10.0.0.2.12345: UDP, length 16
16:16:52.390133 IP 10.0.0.1.12345 > 10.0.0.2.12345: UDP, length 16
16:16:52.390753 IP 10.0.0.1.12345 > 10.0.0.2.12345: UDP, length 16
16:16:52.391367 IP 10.0.0.1.12345 > 10.0.0.2.12345: UDP, length 16
16:16:52.391983 IP 10.0.0.1.12345 > 10.0.0.2.12345: UDP, length 16
16:16:52.392599 IP 10.0.0.1.12345 > 10.0.0.2.12345: UDP, length 16
16:16:52.393214 IP 10.0.0.1.12345 > 10.0.0.2.12345: UDP, length 16
16:16:52.393831 IP 10.0.0.1.12345 > 10.0.0.2.12345: UDP, length 16
16:16:52.394446 IP 10.0.0.1.12345 > 10.0.0.2.12345: UDP, length 16
16:16:52.395062 IP 10.0.0.1.12345 > 10.0.0.2.12345: UDP, length 16
16:16:52.395676 IP 10.0.0.1.12345 > 10.0.0.2.12345: UDP, length 16
16:16:52.396293 IP 10.0.0.1.12345 > 10.0.0.2.12345: UDP, length 16
16:16:52.396908 IP 10.0.0.1.12345 > 10.0.0.2.12345: UDP, length 16
16:16:52.397523 IP 10.0.0.1.12345 > 10.0.0.2.12345: UDP, length 16
16:16:52.398138 IP 10.0.0.1.12345 > 10.0.0.2.12345: UDP, length 16
16:16:52.398754 IP 10.0.0.1.12345 > 10.0.0.2.12345: UDP, length 16
16:16:52.399370 IP 10.0.0.1.12345 > 10.0.0.2.12345: UDP, length 16
16:16:52.399985 IP 10.0.0.1.12345 > 10.0.0.2.12345: UDP, length 16
16:16:52.400602 IP 10.0.0.1.12345 > 10.0.0.2.12345: UDP, length 16
16:16:52.401218 IP 10.0.0.1.12345 > 10.0.0.2.12345: UDP, length 16
16:16:52.401832 IP 10.0.0.1.12345 > 10.0.0.2.12345: UDP, length 16
16:16:52.402447 IP 10.0.0.1.12345 > 10.0.0.2.12345: UDP, length 16
16:16:52.403061 IP 10.0.0.1.12345 > 10.0.0.2.12345: UDP, length 16
16:16:52.403676 IP 10.0.0.1.12345 > 10.0.0.2.12345: UDP, length 16
16:16:52.404295 IP 10.0.0.1.12345 > 10.0.0.2.12345: UDP, length 16
16:16:52.404908 IP 10.0.0.1.12345 > 10.0.0.2.12345: UDP, length 16
16:16:52.405522 IP 10.0.0.1.12345 > 10.0.0.2.12345: UDP, length 16
16:16:52.406136 IP 10.0.0.1.12345 > 10.0.0.2.12345: UDP, length 16
16:16:52.406750 IP 10.0.0.1.12345 > 10.0.0.2.12345: UDP, length 16
16:16:52.407363 IP 10.0.0.1.12345 > 10.0.0.2.12345: UDP, length 16
16:16:52.407976 IP 10.0.0.1.12345 > 10.0.0.2.12345: UDP, length 16
16:16:52.408579 IP 10.0.0.1.12345 > 10.0.0.2.12345: UDP, length 16
16:16:52.409143 IP 10.0.0.1.12345 > 10.0.0.2.12345: UDP, length 16
16:16:52.409743 IP 10.0.0.1.12345 > 10.0.0.2.12345: UDP, length 16
16:16:52.410337 IP 10.0.0.1.12345 > 10.0.0.2.12345: UDP, length 16
16:16:52.410931 IP 10.0.0.1.12345 > 10.0.0.2.12345: UDP, length 16
16:16:52.411525 IP 10.0.0.1.12345 > 10.0.0.2.12345: UDP, length 16
16:16:52.412137 IP 10.0.0.1.12345 > 10.0.0.2.12345: UDP, length 16
16:16:52.412752 IP 10.0.0.1.12345 > 10.0.0.2.12345: UDP, length 16
16:16:52.413361 IP 10.0.0.1.12345 > 10.0.0.2.12345: UDP, length 16
16:16:52.413976 IP 10.0.0.1.12345 > 10.0.0.2.12345: UDP, length 16
16:16:52.414590 IP 10.0.0.1.12345 > 10.0.0.2.12345: UDP, length 16
16:16:52.415205 IP 10.0.0.1.12345 > 10.0.0.2.12345: UDP, length 16
16:16:52.415824 IP 10.0.0.1.12345 > 10.0.0.2.12345: UDP, length 16
16:16:52.416438 IP 10.0.0.1.12345 > 10.0.0.2.12345: UDP, length 16
16:16:52.417052 IP 10.0.0.1.12345 > 10.0.0.2.12345: UDP, length 16
16:16:52.417666 IP 10.0.0.1.12345 > 10.0.0.2.12345: UDP, length 16
16:16:52.418281 IP 10.0.0.1.12345 > 10.0.0.2.12345: UDP, length 16
16:16:52.418881 IP 10.0.0.1.12345 > 10.0.0.2.12345: UDP, length 16
16:16:52.419495 IP 10.0.0.1.12345 > 10.0.0.2.12345: UDP, length 16
16:16:52.420110 IP 10.0.0.1.12345 > 10.0.0.2.12345: UDP, length 16
16:16:52.420725 IP 10.0.0.1.12345 > 10.0.0.2.12345: UDP, length 16
16:16:52.421340 IP 10.0.0.1.12345 > 10.0.0.2.12345: UDP, length 16
16:16:52.421954 IP 10.0.0.1.12345 > 10.0.0.2.12345: UDP, length 16
16:16:52.422569 IP 10.0.0.1.12345 > 10.0.0.2.12345: UDP, length 16
16:16:52.423184 IP 10.0.0.1.12345 > 10.0.0.2.12345: UDP, length 16
16:16:52.423799 IP 10.0.0.1.12345 > 10.0.0.2.12345: UDP, length 16
16:16:52.424414 IP 10.0.0.1.12345 > 10.0.0.2.12345: UDP, length 16
16:16:52.425029 IP 10.0.0.1.12345 > 10.0.0.2.12345: UDP, length 16
16:16:52.425643 IP 10.0.0.1.12345 > 10.0.0.2.12345: UDP, length 16
16:16:52.426258 IP 10.0.0.1.12345 > 10.0.0.2.12345: UDP, length 16
16:16:52.426873 IP 10.0.0.1.12345 > 10.0.0.2.12345: UDP, length 16
16:16:52.427487 IP 10.0.0.1.12345 > 10.0.0.2.12345: UDP, length 16
16:16:52.428102 IP 10.0.0.1.12345 > 10.0.0.2.12345: UDP, length 16
16:16:52.428718 IP 10.0.0.1.12345 > 10.0.0.2.12345: UDP, length 16
16:16:52.429327 IP 10.0.0.1.12345 > 10.0.0.2.12345: UDP, length 16
16:16:52.429941 IP 10.0.0.1.12345 > 10.0.0.2.12345: UDP, length 16
16:16:52.430557 IP 10.0.0.1.12345 > 10.0.0.2.12345: UDP, length 16
16:16:52.431171 IP 10.0.0.1.12345 > 10.0.0.2.12345: UDP, length 16
16:16:52.431786 IP 10.0.0.1.12345 > 10.0.0.2.12345: UDP, length 16
16:16:52.432401 IP 10.0.0.1.12345 > 10.0.0.2.12345: UDP, length 16
16:16:52.433016 IP 10.0.0.1.12345 > 10.0.0.2.12345: UDP, length 16
16:16:52.433630 IP 10.0.0.1.12345 > 10.0.0.2.12345: UDP, length 16
16:16:52.434245 IP 10.0.0.1.12345 > 10.0.0.2.12345: UDP, length 16
16:16:52.434862 IP 10.0.0.1.12345 > 10.0.0.2.12345: UDP, length 16
16:16:52.435477 IP 10.0.0.1.12345 > 10.0.0.2.12345: UDP, length 16
16:16:52.436092 IP 10.0.0.1.12345 > 10.0.0.2.12345: UDP, length 16
16:16:52.436707 IP 10.0.0.1.12345 > 10.0.0.2.12345: UDP, length 16
16:16:52.437322 IP 10.0.0.1.12345 > 10.0.0.2.12345: UDP, length 16
16:16:52.437936 IP 10.0.0.1.12345 > 10.0.0.2.12345: UDP, length 16
16:16:52.438551 IP 10.0.0.1.12345 > 10.0.0.2.12345: UDP, length 16
16:16:52.439166 IP 10.0.0.1.12345 > 10.0.0.2.12345: UDP, length 16
16:16:52.439779 IP 10.0.0.1.12345 > 10.0.0.2.12345: UDP, length 16
16:16:52.440395 IP 10.0.0.1.12345 > 10.0.0.2.12345: UDP, length 16
16:16:52.441011 IP 10.0.0.1.12345 > 10.0.0.2.12345: UDP, length 16
16:16:52.441624 IP 10.0.0.1.12345 > 10.0.0.2.12345: UDP, length 16
16:16:52.442239 IP 10.0.0.1.12345 > 10.0.0.2.12345: UDP, length 16
16:16:52.442854 IP 10.0.0.1.12345 > 10.0.0.2.12345: UDP, length 16
16:16:52.443470 IP 10.0.0.1.12345 > 10.0.0.2.12345: UDP, length 16
16:16:52.444084 IP 10.0.0.1.12345 > 10.0.0.2.12345: UDP, length 16
16:16:52.444700 IP 10.0.0.1.12345 > 10.0.0.2.12345: UDP, length 16
16:16:52.445282 IP 10.0.0.1.12345 > 10.0.0.2.12345: UDP, length 16
16:16:52.445896 IP 10.0.0.1.12345 > 10.0.0.2.12345: UDP, length 16
16:16:52.446510 IP 10.0.0.1.12345 > 10.0.0.2.12345: UDP, length 16
16:16:52.447124 IP 10.0.0.1.12345 > 10.0.0.2.12345: UDP, length 16
16:16:52.447739 IP 10.0.0.1.12345 > 10.0.0.2.12345: UDP, length 16
16:16:52.448356 IP 10.0.0.1.12345 > 10.0.0.2.12345: UDP, length 16
16:16:52.448970 IP 10.0.0.1.12345 > 10.0.0.2.12345: UDP, length 16
16:16:52.449585 IP 10.0.0.1.12345 > 10.0.0.2.12345: UDP, length 16
16:16:52.450199 IP 10.0.0.1.12345 > 10.0.0.2.12345: UDP, length 16
16:16:52.450813 IP 10.0.0.1.12345 > 10.0.0.2.12345: UDP, length 16
16:16:52.451428 IP 10.0.0.1.12345 > 10.0.0.2.12345: UDP, length 16
16:16:52.452043 IP 10.0.0.1.12345 > 10.0.0.2.12345: UDP, length 16
16:16:52.452659 IP 10.0.0.1.12345 > 10.0.0.2.12345: UDP, length 16
16:16:52.453273 IP 10.0.0.1.12345 > 10.0.0.2.12345: UDP, length 16
16:16:52.453891 IP 10.0.0.1.12345 > 10.0.0.2.12345: UDP, length 16
16:16:52.454505 IP 10.0.0.1.12345 > 10.0.0.2.12345: UDP, length 16
16:16:52.455119 IP 10.0.0.1.12345 > 10.0.0.2.12345: UDP, length 16
16:16:52.455734 IP 10.0.0.1.12345 > 10.0.0.2.12345: UDP, length 16
16:16:52.456350 IP 10.0.0.1.12345 > 10.0.0.2.12345: UDP, length 16
16:16:52.456965 IP 10.0.0.1.12345 > 10.0.0.2.12345: UDP, length 16
16:16:52.457579 IP 10.0.0.1.12345 > 10.0.0.2.12345: UDP, length 16
16:16:52.458194 IP 10.0.0.1.12345 > 10.0.0.2.12345: UDP, length 16
16:16:52.458809 IP 10.0.0.1.12345 > 10.0.0.2.12345: UDP, length 16
16:16:52.459423 IP 10.0.0.1.12345 > 10.0.0.2.12345: UDP, length 16
16:16:52.460037 IP 10.0.0.1.12345 > 10.0.0.2.12345: UDP, length 16
16:16:52.460653 IP 10.0.0.1.12345 > 10.0.0.2.12345: UDP, length 16
16:16:52.461234 IP 10.0.0.1.12345 > 10.0.0.2.12345: UDP, length 16
16:16:52.461848 IP 10.0.0.1.12345 > 10.0.0.2.12345: UDP, length 16
16:16:52.462464 IP 10.0.0.1.12345 > 10.0.0.2.12345: UDP, length 16
16:16:52.463078 IP 10.0.0.1.12345 > 10.0.0.2.12345: UDP, length 16
16:16:52.463694 IP 10.0.0.1.12345 > 10.0.0.2.12345: UDP, length 16
16:16:52.464310 IP 10.0.0.1.12345 > 10.0.0.2.12345: UDP, length 16
16:16:52.464925 IP 10.0.0.1.12345 > 10.0.0.2.12345: UDP, length 16
16:16:52.465540 IP 10.0.0.1.12345 > 10.0.0.2.12345: UDP, length 16
16:16:52.466123 IP 10.0.0.1.12345 > 10.0.0.2.12345: UDP, length 16
16:16:52.466734 IP 10.0.0.1.12345 > 10.0.0.2.12345: UDP, length 16
16:16:52.467349 IP 10.0.0.1.12345 > 10.0.0.2.12345: UDP, length 16
16:16:52.467963 IP 10.0.0.1.12345 > 10.0.0.2.12345: UDP, length 16
16:16:52.468579 IP 10.0.0.1.12345 > 10.0.0.2.12345: UDP, length 16
16:16:52.469194 IP 10.0.0.1.12345 > 10.0.0.2.12345: UDP, length 16
16:16:52.469810 IP 10.0.0.1.12345 > 10.0.0.2.12345: UDP, length 16
16:16:52.470424 IP 10.0.0.1.12345 > 10.0.0.2.12345: UDP, length 16
16:16:52.471038 IP 10.0.0.1.12345 > 10.0.0.2.12345: UDP, length 16
16:16:52.471653 IP 10.0.0.1.12345 > 10.0.0.2.12345: UDP, length 16
16:16:52.472270 IP 10.0.0.1.12345 > 10.0.0.2.12345: UDP, length 16
16:16:52.472884 IP 10.0.0.1.12345 > 10.0.0.2.12345: UDP, length 16
16:16:52.473500 IP 10.0.0.1.12345 > 10.0.0.2.12345: UDP, length 16
16:16:52.474114 IP 10.0.0.1.12345 > 10.0.0.2.12345: UDP, length 16
16:16:52.474728 IP 10.0.0.1.12345 > 10.0.0.2.12345: UDP, length 16
16:16:52.475343 IP 10.0.0.1.12345 > 10.0.0.2.12345: UDP, length 16
16:16:52.475959 IP 10.0.0.1.12345 > 10.0.0.2.12345: UDP, length 16
16:16:52.476574 IP 10.0.0.1.12345 > 10.0.0.2.12345: UDP, length 16
16:16:52.477183 IP 10.0.0.1.12345 > 10.0.0.2.12345: UDP, length 16
16:16:52.477794 IP 10.0.0.1.12345 > 10.0.0.2.12345: UDP, length 16
16:16:52.478407 IP 10.0.0.1.12345 > 10.0.0.2.12345: UDP, length 16
16:16:52.479021 IP 10.0.0.1.12345 > 10.0.0.2.12345: UDP, length 16
16:16:52.479635 IP 10.0.0.1.12345 > 10.0.0.2.12345: UDP, length 16
16:16:52.480250 IP 10.0.0.1.12345 > 10.0.0.2.12345: UDP, length 16
16:16:52.480865 IP 10.0.0.1.12345 > 10.0.0.2.12345: UDP, length 16
16:16:52.481480 IP 10.0.0.1.12345 > 10.0.0.2.12345: UDP, length 16
16:16:52.482094 IP 10.0.0.1.12345 > 10.0.0.2.12345: UDP, length 16
16:16:52.482708 IP 10.0.0.1.12345 > 10.0.0.2.12345: UDP, length 16
16:16:52.483323 IP 10.0.0.1.12345 > 10.0.0.2.12345: UDP, length 16
16:16:52.483937 IP 10.0.0.1.12345 > 10.0.0.2.12345: UDP, length 16
16:16:52.484553 IP 10.0.0.1.12345 > 10.0.0.2.12345: UDP, length 16
16:16:52.485167 IP 10.0.0.1.12345 > 10.0.0.2.12345: UDP, length 16
16:16:52.485782 IP 10.0.0.1.12345 > 10.0.0.2.12345: UDP, length 16
16:16:52.486396 IP 10.0.0.1.12345 > 10.0.0.2.12345: UDP, length 16
16:16:52.487013 IP 10.0.0.1.12345 > 10.0.0.2.12345: UDP, length 16
16:16:52.487627 IP 10.0.0.1.12345 > 10.0.0.2.12345: UDP, length 16
16:16:52.488244 IP 10.0.0.1.12345 > 10.0.0.2.12345: UDP, length 16
16:16:52.488859 IP 10.0.0.1.12345 > 10.0.0.2.12345: UDP, length 16
16:16:52.489473 IP 10.0.0.1.12345 > 10.0.0.2.12345: UDP, length 16
16:16:52.490087 IP 10.0.0.1.12345 > 10.0.0.2.12345: UDP, length 16
16:16:52.490701 IP 10.0.0.1.12345 > 10.0.0.2.12345: UDP, length 16
16:16:52.491316 IP 10.0.0.1.12345 > 10.0.0.2.12345: UDP, length 16
16:16:52.491930 IP 10.0.0.1.12345 > 10.0.0.2.12345: UDP, length 16
16:16:52.492544 IP 10.0.0.1.12345 > 10.0.0.2.12345: UDP, length 16
16:16:52.493144 IP 10.0.0.1.12345 > 10.0.0.2.12345: UDP, length 16
16:16:52.493758 IP 10.0.0.1.12345 > 10.0.0.2.12345: UDP, length 16
16:16:52.494373 IP 10.0.0.1.12345 > 10.0.0.2.12345: UDP, length 16
16:16:52.494991 IP 10.0.0.1.12345 > 10.0.0.2.12345: UDP, length 16
16:16:52.495607 IP 10.0.0.1.12345 > 10.0.0.2.12345: UDP, length 16
16:16:52.496242 IP 10.0.0.1.12345 > 10.0.0.2.12345: UDP, length 16
16:16:52.496857 IP 10.0.0.1.12345 > 10.0.0.2.12345: UDP, length 16
16:16:52.497471 IP 10.0.0.1.12345 > 10.0.0.2.12345: UDP, length 16
16:16:52.498086 IP 10.0.0.1.12345 > 10.0.0.2.12345: UDP, length 16
16:16:52.498701 IP 10.0.0.1.12345 > 10.0.0.2.12345: UDP, length 16
16:16:52.499315 IP 10.0.0.1.12345 > 10.0.0.2.12345: UDP, length 16
16:16:52.499929 IP 10.0.0.1.12345 > 10.0.0.2.12345: UDP, length 16
16:16:52.500546 IP 10.0.0.1.12345 > 10.0.0.2.12345: UDP, length 16
16:16:52.501161 IP 10.0.0.1.12345 > 10.0.0.2.12345: UDP, length 16
16:16:52.501776 IP 10.0.0.1.12345 > 10.0.0.2.12345: UDP, length 16
16:16:52.502391 IP 10.0.0.1.12345 > 10.0.0.2.12345: UDP, length 16
16:16:52.503007 IP 10.0.0.1.12345 > 10.0.0.2.12345: UDP, length 16
16:16:52.503622 IP 10.0.0.1.12345 > 10.0.0.2.12345: UDP, length 16
16:16:52.504239 IP 10.0.0.1.12345 > 10.0.0.2.12345: UDP, length 16
16:16:52.504853 IP 10.0.0.1.12345 > 10.0.0.2.12345: UDP, length 16
16:16:52.505469 IP 10.0.0.1.12345 > 10.0.0.2.12345: UDP, length 16
16:16:52.506084 IP 10.0.0.1.12345 > 10.0.0.2.12345: UDP, length 16
16:16:52.506699 IP 10.0.0.1.12345 > 10.0.0.2.12345: UDP, length 16
16:16:52.507314 IP 10.0.0.1.12345 > 10.0.0.2.12345: UDP, length 16
16:16:52.507928 IP 10.0.0.1.12345 > 10.0.0.2.12345: UDP, length 16
16:16:52.508543 IP 10.0.0.1.12345 > 10.0.0.2.12345: UDP, length 16
16:16:52.509144 IP 10.0.0.1.12345 > 10.0.0.2.12345: UDP, length 16
16:16:52.509759 IP 10.0.0.1.12345 > 10.0.0.2.12345: UDP, length 16
16:16:52.510373 IP 10.0.0.1.12345 > 10.0.0.2.12345: UDP, length 16
16:16:52.510989 IP 10.0.0.1.12345 > 10.0.0.2.12345: UDP, length 16
16:16:52.511605 IP 10.0.0.1.12345 > 10.0.0.2.12345: UDP, length 16
16:16:52.512239 IP 10.0.0.1.12345 > 10.0.0.2.12345: UDP, length 16
16:16:52.512853 IP 10.0.0.1.12345 > 10.0.0.2.12345: UDP, length 16
16:16:52.513468 IP 10.0.0.1.12345 > 10.0.0.2.12345: UDP, length 16
16:16:52.514084 IP 10.0.0.1.12345 > 10.0.0.2.12345: UDP, length 16
16:16:52.514684 IP 10.0.0.1.12345 > 10.0.0.2.12345: UDP, length 16
16:16:52.515300 IP 10.0.0.1.12345 > 10.0.0.2.12345: UDP, length 16
16:16:52.515914 IP 10.0.0.1.12345 > 10.0.0.2.12345: UDP, length 16
16:16:52.516530 IP 10.0.0.1.12345 > 10.0.0.2.12345: UDP, length 16
16:16:52.517144 IP 10.0.0.1.12345 > 10.0.0.2.12345: UDP, length 16
16:16:52.517759 IP 10.0.0.1.12345 > 10.0.0.2.12345: UDP, length 16
16:16:52.518373 IP 10.0.0.1.12345 > 10.0.0.2.12345: UDP, length 16
16:16:52.518988 IP 10.0.0.1.12345 > 10.0.0.2.12345: UDP, length 16
16:16:52.519602 IP 10.0.0.1.12345 > 10.0.0.2.12345: UDP, length 16
16:16:52.520221 IP 10.0.0.1.12345 > 10.0.0.2.12345: UDP, length 16
16:16:52.520850 IP 10.0.0.1.12345 > 10.0.0.2.12345: UDP, length 16
16:16:52.521464 IP 10.0.0.1.12345 > 10.0.0.2.12345: UDP, length 16
16:16:52.522080 IP 10.0.0.1.12345 > 10.0.0.2.12345: UDP, length 16
16:16:52.522694 IP 10.0.0.1.12345 > 10.0.0.2.12345: UDP, length 16
16:16:52.523309 IP 10.0.0.1.12345 > 10.0.0.2.12345: UDP, length 16
16:16:52.523924 IP 10.0.0.1.12345 > 10.0.0.2.12345: UDP, length 16
16:16:52.524538 IP 10.0.0.1.12345 > 10.0.0.2.12345: UDP, length 16
16:16:52.525138 IP 10.0.0.1.12345 > 10.0.0.2.12345: UDP, length 16
16:16:52.525753 IP 10.0.0.1.12345 > 10.0.0.2.12345: UDP, length 16
16:16:52.526368 IP 10.0.0.1.12345 > 10.0.0.2.12345: UDP, length 16
16:16:52.526983 IP 10.0.0.1.12345 > 10.0.0.2.12345: UDP, length 16
16:16:52.527598 IP 10.0.0.1.12345 > 10.0.0.2.12345: UDP, length 16
16:16:52.528213 IP 10.0.0.1.12345 > 10.0.0.2.12345: UDP, length 16
16:16:52.528846 IP 10.0.0.1.12345 > 10.0.0.2.12345: UDP, length 16
16:16:52.529460 IP 10.0.0.1.12345 > 10.0.0.2.12345: UDP, length 16
16:16:52.530078 IP 10.0.0.1.12345 > 10.0.0.2.12345: UDP, length 16
16:16:52.530691 IP 10.0.0.1.12345 > 10.0.0.2.12345: UDP, length 16
16:16:52.531306 IP 10.0.0.1.12345 > 10.0.0.2.12345: UDP, length 16
16:16:52.531921 IP 10.0.0.1.12345 > 10.0.0.2.12345: UDP, length 16
16:16:52.532535 IP 10.0.0.1.12345 > 10.0.0.2.12345: UDP, length 16
16:16:52.533149 IP 10.0.0.1.12345 > 10.0.0.2.12345: UDP, length 16
16:16:52.533764 IP 10.0.0.1.12345 > 10.0.0.2.12345: UDP, length 16
16:16:52.534375 IP 10.0.0.1.12345 > 10.0.0.2.12345: UDP, length 16
16:16:52.534990 IP 10.0.0.1.12345 > 10.0.0.2.12345: UDP, length 16
16:16:52.535605 IP 10.0.0.1.12345 > 10.0.0.2.12345: UDP, length 16
16:16:52.536239 IP 10.0.0.1.12345 > 10.0.0.2.12345: UDP, length 16
16:16:52.536854 IP 10.0.0.1.12345 > 10.0.0.2.12345: UDP, length 16
16:16:52.537468 IP 10.0.0.1.12345 > 10.0.0.2.12345: UDP, length 16
16:16:52.538083 IP 10.0.0.1.12345 > 10.0.0.2.12345: UDP, length 16
16:16:52.538697 IP 10.0.0.1.12345 > 10.0.0.2.12345: UDP, length 16
16:16:52.539313 IP 10.0.0.1.12345 > 10.0.0.2.12345: UDP, length 16
16:16:52.539927 IP 10.0.0.1.12345 > 10.0.0.2.12345: UDP, length 16
16:16:52.540542 IP 10.0.0.1.12345 > 10.0.0.2.12345: UDP, length 16
16:16:52.541143 IP 10.0.0.1.12345 > 10.0.0.2.12345: UDP, length 16
16:16:52.541758 IP 10.0.0.1.12345 > 10.0.0.2.12345: UDP, length 16
16:16:52.542372 IP 10.0.0.1.12345 > 10.0.0.2.12345: UDP, length 16
16:16:52.542986 IP 10.0.0.1.12345 > 10.0.0.2.12345: UDP, length 16
16:16:52.543601 IP 10.0.0.1.12345 > 10.0.0.2.12345: UDP, length 16
16:16:52.544221 IP 10.0.0.1.12345 > 10.0.0.2.12345: UDP, length 16
16:16:52.544837 IP 10.0.0.1.12345 > 10.0.0.2.12345: UDP, length 16
16:16:52.545452 IP 10.0.0.1.12345 > 10.0.0.2.12345: UDP, length 16
16:16:52.546066 IP 10.0.0.1.12345 > 10.0.0.2.12345: UDP, length 16

