16:16:52.239144 IP 10.0.0.1.12345 > 10.0.0.2.12345: UDP, length 16
16:16:52.239562 IP 10.0.0.1.12345 > 10.0.0.2.12345: UDP, length 16
16:16:52.240188 IP 10.0.0.1.12345 > 10.0.0.2.12345: UDP, length 16
16:16:52.240811 IP 10.0.0.1.12345 > 10.0.0.2.12345: UDP, length 16
16:16:52.241476 IP 10.0.0.1.12345 > 10.0.0.2.12345: UDP, length 16
16:16:52.242144 IP 10.0.0.1.12345 > 10.0.0.2.12345: UDP, length 16
16:16:52.242817 IP 10.0.0.1.12345 > 10.0.0.2.12345: UDP, length 16
16:16:52.243483 IP 10.0.0.1.12345 > 10.0.0.2.12345: UDP, length 16
16:16:52.244124 IP 10.0.0.1.12345 > 10.0.0.2.12345: UDP, length 16
16:16:52.244779 IP 10.0.0.1.12345 > 10.0.0.2.12345: UDP, length 16
16:16:52.245413 IP 10.0.0.1.12345 > 10.0.0.2.12345: UDP, length 16
16:16:52.246065 IP 10.0.0.1.12345 > 10.0.0.2.12345: UDP, length 16
16:16:52.246720 IP 10.0.0.1.12345 > 10.0.0.2.12345: UDP, length 16
16:16:52.247390 IP 10.0.0.1.12345 > 10.0.0.2.12345: UDP, length 16
16:16:52.248060 IP 10.0.0.1.12345 > 10.0.0.2.12345: UDP, length 16
16:16:52.248684 IP 10.0.0.1.12345 > 10.0.0.2.12345: UDP, length 16
16:16:52.249300 IP 10.0.0.1.12345 > 10.0.0.2.12345: UDP, length 16
16:16:52.249914 IP 10.0.0.1.12345 > 10.0.0.2.12345: UDP, length 16
16:16:52.250530 IP 10.0.0.1.12345 > 10.0.0.2.12345: UDP, length 16
16:16:52.251144 IP 10.0.0.1.12345 > 10.0.0.2.12345: UDP, length 16
16:16:52.251760 IP 10.0.0.1.12345 > 10.0.0.2.12345: UDP, length 16
16:16:52.252354 IP 10.0.0.1.12345 > 10.0.0.2.12345: UDP, length 16
16:16:52.252969 IP 10.0.0.1.12345 > 10.0.0.2.12345: UDP, length 16
16:16:52.253584 IP 10.0.0.1.12345 > 10.0.0.2.12345: UDP, length 16
16:16:52.254198 IP 10.0.0.1.12345 > 10.0.0.2.12345: UDP, length 16
16:16:52.254816 IP 10.0.0.1.12345 > 10.0.0.2.12345: UDP, length 16
16:16:52.255433 IP 10.0.0.1.12345 > 10.0.0.2.12345: UDP, length 16
16:16:52.256049 IP 10.0.0.1.12345 > 10.0.0.2.12345: UDP, length 16
16:16:52.256664 IP 10.0.0.1.12345 > 10.0.0.2.12345: UDP, length 16
16:16:52.257278 IP 10.0.0.1.12345 > 10.0.0.2.12345: UDP, length 16
16:16:52.257893 IP 10.0.0.1.12345 > 10.0.0.2.12345: UDP, length 16
16:16:52.258510 IP 10.0.0.1.12345 > 10.0.0.2.12345: UDP, length 16
16:16:52.259093 IP 10.0.0.1.12345 > 10.0.0.2.12345: UDP, length 16
16:16:52.259707 IP 10.0.0.1.12345 > 10.0.0.2.12345: UDP, length 16
16:16:52.260295 IP 10.0.0.1.12345 > 10.0.0.2.12345: UDP, length 16
16:16:52.260911 IP 10.0.0.1.12345 > 10.0.0.2.12345: UDP, length 16
16:16:52.261526 IP 10.0.0.1.12345 > 10.0.0.2.12345: UDP, length 16
16:16:52.262141 IP 10.0.0.1.12345 > 10.0.0.2.12345: UDP, length 16
16:16:52.262757 IP 10.0.0.1.12345 > 10.0.0.2.12345: UDP, length 16
16:16:52.263372 IP 10.0.0.1.12345 > 10.0.0.2.12345: UDP, length 16
16:16:52.263987 IP 10.0.0.1.12345 > 10.0.0.2.12345: UDP, length 16
16:16:52.264602 IP 10.0.0.1.12345 > 10.0.0.2.12345: UDP, length 16
16:16:52.265220 IP 10.0.0.1.12345 > 10.0.0.2.12345: UDP, length 16
16:16:52.265834 IP 10.0.0.1.12345 > 10.0.0.2.12345: UDP, length 16
16:16:52.266453 IP 10.0.0.1.12345 > 10.0.0.2.12345: UDP, length 16
16:16:52.267068 IP 10.0.0.1.12345 > 10.0.0.2.12345: UDP, length 16
16:16:52.267685 IP 10.0.0.1.12345 > 10.0.0.2.12345: UDP, length 16
16:16:52.268284 IP 10.0.0.1.12345 > 10.0.0.2.12345: UDP, length 16
16:16:52.268902 IP 10.0.0.1.12345 > 10.0.0.2.12345: UDP, length 16
16:16:52.269518 IP 10.0.0.1.12345 > 10.0.0.2.12345: UDP, length 16
16:16:52.270133 IP 10.0.0.1.12345 > 10.0.0.2.12345: UDP, length 16
16:16:52.270748 IP 10.0.0.1.12345 > 10.0.0.2.12345: UDP, length 16
16:16:52.271363 IP 10.0.0.1.12345 > 10.0.0.2.12345: UDP, length 16
16:16:52.271978 IP 10.0.0.1.12345 > 10.0.0.2.12345: UDP, length 16
16:16:52.272593 IP 10.0.0.1.12345 > 10.0.0.2.12345: UDP, length 16
16:16:52.273208 IP 10.0.0.1.12345 > 10.0.0.2.12345: UDP, length 16
16:16:52.273823 IP 10.0.0.1.12345 > 10.0.0.2.12345: UDP, length 16
16:16:52.274438 IP 10.0.0.1.12345 > 10.0.0.2.12345: UDP, length 16
16:16:52.275053 IP 10.0.0.1.12345 > 10.0.0.2.12345: UDP, length 16
16:16:52.275662 IP 10.0.0.1.12345 > 10.0.0.2.12345: UDP, length 16
16:16:52.276281 IP 10.0.0.1.12345 > 10.0.0.2.12345: UDP, length 16
16:16:52.276899 IP 10.0.0.1.12345 > 10.0.0.2.12345: UDP, length 16
16:16:52.277517 IP 10.0.0.1.12345 > 10.0.0.2.12345: UDP, length 16
16:16:52.278132 IP 10.0.0.1.12345 > 10.0.0.2.12345: UDP, length 16
16:16:52.278748 IP 10.0.0.1.12345 > 10.0.0.2.12345: UDP, length 16
16:16:52.279363 IP 10.0.0.1.12345 > 10.0.0.2.12345: UDP, length 16
16:16:52.279978 IP 10.0.0.1.12345 > 10.0.0.2.12345: UDP, length 16
16:16:52.280594 IP 10.0.0.1.12345 > 10.0.0.2.12345: UDP, length 16
16:16:52.281209 IP 10.0.0.1.12345 > 10.0.0.2.12345: UDP, length 16
16:16:52.281824 IP 10.0.0.1.12345 > 10.0.0.2.12345: UDP, length 16
16:16:52.282438 IP 10.0.0.1.12345 > 10.0.0.2.12345: UDP, length 16
16:16:52.283054 IP 10.0.0.1.12345 > 10.0.0.2.12345: UDP, length 16
16:16:52.283670 IP 10.0.0.1.12345 > 10.0.0.2.12345: UDP, length 16
16:16:52.284281 IP 10.0.0.1.12345 > 10.0.0.2.12345: UDP, length 16
16:16:52.284899 IP 10.0.0.1.12345 > 10.0.0.2.12345: UDP, length 16
16:16:52.285518 IP 10.0.0.1.12345 > 10.0.0.2.12345: UDP, length 16
16:16:52.286133 IP 10.0.0.1.12345 > 10.0.0.2.12345: UDP, length 16
16:16:52.286748 IP 10.0.0.1.12345 > 10.0.0.2.12345: UDP, length 16
16:16:52.287363 IP 10.0.0.1.12345 > 10.0.0.2.12345: UDP, length 16
16:16:52.287977 IP 10.0.0.1.12345 > 10.0.0.2.12345: UDP, length 16
16:16:52.288594 IP 10.0.0.1.12345 > 10.0.0.2.12345: UDP, length 16
16:16:52.289209 IP 10.0.0.1.12345 > 10.0.0.2.12345: UDP, length 16
16:16:52.289824 IP 10.0.0.1.12345 > 10.0.0.2.12345: UDP, length 16
16:16:52.290439 IP 10.0.0.1.12345 > 10.0.0.2.12345: UDP, length 16
16:16:52.291054 IP 10.0.0.1.12345 > 10.0.0.2.12345: UDP, length 16
16:16:52.291668 IP 10.0.0.1.12345 > 10.0.0.2.12345: UDP, length 16
16:16:52.292282 IP 10.0.0.1.12345 > 10.0.0.2.12345: UDP, length 16
16:16:52.292900 IP 10.0.0.1.12345 > 10.0.0.2.12345: UDP, length 16
16:16:52.293515 IP 10.0.0.1.12345 > 10.0.0.2.12345: UDP, length 16
16:16:52.294132 IP 10.0.0.1.12345 > 10.0.0.2.12345: UDP, length 16
16:16:52.294747 IP 10.0.0.1.12345 > 10.0.0.2.12345: UDP, length 16
16:16:52.295363 IP 10.0.0.1.12345 > 10.0.0.2.12345: UDP, length 16
16:16:52.295978 IP 10.0.0.1.12345 > 10.0.0.2.12345: UDP, length 16
16:16:52.296597 IP 10.0.0.1.12345 > 10.0.0.2.12345: UDP, length 16
16:16:52.297212 IP 10.0.0.1.12345 > 10.0.0.2.12345: UDP, length 16
16:16:52.297826 IP 10.0.0.1.12345 > 10.0.0.2.12345: UDP, length 16
16:16:52.298442 IP 10.0.0.1.12345 > 10.0.0.2.12345: UDP, length 16
16:16:52.299057 IP 10.0.0.1.12345 > 10.0.0.2.12345: UDP, length 16
16:16:52.299674 IP 10.0.0.1.12345 > 10.0.0.2.12345: UDP, length 16
16:16:52.300281 IP 10.0.0.1.12345 > 10.0.0.2.12345: UDP, length 16
16:16:52.300900 IP 10.0.0.1.12345 > 10.0.0.2.12345: UDP, length 16
16:16:52.301514 IP 10.0.0.1.12345 > 10.0.0.2.12345: UDP, length 16
16:16:52.302130 IP 10.0.0.1.12345 > 10.0.0.2.12345: UDP, length 16
16:16:52.302746 IP 10.0.0.1.12345 > 10.0.0.2.12345: UDP, length 16
16:16:52.303362 IP 10.0.0.1.12345 > 10.0.0.2.12345: UDP, length 16
16:16:52.303977 IP 10.0.0.1.12345 > 10.0.0.2.12345: UDP, length 16
16:16:52.304593 IP 10.0.0.1.12345 > 10.0.0.2.12345: UDP, length 16
16:16:52.305209 IP 10.0.0.1.12345 > 10.0.0.2.12345: UDP, length 16
16:16:52.305824 IP 10.0.0.1.12345 > 10.0.0.2.12345: UDP, length 16
16:16:52.306439 IP 10.0.0.1.12345 > 10.0.0.2.12345: UDP, length 16
16:16:52.307055 IP 10.0.0.1.12345 > 10.0.0.2.12345: UDP, length 16
16:16:52.307670 IP 10.0.0.1.12345 > 10.0.0.2.12345: UDP, length 16
16:16:52.308286 IP 10.0.0.1.12345 > 10.0.0.2.12345: UDP, length 16
16:16:52.308901 IP 10.0.0.1.12345 > 10.0.0.2.12345: UDP, length 16
16:16:52.309516 IP 10.0.0.1.12345 > 10.0.0.2.12345: UDP, length 16
16:16:52.310130 IP 10.0.0.1.12345 > 10.0.0.2.12345: UDP, length 16
16:16:52.310746 IP 10.0.0.1.12345 > 10.0.0.2.12345: UDP, length 16
16:16:52.311361 IP 10.0.0.1.12345 > 10.0.0.2.12345: UDP, length 16
16:16:52.311976 IP 10.0.0.1.12345 > 10.0.0.2.12345: UDP, length 16
16:16:52.312596 IP 10.0.0.1.12345 > 10.0.0.2.12345: UDP, length 16
16:16:52.313210 IP 10.0.0.1.12345 > 10.0.0.2.12345: UDP, length 16
16:16:52.313825 IP 10.0.0.1.12345 > 10.0.0.2.12345: UDP, length 16
16:16:52.314441 IP 10.0.0.1.12345 > 10.0.0.2.12345: UDP, length 16
16:16:52.315058 IP 10.0.0.1.12345 > 10.0.0.2.12345: UDP, length 16
16:16:52.315673 IP 10.0.0.1.12345 > 10.0.0.2.12345: UDP, length 16
16:16:52.316291 IP 10.0.0.1.12345 > 10.0.0.2.12345: UDP, length 16
16:16:52.316906 IP 10.0.0.1.12345 > 10.0.0.2.12345: UDP, length 16
16:16:52.317521 IP 10.0.0.1.12345 > 10.0.0.2.12345: UDP, length 16
16:16:52.318135 IP 10.0.0.1.12345 > 10.0.0.2.12345: UDP, length 16
16:16:52.318752 IP 10.0.0.1.12345 > 10.0.0.2.12345: UDP, length 16
16:16:52.319367 IP 10.0.0.1.12345 > 10.0.0.2.12345: UDP, length 16
16:16:52.319982 IP 10.0.0.1.12345 > 10.0.0.2.12345: UDP, length 16
16:16:52.320602 IP 10.0.0.1.12345 > 10.0.0.2.12345: UDP, length 16
16:16:52.321217 IP 10.0.0.1.12345 > 10.0.0.2.12345: UDP, length 16
16:16:52.321831 IP 10.0.0.1.12345 > 10.0.0.2.12345: UDP, length 16
16:16:52.322445 IP 10.0.0.1.12345 > 10.0.0.2.12345: UDP, length 16
16:16:52.323061 IP 10.0.0.1.12345 > 10.0.0.2.12345: UDP, length 16
16:16:52.323679 IP 10.0.0.1.12345 > 10.0.0.2.12345: UDP, length 16
16:16:52.324295 IP 10.0.0.1.12345 > 10.0.0.2.12345: UDP, length 16
16:16:52.324912 IP 10.0.0.1.12345 > 10.0.0.2.12345: UDP, length 16
16:16:52.325526 IP 10.0.0.1.12345 > 10.0.0.2.12345: UDP, length 16
16:16:52.326141 IP 10.0.0.1.12345 > 10.0.0.2.12345: UDP, length 16
16:16:52.326756 IP 10.0.0.1.12345 > 10.0.0.2.12345: UDP, length 16
16:16:52.327370 IP 10.0.0.1.12345 > 10.0.0.2.12345: UDP, length 16
16:16:52.327966 IP 10.0.0.1.12345 > 10.0.0.2.12345: UDP, length 16
16:16:52.328585 IP 10.0.0.1.12345 > 10.0.0.2.12345: UDP, length 16
16:16:52.329201 IP 10.0.0.1.12345 > 10.0.0.2.12345: UDP, length 16
16:16:52.329817 IP 10.0.0.1.12345 > 10.0.0.2.12345: UDP, length 16
16:16:52.330432 IP 10.0.0.1.12345 > 10.0.0.2.12345: UDP, length 16
16:16:52.331047 IP 10.0.0.1.12345 > 10.0.0.2.12345: UDP, length 16
16:16:52.331666 IP 10.0.0.1.12345 > 10.0.0.2.12345: UDP, length 16
16:16:52.332282 IP 10.0.0.1.12345 > 10.0.0.2.12345: UDP, length 16
16:16:52.332897 IP 10.0.0.1.12345 > 10.0.0.2.12345: UDP, length 16
16:16:52.333512 IP 10.0.0.1.12345 > 10.0.0.2.12345: UDP, length 16
16:16:52.334127 IP 10.0.0.1.12345 > 10.0.0.2.12345: UDP, length 16
16:16:52.334742 IP 10.0.0.1.12345 > 10.0.0.2.12345: UDP, length 16
16:16:52.335357 IP 10.0.0.1.12345 > 10.0.0.2.12345: UDP, length 16
16:16:52.335972 IP 10.0.0.1.12345 > 10.0.0.2.12345: UDP, length 16
16:16:52.336588 IP 10.0.0.1.12345 > 10.0.0.2.12345: UDP, length 16
16:16:52.337204 IP 10.0.0.1.12345 > 10.0.0.2.12345: UDP, length 16
16:16:52.337819 IP 10.0.0.1.12345 > 10.0.0.2.12345: UDP, length 16
16:16:52.338435 IP 10.0.0.1.12345 > 10.0.0.2.12345: UDP, length 16
16:16:52.339050 IP 10.0.0.1.12345 > 10.0.0.2.12345: UDP, length 16
16:16:52.339668 IP 10.0.0.1.12345 > 10.0.0.2.12345: UDP, length 16
16:16:52.340285 IP 10.0.0.1.12345 > 10.0.0.2.12345: UDP, length 16
16:16:52.340900 IP 10.0.0.1.12345 > 10.0.0.2.12345: UDP, length 16
16:16:52.341516 IP 10.0.0.1.12345 > 10.0.0.2.12345: UDP, length 16
16:16:52.342131 IP 10.0.0.1.12345 > 10.0.0.2.12345: UDP, length 16
16:16:52.342747 IP 10.0.0.1.12345 > 10.0.0.2.12345: UDP, length 16
16:16:52.343361 IP 10.0.0.1.12345 > 10.0.0.2.12345: UDP, length 16
16:16:52.343977 IP 10.0.0.1.12345 > 10.0.0.2.12345: UDP, length 16
16:16:52.344593 IP 10.0.0.1.12345 > 10.0.0.2.12345: UDP, length 16
16:16:52.345208 IP 10.0.0.1.12345 > 10.0.0.2.12345: UDP, length 16
16:16:52.345823 IP 10.0.0.1.12345 > 10.0.0.2.12345: UDP, length 16
16:16:52.346438 IP 10.0.0.1.12345 > 10.0.0.2.12345: UDP, length 16
16:16:52.347053 IP 10.0.0.1.12345 > 10.0.0.2.12345: UDP, length 16
16:16:52.347668 IP 10.0.0.1.12345 > 10.0.0.2.12345: UDP, length 16
16:16:52.348283 IP 10.0.0.1.12345 > 10.0.0.2.12345: UDP, length 16
16:16:52.348900 IP 10.0.0.1.12345 > 10.0.0.2.12345: UDP, length 16
16:16:52.349515 IP 10.0.0.1.12345 > 10.0.0.2.12345: UDP, length 16
16:16:52.350129 IP 10.0.0.1.12345 > 10.0.0.2.12345: UDP, length 16
16:16:52.350745 IP 10.0.0.1.12345 > 10.0.0.2.12345: UDP, length 16
16:16:52.351361 IP 10.0.0.1.12345 > 10.0.0.2.12345: UDP, length 16
16:16:52.351978 IP 10.0.0.1.12345 > 10.0.0.2.12345: UDP, length 16
16:16:52.352593 IP 10.0.0.1.12345 > 10.0.0.2.12345: UDP, length 16
16:16:52.353208 IP 10.0.0.1.12345 > 10.0.0.2.12345: UDP, length 16
16:16:52.353824 IP 10.0.0.1.12345 > 10.0.0.2.12345: UDP, length 16
16:16:52.354439 IP 10.0.0.1.12345 > 10.0.0.2.12345: UDP, length 16
16:16:52.355054 IP 10.0.0.1.12345 > 10.0.0.2.12345: UDP, length 16
16:16:52.355672 IP 10.0.0.1.12345 > 10.0.0.2.12345: UDP, length 16
16:16:52.356289 IP 10.0.0.1.12345 > 10.0.0.2.12345: UDP, length 16
16:16:52.356904 IP 10.0.0.1.12345 > 10.0.0.2.12345: UDP, length 16
16:16:52.357518 IP 10.0.0.1.12345 > 10.0.0.2.12345: UDP, length 16
16:16:52.358133 IP 10.0.0.1.12345 > 10.0.0.2.12345: UDP, length 16
16:16:52.358749 IP 10.0.0.1.12345 > 10.0.0.2.12345: UDP, length 16
16:16:52.359364 IP 10.0.0.1.12345 > 10.0.0.2.12345: UDP, length 16
16:16:52.359980 IP 10.0.0.1.12345 > 10.0.0.2.12345: UDP, length 16
16:16:52.360596 IP 10.0.0.1.12345 > 10.0.0.2.12345: UDP, length 16
16:16:52.361210 IP 10.0.0.1.12345 > 10.0.0.2.12345: UDP, length 16
16:16:52.361825 IP 10.0.0.1.12345 > 10.0.0.2.12345: UDP, length 16
16:16:52.362440 IP 10.0.0.1.12345 > 10.0.0.2.12345: UDP, length 16
16:16:52.363055 IP 10.0.0.1.12345 > 10.0.0.2.12345: UDP, length 16
16:16:52.363672 IP 10.0.0.1.12345 > 10.0.0.2.12345: UDP, length 16
16:16:52.364288 IP 10.0.0.1.12345 > 10.0.0.2.12345: UDP, length 16
16:16:52.364902 IP 10.0.0.1.12345 > 10.0.0.2.12345: UDP, length 16
16:16:52.365517 IP 10.0.0.1.12345 > 10.0.0.2.12345: UDP, length 16
16:16:52.366133 IP 10.0.0.1.12345 > 10.0.0.2.12345: UDP, length 16
16:16:52.366749 IP 10.0.0.1.12345 > 10.0.0.2.12345: UDP, length 16
16:16:52.367364 IP 10.0.0.1.12345 > 10.0.0.2.12345: UDP, length 16
16:16:52.367980 IP 10.0.0.1.12345 > 10.0.0.2.12345: UDP, length 16
16:16:52.368596 IP 10.0.0.1.12345 > 10.0.0.2.12345: UDP, length 16
16:16:52.369211 IP 10.0.0.1.12345 > 10.0.0.2.12345: UDP, length 16
16:16:52.369827 IP 10.0.0.1.12345 > 10.0.0.2.12345: UDP, length 16
16:16:52.370441 IP 10.0.0.1.12345 > 10.0.0.2.12345: UDP, length 16
16:16:52.371057 IP 10.0.0.1.12345 > 10.0.0.2.12345: UDP, length 16
16:16:52.371671 IP 10.0.0.1.12345 > 10.0.0.2.12345: UDP, length 16
16:16:52.372287 IP 10.0.0.1.12345 > 10.0.0.2.12345: UDP, length 16
16:16:52.372902 IP 10.0.0.1.12345 > 10.0.0.2.12345: UDP, length 16
16:16:52.373518 IP 10.0.0.1.12345 > 10.0.0.2.12345: UDP, length 16
16:16:52.374134 IP 10.0.0.1.12345 > 10.0.0.2.12345: UDP, length 16
16:16:52.374749 IP 10.0.0.1.12345 > 10.0.0.2.12345: UDP, length 16
16:16:52.375363 IP 10.0.0.1.12345 > 10.0.0.2.12345: UDP, length 16
16:16:52.375979 IP 10.0.0.1.12345 > 10.0.0.2.12345: UDP, length 16
16:16:52.376596 IP 10.0.0.1.12345 > 10.0.0.2.12345: UDP, length 16
16:16:52.377211 IP 10.0.0.1.12345 > 10.0.0.2.12345: UDP, length 16
16:16:52.377827 IP 10.0.0.1.12345 > 10.0.0.2.12345: UDP, length 16
16:16:52.378442 IP 10.0.0.1.12345 > 10.0.0.2.12345: UDP, length 16
16:16:52.379056 IP 10.0.0.1.12345 > 10.0.0.2.12345: UDP, length 16
16:16:52.379671 IP 10.0.0.1.12345 > 10.0.0.2.12345: UDP, length 16
16:16:52.380289 IP 10.0.0.1.12345 > 10.0.0.2.12345: UDP, length 16
16:16:52.380906 IP 10.0.0.1.12345 > 10.0.0.2.12345: UDP, length 16
16:16:52.381520 IP 10.0.0.1.12345 > 10.0.0.2.12345: UDP, length 16
16:16:52.382135 IP 10.0.0.1.12345 > 10.0.0.2.12345: UDP, length 16
16:16:52.382751 IP 10.0.0.1.12345 > 10.0.0.2.12345: UDP, length 16
16:16:52.383367 IP 10.0.0.1.12345 > 10.0.0.2.12345: UDP, length 16
16:16:52.383982 IP 10.0.0.1.12345 > 10.0.0.2.12345: UDP, length 16
16:16:52.384598 IP 10.0.0.1.12345 > 10.0.0.2.12345: UDP, length 16
16:16:52.385213 IP 10.0.0.1.12345 > 10.0.0.2.12345: UDP, length 16
16:16:52.385828 IP 10.0.0.1.12345 > 10.0.0.2.12345: UDP, length 16
16:16:52.386442 IP 10.0.0.1.12345 > 10.0.0.2.12345: UDP, length 16
16:16:52.387056 IP 10.0.0.1.12345 > 10.0.0.2.12345: UDP, length 16
16:16:52.387672 IP 10.0.0.1.12345 > 10.0.0.2.12345: UDP, length 16
16:16:52.388289 IP 10.0.0.1.12345 > 10.0.0.2.12345: UDP, length 16
16:16:52.388905 IP 10.0.0.1.12345 > 10.0.0.2.12345: UDP, length 16
16:16:52.389520 IP 10.0.0.1.12345 > 10.0.0.2.12345: UDP, length 16
16:16:52.390136 IP 10.0.0.1.12345 > 10.0.0.2.12345: UDP, length 16
16:16:52.390756 IP 10.0.0.1.12345 > 10.0.0.2.12345: UDP, length 16
16:16:52.391370 IP 10.0.0.1.12345 > 10.0.0.2.12345: UDP, length 16
16:16:52.391985 IP 10.0.0.1.12345 > 10.0.0.2.12345: UDP, length 16
16:16:52.392602 IP 10.0.0.1.12345 > 10.0.0.2.12345: UDP, length 16
16:16:52.393217 IP 10.0.0.1.12345 > 10.0.0.2.12345: UDP, length 16
16:16:52.393834 IP 10.0.0.1.12345 > 10.0.0.2.12345: UDP, length 16
16:16:52.394448 IP 10.0.0.1.12345 > 10.0.0.2.12345: UDP, length 16
16:16:52.395064 IP 10.0.0.1.12345 > 10.0.0.2.12345: UDP, length 16
16:16:52.395679 IP 10.0.0.1.12345 > 10.0.0.2.12345: UDP, length 16
16:16:52.396296 IP 10.0.0.1.12345 > 10.0.0.2.12345: UDP, length 16
16:16:52.396911 IP 10.0.0.1.12345 > 10.0.0.2.12345: UDP, length 16
16:16:52.397526 IP 10.0.0.1.12345 > 10.0.0.2.12345: UDP, length 16
16:16:52.398141 IP 10.0.0.1.12345 > 10.0.0.2.12345: UDP, length 16
16:16:52.398757 IP 10.0.0.1.12345 > 10.0.0.2.12345: UDP, length 16
16:16:52.399373 IP 10.0.0.1.12345 > 10.0.0.2.12345: UDP, length 16
16:16:52.399988 IP 10.0.0.1.12345 > 10.0.0.2.12345: UDP, length 16
16:16:52.400605 IP 10.0.0.1.12345 > 10.0.0.2.12345: UDP, length 16
16:16:52.401220 IP 10.0.0.1.12345 > 10.0.0.2.12345: UDP, length 16
16:16:52.401835 IP 10.0.0.1.12345 > 10.0.0.2.12345: UDP, length 16
16:16:52.402449 IP 10.0.0.1.12345 > 10.0.0.2.12345: UDP, length 16
16:16:52.403064 IP 10.0.0.1.12345 > 10.0.0.2.12345: UDP, length 16
16:16:52.403679 IP 10.0.0.1.12345 > 10.0.0.2.12345: UDP, length 16
16:16:52.404297 IP 10.0.0.1.12345 > 10.0.0.2.12345: UDP, length 16
16:16:52.404911 IP 10.0.0.1.12345 > 10.0.0.2.12345: UDP, length 16
16:16:52.405525 IP 10.0.0.1.12345 > 10.0.0.2.12345: UDP, length 16
16:16:52.406138 IP 10.0.0.1.12345 > 10.0.0.2.12345: UDP, length 16
16:16:52.406752 IP 10.0.0.1.12345 > 10.0.0.2.12345: UDP, length 16
16:16:52.407366 IP 10.0.0.1.12345 > 10.0.0.2.12345: UDP, length 16
16:16:52.407979 IP 10.0.0.1.12345 > 10.0.0.2.12345: UDP, length 16
16:16:52.408583 IP 10.0.0.1.12345 > 10.0.0.2.12345: UDP, length 16
16:16:52.409146 IP 10.0.0.1.12345 > 10.0.0.2.12345: UDP, length 16
16:16:52.409745 IP 10.0.0.1.12345 > 10.0.0.2.12345: UDP, length 16
16:16:52.410339 IP 10.0.0.1.12345 > 10.0.0.2.12345: UDP, length 16
16:16:52.410933 IP 10.0.0.1.12345 > 10.0.0.2.12345: UDP, length 16
16:16:52.411527 IP 10.0.0.1.12345 > 10.0.0.2.12345: UDP, length 16
16:16:52.412140 IP 10.0.0.1.12345 > 10.0.0.2.12345: UDP, length 16
16:16:52.412755 IP 10.0.0.1.12345 > 10.0.0.2.12345: UDP, length 16
16:16:52.413364 IP 10.0.0.1.12345 > 10.0.0.2.12345: UDP, length 16
16:16:52.413978 IP 10.0.0.1.12345 > 10.0.0.2.12345: UDP, length 16
16:16:52.414592 IP 10.0.0.1.12345 > 10.0.0.2.12345: UDP, length 16
16:16:52.415207 IP 10.0.0.1.12345 > 10.0.0.2.12345: UDP, length 16
16:16:52.415826 IP 10.0.0.1.12345 > 10.0.0.2.12345: UDP, length 16
16:16:52.416441 IP 10.0.0.1.12345 > 10.0.0.2.12345: UDP, length 16
16:16:52.417055 IP 10.0.0.1.12345 > 10.0.0.2.12345: UDP, length 16
16:16:52.417669 IP 10.0.0.1.12345 > 10.0.0.2.12345: UDP, length 16
16:16:52.418284 IP 10.0.0.1.12345 > 10.0.0.2.12345: UDP, length 16
16:16:52.418884 IP 10.0.0.1.12345 > 10.0.0.2.12345: UDP, length 16
16:16:52.419498 IP 10.0.0.1.12345 > 10.0.0.2.12345: UDP, length 16
16:16:52.420112 IP 10.0.0.1.12345 > 10.0.0.2.12345: UDP, length 16
16:16:52.420728 IP 10.0.0.1.12345 > 10.0.0.2.12345: UDP, length 16
16:16:52.421343 IP 10.0.0.1.12345 > 10.0.0.2.12345: UDP, length 16
16:16:52.421957 IP 10.0.0.1.12345 > 10.0.0.2.12345: UDP, length 16
16:16:52.422572 IP 10.0.0.1.12345 > 10.0.0.2.12345: UDP, length 16
16:16:52.423186 IP 10.0.0.1.12345 > 10.0.0.2.12345: UDP, length 16
16:16:52.423801 IP 10.0.0.1.12345 > 10.0.0.2.12345: UDP, length 16
16:16:52.424417 IP 10.0.0.1.12345 > 10.0.0.2.12345: UDP, length 16
16:16:52.425031 IP 10.0.0.1.12345 > 10.0.0.2.12345: UDP, length 16
16:16:52.425646 IP 10.0.0.1.12345 > 10.0.0.2.12345: UDP, length 16
16:16:52.426261 IP 10.0.0.1.12345 > 10.0.0.2.12345: UDP, length 16
16:16:52.426875 IP 10.0.0.1.12345 > 10.0.0.2.12345: UDP, length 16
16:16:52.427490 IP 10.0.0.1.12345 > 10.0.0.2.12345: UDP, length 16
16:16:52.428105 IP 10.0.0.1.12345 > 10.0.0.2.12345: UDP, length 16
16:16:52.428721 IP 10.0.0.1.12345 > 10.0.0.2.12345: UDP, length 16
16:16:52.429329 IP 10.0.0.1.12345 > 10.0.0.2.12345: UDP, length 16
16:16:52.429944 IP 10.0.0.1.12345 > 10.0.0.2.12345: UDP, length 16
16:16:52.430559 IP 10.0.0.1.12345 > 10.0.0.2.12345: UDP, length 16
16:16:52.431174 IP 10.0.0.1.12345 > 10.0.0.2.12345: UDP, length 16
16:16:52.431789 IP 10.0.0.1.12345 > 10.0.0.2.12345: UDP, length 16
16:16:52.432404 IP 10.0.0.1.12345 > 10.0.0.2.12345: UDP, length 16
16:16:52.433019 IP 10.0.0.1.12345 > 10.0.0.2.12345: UDP, length 16
16:16:52.433633 IP 10.0.0.1.12345 > 10.0.0.2.12345: UDP, length 16
16:16:52.434248 IP 10.0.0.1.12345 > 10.0.0.2.12345: UDP, length 16
16:16:52.434865 IP 10.0.0.1.12345 > 10.0.0.2.12345: UDP, length 16
16:16:52.435480 IP 10.0.0.1.12345 > 10.0.0.2.12345: UDP, length 16
16:16:52.436095 IP 10.0.0.1.12345 > 10.0.0.2.12345: UDP, length 16
16:16:52.436710 IP 10.0.0.1.12345 > 10.0.0.2.12345: UDP, length 16
16:16:52.437325 IP 10.0.0.1.12345 > 10.0.0.2.12345: UDP, length 16
16:16:52.437939 IP 10.0.0.1.12345 > 10.0.0.2.12345: UDP, length 16
16:16:52.438553 IP 10.0.0.1.12345 > 10.0.0.2.12345: UDP, length 16
16:16:52.439168 IP 10.0.0.1.12345 > 10.0.0.2.12345: UDP, length 16
16:16:52.439782 IP 10.0.0.1.12345 > 10.0.0.2.12345: UDP, length 16
16:16:52.440398 IP 10.0.0.1.12345 > 10.0.0.2.12345: UDP, length 16
16:16:52.441013 IP 10.0.0.1.12345 > 10.0.0.2.12345: UDP, length 16
16:16:52.441627 IP 10.0.0.1.12345 > 10.0.0.2.12345: UDP, length 16
16:16:52.442241 IP 10.0.0.1.12345 > 10.0.0.2.12345: UDP, length 16
16:16:52.442857 IP 10.0.0.1.12345 > 10.0.0.2.12345: UDP, length 16
16:16:52.443473 IP 10.0.0.1.12345 > 10.0.0.2.12345: UDP, length 16
16:16:52.444087 IP 10.0.0.1.12345 > 10.0.0.2.12345: UDP, length 16
16:16:52.444702 IP 10.0.0.1.12345 > 10.0.0.2.12345: UDP, length 16
16:16:52.445284 IP 10.0.0.1.12345 > 10.0.0.2.12345: UDP, length 16
16:16:52.445899 IP 10.0.0.1.12345 > 10.0.0.2.12345: UDP, length 16
16:16:52.446513 IP 10.0.0.1.12345 > 10.0.0.2.12345: UDP, length 16
16:16:52.447127 IP 10.0.0.1.12345 > 10.0.0.2.12345: UDP, length 16
16:16:52.447742 IP 10.0.0.1.12345 > 10.0.0.2.12345: UDP, length 16
16:16:52.448359 IP 10.0.0.1.12345 > 10.0.0.2.12345: UDP, length 16
16:16:52.448973 IP 10.0.0.1.12345 > 10.0.0.2.12345: UDP, length 16
16:16:52.449588 IP 10.0.0.1.12345 > 10.0.0.2.12345: UDP, length 16
16:16:52.450202 IP 10.0.0.1.12345 > 10.0.0.2.12345: UDP, length 16
16:16:52.450816 IP 10.0.0.1.12345 > 10.0.0.2.12345: UDP, length 16
16:16:52.451431 IP 10.0.0.1.12345 > 10.0.0.2.12345: UDP, length 16
16:16:52.452045 IP 10.0.0.1.12345 > 10.0.0.2.12345: UDP, length 16
16:16:52.452662 IP 10.0.0.1.12345 > 10.0.0.2.12345: UDP, length 16
16:16:52.453276 IP 10.0.0.1.12345 > 10.0.0.2.12345: UDP, length 16
16:16:52.453893 IP 10.0.0.1.12345 > 10.0.0.2.12345: UDP, length 16
16:16:52.454507 IP 10.0.0.1.12345 > 10.0.0.2.12345: UDP, length 16
16:16:52.455122 IP 10.0.0.1.12345 > 10.0.0.2.12345: UDP, length 16
16:16:52.455737 IP 10.0.0.1.12345 > 10.0.0.2.12345: UDP, length 16
16:16:52.456352 IP 10.0.0.1.12345 > 10.0.0.2.12345: UDP, length 16
16:16:52.456967 IP 10.0.0.1.12345 > 10.0.0.2.12345: UDP, length 16
16:16:52.457582 IP 10.0.0.1.12345 > 10.0.0.2.12345: UDP, length 16
16:16:52.458197 IP 10.0.0.1.12345 > 10.0.0.2.12345: UDP, length 16
16:16:52.458812 IP 10.0.0.1.12345 > 10.0.0.2.12345: UDP, length 16
16:16:52.459425 IP 10.0.0.1.12345 > 10.0.0.2.12345: UDP, length 16
16:16:52.460040 IP 10.0.0.1.12345 > 10.0.0.2.12345: UDP, length 16
16:16:52.460655 IP 10.0.0.1.12345 > 10.0.0.2.12345: UDP, length 16
16:16:52.461237 IP 10.0.0.1.12345 > 10.0.0.2.12345: UDP, length 16
16:16:52.461851 IP 10.0.0.1.12345 > 10.0.0.2.12345: UDP, length 16
16:16:52.462466 IP 10.0.0.1.12345 > 10.0.0.2.12345: UDP, length 16
16:16:52.463081 IP 10.0.0.1.12345 > 10.0.0.2.12345: UDP, length 16
16:16:52.463697 IP 10.0.0.1.12345 > 10.0.0.2.12345: UDP, length 16
16:16:52.464313 IP 10.0.0.1.12345 > 10.0.0.2.12345: UDP, length 16
16:16:52.464928 IP 10.0.0.1.12345 > 10.0.0.2.12345: UDP, length 16
16:16:52.465542 IP 10.0.0.1.12345 > 10.0.0.2.12345: UDP, length 16
16:16:52.466124 IP 10.0.0.1.12345 > 10.0.0.2.12345: UDP, length 16
16:16:52.466737 IP 10.0.0.1.12345 > 10.0.0.2.12345: UDP, length 16
16:16:52.467352 IP 10.0.0.1.12345 > 10.0.0.2.12345: UDP, length 16
16:16:52.467966 IP 10.0.0.1.12345 > 10.0.0.2.12345: UDP, length 16
16:16:52.468582 IP 10.0.0.1.12345 > 10.0.0.2.12345: UDP, length 16
16:16:52.469197 IP 10.0.0.1.12345 > 10.0.0.2.12345: UDP, length 16
16:16:52.469812 IP 10.0.0.1.12345 > 10.0.0.2.12345: UDP, length 16
16:16:52.470427 IP 10.0.0.1.12345 > 10.0.0.2.12345: UDP, length 16
16:16:52.471041 IP 10.0.0.1.12345 > 10.0.0.2.12345: UDP, length 16
16:16:52.471656 IP 10.0.0.1.12345 > 10.0.0.2.12345: UDP, length 16
16:16:52.472273 IP 10.0.0.1.12345 > 10.0.0.2.12345: UDP, length 16
16:16:52.472887 IP 10.0.0.1.12345 > 10.0.0.2.12345: UDP, length 16
16:16:52.473503 IP 10.0.0.1.12345 > 10.0.0.2.12345: UDP, length 16
16:16:52.474117 IP 10.0.0.1.12345 > 10.0.0.2.12345: UDP, length 16
16:16:52.474731 IP 10.0.0.1.12345 > 10.0.0.2.12345: UDP, length 16
16:16:52.475345 IP 10.0.0.1.12345 > 10.0.0.2.12345: UDP, length 16
16:16:52.475962 IP 10.0.0.1.12345 > 10.0.0.2.12345: UDP, length 16
16:16:52.476576 IP 10.0.0.1.12345 > 10.0.0.2.12345: UDP, length 16
16:16:52.477187 IP 10.0.0.1.12345 > 10.0.0.2.12345: UDP, length 16
16:16:52.477796 IP 10.0.0.1.12345 > 10.0.0.2.12345: UDP, length 16
16:16:52.478409 IP 10.0.0.1.12345 > 10.0.0.2.12345: UDP, length 16
16:16:52.479024 IP 10.0.0.1.12345 > 10.0.0.2.12345: UDP, length 16
16:16:52.479637 IP 10.0.0.1.12345 > 10.0.0.2.12345: UDP, length 16
16:16:52.480253 IP 10.0.0.1.12345 > 10.0.0.2.12345: UDP, length 16
16:16:52.480868 IP 10.0.0.1.12345 > 10.0.0.2.12345: UDP, length 16
16:16:52.481483 IP 10.0.0.1.12345 > 10.0.0.2.12345: UDP, length 16
16:16:52.482097 IP 10.0.0.1.12345 > 10.0.0.2.12345: UDP, length 16
16:16:52.482711 IP 10.0.0.1.12345 > 10.0.0.2.12345: UDP, length 16
16:16:52.483326 IP 10.0.0.1.12345 > 10.0.0.2.12345: UDP, length 16
16:16:52.483940 IP 10.0.0.1.12345 > 10.0.0.2.12345: UDP, length 16
16:16:52.484555 IP 10.0.0.1.12345 > 10.0.0.2.12345: UDP, length 16
16:16:52.485170 IP 10.0.0.1.12345 > 10.0.0.2.12345: UDP, length 16
16:16:52.485784 IP 10.0.0.1.12345 > 10.0.0.2.12345: UDP, length 16
16:16:52.486399 IP 10.0.0.1.12345 > 10.0.0.2.12345: UDP, length 16
16:16:52.487015 IP 10.0.0.1.12345 > 10.0.0.2.12345: UDP, length 16
16:16:52.487630 IP 10.0.0.1.12345 > 10.0.0.2.12345: UDP, length 16
16:16:52.488247 IP 10.0.0.1.12345 > 10.0.0.2.12345: UDP, length 16
16:16:52.488862 IP 10.0.0.1.12345 > 10.0.0.2.12345: UDP, length 16
16:16:52.489476 IP 10.0.0.1.12345 > 10.0.0.2.12345: UDP, length 16
16:16:52.490090 IP 10.0.0.1.12345 > 10.0.0.2.12345: UDP, length 16
16:16:52.490704 IP 10.0.0.1.12345 > 10.0.0.2.12345: UDP, length 16
16:16:52.491319 IP 10.0.0.1.12345 > 10.0.0.2.12345: UDP, length 16
16:16:52.491933 IP 10.0.0.1.12345 > 10.0.0.2.12345: UDP, length 16
16:16:52.492547 IP 10.0.0.1.12345 > 10.0.0.2.12345: UDP, length 16
16:16:52.493147 IP 10.0.0.1.12345 > 10.0.0.2.12345: UDP, length 16
16:16:52.493761 IP 10.0.0.1.12345 > 10.0.0.2.12345: UDP, length 16
16:16:52.494376 IP 10.0.0.1.12345 > 10.0.0.2.12345: UDP, length 16
16:16:52.494993 IP 10.0.0.1.12345 > 10.0.0.2.12345: UDP, length 16
16:16:52.495610 IP 10.0.0.1.12345 > 10.0.0.2.12345: UDP, length 16
16:16:52.496245 IP 10.0.0.1.12345 > 10.0.0.2.12345: UDP, length 16
16:16:52.496860 IP 10.0.0.1.12345 > 10.0.0.2.12345: UDP, length 16
16:16:52.497473 IP 10.0.0.1.12345 > 10.0.0.2.12345: UDP, length 16
16:16:52.498089 IP 10.0.0.1.12345 > 10.0.0.2.12345: UDP, length 16
16:16:52.498704 IP 10.0.0.1.12345 > 10.0.0.2.12345: UDP, length 16
16:16:52.499318 IP 10.0.0.1.12345 > 10.0.0.2.12345: UDP, length 16
16:16:52.499932 IP 10.0.0.1.12345 > 10.0.0.2.12345: UDP, length 16
16:16:52.500549 IP 10.0.0.1.12345 > 10.0.0.2.12345: UDP, length 16
16:16:52.501164 IP 10.0.0.1.12345 > 10.0.0.2.12345: UDP, length 16
16:16:52.501778 IP 10.0.0.1.12345 > 10.0.0.2.12345: UDP, length 16
16:16:52.502393 IP 10.0.0.1.12345 > 10.0.0.2.12345: UDP, length 16
16:16:52.503010 IP 10.0.0.1.12345 > 10.0.0.2.12345: UDP, length 16
16:16:52.503625 IP 10.0.0.1.12345 > 10.0.0.2.12345: UDP, length 16
16:16:52.504242 IP 10.0.0.1.12345 > 10.0.0.2.12345: UDP, length 16
16:16:52.504856 IP 10.0.0.1.12345 > 10.0.0.2.12345: UDP, length 16
16:16:52.505472 IP 10.0.0.1.12345 > 10.0.0.2.12345: UDP, length 16
16:16:52.506087 IP 10.0.0.1.12345 > 10.0.0.2.12345: UDP, length 16
16:16:52.506702 IP 10.0.0.1.12345 > 10.0.0.2.12345: UDP, length 16
16:16:52.507317 IP 10.0.0.1.12345 > 10.0.0.2.12345: UDP, length 16
16:16:52.507931 IP 10.0.0.1.12345 > 10.0.0.2.12345: UDP, length 16
16:16:52.508546 IP 10.0.0.1.12345 > 10.0.0.2.12345: UDP, length 16
16:16:52.509147 IP 10.0.0.1.12345 > 10.0.0.2.12345: UDP, length 16
16:16:52.509762 IP 10.0.0.1.12345 > 10.0.0.2.12345: UDP, length 16
16:16:52.510376 IP 10.0.0.1.12345 > 10.0.0.2.12345: UDP, length 16
16:16:52.510991 IP 10.0.0.1.12345 > 10.0.0.2.12345: UDP, length 16
16:16:52.511608 IP 10.0.0.1.12345 > 10.0.0.2.12345: UDP, length 16
16:16:52.512241 IP 10.0.0.1.12345 > 10.0.0.2.12345: UDP, length 16
16:16:52.512856 IP 10.0.0.1.12345 > 10.0.0.2.12345: UDP, length 16
16:16:52.513471 IP 10.0.0.1.12345 > 10.0.0.2.12345: UDP, length 16
16:16:52.514087 IP 10.0.0.1.12345 > 10.0.0.2.12345: UDP, length 16
16:16:52.514687 IP 10.0.0.1.12345 > 10.0.0.2.12345: UDP, length 16
16:16:52.515302 IP 10.0.0.1.12345 > 10.0.0.2.12345: UDP, length 16
16:16:52.515917 IP 10.0.0.1.12345 > 10.0.0.2.12345: UDP, length 16
16:16:52.516532 IP 10.0.0.1.12345 > 10.0.0.2.12345: UDP, length 16
16:16:52.517147 IP 10.0.0.1.12345 > 10.0.0.2.12345: UDP, length 16
16:16:52.517761 IP 10.0.0.1.12345 > 10.0.0.2.12345: UDP, length 16
16:16:52.518376 IP 10.0.0.1.12345 > 10.0.0.2.12345: UDP, length 16
16:16:52.518991 IP 10.0.0.1.12345 > 10.0.0.2.12345: UDP, length 16
16:16:52.519605 IP 10.0.0.1.12345 > 10.0.0.2.12345: UDP, length 16
16:16:52.520224 IP 10.0.0.1.12345 > 10.0.0.2.12345: UDP, length 16
16:16:52.520853 IP 10.0.0.1.12345 > 10.0.0.2.12345: UDP, length 16
16:16:52.521467 IP 10.0.0.1.12345 > 10.0.0.2.12345: UDP, length 16
16:16:52.522083 IP 10.0.0.1.12345 > 10.0.0.2.12345: UDP, length 16
16:16:52.522697 IP 10.0.0.1.12345 > 10.0.0.2.12345: UDP, length 16
16:16:52.523311 IP 10.0.0.1.12345 > 10.0.0.2.12345: UDP, length 16
16:16:52.523926 IP 10.0.0.1.12345 > 10.0.0.2.12345: UDP, length 16
16:16:52.524541 IP 10.0.0.1.12345 > 10.0.0.2.12345: UDP, length 16
16:16:52.525141 IP 10.0.0.1.12345 > 10.0.0.2.12345: UDP, length 16
16:16:52.525756 IP 10.0.0.1.12345 > 10.0.0.2.12345: UDP, length 16
16:16:52.526371 IP 10.0.0.1.12345 > 10.0.0.2.12345: UDP, length 16
16:16:52.526985 IP 10.0.0.1.12345 > 10.0.0.2.12345: UDP, length 16
16:16:52.527600 IP 10.0.0.1.12345 > 10.0.0.2.12345: UDP, length 16
16:16:52.528215 IP 10.0.0.1.12345 > 10.0.0.2.12345: UDP, length 16
16:16:52.528848 IP 10.0.0.1.12345 > 10.0.0.2.12345: UDP, length 16
16:16:52.529463 IP 10.0.0.1.12345 > 10.0.0.2.12345: UDP, length 16
16:16:52.530081 IP 10.0.0.1.12345 > 10.0.0.2.12345: UDP, length 16
16:16:52.530694 IP 10.0.0.1.12345 > 10.0.0.2.12345: UDP, length 16
16:16:52.531309 IP 10.0.0.1.12345 > 10.0.0.2.12345: UDP, length 16
16:16:52.531923 IP 10.0.0.1.12345 > 10.0.0.2.12345: UDP, length 16
16:16:52.532537 IP 10.0.0.1.12345 > 10.0.0.2.12345: UDP, length 16
16:16:52.533152 IP 10.0.0.1.12345 > 10.0.0.2.12345: UDP, length 16
16:16:52.533766 IP 10.0.0.1.12345 > 10.0.0.2.12345: UDP, length 16
16:16:52.534378 IP 10.0.0.1.12345 > 10.0.0.2.12345: UDP, length 16
16:16:52.534992 IP 10.0.0.1.12345 > 10.0.0.2.12345: UDP, length 16
16:16:52.535607 IP 10.0.0.1.12345 > 10.0.0.2.12345: UDP, length 16
16:16:52.536242 IP 10.0.0.1.12345 > 10.0.0.2.12345: UDP, length 16
16:16:52.536857 IP 10.0.0.1.12345 > 10.0.0.2.12345: UDP, length 16
16:16:52.537471 IP 10.0.0.1.12345 > 10.0.0.2.12345: UDP, length 16
16:16:52.538086 IP 10.0.0.1.12345 > 10.0.0.2.12345: UDP, length 16
16:16:52.538700 IP 10.0.0.1.12345 > 10.0.0.2.12345: UDP, length 16
16:16:52.539315 IP 10.0.0.1.12345 > 10.0.0.2.12345: UDP, length 16
16:16:52.539930 IP 10.0.0.1.12345 > 10.0.0.2.12345: UDP, length 16
16:16:52.540545 IP 10.0.0.1.12345 > 10.0.0.2.12345: UDP, length 16
16:16:52.541146 IP 10.0.0.1.12345 > 10.0.0.2.12345: UDP, length 16
16:16:52.541761 IP 10.0.0.1.12345 > 10.0.0.2.12345: UDP, length 16
16:16:52.542375 IP 10.0.0.1.12345 > 10.0.0.2.12345: UDP, length 16
16:16:52.542989 IP 10.0.0.1.12345 > 10.0.0.2.12345: UDP, length 16
16:16:52.543604 IP 10.0.0.1.12345 > 10.0.0.2.12345: UDP, length 16
16:16:52.544224 IP 10.0.0.1.12345 > 10.0.0.2.12345: UDP, length 16
16:16:52.544840 IP 10.0.0.1.12345 > 10.0.0.2.12345: UDP, length 16
16:16:52.545455 IP 10.0.0.1.12345 > 10.0.0.2.12345: UDP, length 16
16:16:52.546069 IP 10.0.0.1.12345 > 10.0.0.2.12345: UDP, length 16

