17:13:31.817358 IP 10.0.0.1.12345 > 10.0.0.2.12345: UDP, length 16
17:13:31.817966 IP 10.0.0.1.12345 > 10.0.0.2.12345: UDP, length 16
17:13:31.818560 IP 10.0.0.1.12345 > 10.0.0.2.12345: UDP, length 16
17:13:31.819154 IP 10.0.0.1.12345 > 10.0.0.2.12345: UDP, length 16
17:13:31.819747 IP 10.0.0.1.12345 > 10.0.0.2.12345: UDP, length 16
17:13:31.820313 IP 10.0.0.1.12345 > 10.0.0.2.12345: UDP, length 16
17:13:31.820903 IP 10.0.0.1.12345 > 10.0.0.2.12345: UDP, length 16
17:13:31.821491 IP 10.0.0.1.12345 > 10.0.0.2.12345: UDP, length 16
17:13:31.822079 IP 10.0.0.1.12345 > 10.0.0.2.12345: UDP, length 16
17:13:31.822671 IP 10.0.0.1.12345 > 10.0.0.2.12345: UDP, length 16
17:13:31.823263 IP 10.0.0.1.12345 > 10.0.0.2.12345: UDP, length 16
17:13:31.823854 IP 10.0.0.1.12345 > 10.0.0.2.12345: UDP, length 16
17:13:31.824435 IP 10.0.0.1.12345 > 10.0.0.2.12345: UDP, length 16
17:13:31.825025 IP 10.0.0.1.12345 > 10.0.0.2.12345: UDP, length 16
17:13:31.825613 IP 10.0.0.1.12345 > 10.0.0.2.12345: UDP, length 16
17:13:31.826198 IP 10.0.0.1.12345 > 10.0.0.2.12345: UDP, length 16
17:13:31.826781 IP 10.0.0.1.12345 > 10.0.0.2.12345: UDP, length 16
17:13:31.827359 IP 10.0.0.1.12345 > 10.0.0.2.12345: UDP, length 16
17:13:31.827934 IP 10.0.0.1.12345 > 10.0.0.2.12345: UDP, length 16
17:13:31.828504 IP 10.0.0.1.12345 > 10.0.0.2.12345: UDP, length 16
17:13:31.829074 IP 10.0.0.1.12345 > 10.0.0.2.12345: UDP, length 16
17:13:31.829643 IP 10.0.0.1.12345 > 10.0.0.2.12345: UDP, length 16
17:13:31.830217 IP 10.0.0.1.12345 > 10.0.0.2.12345: UDP, length 16
17:13:31.830793 IP 10.0.0.1.12345 > 10.0.0.2.12345: UDP, length 16
17:13:31.831380 IP 10.0.0.1.12345 > 10.0.0.2.12345: UDP, length 16
17:13:31.831984 IP 10.0.0.1.12345 > 10.0.0.2.12345: UDP, length 16
17:13:31.832586 IP 10.0.0.1.12345 > 10.0.0.2.12345: UDP, length 16
17:13:31.833212 IP 10.0.0.1.12345 > 10.0.0.2.12345: UDP, length 16
17:13:31.833840 IP 10.0.0.1.12345 > 10.0.0.2.12345: UDP, length 16
17:13:31.834468 IP 10.0.0.1.12345 > 10.0.0.2.12345: UDP, length 16
17:13:31.835096 IP 10.0.0.1.12345 > 10.0.0.2.12345: UDP, length 16
17:13:31.835747 IP 10.0.0.1.12345 > 10.0.0.2.12345: UDP, length 16
17:13:31.836321 IP 10.0.0.1.12345 > 10.0.0.2.12345: UDP, length 16
17:13:31.836948 IP 10.0.0.1.12345 > 10.0.0.2.12345: UDP, length 16
17:13:31.837546 IP 10.0.0.1.12345 > 10.0.0.2.12345: UDP, length 16
17:13:31.838174 IP 10.0.0.1.12345 > 10.0.0.2.12345: UDP, length 16
17:13:31.838801 IP 10.0.0.1.12345 > 10.0.0.2.12345: UDP, length 16
17:13:31.839427 IP 10.0.0.1.12345 > 10.0.0.2.12345: UDP, length 16
17:13:31.840055 IP 10.0.0.1.12345 > 10.0.0.2.12345: UDP, length 16
17:13:31.840658 IP 10.0.0.1.12345 > 10.0.0.2.12345: UDP, length 16
17:13:31.841285 IP 10.0.0.1.12345 > 10.0.0.2.12345: UDP, length 16
17:13:31.841913 IP 10.0.0.1.12345 > 10.0.0.2.12345: UDP, length 16
17:13:31.842543 IP 10.0.0.1.12345 > 10.0.0.2.12345: UDP, length 16
17:13:31.843160 IP 10.0.0.1.12345 > 10.0.0.2.12345: UDP, length 16
17:13:31.843776 IP 10.0.0.1.12345 > 10.0.0.2.12345: UDP, length 16
17:13:31.844391 IP 10.0.0.1.12345 > 10.0.0.2.12345: UDP, length 16
17:13:31.845005 IP 10.0.0.1.12345 > 10.0.0.2.12345: UDP, length 16
17:13:31.845618 IP 10.0.0.1.12345 > 10.0.0.2.12345: UDP, length 16
17:13:31.846231 IP 10.0.0.1.12345 > 10.0.0.2.12345: UDP, length 16
17:13:31.846846 IP 10.0.0.1.12345 > 10.0.0.2.12345: UDP, length 16
17:13:31.847459 IP 10.0.0.1.12345 > 10.0.0.2.12345: UDP, length 16
17:13:31.848074 IP 10.0.0.1.12345 > 10.0.0.2.12345: UDP, length 16
17:13:31.848694 IP 10.0.0.1.12345 > 10.0.0.2.12345: UDP, length 16
17:13:31.849316 IP 10.0.0.1.12345 > 10.0.0.2.12345: UDP, length 16
17:13:31.849937 IP 10.0.0.1.12345 > 10.0.0.2.12345: UDP, length 16
17:13:31.850559 IP 10.0.0.1.12345 > 10.0.0.2.12345: UDP, length 16
17:13:31.851182 IP 10.0.0.1.12345 > 10.0.0.2.12345: UDP, length 16
17:13:31.851806 IP 10.0.0.1.12345 > 10.0.0.2.12345: UDP, length 16
17:13:31.852428 IP 10.0.0.1.12345 > 10.0.0.2.12345: UDP, length 16
17:13:31.853050 IP 10.0.0.1.12345 > 10.0.0.2.12345: UDP, length 16
17:13:31.853672 IP 10.0.0.1.12345 > 10.0.0.2.12345: UDP, length 16
17:13:31.854293 IP 10.0.0.1.12345 > 10.0.0.2.12345: UDP, length 16
17:13:31.854915 IP 10.0.0.1.12345 > 10.0.0.2.12345: UDP, length 16
17:13:31.855537 IP 10.0.0.1.12345 > 10.0.0.2.12345: UDP, length 16
17:13:31.856158 IP 10.0.0.1.12345 > 10.0.0.2.12345: UDP, length 16
17:13:31.856782 IP 10.0.0.1.12345 > 10.0.0.2.12345: UDP, length 16
17:13:31.857404 IP 10.0.0.1.12345 > 10.0.0.2.12345: UDP, length 16
17:13:31.858028 IP 10.0.0.1.12345 > 10.0.0.2.12345: UDP, length 16
17:13:31.858650 IP 10.0.0.1.12345 > 10.0.0.2.12345: UDP, length 16
17:13:31.859272 IP 10.0.0.1.12345 > 10.0.0.2.12345: UDP, length 16
17:13:31.859894 IP 10.0.0.1.12345 > 10.0.0.2.12345: UDP, length 16
17:13:31.860497 IP 10.0.0.1.12345 > 10.0.0.2.12345: UDP, length 16
17:13:31.861107 IP 10.0.0.1.12345 > 10.0.0.2.12345: UDP, length 16
17:13:31.861706 IP 10.0.0.1.12345 > 10.0.0.2.12345: UDP, length 16
17:13:31.862305 IP 10.0.0.1.12345 > 10.0.0.2.12345: UDP, length 16
17:13:31.862904 IP 10.0.0.1.12345 > 10.0.0.2.12345: UDP, length 16
17:13:31.863503 IP 10.0.0.1.12345 > 10.0.0.2.12345: UDP, length 16
17:13:31.864101 IP 10.0.0.1.12345 > 10.0.0.2.12345: UDP, length 16
17:13:31.864720 IP 10.0.0.1.12345 > 10.0.0.2.12345: UDP, length 16
17:13:31.865327 IP 10.0.0.1.12345 > 10.0.0.2.12345: UDP, length 16
17:13:31.865935 IP 10.0.0.1.12345 > 10.0.0.2.12345: UDP, length 16
17:13:31.866536 IP 10.0.0.1.12345 > 10.0.0.2.12345: UDP, length 16
17:13:31.867124 IP 10.0.0.1.12345 > 10.0.0.2.12345: UDP, length 16
17:13:31.867741 IP 10.0.0.1.12345 > 10.0.0.2.12345: UDP, length 16
17:13:31.868364 IP 10.0.0.1.12345 > 10.0.0.2.12345: UDP, length 16
17:13:31.868985 IP 10.0.0.1.12345 > 10.0.0.2.12345: UDP, length 16
17:13:31.869604 IP 10.0.0.1.12345 > 10.0.0.2.12345: UDP, length 16
17:13:31.870229 IP 10.0.0.1.12345 > 10.0.0.2.12345: UDP, length 16
17:13:31.870850 IP 10.0.0.1.12345 > 10.0.0.2.12345: UDP, length 16
17:13:31.871472 IP 10.0.0.1.12345 > 10.0.0.2.12345: UDP, length 16
17:13:31.872093 IP 10.0.0.1.12345 > 10.0.0.2.12345: UDP, length 16
17:13:31.872708 IP 10.0.0.1.12345 > 10.0.0.2.12345: UDP, length 16
17:13:31.873331 IP 10.0.0.1.12345 > 10.0.0.2.12345: UDP, length 16
17:13:31.873952 IP 10.0.0.1.12345 > 10.0.0.2.12345: UDP, length 16
17:13:31.874573 IP 10.0.0.1.12345 > 10.0.0.2.12345: UDP, length 16
17:13:31.875195 IP 10.0.0.1.12345 > 10.0.0.2.12345: UDP, length 16
17:13:31.875821 IP 10.0.0.1.12345 > 10.0.0.2.12345: UDP, length 16
17:13:31.876443 IP 10.0.0.1.12345 > 10.0.0.2.12345: UDP, length 16
17:13:31.877077 IP 10.0.0.1.12345 > 10.0.0.2.12345: UDP, length 16
17:13:31.877713 IP 10.0.0.1.12345 > 10.0.0.2.12345: UDP, length 16
17:13:31.878351 IP 10.0.0.1.12345 > 10.0.0.2.12345: UDP, length 16
17:13:31.878988 IP 10.0.0.1.12345 > 10.0.0.2.12345: UDP, length 16
17:13:31.879625 IP 10.0.0.1.12345 > 10.0.0.2.12345: UDP, length 16
17:13:31.880265 IP 10.0.0.1.12345 > 10.0.0.2.12345: UDP, length 16
17:13:31.880903 IP 10.0.0.1.12345 > 10.0.0.2.12345: UDP, length 16
17:13:31.881539 IP 10.0.0.1.12345 > 10.0.0.2.12345: UDP, length 16
17:13:31.882179 IP 10.0.0.1.12345 > 10.0.0.2.12345: UDP, length 16
17:13:31.882816 IP 10.0.0.1.12345 > 10.0.0.2.12345: UDP, length 16
17:13:31.883416 IP 10.0.0.1.12345 > 10.0.0.2.12345: UDP, length 16
17:13:31.884053 IP 10.0.0.1.12345 > 10.0.0.2.12345: UDP, length 16
17:13:31.884691 IP 10.0.0.1.12345 > 10.0.0.2.12345: UDP, length 16
17:13:31.885328 IP 10.0.0.1.12345 > 10.0.0.2.12345: UDP, length 16
17:13:31.885965 IP 10.0.0.1.12345 > 10.0.0.2.12345: UDP, length 16
17:13:31.886602 IP 10.0.0.1.12345 > 10.0.0.2.12345: UDP, length 16
17:13:31.887248 IP 10.0.0.1.12345 > 10.0.0.2.12345: UDP, length 16
17:13:31.887849 IP 10.0.0.1.12345 > 10.0.0.2.12345: UDP, length 16
17:13:31.888487 IP 10.0.0.1.12345 > 10.0.0.2.12345: UDP, length 16
17:13:31.889125 IP 10.0.0.1.12345 > 10.0.0.2.12345: UDP, length 16
17:13:31.889762 IP 10.0.0.1.12345 > 10.0.0.2.12345: UDP, length 16
17:13:31.890398 IP 10.0.0.1.12345 > 10.0.0.2.12345: UDP, length 16
17:13:31.891035 IP 10.0.0.1.12345 > 10.0.0.2.12345: UDP, length 16
17:13:31.891672 IP 10.0.0.1.12345 > 10.0.0.2.12345: UDP, length 16
17:13:31.892310 IP 10.0.0.1.12345 > 10.0.0.2.12345: UDP, length 16
17:13:31.892937 IP 10.0.0.1.12345 > 10.0.0.2.12345: UDP, length 16
17:13:31.893574 IP 10.0.0.1.12345 > 10.0.0.2.12345: UDP, length 16
17:13:31.894211 IP 10.0.0.1.12345 > 10.0.0.2.12345: UDP, length 16
17:13:31.894831 IP 10.0.0.1.12345 > 10.0.0.2.12345: UDP, length 16
17:13:31.895422 IP 10.0.0.1.12345 > 10.0.0.2.12345: UDP, length 16
17:13:31.896056 IP 10.0.0.1.12345 > 10.0.0.2.12345: UDP, length 16
17:13:31.896697 IP 10.0.0.1.12345 > 10.0.0.2.12345: UDP, length 16
17:13:31.897358 IP 10.0.0.1.12345 > 10.0.0.2.12345: UDP, length 16
17:13:31.897999 IP 10.0.0.1.12345 > 10.0.0.2.12345: UDP, length 16
17:13:31.898641 IP 10.0.0.1.12345 > 10.0.0.2.12345: UDP, length 16
17:13:31.899291 IP 10.0.0.1.12345 > 10.0.0.2.12345: UDP, length 16
17:13:31.899934 IP 10.0.0.1.12345 > 10.0.0.2.12345: UDP, length 16
17:13:31.900577 IP 10.0.0.1.12345 > 10.0.0.2.12345: UDP, length 16
17:13:31.901219 IP 10.0.0.1.12345 > 10.0.0.2.12345: UDP, length 16
17:13:31.901861 IP 10.0.0.1.12345 > 10.0.0.2.12345: UDP, length 16
17:13:31.902502 IP 10.0.0.1.12345 > 10.0.0.2.12345: UDP, length 16
17:13:31.903145 IP 10.0.0.1.12345 > 10.0.0.2.12345: UDP, length 16
17:13:31.903791 IP 10.0.0.1.12345 > 10.0.0.2.12345: UDP, length 16
17:13:31.904440 IP 10.0.0.1.12345 > 10.0.0.2.12345: UDP, length 16
17:13:31.905087 IP 10.0.0.1.12345 > 10.0.0.2.12345: UDP, length 16
17:13:31.905733 IP 10.0.0.1.12345 > 10.0.0.2.12345: UDP, length 16
17:13:31.906380 IP 10.0.0.1.12345 > 10.0.0.2.12345: UDP, length 16
17:13:31.907027 IP 10.0.0.1.12345 > 10.0.0.2.12345: UDP, length 16
17:13:31.907673 IP 10.0.0.1.12345 > 10.0.0.2.12345: UDP, length 16
17:13:31.908324 IP 10.0.0.1.12345 > 10.0.0.2.12345: UDP, length 16
17:13:31.908971 IP 10.0.0.1.12345 > 10.0.0.2.12345: UDP, length 16
17:13:31.909610 IP 10.0.0.1.12345 > 10.0.0.2.12345: UDP, length 16
17:13:31.910225 IP 10.0.0.1.12345 > 10.0.0.2.12345: UDP, length 16
17:13:31.910861 IP 10.0.0.1.12345 > 10.0.0.2.12345: UDP, length 16
17:13:31.911508 IP 10.0.0.1.12345 > 10.0.0.2.12345: UDP, length 16
17:13:31.912158 IP 10.0.0.1.12345 > 10.0.0.2.12345: UDP, length 16
17:13:31.912805 IP 10.0.0.1.12345 > 10.0.0.2.12345: UDP, length 16
17:13:31.913451 IP 10.0.0.1.12345 > 10.0.0.2.12345: UDP, length 16
17:13:31.914097 IP 10.0.0.1.12345 > 10.0.0.2.12345: UDP, length 16
17:13:31.914744 IP 10.0.0.1.12345 > 10.0.0.2.12345: UDP, length 16
17:13:31.915377 IP 10.0.0.1.12345 > 10.0.0.2.12345: UDP, length 16
17:13:31.916023 IP 10.0.0.1.12345 > 10.0.0.2.12345: UDP, length 16
17:13:31.916673 IP 10.0.0.1.12345 > 10.0.0.2.12345: UDP, length 16
17:13:31.917321 IP 10.0.0.1.12345 > 10.0.0.2.12345: UDP, length 16
17:13:31.917971 IP 10.0.0.1.12345 > 10.0.0.2.12345: UDP, length 16
17:13:31.918618 IP 10.0.0.1.12345 > 10.0.0.2.12345: UDP, length 16
17:13:31.919266 IP 10.0.0.1.12345 > 10.0.0.2.12345: UDP, length 16
17:13:31.919915 IP 10.0.0.1.12345 > 10.0.0.2.12345: UDP, length 16
17:13:31.920565 IP 10.0.0.1.12345 > 10.0.0.2.12345: UDP, length 16
17:13:31.921213 IP 10.0.0.1.12345 > 10.0.0.2.12345: UDP, length 16
17:13:31.921860 IP 10.0.0.1.12345 > 10.0.0.2.12345: UDP, length 16
17:13:31.922506 IP 10.0.0.1.12345 > 10.0.0.2.12345: UDP, length 16
17:13:31.923154 IP 10.0.0.1.12345 > 10.0.0.2.12345: UDP, length 16
17:13:31.923801 IP 10.0.0.1.12345 > 10.0.0.2.12345: UDP, length 16
17:13:31.924450 IP 10.0.0.1.12345 > 10.0.0.2.12345: UDP, length 16
17:13:31.925097 IP 10.0.0.1.12345 > 10.0.0.2.12345: UDP, length 16
17:13:31.925742 IP 10.0.0.1.12345 > 10.0.0.2.12345: UDP, length 16
17:13:31.926390 IP 10.0.0.1.12345 > 10.0.0.2.12345: UDP, length 16
17:13:31.927036 IP 10.0.0.1.12345 > 10.0.0.2.12345: UDP, length 16
17:13:31.927649 IP 10.0.0.1.12345 > 10.0.0.2.12345: UDP, length 16
17:13:31.928300 IP 10.0.0.1.12345 > 10.0.0.2.12345: UDP, length 16
17:13:31.928948 IP 10.0.0.1.12345 > 10.0.0.2.12345: UDP, length 16
17:13:31.929594 IP 10.0.0.1.12345 > 10.0.0.2.12345: UDP, length 16
17:13:31.930242 IP 10.0.0.1.12345 > 10.0.0.2.12345: UDP, length 16
17:13:31.930889 IP 10.0.0.1.12345 > 10.0.0.2.12345: UDP, length 16
17:13:31.931535 IP 10.0.0.1.12345 > 10.0.0.2.12345: UDP, length 16
17:13:31.932182 IP 10.0.0.1.12345 > 10.0.0.2.12345: UDP, length 16
17:13:31.932846 IP 10.0.0.1.12345 > 10.0.0.2.12345: UDP, length 16
17:13:31.933493 IP 10.0.0.1.12345 > 10.0.0.2.12345: UDP, length 16
17:13:31.934139 IP 10.0.0.1.12345 > 10.0.0.2.12345: UDP, length 16
17:13:31.934786 IP 10.0.0.1.12345 > 10.0.0.2.12345: UDP, length 16
17:13:31.935433 IP 10.0.0.1.12345 > 10.0.0.2.12345: UDP, length 16
17:13:31.936084 IP 10.0.0.1.12345 > 10.0.0.2.12345: UDP, length 16
17:13:31.936722 IP 10.0.0.1.12345 > 10.0.0.2.12345: UDP, length 16
17:13:31.937369 IP 10.0.0.1.12345 > 10.0.0.2.12345: UDP, length 16
17:13:31.938016 IP 10.0.0.1.12345 > 10.0.0.2.12345: UDP, length 16
17:13:31.938664 IP 10.0.0.1.12345 > 10.0.0.2.12345: UDP, length 16
17:13:31.939312 IP 10.0.0.1.12345 > 10.0.0.2.12345: UDP, length 16
17:13:31.939958 IP 10.0.0.1.12345 > 10.0.0.2.12345: UDP, length 16
17:13:31.940609 IP 10.0.0.1.12345 > 10.0.0.2.12345: UDP, length 16
17:13:31.941256 IP 10.0.0.1.12345 > 10.0.0.2.12345: UDP, length 16
17:13:31.941903 IP 10.0.0.1.12345 > 10.0.0.2.12345: UDP, length 16
17:13:31.942549 IP 10.0.0.1.12345 > 10.0.0.2.12345: UDP, length 16
17:13:31.943195 IP 10.0.0.1.12345 > 10.0.0.2.12345: UDP, length 16
17:13:31.943843 IP 10.0.0.1.12345 > 10.0.0.2.12345: UDP, length 16
17:13:31.944492 IP 10.0.0.1.12345 > 10.0.0.2.12345: UDP, length 16
17:13:31.945139 IP 10.0.0.1.12345 > 10.0.0.2.12345: UDP, length 16
17:13:31.945786 IP 10.0.0.1.12345 > 10.0.0.2.12345: UDP, length 16
17:13:31.946433 IP 10.0.0.1.12345 > 10.0.0.2.12345: UDP, length 16
17:13:31.947080 IP 10.0.0.1.12345 > 10.0.0.2.12345: UDP, length 16
17:13:31.947721 IP 10.0.0.1.12345 > 10.0.0.2.12345: UDP, length 16
17:13:31.948380 IP 10.0.0.1.12345 > 10.0.0.2.12345: UDP, length 16
17:13:31.949028 IP 10.0.0.1.12345 > 10.0.0.2.12345: UDP, length 16
17:13:31.949675 IP 10.0.0.1.12345 > 10.0.0.2.12345: UDP, length 16
17:13:31.950322 IP 10.0.0.1.12345 > 10.0.0.2.12345: UDP, length 16
17:13:31.950969 IP 10.0.0.1.12345 > 10.0.0.2.12345: UDP, length 16
17:13:31.951616 IP 10.0.0.1.12345 > 10.0.0.2.12345: UDP, length 16
17:13:31.952265 IP 10.0.0.1.12345 > 10.0.0.2.12345: UDP, length 16
17:13:31.952873 IP 10.0.0.1.12345 > 10.0.0.2.12345: UDP, length 16
17:13:31.953520 IP 10.0.0.1.12345 > 10.0.0.2.12345: UDP, length 16
17:13:31.954169 IP 10.0.0.1.12345 > 10.0.0.2.12345: UDP, length 16
17:13:31.954815 IP 10.0.0.1.12345 > 10.0.0.2.12345: UDP, length 16
17:13:31.955462 IP 10.0.0.1.12345 > 10.0.0.2.12345: UDP, length 16
17:13:31.956109 IP 10.0.0.1.12345 > 10.0.0.2.12345: UDP, length 16
17:13:31.956757 IP 10.0.0.1.12345 > 10.0.0.2.12345: UDP, length 16
17:13:31.957404 IP 10.0.0.1.12345 > 10.0.0.2.12345: UDP, length 16
17:13:31.958051 IP 10.0.0.1.12345 > 10.0.0.2.12345: UDP, length 16
17:13:31.958697 IP 10.0.0.1.12345 > 10.0.0.2.12345: UDP, length 16
17:13:31.959346 IP 10.0.0.1.12345 > 10.0.0.2.12345: UDP, length 16
17:13:31.959992 IP 10.0.0.1.12345 > 10.0.0.2.12345: UDP, length 16
17:13:31.960625 IP 10.0.0.1.12345 > 10.0.0.2.12345: UDP, length 16
17:13:31.961272 IP 10.0.0.1.12345 > 10.0.0.2.12345: UDP, length 16
17:13:31.961915 IP 10.0.0.1.12345 > 10.0.0.2.12345: UDP, length 16
17:13:31.962568 IP 10.0.0.1.12345 > 10.0.0.2.12345: UDP, length 16
17:13:31.963215 IP 10.0.0.1.12345 > 10.0.0.2.12345: UDP, length 16
17:13:31.963862 IP 10.0.0.1.12345 > 10.0.0.2.12345: UDP, length 16
17:13:31.964511 IP 10.0.0.1.12345 > 10.0.0.2.12345: UDP, length 16
17:13:31.965158 IP 10.0.0.1.12345 > 10.0.0.2.12345: UDP, length 16
17:13:31.965805 IP 10.0.0.1.12345 > 10.0.0.2.12345: UDP, length 16
17:13:31.966452 IP 10.0.0.1.12345 > 10.0.0.2.12345: UDP, length 16
17:13:31.967102 IP 10.0.0.1.12345 > 10.0.0.2.12345: UDP, length 16
17:13:31.967751 IP 10.0.0.1.12345 > 10.0.0.2.12345: UDP, length 16
17:13:31.968402 IP 10.0.0.1.12345 > 10.0.0.2.12345: UDP, length 16
17:13:31.969051 IP 10.0.0.1.12345 > 10.0.0.2.12345: UDP, length 16
17:13:31.969697 IP 10.0.0.1.12345 > 10.0.0.2.12345: UDP, length 16
17:13:31.970345 IP 10.0.0.1.12345 > 10.0.0.2.12345: UDP, length 16
17:13:31.970991 IP 10.0.0.1.12345 > 10.0.0.2.12345: UDP, length 16
17:13:31.971638 IP 10.0.0.1.12345 > 10.0.0.2.12345: UDP, length 16
17:13:31.972291 IP 10.0.0.1.12345 > 10.0.0.2.12345: UDP, length 16
17:13:31.972947 IP 10.0.0.1.12345 > 10.0.0.2.12345: UDP, length 16
17:13:31.973598 IP 10.0.0.1.12345 > 10.0.0.2.12345: UDP, length 16
17:13:31.974245 IP 10.0.0.1.12345 > 10.0.0.2.12345: UDP, length 16
17:13:31.974892 IP 10.0.0.1.12345 > 10.0.0.2.12345: UDP, length 16
17:13:31.975540 IP 10.0.0.1.12345 > 10.0.0.2.12345: UDP, length 16
17:13:31.976187 IP 10.0.0.1.12345 > 10.0.0.2.12345: UDP, length 16
17:13:31.976834 IP 10.0.0.1.12345 > 10.0.0.2.12345: UDP, length 16
17:13:31.977480 IP 10.0.0.1.12345 > 10.0.0.2.12345: UDP, length 16
17:13:31.978127 IP 10.0.0.1.12345 > 10.0.0.2.12345: UDP, length 16
17:13:31.978773 IP 10.0.0.1.12345 > 10.0.0.2.12345: UDP, length 16
17:13:31.979407 IP 10.0.0.1.12345 > 10.0.0.2.12345: UDP, length 16
17:13:31.980042 IP 10.0.0.1.12345 > 10.0.0.2.12345: UDP, length 16
17:13:31.980692 IP 10.0.0.1.12345 > 10.0.0.2.12345: UDP, length 16
17:13:31.981339 IP 10.0.0.1.12345 > 10.0.0.2.12345: UDP, length 16
17:13:31.981985 IP 10.0.0.1.12345 > 10.0.0.2.12345: UDP, length 16
17:13:31.982633 IP 10.0.0.1.12345 > 10.0.0.2.12345: UDP, length 16
17:13:31.983279 IP 10.0.0.1.12345 > 10.0.0.2.12345: UDP, length 16
17:13:31.983927 IP 10.0.0.1.12345 > 10.0.0.2.12345: UDP, length 16
17:13:31.984576 IP 10.0.0.1.12345 > 10.0.0.2.12345: UDP, length 16
17:13:31.985223 IP 10.0.0.1.12345 > 10.0.0.2.12345: UDP, length 16
17:13:31.985870 IP 10.0.0.1.12345 > 10.0.0.2.12345: UDP, length 16
17:13:31.986518 IP 10.0.0.1.12345 > 10.0.0.2.12345: UDP, length 16
17:13:31.987165 IP 10.0.0.1.12345 > 10.0.0.2.12345: UDP, length 16
17:13:31.987813 IP 10.0.0.1.12345 > 10.0.0.2.12345: UDP, length 16
17:13:31.988459 IP 10.0.0.1.12345 > 10.0.0.2.12345: UDP, length 16
17:13:31.989108 IP 10.0.0.1.12345 > 10.0.0.2.12345: UDP, length 16
17:13:31.989756 IP 10.0.0.1.12345 > 10.0.0.2.12345: UDP, length 16
17:13:31.990403 IP 10.0.0.1.12345 > 10.0.0.2.12345: UDP, length 16
17:13:31.991050 IP 10.0.0.1.12345 > 10.0.0.2.12345: UDP, length 16
17:13:31.991697 IP 10.0.0.1.12345 > 10.0.0.2.12345: UDP, length 16
17:13:31.992346 IP 10.0.0.1.12345 > 10.0.0.2.12345: UDP, length 16
17:13:31.992993 IP 10.0.0.1.12345 > 10.0.0.2.12345: UDP, length 16
17:13:31.993640 IP 10.0.0.1.12345 > 10.0.0.2.12345: UDP, length 16
17:13:31.994287 IP 10.0.0.1.12345 > 10.0.0.2.12345: UDP, length 16
17:13:31.994933 IP 10.0.0.1.12345 > 10.0.0.2.12345: UDP, length 16
17:13:31.995579 IP 10.0.0.1.12345 > 10.0.0.2.12345: UDP, length 16
17:13:31.996268 IP 10.0.0.1.12345 > 10.0.0.2.12345: UDP, length 16
17:13:31.996914 IP 10.0.0.1.12345 > 10.0.0.2.12345: UDP, length 16
17:13:31.997561 IP 10.0.0.1.12345 > 10.0.0.2.12345: UDP, length 16
17:13:31.998208 IP 10.0.0.1.12345 > 10.0.0.2.12345: UDP, length 16
17:13:31.998856 IP 10.0.0.1.12345 > 10.0.0.2.12345: UDP, length 16
17:13:31.999504 IP 10.0.0.1.12345 > 10.0.0.2.12345: UDP, length 16
17:13:32.000153 IP 10.0.0.1.12345 > 10.0.0.2.12345: UDP, length 16
17:13:32.000802 IP 10.0.0.1.12345 > 10.0.0.2.12345: UDP, length 16
17:13:32.001450 IP 10.0.0.1.12345 > 10.0.0.2.12345: UDP, length 16
17:13:32.002096 IP 10.0.0.1.12345 > 10.0.0.2.12345: UDP, length 16
17:13:32.002746 IP 10.0.0.1.12345 > 10.0.0.2.12345: UDP, length 16
17:13:32.003394 IP 10.0.0.1.12345 > 10.0.0.2.12345: UDP, length 16
17:13:32.004042 IP 10.0.0.1.12345 > 10.0.0.2.12345: UDP, length 16
17:13:32.004691 IP 10.0.0.1.12345 > 10.0.0.2.12345: UDP, length 16
17:13:32.005337 IP 10.0.0.1.12345 > 10.0.0.2.12345: UDP, length 16
17:13:32.006000 IP 10.0.0.1.12345 > 10.0.0.2.12345: UDP, length 16
17:13:32.006670 IP 10.0.0.1.12345 > 10.0.0.2.12345: UDP, length 16
17:13:32.007340 IP 10.0.0.1.12345 > 10.0.0.2.12345: UDP, length 16
17:13:32.008011 IP 10.0.0.1.12345 > 10.0.0.2.12345: UDP, length 16
17:13:32.008682 IP 10.0.0.1.12345 > 10.0.0.2.12345: UDP, length 16
17:13:32.009351 IP 10.0.0.1.12345 > 10.0.0.2.12345: UDP, length 16
17:13:32.010020 IP 10.0.0.1.12345 > 10.0.0.2.12345: UDP, length 16
17:13:32.010689 IP 10.0.0.1.12345 > 10.0.0.2.12345: UDP, length 16
17:13:32.011349 IP 10.0.0.1.12345 > 10.0.0.2.12345: UDP, length 16
17:13:32.012019 IP 10.0.0.1.12345 > 10.0.0.2.12345: UDP, length 16
17:13:32.012691 IP 10.0.0.1.12345 > 10.0.0.2.12345: UDP, length 16
17:13:32.013325 IP 10.0.0.1.12345 > 10.0.0.2.12345: UDP, length 16
17:13:32.013997 IP 10.0.0.1.12345 > 10.0.0.2.12345: UDP, length 16
17:13:32.014666 IP 10.0.0.1.12345 > 10.0.0.2.12345: UDP, length 16
17:13:32.015336 IP 10.0.0.1.12345 > 10.0.0.2.12345: UDP, length 16
17:13:32.016006 IP 10.0.0.1.12345 > 10.0.0.2.12345: UDP, length 16
17:13:32.016677 IP 10.0.0.1.12345 > 10.0.0.2.12345: UDP, length 16
17:13:32.017348 IP 10.0.0.1.12345 > 10.0.0.2.12345: UDP, length 16
17:13:32.018017 IP 10.0.0.1.12345 > 10.0.0.2.12345: UDP, length 16
17:13:32.018686 IP 10.0.0.1.12345 > 10.0.0.2.12345: UDP, length 16
17:13:32.019354 IP 10.0.0.1.12345 > 10.0.0.2.12345: UDP, length 16
17:13:32.020011 IP 10.0.0.1.12345 > 10.0.0.2.12345: UDP, length 16
17:13:32.020682 IP 10.0.0.1.12345 > 10.0.0.2.12345: UDP, length 16
17:13:32.021352 IP 10.0.0.1.12345 > 10.0.0.2.12345: UDP, length 16
17:13:32.022020 IP 10.0.0.1.12345 > 10.0.0.2.12345: UDP, length 16
17:13:32.022691 IP 10.0.0.1.12345 > 10.0.0.2.12345: UDP, length 16
17:13:32.023362 IP 10.0.0.1.12345 > 10.0.0.2.12345: UDP, length 16
17:13:32.024031 IP 10.0.0.1.12345 > 10.0.0.2.12345: UDP, length 16
17:13:32.024702 IP 10.0.0.1.12345 > 10.0.0.2.12345: UDP, length 16
17:13:32.025372 IP 10.0.0.1.12345 > 10.0.0.2.12345: UDP, length 16
17:13:32.026042 IP 10.0.0.1.12345 > 10.0.0.2.12345: UDP, length 16
17:13:32.026711 IP 10.0.0.1.12345 > 10.0.0.2.12345: UDP, length 16
17:13:32.027367 IP 10.0.0.1.12345 > 10.0.0.2.12345: UDP, length 16
17:13:32.028038 IP 10.0.0.1.12345 > 10.0.0.2.12345: UDP, length 16
17:13:32.028709 IP 10.0.0.1.12345 > 10.0.0.2.12345: UDP, length 16
17:13:32.029379 IP 10.0.0.1.12345 > 10.0.0.2.12345: UDP, length 16
17:13:32.030048 IP 10.0.0.1.12345 > 10.0.0.2.12345: UDP, length 16
17:13:32.030718 IP 10.0.0.1.12345 > 10.0.0.2.12345: UDP, length 16
17:13:32.031387 IP 10.0.0.1.12345 > 10.0.0.2.12345: UDP, length 16
17:13:32.032056 IP 10.0.0.1.12345 > 10.0.0.2.12345: UDP, length 16
17:13:32.032728 IP 10.0.0.1.12345 > 10.0.0.2.12345: UDP, length 16
17:13:32.033398 IP 10.0.0.1.12345 > 10.0.0.2.12345: UDP, length 16
17:13:32.034076 IP 10.0.0.1.12345 > 10.0.0.2.12345: UDP, length 16
17:13:32.034745 IP 10.0.0.1.12345 > 10.0.0.2.12345: UDP, length 16
17:13:32.035415 IP 10.0.0.1.12345 > 10.0.0.2.12345: UDP, length 16
17:13:32.036083 IP 10.0.0.1.12345 > 10.0.0.2.12345: UDP, length 16
17:13:32.036753 IP 10.0.0.1.12345 > 10.0.0.2.12345: UDP, length 16
17:13:32.037423 IP 10.0.0.1.12345 > 10.0.0.2.12345: UDP, length 16
17:13:32.038094 IP 10.0.0.1.12345 > 10.0.0.2.12345: UDP, length 16
17:13:32.038764 IP 10.0.0.1.12345 > 10.0.0.2.12345: UDP, length 16
17:13:32.039434 IP 10.0.0.1.12345 > 10.0.0.2.12345: UDP, length 16
17:13:32.040106 IP 10.0.0.1.12345 > 10.0.0.2.12345: UDP, length 16
17:13:32.040776 IP 10.0.0.1.12345 > 10.0.0.2.12345: UDP, length 16
17:13:32.041447 IP 10.0.0.1.12345 > 10.0.0.2.12345: UDP, length 16
17:13:32.042115 IP 10.0.0.1.12345 > 10.0.0.2.12345: UDP, length 16
17:13:32.042785 IP 10.0.0.1.12345 > 10.0.0.2.12345: UDP, length 16
17:13:32.043441 IP 10.0.0.1.12345 > 10.0.0.2.12345: UDP, length 16
17:13:32.044111 IP 10.0.0.1.12345 > 10.0.0.2.12345: UDP, length 16
17:13:32.044782 IP 10.0.0.1.12345 > 10.0.0.2.12345: UDP, length 16
17:13:32.045454 IP 10.0.0.1.12345 > 10.0.0.2.12345: UDP, length 16
17:13:32.046122 IP 10.0.0.1.12345 > 10.0.0.2.12345: UDP, length 16
17:13:32.046792 IP 10.0.0.1.12345 > 10.0.0.2.12345: UDP, length 16
17:13:32.047461 IP 10.0.0.1.12345 > 10.0.0.2.12345: UDP, length 16
17:13:32.048131 IP 10.0.0.1.12345 > 10.0.0.2.12345: UDP, length 16
17:13:32.048802 IP 10.0.0.1.12345 > 10.0.0.2.12345: UDP, length 16
17:13:32.049471 IP 10.0.0.1.12345 > 10.0.0.2.12345: UDP, length 16
17:13:32.050139 IP 10.0.0.1.12345 > 10.0.0.2.12345: UDP, length 16
17:13:32.050809 IP 10.0.0.1.12345 > 10.0.0.2.12345: UDP, length 16
17:13:32.051478 IP 10.0.0.1.12345 > 10.0.0.2.12345: UDP, length 16
17:13:32.052148 IP 10.0.0.1.12345 > 10.0.0.2.12345: UDP, length 16
17:13:32.052818 IP 10.0.0.1.12345 > 10.0.0.2.12345: UDP, length 16
17:13:32.053487 IP 10.0.0.1.12345 > 10.0.0.2.12345: UDP, length 16
17:13:32.054156 IP 10.0.0.1.12345 > 10.0.0.2.12345: UDP, length 16
17:13:32.054826 IP 10.0.0.1.12345 > 10.0.0.2.12345: UDP, length 16
17:13:32.055495 IP 10.0.0.1.12345 > 10.0.0.2.12345: UDP, length 16
17:13:32.056164 IP 10.0.0.1.12345 > 10.0.0.2.12345: UDP, length 16
17:13:32.056833 IP 10.0.0.1.12345 > 10.0.0.2.12345: UDP, length 16
17:13:32.057503 IP 10.0.0.1.12345 > 10.0.0.2.12345: UDP, length 16
17:13:32.058173 IP 10.0.0.1.12345 > 10.0.0.2.12345: UDP, length 16
17:13:32.058841 IP 10.0.0.1.12345 > 10.0.0.2.12345: UDP, length 16
17:13:32.059497 IP 10.0.0.1.12345 > 10.0.0.2.12345: UDP, length 16
17:13:32.060166 IP 10.0.0.1.12345 > 10.0.0.2.12345: UDP, length 16
17:13:32.060850 IP 10.0.0.1.12345 > 10.0.0.2.12345: UDP, length 16
17:13:32.061521 IP 10.0.0.1.12345 > 10.0.0.2.12345: UDP, length 16
17:13:32.062191 IP 10.0.0.1.12345 > 10.0.0.2.12345: UDP, length 16
17:13:32.062861 IP 10.0.0.1.12345 > 10.0.0.2.12345: UDP, length 16
17:13:32.063531 IP 10.0.0.1.12345 > 10.0.0.2.12345: UDP, length 16
17:13:32.064201 IP 10.0.0.1.12345 > 10.0.0.2.12345: UDP, length 16
17:13:32.064931 IP 10.0.0.1.12345 > 10.0.0.2.12345: UDP, length 16
17:13:32.065601 IP 10.0.0.1.12345 > 10.0.0.2.12345: UDP, length 16
17:13:32.066270 IP 10.0.0.1.12345 > 10.0.0.2.12345: UDP, length 16
17:13:32.066910 IP 10.0.0.1.12345 > 10.0.0.2.12345: UDP, length 16
17:13:32.067552 IP 10.0.0.1.12345 > 10.0.0.2.12345: UDP, length 16
17:13:32.068176 IP 10.0.0.1.12345 > 10.0.0.2.12345: UDP, length 16
17:13:32.068773 IP 10.0.0.1.12345 > 10.0.0.2.12345: UDP, length 16
17:13:32.069396 IP 10.0.0.1.12345 > 10.0.0.2.12345: UDP, length 16
17:13:32.070065 IP 10.0.0.1.12345 > 10.0.0.2.12345: UDP, length 16
17:13:32.070735 IP 10.0.0.1.12345 > 10.0.0.2.12345: UDP, length 16
17:13:32.071406 IP 10.0.0.1.12345 > 10.0.0.2.12345: UDP, length 16
17:13:32.072074 IP 10.0.0.1.12345 > 10.0.0.2.12345: UDP, length 16
17:13:32.072743 IP 10.0.0.1.12345 > 10.0.0.2.12345: UDP, length 16
17:13:32.073412 IP 10.0.0.1.12345 > 10.0.0.2.12345: UDP, length 16
17:13:32.074082 IP 10.0.0.1.12345 > 10.0.0.2.12345: UDP, length 16
17:13:32.074753 IP 10.0.0.1.12345 > 10.0.0.2.12345: UDP, length 16
17:13:32.075407 IP 10.0.0.1.12345 > 10.0.0.2.12345: UDP, length 16
17:13:32.076076 IP 10.0.0.1.12345 > 10.0.0.2.12345: UDP, length 16
17:13:32.076745 IP 10.0.0.1.12345 > 10.0.0.2.12345: UDP, length 16
17:13:32.077416 IP 10.0.0.1.12345 > 10.0.0.2.12345: UDP, length 16
17:13:32.078086 IP 10.0.0.1.12345 > 10.0.0.2.12345: UDP, length 16
17:13:32.078755 IP 10.0.0.1.12345 > 10.0.0.2.12345: UDP, length 16
17:13:32.079423 IP 10.0.0.1.12345 > 10.0.0.2.12345: UDP, length 16
17:13:32.080092 IP 10.0.0.1.12345 > 10.0.0.2.12345: UDP, length 16
17:13:32.080761 IP 10.0.0.1.12345 > 10.0.0.2.12345: UDP, length 16
17:13:32.081430 IP 10.0.0.1.12345 > 10.0.0.2.12345: UDP, length 16
17:13:32.082101 IP 10.0.0.1.12345 > 10.0.0.2.12345: UDP, length 16
17:13:32.082770 IP 10.0.0.1.12345 > 10.0.0.2.12345: UDP, length 16
17:13:32.083439 IP 10.0.0.1.12345 > 10.0.0.2.12345: UDP, length 16
17:13:32.084109 IP 10.0.0.1.12345 > 10.0.0.2.12345: UDP, length 16
17:13:32.084781 IP 10.0.0.1.12345 > 10.0.0.2.12345: UDP, length 16
17:13:32.085449 IP 10.0.0.1.12345 > 10.0.0.2.12345: UDP, length 16
17:13:32.086119 IP 10.0.0.1.12345 > 10.0.0.2.12345: UDP, length 16
17:13:32.086789 IP 10.0.0.1.12345 > 10.0.0.2.12345: UDP, length 16
17:13:32.087457 IP 10.0.0.1.12345 > 10.0.0.2.12345: UDP, length 16
17:13:32.088127 IP 10.0.0.1.12345 > 10.0.0.2.12345: UDP, length 16
17:13:32.088826 IP 10.0.0.1.12345 > 10.0.0.2.12345: UDP, length 16
17:13:32.089434 IP 10.0.0.1.12345 > 10.0.0.2.12345: UDP, length 16
17:13:32.090059 IP 10.0.0.1.12345 > 10.0.0.2.12345: UDP, length 16
17:13:32.090681 IP 10.0.0.1.12345 > 10.0.0.2.12345: UDP, length 16
17:13:32.091316 IP 10.0.0.1.12345 > 10.0.0.2.12345: UDP, length 16
17:13:32.091994 IP 10.0.0.1.12345 > 10.0.0.2.12345: UDP, length 16
17:13:32.092665 IP 10.0.0.1.12345 > 10.0.0.2.12345: UDP, length 16
17:13:32.093333 IP 10.0.0.1.12345 > 10.0.0.2.12345: UDP, length 16
17:13:32.094022 IP 10.0.0.1.12345 > 10.0.0.2.12345: UDP, length 16
17:13:32.094726 IP 10.0.0.1.12345 > 10.0.0.2.12345: UDP, length 16
17:13:32.095406 IP 10.0.0.1.12345 > 10.0.0.2.12345: UDP, length 16
17:13:32.096086 IP 10.0.0.1.12345 > 10.0.0.2.12345: UDP, length 16
17:13:32.096771 IP 10.0.0.1.12345 > 10.0.0.2.12345: UDP, length 16
17:13:32.097453 IP 10.0.0.1.12345 > 10.0.0.2.12345: UDP, length 16
17:13:32.098133 IP 10.0.0.1.12345 > 10.0.0.2.12345: UDP, length 16
17:13:32.098814 IP 10.0.0.1.12345 > 10.0.0.2.12345: UDP, length 16
17:13:32.099494 IP 10.0.0.1.12345 > 10.0.0.2.12345: UDP, length 16
17:13:32.100172 IP 10.0.0.1.12345 > 10.0.0.2.12345: UDP, length 16
17:13:32.100852 IP 10.0.0.1.12345 > 10.0.0.2.12345: UDP, length 16
17:13:32.101533 IP 10.0.0.1.12345 > 10.0.0.2.12345: UDP, length 16
17:13:32.102212 IP 10.0.0.1.12345 > 10.0.0.2.12345: UDP, length 16
17:13:32.102891 IP 10.0.0.1.12345 > 10.0.0.2.12345: UDP, length 16
17:13:32.103571 IP 10.0.0.1.12345 > 10.0.0.2.12345: UDP, length 16
17:13:32.104298 IP 10.0.0.1.12345 > 10.0.0.2.12345: UDP, length 16
17:13:32.104979 IP 10.0.0.1.12345 > 10.0.0.2.12345: UDP, length 16
17:13:32.105658 IP 10.0.0.1.12345 > 10.0.0.2.12345: UDP, length 16
17:13:32.106338 IP 10.0.0.1.12345 > 10.0.0.2.12345: UDP, length 16
17:13:32.107018 IP 10.0.0.1.12345 > 10.0.0.2.12345: UDP, length 16
17:13:32.107698 IP 10.0.0.1.12345 > 10.0.0.2.12345: UDP, length 16
17:13:32.108381 IP 10.0.0.1.12345 > 10.0.0.2.12345: UDP, length 16
17:13:32.109046 IP 10.0.0.1.12345 > 10.0.0.2.12345: UDP, length 16
17:13:32.109725 IP 10.0.0.1.12345 > 10.0.0.2.12345: UDP, length 16
17:13:32.110410 IP 10.0.0.1.12345 > 10.0.0.2.12345: UDP, length 16
17:13:32.111089 IP 10.0.0.1.12345 > 10.0.0.2.12345: UDP, length 16
17:13:32.111769 IP 10.0.0.1.12345 > 10.0.0.2.12345: UDP, length 16
17:13:32.112452 IP 10.0.0.1.12345 > 10.0.0.2.12345: UDP, length 16
17:13:32.113131 IP 10.0.0.1.12345 > 10.0.0.2.12345: UDP, length 16
17:13:32.113811 IP 10.0.0.1.12345 > 10.0.0.2.12345: UDP, length 16
17:13:32.114476 IP 10.0.0.1.12345 > 10.0.0.2.12345: UDP, length 16
17:13:32.115157 IP 10.0.0.1.12345 > 10.0.0.2.12345: UDP, length 16
17:13:32.115837 IP 10.0.0.1.12345 > 10.0.0.2.12345: UDP, length 16
17:13:32.116518 IP 10.0.0.1.12345 > 10.0.0.2.12345: UDP, length 16
17:13:32.117198 IP 10.0.0.1.12345 > 10.0.0.2.12345: UDP, length 16
17:13:32.117877 IP 10.0.0.1.12345 > 10.0.0.2.12345: UDP, length 16
17:13:32.118557 IP 10.0.0.1.12345 > 10.0.0.2.12345: UDP, length 16
17:13:32.119236 IP 10.0.0.1.12345 > 10.0.0.2.12345: UDP, length 16
17:13:32.119914 IP 10.0.0.1.12345 > 10.0.0.2.12345: UDP, length 16
17:13:32.120556 IP 10.0.0.1.12345 > 10.0.0.2.12345: UDP, length 16
17:13:32.121229 IP 10.0.0.1.12345 > 10.0.0.2.12345: UDP, length 16
17:13:32.121887 IP 10.0.0.1.12345 > 10.0.0.2.12345: UDP, length 16
17:13:32.122497 IP 10.0.0.1.12345 > 10.0.0.2.12345: UDP, length 16
17:13:32.123171 IP 10.0.0.1.12345 > 10.0.0.2.12345: UDP, length 16
17:13:32.123850 IP 10.0.0.1.12345 > 10.0.0.2.12345: UDP, length 16
17:13:32.124535 IP 10.0.0.1.12345 > 10.0.0.2.12345: UDP, length 16
17:13:32.125216 IP 10.0.0.1.12345 > 10.0.0.2.12345: UDP, length 16
17:13:32.125895 IP 10.0.0.1.12345 > 10.0.0.2.12345: UDP, length 16
17:13:32.126576 IP 10.0.0.1.12345 > 10.0.0.2.12345: UDP, length 16
17:13:32.127257 IP 10.0.0.1.12345 > 10.0.0.2.12345: UDP, length 16
17:13:32.127937 IP 10.0.0.1.12345 > 10.0.0.2.12345: UDP, length 16
17:13:32.128622 IP 10.0.0.1.12345 > 10.0.0.2.12345: UDP, length 16
17:13:32.129302 IP 10.0.0.1.12345 > 10.0.0.2.12345: UDP, length 16
17:13:32.129987 IP 10.0.0.1.12345 > 10.0.0.2.12345: UDP, length 16
17:13:32.130668 IP 10.0.0.1.12345 > 10.0.0.2.12345: UDP, length 16
17:13:32.131350 IP 10.0.0.1.12345 > 10.0.0.2.12345: UDP, length 16
17:13:32.132030 IP 10.0.0.1.12345 > 10.0.0.2.12345: UDP, length 16
17:13:32.132713 IP 10.0.0.1.12345 > 10.0.0.2.12345: UDP, length 16
17:13:32.133394 IP 10.0.0.1.12345 > 10.0.0.2.12345: UDP, length 16
17:13:32.134075 IP 10.0.0.1.12345 > 10.0.0.2.12345: UDP, length 16
17:13:32.134757 IP 10.0.0.1.12345 > 10.0.0.2.12345: UDP, length 16
17:13:32.135436 IP 10.0.0.1.12345 > 10.0.0.2.12345: UDP, length 16
17:13:32.136116 IP 10.0.0.1.12345 > 10.0.0.2.12345: UDP, length 16
17:13:32.136798 IP 10.0.0.1.12345 > 10.0.0.2.12345: UDP, length 16
17:13:32.137480 IP 10.0.0.1.12345 > 10.0.0.2.12345: UDP, length 16
17:13:32.138162 IP 10.0.0.1.12345 > 10.0.0.2.12345: UDP, length 16
17:13:32.138843 IP 10.0.0.1.12345 > 10.0.0.2.12345: UDP, length 16
17:13:32.139521 IP 10.0.0.1.12345 > 10.0.0.2.12345: UDP, length 16
17:13:32.140202 IP 10.0.0.1.12345 > 10.0.0.2.12345: UDP, length 16
17:13:32.140964 IP 10.0.0.1.12345 > 10.0.0.2.12345: UDP, length 16

