17:13:31.817593 IP 10.0.0.1.12345 > 10.0.0.2.12345: UDP, length 16
17:13:31.817971 IP 10.0.0.1.12345 > 10.0.0.2.12345: UDP, length 16
17:13:31.818564 IP 10.0.0.1.12345 > 10.0.0.2.12345: UDP, length 16
17:13:31.819158 IP 10.0.0.1.12345 > 10.0.0.2.12345: UDP, length 16
17:13:31.819751 IP 10.0.0.1.12345 > 10.0.0.2.12345: UDP, length 16
17:13:31.820317 IP 10.0.0.1.12345 > 10.0.0.2.12345: UDP, length 16
17:13:31.820907 IP 10.0.0.1.12345 > 10.0.0.2.12345: UDP, length 16
17:13:31.821495 IP 10.0.0.1.12345 > 10.0.0.2.12345: UDP, length 16
17:13:31.822083 IP 10.0.0.1.12345 > 10.0.0.2.12345: UDP, length 16
17:13:31.822675 IP 10.0.0.1.12345 > 10.0.0.2.12345: UDP, length 16
17:13:31.823267 IP 10.0.0.1.12345 > 10.0.0.2.12345: UDP, length 16
17:13:31.823858 IP 10.0.0.1.12345 > 10.0.0.2.12345: UDP, length 16
17:13:31.824438 IP 10.0.0.1.12345 > 10.0.0.2.12345: UDP, length 16
17:13:31.825029 IP 10.0.0.1.12345 > 10.0.0.2.12345: UDP, length 16
17:13:31.825617 IP 10.0.0.1.12345 > 10.0.0.2.12345: UDP, length 16
17:13:31.826203 IP 10.0.0.1.12345 > 10.0.0.2.12345: UDP, length 16
17:13:31.826785 IP 10.0.0.1.12345 > 10.0.0.2.12345: UDP, length 16
17:13:31.827363 IP 10.0.0.1.12345 > 10.0.0.2.12345: UDP, length 16
17:13:31.827938 IP 10.0.0.1.12345 > 10.0.0.2.12345: UDP, length 16
17:13:31.828508 IP 10.0.0.1.12345 > 10.0.0.2.12345: UDP, length 16
17:13:31.829081 IP 10.0.0.1.12345 > 10.0.0.2.12345: UDP, length 16
17:13:31.829646 IP 10.0.0.1.12345 > 10.0.0.2.12345: UDP, length 16
17:13:31.830220 IP 10.0.0.1.12345 > 10.0.0.2.12345: UDP, length 16
17:13:31.830796 IP 10.0.0.1.12345 > 10.0.0.2.12345: UDP, length 16
17:13:31.831385 IP 10.0.0.1.12345 > 10.0.0.2.12345: UDP, length 16
17:13:31.831988 IP 10.0.0.1.12345 > 10.0.0.2.12345: UDP, length 16
17:13:31.832590 IP 10.0.0.1.12345 > 10.0.0.2.12345: UDP, length 16
17:13:31.833218 IP 10.0.0.1.12345 > 10.0.0.2.12345: UDP, length 16
17:13:31.833845 IP 10.0.0.1.12345 > 10.0.0.2.12345: UDP, length 16
17:13:31.834474 IP 10.0.0.1.12345 > 10.0.0.2.12345: UDP, length 16
17:13:31.835101 IP 10.0.0.1.12345 > 10.0.0.2.12345: UDP, length 16
17:13:31.835753 IP 10.0.0.1.12345 > 10.0.0.2.12345: UDP, length 16
17:13:31.836326 IP 10.0.0.1.12345 > 10.0.0.2.12345: UDP, length 16
17:13:31.836954 IP 10.0.0.1.12345 > 10.0.0.2.12345: UDP, length 16
17:13:31.837552 IP 10.0.0.1.12345 > 10.0.0.2.12345: UDP, length 16
17:13:31.838179 IP 10.0.0.1.12345 > 10.0.0.2.12345: UDP, length 16
17:13:31.838806 IP 10.0.0.1.12345 > 10.0.0.2.12345: UDP, length 16
17:13:31.839433 IP 10.0.0.1.12345 > 10.0.0.2.12345: UDP, length 16
17:13:31.840060 IP 10.0.0.1.12345 > 10.0.0.2.12345: UDP, length 16
17:13:31.840662 IP 10.0.0.1.12345 > 10.0.0.2.12345: UDP, length 16
17:13:31.841291 IP 10.0.0.1.12345 > 10.0.0.2.12345: UDP, length 16
17:13:31.841918 IP 10.0.0.1.12345 > 10.0.0.2.12345: UDP, length 16
17:13:31.842550 IP 10.0.0.1.12345 > 10.0.0.2.12345: UDP, length 16
17:13:31.843166 IP 10.0.0.1.12345 > 10.0.0.2.12345: UDP, length 16
17:13:31.843782 IP 10.0.0.1.12345 > 10.0.0.2.12345: UDP, length 16
17:13:31.844396 IP 10.0.0.1.12345 > 10.0.0.2.12345: UDP, length 16
17:13:31.845010 IP 10.0.0.1.12345 > 10.0.0.2.12345: UDP, length 16
17:13:31.845623 IP 10.0.0.1.12345 > 10.0.0.2.12345: UDP, length 16
17:13:31.846237 IP 10.0.0.1.12345 > 10.0.0.2.12345: UDP, length 16
17:13:31.846851 IP 10.0.0.1.12345 > 10.0.0.2.12345: UDP, length 16
17:13:31.847465 IP 10.0.0.1.12345 > 10.0.0.2.12345: UDP, length 16
17:13:31.848080 IP 10.0.0.1.12345 > 10.0.0.2.12345: UDP, length 16
17:13:31.848701 IP 10.0.0.1.12345 > 10.0.0.2.12345: UDP, length 16
17:13:31.849322 IP 10.0.0.1.12345 > 10.0.0.2.12345: UDP, length 16
17:13:31.849944 IP 10.0.0.1.12345 > 10.0.0.2.12345: UDP, length 16
17:13:31.850566 IP 10.0.0.1.12345 > 10.0.0.2.12345: UDP, length 16
17:13:31.851188 IP 10.0.0.1.12345 > 10.0.0.2.12345: UDP, length 16
17:13:31.851812 IP 10.0.0.1.12345 > 10.0.0.2.12345: UDP, length 16
17:13:31.852435 IP 10.0.0.1.12345 > 10.0.0.2.12345: UDP, length 16
17:13:31.853057 IP 10.0.0.1.12345 > 10.0.0.2.12345: UDP, length 16
17:13:31.853678 IP 10.0.0.1.12345 > 10.0.0.2.12345: UDP, length 16
17:13:31.854299 IP 10.0.0.1.12345 > 10.0.0.2.12345: UDP, length 16
17:13:31.854922 IP 10.0.0.1.12345 > 10.0.0.2.12345: UDP, length 16
17:13:31.855543 IP 10.0.0.1.12345 > 10.0.0.2.12345: UDP, length 16
17:13:31.856165 IP 10.0.0.1.12345 > 10.0.0.2.12345: UDP, length 16
17:13:31.856789 IP 10.0.0.1.12345 > 10.0.0.2.12345: UDP, length 16
17:13:31.857411 IP 10.0.0.1.12345 > 10.0.0.2.12345: UDP, length 16
17:13:31.858034 IP 10.0.0.1.12345 > 10.0.0.2.12345: UDP, length 16
17:13:31.858656 IP 10.0.0.1.12345 > 10.0.0.2.12345: UDP, length 16
17:13:31.859278 IP 10.0.0.1.12345 > 10.0.0.2.12345: UDP, length 16
17:13:31.859900 IP 10.0.0.1.12345 > 10.0.0.2.12345: UDP, length 16
17:13:31.860506 IP 10.0.0.1.12345 > 10.0.0.2.12345: UDP, length 16
17:13:31.861112 IP 10.0.0.1.12345 > 10.0.0.2.12345: UDP, length 16
17:13:31.861711 IP 10.0.0.1.12345 > 10.0.0.2.12345: UDP, length 16
17:13:31.862310 IP 10.0.0.1.12345 > 10.0.0.2.12345: UDP, length 16
17:13:31.862909 IP 10.0.0.1.12345 > 10.0.0.2.12345: UDP, length 16
17:13:31.863507 IP 10.0.0.1.12345 > 10.0.0.2.12345: UDP, length 16
17:13:31.864106 IP 10.0.0.1.12345 > 10.0.0.2.12345: UDP, length 16
17:13:31.864727 IP 10.0.0.1.12345 > 10.0.0.2.12345: UDP, length 16
17:13:31.865334 IP 10.0.0.1.12345 > 10.0.0.2.12345: UDP, length 16
17:13:31.865942 IP 10.0.0.1.12345 > 10.0.0.2.12345: UDP, length 16
17:13:31.866545 IP 10.0.0.1.12345 > 10.0.0.2.12345: UDP, length 16
17:13:31.867131 IP 10.0.0.1.12345 > 10.0.0.2.12345: UDP, length 16
17:13:31.867747 IP 10.0.0.1.12345 > 10.0.0.2.12345: UDP, length 16
17:13:31.868370 IP 10.0.0.1.12345 > 10.0.0.2.12345: UDP, length 16
17:13:31.868992 IP 10.0.0.1.12345 > 10.0.0.2.12345: UDP, length 16
17:13:31.869610 IP 10.0.0.1.12345 > 10.0.0.2.12345: UDP, length 16
17:13:31.870236 IP 10.0.0.1.12345 > 10.0.0.2.12345: UDP, length 16
17:13:31.870857 IP 10.0.0.1.12345 > 10.0.0.2.12345: UDP, length 16
17:13:31.871478 IP 10.0.0.1.12345 > 10.0.0.2.12345: UDP, length 16
17:13:31.872100 IP 10.0.0.1.12345 > 10.0.0.2.12345: UDP, length 16
17:13:31.872715 IP 10.0.0.1.12345 > 10.0.0.2.12345: UDP, length 16
17:13:31.873337 IP 10.0.0.1.12345 > 10.0.0.2.12345: UDP, length 16
17:13:31.873958 IP 10.0.0.1.12345 > 10.0.0.2.12345: UDP, length 16
17:13:31.874579 IP 10.0.0.1.12345 > 10.0.0.2.12345: UDP, length 16
17:13:31.875202 IP 10.0.0.1.12345 > 10.0.0.2.12345: UDP, length 16
17:13:31.875828 IP 10.0.0.1.12345 > 10.0.0.2.12345: UDP, length 16
17:13:31.876450 IP 10.0.0.1.12345 > 10.0.0.2.12345: UDP, length 16
17:13:31.877085 IP 10.0.0.1.12345 > 10.0.0.2.12345: UDP, length 16
17:13:31.877722 IP 10.0.0.1.12345 > 10.0.0.2.12345: UDP, length 16
17:13:31.878359 IP 10.0.0.1.12345 > 10.0.0.2.12345: UDP, length 16
17:13:31.878997 IP 10.0.0.1.12345 > 10.0.0.2.12345: UDP, length 16
17:13:31.879634 IP 10.0.0.1.12345 > 10.0.0.2.12345: UDP, length 16
17:13:31.880274 IP 10.0.0.1.12345 > 10.0.0.2.12345: UDP, length 16
17:13:31.880911 IP 10.0.0.1.12345 > 10.0.0.2.12345: UDP, length 16
17:13:31.881548 IP 10.0.0.1.12345 > 10.0.0.2.12345: UDP, length 16
17:13:31.882187 IP 10.0.0.1.12345 > 10.0.0.2.12345: UDP, length 16
17:13:31.882824 IP 10.0.0.1.12345 > 10.0.0.2.12345: UDP, length 16
17:13:31.883424 IP 10.0.0.1.12345 > 10.0.0.2.12345: UDP, length 16
17:13:31.884061 IP 10.0.0.1.12345 > 10.0.0.2.12345: UDP, length 16
17:13:31.884699 IP 10.0.0.1.12345 > 10.0.0.2.12345: UDP, length 16
17:13:31.885336 IP 10.0.0.1.12345 > 10.0.0.2.12345: UDP, length 16
17:13:31.885974 IP 10.0.0.1.12345 > 10.0.0.2.12345: UDP, length 16
17:13:31.886611 IP 10.0.0.1.12345 > 10.0.0.2.12345: UDP, length 16
17:13:31.887257 IP 10.0.0.1.12345 > 10.0.0.2.12345: UDP, length 16
17:13:31.887857 IP 10.0.0.1.12345 > 10.0.0.2.12345: UDP, length 16
17:13:31.888496 IP 10.0.0.1.12345 > 10.0.0.2.12345: UDP, length 16
17:13:31.889134 IP 10.0.0.1.12345 > 10.0.0.2.12345: UDP, length 16
17:13:31.889770 IP 10.0.0.1.12345 > 10.0.0.2.12345: UDP, length 16
17:13:31.890407 IP 10.0.0.1.12345 > 10.0.0.2.12345: UDP, length 16
17:13:31.891044 IP 10.0.0.1.12345 > 10.0.0.2.12345: UDP, length 16
17:13:31.891681 IP 10.0.0.1.12345 > 10.0.0.2.12345: UDP, length 16
17:13:31.892318 IP 10.0.0.1.12345 > 10.0.0.2.12345: UDP, length 16
17:13:31.892946 IP 10.0.0.1.12345 > 10.0.0.2.12345: UDP, length 16
17:13:31.893583 IP 10.0.0.1.12345 > 10.0.0.2.12345: UDP, length 16
17:13:31.894220 IP 10.0.0.1.12345 > 10.0.0.2.12345: UDP, length 16
17:13:31.894840 IP 10.0.0.1.12345 > 10.0.0.2.12345: UDP, length 16
17:13:31.895430 IP 10.0.0.1.12345 > 10.0.0.2.12345: UDP, length 16
17:13:31.896065 IP 10.0.0.1.12345 > 10.0.0.2.12345: UDP, length 16
17:13:31.896707 IP 10.0.0.1.12345 > 10.0.0.2.12345: UDP, length 16
17:13:31.897367 IP 10.0.0.1.12345 > 10.0.0.2.12345: UDP, length 16
17:13:31.898008 IP 10.0.0.1.12345 > 10.0.0.2.12345: UDP, length 16
17:13:31.898650 IP 10.0.0.1.12345 > 10.0.0.2.12345: UDP, length 16
17:13:31.899301 IP 10.0.0.1.12345 > 10.0.0.2.12345: UDP, length 16
17:13:31.899944 IP 10.0.0.1.12345 > 10.0.0.2.12345: UDP, length 16
17:13:31.900586 IP 10.0.0.1.12345 > 10.0.0.2.12345: UDP, length 16
17:13:31.901228 IP 10.0.0.1.12345 > 10.0.0.2.12345: UDP, length 16
17:13:31.901870 IP 10.0.0.1.12345 > 10.0.0.2.12345: UDP, length 16
17:13:31.902512 IP 10.0.0.1.12345 > 10.0.0.2.12345: UDP, length 16
17:13:31.903155 IP 10.0.0.1.12345 > 10.0.0.2.12345: UDP, length 16
17:13:31.903801 IP 10.0.0.1.12345 > 10.0.0.2.12345: UDP, length 16
17:13:31.904450 IP 10.0.0.1.12345 > 10.0.0.2.12345: UDP, length 16
17:13:31.905097 IP 10.0.0.1.12345 > 10.0.0.2.12345: UDP, length 16
17:13:31.905743 IP 10.0.0.1.12345 > 10.0.0.2.12345: UDP, length 16
17:13:31.906390 IP 10.0.0.1.12345 > 10.0.0.2.12345: UDP, length 16
17:13:31.907037 IP 10.0.0.1.12345 > 10.0.0.2.12345: UDP, length 16
17:13:31.907683 IP 10.0.0.1.12345 > 10.0.0.2.12345: UDP, length 16
17:13:31.908334 IP 10.0.0.1.12345 > 10.0.0.2.12345: UDP, length 16
17:13:31.908981 IP 10.0.0.1.12345 > 10.0.0.2.12345: UDP, length 16
17:13:31.909620 IP 10.0.0.1.12345 > 10.0.0.2.12345: UDP, length 16
17:13:31.910238 IP 10.0.0.1.12345 > 10.0.0.2.12345: UDP, length 16
17:13:31.910871 IP 10.0.0.1.12345 > 10.0.0.2.12345: UDP, length 16
17:13:31.911518 IP 10.0.0.1.12345 > 10.0.0.2.12345: UDP, length 16
17:13:31.912168 IP 10.0.0.1.12345 > 10.0.0.2.12345: UDP, length 16
17:13:31.912815 IP 10.0.0.1.12345 > 10.0.0.2.12345: UDP, length 16
17:13:31.913461 IP 10.0.0.1.12345 > 10.0.0.2.12345: UDP, length 16
17:13:31.914107 IP 10.0.0.1.12345 > 10.0.0.2.12345: UDP, length 16
17:13:31.914754 IP 10.0.0.1.12345 > 10.0.0.2.12345: UDP, length 16
17:13:31.915387 IP 10.0.0.1.12345 > 10.0.0.2.12345: UDP, length 16
17:13:31.916034 IP 10.0.0.1.12345 > 10.0.0.2.12345: UDP, length 16
17:13:31.916683 IP 10.0.0.1.12345 > 10.0.0.2.12345: UDP, length 16
17:13:31.917331 IP 10.0.0.1.12345 > 10.0.0.2.12345: UDP, length 16
17:13:31.917981 IP 10.0.0.1.12345 > 10.0.0.2.12345: UDP, length 16
17:13:31.918628 IP 10.0.0.1.12345 > 10.0.0.2.12345: UDP, length 16
17:13:31.919276 IP 10.0.0.1.12345 > 10.0.0.2.12345: UDP, length 16
17:13:31.919925 IP 10.0.0.1.12345 > 10.0.0.2.12345: UDP, length 16
17:13:31.920575 IP 10.0.0.1.12345 > 10.0.0.2.12345: UDP, length 16
17:13:31.921223 IP 10.0.0.1.12345 > 10.0.0.2.12345: UDP, length 16
17:13:31.921870 IP 10.0.0.1.12345 > 10.0.0.2.12345: UDP, length 16
17:13:31.922516 IP 10.0.0.1.12345 > 10.0.0.2.12345: UDP, length 16
17:13:31.923164 IP 10.0.0.1.12345 > 10.0.0.2.12345: UDP, length 16
17:13:31.923811 IP 10.0.0.1.12345 > 10.0.0.2.12345: UDP, length 16
17:13:31.924460 IP 10.0.0.1.12345 > 10.0.0.2.12345: UDP, length 16
17:13:31.925107 IP 10.0.0.1.12345 > 10.0.0.2.12345: UDP, length 16
17:13:31.925753 IP 10.0.0.1.12345 > 10.0.0.2.12345: UDP, length 16
17:13:31.926400 IP 10.0.0.1.12345 > 10.0.0.2.12345: UDP, length 16
17:13:31.927046 IP 10.0.0.1.12345 > 10.0.0.2.12345: UDP, length 16
17:13:31.927659 IP 10.0.0.1.12345 > 10.0.0.2.12345: UDP, length 16
17:13:31.928310 IP 10.0.0.1.12345 > 10.0.0.2.12345: UDP, length 16
17:13:31.928958 IP 10.0.0.1.12345 > 10.0.0.2.12345: UDP, length 16
17:13:31.929604 IP 10.0.0.1.12345 > 10.0.0.2.12345: UDP, length 16
17:13:31.930252 IP 10.0.0.1.12345 > 10.0.0.2.12345: UDP, length 16
17:13:31.930899 IP 10.0.0.1.12345 > 10.0.0.2.12345: UDP, length 16
17:13:31.931545 IP 10.0.0.1.12345 > 10.0.0.2.12345: UDP, length 16
17:13:31.932192 IP 10.0.0.1.12345 > 10.0.0.2.12345: UDP, length 16
17:13:31.932856 IP 10.0.0.1.12345 > 10.0.0.2.12345: UDP, length 16
17:13:31.933503 IP 10.0.0.1.12345 > 10.0.0.2.12345: UDP, length 16
17:13:31.934149 IP 10.0.0.1.12345 > 10.0.0.2.12345: UDP, length 16
17:13:31.934796 IP 10.0.0.1.12345 > 10.0.0.2.12345: UDP, length 16
17:13:31.935443 IP 10.0.0.1.12345 > 10.0.0.2.12345: UDP, length 16
17:13:31.936094 IP 10.0.0.1.12345 > 10.0.0.2.12345: UDP, length 16
17:13:31.936731 IP 10.0.0.1.12345 > 10.0.0.2.12345: UDP, length 16
17:13:31.937379 IP 10.0.0.1.12345 > 10.0.0.2.12345: UDP, length 16
17:13:31.938026 IP 10.0.0.1.12345 > 10.0.0.2.12345: UDP, length 16
17:13:31.938674 IP 10.0.0.1.12345 > 10.0.0.2.12345: UDP, length 16
17:13:31.939322 IP 10.0.0.1.12345 > 10.0.0.2.12345: UDP, length 16
17:13:31.939968 IP 10.0.0.1.12345 > 10.0.0.2.12345: UDP, length 16
17:13:31.940619 IP 10.0.0.1.12345 > 10.0.0.2.12345: UDP, length 16
17:13:31.941266 IP 10.0.0.1.12345 > 10.0.0.2.12345: UDP, length 16
17:13:31.941913 IP 10.0.0.1.12345 > 10.0.0.2.12345: UDP, length 16
17:13:31.942559 IP 10.0.0.1.12345 > 10.0.0.2.12345: UDP, length 16
17:13:31.943205 IP 10.0.0.1.12345 > 10.0.0.2.12345: UDP, length 16
17:13:31.943853 IP 10.0.0.1.12345 > 10.0.0.2.12345: UDP, length 16
17:13:31.944502 IP 10.0.0.1.12345 > 10.0.0.2.12345: UDP, length 16
17:13:31.945149 IP 10.0.0.1.12345 > 10.0.0.2.12345: UDP, length 16
17:13:31.945796 IP 10.0.0.1.12345 > 10.0.0.2.12345: UDP, length 16
17:13:31.946443 IP 10.0.0.1.12345 > 10.0.0.2.12345: UDP, length 16
17:13:31.947090 IP 10.0.0.1.12345 > 10.0.0.2.12345: UDP, length 16
17:13:31.947734 IP 10.0.0.1.12345 > 10.0.0.2.12345: UDP, length 16
17:13:31.948390 IP 10.0.0.1.12345 > 10.0.0.2.12345: UDP, length 16
17:13:31.949038 IP 10.0.0.1.12345 > 10.0.0.2.12345: UDP, length 16
17:13:31.949685 IP 10.0.0.1.12345 > 10.0.0.2.12345: UDP, length 16
17:13:31.950332 IP 10.0.0.1.12345 > 10.0.0.2.12345: UDP, length 16
17:13:31.950979 IP 10.0.0.1.12345 > 10.0.0.2.12345: UDP, length 16
17:13:31.951626 IP 10.0.0.1.12345 > 10.0.0.2.12345: UDP, length 16
17:13:31.952275 IP 10.0.0.1.12345 > 10.0.0.2.12345: UDP, length 16
17:13:31.952883 IP 10.0.0.1.12345 > 10.0.0.2.12345: UDP, length 16
17:13:31.953530 IP 10.0.0.1.12345 > 10.0.0.2.12345: UDP, length 16
17:13:31.954179 IP 10.0.0.1.12345 > 10.0.0.2.12345: UDP, length 16
17:13:31.954826 IP 10.0.0.1.12345 > 10.0.0.2.12345: UDP, length 16
17:13:31.955472 IP 10.0.0.1.12345 > 10.0.0.2.12345: UDP, length 16
17:13:31.956119 IP 10.0.0.1.12345 > 10.0.0.2.12345: UDP, length 16
17:13:31.956767 IP 10.0.0.1.12345 > 10.0.0.2.12345: UDP, length 16
17:13:31.957414 IP 10.0.0.1.12345 > 10.0.0.2.12345: UDP, length 16
17:13:31.958061 IP 10.0.0.1.12345 > 10.0.0.2.12345: UDP, length 16
17:13:31.958707 IP 10.0.0.1.12345 > 10.0.0.2.12345: UDP, length 16
17:13:31.959356 IP 10.0.0.1.12345 > 10.0.0.2.12345: UDP, length 16
17:13:31.960002 IP 10.0.0.1.12345 > 10.0.0.2.12345: UDP, length 16
17:13:31.960635 IP 10.0.0.1.12345 > 10.0.0.2.12345: UDP, length 16
17:13:31.961282 IP 10.0.0.1.12345 > 10.0.0.2.12345: UDP, length 16
17:13:31.961928 IP 10.0.0.1.12345 > 10.0.0.2.12345: UDP, length 16
17:13:31.962578 IP 10.0.0.1.12345 > 10.0.0.2.12345: UDP, length 16
17:13:31.963225 IP 10.0.0.1.12345 > 10.0.0.2.12345: UDP, length 16
17:13:31.963872 IP 10.0.0.1.12345 > 10.0.0.2.12345: UDP, length 16
17:13:31.964521 IP 10.0.0.1.12345 > 10.0.0.2.12345: UDP, length 16
17:13:31.965168 IP 10.0.0.1.12345 > 10.0.0.2.12345: UDP, length 16
17:13:31.965815 IP 10.0.0.1.12345 > 10.0.0.2.12345: UDP, length 16
17:13:31.966462 IP 10.0.0.1.12345 > 10.0.0.2.12345: UDP, length 16
17:13:31.967112 IP 10.0.0.1.12345 > 10.0.0.2.12345: UDP, length 16
17:13:31.967761 IP 10.0.0.1.12345 > 10.0.0.2.12345: UDP, length 16
17:13:31.968412 IP 10.0.0.1.12345 > 10.0.0.2.12345: UDP, length 16
17:13:31.969061 IP 10.0.0.1.12345 > 10.0.0.2.12345: UDP, length 16
17:13:31.969707 IP 10.0.0.1.12345 > 10.0.0.2.12345: UDP, length 16
17:13:31.970355 IP 10.0.0.1.12345 > 10.0.0.2.12345: UDP, length 16
17:13:31.971001 IP 10.0.0.1.12345 > 10.0.0.2.12345: UDP, length 16
17:13:31.971648 IP 10.0.0.1.12345 > 10.0.0.2.12345: UDP, length 16
17:13:31.972301 IP 10.0.0.1.12345 > 10.0.0.2.12345: UDP, length 16
17:13:31.972960 IP 10.0.0.1.12345 > 10.0.0.2.12345: UDP, length 16
17:13:31.973609 IP 10.0.0.1.12345 > 10.0.0.2.12345: UDP, length 16
17:13:31.974256 IP 10.0.0.1.12345 > 10.0.0.2.12345: UDP, length 16
17:13:31.974902 IP 10.0.0.1.12345 > 10.0.0.2.12345: UDP, length 16
17:13:31.975550 IP 10.0.0.1.12345 > 10.0.0.2.12345: UDP, length 16
17:13:31.976197 IP 10.0.0.1.12345 > 10.0.0.2.12345: UDP, length 16
17:13:31.976844 IP 10.0.0.1.12345 > 10.0.0.2.12345: UDP, length 16
17:13:31.977490 IP 10.0.0.1.12345 > 10.0.0.2.12345: UDP, length 16
17:13:31.978137 IP 10.0.0.1.12345 > 10.0.0.2.12345: UDP, length 16
17:13:31.978784 IP 10.0.0.1.12345 > 10.0.0.2.12345: UDP, length 16
17:13:31.979417 IP 10.0.0.1.12345 > 10.0.0.2.12345: UDP, length 16
17:13:31.980052 IP 10.0.0.1.12345 > 10.0.0.2.12345: UDP, length 16
17:13:31.980702 IP 10.0.0.1.12345 > 10.0.0.2.12345: UDP, length 16
17:13:31.981349 IP 10.0.0.1.12345 > 10.0.0.2.12345: UDP, length 16
17:13:31.981995 IP 10.0.0.1.12345 > 10.0.0.2.12345: UDP, length 16
17:13:31.982642 IP 10.0.0.1.12345 > 10.0.0.2.12345: UDP, length 16
17:13:31.983289 IP 10.0.0.1.12345 > 10.0.0.2.12345: UDP, length 16
17:13:31.983937 IP 10.0.0.1.12345 > 10.0.0.2.12345: UDP, length 16
17:13:31.984586 IP 10.0.0.1.12345 > 10.0.0.2.12345: UDP, length 16
17:13:31.985233 IP 10.0.0.1.12345 > 10.0.0.2.12345: UDP, length 16
17:13:31.985881 IP 10.0.0.1.12345 > 10.0.0.2.12345: UDP, length 16
17:13:31.986528 IP 10.0.0.1.12345 > 10.0.0.2.12345: UDP, length 16
17:13:31.987175 IP 10.0.0.1.12345 > 10.0.0.2.12345: UDP, length 16
17:13:31.987822 IP 10.0.0.1.12345 > 10.0.0.2.12345: UDP, length 16
17:13:31.988469 IP 10.0.0.1.12345 > 10.0.0.2.12345: UDP, length 16
17:13:31.989118 IP 10.0.0.1.12345 > 10.0.0.2.12345: UDP, length 16
17:13:31.989766 IP 10.0.0.1.12345 > 10.0.0.2.12345: UDP, length 16
17:13:31.990413 IP 10.0.0.1.12345 > 10.0.0.2.12345: UDP, length 16
17:13:31.991060 IP 10.0.0.1.12345 > 10.0.0.2.12345: UDP, length 16
17:13:31.991707 IP 10.0.0.1.12345 > 10.0.0.2.12345: UDP, length 16
17:13:31.992356 IP 10.0.0.1.12345 > 10.0.0.2.12345: UDP, length 16
17:13:31.993003 IP 10.0.0.1.12345 > 10.0.0.2.12345: UDP, length 16
17:13:31.993650 IP 10.0.0.1.12345 > 10.0.0.2.12345: UDP, length 16
17:13:31.994297 IP 10.0.0.1.12345 > 10.0.0.2.12345: UDP, length 16
17:13:31.994943 IP 10.0.0.1.12345 > 10.0.0.2.12345: UDP, length 16
17:13:31.995589 IP 10.0.0.1.12345 > 10.0.0.2.12345: UDP, length 16
17:13:31.996278 IP 10.0.0.1.12345 > 10.0.0.2.12345: UDP, length 16
17:13:31.996924 IP 10.0.0.1.12345 > 10.0.0.2.12345: UDP, length 16
17:13:31.997571 IP 10.0.0.1.12345 > 10.0.0.2.12345: UDP, length 16
17:13:31.998218 IP 10.0.0.1.12345 > 10.0.0.2.12345: UDP, length 16
17:13:31.998866 IP 10.0.0.1.12345 > 10.0.0.2.12345: UDP, length 16
17:13:31.999514 IP 10.0.0.1.12345 > 10.0.0.2.12345: UDP, length 16
17:13:32.000163 IP 10.0.0.1.12345 > 10.0.0.2.12345: UDP, length 16
17:13:32.000812 IP 10.0.0.1.12345 > 10.0.0.2.12345: UDP, length 16
17:13:32.001460 IP 10.0.0.1.12345 > 10.0.0.2.12345: UDP, length 16
17:13:32.002106 IP 10.0.0.1.12345 > 10.0.0.2.12345: UDP, length 16
17:13:32.002756 IP 10.0.0.1.12345 > 10.0.0.2.12345: UDP, length 16
17:13:32.003404 IP 10.0.0.1.12345 > 10.0.0.2.12345: UDP, length 16
17:13:32.004052 IP 10.0.0.1.12345 > 10.0.0.2.12345: UDP, length 16
17:13:32.004701 IP 10.0.0.1.12345 > 10.0.0.2.12345: UDP, length 16
17:13:32.005347 IP 10.0.0.1.12345 > 10.0.0.2.12345: UDP, length 16
17:13:32.006013 IP 10.0.0.1.12345 > 10.0.0.2.12345: UDP, length 16
17:13:32.006683 IP 10.0.0.1.12345 > 10.0.0.2.12345: UDP, length 16
17:13:32.007353 IP 10.0.0.1.12345 > 10.0.0.2.12345: UDP, length 16
17:13:32.008024 IP 10.0.0.1.12345 > 10.0.0.2.12345: UDP, length 16
17:13:32.008695 IP 10.0.0.1.12345 > 10.0.0.2.12345: UDP, length 16
17:13:32.009364 IP 10.0.0.1.12345 > 10.0.0.2.12345: UDP, length 16
17:13:32.010033 IP 10.0.0.1.12345 > 10.0.0.2.12345: UDP, length 16
17:13:32.010702 IP 10.0.0.1.12345 > 10.0.0.2.12345: UDP, length 16
17:13:32.011362 IP 10.0.0.1.12345 > 10.0.0.2.12345: UDP, length 16
17:13:32.012032 IP 10.0.0.1.12345 > 10.0.0.2.12345: UDP, length 16
17:13:32.012704 IP 10.0.0.1.12345 > 10.0.0.2.12345: UDP, length 16
17:13:32.013338 IP 10.0.0.1.12345 > 10.0.0.2.12345: UDP, length 16
17:13:32.014010 IP 10.0.0.1.12345 > 10.0.0.2.12345: UDP, length 16
17:13:32.014679 IP 10.0.0.1.12345 > 10.0.0.2.12345: UDP, length 16
17:13:32.015349 IP 10.0.0.1.12345 > 10.0.0.2.12345: UDP, length 16
17:13:32.016019 IP 10.0.0.1.12345 > 10.0.0.2.12345: UDP, length 16
17:13:32.016690 IP 10.0.0.1.12345 > 10.0.0.2.12345: UDP, length 16
17:13:32.017361 IP 10.0.0.1.12345 > 10.0.0.2.12345: UDP, length 16
17:13:32.018030 IP 10.0.0.1.12345 > 10.0.0.2.12345: UDP, length 16
17:13:32.018698 IP 10.0.0.1.12345 > 10.0.0.2.12345: UDP, length 16
17:13:32.019368 IP 10.0.0.1.12345 > 10.0.0.2.12345: UDP, length 16
17:13:32.020024 IP 10.0.0.1.12345 > 10.0.0.2.12345: UDP, length 16
17:13:32.020695 IP 10.0.0.1.12345 > 10.0.0.2.12345: UDP, length 16
17:13:32.021365 IP 10.0.0.1.12345 > 10.0.0.2.12345: UDP, length 16
17:13:32.022033 IP 10.0.0.1.12345 > 10.0.0.2.12345: UDP, length 16
17:13:32.022704 IP 10.0.0.1.12345 > 10.0.0.2.12345: UDP, length 16
17:13:32.023375 IP 10.0.0.1.12345 > 10.0.0.2.12345: UDP, length 16
17:13:32.024044 IP 10.0.0.1.12345 > 10.0.0.2.12345: UDP, length 16
17:13:32.024715 IP 10.0.0.1.12345 > 10.0.0.2.12345: UDP, length 16
17:13:32.025385 IP 10.0.0.1.12345 > 10.0.0.2.12345: UDP, length 16
17:13:32.026055 IP 10.0.0.1.12345 > 10.0.0.2.12345: UDP, length 16
17:13:32.026724 IP 10.0.0.1.12345 > 10.0.0.2.12345: UDP, length 16
17:13:32.027380 IP 10.0.0.1.12345 > 10.0.0.2.12345: UDP, length 16
17:13:32.028051 IP 10.0.0.1.12345 > 10.0.0.2.12345: UDP, length 16
17:13:32.028722 IP 10.0.0.1.12345 > 10.0.0.2.12345: UDP, length 16
17:13:32.029393 IP 10.0.0.1.12345 > 10.0.0.2.12345: UDP, length 16
17:13:32.030061 IP 10.0.0.1.12345 > 10.0.0.2.12345: UDP, length 16
17:13:32.030731 IP 10.0.0.1.12345 > 10.0.0.2.12345: UDP, length 16
17:13:32.031400 IP 10.0.0.1.12345 > 10.0.0.2.12345: UDP, length 16
17:13:32.032069 IP 10.0.0.1.12345 > 10.0.0.2.12345: UDP, length 16
17:13:32.032741 IP 10.0.0.1.12345 > 10.0.0.2.12345: UDP, length 16
17:13:32.033415 IP 10.0.0.1.12345 > 10.0.0.2.12345: UDP, length 16
17:13:32.034089 IP 10.0.0.1.12345 > 10.0.0.2.12345: UDP, length 16
17:13:32.034758 IP 10.0.0.1.12345 > 10.0.0.2.12345: UDP, length 16
17:13:32.035427 IP 10.0.0.1.12345 > 10.0.0.2.12345: UDP, length 16
17:13:32.036096 IP 10.0.0.1.12345 > 10.0.0.2.12345: UDP, length 16
17:13:32.036766 IP 10.0.0.1.12345 > 10.0.0.2.12345: UDP, length 16
17:13:32.037436 IP 10.0.0.1.12345 > 10.0.0.2.12345: UDP, length 16
17:13:32.038107 IP 10.0.0.1.12345 > 10.0.0.2.12345: UDP, length 16
17:13:32.038777 IP 10.0.0.1.12345 > 10.0.0.2.12345: UDP, length 16
17:13:32.039447 IP 10.0.0.1.12345 > 10.0.0.2.12345: UDP, length 16
17:13:32.040119 IP 10.0.0.1.12345 > 10.0.0.2.12345: UDP, length 16
17:13:32.040789 IP 10.0.0.1.12345 > 10.0.0.2.12345: UDP, length 16
17:13:32.041460 IP 10.0.0.1.12345 > 10.0.0.2.12345: UDP, length 16
17:13:32.042128 IP 10.0.0.1.12345 > 10.0.0.2.12345: UDP, length 16
17:13:32.042798 IP 10.0.0.1.12345 > 10.0.0.2.12345: UDP, length 16
17:13:32.043454 IP 10.0.0.1.12345 > 10.0.0.2.12345: UDP, length 16
17:13:32.044124 IP 10.0.0.1.12345 > 10.0.0.2.12345: UDP, length 16
17:13:32.044795 IP 10.0.0.1.12345 > 10.0.0.2.12345: UDP, length 16
17:13:32.045467 IP 10.0.0.1.12345 > 10.0.0.2.12345: UDP, length 16
17:13:32.046135 IP 10.0.0.1.12345 > 10.0.0.2.12345: UDP, length 16
17:13:32.046805 IP 10.0.0.1.12345 > 10.0.0.2.12345: UDP, length 16
17:13:32.047474 IP 10.0.0.1.12345 > 10.0.0.2.12345: UDP, length 16
17:13:32.048144 IP 10.0.0.1.12345 > 10.0.0.2.12345: UDP, length 16
17:13:32.048815 IP 10.0.0.1.12345 > 10.0.0.2.12345: UDP, length 16
17:13:32.049484 IP 10.0.0.1.12345 > 10.0.0.2.12345: UDP, length 16
17:13:32.050152 IP 10.0.0.1.12345 > 10.0.0.2.12345: UDP, length 16
17:13:32.050822 IP 10.0.0.1.12345 > 10.0.0.2.12345: UDP, length 16
17:13:32.051491 IP 10.0.0.1.12345 > 10.0.0.2.12345: UDP, length 16
17:13:32.052161 IP 10.0.0.1.12345 > 10.0.0.2.12345: UDP, length 16
17:13:32.052831 IP 10.0.0.1.12345 > 10.0.0.2.12345: UDP, length 16
17:13:32.053500 IP 10.0.0.1.12345 > 10.0.0.2.12345: UDP, length 16
17:13:32.054169 IP 10.0.0.1.12345 > 10.0.0.2.12345: UDP, length 16
17:13:32.054839 IP 10.0.0.1.12345 > 10.0.0.2.12345: UDP, length 16
17:13:32.055508 IP 10.0.0.1.12345 > 10.0.0.2.12345: UDP, length 16
17:13:32.056177 IP 10.0.0.1.12345 > 10.0.0.2.12345: UDP, length 16
17:13:32.056846 IP 10.0.0.1.12345 > 10.0.0.2.12345: UDP, length 16
17:13:32.057516 IP 10.0.0.1.12345 > 10.0.0.2.12345: UDP, length 16
17:13:32.058186 IP 10.0.0.1.12345 > 10.0.0.2.12345: UDP, length 16
17:13:32.058854 IP 10.0.0.1.12345 > 10.0.0.2.12345: UDP, length 16
17:13:32.059510 IP 10.0.0.1.12345 > 10.0.0.2.12345: UDP, length 16
17:13:32.060179 IP 10.0.0.1.12345 > 10.0.0.2.12345: UDP, length 16
17:13:32.060864 IP 10.0.0.1.12345 > 10.0.0.2.12345: UDP, length 16
17:13:32.061534 IP 10.0.0.1.12345 > 10.0.0.2.12345: UDP, length 16
17:13:32.062204 IP 10.0.0.1.12345 > 10.0.0.2.12345: UDP, length 16
17:13:32.062874 IP 10.0.0.1.12345 > 10.0.0.2.12345: UDP, length 16
17:13:32.063544 IP 10.0.0.1.12345 > 10.0.0.2.12345: UDP, length 16
17:13:32.064214 IP 10.0.0.1.12345 > 10.0.0.2.12345: UDP, length 16
17:13:32.064944 IP 10.0.0.1.12345 > 10.0.0.2.12345: UDP, length 16
17:13:32.065614 IP 10.0.0.1.12345 > 10.0.0.2.12345: UDP, length 16
17:13:32.066283 IP 10.0.0.1.12345 > 10.0.0.2.12345: UDP, length 16
17:13:32.066924 IP 10.0.0.1.12345 > 10.0.0.2.12345: UDP, length 16
17:13:32.067562 IP 10.0.0.1.12345 > 10.0.0.2.12345: UDP, length 16
17:13:32.068185 IP 10.0.0.1.12345 > 10.0.0.2.12345: UDP, length 16
17:13:32.068783 IP 10.0.0.1.12345 > 10.0.0.2.12345: UDP, length 16
17:13:32.069406 IP 10.0.0.1.12345 > 10.0.0.2.12345: UDP, length 16
17:13:32.070078 IP 10.0.0.1.12345 > 10.0.0.2.12345: UDP, length 16
17:13:32.070747 IP 10.0.0.1.12345 > 10.0.0.2.12345: UDP, length 16
17:13:32.071418 IP 10.0.0.1.12345 > 10.0.0.2.12345: UDP, length 16
17:13:32.072086 IP 10.0.0.1.12345 > 10.0.0.2.12345: UDP, length 16
17:13:32.072756 IP 10.0.0.1.12345 > 10.0.0.2.12345: UDP, length 16
17:13:32.073425 IP 10.0.0.1.12345 > 10.0.0.2.12345: UDP, length 16
17:13:32.074095 IP 10.0.0.1.12345 > 10.0.0.2.12345: UDP, length 16
17:13:32.074765 IP 10.0.0.1.12345 > 10.0.0.2.12345: UDP, length 16
17:13:32.075419 IP 10.0.0.1.12345 > 10.0.0.2.12345: UDP, length 16
17:13:32.076089 IP 10.0.0.1.12345 > 10.0.0.2.12345: UDP, length 16
17:13:32.076757 IP 10.0.0.1.12345 > 10.0.0.2.12345: UDP, length 16
17:13:32.077428 IP 10.0.0.1.12345 > 10.0.0.2.12345: UDP, length 16
17:13:32.078098 IP 10.0.0.1.12345 > 10.0.0.2.12345: UDP, length 16
17:13:32.078768 IP 10.0.0.1.12345 > 10.0.0.2.12345: UDP, length 16
17:13:32.079436 IP 10.0.0.1.12345 > 10.0.0.2.12345: UDP, length 16
17:13:32.080104 IP 10.0.0.1.12345 > 10.0.0.2.12345: UDP, length 16
17:13:32.080774 IP 10.0.0.1.12345 > 10.0.0.2.12345: UDP, length 16
17:13:32.081443 IP 10.0.0.1.12345 > 10.0.0.2.12345: UDP, length 16
17:13:32.082113 IP 10.0.0.1.12345 > 10.0.0.2.12345: UDP, length 16
17:13:32.082783 IP 10.0.0.1.12345 > 10.0.0.2.12345: UDP, length 16
17:13:32.083452 IP 10.0.0.1.12345 > 10.0.0.2.12345: UDP, length 16
17:13:32.084122 IP 10.0.0.1.12345 > 10.0.0.2.12345: UDP, length 16
17:13:32.084793 IP 10.0.0.1.12345 > 10.0.0.2.12345: UDP, length 16
17:13:32.085461 IP 10.0.0.1.12345 > 10.0.0.2.12345: UDP, length 16
17:13:32.086132 IP 10.0.0.1.12345 > 10.0.0.2.12345: UDP, length 16
17:13:32.086801 IP 10.0.0.1.12345 > 10.0.0.2.12345: UDP, length 16
17:13:32.087470 IP 10.0.0.1.12345 > 10.0.0.2.12345: UDP, length 16
17:13:32.088139 IP 10.0.0.1.12345 > 10.0.0.2.12345: UDP, length 16
17:13:32.088844 IP 10.0.0.1.12345 > 10.0.0.2.12345: UDP, length 16
17:13:32.089444 IP 10.0.0.1.12345 > 10.0.0.2.12345: UDP, length 16
17:13:32.090068 IP 10.0.0.1.12345 > 10.0.0.2.12345: UDP, length 16
17:13:32.090691 IP 10.0.0.1.12345 > 10.0.0.2.12345: UDP, length 16
17:13:32.091333 IP 10.0.0.1.12345 > 10.0.0.2.12345: UDP, length 16
17:13:32.092007 IP 10.0.0.1.12345 > 10.0.0.2.12345: UDP, length 16
17:13:32.092678 IP 10.0.0.1.12345 > 10.0.0.2.12345: UDP, length 16
17:13:32.093346 IP 10.0.0.1.12345 > 10.0.0.2.12345: UDP, length 16
17:13:32.094052 IP 10.0.0.1.12345 > 10.0.0.2.12345: UDP, length 16
17:13:32.094740 IP 10.0.0.1.12345 > 10.0.0.2.12345: UDP, length 16
17:13:32.095420 IP 10.0.0.1.12345 > 10.0.0.2.12345: UDP, length 16
17:13:32.096100 IP 10.0.0.1.12345 > 10.0.0.2.12345: UDP, length 16
17:13:32.096785 IP 10.0.0.1.12345 > 10.0.0.2.12345: UDP, length 16
17:13:32.097467 IP 10.0.0.1.12345 > 10.0.0.2.12345: UDP, length 16
17:13:32.098147 IP 10.0.0.1.12345 > 10.0.0.2.12345: UDP, length 16
17:13:32.098828 IP 10.0.0.1.12345 > 10.0.0.2.12345: UDP, length 16
17:13:32.099508 IP 10.0.0.1.12345 > 10.0.0.2.12345: UDP, length 16
17:13:32.100187 IP 10.0.0.1.12345 > 10.0.0.2.12345: UDP, length 16
17:13:32.100866 IP 10.0.0.1.12345 > 10.0.0.2.12345: UDP, length 16
17:13:32.101547 IP 10.0.0.1.12345 > 10.0.0.2.12345: UDP, length 16
17:13:32.102226 IP 10.0.0.1.12345 > 10.0.0.2.12345: UDP, length 16
17:13:32.102905 IP 10.0.0.1.12345 > 10.0.0.2.12345: UDP, length 16
17:13:32.103586 IP 10.0.0.1.12345 > 10.0.0.2.12345: UDP, length 16
17:13:32.104312 IP 10.0.0.1.12345 > 10.0.0.2.12345: UDP, length 16
17:13:32.104993 IP 10.0.0.1.12345 > 10.0.0.2.12345: UDP, length 16
17:13:32.105672 IP 10.0.0.1.12345 > 10.0.0.2.12345: UDP, length 16
17:13:32.106352 IP 10.0.0.1.12345 > 10.0.0.2.12345: UDP, length 16
17:13:32.107032 IP 10.0.0.1.12345 > 10.0.0.2.12345: UDP, length 16
17:13:32.107712 IP 10.0.0.1.12345 > 10.0.0.2.12345: UDP, length 16
17:13:32.108395 IP 10.0.0.1.12345 > 10.0.0.2.12345: UDP, length 16
17:13:32.109060 IP 10.0.0.1.12345 > 10.0.0.2.12345: UDP, length 16
17:13:32.109740 IP 10.0.0.1.12345 > 10.0.0.2.12345: UDP, length 16
17:13:32.110424 IP 10.0.0.1.12345 > 10.0.0.2.12345: UDP, length 16
17:13:32.111103 IP 10.0.0.1.12345 > 10.0.0.2.12345: UDP, length 16
17:13:32.111783 IP 10.0.0.1.12345 > 10.0.0.2.12345: UDP, length 16
17:13:32.112466 IP 10.0.0.1.12345 > 10.0.0.2.12345: UDP, length 16
17:13:32.113145 IP 10.0.0.1.12345 > 10.0.0.2.12345: UDP, length 16
17:13:32.113825 IP 10.0.0.1.12345 > 10.0.0.2.12345: UDP, length 16
17:13:32.114491 IP 10.0.0.1.12345 > 10.0.0.2.12345: UDP, length 16
17:13:32.115171 IP 10.0.0.1.12345 > 10.0.0.2.12345: UDP, length 16
17:13:32.115851 IP 10.0.0.1.12345 > 10.0.0.2.12345: UDP, length 16
17:13:32.116532 IP 10.0.0.1.12345 > 10.0.0.2.12345: UDP, length 16
17:13:32.117212 IP 10.0.0.1.12345 > 10.0.0.2.12345: UDP, length 16
17:13:32.117891 IP 10.0.0.1.12345 > 10.0.0.2.12345: UDP, length 16
17:13:32.118571 IP 10.0.0.1.12345 > 10.0.0.2.12345: UDP, length 16
17:13:32.119250 IP 10.0.0.1.12345 > 10.0.0.2.12345: UDP, length 16
17:13:32.119928 IP 10.0.0.1.12345 > 10.0.0.2.12345: UDP, length 16
17:13:32.120567 IP 10.0.0.1.12345 > 10.0.0.2.12345: UDP, length 16
17:13:32.121243 IP 10.0.0.1.12345 > 10.0.0.2.12345: UDP, length 16
17:13:32.121908 IP 10.0.0.1.12345 > 10.0.0.2.12345: UDP, length 16
17:13:32.122509 IP 10.0.0.1.12345 > 10.0.0.2.12345: UDP, length 16
17:13:32.123187 IP 10.0.0.1.12345 > 10.0.0.2.12345: UDP, length 16
17:13:32.123867 IP 10.0.0.1.12345 > 10.0.0.2.12345: UDP, length 16
17:13:32.124551 IP 10.0.0.1.12345 > 10.0.0.2.12345: UDP, length 16
17:13:32.125232 IP 10.0.0.1.12345 > 10.0.0.2.12345: UDP, length 16
17:13:32.125911 IP 10.0.0.1.12345 > 10.0.0.2.12345: UDP, length 16
17:13:32.126592 IP 10.0.0.1.12345 > 10.0.0.2.12345: UDP, length 16
17:13:32.127273 IP 10.0.0.1.12345 > 10.0.0.2.12345: UDP, length 16
17:13:32.127953 IP 10.0.0.1.12345 > 10.0.0.2.12345: UDP, length 16
17:13:32.128638 IP 10.0.0.1.12345 > 10.0.0.2.12345: UDP, length 16
17:13:32.129319 IP 10.0.0.1.12345 > 10.0.0.2.12345: UDP, length 16
17:13:32.130003 IP 10.0.0.1.12345 > 10.0.0.2.12345: UDP, length 16
17:13:32.130684 IP 10.0.0.1.12345 > 10.0.0.2.12345: UDP, length 16
17:13:32.131366 IP 10.0.0.1.12345 > 10.0.0.2.12345: UDP, length 16
17:13:32.132046 IP 10.0.0.1.12345 > 10.0.0.2.12345: UDP, length 16
17:13:32.132729 IP 10.0.0.1.12345 > 10.0.0.2.12345: UDP, length 16
17:13:32.133410 IP 10.0.0.1.12345 > 10.0.0.2.12345: UDP, length 16
17:13:32.134091 IP 10.0.0.1.12345 > 10.0.0.2.12345: UDP, length 16
17:13:32.134773 IP 10.0.0.1.12345 > 10.0.0.2.12345: UDP, length 16
17:13:32.135452 IP 10.0.0.1.12345 > 10.0.0.2.12345: UDP, length 16
17:13:32.136132 IP 10.0.0.1.12345 > 10.0.0.2.12345: UDP, length 16
17:13:32.136813 IP 10.0.0.1.12345 > 10.0.0.2.12345: UDP, length 16
17:13:32.137496 IP 10.0.0.1.12345 > 10.0.0.2.12345: UDP, length 16
17:13:32.138178 IP 10.0.0.1.12345 > 10.0.0.2.12345: UDP, length 16
17:13:32.138859 IP 10.0.0.1.12345 > 10.0.0.2.12345: UDP, length 16
17:13:32.139538 IP 10.0.0.1.12345 > 10.0.0.2.12345: UDP, length 16
17:13:32.140231 IP 10.0.0.1.12345 > 10.0.0.2.12345: UDP, length 16
17:13:32.140980 IP 10.0.0.1.12345 > 10.0.0.2.12345: UDP, length 16

