15:54:54.293668 IP 10.0.0.1.12345 > 10.0.0.2.12345: UDP, length 16
15:54:54.294364 IP 10.0.0.1.12345 > 10.0.0.2.12345: UDP, length 16
15:54:54.294986 IP 10.0.0.1.12345 > 10.0.0.2.12345: UDP, length 16
15:54:54.295647 IP 10.0.0.1.12345 > 10.0.0.2.12345: UDP, length 16
15:54:54.296271 IP 10.0.0.1.12345 > 10.0.0.2.12345: UDP, length 16
15:54:54.296932 IP 10.0.0.1.12345 > 10.0.0.2.12345: UDP, length 16
15:54:54.297599 IP 10.0.0.1.12345 > 10.0.0.2.12345: UDP, length 16
15:54:54.298249 IP 10.0.0.1.12345 > 10.0.0.2.12345: UDP, length 16
15:54:54.298858 IP 10.0.0.1.12345 > 10.0.0.2.12345: UDP, length 16
15:54:54.299467 IP 10.0.0.1.12345 > 10.0.0.2.12345: UDP, length 16
15:54:54.300064 IP 10.0.0.1.12345 > 10.0.0.2.12345: UDP, length 16
15:54:54.300671 IP 10.0.0.1.12345 > 10.0.0.2.12345: UDP, length 16
15:54:54.301279 IP 10.0.0.1.12345 > 10.0.0.2.12345: UDP, length 16
15:54:54.301890 IP 10.0.0.1.12345 > 10.0.0.2.12345: UDP, length 16
15:54:54.302486 IP 10.0.0.1.12345 > 10.0.0.2.12345: UDP, length 16
15:54:54.303084 IP 10.0.0.1.12345 > 10.0.0.2.12345: UDP, length 16
15:54:54.303679 IP 10.0.0.1.12345 > 10.0.0.2.12345: UDP, length 16
15:54:54.304272 IP 10.0.0.1.12345 > 10.0.0.2.12345: UDP, length 16
15:54:54.304863 IP 10.0.0.1.12345 > 10.0.0.2.12345: UDP, length 16
15:54:54.305454 IP 10.0.0.1.12345 > 10.0.0.2.12345: UDP, length 16
15:54:54.306045 IP 10.0.0.1.12345 > 10.0.0.2.12345: UDP, length 16
15:54:54.306637 IP 10.0.0.1.12345 > 10.0.0.2.12345: UDP, length 16
15:54:54.307229 IP 10.0.0.1.12345 > 10.0.0.2.12345: UDP, length 16
15:54:54.307801 IP 10.0.0.1.12345 > 10.0.0.2.12345: UDP, length 16
15:54:54.308392 IP 10.0.0.1.12345 > 10.0.0.2.12345: UDP, length 16
15:54:54.308984 IP 10.0.0.1.12345 > 10.0.0.2.12345: UDP, length 16
15:54:54.309592 IP 10.0.0.1.12345 > 10.0.0.2.12345: UDP, length 16
15:54:54.310203 IP 10.0.0.1.12345 > 10.0.0.2.12345: UDP, length 16
15:54:54.310817 IP 10.0.0.1.12345 > 10.0.0.2.12345: UDP, length 16
15:54:54.311428 IP 10.0.0.1.12345 > 10.0.0.2.12345: UDP, length 16
15:54:54.312024 IP 10.0.0.1.12345 > 10.0.0.2.12345: UDP, length 16
15:54:54.312633 IP 10.0.0.1.12345 > 10.0.0.2.12345: UDP, length 16
15:54:54.313244 IP 10.0.0.1.12345 > 10.0.0.2.12345: UDP, length 16
15:54:54.313854 IP 10.0.0.1.12345 > 10.0.0.2.12345: UDP, length 16
15:54:54.314464 IP 10.0.0.1.12345 > 10.0.0.2.12345: UDP, length 16
15:54:54.315074 IP 10.0.0.1.12345 > 10.0.0.2.12345: UDP, length 16
15:54:54.315686 IP 10.0.0.1.12345 > 10.0.0.2.12345: UDP, length 16
15:54:54.316297 IP 10.0.0.1.12345 > 10.0.0.2.12345: UDP, length 16
15:54:54.316907 IP 10.0.0.1.12345 > 10.0.0.2.12345: UDP, length 16
15:54:54.317518 IP 10.0.0.1.12345 > 10.0.0.2.12345: UDP, length 16
15:54:54.318128 IP 10.0.0.1.12345 > 10.0.0.2.12345: UDP, length 16
15:54:54.318740 IP 10.0.0.1.12345 > 10.0.0.2.12345: UDP, length 16
15:54:54.319342 IP 10.0.0.1.12345 > 10.0.0.2.12345: UDP, length 16
15:54:54.319953 IP 10.0.0.1.12345 > 10.0.0.2.12345: UDP, length 16
15:54:54.320565 IP 10.0.0.1.12345 > 10.0.0.2.12345: UDP, length 16
15:54:54.321178 IP 10.0.0.1.12345 > 10.0.0.2.12345: UDP, length 16
15:54:54.321789 IP 10.0.0.1.12345 > 10.0.0.2.12345: UDP, length 16
15:54:54.322401 IP 10.0.0.1.12345 > 10.0.0.2.12345: UDP, length 16
15:54:54.323012 IP 10.0.0.1.12345 > 10.0.0.2.12345: UDP, length 16
15:54:54.323624 IP 10.0.0.1.12345 > 10.0.0.2.12345: UDP, length 16
15:54:54.324235 IP 10.0.0.1.12345 > 10.0.0.2.12345: UDP, length 16
15:54:54.324845 IP 10.0.0.1.12345 > 10.0.0.2.12345: UDP, length 16
15:54:54.325455 IP 10.0.0.1.12345 > 10.0.0.2.12345: UDP, length 16
15:54:54.326066 IP 10.0.0.1.12345 > 10.0.0.2.12345: UDP, length 16
15:54:54.326676 IP 10.0.0.1.12345 > 10.0.0.2.12345: UDP, length 16
15:54:54.327286 IP 10.0.0.1.12345 > 10.0.0.2.12345: UDP, length 16
15:54:54.327897 IP 10.0.0.1.12345 > 10.0.0.2.12345: UDP, length 16
15:54:54.328508 IP 10.0.0.1.12345 > 10.0.0.2.12345: UDP, length 16
15:54:54.329119 IP 10.0.0.1.12345 > 10.0.0.2.12345: UDP, length 16
15:54:54.329729 IP 10.0.0.1.12345 > 10.0.0.2.12345: UDP, length 16
15:54:54.330340 IP 10.0.0.1.12345 > 10.0.0.2.12345: UDP, length 16
15:54:54.330949 IP 10.0.0.1.12345 > 10.0.0.2.12345: UDP, length 16
15:54:54.331559 IP 10.0.0.1.12345 > 10.0.0.2.12345: UDP, length 16
15:54:54.332170 IP 10.0.0.1.12345 > 10.0.0.2.12345: UDP, length 16
15:54:54.332780 IP 10.0.0.1.12345 > 10.0.0.2.12345: UDP, length 16
15:54:54.333391 IP 10.0.0.1.12345 > 10.0.0.2.12345: UDP, length 16
15:54:54.334002 IP 10.0.0.1.12345 > 10.0.0.2.12345: UDP, length 16
15:54:54.334613 IP 10.0.0.1.12345 > 10.0.0.2.12345: UDP, length 16
15:54:54.335225 IP 10.0.0.1.12345 > 10.0.0.2.12345: UDP, length 16
15:54:54.335838 IP 10.0.0.1.12345 > 10.0.0.2.12345: UDP, length 16
15:54:54.336449 IP 10.0.0.1.12345 > 10.0.0.2.12345: UDP, length 16
15:54:54.337059 IP 10.0.0.1.12345 > 10.0.0.2.12345: UDP, length 16
15:54:54.337670 IP 10.0.0.1.12345 > 10.0.0.2.12345: UDP, length 16
15:54:54.338282 IP 10.0.0.1.12345 > 10.0.0.2.12345: UDP, length 16
15:54:54.338893 IP 10.0.0.1.12345 > 10.0.0.2.12345: UDP, length 16
15:54:54.339504 IP 10.0.0.1.12345 > 10.0.0.2.12345: UDP, length 16
15:54:54.340115 IP 10.0.0.1.12345 > 10.0.0.2.12345: UDP, length 16
15:54:54.340725 IP 10.0.0.1.12345 > 10.0.0.2.12345: UDP, length 16
15:54:54.341337 IP 10.0.0.1.12345 > 10.0.0.2.12345: UDP, length 16
15:54:54.341949 IP 10.0.0.1.12345 > 10.0.0.2.12345: UDP, length 16
15:54:54.342559 IP 10.0.0.1.12345 > 10.0.0.2.12345: UDP, length 16
15:54:54.343170 IP 10.0.0.1.12345 > 10.0.0.2.12345: UDP, length 16
15:54:54.343781 IP 10.0.0.1.12345 > 10.0.0.2.12345: UDP, length 16
15:54:54.344391 IP 10.0.0.1.12345 > 10.0.0.2.12345: UDP, length 16
15:54:54.345001 IP 10.0.0.1.12345 > 10.0.0.2.12345: UDP, length 16
15:54:54.345612 IP 10.0.0.1.12345 > 10.0.0.2.12345: UDP, length 16
15:54:54.346222 IP 10.0.0.1.12345 > 10.0.0.2.12345: UDP, length 16
15:54:54.346832 IP 10.0.0.1.12345 > 10.0.0.2.12345: UDP, length 16
15:54:54.347444 IP 10.0.0.1.12345 > 10.0.0.2.12345: UDP, length 16
15:54:54.348057 IP 10.0.0.1.12345 > 10.0.0.2.12345: UDP, length 16
15:54:54.348668 IP 10.0.0.1.12345 > 10.0.0.2.12345: UDP, length 16
15:54:54.349278 IP 10.0.0.1.12345 > 10.0.0.2.12345: UDP, length 16
15:54:54.349889 IP 10.0.0.1.12345 > 10.0.0.2.12345: UDP, length 16
15:54:54.350499 IP 10.0.0.1.12345 > 10.0.0.2.12345: UDP, length 16
15:54:54.351109 IP 10.0.0.1.12345 > 10.0.0.2.12345: UDP, length 16
15:54:54.351720 IP 10.0.0.1.12345 > 10.0.0.2.12345: UDP, length 16
15:54:54.352331 IP 10.0.0.1.12345 > 10.0.0.2.12345: UDP, length 16
15:54:54.352942 IP 10.0.0.1.12345 > 10.0.0.2.12345: UDP, length 16
15:54:54.353553 IP 10.0.0.1.12345 > 10.0.0.2.12345: UDP, length 16
15:54:54.354164 IP 10.0.0.1.12345 > 10.0.0.2.12345: UDP, length 16
15:54:54.354775 IP 10.0.0.1.12345 > 10.0.0.2.12345: UDP, length 16
15:54:54.355385 IP 10.0.0.1.12345 > 10.0.0.2.12345: UDP, length 16
15:54:54.355996 IP 10.0.0.1.12345 > 10.0.0.2.12345: UDP, length 16
15:54:54.356607 IP 10.0.0.1.12345 > 10.0.0.2.12345: UDP, length 16
15:54:54.357217 IP 10.0.0.1.12345 > 10.0.0.2.12345: UDP, length 16
15:54:54.357827 IP 10.0.0.1.12345 > 10.0.0.2.12345: UDP, length 16
15:54:54.358438 IP 10.0.0.1.12345 > 10.0.0.2.12345: UDP, length 16
15:54:54.359048 IP 10.0.0.1.12345 > 10.0.0.2.12345: UDP, length 16
15:54:54.359658 IP 10.0.0.1.12345 > 10.0.0.2.12345: UDP, length 16
15:54:54.360242 IP 10.0.0.1.12345 > 10.0.0.2.12345: UDP, length 16
15:54:54.360855 IP 10.0.0.1.12345 > 10.0.0.2.12345: UDP, length 16
15:54:54.361465 IP 10.0.0.1.12345 > 10.0.0.2.12345: UDP, length 16
15:54:54.362076 IP 10.0.0.1.12345 > 10.0.0.2.12345: UDP, length 16
15:54:54.362686 IP 10.0.0.1.12345 > 10.0.0.2.12345: UDP, length 16
15:54:54.363299 IP 10.0.0.1.12345 > 10.0.0.2.12345: UDP, length 16
15:54:54.363911 IP 10.0.0.1.12345 > 10.0.0.2.12345: UDP, length 16
15:54:54.364522 IP 10.0.0.1.12345 > 10.0.0.2.12345: UDP, length 16
15:54:54.365117 IP 10.0.0.1.12345 > 10.0.0.2.12345: UDP, length 16
15:54:54.365683 IP 10.0.0.1.12345 > 10.0.0.2.12345: UDP, length 16
15:54:54.366277 IP 10.0.0.1.12345 > 10.0.0.2.12345: UDP, length 16
15:54:54.366869 IP 10.0.0.1.12345 > 10.0.0.2.12345: UDP, length 16
15:54:54.367465 IP 10.0.0.1.12345 > 10.0.0.2.12345: UDP, length 16
15:54:54.368067 IP 10.0.0.1.12345 > 10.0.0.2.12345: UDP, length 16
15:54:54.368692 IP 10.0.0.1.12345 > 10.0.0.2.12345: UDP, length 16
15:54:54.369322 IP 10.0.0.1.12345 > 10.0.0.2.12345: UDP, length 16
15:54:54.369949 IP 10.0.0.1.12345 > 10.0.0.2.12345: UDP, length 16
15:54:54.370576 IP 10.0.0.1.12345 > 10.0.0.2.12345: UDP, length 16
15:54:54.371204 IP 10.0.0.1.12345 > 10.0.0.2.12345: UDP, length 16
15:54:54.371834 IP 10.0.0.1.12345 > 10.0.0.2.12345: UDP, length 16
15:54:54.372461 IP 10.0.0.1.12345 > 10.0.0.2.12345: UDP, length 16
15:54:54.373089 IP 10.0.0.1.12345 > 10.0.0.2.12345: UDP, length 16
15:54:54.373716 IP 10.0.0.1.12345 > 10.0.0.2.12345: UDP, length 16
15:54:54.374346 IP 10.0.0.1.12345 > 10.0.0.2.12345: UDP, length 16
15:54:54.374974 IP 10.0.0.1.12345 > 10.0.0.2.12345: UDP, length 16
15:54:54.375601 IP 10.0.0.1.12345 > 10.0.0.2.12345: UDP, length 16
15:54:54.376234 IP 10.0.0.1.12345 > 10.0.0.2.12345: UDP, length 16
15:54:54.376863 IP 10.0.0.1.12345 > 10.0.0.2.12345: UDP, length 16
15:54:54.377492 IP 10.0.0.1.12345 > 10.0.0.2.12345: UDP, length 16
15:54:54.378119 IP 10.0.0.1.12345 > 10.0.0.2.12345: UDP, length 16
15:54:54.378747 IP 10.0.0.1.12345 > 10.0.0.2.12345: UDP, length 16
15:54:54.379375 IP 10.0.0.1.12345 > 10.0.0.2.12345: UDP, length 16
15:54:54.379977 IP 10.0.0.1.12345 > 10.0.0.2.12345: UDP, length 16
15:54:54.380605 IP 10.0.0.1.12345 > 10.0.0.2.12345: UDP, length 16
15:54:54.381208 IP 10.0.0.1.12345 > 10.0.0.2.12345: UDP, length 16
15:54:54.381812 IP 10.0.0.1.12345 > 10.0.0.2.12345: UDP, length 16
15:54:54.382428 IP 10.0.0.1.12345 > 10.0.0.2.12345: UDP, length 16
15:54:54.383031 IP 10.0.0.1.12345 > 10.0.0.2.12345: UDP, length 16
15:54:54.383649 IP 10.0.0.1.12345 > 10.0.0.2.12345: UDP, length 16
15:54:54.384269 IP 10.0.0.1.12345 > 10.0.0.2.12345: UDP, length 16
15:54:54.384897 IP 10.0.0.1.12345 > 10.0.0.2.12345: UDP, length 16
15:54:54.385525 IP 10.0.0.1.12345 > 10.0.0.2.12345: UDP, length 16
15:54:54.386152 IP 10.0.0.1.12345 > 10.0.0.2.12345: UDP, length 16
15:54:54.386780 IP 10.0.0.1.12345 > 10.0.0.2.12345: UDP, length 16
15:54:54.387410 IP 10.0.0.1.12345 > 10.0.0.2.12345: UDP, length 16
15:54:54.388037 IP 10.0.0.1.12345 > 10.0.0.2.12345: UDP, length 16
15:54:54.388666 IP 10.0.0.1.12345 > 10.0.0.2.12345: UDP, length 16
15:54:54.389294 IP 10.0.0.1.12345 > 10.0.0.2.12345: UDP, length 16
15:54:54.389922 IP 10.0.0.1.12345 > 10.0.0.2.12345: UDP, length 16
15:54:54.390549 IP 10.0.0.1.12345 > 10.0.0.2.12345: UDP, length 16
15:54:54.391178 IP 10.0.0.1.12345 > 10.0.0.2.12345: UDP, length 16
15:54:54.391823 IP 10.0.0.1.12345 > 10.0.0.2.12345: UDP, length 16
15:54:54.392418 IP 10.0.0.1.12345 > 10.0.0.2.12345: UDP, length 16
15:54:54.393049 IP 10.0.0.1.12345 > 10.0.0.2.12345: UDP, length 16
15:54:54.393680 IP 10.0.0.1.12345 > 10.0.0.2.12345: UDP, length 16
15:54:54.394311 IP 10.0.0.1.12345 > 10.0.0.2.12345: UDP, length 16
15:54:54.394942 IP 10.0.0.1.12345 > 10.0.0.2.12345: UDP, length 16
15:54:54.395573 IP 10.0.0.1.12345 > 10.0.0.2.12345: UDP, length 16
15:54:54.396204 IP 10.0.0.1.12345 > 10.0.0.2.12345: UDP, length 16
15:54:54.396836 IP 10.0.0.1.12345 > 10.0.0.2.12345: UDP, length 16
15:54:54.397469 IP 10.0.0.1.12345 > 10.0.0.2.12345: UDP, length 16
15:54:54.398101 IP 10.0.0.1.12345 > 10.0.0.2.12345: UDP, length 16
15:54:54.398734 IP 10.0.0.1.12345 > 10.0.0.2.12345: UDP, length 16
15:54:54.399367 IP 10.0.0.1.12345 > 10.0.0.2.12345: UDP, length 16
15:54:54.400000 IP 10.0.0.1.12345 > 10.0.0.2.12345: UDP, length 16
15:54:54.400632 IP 10.0.0.1.12345 > 10.0.0.2.12345: UDP, length 16
15:54:54.401263 IP 10.0.0.1.12345 > 10.0.0.2.12345: UDP, length 16
15:54:54.401895 IP 10.0.0.1.12345 > 10.0.0.2.12345: UDP, length 16
15:54:54.402526 IP 10.0.0.1.12345 > 10.0.0.2.12345: UDP, length 16
15:54:54.403157 IP 10.0.0.1.12345 > 10.0.0.2.12345: UDP, length 16
15:54:54.403791 IP 10.0.0.1.12345 > 10.0.0.2.12345: UDP, length 16
15:54:54.404424 IP 10.0.0.1.12345 > 10.0.0.2.12345: UDP, length 16
15:54:54.405056 IP 10.0.0.1.12345 > 10.0.0.2.12345: UDP, length 16
15:54:54.405687 IP 10.0.0.1.12345 > 10.0.0.2.12345: UDP, length 16
15:54:54.406320 IP 10.0.0.1.12345 > 10.0.0.2.12345: UDP, length 16
15:54:54.406951 IP 10.0.0.1.12345 > 10.0.0.2.12345: UDP, length 16
15:54:54.407582 IP 10.0.0.1.12345 > 10.0.0.2.12345: UDP, length 16
15:54:54.408207 IP 10.0.0.1.12345 > 10.0.0.2.12345: UDP, length 16
15:54:54.408860 IP 10.0.0.1.12345 > 10.0.0.2.12345: UDP, length 16
15:54:54.409477 IP 10.0.0.1.12345 > 10.0.0.2.12345: UDP, length 16
15:54:54.410094 IP 10.0.0.1.12345 > 10.0.0.2.12345: UDP, length 16
15:54:54.410710 IP 10.0.0.1.12345 > 10.0.0.2.12345: UDP, length 16
15:54:54.411328 IP 10.0.0.1.12345 > 10.0.0.2.12345: UDP, length 16
15:54:54.411945 IP 10.0.0.1.12345 > 10.0.0.2.12345: UDP, length 16
15:54:54.412562 IP 10.0.0.1.12345 > 10.0.0.2.12345: UDP, length 16
15:54:54.413180 IP 10.0.0.1.12345 > 10.0.0.2.12345: UDP, length 16
15:54:54.413796 IP 10.0.0.1.12345 > 10.0.0.2.12345: UDP, length 16
15:54:54.414414 IP 10.0.0.1.12345 > 10.0.0.2.12345: UDP, length 16
15:54:54.415031 IP 10.0.0.1.12345 > 10.0.0.2.12345: UDP, length 16
15:54:54.415647 IP 10.0.0.1.12345 > 10.0.0.2.12345: UDP, length 16
15:54:54.416233 IP 10.0.0.1.12345 > 10.0.0.2.12345: UDP, length 16
15:54:54.416827 IP 10.0.0.1.12345 > 10.0.0.2.12345: UDP, length 16
15:54:54.417423 IP 10.0.0.1.12345 > 10.0.0.2.12345: UDP, length 16
15:54:54.418020 IP 10.0.0.1.12345 > 10.0.0.2.12345: UDP, length 16
15:54:54.418616 IP 10.0.0.1.12345 > 10.0.0.2.12345: UDP, length 16
15:54:54.419212 IP 10.0.0.1.12345 > 10.0.0.2.12345: UDP, length 16
15:54:54.419815 IP 10.0.0.1.12345 > 10.0.0.2.12345: UDP, length 16
15:54:54.420415 IP 10.0.0.1.12345 > 10.0.0.2.12345: UDP, length 16
15:54:54.421011 IP 10.0.0.1.12345 > 10.0.0.2.12345: UDP, length 16
15:54:54.421607 IP 10.0.0.1.12345 > 10.0.0.2.12345: UDP, length 16
15:54:54.422203 IP 10.0.0.1.12345 > 10.0.0.2.12345: UDP, length 16
15:54:54.422799 IP 10.0.0.1.12345 > 10.0.0.2.12345: UDP, length 16
15:54:54.423397 IP 10.0.0.1.12345 > 10.0.0.2.12345: UDP, length 16
15:54:54.423993 IP 10.0.0.1.12345 > 10.0.0.2.12345: UDP, length 16
15:54:54.424591 IP 10.0.0.1.12345 > 10.0.0.2.12345: UDP, length 16
15:54:54.425188 IP 10.0.0.1.12345 > 10.0.0.2.12345: UDP, length 16
15:54:54.425784 IP 10.0.0.1.12345 > 10.0.0.2.12345: UDP, length 16
15:54:54.426382 IP 10.0.0.1.12345 > 10.0.0.2.12345: UDP, length 16
15:54:54.426979 IP 10.0.0.1.12345 > 10.0.0.2.12345: UDP, length 16
15:54:54.427575 IP 10.0.0.1.12345 > 10.0.0.2.12345: UDP, length 16
15:54:54.428174 IP 10.0.0.1.12345 > 10.0.0.2.12345: UDP, length 16
15:54:54.428762 IP 10.0.0.1.12345 > 10.0.0.2.12345: UDP, length 16
15:54:54.429353 IP 10.0.0.1.12345 > 10.0.0.2.12345: UDP, length 16
15:54:54.429954 IP 10.0.0.1.12345 > 10.0.0.2.12345: UDP, length 16
15:54:54.430558 IP 10.0.0.1.12345 > 10.0.0.2.12345: UDP, length 16
15:54:54.431163 IP 10.0.0.1.12345 > 10.0.0.2.12345: UDP, length 16
15:54:54.431774 IP 10.0.0.1.12345 > 10.0.0.2.12345: UDP, length 16
15:54:54.432384 IP 10.0.0.1.12345 > 10.0.0.2.12345: UDP, length 16
15:54:54.432994 IP 10.0.0.1.12345 > 10.0.0.2.12345: UDP, length 16
15:54:54.433604 IP 10.0.0.1.12345 > 10.0.0.2.12345: UDP, length 16
15:54:54.434215 IP 10.0.0.1.12345 > 10.0.0.2.12345: UDP, length 16
15:54:54.434825 IP 10.0.0.1.12345 > 10.0.0.2.12345: UDP, length 16
15:54:54.435437 IP 10.0.0.1.12345 > 10.0.0.2.12345: UDP, length 16
15:54:54.436047 IP 10.0.0.1.12345 > 10.0.0.2.12345: UDP, length 16
15:54:54.436656 IP 10.0.0.1.12345 > 10.0.0.2.12345: UDP, length 16
15:54:54.437266 IP 10.0.0.1.12345 > 10.0.0.2.12345: UDP, length 16
15:54:54.437878 IP 10.0.0.1.12345 > 10.0.0.2.12345: UDP, length 16
15:54:54.438491 IP 10.0.0.1.12345 > 10.0.0.2.12345: UDP, length 16
15:54:54.439101 IP 10.0.0.1.12345 > 10.0.0.2.12345: UDP, length 16
15:54:54.439711 IP 10.0.0.1.12345 > 10.0.0.2.12345: UDP, length 16
15:54:54.440315 IP 10.0.0.1.12345 > 10.0.0.2.12345: UDP, length 16
15:54:54.440935 IP 10.0.0.1.12345 > 10.0.0.2.12345: UDP, length 16
15:54:54.441556 IP 10.0.0.1.12345 > 10.0.0.2.12345: UDP, length 16
15:54:54.442175 IP 10.0.0.1.12345 > 10.0.0.2.12345: UDP, length 16
15:54:54.442796 IP 10.0.0.1.12345 > 10.0.0.2.12345: UDP, length 16
15:54:54.443415 IP 10.0.0.1.12345 > 10.0.0.2.12345: UDP, length 16
15:54:54.444036 IP 10.0.0.1.12345 > 10.0.0.2.12345: UDP, length 16
15:54:54.444656 IP 10.0.0.1.12345 > 10.0.0.2.12345: UDP, length 16
15:54:54.445274 IP 10.0.0.1.12345 > 10.0.0.2.12345: UDP, length 16
15:54:54.445893 IP 10.0.0.1.12345 > 10.0.0.2.12345: UDP, length 16
15:54:54.446513 IP 10.0.0.1.12345 > 10.0.0.2.12345: UDP, length 16
15:54:54.447133 IP 10.0.0.1.12345 > 10.0.0.2.12345: UDP, length 16
15:54:54.447785 IP 10.0.0.1.12345 > 10.0.0.2.12345: UDP, length 16
15:54:54.448405 IP 10.0.0.1.12345 > 10.0.0.2.12345: UDP, length 16
15:54:54.449024 IP 10.0.0.1.12345 > 10.0.0.2.12345: UDP, length 16
15:54:54.449644 IP 10.0.0.1.12345 > 10.0.0.2.12345: UDP, length 16
15:54:54.450264 IP 10.0.0.1.12345 > 10.0.0.2.12345: UDP, length 16
15:54:54.450883 IP 10.0.0.1.12345 > 10.0.0.2.12345: UDP, length 16
15:54:54.451504 IP 10.0.0.1.12345 > 10.0.0.2.12345: UDP, length 16
15:54:54.452133 IP 10.0.0.1.12345 > 10.0.0.2.12345: UDP, length 16
15:54:54.452760 IP 10.0.0.1.12345 > 10.0.0.2.12345: UDP, length 16
15:54:54.453385 IP 10.0.0.1.12345 > 10.0.0.2.12345: UDP, length 16
15:54:54.454010 IP 10.0.0.1.12345 > 10.0.0.2.12345: UDP, length 16
15:54:54.454634 IP 10.0.0.1.12345 > 10.0.0.2.12345: UDP, length 16
15:54:54.455259 IP 10.0.0.1.12345 > 10.0.0.2.12345: UDP, length 16
15:54:54.455892 IP 10.0.0.1.12345 > 10.0.0.2.12345: UDP, length 16
15:54:54.456522 IP 10.0.0.1.12345 > 10.0.0.2.12345: UDP, length 16
15:54:54.457154 IP 10.0.0.1.12345 > 10.0.0.2.12345: UDP, length 16
15:54:54.457786 IP 10.0.0.1.12345 > 10.0.0.2.12345: UDP, length 16
15:54:54.458417 IP 10.0.0.1.12345 > 10.0.0.2.12345: UDP, length 16
15:54:54.459048 IP 10.0.0.1.12345 > 10.0.0.2.12345: UDP, length 16
15:54:54.459680 IP 10.0.0.1.12345 > 10.0.0.2.12345: UDP, length 16
15:54:54.460318 IP 10.0.0.1.12345 > 10.0.0.2.12345: UDP, length 16
15:54:54.460950 IP 10.0.0.1.12345 > 10.0.0.2.12345: UDP, length 16
15:54:54.461581 IP 10.0.0.1.12345 > 10.0.0.2.12345: UDP, length 16
15:54:54.462213 IP 10.0.0.1.12345 > 10.0.0.2.12345: UDP, length 16
15:54:54.462846 IP 10.0.0.1.12345 > 10.0.0.2.12345: UDP, length 16
15:54:54.463477 IP 10.0.0.1.12345 > 10.0.0.2.12345: UDP, length 16
15:54:54.464110 IP 10.0.0.1.12345 > 10.0.0.2.12345: UDP, length 16
15:54:54.464742 IP 10.0.0.1.12345 > 10.0.0.2.12345: UDP, length 16
15:54:54.465374 IP 10.0.0.1.12345 > 10.0.0.2.12345: UDP, length 16
15:54:54.466006 IP 10.0.0.1.12345 > 10.0.0.2.12345: UDP, length 16
15:54:54.466624 IP 10.0.0.1.12345 > 10.0.0.2.12345: UDP, length 16
15:54:54.467256 IP 10.0.0.1.12345 > 10.0.0.2.12345: UDP, length 16
15:54:54.467889 IP 10.0.0.1.12345 > 10.0.0.2.12345: UDP, length 16
15:54:54.468521 IP 10.0.0.1.12345 > 10.0.0.2.12345: UDP, length 16
15:54:54.469152 IP 10.0.0.1.12345 > 10.0.0.2.12345: UDP, length 16
15:54:54.469784 IP 10.0.0.1.12345 > 10.0.0.2.12345: UDP, length 16
15:54:54.470415 IP 10.0.0.1.12345 > 10.0.0.2.12345: UDP, length 16
15:54:54.471047 IP 10.0.0.1.12345 > 10.0.0.2.12345: UDP, length 16
15:54:54.471678 IP 10.0.0.1.12345 > 10.0.0.2.12345: UDP, length 16
15:54:54.472296 IP 10.0.0.1.12345 > 10.0.0.2.12345: UDP, length 16
15:54:54.472929 IP 10.0.0.1.12345 > 10.0.0.2.12345: UDP, length 16
15:54:54.473562 IP 10.0.0.1.12345 > 10.0.0.2.12345: UDP, length 16
15:54:54.474193 IP 10.0.0.1.12345 > 10.0.0.2.12345: UDP, length 16
15:54:54.474824 IP 10.0.0.1.12345 > 10.0.0.2.12345: UDP, length 16
15:54:54.475455 IP 10.0.0.1.12345 > 10.0.0.2.12345: UDP, length 16
15:54:54.476089 IP 10.0.0.1.12345 > 10.0.0.2.12345: UDP, length 16
15:54:54.476721 IP 10.0.0.1.12345 > 10.0.0.2.12345: UDP, length 16
15:54:54.477352 IP 10.0.0.1.12345 > 10.0.0.2.12345: UDP, length 16
15:54:54.477984 IP 10.0.0.1.12345 > 10.0.0.2.12345: UDP, length 16
15:54:54.478616 IP 10.0.0.1.12345 > 10.0.0.2.12345: UDP, length 16
15:54:54.479247 IP 10.0.0.1.12345 > 10.0.0.2.12345: UDP, length 16
15:54:54.479881 IP 10.0.0.1.12345 > 10.0.0.2.12345: UDP, length 16
15:54:54.480517 IP 10.0.0.1.12345 > 10.0.0.2.12345: UDP, length 16
15:54:54.481152 IP 10.0.0.1.12345 > 10.0.0.2.12345: UDP, length 16
15:54:54.481787 IP 10.0.0.1.12345 > 10.0.0.2.12345: UDP, length 16
15:54:54.482422 IP 10.0.0.1.12345 > 10.0.0.2.12345: UDP, length 16
15:54:54.483058 IP 10.0.0.1.12345 > 10.0.0.2.12345: UDP, length 16
15:54:54.483695 IP 10.0.0.1.12345 > 10.0.0.2.12345: UDP, length 16
15:54:54.484331 IP 10.0.0.1.12345 > 10.0.0.2.12345: UDP, length 16
15:54:54.484967 IP 10.0.0.1.12345 > 10.0.0.2.12345: UDP, length 16
15:54:54.485604 IP 10.0.0.1.12345 > 10.0.0.2.12345: UDP, length 16
15:54:54.486240 IP 10.0.0.1.12345 > 10.0.0.2.12345: UDP, length 16
15:54:54.486875 IP 10.0.0.1.12345 > 10.0.0.2.12345: UDP, length 16
15:54:54.487512 IP 10.0.0.1.12345 > 10.0.0.2.12345: UDP, length 16
15:54:54.488149 IP 10.0.0.1.12345 > 10.0.0.2.12345: UDP, length 16
15:54:54.488786 IP 10.0.0.1.12345 > 10.0.0.2.12345: UDP, length 16
15:54:54.489407 IP 10.0.0.1.12345 > 10.0.0.2.12345: UDP, length 16
15:54:54.490058 IP 10.0.0.1.12345 > 10.0.0.2.12345: UDP, length 16
15:54:54.490695 IP 10.0.0.1.12345 > 10.0.0.2.12345: UDP, length 16
15:54:54.491329 IP 10.0.0.1.12345 > 10.0.0.2.12345: UDP, length 16
15:54:54.491966 IP 10.0.0.1.12345 > 10.0.0.2.12345: UDP, length 16
15:54:54.492605 IP 10.0.0.1.12345 > 10.0.0.2.12345: UDP, length 16
15:54:54.493240 IP 10.0.0.1.12345 > 10.0.0.2.12345: UDP, length 16
15:54:54.493877 IP 10.0.0.1.12345 > 10.0.0.2.12345: UDP, length 16
15:54:54.494512 IP 10.0.0.1.12345 > 10.0.0.2.12345: UDP, length 16
15:54:54.495147 IP 10.0.0.1.12345 > 10.0.0.2.12345: UDP, length 16
15:54:54.495785 IP 10.0.0.1.12345 > 10.0.0.2.12345: UDP, length 16
15:54:54.496421 IP 10.0.0.1.12345 > 10.0.0.2.12345: UDP, length 16
15:54:54.497057 IP 10.0.0.1.12345 > 10.0.0.2.12345: UDP, length 16
15:54:54.497693 IP 10.0.0.1.12345 > 10.0.0.2.12345: UDP, length 16
15:54:54.498329 IP 10.0.0.1.12345 > 10.0.0.2.12345: UDP, length 16
15:54:54.498965 IP 10.0.0.1.12345 > 10.0.0.2.12345: UDP, length 16
15:54:54.499604 IP 10.0.0.1.12345 > 10.0.0.2.12345: UDP, length 16
15:54:54.500241 IP 10.0.0.1.12345 > 10.0.0.2.12345: UDP, length 16
15:54:54.500878 IP 10.0.0.1.12345 > 10.0.0.2.12345: UDP, length 16
15:54:54.501513 IP 10.0.0.1.12345 > 10.0.0.2.12345: UDP, length 16
15:54:54.502149 IP 10.0.0.1.12345 > 10.0.0.2.12345: UDP, length 16
15:54:54.502786 IP 10.0.0.1.12345 > 10.0.0.2.12345: UDP, length 16
15:54:54.503423 IP 10.0.0.1.12345 > 10.0.0.2.12345: UDP, length 16
15:54:54.504060 IP 10.0.0.1.12345 > 10.0.0.2.12345: UDP, length 16
15:54:54.504696 IP 10.0.0.1.12345 > 10.0.0.2.12345: UDP, length 16
15:54:54.505335 IP 10.0.0.1.12345 > 10.0.0.2.12345: UDP, length 16
15:54:54.505972 IP 10.0.0.1.12345 > 10.0.0.2.12345: UDP, length 16
15:54:54.506608 IP 10.0.0.1.12345 > 10.0.0.2.12345: UDP, length 16
15:54:54.507243 IP 10.0.0.1.12345 > 10.0.0.2.12345: UDP, length 16
15:54:54.507865 IP 10.0.0.1.12345 > 10.0.0.2.12345: UDP, length 16
15:54:54.508502 IP 10.0.0.1.12345 > 10.0.0.2.12345: UDP, length 16
15:54:54.509137 IP 10.0.0.1.12345 > 10.0.0.2.12345: UDP, length 16
15:54:54.509773 IP 10.0.0.1.12345 > 10.0.0.2.12345: UDP, length 16
15:54:54.510411 IP 10.0.0.1.12345 > 10.0.0.2.12345: UDP, length 16
15:54:54.511047 IP 10.0.0.1.12345 > 10.0.0.2.12345: UDP, length 16
15:54:54.511683 IP 10.0.0.1.12345 > 10.0.0.2.12345: UDP, length 16
15:54:54.512319 IP 10.0.0.1.12345 > 10.0.0.2.12345: UDP, length 16
15:54:54.512955 IP 10.0.0.1.12345 > 10.0.0.2.12345: UDP, length 16
15:54:54.513590 IP 10.0.0.1.12345 > 10.0.0.2.12345: UDP, length 16
15:54:54.514225 IP 10.0.0.1.12345 > 10.0.0.2.12345: UDP, length 16
15:54:54.514861 IP 10.0.0.1.12345 > 10.0.0.2.12345: UDP, length 16
15:54:54.515497 IP 10.0.0.1.12345 > 10.0.0.2.12345: UDP, length 16
15:54:54.516136 IP 10.0.0.1.12345 > 10.0.0.2.12345: UDP, length 16
15:54:54.516771 IP 10.0.0.1.12345 > 10.0.0.2.12345: UDP, length 16
15:54:54.517406 IP 10.0.0.1.12345 > 10.0.0.2.12345: UDP, length 16
15:54:54.518042 IP 10.0.0.1.12345 > 10.0.0.2.12345: UDP, length 16
15:54:54.518679 IP 10.0.0.1.12345 > 10.0.0.2.12345: UDP, length 16
15:54:54.519314 IP 10.0.0.1.12345 > 10.0.0.2.12345: UDP, length 16
15:54:54.519953 IP 10.0.0.1.12345 > 10.0.0.2.12345: UDP, length 16
15:54:54.520591 IP 10.0.0.1.12345 > 10.0.0.2.12345: UDP, length 16
15:54:54.521226 IP 10.0.0.1.12345 > 10.0.0.2.12345: UDP, length 16
15:54:54.521862 IP 10.0.0.1.12345 > 10.0.0.2.12345: UDP, length 16
15:54:54.522472 IP 10.0.0.1.12345 > 10.0.0.2.12345: UDP, length 16
15:54:54.523108 IP 10.0.0.1.12345 > 10.0.0.2.12345: UDP, length 16
15:54:54.523742 IP 10.0.0.1.12345 > 10.0.0.2.12345: UDP, length 16
15:54:54.524420 IP 10.0.0.1.12345 > 10.0.0.2.12345: UDP, length 16
15:54:54.525055 IP 10.0.0.1.12345 > 10.0.0.2.12345: UDP, length 16
15:54:54.525692 IP 10.0.0.1.12345 > 10.0.0.2.12345: UDP, length 16
15:54:54.526329 IP 10.0.0.1.12345 > 10.0.0.2.12345: UDP, length 16
15:54:54.526967 IP 10.0.0.1.12345 > 10.0.0.2.12345: UDP, length 16
15:54:54.527603 IP 10.0.0.1.12345 > 10.0.0.2.12345: UDP, length 16
15:54:54.528240 IP 10.0.0.1.12345 > 10.0.0.2.12345: UDP, length 16
15:54:54.528876 IP 10.0.0.1.12345 > 10.0.0.2.12345: UDP, length 16
15:54:54.529512 IP 10.0.0.1.12345 > 10.0.0.2.12345: UDP, length 16
15:54:54.530148 IP 10.0.0.1.12345 > 10.0.0.2.12345: UDP, length 16
15:54:54.530784 IP 10.0.0.1.12345 > 10.0.0.2.12345: UDP, length 16
15:54:54.531419 IP 10.0.0.1.12345 > 10.0.0.2.12345: UDP, length 16
15:54:54.532058 IP 10.0.0.1.12345 > 10.0.0.2.12345: UDP, length 16
15:54:54.532695 IP 10.0.0.1.12345 > 10.0.0.2.12345: UDP, length 16
15:54:54.533330 IP 10.0.0.1.12345 > 10.0.0.2.12345: UDP, length 16
15:54:54.533966 IP 10.0.0.1.12345 > 10.0.0.2.12345: UDP, length 16
15:54:54.534603 IP 10.0.0.1.12345 > 10.0.0.2.12345: UDP, length 16
15:54:54.535239 IP 10.0.0.1.12345 > 10.0.0.2.12345: UDP, length 16
15:54:54.535879 IP 10.0.0.1.12345 > 10.0.0.2.12345: UDP, length 16
15:54:54.536494 IP 10.0.0.1.12345 > 10.0.0.2.12345: UDP, length 16
15:54:54.537151 IP 10.0.0.1.12345 > 10.0.0.2.12345: UDP, length 16
15:54:54.537804 IP 10.0.0.1.12345 > 10.0.0.2.12345: UDP, length 16
15:54:54.538457 IP 10.0.0.1.12345 > 10.0.0.2.12345: UDP, length 16
15:54:54.539110 IP 10.0.0.1.12345 > 10.0.0.2.12345: UDP, length 16
15:54:54.539812 IP 10.0.0.1.12345 > 10.0.0.2.12345: UDP, length 16
15:54:54.540469 IP 10.0.0.1.12345 > 10.0.0.2.12345: UDP, length 16
15:54:54.541123 IP 10.0.0.1.12345 > 10.0.0.2.12345: UDP, length 16
15:54:54.541780 IP 10.0.0.1.12345 > 10.0.0.2.12345: UDP, length 16
15:54:54.542434 IP 10.0.0.1.12345 > 10.0.0.2.12345: UDP, length 16
15:54:54.543088 IP 10.0.0.1.12345 > 10.0.0.2.12345: UDP, length 16
15:54:54.543743 IP 10.0.0.1.12345 > 10.0.0.2.12345: UDP, length 16
15:54:54.544436 IP 10.0.0.1.12345 > 10.0.0.2.12345: UDP, length 16
15:54:54.545062 IP 10.0.0.1.12345 > 10.0.0.2.12345: UDP, length 16
15:54:54.545687 IP 10.0.0.1.12345 > 10.0.0.2.12345: UDP, length 16
15:54:54.546314 IP 10.0.0.1.12345 > 10.0.0.2.12345: UDP, length 16
15:54:54.546957 IP 10.0.0.1.12345 > 10.0.0.2.12345: UDP, length 16
15:54:54.547608 IP 10.0.0.1.12345 > 10.0.0.2.12345: UDP, length 16
15:54:54.548237 IP 10.0.0.1.12345 > 10.0.0.2.12345: UDP, length 16
15:54:54.548871 IP 10.0.0.1.12345 > 10.0.0.2.12345: UDP, length 16
15:54:54.549484 IP 10.0.0.1.12345 > 10.0.0.2.12345: UDP, length 16
15:54:54.550093 IP 10.0.0.1.12345 > 10.0.0.2.12345: UDP, length 16
15:54:54.550703 IP 10.0.0.1.12345 > 10.0.0.2.12345: UDP, length 16
15:54:54.551348 IP 10.0.0.1.12345 > 10.0.0.2.12345: UDP, length 16
15:54:54.551941 IP 10.0.0.1.12345 > 10.0.0.2.12345: UDP, length 16
15:54:54.552588 IP 10.0.0.1.12345 > 10.0.0.2.12345: UDP, length 16
15:54:54.553238 IP 10.0.0.1.12345 > 10.0.0.2.12345: UDP, length 16
15:54:54.553888 IP 10.0.0.1.12345 > 10.0.0.2.12345: UDP, length 16
15:54:54.554538 IP 10.0.0.1.12345 > 10.0.0.2.12345: UDP, length 16
15:54:54.555189 IP 10.0.0.1.12345 > 10.0.0.2.12345: UDP, length 16
15:54:54.555874 IP 10.0.0.1.12345 > 10.0.0.2.12345: UDP, length 16
15:54:54.556526 IP 10.0.0.1.12345 > 10.0.0.2.12345: UDP, length 16
15:54:54.557178 IP 10.0.0.1.12345 > 10.0.0.2.12345: UDP, length 16
15:54:54.557830 IP 10.0.0.1.12345 > 10.0.0.2.12345: UDP, length 16
15:54:54.558480 IP 10.0.0.1.12345 > 10.0.0.2.12345: UDP, length 16
15:54:54.559132 IP 10.0.0.1.12345 > 10.0.0.2.12345: UDP, length 16
15:54:54.559826 IP 10.0.0.1.12345 > 10.0.0.2.12345: UDP, length 16
15:54:54.560477 IP 10.0.0.1.12345 > 10.0.0.2.12345: UDP, length 16
15:54:54.561129 IP 10.0.0.1.12345 > 10.0.0.2.12345: UDP, length 16
15:54:54.561781 IP 10.0.0.1.12345 > 10.0.0.2.12345: UDP, length 16
15:54:54.562431 IP 10.0.0.1.12345 > 10.0.0.2.12345: UDP, length 16
15:54:54.563082 IP 10.0.0.1.12345 > 10.0.0.2.12345: UDP, length 16
15:54:54.563735 IP 10.0.0.1.12345 > 10.0.0.2.12345: UDP, length 16
15:54:54.564441 IP 10.0.0.1.12345 > 10.0.0.2.12345: UDP, length 16
15:54:54.565094 IP 10.0.0.1.12345 > 10.0.0.2.12345: UDP, length 16
15:54:54.565745 IP 10.0.0.1.12345 > 10.0.0.2.12345: UDP, length 16
15:54:54.566396 IP 10.0.0.1.12345 > 10.0.0.2.12345: UDP, length 16
15:54:54.567049 IP 10.0.0.1.12345 > 10.0.0.2.12345: UDP, length 16
15:54:54.567699 IP 10.0.0.1.12345 > 10.0.0.2.12345: UDP, length 16
15:54:54.568304 IP 10.0.0.1.12345 > 10.0.0.2.12345: UDP, length 16
15:54:54.568959 IP 10.0.0.1.12345 > 10.0.0.2.12345: UDP, length 16
15:54:54.569611 IP 10.0.0.1.12345 > 10.0.0.2.12345: UDP, length 16
15:54:54.570261 IP 10.0.0.1.12345 > 10.0.0.2.12345: UDP, length 16
15:54:54.570913 IP 10.0.0.1.12345 > 10.0.0.2.12345: UDP, length 16
15:54:54.571565 IP 10.0.0.1.12345 > 10.0.0.2.12345: UDP, length 16
15:54:54.572184 IP 10.0.0.1.12345 > 10.0.0.2.12345: UDP, length 16
15:54:54.572831 IP 10.0.0.1.12345 > 10.0.0.2.12345: UDP, length 16
15:54:54.573482 IP 10.0.0.1.12345 > 10.0.0.2.12345: UDP, length 16
15:54:54.574132 IP 10.0.0.1.12345 > 10.0.0.2.12345: UDP, length 16
15:54:54.574784 IP 10.0.0.1.12345 > 10.0.0.2.12345: UDP, length 16
15:54:54.575435 IP 10.0.0.1.12345 > 10.0.0.2.12345: UDP, length 16
15:54:54.576054 IP 10.0.0.1.12345 > 10.0.0.2.12345: UDP, length 16
15:54:54.576704 IP 10.0.0.1.12345 > 10.0.0.2.12345: UDP, length 16
15:54:54.577353 IP 10.0.0.1.12345 > 10.0.0.2.12345: UDP, length 16
15:54:54.578004 IP 10.0.0.1.12345 > 10.0.0.2.12345: UDP, length 16
15:54:54.578654 IP 10.0.0.1.12345 > 10.0.0.2.12345: UDP, length 16
15:54:54.579304 IP 10.0.0.1.12345 > 10.0.0.2.12345: UDP, length 16
15:54:54.579899 IP 10.0.0.1.12345 > 10.0.0.2.12345: UDP, length 16
15:54:54.580547 IP 10.0.0.1.12345 > 10.0.0.2.12345: UDP, length 16
15:54:54.581201 IP 10.0.0.1.12345 > 10.0.0.2.12345: UDP, length 16
15:54:54.581854 IP 10.0.0.1.12345 > 10.0.0.2.12345: UDP, length 16
15:54:54.582507 IP 10.0.0.1.12345 > 10.0.0.2.12345: UDP, length 16
15:54:54.583160 IP 10.0.0.1.12345 > 10.0.0.2.12345: UDP, length 16
15:54:54.583818 IP 10.0.0.1.12345 > 10.0.0.2.12345: UDP, length 16
15:54:54.584470 IP 10.0.0.1.12345 > 10.0.0.2.12345: UDP, length 16
15:54:54.585124 IP 10.0.0.1.12345 > 10.0.0.2.12345: UDP, length 16
15:54:54.585775 IP 10.0.0.1.12345 > 10.0.0.2.12345: UDP, length 16
15:54:54.586428 IP 10.0.0.1.12345 > 10.0.0.2.12345: UDP, length 16
15:54:54.587081 IP 10.0.0.1.12345 > 10.0.0.2.12345: UDP, length 16
15:54:54.587733 IP 10.0.0.1.12345 > 10.0.0.2.12345: UDP, length 16
15:54:54.588421 IP 10.0.0.1.12345 > 10.0.0.2.12345: UDP, length 16
15:54:54.589073 IP 10.0.0.1.12345 > 10.0.0.2.12345: UDP, length 16
15:54:54.589726 IP 10.0.0.1.12345 > 10.0.0.2.12345: UDP, length 16
15:54:54.590383 IP 10.0.0.1.12345 > 10.0.0.2.12345: UDP, length 16
15:54:54.591055 IP 10.0.0.1.12345 > 10.0.0.2.12345: UDP, length 16
15:54:54.591726 IP 10.0.0.1.12345 > 10.0.0.2.12345: UDP, length 16
15:54:54.592397 IP 10.0.0.1.12345 > 10.0.0.2.12345: UDP, length 16
15:54:54.593067 IP 10.0.0.1.12345 > 10.0.0.2.12345: UDP, length 16
15:54:54.593739 IP 10.0.0.1.12345 > 10.0.0.2.12345: UDP, length 16
15:54:54.594410 IP 10.0.0.1.12345 > 10.0.0.2.12345: UDP, length 16
15:54:54.595081 IP 10.0.0.1.12345 > 10.0.0.2.12345: UDP, length 16
15:54:54.595763 IP 10.0.0.1.12345 > 10.0.0.2.12345: UDP, length 16
15:54:54.596465 IP 10.0.0.1.12345 > 10.0.0.2.12345: UDP, length 16
15:54:54.597136 IP 10.0.0.1.12345 > 10.0.0.2.12345: UDP, length 16
15:54:54.597809 IP 10.0.0.1.12345 > 10.0.0.2.12345: UDP, length 16
15:54:54.598480 IP 10.0.0.1.12345 > 10.0.0.2.12345: UDP, length 16
15:54:54.599151 IP 10.0.0.1.12345 > 10.0.0.2.12345: UDP, length 16
15:54:54.599842 IP 10.0.0.1.12345 > 10.0.0.2.12345: UDP, length 16
15:54:54.600526 IP 10.0.0.1.12345 > 10.0.0.2.12345: UDP, length 16
15:54:54.601197 IP 10.0.0.1.12345 > 10.0.0.2.12345: UDP, length 16
15:54:54.601871 IP 10.0.0.1.12345 > 10.0.0.2.12345: UDP, length 16
15:54:54.602541 IP 10.0.0.1.12345 > 10.0.0.2.12345: UDP, length 16
15:54:54.603213 IP 10.0.0.1.12345 > 10.0.0.2.12345: UDP, length 16
15:54:54.603876 IP 10.0.0.1.12345 > 10.0.0.2.12345: UDP, length 16
15:54:54.604547 IP 10.0.0.1.12345 > 10.0.0.2.12345: UDP, length 16
15:54:54.605218 IP 10.0.0.1.12345 > 10.0.0.2.12345: UDP, length 16
15:54:54.605889 IP 10.0.0.1.12345 > 10.0.0.2.12345: UDP, length 16
15:54:54.606542 IP 10.0.0.1.12345 > 10.0.0.2.12345: UDP, length 16
15:54:54.607213 IP 10.0.0.1.12345 > 10.0.0.2.12345: UDP, length 16
15:54:54.607877 IP 10.0.0.1.12345 > 10.0.0.2.12345: UDP, length 16
15:54:54.608549 IP 10.0.0.1.12345 > 10.0.0.2.12345: UDP, length 16
15:54:54.609220 IP 10.0.0.1.12345 > 10.0.0.2.12345: UDP, length 16
15:54:54.609893 IP 10.0.0.1.12345 > 10.0.0.2.12345: UDP, length 16
15:54:54.610563 IP 10.0.0.1.12345 > 10.0.0.2.12345: UDP, length 16
15:54:54.611234 IP 10.0.0.1.12345 > 10.0.0.2.12345: UDP, length 16
15:54:54.611893 IP 10.0.0.1.12345 > 10.0.0.2.12345: UDP, length 16
15:54:54.612564 IP 10.0.0.1.12345 > 10.0.0.2.12345: UDP, length 16
15:54:54.613235 IP 10.0.0.1.12345 > 10.0.0.2.12345: UDP, length 16
15:54:54.613909 IP 10.0.0.1.12345 > 10.0.0.2.12345: UDP, length 16
15:54:54.614580 IP 10.0.0.1.12345 > 10.0.0.2.12345: UDP, length 16
15:54:54.615250 IP 10.0.0.1.12345 > 10.0.0.2.12345: UDP, length 16
15:54:54.615909 IP 10.0.0.1.12345 > 10.0.0.2.12345: UDP, length 16
15:54:54.616580 IP 10.0.0.1.12345 > 10.0.0.2.12345: UDP, length 16
15:54:54.617251 IP 10.0.0.1.12345 > 10.0.0.2.12345: UDP, length 16
15:54:54.617924 IP 10.0.0.1.12345 > 10.0.0.2.12345: UDP, length 16
15:54:54.618596 IP 10.0.0.1.12345 > 10.0.0.2.12345: UDP, length 16
15:54:54.619267 IP 10.0.0.1.12345 > 10.0.0.2.12345: UDP, length 16
15:54:54.619944 IP 10.0.0.1.12345 > 10.0.0.2.12345: UDP, length 16
15:54:54.620615 IP 10.0.0.1.12345 > 10.0.0.2.12345: UDP, length 16
15:54:54.621287 IP 10.0.0.1.12345 > 10.0.0.2.12345: UDP, length 16
15:54:54.621961 IP 10.0.0.1.12345 > 10.0.0.2.12345: UDP, length 16
15:54:54.622631 IP 10.0.0.1.12345 > 10.0.0.2.12345: UDP, length 16
15:54:54.623302 IP 10.0.0.1.12345 > 10.0.0.2.12345: UDP, length 16
15:54:54.623997 IP 10.0.0.1.12345 > 10.0.0.2.12345: UDP, length 16
15:54:54.624668 IP 10.0.0.1.12345 > 10.0.0.2.12345: UDP, length 16
15:54:54.625340 IP 10.0.0.1.12345 > 10.0.0.2.12345: UDP, length 16
15:54:54.626011 IP 10.0.0.1.12345 > 10.0.0.2.12345: UDP, length 16
15:54:54.626681 IP 10.0.0.1.12345 > 10.0.0.2.12345: UDP, length 16
15:54:54.627352 IP 10.0.0.1.12345 > 10.0.0.2.12345: UDP, length 16
15:54:54.628027 IP 10.0.0.1.12345 > 10.0.0.2.12345: UDP, length 16
15:54:54.628697 IP 10.0.0.1.12345 > 10.0.0.2.12345: UDP, length 16
15:54:54.629369 IP 10.0.0.1.12345 > 10.0.0.2.12345: UDP, length 16
15:54:54.630041 IP 10.0.0.1.12345 > 10.0.0.2.12345: UDP, length 16
15:54:54.630712 IP 10.0.0.1.12345 > 10.0.0.2.12345: UDP, length 16
15:54:54.631382 IP 10.0.0.1.12345 > 10.0.0.2.12345: UDP, length 16
15:54:54.632040 IP 10.0.0.1.12345 > 10.0.0.2.12345: UDP, length 16
15:54:54.632697 IP 10.0.0.1.12345 > 10.0.0.2.12345: UDP, length 16
15:54:54.633354 IP 10.0.0.1.12345 > 10.0.0.2.12345: UDP, length 16
15:54:54.634009 IP 10.0.0.1.12345 > 10.0.0.2.12345: UDP, length 16
15:54:54.634665 IP 10.0.0.1.12345 > 10.0.0.2.12345: UDP, length 16
15:54:54.635320 IP 10.0.0.1.12345 > 10.0.0.2.12345: UDP, length 16
15:54:54.635978 IP 10.0.0.1.12345 > 10.0.0.2.12345: UDP, length 16
15:54:54.636634 IP 10.0.0.1.12345 > 10.0.0.2.12345: UDP, length 16
15:54:54.637289 IP 10.0.0.1.12345 > 10.0.0.2.12345: UDP, length 16
15:54:54.637947 IP 10.0.0.1.12345 > 10.0.0.2.12345: UDP, length 16
15:54:54.638603 IP 10.0.0.1.12345 > 10.0.0.2.12345: UDP, length 16
15:54:54.639275 IP 10.0.0.1.12345 > 10.0.0.2.12345: UDP, length 16
15:54:54.639954 IP 10.0.0.1.12345 > 10.0.0.2.12345: UDP, length 16
15:54:54.640626 IP 10.0.0.1.12345 > 10.0.0.2.12345: UDP, length 16
15:54:54.641297 IP 10.0.0.1.12345 > 10.0.0.2.12345: UDP, length 16
15:54:54.641970 IP 10.0.0.1.12345 > 10.0.0.2.12345: UDP, length 16
15:54:54.642640 IP 10.0.0.1.12345 > 10.0.0.2.12345: UDP, length 16
15:54:54.643309 IP 10.0.0.1.12345 > 10.0.0.2.12345: UDP, length 16
15:54:54.643987 IP 10.0.0.1.12345 > 10.0.0.2.12345: UDP, length 16
15:54:54.644657 IP 10.0.0.1.12345 > 10.0.0.2.12345: UDP, length 16
15:54:54.645275 IP 10.0.0.1.12345 > 10.0.0.2.12345: UDP, length 16
15:54:54.645890 IP 10.0.0.1.12345 > 10.0.0.2.12345: UDP, length 16
15:54:54.646503 IP 10.0.0.1.12345 > 10.0.0.2.12345: UDP, length 16
15:54:54.647117 IP 10.0.0.1.12345 > 10.0.0.2.12345: UDP, length 16
15:54:54.647731 IP 10.0.0.1.12345 > 10.0.0.2.12345: UDP, length 16
15:54:54.648350 IP 10.0.0.1.12345 > 10.0.0.2.12345: UDP, length 16
15:54:54.648966 IP 10.0.0.1.12345 > 10.0.0.2.12345: UDP, length 16
15:54:54.649580 IP 10.0.0.1.12345 > 10.0.0.2.12345: UDP, length 16
15:54:54.650195 IP 10.0.0.1.12345 > 10.0.0.2.12345: UDP, length 16
15:54:54.650809 IP 10.0.0.1.12345 > 10.0.0.2.12345: UDP, length 16
15:54:54.651423 IP 10.0.0.1.12345 > 10.0.0.2.12345: UDP, length 16
15:54:54.652037 IP 10.0.0.1.12345 > 10.0.0.2.12345: UDP, length 16
15:54:54.652652 IP 10.0.0.1.12345 > 10.0.0.2.12345: UDP, length 16
15:54:54.653266 IP 10.0.0.1.12345 > 10.0.0.2.12345: UDP, length 16
15:54:54.653879 IP 10.0.0.1.12345 > 10.0.0.2.12345: UDP, length 16
15:54:54.654493 IP 10.0.0.1.12345 > 10.0.0.2.12345: UDP, length 16
15:54:54.655107 IP 10.0.0.1.12345 > 10.0.0.2.12345: UDP, length 16
15:54:54.655721 IP 10.0.0.1.12345 > 10.0.0.2.12345: UDP, length 16
15:54:54.656335 IP 10.0.0.1.12345 > 10.0.0.2.12345: UDP, length 16
15:54:54.656952 IP 10.0.0.1.12345 > 10.0.0.2.12345: UDP, length 16
15:54:54.657565 IP 10.0.0.1.12345 > 10.0.0.2.12345: UDP, length 16
15:54:54.658180 IP 10.0.0.1.12345 > 10.0.0.2.12345: UDP, length 16
15:54:54.658793 IP 10.0.0.1.12345 > 10.0.0.2.12345: UDP, length 16
15:54:54.659408 IP 10.0.0.1.12345 > 10.0.0.2.12345: UDP, length 16
15:54:54.660023 IP 10.0.0.1.12345 > 10.0.0.2.12345: UDP, length 16
15:54:54.660638 IP 10.0.0.1.12345 > 10.0.0.2.12345: UDP, length 16
15:54:54.661252 IP 10.0.0.1.12345 > 10.0.0.2.12345: UDP, length 16
15:54:54.661879 IP 10.0.0.1.12345 > 10.0.0.2.12345: UDP, length 16
15:54:54.662511 IP 10.0.0.1.12345 > 10.0.0.2.12345: UDP, length 16
15:54:54.663143 IP 10.0.0.1.12345 > 10.0.0.2.12345: UDP, length 16
15:54:54.663778 IP 10.0.0.1.12345 > 10.0.0.2.12345: UDP, length 16
15:54:54.664410 IP 10.0.0.1.12345 > 10.0.0.2.12345: UDP, length 16
15:54:54.665042 IP 10.0.0.1.12345 > 10.0.0.2.12345: UDP, length 16
15:54:54.665674 IP 10.0.0.1.12345 > 10.0.0.2.12345: UDP, length 16
15:54:54.666306 IP 10.0.0.1.12345 > 10.0.0.2.12345: UDP, length 16
15:54:54.666938 IP 10.0.0.1.12345 > 10.0.0.2.12345: UDP, length 16
15:54:54.667569 IP 10.0.0.1.12345 > 10.0.0.2.12345: UDP, length 16
15:54:54.668202 IP 10.0.0.1.12345 > 10.0.0.2.12345: UDP, length 16
15:54:54.668834 IP 10.0.0.1.12345 > 10.0.0.2.12345: UDP, length 16
15:54:54.669468 IP 10.0.0.1.12345 > 10.0.0.2.12345: UDP, length 16
15:54:54.670099 IP 10.0.0.1.12345 > 10.0.0.2.12345: UDP, length 16
