Apr 15, 2020 13:16:04.448711429 CST    127.0.0.1 → 127.0.0.1    OpenFlow Type: OFPT_ECHO_REQUEST
Apr 15, 2020 13:16:04.449122040 CST    127.0.0.1 → 127.0.0.1    OpenFlow Type: OFPT_ECHO_REPLY
Apr 15, 2020 13:16:04.449139864 CST    127.0.0.1 → 127.0.0.1    TCP 48862 → 6653 [ACK] Seq=9 Ack=9 Win=86 Len=0 TSval=546083723 TSecr=546083723
Apr 15, 2020 13:16:05.499337594 CST    127.0.0.1 → 127.0.0.1    HTTP POST /stats/flowentry/add HTTP/1.1  (text/plain)
Apr 15, 2020 13:16:05.500777578 CST    127.0.0.1 → 127.0.0.1    HTTP HTTP/1.1 200 OK 
Apr 15, 2020 13:16:05.500794525 CST    127.0.0.1 → 127.0.0.1    TCP 43248 → 8080 [ACK] Seq=657 Ack=140 Win=86 Len=0 TSval=546084775 TSecr=546084775
Apr 15, 2020 13:16:05.501180499 CST    127.0.0.1 → 127.0.0.1    OpenFlow Type: OFPT_FLOW_MOD
Apr 15, 2020 13:16:05.501196895 CST    127.0.0.1 → 127.0.0.1    TCP 48862 → 6653 [ACK] Seq=9 Ack=121 Win=86 Len=0 TSval=546084775 TSecr=546084775
Apr 15, 2020 13:16:06.444142878 CST    127.0.0.1 → 127.0.0.53   DNS Standard query 0xac0c PTR 2.0.0.10.in-addr.arpa OPT
Apr 15, 2020 13:16:06.507727691 CST    127.0.0.1 → 127.0.0.1    TCP [TCP Keep-Alive] 43248 → 8080 [ACK] Seq=656 Ack=140 Win=86 Len=0 TSval=546085782 TSecr=546084775
Apr 15, 2020 13:16:06.507790142 CST    127.0.0.1 → 127.0.0.1    TCP [TCP Keep-Alive ACK] 8080 → 43248 [ACK] Seq=140 Ack=657 Win=86 Len=0 TSval=546085782 TSecr=546084775
Apr 15, 2020 13:16:06.542424099 CST   127.0.0.53 → 127.0.0.1    DNS Standard query response 0xac0c PTR 2.0.0.10.in-addr.arpa OPT
Apr 15, 2020 13:16:06.543151765 CST    127.0.0.1 → 127.0.0.53   DNS Standard query 0xaa9c PTR 9.0.0.10.in-addr.arpa OPT
Apr 15, 2020 13:16:06.621078383 CST   127.0.0.53 → 127.0.0.1    DNS Standard query response 0xaa9c PTR 9.0.0.10.in-addr.arpa OPT
Apr 15, 2020 13:16:10.449252361 CST    127.0.0.1 → 127.0.0.1    OpenFlow Type: OFPT_ECHO_REQUEST
Apr 15, 2020 13:16:10.449748392 CST    127.0.0.1 → 127.0.0.1    OpenFlow Type: OFPT_ECHO_REPLY
Apr 15, 2020 13:16:10.449766679 CST    127.0.0.1 → 127.0.0.1    TCP 48862 → 6653 [ACK] Seq=17 Ack=129 Win=86 Len=0 TSval=546089724 TSecr=546089724
