Apr 15, 2020 13:18:11.682653159 CST    127.0.0.1 → 127.0.0.1    OpenFlow Type: OFPT_PORT_STATUS
Apr 15, 2020 13:18:11.723720804 CST    127.0.0.1 → 127.0.0.1    TCP 6653 → 48862 [ACK] Seq=1 Ack=81 Win=86 Len=0 TSval=546210998 TSecr=546210957
Apr 15, 2020 13:18:15.448803802 CST    127.0.0.1 → 127.0.0.1    OpenFlow Type: OFPT_ECHO_REQUEST
Apr 15, 2020 13:18:15.448816097 CST    127.0.0.1 → 127.0.0.1    TCP 6653 → 48862 [ACK] Seq=1 Ack=89 Win=86 Len=0 TSval=546214723 TSecr=546214723
Apr 15, 2020 13:18:15.449410914 CST    127.0.0.1 → 127.0.0.1    OpenFlow Type: OFPT_ECHO_REPLY
Apr 15, 2020 13:18:15.449421178 CST    127.0.0.1 → 127.0.0.1    TCP 48862 → 6653 [ACK] Seq=89 Ack=9 Win=86 Len=0 TSval=546214723 TSecr=546214723
Apr 15, 2020 13:18:16.099892105 CST    127.0.0.1 → 127.0.0.1    HTTP POST /stats/flowentry/add HTTP/1.1  (text/plain)
Apr 15, 2020 13:18:16.101336234 CST    127.0.0.1 → 127.0.0.1    HTTP HTTP/1.1 200 OK 
Apr 15, 2020 13:18:16.101353317 CST    127.0.0.1 → 127.0.0.1    TCP 43248 → 8080 [ACK] Seq=658 Ack=140 Win=86 Len=0 TSval=546215375 TSecr=546215375
Apr 15, 2020 13:18:16.101672172 CST    127.0.0.1 → 127.0.0.1    OpenFlow Type: OFPT_FLOW_MOD
Apr 15, 2020 13:18:16.101681980 CST    127.0.0.1 → 127.0.0.1    TCP 48862 → 6653 [ACK] Seq=89 Ack=121 Win=86 Len=0 TSval=546215376 TSecr=546215376
Apr 15, 2020 13:18:16.780311022 CST    127.0.0.1 → 127.0.0.53   DNS Standard query 0xe24e PTR 2.0.0.10.in-addr.arpa OPT
Apr 15, 2020 13:18:16.870571152 CST   127.0.0.53 → 127.0.0.1    DNS Standard query response 0xe24e PTR 2.0.0.10.in-addr.arpa OPT
Apr 15, 2020 13:18:16.871569364 CST    127.0.0.1 → 127.0.0.53   DNS Standard query 0xa4b5 PTR 10.0.0.10.in-addr.arpa OPT
Apr 15, 2020 13:18:16.969187128 CST   127.0.0.53 → 127.0.0.1    DNS Standard query response 0xa4b5 PTR 10.0.0.10.in-addr.arpa OPT
Apr 15, 2020 13:18:17.131690294 CST    127.0.0.1 → 127.0.0.1    TCP [TCP Keep-Alive] 43248 → 8080 [ACK] Seq=657 Ack=140 Win=86 Len=0 TSval=546216406 TSecr=546215375
Apr 15, 2020 13:18:17.131727916 CST    127.0.0.1 → 127.0.0.1    TCP [TCP Keep-Alive ACK] 8080 → 43248 [ACK] Seq=140 Ack=658 Win=86 Len=0 TSval=546216406 TSecr=546215375
Apr 15, 2020 13:18:20.448295679 CST    127.0.0.1 → 127.0.0.1    OpenFlow Type: OFPT_ECHO_REQUEST
Apr 15, 2020 13:18:20.448722378 CST    127.0.0.1 → 127.0.0.1    OpenFlow Type: OFPT_ECHO_REPLY
Apr 15, 2020 13:18:20.448738059 CST    127.0.0.1 → 127.0.0.1    TCP 48862 → 6653 [ACK] Seq=97 Ack=129 Win=86 Len=0 TSval=546219723 TSecr=546219723
Apr 15, 2020 13:18:23.400850034 CST    127.0.0.1 → 127.0.0.1    OpenFlow Type: OFPT_PORT_STATUS
Apr 15, 2020 13:18:23.443698385 CST    127.0.0.1 → 127.0.0.1    TCP 6653 → 48862 [ACK] Seq=129 Ack=177 Win=86 Len=0 TSval=546222718 TSecr=546222675
