13:18:16.102739 IP 10.0.0.10.12345 > 10.0.0.2.12345: UDP, length 16
13:18:16.103264 IP 10.0.0.10.12345 > 10.0.0.2.12345: UDP, length 16
13:18:16.103954 IP 10.0.0.10.12345 > 10.0.0.2.12345: UDP, length 16
13:18:16.104553 IP 10.0.0.10.12345 > 10.0.0.2.12345: UDP, length 16
13:18:16.107235 IP 10.0.0.10.12345 > 10.0.0.2.12345: UDP, length 16
13:18:16.107824 IP 10.0.0.10.12345 > 10.0.0.2.12345: UDP, length 16
13:18:16.108409 IP 10.0.0.10.12345 > 10.0.0.2.12345: UDP, length 16
13:18:16.108996 IP 10.0.0.10.12345 > 10.0.0.2.12345: UDP, length 16
13:18:16.109576 IP 10.0.0.10.12345 > 10.0.0.2.12345: UDP, length 16
13:18:16.110151 IP 10.0.0.10.12345 > 10.0.0.2.12345: UDP, length 16
13:18:16.110729 IP 10.0.0.10.12345 > 10.0.0.2.12345: UDP, length 16
13:18:16.111308 IP 10.0.0.10.12345 > 10.0.0.2.12345: UDP, length 16
13:18:16.111883 IP 10.0.0.10.12345 > 10.0.0.2.12345: UDP, length 16
13:18:16.112454 IP 10.0.0.10.12345 > 10.0.0.2.12345: UDP, length 16
13:18:16.113026 IP 10.0.0.10.12345 > 10.0.0.2.12345: UDP, length 16
13:18:16.113604 IP 10.0.0.10.12345 > 10.0.0.2.12345: UDP, length 16
13:18:16.114180 IP 10.0.0.10.12345 > 10.0.0.2.12345: UDP, length 16
13:18:16.114759 IP 10.0.0.10.12345 > 10.0.0.2.12345: UDP, length 16
13:18:16.115349 IP 10.0.0.10.12345 > 10.0.0.2.12345: UDP, length 16
13:18:16.115930 IP 10.0.0.10.12345 > 10.0.0.2.12345: UDP, length 16
13:18:16.116504 IP 10.0.0.10.12345 > 10.0.0.2.12345: UDP, length 16
13:18:16.117081 IP 10.0.0.10.12345 > 10.0.0.2.12345: UDP, length 16
13:18:16.117664 IP 10.0.0.10.12345 > 10.0.0.2.12345: UDP, length 16
13:18:16.118242 IP 10.0.0.10.12345 > 10.0.0.2.12345: UDP, length 16
13:18:16.118839 IP 10.0.0.10.12345 > 10.0.0.2.12345: UDP, length 16
13:18:16.119423 IP 10.0.0.10.12345 > 10.0.0.2.12345: UDP, length 16
13:18:16.119998 IP 10.0.0.10.12345 > 10.0.0.2.12345: UDP, length 16
13:18:16.120571 IP 10.0.0.10.12345 > 10.0.0.2.12345: UDP, length 16
13:18:16.121154 IP 10.0.0.10.12345 > 10.0.0.2.12345: UDP, length 16
13:18:16.121730 IP 10.0.0.10.12345 > 10.0.0.2.12345: UDP, length 16
13:18:16.122307 IP 10.0.0.10.12345 > 10.0.0.2.12345: UDP, length 16
13:18:16.122889 IP 10.0.0.10.12345 > 10.0.0.2.12345: UDP, length 16
13:18:16.123463 IP 10.0.0.10.12345 > 10.0.0.2.12345: UDP, length 16
13:18:16.124036 IP 10.0.0.10.12345 > 10.0.0.2.12345: UDP, length 16
13:18:16.124612 IP 10.0.0.10.12345 > 10.0.0.2.12345: UDP, length 16
13:18:16.125189 IP 10.0.0.10.12345 > 10.0.0.2.12345: UDP, length 16
13:18:16.125766 IP 10.0.0.10.12345 > 10.0.0.2.12345: UDP, length 16
13:18:16.126346 IP 10.0.0.10.12345 > 10.0.0.2.12345: UDP, length 16
13:18:16.126928 IP 10.0.0.10.12345 > 10.0.0.2.12345: UDP, length 16
13:18:16.127498 IP 10.0.0.10.12345 > 10.0.0.2.12345: UDP, length 16
13:18:16.128076 IP 10.0.0.10.12345 > 10.0.0.2.12345: UDP, length 16
13:18:16.128644 IP 10.0.0.10.12345 > 10.0.0.2.12345: UDP, length 16
13:18:16.129208 IP 10.0.0.10.12345 > 10.0.0.2.12345: UDP, length 16
13:18:16.129771 IP 10.0.0.10.12345 > 10.0.0.2.12345: UDP, length 16
13:18:16.130337 IP 10.0.0.10.12345 > 10.0.0.2.12345: UDP, length 16
13:18:16.130919 IP 10.0.0.10.12345 > 10.0.0.2.12345: UDP, length 16
13:18:16.131495 IP 10.0.0.10.12345 > 10.0.0.2.12345: UDP, length 16
13:18:16.132070 IP 10.0.0.10.12345 > 10.0.0.2.12345: UDP, length 16
13:18:16.132640 IP 10.0.0.10.12345 > 10.0.0.2.12345: UDP, length 16
13:18:16.133212 IP 10.0.0.10.12345 > 10.0.0.2.12345: UDP, length 16
13:18:16.133786 IP 10.0.0.10.12345 > 10.0.0.2.12345: UDP, length 16
13:18:16.134352 IP 10.0.0.10.12345 > 10.0.0.2.12345: UDP, length 16
13:18:16.134931 IP 10.0.0.10.12345 > 10.0.0.2.12345: UDP, length 16
13:18:16.135519 IP 10.0.0.10.12345 > 10.0.0.2.12345: UDP, length 16
13:18:16.136092 IP 10.0.0.10.12345 > 10.0.0.2.12345: UDP, length 16
13:18:16.136674 IP 10.0.0.10.12345 > 10.0.0.2.12345: UDP, length 16
13:18:16.137284 IP 10.0.0.10.12345 > 10.0.0.2.12345: UDP, length 16
13:18:16.137864 IP 10.0.0.10.12345 > 10.0.0.2.12345: UDP, length 16
13:18:16.138456 IP 10.0.0.10.12345 > 10.0.0.2.12345: UDP, length 16
13:18:16.139056 IP 10.0.0.10.12345 > 10.0.0.2.12345: UDP, length 16
13:18:16.139658 IP 10.0.0.10.12345 > 10.0.0.2.12345: UDP, length 16
13:18:16.140238 IP 10.0.0.10.12345 > 10.0.0.2.12345: UDP, length 16
13:18:16.140830 IP 10.0.0.10.12345 > 10.0.0.2.12345: UDP, length 16
13:18:16.141420 IP 10.0.0.10.12345 > 10.0.0.2.12345: UDP, length 16
13:18:16.142055 IP 10.0.0.10.12345 > 10.0.0.2.12345: UDP, length 16
13:18:16.142638 IP 10.0.0.10.12345 > 10.0.0.2.12345: UDP, length 16
13:18:16.143243 IP 10.0.0.10.12345 > 10.0.0.2.12345: UDP, length 16
13:18:16.143816 IP 10.0.0.10.12345 > 10.0.0.2.12345: UDP, length 16
13:18:16.144402 IP 10.0.0.10.12345 > 10.0.0.2.12345: UDP, length 16
13:18:16.144977 IP 10.0.0.10.12345 > 10.0.0.2.12345: UDP, length 16
13:18:16.145552 IP 10.0.0.10.12345 > 10.0.0.2.12345: UDP, length 16
13:18:16.146133 IP 10.0.0.10.12345 > 10.0.0.2.12345: UDP, length 16
13:18:16.146710 IP 10.0.0.10.12345 > 10.0.0.2.12345: UDP, length 16
13:18:16.147283 IP 10.0.0.10.12345 > 10.0.0.2.12345: UDP, length 16
13:18:16.147846 IP 10.0.0.10.12345 > 10.0.0.2.12345: UDP, length 16
13:18:16.148442 IP 10.0.0.10.12345 > 10.0.0.2.12345: UDP, length 16
13:18:16.149034 IP 10.0.0.10.12345 > 10.0.0.2.12345: UDP, length 16
13:18:16.149625 IP 10.0.0.10.12345 > 10.0.0.2.12345: UDP, length 16
13:18:16.150211 IP 10.0.0.10.12345 > 10.0.0.2.12345: UDP, length 16
13:18:16.150805 IP 10.0.0.10.12345 > 10.0.0.2.12345: UDP, length 16
13:18:16.151394 IP 10.0.0.10.12345 > 10.0.0.2.12345: UDP, length 16
13:18:16.151966 IP 10.0.0.10.12345 > 10.0.0.2.12345: UDP, length 16
13:18:16.152534 IP 10.0.0.10.12345 > 10.0.0.2.12345: UDP, length 16
13:18:16.153094 IP 10.0.0.10.12345 > 10.0.0.2.12345: UDP, length 16
13:18:16.153652 IP 10.0.0.10.12345 > 10.0.0.2.12345: UDP, length 16
13:18:16.154227 IP 10.0.0.10.12345 > 10.0.0.2.12345: UDP, length 16
13:18:16.154808 IP 10.0.0.10.12345 > 10.0.0.2.12345: UDP, length 16
13:18:16.155387 IP 10.0.0.10.12345 > 10.0.0.2.12345: UDP, length 16
13:18:16.155964 IP 10.0.0.10.12345 > 10.0.0.2.12345: UDP, length 16
13:18:16.156545 IP 10.0.0.10.12345 > 10.0.0.2.12345: UDP, length 16
13:18:16.157135 IP 10.0.0.10.12345 > 10.0.0.2.12345: UDP, length 16
13:18:16.157724 IP 10.0.0.10.12345 > 10.0.0.2.12345: UDP, length 16
13:18:16.158312 IP 10.0.0.10.12345 > 10.0.0.2.12345: UDP, length 16
13:18:16.158899 IP 10.0.0.10.12345 > 10.0.0.2.12345: UDP, length 16
13:18:16.159484 IP 10.0.0.10.12345 > 10.0.0.2.12345: UDP, length 16
13:18:16.160077 IP 10.0.0.10.12345 > 10.0.0.2.12345: UDP, length 16
13:18:16.160712 IP 10.0.0.10.12345 > 10.0.0.2.12345: UDP, length 16
13:18:16.161312 IP 10.0.0.10.12345 > 10.0.0.2.12345: UDP, length 16
13:18:16.161893 IP 10.0.0.10.12345 > 10.0.0.2.12345: UDP, length 16
13:18:16.162476 IP 10.0.0.10.12345 > 10.0.0.2.12345: UDP, length 16
13:18:16.163056 IP 10.0.0.10.12345 > 10.0.0.2.12345: UDP, length 16
13:18:16.163637 IP 10.0.0.10.12345 > 10.0.0.2.12345: UDP, length 16
13:18:16.164226 IP 10.0.0.10.12345 > 10.0.0.2.12345: UDP, length 16
13:18:16.164846 IP 10.0.0.10.12345 > 10.0.0.2.12345: UDP, length 16
13:18:16.165435 IP 10.0.0.10.12345 > 10.0.0.2.12345: UDP, length 16
13:18:16.166048 IP 10.0.0.10.12345 > 10.0.0.2.12345: UDP, length 16
13:18:16.166637 IP 10.0.0.10.12345 > 10.0.0.2.12345: UDP, length 16
13:18:16.167213 IP 10.0.0.10.12345 > 10.0.0.2.12345: UDP, length 16
13:18:16.167793 IP 10.0.0.10.12345 > 10.0.0.2.12345: UDP, length 16
13:18:16.168370 IP 10.0.0.10.12345 > 10.0.0.2.12345: UDP, length 16
13:18:16.168944 IP 10.0.0.10.12345 > 10.0.0.2.12345: UDP, length 16
13:18:16.169517 IP 10.0.0.10.12345 > 10.0.0.2.12345: UDP, length 16
13:18:16.170086 IP 10.0.0.10.12345 > 10.0.0.2.12345: UDP, length 16
13:18:16.170663 IP 10.0.0.10.12345 > 10.0.0.2.12345: UDP, length 16
13:18:16.171241 IP 10.0.0.10.12345 > 10.0.0.2.12345: UDP, length 16
13:18:16.171813 IP 10.0.0.10.12345 > 10.0.0.2.12345: UDP, length 16
13:18:16.172410 IP 10.0.0.10.12345 > 10.0.0.2.12345: UDP, length 16
13:18:16.172986 IP 10.0.0.10.12345 > 10.0.0.2.12345: UDP, length 16
13:18:16.173562 IP 10.0.0.10.12345 > 10.0.0.2.12345: UDP, length 16
13:18:16.174133 IP 10.0.0.10.12345 > 10.0.0.2.12345: UDP, length 16
13:18:16.174700 IP 10.0.0.10.12345 > 10.0.0.2.12345: UDP, length 16
13:18:16.175260 IP 10.0.0.10.12345 > 10.0.0.2.12345: UDP, length 16
13:18:16.175839 IP 10.0.0.10.12345 > 10.0.0.2.12345: UDP, length 16
13:18:16.176412 IP 10.0.0.10.12345 > 10.0.0.2.12345: UDP, length 16
13:18:16.176978 IP 10.0.0.10.12345 > 10.0.0.2.12345: UDP, length 16
13:18:16.177544 IP 10.0.0.10.12345 > 10.0.0.2.12345: UDP, length 16
13:18:16.178109 IP 10.0.0.10.12345 > 10.0.0.2.12345: UDP, length 16
13:18:16.178693 IP 10.0.0.10.12345 > 10.0.0.2.12345: UDP, length 16
13:18:16.179268 IP 10.0.0.10.12345 > 10.0.0.2.12345: UDP, length 16
13:18:16.179835 IP 10.0.0.10.12345 > 10.0.0.2.12345: UDP, length 16
13:18:16.180405 IP 10.0.0.10.12345 > 10.0.0.2.12345: UDP, length 16
13:18:16.180966 IP 10.0.0.10.12345 > 10.0.0.2.12345: UDP, length 16
13:18:16.181530 IP 10.0.0.10.12345 > 10.0.0.2.12345: UDP, length 16
13:18:16.182094 IP 10.0.0.10.12345 > 10.0.0.2.12345: UDP, length 16
13:18:16.182659 IP 10.0.0.10.12345 > 10.0.0.2.12345: UDP, length 16
13:18:16.183227 IP 10.0.0.10.12345 > 10.0.0.2.12345: UDP, length 16
13:18:16.183796 IP 10.0.0.10.12345 > 10.0.0.2.12345: UDP, length 16
13:18:16.184371 IP 10.0.0.10.12345 > 10.0.0.2.12345: UDP, length 16
13:18:16.184942 IP 10.0.0.10.12345 > 10.0.0.2.12345: UDP, length 16
13:18:16.185515 IP 10.0.0.10.12345 > 10.0.0.2.12345: UDP, length 16
13:18:16.186086 IP 10.0.0.10.12345 > 10.0.0.2.12345: UDP, length 16
13:18:16.186669 IP 10.0.0.10.12345 > 10.0.0.2.12345: UDP, length 16
13:18:16.187252 IP 10.0.0.10.12345 > 10.0.0.2.12345: UDP, length 16
13:18:16.187839 IP 10.0.0.10.12345 > 10.0.0.2.12345: UDP, length 16
13:18:16.188434 IP 10.0.0.10.12345 > 10.0.0.2.12345: UDP, length 16
13:18:16.189006 IP 10.0.0.10.12345 > 10.0.0.2.12345: UDP, length 16
13:18:16.189578 IP 10.0.0.10.12345 > 10.0.0.2.12345: UDP, length 16
13:18:16.190163 IP 10.0.0.10.12345 > 10.0.0.2.12345: UDP, length 16
13:18:16.190749 IP 10.0.0.10.12345 > 10.0.0.2.12345: UDP, length 16
13:18:16.191324 IP 10.0.0.10.12345 > 10.0.0.2.12345: UDP, length 16
13:18:16.191892 IP 10.0.0.10.12345 > 10.0.0.2.12345: UDP, length 16
13:18:16.192469 IP 10.0.0.10.12345 > 10.0.0.2.12345: UDP, length 16
13:18:16.193044 IP 10.0.0.10.12345 > 10.0.0.2.12345: UDP, length 16
13:18:16.193620 IP 10.0.0.10.12345 > 10.0.0.2.12345: UDP, length 16
13:18:16.194194 IP 10.0.0.10.12345 > 10.0.0.2.12345: UDP, length 16
13:18:16.194767 IP 10.0.0.10.12345 > 10.0.0.2.12345: UDP, length 16
13:18:16.195352 IP 10.0.0.10.12345 > 10.0.0.2.12345: UDP, length 16
13:18:16.195920 IP 10.0.0.10.12345 > 10.0.0.2.12345: UDP, length 16
13:18:16.196510 IP 10.0.0.10.12345 > 10.0.0.2.12345: UDP, length 16
13:18:16.197099 IP 10.0.0.10.12345 > 10.0.0.2.12345: UDP, length 16
13:18:16.197688 IP 10.0.0.10.12345 > 10.0.0.2.12345: UDP, length 16
13:18:16.198277 IP 10.0.0.10.12345 > 10.0.0.2.12345: UDP, length 16
13:18:16.198866 IP 10.0.0.10.12345 > 10.0.0.2.12345: UDP, length 16
13:18:16.199454 IP 10.0.0.10.12345 > 10.0.0.2.12345: UDP, length 16
13:18:16.200027 IP 10.0.0.10.12345 > 10.0.0.2.12345: UDP, length 16
13:18:16.200633 IP 10.0.0.10.12345 > 10.0.0.2.12345: UDP, length 16
13:18:16.201234 IP 10.0.0.10.12345 > 10.0.0.2.12345: UDP, length 16
13:18:16.201808 IP 10.0.0.10.12345 > 10.0.0.2.12345: UDP, length 16
13:18:16.202379 IP 10.0.0.10.12345 > 10.0.0.2.12345: UDP, length 16
13:18:16.202952 IP 10.0.0.10.12345 > 10.0.0.2.12345: UDP, length 16
13:18:16.203520 IP 10.0.0.10.12345 > 10.0.0.2.12345: UDP, length 16
13:18:16.204120 IP 10.0.0.10.12345 > 10.0.0.2.12345: UDP, length 16
13:18:16.204701 IP 10.0.0.10.12345 > 10.0.0.2.12345: UDP, length 16
13:18:16.205304 IP 10.0.0.10.12345 > 10.0.0.2.12345: UDP, length 16
13:18:16.205899 IP 10.0.0.10.12345 > 10.0.0.2.12345: UDP, length 16
13:18:16.206468 IP 10.0.0.10.12345 > 10.0.0.2.12345: UDP, length 16
13:18:16.207063 IP 10.0.0.10.12345 > 10.0.0.2.12345: UDP, length 16
13:18:16.207657 IP 10.0.0.10.12345 > 10.0.0.2.12345: UDP, length 16
13:18:16.208247 IP 10.0.0.10.12345 > 10.0.0.2.12345: UDP, length 16
13:18:16.208835 IP 10.0.0.10.12345 > 10.0.0.2.12345: UDP, length 16
13:18:16.209425 IP 10.0.0.10.12345 > 10.0.0.2.12345: UDP, length 16
13:18:16.210032 IP 10.0.0.10.12345 > 10.0.0.2.12345: UDP, length 16
13:18:16.210611 IP 10.0.0.10.12345 > 10.0.0.2.12345: UDP, length 16
13:18:16.211190 IP 10.0.0.10.12345 > 10.0.0.2.12345: UDP, length 16
13:18:16.211760 IP 10.0.0.10.12345 > 10.0.0.2.12345: UDP, length 16
13:18:16.212337 IP 10.0.0.10.12345 > 10.0.0.2.12345: UDP, length 16
13:18:16.212932 IP 10.0.0.10.12345 > 10.0.0.2.12345: UDP, length 16
13:18:16.213543 IP 10.0.0.10.12345 > 10.0.0.2.12345: UDP, length 16
13:18:16.214155 IP 10.0.0.10.12345 > 10.0.0.2.12345: UDP, length 16
13:18:16.214769 IP 10.0.0.10.12345 > 10.0.0.2.12345: UDP, length 16
13:18:16.215380 IP 10.0.0.10.12345 > 10.0.0.2.12345: UDP, length 16
13:18:16.215996 IP 10.0.0.10.12345 > 10.0.0.2.12345: UDP, length 16
13:18:16.216580 IP 10.0.0.10.12345 > 10.0.0.2.12345: UDP, length 16
13:18:16.217194 IP 10.0.0.10.12345 > 10.0.0.2.12345: UDP, length 16
13:18:16.217808 IP 10.0.0.10.12345 > 10.0.0.2.12345: UDP, length 16
13:18:16.218387 IP 10.0.0.10.12345 > 10.0.0.2.12345: UDP, length 16
13:18:16.218988 IP 10.0.0.10.12345 > 10.0.0.2.12345: UDP, length 16
13:18:16.219577 IP 10.0.0.10.12345 > 10.0.0.2.12345: UDP, length 16
13:18:16.220178 IP 10.0.0.10.12345 > 10.0.0.2.12345: UDP, length 16
13:18:16.220771 IP 10.0.0.10.12345 > 10.0.0.2.12345: UDP, length 16
13:18:16.221354 IP 10.0.0.10.12345 > 10.0.0.2.12345: UDP, length 16
13:18:16.221935 IP 10.0.0.10.12345 > 10.0.0.2.12345: UDP, length 16
13:18:16.222506 IP 10.0.0.10.12345 > 10.0.0.2.12345: UDP, length 16
13:18:16.223098 IP 10.0.0.10.12345 > 10.0.0.2.12345: UDP, length 16
13:18:16.223721 IP 10.0.0.10.12345 > 10.0.0.2.12345: UDP, length 16
13:18:16.224313 IP 10.0.0.10.12345 > 10.0.0.2.12345: UDP, length 16
13:18:16.224905 IP 10.0.0.10.12345 > 10.0.0.2.12345: UDP, length 16
13:18:16.225496 IP 10.0.0.10.12345 > 10.0.0.2.12345: UDP, length 16
13:18:16.226088 IP 10.0.0.10.12345 > 10.0.0.2.12345: UDP, length 16
13:18:16.226668 IP 10.0.0.10.12345 > 10.0.0.2.12345: UDP, length 16
13:18:16.227265 IP 10.0.0.10.12345 > 10.0.0.2.12345: UDP, length 16
13:18:16.227858 IP 10.0.0.10.12345 > 10.0.0.2.12345: UDP, length 16
13:18:16.228461 IP 10.0.0.10.12345 > 10.0.0.2.12345: UDP, length 16
13:18:16.229057 IP 10.0.0.10.12345 > 10.0.0.2.12345: UDP, length 16
13:18:16.229651 IP 10.0.0.10.12345 > 10.0.0.2.12345: UDP, length 16
13:18:16.230245 IP 10.0.0.10.12345 > 10.0.0.2.12345: UDP, length 16
13:18:16.230839 IP 10.0.0.10.12345 > 10.0.0.2.12345: UDP, length 16
13:18:16.231433 IP 10.0.0.10.12345 > 10.0.0.2.12345: UDP, length 16
13:18:16.232030 IP 10.0.0.10.12345 > 10.0.0.2.12345: UDP, length 16
13:18:16.232645 IP 10.0.0.10.12345 > 10.0.0.2.12345: UDP, length 16
13:18:16.233247 IP 10.0.0.10.12345 > 10.0.0.2.12345: UDP, length 16
13:18:16.233850 IP 10.0.0.10.12345 > 10.0.0.2.12345: UDP, length 16
13:18:16.234473 IP 10.0.0.10.12345 > 10.0.0.2.12345: UDP, length 16
13:18:16.235090 IP 10.0.0.10.12345 > 10.0.0.2.12345: UDP, length 16
13:18:16.235719 IP 10.0.0.10.12345 > 10.0.0.2.12345: UDP, length 16
13:18:16.236309 IP 10.0.0.10.12345 > 10.0.0.2.12345: UDP, length 16
13:18:16.236927 IP 10.0.0.10.12345 > 10.0.0.2.12345: UDP, length 16
13:18:16.237515 IP 10.0.0.10.12345 > 10.0.0.2.12345: UDP, length 16
13:18:16.238087 IP 10.0.0.10.12345 > 10.0.0.2.12345: UDP, length 16
13:18:16.238677 IP 10.0.0.10.12345 > 10.0.0.2.12345: UDP, length 16
13:18:16.239265 IP 10.0.0.10.12345 > 10.0.0.2.12345: UDP, length 16
13:18:16.239857 IP 10.0.0.10.12345 > 10.0.0.2.12345: UDP, length 16
13:18:16.240443 IP 10.0.0.10.12345 > 10.0.0.2.12345: UDP, length 16
13:18:16.241028 IP 10.0.0.10.12345 > 10.0.0.2.12345: UDP, length 16
13:18:16.241613 IP 10.0.0.10.12345 > 10.0.0.2.12345: UDP, length 16
13:18:16.242200 IP 10.0.0.10.12345 > 10.0.0.2.12345: UDP, length 16
13:18:16.242788 IP 10.0.0.10.12345 > 10.0.0.2.12345: UDP, length 16
13:18:16.243389 IP 10.0.0.10.12345 > 10.0.0.2.12345: UDP, length 16
13:18:16.244009 IP 10.0.0.10.12345 > 10.0.0.2.12345: UDP, length 16
13:18:16.244613 IP 10.0.0.10.12345 > 10.0.0.2.12345: UDP, length 16
13:18:16.245250 IP 10.0.0.10.12345 > 10.0.0.2.12345: UDP, length 16
13:18:16.245886 IP 10.0.0.10.12345 > 10.0.0.2.12345: UDP, length 16
13:18:16.246521 IP 10.0.0.10.12345 > 10.0.0.2.12345: UDP, length 16
13:18:16.247158 IP 10.0.0.10.12345 > 10.0.0.2.12345: UDP, length 16
13:18:16.247779 IP 10.0.0.10.12345 > 10.0.0.2.12345: UDP, length 16
13:18:16.248415 IP 10.0.0.10.12345 > 10.0.0.2.12345: UDP, length 16
13:18:16.249051 IP 10.0.0.10.12345 > 10.0.0.2.12345: UDP, length 16
13:18:16.249687 IP 10.0.0.10.12345 > 10.0.0.2.12345: UDP, length 16
13:18:16.250312 IP 10.0.0.10.12345 > 10.0.0.2.12345: UDP, length 16
13:18:16.250925 IP 10.0.0.10.12345 > 10.0.0.2.12345: UDP, length 16
13:18:16.251529 IP 10.0.0.10.12345 > 10.0.0.2.12345: UDP, length 16
13:18:16.252151 IP 10.0.0.10.12345 > 10.0.0.2.12345: UDP, length 16
13:18:16.252765 IP 10.0.0.10.12345 > 10.0.0.2.12345: UDP, length 16
13:18:16.253388 IP 10.0.0.10.12345 > 10.0.0.2.12345: UDP, length 16
13:18:16.254017 IP 10.0.0.10.12345 > 10.0.0.2.12345: UDP, length 16
13:18:16.254623 IP 10.0.0.10.12345 > 10.0.0.2.12345: UDP, length 16
13:18:16.255213 IP 10.0.0.10.12345 > 10.0.0.2.12345: UDP, length 16
13:18:16.255797 IP 10.0.0.10.12345 > 10.0.0.2.12345: UDP, length 16
13:18:16.256387 IP 10.0.0.10.12345 > 10.0.0.2.12345: UDP, length 16
13:18:16.256970 IP 10.0.0.10.12345 > 10.0.0.2.12345: UDP, length 16
13:18:16.257580 IP 10.0.0.10.12345 > 10.0.0.2.12345: UDP, length 16
13:18:16.258182 IP 10.0.0.10.12345 > 10.0.0.2.12345: UDP, length 16
13:18:16.258780 IP 10.0.0.10.12345 > 10.0.0.2.12345: UDP, length 16
13:18:16.259391 IP 10.0.0.10.12345 > 10.0.0.2.12345: UDP, length 16
13:18:16.260029 IP 10.0.0.10.12345 > 10.0.0.2.12345: UDP, length 16
13:18:16.260633 IP 10.0.0.10.12345 > 10.0.0.2.12345: UDP, length 16
13:18:16.261223 IP 10.0.0.10.12345 > 10.0.0.2.12345: UDP, length 16
13:18:16.261830 IP 10.0.0.10.12345 > 10.0.0.2.12345: UDP, length 16
13:18:16.262417 IP 10.0.0.10.12345 > 10.0.0.2.12345: UDP, length 16
13:18:16.263019 IP 10.0.0.10.12345 > 10.0.0.2.12345: UDP, length 16
13:18:16.263664 IP 10.0.0.10.12345 > 10.0.0.2.12345: UDP, length 16
13:18:16.264286 IP 10.0.0.10.12345 > 10.0.0.2.12345: UDP, length 16
13:18:16.264932 IP 10.0.0.10.12345 > 10.0.0.2.12345: UDP, length 16
13:18:16.265508 IP 10.0.0.10.12345 > 10.0.0.2.12345: UDP, length 16
13:18:16.266102 IP 10.0.0.10.12345 > 10.0.0.2.12345: UDP, length 16
13:18:16.266699 IP 10.0.0.10.12345 > 10.0.0.2.12345: UDP, length 16
13:18:16.267299 IP 10.0.0.10.12345 > 10.0.0.2.12345: UDP, length 16
13:18:16.267882 IP 10.0.0.10.12345 > 10.0.0.2.12345: UDP, length 16
13:18:16.268473 IP 10.0.0.10.12345 > 10.0.0.2.12345: UDP, length 16
13:18:16.269102 IP 10.0.0.10.12345 > 10.0.0.2.12345: UDP, length 16
13:18:16.269702 IP 10.0.0.10.12345 > 10.0.0.2.12345: UDP, length 16
13:18:16.270308 IP 10.0.0.10.12345 > 10.0.0.2.12345: UDP, length 16
13:18:16.270908 IP 10.0.0.10.12345 > 10.0.0.2.12345: UDP, length 16
13:18:16.271510 IP 10.0.0.10.12345 > 10.0.0.2.12345: UDP, length 16
13:18:16.272100 IP 10.0.0.10.12345 > 10.0.0.2.12345: UDP, length 16
13:18:16.272688 IP 10.0.0.10.12345 > 10.0.0.2.12345: UDP, length 16
13:18:16.273303 IP 10.0.0.10.12345 > 10.0.0.2.12345: UDP, length 16
13:18:16.273894 IP 10.0.0.10.12345 > 10.0.0.2.12345: UDP, length 16
13:18:16.274527 IP 10.0.0.10.12345 > 10.0.0.2.12345: UDP, length 16
13:18:16.275126 IP 10.0.0.10.12345 > 10.0.0.2.12345: UDP, length 16
13:18:16.275726 IP 10.0.0.10.12345 > 10.0.0.2.12345: UDP, length 16
13:18:16.276328 IP 10.0.0.10.12345 > 10.0.0.2.12345: UDP, length 16
13:18:16.276946 IP 10.0.0.10.12345 > 10.0.0.2.12345: UDP, length 16
13:18:16.277561 IP 10.0.0.10.12345 > 10.0.0.2.12345: UDP, length 16
13:18:16.278175 IP 10.0.0.10.12345 > 10.0.0.2.12345: UDP, length 16
13:18:16.278790 IP 10.0.0.10.12345 > 10.0.0.2.12345: UDP, length 16
13:18:16.279394 IP 10.0.0.10.12345 > 10.0.0.2.12345: UDP, length 16
13:18:16.280009 IP 10.0.0.10.12345 > 10.0.0.2.12345: UDP, length 16
13:18:16.280624 IP 10.0.0.10.12345 > 10.0.0.2.12345: UDP, length 16
13:18:16.281237 IP 10.0.0.10.12345 > 10.0.0.2.12345: UDP, length 16
13:18:16.281852 IP 10.0.0.10.12345 > 10.0.0.2.12345: UDP, length 16
13:18:16.282443 IP 10.0.0.10.12345 > 10.0.0.2.12345: UDP, length 16
13:18:16.283041 IP 10.0.0.10.12345 > 10.0.0.2.12345: UDP, length 16
13:18:16.283652 IP 10.0.0.10.12345 > 10.0.0.2.12345: UDP, length 16
13:18:16.284262 IP 10.0.0.10.12345 > 10.0.0.2.12345: UDP, length 16
13:18:16.284858 IP 10.0.0.10.12345 > 10.0.0.2.12345: UDP, length 16
13:18:16.285459 IP 10.0.0.10.12345 > 10.0.0.2.12345: UDP, length 16
13:18:16.286090 IP 10.0.0.10.12345 > 10.0.0.2.12345: UDP, length 16
13:18:16.286702 IP 10.0.0.10.12345 > 10.0.0.2.12345: UDP, length 16
13:18:16.287305 IP 10.0.0.10.12345 > 10.0.0.2.12345: UDP, length 16
13:18:16.287941 IP 10.0.0.10.12345 > 10.0.0.2.12345: UDP, length 16
13:18:16.288546 IP 10.0.0.10.12345 > 10.0.0.2.12345: UDP, length 16
13:18:16.289158 IP 10.0.0.10.12345 > 10.0.0.2.12345: UDP, length 16
13:18:16.289752 IP 10.0.0.10.12345 > 10.0.0.2.12345: UDP, length 16
13:18:16.290396 IP 10.0.0.10.12345 > 10.0.0.2.12345: UDP, length 16
13:18:16.291020 IP 10.0.0.10.12345 > 10.0.0.2.12345: UDP, length 16
13:18:16.291634 IP 10.0.0.10.12345 > 10.0.0.2.12345: UDP, length 16
13:18:16.292231 IP 10.0.0.10.12345 > 10.0.0.2.12345: UDP, length 16
13:18:16.292822 IP 10.0.0.10.12345 > 10.0.0.2.12345: UDP, length 16
13:18:16.293415 IP 10.0.0.10.12345 > 10.0.0.2.12345: UDP, length 16
13:18:16.294021 IP 10.0.0.10.12345 > 10.0.0.2.12345: UDP, length 16
13:18:16.294625 IP 10.0.0.10.12345 > 10.0.0.2.12345: UDP, length 16
13:18:16.295227 IP 10.0.0.10.12345 > 10.0.0.2.12345: UDP, length 16
13:18:16.295808 IP 10.0.0.10.12345 > 10.0.0.2.12345: UDP, length 16
13:18:16.296457 IP 10.0.0.10.12345 > 10.0.0.2.12345: UDP, length 16
13:18:16.297108 IP 10.0.0.10.12345 > 10.0.0.2.12345: UDP, length 16
13:18:16.297759 IP 10.0.0.10.12345 > 10.0.0.2.12345: UDP, length 16
13:18:16.298398 IP 10.0.0.10.12345 > 10.0.0.2.12345: UDP, length 16
13:18:16.299019 IP 10.0.0.10.12345 > 10.0.0.2.12345: UDP, length 16
13:18:16.299628 IP 10.0.0.10.12345 > 10.0.0.2.12345: UDP, length 16
13:18:16.300241 IP 10.0.0.10.12345 > 10.0.0.2.12345: UDP, length 16
13:18:16.300879 IP 10.0.0.10.12345 > 10.0.0.2.12345: UDP, length 16
13:18:16.301506 IP 10.0.0.10.12345 > 10.0.0.2.12345: UDP, length 16
13:18:16.302142 IP 10.0.0.10.12345 > 10.0.0.2.12345: UDP, length 16
13:18:16.302760 IP 10.0.0.10.12345 > 10.0.0.2.12345: UDP, length 16
13:18:16.303387 IP 10.0.0.10.12345 > 10.0.0.2.12345: UDP, length 16
13:18:16.303986 IP 10.0.0.10.12345 > 10.0.0.2.12345: UDP, length 16
13:18:16.304585 IP 10.0.0.10.12345 > 10.0.0.2.12345: UDP, length 16
13:18:16.305208 IP 10.0.0.10.12345 > 10.0.0.2.12345: UDP, length 16
13:18:16.305804 IP 10.0.0.10.12345 > 10.0.0.2.12345: UDP, length 16
13:18:16.306426 IP 10.0.0.10.12345 > 10.0.0.2.12345: UDP, length 16
13:18:16.307038 IP 10.0.0.10.12345 > 10.0.0.2.12345: UDP, length 16
13:18:16.307640 IP 10.0.0.10.12345 > 10.0.0.2.12345: UDP, length 16
13:18:16.308237 IP 10.0.0.10.12345 > 10.0.0.2.12345: UDP, length 16
13:18:16.308829 IP 10.0.0.10.12345 > 10.0.0.2.12345: UDP, length 16
13:18:16.309436 IP 10.0.0.10.12345 > 10.0.0.2.12345: UDP, length 16
13:18:16.310031 IP 10.0.0.10.12345 > 10.0.0.2.12345: UDP, length 16
13:18:16.310618 IP 10.0.0.10.12345 > 10.0.0.2.12345: UDP, length 16
13:18:16.311239 IP 10.0.0.10.12345 > 10.0.0.2.12345: UDP, length 16
13:18:16.311864 IP 10.0.0.10.12345 > 10.0.0.2.12345: UDP, length 16
13:18:16.312488 IP 10.0.0.10.12345 > 10.0.0.2.12345: UDP, length 16
13:18:16.313112 IP 10.0.0.10.12345 > 10.0.0.2.12345: UDP, length 16
13:18:16.313734 IP 10.0.0.10.12345 > 10.0.0.2.12345: UDP, length 16
13:18:16.314324 IP 10.0.0.10.12345 > 10.0.0.2.12345: UDP, length 16
13:18:16.314917 IP 10.0.0.10.12345 > 10.0.0.2.12345: UDP, length 16
13:18:16.315517 IP 10.0.0.10.12345 > 10.0.0.2.12345: UDP, length 16
13:18:16.316109 IP 10.0.0.10.12345 > 10.0.0.2.12345: UDP, length 16
13:18:16.316703 IP 10.0.0.10.12345 > 10.0.0.2.12345: UDP, length 16
13:18:16.317299 IP 10.0.0.10.12345 > 10.0.0.2.12345: UDP, length 16
13:18:16.317890 IP 10.0.0.10.12345 > 10.0.0.2.12345: UDP, length 16
13:18:16.318489 IP 10.0.0.10.12345 > 10.0.0.2.12345: UDP, length 16
13:18:16.319121 IP 10.0.0.10.12345 > 10.0.0.2.12345: UDP, length 16
13:18:16.319753 IP 10.0.0.10.12345 > 10.0.0.2.12345: UDP, length 16
13:18:16.320352 IP 10.0.0.10.12345 > 10.0.0.2.12345: UDP, length 16
13:18:16.320991 IP 10.0.0.10.12345 > 10.0.0.2.12345: UDP, length 16
13:18:16.321621 IP 10.0.0.10.12345 > 10.0.0.2.12345: UDP, length 16
13:18:16.322226 IP 10.0.0.10.12345 > 10.0.0.2.12345: UDP, length 16
13:18:16.322828 IP 10.0.0.10.12345 > 10.0.0.2.12345: UDP, length 16
13:18:16.323414 IP 10.0.0.10.12345 > 10.0.0.2.12345: UDP, length 16
13:18:16.324006 IP 10.0.0.10.12345 > 10.0.0.2.12345: UDP, length 16
13:18:16.324597 IP 10.0.0.10.12345 > 10.0.0.2.12345: UDP, length 16
13:18:16.325183 IP 10.0.0.10.12345 > 10.0.0.2.12345: UDP, length 16
13:18:16.325773 IP 10.0.0.10.12345 > 10.0.0.2.12345: UDP, length 16
13:18:16.326359 IP 10.0.0.10.12345 > 10.0.0.2.12345: UDP, length 16
13:18:16.326947 IP 10.0.0.10.12345 > 10.0.0.2.12345: UDP, length 16
13:18:16.327533 IP 10.0.0.10.12345 > 10.0.0.2.12345: UDP, length 16
13:18:16.328120 IP 10.0.0.10.12345 > 10.0.0.2.12345: UDP, length 16
13:18:16.328704 IP 10.0.0.10.12345 > 10.0.0.2.12345: UDP, length 16
13:18:16.329289 IP 10.0.0.10.12345 > 10.0.0.2.12345: UDP, length 16
13:18:16.329873 IP 10.0.0.10.12345 > 10.0.0.2.12345: UDP, length 16
13:18:16.330459 IP 10.0.0.10.12345 > 10.0.0.2.12345: UDP, length 16
13:18:16.331048 IP 10.0.0.10.12345 > 10.0.0.2.12345: UDP, length 16
13:18:16.331653 IP 10.0.0.10.12345 > 10.0.0.2.12345: UDP, length 16
13:18:16.332254 IP 10.0.0.10.12345 > 10.0.0.2.12345: UDP, length 16
13:18:16.332843 IP 10.0.0.10.12345 > 10.0.0.2.12345: UDP, length 16
13:18:16.333443 IP 10.0.0.10.12345 > 10.0.0.2.12345: UDP, length 16
13:18:16.334034 IP 10.0.0.10.12345 > 10.0.0.2.12345: UDP, length 16
13:18:16.334624 IP 10.0.0.10.12345 > 10.0.0.2.12345: UDP, length 16
13:18:16.335222 IP 10.0.0.10.12345 > 10.0.0.2.12345: UDP, length 16
13:18:16.335825 IP 10.0.0.10.12345 > 10.0.0.2.12345: UDP, length 16
13:18:16.336420 IP 10.0.0.10.12345 > 10.0.0.2.12345: UDP, length 16
13:18:16.337023 IP 10.0.0.10.12345 > 10.0.0.2.12345: UDP, length 16
13:18:16.337631 IP 10.0.0.10.12345 > 10.0.0.2.12345: UDP, length 16
13:18:16.338226 IP 10.0.0.10.12345 > 10.0.0.2.12345: UDP, length 16
13:18:16.338823 IP 10.0.0.10.12345 > 10.0.0.2.12345: UDP, length 16
13:18:16.339460 IP 10.0.0.10.12345 > 10.0.0.2.12345: UDP, length 16
13:18:16.340066 IP 10.0.0.10.12345 > 10.0.0.2.12345: UDP, length 16
13:18:16.340673 IP 10.0.0.10.12345 > 10.0.0.2.12345: UDP, length 16
13:18:16.341270 IP 10.0.0.10.12345 > 10.0.0.2.12345: UDP, length 16
13:18:16.341873 IP 10.0.0.10.12345 > 10.0.0.2.12345: UDP, length 16
13:18:16.342467 IP 10.0.0.10.12345 > 10.0.0.2.12345: UDP, length 16
13:18:16.343059 IP 10.0.0.10.12345 > 10.0.0.2.12345: UDP, length 16
13:18:16.343704 IP 10.0.0.10.12345 > 10.0.0.2.12345: UDP, length 16
13:18:16.344337 IP 10.0.0.10.12345 > 10.0.0.2.12345: UDP, length 16
13:18:16.344972 IP 10.0.0.10.12345 > 10.0.0.2.12345: UDP, length 16
13:18:16.345605 IP 10.0.0.10.12345 > 10.0.0.2.12345: UDP, length 16
13:18:16.346238 IP 10.0.0.10.12345 > 10.0.0.2.12345: UDP, length 16
13:18:16.346896 IP 10.0.0.10.12345 > 10.0.0.2.12345: UDP, length 16
13:18:16.347506 IP 10.0.0.10.12345 > 10.0.0.2.12345: UDP, length 16
13:18:16.348100 IP 10.0.0.10.12345 > 10.0.0.2.12345: UDP, length 16
13:18:16.348728 IP 10.0.0.10.12345 > 10.0.0.2.12345: UDP, length 16
13:18:16.349322 IP 10.0.0.10.12345 > 10.0.0.2.12345: UDP, length 16
13:18:16.349913 IP 10.0.0.10.12345 > 10.0.0.2.12345: UDP, length 16
13:18:16.350535 IP 10.0.0.10.12345 > 10.0.0.2.12345: UDP, length 16
13:18:16.351160 IP 10.0.0.10.12345 > 10.0.0.2.12345: UDP, length 16
13:18:16.351785 IP 10.0.0.10.12345 > 10.0.0.2.12345: UDP, length 16
13:18:16.352380 IP 10.0.0.10.12345 > 10.0.0.2.12345: UDP, length 16
13:18:16.353006 IP 10.0.0.10.12345 > 10.0.0.2.12345: UDP, length 16
13:18:16.353631 IP 10.0.0.10.12345 > 10.0.0.2.12345: UDP, length 16
13:18:16.354232 IP 10.0.0.10.12345 > 10.0.0.2.12345: UDP, length 16
13:18:16.354832 IP 10.0.0.10.12345 > 10.0.0.2.12345: UDP, length 16
13:18:16.355429 IP 10.0.0.10.12345 > 10.0.0.2.12345: UDP, length 16
13:18:16.356043 IP 10.0.0.10.12345 > 10.0.0.2.12345: UDP, length 16
13:18:16.356649 IP 10.0.0.10.12345 > 10.0.0.2.12345: UDP, length 16
13:18:16.357245 IP 10.0.0.10.12345 > 10.0.0.2.12345: UDP, length 16
13:18:16.357832 IP 10.0.0.10.12345 > 10.0.0.2.12345: UDP, length 16
13:18:16.358421 IP 10.0.0.10.12345 > 10.0.0.2.12345: UDP, length 16
13:18:16.359008 IP 10.0.0.10.12345 > 10.0.0.2.12345: UDP, length 16
13:18:16.359632 IP 10.0.0.10.12345 > 10.0.0.2.12345: UDP, length 16
13:18:16.360269 IP 10.0.0.10.12345 > 10.0.0.2.12345: UDP, length 16
13:18:16.360906 IP 10.0.0.10.12345 > 10.0.0.2.12345: UDP, length 16
13:18:16.361542 IP 10.0.0.10.12345 > 10.0.0.2.12345: UDP, length 16
13:18:16.362177 IP 10.0.0.10.12345 > 10.0.0.2.12345: UDP, length 16
13:18:16.362781 IP 10.0.0.10.12345 > 10.0.0.2.12345: UDP, length 16
13:18:16.363389 IP 10.0.0.10.12345 > 10.0.0.2.12345: UDP, length 16
13:18:16.364009 IP 10.0.0.10.12345 > 10.0.0.2.12345: UDP, length 16
13:18:16.364610 IP 10.0.0.10.12345 > 10.0.0.2.12345: UDP, length 16
13:18:16.365205 IP 10.0.0.10.12345 > 10.0.0.2.12345: UDP, length 16
13:18:16.365806 IP 10.0.0.10.12345 > 10.0.0.2.12345: UDP, length 16
13:18:16.366441 IP 10.0.0.10.12345 > 10.0.0.2.12345: UDP, length 16
13:18:16.367044 IP 10.0.0.10.12345 > 10.0.0.2.12345: UDP, length 16
13:18:16.367637 IP 10.0.0.10.12345 > 10.0.0.2.12345: UDP, length 16
13:18:16.368274 IP 10.0.0.10.12345 > 10.0.0.2.12345: UDP, length 16
13:18:16.368883 IP 10.0.0.10.12345 > 10.0.0.2.12345: UDP, length 16
13:18:16.369475 IP 10.0.0.10.12345 > 10.0.0.2.12345: UDP, length 16
13:18:16.370069 IP 10.0.0.10.12345 > 10.0.0.2.12345: UDP, length 16
13:18:16.370666 IP 10.0.0.10.12345 > 10.0.0.2.12345: UDP, length 16
13:18:16.371288 IP 10.0.0.10.12345 > 10.0.0.2.12345: UDP, length 16
13:18:16.371881 IP 10.0.0.10.12345 > 10.0.0.2.12345: UDP, length 16
13:18:16.372469 IP 10.0.0.10.12345 > 10.0.0.2.12345: UDP, length 16
13:18:16.373060 IP 10.0.0.10.12345 > 10.0.0.2.12345: UDP, length 16
13:18:16.373646 IP 10.0.0.10.12345 > 10.0.0.2.12345: UDP, length 16
13:18:16.374236 IP 10.0.0.10.12345 > 10.0.0.2.12345: UDP, length 16
13:18:16.374832 IP 10.0.0.10.12345 > 10.0.0.2.12345: UDP, length 16
13:18:16.375436 IP 10.0.0.10.12345 > 10.0.0.2.12345: UDP, length 16
13:18:16.376024 IP 10.0.0.10.12345 > 10.0.0.2.12345: UDP, length 16
13:18:16.376625 IP 10.0.0.10.12345 > 10.0.0.2.12345: UDP, length 16
13:18:16.377226 IP 10.0.0.10.12345 > 10.0.0.2.12345: UDP, length 16
13:18:16.377826 IP 10.0.0.10.12345 > 10.0.0.2.12345: UDP, length 16
13:18:16.378409 IP 10.0.0.10.12345 > 10.0.0.2.12345: UDP, length 16
13:18:16.379025 IP 10.0.0.10.12345 > 10.0.0.2.12345: UDP, length 16
13:18:16.379643 IP 10.0.0.10.12345 > 10.0.0.2.12345: UDP, length 16
13:18:16.380236 IP 10.0.0.10.12345 > 10.0.0.2.12345: UDP, length 16
13:18:16.380834 IP 10.0.0.10.12345 > 10.0.0.2.12345: UDP, length 16
13:18:16.381482 IP 10.0.0.10.12345 > 10.0.0.2.12345: UDP, length 16
13:18:16.382066 IP 10.0.0.10.12345 > 10.0.0.2.12345: UDP, length 16
13:18:16.382712 IP 10.0.0.10.12345 > 10.0.0.2.12345: UDP, length 16
13:18:16.383315 IP 10.0.0.10.12345 > 10.0.0.2.12345: UDP, length 16
13:18:16.383943 IP 10.0.0.10.12345 > 10.0.0.2.12345: UDP, length 16
13:18:16.384535 IP 10.0.0.10.12345 > 10.0.0.2.12345: UDP, length 16
13:18:16.385139 IP 10.0.0.10.12345 > 10.0.0.2.12345: UDP, length 16
13:18:16.385772 IP 10.0.0.10.12345 > 10.0.0.2.12345: UDP, length 16
13:18:16.386361 IP 10.0.0.10.12345 > 10.0.0.2.12345: UDP, length 16
13:18:16.386971 IP 10.0.0.10.12345 > 10.0.0.2.12345: UDP, length 16
13:18:16.387586 IP 10.0.0.10.12345 > 10.0.0.2.12345: UDP, length 16
13:18:16.388183 IP 10.0.0.10.12345 > 10.0.0.2.12345: UDP, length 16
13:18:16.388780 IP 10.0.0.10.12345 > 10.0.0.2.12345: UDP, length 16
13:18:16.389376 IP 10.0.0.10.12345 > 10.0.0.2.12345: UDP, length 16
13:18:16.389975 IP 10.0.0.10.12345 > 10.0.0.2.12345: UDP, length 16
13:18:16.390580 IP 10.0.0.10.12345 > 10.0.0.2.12345: UDP, length 16
13:18:16.391185 IP 10.0.0.10.12345 > 10.0.0.2.12345: UDP, length 16
13:18:16.391791 IP 10.0.0.10.12345 > 10.0.0.2.12345: UDP, length 16
13:18:16.392397 IP 10.0.0.10.12345 > 10.0.0.2.12345: UDP, length 16
13:18:16.393006 IP 10.0.0.10.12345 > 10.0.0.2.12345: UDP, length 16
13:18:16.393602 IP 10.0.0.10.12345 > 10.0.0.2.12345: UDP, length 16
13:18:16.394226 IP 10.0.0.10.12345 > 10.0.0.2.12345: UDP, length 16
13:18:16.394820 IP 10.0.0.10.12345 > 10.0.0.2.12345: UDP, length 16
13:18:16.395401 IP 10.0.0.10.12345 > 10.0.0.2.12345: UDP, length 16
13:18:16.395979 IP 10.0.0.10.12345 > 10.0.0.2.12345: UDP, length 16
13:18:16.396570 IP 10.0.0.10.12345 > 10.0.0.2.12345: UDP, length 16
13:18:16.397180 IP 10.0.0.10.12345 > 10.0.0.2.12345: UDP, length 16
13:18:16.397789 IP 10.0.0.10.12345 > 10.0.0.2.12345: UDP, length 16
13:18:16.398399 IP 10.0.0.10.12345 > 10.0.0.2.12345: UDP, length 16
13:18:16.398993 IP 10.0.0.10.12345 > 10.0.0.2.12345: UDP, length 16
13:18:16.399574 IP 10.0.0.10.12345 > 10.0.0.2.12345: UDP, length 16
13:18:16.400186 IP 10.0.0.10.12345 > 10.0.0.2.12345: UDP, length 16
13:18:16.400798 IP 10.0.0.10.12345 > 10.0.0.2.12345: UDP, length 16
13:18:16.401388 IP 10.0.0.10.12345 > 10.0.0.2.12345: UDP, length 16
13:18:16.401990 IP 10.0.0.10.12345 > 10.0.0.2.12345: UDP, length 16
13:18:16.402573 IP 10.0.0.10.12345 > 10.0.0.2.12345: UDP, length 16
13:18:16.403158 IP 10.0.0.10.12345 > 10.0.0.2.12345: UDP, length 16
13:18:16.403730 IP 10.0.0.10.12345 > 10.0.0.2.12345: UDP, length 16
13:18:16.404313 IP 10.0.0.10.12345 > 10.0.0.2.12345: UDP, length 16
13:18:16.404894 IP 10.0.0.10.12345 > 10.0.0.2.12345: UDP, length 16
13:18:16.405474 IP 10.0.0.10.12345 > 10.0.0.2.12345: UDP, length 16
13:18:16.406051 IP 10.0.0.10.12345 > 10.0.0.2.12345: UDP, length 16
13:18:16.406649 IP 10.0.0.10.12345 > 10.0.0.2.12345: UDP, length 16
13:18:16.407248 IP 10.0.0.10.12345 > 10.0.0.2.12345: UDP, length 16
13:18:16.407820 IP 10.0.0.10.12345 > 10.0.0.2.12345: UDP, length 16
13:18:16.408444 IP 10.0.0.10.12345 > 10.0.0.2.12345: UDP, length 16
13:18:16.409073 IP 10.0.0.10.12345 > 10.0.0.2.12345: UDP, length 16
13:18:16.409683 IP 10.0.0.10.12345 > 10.0.0.2.12345: UDP, length 16
13:18:16.410298 IP 10.0.0.10.12345 > 10.0.0.2.12345: UDP, length 16
13:18:16.410896 IP 10.0.0.10.12345 > 10.0.0.2.12345: UDP, length 16
13:18:16.411483 IP 10.0.0.10.12345 > 10.0.0.2.12345: UDP, length 16
13:18:16.412057 IP 10.0.0.10.12345 > 10.0.0.2.12345: UDP, length 16
13:18:16.412651 IP 10.0.0.10.12345 > 10.0.0.2.12345: UDP, length 16
13:18:16.413243 IP 10.0.0.10.12345 > 10.0.0.2.12345: UDP, length 16
13:18:16.413855 IP 10.0.0.10.12345 > 10.0.0.2.12345: UDP, length 16
13:18:16.414468 IP 10.0.0.10.12345 > 10.0.0.2.12345: UDP, length 16
13:18:16.415082 IP 10.0.0.10.12345 > 10.0.0.2.12345: UDP, length 16
13:18:16.415701 IP 10.0.0.10.12345 > 10.0.0.2.12345: UDP, length 16
13:18:16.416279 IP 10.0.0.10.12345 > 10.0.0.2.12345: UDP, length 16
13:18:16.416890 IP 10.0.0.10.12345 > 10.0.0.2.12345: UDP, length 16
13:18:16.417500 IP 10.0.0.10.12345 > 10.0.0.2.12345: UDP, length 16
13:18:16.418119 IP 10.0.0.10.12345 > 10.0.0.2.12345: UDP, length 16
13:18:16.418700 IP 10.0.0.10.12345 > 10.0.0.2.12345: UDP, length 16
13:18:16.419288 IP 10.0.0.10.12345 > 10.0.0.2.12345: UDP, length 16
13:18:16.419870 IP 10.0.0.10.12345 > 10.0.0.2.12345: UDP, length 16
13:18:16.420458 IP 10.0.0.10.12345 > 10.0.0.2.12345: UDP, length 16
13:18:16.421041 IP 10.0.0.10.12345 > 10.0.0.2.12345: UDP, length 16
13:18:16.421622 IP 10.0.0.10.12345 > 10.0.0.2.12345: UDP, length 16
13:18:16.422203 IP 10.0.0.10.12345 > 10.0.0.2.12345: UDP, length 16
13:18:16.422791 IP 10.0.0.10.12345 > 10.0.0.2.12345: UDP, length 16
13:18:16.423391 IP 10.0.0.10.12345 > 10.0.0.2.12345: UDP, length 16
13:18:16.423974 IP 10.0.0.10.12345 > 10.0.0.2.12345: UDP, length 16
13:18:16.424573 IP 10.0.0.10.12345 > 10.0.0.2.12345: UDP, length 16
13:18:16.425177 IP 10.0.0.10.12345 > 10.0.0.2.12345: UDP, length 16
13:18:16.425810 IP 10.0.0.10.12345 > 10.0.0.2.12345: UDP, length 16
13:18:16.426411 IP 10.0.0.10.12345 > 10.0.0.2.12345: UDP, length 16
13:18:16.427031 IP 10.0.0.10.12345 > 10.0.0.2.12345: UDP, length 16
13:18:16.427633 IP 10.0.0.10.12345 > 10.0.0.2.12345: UDP, length 16
13:18:16.428249 IP 10.0.0.10.12345 > 10.0.0.2.12345: UDP, length 16
13:18:16.428869 IP 10.0.0.10.12345 > 10.0.0.2.12345: UDP, length 16
13:18:16.429488 IP 10.0.0.10.12345 > 10.0.0.2.12345: UDP, length 16
13:18:16.430130 IP 10.0.0.10.12345 > 10.0.0.2.12345: UDP, length 16
13:18:16.430770 IP 10.0.0.10.12345 > 10.0.0.2.12345: UDP, length 16
13:18:16.431408 IP 10.0.0.10.12345 > 10.0.0.2.12345: UDP, length 16
13:18:16.432026 IP 10.0.0.10.12345 > 10.0.0.2.12345: UDP, length 16
13:18:16.432667 IP 10.0.0.10.12345 > 10.0.0.2.12345: UDP, length 16
13:18:16.433284 IP 10.0.0.10.12345 > 10.0.0.2.12345: UDP, length 16
13:18:16.433903 IP 10.0.0.10.12345 > 10.0.0.2.12345: UDP, length 16
13:18:16.434529 IP 10.0.0.10.12345 > 10.0.0.2.12345: UDP, length 16
13:18:16.435128 IP 10.0.0.10.12345 > 10.0.0.2.12345: UDP, length 16
13:18:16.435726 IP 10.0.0.10.12345 > 10.0.0.2.12345: UDP, length 16
13:18:16.436341 IP 10.0.0.10.12345 > 10.0.0.2.12345: UDP, length 16
13:18:16.436946 IP 10.0.0.10.12345 > 10.0.0.2.12345: UDP, length 16
13:18:16.437550 IP 10.0.0.10.12345 > 10.0.0.2.12345: UDP, length 16
13:18:16.438142 IP 10.0.0.10.12345 > 10.0.0.2.12345: UDP, length 16
13:18:16.438762 IP 10.0.0.10.12345 > 10.0.0.2.12345: UDP, length 16
13:18:16.439382 IP 10.0.0.10.12345 > 10.0.0.2.12345: UDP, length 16
13:18:16.440003 IP 10.0.0.10.12345 > 10.0.0.2.12345: UDP, length 16
13:18:16.440622 IP 10.0.0.10.12345 > 10.0.0.2.12345: UDP, length 16
13:18:16.441241 IP 10.0.0.10.12345 > 10.0.0.2.12345: UDP, length 16
13:18:16.441860 IP 10.0.0.10.12345 > 10.0.0.2.12345: UDP, length 16
13:18:16.442461 IP 10.0.0.10.12345 > 10.0.0.2.12345: UDP, length 16
13:18:16.443070 IP 10.0.0.10.12345 > 10.0.0.2.12345: UDP, length 16
13:18:16.443738 IP 10.0.0.10.12345 > 10.0.0.2.12345: UDP, length 16
13:18:16.444359 IP 10.0.0.10.12345 > 10.0.0.2.12345: UDP, length 16
13:18:16.444960 IP 10.0.0.10.12345 > 10.0.0.2.12345: UDP, length 16
13:18:16.445597 IP 10.0.0.10.12345 > 10.0.0.2.12345: UDP, length 16
13:18:16.446235 IP 10.0.0.10.12345 > 10.0.0.2.12345: UDP, length 16
13:18:16.446869 IP 10.0.0.10.12345 > 10.0.0.2.12345: UDP, length 16
13:18:16.447508 IP 10.0.0.10.12345 > 10.0.0.2.12345: UDP, length 16
13:18:16.448145 IP 10.0.0.10.12345 > 10.0.0.2.12345: UDP, length 16
13:18:16.448781 IP 10.0.0.10.12345 > 10.0.0.2.12345: UDP, length 16
13:18:16.449419 IP 10.0.0.10.12345 > 10.0.0.2.12345: UDP, length 16
13:18:16.450041 IP 10.0.0.10.12345 > 10.0.0.2.12345: UDP, length 16
13:18:16.450652 IP 10.0.0.10.12345 > 10.0.0.2.12345: UDP, length 16
13:18:16.451243 IP 10.0.0.10.12345 > 10.0.0.2.12345: UDP, length 16
13:18:16.451845 IP 10.0.0.10.12345 > 10.0.0.2.12345: UDP, length 16
13:18:16.452442 IP 10.0.0.10.12345 > 10.0.0.2.12345: UDP, length 16
13:18:16.453038 IP 10.0.0.10.12345 > 10.0.0.2.12345: UDP, length 16
13:18:16.453644 IP 10.0.0.10.12345 > 10.0.0.2.12345: UDP, length 16
13:18:16.454286 IP 10.0.0.10.12345 > 10.0.0.2.12345: UDP, length 16
13:18:16.454899 IP 10.0.0.10.12345 > 10.0.0.2.12345: UDP, length 16
13:18:16.455498 IP 10.0.0.10.12345 > 10.0.0.2.12345: UDP, length 16
13:18:16.456090 IP 10.0.0.10.12345 > 10.0.0.2.12345: UDP, length 16
