13:04:24.779240 IP 10.0.0.5.12345 > 10.0.0.2.12345: UDP, length 16
13:04:24.779759 IP 10.0.0.5.12345 > 10.0.0.2.12345: UDP, length 16
13:04:24.780337 IP 10.0.0.5.12345 > 10.0.0.2.12345: UDP, length 16
13:04:24.780914 IP 10.0.0.5.12345 > 10.0.0.2.12345: UDP, length 16
13:04:24.781501 IP 10.0.0.5.12345 > 10.0.0.2.12345: UDP, length 16
13:04:24.782077 IP 10.0.0.5.12345 > 10.0.0.2.12345: UDP, length 16
13:04:24.782658 IP 10.0.0.5.12345 > 10.0.0.2.12345: UDP, length 16
13:04:24.783230 IP 10.0.0.5.12345 > 10.0.0.2.12345: UDP, length 16
13:04:24.783804 IP 10.0.0.5.12345 > 10.0.0.2.12345: UDP, length 16
13:04:24.784396 IP 10.0.0.5.12345 > 10.0.0.2.12345: UDP, length 16
13:04:24.784965 IP 10.0.0.5.12345 > 10.0.0.2.12345: UDP, length 16
13:04:24.785538 IP 10.0.0.5.12345 > 10.0.0.2.12345: UDP, length 16
13:04:24.786119 IP 10.0.0.5.12345 > 10.0.0.2.12345: UDP, length 16
13:04:24.786698 IP 10.0.0.5.12345 > 10.0.0.2.12345: UDP, length 16
13:04:24.787279 IP 10.0.0.5.12345 > 10.0.0.2.12345: UDP, length 16
13:04:24.787863 IP 10.0.0.5.12345 > 10.0.0.2.12345: UDP, length 16
13:04:24.788463 IP 10.0.0.5.12345 > 10.0.0.2.12345: UDP, length 16
13:04:24.789032 IP 10.0.0.5.12345 > 10.0.0.2.12345: UDP, length 16
13:04:24.789608 IP 10.0.0.5.12345 > 10.0.0.2.12345: UDP, length 16
13:04:24.790193 IP 10.0.0.5.12345 > 10.0.0.2.12345: UDP, length 16
13:04:24.790773 IP 10.0.0.5.12345 > 10.0.0.2.12345: UDP, length 16
13:04:24.791350 IP 10.0.0.5.12345 > 10.0.0.2.12345: UDP, length 16
13:04:24.791951 IP 10.0.0.5.12345 > 10.0.0.2.12345: UDP, length 16
13:04:24.792517 IP 10.0.0.5.12345 > 10.0.0.2.12345: UDP, length 16
13:04:24.793094 IP 10.0.0.5.12345 > 10.0.0.2.12345: UDP, length 16
13:04:24.793673 IP 10.0.0.5.12345 > 10.0.0.2.12345: UDP, length 16
13:04:24.794250 IP 10.0.0.5.12345 > 10.0.0.2.12345: UDP, length 16
13:04:24.794832 IP 10.0.0.5.12345 > 10.0.0.2.12345: UDP, length 16
13:04:24.795411 IP 10.0.0.5.12345 > 10.0.0.2.12345: UDP, length 16
13:04:24.795991 IP 10.0.0.5.12345 > 10.0.0.2.12345: UDP, length 16
13:04:24.796579 IP 10.0.0.5.12345 > 10.0.0.2.12345: UDP, length 16
13:04:24.797167 IP 10.0.0.5.12345 > 10.0.0.2.12345: UDP, length 16
13:04:24.797763 IP 10.0.0.5.12345 > 10.0.0.2.12345: UDP, length 16
13:04:24.798343 IP 10.0.0.5.12345 > 10.0.0.2.12345: UDP, length 16
13:04:24.798922 IP 10.0.0.5.12345 > 10.0.0.2.12345: UDP, length 16
13:04:24.799498 IP 10.0.0.5.12345 > 10.0.0.2.12345: UDP, length 16
13:04:24.800070 IP 10.0.0.5.12345 > 10.0.0.2.12345: UDP, length 16
13:04:24.800643 IP 10.0.0.5.12345 > 10.0.0.2.12345: UDP, length 16
13:04:24.801231 IP 10.0.0.5.12345 > 10.0.0.2.12345: UDP, length 16
13:04:24.801819 IP 10.0.0.5.12345 > 10.0.0.2.12345: UDP, length 16
13:04:24.802387 IP 10.0.0.5.12345 > 10.0.0.2.12345: UDP, length 16
13:04:24.802953 IP 10.0.0.5.12345 > 10.0.0.2.12345: UDP, length 16
13:04:24.803538 IP 10.0.0.5.12345 > 10.0.0.2.12345: UDP, length 16
13:04:24.804112 IP 10.0.0.5.12345 > 10.0.0.2.12345: UDP, length 16
13:04:24.804686 IP 10.0.0.5.12345 > 10.0.0.2.12345: UDP, length 16
13:04:24.805273 IP 10.0.0.5.12345 > 10.0.0.2.12345: UDP, length 16
13:04:24.805858 IP 10.0.0.5.12345 > 10.0.0.2.12345: UDP, length 16
13:04:24.806445 IP 10.0.0.5.12345 > 10.0.0.2.12345: UDP, length 16
13:04:24.807032 IP 10.0.0.5.12345 > 10.0.0.2.12345: UDP, length 16
13:04:24.807605 IP 10.0.0.5.12345 > 10.0.0.2.12345: UDP, length 16
13:04:24.808172 IP 10.0.0.5.12345 > 10.0.0.2.12345: UDP, length 16
13:04:24.808732 IP 10.0.0.5.12345 > 10.0.0.2.12345: UDP, length 16
13:04:24.809291 IP 10.0.0.5.12345 > 10.0.0.2.12345: UDP, length 16
13:04:24.809849 IP 10.0.0.5.12345 > 10.0.0.2.12345: UDP, length 16
13:04:24.810406 IP 10.0.0.5.12345 > 10.0.0.2.12345: UDP, length 16
13:04:24.810964 IP 10.0.0.5.12345 > 10.0.0.2.12345: UDP, length 16
13:04:24.811522 IP 10.0.0.5.12345 > 10.0.0.2.12345: UDP, length 16
13:04:24.812083 IP 10.0.0.5.12345 > 10.0.0.2.12345: UDP, length 16
13:04:24.812642 IP 10.0.0.5.12345 > 10.0.0.2.12345: UDP, length 16
13:04:24.813200 IP 10.0.0.5.12345 > 10.0.0.2.12345: UDP, length 16
13:04:24.813758 IP 10.0.0.5.12345 > 10.0.0.2.12345: UDP, length 16
13:04:24.814318 IP 10.0.0.5.12345 > 10.0.0.2.12345: UDP, length 16
13:04:24.814876 IP 10.0.0.5.12345 > 10.0.0.2.12345: UDP, length 16
13:04:24.815441 IP 10.0.0.5.12345 > 10.0.0.2.12345: UDP, length 16
13:04:24.816000 IP 10.0.0.5.12345 > 10.0.0.2.12345: UDP, length 16
13:04:24.816559 IP 10.0.0.5.12345 > 10.0.0.2.12345: UDP, length 16
13:04:24.817117 IP 10.0.0.5.12345 > 10.0.0.2.12345: UDP, length 16
13:04:24.817677 IP 10.0.0.5.12345 > 10.0.0.2.12345: UDP, length 16
13:04:24.818236 IP 10.0.0.5.12345 > 10.0.0.2.12345: UDP, length 16
13:04:24.818818 IP 10.0.0.5.12345 > 10.0.0.2.12345: UDP, length 16
13:04:24.819391 IP 10.0.0.5.12345 > 10.0.0.2.12345: UDP, length 16
13:04:24.819974 IP 10.0.0.5.12345 > 10.0.0.2.12345: UDP, length 16
13:04:24.820557 IP 10.0.0.5.12345 > 10.0.0.2.12345: UDP, length 16
13:04:24.821139 IP 10.0.0.5.12345 > 10.0.0.2.12345: UDP, length 16
13:04:24.821722 IP 10.0.0.5.12345 > 10.0.0.2.12345: UDP, length 16
13:04:24.822305 IP 10.0.0.5.12345 > 10.0.0.2.12345: UDP, length 16
13:04:24.822888 IP 10.0.0.5.12345 > 10.0.0.2.12345: UDP, length 16
13:04:24.823494 IP 10.0.0.5.12345 > 10.0.0.2.12345: UDP, length 16
13:04:24.824089 IP 10.0.0.5.12345 > 10.0.0.2.12345: UDP, length 16
13:04:24.824697 IP 10.0.0.5.12345 > 10.0.0.2.12345: UDP, length 16
13:04:24.825313 IP 10.0.0.5.12345 > 10.0.0.2.12345: UDP, length 16
13:04:24.825936 IP 10.0.0.5.12345 > 10.0.0.2.12345: UDP, length 16
13:04:24.826530 IP 10.0.0.5.12345 > 10.0.0.2.12345: UDP, length 16
13:04:24.827123 IP 10.0.0.5.12345 > 10.0.0.2.12345: UDP, length 16
13:04:24.827711 IP 10.0.0.5.12345 > 10.0.0.2.12345: UDP, length 16
13:04:24.828294 IP 10.0.0.5.12345 > 10.0.0.2.12345: UDP, length 16
13:04:24.828870 IP 10.0.0.5.12345 > 10.0.0.2.12345: UDP, length 16
13:04:24.829444 IP 10.0.0.5.12345 > 10.0.0.2.12345: UDP, length 16
13:04:24.830024 IP 10.0.0.5.12345 > 10.0.0.2.12345: UDP, length 16
13:04:24.830600 IP 10.0.0.5.12345 > 10.0.0.2.12345: UDP, length 16
13:04:24.831174 IP 10.0.0.5.12345 > 10.0.0.2.12345: UDP, length 16
13:04:24.831722 IP 10.0.0.5.12345 > 10.0.0.2.12345: UDP, length 16
13:04:24.832298 IP 10.0.0.5.12345 > 10.0.0.2.12345: UDP, length 16
13:04:24.832869 IP 10.0.0.5.12345 > 10.0.0.2.12345: UDP, length 16
13:04:24.833448 IP 10.0.0.5.12345 > 10.0.0.2.12345: UDP, length 16
13:04:24.834020 IP 10.0.0.5.12345 > 10.0.0.2.12345: UDP, length 16
13:04:24.834599 IP 10.0.0.5.12345 > 10.0.0.2.12345: UDP, length 16
13:04:24.835173 IP 10.0.0.5.12345 > 10.0.0.2.12345: UDP, length 16
13:04:24.835762 IP 10.0.0.5.12345 > 10.0.0.2.12345: UDP, length 16
13:04:24.836363 IP 10.0.0.5.12345 > 10.0.0.2.12345: UDP, length 16
13:04:24.836949 IP 10.0.0.5.12345 > 10.0.0.2.12345: UDP, length 16
13:04:24.837524 IP 10.0.0.5.12345 > 10.0.0.2.12345: UDP, length 16
13:04:24.838095 IP 10.0.0.5.12345 > 10.0.0.2.12345: UDP, length 16
13:04:24.838678 IP 10.0.0.5.12345 > 10.0.0.2.12345: UDP, length 16
13:04:24.839259 IP 10.0.0.5.12345 > 10.0.0.2.12345: UDP, length 16
13:04:24.839828 IP 10.0.0.5.12345 > 10.0.0.2.12345: UDP, length 16
13:04:24.840397 IP 10.0.0.5.12345 > 10.0.0.2.12345: UDP, length 16
13:04:24.840967 IP 10.0.0.5.12345 > 10.0.0.2.12345: UDP, length 16
13:04:24.841537 IP 10.0.0.5.12345 > 10.0.0.2.12345: UDP, length 16
13:04:24.842112 IP 10.0.0.5.12345 > 10.0.0.2.12345: UDP, length 16
13:04:24.842696 IP 10.0.0.5.12345 > 10.0.0.2.12345: UDP, length 16
13:04:24.843269 IP 10.0.0.5.12345 > 10.0.0.2.12345: UDP, length 16
13:04:24.843837 IP 10.0.0.5.12345 > 10.0.0.2.12345: UDP, length 16
13:04:24.844401 IP 10.0.0.5.12345 > 10.0.0.2.12345: UDP, length 16
13:04:24.844968 IP 10.0.0.5.12345 > 10.0.0.2.12345: UDP, length 16
13:04:24.845535 IP 10.0.0.5.12345 > 10.0.0.2.12345: UDP, length 16
13:04:24.846102 IP 10.0.0.5.12345 > 10.0.0.2.12345: UDP, length 16
13:04:24.846669 IP 10.0.0.5.12345 > 10.0.0.2.12345: UDP, length 16
13:04:24.847249 IP 10.0.0.5.12345 > 10.0.0.2.12345: UDP, length 16
13:04:24.847839 IP 10.0.0.5.12345 > 10.0.0.2.12345: UDP, length 16
13:04:24.848434 IP 10.0.0.5.12345 > 10.0.0.2.12345: UDP, length 16
13:04:24.849014 IP 10.0.0.5.12345 > 10.0.0.2.12345: UDP, length 16
13:04:24.849583 IP 10.0.0.5.12345 > 10.0.0.2.12345: UDP, length 16
13:04:24.850158 IP 10.0.0.5.12345 > 10.0.0.2.12345: UDP, length 16
13:04:24.850735 IP 10.0.0.5.12345 > 10.0.0.2.12345: UDP, length 16
13:04:24.851318 IP 10.0.0.5.12345 > 10.0.0.2.12345: UDP, length 16
13:04:24.851903 IP 10.0.0.5.12345 > 10.0.0.2.12345: UDP, length 16
13:04:24.852488 IP 10.0.0.5.12345 > 10.0.0.2.12345: UDP, length 16
13:04:24.853071 IP 10.0.0.5.12345 > 10.0.0.2.12345: UDP, length 16
13:04:24.853652 IP 10.0.0.5.12345 > 10.0.0.2.12345: UDP, length 16
13:04:24.854232 IP 10.0.0.5.12345 > 10.0.0.2.12345: UDP, length 16
13:04:24.854810 IP 10.0.0.5.12345 > 10.0.0.2.12345: UDP, length 16
13:04:24.855391 IP 10.0.0.5.12345 > 10.0.0.2.12345: UDP, length 16
13:04:24.855967 IP 10.0.0.5.12345 > 10.0.0.2.12345: UDP, length 16
13:04:24.856545 IP 10.0.0.5.12345 > 10.0.0.2.12345: UDP, length 16
13:04:24.857117 IP 10.0.0.5.12345 > 10.0.0.2.12345: UDP, length 16
13:04:24.857687 IP 10.0.0.5.12345 > 10.0.0.2.12345: UDP, length 16
13:04:24.858263 IP 10.0.0.5.12345 > 10.0.0.2.12345: UDP, length 16
13:04:24.858839 IP 10.0.0.5.12345 > 10.0.0.2.12345: UDP, length 16
13:04:24.859419 IP 10.0.0.5.12345 > 10.0.0.2.12345: UDP, length 16
13:04:24.859993 IP 10.0.0.5.12345 > 10.0.0.2.12345: UDP, length 16
13:04:24.860570 IP 10.0.0.5.12345 > 10.0.0.2.12345: UDP, length 16
13:04:24.861141 IP 10.0.0.5.12345 > 10.0.0.2.12345: UDP, length 16
13:04:24.861732 IP 10.0.0.5.12345 > 10.0.0.2.12345: UDP, length 16
13:04:24.862323 IP 10.0.0.5.12345 > 10.0.0.2.12345: UDP, length 16
13:04:24.862914 IP 10.0.0.5.12345 > 10.0.0.2.12345: UDP, length 16
13:04:24.863488 IP 10.0.0.5.12345 > 10.0.0.2.12345: UDP, length 16
13:04:24.864080 IP 10.0.0.5.12345 > 10.0.0.2.12345: UDP, length 16
13:04:24.864702 IP 10.0.0.5.12345 > 10.0.0.2.12345: UDP, length 16
13:04:24.865310 IP 10.0.0.5.12345 > 10.0.0.2.12345: UDP, length 16
13:04:24.865919 IP 10.0.0.5.12345 > 10.0.0.2.12345: UDP, length 16
13:04:24.866493 IP 10.0.0.5.12345 > 10.0.0.2.12345: UDP, length 16
13:04:24.867066 IP 10.0.0.5.12345 > 10.0.0.2.12345: UDP, length 16
13:04:24.867648 IP 10.0.0.5.12345 > 10.0.0.2.12345: UDP, length 16
13:04:24.868222 IP 10.0.0.5.12345 > 10.0.0.2.12345: UDP, length 16
13:04:24.868819 IP 10.0.0.5.12345 > 10.0.0.2.12345: UDP, length 16
13:04:24.869392 IP 10.0.0.5.12345 > 10.0.0.2.12345: UDP, length 16
13:04:24.869977 IP 10.0.0.5.12345 > 10.0.0.2.12345: UDP, length 16
13:04:24.870579 IP 10.0.0.5.12345 > 10.0.0.2.12345: UDP, length 16
13:04:24.871211 IP 10.0.0.5.12345 > 10.0.0.2.12345: UDP, length 16
13:04:24.871779 IP 10.0.0.5.12345 > 10.0.0.2.12345: UDP, length 16
13:04:24.872382 IP 10.0.0.5.12345 > 10.0.0.2.12345: UDP, length 16
13:04:24.872986 IP 10.0.0.5.12345 > 10.0.0.2.12345: UDP, length 16
13:04:24.873593 IP 10.0.0.5.12345 > 10.0.0.2.12345: UDP, length 16
13:04:24.874197 IP 10.0.0.5.12345 > 10.0.0.2.12345: UDP, length 16
13:04:24.874795 IP 10.0.0.5.12345 > 10.0.0.2.12345: UDP, length 16
13:04:24.875389 IP 10.0.0.5.12345 > 10.0.0.2.12345: UDP, length 16
13:04:24.875959 IP 10.0.0.5.12345 > 10.0.0.2.12345: UDP, length 16
13:04:24.876560 IP 10.0.0.5.12345 > 10.0.0.2.12345: UDP, length 16
13:04:24.877156 IP 10.0.0.5.12345 > 10.0.0.2.12345: UDP, length 16
13:04:24.877751 IP 10.0.0.5.12345 > 10.0.0.2.12345: UDP, length 16
13:04:24.878344 IP 10.0.0.5.12345 > 10.0.0.2.12345: UDP, length 16
13:04:24.878957 IP 10.0.0.5.12345 > 10.0.0.2.12345: UDP, length 16
13:04:24.879572 IP 10.0.0.5.12345 > 10.0.0.2.12345: UDP, length 16
13:04:24.880171 IP 10.0.0.5.12345 > 10.0.0.2.12345: UDP, length 16
13:04:24.880790 IP 10.0.0.5.12345 > 10.0.0.2.12345: UDP, length 16
13:04:24.881404 IP 10.0.0.5.12345 > 10.0.0.2.12345: UDP, length 16
13:04:24.882018 IP 10.0.0.5.12345 > 10.0.0.2.12345: UDP, length 16
13:04:24.882609 IP 10.0.0.5.12345 > 10.0.0.2.12345: UDP, length 16
13:04:24.883204 IP 10.0.0.5.12345 > 10.0.0.2.12345: UDP, length 16
13:04:24.883789 IP 10.0.0.5.12345 > 10.0.0.2.12345: UDP, length 16
13:04:24.884390 IP 10.0.0.5.12345 > 10.0.0.2.12345: UDP, length 16
13:04:24.884991 IP 10.0.0.5.12345 > 10.0.0.2.12345: UDP, length 16
13:04:24.885592 IP 10.0.0.5.12345 > 10.0.0.2.12345: UDP, length 16
13:04:24.886178 IP 10.0.0.5.12345 > 10.0.0.2.12345: UDP, length 16
13:04:24.886757 IP 10.0.0.5.12345 > 10.0.0.2.12345: UDP, length 16
13:04:24.887340 IP 10.0.0.5.12345 > 10.0.0.2.12345: UDP, length 16
13:04:24.887905 IP 10.0.0.5.12345 > 10.0.0.2.12345: UDP, length 16
13:04:24.888488 IP 10.0.0.5.12345 > 10.0.0.2.12345: UDP, length 16
13:04:24.889069 IP 10.0.0.5.12345 > 10.0.0.2.12345: UDP, length 16
13:04:24.889650 IP 10.0.0.5.12345 > 10.0.0.2.12345: UDP, length 16
13:04:24.890231 IP 10.0.0.5.12345 > 10.0.0.2.12345: UDP, length 16
13:04:24.890817 IP 10.0.0.5.12345 > 10.0.0.2.12345: UDP, length 16
13:04:24.891401 IP 10.0.0.5.12345 > 10.0.0.2.12345: UDP, length 16
13:04:24.891986 IP 10.0.0.5.12345 > 10.0.0.2.12345: UDP, length 16
13:04:24.892582 IP 10.0.0.5.12345 > 10.0.0.2.12345: UDP, length 16
13:04:24.893214 IP 10.0.0.5.12345 > 10.0.0.2.12345: UDP, length 16
13:04:24.893833 IP 10.0.0.5.12345 > 10.0.0.2.12345: UDP, length 16
13:04:24.894450 IP 10.0.0.5.12345 > 10.0.0.2.12345: UDP, length 16
13:04:24.895069 IP 10.0.0.5.12345 > 10.0.0.2.12345: UDP, length 16
13:04:24.895695 IP 10.0.0.5.12345 > 10.0.0.2.12345: UDP, length 16
13:04:24.896317 IP 10.0.0.5.12345 > 10.0.0.2.12345: UDP, length 16
13:04:24.896949 IP 10.0.0.5.12345 > 10.0.0.2.12345: UDP, length 16
13:04:24.897552 IP 10.0.0.5.12345 > 10.0.0.2.12345: UDP, length 16
13:04:24.898171 IP 10.0.0.5.12345 > 10.0.0.2.12345: UDP, length 16
13:04:24.898773 IP 10.0.0.5.12345 > 10.0.0.2.12345: UDP, length 16
13:04:24.899372 IP 10.0.0.5.12345 > 10.0.0.2.12345: UDP, length 16
13:04:24.899965 IP 10.0.0.5.12345 > 10.0.0.2.12345: UDP, length 16
13:04:24.900568 IP 10.0.0.5.12345 > 10.0.0.2.12345: UDP, length 16
13:04:24.901154 IP 10.0.0.5.12345 > 10.0.0.2.12345: UDP, length 16
13:04:24.901736 IP 10.0.0.5.12345 > 10.0.0.2.12345: UDP, length 16
13:04:24.902313 IP 10.0.0.5.12345 > 10.0.0.2.12345: UDP, length 16
13:04:24.902895 IP 10.0.0.5.12345 > 10.0.0.2.12345: UDP, length 16
13:04:24.903493 IP 10.0.0.5.12345 > 10.0.0.2.12345: UDP, length 16
13:04:24.904097 IP 10.0.0.5.12345 > 10.0.0.2.12345: UDP, length 16
13:04:24.904691 IP 10.0.0.5.12345 > 10.0.0.2.12345: UDP, length 16
13:04:24.905297 IP 10.0.0.5.12345 > 10.0.0.2.12345: UDP, length 16
13:04:24.905895 IP 10.0.0.5.12345 > 10.0.0.2.12345: UDP, length 16
13:04:24.906477 IP 10.0.0.5.12345 > 10.0.0.2.12345: UDP, length 16
13:04:24.907074 IP 10.0.0.5.12345 > 10.0.0.2.12345: UDP, length 16
13:04:24.907660 IP 10.0.0.5.12345 > 10.0.0.2.12345: UDP, length 16
13:04:24.908256 IP 10.0.0.5.12345 > 10.0.0.2.12345: UDP, length 16
13:04:24.908843 IP 10.0.0.5.12345 > 10.0.0.2.12345: UDP, length 16
13:04:24.909428 IP 10.0.0.5.12345 > 10.0.0.2.12345: UDP, length 16
13:04:24.910013 IP 10.0.0.5.12345 > 10.0.0.2.12345: UDP, length 16
13:04:24.910599 IP 10.0.0.5.12345 > 10.0.0.2.12345: UDP, length 16
13:04:24.911183 IP 10.0.0.5.12345 > 10.0.0.2.12345: UDP, length 16
13:04:24.911794 IP 10.0.0.5.12345 > 10.0.0.2.12345: UDP, length 16
13:04:24.912396 IP 10.0.0.5.12345 > 10.0.0.2.12345: UDP, length 16
13:04:24.912997 IP 10.0.0.5.12345 > 10.0.0.2.12345: UDP, length 16
13:04:24.913597 IP 10.0.0.5.12345 > 10.0.0.2.12345: UDP, length 16
13:04:24.914181 IP 10.0.0.5.12345 > 10.0.0.2.12345: UDP, length 16
13:04:24.914780 IP 10.0.0.5.12345 > 10.0.0.2.12345: UDP, length 16
13:04:24.915391 IP 10.0.0.5.12345 > 10.0.0.2.12345: UDP, length 16
13:04:24.915986 IP 10.0.0.5.12345 > 10.0.0.2.12345: UDP, length 16
13:04:24.916583 IP 10.0.0.5.12345 > 10.0.0.2.12345: UDP, length 16
13:04:24.917171 IP 10.0.0.5.12345 > 10.0.0.2.12345: UDP, length 16
13:04:24.917764 IP 10.0.0.5.12345 > 10.0.0.2.12345: UDP, length 16
13:04:24.918383 IP 10.0.0.5.12345 > 10.0.0.2.12345: UDP, length 16
13:04:24.918978 IP 10.0.0.5.12345 > 10.0.0.2.12345: UDP, length 16
13:04:24.919566 IP 10.0.0.5.12345 > 10.0.0.2.12345: UDP, length 16
13:04:24.920163 IP 10.0.0.5.12345 > 10.0.0.2.12345: UDP, length 16
13:04:24.920769 IP 10.0.0.5.12345 > 10.0.0.2.12345: UDP, length 16
13:04:24.921357 IP 10.0.0.5.12345 > 10.0.0.2.12345: UDP, length 16
13:04:24.921959 IP 10.0.0.5.12345 > 10.0.0.2.12345: UDP, length 16
13:04:24.922554 IP 10.0.0.5.12345 > 10.0.0.2.12345: UDP, length 16
13:04:24.923163 IP 10.0.0.5.12345 > 10.0.0.2.12345: UDP, length 16
13:04:24.923772 IP 10.0.0.5.12345 > 10.0.0.2.12345: UDP, length 16
13:04:24.924376 IP 10.0.0.5.12345 > 10.0.0.2.12345: UDP, length 16
13:04:24.924971 IP 10.0.0.5.12345 > 10.0.0.2.12345: UDP, length 16
13:04:24.925563 IP 10.0.0.5.12345 > 10.0.0.2.12345: UDP, length 16
13:04:24.926149 IP 10.0.0.5.12345 > 10.0.0.2.12345: UDP, length 16
13:04:24.926752 IP 10.0.0.5.12345 > 10.0.0.2.12345: UDP, length 16
13:04:24.927355 IP 10.0.0.5.12345 > 10.0.0.2.12345: UDP, length 16
13:04:24.927999 IP 10.0.0.5.12345 > 10.0.0.2.12345: UDP, length 16
13:04:24.928647 IP 10.0.0.5.12345 > 10.0.0.2.12345: UDP, length 16
13:04:24.929293 IP 10.0.0.5.12345 > 10.0.0.2.12345: UDP, length 16
13:04:24.929943 IP 10.0.0.5.12345 > 10.0.0.2.12345: UDP, length 16
13:04:24.930612 IP 10.0.0.5.12345 > 10.0.0.2.12345: UDP, length 16
13:04:24.931226 IP 10.0.0.5.12345 > 10.0.0.2.12345: UDP, length 16
13:04:24.931840 IP 10.0.0.5.12345 > 10.0.0.2.12345: UDP, length 16
13:04:24.932449 IP 10.0.0.5.12345 > 10.0.0.2.12345: UDP, length 16
13:04:24.933058 IP 10.0.0.5.12345 > 10.0.0.2.12345: UDP, length 16
13:04:24.933670 IP 10.0.0.5.12345 > 10.0.0.2.12345: UDP, length 16
13:04:24.934284 IP 10.0.0.5.12345 > 10.0.0.2.12345: UDP, length 16
13:04:24.934918 IP 10.0.0.5.12345 > 10.0.0.2.12345: UDP, length 16
13:04:24.935532 IP 10.0.0.5.12345 > 10.0.0.2.12345: UDP, length 16
13:04:24.936134 IP 10.0.0.5.12345 > 10.0.0.2.12345: UDP, length 16
13:04:24.936739 IP 10.0.0.5.12345 > 10.0.0.2.12345: UDP, length 16
13:04:24.937332 IP 10.0.0.5.12345 > 10.0.0.2.12345: UDP, length 16
13:04:24.937964 IP 10.0.0.5.12345 > 10.0.0.2.12345: UDP, length 16
13:04:24.938590 IP 10.0.0.5.12345 > 10.0.0.2.12345: UDP, length 16
13:04:24.939214 IP 10.0.0.5.12345 > 10.0.0.2.12345: UDP, length 16
13:04:24.939826 IP 10.0.0.5.12345 > 10.0.0.2.12345: UDP, length 16
13:04:24.940432 IP 10.0.0.5.12345 > 10.0.0.2.12345: UDP, length 16
13:04:24.941037 IP 10.0.0.5.12345 > 10.0.0.2.12345: UDP, length 16
13:04:24.941661 IP 10.0.0.5.12345 > 10.0.0.2.12345: UDP, length 16
13:04:24.942286 IP 10.0.0.5.12345 > 10.0.0.2.12345: UDP, length 16
13:04:24.942909 IP 10.0.0.5.12345 > 10.0.0.2.12345: UDP, length 16
13:04:24.943551 IP 10.0.0.5.12345 > 10.0.0.2.12345: UDP, length 16
13:04:24.944193 IP 10.0.0.5.12345 > 10.0.0.2.12345: UDP, length 16
13:04:24.944834 IP 10.0.0.5.12345 > 10.0.0.2.12345: UDP, length 16
13:04:24.945475 IP 10.0.0.5.12345 > 10.0.0.2.12345: UDP, length 16
13:04:24.946116 IP 10.0.0.5.12345 > 10.0.0.2.12345: UDP, length 16
13:04:24.946742 IP 10.0.0.5.12345 > 10.0.0.2.12345: UDP, length 16
13:04:24.947373 IP 10.0.0.5.12345 > 10.0.0.2.12345: UDP, length 16
13:04:24.947984 IP 10.0.0.5.12345 > 10.0.0.2.12345: UDP, length 16
13:04:24.948617 IP 10.0.0.5.12345 > 10.0.0.2.12345: UDP, length 16
13:04:24.949225 IP 10.0.0.5.12345 > 10.0.0.2.12345: UDP, length 16
13:04:24.949835 IP 10.0.0.5.12345 > 10.0.0.2.12345: UDP, length 16
13:04:24.950453 IP 10.0.0.5.12345 > 10.0.0.2.12345: UDP, length 16
13:04:24.951045 IP 10.0.0.5.12345 > 10.0.0.2.12345: UDP, length 16
13:04:24.951649 IP 10.0.0.5.12345 > 10.0.0.2.12345: UDP, length 16
13:04:24.952248 IP 10.0.0.5.12345 > 10.0.0.2.12345: UDP, length 16
13:04:24.952866 IP 10.0.0.5.12345 > 10.0.0.2.12345: UDP, length 16
13:04:24.953483 IP 10.0.0.5.12345 > 10.0.0.2.12345: UDP, length 16
13:04:24.954076 IP 10.0.0.5.12345 > 10.0.0.2.12345: UDP, length 16
13:04:24.954692 IP 10.0.0.5.12345 > 10.0.0.2.12345: UDP, length 16
13:04:24.955297 IP 10.0.0.5.12345 > 10.0.0.2.12345: UDP, length 16
13:04:24.955916 IP 10.0.0.5.12345 > 10.0.0.2.12345: UDP, length 16
13:04:24.956557 IP 10.0.0.5.12345 > 10.0.0.2.12345: UDP, length 16
13:04:24.957198 IP 10.0.0.5.12345 > 10.0.0.2.12345: UDP, length 16
13:04:24.957841 IP 10.0.0.5.12345 > 10.0.0.2.12345: UDP, length 16
13:04:24.958480 IP 10.0.0.5.12345 > 10.0.0.2.12345: UDP, length 16
13:04:24.959121 IP 10.0.0.5.12345 > 10.0.0.2.12345: UDP, length 16
13:04:24.959766 IP 10.0.0.5.12345 > 10.0.0.2.12345: UDP, length 16
13:04:24.960405 IP 10.0.0.5.12345 > 10.0.0.2.12345: UDP, length 16
13:04:24.961044 IP 10.0.0.5.12345 > 10.0.0.2.12345: UDP, length 16
13:04:24.961684 IP 10.0.0.5.12345 > 10.0.0.2.12345: UDP, length 16
13:04:24.962327 IP 10.0.0.5.12345 > 10.0.0.2.12345: UDP, length 16
13:04:24.962967 IP 10.0.0.5.12345 > 10.0.0.2.12345: UDP, length 16
13:04:24.963592 IP 10.0.0.5.12345 > 10.0.0.2.12345: UDP, length 16
13:04:24.964214 IP 10.0.0.5.12345 > 10.0.0.2.12345: UDP, length 16
13:04:24.964831 IP 10.0.0.5.12345 > 10.0.0.2.12345: UDP, length 16
13:04:24.965469 IP 10.0.0.5.12345 > 10.0.0.2.12345: UDP, length 16
13:04:24.966096 IP 10.0.0.5.12345 > 10.0.0.2.12345: UDP, length 16
13:04:24.966717 IP 10.0.0.5.12345 > 10.0.0.2.12345: UDP, length 16
13:04:24.967358 IP 10.0.0.5.12345 > 10.0.0.2.12345: UDP, length 16
13:04:24.967988 IP 10.0.0.5.12345 > 10.0.0.2.12345: UDP, length 16
13:04:24.968605 IP 10.0.0.5.12345 > 10.0.0.2.12345: UDP, length 16
13:04:24.969224 IP 10.0.0.5.12345 > 10.0.0.2.12345: UDP, length 16
13:04:24.969831 IP 10.0.0.5.12345 > 10.0.0.2.12345: UDP, length 16
13:04:24.970429 IP 10.0.0.5.12345 > 10.0.0.2.12345: UDP, length 16
13:04:24.971033 IP 10.0.0.5.12345 > 10.0.0.2.12345: UDP, length 16
13:04:24.971683 IP 10.0.0.5.12345 > 10.0.0.2.12345: UDP, length 16
13:04:24.972323 IP 10.0.0.5.12345 > 10.0.0.2.12345: UDP, length 16
13:04:24.972926 IP 10.0.0.5.12345 > 10.0.0.2.12345: UDP, length 16
13:04:24.973518 IP 10.0.0.5.12345 > 10.0.0.2.12345: UDP, length 16
13:04:24.974105 IP 10.0.0.5.12345 > 10.0.0.2.12345: UDP, length 16
13:04:24.974694 IP 10.0.0.5.12345 > 10.0.0.2.12345: UDP, length 16
13:04:24.975281 IP 10.0.0.5.12345 > 10.0.0.2.12345: UDP, length 16
13:04:24.975862 IP 10.0.0.5.12345 > 10.0.0.2.12345: UDP, length 16
13:04:24.976502 IP 10.0.0.5.12345 > 10.0.0.2.12345: UDP, length 16
13:04:24.977143 IP 10.0.0.5.12345 > 10.0.0.2.12345: UDP, length 16
13:04:24.977783 IP 10.0.0.5.12345 > 10.0.0.2.12345: UDP, length 16
13:04:24.978414 IP 10.0.0.5.12345 > 10.0.0.2.12345: UDP, length 16
13:04:24.979024 IP 10.0.0.5.12345 > 10.0.0.2.12345: UDP, length 16
13:04:24.979626 IP 10.0.0.5.12345 > 10.0.0.2.12345: UDP, length 16
13:04:24.980215 IP 10.0.0.5.12345 > 10.0.0.2.12345: UDP, length 16
13:04:24.980825 IP 10.0.0.5.12345 > 10.0.0.2.12345: UDP, length 16
13:04:24.981427 IP 10.0.0.5.12345 > 10.0.0.2.12345: UDP, length 16
13:04:24.982020 IP 10.0.0.5.12345 > 10.0.0.2.12345: UDP, length 16
13:04:24.982610 IP 10.0.0.5.12345 > 10.0.0.2.12345: UDP, length 16
13:04:24.983202 IP 10.0.0.5.12345 > 10.0.0.2.12345: UDP, length 16
13:04:24.983780 IP 10.0.0.5.12345 > 10.0.0.2.12345: UDP, length 16
13:04:24.984377 IP 10.0.0.5.12345 > 10.0.0.2.12345: UDP, length 16
13:04:24.984974 IP 10.0.0.5.12345 > 10.0.0.2.12345: UDP, length 16
13:04:24.985570 IP 10.0.0.5.12345 > 10.0.0.2.12345: UDP, length 16
13:04:24.986193 IP 10.0.0.5.12345 > 10.0.0.2.12345: UDP, length 16
13:04:24.986796 IP 10.0.0.5.12345 > 10.0.0.2.12345: UDP, length 16
13:04:24.987401 IP 10.0.0.5.12345 > 10.0.0.2.12345: UDP, length 16
13:04:24.988002 IP 10.0.0.5.12345 > 10.0.0.2.12345: UDP, length 16
13:04:24.988589 IP 10.0.0.5.12345 > 10.0.0.2.12345: UDP, length 16
13:04:24.989174 IP 10.0.0.5.12345 > 10.0.0.2.12345: UDP, length 16
13:04:24.989789 IP 10.0.0.5.12345 > 10.0.0.2.12345: UDP, length 16
13:04:24.990407 IP 10.0.0.5.12345 > 10.0.0.2.12345: UDP, length 16
13:04:24.991026 IP 10.0.0.5.12345 > 10.0.0.2.12345: UDP, length 16
13:04:24.991644 IP 10.0.0.5.12345 > 10.0.0.2.12345: UDP, length 16
13:04:24.992237 IP 10.0.0.5.12345 > 10.0.0.2.12345: UDP, length 16
13:04:24.992855 IP 10.0.0.5.12345 > 10.0.0.2.12345: UDP, length 16
13:04:24.993475 IP 10.0.0.5.12345 > 10.0.0.2.12345: UDP, length 16
13:04:24.994099 IP 10.0.0.5.12345 > 10.0.0.2.12345: UDP, length 16
13:04:24.994712 IP 10.0.0.5.12345 > 10.0.0.2.12345: UDP, length 16
13:04:24.995324 IP 10.0.0.5.12345 > 10.0.0.2.12345: UDP, length 16
13:04:24.995922 IP 10.0.0.5.12345 > 10.0.0.2.12345: UDP, length 16
13:04:24.996554 IP 10.0.0.5.12345 > 10.0.0.2.12345: UDP, length 16
13:04:24.997188 IP 10.0.0.5.12345 > 10.0.0.2.12345: UDP, length 16
13:04:24.997822 IP 10.0.0.5.12345 > 10.0.0.2.12345: UDP, length 16
13:04:24.998457 IP 10.0.0.5.12345 > 10.0.0.2.12345: UDP, length 16
13:04:24.999093 IP 10.0.0.5.12345 > 10.0.0.2.12345: UDP, length 16
13:04:24.999781 IP 10.0.0.5.12345 > 10.0.0.2.12345: UDP, length 16
13:04:25.000418 IP 10.0.0.5.12345 > 10.0.0.2.12345: UDP, length 16
13:04:25.001041 IP 10.0.0.5.12345 > 10.0.0.2.12345: UDP, length 16
13:04:25.001663 IP 10.0.0.5.12345 > 10.0.0.2.12345: UDP, length 16
13:04:25.002305 IP 10.0.0.5.12345 > 10.0.0.2.12345: UDP, length 16
13:04:25.002918 IP 10.0.0.5.12345 > 10.0.0.2.12345: UDP, length 16
13:04:25.003507 IP 10.0.0.5.12345 > 10.0.0.2.12345: UDP, length 16
13:04:25.004111 IP 10.0.0.5.12345 > 10.0.0.2.12345: UDP, length 16
13:04:25.004721 IP 10.0.0.5.12345 > 10.0.0.2.12345: UDP, length 16
13:04:25.005340 IP 10.0.0.5.12345 > 10.0.0.2.12345: UDP, length 16
13:04:25.005951 IP 10.0.0.5.12345 > 10.0.0.2.12345: UDP, length 16
13:04:25.006562 IP 10.0.0.5.12345 > 10.0.0.2.12345: UDP, length 16
13:04:25.007176 IP 10.0.0.5.12345 > 10.0.0.2.12345: UDP, length 16
13:04:25.007759 IP 10.0.0.5.12345 > 10.0.0.2.12345: UDP, length 16
13:04:25.008372 IP 10.0.0.5.12345 > 10.0.0.2.12345: UDP, length 16
13:04:25.008985 IP 10.0.0.5.12345 > 10.0.0.2.12345: UDP, length 16
13:04:25.009596 IP 10.0.0.5.12345 > 10.0.0.2.12345: UDP, length 16
13:04:25.010207 IP 10.0.0.5.12345 > 10.0.0.2.12345: UDP, length 16
13:04:25.010810 IP 10.0.0.5.12345 > 10.0.0.2.12345: UDP, length 16
13:04:25.011398 IP 10.0.0.5.12345 > 10.0.0.2.12345: UDP, length 16
13:04:25.011975 IP 10.0.0.5.12345 > 10.0.0.2.12345: UDP, length 16
13:04:25.012570 IP 10.0.0.5.12345 > 10.0.0.2.12345: UDP, length 16
13:04:25.013180 IP 10.0.0.5.12345 > 10.0.0.2.12345: UDP, length 16
13:04:25.013769 IP 10.0.0.5.12345 > 10.0.0.2.12345: UDP, length 16
13:04:25.014366 IP 10.0.0.5.12345 > 10.0.0.2.12345: UDP, length 16
13:04:25.014960 IP 10.0.0.5.12345 > 10.0.0.2.12345: UDP, length 16
13:04:25.015541 IP 10.0.0.5.12345 > 10.0.0.2.12345: UDP, length 16
13:04:25.016120 IP 10.0.0.5.12345 > 10.0.0.2.12345: UDP, length 16
13:04:25.016703 IP 10.0.0.5.12345 > 10.0.0.2.12345: UDP, length 16
13:04:25.017276 IP 10.0.0.5.12345 > 10.0.0.2.12345: UDP, length 16
13:04:25.017858 IP 10.0.0.5.12345 > 10.0.0.2.12345: UDP, length 16
13:04:25.018433 IP 10.0.0.5.12345 > 10.0.0.2.12345: UDP, length 16
13:04:25.019016 IP 10.0.0.5.12345 > 10.0.0.2.12345: UDP, length 16
13:04:25.019611 IP 10.0.0.5.12345 > 10.0.0.2.12345: UDP, length 16
13:04:25.020204 IP 10.0.0.5.12345 > 10.0.0.2.12345: UDP, length 16
13:04:25.020793 IP 10.0.0.5.12345 > 10.0.0.2.12345: UDP, length 16
13:04:25.021379 IP 10.0.0.5.12345 > 10.0.0.2.12345: UDP, length 16
13:04:25.021966 IP 10.0.0.5.12345 > 10.0.0.2.12345: UDP, length 16
13:04:25.022551 IP 10.0.0.5.12345 > 10.0.0.2.12345: UDP, length 16
13:04:25.023137 IP 10.0.0.5.12345 > 10.0.0.2.12345: UDP, length 16
13:04:25.023725 IP 10.0.0.5.12345 > 10.0.0.2.12345: UDP, length 16
13:04:25.024311 IP 10.0.0.5.12345 > 10.0.0.2.12345: UDP, length 16
13:04:25.024929 IP 10.0.0.5.12345 > 10.0.0.2.12345: UDP, length 16
13:04:25.025548 IP 10.0.0.5.12345 > 10.0.0.2.12345: UDP, length 16
13:04:25.026170 IP 10.0.0.5.12345 > 10.0.0.2.12345: UDP, length 16
13:04:25.026764 IP 10.0.0.5.12345 > 10.0.0.2.12345: UDP, length 16
13:04:25.027348 IP 10.0.0.5.12345 > 10.0.0.2.12345: UDP, length 16
13:04:25.027940 IP 10.0.0.5.12345 > 10.0.0.2.12345: UDP, length 16
13:04:25.028522 IP 10.0.0.5.12345 > 10.0.0.2.12345: UDP, length 16
13:04:25.029112 IP 10.0.0.5.12345 > 10.0.0.2.12345: UDP, length 16
13:04:25.029699 IP 10.0.0.5.12345 > 10.0.0.2.12345: UDP, length 16
13:04:25.030286 IP 10.0.0.5.12345 > 10.0.0.2.12345: UDP, length 16
13:04:25.030883 IP 10.0.0.5.12345 > 10.0.0.2.12345: UDP, length 16
13:04:25.031505 IP 10.0.0.5.12345 > 10.0.0.2.12345: UDP, length 16
13:04:25.032111 IP 10.0.0.5.12345 > 10.0.0.2.12345: UDP, length 16
13:04:25.032702 IP 10.0.0.5.12345 > 10.0.0.2.12345: UDP, length 16
13:04:25.033325 IP 10.0.0.5.12345 > 10.0.0.2.12345: UDP, length 16
13:04:25.033944 IP 10.0.0.5.12345 > 10.0.0.2.12345: UDP, length 16
13:04:25.034547 IP 10.0.0.5.12345 > 10.0.0.2.12345: UDP, length 16
13:04:25.035149 IP 10.0.0.5.12345 > 10.0.0.2.12345: UDP, length 16
13:04:25.035755 IP 10.0.0.5.12345 > 10.0.0.2.12345: UDP, length 16
13:04:25.036348 IP 10.0.0.5.12345 > 10.0.0.2.12345: UDP, length 16
13:04:25.036967 IP 10.0.0.5.12345 > 10.0.0.2.12345: UDP, length 16
13:04:25.037559 IP 10.0.0.5.12345 > 10.0.0.2.12345: UDP, length 16
13:04:25.038167 IP 10.0.0.5.12345 > 10.0.0.2.12345: UDP, length 16
13:04:25.038770 IP 10.0.0.5.12345 > 10.0.0.2.12345: UDP, length 16
13:04:25.039410 IP 10.0.0.5.12345 > 10.0.0.2.12345: UDP, length 16
13:04:25.040033 IP 10.0.0.5.12345 > 10.0.0.2.12345: UDP, length 16
13:04:25.040655 IP 10.0.0.5.12345 > 10.0.0.2.12345: UDP, length 16
13:04:25.041275 IP 10.0.0.5.12345 > 10.0.0.2.12345: UDP, length 16
13:04:25.041895 IP 10.0.0.5.12345 > 10.0.0.2.12345: UDP, length 16
13:04:25.042489 IP 10.0.0.5.12345 > 10.0.0.2.12345: UDP, length 16
13:04:25.043090 IP 10.0.0.5.12345 > 10.0.0.2.12345: UDP, length 16
13:04:25.043770 IP 10.0.0.5.12345 > 10.0.0.2.12345: UDP, length 16
13:04:25.044381 IP 10.0.0.5.12345 > 10.0.0.2.12345: UDP, length 16
13:04:25.045006 IP 10.0.0.5.12345 > 10.0.0.2.12345: UDP, length 16
13:04:25.045629 IP 10.0.0.5.12345 > 10.0.0.2.12345: UDP, length 16
13:04:25.046253 IP 10.0.0.5.12345 > 10.0.0.2.12345: UDP, length 16
13:04:25.046878 IP 10.0.0.5.12345 > 10.0.0.2.12345: UDP, length 16
13:04:25.047492 IP 10.0.0.5.12345 > 10.0.0.2.12345: UDP, length 16
13:04:25.048123 IP 10.0.0.5.12345 > 10.0.0.2.12345: UDP, length 16
13:04:25.048747 IP 10.0.0.5.12345 > 10.0.0.2.12345: UDP, length 16
13:04:25.049359 IP 10.0.0.5.12345 > 10.0.0.2.12345: UDP, length 16
13:04:25.049968 IP 10.0.0.5.12345 > 10.0.0.2.12345: UDP, length 16
13:04:25.050572 IP 10.0.0.5.12345 > 10.0.0.2.12345: UDP, length 16
13:04:25.051183 IP 10.0.0.5.12345 > 10.0.0.2.12345: UDP, length 16
13:04:25.051799 IP 10.0.0.5.12345 > 10.0.0.2.12345: UDP, length 16
13:04:25.052422 IP 10.0.0.5.12345 > 10.0.0.2.12345: UDP, length 16
13:04:25.053060 IP 10.0.0.5.12345 > 10.0.0.2.12345: UDP, length 16
13:04:25.053662 IP 10.0.0.5.12345 > 10.0.0.2.12345: UDP, length 16
13:04:25.054256 IP 10.0.0.5.12345 > 10.0.0.2.12345: UDP, length 16
13:04:25.054850 IP 10.0.0.5.12345 > 10.0.0.2.12345: UDP, length 16
13:04:25.055484 IP 10.0.0.5.12345 > 10.0.0.2.12345: UDP, length 16
13:04:25.056079 IP 10.0.0.5.12345 > 10.0.0.2.12345: UDP, length 16
13:04:25.056689 IP 10.0.0.5.12345 > 10.0.0.2.12345: UDP, length 16
13:04:25.057282 IP 10.0.0.5.12345 > 10.0.0.2.12345: UDP, length 16
13:04:25.057873 IP 10.0.0.5.12345 > 10.0.0.2.12345: UDP, length 16
13:04:25.058515 IP 10.0.0.5.12345 > 10.0.0.2.12345: UDP, length 16
13:04:25.059128 IP 10.0.0.5.12345 > 10.0.0.2.12345: UDP, length 16
13:04:25.059758 IP 10.0.0.5.12345 > 10.0.0.2.12345: UDP, length 16
13:04:25.060352 IP 10.0.0.5.12345 > 10.0.0.2.12345: UDP, length 16
13:04:25.060947 IP 10.0.0.5.12345 > 10.0.0.2.12345: UDP, length 16
13:04:25.061553 IP 10.0.0.5.12345 > 10.0.0.2.12345: UDP, length 16
13:04:25.062138 IP 10.0.0.5.12345 > 10.0.0.2.12345: UDP, length 16
13:04:25.062722 IP 10.0.0.5.12345 > 10.0.0.2.12345: UDP, length 16
13:04:25.063306 IP 10.0.0.5.12345 > 10.0.0.2.12345: UDP, length 16
13:04:25.063935 IP 10.0.0.5.12345 > 10.0.0.2.12345: UDP, length 16
13:04:25.064531 IP 10.0.0.5.12345 > 10.0.0.2.12345: UDP, length 16
13:04:25.065119 IP 10.0.0.5.12345 > 10.0.0.2.12345: UDP, length 16
13:04:25.065716 IP 10.0.0.5.12345 > 10.0.0.2.12345: UDP, length 16
13:04:25.066320 IP 10.0.0.5.12345 > 10.0.0.2.12345: UDP, length 16
13:04:25.066925 IP 10.0.0.5.12345 > 10.0.0.2.12345: UDP, length 16
13:04:25.067551 IP 10.0.0.5.12345 > 10.0.0.2.12345: UDP, length 16
13:04:25.068153 IP 10.0.0.5.12345 > 10.0.0.2.12345: UDP, length 16
13:04:25.068744 IP 10.0.0.5.12345 > 10.0.0.2.12345: UDP, length 16
13:04:25.069339 IP 10.0.0.5.12345 > 10.0.0.2.12345: UDP, length 16
13:04:25.069929 IP 10.0.0.5.12345 > 10.0.0.2.12345: UDP, length 16
13:04:25.070516 IP 10.0.0.5.12345 > 10.0.0.2.12345: UDP, length 16
13:04:25.071107 IP 10.0.0.5.12345 > 10.0.0.2.12345: UDP, length 16
13:04:25.071728 IP 10.0.0.5.12345 > 10.0.0.2.12345: UDP, length 16
13:04:25.072349 IP 10.0.0.5.12345 > 10.0.0.2.12345: UDP, length 16
13:04:25.072968 IP 10.0.0.5.12345 > 10.0.0.2.12345: UDP, length 16
13:04:25.073588 IP 10.0.0.5.12345 > 10.0.0.2.12345: UDP, length 16
13:04:25.074209 IP 10.0.0.5.12345 > 10.0.0.2.12345: UDP, length 16
13:04:25.074830 IP 10.0.0.5.12345 > 10.0.0.2.12345: UDP, length 16
13:04:25.075434 IP 10.0.0.5.12345 > 10.0.0.2.12345: UDP, length 16
13:04:25.076039 IP 10.0.0.5.12345 > 10.0.0.2.12345: UDP, length 16
13:04:25.076643 IP 10.0.0.5.12345 > 10.0.0.2.12345: UDP, length 16
13:04:25.077250 IP 10.0.0.5.12345 > 10.0.0.2.12345: UDP, length 16
13:04:25.077841 IP 10.0.0.5.12345 > 10.0.0.2.12345: UDP, length 16
13:04:25.078460 IP 10.0.0.5.12345 > 10.0.0.2.12345: UDP, length 16
13:04:25.079079 IP 10.0.0.5.12345 > 10.0.0.2.12345: UDP, length 16
13:04:25.079713 IP 10.0.0.5.12345 > 10.0.0.2.12345: UDP, length 16
13:04:25.080341 IP 10.0.0.5.12345 > 10.0.0.2.12345: UDP, length 16
13:04:25.080972 IP 10.0.0.5.12345 > 10.0.0.2.12345: UDP, length 16
13:04:25.081604 IP 10.0.0.5.12345 > 10.0.0.2.12345: UDP, length 16
13:04:25.082204 IP 10.0.0.5.12345 > 10.0.0.2.12345: UDP, length 16
13:04:25.082816 IP 10.0.0.5.12345 > 10.0.0.2.12345: UDP, length 16
13:04:25.083438 IP 10.0.0.5.12345 > 10.0.0.2.12345: UDP, length 16
13:04:25.084036 IP 10.0.0.5.12345 > 10.0.0.2.12345: UDP, length 16
13:04:25.084648 IP 10.0.0.5.12345 > 10.0.0.2.12345: UDP, length 16
13:04:25.085247 IP 10.0.0.5.12345 > 10.0.0.2.12345: UDP, length 16
13:04:25.085884 IP 10.0.0.5.12345 > 10.0.0.2.12345: UDP, length 16
13:04:25.086489 IP 10.0.0.5.12345 > 10.0.0.2.12345: UDP, length 16
13:04:25.087084 IP 10.0.0.5.12345 > 10.0.0.2.12345: UDP, length 16
13:04:25.087779 IP 10.0.0.5.12345 > 10.0.0.2.12345: UDP, length 16
13:04:25.088385 IP 10.0.0.5.12345 > 10.0.0.2.12345: UDP, length 16
13:04:25.088994 IP 10.0.0.5.12345 > 10.0.0.2.12345: UDP, length 16
13:04:25.089589 IP 10.0.0.5.12345 > 10.0.0.2.12345: UDP, length 16
13:04:25.090206 IP 10.0.0.5.12345 > 10.0.0.2.12345: UDP, length 16
13:04:25.090811 IP 10.0.0.5.12345 > 10.0.0.2.12345: UDP, length 16
13:04:25.091456 IP 10.0.0.5.12345 > 10.0.0.2.12345: UDP, length 16
13:04:25.092066 IP 10.0.0.5.12345 > 10.0.0.2.12345: UDP, length 16
13:04:25.092656 IP 10.0.0.5.12345 > 10.0.0.2.12345: UDP, length 16
13:04:25.093244 IP 10.0.0.5.12345 > 10.0.0.2.12345: UDP, length 16
13:04:25.093829 IP 10.0.0.5.12345 > 10.0.0.2.12345: UDP, length 16
13:04:25.094415 IP 10.0.0.5.12345 > 10.0.0.2.12345: UDP, length 16
13:04:25.095000 IP 10.0.0.5.12345 > 10.0.0.2.12345: UDP, length 16
13:04:25.095585 IP 10.0.0.5.12345 > 10.0.0.2.12345: UDP, length 16
13:04:25.096205 IP 10.0.0.5.12345 > 10.0.0.2.12345: UDP, length 16
13:04:25.096823 IP 10.0.0.5.12345 > 10.0.0.2.12345: UDP, length 16
13:04:25.097439 IP 10.0.0.5.12345 > 10.0.0.2.12345: UDP, length 16
13:04:25.098062 IP 10.0.0.5.12345 > 10.0.0.2.12345: UDP, length 16
13:04:25.098670 IP 10.0.0.5.12345 > 10.0.0.2.12345: UDP, length 16
13:04:25.099297 IP 10.0.0.5.12345 > 10.0.0.2.12345: UDP, length 16
13:04:25.099880 IP 10.0.0.5.12345 > 10.0.0.2.12345: UDP, length 16
13:04:25.100479 IP 10.0.0.5.12345 > 10.0.0.2.12345: UDP, length 16
13:04:25.101076 IP 10.0.0.5.12345 > 10.0.0.2.12345: UDP, length 16
13:04:25.101694 IP 10.0.0.5.12345 > 10.0.0.2.12345: UDP, length 16
13:04:25.102327 IP 10.0.0.5.12345 > 10.0.0.2.12345: UDP, length 16
13:04:25.102941 IP 10.0.0.5.12345 > 10.0.0.2.12345: UDP, length 16
13:04:25.103572 IP 10.0.0.5.12345 > 10.0.0.2.12345: UDP, length 16
13:04:25.104210 IP 10.0.0.5.12345 > 10.0.0.2.12345: UDP, length 16
13:04:25.104848 IP 10.0.0.5.12345 > 10.0.0.2.12345: UDP, length 16
13:04:25.105484 IP 10.0.0.5.12345 > 10.0.0.2.12345: UDP, length 16
13:04:25.106121 IP 10.0.0.5.12345 > 10.0.0.2.12345: UDP, length 16
13:04:25.106745 IP 10.0.0.5.12345 > 10.0.0.2.12345: UDP, length 16
13:04:25.107385 IP 10.0.0.5.12345 > 10.0.0.2.12345: UDP, length 16
13:04:25.108031 IP 10.0.0.5.12345 > 10.0.0.2.12345: UDP, length 16
13:04:25.108638 IP 10.0.0.5.12345 > 10.0.0.2.12345: UDP, length 16
13:04:25.109234 IP 10.0.0.5.12345 > 10.0.0.2.12345: UDP, length 16
13:04:25.109833 IP 10.0.0.5.12345 > 10.0.0.2.12345: UDP, length 16
13:04:25.110429 IP 10.0.0.5.12345 > 10.0.0.2.12345: UDP, length 16
13:04:25.111022 IP 10.0.0.5.12345 > 10.0.0.2.12345: UDP, length 16
13:04:25.111614 IP 10.0.0.5.12345 > 10.0.0.2.12345: UDP, length 16
13:04:25.112223 IP 10.0.0.5.12345 > 10.0.0.2.12345: UDP, length 16
13:04:25.112817 IP 10.0.0.5.12345 > 10.0.0.2.12345: UDP, length 16
13:04:25.113410 IP 10.0.0.5.12345 > 10.0.0.2.12345: UDP, length 16
13:04:25.114011 IP 10.0.0.5.12345 > 10.0.0.2.12345: UDP, length 16
13:04:25.114615 IP 10.0.0.5.12345 > 10.0.0.2.12345: UDP, length 16
13:04:25.115202 IP 10.0.0.5.12345 > 10.0.0.2.12345: UDP, length 16
13:04:25.115792 IP 10.0.0.5.12345 > 10.0.0.2.12345: UDP, length 16
13:04:25.116428 IP 10.0.0.5.12345 > 10.0.0.2.12345: UDP, length 16
13:04:25.117033 IP 10.0.0.5.12345 > 10.0.0.2.12345: UDP, length 16
13:04:25.117645 IP 10.0.0.5.12345 > 10.0.0.2.12345: UDP, length 16
13:04:25.118277 IP 10.0.0.5.12345 > 10.0.0.2.12345: UDP, length 16
13:04:25.118878 IP 10.0.0.5.12345 > 10.0.0.2.12345: UDP, length 16
13:04:25.119502 IP 10.0.0.5.12345 > 10.0.0.2.12345: UDP, length 16
13:04:25.120127 IP 10.0.0.5.12345 > 10.0.0.2.12345: UDP, length 16
13:04:25.120752 IP 10.0.0.5.12345 > 10.0.0.2.12345: UDP, length 16
13:04:25.121378 IP 10.0.0.5.12345 > 10.0.0.2.12345: UDP, length 16
13:04:25.122003 IP 10.0.0.5.12345 > 10.0.0.2.12345: UDP, length 16
13:04:25.122630 IP 10.0.0.5.12345 > 10.0.0.2.12345: UDP, length 16
13:04:25.123235 IP 10.0.0.5.12345 > 10.0.0.2.12345: UDP, length 16
13:04:25.123867 IP 10.0.0.5.12345 > 10.0.0.2.12345: UDP, length 16
13:04:25.124463 IP 10.0.0.5.12345 > 10.0.0.2.12345: UDP, length 16
13:04:25.125061 IP 10.0.0.5.12345 > 10.0.0.2.12345: UDP, length 16
13:04:25.125686 IP 10.0.0.5.12345 > 10.0.0.2.12345: UDP, length 16
13:04:25.126311 IP 10.0.0.5.12345 > 10.0.0.2.12345: UDP, length 16
13:04:25.126934 IP 10.0.0.5.12345 > 10.0.0.2.12345: UDP, length 16
13:04:25.127558 IP 10.0.0.5.12345 > 10.0.0.2.12345: UDP, length 16
13:04:25.128182 IP 10.0.0.5.12345 > 10.0.0.2.12345: UDP, length 16
13:04:25.128806 IP 10.0.0.5.12345 > 10.0.0.2.12345: UDP, length 16
13:04:25.129429 IP 10.0.0.5.12345 > 10.0.0.2.12345: UDP, length 16
13:04:25.130063 IP 10.0.0.5.12345 > 10.0.0.2.12345: UDP, length 16
13:04:25.130682 IP 10.0.0.5.12345 > 10.0.0.2.12345: UDP, length 16
13:04:25.131323 IP 10.0.0.5.12345 > 10.0.0.2.12345: UDP, length 16
13:04:25.131959 IP 10.0.0.5.12345 > 10.0.0.2.12345: UDP, length 16
13:04:25.132594 IP 10.0.0.5.12345 > 10.0.0.2.12345: UDP, length 16
13:04:25.133230 IP 10.0.0.5.12345 > 10.0.0.2.12345: UDP, length 16
13:04:25.133867 IP 10.0.0.5.12345 > 10.0.0.2.12345: UDP, length 16
13:04:25.134502 IP 10.0.0.5.12345 > 10.0.0.2.12345: UDP, length 16
13:04:25.135122 IP 10.0.0.5.12345 > 10.0.0.2.12345: UDP, length 16
13:04:25.135748 IP 10.0.0.5.12345 > 10.0.0.2.12345: UDP, length 16
13:04:25.136357 IP 10.0.0.5.12345 > 10.0.0.2.12345: UDP, length 16
13:04:25.136957 IP 10.0.0.5.12345 > 10.0.0.2.12345: UDP, length 16
13:04:25.137572 IP 10.0.0.5.12345 > 10.0.0.2.12345: UDP, length 16
