13:25:20.895101 IP 10.0.0.14.12345 > 10.0.0.2.12345: UDP, length 16
13:25:20.895613 IP 10.0.0.14.12345 > 10.0.0.2.12345: UDP, length 16
13:25:20.896195 IP 10.0.0.14.12345 > 10.0.0.2.12345: UDP, length 16
13:25:20.896790 IP 10.0.0.14.12345 > 10.0.0.2.12345: UDP, length 16
13:25:20.897375 IP 10.0.0.14.12345 > 10.0.0.2.12345: UDP, length 16
13:25:20.897951 IP 10.0.0.14.12345 > 10.0.0.2.12345: UDP, length 16
13:25:20.898532 IP 10.0.0.14.12345 > 10.0.0.2.12345: UDP, length 16
13:25:20.899125 IP 10.0.0.14.12345 > 10.0.0.2.12345: UDP, length 16
13:25:20.899736 IP 10.0.0.14.12345 > 10.0.0.2.12345: UDP, length 16
13:25:20.900321 IP 10.0.0.14.12345 > 10.0.0.2.12345: UDP, length 16
13:25:20.900904 IP 10.0.0.14.12345 > 10.0.0.2.12345: UDP, length 16
13:25:20.901482 IP 10.0.0.14.12345 > 10.0.0.2.12345: UDP, length 16
13:25:20.902053 IP 10.0.0.14.12345 > 10.0.0.2.12345: UDP, length 16
13:25:20.902621 IP 10.0.0.14.12345 > 10.0.0.2.12345: UDP, length 16
13:25:20.903191 IP 10.0.0.14.12345 > 10.0.0.2.12345: UDP, length 16
13:25:20.903784 IP 10.0.0.14.12345 > 10.0.0.2.12345: UDP, length 16
13:25:20.904392 IP 10.0.0.14.12345 > 10.0.0.2.12345: UDP, length 16
13:25:20.904983 IP 10.0.0.14.12345 > 10.0.0.2.12345: UDP, length 16
13:25:20.905564 IP 10.0.0.14.12345 > 10.0.0.2.12345: UDP, length 16
13:25:20.906139 IP 10.0.0.14.12345 > 10.0.0.2.12345: UDP, length 16
13:25:20.906719 IP 10.0.0.14.12345 > 10.0.0.2.12345: UDP, length 16
13:25:20.907316 IP 10.0.0.14.12345 > 10.0.0.2.12345: UDP, length 16
13:25:20.907914 IP 10.0.0.14.12345 > 10.0.0.2.12345: UDP, length 16
13:25:20.908496 IP 10.0.0.14.12345 > 10.0.0.2.12345: UDP, length 16
13:25:20.909069 IP 10.0.0.14.12345 > 10.0.0.2.12345: UDP, length 16
13:25:20.909639 IP 10.0.0.14.12345 > 10.0.0.2.12345: UDP, length 16
13:25:20.910209 IP 10.0.0.14.12345 > 10.0.0.2.12345: UDP, length 16
13:25:20.910778 IP 10.0.0.14.12345 > 10.0.0.2.12345: UDP, length 16
13:25:20.911347 IP 10.0.0.14.12345 > 10.0.0.2.12345: UDP, length 16
13:25:20.911918 IP 10.0.0.14.12345 > 10.0.0.2.12345: UDP, length 16
13:25:20.912490 IP 10.0.0.14.12345 > 10.0.0.2.12345: UDP, length 16
13:25:20.913072 IP 10.0.0.14.12345 > 10.0.0.2.12345: UDP, length 16
13:25:20.913656 IP 10.0.0.14.12345 > 10.0.0.2.12345: UDP, length 16
13:25:20.914242 IP 10.0.0.14.12345 > 10.0.0.2.12345: UDP, length 16
13:25:20.914810 IP 10.0.0.14.12345 > 10.0.0.2.12345: UDP, length 16
13:25:20.915384 IP 10.0.0.14.12345 > 10.0.0.2.12345: UDP, length 16
13:25:20.915961 IP 10.0.0.14.12345 > 10.0.0.2.12345: UDP, length 16
13:25:20.916536 IP 10.0.0.14.12345 > 10.0.0.2.12345: UDP, length 16
13:25:20.917109 IP 10.0.0.14.12345 > 10.0.0.2.12345: UDP, length 16
13:25:20.917693 IP 10.0.0.14.12345 > 10.0.0.2.12345: UDP, length 16
13:25:20.918272 IP 10.0.0.14.12345 > 10.0.0.2.12345: UDP, length 16
13:25:20.918858 IP 10.0.0.14.12345 > 10.0.0.2.12345: UDP, length 16
13:25:20.919443 IP 10.0.0.14.12345 > 10.0.0.2.12345: UDP, length 16
13:25:20.920017 IP 10.0.0.14.12345 > 10.0.0.2.12345: UDP, length 16
13:25:20.920602 IP 10.0.0.14.12345 > 10.0.0.2.12345: UDP, length 16
13:25:20.921189 IP 10.0.0.14.12345 > 10.0.0.2.12345: UDP, length 16
13:25:20.921766 IP 10.0.0.14.12345 > 10.0.0.2.12345: UDP, length 16
13:25:20.922338 IP 10.0.0.14.12345 > 10.0.0.2.12345: UDP, length 16
13:25:20.922914 IP 10.0.0.14.12345 > 10.0.0.2.12345: UDP, length 16
13:25:20.923500 IP 10.0.0.14.12345 > 10.0.0.2.12345: UDP, length 16
13:25:20.924109 IP 10.0.0.14.12345 > 10.0.0.2.12345: UDP, length 16
13:25:20.924711 IP 10.0.0.14.12345 > 10.0.0.2.12345: UDP, length 16
13:25:20.925299 IP 10.0.0.14.12345 > 10.0.0.2.12345: UDP, length 16
13:25:20.925880 IP 10.0.0.14.12345 > 10.0.0.2.12345: UDP, length 16
13:25:20.926466 IP 10.0.0.14.12345 > 10.0.0.2.12345: UDP, length 16
13:25:20.927068 IP 10.0.0.14.12345 > 10.0.0.2.12345: UDP, length 16
13:25:20.927650 IP 10.0.0.14.12345 > 10.0.0.2.12345: UDP, length 16
13:25:20.928234 IP 10.0.0.14.12345 > 10.0.0.2.12345: UDP, length 16
13:25:20.928828 IP 10.0.0.14.12345 > 10.0.0.2.12345: UDP, length 16
13:25:20.929417 IP 10.0.0.14.12345 > 10.0.0.2.12345: UDP, length 16
13:25:20.930003 IP 10.0.0.14.12345 > 10.0.0.2.12345: UDP, length 16
13:25:20.930594 IP 10.0.0.14.12345 > 10.0.0.2.12345: UDP, length 16
13:25:20.931182 IP 10.0.0.14.12345 > 10.0.0.2.12345: UDP, length 16
13:25:20.931778 IP 10.0.0.14.12345 > 10.0.0.2.12345: UDP, length 16
13:25:20.932351 IP 10.0.0.14.12345 > 10.0.0.2.12345: UDP, length 16
13:25:20.932930 IP 10.0.0.14.12345 > 10.0.0.2.12345: UDP, length 16
13:25:20.933497 IP 10.0.0.14.12345 > 10.0.0.2.12345: UDP, length 16
13:25:20.934064 IP 10.0.0.14.12345 > 10.0.0.2.12345: UDP, length 16
13:25:20.934630 IP 10.0.0.14.12345 > 10.0.0.2.12345: UDP, length 16
13:25:20.935202 IP 10.0.0.14.12345 > 10.0.0.2.12345: UDP, length 16
13:25:20.935773 IP 10.0.0.14.12345 > 10.0.0.2.12345: UDP, length 16
13:25:20.936351 IP 10.0.0.14.12345 > 10.0.0.2.12345: UDP, length 16
13:25:20.936937 IP 10.0.0.14.12345 > 10.0.0.2.12345: UDP, length 16
13:25:20.937543 IP 10.0.0.14.12345 > 10.0.0.2.12345: UDP, length 16
13:25:20.938136 IP 10.0.0.14.12345 > 10.0.0.2.12345: UDP, length 16
13:25:20.938719 IP 10.0.0.14.12345 > 10.0.0.2.12345: UDP, length 16
13:25:20.939293 IP 10.0.0.14.12345 > 10.0.0.2.12345: UDP, length 16
13:25:20.939865 IP 10.0.0.14.12345 > 10.0.0.2.12345: UDP, length 16
13:25:20.940443 IP 10.0.0.14.12345 > 10.0.0.2.12345: UDP, length 16
13:25:20.941033 IP 10.0.0.14.12345 > 10.0.0.2.12345: UDP, length 16
13:25:20.941621 IP 10.0.0.14.12345 > 10.0.0.2.12345: UDP, length 16
13:25:20.942208 IP 10.0.0.14.12345 > 10.0.0.2.12345: UDP, length 16
13:25:20.942796 IP 10.0.0.14.12345 > 10.0.0.2.12345: UDP, length 16
13:25:20.943382 IP 10.0.0.14.12345 > 10.0.0.2.12345: UDP, length 16
13:25:20.943952 IP 10.0.0.14.12345 > 10.0.0.2.12345: UDP, length 16
13:25:20.944539 IP 10.0.0.14.12345 > 10.0.0.2.12345: UDP, length 16
13:25:20.945123 IP 10.0.0.14.12345 > 10.0.0.2.12345: UDP, length 16
13:25:20.945737 IP 10.0.0.14.12345 > 10.0.0.2.12345: UDP, length 16
13:25:20.946326 IP 10.0.0.14.12345 > 10.0.0.2.12345: UDP, length 16
13:25:20.946902 IP 10.0.0.14.12345 > 10.0.0.2.12345: UDP, length 16
13:25:20.947473 IP 10.0.0.14.12345 > 10.0.0.2.12345: UDP, length 16
13:25:20.948044 IP 10.0.0.14.12345 > 10.0.0.2.12345: UDP, length 16
13:25:20.948621 IP 10.0.0.14.12345 > 10.0.0.2.12345: UDP, length 16
13:25:20.949206 IP 10.0.0.14.12345 > 10.0.0.2.12345: UDP, length 16
13:25:20.949805 IP 10.0.0.14.12345 > 10.0.0.2.12345: UDP, length 16
13:25:20.950422 IP 10.0.0.14.12345 > 10.0.0.2.12345: UDP, length 16
13:25:20.951013 IP 10.0.0.14.12345 > 10.0.0.2.12345: UDP, length 16
13:25:20.951642 IP 10.0.0.14.12345 > 10.0.0.2.12345: UDP, length 16
13:25:20.952237 IP 10.0.0.14.12345 > 10.0.0.2.12345: UDP, length 16
13:25:20.952837 IP 10.0.0.14.12345 > 10.0.0.2.12345: UDP, length 16
13:25:20.953429 IP 10.0.0.14.12345 > 10.0.0.2.12345: UDP, length 16
13:25:20.954016 IP 10.0.0.14.12345 > 10.0.0.2.12345: UDP, length 16
13:25:20.954609 IP 10.0.0.14.12345 > 10.0.0.2.12345: UDP, length 16
13:25:20.955189 IP 10.0.0.14.12345 > 10.0.0.2.12345: UDP, length 16
13:25:20.955766 IP 10.0.0.14.12345 > 10.0.0.2.12345: UDP, length 16
13:25:20.956357 IP 10.0.0.14.12345 > 10.0.0.2.12345: UDP, length 16
13:25:20.956951 IP 10.0.0.14.12345 > 10.0.0.2.12345: UDP, length 16
13:25:20.957547 IP 10.0.0.14.12345 > 10.0.0.2.12345: UDP, length 16
13:25:20.958137 IP 10.0.0.14.12345 > 10.0.0.2.12345: UDP, length 16
13:25:20.958751 IP 10.0.0.14.12345 > 10.0.0.2.12345: UDP, length 16
13:25:20.959339 IP 10.0.0.14.12345 > 10.0.0.2.12345: UDP, length 16
13:25:20.959927 IP 10.0.0.14.12345 > 10.0.0.2.12345: UDP, length 16
13:25:20.960502 IP 10.0.0.14.12345 > 10.0.0.2.12345: UDP, length 16
13:25:20.961095 IP 10.0.0.14.12345 > 10.0.0.2.12345: UDP, length 16
13:25:20.961673 IP 10.0.0.14.12345 > 10.0.0.2.12345: UDP, length 16
13:25:20.962249 IP 10.0.0.14.12345 > 10.0.0.2.12345: UDP, length 16
13:25:20.962854 IP 10.0.0.14.12345 > 10.0.0.2.12345: UDP, length 16
13:25:20.963429 IP 10.0.0.14.12345 > 10.0.0.2.12345: UDP, length 16
13:25:20.964000 IP 10.0.0.14.12345 > 10.0.0.2.12345: UDP, length 16
13:25:20.964573 IP 10.0.0.14.12345 > 10.0.0.2.12345: UDP, length 16
13:25:20.965147 IP 10.0.0.14.12345 > 10.0.0.2.12345: UDP, length 16
13:25:20.965721 IP 10.0.0.14.12345 > 10.0.0.2.12345: UDP, length 16
13:25:20.966290 IP 10.0.0.14.12345 > 10.0.0.2.12345: UDP, length 16
13:25:20.966866 IP 10.0.0.14.12345 > 10.0.0.2.12345: UDP, length 16
13:25:20.967432 IP 10.0.0.14.12345 > 10.0.0.2.12345: UDP, length 16
13:25:20.967999 IP 10.0.0.14.12345 > 10.0.0.2.12345: UDP, length 16
13:25:20.968567 IP 10.0.0.14.12345 > 10.0.0.2.12345: UDP, length 16
13:25:20.969145 IP 10.0.0.14.12345 > 10.0.0.2.12345: UDP, length 16
13:25:20.969717 IP 10.0.0.14.12345 > 10.0.0.2.12345: UDP, length 16
13:25:20.970295 IP 10.0.0.14.12345 > 10.0.0.2.12345: UDP, length 16
13:25:20.970881 IP 10.0.0.14.12345 > 10.0.0.2.12345: UDP, length 16
13:25:20.971458 IP 10.0.0.14.12345 > 10.0.0.2.12345: UDP, length 16
13:25:20.972036 IP 10.0.0.14.12345 > 10.0.0.2.12345: UDP, length 16
13:25:20.972606 IP 10.0.0.14.12345 > 10.0.0.2.12345: UDP, length 16
13:25:20.973178 IP 10.0.0.14.12345 > 10.0.0.2.12345: UDP, length 16
13:25:20.973764 IP 10.0.0.14.12345 > 10.0.0.2.12345: UDP, length 16
13:25:20.974349 IP 10.0.0.14.12345 > 10.0.0.2.12345: UDP, length 16
13:25:20.974927 IP 10.0.0.14.12345 > 10.0.0.2.12345: UDP, length 16
13:25:20.975510 IP 10.0.0.14.12345 > 10.0.0.2.12345: UDP, length 16
13:25:20.976091 IP 10.0.0.14.12345 > 10.0.0.2.12345: UDP, length 16
13:25:20.976674 IP 10.0.0.14.12345 > 10.0.0.2.12345: UDP, length 16
13:25:20.977253 IP 10.0.0.14.12345 > 10.0.0.2.12345: UDP, length 16
13:25:20.977831 IP 10.0.0.14.12345 > 10.0.0.2.12345: UDP, length 16
13:25:20.978399 IP 10.0.0.14.12345 > 10.0.0.2.12345: UDP, length 16
13:25:20.978987 IP 10.0.0.14.12345 > 10.0.0.2.12345: UDP, length 16
13:25:20.979570 IP 10.0.0.14.12345 > 10.0.0.2.12345: UDP, length 16
13:25:20.980148 IP 10.0.0.14.12345 > 10.0.0.2.12345: UDP, length 16
13:25:20.980727 IP 10.0.0.14.12345 > 10.0.0.2.12345: UDP, length 16
13:25:20.981305 IP 10.0.0.14.12345 > 10.0.0.2.12345: UDP, length 16
13:25:20.981888 IP 10.0.0.14.12345 > 10.0.0.2.12345: UDP, length 16
13:25:20.982465 IP 10.0.0.14.12345 > 10.0.0.2.12345: UDP, length 16
13:25:20.983040 IP 10.0.0.14.12345 > 10.0.0.2.12345: UDP, length 16
13:25:20.983615 IP 10.0.0.14.12345 > 10.0.0.2.12345: UDP, length 16
13:25:20.984178 IP 10.0.0.14.12345 > 10.0.0.2.12345: UDP, length 16
13:25:20.984739 IP 10.0.0.14.12345 > 10.0.0.2.12345: UDP, length 16
13:25:20.985298 IP 10.0.0.14.12345 > 10.0.0.2.12345: UDP, length 16
13:25:20.985857 IP 10.0.0.14.12345 > 10.0.0.2.12345: UDP, length 16
13:25:20.986416 IP 10.0.0.14.12345 > 10.0.0.2.12345: UDP, length 16
13:25:20.987003 IP 10.0.0.14.12345 > 10.0.0.2.12345: UDP, length 16
13:25:20.987580 IP 10.0.0.14.12345 > 10.0.0.2.12345: UDP, length 16
13:25:20.988154 IP 10.0.0.14.12345 > 10.0.0.2.12345: UDP, length 16
13:25:20.988729 IP 10.0.0.14.12345 > 10.0.0.2.12345: UDP, length 16
13:25:20.989305 IP 10.0.0.14.12345 > 10.0.0.2.12345: UDP, length 16
13:25:20.989897 IP 10.0.0.14.12345 > 10.0.0.2.12345: UDP, length 16
13:25:20.990474 IP 10.0.0.14.12345 > 10.0.0.2.12345: UDP, length 16
13:25:20.991061 IP 10.0.0.14.12345 > 10.0.0.2.12345: UDP, length 16
13:25:20.991635 IP 10.0.0.14.12345 > 10.0.0.2.12345: UDP, length 16
13:25:20.992226 IP 10.0.0.14.12345 > 10.0.0.2.12345: UDP, length 16
13:25:20.992818 IP 10.0.0.14.12345 > 10.0.0.2.12345: UDP, length 16
13:25:20.993410 IP 10.0.0.14.12345 > 10.0.0.2.12345: UDP, length 16
13:25:20.994002 IP 10.0.0.14.12345 > 10.0.0.2.12345: UDP, length 16
13:25:20.994608 IP 10.0.0.14.12345 > 10.0.0.2.12345: UDP, length 16
13:25:20.995200 IP 10.0.0.14.12345 > 10.0.0.2.12345: UDP, length 16
13:25:20.995771 IP 10.0.0.14.12345 > 10.0.0.2.12345: UDP, length 16
13:25:20.996366 IP 10.0.0.14.12345 > 10.0.0.2.12345: UDP, length 16
13:25:20.996974 IP 10.0.0.14.12345 > 10.0.0.2.12345: UDP, length 16
13:25:20.997580 IP 10.0.0.14.12345 > 10.0.0.2.12345: UDP, length 16
13:25:20.998191 IP 10.0.0.14.12345 > 10.0.0.2.12345: UDP, length 16
13:25:20.998801 IP 10.0.0.14.12345 > 10.0.0.2.12345: UDP, length 16
13:25:20.999411 IP 10.0.0.14.12345 > 10.0.0.2.12345: UDP, length 16
13:25:21.000029 IP 10.0.0.14.12345 > 10.0.0.2.12345: UDP, length 16
13:25:21.000645 IP 10.0.0.14.12345 > 10.0.0.2.12345: UDP, length 16
13:25:21.001262 IP 10.0.0.14.12345 > 10.0.0.2.12345: UDP, length 16
13:25:21.001877 IP 10.0.0.14.12345 > 10.0.0.2.12345: UDP, length 16
13:25:21.002459 IP 10.0.0.14.12345 > 10.0.0.2.12345: UDP, length 16
13:25:21.003066 IP 10.0.0.14.12345 > 10.0.0.2.12345: UDP, length 16
13:25:21.003646 IP 10.0.0.14.12345 > 10.0.0.2.12345: UDP, length 16
13:25:21.004229 IP 10.0.0.14.12345 > 10.0.0.2.12345: UDP, length 16
13:25:21.004810 IP 10.0.0.14.12345 > 10.0.0.2.12345: UDP, length 16
13:25:21.005412 IP 10.0.0.14.12345 > 10.0.0.2.12345: UDP, length 16
13:25:21.006014 IP 10.0.0.14.12345 > 10.0.0.2.12345: UDP, length 16
13:25:21.006608 IP 10.0.0.14.12345 > 10.0.0.2.12345: UDP, length 16
13:25:21.007203 IP 10.0.0.14.12345 > 10.0.0.2.12345: UDP, length 16
13:25:21.007818 IP 10.0.0.14.12345 > 10.0.0.2.12345: UDP, length 16
13:25:21.008414 IP 10.0.0.14.12345 > 10.0.0.2.12345: UDP, length 16
13:25:21.009015 IP 10.0.0.14.12345 > 10.0.0.2.12345: UDP, length 16
13:25:21.009609 IP 10.0.0.14.12345 > 10.0.0.2.12345: UDP, length 16
13:25:21.010202 IP 10.0.0.14.12345 > 10.0.0.2.12345: UDP, length 16
13:25:21.010782 IP 10.0.0.14.12345 > 10.0.0.2.12345: UDP, length 16
13:25:21.011358 IP 10.0.0.14.12345 > 10.0.0.2.12345: UDP, length 16
13:25:21.011942 IP 10.0.0.14.12345 > 10.0.0.2.12345: UDP, length 16
13:25:21.012523 IP 10.0.0.14.12345 > 10.0.0.2.12345: UDP, length 16
13:25:21.013120 IP 10.0.0.14.12345 > 10.0.0.2.12345: UDP, length 16
13:25:21.013714 IP 10.0.0.14.12345 > 10.0.0.2.12345: UDP, length 16
13:25:21.014307 IP 10.0.0.14.12345 > 10.0.0.2.12345: UDP, length 16
13:25:21.014901 IP 10.0.0.14.12345 > 10.0.0.2.12345: UDP, length 16
13:25:21.015518 IP 10.0.0.14.12345 > 10.0.0.2.12345: UDP, length 16
13:25:21.016165 IP 10.0.0.14.12345 > 10.0.0.2.12345: UDP, length 16
13:25:21.016789 IP 10.0.0.14.12345 > 10.0.0.2.12345: UDP, length 16
13:25:21.017410 IP 10.0.0.14.12345 > 10.0.0.2.12345: UDP, length 16
13:25:21.018033 IP 10.0.0.14.12345 > 10.0.0.2.12345: UDP, length 16
13:25:21.018621 IP 10.0.0.14.12345 > 10.0.0.2.12345: UDP, length 16
13:25:21.019272 IP 10.0.0.14.12345 > 10.0.0.2.12345: UDP, length 16
13:25:21.019870 IP 10.0.0.14.12345 > 10.0.0.2.12345: UDP, length 16
13:25:21.020469 IP 10.0.0.14.12345 > 10.0.0.2.12345: UDP, length 16
13:25:21.021056 IP 10.0.0.14.12345 > 10.0.0.2.12345: UDP, length 16
13:25:21.021644 IP 10.0.0.14.12345 > 10.0.0.2.12345: UDP, length 16
13:25:21.022232 IP 10.0.0.14.12345 > 10.0.0.2.12345: UDP, length 16
13:25:21.022818 IP 10.0.0.14.12345 > 10.0.0.2.12345: UDP, length 16
13:25:21.023406 IP 10.0.0.14.12345 > 10.0.0.2.12345: UDP, length 16
13:25:21.024007 IP 10.0.0.14.12345 > 10.0.0.2.12345: UDP, length 16
13:25:21.024633 IP 10.0.0.14.12345 > 10.0.0.2.12345: UDP, length 16
13:25:21.025256 IP 10.0.0.14.12345 > 10.0.0.2.12345: UDP, length 16
13:25:21.025876 IP 10.0.0.14.12345 > 10.0.0.2.12345: UDP, length 16
13:25:21.026483 IP 10.0.0.14.12345 > 10.0.0.2.12345: UDP, length 16
13:25:21.027091 IP 10.0.0.14.12345 > 10.0.0.2.12345: UDP, length 16
13:25:21.027728 IP 10.0.0.14.12345 > 10.0.0.2.12345: UDP, length 16
13:25:21.028316 IP 10.0.0.14.12345 > 10.0.0.2.12345: UDP, length 16
13:25:21.028911 IP 10.0.0.14.12345 > 10.0.0.2.12345: UDP, length 16
13:25:21.029555 IP 10.0.0.14.12345 > 10.0.0.2.12345: UDP, length 16
13:25:21.030163 IP 10.0.0.14.12345 > 10.0.0.2.12345: UDP, length 16
13:25:21.030771 IP 10.0.0.14.12345 > 10.0.0.2.12345: UDP, length 16
13:25:21.031373 IP 10.0.0.14.12345 > 10.0.0.2.12345: UDP, length 16
13:25:21.031992 IP 10.0.0.14.12345 > 10.0.0.2.12345: UDP, length 16
13:25:21.032612 IP 10.0.0.14.12345 > 10.0.0.2.12345: UDP, length 16
13:25:21.033248 IP 10.0.0.14.12345 > 10.0.0.2.12345: UDP, length 16
13:25:21.033885 IP 10.0.0.14.12345 > 10.0.0.2.12345: UDP, length 16
13:25:21.034506 IP 10.0.0.14.12345 > 10.0.0.2.12345: UDP, length 16
13:25:21.035103 IP 10.0.0.14.12345 > 10.0.0.2.12345: UDP, length 16
13:25:21.035725 IP 10.0.0.14.12345 > 10.0.0.2.12345: UDP, length 16
13:25:21.036369 IP 10.0.0.14.12345 > 10.0.0.2.12345: UDP, length 16
13:25:21.036992 IP 10.0.0.14.12345 > 10.0.0.2.12345: UDP, length 16
13:25:21.037613 IP 10.0.0.14.12345 > 10.0.0.2.12345: UDP, length 16
13:25:21.038253 IP 10.0.0.14.12345 > 10.0.0.2.12345: UDP, length 16
13:25:21.038878 IP 10.0.0.14.12345 > 10.0.0.2.12345: UDP, length 16
13:25:21.039498 IP 10.0.0.14.12345 > 10.0.0.2.12345: UDP, length 16
13:25:21.040120 IP 10.0.0.14.12345 > 10.0.0.2.12345: UDP, length 16
13:25:21.040740 IP 10.0.0.14.12345 > 10.0.0.2.12345: UDP, length 16
13:25:21.041369 IP 10.0.0.14.12345 > 10.0.0.2.12345: UDP, length 16
13:25:21.041966 IP 10.0.0.14.12345 > 10.0.0.2.12345: UDP, length 16
13:25:21.042553 IP 10.0.0.14.12345 > 10.0.0.2.12345: UDP, length 16
13:25:21.043155 IP 10.0.0.14.12345 > 10.0.0.2.12345: UDP, length 16
13:25:21.043755 IP 10.0.0.14.12345 > 10.0.0.2.12345: UDP, length 16
13:25:21.044329 IP 10.0.0.14.12345 > 10.0.0.2.12345: UDP, length 16
13:25:21.044902 IP 10.0.0.14.12345 > 10.0.0.2.12345: UDP, length 16
13:25:21.045486 IP 10.0.0.14.12345 > 10.0.0.2.12345: UDP, length 16
13:25:21.046069 IP 10.0.0.14.12345 > 10.0.0.2.12345: UDP, length 16
13:25:21.046652 IP 10.0.0.14.12345 > 10.0.0.2.12345: UDP, length 16
13:25:21.047234 IP 10.0.0.14.12345 > 10.0.0.2.12345: UDP, length 16
13:25:21.047808 IP 10.0.0.14.12345 > 10.0.0.2.12345: UDP, length 16
13:25:21.048425 IP 10.0.0.14.12345 > 10.0.0.2.12345: UDP, length 16
13:25:21.049042 IP 10.0.0.14.12345 > 10.0.0.2.12345: UDP, length 16
13:25:21.049677 IP 10.0.0.14.12345 > 10.0.0.2.12345: UDP, length 16
13:25:21.050312 IP 10.0.0.14.12345 > 10.0.0.2.12345: UDP, length 16
13:25:21.050905 IP 10.0.0.14.12345 > 10.0.0.2.12345: UDP, length 16
13:25:21.051498 IP 10.0.0.14.12345 > 10.0.0.2.12345: UDP, length 16
13:25:21.052087 IP 10.0.0.14.12345 > 10.0.0.2.12345: UDP, length 16
13:25:21.052688 IP 10.0.0.14.12345 > 10.0.0.2.12345: UDP, length 16
13:25:21.053282 IP 10.0.0.14.12345 > 10.0.0.2.12345: UDP, length 16
13:25:21.053886 IP 10.0.0.14.12345 > 10.0.0.2.12345: UDP, length 16
13:25:21.054509 IP 10.0.0.14.12345 > 10.0.0.2.12345: UDP, length 16
13:25:21.055131 IP 10.0.0.14.12345 > 10.0.0.2.12345: UDP, length 16
13:25:21.055775 IP 10.0.0.14.12345 > 10.0.0.2.12345: UDP, length 16
13:25:21.056394 IP 10.0.0.14.12345 > 10.0.0.2.12345: UDP, length 16
13:25:21.057010 IP 10.0.0.14.12345 > 10.0.0.2.12345: UDP, length 16
13:25:21.057626 IP 10.0.0.14.12345 > 10.0.0.2.12345: UDP, length 16
13:25:21.058258 IP 10.0.0.14.12345 > 10.0.0.2.12345: UDP, length 16
13:25:21.058874 IP 10.0.0.14.12345 > 10.0.0.2.12345: UDP, length 16
13:25:21.059482 IP 10.0.0.14.12345 > 10.0.0.2.12345: UDP, length 16
13:25:21.060123 IP 10.0.0.14.12345 > 10.0.0.2.12345: UDP, length 16
13:25:21.060726 IP 10.0.0.14.12345 > 10.0.0.2.12345: UDP, length 16
13:25:21.061317 IP 10.0.0.14.12345 > 10.0.0.2.12345: UDP, length 16
13:25:21.061915 IP 10.0.0.14.12345 > 10.0.0.2.12345: UDP, length 16
13:25:21.062505 IP 10.0.0.14.12345 > 10.0.0.2.12345: UDP, length 16
13:25:21.063094 IP 10.0.0.14.12345 > 10.0.0.2.12345: UDP, length 16
13:25:21.063731 IP 10.0.0.14.12345 > 10.0.0.2.12345: UDP, length 16
13:25:21.064360 IP 10.0.0.14.12345 > 10.0.0.2.12345: UDP, length 16
13:25:21.064992 IP 10.0.0.14.12345 > 10.0.0.2.12345: UDP, length 16
13:25:21.065623 IP 10.0.0.14.12345 > 10.0.0.2.12345: UDP, length 16
13:25:21.066275 IP 10.0.0.14.12345 > 10.0.0.2.12345: UDP, length 16
13:25:21.066896 IP 10.0.0.14.12345 > 10.0.0.2.12345: UDP, length 16
13:25:21.067541 IP 10.0.0.14.12345 > 10.0.0.2.12345: UDP, length 16
13:25:21.068192 IP 10.0.0.14.12345 > 10.0.0.2.12345: UDP, length 16
13:25:21.068841 IP 10.0.0.14.12345 > 10.0.0.2.12345: UDP, length 16
13:25:21.069489 IP 10.0.0.14.12345 > 10.0.0.2.12345: UDP, length 16
13:25:21.070119 IP 10.0.0.14.12345 > 10.0.0.2.12345: UDP, length 16
13:25:21.070752 IP 10.0.0.14.12345 > 10.0.0.2.12345: UDP, length 16
13:25:21.071399 IP 10.0.0.14.12345 > 10.0.0.2.12345: UDP, length 16
13:25:21.072032 IP 10.0.0.14.12345 > 10.0.0.2.12345: UDP, length 16
13:25:21.072664 IP 10.0.0.14.12345 > 10.0.0.2.12345: UDP, length 16
13:25:21.073283 IP 10.0.0.14.12345 > 10.0.0.2.12345: UDP, length 16
13:25:21.073905 IP 10.0.0.14.12345 > 10.0.0.2.12345: UDP, length 16
13:25:21.074525 IP 10.0.0.14.12345 > 10.0.0.2.12345: UDP, length 16
13:25:21.075165 IP 10.0.0.14.12345 > 10.0.0.2.12345: UDP, length 16
13:25:21.075814 IP 10.0.0.14.12345 > 10.0.0.2.12345: UDP, length 16
13:25:21.076446 IP 10.0.0.14.12345 > 10.0.0.2.12345: UDP, length 16
13:25:21.077078 IP 10.0.0.14.12345 > 10.0.0.2.12345: UDP, length 16
13:25:21.077709 IP 10.0.0.14.12345 > 10.0.0.2.12345: UDP, length 16
13:25:21.078323 IP 10.0.0.14.12345 > 10.0.0.2.12345: UDP, length 16
13:25:21.078921 IP 10.0.0.14.12345 > 10.0.0.2.12345: UDP, length 16
13:25:21.079511 IP 10.0.0.14.12345 > 10.0.0.2.12345: UDP, length 16
13:25:21.080108 IP 10.0.0.14.12345 > 10.0.0.2.12345: UDP, length 16
13:25:21.080701 IP 10.0.0.14.12345 > 10.0.0.2.12345: UDP, length 16
13:25:21.081298 IP 10.0.0.14.12345 > 10.0.0.2.12345: UDP, length 16
13:25:21.081896 IP 10.0.0.14.12345 > 10.0.0.2.12345: UDP, length 16
13:25:21.082489 IP 10.0.0.14.12345 > 10.0.0.2.12345: UDP, length 16
13:25:21.083119 IP 10.0.0.14.12345 > 10.0.0.2.12345: UDP, length 16
13:25:21.083740 IP 10.0.0.14.12345 > 10.0.0.2.12345: UDP, length 16
13:25:21.084414 IP 10.0.0.14.12345 > 10.0.0.2.12345: UDP, length 16
13:25:21.085031 IP 10.0.0.14.12345 > 10.0.0.2.12345: UDP, length 16
13:25:21.085623 IP 10.0.0.14.12345 > 10.0.0.2.12345: UDP, length 16
13:25:21.086231 IP 10.0.0.14.12345 > 10.0.0.2.12345: UDP, length 16
13:25:21.086859 IP 10.0.0.14.12345 > 10.0.0.2.12345: UDP, length 16
13:25:21.087460 IP 10.0.0.14.12345 > 10.0.0.2.12345: UDP, length 16
13:25:21.088069 IP 10.0.0.14.12345 > 10.0.0.2.12345: UDP, length 16
13:25:21.088673 IP 10.0.0.14.12345 > 10.0.0.2.12345: UDP, length 16
13:25:21.089303 IP 10.0.0.14.12345 > 10.0.0.2.12345: UDP, length 16
13:25:21.089906 IP 10.0.0.14.12345 > 10.0.0.2.12345: UDP, length 16
13:25:21.090504 IP 10.0.0.14.12345 > 10.0.0.2.12345: UDP, length 16
13:25:21.091114 IP 10.0.0.14.12345 > 10.0.0.2.12345: UDP, length 16
13:25:21.091777 IP 10.0.0.14.12345 > 10.0.0.2.12345: UDP, length 16
13:25:21.092386 IP 10.0.0.14.12345 > 10.0.0.2.12345: UDP, length 16
13:25:21.092978 IP 10.0.0.14.12345 > 10.0.0.2.12345: UDP, length 16
13:25:21.093567 IP 10.0.0.14.12345 > 10.0.0.2.12345: UDP, length 16
13:25:21.094168 IP 10.0.0.14.12345 > 10.0.0.2.12345: UDP, length 16
13:25:21.094760 IP 10.0.0.14.12345 > 10.0.0.2.12345: UDP, length 16
13:25:21.095358 IP 10.0.0.14.12345 > 10.0.0.2.12345: UDP, length 16
13:25:21.095950 IP 10.0.0.14.12345 > 10.0.0.2.12345: UDP, length 16
13:25:21.096537 IP 10.0.0.14.12345 > 10.0.0.2.12345: UDP, length 16
13:25:21.097125 IP 10.0.0.14.12345 > 10.0.0.2.12345: UDP, length 16
13:25:21.097712 IP 10.0.0.14.12345 > 10.0.0.2.12345: UDP, length 16
13:25:21.098300 IP 10.0.0.14.12345 > 10.0.0.2.12345: UDP, length 16
13:25:21.098913 IP 10.0.0.14.12345 > 10.0.0.2.12345: UDP, length 16
13:25:21.099525 IP 10.0.0.14.12345 > 10.0.0.2.12345: UDP, length 16
13:25:21.100130 IP 10.0.0.14.12345 > 10.0.0.2.12345: UDP, length 16
13:25:21.100781 IP 10.0.0.14.12345 > 10.0.0.2.12345: UDP, length 16
13:25:21.101433 IP 10.0.0.14.12345 > 10.0.0.2.12345: UDP, length 16
13:25:21.102088 IP 10.0.0.14.12345 > 10.0.0.2.12345: UDP, length 16
13:25:21.102740 IP 10.0.0.14.12345 > 10.0.0.2.12345: UDP, length 16
13:25:21.103359 IP 10.0.0.14.12345 > 10.0.0.2.12345: UDP, length 16
13:25:21.103963 IP 10.0.0.14.12345 > 10.0.0.2.12345: UDP, length 16
13:25:21.104578 IP 10.0.0.14.12345 > 10.0.0.2.12345: UDP, length 16
13:25:21.105237 IP 10.0.0.14.12345 > 10.0.0.2.12345: UDP, length 16
13:25:21.105870 IP 10.0.0.14.12345 > 10.0.0.2.12345: UDP, length 16
13:25:21.106506 IP 10.0.0.14.12345 > 10.0.0.2.12345: UDP, length 16
13:25:21.107122 IP 10.0.0.14.12345 > 10.0.0.2.12345: UDP, length 16
13:25:21.107778 IP 10.0.0.14.12345 > 10.0.0.2.12345: UDP, length 16
13:25:21.108387 IP 10.0.0.14.12345 > 10.0.0.2.12345: UDP, length 16
13:25:21.109021 IP 10.0.0.14.12345 > 10.0.0.2.12345: UDP, length 16
13:25:21.109643 IP 10.0.0.14.12345 > 10.0.0.2.12345: UDP, length 16
13:25:21.110245 IP 10.0.0.14.12345 > 10.0.0.2.12345: UDP, length 16
13:25:21.110880 IP 10.0.0.14.12345 > 10.0.0.2.12345: UDP, length 16
13:25:21.111484 IP 10.0.0.14.12345 > 10.0.0.2.12345: UDP, length 16
13:25:21.112086 IP 10.0.0.14.12345 > 10.0.0.2.12345: UDP, length 16
13:25:21.112681 IP 10.0.0.14.12345 > 10.0.0.2.12345: UDP, length 16
13:25:21.113270 IP 10.0.0.14.12345 > 10.0.0.2.12345: UDP, length 16
13:25:21.113886 IP 10.0.0.14.12345 > 10.0.0.2.12345: UDP, length 16
13:25:21.114483 IP 10.0.0.14.12345 > 10.0.0.2.12345: UDP, length 16
13:25:21.115120 IP 10.0.0.14.12345 > 10.0.0.2.12345: UDP, length 16
13:25:21.115780 IP 10.0.0.14.12345 > 10.0.0.2.12345: UDP, length 16
13:25:21.116368 IP 10.0.0.14.12345 > 10.0.0.2.12345: UDP, length 16
13:25:21.116963 IP 10.0.0.14.12345 > 10.0.0.2.12345: UDP, length 16
13:25:21.117593 IP 10.0.0.14.12345 > 10.0.0.2.12345: UDP, length 16
13:25:21.118227 IP 10.0.0.14.12345 > 10.0.0.2.12345: UDP, length 16
13:25:21.118862 IP 10.0.0.14.12345 > 10.0.0.2.12345: UDP, length 16
13:25:21.119495 IP 10.0.0.14.12345 > 10.0.0.2.12345: UDP, length 16
13:25:21.120108 IP 10.0.0.14.12345 > 10.0.0.2.12345: UDP, length 16
13:25:21.120748 IP 10.0.0.14.12345 > 10.0.0.2.12345: UDP, length 16
13:25:21.121381 IP 10.0.0.14.12345 > 10.0.0.2.12345: UDP, length 16
13:25:21.122018 IP 10.0.0.14.12345 > 10.0.0.2.12345: UDP, length 16
13:25:21.122652 IP 10.0.0.14.12345 > 10.0.0.2.12345: UDP, length 16
13:25:21.123266 IP 10.0.0.14.12345 > 10.0.0.2.12345: UDP, length 16
13:25:21.123874 IP 10.0.0.14.12345 > 10.0.0.2.12345: UDP, length 16
13:25:21.124520 IP 10.0.0.14.12345 > 10.0.0.2.12345: UDP, length 16
13:25:21.125137 IP 10.0.0.14.12345 > 10.0.0.2.12345: UDP, length 16
13:25:21.125734 IP 10.0.0.14.12345 > 10.0.0.2.12345: UDP, length 16
13:25:21.126330 IP 10.0.0.14.12345 > 10.0.0.2.12345: UDP, length 16
13:25:21.126921 IP 10.0.0.14.12345 > 10.0.0.2.12345: UDP, length 16
13:25:21.127518 IP 10.0.0.14.12345 > 10.0.0.2.12345: UDP, length 16
13:25:21.128157 IP 10.0.0.14.12345 > 10.0.0.2.12345: UDP, length 16
13:25:21.128793 IP 10.0.0.14.12345 > 10.0.0.2.12345: UDP, length 16
13:25:21.129432 IP 10.0.0.14.12345 > 10.0.0.2.12345: UDP, length 16
13:25:21.130071 IP 10.0.0.14.12345 > 10.0.0.2.12345: UDP, length 16
13:25:21.130711 IP 10.0.0.14.12345 > 10.0.0.2.12345: UDP, length 16
13:25:21.131351 IP 10.0.0.14.12345 > 10.0.0.2.12345: UDP, length 16
13:25:21.131974 IP 10.0.0.14.12345 > 10.0.0.2.12345: UDP, length 16
13:25:21.132596 IP 10.0.0.14.12345 > 10.0.0.2.12345: UDP, length 16
13:25:21.133187 IP 10.0.0.14.12345 > 10.0.0.2.12345: UDP, length 16
13:25:21.133771 IP 10.0.0.14.12345 > 10.0.0.2.12345: UDP, length 16
13:25:21.134353 IP 10.0.0.14.12345 > 10.0.0.2.12345: UDP, length 16
13:25:21.134935 IP 10.0.0.14.12345 > 10.0.0.2.12345: UDP, length 16
13:25:21.135549 IP 10.0.0.14.12345 > 10.0.0.2.12345: UDP, length 16
13:25:21.136139 IP 10.0.0.14.12345 > 10.0.0.2.12345: UDP, length 16
13:25:21.136755 IP 10.0.0.14.12345 > 10.0.0.2.12345: UDP, length 16
13:25:21.137372 IP 10.0.0.14.12345 > 10.0.0.2.12345: UDP, length 16
13:25:21.137968 IP 10.0.0.14.12345 > 10.0.0.2.12345: UDP, length 16
13:25:21.138566 IP 10.0.0.14.12345 > 10.0.0.2.12345: UDP, length 16
13:25:21.139161 IP 10.0.0.14.12345 > 10.0.0.2.12345: UDP, length 16
13:25:21.139742 IP 10.0.0.14.12345 > 10.0.0.2.12345: UDP, length 16
13:25:21.140352 IP 10.0.0.14.12345 > 10.0.0.2.12345: UDP, length 16
13:25:21.140956 IP 10.0.0.14.12345 > 10.0.0.2.12345: UDP, length 16
13:25:21.141552 IP 10.0.0.14.12345 > 10.0.0.2.12345: UDP, length 16
13:25:21.142143 IP 10.0.0.14.12345 > 10.0.0.2.12345: UDP, length 16
13:25:21.142770 IP 10.0.0.14.12345 > 10.0.0.2.12345: UDP, length 16
13:25:21.143382 IP 10.0.0.14.12345 > 10.0.0.2.12345: UDP, length 16
13:25:21.143973 IP 10.0.0.14.12345 > 10.0.0.2.12345: UDP, length 16
13:25:21.144583 IP 10.0.0.14.12345 > 10.0.0.2.12345: UDP, length 16
13:25:21.145196 IP 10.0.0.14.12345 > 10.0.0.2.12345: UDP, length 16
13:25:21.145807 IP 10.0.0.14.12345 > 10.0.0.2.12345: UDP, length 16
13:25:21.146430 IP 10.0.0.14.12345 > 10.0.0.2.12345: UDP, length 16
13:25:21.147047 IP 10.0.0.14.12345 > 10.0.0.2.12345: UDP, length 16
13:25:21.147663 IP 10.0.0.14.12345 > 10.0.0.2.12345: UDP, length 16
13:25:21.148294 IP 10.0.0.14.12345 > 10.0.0.2.12345: UDP, length 16
13:25:21.148907 IP 10.0.0.14.12345 > 10.0.0.2.12345: UDP, length 16
13:25:21.149518 IP 10.0.0.14.12345 > 10.0.0.2.12345: UDP, length 16
13:25:21.150128 IP 10.0.0.14.12345 > 10.0.0.2.12345: UDP, length 16
13:25:21.150738 IP 10.0.0.14.12345 > 10.0.0.2.12345: UDP, length 16
13:25:21.151351 IP 10.0.0.14.12345 > 10.0.0.2.12345: UDP, length 16
13:25:21.151938 IP 10.0.0.14.12345 > 10.0.0.2.12345: UDP, length 16
13:25:21.152547 IP 10.0.0.14.12345 > 10.0.0.2.12345: UDP, length 16
13:25:21.153166 IP 10.0.0.14.12345 > 10.0.0.2.12345: UDP, length 16
13:25:21.153780 IP 10.0.0.14.12345 > 10.0.0.2.12345: UDP, length 16
13:25:21.154391 IP 10.0.0.14.12345 > 10.0.0.2.12345: UDP, length 16
13:25:21.155001 IP 10.0.0.14.12345 > 10.0.0.2.12345: UDP, length 16
13:25:21.155613 IP 10.0.0.14.12345 > 10.0.0.2.12345: UDP, length 16
13:25:21.156208 IP 10.0.0.14.12345 > 10.0.0.2.12345: UDP, length 16
13:25:21.156807 IP 10.0.0.14.12345 > 10.0.0.2.12345: UDP, length 16
13:25:21.157423 IP 10.0.0.14.12345 > 10.0.0.2.12345: UDP, length 16
13:25:21.158036 IP 10.0.0.14.12345 > 10.0.0.2.12345: UDP, length 16
13:25:21.158644 IP 10.0.0.14.12345 > 10.0.0.2.12345: UDP, length 16
13:25:21.159236 IP 10.0.0.14.12345 > 10.0.0.2.12345: UDP, length 16
13:25:21.159823 IP 10.0.0.14.12345 > 10.0.0.2.12345: UDP, length 16
13:25:21.160451 IP 10.0.0.14.12345 > 10.0.0.2.12345: UDP, length 16
13:25:21.161084 IP 10.0.0.14.12345 > 10.0.0.2.12345: UDP, length 16
13:25:21.161717 IP 10.0.0.14.12345 > 10.0.0.2.12345: UDP, length 16
13:25:21.162347 IP 10.0.0.14.12345 > 10.0.0.2.12345: UDP, length 16
13:25:21.162953 IP 10.0.0.14.12345 > 10.0.0.2.12345: UDP, length 16
13:25:21.163584 IP 10.0.0.14.12345 > 10.0.0.2.12345: UDP, length 16
13:25:21.164185 IP 10.0.0.14.12345 > 10.0.0.2.12345: UDP, length 16
13:25:21.164817 IP 10.0.0.14.12345 > 10.0.0.2.12345: UDP, length 16
13:25:21.165446 IP 10.0.0.14.12345 > 10.0.0.2.12345: UDP, length 16
13:25:21.166075 IP 10.0.0.14.12345 > 10.0.0.2.12345: UDP, length 16
13:25:21.166702 IP 10.0.0.14.12345 > 10.0.0.2.12345: UDP, length 16
13:25:21.167330 IP 10.0.0.14.12345 > 10.0.0.2.12345: UDP, length 16
13:25:21.167929 IP 10.0.0.14.12345 > 10.0.0.2.12345: UDP, length 16
13:25:21.168556 IP 10.0.0.14.12345 > 10.0.0.2.12345: UDP, length 16
13:25:21.169187 IP 10.0.0.14.12345 > 10.0.0.2.12345: UDP, length 16
13:25:21.169817 IP 10.0.0.14.12345 > 10.0.0.2.12345: UDP, length 16
13:25:21.170452 IP 10.0.0.14.12345 > 10.0.0.2.12345: UDP, length 16
13:25:21.171074 IP 10.0.0.14.12345 > 10.0.0.2.12345: UDP, length 16
13:25:21.171726 IP 10.0.0.14.12345 > 10.0.0.2.12345: UDP, length 16
13:25:21.172354 IP 10.0.0.14.12345 > 10.0.0.2.12345: UDP, length 16
13:25:21.172983 IP 10.0.0.14.12345 > 10.0.0.2.12345: UDP, length 16
13:25:21.173597 IP 10.0.0.14.12345 > 10.0.0.2.12345: UDP, length 16
13:25:21.174230 IP 10.0.0.14.12345 > 10.0.0.2.12345: UDP, length 16
13:25:21.174861 IP 10.0.0.14.12345 > 10.0.0.2.12345: UDP, length 16
13:25:21.175464 IP 10.0.0.14.12345 > 10.0.0.2.12345: UDP, length 16
13:25:21.176057 IP 10.0.0.14.12345 > 10.0.0.2.12345: UDP, length 16
13:25:21.176644 IP 10.0.0.14.12345 > 10.0.0.2.12345: UDP, length 16
13:25:21.177233 IP 10.0.0.14.12345 > 10.0.0.2.12345: UDP, length 16
13:25:21.177825 IP 10.0.0.14.12345 > 10.0.0.2.12345: UDP, length 16
13:25:21.178465 IP 10.0.0.14.12345 > 10.0.0.2.12345: UDP, length 16
13:25:21.179069 IP 10.0.0.14.12345 > 10.0.0.2.12345: UDP, length 16
13:25:21.179680 IP 10.0.0.14.12345 > 10.0.0.2.12345: UDP, length 16
13:25:21.180285 IP 10.0.0.14.12345 > 10.0.0.2.12345: UDP, length 16
13:25:21.180907 IP 10.0.0.14.12345 > 10.0.0.2.12345: UDP, length 16
13:25:21.181531 IP 10.0.0.14.12345 > 10.0.0.2.12345: UDP, length 16
13:25:21.182151 IP 10.0.0.14.12345 > 10.0.0.2.12345: UDP, length 16
13:25:21.182771 IP 10.0.0.14.12345 > 10.0.0.2.12345: UDP, length 16
13:25:21.183390 IP 10.0.0.14.12345 > 10.0.0.2.12345: UDP, length 16
13:25:21.184010 IP 10.0.0.14.12345 > 10.0.0.2.12345: UDP, length 16
13:25:21.184629 IP 10.0.0.14.12345 > 10.0.0.2.12345: UDP, length 16
13:25:21.185248 IP 10.0.0.14.12345 > 10.0.0.2.12345: UDP, length 16
13:25:21.185867 IP 10.0.0.14.12345 > 10.0.0.2.12345: UDP, length 16
13:25:21.186500 IP 10.0.0.14.12345 > 10.0.0.2.12345: UDP, length 16
13:25:21.187103 IP 10.0.0.14.12345 > 10.0.0.2.12345: UDP, length 16
13:25:21.187692 IP 10.0.0.14.12345 > 10.0.0.2.12345: UDP, length 16
13:25:21.188312 IP 10.0.0.14.12345 > 10.0.0.2.12345: UDP, length 16
13:25:21.188940 IP 10.0.0.14.12345 > 10.0.0.2.12345: UDP, length 16
13:25:21.189537 IP 10.0.0.14.12345 > 10.0.0.2.12345: UDP, length 16
13:25:21.190141 IP 10.0.0.14.12345 > 10.0.0.2.12345: UDP, length 16
13:25:21.190740 IP 10.0.0.14.12345 > 10.0.0.2.12345: UDP, length 16
13:25:21.191339 IP 10.0.0.14.12345 > 10.0.0.2.12345: UDP, length 16
13:25:21.191933 IP 10.0.0.14.12345 > 10.0.0.2.12345: UDP, length 16
13:25:21.192532 IP 10.0.0.14.12345 > 10.0.0.2.12345: UDP, length 16
13:25:21.193125 IP 10.0.0.14.12345 > 10.0.0.2.12345: UDP, length 16
13:25:21.193763 IP 10.0.0.14.12345 > 10.0.0.2.12345: UDP, length 16
13:25:21.194366 IP 10.0.0.14.12345 > 10.0.0.2.12345: UDP, length 16
13:25:21.194968 IP 10.0.0.14.12345 > 10.0.0.2.12345: UDP, length 16
13:25:21.195582 IP 10.0.0.14.12345 > 10.0.0.2.12345: UDP, length 16
13:25:21.196185 IP 10.0.0.14.12345 > 10.0.0.2.12345: UDP, length 16
13:25:21.196777 IP 10.0.0.14.12345 > 10.0.0.2.12345: UDP, length 16
13:25:21.197373 IP 10.0.0.14.12345 > 10.0.0.2.12345: UDP, length 16
13:25:21.197989 IP 10.0.0.14.12345 > 10.0.0.2.12345: UDP, length 16
13:25:21.198590 IP 10.0.0.14.12345 > 10.0.0.2.12345: UDP, length 16
13:25:21.199181 IP 10.0.0.14.12345 > 10.0.0.2.12345: UDP, length 16
13:25:21.199790 IP 10.0.0.14.12345 > 10.0.0.2.12345: UDP, length 16
13:25:21.200421 IP 10.0.0.14.12345 > 10.0.0.2.12345: UDP, length 16
13:25:21.201049 IP 10.0.0.14.12345 > 10.0.0.2.12345: UDP, length 16
13:25:21.201679 IP 10.0.0.14.12345 > 10.0.0.2.12345: UDP, length 16
13:25:21.202292 IP 10.0.0.14.12345 > 10.0.0.2.12345: UDP, length 16
13:25:21.202892 IP 10.0.0.14.12345 > 10.0.0.2.12345: UDP, length 16
13:25:21.203491 IP 10.0.0.14.12345 > 10.0.0.2.12345: UDP, length 16
13:25:21.204118 IP 10.0.0.14.12345 > 10.0.0.2.12345: UDP, length 16
13:25:21.204732 IP 10.0.0.14.12345 > 10.0.0.2.12345: UDP, length 16
13:25:21.205332 IP 10.0.0.14.12345 > 10.0.0.2.12345: UDP, length 16
13:25:21.205933 IP 10.0.0.14.12345 > 10.0.0.2.12345: UDP, length 16
13:25:21.206536 IP 10.0.0.14.12345 > 10.0.0.2.12345: UDP, length 16
13:25:21.207162 IP 10.0.0.14.12345 > 10.0.0.2.12345: UDP, length 16
13:25:21.207781 IP 10.0.0.14.12345 > 10.0.0.2.12345: UDP, length 16
13:25:21.208384 IP 10.0.0.14.12345 > 10.0.0.2.12345: UDP, length 16
13:25:21.209014 IP 10.0.0.14.12345 > 10.0.0.2.12345: UDP, length 16
13:25:21.209647 IP 10.0.0.14.12345 > 10.0.0.2.12345: UDP, length 16
13:25:21.210258 IP 10.0.0.14.12345 > 10.0.0.2.12345: UDP, length 16
13:25:21.210859 IP 10.0.0.14.12345 > 10.0.0.2.12345: UDP, length 16
13:25:21.211486 IP 10.0.0.14.12345 > 10.0.0.2.12345: UDP, length 16
13:25:21.212087 IP 10.0.0.14.12345 > 10.0.0.2.12345: UDP, length 16
13:25:21.212673 IP 10.0.0.14.12345 > 10.0.0.2.12345: UDP, length 16
13:25:21.213258 IP 10.0.0.14.12345 > 10.0.0.2.12345: UDP, length 16
13:25:21.213843 IP 10.0.0.14.12345 > 10.0.0.2.12345: UDP, length 16
13:25:21.214428 IP 10.0.0.14.12345 > 10.0.0.2.12345: UDP, length 16
13:25:21.215013 IP 10.0.0.14.12345 > 10.0.0.2.12345: UDP, length 16
13:25:21.215598 IP 10.0.0.14.12345 > 10.0.0.2.12345: UDP, length 16
13:25:21.216218 IP 10.0.0.14.12345 > 10.0.0.2.12345: UDP, length 16
13:25:21.216837 IP 10.0.0.14.12345 > 10.0.0.2.12345: UDP, length 16
13:25:21.217456 IP 10.0.0.14.12345 > 10.0.0.2.12345: UDP, length 16
13:25:21.218074 IP 10.0.0.14.12345 > 10.0.0.2.12345: UDP, length 16
13:25:21.218695 IP 10.0.0.14.12345 > 10.0.0.2.12345: UDP, length 16
13:25:21.219315 IP 10.0.0.14.12345 > 10.0.0.2.12345: UDP, length 16
13:25:21.219946 IP 10.0.0.14.12345 > 10.0.0.2.12345: UDP, length 16
13:25:21.220545 IP 10.0.0.14.12345 > 10.0.0.2.12345: UDP, length 16
13:25:21.221170 IP 10.0.0.14.12345 > 10.0.0.2.12345: UDP, length 16
13:25:21.221765 IP 10.0.0.14.12345 > 10.0.0.2.12345: UDP, length 16
13:25:21.222381 IP 10.0.0.14.12345 > 10.0.0.2.12345: UDP, length 16
13:25:21.223000 IP 10.0.0.14.12345 > 10.0.0.2.12345: UDP, length 16
13:25:21.223606 IP 10.0.0.14.12345 > 10.0.0.2.12345: UDP, length 16
13:25:21.224222 IP 10.0.0.14.12345 > 10.0.0.2.12345: UDP, length 16
13:25:21.224845 IP 10.0.0.14.12345 > 10.0.0.2.12345: UDP, length 16
13:25:21.225456 IP 10.0.0.14.12345 > 10.0.0.2.12345: UDP, length 16
13:25:21.226062 IP 10.0.0.14.12345 > 10.0.0.2.12345: UDP, length 16
13:25:21.226674 IP 10.0.0.14.12345 > 10.0.0.2.12345: UDP, length 16
13:25:21.227273 IP 10.0.0.14.12345 > 10.0.0.2.12345: UDP, length 16
13:25:21.227866 IP 10.0.0.14.12345 > 10.0.0.2.12345: UDP, length 16
13:25:21.228456 IP 10.0.0.14.12345 > 10.0.0.2.12345: UDP, length 16
13:25:21.229044 IP 10.0.0.14.12345 > 10.0.0.2.12345: UDP, length 16
13:25:21.229630 IP 10.0.0.14.12345 > 10.0.0.2.12345: UDP, length 16
13:25:21.230295 IP 10.0.0.14.12345 > 10.0.0.2.12345: UDP, length 16
13:25:21.230948 IP 10.0.0.14.12345 > 10.0.0.2.12345: UDP, length 16
13:25:21.231604 IP 10.0.0.14.12345 > 10.0.0.2.12345: UDP, length 16
13:25:21.232223 IP 10.0.0.14.12345 > 10.0.0.2.12345: UDP, length 16
13:25:21.232875 IP 10.0.0.14.12345 > 10.0.0.2.12345: UDP, length 16
13:25:21.233529 IP 10.0.0.14.12345 > 10.0.0.2.12345: UDP, length 16
13:25:21.234184 IP 10.0.0.14.12345 > 10.0.0.2.12345: UDP, length 16
13:25:21.234839 IP 10.0.0.14.12345 > 10.0.0.2.12345: UDP, length 16
13:25:21.235477 IP 10.0.0.14.12345 > 10.0.0.2.12345: UDP, length 16
13:25:21.236132 IP 10.0.0.14.12345 > 10.0.0.2.12345: UDP, length 16
13:25:21.236760 IP 10.0.0.14.12345 > 10.0.0.2.12345: UDP, length 16
13:25:21.237390 IP 10.0.0.14.12345 > 10.0.0.2.12345: UDP, length 16
13:25:21.238017 IP 10.0.0.14.12345 > 10.0.0.2.12345: UDP, length 16
13:25:21.238647 IP 10.0.0.14.12345 > 10.0.0.2.12345: UDP, length 16
13:25:21.239277 IP 10.0.0.14.12345 > 10.0.0.2.12345: UDP, length 16
13:25:21.239883 IP 10.0.0.14.12345 > 10.0.0.2.12345: UDP, length 16
13:25:21.240490 IP 10.0.0.14.12345 > 10.0.0.2.12345: UDP, length 16
13:25:21.241091 IP 10.0.0.14.12345 > 10.0.0.2.12345: UDP, length 16
13:25:21.241697 IP 10.0.0.14.12345 > 10.0.0.2.12345: UDP, length 16
13:25:21.242305 IP 10.0.0.14.12345 > 10.0.0.2.12345: UDP, length 16
13:25:21.242933 IP 10.0.0.14.12345 > 10.0.0.2.12345: UDP, length 16
13:25:21.243565 IP 10.0.0.14.12345 > 10.0.0.2.12345: UDP, length 16
13:25:21.244196 IP 10.0.0.14.12345 > 10.0.0.2.12345: UDP, length 16
13:25:21.244824 IP 10.0.0.14.12345 > 10.0.0.2.12345: UDP, length 16
13:25:21.245452 IP 10.0.0.14.12345 > 10.0.0.2.12345: UDP, length 16
13:25:21.246078 IP 10.0.0.14.12345 > 10.0.0.2.12345: UDP, length 16
13:25:21.246708 IP 10.0.0.14.12345 > 10.0.0.2.12345: UDP, length 16
13:25:21.247337 IP 10.0.0.14.12345 > 10.0.0.2.12345: UDP, length 16
13:25:21.247938 IP 10.0.0.14.12345 > 10.0.0.2.12345: UDP, length 16
13:25:21.248571 IP 10.0.0.14.12345 > 10.0.0.2.12345: UDP, length 16
13:25:21.249209 IP 10.0.0.14.12345 > 10.0.0.2.12345: UDP, length 16
13:25:21.249846 IP 10.0.0.14.12345 > 10.0.0.2.12345: UDP, length 16
