13:09:52.571018 IP 10.0.0.7.12345 > 10.0.0.2.12345: UDP, length 16
13:09:52.571549 IP 10.0.0.7.12345 > 10.0.0.2.12345: UDP, length 16
13:09:52.572129 IP 10.0.0.7.12345 > 10.0.0.2.12345: UDP, length 16
13:09:52.572715 IP 10.0.0.7.12345 > 10.0.0.2.12345: UDP, length 16
13:09:52.573295 IP 10.0.0.7.12345 > 10.0.0.2.12345: UDP, length 16
13:09:52.573877 IP 10.0.0.7.12345 > 10.0.0.2.12345: UDP, length 16
13:09:52.574450 IP 10.0.0.7.12345 > 10.0.0.2.12345: UDP, length 16
13:09:52.575032 IP 10.0.0.7.12345 > 10.0.0.2.12345: UDP, length 16
13:09:52.575608 IP 10.0.0.7.12345 > 10.0.0.2.12345: UDP, length 16
13:09:52.576194 IP 10.0.0.7.12345 > 10.0.0.2.12345: UDP, length 16
13:09:52.576781 IP 10.0.0.7.12345 > 10.0.0.2.12345: UDP, length 16
13:09:52.577361 IP 10.0.0.7.12345 > 10.0.0.2.12345: UDP, length 16
13:09:52.577943 IP 10.0.0.7.12345 > 10.0.0.2.12345: UDP, length 16
13:09:52.578530 IP 10.0.0.7.12345 > 10.0.0.2.12345: UDP, length 16
13:09:52.579121 IP 10.0.0.7.12345 > 10.0.0.2.12345: UDP, length 16
13:09:52.579752 IP 10.0.0.7.12345 > 10.0.0.2.12345: UDP, length 16
13:09:52.580319 IP 10.0.0.7.12345 > 10.0.0.2.12345: UDP, length 16
13:09:52.580896 IP 10.0.0.7.12345 > 10.0.0.2.12345: UDP, length 16
13:09:52.581467 IP 10.0.0.7.12345 > 10.0.0.2.12345: UDP, length 16
13:09:52.582036 IP 10.0.0.7.12345 > 10.0.0.2.12345: UDP, length 16
13:09:52.582620 IP 10.0.0.7.12345 > 10.0.0.2.12345: UDP, length 16
13:09:52.583236 IP 10.0.0.7.12345 > 10.0.0.2.12345: UDP, length 16
13:09:52.583802 IP 10.0.0.7.12345 > 10.0.0.2.12345: UDP, length 16
13:09:52.584372 IP 10.0.0.7.12345 > 10.0.0.2.12345: UDP, length 16
13:09:52.584949 IP 10.0.0.7.12345 > 10.0.0.2.12345: UDP, length 16
13:09:52.585528 IP 10.0.0.7.12345 > 10.0.0.2.12345: UDP, length 16
13:09:52.586106 IP 10.0.0.7.12345 > 10.0.0.2.12345: UDP, length 16
13:09:52.586696 IP 10.0.0.7.12345 > 10.0.0.2.12345: UDP, length 16
13:09:52.587283 IP 10.0.0.7.12345 > 10.0.0.2.12345: UDP, length 16
13:09:52.587857 IP 10.0.0.7.12345 > 10.0.0.2.12345: UDP, length 16
13:09:52.588428 IP 10.0.0.7.12345 > 10.0.0.2.12345: UDP, length 16
13:09:52.588991 IP 10.0.0.7.12345 > 10.0.0.2.12345: UDP, length 16
13:09:52.589548 IP 10.0.0.7.12345 > 10.0.0.2.12345: UDP, length 16
13:09:52.590128 IP 10.0.0.7.12345 > 10.0.0.2.12345: UDP, length 16
13:09:52.590710 IP 10.0.0.7.12345 > 10.0.0.2.12345: UDP, length 16
13:09:52.591284 IP 10.0.0.7.12345 > 10.0.0.2.12345: UDP, length 16
13:09:52.591850 IP 10.0.0.7.12345 > 10.0.0.2.12345: UDP, length 16
13:09:52.592422 IP 10.0.0.7.12345 > 10.0.0.2.12345: UDP, length 16
13:09:52.592996 IP 10.0.0.7.12345 > 10.0.0.2.12345: UDP, length 16
13:09:52.593586 IP 10.0.0.7.12345 > 10.0.0.2.12345: UDP, length 16
13:09:52.594159 IP 10.0.0.7.12345 > 10.0.0.2.12345: UDP, length 16
13:09:52.594736 IP 10.0.0.7.12345 > 10.0.0.2.12345: UDP, length 16
13:09:52.595312 IP 10.0.0.7.12345 > 10.0.0.2.12345: UDP, length 16
13:09:52.595875 IP 10.0.0.7.12345 > 10.0.0.2.12345: UDP, length 16
13:09:52.596447 IP 10.0.0.7.12345 > 10.0.0.2.12345: UDP, length 16
13:09:52.597017 IP 10.0.0.7.12345 > 10.0.0.2.12345: UDP, length 16
13:09:52.597584 IP 10.0.0.7.12345 > 10.0.0.2.12345: UDP, length 16
13:09:52.598154 IP 10.0.0.7.12345 > 10.0.0.2.12345: UDP, length 16
13:09:52.598712 IP 10.0.0.7.12345 > 10.0.0.2.12345: UDP, length 16
13:09:52.599289 IP 10.0.0.7.12345 > 10.0.0.2.12345: UDP, length 16
13:09:52.599851 IP 10.0.0.7.12345 > 10.0.0.2.12345: UDP, length 16
13:09:52.600423 IP 10.0.0.7.12345 > 10.0.0.2.12345: UDP, length 16
13:09:52.601007 IP 10.0.0.7.12345 > 10.0.0.2.12345: UDP, length 16
13:09:52.601590 IP 10.0.0.7.12345 > 10.0.0.2.12345: UDP, length 16
13:09:52.602173 IP 10.0.0.7.12345 > 10.0.0.2.12345: UDP, length 16
13:09:52.602768 IP 10.0.0.7.12345 > 10.0.0.2.12345: UDP, length 16
13:09:52.603361 IP 10.0.0.7.12345 > 10.0.0.2.12345: UDP, length 16
13:09:52.603952 IP 10.0.0.7.12345 > 10.0.0.2.12345: UDP, length 16
13:09:52.604531 IP 10.0.0.7.12345 > 10.0.0.2.12345: UDP, length 16
13:09:52.605142 IP 10.0.0.7.12345 > 10.0.0.2.12345: UDP, length 16
13:09:52.605734 IP 10.0.0.7.12345 > 10.0.0.2.12345: UDP, length 16
13:09:52.606311 IP 10.0.0.7.12345 > 10.0.0.2.12345: UDP, length 16
13:09:52.606884 IP 10.0.0.7.12345 > 10.0.0.2.12345: UDP, length 16
13:09:52.607463 IP 10.0.0.7.12345 > 10.0.0.2.12345: UDP, length 16
13:09:52.608049 IP 10.0.0.7.12345 > 10.0.0.2.12345: UDP, length 16
13:09:52.608628 IP 10.0.0.7.12345 > 10.0.0.2.12345: UDP, length 16
13:09:52.609208 IP 10.0.0.7.12345 > 10.0.0.2.12345: UDP, length 16
13:09:52.609791 IP 10.0.0.7.12345 > 10.0.0.2.12345: UDP, length 16
13:09:52.610368 IP 10.0.0.7.12345 > 10.0.0.2.12345: UDP, length 16
13:09:52.610958 IP 10.0.0.7.12345 > 10.0.0.2.12345: UDP, length 16
13:09:52.611538 IP 10.0.0.7.12345 > 10.0.0.2.12345: UDP, length 16
13:09:52.612138 IP 10.0.0.7.12345 > 10.0.0.2.12345: UDP, length 16
13:09:52.612720 IP 10.0.0.7.12345 > 10.0.0.2.12345: UDP, length 16
13:09:52.613300 IP 10.0.0.7.12345 > 10.0.0.2.12345: UDP, length 16
13:09:52.613877 IP 10.0.0.7.12345 > 10.0.0.2.12345: UDP, length 16
13:09:52.614454 IP 10.0.0.7.12345 > 10.0.0.2.12345: UDP, length 16
13:09:52.615031 IP 10.0.0.7.12345 > 10.0.0.2.12345: UDP, length 16
13:09:52.615607 IP 10.0.0.7.12345 > 10.0.0.2.12345: UDP, length 16
13:09:52.616186 IP 10.0.0.7.12345 > 10.0.0.2.12345: UDP, length 16
13:09:52.616760 IP 10.0.0.7.12345 > 10.0.0.2.12345: UDP, length 16
13:09:52.617341 IP 10.0.0.7.12345 > 10.0.0.2.12345: UDP, length 16
13:09:52.617915 IP 10.0.0.7.12345 > 10.0.0.2.12345: UDP, length 16
13:09:52.618500 IP 10.0.0.7.12345 > 10.0.0.2.12345: UDP, length 16
13:09:52.619070 IP 10.0.0.7.12345 > 10.0.0.2.12345: UDP, length 16
13:09:52.619644 IP 10.0.0.7.12345 > 10.0.0.2.12345: UDP, length 16
13:09:52.620219 IP 10.0.0.7.12345 > 10.0.0.2.12345: UDP, length 16
13:09:52.620802 IP 10.0.0.7.12345 > 10.0.0.2.12345: UDP, length 16
13:09:52.621386 IP 10.0.0.7.12345 > 10.0.0.2.12345: UDP, length 16
13:09:52.621970 IP 10.0.0.7.12345 > 10.0.0.2.12345: UDP, length 16
13:09:52.622559 IP 10.0.0.7.12345 > 10.0.0.2.12345: UDP, length 16
13:09:52.623145 IP 10.0.0.7.12345 > 10.0.0.2.12345: UDP, length 16
13:09:52.623832 IP 10.0.0.7.12345 > 10.0.0.2.12345: UDP, length 16
13:09:52.624445 IP 10.0.0.7.12345 > 10.0.0.2.12345: UDP, length 16
13:09:52.625047 IP 10.0.0.7.12345 > 10.0.0.2.12345: UDP, length 16
13:09:52.625640 IP 10.0.0.7.12345 > 10.0.0.2.12345: UDP, length 16
13:09:52.626233 IP 10.0.0.7.12345 > 10.0.0.2.12345: UDP, length 16
13:09:52.626816 IP 10.0.0.7.12345 > 10.0.0.2.12345: UDP, length 16
13:09:52.627395 IP 10.0.0.7.12345 > 10.0.0.2.12345: UDP, length 16
13:09:52.627987 IP 10.0.0.7.12345 > 10.0.0.2.12345: UDP, length 16
13:09:52.628586 IP 10.0.0.7.12345 > 10.0.0.2.12345: UDP, length 16
13:09:52.629192 IP 10.0.0.7.12345 > 10.0.0.2.12345: UDP, length 16
13:09:52.629768 IP 10.0.0.7.12345 > 10.0.0.2.12345: UDP, length 16
13:09:52.630346 IP 10.0.0.7.12345 > 10.0.0.2.12345: UDP, length 16
13:09:52.630917 IP 10.0.0.7.12345 > 10.0.0.2.12345: UDP, length 16
13:09:52.631484 IP 10.0.0.7.12345 > 10.0.0.2.12345: UDP, length 16
13:09:52.632053 IP 10.0.0.7.12345 > 10.0.0.2.12345: UDP, length 16
13:09:52.632622 IP 10.0.0.7.12345 > 10.0.0.2.12345: UDP, length 16
13:09:52.633188 IP 10.0.0.7.12345 > 10.0.0.2.12345: UDP, length 16
13:09:52.633756 IP 10.0.0.7.12345 > 10.0.0.2.12345: UDP, length 16
13:09:52.634337 IP 10.0.0.7.12345 > 10.0.0.2.12345: UDP, length 16
13:09:52.634906 IP 10.0.0.7.12345 > 10.0.0.2.12345: UDP, length 16
13:09:52.635476 IP 10.0.0.7.12345 > 10.0.0.2.12345: UDP, length 16
13:09:52.636053 IP 10.0.0.7.12345 > 10.0.0.2.12345: UDP, length 16
13:09:52.636625 IP 10.0.0.7.12345 > 10.0.0.2.12345: UDP, length 16
13:09:52.637194 IP 10.0.0.7.12345 > 10.0.0.2.12345: UDP, length 16
13:09:52.637753 IP 10.0.0.7.12345 > 10.0.0.2.12345: UDP, length 16
13:09:52.638311 IP 10.0.0.7.12345 > 10.0.0.2.12345: UDP, length 16
13:09:52.638877 IP 10.0.0.7.12345 > 10.0.0.2.12345: UDP, length 16
13:09:52.639441 IP 10.0.0.7.12345 > 10.0.0.2.12345: UDP, length 16
13:09:52.640009 IP 10.0.0.7.12345 > 10.0.0.2.12345: UDP, length 16
13:09:52.640586 IP 10.0.0.7.12345 > 10.0.0.2.12345: UDP, length 16
13:09:52.641152 IP 10.0.0.7.12345 > 10.0.0.2.12345: UDP, length 16
13:09:52.641727 IP 10.0.0.7.12345 > 10.0.0.2.12345: UDP, length 16
13:09:52.642306 IP 10.0.0.7.12345 > 10.0.0.2.12345: UDP, length 16
13:09:52.642887 IP 10.0.0.7.12345 > 10.0.0.2.12345: UDP, length 16
13:09:52.643479 IP 10.0.0.7.12345 > 10.0.0.2.12345: UDP, length 16
13:09:52.644064 IP 10.0.0.7.12345 > 10.0.0.2.12345: UDP, length 16
13:09:52.644644 IP 10.0.0.7.12345 > 10.0.0.2.12345: UDP, length 16
13:09:52.645227 IP 10.0.0.7.12345 > 10.0.0.2.12345: UDP, length 16
13:09:52.645810 IP 10.0.0.7.12345 > 10.0.0.2.12345: UDP, length 16
13:09:52.646387 IP 10.0.0.7.12345 > 10.0.0.2.12345: UDP, length 16
13:09:52.646972 IP 10.0.0.7.12345 > 10.0.0.2.12345: UDP, length 16
13:09:52.647557 IP 10.0.0.7.12345 > 10.0.0.2.12345: UDP, length 16
13:09:52.648131 IP 10.0.0.7.12345 > 10.0.0.2.12345: UDP, length 16
13:09:52.648707 IP 10.0.0.7.12345 > 10.0.0.2.12345: UDP, length 16
13:09:52.649289 IP 10.0.0.7.12345 > 10.0.0.2.12345: UDP, length 16
13:09:52.649868 IP 10.0.0.7.12345 > 10.0.0.2.12345: UDP, length 16
13:09:52.650460 IP 10.0.0.7.12345 > 10.0.0.2.12345: UDP, length 16
13:09:52.651034 IP 10.0.0.7.12345 > 10.0.0.2.12345: UDP, length 16
13:09:52.651618 IP 10.0.0.7.12345 > 10.0.0.2.12345: UDP, length 16
13:09:52.652194 IP 10.0.0.7.12345 > 10.0.0.2.12345: UDP, length 16
13:09:52.652779 IP 10.0.0.7.12345 > 10.0.0.2.12345: UDP, length 16
13:09:52.653360 IP 10.0.0.7.12345 > 10.0.0.2.12345: UDP, length 16
13:09:52.653933 IP 10.0.0.7.12345 > 10.0.0.2.12345: UDP, length 16
13:09:52.654503 IP 10.0.0.7.12345 > 10.0.0.2.12345: UDP, length 16
13:09:52.655088 IP 10.0.0.7.12345 > 10.0.0.2.12345: UDP, length 16
13:09:52.655660 IP 10.0.0.7.12345 > 10.0.0.2.12345: UDP, length 16
13:09:52.656235 IP 10.0.0.7.12345 > 10.0.0.2.12345: UDP, length 16
13:09:52.656822 IP 10.0.0.7.12345 > 10.0.0.2.12345: UDP, length 16
13:09:52.657404 IP 10.0.0.7.12345 > 10.0.0.2.12345: UDP, length 16
13:09:52.657982 IP 10.0.0.7.12345 > 10.0.0.2.12345: UDP, length 16
13:09:52.658560 IP 10.0.0.7.12345 > 10.0.0.2.12345: UDP, length 16
13:09:52.659130 IP 10.0.0.7.12345 > 10.0.0.2.12345: UDP, length 16
13:09:52.659733 IP 10.0.0.7.12345 > 10.0.0.2.12345: UDP, length 16
13:09:52.660305 IP 10.0.0.7.12345 > 10.0.0.2.12345: UDP, length 16
13:09:52.660903 IP 10.0.0.7.12345 > 10.0.0.2.12345: UDP, length 16
13:09:52.661484 IP 10.0.0.7.12345 > 10.0.0.2.12345: UDP, length 16
13:09:52.662062 IP 10.0.0.7.12345 > 10.0.0.2.12345: UDP, length 16
13:09:52.662636 IP 10.0.0.7.12345 > 10.0.0.2.12345: UDP, length 16
13:09:52.663214 IP 10.0.0.7.12345 > 10.0.0.2.12345: UDP, length 16
13:09:52.663781 IP 10.0.0.7.12345 > 10.0.0.2.12345: UDP, length 16
13:09:52.664370 IP 10.0.0.7.12345 > 10.0.0.2.12345: UDP, length 16
13:09:52.664959 IP 10.0.0.7.12345 > 10.0.0.2.12345: UDP, length 16
13:09:52.665548 IP 10.0.0.7.12345 > 10.0.0.2.12345: UDP, length 16
13:09:52.666137 IP 10.0.0.7.12345 > 10.0.0.2.12345: UDP, length 16
13:09:52.666717 IP 10.0.0.7.12345 > 10.0.0.2.12345: UDP, length 16
13:09:52.667309 IP 10.0.0.7.12345 > 10.0.0.2.12345: UDP, length 16
13:09:52.667886 IP 10.0.0.7.12345 > 10.0.0.2.12345: UDP, length 16
13:09:52.668477 IP 10.0.0.7.12345 > 10.0.0.2.12345: UDP, length 16
13:09:52.669066 IP 10.0.0.7.12345 > 10.0.0.2.12345: UDP, length 16
13:09:52.669655 IP 10.0.0.7.12345 > 10.0.0.2.12345: UDP, length 16
13:09:52.670244 IP 10.0.0.7.12345 > 10.0.0.2.12345: UDP, length 16
13:09:52.670832 IP 10.0.0.7.12345 > 10.0.0.2.12345: UDP, length 16
13:09:52.671440 IP 10.0.0.7.12345 > 10.0.0.2.12345: UDP, length 16
13:09:52.672036 IP 10.0.0.7.12345 > 10.0.0.2.12345: UDP, length 16
13:09:52.672660 IP 10.0.0.7.12345 > 10.0.0.2.12345: UDP, length 16
13:09:52.673261 IP 10.0.0.7.12345 > 10.0.0.2.12345: UDP, length 16
13:09:52.673857 IP 10.0.0.7.12345 > 10.0.0.2.12345: UDP, length 16
13:09:52.674460 IP 10.0.0.7.12345 > 10.0.0.2.12345: UDP, length 16
13:09:52.675041 IP 10.0.0.7.12345 > 10.0.0.2.12345: UDP, length 16
13:09:52.675631 IP 10.0.0.7.12345 > 10.0.0.2.12345: UDP, length 16
13:09:52.676213 IP 10.0.0.7.12345 > 10.0.0.2.12345: UDP, length 16
13:09:52.676793 IP 10.0.0.7.12345 > 10.0.0.2.12345: UDP, length 16
13:09:52.677376 IP 10.0.0.7.12345 > 10.0.0.2.12345: UDP, length 16
13:09:52.677962 IP 10.0.0.7.12345 > 10.0.0.2.12345: UDP, length 16
13:09:52.678544 IP 10.0.0.7.12345 > 10.0.0.2.12345: UDP, length 16
13:09:52.679131 IP 10.0.0.7.12345 > 10.0.0.2.12345: UDP, length 16
13:09:52.679728 IP 10.0.0.7.12345 > 10.0.0.2.12345: UDP, length 16
13:09:52.680339 IP 10.0.0.7.12345 > 10.0.0.2.12345: UDP, length 16
13:09:52.680951 IP 10.0.0.7.12345 > 10.0.0.2.12345: UDP, length 16
13:09:52.681563 IP 10.0.0.7.12345 > 10.0.0.2.12345: UDP, length 16
13:09:52.682176 IP 10.0.0.7.12345 > 10.0.0.2.12345: UDP, length 16
13:09:52.682777 IP 10.0.0.7.12345 > 10.0.0.2.12345: UDP, length 16
13:09:52.683381 IP 10.0.0.7.12345 > 10.0.0.2.12345: UDP, length 16
13:09:52.684005 IP 10.0.0.7.12345 > 10.0.0.2.12345: UDP, length 16
13:09:52.684616 IP 10.0.0.7.12345 > 10.0.0.2.12345: UDP, length 16
13:09:52.685226 IP 10.0.0.7.12345 > 10.0.0.2.12345: UDP, length 16
13:09:52.685838 IP 10.0.0.7.12345 > 10.0.0.2.12345: UDP, length 16
13:09:52.686437 IP 10.0.0.7.12345 > 10.0.0.2.12345: UDP, length 16
13:09:52.687047 IP 10.0.0.7.12345 > 10.0.0.2.12345: UDP, length 16
13:09:52.687658 IP 10.0.0.7.12345 > 10.0.0.2.12345: UDP, length 16
13:09:52.688272 IP 10.0.0.7.12345 > 10.0.0.2.12345: UDP, length 16
13:09:52.688888 IP 10.0.0.7.12345 > 10.0.0.2.12345: UDP, length 16
13:09:52.689503 IP 10.0.0.7.12345 > 10.0.0.2.12345: UDP, length 16
13:09:52.690112 IP 10.0.0.7.12345 > 10.0.0.2.12345: UDP, length 16
13:09:52.690698 IP 10.0.0.7.12345 > 10.0.0.2.12345: UDP, length 16
13:09:52.691326 IP 10.0.0.7.12345 > 10.0.0.2.12345: UDP, length 16
13:09:52.691918 IP 10.0.0.7.12345 > 10.0.0.2.12345: UDP, length 16
13:09:52.692500 IP 10.0.0.7.12345 > 10.0.0.2.12345: UDP, length 16
13:09:52.693074 IP 10.0.0.7.12345 > 10.0.0.2.12345: UDP, length 16
13:09:52.693653 IP 10.0.0.7.12345 > 10.0.0.2.12345: UDP, length 16
13:09:52.694231 IP 10.0.0.7.12345 > 10.0.0.2.12345: UDP, length 16
13:09:52.694814 IP 10.0.0.7.12345 > 10.0.0.2.12345: UDP, length 16
13:09:52.695396 IP 10.0.0.7.12345 > 10.0.0.2.12345: UDP, length 16
13:09:52.695985 IP 10.0.0.7.12345 > 10.0.0.2.12345: UDP, length 16
13:09:52.696587 IP 10.0.0.7.12345 > 10.0.0.2.12345: UDP, length 16
13:09:52.697187 IP 10.0.0.7.12345 > 10.0.0.2.12345: UDP, length 16
13:09:52.697762 IP 10.0.0.7.12345 > 10.0.0.2.12345: UDP, length 16
13:09:52.698365 IP 10.0.0.7.12345 > 10.0.0.2.12345: UDP, length 16
13:09:52.698952 IP 10.0.0.7.12345 > 10.0.0.2.12345: UDP, length 16
13:09:52.699540 IP 10.0.0.7.12345 > 10.0.0.2.12345: UDP, length 16
13:09:52.700162 IP 10.0.0.7.12345 > 10.0.0.2.12345: UDP, length 16
13:09:52.700769 IP 10.0.0.7.12345 > 10.0.0.2.12345: UDP, length 16
13:09:52.701359 IP 10.0.0.7.12345 > 10.0.0.2.12345: UDP, length 16
13:09:52.701944 IP 10.0.0.7.12345 > 10.0.0.2.12345: UDP, length 16
13:09:52.702560 IP 10.0.0.7.12345 > 10.0.0.2.12345: UDP, length 16
13:09:52.703178 IP 10.0.0.7.12345 > 10.0.0.2.12345: UDP, length 16
13:09:52.703758 IP 10.0.0.7.12345 > 10.0.0.2.12345: UDP, length 16
13:09:52.704374 IP 10.0.0.7.12345 > 10.0.0.2.12345: UDP, length 16
13:09:52.704990 IP 10.0.0.7.12345 > 10.0.0.2.12345: UDP, length 16
13:09:52.705608 IP 10.0.0.7.12345 > 10.0.0.2.12345: UDP, length 16
13:09:52.706225 IP 10.0.0.7.12345 > 10.0.0.2.12345: UDP, length 16
13:09:52.706850 IP 10.0.0.7.12345 > 10.0.0.2.12345: UDP, length 16
13:09:52.707449 IP 10.0.0.7.12345 > 10.0.0.2.12345: UDP, length 16
13:09:52.708036 IP 10.0.0.7.12345 > 10.0.0.2.12345: UDP, length 16
13:09:52.708624 IP 10.0.0.7.12345 > 10.0.0.2.12345: UDP, length 16
13:09:52.709236 IP 10.0.0.7.12345 > 10.0.0.2.12345: UDP, length 16
13:09:52.709855 IP 10.0.0.7.12345 > 10.0.0.2.12345: UDP, length 16
13:09:52.710477 IP 10.0.0.7.12345 > 10.0.0.2.12345: UDP, length 16
13:09:52.711088 IP 10.0.0.7.12345 > 10.0.0.2.12345: UDP, length 16
13:09:52.711752 IP 10.0.0.7.12345 > 10.0.0.2.12345: UDP, length 16
13:09:52.712354 IP 10.0.0.7.12345 > 10.0.0.2.12345: UDP, length 16
13:09:52.712962 IP 10.0.0.7.12345 > 10.0.0.2.12345: UDP, length 16
13:09:52.713573 IP 10.0.0.7.12345 > 10.0.0.2.12345: UDP, length 16
13:09:52.714183 IP 10.0.0.7.12345 > 10.0.0.2.12345: UDP, length 16
13:09:52.714775 IP 10.0.0.7.12345 > 10.0.0.2.12345: UDP, length 16
13:09:52.715381 IP 10.0.0.7.12345 > 10.0.0.2.12345: UDP, length 16
13:09:52.715989 IP 10.0.0.7.12345 > 10.0.0.2.12345: UDP, length 16
13:09:52.716585 IP 10.0.0.7.12345 > 10.0.0.2.12345: UDP, length 16
13:09:52.717174 IP 10.0.0.7.12345 > 10.0.0.2.12345: UDP, length 16
13:09:52.717759 IP 10.0.0.7.12345 > 10.0.0.2.12345: UDP, length 16
13:09:52.718345 IP 10.0.0.7.12345 > 10.0.0.2.12345: UDP, length 16
13:09:52.718962 IP 10.0.0.7.12345 > 10.0.0.2.12345: UDP, length 16
13:09:52.719561 IP 10.0.0.7.12345 > 10.0.0.2.12345: UDP, length 16
13:09:52.720158 IP 10.0.0.7.12345 > 10.0.0.2.12345: UDP, length 16
13:09:52.720783 IP 10.0.0.7.12345 > 10.0.0.2.12345: UDP, length 16
13:09:52.721411 IP 10.0.0.7.12345 > 10.0.0.2.12345: UDP, length 16
13:09:52.722039 IP 10.0.0.7.12345 > 10.0.0.2.12345: UDP, length 16
13:09:52.722665 IP 10.0.0.7.12345 > 10.0.0.2.12345: UDP, length 16
13:09:52.723283 IP 10.0.0.7.12345 > 10.0.0.2.12345: UDP, length 16
13:09:52.723882 IP 10.0.0.7.12345 > 10.0.0.2.12345: UDP, length 16
13:09:52.724476 IP 10.0.0.7.12345 > 10.0.0.2.12345: UDP, length 16
13:09:52.725066 IP 10.0.0.7.12345 > 10.0.0.2.12345: UDP, length 16
13:09:52.725656 IP 10.0.0.7.12345 > 10.0.0.2.12345: UDP, length 16
13:09:52.726246 IP 10.0.0.7.12345 > 10.0.0.2.12345: UDP, length 16
13:09:52.726839 IP 10.0.0.7.12345 > 10.0.0.2.12345: UDP, length 16
13:09:52.727421 IP 10.0.0.7.12345 > 10.0.0.2.12345: UDP, length 16
13:09:52.728011 IP 10.0.0.7.12345 > 10.0.0.2.12345: UDP, length 16
13:09:52.728599 IP 10.0.0.7.12345 > 10.0.0.2.12345: UDP, length 16
13:09:52.729190 IP 10.0.0.7.12345 > 10.0.0.2.12345: UDP, length 16
13:09:52.729783 IP 10.0.0.7.12345 > 10.0.0.2.12345: UDP, length 16
13:09:52.730378 IP 10.0.0.7.12345 > 10.0.0.2.12345: UDP, length 16
13:09:52.730977 IP 10.0.0.7.12345 > 10.0.0.2.12345: UDP, length 16
13:09:52.731578 IP 10.0.0.7.12345 > 10.0.0.2.12345: UDP, length 16
13:09:52.732180 IP 10.0.0.7.12345 > 10.0.0.2.12345: UDP, length 16
13:09:52.732778 IP 10.0.0.7.12345 > 10.0.0.2.12345: UDP, length 16
13:09:52.733373 IP 10.0.0.7.12345 > 10.0.0.2.12345: UDP, length 16
13:09:52.733969 IP 10.0.0.7.12345 > 10.0.0.2.12345: UDP, length 16
13:09:52.734564 IP 10.0.0.7.12345 > 10.0.0.2.12345: UDP, length 16
13:09:52.735160 IP 10.0.0.7.12345 > 10.0.0.2.12345: UDP, length 16
13:09:52.735775 IP 10.0.0.7.12345 > 10.0.0.2.12345: UDP, length 16
13:09:52.736399 IP 10.0.0.7.12345 > 10.0.0.2.12345: UDP, length 16
13:09:52.737023 IP 10.0.0.7.12345 > 10.0.0.2.12345: UDP, length 16
13:09:52.737648 IP 10.0.0.7.12345 > 10.0.0.2.12345: UDP, length 16
13:09:52.738272 IP 10.0.0.7.12345 > 10.0.0.2.12345: UDP, length 16
13:09:52.738904 IP 10.0.0.7.12345 > 10.0.0.2.12345: UDP, length 16
13:09:52.739502 IP 10.0.0.7.12345 > 10.0.0.2.12345: UDP, length 16
13:09:52.740095 IP 10.0.0.7.12345 > 10.0.0.2.12345: UDP, length 16
13:09:52.740689 IP 10.0.0.7.12345 > 10.0.0.2.12345: UDP, length 16
13:09:52.741279 IP 10.0.0.7.12345 > 10.0.0.2.12345: UDP, length 16
13:09:52.741867 IP 10.0.0.7.12345 > 10.0.0.2.12345: UDP, length 16
13:09:52.742455 IP 10.0.0.7.12345 > 10.0.0.2.12345: UDP, length 16
13:09:52.743058 IP 10.0.0.7.12345 > 10.0.0.2.12345: UDP, length 16
13:09:52.743665 IP 10.0.0.7.12345 > 10.0.0.2.12345: UDP, length 16
13:09:52.744310 IP 10.0.0.7.12345 > 10.0.0.2.12345: UDP, length 16
13:09:52.744910 IP 10.0.0.7.12345 > 10.0.0.2.12345: UDP, length 16
13:09:52.745503 IP 10.0.0.7.12345 > 10.0.0.2.12345: UDP, length 16
13:09:52.746098 IP 10.0.0.7.12345 > 10.0.0.2.12345: UDP, length 16
13:09:52.746750 IP 10.0.0.7.12345 > 10.0.0.2.12345: UDP, length 16
13:09:52.747360 IP 10.0.0.7.12345 > 10.0.0.2.12345: UDP, length 16
13:09:52.747998 IP 10.0.0.7.12345 > 10.0.0.2.12345: UDP, length 16
13:09:52.748632 IP 10.0.0.7.12345 > 10.0.0.2.12345: UDP, length 16
13:09:52.749246 IP 10.0.0.7.12345 > 10.0.0.2.12345: UDP, length 16
13:09:52.749845 IP 10.0.0.7.12345 > 10.0.0.2.12345: UDP, length 16
13:09:52.750483 IP 10.0.0.7.12345 > 10.0.0.2.12345: UDP, length 16
13:09:52.751119 IP 10.0.0.7.12345 > 10.0.0.2.12345: UDP, length 16
13:09:52.751758 IP 10.0.0.7.12345 > 10.0.0.2.12345: UDP, length 16
13:09:52.752391 IP 10.0.0.7.12345 > 10.0.0.2.12345: UDP, length 16
13:09:52.753024 IP 10.0.0.7.12345 > 10.0.0.2.12345: UDP, length 16
13:09:52.753659 IP 10.0.0.7.12345 > 10.0.0.2.12345: UDP, length 16
13:09:52.754292 IP 10.0.0.7.12345 > 10.0.0.2.12345: UDP, length 16
13:09:52.754921 IP 10.0.0.7.12345 > 10.0.0.2.12345: UDP, length 16
13:09:52.755537 IP 10.0.0.7.12345 > 10.0.0.2.12345: UDP, length 16
13:09:52.756183 IP 10.0.0.7.12345 > 10.0.0.2.12345: UDP, length 16
13:09:52.756802 IP 10.0.0.7.12345 > 10.0.0.2.12345: UDP, length 16
13:09:52.757401 IP 10.0.0.7.12345 > 10.0.0.2.12345: UDP, length 16
13:09:52.758007 IP 10.0.0.7.12345 > 10.0.0.2.12345: UDP, length 16
13:09:52.758640 IP 10.0.0.7.12345 > 10.0.0.2.12345: UDP, length 16
13:09:52.759275 IP 10.0.0.7.12345 > 10.0.0.2.12345: UDP, length 16
13:09:52.759873 IP 10.0.0.7.12345 > 10.0.0.2.12345: UDP, length 16
13:09:52.760494 IP 10.0.0.7.12345 > 10.0.0.2.12345: UDP, length 16
13:09:52.761103 IP 10.0.0.7.12345 > 10.0.0.2.12345: UDP, length 16
13:09:52.761745 IP 10.0.0.7.12345 > 10.0.0.2.12345: UDP, length 16
13:09:52.762387 IP 10.0.0.7.12345 > 10.0.0.2.12345: UDP, length 16
13:09:52.763002 IP 10.0.0.7.12345 > 10.0.0.2.12345: UDP, length 16
13:09:52.763622 IP 10.0.0.7.12345 > 10.0.0.2.12345: UDP, length 16
13:09:52.764250 IP 10.0.0.7.12345 > 10.0.0.2.12345: UDP, length 16
13:09:52.764859 IP 10.0.0.7.12345 > 10.0.0.2.12345: UDP, length 16
13:09:52.765460 IP 10.0.0.7.12345 > 10.0.0.2.12345: UDP, length 16
13:09:52.766050 IP 10.0.0.7.12345 > 10.0.0.2.12345: UDP, length 16
13:09:52.766653 IP 10.0.0.7.12345 > 10.0.0.2.12345: UDP, length 16
13:09:52.767258 IP 10.0.0.7.12345 > 10.0.0.2.12345: UDP, length 16
13:09:52.767876 IP 10.0.0.7.12345 > 10.0.0.2.12345: UDP, length 16
13:09:52.768519 IP 10.0.0.7.12345 > 10.0.0.2.12345: UDP, length 16
13:09:52.769160 IP 10.0.0.7.12345 > 10.0.0.2.12345: UDP, length 16
13:09:52.769801 IP 10.0.0.7.12345 > 10.0.0.2.12345: UDP, length 16
13:09:52.770444 IP 10.0.0.7.12345 > 10.0.0.2.12345: UDP, length 16
13:09:52.771047 IP 10.0.0.7.12345 > 10.0.0.2.12345: UDP, length 16
13:09:52.771642 IP 10.0.0.7.12345 > 10.0.0.2.12345: UDP, length 16
13:09:52.772236 IP 10.0.0.7.12345 > 10.0.0.2.12345: UDP, length 16
13:09:52.772844 IP 10.0.0.7.12345 > 10.0.0.2.12345: UDP, length 16
13:09:52.773430 IP 10.0.0.7.12345 > 10.0.0.2.12345: UDP, length 16
13:09:52.774042 IP 10.0.0.7.12345 > 10.0.0.2.12345: UDP, length 16
13:09:52.774653 IP 10.0.0.7.12345 > 10.0.0.2.12345: UDP, length 16
13:09:52.775264 IP 10.0.0.7.12345 > 10.0.0.2.12345: UDP, length 16
13:09:52.775859 IP 10.0.0.7.12345 > 10.0.0.2.12345: UDP, length 16
13:09:52.776445 IP 10.0.0.7.12345 > 10.0.0.2.12345: UDP, length 16
13:09:52.777037 IP 10.0.0.7.12345 > 10.0.0.2.12345: UDP, length 16
13:09:52.777626 IP 10.0.0.7.12345 > 10.0.0.2.12345: UDP, length 16
13:09:52.778209 IP 10.0.0.7.12345 > 10.0.0.2.12345: UDP, length 16
13:09:52.778825 IP 10.0.0.7.12345 > 10.0.0.2.12345: UDP, length 16
13:09:52.779420 IP 10.0.0.7.12345 > 10.0.0.2.12345: UDP, length 16
13:09:52.780020 IP 10.0.0.7.12345 > 10.0.0.2.12345: UDP, length 16
13:09:52.780629 IP 10.0.0.7.12345 > 10.0.0.2.12345: UDP, length 16
13:09:52.781239 IP 10.0.0.7.12345 > 10.0.0.2.12345: UDP, length 16
13:09:52.781851 IP 10.0.0.7.12345 > 10.0.0.2.12345: UDP, length 16
13:09:52.782460 IP 10.0.0.7.12345 > 10.0.0.2.12345: UDP, length 16
13:09:52.783070 IP 10.0.0.7.12345 > 10.0.0.2.12345: UDP, length 16
13:09:52.783724 IP 10.0.0.7.12345 > 10.0.0.2.12345: UDP, length 16
13:09:52.784337 IP 10.0.0.7.12345 > 10.0.0.2.12345: UDP, length 16
13:09:52.784947 IP 10.0.0.7.12345 > 10.0.0.2.12345: UDP, length 16
13:09:52.785555 IP 10.0.0.7.12345 > 10.0.0.2.12345: UDP, length 16
13:09:52.786164 IP 10.0.0.7.12345 > 10.0.0.2.12345: UDP, length 16
13:09:52.786787 IP 10.0.0.7.12345 > 10.0.0.2.12345: UDP, length 16
13:09:52.787395 IP 10.0.0.7.12345 > 10.0.0.2.12345: UDP, length 16
13:09:52.787997 IP 10.0.0.7.12345 > 10.0.0.2.12345: UDP, length 16
13:09:52.788622 IP 10.0.0.7.12345 > 10.0.0.2.12345: UDP, length 16
13:09:52.789245 IP 10.0.0.7.12345 > 10.0.0.2.12345: UDP, length 16
13:09:52.789879 IP 10.0.0.7.12345 > 10.0.0.2.12345: UDP, length 16
13:09:52.790483 IP 10.0.0.7.12345 > 10.0.0.2.12345: UDP, length 16
13:09:52.791104 IP 10.0.0.7.12345 > 10.0.0.2.12345: UDP, length 16
13:09:52.791710 IP 10.0.0.7.12345 > 10.0.0.2.12345: UDP, length 16
13:09:52.792310 IP 10.0.0.7.12345 > 10.0.0.2.12345: UDP, length 16
13:09:52.792932 IP 10.0.0.7.12345 > 10.0.0.2.12345: UDP, length 16
13:09:52.793557 IP 10.0.0.7.12345 > 10.0.0.2.12345: UDP, length 16
13:09:52.794180 IP 10.0.0.7.12345 > 10.0.0.2.12345: UDP, length 16
13:09:52.794780 IP 10.0.0.7.12345 > 10.0.0.2.12345: UDP, length 16
13:09:52.795386 IP 10.0.0.7.12345 > 10.0.0.2.12345: UDP, length 16
13:09:52.796015 IP 10.0.0.7.12345 > 10.0.0.2.12345: UDP, length 16
13:09:52.796620 IP 10.0.0.7.12345 > 10.0.0.2.12345: UDP, length 16
13:09:52.797218 IP 10.0.0.7.12345 > 10.0.0.2.12345: UDP, length 16
13:09:52.797813 IP 10.0.0.7.12345 > 10.0.0.2.12345: UDP, length 16
13:09:52.798405 IP 10.0.0.7.12345 > 10.0.0.2.12345: UDP, length 16
13:09:52.798992 IP 10.0.0.7.12345 > 10.0.0.2.12345: UDP, length 16
13:09:52.799579 IP 10.0.0.7.12345 > 10.0.0.2.12345: UDP, length 16
13:09:52.800165 IP 10.0.0.7.12345 > 10.0.0.2.12345: UDP, length 16
13:09:52.800751 IP 10.0.0.7.12345 > 10.0.0.2.12345: UDP, length 16
13:09:52.801335 IP 10.0.0.7.12345 > 10.0.0.2.12345: UDP, length 16
13:09:52.801963 IP 10.0.0.7.12345 > 10.0.0.2.12345: UDP, length 16
13:09:52.802594 IP 10.0.0.7.12345 > 10.0.0.2.12345: UDP, length 16
13:09:52.803202 IP 10.0.0.7.12345 > 10.0.0.2.12345: UDP, length 16
13:09:52.803786 IP 10.0.0.7.12345 > 10.0.0.2.12345: UDP, length 16
13:09:52.804399 IP 10.0.0.7.12345 > 10.0.0.2.12345: UDP, length 16
13:09:52.805003 IP 10.0.0.7.12345 > 10.0.0.2.12345: UDP, length 16
13:09:52.805604 IP 10.0.0.7.12345 > 10.0.0.2.12345: UDP, length 16
13:09:52.806179 IP 10.0.0.7.12345 > 10.0.0.2.12345: UDP, length 16
13:09:52.806764 IP 10.0.0.7.12345 > 10.0.0.2.12345: UDP, length 16
13:09:52.807344 IP 10.0.0.7.12345 > 10.0.0.2.12345: UDP, length 16
13:09:52.807932 IP 10.0.0.7.12345 > 10.0.0.2.12345: UDP, length 16
13:09:52.808543 IP 10.0.0.7.12345 > 10.0.0.2.12345: UDP, length 16
13:09:52.809135 IP 10.0.0.7.12345 > 10.0.0.2.12345: UDP, length 16
13:09:52.809751 IP 10.0.0.7.12345 > 10.0.0.2.12345: UDP, length 16
13:09:52.810358 IP 10.0.0.7.12345 > 10.0.0.2.12345: UDP, length 16
13:09:52.810963 IP 10.0.0.7.12345 > 10.0.0.2.12345: UDP, length 16
13:09:52.811597 IP 10.0.0.7.12345 > 10.0.0.2.12345: UDP, length 16
13:09:52.812219 IP 10.0.0.7.12345 > 10.0.0.2.12345: UDP, length 16
13:09:52.812840 IP 10.0.0.7.12345 > 10.0.0.2.12345: UDP, length 16
13:09:52.813471 IP 10.0.0.7.12345 > 10.0.0.2.12345: UDP, length 16
13:09:52.814116 IP 10.0.0.7.12345 > 10.0.0.2.12345: UDP, length 16
13:09:52.814727 IP 10.0.0.7.12345 > 10.0.0.2.12345: UDP, length 16
13:09:52.815324 IP 10.0.0.7.12345 > 10.0.0.2.12345: UDP, length 16
13:09:52.815916 IP 10.0.0.7.12345 > 10.0.0.2.12345: UDP, length 16
13:09:52.816509 IP 10.0.0.7.12345 > 10.0.0.2.12345: UDP, length 16
13:09:52.817139 IP 10.0.0.7.12345 > 10.0.0.2.12345: UDP, length 16
13:09:52.817774 IP 10.0.0.7.12345 > 10.0.0.2.12345: UDP, length 16
13:09:52.818427 IP 10.0.0.7.12345 > 10.0.0.2.12345: UDP, length 16
13:09:52.819064 IP 10.0.0.7.12345 > 10.0.0.2.12345: UDP, length 16
13:09:52.819749 IP 10.0.0.7.12345 > 10.0.0.2.12345: UDP, length 16
13:09:52.820361 IP 10.0.0.7.12345 > 10.0.0.2.12345: UDP, length 16
13:09:52.820952 IP 10.0.0.7.12345 > 10.0.0.2.12345: UDP, length 16
13:09:52.821565 IP 10.0.0.7.12345 > 10.0.0.2.12345: UDP, length 16
13:09:52.822215 IP 10.0.0.7.12345 > 10.0.0.2.12345: UDP, length 16
13:09:52.822858 IP 10.0.0.7.12345 > 10.0.0.2.12345: UDP, length 16
13:09:52.823493 IP 10.0.0.7.12345 > 10.0.0.2.12345: UDP, length 16
13:09:52.824087 IP 10.0.0.7.12345 > 10.0.0.2.12345: UDP, length 16
13:09:52.824725 IP 10.0.0.7.12345 > 10.0.0.2.12345: UDP, length 16
13:09:52.825363 IP 10.0.0.7.12345 > 10.0.0.2.12345: UDP, length 16
13:09:52.826002 IP 10.0.0.7.12345 > 10.0.0.2.12345: UDP, length 16
13:09:52.826644 IP 10.0.0.7.12345 > 10.0.0.2.12345: UDP, length 16
13:09:52.827288 IP 10.0.0.7.12345 > 10.0.0.2.12345: UDP, length 16
13:09:52.827935 IP 10.0.0.7.12345 > 10.0.0.2.12345: UDP, length 16
13:09:52.828551 IP 10.0.0.7.12345 > 10.0.0.2.12345: UDP, length 16
13:09:52.829177 IP 10.0.0.7.12345 > 10.0.0.2.12345: UDP, length 16
13:09:52.829780 IP 10.0.0.7.12345 > 10.0.0.2.12345: UDP, length 16
13:09:52.830380 IP 10.0.0.7.12345 > 10.0.0.2.12345: UDP, length 16
13:09:52.830978 IP 10.0.0.7.12345 > 10.0.0.2.12345: UDP, length 16
13:09:52.831595 IP 10.0.0.7.12345 > 10.0.0.2.12345: UDP, length 16
13:09:52.832190 IP 10.0.0.7.12345 > 10.0.0.2.12345: UDP, length 16
13:09:52.832778 IP 10.0.0.7.12345 > 10.0.0.2.12345: UDP, length 16
13:09:52.833366 IP 10.0.0.7.12345 > 10.0.0.2.12345: UDP, length 16
13:09:52.833978 IP 10.0.0.7.12345 > 10.0.0.2.12345: UDP, length 16
13:09:52.834592 IP 10.0.0.7.12345 > 10.0.0.2.12345: UDP, length 16
13:09:52.835181 IP 10.0.0.7.12345 > 10.0.0.2.12345: UDP, length 16
13:09:52.835772 IP 10.0.0.7.12345 > 10.0.0.2.12345: UDP, length 16
13:09:52.836401 IP 10.0.0.7.12345 > 10.0.0.2.12345: UDP, length 16
13:09:52.837028 IP 10.0.0.7.12345 > 10.0.0.2.12345: UDP, length 16
13:09:52.837657 IP 10.0.0.7.12345 > 10.0.0.2.12345: UDP, length 16
13:09:52.838285 IP 10.0.0.7.12345 > 10.0.0.2.12345: UDP, length 16
13:09:52.838912 IP 10.0.0.7.12345 > 10.0.0.2.12345: UDP, length 16
13:09:52.839532 IP 10.0.0.7.12345 > 10.0.0.2.12345: UDP, length 16
13:09:52.840146 IP 10.0.0.7.12345 > 10.0.0.2.12345: UDP, length 16
13:09:52.840761 IP 10.0.0.7.12345 > 10.0.0.2.12345: UDP, length 16
13:09:52.841360 IP 10.0.0.7.12345 > 10.0.0.2.12345: UDP, length 16
13:09:52.841950 IP 10.0.0.7.12345 > 10.0.0.2.12345: UDP, length 16
13:09:52.842532 IP 10.0.0.7.12345 > 10.0.0.2.12345: UDP, length 16
13:09:52.843112 IP 10.0.0.7.12345 > 10.0.0.2.12345: UDP, length 16
13:09:52.843735 IP 10.0.0.7.12345 > 10.0.0.2.12345: UDP, length 16
13:09:52.844368 IP 10.0.0.7.12345 > 10.0.0.2.12345: UDP, length 16
13:09:52.844969 IP 10.0.0.7.12345 > 10.0.0.2.12345: UDP, length 16
13:09:52.845565 IP 10.0.0.7.12345 > 10.0.0.2.12345: UDP, length 16
13:09:52.846157 IP 10.0.0.7.12345 > 10.0.0.2.12345: UDP, length 16
13:09:52.846759 IP 10.0.0.7.12345 > 10.0.0.2.12345: UDP, length 16
13:09:52.847389 IP 10.0.0.7.12345 > 10.0.0.2.12345: UDP, length 16
13:09:52.848034 IP 10.0.0.7.12345 > 10.0.0.2.12345: UDP, length 16
13:09:52.848663 IP 10.0.0.7.12345 > 10.0.0.2.12345: UDP, length 16
13:09:52.849294 IP 10.0.0.7.12345 > 10.0.0.2.12345: UDP, length 16
13:09:52.849926 IP 10.0.0.7.12345 > 10.0.0.2.12345: UDP, length 16
13:09:52.850558 IP 10.0.0.7.12345 > 10.0.0.2.12345: UDP, length 16
13:09:52.851178 IP 10.0.0.7.12345 > 10.0.0.2.12345: UDP, length 16
13:09:52.851773 IP 10.0.0.7.12345 > 10.0.0.2.12345: UDP, length 16
13:09:52.852378 IP 10.0.0.7.12345 > 10.0.0.2.12345: UDP, length 16
13:09:52.852990 IP 10.0.0.7.12345 > 10.0.0.2.12345: UDP, length 16
13:09:52.853600 IP 10.0.0.7.12345 > 10.0.0.2.12345: UDP, length 16
13:09:52.854207 IP 10.0.0.7.12345 > 10.0.0.2.12345: UDP, length 16
13:09:52.854811 IP 10.0.0.7.12345 > 10.0.0.2.12345: UDP, length 16
13:09:52.855417 IP 10.0.0.7.12345 > 10.0.0.2.12345: UDP, length 16
13:09:52.856063 IP 10.0.0.7.12345 > 10.0.0.2.12345: UDP, length 16
13:09:52.856667 IP 10.0.0.7.12345 > 10.0.0.2.12345: UDP, length 16
13:09:52.857259 IP 10.0.0.7.12345 > 10.0.0.2.12345: UDP, length 16
13:09:52.857888 IP 10.0.0.7.12345 > 10.0.0.2.12345: UDP, length 16
13:09:52.858520 IP 10.0.0.7.12345 > 10.0.0.2.12345: UDP, length 16
13:09:52.859137 IP 10.0.0.7.12345 > 10.0.0.2.12345: UDP, length 16
13:09:52.859783 IP 10.0.0.7.12345 > 10.0.0.2.12345: UDP, length 16
13:09:52.860420 IP 10.0.0.7.12345 > 10.0.0.2.12345: UDP, length 16
13:09:52.861057 IP 10.0.0.7.12345 > 10.0.0.2.12345: UDP, length 16
13:09:52.861696 IP 10.0.0.7.12345 > 10.0.0.2.12345: UDP, length 16
13:09:52.862288 IP 10.0.0.7.12345 > 10.0.0.2.12345: UDP, length 16
13:09:52.862915 IP 10.0.0.7.12345 > 10.0.0.2.12345: UDP, length 16
13:09:52.863556 IP 10.0.0.7.12345 > 10.0.0.2.12345: UDP, length 16
13:09:52.864192 IP 10.0.0.7.12345 > 10.0.0.2.12345: UDP, length 16
13:09:52.864818 IP 10.0.0.7.12345 > 10.0.0.2.12345: UDP, length 16
13:09:52.865425 IP 10.0.0.7.12345 > 10.0.0.2.12345: UDP, length 16
13:09:52.866053 IP 10.0.0.7.12345 > 10.0.0.2.12345: UDP, length 16
13:09:52.866678 IP 10.0.0.7.12345 > 10.0.0.2.12345: UDP, length 16
13:09:52.867289 IP 10.0.0.7.12345 > 10.0.0.2.12345: UDP, length 16
13:09:52.867899 IP 10.0.0.7.12345 > 10.0.0.2.12345: UDP, length 16
13:09:52.868488 IP 10.0.0.7.12345 > 10.0.0.2.12345: UDP, length 16
13:09:52.869075 IP 10.0.0.7.12345 > 10.0.0.2.12345: UDP, length 16
13:09:52.869665 IP 10.0.0.7.12345 > 10.0.0.2.12345: UDP, length 16
13:09:52.870247 IP 10.0.0.7.12345 > 10.0.0.2.12345: UDP, length 16
13:09:52.870837 IP 10.0.0.7.12345 > 10.0.0.2.12345: UDP, length 16
13:09:52.871439 IP 10.0.0.7.12345 > 10.0.0.2.12345: UDP, length 16
13:09:52.872031 IP 10.0.0.7.12345 > 10.0.0.2.12345: UDP, length 16
13:09:52.872620 IP 10.0.0.7.12345 > 10.0.0.2.12345: UDP, length 16
13:09:52.873225 IP 10.0.0.7.12345 > 10.0.0.2.12345: UDP, length 16
13:09:52.873839 IP 10.0.0.7.12345 > 10.0.0.2.12345: UDP, length 16
13:09:52.874419 IP 10.0.0.7.12345 > 10.0.0.2.12345: UDP, length 16
13:09:52.875020 IP 10.0.0.7.12345 > 10.0.0.2.12345: UDP, length 16
13:09:52.875613 IP 10.0.0.7.12345 > 10.0.0.2.12345: UDP, length 16
13:09:52.876207 IP 10.0.0.7.12345 > 10.0.0.2.12345: UDP, length 16
13:09:52.876784 IP 10.0.0.7.12345 > 10.0.0.2.12345: UDP, length 16
13:09:52.877361 IP 10.0.0.7.12345 > 10.0.0.2.12345: UDP, length 16
13:09:52.877942 IP 10.0.0.7.12345 > 10.0.0.2.12345: UDP, length 16
13:09:52.878545 IP 10.0.0.7.12345 > 10.0.0.2.12345: UDP, length 16
13:09:52.879118 IP 10.0.0.7.12345 > 10.0.0.2.12345: UDP, length 16
13:09:52.879738 IP 10.0.0.7.12345 > 10.0.0.2.12345: UDP, length 16
13:09:52.880329 IP 10.0.0.7.12345 > 10.0.0.2.12345: UDP, length 16
13:09:52.880918 IP 10.0.0.7.12345 > 10.0.0.2.12345: UDP, length 16
13:09:52.881509 IP 10.0.0.7.12345 > 10.0.0.2.12345: UDP, length 16
13:09:52.882099 IP 10.0.0.7.12345 > 10.0.0.2.12345: UDP, length 16
13:09:52.882690 IP 10.0.0.7.12345 > 10.0.0.2.12345: UDP, length 16
13:09:52.883272 IP 10.0.0.7.12345 > 10.0.0.2.12345: UDP, length 16
13:09:52.883847 IP 10.0.0.7.12345 > 10.0.0.2.12345: UDP, length 16
13:09:52.884437 IP 10.0.0.7.12345 > 10.0.0.2.12345: UDP, length 16
13:09:52.885059 IP 10.0.0.7.12345 > 10.0.0.2.12345: UDP, length 16
13:09:52.885654 IP 10.0.0.7.12345 > 10.0.0.2.12345: UDP, length 16
13:09:52.886260 IP 10.0.0.7.12345 > 10.0.0.2.12345: UDP, length 16
13:09:52.886865 IP 10.0.0.7.12345 > 10.0.0.2.12345: UDP, length 16
13:09:52.887468 IP 10.0.0.7.12345 > 10.0.0.2.12345: UDP, length 16
13:09:52.888072 IP 10.0.0.7.12345 > 10.0.0.2.12345: UDP, length 16
13:09:52.888679 IP 10.0.0.7.12345 > 10.0.0.2.12345: UDP, length 16
13:09:52.889308 IP 10.0.0.7.12345 > 10.0.0.2.12345: UDP, length 16
13:09:52.889929 IP 10.0.0.7.12345 > 10.0.0.2.12345: UDP, length 16
13:09:52.890550 IP 10.0.0.7.12345 > 10.0.0.2.12345: UDP, length 16
13:09:52.891169 IP 10.0.0.7.12345 > 10.0.0.2.12345: UDP, length 16
13:09:52.891789 IP 10.0.0.7.12345 > 10.0.0.2.12345: UDP, length 16
13:09:52.892408 IP 10.0.0.7.12345 > 10.0.0.2.12345: UDP, length 16
13:09:52.893005 IP 10.0.0.7.12345 > 10.0.0.2.12345: UDP, length 16
13:09:52.893610 IP 10.0.0.7.12345 > 10.0.0.2.12345: UDP, length 16
13:09:52.894232 IP 10.0.0.7.12345 > 10.0.0.2.12345: UDP, length 16
13:09:52.894851 IP 10.0.0.7.12345 > 10.0.0.2.12345: UDP, length 16
13:09:52.895469 IP 10.0.0.7.12345 > 10.0.0.2.12345: UDP, length 16
13:09:52.896089 IP 10.0.0.7.12345 > 10.0.0.2.12345: UDP, length 16
13:09:52.896708 IP 10.0.0.7.12345 > 10.0.0.2.12345: UDP, length 16
13:09:52.897326 IP 10.0.0.7.12345 > 10.0.0.2.12345: UDP, length 16
13:09:52.897943 IP 10.0.0.7.12345 > 10.0.0.2.12345: UDP, length 16
13:09:52.898563 IP 10.0.0.7.12345 > 10.0.0.2.12345: UDP, length 16
13:09:52.899155 IP 10.0.0.7.12345 > 10.0.0.2.12345: UDP, length 16
13:09:52.899754 IP 10.0.0.7.12345 > 10.0.0.2.12345: UDP, length 16
13:09:52.900378 IP 10.0.0.7.12345 > 10.0.0.2.12345: UDP, length 16
13:09:52.900999 IP 10.0.0.7.12345 > 10.0.0.2.12345: UDP, length 16
13:09:52.901616 IP 10.0.0.7.12345 > 10.0.0.2.12345: UDP, length 16
13:09:52.902248 IP 10.0.0.7.12345 > 10.0.0.2.12345: UDP, length 16
13:09:52.902880 IP 10.0.0.7.12345 > 10.0.0.2.12345: UDP, length 16
13:09:52.903512 IP 10.0.0.7.12345 > 10.0.0.2.12345: UDP, length 16
13:09:52.904149 IP 10.0.0.7.12345 > 10.0.0.2.12345: UDP, length 16
13:09:52.904789 IP 10.0.0.7.12345 > 10.0.0.2.12345: UDP, length 16
13:09:52.905426 IP 10.0.0.7.12345 > 10.0.0.2.12345: UDP, length 16
13:09:52.906053 IP 10.0.0.7.12345 > 10.0.0.2.12345: UDP, length 16
13:09:52.906676 IP 10.0.0.7.12345 > 10.0.0.2.12345: UDP, length 16
13:09:52.907307 IP 10.0.0.7.12345 > 10.0.0.2.12345: UDP, length 16
13:09:52.907933 IP 10.0.0.7.12345 > 10.0.0.2.12345: UDP, length 16
13:09:52.908555 IP 10.0.0.7.12345 > 10.0.0.2.12345: UDP, length 16
13:09:52.909186 IP 10.0.0.7.12345 > 10.0.0.2.12345: UDP, length 16
13:09:52.909836 IP 10.0.0.7.12345 > 10.0.0.2.12345: UDP, length 16
13:09:52.910446 IP 10.0.0.7.12345 > 10.0.0.2.12345: UDP, length 16
13:09:52.911056 IP 10.0.0.7.12345 > 10.0.0.2.12345: UDP, length 16
13:09:52.911690 IP 10.0.0.7.12345 > 10.0.0.2.12345: UDP, length 16
13:09:52.912338 IP 10.0.0.7.12345 > 10.0.0.2.12345: UDP, length 16
13:09:52.912942 IP 10.0.0.7.12345 > 10.0.0.2.12345: UDP, length 16
13:09:52.913536 IP 10.0.0.7.12345 > 10.0.0.2.12345: UDP, length 16
13:09:52.914162 IP 10.0.0.7.12345 > 10.0.0.2.12345: UDP, length 16
13:09:52.914762 IP 10.0.0.7.12345 > 10.0.0.2.12345: UDP, length 16
13:09:52.915348 IP 10.0.0.7.12345 > 10.0.0.2.12345: UDP, length 16
13:09:52.915949 IP 10.0.0.7.12345 > 10.0.0.2.12345: UDP, length 16
13:09:52.916541 IP 10.0.0.7.12345 > 10.0.0.2.12345: UDP, length 16
13:09:52.917133 IP 10.0.0.7.12345 > 10.0.0.2.12345: UDP, length 16
13:09:52.917780 IP 10.0.0.7.12345 > 10.0.0.2.12345: UDP, length 16
13:09:52.918422 IP 10.0.0.7.12345 > 10.0.0.2.12345: UDP, length 16
13:09:52.919062 IP 10.0.0.7.12345 > 10.0.0.2.12345: UDP, length 16
13:09:52.919707 IP 10.0.0.7.12345 > 10.0.0.2.12345: UDP, length 16
13:09:52.920348 IP 10.0.0.7.12345 > 10.0.0.2.12345: UDP, length 16
13:09:52.920988 IP 10.0.0.7.12345 > 10.0.0.2.12345: UDP, length 16
13:09:52.921652 IP 10.0.0.7.12345 > 10.0.0.2.12345: UDP, length 16
13:09:52.922294 IP 10.0.0.7.12345 > 10.0.0.2.12345: UDP, length 16
13:09:52.922912 IP 10.0.0.7.12345 > 10.0.0.2.12345: UDP, length 16
13:09:52.923517 IP 10.0.0.7.12345 > 10.0.0.2.12345: UDP, length 16
13:09:52.924121 IP 10.0.0.7.12345 > 10.0.0.2.12345: UDP, length 16
13:09:52.924712 IP 10.0.0.7.12345 > 10.0.0.2.12345: UDP, length 16
13:09:52.925340 IP 10.0.0.7.12345 > 10.0.0.2.12345: UDP, length 16
13:09:52.925941 IP 10.0.0.7.12345 > 10.0.0.2.12345: UDP, length 16
13:09:52.926540 IP 10.0.0.7.12345 > 10.0.0.2.12345: UDP, length 16
13:09:52.927126 IP 10.0.0.7.12345 > 10.0.0.2.12345: UDP, length 16
13:09:52.927753 IP 10.0.0.7.12345 > 10.0.0.2.12345: UDP, length 16
13:09:52.928337 IP 10.0.0.7.12345 > 10.0.0.2.12345: UDP, length 16
13:09:52.928924 IP 10.0.0.7.12345 > 10.0.0.2.12345: UDP, length 16
13:09:52.929511 IP 10.0.0.7.12345 > 10.0.0.2.12345: UDP, length 16
