13:12:20.201715 IP 10.0.0.8.12345 > 10.0.0.2.12345: UDP, length 16
13:12:20.202246 IP 10.0.0.8.12345 > 10.0.0.2.12345: UDP, length 16
13:12:20.202821 IP 10.0.0.8.12345 > 10.0.0.2.12345: UDP, length 16
13:12:20.203398 IP 10.0.0.8.12345 > 10.0.0.2.12345: UDP, length 16
13:12:20.203974 IP 10.0.0.8.12345 > 10.0.0.2.12345: UDP, length 16
13:12:20.204551 IP 10.0.0.8.12345 > 10.0.0.2.12345: UDP, length 16
13:12:20.205135 IP 10.0.0.8.12345 > 10.0.0.2.12345: UDP, length 16
13:12:20.205721 IP 10.0.0.8.12345 > 10.0.0.2.12345: UDP, length 16
13:12:20.206310 IP 10.0.0.8.12345 > 10.0.0.2.12345: UDP, length 16
13:12:20.206897 IP 10.0.0.8.12345 > 10.0.0.2.12345: UDP, length 16
13:12:20.207478 IP 10.0.0.8.12345 > 10.0.0.2.12345: UDP, length 16
13:12:20.208061 IP 10.0.0.8.12345 > 10.0.0.2.12345: UDP, length 16
13:12:20.208638 IP 10.0.0.8.12345 > 10.0.0.2.12345: UDP, length 16
13:12:20.209215 IP 10.0.0.8.12345 > 10.0.0.2.12345: UDP, length 16
13:12:20.209790 IP 10.0.0.8.12345 > 10.0.0.2.12345: UDP, length 16
13:12:20.210365 IP 10.0.0.8.12345 > 10.0.0.2.12345: UDP, length 16
13:12:20.210940 IP 10.0.0.8.12345 > 10.0.0.2.12345: UDP, length 16
13:12:20.211517 IP 10.0.0.8.12345 > 10.0.0.2.12345: UDP, length 16
13:12:20.212092 IP 10.0.0.8.12345 > 10.0.0.2.12345: UDP, length 16
13:12:20.212668 IP 10.0.0.8.12345 > 10.0.0.2.12345: UDP, length 16
13:12:20.213240 IP 10.0.0.8.12345 > 10.0.0.2.12345: UDP, length 16
13:12:20.213811 IP 10.0.0.8.12345 > 10.0.0.2.12345: UDP, length 16
13:12:20.214380 IP 10.0.0.8.12345 > 10.0.0.2.12345: UDP, length 16
13:12:20.214963 IP 10.0.0.8.12345 > 10.0.0.2.12345: UDP, length 16
13:12:20.215538 IP 10.0.0.8.12345 > 10.0.0.2.12345: UDP, length 16
13:12:20.216112 IP 10.0.0.8.12345 > 10.0.0.2.12345: UDP, length 16
13:12:20.216699 IP 10.0.0.8.12345 > 10.0.0.2.12345: UDP, length 16
13:12:20.217268 IP 10.0.0.8.12345 > 10.0.0.2.12345: UDP, length 16
13:12:20.217842 IP 10.0.0.8.12345 > 10.0.0.2.12345: UDP, length 16
13:12:20.218418 IP 10.0.0.8.12345 > 10.0.0.2.12345: UDP, length 16
13:12:20.218986 IP 10.0.0.8.12345 > 10.0.0.2.12345: UDP, length 16
13:12:20.219572 IP 10.0.0.8.12345 > 10.0.0.2.12345: UDP, length 16
13:12:20.220142 IP 10.0.0.8.12345 > 10.0.0.2.12345: UDP, length 16
13:12:20.220732 IP 10.0.0.8.12345 > 10.0.0.2.12345: UDP, length 16
13:12:20.221312 IP 10.0.0.8.12345 > 10.0.0.2.12345: UDP, length 16
13:12:20.221882 IP 10.0.0.8.12345 > 10.0.0.2.12345: UDP, length 16
13:12:20.222460 IP 10.0.0.8.12345 > 10.0.0.2.12345: UDP, length 16
13:12:20.223042 IP 10.0.0.8.12345 > 10.0.0.2.12345: UDP, length 16
13:12:20.223618 IP 10.0.0.8.12345 > 10.0.0.2.12345: UDP, length 16
13:12:20.224206 IP 10.0.0.8.12345 > 10.0.0.2.12345: UDP, length 16
13:12:20.224786 IP 10.0.0.8.12345 > 10.0.0.2.12345: UDP, length 16
13:12:20.225360 IP 10.0.0.8.12345 > 10.0.0.2.12345: UDP, length 16
13:12:20.225938 IP 10.0.0.8.12345 > 10.0.0.2.12345: UDP, length 16
13:12:20.226504 IP 10.0.0.8.12345 > 10.0.0.2.12345: UDP, length 16
13:12:20.227081 IP 10.0.0.8.12345 > 10.0.0.2.12345: UDP, length 16
13:12:20.227653 IP 10.0.0.8.12345 > 10.0.0.2.12345: UDP, length 16
13:12:20.228224 IP 10.0.0.8.12345 > 10.0.0.2.12345: UDP, length 16
13:12:20.228815 IP 10.0.0.8.12345 > 10.0.0.2.12345: UDP, length 16
13:12:20.229398 IP 10.0.0.8.12345 > 10.0.0.2.12345: UDP, length 16
13:12:20.229981 IP 10.0.0.8.12345 > 10.0.0.2.12345: UDP, length 16
13:12:20.230564 IP 10.0.0.8.12345 > 10.0.0.2.12345: UDP, length 16
13:12:20.231146 IP 10.0.0.8.12345 > 10.0.0.2.12345: UDP, length 16
13:12:20.231720 IP 10.0.0.8.12345 > 10.0.0.2.12345: UDP, length 16
13:12:20.232302 IP 10.0.0.8.12345 > 10.0.0.2.12345: UDP, length 16
13:12:20.232884 IP 10.0.0.8.12345 > 10.0.0.2.12345: UDP, length 16
13:12:20.233467 IP 10.0.0.8.12345 > 10.0.0.2.12345: UDP, length 16
13:12:20.234049 IP 10.0.0.8.12345 > 10.0.0.2.12345: UDP, length 16
13:12:20.234622 IP 10.0.0.8.12345 > 10.0.0.2.12345: UDP, length 16
13:12:20.235205 IP 10.0.0.8.12345 > 10.0.0.2.12345: UDP, length 16
13:12:20.235768 IP 10.0.0.8.12345 > 10.0.0.2.12345: UDP, length 16
13:12:20.236350 IP 10.0.0.8.12345 > 10.0.0.2.12345: UDP, length 16
13:12:20.236929 IP 10.0.0.8.12345 > 10.0.0.2.12345: UDP, length 16
13:12:20.237520 IP 10.0.0.8.12345 > 10.0.0.2.12345: UDP, length 16
13:12:20.238103 IP 10.0.0.8.12345 > 10.0.0.2.12345: UDP, length 16
13:12:20.238686 IP 10.0.0.8.12345 > 10.0.0.2.12345: UDP, length 16
13:12:20.239268 IP 10.0.0.8.12345 > 10.0.0.2.12345: UDP, length 16
13:12:20.239839 IP 10.0.0.8.12345 > 10.0.0.2.12345: UDP, length 16
13:12:20.240420 IP 10.0.0.8.12345 > 10.0.0.2.12345: UDP, length 16
13:12:20.241008 IP 10.0.0.8.12345 > 10.0.0.2.12345: UDP, length 16
13:12:20.241623 IP 10.0.0.8.12345 > 10.0.0.2.12345: UDP, length 16
13:12:20.242233 IP 10.0.0.8.12345 > 10.0.0.2.12345: UDP, length 16
13:12:20.242843 IP 10.0.0.8.12345 > 10.0.0.2.12345: UDP, length 16
13:12:20.243432 IP 10.0.0.8.12345 > 10.0.0.2.12345: UDP, length 16
13:12:20.244008 IP 10.0.0.8.12345 > 10.0.0.2.12345: UDP, length 16
13:12:20.244591 IP 10.0.0.8.12345 > 10.0.0.2.12345: UDP, length 16
13:12:20.245183 IP 10.0.0.8.12345 > 10.0.0.2.12345: UDP, length 16
13:12:20.245787 IP 10.0.0.8.12345 > 10.0.0.2.12345: UDP, length 16
13:12:20.246379 IP 10.0.0.8.12345 > 10.0.0.2.12345: UDP, length 16
13:12:20.246958 IP 10.0.0.8.12345 > 10.0.0.2.12345: UDP, length 16
13:12:20.247533 IP 10.0.0.8.12345 > 10.0.0.2.12345: UDP, length 16
13:12:20.248111 IP 10.0.0.8.12345 > 10.0.0.2.12345: UDP, length 16
13:12:20.248685 IP 10.0.0.8.12345 > 10.0.0.2.12345: UDP, length 16
13:12:20.249258 IP 10.0.0.8.12345 > 10.0.0.2.12345: UDP, length 16
13:12:20.249831 IP 10.0.0.8.12345 > 10.0.0.2.12345: UDP, length 16
13:12:20.250431 IP 10.0.0.8.12345 > 10.0.0.2.12345: UDP, length 16
13:12:20.251012 IP 10.0.0.8.12345 > 10.0.0.2.12345: UDP, length 16
13:12:20.251586 IP 10.0.0.8.12345 > 10.0.0.2.12345: UDP, length 16
13:12:20.252178 IP 10.0.0.8.12345 > 10.0.0.2.12345: UDP, length 16
13:12:20.252770 IP 10.0.0.8.12345 > 10.0.0.2.12345: UDP, length 16
13:12:20.253371 IP 10.0.0.8.12345 > 10.0.0.2.12345: UDP, length 16
13:12:20.253951 IP 10.0.0.8.12345 > 10.0.0.2.12345: UDP, length 16
13:12:20.254532 IP 10.0.0.8.12345 > 10.0.0.2.12345: UDP, length 16
13:12:20.255123 IP 10.0.0.8.12345 > 10.0.0.2.12345: UDP, length 16
13:12:20.255699 IP 10.0.0.8.12345 > 10.0.0.2.12345: UDP, length 16
13:12:20.256293 IP 10.0.0.8.12345 > 10.0.0.2.12345: UDP, length 16
13:12:20.256859 IP 10.0.0.8.12345 > 10.0.0.2.12345: UDP, length 16
13:12:20.257429 IP 10.0.0.8.12345 > 10.0.0.2.12345: UDP, length 16
13:12:20.258003 IP 10.0.0.8.12345 > 10.0.0.2.12345: UDP, length 16
13:12:20.258587 IP 10.0.0.8.12345 > 10.0.0.2.12345: UDP, length 16
13:12:20.259155 IP 10.0.0.8.12345 > 10.0.0.2.12345: UDP, length 16
13:12:20.259706 IP 10.0.0.8.12345 > 10.0.0.2.12345: UDP, length 16
13:12:20.260282 IP 10.0.0.8.12345 > 10.0.0.2.12345: UDP, length 16
13:12:20.260859 IP 10.0.0.8.12345 > 10.0.0.2.12345: UDP, length 16
13:12:20.261434 IP 10.0.0.8.12345 > 10.0.0.2.12345: UDP, length 16
13:12:20.262005 IP 10.0.0.8.12345 > 10.0.0.2.12345: UDP, length 16
13:12:20.262569 IP 10.0.0.8.12345 > 10.0.0.2.12345: UDP, length 16
13:12:20.263184 IP 10.0.0.8.12345 > 10.0.0.2.12345: UDP, length 16
13:12:20.263775 IP 10.0.0.8.12345 > 10.0.0.2.12345: UDP, length 16
13:12:20.264401 IP 10.0.0.8.12345 > 10.0.0.2.12345: UDP, length 16
13:12:20.264998 IP 10.0.0.8.12345 > 10.0.0.2.12345: UDP, length 16
13:12:20.265590 IP 10.0.0.8.12345 > 10.0.0.2.12345: UDP, length 16
13:12:20.266185 IP 10.0.0.8.12345 > 10.0.0.2.12345: UDP, length 16
13:12:20.266774 IP 10.0.0.8.12345 > 10.0.0.2.12345: UDP, length 16
13:12:20.267354 IP 10.0.0.8.12345 > 10.0.0.2.12345: UDP, length 16
13:12:20.267925 IP 10.0.0.8.12345 > 10.0.0.2.12345: UDP, length 16
13:12:20.268493 IP 10.0.0.8.12345 > 10.0.0.2.12345: UDP, length 16
13:12:20.269076 IP 10.0.0.8.12345 > 10.0.0.2.12345: UDP, length 16
13:12:20.269660 IP 10.0.0.8.12345 > 10.0.0.2.12345: UDP, length 16
13:12:20.270230 IP 10.0.0.8.12345 > 10.0.0.2.12345: UDP, length 16
13:12:20.270801 IP 10.0.0.8.12345 > 10.0.0.2.12345: UDP, length 16
13:12:20.271386 IP 10.0.0.8.12345 > 10.0.0.2.12345: UDP, length 16
13:12:20.271971 IP 10.0.0.8.12345 > 10.0.0.2.12345: UDP, length 16
13:12:20.272546 IP 10.0.0.8.12345 > 10.0.0.2.12345: UDP, length 16
13:12:20.273124 IP 10.0.0.8.12345 > 10.0.0.2.12345: UDP, length 16
13:12:20.273697 IP 10.0.0.8.12345 > 10.0.0.2.12345: UDP, length 16
13:12:20.274271 IP 10.0.0.8.12345 > 10.0.0.2.12345: UDP, length 16
13:12:20.274864 IP 10.0.0.8.12345 > 10.0.0.2.12345: UDP, length 16
13:12:20.275450 IP 10.0.0.8.12345 > 10.0.0.2.12345: UDP, length 16
13:12:20.276006 IP 10.0.0.8.12345 > 10.0.0.2.12345: UDP, length 16
13:12:20.276576 IP 10.0.0.8.12345 > 10.0.0.2.12345: UDP, length 16
13:12:20.277147 IP 10.0.0.8.12345 > 10.0.0.2.12345: UDP, length 16
13:12:20.277734 IP 10.0.0.8.12345 > 10.0.0.2.12345: UDP, length 16
13:12:20.278316 IP 10.0.0.8.12345 > 10.0.0.2.12345: UDP, length 16
13:12:20.278893 IP 10.0.0.8.12345 > 10.0.0.2.12345: UDP, length 16
13:12:20.279472 IP 10.0.0.8.12345 > 10.0.0.2.12345: UDP, length 16
13:12:20.280049 IP 10.0.0.8.12345 > 10.0.0.2.12345: UDP, length 16
13:12:20.280640 IP 10.0.0.8.12345 > 10.0.0.2.12345: UDP, length 16
13:12:20.281229 IP 10.0.0.8.12345 > 10.0.0.2.12345: UDP, length 16
13:12:20.281816 IP 10.0.0.8.12345 > 10.0.0.2.12345: UDP, length 16
13:12:20.282400 IP 10.0.0.8.12345 > 10.0.0.2.12345: UDP, length 16
13:12:20.282969 IP 10.0.0.8.12345 > 10.0.0.2.12345: UDP, length 16
13:12:20.283550 IP 10.0.0.8.12345 > 10.0.0.2.12345: UDP, length 16
13:12:20.284143 IP 10.0.0.8.12345 > 10.0.0.2.12345: UDP, length 16
13:12:20.284735 IP 10.0.0.8.12345 > 10.0.0.2.12345: UDP, length 16
13:12:20.285350 IP 10.0.0.8.12345 > 10.0.0.2.12345: UDP, length 16
13:12:20.285956 IP 10.0.0.8.12345 > 10.0.0.2.12345: UDP, length 16
13:12:20.286551 IP 10.0.0.8.12345 > 10.0.0.2.12345: UDP, length 16
13:12:20.287158 IP 10.0.0.8.12345 > 10.0.0.2.12345: UDP, length 16
13:12:20.287752 IP 10.0.0.8.12345 > 10.0.0.2.12345: UDP, length 16
13:12:20.288362 IP 10.0.0.8.12345 > 10.0.0.2.12345: UDP, length 16
13:12:20.288956 IP 10.0.0.8.12345 > 10.0.0.2.12345: UDP, length 16
13:12:20.289529 IP 10.0.0.8.12345 > 10.0.0.2.12345: UDP, length 16
13:12:20.290109 IP 10.0.0.8.12345 > 10.0.0.2.12345: UDP, length 16
13:12:20.290681 IP 10.0.0.8.12345 > 10.0.0.2.12345: UDP, length 16
13:12:20.291265 IP 10.0.0.8.12345 > 10.0.0.2.12345: UDP, length 16
13:12:20.291844 IP 10.0.0.8.12345 > 10.0.0.2.12345: UDP, length 16
13:12:20.292419 IP 10.0.0.8.12345 > 10.0.0.2.12345: UDP, length 16
13:12:20.292984 IP 10.0.0.8.12345 > 10.0.0.2.12345: UDP, length 16
13:12:20.293552 IP 10.0.0.8.12345 > 10.0.0.2.12345: UDP, length 16
13:12:20.294121 IP 10.0.0.8.12345 > 10.0.0.2.12345: UDP, length 16
13:12:20.294699 IP 10.0.0.8.12345 > 10.0.0.2.12345: UDP, length 16
13:12:20.295300 IP 10.0.0.8.12345 > 10.0.0.2.12345: UDP, length 16
13:12:20.295868 IP 10.0.0.8.12345 > 10.0.0.2.12345: UDP, length 16
13:12:20.296455 IP 10.0.0.8.12345 > 10.0.0.2.12345: UDP, length 16
13:12:20.297032 IP 10.0.0.8.12345 > 10.0.0.2.12345: UDP, length 16
13:12:20.297622 IP 10.0.0.8.12345 > 10.0.0.2.12345: UDP, length 16
13:12:20.298190 IP 10.0.0.8.12345 > 10.0.0.2.12345: UDP, length 16
13:12:20.298781 IP 10.0.0.8.12345 > 10.0.0.2.12345: UDP, length 16
13:12:20.299369 IP 10.0.0.8.12345 > 10.0.0.2.12345: UDP, length 16
13:12:20.299952 IP 10.0.0.8.12345 > 10.0.0.2.12345: UDP, length 16
13:12:20.300533 IP 10.0.0.8.12345 > 10.0.0.2.12345: UDP, length 16
13:12:20.301106 IP 10.0.0.8.12345 > 10.0.0.2.12345: UDP, length 16
13:12:20.301676 IP 10.0.0.8.12345 > 10.0.0.2.12345: UDP, length 16
13:12:20.302246 IP 10.0.0.8.12345 > 10.0.0.2.12345: UDP, length 16
13:12:20.302816 IP 10.0.0.8.12345 > 10.0.0.2.12345: UDP, length 16
13:12:20.303390 IP 10.0.0.8.12345 > 10.0.0.2.12345: UDP, length 16
13:12:20.303966 IP 10.0.0.8.12345 > 10.0.0.2.12345: UDP, length 16
13:12:20.304539 IP 10.0.0.8.12345 > 10.0.0.2.12345: UDP, length 16
13:12:20.305113 IP 10.0.0.8.12345 > 10.0.0.2.12345: UDP, length 16
13:12:20.305687 IP 10.0.0.8.12345 > 10.0.0.2.12345: UDP, length 16
13:12:20.306260 IP 10.0.0.8.12345 > 10.0.0.2.12345: UDP, length 16
13:12:20.306843 IP 10.0.0.8.12345 > 10.0.0.2.12345: UDP, length 16
13:12:20.307428 IP 10.0.0.8.12345 > 10.0.0.2.12345: UDP, length 16
13:12:20.308020 IP 10.0.0.8.12345 > 10.0.0.2.12345: UDP, length 16
13:12:20.308612 IP 10.0.0.8.12345 > 10.0.0.2.12345: UDP, length 16
13:12:20.309195 IP 10.0.0.8.12345 > 10.0.0.2.12345: UDP, length 16
13:12:20.309767 IP 10.0.0.8.12345 > 10.0.0.2.12345: UDP, length 16
13:12:20.310343 IP 10.0.0.8.12345 > 10.0.0.2.12345: UDP, length 16
13:12:20.310925 IP 10.0.0.8.12345 > 10.0.0.2.12345: UDP, length 16
13:12:20.311504 IP 10.0.0.8.12345 > 10.0.0.2.12345: UDP, length 16
13:12:20.312089 IP 10.0.0.8.12345 > 10.0.0.2.12345: UDP, length 16
13:12:20.312655 IP 10.0.0.8.12345 > 10.0.0.2.12345: UDP, length 16
13:12:20.313236 IP 10.0.0.8.12345 > 10.0.0.2.12345: UDP, length 16
13:12:20.313818 IP 10.0.0.8.12345 > 10.0.0.2.12345: UDP, length 16
13:12:20.314398 IP 10.0.0.8.12345 > 10.0.0.2.12345: UDP, length 16
13:12:20.314996 IP 10.0.0.8.12345 > 10.0.0.2.12345: UDP, length 16
13:12:20.315573 IP 10.0.0.8.12345 > 10.0.0.2.12345: UDP, length 16
13:12:20.316153 IP 10.0.0.8.12345 > 10.0.0.2.12345: UDP, length 16
13:12:20.316725 IP 10.0.0.8.12345 > 10.0.0.2.12345: UDP, length 16
13:12:20.317312 IP 10.0.0.8.12345 > 10.0.0.2.12345: UDP, length 16
13:12:20.317902 IP 10.0.0.8.12345 > 10.0.0.2.12345: UDP, length 16
13:12:20.318492 IP 10.0.0.8.12345 > 10.0.0.2.12345: UDP, length 16
13:12:20.319082 IP 10.0.0.8.12345 > 10.0.0.2.12345: UDP, length 16
13:12:20.319698 IP 10.0.0.8.12345 > 10.0.0.2.12345: UDP, length 16
13:12:20.320304 IP 10.0.0.8.12345 > 10.0.0.2.12345: UDP, length 16
13:12:20.320905 IP 10.0.0.8.12345 > 10.0.0.2.12345: UDP, length 16
13:12:20.321503 IP 10.0.0.8.12345 > 10.0.0.2.12345: UDP, length 16
13:12:20.322099 IP 10.0.0.8.12345 > 10.0.0.2.12345: UDP, length 16
13:12:20.322694 IP 10.0.0.8.12345 > 10.0.0.2.12345: UDP, length 16
13:12:20.323273 IP 10.0.0.8.12345 > 10.0.0.2.12345: UDP, length 16
13:12:20.323851 IP 10.0.0.8.12345 > 10.0.0.2.12345: UDP, length 16
13:12:20.324434 IP 10.0.0.8.12345 > 10.0.0.2.12345: UDP, length 16
13:12:20.325014 IP 10.0.0.8.12345 > 10.0.0.2.12345: UDP, length 16
13:12:20.325596 IP 10.0.0.8.12345 > 10.0.0.2.12345: UDP, length 16
13:12:20.326168 IP 10.0.0.8.12345 > 10.0.0.2.12345: UDP, length 16
13:12:20.326735 IP 10.0.0.8.12345 > 10.0.0.2.12345: UDP, length 16
13:12:20.327298 IP 10.0.0.8.12345 > 10.0.0.2.12345: UDP, length 16
13:12:20.327878 IP 10.0.0.8.12345 > 10.0.0.2.12345: UDP, length 16
13:12:20.328473 IP 10.0.0.8.12345 > 10.0.0.2.12345: UDP, length 16
13:12:20.329071 IP 10.0.0.8.12345 > 10.0.0.2.12345: UDP, length 16
13:12:20.329667 IP 10.0.0.8.12345 > 10.0.0.2.12345: UDP, length 16
13:12:20.330264 IP 10.0.0.8.12345 > 10.0.0.2.12345: UDP, length 16
13:12:20.330854 IP 10.0.0.8.12345 > 10.0.0.2.12345: UDP, length 16
13:12:20.331439 IP 10.0.0.8.12345 > 10.0.0.2.12345: UDP, length 16
13:12:20.332016 IP 10.0.0.8.12345 > 10.0.0.2.12345: UDP, length 16
13:12:20.332602 IP 10.0.0.8.12345 > 10.0.0.2.12345: UDP, length 16
13:12:20.333186 IP 10.0.0.8.12345 > 10.0.0.2.12345: UDP, length 16
13:12:20.333760 IP 10.0.0.8.12345 > 10.0.0.2.12345: UDP, length 16
13:12:20.334343 IP 10.0.0.8.12345 > 10.0.0.2.12345: UDP, length 16
13:12:20.334927 IP 10.0.0.8.12345 > 10.0.0.2.12345: UDP, length 16
13:12:20.335502 IP 10.0.0.8.12345 > 10.0.0.2.12345: UDP, length 16
13:12:20.336075 IP 10.0.0.8.12345 > 10.0.0.2.12345: UDP, length 16
13:12:20.336650 IP 10.0.0.8.12345 > 10.0.0.2.12345: UDP, length 16
13:12:20.337227 IP 10.0.0.8.12345 > 10.0.0.2.12345: UDP, length 16
13:12:20.337799 IP 10.0.0.8.12345 > 10.0.0.2.12345: UDP, length 16
13:12:20.338375 IP 10.0.0.8.12345 > 10.0.0.2.12345: UDP, length 16
13:12:20.338964 IP 10.0.0.8.12345 > 10.0.0.2.12345: UDP, length 16
13:12:20.339531 IP 10.0.0.8.12345 > 10.0.0.2.12345: UDP, length 16
13:12:20.340099 IP 10.0.0.8.12345 > 10.0.0.2.12345: UDP, length 16
13:12:20.340669 IP 10.0.0.8.12345 > 10.0.0.2.12345: UDP, length 16
13:12:20.341246 IP 10.0.0.8.12345 > 10.0.0.2.12345: UDP, length 16
13:12:20.341821 IP 10.0.0.8.12345 > 10.0.0.2.12345: UDP, length 16
13:12:20.342393 IP 10.0.0.8.12345 > 10.0.0.2.12345: UDP, length 16
13:12:20.342964 IP 10.0.0.8.12345 > 10.0.0.2.12345: UDP, length 16
13:12:20.343534 IP 10.0.0.8.12345 > 10.0.0.2.12345: UDP, length 16
13:12:20.344108 IP 10.0.0.8.12345 > 10.0.0.2.12345: UDP, length 16
13:12:20.344676 IP 10.0.0.8.12345 > 10.0.0.2.12345: UDP, length 16
13:12:20.345245 IP 10.0.0.8.12345 > 10.0.0.2.12345: UDP, length 16
13:12:20.345820 IP 10.0.0.8.12345 > 10.0.0.2.12345: UDP, length 16
13:12:20.346388 IP 10.0.0.8.12345 > 10.0.0.2.12345: UDP, length 16
13:12:20.346952 IP 10.0.0.8.12345 > 10.0.0.2.12345: UDP, length 16
13:12:20.347518 IP 10.0.0.8.12345 > 10.0.0.2.12345: UDP, length 16
13:12:20.348082 IP 10.0.0.8.12345 > 10.0.0.2.12345: UDP, length 16
13:12:20.348656 IP 10.0.0.8.12345 > 10.0.0.2.12345: UDP, length 16
13:12:20.349229 IP 10.0.0.8.12345 > 10.0.0.2.12345: UDP, length 16
13:12:20.349802 IP 10.0.0.8.12345 > 10.0.0.2.12345: UDP, length 16
13:12:20.350375 IP 10.0.0.8.12345 > 10.0.0.2.12345: UDP, length 16
13:12:20.350948 IP 10.0.0.8.12345 > 10.0.0.2.12345: UDP, length 16
13:12:20.351521 IP 10.0.0.8.12345 > 10.0.0.2.12345: UDP, length 16
13:12:20.352095 IP 10.0.0.8.12345 > 10.0.0.2.12345: UDP, length 16
13:12:20.352669 IP 10.0.0.8.12345 > 10.0.0.2.12345: UDP, length 16
13:12:20.353242 IP 10.0.0.8.12345 > 10.0.0.2.12345: UDP, length 16
13:12:20.353816 IP 10.0.0.8.12345 > 10.0.0.2.12345: UDP, length 16
13:12:20.354390 IP 10.0.0.8.12345 > 10.0.0.2.12345: UDP, length 16
13:12:20.354960 IP 10.0.0.8.12345 > 10.0.0.2.12345: UDP, length 16
13:12:20.355529 IP 10.0.0.8.12345 > 10.0.0.2.12345: UDP, length 16
13:12:20.356124 IP 10.0.0.8.12345 > 10.0.0.2.12345: UDP, length 16
13:12:20.356721 IP 10.0.0.8.12345 > 10.0.0.2.12345: UDP, length 16
13:12:20.357288 IP 10.0.0.8.12345 > 10.0.0.2.12345: UDP, length 16
13:12:20.357848 IP 10.0.0.8.12345 > 10.0.0.2.12345: UDP, length 16
13:12:20.358427 IP 10.0.0.8.12345 > 10.0.0.2.12345: UDP, length 16
13:12:20.359022 IP 10.0.0.8.12345 > 10.0.0.2.12345: UDP, length 16
13:12:20.359611 IP 10.0.0.8.12345 > 10.0.0.2.12345: UDP, length 16
13:12:20.360201 IP 10.0.0.8.12345 > 10.0.0.2.12345: UDP, length 16
13:12:20.360789 IP 10.0.0.8.12345 > 10.0.0.2.12345: UDP, length 16
13:12:20.361377 IP 10.0.0.8.12345 > 10.0.0.2.12345: UDP, length 16
13:12:20.361965 IP 10.0.0.8.12345 > 10.0.0.2.12345: UDP, length 16
13:12:20.362543 IP 10.0.0.8.12345 > 10.0.0.2.12345: UDP, length 16
13:12:20.363118 IP 10.0.0.8.12345 > 10.0.0.2.12345: UDP, length 16
13:12:20.363704 IP 10.0.0.8.12345 > 10.0.0.2.12345: UDP, length 16
13:12:20.364307 IP 10.0.0.8.12345 > 10.0.0.2.12345: UDP, length 16
13:12:20.364922 IP 10.0.0.8.12345 > 10.0.0.2.12345: UDP, length 16
13:12:20.365536 IP 10.0.0.8.12345 > 10.0.0.2.12345: UDP, length 16
13:12:20.366149 IP 10.0.0.8.12345 > 10.0.0.2.12345: UDP, length 16
13:12:20.366762 IP 10.0.0.8.12345 > 10.0.0.2.12345: UDP, length 16
13:12:20.367375 IP 10.0.0.8.12345 > 10.0.0.2.12345: UDP, length 16
13:12:20.367988 IP 10.0.0.8.12345 > 10.0.0.2.12345: UDP, length 16
13:12:20.368601 IP 10.0.0.8.12345 > 10.0.0.2.12345: UDP, length 16
13:12:20.369215 IP 10.0.0.8.12345 > 10.0.0.2.12345: UDP, length 16
13:12:20.369818 IP 10.0.0.8.12345 > 10.0.0.2.12345: UDP, length 16
13:12:20.370433 IP 10.0.0.8.12345 > 10.0.0.2.12345: UDP, length 16
13:12:20.371037 IP 10.0.0.8.12345 > 10.0.0.2.12345: UDP, length 16
13:12:20.371634 IP 10.0.0.8.12345 > 10.0.0.2.12345: UDP, length 16
13:12:20.372208 IP 10.0.0.8.12345 > 10.0.0.2.12345: UDP, length 16
13:12:20.372789 IP 10.0.0.8.12345 > 10.0.0.2.12345: UDP, length 16
13:12:20.373377 IP 10.0.0.8.12345 > 10.0.0.2.12345: UDP, length 16
13:12:20.373961 IP 10.0.0.8.12345 > 10.0.0.2.12345: UDP, length 16
13:12:20.374542 IP 10.0.0.8.12345 > 10.0.0.2.12345: UDP, length 16
13:12:20.375145 IP 10.0.0.8.12345 > 10.0.0.2.12345: UDP, length 16
13:12:20.375735 IP 10.0.0.8.12345 > 10.0.0.2.12345: UDP, length 16
13:12:20.376337 IP 10.0.0.8.12345 > 10.0.0.2.12345: UDP, length 16
13:12:20.376929 IP 10.0.0.8.12345 > 10.0.0.2.12345: UDP, length 16
13:12:20.377539 IP 10.0.0.8.12345 > 10.0.0.2.12345: UDP, length 16
13:12:20.378153 IP 10.0.0.8.12345 > 10.0.0.2.12345: UDP, length 16
13:12:20.378753 IP 10.0.0.8.12345 > 10.0.0.2.12345: UDP, length 16
13:12:20.379352 IP 10.0.0.8.12345 > 10.0.0.2.12345: UDP, length 16
13:12:20.379935 IP 10.0.0.8.12345 > 10.0.0.2.12345: UDP, length 16
13:12:20.380516 IP 10.0.0.8.12345 > 10.0.0.2.12345: UDP, length 16
13:12:20.381128 IP 10.0.0.8.12345 > 10.0.0.2.12345: UDP, length 16
13:12:20.381739 IP 10.0.0.8.12345 > 10.0.0.2.12345: UDP, length 16
13:12:20.382351 IP 10.0.0.8.12345 > 10.0.0.2.12345: UDP, length 16
13:12:20.382962 IP 10.0.0.8.12345 > 10.0.0.2.12345: UDP, length 16
13:12:20.383574 IP 10.0.0.8.12345 > 10.0.0.2.12345: UDP, length 16
13:12:20.384169 IP 10.0.0.8.12345 > 10.0.0.2.12345: UDP, length 16
13:12:20.384780 IP 10.0.0.8.12345 > 10.0.0.2.12345: UDP, length 16
13:12:20.385409 IP 10.0.0.8.12345 > 10.0.0.2.12345: UDP, length 16
13:12:20.386021 IP 10.0.0.8.12345 > 10.0.0.2.12345: UDP, length 16
13:12:20.386624 IP 10.0.0.8.12345 > 10.0.0.2.12345: UDP, length 16
13:12:20.387205 IP 10.0.0.8.12345 > 10.0.0.2.12345: UDP, length 16
13:12:20.387789 IP 10.0.0.8.12345 > 10.0.0.2.12345: UDP, length 16
13:12:20.388371 IP 10.0.0.8.12345 > 10.0.0.2.12345: UDP, length 16
13:12:20.388965 IP 10.0.0.8.12345 > 10.0.0.2.12345: UDP, length 16
13:12:20.389559 IP 10.0.0.8.12345 > 10.0.0.2.12345: UDP, length 16
13:12:20.390144 IP 10.0.0.8.12345 > 10.0.0.2.12345: UDP, length 16
13:12:20.390716 IP 10.0.0.8.12345 > 10.0.0.2.12345: UDP, length 16
13:12:20.391301 IP 10.0.0.8.12345 > 10.0.0.2.12345: UDP, length 16
13:12:20.391885 IP 10.0.0.8.12345 > 10.0.0.2.12345: UDP, length 16
13:12:20.392458 IP 10.0.0.8.12345 > 10.0.0.2.12345: UDP, length 16
13:12:20.393038 IP 10.0.0.8.12345 > 10.0.0.2.12345: UDP, length 16
13:12:20.393615 IP 10.0.0.8.12345 > 10.0.0.2.12345: UDP, length 16
13:12:20.394216 IP 10.0.0.8.12345 > 10.0.0.2.12345: UDP, length 16
13:12:20.394806 IP 10.0.0.8.12345 > 10.0.0.2.12345: UDP, length 16
13:12:20.395400 IP 10.0.0.8.12345 > 10.0.0.2.12345: UDP, length 16
13:12:20.395981 IP 10.0.0.8.12345 > 10.0.0.2.12345: UDP, length 16
13:12:20.396574 IP 10.0.0.8.12345 > 10.0.0.2.12345: UDP, length 16
13:12:20.397179 IP 10.0.0.8.12345 > 10.0.0.2.12345: UDP, length 16
13:12:20.397782 IP 10.0.0.8.12345 > 10.0.0.2.12345: UDP, length 16
13:12:20.398364 IP 10.0.0.8.12345 > 10.0.0.2.12345: UDP, length 16
13:12:20.398969 IP 10.0.0.8.12345 > 10.0.0.2.12345: UDP, length 16
13:12:20.399572 IP 10.0.0.8.12345 > 10.0.0.2.12345: UDP, length 16
13:12:20.400177 IP 10.0.0.8.12345 > 10.0.0.2.12345: UDP, length 16
13:12:20.400765 IP 10.0.0.8.12345 > 10.0.0.2.12345: UDP, length 16
13:12:20.401351 IP 10.0.0.8.12345 > 10.0.0.2.12345: UDP, length 16
13:12:20.401941 IP 10.0.0.8.12345 > 10.0.0.2.12345: UDP, length 16
13:12:20.402533 IP 10.0.0.8.12345 > 10.0.0.2.12345: UDP, length 16
13:12:20.403108 IP 10.0.0.8.12345 > 10.0.0.2.12345: UDP, length 16
13:12:20.403731 IP 10.0.0.8.12345 > 10.0.0.2.12345: UDP, length 16
13:12:20.404322 IP 10.0.0.8.12345 > 10.0.0.2.12345: UDP, length 16
13:12:20.404896 IP 10.0.0.8.12345 > 10.0.0.2.12345: UDP, length 16
13:12:20.405478 IP 10.0.0.8.12345 > 10.0.0.2.12345: UDP, length 16
13:12:20.406074 IP 10.0.0.8.12345 > 10.0.0.2.12345: UDP, length 16
13:12:20.406661 IP 10.0.0.8.12345 > 10.0.0.2.12345: UDP, length 16
13:12:20.407235 IP 10.0.0.8.12345 > 10.0.0.2.12345: UDP, length 16
13:12:20.407807 IP 10.0.0.8.12345 > 10.0.0.2.12345: UDP, length 16
13:12:20.408376 IP 10.0.0.8.12345 > 10.0.0.2.12345: UDP, length 16
13:12:20.408935 IP 10.0.0.8.12345 > 10.0.0.2.12345: UDP, length 16
13:12:20.409515 IP 10.0.0.8.12345 > 10.0.0.2.12345: UDP, length 16
13:12:20.410094 IP 10.0.0.8.12345 > 10.0.0.2.12345: UDP, length 16
13:12:20.410659 IP 10.0.0.8.12345 > 10.0.0.2.12345: UDP, length 16
13:12:20.411234 IP 10.0.0.8.12345 > 10.0.0.2.12345: UDP, length 16
13:12:20.411811 IP 10.0.0.8.12345 > 10.0.0.2.12345: UDP, length 16
13:12:20.412406 IP 10.0.0.8.12345 > 10.0.0.2.12345: UDP, length 16
13:12:20.413000 IP 10.0.0.8.12345 > 10.0.0.2.12345: UDP, length 16
13:12:20.413593 IP 10.0.0.8.12345 > 10.0.0.2.12345: UDP, length 16
13:12:20.414187 IP 10.0.0.8.12345 > 10.0.0.2.12345: UDP, length 16
13:12:20.414780 IP 10.0.0.8.12345 > 10.0.0.2.12345: UDP, length 16
13:12:20.415373 IP 10.0.0.8.12345 > 10.0.0.2.12345: UDP, length 16
13:12:20.415977 IP 10.0.0.8.12345 > 10.0.0.2.12345: UDP, length 16
13:12:20.416579 IP 10.0.0.8.12345 > 10.0.0.2.12345: UDP, length 16
13:12:20.417184 IP 10.0.0.8.12345 > 10.0.0.2.12345: UDP, length 16
13:12:20.417787 IP 10.0.0.8.12345 > 10.0.0.2.12345: UDP, length 16
13:12:20.418390 IP 10.0.0.8.12345 > 10.0.0.2.12345: UDP, length 16
13:12:20.418977 IP 10.0.0.8.12345 > 10.0.0.2.12345: UDP, length 16
13:12:20.419560 IP 10.0.0.8.12345 > 10.0.0.2.12345: UDP, length 16
13:12:20.420155 IP 10.0.0.8.12345 > 10.0.0.2.12345: UDP, length 16
13:12:20.420736 IP 10.0.0.8.12345 > 10.0.0.2.12345: UDP, length 16
13:12:20.421314 IP 10.0.0.8.12345 > 10.0.0.2.12345: UDP, length 16
13:12:20.421890 IP 10.0.0.8.12345 > 10.0.0.2.12345: UDP, length 16
13:12:20.422468 IP 10.0.0.8.12345 > 10.0.0.2.12345: UDP, length 16
13:12:20.423060 IP 10.0.0.8.12345 > 10.0.0.2.12345: UDP, length 16
13:12:20.423644 IP 10.0.0.8.12345 > 10.0.0.2.12345: UDP, length 16
13:12:20.424224 IP 10.0.0.8.12345 > 10.0.0.2.12345: UDP, length 16
13:12:20.424819 IP 10.0.0.8.12345 > 10.0.0.2.12345: UDP, length 16
13:12:20.425426 IP 10.0.0.8.12345 > 10.0.0.2.12345: UDP, length 16
13:12:20.426027 IP 10.0.0.8.12345 > 10.0.0.2.12345: UDP, length 16
13:12:20.426618 IP 10.0.0.8.12345 > 10.0.0.2.12345: UDP, length 16
13:12:20.427225 IP 10.0.0.8.12345 > 10.0.0.2.12345: UDP, length 16
13:12:20.427797 IP 10.0.0.8.12345 > 10.0.0.2.12345: UDP, length 16
13:12:20.428396 IP 10.0.0.8.12345 > 10.0.0.2.12345: UDP, length 16
13:12:20.428987 IP 10.0.0.8.12345 > 10.0.0.2.12345: UDP, length 16
13:12:20.429594 IP 10.0.0.8.12345 > 10.0.0.2.12345: UDP, length 16
13:12:20.430202 IP 10.0.0.8.12345 > 10.0.0.2.12345: UDP, length 16
13:12:20.430809 IP 10.0.0.8.12345 > 10.0.0.2.12345: UDP, length 16
13:12:20.431409 IP 10.0.0.8.12345 > 10.0.0.2.12345: UDP, length 16
13:12:20.432005 IP 10.0.0.8.12345 > 10.0.0.2.12345: UDP, length 16
13:12:20.432621 IP 10.0.0.8.12345 > 10.0.0.2.12345: UDP, length 16
13:12:20.433236 IP 10.0.0.8.12345 > 10.0.0.2.12345: UDP, length 16
13:12:20.433853 IP 10.0.0.8.12345 > 10.0.0.2.12345: UDP, length 16
13:12:20.434469 IP 10.0.0.8.12345 > 10.0.0.2.12345: UDP, length 16
13:12:20.435086 IP 10.0.0.8.12345 > 10.0.0.2.12345: UDP, length 16
13:12:20.435717 IP 10.0.0.8.12345 > 10.0.0.2.12345: UDP, length 16
13:12:20.436299 IP 10.0.0.8.12345 > 10.0.0.2.12345: UDP, length 16
13:12:20.436917 IP 10.0.0.8.12345 > 10.0.0.2.12345: UDP, length 16
13:12:20.437531 IP 10.0.0.8.12345 > 10.0.0.2.12345: UDP, length 16
13:12:20.438127 IP 10.0.0.8.12345 > 10.0.0.2.12345: UDP, length 16
13:12:20.438739 IP 10.0.0.8.12345 > 10.0.0.2.12345: UDP, length 16
13:12:20.439329 IP 10.0.0.8.12345 > 10.0.0.2.12345: UDP, length 16
13:12:20.439916 IP 10.0.0.8.12345 > 10.0.0.2.12345: UDP, length 16
13:12:20.440508 IP 10.0.0.8.12345 > 10.0.0.2.12345: UDP, length 16
13:12:20.441106 IP 10.0.0.8.12345 > 10.0.0.2.12345: UDP, length 16
13:12:20.441681 IP 10.0.0.8.12345 > 10.0.0.2.12345: UDP, length 16
13:12:20.442283 IP 10.0.0.8.12345 > 10.0.0.2.12345: UDP, length 16
13:12:20.442882 IP 10.0.0.8.12345 > 10.0.0.2.12345: UDP, length 16
13:12:20.443483 IP 10.0.0.8.12345 > 10.0.0.2.12345: UDP, length 16
13:12:20.444085 IP 10.0.0.8.12345 > 10.0.0.2.12345: UDP, length 16
13:12:20.444717 IP 10.0.0.8.12345 > 10.0.0.2.12345: UDP, length 16
13:12:20.445359 IP 10.0.0.8.12345 > 10.0.0.2.12345: UDP, length 16
13:12:20.445993 IP 10.0.0.8.12345 > 10.0.0.2.12345: UDP, length 16
13:12:20.446626 IP 10.0.0.8.12345 > 10.0.0.2.12345: UDP, length 16
13:12:20.447259 IP 10.0.0.8.12345 > 10.0.0.2.12345: UDP, length 16
13:12:20.447870 IP 10.0.0.8.12345 > 10.0.0.2.12345: UDP, length 16
13:12:20.448486 IP 10.0.0.8.12345 > 10.0.0.2.12345: UDP, length 16
13:12:20.449079 IP 10.0.0.8.12345 > 10.0.0.2.12345: UDP, length 16
13:12:20.449697 IP 10.0.0.8.12345 > 10.0.0.2.12345: UDP, length 16
13:12:20.450311 IP 10.0.0.8.12345 > 10.0.0.2.12345: UDP, length 16
13:12:20.450926 IP 10.0.0.8.12345 > 10.0.0.2.12345: UDP, length 16
13:12:20.451541 IP 10.0.0.8.12345 > 10.0.0.2.12345: UDP, length 16
13:12:20.452156 IP 10.0.0.8.12345 > 10.0.0.2.12345: UDP, length 16
13:12:20.452732 IP 10.0.0.8.12345 > 10.0.0.2.12345: UDP, length 16
13:12:20.453336 IP 10.0.0.8.12345 > 10.0.0.2.12345: UDP, length 16
13:12:20.453953 IP 10.0.0.8.12345 > 10.0.0.2.12345: UDP, length 16
13:12:20.454568 IP 10.0.0.8.12345 > 10.0.0.2.12345: UDP, length 16
13:12:20.455185 IP 10.0.0.8.12345 > 10.0.0.2.12345: UDP, length 16
13:12:20.455830 IP 10.0.0.8.12345 > 10.0.0.2.12345: UDP, length 16
13:12:20.456424 IP 10.0.0.8.12345 > 10.0.0.2.12345: UDP, length 16
13:12:20.457012 IP 10.0.0.8.12345 > 10.0.0.2.12345: UDP, length 16
13:12:20.457626 IP 10.0.0.8.12345 > 10.0.0.2.12345: UDP, length 16
13:12:20.458247 IP 10.0.0.8.12345 > 10.0.0.2.12345: UDP, length 16
13:12:20.458839 IP 10.0.0.8.12345 > 10.0.0.2.12345: UDP, length 16
13:12:20.459446 IP 10.0.0.8.12345 > 10.0.0.2.12345: UDP, length 16
13:12:20.460037 IP 10.0.0.8.12345 > 10.0.0.2.12345: UDP, length 16
13:12:20.460639 IP 10.0.0.8.12345 > 10.0.0.2.12345: UDP, length 16
13:12:20.461279 IP 10.0.0.8.12345 > 10.0.0.2.12345: UDP, length 16
13:12:20.461919 IP 10.0.0.8.12345 > 10.0.0.2.12345: UDP, length 16
13:12:20.462571 IP 10.0.0.8.12345 > 10.0.0.2.12345: UDP, length 16
13:12:20.463214 IP 10.0.0.8.12345 > 10.0.0.2.12345: UDP, length 16
13:12:20.463832 IP 10.0.0.8.12345 > 10.0.0.2.12345: UDP, length 16
13:12:20.464474 IP 10.0.0.8.12345 > 10.0.0.2.12345: UDP, length 16
13:12:20.465089 IP 10.0.0.8.12345 > 10.0.0.2.12345: UDP, length 16
13:12:20.465729 IP 10.0.0.8.12345 > 10.0.0.2.12345: UDP, length 16
13:12:20.466369 IP 10.0.0.8.12345 > 10.0.0.2.12345: UDP, length 16
13:12:20.467007 IP 10.0.0.8.12345 > 10.0.0.2.12345: UDP, length 16
13:12:20.467647 IP 10.0.0.8.12345 > 10.0.0.2.12345: UDP, length 16
13:12:20.468287 IP 10.0.0.8.12345 > 10.0.0.2.12345: UDP, length 16
13:12:20.468926 IP 10.0.0.8.12345 > 10.0.0.2.12345: UDP, length 16
13:12:20.469553 IP 10.0.0.8.12345 > 10.0.0.2.12345: UDP, length 16
13:12:20.470205 IP 10.0.0.8.12345 > 10.0.0.2.12345: UDP, length 16
13:12:20.470851 IP 10.0.0.8.12345 > 10.0.0.2.12345: UDP, length 16
13:12:20.471467 IP 10.0.0.8.12345 > 10.0.0.2.12345: UDP, length 16
13:12:20.472070 IP 10.0.0.8.12345 > 10.0.0.2.12345: UDP, length 16
13:12:20.472687 IP 10.0.0.8.12345 > 10.0.0.2.12345: UDP, length 16
13:12:20.473310 IP 10.0.0.8.12345 > 10.0.0.2.12345: UDP, length 16
13:12:20.473935 IP 10.0.0.8.12345 > 10.0.0.2.12345: UDP, length 16
13:12:20.474561 IP 10.0.0.8.12345 > 10.0.0.2.12345: UDP, length 16
13:12:20.475160 IP 10.0.0.8.12345 > 10.0.0.2.12345: UDP, length 16
13:12:20.475757 IP 10.0.0.8.12345 > 10.0.0.2.12345: UDP, length 16
13:12:20.476362 IP 10.0.0.8.12345 > 10.0.0.2.12345: UDP, length 16
13:12:20.476965 IP 10.0.0.8.12345 > 10.0.0.2.12345: UDP, length 16
13:12:20.477608 IP 10.0.0.8.12345 > 10.0.0.2.12345: UDP, length 16
13:12:20.478235 IP 10.0.0.8.12345 > 10.0.0.2.12345: UDP, length 16
13:12:20.478881 IP 10.0.0.8.12345 > 10.0.0.2.12345: UDP, length 16
13:12:20.479525 IP 10.0.0.8.12345 > 10.0.0.2.12345: UDP, length 16
13:12:20.480172 IP 10.0.0.8.12345 > 10.0.0.2.12345: UDP, length 16
13:12:20.480817 IP 10.0.0.8.12345 > 10.0.0.2.12345: UDP, length 16
13:12:20.481461 IP 10.0.0.8.12345 > 10.0.0.2.12345: UDP, length 16
13:12:20.482106 IP 10.0.0.8.12345 > 10.0.0.2.12345: UDP, length 16
13:12:20.482749 IP 10.0.0.8.12345 > 10.0.0.2.12345: UDP, length 16
13:12:20.483394 IP 10.0.0.8.12345 > 10.0.0.2.12345: UDP, length 16
13:12:20.484052 IP 10.0.0.8.12345 > 10.0.0.2.12345: UDP, length 16
13:12:20.484695 IP 10.0.0.8.12345 > 10.0.0.2.12345: UDP, length 16
13:12:20.485340 IP 10.0.0.8.12345 > 10.0.0.2.12345: UDP, length 16
13:12:20.485984 IP 10.0.0.8.12345 > 10.0.0.2.12345: UDP, length 16
13:12:20.486612 IP 10.0.0.8.12345 > 10.0.0.2.12345: UDP, length 16
13:12:20.487243 IP 10.0.0.8.12345 > 10.0.0.2.12345: UDP, length 16
13:12:20.487869 IP 10.0.0.8.12345 > 10.0.0.2.12345: UDP, length 16
13:12:20.488477 IP 10.0.0.8.12345 > 10.0.0.2.12345: UDP, length 16
13:12:20.489064 IP 10.0.0.8.12345 > 10.0.0.2.12345: UDP, length 16
13:12:20.489654 IP 10.0.0.8.12345 > 10.0.0.2.12345: UDP, length 16
13:12:20.490278 IP 10.0.0.8.12345 > 10.0.0.2.12345: UDP, length 16
13:12:20.490903 IP 10.0.0.8.12345 > 10.0.0.2.12345: UDP, length 16
13:12:20.491504 IP 10.0.0.8.12345 > 10.0.0.2.12345: UDP, length 16
13:12:20.492117 IP 10.0.0.8.12345 > 10.0.0.2.12345: UDP, length 16
13:12:20.492761 IP 10.0.0.8.12345 > 10.0.0.2.12345: UDP, length 16
13:12:20.493406 IP 10.0.0.8.12345 > 10.0.0.2.12345: UDP, length 16
13:12:20.494052 IP 10.0.0.8.12345 > 10.0.0.2.12345: UDP, length 16
13:12:20.494698 IP 10.0.0.8.12345 > 10.0.0.2.12345: UDP, length 16
13:12:20.495323 IP 10.0.0.8.12345 > 10.0.0.2.12345: UDP, length 16
13:12:20.495950 IP 10.0.0.8.12345 > 10.0.0.2.12345: UDP, length 16
13:12:20.496574 IP 10.0.0.8.12345 > 10.0.0.2.12345: UDP, length 16
13:12:20.497198 IP 10.0.0.8.12345 > 10.0.0.2.12345: UDP, length 16
13:12:20.497822 IP 10.0.0.8.12345 > 10.0.0.2.12345: UDP, length 16
13:12:20.498446 IP 10.0.0.8.12345 > 10.0.0.2.12345: UDP, length 16
13:12:20.499070 IP 10.0.0.8.12345 > 10.0.0.2.12345: UDP, length 16
13:12:20.499740 IP 10.0.0.8.12345 > 10.0.0.2.12345: UDP, length 16
13:12:20.500364 IP 10.0.0.8.12345 > 10.0.0.2.12345: UDP, length 16
13:12:20.500988 IP 10.0.0.8.12345 > 10.0.0.2.12345: UDP, length 16
13:12:20.501611 IP 10.0.0.8.12345 > 10.0.0.2.12345: UDP, length 16
13:12:20.502237 IP 10.0.0.8.12345 > 10.0.0.2.12345: UDP, length 16
13:12:20.502865 IP 10.0.0.8.12345 > 10.0.0.2.12345: UDP, length 16
13:12:20.503490 IP 10.0.0.8.12345 > 10.0.0.2.12345: UDP, length 16
13:12:20.504117 IP 10.0.0.8.12345 > 10.0.0.2.12345: UDP, length 16
13:12:20.504740 IP 10.0.0.8.12345 > 10.0.0.2.12345: UDP, length 16
13:12:20.505365 IP 10.0.0.8.12345 > 10.0.0.2.12345: UDP, length 16
13:12:20.505963 IP 10.0.0.8.12345 > 10.0.0.2.12345: UDP, length 16
13:12:20.506597 IP 10.0.0.8.12345 > 10.0.0.2.12345: UDP, length 16
13:12:20.507224 IP 10.0.0.8.12345 > 10.0.0.2.12345: UDP, length 16
13:12:20.507821 IP 10.0.0.8.12345 > 10.0.0.2.12345: UDP, length 16
13:12:20.508418 IP 10.0.0.8.12345 > 10.0.0.2.12345: UDP, length 16
13:12:20.509023 IP 10.0.0.8.12345 > 10.0.0.2.12345: UDP, length 16
13:12:20.509618 IP 10.0.0.8.12345 > 10.0.0.2.12345: UDP, length 16
13:12:20.510213 IP 10.0.0.8.12345 > 10.0.0.2.12345: UDP, length 16
13:12:20.510807 IP 10.0.0.8.12345 > 10.0.0.2.12345: UDP, length 16
13:12:20.511400 IP 10.0.0.8.12345 > 10.0.0.2.12345: UDP, length 16
13:12:20.511995 IP 10.0.0.8.12345 > 10.0.0.2.12345: UDP, length 16
13:12:20.512590 IP 10.0.0.8.12345 > 10.0.0.2.12345: UDP, length 16
13:12:20.513183 IP 10.0.0.8.12345 > 10.0.0.2.12345: UDP, length 16
13:12:20.513776 IP 10.0.0.8.12345 > 10.0.0.2.12345: UDP, length 16
13:12:20.514409 IP 10.0.0.8.12345 > 10.0.0.2.12345: UDP, length 16
13:12:20.515063 IP 10.0.0.8.12345 > 10.0.0.2.12345: UDP, length 16
13:12:20.515724 IP 10.0.0.8.12345 > 10.0.0.2.12345: UDP, length 16
13:12:20.516384 IP 10.0.0.8.12345 > 10.0.0.2.12345: UDP, length 16
13:12:20.517038 IP 10.0.0.8.12345 > 10.0.0.2.12345: UDP, length 16
13:12:20.517693 IP 10.0.0.8.12345 > 10.0.0.2.12345: UDP, length 16
13:12:20.518345 IP 10.0.0.8.12345 > 10.0.0.2.12345: UDP, length 16
13:12:20.518991 IP 10.0.0.8.12345 > 10.0.0.2.12345: UDP, length 16
13:12:20.519609 IP 10.0.0.8.12345 > 10.0.0.2.12345: UDP, length 16
13:12:20.520218 IP 10.0.0.8.12345 > 10.0.0.2.12345: UDP, length 16
13:12:20.520806 IP 10.0.0.8.12345 > 10.0.0.2.12345: UDP, length 16
13:12:20.521424 IP 10.0.0.8.12345 > 10.0.0.2.12345: UDP, length 16
13:12:20.522085 IP 10.0.0.8.12345 > 10.0.0.2.12345: UDP, length 16
13:12:20.522716 IP 10.0.0.8.12345 > 10.0.0.2.12345: UDP, length 16
13:12:20.523341 IP 10.0.0.8.12345 > 10.0.0.2.12345: UDP, length 16
13:12:20.523962 IP 10.0.0.8.12345 > 10.0.0.2.12345: UDP, length 16
13:12:20.524565 IP 10.0.0.8.12345 > 10.0.0.2.12345: UDP, length 16
13:12:20.525166 IP 10.0.0.8.12345 > 10.0.0.2.12345: UDP, length 16
13:12:20.525808 IP 10.0.0.8.12345 > 10.0.0.2.12345: UDP, length 16
13:12:20.526455 IP 10.0.0.8.12345 > 10.0.0.2.12345: UDP, length 16
13:12:20.527088 IP 10.0.0.8.12345 > 10.0.0.2.12345: UDP, length 16
13:12:20.527695 IP 10.0.0.8.12345 > 10.0.0.2.12345: UDP, length 16
13:12:20.528284 IP 10.0.0.8.12345 > 10.0.0.2.12345: UDP, length 16
13:12:20.528870 IP 10.0.0.8.12345 > 10.0.0.2.12345: UDP, length 16
13:12:20.529488 IP 10.0.0.8.12345 > 10.0.0.2.12345: UDP, length 16
13:12:20.530108 IP 10.0.0.8.12345 > 10.0.0.2.12345: UDP, length 16
13:12:20.530726 IP 10.0.0.8.12345 > 10.0.0.2.12345: UDP, length 16
13:12:20.531347 IP 10.0.0.8.12345 > 10.0.0.2.12345: UDP, length 16
13:12:20.531968 IP 10.0.0.8.12345 > 10.0.0.2.12345: UDP, length 16
13:12:20.532609 IP 10.0.0.8.12345 > 10.0.0.2.12345: UDP, length 16
13:12:20.533243 IP 10.0.0.8.12345 > 10.0.0.2.12345: UDP, length 16
13:12:20.533880 IP 10.0.0.8.12345 > 10.0.0.2.12345: UDP, length 16
13:12:20.534516 IP 10.0.0.8.12345 > 10.0.0.2.12345: UDP, length 16
13:12:20.535151 IP 10.0.0.8.12345 > 10.0.0.2.12345: UDP, length 16
13:12:20.535773 IP 10.0.0.8.12345 > 10.0.0.2.12345: UDP, length 16
13:12:20.536399 IP 10.0.0.8.12345 > 10.0.0.2.12345: UDP, length 16
13:12:20.537019 IP 10.0.0.8.12345 > 10.0.0.2.12345: UDP, length 16
13:12:20.537657 IP 10.0.0.8.12345 > 10.0.0.2.12345: UDP, length 16
13:12:20.538295 IP 10.0.0.8.12345 > 10.0.0.2.12345: UDP, length 16
13:12:20.538934 IP 10.0.0.8.12345 > 10.0.0.2.12345: UDP, length 16
13:12:20.539573 IP 10.0.0.8.12345 > 10.0.0.2.12345: UDP, length 16
13:12:20.540195 IP 10.0.0.8.12345 > 10.0.0.2.12345: UDP, length 16
13:12:20.540827 IP 10.0.0.8.12345 > 10.0.0.2.12345: UDP, length 16
13:12:20.541429 IP 10.0.0.8.12345 > 10.0.0.2.12345: UDP, length 16
13:12:20.542025 IP 10.0.0.8.12345 > 10.0.0.2.12345: UDP, length 16
13:12:20.542618 IP 10.0.0.8.12345 > 10.0.0.2.12345: UDP, length 16
13:12:20.543254 IP 10.0.0.8.12345 > 10.0.0.2.12345: UDP, length 16
13:12:20.543857 IP 10.0.0.8.12345 > 10.0.0.2.12345: UDP, length 16
13:12:20.544457 IP 10.0.0.8.12345 > 10.0.0.2.12345: UDP, length 16
13:12:20.545093 IP 10.0.0.8.12345 > 10.0.0.2.12345: UDP, length 16
13:12:20.545731 IP 10.0.0.8.12345 > 10.0.0.2.12345: UDP, length 16
13:12:20.546369 IP 10.0.0.8.12345 > 10.0.0.2.12345: UDP, length 16
13:12:20.547007 IP 10.0.0.8.12345 > 10.0.0.2.12345: UDP, length 16
13:12:20.547644 IP 10.0.0.8.12345 > 10.0.0.2.12345: UDP, length 16
13:12:20.548271 IP 10.0.0.8.12345 > 10.0.0.2.12345: UDP, length 16
13:12:20.548911 IP 10.0.0.8.12345 > 10.0.0.2.12345: UDP, length 16
13:12:20.549553 IP 10.0.0.8.12345 > 10.0.0.2.12345: UDP, length 16
13:12:20.550195 IP 10.0.0.8.12345 > 10.0.0.2.12345: UDP, length 16
13:12:20.550837 IP 10.0.0.8.12345 > 10.0.0.2.12345: UDP, length 16
13:12:20.551481 IP 10.0.0.8.12345 > 10.0.0.2.12345: UDP, length 16
13:12:20.552122 IP 10.0.0.8.12345 > 10.0.0.2.12345: UDP, length 16
13:12:20.552760 IP 10.0.0.8.12345 > 10.0.0.2.12345: UDP, length 16
13:12:20.553386 IP 10.0.0.8.12345 > 10.0.0.2.12345: UDP, length 16
13:12:20.554012 IP 10.0.0.8.12345 > 10.0.0.2.12345: UDP, length 16
13:12:20.554641 IP 10.0.0.8.12345 > 10.0.0.2.12345: UDP, length 16
13:12:20.555268 IP 10.0.0.8.12345 > 10.0.0.2.12345: UDP, length 16
13:12:20.555866 IP 10.0.0.8.12345 > 10.0.0.2.12345: UDP, length 16
13:12:20.556483 IP 10.0.0.8.12345 > 10.0.0.2.12345: UDP, length 16
13:12:20.557088 IP 10.0.0.8.12345 > 10.0.0.2.12345: UDP, length 16
13:12:20.557687 IP 10.0.0.8.12345 > 10.0.0.2.12345: UDP, length 16
