13:23:33.396514 IP 10.0.0.13.12345 > 10.0.0.2.12345: UDP, length 16
13:23:33.397434 IP 10.0.0.13.12345 > 10.0.0.2.12345: UDP, length 16
13:23:33.398036 IP 10.0.0.13.12345 > 10.0.0.2.12345: UDP, length 16
13:23:33.398626 IP 10.0.0.13.12345 > 10.0.0.2.12345: UDP, length 16
13:23:33.399223 IP 10.0.0.13.12345 > 10.0.0.2.12345: UDP, length 16
13:23:33.399804 IP 10.0.0.13.12345 > 10.0.0.2.12345: UDP, length 16
13:23:33.400379 IP 10.0.0.13.12345 > 10.0.0.2.12345: UDP, length 16
13:23:33.400954 IP 10.0.0.13.12345 > 10.0.0.2.12345: UDP, length 16
13:23:33.401531 IP 10.0.0.13.12345 > 10.0.0.2.12345: UDP, length 16
13:23:33.402110 IP 10.0.0.13.12345 > 10.0.0.2.12345: UDP, length 16
13:23:33.402687 IP 10.0.0.13.12345 > 10.0.0.2.12345: UDP, length 16
13:23:33.403263 IP 10.0.0.13.12345 > 10.0.0.2.12345: UDP, length 16
13:23:33.403839 IP 10.0.0.13.12345 > 10.0.0.2.12345: UDP, length 16
13:23:33.404414 IP 10.0.0.13.12345 > 10.0.0.2.12345: UDP, length 16
13:23:33.404991 IP 10.0.0.13.12345 > 10.0.0.2.12345: UDP, length 16
13:23:33.405569 IP 10.0.0.13.12345 > 10.0.0.2.12345: UDP, length 16
13:23:33.406140 IP 10.0.0.13.12345 > 10.0.0.2.12345: UDP, length 16
13:23:33.406718 IP 10.0.0.13.12345 > 10.0.0.2.12345: UDP, length 16
13:23:33.407300 IP 10.0.0.13.12345 > 10.0.0.2.12345: UDP, length 16
13:23:33.407886 IP 10.0.0.13.12345 > 10.0.0.2.12345: UDP, length 16
13:23:33.408471 IP 10.0.0.13.12345 > 10.0.0.2.12345: UDP, length 16
13:23:33.409140 IP 10.0.0.13.12345 > 10.0.0.2.12345: UDP, length 16
13:23:33.409755 IP 10.0.0.13.12345 > 10.0.0.2.12345: UDP, length 16
13:23:33.410335 IP 10.0.0.13.12345 > 10.0.0.2.12345: UDP, length 16
13:23:33.410916 IP 10.0.0.13.12345 > 10.0.0.2.12345: UDP, length 16
13:23:33.411493 IP 10.0.0.13.12345 > 10.0.0.2.12345: UDP, length 16
13:23:33.412067 IP 10.0.0.13.12345 > 10.0.0.2.12345: UDP, length 16
13:23:33.412635 IP 10.0.0.13.12345 > 10.0.0.2.12345: UDP, length 16
13:23:33.413209 IP 10.0.0.13.12345 > 10.0.0.2.12345: UDP, length 16
13:23:33.413778 IP 10.0.0.13.12345 > 10.0.0.2.12345: UDP, length 16
13:23:33.414345 IP 10.0.0.13.12345 > 10.0.0.2.12345: UDP, length 16
13:23:33.414911 IP 10.0.0.13.12345 > 10.0.0.2.12345: UDP, length 16
13:23:33.415484 IP 10.0.0.13.12345 > 10.0.0.2.12345: UDP, length 16
13:23:33.416062 IP 10.0.0.13.12345 > 10.0.0.2.12345: UDP, length 16
13:23:33.416634 IP 10.0.0.13.12345 > 10.0.0.2.12345: UDP, length 16
13:23:33.417206 IP 10.0.0.13.12345 > 10.0.0.2.12345: UDP, length 16
13:23:33.417775 IP 10.0.0.13.12345 > 10.0.0.2.12345: UDP, length 16
13:23:33.418358 IP 10.0.0.13.12345 > 10.0.0.2.12345: UDP, length 16
13:23:33.418920 IP 10.0.0.13.12345 > 10.0.0.2.12345: UDP, length 16
13:23:33.419478 IP 10.0.0.13.12345 > 10.0.0.2.12345: UDP, length 16
13:23:33.420056 IP 10.0.0.13.12345 > 10.0.0.2.12345: UDP, length 16
13:23:33.420639 IP 10.0.0.13.12345 > 10.0.0.2.12345: UDP, length 16
13:23:33.421200 IP 10.0.0.13.12345 > 10.0.0.2.12345: UDP, length 16
13:23:33.421773 IP 10.0.0.13.12345 > 10.0.0.2.12345: UDP, length 16
13:23:33.422351 IP 10.0.0.13.12345 > 10.0.0.2.12345: UDP, length 16
13:23:33.422927 IP 10.0.0.13.12345 > 10.0.0.2.12345: UDP, length 16
13:23:33.423503 IP 10.0.0.13.12345 > 10.0.0.2.12345: UDP, length 16
13:23:33.424081 IP 10.0.0.13.12345 > 10.0.0.2.12345: UDP, length 16
13:23:33.424657 IP 10.0.0.13.12345 > 10.0.0.2.12345: UDP, length 16
13:23:33.425236 IP 10.0.0.13.12345 > 10.0.0.2.12345: UDP, length 16
13:23:33.425831 IP 10.0.0.13.12345 > 10.0.0.2.12345: UDP, length 16
13:23:33.426387 IP 10.0.0.13.12345 > 10.0.0.2.12345: UDP, length 16
13:23:33.426970 IP 10.0.0.13.12345 > 10.0.0.2.12345: UDP, length 16
13:23:33.427545 IP 10.0.0.13.12345 > 10.0.0.2.12345: UDP, length 16
13:23:33.428125 IP 10.0.0.13.12345 > 10.0.0.2.12345: UDP, length 16
13:23:33.428723 IP 10.0.0.13.12345 > 10.0.0.2.12345: UDP, length 16
13:23:33.429304 IP 10.0.0.13.12345 > 10.0.0.2.12345: UDP, length 16
13:23:33.429903 IP 10.0.0.13.12345 > 10.0.0.2.12345: UDP, length 16
13:23:33.430507 IP 10.0.0.13.12345 > 10.0.0.2.12345: UDP, length 16
13:23:33.431112 IP 10.0.0.13.12345 > 10.0.0.2.12345: UDP, length 16
13:23:33.431736 IP 10.0.0.13.12345 > 10.0.0.2.12345: UDP, length 16
13:23:33.432330 IP 10.0.0.13.12345 > 10.0.0.2.12345: UDP, length 16
13:23:33.432907 IP 10.0.0.13.12345 > 10.0.0.2.12345: UDP, length 16
13:23:33.433488 IP 10.0.0.13.12345 > 10.0.0.2.12345: UDP, length 16
13:23:33.434069 IP 10.0.0.13.12345 > 10.0.0.2.12345: UDP, length 16
13:23:33.434644 IP 10.0.0.13.12345 > 10.0.0.2.12345: UDP, length 16
13:23:33.435230 IP 10.0.0.13.12345 > 10.0.0.2.12345: UDP, length 16
13:23:33.435795 IP 10.0.0.13.12345 > 10.0.0.2.12345: UDP, length 16
13:23:33.436374 IP 10.0.0.13.12345 > 10.0.0.2.12345: UDP, length 16
13:23:33.436949 IP 10.0.0.13.12345 > 10.0.0.2.12345: UDP, length 16
13:23:33.437521 IP 10.0.0.13.12345 > 10.0.0.2.12345: UDP, length 16
13:23:33.438111 IP 10.0.0.13.12345 > 10.0.0.2.12345: UDP, length 16
13:23:33.438705 IP 10.0.0.13.12345 > 10.0.0.2.12345: UDP, length 16
13:23:33.439298 IP 10.0.0.13.12345 > 10.0.0.2.12345: UDP, length 16
13:23:33.439871 IP 10.0.0.13.12345 > 10.0.0.2.12345: UDP, length 16
13:23:33.440455 IP 10.0.0.13.12345 > 10.0.0.2.12345: UDP, length 16
13:23:33.441046 IP 10.0.0.13.12345 > 10.0.0.2.12345: UDP, length 16
13:23:33.441638 IP 10.0.0.13.12345 > 10.0.0.2.12345: UDP, length 16
13:23:33.442224 IP 10.0.0.13.12345 > 10.0.0.2.12345: UDP, length 16
13:23:33.442816 IP 10.0.0.13.12345 > 10.0.0.2.12345: UDP, length 16
13:23:33.443401 IP 10.0.0.13.12345 > 10.0.0.2.12345: UDP, length 16
13:23:33.443968 IP 10.0.0.13.12345 > 10.0.0.2.12345: UDP, length 16
13:23:33.444533 IP 10.0.0.13.12345 > 10.0.0.2.12345: UDP, length 16
13:23:33.445099 IP 10.0.0.13.12345 > 10.0.0.2.12345: UDP, length 16
13:23:33.445658 IP 10.0.0.13.12345 > 10.0.0.2.12345: UDP, length 16
13:23:33.446215 IP 10.0.0.13.12345 > 10.0.0.2.12345: UDP, length 16
13:23:33.446791 IP 10.0.0.13.12345 > 10.0.0.2.12345: UDP, length 16
13:23:33.447362 IP 10.0.0.13.12345 > 10.0.0.2.12345: UDP, length 16
13:23:33.447935 IP 10.0.0.13.12345 > 10.0.0.2.12345: UDP, length 16
13:23:33.448509 IP 10.0.0.13.12345 > 10.0.0.2.12345: UDP, length 16
13:23:33.449082 IP 10.0.0.13.12345 > 10.0.0.2.12345: UDP, length 16
13:23:33.449654 IP 10.0.0.13.12345 > 10.0.0.2.12345: UDP, length 16
13:23:33.450224 IP 10.0.0.13.12345 > 10.0.0.2.12345: UDP, length 16
13:23:33.450792 IP 10.0.0.13.12345 > 10.0.0.2.12345: UDP, length 16
13:23:33.451369 IP 10.0.0.13.12345 > 10.0.0.2.12345: UDP, length 16
13:23:33.451973 IP 10.0.0.13.12345 > 10.0.0.2.12345: UDP, length 16
13:23:33.452596 IP 10.0.0.13.12345 > 10.0.0.2.12345: UDP, length 16
13:23:33.453197 IP 10.0.0.13.12345 > 10.0.0.2.12345: UDP, length 16
13:23:33.453775 IP 10.0.0.13.12345 > 10.0.0.2.12345: UDP, length 16
13:23:33.454353 IP 10.0.0.13.12345 > 10.0.0.2.12345: UDP, length 16
13:23:33.454937 IP 10.0.0.13.12345 > 10.0.0.2.12345: UDP, length 16
13:23:33.455519 IP 10.0.0.13.12345 > 10.0.0.2.12345: UDP, length 16
13:23:33.456099 IP 10.0.0.13.12345 > 10.0.0.2.12345: UDP, length 16
13:23:33.456678 IP 10.0.0.13.12345 > 10.0.0.2.12345: UDP, length 16
13:23:33.457259 IP 10.0.0.13.12345 > 10.0.0.2.12345: UDP, length 16
13:23:33.457834 IP 10.0.0.13.12345 > 10.0.0.2.12345: UDP, length 16
13:23:33.458424 IP 10.0.0.13.12345 > 10.0.0.2.12345: UDP, length 16
13:23:33.459004 IP 10.0.0.13.12345 > 10.0.0.2.12345: UDP, length 16
13:23:33.459581 IP 10.0.0.13.12345 > 10.0.0.2.12345: UDP, length 16
13:23:33.460164 IP 10.0.0.13.12345 > 10.0.0.2.12345: UDP, length 16
13:23:33.460734 IP 10.0.0.13.12345 > 10.0.0.2.12345: UDP, length 16
13:23:33.461308 IP 10.0.0.13.12345 > 10.0.0.2.12345: UDP, length 16
13:23:33.461882 IP 10.0.0.13.12345 > 10.0.0.2.12345: UDP, length 16
13:23:33.462471 IP 10.0.0.13.12345 > 10.0.0.2.12345: UDP, length 16
13:23:33.463061 IP 10.0.0.13.12345 > 10.0.0.2.12345: UDP, length 16
13:23:33.463638 IP 10.0.0.13.12345 > 10.0.0.2.12345: UDP, length 16
13:23:33.464212 IP 10.0.0.13.12345 > 10.0.0.2.12345: UDP, length 16
13:23:33.464781 IP 10.0.0.13.12345 > 10.0.0.2.12345: UDP, length 16
13:23:33.465361 IP 10.0.0.13.12345 > 10.0.0.2.12345: UDP, length 16
13:23:33.465937 IP 10.0.0.13.12345 > 10.0.0.2.12345: UDP, length 16
13:23:33.466515 IP 10.0.0.13.12345 > 10.0.0.2.12345: UDP, length 16
13:23:33.467088 IP 10.0.0.13.12345 > 10.0.0.2.12345: UDP, length 16
13:23:33.467674 IP 10.0.0.13.12345 > 10.0.0.2.12345: UDP, length 16
13:23:33.468247 IP 10.0.0.13.12345 > 10.0.0.2.12345: UDP, length 16
13:23:33.468816 IP 10.0.0.13.12345 > 10.0.0.2.12345: UDP, length 16
13:23:33.469383 IP 10.0.0.13.12345 > 10.0.0.2.12345: UDP, length 16
13:23:33.469953 IP 10.0.0.13.12345 > 10.0.0.2.12345: UDP, length 16
13:23:33.470524 IP 10.0.0.13.12345 > 10.0.0.2.12345: UDP, length 16
13:23:33.471103 IP 10.0.0.13.12345 > 10.0.0.2.12345: UDP, length 16
13:23:33.471709 IP 10.0.0.13.12345 > 10.0.0.2.12345: UDP, length 16
13:23:33.472296 IP 10.0.0.13.12345 > 10.0.0.2.12345: UDP, length 16
13:23:33.472881 IP 10.0.0.13.12345 > 10.0.0.2.12345: UDP, length 16
13:23:33.473466 IP 10.0.0.13.12345 > 10.0.0.2.12345: UDP, length 16
13:23:33.474054 IP 10.0.0.13.12345 > 10.0.0.2.12345: UDP, length 16
13:23:33.474631 IP 10.0.0.13.12345 > 10.0.0.2.12345: UDP, length 16
13:23:33.475200 IP 10.0.0.13.12345 > 10.0.0.2.12345: UDP, length 16
13:23:33.475776 IP 10.0.0.13.12345 > 10.0.0.2.12345: UDP, length 16
13:23:33.476360 IP 10.0.0.13.12345 > 10.0.0.2.12345: UDP, length 16
13:23:33.476931 IP 10.0.0.13.12345 > 10.0.0.2.12345: UDP, length 16
13:23:33.477518 IP 10.0.0.13.12345 > 10.0.0.2.12345: UDP, length 16
13:23:33.478089 IP 10.0.0.13.12345 > 10.0.0.2.12345: UDP, length 16
13:23:33.478661 IP 10.0.0.13.12345 > 10.0.0.2.12345: UDP, length 16
13:23:33.479232 IP 10.0.0.13.12345 > 10.0.0.2.12345: UDP, length 16
13:23:33.479800 IP 10.0.0.13.12345 > 10.0.0.2.12345: UDP, length 16
13:23:33.480378 IP 10.0.0.13.12345 > 10.0.0.2.12345: UDP, length 16
13:23:33.480952 IP 10.0.0.13.12345 > 10.0.0.2.12345: UDP, length 16
13:23:33.481518 IP 10.0.0.13.12345 > 10.0.0.2.12345: UDP, length 16
13:23:33.482092 IP 10.0.0.13.12345 > 10.0.0.2.12345: UDP, length 16
13:23:33.482666 IP 10.0.0.13.12345 > 10.0.0.2.12345: UDP, length 16
13:23:33.483238 IP 10.0.0.13.12345 > 10.0.0.2.12345: UDP, length 16
13:23:33.483807 IP 10.0.0.13.12345 > 10.0.0.2.12345: UDP, length 16
13:23:33.484384 IP 10.0.0.13.12345 > 10.0.0.2.12345: UDP, length 16
13:23:33.484961 IP 10.0.0.13.12345 > 10.0.0.2.12345: UDP, length 16
13:23:33.485537 IP 10.0.0.13.12345 > 10.0.0.2.12345: UDP, length 16
13:23:33.486111 IP 10.0.0.13.12345 > 10.0.0.2.12345: UDP, length 16
13:23:33.486684 IP 10.0.0.13.12345 > 10.0.0.2.12345: UDP, length 16
13:23:33.487256 IP 10.0.0.13.12345 > 10.0.0.2.12345: UDP, length 16
13:23:33.487820 IP 10.0.0.13.12345 > 10.0.0.2.12345: UDP, length 16
13:23:33.488410 IP 10.0.0.13.12345 > 10.0.0.2.12345: UDP, length 16
13:23:33.489001 IP 10.0.0.13.12345 > 10.0.0.2.12345: UDP, length 16
13:23:33.489592 IP 10.0.0.13.12345 > 10.0.0.2.12345: UDP, length 16
13:23:33.490183 IP 10.0.0.13.12345 > 10.0.0.2.12345: UDP, length 16
13:23:33.490757 IP 10.0.0.13.12345 > 10.0.0.2.12345: UDP, length 16
13:23:33.491344 IP 10.0.0.13.12345 > 10.0.0.2.12345: UDP, length 16
13:23:33.491936 IP 10.0.0.13.12345 > 10.0.0.2.12345: UDP, length 16
13:23:33.492524 IP 10.0.0.13.12345 > 10.0.0.2.12345: UDP, length 16
13:23:33.493110 IP 10.0.0.13.12345 > 10.0.0.2.12345: UDP, length 16
13:23:33.493711 IP 10.0.0.13.12345 > 10.0.0.2.12345: UDP, length 16
13:23:33.494296 IP 10.0.0.13.12345 > 10.0.0.2.12345: UDP, length 16
13:23:33.494877 IP 10.0.0.13.12345 > 10.0.0.2.12345: UDP, length 16
13:23:33.495460 IP 10.0.0.13.12345 > 10.0.0.2.12345: UDP, length 16
13:23:33.496045 IP 10.0.0.13.12345 > 10.0.0.2.12345: UDP, length 16
13:23:33.496629 IP 10.0.0.13.12345 > 10.0.0.2.12345: UDP, length 16
13:23:33.497206 IP 10.0.0.13.12345 > 10.0.0.2.12345: UDP, length 16
13:23:33.497784 IP 10.0.0.13.12345 > 10.0.0.2.12345: UDP, length 16
13:23:33.498355 IP 10.0.0.13.12345 > 10.0.0.2.12345: UDP, length 16
13:23:33.498934 IP 10.0.0.13.12345 > 10.0.0.2.12345: UDP, length 16
13:23:33.499514 IP 10.0.0.13.12345 > 10.0.0.2.12345: UDP, length 16
13:23:33.500113 IP 10.0.0.13.12345 > 10.0.0.2.12345: UDP, length 16
13:23:33.500705 IP 10.0.0.13.12345 > 10.0.0.2.12345: UDP, length 16
13:23:33.501297 IP 10.0.0.13.12345 > 10.0.0.2.12345: UDP, length 16
13:23:33.501888 IP 10.0.0.13.12345 > 10.0.0.2.12345: UDP, length 16
13:23:33.502502 IP 10.0.0.13.12345 > 10.0.0.2.12345: UDP, length 16
13:23:33.503117 IP 10.0.0.13.12345 > 10.0.0.2.12345: UDP, length 16
13:23:33.503734 IP 10.0.0.13.12345 > 10.0.0.2.12345: UDP, length 16
13:23:33.504347 IP 10.0.0.13.12345 > 10.0.0.2.12345: UDP, length 16
13:23:33.504959 IP 10.0.0.13.12345 > 10.0.0.2.12345: UDP, length 16
13:23:33.505572 IP 10.0.0.13.12345 > 10.0.0.2.12345: UDP, length 16
13:23:33.506183 IP 10.0.0.13.12345 > 10.0.0.2.12345: UDP, length 16
13:23:33.506778 IP 10.0.0.13.12345 > 10.0.0.2.12345: UDP, length 16
13:23:33.507376 IP 10.0.0.13.12345 > 10.0.0.2.12345: UDP, length 16
13:23:33.507963 IP 10.0.0.13.12345 > 10.0.0.2.12345: UDP, length 16
13:23:33.508564 IP 10.0.0.13.12345 > 10.0.0.2.12345: UDP, length 16
13:23:33.509158 IP 10.0.0.13.12345 > 10.0.0.2.12345: UDP, length 16
13:23:33.509751 IP 10.0.0.13.12345 > 10.0.0.2.12345: UDP, length 16
13:23:33.510359 IP 10.0.0.13.12345 > 10.0.0.2.12345: UDP, length 16
13:23:33.510940 IP 10.0.0.13.12345 > 10.0.0.2.12345: UDP, length 16
13:23:33.511535 IP 10.0.0.13.12345 > 10.0.0.2.12345: UDP, length 16
13:23:33.512125 IP 10.0.0.13.12345 > 10.0.0.2.12345: UDP, length 16
13:23:33.512711 IP 10.0.0.13.12345 > 10.0.0.2.12345: UDP, length 16
13:23:33.513299 IP 10.0.0.13.12345 > 10.0.0.2.12345: UDP, length 16
13:23:33.513914 IP 10.0.0.13.12345 > 10.0.0.2.12345: UDP, length 16
13:23:33.514527 IP 10.0.0.13.12345 > 10.0.0.2.12345: UDP, length 16
13:23:33.515128 IP 10.0.0.13.12345 > 10.0.0.2.12345: UDP, length 16
13:23:33.515712 IP 10.0.0.13.12345 > 10.0.0.2.12345: UDP, length 16
13:23:33.516294 IP 10.0.0.13.12345 > 10.0.0.2.12345: UDP, length 16
13:23:33.516903 IP 10.0.0.13.12345 > 10.0.0.2.12345: UDP, length 16
13:23:33.517493 IP 10.0.0.13.12345 > 10.0.0.2.12345: UDP, length 16
13:23:33.518077 IP 10.0.0.13.12345 > 10.0.0.2.12345: UDP, length 16
13:23:33.518659 IP 10.0.0.13.12345 > 10.0.0.2.12345: UDP, length 16
13:23:33.519242 IP 10.0.0.13.12345 > 10.0.0.2.12345: UDP, length 16
13:23:33.519817 IP 10.0.0.13.12345 > 10.0.0.2.12345: UDP, length 16
13:23:33.520401 IP 10.0.0.13.12345 > 10.0.0.2.12345: UDP, length 16
13:23:33.521014 IP 10.0.0.13.12345 > 10.0.0.2.12345: UDP, length 16
13:23:33.521626 IP 10.0.0.13.12345 > 10.0.0.2.12345: UDP, length 16
13:23:33.522239 IP 10.0.0.13.12345 > 10.0.0.2.12345: UDP, length 16
13:23:33.522841 IP 10.0.0.13.12345 > 10.0.0.2.12345: UDP, length 16
13:23:33.523444 IP 10.0.0.13.12345 > 10.0.0.2.12345: UDP, length 16
13:23:33.524033 IP 10.0.0.13.12345 > 10.0.0.2.12345: UDP, length 16
13:23:33.524617 IP 10.0.0.13.12345 > 10.0.0.2.12345: UDP, length 16
13:23:33.525231 IP 10.0.0.13.12345 > 10.0.0.2.12345: UDP, length 16
13:23:33.525845 IP 10.0.0.13.12345 > 10.0.0.2.12345: UDP, length 16
13:23:33.526463 IP 10.0.0.13.12345 > 10.0.0.2.12345: UDP, length 16
13:23:33.527084 IP 10.0.0.13.12345 > 10.0.0.2.12345: UDP, length 16
13:23:33.527755 IP 10.0.0.13.12345 > 10.0.0.2.12345: UDP, length 16
13:23:33.528365 IP 10.0.0.13.12345 > 10.0.0.2.12345: UDP, length 16
13:23:33.528998 IP 10.0.0.13.12345 > 10.0.0.2.12345: UDP, length 16
13:23:33.529595 IP 10.0.0.13.12345 > 10.0.0.2.12345: UDP, length 16
13:23:33.530182 IP 10.0.0.13.12345 > 10.0.0.2.12345: UDP, length 16
13:23:33.530764 IP 10.0.0.13.12345 > 10.0.0.2.12345: UDP, length 16
13:23:33.531337 IP 10.0.0.13.12345 > 10.0.0.2.12345: UDP, length 16
13:23:33.531928 IP 10.0.0.13.12345 > 10.0.0.2.12345: UDP, length 16
13:23:33.532532 IP 10.0.0.13.12345 > 10.0.0.2.12345: UDP, length 16
13:23:33.533138 IP 10.0.0.13.12345 > 10.0.0.2.12345: UDP, length 16
13:23:33.533736 IP 10.0.0.13.12345 > 10.0.0.2.12345: UDP, length 16
13:23:33.534328 IP 10.0.0.13.12345 > 10.0.0.2.12345: UDP, length 16
13:23:33.534933 IP 10.0.0.13.12345 > 10.0.0.2.12345: UDP, length 16
13:23:33.535537 IP 10.0.0.13.12345 > 10.0.0.2.12345: UDP, length 16
13:23:33.536126 IP 10.0.0.13.12345 > 10.0.0.2.12345: UDP, length 16
13:23:33.536729 IP 10.0.0.13.12345 > 10.0.0.2.12345: UDP, length 16
13:23:33.537334 IP 10.0.0.13.12345 > 10.0.0.2.12345: UDP, length 16
13:23:33.537938 IP 10.0.0.13.12345 > 10.0.0.2.12345: UDP, length 16
13:23:33.538527 IP 10.0.0.13.12345 > 10.0.0.2.12345: UDP, length 16
13:23:33.539103 IP 10.0.0.13.12345 > 10.0.0.2.12345: UDP, length 16
13:23:33.539731 IP 10.0.0.13.12345 > 10.0.0.2.12345: UDP, length 16
13:23:33.540318 IP 10.0.0.13.12345 > 10.0.0.2.12345: UDP, length 16
13:23:33.540903 IP 10.0.0.13.12345 > 10.0.0.2.12345: UDP, length 16
13:23:33.541504 IP 10.0.0.13.12345 > 10.0.0.2.12345: UDP, length 16
13:23:33.542100 IP 10.0.0.13.12345 > 10.0.0.2.12345: UDP, length 16
13:23:33.542704 IP 10.0.0.13.12345 > 10.0.0.2.12345: UDP, length 16
13:23:33.543307 IP 10.0.0.13.12345 > 10.0.0.2.12345: UDP, length 16
13:23:33.543888 IP 10.0.0.13.12345 > 10.0.0.2.12345: UDP, length 16
13:23:33.544482 IP 10.0.0.13.12345 > 10.0.0.2.12345: UDP, length 16
13:23:33.545067 IP 10.0.0.13.12345 > 10.0.0.2.12345: UDP, length 16
13:23:33.545660 IP 10.0.0.13.12345 > 10.0.0.2.12345: UDP, length 16
13:23:33.546250 IP 10.0.0.13.12345 > 10.0.0.2.12345: UDP, length 16
13:23:33.546841 IP 10.0.0.13.12345 > 10.0.0.2.12345: UDP, length 16
13:23:33.547430 IP 10.0.0.13.12345 > 10.0.0.2.12345: UDP, length 16
13:23:33.548018 IP 10.0.0.13.12345 > 10.0.0.2.12345: UDP, length 16
13:23:33.548582 IP 10.0.0.13.12345 > 10.0.0.2.12345: UDP, length 16
13:23:33.549168 IP 10.0.0.13.12345 > 10.0.0.2.12345: UDP, length 16
13:23:33.549733 IP 10.0.0.13.12345 > 10.0.0.2.12345: UDP, length 16
13:23:33.550319 IP 10.0.0.13.12345 > 10.0.0.2.12345: UDP, length 16
13:23:33.550905 IP 10.0.0.13.12345 > 10.0.0.2.12345: UDP, length 16
13:23:33.551493 IP 10.0.0.13.12345 > 10.0.0.2.12345: UDP, length 16
13:23:33.552082 IP 10.0.0.13.12345 > 10.0.0.2.12345: UDP, length 16
13:23:33.552703 IP 10.0.0.13.12345 > 10.0.0.2.12345: UDP, length 16
13:23:33.553309 IP 10.0.0.13.12345 > 10.0.0.2.12345: UDP, length 16
13:23:33.553915 IP 10.0.0.13.12345 > 10.0.0.2.12345: UDP, length 16
13:23:33.554532 IP 10.0.0.13.12345 > 10.0.0.2.12345: UDP, length 16
13:23:33.555115 IP 10.0.0.13.12345 > 10.0.0.2.12345: UDP, length 16
13:23:33.555726 IP 10.0.0.13.12345 > 10.0.0.2.12345: UDP, length 16
13:23:33.556313 IP 10.0.0.13.12345 > 10.0.0.2.12345: UDP, length 16
13:23:33.556898 IP 10.0.0.13.12345 > 10.0.0.2.12345: UDP, length 16
13:23:33.557502 IP 10.0.0.13.12345 > 10.0.0.2.12345: UDP, length 16
13:23:33.558106 IP 10.0.0.13.12345 > 10.0.0.2.12345: UDP, length 16
13:23:33.558681 IP 10.0.0.13.12345 > 10.0.0.2.12345: UDP, length 16
13:23:33.559286 IP 10.0.0.13.12345 > 10.0.0.2.12345: UDP, length 16
13:23:33.559856 IP 10.0.0.13.12345 > 10.0.0.2.12345: UDP, length 16
13:23:33.560448 IP 10.0.0.13.12345 > 10.0.0.2.12345: UDP, length 16
13:23:33.561045 IP 10.0.0.13.12345 > 10.0.0.2.12345: UDP, length 16
13:23:33.561638 IP 10.0.0.13.12345 > 10.0.0.2.12345: UDP, length 16
13:23:33.562227 IP 10.0.0.13.12345 > 10.0.0.2.12345: UDP, length 16
13:23:33.562826 IP 10.0.0.13.12345 > 10.0.0.2.12345: UDP, length 16
13:23:33.563403 IP 10.0.0.13.12345 > 10.0.0.2.12345: UDP, length 16
13:23:33.563980 IP 10.0.0.13.12345 > 10.0.0.2.12345: UDP, length 16
13:23:33.564560 IP 10.0.0.13.12345 > 10.0.0.2.12345: UDP, length 16
13:23:33.565137 IP 10.0.0.13.12345 > 10.0.0.2.12345: UDP, length 16
13:23:33.565713 IP 10.0.0.13.12345 > 10.0.0.2.12345: UDP, length 16
13:23:33.566292 IP 10.0.0.13.12345 > 10.0.0.2.12345: UDP, length 16
13:23:33.566869 IP 10.0.0.13.12345 > 10.0.0.2.12345: UDP, length 16
13:23:33.567446 IP 10.0.0.13.12345 > 10.0.0.2.12345: UDP, length 16
13:23:33.568024 IP 10.0.0.13.12345 > 10.0.0.2.12345: UDP, length 16
13:23:33.568601 IP 10.0.0.13.12345 > 10.0.0.2.12345: UDP, length 16
13:23:33.569177 IP 10.0.0.13.12345 > 10.0.0.2.12345: UDP, length 16
13:23:33.569757 IP 10.0.0.13.12345 > 10.0.0.2.12345: UDP, length 16
13:23:33.570339 IP 10.0.0.13.12345 > 10.0.0.2.12345: UDP, length 16
13:23:33.570937 IP 10.0.0.13.12345 > 10.0.0.2.12345: UDP, length 16
13:23:33.571536 IP 10.0.0.13.12345 > 10.0.0.2.12345: UDP, length 16
13:23:33.572144 IP 10.0.0.13.12345 > 10.0.0.2.12345: UDP, length 16
13:23:33.572753 IP 10.0.0.13.12345 > 10.0.0.2.12345: UDP, length 16
13:23:33.573361 IP 10.0.0.13.12345 > 10.0.0.2.12345: UDP, length 16
13:23:33.573970 IP 10.0.0.13.12345 > 10.0.0.2.12345: UDP, length 16
13:23:33.574582 IP 10.0.0.13.12345 > 10.0.0.2.12345: UDP, length 16
13:23:33.575195 IP 10.0.0.13.12345 > 10.0.0.2.12345: UDP, length 16
13:23:33.575793 IP 10.0.0.13.12345 > 10.0.0.2.12345: UDP, length 16
13:23:33.576408 IP 10.0.0.13.12345 > 10.0.0.2.12345: UDP, length 16
13:23:33.577029 IP 10.0.0.13.12345 > 10.0.0.2.12345: UDP, length 16
13:23:33.577643 IP 10.0.0.13.12345 > 10.0.0.2.12345: UDP, length 16
13:23:33.578257 IP 10.0.0.13.12345 > 10.0.0.2.12345: UDP, length 16
13:23:33.578860 IP 10.0.0.13.12345 > 10.0.0.2.12345: UDP, length 16
13:23:33.579459 IP 10.0.0.13.12345 > 10.0.0.2.12345: UDP, length 16
13:23:33.580041 IP 10.0.0.13.12345 > 10.0.0.2.12345: UDP, length 16
13:23:33.580638 IP 10.0.0.13.12345 > 10.0.0.2.12345: UDP, length 16
13:23:33.581228 IP 10.0.0.13.12345 > 10.0.0.2.12345: UDP, length 16
13:23:33.581814 IP 10.0.0.13.12345 > 10.0.0.2.12345: UDP, length 16
13:23:33.582394 IP 10.0.0.13.12345 > 10.0.0.2.12345: UDP, length 16
13:23:33.582986 IP 10.0.0.13.12345 > 10.0.0.2.12345: UDP, length 16
13:23:33.583571 IP 10.0.0.13.12345 > 10.0.0.2.12345: UDP, length 16
13:23:33.584159 IP 10.0.0.13.12345 > 10.0.0.2.12345: UDP, length 16
13:23:33.584742 IP 10.0.0.13.12345 > 10.0.0.2.12345: UDP, length 16
13:23:33.585353 IP 10.0.0.13.12345 > 10.0.0.2.12345: UDP, length 16
13:23:33.585965 IP 10.0.0.13.12345 > 10.0.0.2.12345: UDP, length 16
13:23:33.586570 IP 10.0.0.13.12345 > 10.0.0.2.12345: UDP, length 16
13:23:33.587158 IP 10.0.0.13.12345 > 10.0.0.2.12345: UDP, length 16
13:23:33.587741 IP 10.0.0.13.12345 > 10.0.0.2.12345: UDP, length 16
13:23:33.588351 IP 10.0.0.13.12345 > 10.0.0.2.12345: UDP, length 16
13:23:33.588961 IP 10.0.0.13.12345 > 10.0.0.2.12345: UDP, length 16
13:23:33.589573 IP 10.0.0.13.12345 > 10.0.0.2.12345: UDP, length 16
13:23:33.590184 IP 10.0.0.13.12345 > 10.0.0.2.12345: UDP, length 16
13:23:33.590795 IP 10.0.0.13.12345 > 10.0.0.2.12345: UDP, length 16
13:23:33.591408 IP 10.0.0.13.12345 > 10.0.0.2.12345: UDP, length 16
13:23:33.591997 IP 10.0.0.13.12345 > 10.0.0.2.12345: UDP, length 16
13:23:33.592615 IP 10.0.0.13.12345 > 10.0.0.2.12345: UDP, length 16
13:23:33.593219 IP 10.0.0.13.12345 > 10.0.0.2.12345: UDP, length 16
13:23:33.593836 IP 10.0.0.13.12345 > 10.0.0.2.12345: UDP, length 16
13:23:33.594438 IP 10.0.0.13.12345 > 10.0.0.2.12345: UDP, length 16
13:23:33.595036 IP 10.0.0.13.12345 > 10.0.0.2.12345: UDP, length 16
13:23:33.595637 IP 10.0.0.13.12345 > 10.0.0.2.12345: UDP, length 16
13:23:33.596242 IP 10.0.0.13.12345 > 10.0.0.2.12345: UDP, length 16
13:23:33.596847 IP 10.0.0.13.12345 > 10.0.0.2.12345: UDP, length 16
13:23:33.597439 IP 10.0.0.13.12345 > 10.0.0.2.12345: UDP, length 16
13:23:33.598025 IP 10.0.0.13.12345 > 10.0.0.2.12345: UDP, length 16
13:23:33.598644 IP 10.0.0.13.12345 > 10.0.0.2.12345: UDP, length 16
13:23:33.599247 IP 10.0.0.13.12345 > 10.0.0.2.12345: UDP, length 16
13:23:33.599840 IP 10.0.0.13.12345 > 10.0.0.2.12345: UDP, length 16
13:23:33.600427 IP 10.0.0.13.12345 > 10.0.0.2.12345: UDP, length 16
13:23:33.601012 IP 10.0.0.13.12345 > 10.0.0.2.12345: UDP, length 16
13:23:33.601626 IP 10.0.0.13.12345 > 10.0.0.2.12345: UDP, length 16
13:23:33.602242 IP 10.0.0.13.12345 > 10.0.0.2.12345: UDP, length 16
13:23:33.602849 IP 10.0.0.13.12345 > 10.0.0.2.12345: UDP, length 16
13:23:33.603442 IP 10.0.0.13.12345 > 10.0.0.2.12345: UDP, length 16
13:23:33.604025 IP 10.0.0.13.12345 > 10.0.0.2.12345: UDP, length 16
13:23:33.604620 IP 10.0.0.13.12345 > 10.0.0.2.12345: UDP, length 16
13:23:33.605233 IP 10.0.0.13.12345 > 10.0.0.2.12345: UDP, length 16
13:23:33.605848 IP 10.0.0.13.12345 > 10.0.0.2.12345: UDP, length 16
13:23:33.606462 IP 10.0.0.13.12345 > 10.0.0.2.12345: UDP, length 16
13:23:33.607077 IP 10.0.0.13.12345 > 10.0.0.2.12345: UDP, length 16
13:23:33.607677 IP 10.0.0.13.12345 > 10.0.0.2.12345: UDP, length 16
13:23:33.608326 IP 10.0.0.13.12345 > 10.0.0.2.12345: UDP, length 16
13:23:33.608931 IP 10.0.0.13.12345 > 10.0.0.2.12345: UDP, length 16
13:23:33.609522 IP 10.0.0.13.12345 > 10.0.0.2.12345: UDP, length 16
13:23:33.610137 IP 10.0.0.13.12345 > 10.0.0.2.12345: UDP, length 16
13:23:33.610753 IP 10.0.0.13.12345 > 10.0.0.2.12345: UDP, length 16
13:23:33.611357 IP 10.0.0.13.12345 > 10.0.0.2.12345: UDP, length 16
13:23:33.611953 IP 10.0.0.13.12345 > 10.0.0.2.12345: UDP, length 16
13:23:33.612552 IP 10.0.0.13.12345 > 10.0.0.2.12345: UDP, length 16
13:23:33.613189 IP 10.0.0.13.12345 > 10.0.0.2.12345: UDP, length 16
13:23:33.613791 IP 10.0.0.13.12345 > 10.0.0.2.12345: UDP, length 16
13:23:33.614393 IP 10.0.0.13.12345 > 10.0.0.2.12345: UDP, length 16
13:23:33.614981 IP 10.0.0.13.12345 > 10.0.0.2.12345: UDP, length 16
13:23:33.615566 IP 10.0.0.13.12345 > 10.0.0.2.12345: UDP, length 16
13:23:33.616158 IP 10.0.0.13.12345 > 10.0.0.2.12345: UDP, length 16
13:23:33.616768 IP 10.0.0.13.12345 > 10.0.0.2.12345: UDP, length 16
13:23:33.617371 IP 10.0.0.13.12345 > 10.0.0.2.12345: UDP, length 16
13:23:33.617962 IP 10.0.0.13.12345 > 10.0.0.2.12345: UDP, length 16
13:23:33.618550 IP 10.0.0.13.12345 > 10.0.0.2.12345: UDP, length 16
13:23:33.619166 IP 10.0.0.13.12345 > 10.0.0.2.12345: UDP, length 16
13:23:33.619761 IP 10.0.0.13.12345 > 10.0.0.2.12345: UDP, length 16
13:23:33.620373 IP 10.0.0.13.12345 > 10.0.0.2.12345: UDP, length 16
13:23:33.620985 IP 10.0.0.13.12345 > 10.0.0.2.12345: UDP, length 16
13:23:33.621596 IP 10.0.0.13.12345 > 10.0.0.2.12345: UDP, length 16
13:23:33.622207 IP 10.0.0.13.12345 > 10.0.0.2.12345: UDP, length 16
13:23:33.622819 IP 10.0.0.13.12345 > 10.0.0.2.12345: UDP, length 16
13:23:33.623430 IP 10.0.0.13.12345 > 10.0.0.2.12345: UDP, length 16
13:23:33.624042 IP 10.0.0.13.12345 > 10.0.0.2.12345: UDP, length 16
13:23:33.624656 IP 10.0.0.13.12345 > 10.0.0.2.12345: UDP, length 16
13:23:33.625270 IP 10.0.0.13.12345 > 10.0.0.2.12345: UDP, length 16
13:23:33.625865 IP 10.0.0.13.12345 > 10.0.0.2.12345: UDP, length 16
13:23:33.626450 IP 10.0.0.13.12345 > 10.0.0.2.12345: UDP, length 16
13:23:33.627041 IP 10.0.0.13.12345 > 10.0.0.2.12345: UDP, length 16
13:23:33.627626 IP 10.0.0.13.12345 > 10.0.0.2.12345: UDP, length 16
13:23:33.628209 IP 10.0.0.13.12345 > 10.0.0.2.12345: UDP, length 16
13:23:33.628781 IP 10.0.0.13.12345 > 10.0.0.2.12345: UDP, length 16
13:23:33.629377 IP 10.0.0.13.12345 > 10.0.0.2.12345: UDP, length 16
13:23:33.629961 IP 10.0.0.13.12345 > 10.0.0.2.12345: UDP, length 16
13:23:33.630549 IP 10.0.0.13.12345 > 10.0.0.2.12345: UDP, length 16
13:23:33.631140 IP 10.0.0.13.12345 > 10.0.0.2.12345: UDP, length 16
13:23:33.631760 IP 10.0.0.13.12345 > 10.0.0.2.12345: UDP, length 16
13:23:33.632393 IP 10.0.0.13.12345 > 10.0.0.2.12345: UDP, length 16
13:23:33.632994 IP 10.0.0.13.12345 > 10.0.0.2.12345: UDP, length 16
13:23:33.633592 IP 10.0.0.13.12345 > 10.0.0.2.12345: UDP, length 16
13:23:33.634182 IP 10.0.0.13.12345 > 10.0.0.2.12345: UDP, length 16
13:23:33.634775 IP 10.0.0.13.12345 > 10.0.0.2.12345: UDP, length 16
13:23:33.635386 IP 10.0.0.13.12345 > 10.0.0.2.12345: UDP, length 16
13:23:33.635984 IP 10.0.0.13.12345 > 10.0.0.2.12345: UDP, length 16
13:23:33.636594 IP 10.0.0.13.12345 > 10.0.0.2.12345: UDP, length 16
13:23:33.637189 IP 10.0.0.13.12345 > 10.0.0.2.12345: UDP, length 16
13:23:33.637778 IP 10.0.0.13.12345 > 10.0.0.2.12345: UDP, length 16
13:23:33.638399 IP 10.0.0.13.12345 > 10.0.0.2.12345: UDP, length 16
13:23:33.639022 IP 10.0.0.13.12345 > 10.0.0.2.12345: UDP, length 16
13:23:33.639657 IP 10.0.0.13.12345 > 10.0.0.2.12345: UDP, length 16
13:23:33.640271 IP 10.0.0.13.12345 > 10.0.0.2.12345: UDP, length 16
13:23:33.640908 IP 10.0.0.13.12345 > 10.0.0.2.12345: UDP, length 16
13:23:33.641500 IP 10.0.0.13.12345 > 10.0.0.2.12345: UDP, length 16
13:23:33.642086 IP 10.0.0.13.12345 > 10.0.0.2.12345: UDP, length 16
13:23:33.642711 IP 10.0.0.13.12345 > 10.0.0.2.12345: UDP, length 16
13:23:33.643319 IP 10.0.0.13.12345 > 10.0.0.2.12345: UDP, length 16
13:23:33.643900 IP 10.0.0.13.12345 > 10.0.0.2.12345: UDP, length 16
13:23:33.644483 IP 10.0.0.13.12345 > 10.0.0.2.12345: UDP, length 16
13:23:33.645099 IP 10.0.0.13.12345 > 10.0.0.2.12345: UDP, length 16
13:23:33.645708 IP 10.0.0.13.12345 > 10.0.0.2.12345: UDP, length 16
13:23:33.646314 IP 10.0.0.13.12345 > 10.0.0.2.12345: UDP, length 16
13:23:33.646904 IP 10.0.0.13.12345 > 10.0.0.2.12345: UDP, length 16
13:23:33.647489 IP 10.0.0.13.12345 > 10.0.0.2.12345: UDP, length 16
13:23:33.648077 IP 10.0.0.13.12345 > 10.0.0.2.12345: UDP, length 16
13:23:33.648662 IP 10.0.0.13.12345 > 10.0.0.2.12345: UDP, length 16
13:23:33.649277 IP 10.0.0.13.12345 > 10.0.0.2.12345: UDP, length 16
13:23:33.649893 IP 10.0.0.13.12345 > 10.0.0.2.12345: UDP, length 16
13:23:33.650502 IP 10.0.0.13.12345 > 10.0.0.2.12345: UDP, length 16
13:23:33.651130 IP 10.0.0.13.12345 > 10.0.0.2.12345: UDP, length 16
13:23:33.651758 IP 10.0.0.13.12345 > 10.0.0.2.12345: UDP, length 16
13:23:33.652363 IP 10.0.0.13.12345 > 10.0.0.2.12345: UDP, length 16
13:23:33.652993 IP 10.0.0.13.12345 > 10.0.0.2.12345: UDP, length 16
13:23:33.653623 IP 10.0.0.13.12345 > 10.0.0.2.12345: UDP, length 16
13:23:33.654271 IP 10.0.0.13.12345 > 10.0.0.2.12345: UDP, length 16
13:23:33.654919 IP 10.0.0.13.12345 > 10.0.0.2.12345: UDP, length 16
13:23:33.655567 IP 10.0.0.13.12345 > 10.0.0.2.12345: UDP, length 16
13:23:33.656215 IP 10.0.0.13.12345 > 10.0.0.2.12345: UDP, length 16
13:23:33.656862 IP 10.0.0.13.12345 > 10.0.0.2.12345: UDP, length 16
13:23:33.657512 IP 10.0.0.13.12345 > 10.0.0.2.12345: UDP, length 16
13:23:33.658160 IP 10.0.0.13.12345 > 10.0.0.2.12345: UDP, length 16
13:23:33.658793 IP 10.0.0.13.12345 > 10.0.0.2.12345: UDP, length 16
13:23:33.659424 IP 10.0.0.13.12345 > 10.0.0.2.12345: UDP, length 16
13:23:33.660056 IP 10.0.0.13.12345 > 10.0.0.2.12345: UDP, length 16
13:23:33.660691 IP 10.0.0.13.12345 > 10.0.0.2.12345: UDP, length 16
13:23:33.661314 IP 10.0.0.13.12345 > 10.0.0.2.12345: UDP, length 16
13:23:33.661927 IP 10.0.0.13.12345 > 10.0.0.2.12345: UDP, length 16
13:23:33.662547 IP 10.0.0.13.12345 > 10.0.0.2.12345: UDP, length 16
13:23:33.663161 IP 10.0.0.13.12345 > 10.0.0.2.12345: UDP, length 16
13:23:33.663802 IP 10.0.0.13.12345 > 10.0.0.2.12345: UDP, length 16
13:23:33.664412 IP 10.0.0.13.12345 > 10.0.0.2.12345: UDP, length 16
13:23:33.665049 IP 10.0.0.13.12345 > 10.0.0.2.12345: UDP, length 16
13:23:33.665687 IP 10.0.0.13.12345 > 10.0.0.2.12345: UDP, length 16
13:23:33.666322 IP 10.0.0.13.12345 > 10.0.0.2.12345: UDP, length 16
13:23:33.666934 IP 10.0.0.13.12345 > 10.0.0.2.12345: UDP, length 16
13:23:33.667564 IP 10.0.0.13.12345 > 10.0.0.2.12345: UDP, length 16
13:23:33.668197 IP 10.0.0.13.12345 > 10.0.0.2.12345: UDP, length 16
13:23:33.668827 IP 10.0.0.13.12345 > 10.0.0.2.12345: UDP, length 16
13:23:33.669456 IP 10.0.0.13.12345 > 10.0.0.2.12345: UDP, length 16
13:23:33.670089 IP 10.0.0.13.12345 > 10.0.0.2.12345: UDP, length 16
13:23:33.670718 IP 10.0.0.13.12345 > 10.0.0.2.12345: UDP, length 16
13:23:33.671347 IP 10.0.0.13.12345 > 10.0.0.2.12345: UDP, length 16
13:23:33.671997 IP 10.0.0.13.12345 > 10.0.0.2.12345: UDP, length 16
13:23:33.672643 IP 10.0.0.13.12345 > 10.0.0.2.12345: UDP, length 16
13:23:33.673292 IP 10.0.0.13.12345 > 10.0.0.2.12345: UDP, length 16
13:23:33.673938 IP 10.0.0.13.12345 > 10.0.0.2.12345: UDP, length 16
13:23:33.674572 IP 10.0.0.13.12345 > 10.0.0.2.12345: UDP, length 16
13:23:33.675193 IP 10.0.0.13.12345 > 10.0.0.2.12345: UDP, length 16
13:23:33.675809 IP 10.0.0.13.12345 > 10.0.0.2.12345: UDP, length 16
13:23:33.676404 IP 10.0.0.13.12345 > 10.0.0.2.12345: UDP, length 16
13:23:33.677033 IP 10.0.0.13.12345 > 10.0.0.2.12345: UDP, length 16
13:23:33.677665 IP 10.0.0.13.12345 > 10.0.0.2.12345: UDP, length 16
13:23:33.678279 IP 10.0.0.13.12345 > 10.0.0.2.12345: UDP, length 16
13:23:33.678891 IP 10.0.0.13.12345 > 10.0.0.2.12345: UDP, length 16
13:23:33.679499 IP 10.0.0.13.12345 > 10.0.0.2.12345: UDP, length 16
13:23:33.680090 IP 10.0.0.13.12345 > 10.0.0.2.12345: UDP, length 16
13:23:33.680682 IP 10.0.0.13.12345 > 10.0.0.2.12345: UDP, length 16
13:23:33.681270 IP 10.0.0.13.12345 > 10.0.0.2.12345: UDP, length 16
13:23:33.681858 IP 10.0.0.13.12345 > 10.0.0.2.12345: UDP, length 16
13:23:33.682468 IP 10.0.0.13.12345 > 10.0.0.2.12345: UDP, length 16
13:23:33.683082 IP 10.0.0.13.12345 > 10.0.0.2.12345: UDP, length 16
13:23:33.683710 IP 10.0.0.13.12345 > 10.0.0.2.12345: UDP, length 16
13:23:33.684334 IP 10.0.0.13.12345 > 10.0.0.2.12345: UDP, length 16
13:23:33.684958 IP 10.0.0.13.12345 > 10.0.0.2.12345: UDP, length 16
13:23:33.685582 IP 10.0.0.13.12345 > 10.0.0.2.12345: UDP, length 16
13:23:33.686206 IP 10.0.0.13.12345 > 10.0.0.2.12345: UDP, length 16
13:23:33.686833 IP 10.0.0.13.12345 > 10.0.0.2.12345: UDP, length 16
13:23:33.687457 IP 10.0.0.13.12345 > 10.0.0.2.12345: UDP, length 16
13:23:33.688099 IP 10.0.0.13.12345 > 10.0.0.2.12345: UDP, length 16
13:23:33.688740 IP 10.0.0.13.12345 > 10.0.0.2.12345: UDP, length 16
13:23:33.689381 IP 10.0.0.13.12345 > 10.0.0.2.12345: UDP, length 16
13:23:33.689981 IP 10.0.0.13.12345 > 10.0.0.2.12345: UDP, length 16
13:23:33.690576 IP 10.0.0.13.12345 > 10.0.0.2.12345: UDP, length 16
13:23:33.691180 IP 10.0.0.13.12345 > 10.0.0.2.12345: UDP, length 16
13:23:33.691825 IP 10.0.0.13.12345 > 10.0.0.2.12345: UDP, length 16
13:23:33.692445 IP 10.0.0.13.12345 > 10.0.0.2.12345: UDP, length 16
13:23:33.693048 IP 10.0.0.13.12345 > 10.0.0.2.12345: UDP, length 16
13:23:33.693656 IP 10.0.0.13.12345 > 10.0.0.2.12345: UDP, length 16
13:23:33.694253 IP 10.0.0.13.12345 > 10.0.0.2.12345: UDP, length 16
13:23:33.694857 IP 10.0.0.13.12345 > 10.0.0.2.12345: UDP, length 16
13:23:33.695452 IP 10.0.0.13.12345 > 10.0.0.2.12345: UDP, length 16
13:23:33.696069 IP 10.0.0.13.12345 > 10.0.0.2.12345: UDP, length 16
13:23:33.696689 IP 10.0.0.13.12345 > 10.0.0.2.12345: UDP, length 16
13:23:33.697340 IP 10.0.0.13.12345 > 10.0.0.2.12345: UDP, length 16
13:23:33.697949 IP 10.0.0.13.12345 > 10.0.0.2.12345: UDP, length 16
13:23:33.698543 IP 10.0.0.13.12345 > 10.0.0.2.12345: UDP, length 16
13:23:33.699152 IP 10.0.0.13.12345 > 10.0.0.2.12345: UDP, length 16
13:23:33.699780 IP 10.0.0.13.12345 > 10.0.0.2.12345: UDP, length 16
13:23:33.700418 IP 10.0.0.13.12345 > 10.0.0.2.12345: UDP, length 16
13:23:33.701056 IP 10.0.0.13.12345 > 10.0.0.2.12345: UDP, length 16
13:23:33.701693 IP 10.0.0.13.12345 > 10.0.0.2.12345: UDP, length 16
13:23:33.702332 IP 10.0.0.13.12345 > 10.0.0.2.12345: UDP, length 16
13:23:33.702973 IP 10.0.0.13.12345 > 10.0.0.2.12345: UDP, length 16
13:23:33.703612 IP 10.0.0.13.12345 > 10.0.0.2.12345: UDP, length 16
13:23:33.704228 IP 10.0.0.13.12345 > 10.0.0.2.12345: UDP, length 16
13:23:33.704841 IP 10.0.0.13.12345 > 10.0.0.2.12345: UDP, length 16
13:23:33.705468 IP 10.0.0.13.12345 > 10.0.0.2.12345: UDP, length 16
13:23:33.706097 IP 10.0.0.13.12345 > 10.0.0.2.12345: UDP, length 16
13:23:33.706725 IP 10.0.0.13.12345 > 10.0.0.2.12345: UDP, length 16
13:23:33.707353 IP 10.0.0.13.12345 > 10.0.0.2.12345: UDP, length 16
13:23:33.707981 IP 10.0.0.13.12345 > 10.0.0.2.12345: UDP, length 16
13:23:33.708588 IP 10.0.0.13.12345 > 10.0.0.2.12345: UDP, length 16
13:23:33.709187 IP 10.0.0.13.12345 > 10.0.0.2.12345: UDP, length 16
13:23:33.709800 IP 10.0.0.13.12345 > 10.0.0.2.12345: UDP, length 16
13:23:33.710390 IP 10.0.0.13.12345 > 10.0.0.2.12345: UDP, length 16
13:23:33.710973 IP 10.0.0.13.12345 > 10.0.0.2.12345: UDP, length 16
13:23:33.711589 IP 10.0.0.13.12345 > 10.0.0.2.12345: UDP, length 16
13:23:33.712201 IP 10.0.0.13.12345 > 10.0.0.2.12345: UDP, length 16
13:23:33.712798 IP 10.0.0.13.12345 > 10.0.0.2.12345: UDP, length 16
13:23:33.713418 IP 10.0.0.13.12345 > 10.0.0.2.12345: UDP, length 16
13:23:33.714034 IP 10.0.0.13.12345 > 10.0.0.2.12345: UDP, length 16
13:23:33.714628 IP 10.0.0.13.12345 > 10.0.0.2.12345: UDP, length 16
13:23:33.715216 IP 10.0.0.13.12345 > 10.0.0.2.12345: UDP, length 16
13:23:33.715797 IP 10.0.0.13.12345 > 10.0.0.2.12345: UDP, length 16
13:23:33.716445 IP 10.0.0.13.12345 > 10.0.0.2.12345: UDP, length 16
13:23:33.717091 IP 10.0.0.13.12345 > 10.0.0.2.12345: UDP, length 16
13:23:33.717737 IP 10.0.0.13.12345 > 10.0.0.2.12345: UDP, length 16
13:23:33.718368 IP 10.0.0.13.12345 > 10.0.0.2.12345: UDP, length 16
13:23:33.719014 IP 10.0.0.13.12345 > 10.0.0.2.12345: UDP, length 16
13:23:33.719661 IP 10.0.0.13.12345 > 10.0.0.2.12345: UDP, length 16
13:23:33.720285 IP 10.0.0.13.12345 > 10.0.0.2.12345: UDP, length 16
13:23:33.720930 IP 10.0.0.13.12345 > 10.0.0.2.12345: UDP, length 16
13:23:33.721578 IP 10.0.0.13.12345 > 10.0.0.2.12345: UDP, length 16
13:23:33.722224 IP 10.0.0.13.12345 > 10.0.0.2.12345: UDP, length 16
13:23:33.722825 IP 10.0.0.13.12345 > 10.0.0.2.12345: UDP, length 16
13:23:33.723458 IP 10.0.0.13.12345 > 10.0.0.2.12345: UDP, length 16
13:23:33.724064 IP 10.0.0.13.12345 > 10.0.0.2.12345: UDP, length 16
13:23:33.724666 IP 10.0.0.13.12345 > 10.0.0.2.12345: UDP, length 16
13:23:33.725271 IP 10.0.0.13.12345 > 10.0.0.2.12345: UDP, length 16
13:23:33.725864 IP 10.0.0.13.12345 > 10.0.0.2.12345: UDP, length 16
13:23:33.726476 IP 10.0.0.13.12345 > 10.0.0.2.12345: UDP, length 16
13:23:33.727102 IP 10.0.0.13.12345 > 10.0.0.2.12345: UDP, length 16
13:23:33.727718 IP 10.0.0.13.12345 > 10.0.0.2.12345: UDP, length 16
13:23:33.728328 IP 10.0.0.13.12345 > 10.0.0.2.12345: UDP, length 16
13:23:33.728963 IP 10.0.0.13.12345 > 10.0.0.2.12345: UDP, length 16
13:23:33.729600 IP 10.0.0.13.12345 > 10.0.0.2.12345: UDP, length 16
13:23:33.730215 IP 10.0.0.13.12345 > 10.0.0.2.12345: UDP, length 16
13:23:33.730812 IP 10.0.0.13.12345 > 10.0.0.2.12345: UDP, length 16
13:23:33.731441 IP 10.0.0.13.12345 > 10.0.0.2.12345: UDP, length 16
13:23:33.732073 IP 10.0.0.13.12345 > 10.0.0.2.12345: UDP, length 16
13:23:33.732672 IP 10.0.0.13.12345 > 10.0.0.2.12345: UDP, length 16
13:23:33.733269 IP 10.0.0.13.12345 > 10.0.0.2.12345: UDP, length 16
13:23:33.733874 IP 10.0.0.13.12345 > 10.0.0.2.12345: UDP, length 16
13:23:33.734465 IP 10.0.0.13.12345 > 10.0.0.2.12345: UDP, length 16
13:23:33.735116 IP 10.0.0.13.12345 > 10.0.0.2.12345: UDP, length 16
13:23:33.735749 IP 10.0.0.13.12345 > 10.0.0.2.12345: UDP, length 16
13:23:33.736405 IP 10.0.0.13.12345 > 10.0.0.2.12345: UDP, length 16
13:23:33.737057 IP 10.0.0.13.12345 > 10.0.0.2.12345: UDP, length 16
13:23:33.737707 IP 10.0.0.13.12345 > 10.0.0.2.12345: UDP, length 16
13:23:33.738312 IP 10.0.0.13.12345 > 10.0.0.2.12345: UDP, length 16
13:23:33.738918 IP 10.0.0.13.12345 > 10.0.0.2.12345: UDP, length 16
13:23:33.739554 IP 10.0.0.13.12345 > 10.0.0.2.12345: UDP, length 16
13:23:33.740160 IP 10.0.0.13.12345 > 10.0.0.2.12345: UDP, length 16
13:23:33.740751 IP 10.0.0.13.12345 > 10.0.0.2.12345: UDP, length 16
13:23:33.741340 IP 10.0.0.13.12345 > 10.0.0.2.12345: UDP, length 16
13:23:33.741926 IP 10.0.0.13.12345 > 10.0.0.2.12345: UDP, length 16
13:23:33.742515 IP 10.0.0.13.12345 > 10.0.0.2.12345: UDP, length 16
13:23:33.743119 IP 10.0.0.13.12345 > 10.0.0.2.12345: UDP, length 16
13:23:33.743756 IP 10.0.0.13.12345 > 10.0.0.2.12345: UDP, length 16
13:23:33.744385 IP 10.0.0.13.12345 > 10.0.0.2.12345: UDP, length 16
13:23:33.745015 IP 10.0.0.13.12345 > 10.0.0.2.12345: UDP, length 16
13:23:33.745660 IP 10.0.0.13.12345 > 10.0.0.2.12345: UDP, length 16
13:23:33.746286 IP 10.0.0.13.12345 > 10.0.0.2.12345: UDP, length 16
13:23:33.746925 IP 10.0.0.13.12345 > 10.0.0.2.12345: UDP, length 16
13:23:33.747574 IP 10.0.0.13.12345 > 10.0.0.2.12345: UDP, length 16
13:23:33.748176 IP 10.0.0.13.12345 > 10.0.0.2.12345: UDP, length 16
13:23:33.748773 IP 10.0.0.13.12345 > 10.0.0.2.12345: UDP, length 16
