13:20:42.358353 IP 10.0.0.11.12345 > 10.0.0.2.12345: UDP, length 16
13:20:42.358853 IP 10.0.0.11.12345 > 10.0.0.2.12345: UDP, length 16
13:20:42.359423 IP 10.0.0.11.12345 > 10.0.0.2.12345: UDP, length 16
13:20:42.359994 IP 10.0.0.11.12345 > 10.0.0.2.12345: UDP, length 16
13:20:42.360561 IP 10.0.0.11.12345 > 10.0.0.2.12345: UDP, length 16
13:20:42.361139 IP 10.0.0.11.12345 > 10.0.0.2.12345: UDP, length 16
13:20:42.361715 IP 10.0.0.11.12345 > 10.0.0.2.12345: UDP, length 16
13:20:42.362868 IP 10.0.0.11.12345 > 10.0.0.2.12345: UDP, length 16
13:20:42.363450 IP 10.0.0.11.12345 > 10.0.0.2.12345: UDP, length 16
13:20:42.364028 IP 10.0.0.11.12345 > 10.0.0.2.12345: UDP, length 16
13:20:42.364603 IP 10.0.0.11.12345 > 10.0.0.2.12345: UDP, length 16
13:20:42.365174 IP 10.0.0.11.12345 > 10.0.0.2.12345: UDP, length 16
13:20:42.365749 IP 10.0.0.11.12345 > 10.0.0.2.12345: UDP, length 16
13:20:42.366324 IP 10.0.0.11.12345 > 10.0.0.2.12345: UDP, length 16
13:20:42.366896 IP 10.0.0.11.12345 > 10.0.0.2.12345: UDP, length 16
13:20:42.367470 IP 10.0.0.11.12345 > 10.0.0.2.12345: UDP, length 16
13:20:42.368042 IP 10.0.0.11.12345 > 10.0.0.2.12345: UDP, length 16
13:20:42.368610 IP 10.0.0.11.12345 > 10.0.0.2.12345: UDP, length 16
13:20:42.369175 IP 10.0.0.11.12345 > 10.0.0.2.12345: UDP, length 16
13:20:42.369750 IP 10.0.0.11.12345 > 10.0.0.2.12345: UDP, length 16
13:20:42.370321 IP 10.0.0.11.12345 > 10.0.0.2.12345: UDP, length 16
13:20:42.370895 IP 10.0.0.11.12345 > 10.0.0.2.12345: UDP, length 16
13:20:42.371461 IP 10.0.0.11.12345 > 10.0.0.2.12345: UDP, length 16
13:20:42.372030 IP 10.0.0.11.12345 > 10.0.0.2.12345: UDP, length 16
13:20:42.372601 IP 10.0.0.11.12345 > 10.0.0.2.12345: UDP, length 16
13:20:42.373174 IP 10.0.0.11.12345 > 10.0.0.2.12345: UDP, length 16
13:20:42.373743 IP 10.0.0.11.12345 > 10.0.0.2.12345: UDP, length 16
13:20:42.374306 IP 10.0.0.11.12345 > 10.0.0.2.12345: UDP, length 16
13:20:42.374876 IP 10.0.0.11.12345 > 10.0.0.2.12345: UDP, length 16
13:20:42.375456 IP 10.0.0.11.12345 > 10.0.0.2.12345: UDP, length 16
13:20:42.376034 IP 10.0.0.11.12345 > 10.0.0.2.12345: UDP, length 16
13:20:42.376609 IP 10.0.0.11.12345 > 10.0.0.2.12345: UDP, length 16
13:20:42.377192 IP 10.0.0.11.12345 > 10.0.0.2.12345: UDP, length 16
13:20:42.377772 IP 10.0.0.11.12345 > 10.0.0.2.12345: UDP, length 16
13:20:42.378371 IP 10.0.0.11.12345 > 10.0.0.2.12345: UDP, length 16
13:20:42.378961 IP 10.0.0.11.12345 > 10.0.0.2.12345: UDP, length 16
13:20:42.379559 IP 10.0.0.11.12345 > 10.0.0.2.12345: UDP, length 16
13:20:42.380163 IP 10.0.0.11.12345 > 10.0.0.2.12345: UDP, length 16
13:20:42.380750 IP 10.0.0.11.12345 > 10.0.0.2.12345: UDP, length 16
13:20:42.381325 IP 10.0.0.11.12345 > 10.0.0.2.12345: UDP, length 16
13:20:42.381902 IP 10.0.0.11.12345 > 10.0.0.2.12345: UDP, length 16
13:20:42.382497 IP 10.0.0.11.12345 > 10.0.0.2.12345: UDP, length 16
13:20:42.383074 IP 10.0.0.11.12345 > 10.0.0.2.12345: UDP, length 16
13:20:42.383652 IP 10.0.0.11.12345 > 10.0.0.2.12345: UDP, length 16
13:20:42.384228 IP 10.0.0.11.12345 > 10.0.0.2.12345: UDP, length 16
13:20:42.384799 IP 10.0.0.11.12345 > 10.0.0.2.12345: UDP, length 16
13:20:42.385375 IP 10.0.0.11.12345 > 10.0.0.2.12345: UDP, length 16
13:20:42.385948 IP 10.0.0.11.12345 > 10.0.0.2.12345: UDP, length 16
13:20:42.386532 IP 10.0.0.11.12345 > 10.0.0.2.12345: UDP, length 16
13:20:42.387115 IP 10.0.0.11.12345 > 10.0.0.2.12345: UDP, length 16
13:20:42.387732 IP 10.0.0.11.12345 > 10.0.0.2.12345: UDP, length 16
13:20:42.388317 IP 10.0.0.11.12345 > 10.0.0.2.12345: UDP, length 16
13:20:42.388892 IP 10.0.0.11.12345 > 10.0.0.2.12345: UDP, length 16
13:20:42.389466 IP 10.0.0.11.12345 > 10.0.0.2.12345: UDP, length 16
13:20:42.390039 IP 10.0.0.11.12345 > 10.0.0.2.12345: UDP, length 16
13:20:42.390615 IP 10.0.0.11.12345 > 10.0.0.2.12345: UDP, length 16
13:20:42.391184 IP 10.0.0.11.12345 > 10.0.0.2.12345: UDP, length 16
13:20:42.391751 IP 10.0.0.11.12345 > 10.0.0.2.12345: UDP, length 16
13:20:42.392318 IP 10.0.0.11.12345 > 10.0.0.2.12345: UDP, length 16
13:20:42.392888 IP 10.0.0.11.12345 > 10.0.0.2.12345: UDP, length 16
13:20:42.393455 IP 10.0.0.11.12345 > 10.0.0.2.12345: UDP, length 16
13:20:42.394044 IP 10.0.0.11.12345 > 10.0.0.2.12345: UDP, length 16
13:20:42.394636 IP 10.0.0.11.12345 > 10.0.0.2.12345: UDP, length 16
13:20:42.395238 IP 10.0.0.11.12345 > 10.0.0.2.12345: UDP, length 16
13:20:42.395855 IP 10.0.0.11.12345 > 10.0.0.2.12345: UDP, length 16
13:20:42.396449 IP 10.0.0.11.12345 > 10.0.0.2.12345: UDP, length 16
13:20:42.397035 IP 10.0.0.11.12345 > 10.0.0.2.12345: UDP, length 16
13:20:42.397624 IP 10.0.0.11.12345 > 10.0.0.2.12345: UDP, length 16
13:20:42.398216 IP 10.0.0.11.12345 > 10.0.0.2.12345: UDP, length 16
13:20:42.398800 IP 10.0.0.11.12345 > 10.0.0.2.12345: UDP, length 16
13:20:42.399381 IP 10.0.0.11.12345 > 10.0.0.2.12345: UDP, length 16
13:20:42.399958 IP 10.0.0.11.12345 > 10.0.0.2.12345: UDP, length 16
13:20:42.400543 IP 10.0.0.11.12345 > 10.0.0.2.12345: UDP, length 16
13:20:42.401139 IP 10.0.0.11.12345 > 10.0.0.2.12345: UDP, length 16
13:20:42.401731 IP 10.0.0.11.12345 > 10.0.0.2.12345: UDP, length 16
13:20:42.402324 IP 10.0.0.11.12345 > 10.0.0.2.12345: UDP, length 16
13:20:42.402904 IP 10.0.0.11.12345 > 10.0.0.2.12345: UDP, length 16
13:20:42.403480 IP 10.0.0.11.12345 > 10.0.0.2.12345: UDP, length 16
13:20:42.404054 IP 10.0.0.11.12345 > 10.0.0.2.12345: UDP, length 16
13:20:42.404641 IP 10.0.0.11.12345 > 10.0.0.2.12345: UDP, length 16
13:20:42.405212 IP 10.0.0.11.12345 > 10.0.0.2.12345: UDP, length 16
13:20:42.405791 IP 10.0.0.11.12345 > 10.0.0.2.12345: UDP, length 16
13:20:42.406365 IP 10.0.0.11.12345 > 10.0.0.2.12345: UDP, length 16
13:20:42.406952 IP 10.0.0.11.12345 > 10.0.0.2.12345: UDP, length 16
13:20:42.407522 IP 10.0.0.11.12345 > 10.0.0.2.12345: UDP, length 16
13:20:42.408099 IP 10.0.0.11.12345 > 10.0.0.2.12345: UDP, length 16
13:20:42.408671 IP 10.0.0.11.12345 > 10.0.0.2.12345: UDP, length 16
13:20:42.409238 IP 10.0.0.11.12345 > 10.0.0.2.12345: UDP, length 16
13:20:42.409810 IP 10.0.0.11.12345 > 10.0.0.2.12345: UDP, length 16
13:20:42.410393 IP 10.0.0.11.12345 > 10.0.0.2.12345: UDP, length 16
13:20:42.410969 IP 10.0.0.11.12345 > 10.0.0.2.12345: UDP, length 16
13:20:42.411542 IP 10.0.0.11.12345 > 10.0.0.2.12345: UDP, length 16
13:20:42.412137 IP 10.0.0.11.12345 > 10.0.0.2.12345: UDP, length 16
13:20:42.412708 IP 10.0.0.11.12345 > 10.0.0.2.12345: UDP, length 16
13:20:42.413285 IP 10.0.0.11.12345 > 10.0.0.2.12345: UDP, length 16
13:20:42.413860 IP 10.0.0.11.12345 > 10.0.0.2.12345: UDP, length 16
13:20:42.414435 IP 10.0.0.11.12345 > 10.0.0.2.12345: UDP, length 16
13:20:42.415009 IP 10.0.0.11.12345 > 10.0.0.2.12345: UDP, length 16
13:20:42.415582 IP 10.0.0.11.12345 > 10.0.0.2.12345: UDP, length 16
13:20:42.416161 IP 10.0.0.11.12345 > 10.0.0.2.12345: UDP, length 16
13:20:42.416743 IP 10.0.0.11.12345 > 10.0.0.2.12345: UDP, length 16
13:20:42.417319 IP 10.0.0.11.12345 > 10.0.0.2.12345: UDP, length 16
13:20:42.417905 IP 10.0.0.11.12345 > 10.0.0.2.12345: UDP, length 16
13:20:42.418481 IP 10.0.0.11.12345 > 10.0.0.2.12345: UDP, length 16
13:20:42.419060 IP 10.0.0.11.12345 > 10.0.0.2.12345: UDP, length 16
13:20:42.419632 IP 10.0.0.11.12345 > 10.0.0.2.12345: UDP, length 16
13:20:42.420211 IP 10.0.0.11.12345 > 10.0.0.2.12345: UDP, length 16
13:20:42.420783 IP 10.0.0.11.12345 > 10.0.0.2.12345: UDP, length 16
13:20:42.421369 IP 10.0.0.11.12345 > 10.0.0.2.12345: UDP, length 16
13:20:42.421953 IP 10.0.0.11.12345 > 10.0.0.2.12345: UDP, length 16
13:20:42.422537 IP 10.0.0.11.12345 > 10.0.0.2.12345: UDP, length 16
13:20:42.423123 IP 10.0.0.11.12345 > 10.0.0.2.12345: UDP, length 16
13:20:42.423706 IP 10.0.0.11.12345 > 10.0.0.2.12345: UDP, length 16
13:20:42.424290 IP 10.0.0.11.12345 > 10.0.0.2.12345: UDP, length 16
13:20:42.424873 IP 10.0.0.11.12345 > 10.0.0.2.12345: UDP, length 16
13:20:42.425456 IP 10.0.0.11.12345 > 10.0.0.2.12345: UDP, length 16
13:20:42.426039 IP 10.0.0.11.12345 > 10.0.0.2.12345: UDP, length 16
13:20:42.426618 IP 10.0.0.11.12345 > 10.0.0.2.12345: UDP, length 16
13:20:42.427201 IP 10.0.0.11.12345 > 10.0.0.2.12345: UDP, length 16
13:20:42.427785 IP 10.0.0.11.12345 > 10.0.0.2.12345: UDP, length 16
13:20:42.428368 IP 10.0.0.11.12345 > 10.0.0.2.12345: UDP, length 16
13:20:42.428958 IP 10.0.0.11.12345 > 10.0.0.2.12345: UDP, length 16
13:20:42.429564 IP 10.0.0.11.12345 > 10.0.0.2.12345: UDP, length 16
13:20:42.430153 IP 10.0.0.11.12345 > 10.0.0.2.12345: UDP, length 16
13:20:42.430748 IP 10.0.0.11.12345 > 10.0.0.2.12345: UDP, length 16
13:20:42.431351 IP 10.0.0.11.12345 > 10.0.0.2.12345: UDP, length 16
13:20:42.431932 IP 10.0.0.11.12345 > 10.0.0.2.12345: UDP, length 16
13:20:42.432518 IP 10.0.0.11.12345 > 10.0.0.2.12345: UDP, length 16
13:20:42.433095 IP 10.0.0.11.12345 > 10.0.0.2.12345: UDP, length 16
13:20:42.433673 IP 10.0.0.11.12345 > 10.0.0.2.12345: UDP, length 16
13:20:42.434259 IP 10.0.0.11.12345 > 10.0.0.2.12345: UDP, length 16
13:20:42.434848 IP 10.0.0.11.12345 > 10.0.0.2.12345: UDP, length 16
13:20:42.435429 IP 10.0.0.11.12345 > 10.0.0.2.12345: UDP, length 16
13:20:42.436011 IP 10.0.0.11.12345 > 10.0.0.2.12345: UDP, length 16
13:20:42.436611 IP 10.0.0.11.12345 > 10.0.0.2.12345: UDP, length 16
13:20:42.437210 IP 10.0.0.11.12345 > 10.0.0.2.12345: UDP, length 16
13:20:42.437789 IP 10.0.0.11.12345 > 10.0.0.2.12345: UDP, length 16
13:20:42.438400 IP 10.0.0.11.12345 > 10.0.0.2.12345: UDP, length 16
13:20:42.438979 IP 10.0.0.11.12345 > 10.0.0.2.12345: UDP, length 16
13:20:42.439561 IP 10.0.0.11.12345 > 10.0.0.2.12345: UDP, length 16
13:20:42.440137 IP 10.0.0.11.12345 > 10.0.0.2.12345: UDP, length 16
13:20:42.440720 IP 10.0.0.11.12345 > 10.0.0.2.12345: UDP, length 16
13:20:42.441304 IP 10.0.0.11.12345 > 10.0.0.2.12345: UDP, length 16
13:20:42.441898 IP 10.0.0.11.12345 > 10.0.0.2.12345: UDP, length 16
13:20:42.442474 IP 10.0.0.11.12345 > 10.0.0.2.12345: UDP, length 16
13:20:42.443057 IP 10.0.0.11.12345 > 10.0.0.2.12345: UDP, length 16
13:20:42.443632 IP 10.0.0.11.12345 > 10.0.0.2.12345: UDP, length 16
13:20:42.444219 IP 10.0.0.11.12345 > 10.0.0.2.12345: UDP, length 16
13:20:42.444811 IP 10.0.0.11.12345 > 10.0.0.2.12345: UDP, length 16
13:20:42.445402 IP 10.0.0.11.12345 > 10.0.0.2.12345: UDP, length 16
13:20:42.445971 IP 10.0.0.11.12345 > 10.0.0.2.12345: UDP, length 16
13:20:42.446562 IP 10.0.0.11.12345 > 10.0.0.2.12345: UDP, length 16
13:20:42.447152 IP 10.0.0.11.12345 > 10.0.0.2.12345: UDP, length 16
13:20:42.447732 IP 10.0.0.11.12345 > 10.0.0.2.12345: UDP, length 16
13:20:42.448311 IP 10.0.0.11.12345 > 10.0.0.2.12345: UDP, length 16
13:20:42.448905 IP 10.0.0.11.12345 > 10.0.0.2.12345: UDP, length 16
13:20:42.449476 IP 10.0.0.11.12345 > 10.0.0.2.12345: UDP, length 16
13:20:42.450066 IP 10.0.0.11.12345 > 10.0.0.2.12345: UDP, length 16
13:20:42.450653 IP 10.0.0.11.12345 > 10.0.0.2.12345: UDP, length 16
13:20:42.451233 IP 10.0.0.11.12345 > 10.0.0.2.12345: UDP, length 16
13:20:42.451809 IP 10.0.0.11.12345 > 10.0.0.2.12345: UDP, length 16
13:20:42.452384 IP 10.0.0.11.12345 > 10.0.0.2.12345: UDP, length 16
13:20:42.452957 IP 10.0.0.11.12345 > 10.0.0.2.12345: UDP, length 16
13:20:42.453545 IP 10.0.0.11.12345 > 10.0.0.2.12345: UDP, length 16
13:20:42.454136 IP 10.0.0.11.12345 > 10.0.0.2.12345: UDP, length 16
13:20:42.454723 IP 10.0.0.11.12345 > 10.0.0.2.12345: UDP, length 16
13:20:42.455312 IP 10.0.0.11.12345 > 10.0.0.2.12345: UDP, length 16
13:20:42.455894 IP 10.0.0.11.12345 > 10.0.0.2.12345: UDP, length 16
13:20:42.456488 IP 10.0.0.11.12345 > 10.0.0.2.12345: UDP, length 16
13:20:42.457063 IP 10.0.0.11.12345 > 10.0.0.2.12345: UDP, length 16
13:20:42.457655 IP 10.0.0.11.12345 > 10.0.0.2.12345: UDP, length 16
13:20:42.458239 IP 10.0.0.11.12345 > 10.0.0.2.12345: UDP, length 16
13:20:42.458815 IP 10.0.0.11.12345 > 10.0.0.2.12345: UDP, length 16
13:20:42.459386 IP 10.0.0.11.12345 > 10.0.0.2.12345: UDP, length 16
13:20:42.459961 IP 10.0.0.11.12345 > 10.0.0.2.12345: UDP, length 16
13:20:42.460544 IP 10.0.0.11.12345 > 10.0.0.2.12345: UDP, length 16
13:20:42.461122 IP 10.0.0.11.12345 > 10.0.0.2.12345: UDP, length 16
13:20:42.461702 IP 10.0.0.11.12345 > 10.0.0.2.12345: UDP, length 16
13:20:42.462281 IP 10.0.0.11.12345 > 10.0.0.2.12345: UDP, length 16
13:20:42.462858 IP 10.0.0.11.12345 > 10.0.0.2.12345: UDP, length 16
13:20:42.463418 IP 10.0.0.11.12345 > 10.0.0.2.12345: UDP, length 16
13:20:42.463979 IP 10.0.0.11.12345 > 10.0.0.2.12345: UDP, length 16
13:20:42.464555 IP 10.0.0.11.12345 > 10.0.0.2.12345: UDP, length 16
13:20:42.465129 IP 10.0.0.11.12345 > 10.0.0.2.12345: UDP, length 16
13:20:42.465704 IP 10.0.0.11.12345 > 10.0.0.2.12345: UDP, length 16
13:20:42.466337 IP 10.0.0.11.12345 > 10.0.0.2.12345: UDP, length 16
13:20:42.466917 IP 10.0.0.11.12345 > 10.0.0.2.12345: UDP, length 16
13:20:42.467500 IP 10.0.0.11.12345 > 10.0.0.2.12345: UDP, length 16
13:20:42.468084 IP 10.0.0.11.12345 > 10.0.0.2.12345: UDP, length 16
13:20:42.468666 IP 10.0.0.11.12345 > 10.0.0.2.12345: UDP, length 16
13:20:42.469255 IP 10.0.0.11.12345 > 10.0.0.2.12345: UDP, length 16
13:20:42.469838 IP 10.0.0.11.12345 > 10.0.0.2.12345: UDP, length 16
13:20:42.470425 IP 10.0.0.11.12345 > 10.0.0.2.12345: UDP, length 16
13:20:42.471022 IP 10.0.0.11.12345 > 10.0.0.2.12345: UDP, length 16
13:20:42.471610 IP 10.0.0.11.12345 > 10.0.0.2.12345: UDP, length 16
13:20:42.472255 IP 10.0.0.11.12345 > 10.0.0.2.12345: UDP, length 16
13:20:42.472848 IP 10.0.0.11.12345 > 10.0.0.2.12345: UDP, length 16
13:20:42.473439 IP 10.0.0.11.12345 > 10.0.0.2.12345: UDP, length 16
13:20:42.474026 IP 10.0.0.11.12345 > 10.0.0.2.12345: UDP, length 16
13:20:42.474616 IP 10.0.0.11.12345 > 10.0.0.2.12345: UDP, length 16
13:20:42.475210 IP 10.0.0.11.12345 > 10.0.0.2.12345: UDP, length 16
13:20:42.475808 IP 10.0.0.11.12345 > 10.0.0.2.12345: UDP, length 16
13:20:42.476407 IP 10.0.0.11.12345 > 10.0.0.2.12345: UDP, length 16
13:20:42.477001 IP 10.0.0.11.12345 > 10.0.0.2.12345: UDP, length 16
13:20:42.477591 IP 10.0.0.11.12345 > 10.0.0.2.12345: UDP, length 16
13:20:42.478206 IP 10.0.0.11.12345 > 10.0.0.2.12345: UDP, length 16
13:20:42.478798 IP 10.0.0.11.12345 > 10.0.0.2.12345: UDP, length 16
13:20:42.479412 IP 10.0.0.11.12345 > 10.0.0.2.12345: UDP, length 16
13:20:42.480001 IP 10.0.0.11.12345 > 10.0.0.2.12345: UDP, length 16
13:20:42.480579 IP 10.0.0.11.12345 > 10.0.0.2.12345: UDP, length 16
13:20:42.481194 IP 10.0.0.11.12345 > 10.0.0.2.12345: UDP, length 16
13:20:42.481810 IP 10.0.0.11.12345 > 10.0.0.2.12345: UDP, length 16
13:20:42.482417 IP 10.0.0.11.12345 > 10.0.0.2.12345: UDP, length 16
13:20:42.483020 IP 10.0.0.11.12345 > 10.0.0.2.12345: UDP, length 16
13:20:42.483616 IP 10.0.0.11.12345 > 10.0.0.2.12345: UDP, length 16
13:20:42.484221 IP 10.0.0.11.12345 > 10.0.0.2.12345: UDP, length 16
13:20:42.484808 IP 10.0.0.11.12345 > 10.0.0.2.12345: UDP, length 16
13:20:42.485414 IP 10.0.0.11.12345 > 10.0.0.2.12345: UDP, length 16
13:20:42.486035 IP 10.0.0.11.12345 > 10.0.0.2.12345: UDP, length 16
13:20:42.486651 IP 10.0.0.11.12345 > 10.0.0.2.12345: UDP, length 16
13:20:42.487240 IP 10.0.0.11.12345 > 10.0.0.2.12345: UDP, length 16
13:20:42.487821 IP 10.0.0.11.12345 > 10.0.0.2.12345: UDP, length 16
13:20:42.488432 IP 10.0.0.11.12345 > 10.0.0.2.12345: UDP, length 16
13:20:42.489045 IP 10.0.0.11.12345 > 10.0.0.2.12345: UDP, length 16
13:20:42.489658 IP 10.0.0.11.12345 > 10.0.0.2.12345: UDP, length 16
13:20:42.490270 IP 10.0.0.11.12345 > 10.0.0.2.12345: UDP, length 16
13:20:42.490876 IP 10.0.0.11.12345 > 10.0.0.2.12345: UDP, length 16
13:20:42.491483 IP 10.0.0.11.12345 > 10.0.0.2.12345: UDP, length 16
13:20:42.492097 IP 10.0.0.11.12345 > 10.0.0.2.12345: UDP, length 16
13:20:42.492702 IP 10.0.0.11.12345 > 10.0.0.2.12345: UDP, length 16
13:20:42.493321 IP 10.0.0.11.12345 > 10.0.0.2.12345: UDP, length 16
13:20:42.493934 IP 10.0.0.11.12345 > 10.0.0.2.12345: UDP, length 16
13:20:42.494546 IP 10.0.0.11.12345 > 10.0.0.2.12345: UDP, length 16
13:20:42.495176 IP 10.0.0.11.12345 > 10.0.0.2.12345: UDP, length 16
13:20:42.495770 IP 10.0.0.11.12345 > 10.0.0.2.12345: UDP, length 16
13:20:42.496400 IP 10.0.0.11.12345 > 10.0.0.2.12345: UDP, length 16
13:20:42.497027 IP 10.0.0.11.12345 > 10.0.0.2.12345: UDP, length 16
13:20:42.497655 IP 10.0.0.11.12345 > 10.0.0.2.12345: UDP, length 16
13:20:42.498286 IP 10.0.0.11.12345 > 10.0.0.2.12345: UDP, length 16
13:20:42.498884 IP 10.0.0.11.12345 > 10.0.0.2.12345: UDP, length 16
13:20:42.499492 IP 10.0.0.11.12345 > 10.0.0.2.12345: UDP, length 16
13:20:42.500097 IP 10.0.0.11.12345 > 10.0.0.2.12345: UDP, length 16
13:20:42.500693 IP 10.0.0.11.12345 > 10.0.0.2.12345: UDP, length 16
13:20:42.501300 IP 10.0.0.11.12345 > 10.0.0.2.12345: UDP, length 16
13:20:42.501900 IP 10.0.0.11.12345 > 10.0.0.2.12345: UDP, length 16
13:20:42.502520 IP 10.0.0.11.12345 > 10.0.0.2.12345: UDP, length 16
13:20:42.503142 IP 10.0.0.11.12345 > 10.0.0.2.12345: UDP, length 16
13:20:42.503751 IP 10.0.0.11.12345 > 10.0.0.2.12345: UDP, length 16
13:20:42.504359 IP 10.0.0.11.12345 > 10.0.0.2.12345: UDP, length 16
13:20:42.504954 IP 10.0.0.11.12345 > 10.0.0.2.12345: UDP, length 16
13:20:42.505572 IP 10.0.0.11.12345 > 10.0.0.2.12345: UDP, length 16
13:20:42.506192 IP 10.0.0.11.12345 > 10.0.0.2.12345: UDP, length 16
13:20:42.506814 IP 10.0.0.11.12345 > 10.0.0.2.12345: UDP, length 16
13:20:42.507406 IP 10.0.0.11.12345 > 10.0.0.2.12345: UDP, length 16
13:20:42.508025 IP 10.0.0.11.12345 > 10.0.0.2.12345: UDP, length 16
13:20:42.508646 IP 10.0.0.11.12345 > 10.0.0.2.12345: UDP, length 16
13:20:42.509267 IP 10.0.0.11.12345 > 10.0.0.2.12345: UDP, length 16
13:20:42.509860 IP 10.0.0.11.12345 > 10.0.0.2.12345: UDP, length 16
13:20:42.510444 IP 10.0.0.11.12345 > 10.0.0.2.12345: UDP, length 16
13:20:42.511027 IP 10.0.0.11.12345 > 10.0.0.2.12345: UDP, length 16
13:20:42.511608 IP 10.0.0.11.12345 > 10.0.0.2.12345: UDP, length 16
13:20:42.512209 IP 10.0.0.11.12345 > 10.0.0.2.12345: UDP, length 16
13:20:42.512810 IP 10.0.0.11.12345 > 10.0.0.2.12345: UDP, length 16
13:20:42.513441 IP 10.0.0.11.12345 > 10.0.0.2.12345: UDP, length 16
13:20:42.514077 IP 10.0.0.11.12345 > 10.0.0.2.12345: UDP, length 16
13:20:42.514704 IP 10.0.0.11.12345 > 10.0.0.2.12345: UDP, length 16
13:20:42.515304 IP 10.0.0.11.12345 > 10.0.0.2.12345: UDP, length 16
13:20:42.515940 IP 10.0.0.11.12345 > 10.0.0.2.12345: UDP, length 16
13:20:42.516537 IP 10.0.0.11.12345 > 10.0.0.2.12345: UDP, length 16
13:20:42.517122 IP 10.0.0.11.12345 > 10.0.0.2.12345: UDP, length 16
13:20:42.517706 IP 10.0.0.11.12345 > 10.0.0.2.12345: UDP, length 16
13:20:42.518289 IP 10.0.0.11.12345 > 10.0.0.2.12345: UDP, length 16
13:20:42.518872 IP 10.0.0.11.12345 > 10.0.0.2.12345: UDP, length 16
13:20:42.519490 IP 10.0.0.11.12345 > 10.0.0.2.12345: UDP, length 16
13:20:42.520079 IP 10.0.0.11.12345 > 10.0.0.2.12345: UDP, length 16
13:20:42.520674 IP 10.0.0.11.12345 > 10.0.0.2.12345: UDP, length 16
13:20:42.521294 IP 10.0.0.11.12345 > 10.0.0.2.12345: UDP, length 16
13:20:42.521912 IP 10.0.0.11.12345 > 10.0.0.2.12345: UDP, length 16
13:20:42.522501 IP 10.0.0.11.12345 > 10.0.0.2.12345: UDP, length 16
13:20:42.523112 IP 10.0.0.11.12345 > 10.0.0.2.12345: UDP, length 16
13:20:42.523754 IP 10.0.0.11.12345 > 10.0.0.2.12345: UDP, length 16
13:20:42.524366 IP 10.0.0.11.12345 > 10.0.0.2.12345: UDP, length 16
13:20:42.524976 IP 10.0.0.11.12345 > 10.0.0.2.12345: UDP, length 16
13:20:42.525587 IP 10.0.0.11.12345 > 10.0.0.2.12345: UDP, length 16
13:20:42.526198 IP 10.0.0.11.12345 > 10.0.0.2.12345: UDP, length 16
13:20:42.526808 IP 10.0.0.11.12345 > 10.0.0.2.12345: UDP, length 16
13:20:42.527419 IP 10.0.0.11.12345 > 10.0.0.2.12345: UDP, length 16
13:20:42.528006 IP 10.0.0.11.12345 > 10.0.0.2.12345: UDP, length 16
13:20:42.528587 IP 10.0.0.11.12345 > 10.0.0.2.12345: UDP, length 16
13:20:42.529195 IP 10.0.0.11.12345 > 10.0.0.2.12345: UDP, length 16
13:20:42.529805 IP 10.0.0.11.12345 > 10.0.0.2.12345: UDP, length 16
13:20:42.530416 IP 10.0.0.11.12345 > 10.0.0.2.12345: UDP, length 16
13:20:42.531028 IP 10.0.0.11.12345 > 10.0.0.2.12345: UDP, length 16
13:20:42.531647 IP 10.0.0.11.12345 > 10.0.0.2.12345: UDP, length 16
13:20:42.532238 IP 10.0.0.11.12345 > 10.0.0.2.12345: UDP, length 16
13:20:42.532840 IP 10.0.0.11.12345 > 10.0.0.2.12345: UDP, length 16
13:20:42.533429 IP 10.0.0.11.12345 > 10.0.0.2.12345: UDP, length 16
13:20:42.534015 IP 10.0.0.11.12345 > 10.0.0.2.12345: UDP, length 16
13:20:42.534599 IP 10.0.0.11.12345 > 10.0.0.2.12345: UDP, length 16
13:20:42.535220 IP 10.0.0.11.12345 > 10.0.0.2.12345: UDP, length 16
13:20:42.535807 IP 10.0.0.11.12345 > 10.0.0.2.12345: UDP, length 16
13:20:42.536404 IP 10.0.0.11.12345 > 10.0.0.2.12345: UDP, length 16
13:20:42.537028 IP 10.0.0.11.12345 > 10.0.0.2.12345: UDP, length 16
13:20:42.537652 IP 10.0.0.11.12345 > 10.0.0.2.12345: UDP, length 16
13:20:42.538276 IP 10.0.0.11.12345 > 10.0.0.2.12345: UDP, length 16
13:20:42.538901 IP 10.0.0.11.12345 > 10.0.0.2.12345: UDP, length 16
13:20:42.539527 IP 10.0.0.11.12345 > 10.0.0.2.12345: UDP, length 16
13:20:42.540121 IP 10.0.0.11.12345 > 10.0.0.2.12345: UDP, length 16
13:20:42.540743 IP 10.0.0.11.12345 > 10.0.0.2.12345: UDP, length 16
13:20:42.541374 IP 10.0.0.11.12345 > 10.0.0.2.12345: UDP, length 16
13:20:42.541998 IP 10.0.0.11.12345 > 10.0.0.2.12345: UDP, length 16
13:20:42.542625 IP 10.0.0.11.12345 > 10.0.0.2.12345: UDP, length 16
13:20:42.543250 IP 10.0.0.11.12345 > 10.0.0.2.12345: UDP, length 16
13:20:42.543868 IP 10.0.0.11.12345 > 10.0.0.2.12345: UDP, length 16
13:20:42.544484 IP 10.0.0.11.12345 > 10.0.0.2.12345: UDP, length 16
13:20:42.545099 IP 10.0.0.11.12345 > 10.0.0.2.12345: UDP, length 16
13:20:42.545715 IP 10.0.0.11.12345 > 10.0.0.2.12345: UDP, length 16
13:20:42.546334 IP 10.0.0.11.12345 > 10.0.0.2.12345: UDP, length 16
13:20:42.546947 IP 10.0.0.11.12345 > 10.0.0.2.12345: UDP, length 16
13:20:42.547550 IP 10.0.0.11.12345 > 10.0.0.2.12345: UDP, length 16
13:20:42.548127 IP 10.0.0.11.12345 > 10.0.0.2.12345: UDP, length 16
13:20:42.548721 IP 10.0.0.11.12345 > 10.0.0.2.12345: UDP, length 16
13:20:42.549309 IP 10.0.0.11.12345 > 10.0.0.2.12345: UDP, length 16
13:20:42.549896 IP 10.0.0.11.12345 > 10.0.0.2.12345: UDP, length 16
13:20:42.550477 IP 10.0.0.11.12345 > 10.0.0.2.12345: UDP, length 16
13:20:42.551076 IP 10.0.0.11.12345 > 10.0.0.2.12345: UDP, length 16
13:20:42.551659 IP 10.0.0.11.12345 > 10.0.0.2.12345: UDP, length 16
13:20:42.552281 IP 10.0.0.11.12345 > 10.0.0.2.12345: UDP, length 16
13:20:42.552907 IP 10.0.0.11.12345 > 10.0.0.2.12345: UDP, length 16
13:20:42.553521 IP 10.0.0.11.12345 > 10.0.0.2.12345: UDP, length 16
13:20:42.554140 IP 10.0.0.11.12345 > 10.0.0.2.12345: UDP, length 16
13:20:42.554734 IP 10.0.0.11.12345 > 10.0.0.2.12345: UDP, length 16
13:20:42.555328 IP 10.0.0.11.12345 > 10.0.0.2.12345: UDP, length 16
13:20:42.555926 IP 10.0.0.11.12345 > 10.0.0.2.12345: UDP, length 16
13:20:42.556502 IP 10.0.0.11.12345 > 10.0.0.2.12345: UDP, length 16
13:20:42.557086 IP 10.0.0.11.12345 > 10.0.0.2.12345: UDP, length 16
13:20:42.557697 IP 10.0.0.11.12345 > 10.0.0.2.12345: UDP, length 16
13:20:42.558309 IP 10.0.0.11.12345 > 10.0.0.2.12345: UDP, length 16
13:20:42.558922 IP 10.0.0.11.12345 > 10.0.0.2.12345: UDP, length 16
13:20:42.559534 IP 10.0.0.11.12345 > 10.0.0.2.12345: UDP, length 16
13:20:42.560150 IP 10.0.0.11.12345 > 10.0.0.2.12345: UDP, length 16
13:20:42.560760 IP 10.0.0.11.12345 > 10.0.0.2.12345: UDP, length 16
13:20:42.561370 IP 10.0.0.11.12345 > 10.0.0.2.12345: UDP, length 16
13:20:42.561980 IP 10.0.0.11.12345 > 10.0.0.2.12345: UDP, length 16
13:20:42.562570 IP 10.0.0.11.12345 > 10.0.0.2.12345: UDP, length 16
13:20:42.563160 IP 10.0.0.11.12345 > 10.0.0.2.12345: UDP, length 16
13:20:42.563730 IP 10.0.0.11.12345 > 10.0.0.2.12345: UDP, length 16
13:20:42.564345 IP 10.0.0.11.12345 > 10.0.0.2.12345: UDP, length 16
13:20:42.564957 IP 10.0.0.11.12345 > 10.0.0.2.12345: UDP, length 16
13:20:42.565602 IP 10.0.0.11.12345 > 10.0.0.2.12345: UDP, length 16
13:20:42.566228 IP 10.0.0.11.12345 > 10.0.0.2.12345: UDP, length 16
13:20:42.566853 IP 10.0.0.11.12345 > 10.0.0.2.12345: UDP, length 16
13:20:42.567477 IP 10.0.0.11.12345 > 10.0.0.2.12345: UDP, length 16
13:20:42.568102 IP 10.0.0.11.12345 > 10.0.0.2.12345: UDP, length 16
13:20:42.568726 IP 10.0.0.11.12345 > 10.0.0.2.12345: UDP, length 16
13:20:42.569350 IP 10.0.0.11.12345 > 10.0.0.2.12345: UDP, length 16
13:20:42.569946 IP 10.0.0.11.12345 > 10.0.0.2.12345: UDP, length 16
13:20:42.570565 IP 10.0.0.11.12345 > 10.0.0.2.12345: UDP, length 16
13:20:42.571168 IP 10.0.0.11.12345 > 10.0.0.2.12345: UDP, length 16
13:20:42.571763 IP 10.0.0.11.12345 > 10.0.0.2.12345: UDP, length 16
13:20:42.572385 IP 10.0.0.11.12345 > 10.0.0.2.12345: UDP, length 16
13:20:42.572992 IP 10.0.0.11.12345 > 10.0.0.2.12345: UDP, length 16
13:20:42.573595 IP 10.0.0.11.12345 > 10.0.0.2.12345: UDP, length 16
13:20:42.574219 IP 10.0.0.11.12345 > 10.0.0.2.12345: UDP, length 16
13:20:42.574844 IP 10.0.0.11.12345 > 10.0.0.2.12345: UDP, length 16
13:20:42.575462 IP 10.0.0.11.12345 > 10.0.0.2.12345: UDP, length 16
13:20:42.576064 IP 10.0.0.11.12345 > 10.0.0.2.12345: UDP, length 16
13:20:42.576680 IP 10.0.0.11.12345 > 10.0.0.2.12345: UDP, length 16
13:20:42.577296 IP 10.0.0.11.12345 > 10.0.0.2.12345: UDP, length 16
13:20:42.577912 IP 10.0.0.11.12345 > 10.0.0.2.12345: UDP, length 16
13:20:42.578514 IP 10.0.0.11.12345 > 10.0.0.2.12345: UDP, length 16
13:20:42.579133 IP 10.0.0.11.12345 > 10.0.0.2.12345: UDP, length 16
13:20:42.579749 IP 10.0.0.11.12345 > 10.0.0.2.12345: UDP, length 16
13:20:42.580365 IP 10.0.0.11.12345 > 10.0.0.2.12345: UDP, length 16
13:20:42.580981 IP 10.0.0.11.12345 > 10.0.0.2.12345: UDP, length 16
13:20:42.581598 IP 10.0.0.11.12345 > 10.0.0.2.12345: UDP, length 16
13:20:42.582221 IP 10.0.0.11.12345 > 10.0.0.2.12345: UDP, length 16
13:20:42.582837 IP 10.0.0.11.12345 > 10.0.0.2.12345: UDP, length 16
13:20:42.583454 IP 10.0.0.11.12345 > 10.0.0.2.12345: UDP, length 16
13:20:42.584070 IP 10.0.0.11.12345 > 10.0.0.2.12345: UDP, length 16
13:20:42.584686 IP 10.0.0.11.12345 > 10.0.0.2.12345: UDP, length 16
13:20:42.585302 IP 10.0.0.11.12345 > 10.0.0.2.12345: UDP, length 16
13:20:42.585925 IP 10.0.0.11.12345 > 10.0.0.2.12345: UDP, length 16
13:20:42.586533 IP 10.0.0.11.12345 > 10.0.0.2.12345: UDP, length 16
13:20:42.587147 IP 10.0.0.11.12345 > 10.0.0.2.12345: UDP, length 16
13:20:42.587757 IP 10.0.0.11.12345 > 10.0.0.2.12345: UDP, length 16
13:20:42.588359 IP 10.0.0.11.12345 > 10.0.0.2.12345: UDP, length 16
13:20:42.588984 IP 10.0.0.11.12345 > 10.0.0.2.12345: UDP, length 16
13:20:42.589610 IP 10.0.0.11.12345 > 10.0.0.2.12345: UDP, length 16
13:20:42.590233 IP 10.0.0.11.12345 > 10.0.0.2.12345: UDP, length 16
13:20:42.590858 IP 10.0.0.11.12345 > 10.0.0.2.12345: UDP, length 16
13:20:42.591483 IP 10.0.0.11.12345 > 10.0.0.2.12345: UDP, length 16
13:20:42.592107 IP 10.0.0.11.12345 > 10.0.0.2.12345: UDP, length 16
13:20:42.592719 IP 10.0.0.11.12345 > 10.0.0.2.12345: UDP, length 16
13:20:42.593344 IP 10.0.0.11.12345 > 10.0.0.2.12345: UDP, length 16
13:20:42.593969 IP 10.0.0.11.12345 > 10.0.0.2.12345: UDP, length 16
13:20:42.594594 IP 10.0.0.11.12345 > 10.0.0.2.12345: UDP, length 16
13:20:42.595219 IP 10.0.0.11.12345 > 10.0.0.2.12345: UDP, length 16
13:20:42.595840 IP 10.0.0.11.12345 > 10.0.0.2.12345: UDP, length 16
13:20:42.596458 IP 10.0.0.11.12345 > 10.0.0.2.12345: UDP, length 16
13:20:42.597096 IP 10.0.0.11.12345 > 10.0.0.2.12345: UDP, length 16
13:20:42.597731 IP 10.0.0.11.12345 > 10.0.0.2.12345: UDP, length 16
13:20:42.598366 IP 10.0.0.11.12345 > 10.0.0.2.12345: UDP, length 16
13:20:42.598972 IP 10.0.0.11.12345 > 10.0.0.2.12345: UDP, length 16
13:20:42.599608 IP 10.0.0.11.12345 > 10.0.0.2.12345: UDP, length 16
13:20:42.600233 IP 10.0.0.11.12345 > 10.0.0.2.12345: UDP, length 16
13:20:42.600851 IP 10.0.0.11.12345 > 10.0.0.2.12345: UDP, length 16
13:20:42.601468 IP 10.0.0.11.12345 > 10.0.0.2.12345: UDP, length 16
13:20:42.602108 IP 10.0.0.11.12345 > 10.0.0.2.12345: UDP, length 16
13:20:42.602711 IP 10.0.0.11.12345 > 10.0.0.2.12345: UDP, length 16
13:20:42.603314 IP 10.0.0.11.12345 > 10.0.0.2.12345: UDP, length 16
13:20:42.603938 IP 10.0.0.11.12345 > 10.0.0.2.12345: UDP, length 16
13:20:42.604546 IP 10.0.0.11.12345 > 10.0.0.2.12345: UDP, length 16
13:20:42.605139 IP 10.0.0.11.12345 > 10.0.0.2.12345: UDP, length 16
13:20:42.605729 IP 10.0.0.11.12345 > 10.0.0.2.12345: UDP, length 16
13:20:42.606327 IP 10.0.0.11.12345 > 10.0.0.2.12345: UDP, length 16
13:20:42.606927 IP 10.0.0.11.12345 > 10.0.0.2.12345: UDP, length 16
13:20:42.607559 IP 10.0.0.11.12345 > 10.0.0.2.12345: UDP, length 16
13:20:42.608157 IP 10.0.0.11.12345 > 10.0.0.2.12345: UDP, length 16
13:20:42.608789 IP 10.0.0.11.12345 > 10.0.0.2.12345: UDP, length 16
13:20:42.609423 IP 10.0.0.11.12345 > 10.0.0.2.12345: UDP, length 16
13:20:42.610057 IP 10.0.0.11.12345 > 10.0.0.2.12345: UDP, length 16
13:20:42.610694 IP 10.0.0.11.12345 > 10.0.0.2.12345: UDP, length 16
13:20:42.611337 IP 10.0.0.11.12345 > 10.0.0.2.12345: UDP, length 16
13:20:42.611980 IP 10.0.0.11.12345 > 10.0.0.2.12345: UDP, length 16
13:20:42.612622 IP 10.0.0.11.12345 > 10.0.0.2.12345: UDP, length 16
13:20:42.613259 IP 10.0.0.11.12345 > 10.0.0.2.12345: UDP, length 16
13:20:42.613895 IP 10.0.0.11.12345 > 10.0.0.2.12345: UDP, length 16
13:20:42.614530 IP 10.0.0.11.12345 > 10.0.0.2.12345: UDP, length 16
13:20:42.615165 IP 10.0.0.11.12345 > 10.0.0.2.12345: UDP, length 16
13:20:42.615802 IP 10.0.0.11.12345 > 10.0.0.2.12345: UDP, length 16
13:20:42.616441 IP 10.0.0.11.12345 > 10.0.0.2.12345: UDP, length 16
13:20:42.617077 IP 10.0.0.11.12345 > 10.0.0.2.12345: UDP, length 16
13:20:42.617717 IP 10.0.0.11.12345 > 10.0.0.2.12345: UDP, length 16
13:20:42.618352 IP 10.0.0.11.12345 > 10.0.0.2.12345: UDP, length 16
13:20:42.618989 IP 10.0.0.11.12345 > 10.0.0.2.12345: UDP, length 16
13:20:42.619612 IP 10.0.0.11.12345 > 10.0.0.2.12345: UDP, length 16
13:20:42.620240 IP 10.0.0.11.12345 > 10.0.0.2.12345: UDP, length 16
13:20:42.620884 IP 10.0.0.11.12345 > 10.0.0.2.12345: UDP, length 16
13:20:42.621529 IP 10.0.0.11.12345 > 10.0.0.2.12345: UDP, length 16
13:20:42.622134 IP 10.0.0.11.12345 > 10.0.0.2.12345: UDP, length 16
13:20:42.622726 IP 10.0.0.11.12345 > 10.0.0.2.12345: UDP, length 16
13:20:42.623325 IP 10.0.0.11.12345 > 10.0.0.2.12345: UDP, length 16
13:20:42.623925 IP 10.0.0.11.12345 > 10.0.0.2.12345: UDP, length 16
13:20:42.624515 IP 10.0.0.11.12345 > 10.0.0.2.12345: UDP, length 16
13:20:42.625129 IP 10.0.0.11.12345 > 10.0.0.2.12345: UDP, length 16
13:20:42.625745 IP 10.0.0.11.12345 > 10.0.0.2.12345: UDP, length 16
13:20:42.626361 IP 10.0.0.11.12345 > 10.0.0.2.12345: UDP, length 16
13:20:42.626976 IP 10.0.0.11.12345 > 10.0.0.2.12345: UDP, length 16
13:20:42.627592 IP 10.0.0.11.12345 > 10.0.0.2.12345: UDP, length 16
13:20:42.628209 IP 10.0.0.11.12345 > 10.0.0.2.12345: UDP, length 16
13:20:42.628824 IP 10.0.0.11.12345 > 10.0.0.2.12345: UDP, length 16
13:20:42.629439 IP 10.0.0.11.12345 > 10.0.0.2.12345: UDP, length 16
13:20:42.630054 IP 10.0.0.11.12345 > 10.0.0.2.12345: UDP, length 16
13:20:42.630669 IP 10.0.0.11.12345 > 10.0.0.2.12345: UDP, length 16
13:20:42.631283 IP 10.0.0.11.12345 > 10.0.0.2.12345: UDP, length 16
13:20:42.631898 IP 10.0.0.11.12345 > 10.0.0.2.12345: UDP, length 16
13:20:42.632504 IP 10.0.0.11.12345 > 10.0.0.2.12345: UDP, length 16
13:20:42.633119 IP 10.0.0.11.12345 > 10.0.0.2.12345: UDP, length 16
13:20:42.633742 IP 10.0.0.11.12345 > 10.0.0.2.12345: UDP, length 16
13:20:42.634339 IP 10.0.0.11.12345 > 10.0.0.2.12345: UDP, length 16
13:20:42.634960 IP 10.0.0.11.12345 > 10.0.0.2.12345: UDP, length 16
13:20:42.635598 IP 10.0.0.11.12345 > 10.0.0.2.12345: UDP, length 16
13:20:42.636236 IP 10.0.0.11.12345 > 10.0.0.2.12345: UDP, length 16
13:20:42.636873 IP 10.0.0.11.12345 > 10.0.0.2.12345: UDP, length 16
13:20:42.637510 IP 10.0.0.11.12345 > 10.0.0.2.12345: UDP, length 16
13:20:42.638139 IP 10.0.0.11.12345 > 10.0.0.2.12345: UDP, length 16
13:20:42.638776 IP 10.0.0.11.12345 > 10.0.0.2.12345: UDP, length 16
13:20:42.639412 IP 10.0.0.11.12345 > 10.0.0.2.12345: UDP, length 16
13:20:42.640050 IP 10.0.0.11.12345 > 10.0.0.2.12345: UDP, length 16
13:20:42.640685 IP 10.0.0.11.12345 > 10.0.0.2.12345: UDP, length 16
13:20:42.641321 IP 10.0.0.11.12345 > 10.0.0.2.12345: UDP, length 16
13:20:42.641959 IP 10.0.0.11.12345 > 10.0.0.2.12345: UDP, length 16
13:20:42.642594 IP 10.0.0.11.12345 > 10.0.0.2.12345: UDP, length 16
13:20:42.643232 IP 10.0.0.11.12345 > 10.0.0.2.12345: UDP, length 16
13:20:42.643869 IP 10.0.0.11.12345 > 10.0.0.2.12345: UDP, length 16
13:20:42.644504 IP 10.0.0.11.12345 > 10.0.0.2.12345: UDP, length 16
13:20:42.645143 IP 10.0.0.11.12345 > 10.0.0.2.12345: UDP, length 16
13:20:42.645779 IP 10.0.0.11.12345 > 10.0.0.2.12345: UDP, length 16
13:20:42.646415 IP 10.0.0.11.12345 > 10.0.0.2.12345: UDP, length 16
13:20:42.647052 IP 10.0.0.11.12345 > 10.0.0.2.12345: UDP, length 16
13:20:42.647732 IP 10.0.0.11.12345 > 10.0.0.2.12345: UDP, length 16
13:20:42.648369 IP 10.0.0.11.12345 > 10.0.0.2.12345: UDP, length 16
13:20:42.648975 IP 10.0.0.11.12345 > 10.0.0.2.12345: UDP, length 16
13:20:42.649612 IP 10.0.0.11.12345 > 10.0.0.2.12345: UDP, length 16
13:20:42.650268 IP 10.0.0.11.12345 > 10.0.0.2.12345: UDP, length 16
13:20:42.650915 IP 10.0.0.11.12345 > 10.0.0.2.12345: UDP, length 16
13:20:42.651560 IP 10.0.0.11.12345 > 10.0.0.2.12345: UDP, length 16
13:20:42.652205 IP 10.0.0.11.12345 > 10.0.0.2.12345: UDP, length 16
13:20:42.652852 IP 10.0.0.11.12345 > 10.0.0.2.12345: UDP, length 16
13:20:42.653487 IP 10.0.0.11.12345 > 10.0.0.2.12345: UDP, length 16
13:20:42.654107 IP 10.0.0.11.12345 > 10.0.0.2.12345: UDP, length 16
13:20:42.654755 IP 10.0.0.11.12345 > 10.0.0.2.12345: UDP, length 16
13:20:42.655399 IP 10.0.0.11.12345 > 10.0.0.2.12345: UDP, length 16
13:20:42.656047 IP 10.0.0.11.12345 > 10.0.0.2.12345: UDP, length 16
13:20:42.656728 IP 10.0.0.11.12345 > 10.0.0.2.12345: UDP, length 16
13:20:42.657338 IP 10.0.0.11.12345 > 10.0.0.2.12345: UDP, length 16
13:20:42.657951 IP 10.0.0.11.12345 > 10.0.0.2.12345: UDP, length 16
13:20:42.658594 IP 10.0.0.11.12345 > 10.0.0.2.12345: UDP, length 16
13:20:42.659238 IP 10.0.0.11.12345 > 10.0.0.2.12345: UDP, length 16
13:20:42.659878 IP 10.0.0.11.12345 > 10.0.0.2.12345: UDP, length 16
13:20:42.660512 IP 10.0.0.11.12345 > 10.0.0.2.12345: UDP, length 16
13:20:42.661147 IP 10.0.0.11.12345 > 10.0.0.2.12345: UDP, length 16
13:20:42.661781 IP 10.0.0.11.12345 > 10.0.0.2.12345: UDP, length 16
13:20:42.662413 IP 10.0.0.11.12345 > 10.0.0.2.12345: UDP, length 16
13:20:42.663047 IP 10.0.0.11.12345 > 10.0.0.2.12345: UDP, length 16
13:20:42.663725 IP 10.0.0.11.12345 > 10.0.0.2.12345: UDP, length 16
13:20:42.664359 IP 10.0.0.11.12345 > 10.0.0.2.12345: UDP, length 16
13:20:42.664993 IP 10.0.0.11.12345 > 10.0.0.2.12345: UDP, length 16
13:20:42.665637 IP 10.0.0.11.12345 > 10.0.0.2.12345: UDP, length 16
13:20:42.666246 IP 10.0.0.11.12345 > 10.0.0.2.12345: UDP, length 16
13:20:42.666839 IP 10.0.0.11.12345 > 10.0.0.2.12345: UDP, length 16
13:20:42.667434 IP 10.0.0.11.12345 > 10.0.0.2.12345: UDP, length 16
13:20:42.668075 IP 10.0.0.11.12345 > 10.0.0.2.12345: UDP, length 16
13:20:42.668714 IP 10.0.0.11.12345 > 10.0.0.2.12345: UDP, length 16
13:20:42.669333 IP 10.0.0.11.12345 > 10.0.0.2.12345: UDP, length 16
13:20:42.669953 IP 10.0.0.11.12345 > 10.0.0.2.12345: UDP, length 16
13:20:42.670571 IP 10.0.0.11.12345 > 10.0.0.2.12345: UDP, length 16
13:20:42.671176 IP 10.0.0.11.12345 > 10.0.0.2.12345: UDP, length 16
13:20:42.671822 IP 10.0.0.11.12345 > 10.0.0.2.12345: UDP, length 16
13:20:42.672430 IP 10.0.0.11.12345 > 10.0.0.2.12345: UDP, length 16
13:20:42.673032 IP 10.0.0.11.12345 > 10.0.0.2.12345: UDP, length 16
13:20:42.673674 IP 10.0.0.11.12345 > 10.0.0.2.12345: UDP, length 16
13:20:42.674330 IP 10.0.0.11.12345 > 10.0.0.2.12345: UDP, length 16
13:20:42.674976 IP 10.0.0.11.12345 > 10.0.0.2.12345: UDP, length 16
13:20:42.675583 IP 10.0.0.11.12345 > 10.0.0.2.12345: UDP, length 16
13:20:42.676198 IP 10.0.0.11.12345 > 10.0.0.2.12345: UDP, length 16
13:20:42.676804 IP 10.0.0.11.12345 > 10.0.0.2.12345: UDP, length 16
13:20:42.677397 IP 10.0.0.11.12345 > 10.0.0.2.12345: UDP, length 16
13:20:42.678076 IP 10.0.0.11.12345 > 10.0.0.2.12345: UDP, length 16
13:20:42.678740 IP 10.0.0.11.12345 > 10.0.0.2.12345: UDP, length 16
13:20:42.679403 IP 10.0.0.11.12345 > 10.0.0.2.12345: UDP, length 16
13:20:42.680059 IP 10.0.0.11.12345 > 10.0.0.2.12345: UDP, length 16
13:20:42.680708 IP 10.0.0.11.12345 > 10.0.0.2.12345: UDP, length 16
13:20:42.681344 IP 10.0.0.11.12345 > 10.0.0.2.12345: UDP, length 16
13:20:42.681982 IP 10.0.0.11.12345 > 10.0.0.2.12345: UDP, length 16
13:20:42.682586 IP 10.0.0.11.12345 > 10.0.0.2.12345: UDP, length 16
13:20:42.683234 IP 10.0.0.11.12345 > 10.0.0.2.12345: UDP, length 16
13:20:42.683853 IP 10.0.0.11.12345 > 10.0.0.2.12345: UDP, length 16
13:20:42.684456 IP 10.0.0.11.12345 > 10.0.0.2.12345: UDP, length 16
13:20:42.685104 IP 10.0.0.11.12345 > 10.0.0.2.12345: UDP, length 16
13:20:42.685720 IP 10.0.0.11.12345 > 10.0.0.2.12345: UDP, length 16
13:20:42.686344 IP 10.0.0.11.12345 > 10.0.0.2.12345: UDP, length 16
13:20:42.686968 IP 10.0.0.11.12345 > 10.0.0.2.12345: UDP, length 16
13:20:42.687572 IP 10.0.0.11.12345 > 10.0.0.2.12345: UDP, length 16
13:20:42.688174 IP 10.0.0.11.12345 > 10.0.0.2.12345: UDP, length 16
13:20:42.688763 IP 10.0.0.11.12345 > 10.0.0.2.12345: UDP, length 16
13:20:42.689392 IP 10.0.0.11.12345 > 10.0.0.2.12345: UDP, length 16
13:20:42.689991 IP 10.0.0.11.12345 > 10.0.0.2.12345: UDP, length 16
13:20:42.690585 IP 10.0.0.11.12345 > 10.0.0.2.12345: UDP, length 16
13:20:42.691175 IP 10.0.0.11.12345 > 10.0.0.2.12345: UDP, length 16
13:20:42.691766 IP 10.0.0.11.12345 > 10.0.0.2.12345: UDP, length 16
13:20:42.692393 IP 10.0.0.11.12345 > 10.0.0.2.12345: UDP, length 16
13:20:42.693023 IP 10.0.0.11.12345 > 10.0.0.2.12345: UDP, length 16
13:20:42.693653 IP 10.0.0.11.12345 > 10.0.0.2.12345: UDP, length 16
13:20:42.694261 IP 10.0.0.11.12345 > 10.0.0.2.12345: UDP, length 16
13:20:42.694891 IP 10.0.0.11.12345 > 10.0.0.2.12345: UDP, length 16
13:20:42.695539 IP 10.0.0.11.12345 > 10.0.0.2.12345: UDP, length 16
13:20:42.696186 IP 10.0.0.11.12345 > 10.0.0.2.12345: UDP, length 16
13:20:42.696834 IP 10.0.0.11.12345 > 10.0.0.2.12345: UDP, length 16
13:20:42.697484 IP 10.0.0.11.12345 > 10.0.0.2.12345: UDP, length 16
13:20:42.698130 IP 10.0.0.11.12345 > 10.0.0.2.12345: UDP, length 16
13:20:42.698767 IP 10.0.0.11.12345 > 10.0.0.2.12345: UDP, length 16
13:20:42.699397 IP 10.0.0.11.12345 > 10.0.0.2.12345: UDP, length 16
13:20:42.700032 IP 10.0.0.11.12345 > 10.0.0.2.12345: UDP, length 16
13:20:42.700667 IP 10.0.0.11.12345 > 10.0.0.2.12345: UDP, length 16
13:20:42.701299 IP 10.0.0.11.12345 > 10.0.0.2.12345: UDP, length 16
13:20:42.701933 IP 10.0.0.11.12345 > 10.0.0.2.12345: UDP, length 16
13:20:42.702550 IP 10.0.0.11.12345 > 10.0.0.2.12345: UDP, length 16
13:20:42.703164 IP 10.0.0.11.12345 > 10.0.0.2.12345: UDP, length 16
13:20:42.703767 IP 10.0.0.11.12345 > 10.0.0.2.12345: UDP, length 16
13:20:42.704367 IP 10.0.0.11.12345 > 10.0.0.2.12345: UDP, length 16
13:20:42.704966 IP 10.0.0.11.12345 > 10.0.0.2.12345: UDP, length 16
13:20:42.705560 IP 10.0.0.11.12345 > 10.0.0.2.12345: UDP, length 16
13:20:42.706151 IP 10.0.0.11.12345 > 10.0.0.2.12345: UDP, length 16
13:20:42.706778 IP 10.0.0.11.12345 > 10.0.0.2.12345: UDP, length 16
13:20:42.707408 IP 10.0.0.11.12345 > 10.0.0.2.12345: UDP, length 16
13:20:42.708039 IP 10.0.0.11.12345 > 10.0.0.2.12345: UDP, length 16
13:20:42.708670 IP 10.0.0.11.12345 > 10.0.0.2.12345: UDP, length 16
13:20:42.709300 IP 10.0.0.11.12345 > 10.0.0.2.12345: UDP, length 16
13:20:42.709933 IP 10.0.0.11.12345 > 10.0.0.2.12345: UDP, length 16
13:20:42.710562 IP 10.0.0.11.12345 > 10.0.0.2.12345: UDP, length 16
13:20:42.711192 IP 10.0.0.11.12345 > 10.0.0.2.12345: UDP, length 16
13:20:42.711806 IP 10.0.0.11.12345 > 10.0.0.2.12345: UDP, length 16
13:20:42.712454 IP 10.0.0.11.12345 > 10.0.0.2.12345: UDP, length 16
13:20:42.713103 IP 10.0.0.11.12345 > 10.0.0.2.12345: UDP, length 16
13:20:42.713750 IP 10.0.0.11.12345 > 10.0.0.2.12345: UDP, length 16
13:20:42.714398 IP 10.0.0.11.12345 > 10.0.0.2.12345: UDP, length 16
