12:59:53.168028 IP6 asus.mdns > ff02::fb.mdns: 0 [9q] PTR (QM)? _ipps._tcp.local. PTR (QM)? _ftp._tcp.local. PTR (QM)? _webdav._tcp.local. PTR (QM)? _webdavs._tcp.local. PTR (QM)? _sftp-ssh._tcp.local. PTR (QM)? _smb._tcp.local. PTR (QM)? _afpovertcp._tcp.local. PTR (QM)? _nfs._tcp.local. PTR (QM)? _ipp._tcp.local. (141)
13:00:29.516575 IP 10.0.0.3.12345 > 10.0.0.2.12345: UDP, length 16
13:00:29.517071 IP 10.0.0.3.12345 > 10.0.0.2.12345: UDP, length 16
13:00:29.517663 IP 10.0.0.3.12345 > 10.0.0.2.12345: UDP, length 16
13:00:29.518250 IP 10.0.0.3.12345 > 10.0.0.2.12345: UDP, length 16
13:00:29.518836 IP 10.0.0.3.12345 > 10.0.0.2.12345: UDP, length 16
13:00:29.519414 IP 10.0.0.3.12345 > 10.0.0.2.12345: UDP, length 16
13:00:29.519989 IP 10.0.0.3.12345 > 10.0.0.2.12345: UDP, length 16
13:00:29.520564 IP 10.0.0.3.12345 > 10.0.0.2.12345: UDP, length 16
13:00:29.521145 IP 10.0.0.3.12345 > 10.0.0.2.12345: UDP, length 16
13:00:29.521730 IP 10.0.0.3.12345 > 10.0.0.2.12345: UDP, length 16
13:00:29.522310 IP 10.0.0.3.12345 > 10.0.0.2.12345: UDP, length 16
13:00:29.522896 IP 10.0.0.3.12345 > 10.0.0.2.12345: UDP, length 16
13:00:29.523479 IP 10.0.0.3.12345 > 10.0.0.2.12345: UDP, length 16
13:00:29.524056 IP 10.0.0.3.12345 > 10.0.0.2.12345: UDP, length 16
13:00:29.524663 IP 10.0.0.3.12345 > 10.0.0.2.12345: UDP, length 16
13:00:29.525270 IP 10.0.0.3.12345 > 10.0.0.2.12345: UDP, length 16
13:00:29.525877 IP 10.0.0.3.12345 > 10.0.0.2.12345: UDP, length 16
13:00:29.526460 IP 10.0.0.3.12345 > 10.0.0.2.12345: UDP, length 16
13:00:29.527037 IP 10.0.0.3.12345 > 10.0.0.2.12345: UDP, length 16
13:00:29.527607 IP 10.0.0.3.12345 > 10.0.0.2.12345: UDP, length 16
13:00:29.528187 IP 10.0.0.3.12345 > 10.0.0.2.12345: UDP, length 16
13:00:29.528763 IP 10.0.0.3.12345 > 10.0.0.2.12345: UDP, length 16
13:00:29.529342 IP 10.0.0.3.12345 > 10.0.0.2.12345: UDP, length 16
13:00:29.529929 IP 10.0.0.3.12345 > 10.0.0.2.12345: UDP, length 16
13:00:29.530507 IP 10.0.0.3.12345 > 10.0.0.2.12345: UDP, length 16
13:00:29.531084 IP 10.0.0.3.12345 > 10.0.0.2.12345: UDP, length 16
13:00:29.531656 IP 10.0.0.3.12345 > 10.0.0.2.12345: UDP, length 16
13:00:29.532230 IP 10.0.0.3.12345 > 10.0.0.2.12345: UDP, length 16
13:00:29.532800 IP 10.0.0.3.12345 > 10.0.0.2.12345: UDP, length 16
13:00:29.533360 IP 10.0.0.3.12345 > 10.0.0.2.12345: UDP, length 16
13:00:29.533936 IP 10.0.0.3.12345 > 10.0.0.2.12345: UDP, length 16
13:00:29.534507 IP 10.0.0.3.12345 > 10.0.0.2.12345: UDP, length 16
13:00:29.535076 IP 10.0.0.3.12345 > 10.0.0.2.12345: UDP, length 16
13:00:29.535646 IP 10.0.0.3.12345 > 10.0.0.2.12345: UDP, length 16
13:00:29.536229 IP 10.0.0.3.12345 > 10.0.0.2.12345: UDP, length 16
13:00:29.536812 IP 10.0.0.3.12345 > 10.0.0.2.12345: UDP, length 16
13:00:29.537395 IP 10.0.0.3.12345 > 10.0.0.2.12345: UDP, length 16
13:00:29.537984 IP 10.0.0.3.12345 > 10.0.0.2.12345: UDP, length 16
13:00:29.538575 IP 10.0.0.3.12345 > 10.0.0.2.12345: UDP, length 16
13:00:29.539165 IP 10.0.0.3.12345 > 10.0.0.2.12345: UDP, length 16
13:00:29.539762 IP 10.0.0.3.12345 > 10.0.0.2.12345: UDP, length 16
13:00:29.540349 IP 10.0.0.3.12345 > 10.0.0.2.12345: UDP, length 16
13:00:29.540935 IP 10.0.0.3.12345 > 10.0.0.2.12345: UDP, length 16
13:00:29.541522 IP 10.0.0.3.12345 > 10.0.0.2.12345: UDP, length 16
13:00:29.542109 IP 10.0.0.3.12345 > 10.0.0.2.12345: UDP, length 16
13:00:29.542693 IP 10.0.0.3.12345 > 10.0.0.2.12345: UDP, length 16
13:00:29.543276 IP 10.0.0.3.12345 > 10.0.0.2.12345: UDP, length 16
13:00:29.543867 IP 10.0.0.3.12345 > 10.0.0.2.12345: UDP, length 16
13:00:29.544433 IP 10.0.0.3.12345 > 10.0.0.2.12345: UDP, length 16
13:00:29.545003 IP 10.0.0.3.12345 > 10.0.0.2.12345: UDP, length 16
13:00:29.545572 IP 10.0.0.3.12345 > 10.0.0.2.12345: UDP, length 16
13:00:29.546153 IP 10.0.0.3.12345 > 10.0.0.2.12345: UDP, length 16
13:00:29.546727 IP 10.0.0.3.12345 > 10.0.0.2.12345: UDP, length 16
13:00:29.547296 IP 10.0.0.3.12345 > 10.0.0.2.12345: UDP, length 16
13:00:29.547857 IP 10.0.0.3.12345 > 10.0.0.2.12345: UDP, length 16
13:00:29.548426 IP 10.0.0.3.12345 > 10.0.0.2.12345: UDP, length 16
13:00:29.549020 IP 10.0.0.3.12345 > 10.0.0.2.12345: UDP, length 16
13:00:29.549603 IP 10.0.0.3.12345 > 10.0.0.2.12345: UDP, length 16
13:00:29.550201 IP 10.0.0.3.12345 > 10.0.0.2.12345: UDP, length 16
13:00:29.550787 IP 10.0.0.3.12345 > 10.0.0.2.12345: UDP, length 16
13:00:29.551374 IP 10.0.0.3.12345 > 10.0.0.2.12345: UDP, length 16
13:00:29.551954 IP 10.0.0.3.12345 > 10.0.0.2.12345: UDP, length 16
13:00:29.552525 IP 10.0.0.3.12345 > 10.0.0.2.12345: UDP, length 16
13:00:29.553095 IP 10.0.0.3.12345 > 10.0.0.2.12345: UDP, length 16
13:00:29.553661 IP 10.0.0.3.12345 > 10.0.0.2.12345: UDP, length 16
13:00:29.554228 IP 10.0.0.3.12345 > 10.0.0.2.12345: UDP, length 16
13:00:29.554814 IP 10.0.0.3.12345 > 10.0.0.2.12345: UDP, length 16
13:00:29.555399 IP 10.0.0.3.12345 > 10.0.0.2.12345: UDP, length 16
13:00:29.555986 IP 10.0.0.3.12345 > 10.0.0.2.12345: UDP, length 16
13:00:29.556565 IP 10.0.0.3.12345 > 10.0.0.2.12345: UDP, length 16
13:00:29.557139 IP 10.0.0.3.12345 > 10.0.0.2.12345: UDP, length 16
13:00:29.557713 IP 10.0.0.3.12345 > 10.0.0.2.12345: UDP, length 16
13:00:29.558295 IP 10.0.0.3.12345 > 10.0.0.2.12345: UDP, length 16
13:00:29.558885 IP 10.0.0.3.12345 > 10.0.0.2.12345: UDP, length 16
13:00:29.559473 IP 10.0.0.3.12345 > 10.0.0.2.12345: UDP, length 16
13:00:29.560057 IP 10.0.0.3.12345 > 10.0.0.2.12345: UDP, length 16
13:00:29.560642 IP 10.0.0.3.12345 > 10.0.0.2.12345: UDP, length 16
13:00:29.561251 IP 10.0.0.3.12345 > 10.0.0.2.12345: UDP, length 16
13:00:29.561838 IP 10.0.0.3.12345 > 10.0.0.2.12345: UDP, length 16
13:00:29.562416 IP 10.0.0.3.12345 > 10.0.0.2.12345: UDP, length 16
13:00:29.563003 IP 10.0.0.3.12345 > 10.0.0.2.12345: UDP, length 16
13:00:29.563600 IP 10.0.0.3.12345 > 10.0.0.2.12345: UDP, length 16
13:00:29.564193 IP 10.0.0.3.12345 > 10.0.0.2.12345: UDP, length 16
13:00:29.564772 IP 10.0.0.3.12345 > 10.0.0.2.12345: UDP, length 16
13:00:29.565374 IP 10.0.0.3.12345 > 10.0.0.2.12345: UDP, length 16
13:00:29.565960 IP 10.0.0.3.12345 > 10.0.0.2.12345: UDP, length 16
13:00:29.566540 IP 10.0.0.3.12345 > 10.0.0.2.12345: UDP, length 16
13:00:29.567120 IP 10.0.0.3.12345 > 10.0.0.2.12345: UDP, length 16
13:00:29.567693 IP 10.0.0.3.12345 > 10.0.0.2.12345: UDP, length 16
13:00:29.568268 IP 10.0.0.3.12345 > 10.0.0.2.12345: UDP, length 16
13:00:29.568855 IP 10.0.0.3.12345 > 10.0.0.2.12345: UDP, length 16
13:00:29.569443 IP 10.0.0.3.12345 > 10.0.0.2.12345: UDP, length 16
13:00:29.570028 IP 10.0.0.3.12345 > 10.0.0.2.12345: UDP, length 16
13:00:29.570602 IP 10.0.0.3.12345 > 10.0.0.2.12345: UDP, length 16
13:00:29.571171 IP 10.0.0.3.12345 > 10.0.0.2.12345: UDP, length 16
13:00:29.571733 IP 10.0.0.3.12345 > 10.0.0.2.12345: UDP, length 16
13:00:29.572295 IP 10.0.0.3.12345 > 10.0.0.2.12345: UDP, length 16
13:00:29.572883 IP 10.0.0.3.12345 > 10.0.0.2.12345: UDP, length 16
13:00:29.573480 IP 10.0.0.3.12345 > 10.0.0.2.12345: UDP, length 16
13:00:29.574112 IP 10.0.0.3.12345 > 10.0.0.2.12345: UDP, length 16
13:00:29.574698 IP 10.0.0.3.12345 > 10.0.0.2.12345: UDP, length 16
13:00:29.575309 IP 10.0.0.3.12345 > 10.0.0.2.12345: UDP, length 16
13:00:29.575889 IP 10.0.0.3.12345 > 10.0.0.2.12345: UDP, length 16
13:00:29.576466 IP 10.0.0.3.12345 > 10.0.0.2.12345: UDP, length 16
13:00:29.577044 IP 10.0.0.3.12345 > 10.0.0.2.12345: UDP, length 16
13:00:29.577616 IP 10.0.0.3.12345 > 10.0.0.2.12345: UDP, length 16
13:00:29.578184 IP 10.0.0.3.12345 > 10.0.0.2.12345: UDP, length 16
13:00:29.578758 IP 10.0.0.3.12345 > 10.0.0.2.12345: UDP, length 16
13:00:29.579333 IP 10.0.0.3.12345 > 10.0.0.2.12345: UDP, length 16
13:00:29.579921 IP 10.0.0.3.12345 > 10.0.0.2.12345: UDP, length 16
13:00:29.580500 IP 10.0.0.3.12345 > 10.0.0.2.12345: UDP, length 16
13:00:29.581077 IP 10.0.0.3.12345 > 10.0.0.2.12345: UDP, length 16
13:00:29.581649 IP 10.0.0.3.12345 > 10.0.0.2.12345: UDP, length 16
13:00:29.582216 IP 10.0.0.3.12345 > 10.0.0.2.12345: UDP, length 16
13:00:29.582781 IP 10.0.0.3.12345 > 10.0.0.2.12345: UDP, length 16
13:00:29.583343 IP 10.0.0.3.12345 > 10.0.0.2.12345: UDP, length 16
13:00:29.583907 IP 10.0.0.3.12345 > 10.0.0.2.12345: UDP, length 16
13:00:29.584467 IP 10.0.0.3.12345 > 10.0.0.2.12345: UDP, length 16
13:00:29.585027 IP 10.0.0.3.12345 > 10.0.0.2.12345: UDP, length 16
13:00:29.585589 IP 10.0.0.3.12345 > 10.0.0.2.12345: UDP, length 16
13:00:29.586152 IP 10.0.0.3.12345 > 10.0.0.2.12345: UDP, length 16
13:00:29.586715 IP 10.0.0.3.12345 > 10.0.0.2.12345: UDP, length 16
13:00:29.587277 IP 10.0.0.3.12345 > 10.0.0.2.12345: UDP, length 16
13:00:29.587854 IP 10.0.0.3.12345 > 10.0.0.2.12345: UDP, length 16
13:00:29.588439 IP 10.0.0.3.12345 > 10.0.0.2.12345: UDP, length 16
13:00:29.589023 IP 10.0.0.3.12345 > 10.0.0.2.12345: UDP, length 16
13:00:29.589607 IP 10.0.0.3.12345 > 10.0.0.2.12345: UDP, length 16
13:00:29.590196 IP 10.0.0.3.12345 > 10.0.0.2.12345: UDP, length 16
13:00:29.590770 IP 10.0.0.3.12345 > 10.0.0.2.12345: UDP, length 16
13:00:29.591368 IP 10.0.0.3.12345 > 10.0.0.2.12345: UDP, length 16
13:00:29.591974 IP 10.0.0.3.12345 > 10.0.0.2.12345: UDP, length 16
13:00:29.592560 IP 10.0.0.3.12345 > 10.0.0.2.12345: UDP, length 16
13:00:29.593147 IP 10.0.0.3.12345 > 10.0.0.2.12345: UDP, length 16
13:00:29.593722 IP 10.0.0.3.12345 > 10.0.0.2.12345: UDP, length 16
13:00:29.594303 IP 10.0.0.3.12345 > 10.0.0.2.12345: UDP, length 16
13:00:29.594891 IP 10.0.0.3.12345 > 10.0.0.2.12345: UDP, length 16
13:00:29.595479 IP 10.0.0.3.12345 > 10.0.0.2.12345: UDP, length 16
13:00:29.596079 IP 10.0.0.3.12345 > 10.0.0.2.12345: UDP, length 16
13:00:29.596654 IP 10.0.0.3.12345 > 10.0.0.2.12345: UDP, length 16
13:00:29.597236 IP 10.0.0.3.12345 > 10.0.0.2.12345: UDP, length 16
13:00:29.597817 IP 10.0.0.3.12345 > 10.0.0.2.12345: UDP, length 16
13:00:29.598395 IP 10.0.0.3.12345 > 10.0.0.2.12345: UDP, length 16
13:00:29.598968 IP 10.0.0.3.12345 > 10.0.0.2.12345: UDP, length 16
13:00:29.599544 IP 10.0.0.3.12345 > 10.0.0.2.12345: UDP, length 16
13:00:29.600121 IP 10.0.0.3.12345 > 10.0.0.2.12345: UDP, length 16
13:00:29.600704 IP 10.0.0.3.12345 > 10.0.0.2.12345: UDP, length 16
13:00:29.601293 IP 10.0.0.3.12345 > 10.0.0.2.12345: UDP, length 16
13:00:29.601871 IP 10.0.0.3.12345 > 10.0.0.2.12345: UDP, length 16
13:00:29.602443 IP 10.0.0.3.12345 > 10.0.0.2.12345: UDP, length 16
13:00:29.603011 IP 10.0.0.3.12345 > 10.0.0.2.12345: UDP, length 16
13:00:29.603593 IP 10.0.0.3.12345 > 10.0.0.2.12345: UDP, length 16
13:00:29.604176 IP 10.0.0.3.12345 > 10.0.0.2.12345: UDP, length 16
13:00:29.604744 IP 10.0.0.3.12345 > 10.0.0.2.12345: UDP, length 16
13:00:29.605319 IP 10.0.0.3.12345 > 10.0.0.2.12345: UDP, length 16
13:00:29.605892 IP 10.0.0.3.12345 > 10.0.0.2.12345: UDP, length 16
13:00:29.606456 IP 10.0.0.3.12345 > 10.0.0.2.12345: UDP, length 16
13:00:29.607033 IP 10.0.0.3.12345 > 10.0.0.2.12345: UDP, length 16
13:00:29.607612 IP 10.0.0.3.12345 > 10.0.0.2.12345: UDP, length 16
13:00:29.608197 IP 10.0.0.3.12345 > 10.0.0.2.12345: UDP, length 16
13:00:29.608763 IP 10.0.0.3.12345 > 10.0.0.2.12345: UDP, length 16
13:00:29.609324 IP 10.0.0.3.12345 > 10.0.0.2.12345: UDP, length 16
13:00:29.609894 IP 10.0.0.3.12345 > 10.0.0.2.12345: UDP, length 16
13:00:29.610473 IP 10.0.0.3.12345 > 10.0.0.2.12345: UDP, length 16
13:00:29.611048 IP 10.0.0.3.12345 > 10.0.0.2.12345: UDP, length 16
13:00:29.611629 IP 10.0.0.3.12345 > 10.0.0.2.12345: UDP, length 16
13:00:29.612210 IP 10.0.0.3.12345 > 10.0.0.2.12345: UDP, length 16
13:00:29.612788 IP 10.0.0.3.12345 > 10.0.0.2.12345: UDP, length 16
13:00:29.613363 IP 10.0.0.3.12345 > 10.0.0.2.12345: UDP, length 16
13:00:29.613936 IP 10.0.0.3.12345 > 10.0.0.2.12345: UDP, length 16
13:00:29.614507 IP 10.0.0.3.12345 > 10.0.0.2.12345: UDP, length 16
13:00:29.615082 IP 10.0.0.3.12345 > 10.0.0.2.12345: UDP, length 16
13:00:29.615656 IP 10.0.0.3.12345 > 10.0.0.2.12345: UDP, length 16
13:00:29.616228 IP 10.0.0.3.12345 > 10.0.0.2.12345: UDP, length 16
13:00:29.616801 IP 10.0.0.3.12345 > 10.0.0.2.12345: UDP, length 16
13:00:29.617372 IP 10.0.0.3.12345 > 10.0.0.2.12345: UDP, length 16
13:00:29.617942 IP 10.0.0.3.12345 > 10.0.0.2.12345: UDP, length 16
13:00:29.618517 IP 10.0.0.3.12345 > 10.0.0.2.12345: UDP, length 16
13:00:29.619086 IP 10.0.0.3.12345 > 10.0.0.2.12345: UDP, length 16
13:00:29.619656 IP 10.0.0.3.12345 > 10.0.0.2.12345: UDP, length 16
13:00:29.620226 IP 10.0.0.3.12345 > 10.0.0.2.12345: UDP, length 16
13:00:29.620795 IP 10.0.0.3.12345 > 10.0.0.2.12345: UDP, length 16
13:00:29.621362 IP 10.0.0.3.12345 > 10.0.0.2.12345: UDP, length 16
13:00:29.621929 IP 10.0.0.3.12345 > 10.0.0.2.12345: UDP, length 16
13:00:29.622496 IP 10.0.0.3.12345 > 10.0.0.2.12345: UDP, length 16
13:00:29.623062 IP 10.0.0.3.12345 > 10.0.0.2.12345: UDP, length 16
13:00:29.623630 IP 10.0.0.3.12345 > 10.0.0.2.12345: UDP, length 16
13:00:29.624203 IP 10.0.0.3.12345 > 10.0.0.2.12345: UDP, length 16
13:00:29.624777 IP 10.0.0.3.12345 > 10.0.0.2.12345: UDP, length 16
13:00:29.625346 IP 10.0.0.3.12345 > 10.0.0.2.12345: UDP, length 16
13:00:29.625914 IP 10.0.0.3.12345 > 10.0.0.2.12345: UDP, length 16
13:00:29.626484 IP 10.0.0.3.12345 > 10.0.0.2.12345: UDP, length 16
13:00:29.627061 IP 10.0.0.3.12345 > 10.0.0.2.12345: UDP, length 16
13:00:29.627634 IP 10.0.0.3.12345 > 10.0.0.2.12345: UDP, length 16
13:00:29.628200 IP 10.0.0.3.12345 > 10.0.0.2.12345: UDP, length 16
13:00:29.628761 IP 10.0.0.3.12345 > 10.0.0.2.12345: UDP, length 16
13:00:29.629336 IP 10.0.0.3.12345 > 10.0.0.2.12345: UDP, length 16
13:00:29.629909 IP 10.0.0.3.12345 > 10.0.0.2.12345: UDP, length 16
13:00:29.630482 IP 10.0.0.3.12345 > 10.0.0.2.12345: UDP, length 16
13:00:29.631062 IP 10.0.0.3.12345 > 10.0.0.2.12345: UDP, length 16
13:00:29.631628 IP 10.0.0.3.12345 > 10.0.0.2.12345: UDP, length 16
13:00:29.632208 IP 10.0.0.3.12345 > 10.0.0.2.12345: UDP, length 16
13:00:29.632781 IP 10.0.0.3.12345 > 10.0.0.2.12345: UDP, length 16
13:00:29.633366 IP 10.0.0.3.12345 > 10.0.0.2.12345: UDP, length 16
13:00:29.633947 IP 10.0.0.3.12345 > 10.0.0.2.12345: UDP, length 16
13:00:29.634528 IP 10.0.0.3.12345 > 10.0.0.2.12345: UDP, length 16
13:00:29.635102 IP 10.0.0.3.12345 > 10.0.0.2.12345: UDP, length 16
13:00:29.635732 IP 10.0.0.3.12345 > 10.0.0.2.12345: UDP, length 16
13:00:29.636318 IP 10.0.0.3.12345 > 10.0.0.2.12345: UDP, length 16
13:00:29.636891 IP 10.0.0.3.12345 > 10.0.0.2.12345: UDP, length 16
13:00:29.637481 IP 10.0.0.3.12345 > 10.0.0.2.12345: UDP, length 16
13:00:29.638070 IP 10.0.0.3.12345 > 10.0.0.2.12345: UDP, length 16
13:00:29.638660 IP 10.0.0.3.12345 > 10.0.0.2.12345: UDP, length 16
13:00:29.639249 IP 10.0.0.3.12345 > 10.0.0.2.12345: UDP, length 16
13:00:29.639857 IP 10.0.0.3.12345 > 10.0.0.2.12345: UDP, length 16
13:00:29.640465 IP 10.0.0.3.12345 > 10.0.0.2.12345: UDP, length 16
13:00:29.641064 IP 10.0.0.3.12345 > 10.0.0.2.12345: UDP, length 16
13:00:29.641653 IP 10.0.0.3.12345 > 10.0.0.2.12345: UDP, length 16
13:00:29.642248 IP 10.0.0.3.12345 > 10.0.0.2.12345: UDP, length 16
13:00:29.642820 IP 10.0.0.3.12345 > 10.0.0.2.12345: UDP, length 16
13:00:29.643390 IP 10.0.0.3.12345 > 10.0.0.2.12345: UDP, length 16
13:00:29.643959 IP 10.0.0.3.12345 > 10.0.0.2.12345: UDP, length 16
13:00:29.644542 IP 10.0.0.3.12345 > 10.0.0.2.12345: UDP, length 16
13:00:29.645121 IP 10.0.0.3.12345 > 10.0.0.2.12345: UDP, length 16
13:00:29.645705 IP 10.0.0.3.12345 > 10.0.0.2.12345: UDP, length 16
13:00:29.646285 IP 10.0.0.3.12345 > 10.0.0.2.12345: UDP, length 16
13:00:29.646848 IP 10.0.0.3.12345 > 10.0.0.2.12345: UDP, length 16
13:00:29.647422 IP 10.0.0.3.12345 > 10.0.0.2.12345: UDP, length 16
13:00:29.648001 IP 10.0.0.3.12345 > 10.0.0.2.12345: UDP, length 16
13:00:29.648577 IP 10.0.0.3.12345 > 10.0.0.2.12345: UDP, length 16
13:00:29.649169 IP 10.0.0.3.12345 > 10.0.0.2.12345: UDP, length 16
13:00:29.649762 IP 10.0.0.3.12345 > 10.0.0.2.12345: UDP, length 16
13:00:29.650345 IP 10.0.0.3.12345 > 10.0.0.2.12345: UDP, length 16
13:00:29.650928 IP 10.0.0.3.12345 > 10.0.0.2.12345: UDP, length 16
13:00:29.651513 IP 10.0.0.3.12345 > 10.0.0.2.12345: UDP, length 16
13:00:29.652105 IP 10.0.0.3.12345 > 10.0.0.2.12345: UDP, length 16
13:00:29.652695 IP 10.0.0.3.12345 > 10.0.0.2.12345: UDP, length 16
13:00:29.653303 IP 10.0.0.3.12345 > 10.0.0.2.12345: UDP, length 16
13:00:29.653909 IP 10.0.0.3.12345 > 10.0.0.2.12345: UDP, length 16
13:00:29.654515 IP 10.0.0.3.12345 > 10.0.0.2.12345: UDP, length 16
13:00:29.655122 IP 10.0.0.3.12345 > 10.0.0.2.12345: UDP, length 16
13:00:29.655744 IP 10.0.0.3.12345 > 10.0.0.2.12345: UDP, length 16
13:00:29.656323 IP 10.0.0.3.12345 > 10.0.0.2.12345: UDP, length 16
13:00:29.656928 IP 10.0.0.3.12345 > 10.0.0.2.12345: UDP, length 16
13:00:29.657539 IP 10.0.0.3.12345 > 10.0.0.2.12345: UDP, length 16
13:00:29.658144 IP 10.0.0.3.12345 > 10.0.0.2.12345: UDP, length 16
13:00:29.658723 IP 10.0.0.3.12345 > 10.0.0.2.12345: UDP, length 16
13:00:29.659308 IP 10.0.0.3.12345 > 10.0.0.2.12345: UDP, length 16
13:00:29.659877 IP 10.0.0.3.12345 > 10.0.0.2.12345: UDP, length 16
13:00:29.660467 IP 10.0.0.3.12345 > 10.0.0.2.12345: UDP, length 16
13:00:29.661059 IP 10.0.0.3.12345 > 10.0.0.2.12345: UDP, length 16
13:00:29.661627 IP 10.0.0.3.12345 > 10.0.0.2.12345: UDP, length 16
13:00:29.662215 IP 10.0.0.3.12345 > 10.0.0.2.12345: UDP, length 16
13:00:29.662813 IP 10.0.0.3.12345 > 10.0.0.2.12345: UDP, length 16
13:00:29.663405 IP 10.0.0.3.12345 > 10.0.0.2.12345: UDP, length 16
13:00:29.664008 IP 10.0.0.3.12345 > 10.0.0.2.12345: UDP, length 16
13:00:29.664601 IP 10.0.0.3.12345 > 10.0.0.2.12345: UDP, length 16
13:00:29.665191 IP 10.0.0.3.12345 > 10.0.0.2.12345: UDP, length 16
13:00:29.665782 IP 10.0.0.3.12345 > 10.0.0.2.12345: UDP, length 16
13:00:29.666370 IP 10.0.0.3.12345 > 10.0.0.2.12345: UDP, length 16
13:00:29.666974 IP 10.0.0.3.12345 > 10.0.0.2.12345: UDP, length 16
13:00:29.667577 IP 10.0.0.3.12345 > 10.0.0.2.12345: UDP, length 16
13:00:29.668183 IP 10.0.0.3.12345 > 10.0.0.2.12345: UDP, length 16
13:00:29.668777 IP 10.0.0.3.12345 > 10.0.0.2.12345: UDP, length 16
13:00:29.669404 IP 10.0.0.3.12345 > 10.0.0.2.12345: UDP, length 16
13:00:29.670019 IP 10.0.0.3.12345 > 10.0.0.2.12345: UDP, length 16
13:00:29.670634 IP 10.0.0.3.12345 > 10.0.0.2.12345: UDP, length 16
13:00:29.671250 IP 10.0.0.3.12345 > 10.0.0.2.12345: UDP, length 16
13:00:29.671821 IP 10.0.0.3.12345 > 10.0.0.2.12345: UDP, length 16
13:00:29.672434 IP 10.0.0.3.12345 > 10.0.0.2.12345: UDP, length 16
13:00:29.673003 IP 10.0.0.3.12345 > 10.0.0.2.12345: UDP, length 16
13:00:29.673616 IP 10.0.0.3.12345 > 10.0.0.2.12345: UDP, length 16
13:00:29.674229 IP 10.0.0.3.12345 > 10.0.0.2.12345: UDP, length 16
13:00:29.674842 IP 10.0.0.3.12345 > 10.0.0.2.12345: UDP, length 16
13:00:29.675456 IP 10.0.0.3.12345 > 10.0.0.2.12345: UDP, length 16
13:00:29.676034 IP 10.0.0.3.12345 > 10.0.0.2.12345: UDP, length 16
13:00:29.676634 IP 10.0.0.3.12345 > 10.0.0.2.12345: UDP, length 16
13:00:29.677216 IP 10.0.0.3.12345 > 10.0.0.2.12345: UDP, length 16
13:00:29.677830 IP 10.0.0.3.12345 > 10.0.0.2.12345: UDP, length 16
13:00:29.678415 IP 10.0.0.3.12345 > 10.0.0.2.12345: UDP, length 16
13:00:29.679006 IP 10.0.0.3.12345 > 10.0.0.2.12345: UDP, length 16
13:00:29.679596 IP 10.0.0.3.12345 > 10.0.0.2.12345: UDP, length 16
13:00:29.680180 IP 10.0.0.3.12345 > 10.0.0.2.12345: UDP, length 16
13:00:29.680762 IP 10.0.0.3.12345 > 10.0.0.2.12345: UDP, length 16
13:00:29.681346 IP 10.0.0.3.12345 > 10.0.0.2.12345: UDP, length 16
13:00:29.681928 IP 10.0.0.3.12345 > 10.0.0.2.12345: UDP, length 16
13:00:29.682512 IP 10.0.0.3.12345 > 10.0.0.2.12345: UDP, length 16
13:00:29.683094 IP 10.0.0.3.12345 > 10.0.0.2.12345: UDP, length 16
13:00:29.683720 IP 10.0.0.3.12345 > 10.0.0.2.12345: UDP, length 16
13:00:29.684304 IP 10.0.0.3.12345 > 10.0.0.2.12345: UDP, length 16
13:00:29.684885 IP 10.0.0.3.12345 > 10.0.0.2.12345: UDP, length 16
13:00:29.685482 IP 10.0.0.3.12345 > 10.0.0.2.12345: UDP, length 16
13:00:29.686080 IP 10.0.0.3.12345 > 10.0.0.2.12345: UDP, length 16
13:00:29.686678 IP 10.0.0.3.12345 > 10.0.0.2.12345: UDP, length 16
13:00:29.687274 IP 10.0.0.3.12345 > 10.0.0.2.12345: UDP, length 16
13:00:29.687874 IP 10.0.0.3.12345 > 10.0.0.2.12345: UDP, length 16
13:00:29.688473 IP 10.0.0.3.12345 > 10.0.0.2.12345: UDP, length 16
13:00:29.689071 IP 10.0.0.3.12345 > 10.0.0.2.12345: UDP, length 16
13:00:29.689670 IP 10.0.0.3.12345 > 10.0.0.2.12345: UDP, length 16
13:00:29.690267 IP 10.0.0.3.12345 > 10.0.0.2.12345: UDP, length 16
13:00:29.690875 IP 10.0.0.3.12345 > 10.0.0.2.12345: UDP, length 16
13:00:29.691484 IP 10.0.0.3.12345 > 10.0.0.2.12345: UDP, length 16
13:00:29.692083 IP 10.0.0.3.12345 > 10.0.0.2.12345: UDP, length 16
13:00:29.692693 IP 10.0.0.3.12345 > 10.0.0.2.12345: UDP, length 16
13:00:29.693303 IP 10.0.0.3.12345 > 10.0.0.2.12345: UDP, length 16
13:00:29.693903 IP 10.0.0.3.12345 > 10.0.0.2.12345: UDP, length 16
13:00:29.694498 IP 10.0.0.3.12345 > 10.0.0.2.12345: UDP, length 16
13:00:29.695094 IP 10.0.0.3.12345 > 10.0.0.2.12345: UDP, length 16
13:00:29.695717 IP 10.0.0.3.12345 > 10.0.0.2.12345: UDP, length 16
13:00:29.696337 IP 10.0.0.3.12345 > 10.0.0.2.12345: UDP, length 16
13:00:29.696957 IP 10.0.0.3.12345 > 10.0.0.2.12345: UDP, length 16
13:00:29.697576 IP 10.0.0.3.12345 > 10.0.0.2.12345: UDP, length 16
13:00:29.698197 IP 10.0.0.3.12345 > 10.0.0.2.12345: UDP, length 16
13:00:29.698817 IP 10.0.0.3.12345 > 10.0.0.2.12345: UDP, length 16
13:00:29.699436 IP 10.0.0.3.12345 > 10.0.0.2.12345: UDP, length 16
13:00:29.700057 IP 10.0.0.3.12345 > 10.0.0.2.12345: UDP, length 16
13:00:29.700676 IP 10.0.0.3.12345 > 10.0.0.2.12345: UDP, length 16
13:00:29.701296 IP 10.0.0.3.12345 > 10.0.0.2.12345: UDP, length 16
13:00:29.701914 IP 10.0.0.3.12345 > 10.0.0.2.12345: UDP, length 16
13:00:29.702533 IP 10.0.0.3.12345 > 10.0.0.2.12345: UDP, length 16
13:00:29.703154 IP 10.0.0.3.12345 > 10.0.0.2.12345: UDP, length 16
13:00:29.703774 IP 10.0.0.3.12345 > 10.0.0.2.12345: UDP, length 16
13:00:29.704394 IP 10.0.0.3.12345 > 10.0.0.2.12345: UDP, length 16
13:00:29.705012 IP 10.0.0.3.12345 > 10.0.0.2.12345: UDP, length 16
13:00:29.705631 IP 10.0.0.3.12345 > 10.0.0.2.12345: UDP, length 16
13:00:29.706249 IP 10.0.0.3.12345 > 10.0.0.2.12345: UDP, length 16
13:00:29.706867 IP 10.0.0.3.12345 > 10.0.0.2.12345: UDP, length 16
13:00:29.707456 IP 10.0.0.3.12345 > 10.0.0.2.12345: UDP, length 16
13:00:29.708075 IP 10.0.0.3.12345 > 10.0.0.2.12345: UDP, length 16
13:00:29.708695 IP 10.0.0.3.12345 > 10.0.0.2.12345: UDP, length 16
13:00:29.709314 IP 10.0.0.3.12345 > 10.0.0.2.12345: UDP, length 16
13:00:29.709920 IP 10.0.0.3.12345 > 10.0.0.2.12345: UDP, length 16
13:00:29.710543 IP 10.0.0.3.12345 > 10.0.0.2.12345: UDP, length 16
13:00:29.711150 IP 10.0.0.3.12345 > 10.0.0.2.12345: UDP, length 16
13:00:29.711754 IP 10.0.0.3.12345 > 10.0.0.2.12345: UDP, length 16
13:00:29.712360 IP 10.0.0.3.12345 > 10.0.0.2.12345: UDP, length 16
13:00:29.712975 IP 10.0.0.3.12345 > 10.0.0.2.12345: UDP, length 16
13:00:29.713608 IP 10.0.0.3.12345 > 10.0.0.2.12345: UDP, length 16
13:00:29.714237 IP 10.0.0.3.12345 > 10.0.0.2.12345: UDP, length 16
13:00:29.714867 IP 10.0.0.3.12345 > 10.0.0.2.12345: UDP, length 16
13:00:29.715496 IP 10.0.0.3.12345 > 10.0.0.2.12345: UDP, length 16
13:00:29.716128 IP 10.0.0.3.12345 > 10.0.0.2.12345: UDP, length 16
13:00:29.716758 IP 10.0.0.3.12345 > 10.0.0.2.12345: UDP, length 16
13:00:29.717387 IP 10.0.0.3.12345 > 10.0.0.2.12345: UDP, length 16
13:00:29.718017 IP 10.0.0.3.12345 > 10.0.0.2.12345: UDP, length 16
13:00:29.718647 IP 10.0.0.3.12345 > 10.0.0.2.12345: UDP, length 16
13:00:29.719277 IP 10.0.0.3.12345 > 10.0.0.2.12345: UDP, length 16
13:00:29.719907 IP 10.0.0.3.12345 > 10.0.0.2.12345: UDP, length 16
13:00:29.720536 IP 10.0.0.3.12345 > 10.0.0.2.12345: UDP, length 16
13:00:29.721205 IP 10.0.0.3.12345 > 10.0.0.2.12345: UDP, length 16
13:00:29.721842 IP 10.0.0.3.12345 > 10.0.0.2.12345: UDP, length 16
13:00:29.722447 IP 10.0.0.3.12345 > 10.0.0.2.12345: UDP, length 16
13:00:29.723035 IP 10.0.0.3.12345 > 10.0.0.2.12345: UDP, length 16
13:00:29.723623 IP 10.0.0.3.12345 > 10.0.0.2.12345: UDP, length 16
13:00:29.724218 IP 10.0.0.3.12345 > 10.0.0.2.12345: UDP, length 16
13:00:29.724811 IP 10.0.0.3.12345 > 10.0.0.2.12345: UDP, length 16
13:00:29.725402 IP 10.0.0.3.12345 > 10.0.0.2.12345: UDP, length 16
13:00:29.725991 IP 10.0.0.3.12345 > 10.0.0.2.12345: UDP, length 16
13:00:29.726619 IP 10.0.0.3.12345 > 10.0.0.2.12345: UDP, length 16
13:00:29.727257 IP 10.0.0.3.12345 > 10.0.0.2.12345: UDP, length 16
13:00:29.727868 IP 10.0.0.3.12345 > 10.0.0.2.12345: UDP, length 16
13:00:29.728485 IP 10.0.0.3.12345 > 10.0.0.2.12345: UDP, length 16
13:00:29.729089 IP 10.0.0.3.12345 > 10.0.0.2.12345: UDP, length 16
13:00:29.729681 IP 10.0.0.3.12345 > 10.0.0.2.12345: UDP, length 16
13:00:29.730270 IP 10.0.0.3.12345 > 10.0.0.2.12345: UDP, length 16
13:00:29.730875 IP 10.0.0.3.12345 > 10.0.0.2.12345: UDP, length 16
13:00:29.731469 IP 10.0.0.3.12345 > 10.0.0.2.12345: UDP, length 16
13:00:29.732096 IP 10.0.0.3.12345 > 10.0.0.2.12345: UDP, length 16
13:00:29.732726 IP 10.0.0.3.12345 > 10.0.0.2.12345: UDP, length 16
13:00:29.733355 IP 10.0.0.3.12345 > 10.0.0.2.12345: UDP, length 16
13:00:29.733985 IP 10.0.0.3.12345 > 10.0.0.2.12345: UDP, length 16
13:00:29.734616 IP 10.0.0.3.12345 > 10.0.0.2.12345: UDP, length 16
13:00:29.735246 IP 10.0.0.3.12345 > 10.0.0.2.12345: UDP, length 16
13:00:29.735856 IP 10.0.0.3.12345 > 10.0.0.2.12345: UDP, length 16
13:00:29.736493 IP 10.0.0.3.12345 > 10.0.0.2.12345: UDP, length 16
13:00:29.737129 IP 10.0.0.3.12345 > 10.0.0.2.12345: UDP, length 16
13:00:29.737764 IP 10.0.0.3.12345 > 10.0.0.2.12345: UDP, length 16
13:00:29.738399 IP 10.0.0.3.12345 > 10.0.0.2.12345: UDP, length 16
13:00:29.739035 IP 10.0.0.3.12345 > 10.0.0.2.12345: UDP, length 16
13:00:29.739681 IP 10.0.0.3.12345 > 10.0.0.2.12345: UDP, length 16
13:00:29.740290 IP 10.0.0.3.12345 > 10.0.0.2.12345: UDP, length 16
13:00:29.740900 IP 10.0.0.3.12345 > 10.0.0.2.12345: UDP, length 16
13:00:29.741526 IP 10.0.0.3.12345 > 10.0.0.2.12345: UDP, length 16
13:00:29.742165 IP 10.0.0.3.12345 > 10.0.0.2.12345: UDP, length 16
13:00:29.742792 IP 10.0.0.3.12345 > 10.0.0.2.12345: UDP, length 16
13:00:29.743420 IP 10.0.0.3.12345 > 10.0.0.2.12345: UDP, length 16
13:00:29.744030 IP 10.0.0.3.12345 > 10.0.0.2.12345: UDP, length 16
13:00:29.744681 IP 10.0.0.3.12345 > 10.0.0.2.12345: UDP, length 16
13:00:29.745295 IP 10.0.0.3.12345 > 10.0.0.2.12345: UDP, length 16
13:00:29.745940 IP 10.0.0.3.12345 > 10.0.0.2.12345: UDP, length 16
13:00:29.746578 IP 10.0.0.3.12345 > 10.0.0.2.12345: UDP, length 16
13:00:29.747206 IP 10.0.0.3.12345 > 10.0.0.2.12345: UDP, length 16
13:00:29.747802 IP 10.0.0.3.12345 > 10.0.0.2.12345: UDP, length 16
13:00:29.748444 IP 10.0.0.3.12345 > 10.0.0.2.12345: UDP, length 16
13:00:29.749089 IP 10.0.0.3.12345 > 10.0.0.2.12345: UDP, length 16
13:00:29.749733 IP 10.0.0.3.12345 > 10.0.0.2.12345: UDP, length 16
13:00:29.750377 IP 10.0.0.3.12345 > 10.0.0.2.12345: UDP, length 16
13:00:29.751022 IP 10.0.0.3.12345 > 10.0.0.2.12345: UDP, length 16
13:00:29.751678 IP 10.0.0.3.12345 > 10.0.0.2.12345: UDP, length 16
13:00:29.752289 IP 10.0.0.3.12345 > 10.0.0.2.12345: UDP, length 16
13:00:29.752930 IP 10.0.0.3.12345 > 10.0.0.2.12345: UDP, length 16
13:00:29.753577 IP 10.0.0.3.12345 > 10.0.0.2.12345: UDP, length 16
13:00:29.754219 IP 10.0.0.3.12345 > 10.0.0.2.12345: UDP, length 16
13:00:29.754863 IP 10.0.0.3.12345 > 10.0.0.2.12345: UDP, length 16
13:00:29.755506 IP 10.0.0.3.12345 > 10.0.0.2.12345: UDP, length 16
13:00:29.756150 IP 10.0.0.3.12345 > 10.0.0.2.12345: UDP, length 16
13:00:29.756794 IP 10.0.0.3.12345 > 10.0.0.2.12345: UDP, length 16
13:00:29.757427 IP 10.0.0.3.12345 > 10.0.0.2.12345: UDP, length 16
13:00:29.758077 IP 10.0.0.3.12345 > 10.0.0.2.12345: UDP, length 16
13:00:29.758721 IP 10.0.0.3.12345 > 10.0.0.2.12345: UDP, length 16
13:00:29.759347 IP 10.0.0.3.12345 > 10.0.0.2.12345: UDP, length 16
13:00:29.759994 IP 10.0.0.3.12345 > 10.0.0.2.12345: UDP, length 16
13:00:29.760623 IP 10.0.0.3.12345 > 10.0.0.2.12345: UDP, length 16
13:00:29.761235 IP 10.0.0.3.12345 > 10.0.0.2.12345: UDP, length 16
13:00:29.761880 IP 10.0.0.3.12345 > 10.0.0.2.12345: UDP, length 16
13:00:29.762526 IP 10.0.0.3.12345 > 10.0.0.2.12345: UDP, length 16
13:00:29.763172 IP 10.0.0.3.12345 > 10.0.0.2.12345: UDP, length 16
13:00:29.763797 IP 10.0.0.3.12345 > 10.0.0.2.12345: UDP, length 16
13:00:29.764414 IP 10.0.0.3.12345 > 10.0.0.2.12345: UDP, length 16
13:00:29.765059 IP 10.0.0.3.12345 > 10.0.0.2.12345: UDP, length 16
13:00:29.765702 IP 10.0.0.3.12345 > 10.0.0.2.12345: UDP, length 16
13:00:29.766347 IP 10.0.0.3.12345 > 10.0.0.2.12345: UDP, length 16
13:00:29.766990 IP 10.0.0.3.12345 > 10.0.0.2.12345: UDP, length 16
13:00:29.767634 IP 10.0.0.3.12345 > 10.0.0.2.12345: UDP, length 16
13:00:29.768281 IP 10.0.0.3.12345 > 10.0.0.2.12345: UDP, length 16
13:00:29.768924 IP 10.0.0.3.12345 > 10.0.0.2.12345: UDP, length 16
13:00:29.769570 IP 10.0.0.3.12345 > 10.0.0.2.12345: UDP, length 16
13:00:29.770212 IP 10.0.0.3.12345 > 10.0.0.2.12345: UDP, length 16
13:00:29.770856 IP 10.0.0.3.12345 > 10.0.0.2.12345: UDP, length 16
13:00:29.771501 IP 10.0.0.3.12345 > 10.0.0.2.12345: UDP, length 16
13:00:29.772145 IP 10.0.0.3.12345 > 10.0.0.2.12345: UDP, length 16
13:00:29.772789 IP 10.0.0.3.12345 > 10.0.0.2.12345: UDP, length 16
13:00:29.773433 IP 10.0.0.3.12345 > 10.0.0.2.12345: UDP, length 16
13:00:29.774078 IP 10.0.0.3.12345 > 10.0.0.2.12345: UDP, length 16
13:00:29.774726 IP 10.0.0.3.12345 > 10.0.0.2.12345: UDP, length 16
13:00:29.775369 IP 10.0.0.3.12345 > 10.0.0.2.12345: UDP, length 16
13:00:29.776015 IP 10.0.0.3.12345 > 10.0.0.2.12345: UDP, length 16
13:00:29.776666 IP 10.0.0.3.12345 > 10.0.0.2.12345: UDP, length 16
13:00:29.777311 IP 10.0.0.3.12345 > 10.0.0.2.12345: UDP, length 16
13:00:29.777937 IP 10.0.0.3.12345 > 10.0.0.2.12345: UDP, length 16
13:00:29.778544 IP 10.0.0.3.12345 > 10.0.0.2.12345: UDP, length 16
13:00:29.779187 IP 10.0.0.3.12345 > 10.0.0.2.12345: UDP, length 16
13:00:29.779820 IP 10.0.0.3.12345 > 10.0.0.2.12345: UDP, length 16
13:00:29.780477 IP 10.0.0.3.12345 > 10.0.0.2.12345: UDP, length 16
13:00:29.781135 IP 10.0.0.3.12345 > 10.0.0.2.12345: UDP, length 16
13:00:29.781792 IP 10.0.0.3.12345 > 10.0.0.2.12345: UDP, length 16
13:00:29.782447 IP 10.0.0.3.12345 > 10.0.0.2.12345: UDP, length 16
13:00:29.783045 IP 10.0.0.3.12345 > 10.0.0.2.12345: UDP, length 16
13:00:29.783765 IP 10.0.0.3.12345 > 10.0.0.2.12345: UDP, length 16
13:00:29.784422 IP 10.0.0.3.12345 > 10.0.0.2.12345: UDP, length 16
13:00:29.785078 IP 10.0.0.3.12345 > 10.0.0.2.12345: UDP, length 16
13:00:29.785731 IP 10.0.0.3.12345 > 10.0.0.2.12345: UDP, length 16
13:00:29.786386 IP 10.0.0.3.12345 > 10.0.0.2.12345: UDP, length 16
13:00:29.787040 IP 10.0.0.3.12345 > 10.0.0.2.12345: UDP, length 16
13:00:29.787758 IP 10.0.0.3.12345 > 10.0.0.2.12345: UDP, length 16
13:00:29.788413 IP 10.0.0.3.12345 > 10.0.0.2.12345: UDP, length 16
13:00:29.789066 IP 10.0.0.3.12345 > 10.0.0.2.12345: UDP, length 16
13:00:29.789719 IP 10.0.0.3.12345 > 10.0.0.2.12345: UDP, length 16
13:00:29.790357 IP 10.0.0.3.12345 > 10.0.0.2.12345: UDP, length 16
13:00:29.791015 IP 10.0.0.3.12345 > 10.0.0.2.12345: UDP, length 16
13:00:29.791751 IP 10.0.0.3.12345 > 10.0.0.2.12345: UDP, length 16
13:00:29.792406 IP 10.0.0.3.12345 > 10.0.0.2.12345: UDP, length 16
13:00:29.793041 IP 10.0.0.3.12345 > 10.0.0.2.12345: UDP, length 16
13:00:29.793708 IP 10.0.0.3.12345 > 10.0.0.2.12345: UDP, length 16
13:00:29.794316 IP 10.0.0.3.12345 > 10.0.0.2.12345: UDP, length 16
13:00:29.794918 IP 10.0.0.3.12345 > 10.0.0.2.12345: UDP, length 16
13:00:29.795505 IP 10.0.0.3.12345 > 10.0.0.2.12345: UDP, length 16
13:00:29.796159 IP 10.0.0.3.12345 > 10.0.0.2.12345: UDP, length 16
13:00:29.796813 IP 10.0.0.3.12345 > 10.0.0.2.12345: UDP, length 16
13:00:29.797414 IP 10.0.0.3.12345 > 10.0.0.2.12345: UDP, length 16
13:00:29.798016 IP 10.0.0.3.12345 > 10.0.0.2.12345: UDP, length 16
13:00:29.798616 IP 10.0.0.3.12345 > 10.0.0.2.12345: UDP, length 16
13:00:29.799215 IP 10.0.0.3.12345 > 10.0.0.2.12345: UDP, length 16
13:00:29.799815 IP 10.0.0.3.12345 > 10.0.0.2.12345: UDP, length 16
13:00:29.800465 IP 10.0.0.3.12345 > 10.0.0.2.12345: UDP, length 16
13:00:29.801123 IP 10.0.0.3.12345 > 10.0.0.2.12345: UDP, length 16
13:00:29.801779 IP 10.0.0.3.12345 > 10.0.0.2.12345: UDP, length 16
13:00:29.802435 IP 10.0.0.3.12345 > 10.0.0.2.12345: UDP, length 16
13:00:29.803090 IP 10.0.0.3.12345 > 10.0.0.2.12345: UDP, length 16
13:00:29.803746 IP 10.0.0.3.12345 > 10.0.0.2.12345: UDP, length 16
13:00:29.804399 IP 10.0.0.3.12345 > 10.0.0.2.12345: UDP, length 16
13:00:29.805053 IP 10.0.0.3.12345 > 10.0.0.2.12345: UDP, length 16
13:00:29.805709 IP 10.0.0.3.12345 > 10.0.0.2.12345: UDP, length 16
13:00:29.806363 IP 10.0.0.3.12345 > 10.0.0.2.12345: UDP, length 16
13:00:29.807028 IP 10.0.0.3.12345 > 10.0.0.2.12345: UDP, length 16
13:00:29.807742 IP 10.0.0.3.12345 > 10.0.0.2.12345: UDP, length 16
13:00:29.808398 IP 10.0.0.3.12345 > 10.0.0.2.12345: UDP, length 16
13:00:29.809053 IP 10.0.0.3.12345 > 10.0.0.2.12345: UDP, length 16
13:00:29.809710 IP 10.0.0.3.12345 > 10.0.0.2.12345: UDP, length 16
13:00:29.810366 IP 10.0.0.3.12345 > 10.0.0.2.12345: UDP, length 16
13:00:29.810989 IP 10.0.0.3.12345 > 10.0.0.2.12345: UDP, length 16
13:00:29.811604 IP 10.0.0.3.12345 > 10.0.0.2.12345: UDP, length 16
13:00:29.812212 IP 10.0.0.3.12345 > 10.0.0.2.12345: UDP, length 16
13:00:29.812844 IP 10.0.0.3.12345 > 10.0.0.2.12345: UDP, length 16
13:00:29.813457 IP 10.0.0.3.12345 > 10.0.0.2.12345: UDP, length 16
13:00:29.814108 IP 10.0.0.3.12345 > 10.0.0.2.12345: UDP, length 16
13:00:29.814739 IP 10.0.0.3.12345 > 10.0.0.2.12345: UDP, length 16
13:00:29.815342 IP 10.0.0.3.12345 > 10.0.0.2.12345: UDP, length 16
13:00:29.815983 IP 10.0.0.3.12345 > 10.0.0.2.12345: UDP, length 16
13:00:29.816628 IP 10.0.0.3.12345 > 10.0.0.2.12345: UDP, length 16
13:00:29.817272 IP 10.0.0.3.12345 > 10.0.0.2.12345: UDP, length 16
13:00:29.817917 IP 10.0.0.3.12345 > 10.0.0.2.12345: UDP, length 16
13:00:29.818562 IP 10.0.0.3.12345 > 10.0.0.2.12345: UDP, length 16
13:00:29.819205 IP 10.0.0.3.12345 > 10.0.0.2.12345: UDP, length 16
13:00:29.819851 IP 10.0.0.3.12345 > 10.0.0.2.12345: UDP, length 16
13:00:29.820494 IP 10.0.0.3.12345 > 10.0.0.2.12345: UDP, length 16
13:00:29.821138 IP 10.0.0.3.12345 > 10.0.0.2.12345: UDP, length 16
13:00:29.821782 IP 10.0.0.3.12345 > 10.0.0.2.12345: UDP, length 16
13:00:29.822425 IP 10.0.0.3.12345 > 10.0.0.2.12345: UDP, length 16
13:00:29.823069 IP 10.0.0.3.12345 > 10.0.0.2.12345: UDP, length 16
13:00:29.823736 IP 10.0.0.3.12345 > 10.0.0.2.12345: UDP, length 16
13:00:29.824380 IP 10.0.0.3.12345 > 10.0.0.2.12345: UDP, length 16
13:00:29.825026 IP 10.0.0.3.12345 > 10.0.0.2.12345: UDP, length 16
13:00:29.825669 IP 10.0.0.3.12345 > 10.0.0.2.12345: UDP, length 16
13:00:29.826294 IP 10.0.0.3.12345 > 10.0.0.2.12345: UDP, length 16
13:00:29.826961 IP 10.0.0.3.12345 > 10.0.0.2.12345: UDP, length 16
13:00:29.827617 IP 10.0.0.3.12345 > 10.0.0.2.12345: UDP, length 16
13:00:29.828254 IP 10.0.0.3.12345 > 10.0.0.2.12345: UDP, length 16
13:00:29.828871 IP 10.0.0.3.12345 > 10.0.0.2.12345: UDP, length 16
13:00:29.829487 IP 10.0.0.3.12345 > 10.0.0.2.12345: UDP, length 16
13:00:29.830118 IP 10.0.0.3.12345 > 10.0.0.2.12345: UDP, length 16
13:00:29.830745 IP 10.0.0.3.12345 > 10.0.0.2.12345: UDP, length 16
13:00:29.831383 IP 10.0.0.3.12345 > 10.0.0.2.12345: UDP, length 16
13:00:29.831973 IP 10.0.0.3.12345 > 10.0.0.2.12345: UDP, length 16
13:00:29.832576 IP 10.0.0.3.12345 > 10.0.0.2.12345: UDP, length 16
13:00:29.833179 IP 10.0.0.3.12345 > 10.0.0.2.12345: UDP, length 16
13:00:29.833822 IP 10.0.0.3.12345 > 10.0.0.2.12345: UDP, length 16
13:00:29.834468 IP 10.0.0.3.12345 > 10.0.0.2.12345: UDP, length 16
13:00:29.835112 IP 10.0.0.3.12345 > 10.0.0.2.12345: UDP, length 16
13:00:29.835766 IP 10.0.0.3.12345 > 10.0.0.2.12345: UDP, length 16
13:00:29.836391 IP 10.0.0.3.12345 > 10.0.0.2.12345: UDP, length 16
13:00:29.837034 IP 10.0.0.3.12345 > 10.0.0.2.12345: UDP, length 16
13:00:29.837678 IP 10.0.0.3.12345 > 10.0.0.2.12345: UDP, length 16
13:00:29.838322 IP 10.0.0.3.12345 > 10.0.0.2.12345: UDP, length 16
13:00:29.838967 IP 10.0.0.3.12345 > 10.0.0.2.12345: UDP, length 16
13:00:29.839611 IP 10.0.0.3.12345 > 10.0.0.2.12345: UDP, length 16
13:00:29.840260 IP 10.0.0.3.12345 > 10.0.0.2.12345: UDP, length 16
13:00:29.840887 IP 10.0.0.3.12345 > 10.0.0.2.12345: UDP, length 16
13:00:29.841511 IP 10.0.0.3.12345 > 10.0.0.2.12345: UDP, length 16
13:00:29.842149 IP 10.0.0.3.12345 > 10.0.0.2.12345: UDP, length 16
13:00:29.842787 IP 10.0.0.3.12345 > 10.0.0.2.12345: UDP, length 16
13:00:29.843404 IP 10.0.0.3.12345 > 10.0.0.2.12345: UDP, length 16
13:00:29.844028 IP 10.0.0.3.12345 > 10.0.0.2.12345: UDP, length 16
13:00:29.844643 IP 10.0.0.3.12345 > 10.0.0.2.12345: UDP, length 16
13:00:29.845257 IP 10.0.0.3.12345 > 10.0.0.2.12345: UDP, length 16
13:00:29.845896 IP 10.0.0.3.12345 > 10.0.0.2.12345: UDP, length 16
13:00:29.846496 IP 10.0.0.3.12345 > 10.0.0.2.12345: UDP, length 16
13:00:29.847130 IP 10.0.0.3.12345 > 10.0.0.2.12345: UDP, length 16
13:00:29.847783 IP 10.0.0.3.12345 > 10.0.0.2.12345: UDP, length 16
13:00:29.848436 IP 10.0.0.3.12345 > 10.0.0.2.12345: UDP, length 16
13:00:29.849091 IP 10.0.0.3.12345 > 10.0.0.2.12345: UDP, length 16
13:00:29.849747 IP 10.0.0.3.12345 > 10.0.0.2.12345: UDP, length 16
13:00:29.850402 IP 10.0.0.3.12345 > 10.0.0.2.12345: UDP, length 16
13:00:29.851056 IP 10.0.0.3.12345 > 10.0.0.2.12345: UDP, length 16
13:00:29.851713 IP 10.0.0.3.12345 > 10.0.0.2.12345: UDP, length 16
13:00:29.852368 IP 10.0.0.3.12345 > 10.0.0.2.12345: UDP, length 16
13:00:29.853020 IP 10.0.0.3.12345 > 10.0.0.2.12345: UDP, length 16
13:00:29.853672 IP 10.0.0.3.12345 > 10.0.0.2.12345: UDP, length 16
13:00:29.854325 IP 10.0.0.3.12345 > 10.0.0.2.12345: UDP, length 16
13:00:29.854960 IP 10.0.0.3.12345 > 10.0.0.2.12345: UDP, length 16
13:00:29.855613 IP 10.0.0.3.12345 > 10.0.0.2.12345: UDP, length 16
13:00:29.856268 IP 10.0.0.3.12345 > 10.0.0.2.12345: UDP, length 16
13:00:29.856920 IP 10.0.0.3.12345 > 10.0.0.2.12345: UDP, length 16
13:00:29.857555 IP 10.0.0.3.12345 > 10.0.0.2.12345: UDP, length 16
13:00:29.858190 IP 10.0.0.3.12345 > 10.0.0.2.12345: UDP, length 16
13:00:29.858837 IP 10.0.0.3.12345 > 10.0.0.2.12345: UDP, length 16
13:00:29.859473 IP 10.0.0.3.12345 > 10.0.0.2.12345: UDP, length 16
13:00:29.860110 IP 10.0.0.3.12345 > 10.0.0.2.12345: UDP, length 16
13:00:29.860732 IP 10.0.0.3.12345 > 10.0.0.2.12345: UDP, length 16
13:00:29.861347 IP 10.0.0.3.12345 > 10.0.0.2.12345: UDP, length 16
13:00:29.861972 IP 10.0.0.3.12345 > 10.0.0.2.12345: UDP, length 16
13:00:29.862609 IP 10.0.0.3.12345 > 10.0.0.2.12345: UDP, length 16
13:00:29.863246 IP 10.0.0.3.12345 > 10.0.0.2.12345: UDP, length 16
13:00:29.863893 IP 10.0.0.3.12345 > 10.0.0.2.12345: UDP, length 16
13:00:29.864537 IP 10.0.0.3.12345 > 10.0.0.2.12345: UDP, length 16
13:00:29.865184 IP 10.0.0.3.12345 > 10.0.0.2.12345: UDP, length 16
13:00:29.865845 IP 10.0.0.3.12345 > 10.0.0.2.12345: UDP, length 16
13:00:29.866505 IP 10.0.0.3.12345 > 10.0.0.2.12345: UDP, length 16
13:00:29.867167 IP 10.0.0.3.12345 > 10.0.0.2.12345: UDP, length 16
13:00:29.867815 IP 10.0.0.3.12345 > 10.0.0.2.12345: UDP, length 16
13:00:29.868475 IP 10.0.0.3.12345 > 10.0.0.2.12345: UDP, length 16
13:00:29.869136 IP 10.0.0.3.12345 > 10.0.0.2.12345: UDP, length 16
13:00:29.869799 IP 10.0.0.3.12345 > 10.0.0.2.12345: UDP, length 16
13:00:29.870462 IP 10.0.0.3.12345 > 10.0.0.2.12345: UDP, length 16
13:00:29.871127 IP 10.0.0.3.12345 > 10.0.0.2.12345: UDP, length 16
13:00:29.871790 IP 10.0.0.3.12345 > 10.0.0.2.12345: UDP, length 16
13:00:29.872455 IP 10.0.0.3.12345 > 10.0.0.2.12345: UDP, length 16
13:00:29.873120 IP 10.0.0.3.12345 > 10.0.0.2.12345: UDP, length 16
13:00:29.873753 IP 10.0.0.3.12345 > 10.0.0.2.12345: UDP, length 16
13:00:29.874403 IP 10.0.0.3.12345 > 10.0.0.2.12345: UDP, length 16
13:00:29.875046 IP 10.0.0.3.12345 > 10.0.0.2.12345: UDP, length 16
13:00:29.875751 IP 10.0.0.3.12345 > 10.0.0.2.12345: UDP, length 16
13:00:29.876400 IP 10.0.0.3.12345 > 10.0.0.2.12345: UDP, length 16
