13:16:05.501904 IP 10.0.0.9.12345 > 10.0.0.2.12345: UDP, length 16
13:16:05.502404 IP 10.0.0.9.12345 > 10.0.0.2.12345: UDP, length 16
13:16:05.502976 IP 10.0.0.9.12345 > 10.0.0.2.12345: UDP, length 16
13:16:05.503546 IP 10.0.0.9.12345 > 10.0.0.2.12345: UDP, length 16
13:16:05.504139 IP 10.0.0.9.12345 > 10.0.0.2.12345: UDP, length 16
13:16:05.504721 IP 10.0.0.9.12345 > 10.0.0.2.12345: UDP, length 16
13:16:05.505294 IP 10.0.0.9.12345 > 10.0.0.2.12345: UDP, length 16
13:16:05.505863 IP 10.0.0.9.12345 > 10.0.0.2.12345: UDP, length 16
13:16:05.506432 IP 10.0.0.9.12345 > 10.0.0.2.12345: UDP, length 16
13:16:05.506991 IP 10.0.0.9.12345 > 10.0.0.2.12345: UDP, length 16
13:16:05.507556 IP 10.0.0.9.12345 > 10.0.0.2.12345: UDP, length 16
13:16:05.508134 IP 10.0.0.9.12345 > 10.0.0.2.12345: UDP, length 16
13:16:05.508664 IP 10.0.0.9.12345 > 10.0.0.2.12345: UDP, length 16
13:16:05.509245 IP 10.0.0.9.12345 > 10.0.0.2.12345: UDP, length 16
13:16:05.509862 IP 10.0.0.9.12345 > 10.0.0.2.12345: UDP, length 16
13:16:05.510458 IP 10.0.0.9.12345 > 10.0.0.2.12345: UDP, length 16
13:16:05.511050 IP 10.0.0.9.12345 > 10.0.0.2.12345: UDP, length 16
13:16:05.511648 IP 10.0.0.9.12345 > 10.0.0.2.12345: UDP, length 16
13:16:05.512238 IP 10.0.0.9.12345 > 10.0.0.2.12345: UDP, length 16
13:16:05.512818 IP 10.0.0.9.12345 > 10.0.0.2.12345: UDP, length 16
13:16:05.513392 IP 10.0.0.9.12345 > 10.0.0.2.12345: UDP, length 16
13:16:05.513960 IP 10.0.0.9.12345 > 10.0.0.2.12345: UDP, length 16
13:16:05.514536 IP 10.0.0.9.12345 > 10.0.0.2.12345: UDP, length 16
13:16:05.515113 IP 10.0.0.9.12345 > 10.0.0.2.12345: UDP, length 16
13:16:05.515741 IP 10.0.0.9.12345 > 10.0.0.2.12345: UDP, length 16
13:16:05.516272 IP 10.0.0.9.12345 > 10.0.0.2.12345: UDP, length 16
13:16:05.516847 IP 10.0.0.9.12345 > 10.0.0.2.12345: UDP, length 16
13:16:05.517416 IP 10.0.0.9.12345 > 10.0.0.2.12345: UDP, length 16
13:16:05.517986 IP 10.0.0.9.12345 > 10.0.0.2.12345: UDP, length 16
13:16:05.518555 IP 10.0.0.9.12345 > 10.0.0.2.12345: UDP, length 16
13:16:05.519125 IP 10.0.0.9.12345 > 10.0.0.2.12345: UDP, length 16
13:16:05.519692 IP 10.0.0.9.12345 > 10.0.0.2.12345: UDP, length 16
13:16:05.520277 IP 10.0.0.9.12345 > 10.0.0.2.12345: UDP, length 16
13:16:05.520860 IP 10.0.0.9.12345 > 10.0.0.2.12345: UDP, length 16
13:16:05.521444 IP 10.0.0.9.12345 > 10.0.0.2.12345: UDP, length 16
13:16:05.522028 IP 10.0.0.9.12345 > 10.0.0.2.12345: UDP, length 16
13:16:05.522597 IP 10.0.0.9.12345 > 10.0.0.2.12345: UDP, length 16
13:16:05.523170 IP 10.0.0.9.12345 > 10.0.0.2.12345: UDP, length 16
13:16:05.523731 IP 10.0.0.9.12345 > 10.0.0.2.12345: UDP, length 16
13:16:05.524298 IP 10.0.0.9.12345 > 10.0.0.2.12345: UDP, length 16
13:16:05.524869 IP 10.0.0.9.12345 > 10.0.0.2.12345: UDP, length 16
13:16:05.525460 IP 10.0.0.9.12345 > 10.0.0.2.12345: UDP, length 16
13:16:05.526040 IP 10.0.0.9.12345 > 10.0.0.2.12345: UDP, length 16
13:16:05.526619 IP 10.0.0.9.12345 > 10.0.0.2.12345: UDP, length 16
13:16:05.527194 IP 10.0.0.9.12345 > 10.0.0.2.12345: UDP, length 16
13:16:05.527761 IP 10.0.0.9.12345 > 10.0.0.2.12345: UDP, length 16
13:16:05.528334 IP 10.0.0.9.12345 > 10.0.0.2.12345: UDP, length 16
13:16:05.528918 IP 10.0.0.9.12345 > 10.0.0.2.12345: UDP, length 16
13:16:05.529502 IP 10.0.0.9.12345 > 10.0.0.2.12345: UDP, length 16
13:16:05.530086 IP 10.0.0.9.12345 > 10.0.0.2.12345: UDP, length 16
13:16:05.530665 IP 10.0.0.9.12345 > 10.0.0.2.12345: UDP, length 16
13:16:05.531249 IP 10.0.0.9.12345 > 10.0.0.2.12345: UDP, length 16
13:16:05.531832 IP 10.0.0.9.12345 > 10.0.0.2.12345: UDP, length 16
13:16:05.532415 IP 10.0.0.9.12345 > 10.0.0.2.12345: UDP, length 16
13:16:05.532998 IP 10.0.0.9.12345 > 10.0.0.2.12345: UDP, length 16
13:16:05.533581 IP 10.0.0.9.12345 > 10.0.0.2.12345: UDP, length 16
13:16:05.534165 IP 10.0.0.9.12345 > 10.0.0.2.12345: UDP, length 16
13:16:05.534749 IP 10.0.0.9.12345 > 10.0.0.2.12345: UDP, length 16
13:16:05.535341 IP 10.0.0.9.12345 > 10.0.0.2.12345: UDP, length 16
13:16:05.535922 IP 10.0.0.9.12345 > 10.0.0.2.12345: UDP, length 16
13:16:05.536499 IP 10.0.0.9.12345 > 10.0.0.2.12345: UDP, length 16
13:16:05.537071 IP 10.0.0.9.12345 > 10.0.0.2.12345: UDP, length 16
13:16:05.537641 IP 10.0.0.9.12345 > 10.0.0.2.12345: UDP, length 16
13:16:05.538212 IP 10.0.0.9.12345 > 10.0.0.2.12345: UDP, length 16
13:16:05.538775 IP 10.0.0.9.12345 > 10.0.0.2.12345: UDP, length 16
13:16:05.539345 IP 10.0.0.9.12345 > 10.0.0.2.12345: UDP, length 16
13:16:05.539917 IP 10.0.0.9.12345 > 10.0.0.2.12345: UDP, length 16
13:16:05.540486 IP 10.0.0.9.12345 > 10.0.0.2.12345: UDP, length 16
13:16:05.541056 IP 10.0.0.9.12345 > 10.0.0.2.12345: UDP, length 16
13:16:05.541624 IP 10.0.0.9.12345 > 10.0.0.2.12345: UDP, length 16
13:16:05.542206 IP 10.0.0.9.12345 > 10.0.0.2.12345: UDP, length 16
13:16:05.542799 IP 10.0.0.9.12345 > 10.0.0.2.12345: UDP, length 16
13:16:05.543383 IP 10.0.0.9.12345 > 10.0.0.2.12345: UDP, length 16
13:16:05.543972 IP 10.0.0.9.12345 > 10.0.0.2.12345: UDP, length 16
13:16:05.544559 IP 10.0.0.9.12345 > 10.0.0.2.12345: UDP, length 16
13:16:05.545142 IP 10.0.0.9.12345 > 10.0.0.2.12345: UDP, length 16
13:16:05.545716 IP 10.0.0.9.12345 > 10.0.0.2.12345: UDP, length 16
13:16:05.546323 IP 10.0.0.9.12345 > 10.0.0.2.12345: UDP, length 16
13:16:05.546918 IP 10.0.0.9.12345 > 10.0.0.2.12345: UDP, length 16
13:16:05.547501 IP 10.0.0.9.12345 > 10.0.0.2.12345: UDP, length 16
13:16:05.548074 IP 10.0.0.9.12345 > 10.0.0.2.12345: UDP, length 16
13:16:05.548646 IP 10.0.0.9.12345 > 10.0.0.2.12345: UDP, length 16
13:16:05.549227 IP 10.0.0.9.12345 > 10.0.0.2.12345: UDP, length 16
13:16:05.549804 IP 10.0.0.9.12345 > 10.0.0.2.12345: UDP, length 16
13:16:05.550385 IP 10.0.0.9.12345 > 10.0.0.2.12345: UDP, length 16
13:16:05.550966 IP 10.0.0.9.12345 > 10.0.0.2.12345: UDP, length 16
13:16:05.551548 IP 10.0.0.9.12345 > 10.0.0.2.12345: UDP, length 16
13:16:05.552124 IP 10.0.0.9.12345 > 10.0.0.2.12345: UDP, length 16
13:16:05.552714 IP 10.0.0.9.12345 > 10.0.0.2.12345: UDP, length 16
13:16:05.553313 IP 10.0.0.9.12345 > 10.0.0.2.12345: UDP, length 16
13:16:05.553908 IP 10.0.0.9.12345 > 10.0.0.2.12345: UDP, length 16
13:16:05.554486 IP 10.0.0.9.12345 > 10.0.0.2.12345: UDP, length 16
13:16:05.555086 IP 10.0.0.9.12345 > 10.0.0.2.12345: UDP, length 16
13:16:05.555660 IP 10.0.0.9.12345 > 10.0.0.2.12345: UDP, length 16
13:16:05.556244 IP 10.0.0.9.12345 > 10.0.0.2.12345: UDP, length 16
13:16:05.556819 IP 10.0.0.9.12345 > 10.0.0.2.12345: UDP, length 16
13:16:05.557394 IP 10.0.0.9.12345 > 10.0.0.2.12345: UDP, length 16
13:16:05.557975 IP 10.0.0.9.12345 > 10.0.0.2.12345: UDP, length 16
13:16:05.558548 IP 10.0.0.9.12345 > 10.0.0.2.12345: UDP, length 16
13:16:05.559116 IP 10.0.0.9.12345 > 10.0.0.2.12345: UDP, length 16
13:16:05.559701 IP 10.0.0.9.12345 > 10.0.0.2.12345: UDP, length 16
13:16:05.560290 IP 10.0.0.9.12345 > 10.0.0.2.12345: UDP, length 16
13:16:05.560876 IP 10.0.0.9.12345 > 10.0.0.2.12345: UDP, length 16
13:16:05.561460 IP 10.0.0.9.12345 > 10.0.0.2.12345: UDP, length 16
13:16:05.562044 IP 10.0.0.9.12345 > 10.0.0.2.12345: UDP, length 16
13:16:05.562624 IP 10.0.0.9.12345 > 10.0.0.2.12345: UDP, length 16
13:16:05.563193 IP 10.0.0.9.12345 > 10.0.0.2.12345: UDP, length 16
13:16:05.563760 IP 10.0.0.9.12345 > 10.0.0.2.12345: UDP, length 16
13:16:05.564333 IP 10.0.0.9.12345 > 10.0.0.2.12345: UDP, length 16
13:16:05.564911 IP 10.0.0.9.12345 > 10.0.0.2.12345: UDP, length 16
13:16:05.565472 IP 10.0.0.9.12345 > 10.0.0.2.12345: UDP, length 16
13:16:05.566031 IP 10.0.0.9.12345 > 10.0.0.2.12345: UDP, length 16
13:16:05.566589 IP 10.0.0.9.12345 > 10.0.0.2.12345: UDP, length 16
13:16:05.567146 IP 10.0.0.9.12345 > 10.0.0.2.12345: UDP, length 16
13:16:05.567684 IP 10.0.0.9.12345 > 10.0.0.2.12345: UDP, length 16
13:16:05.568250 IP 10.0.0.9.12345 > 10.0.0.2.12345: UDP, length 16
13:16:05.568814 IP 10.0.0.9.12345 > 10.0.0.2.12345: UDP, length 16
13:16:05.569372 IP 10.0.0.9.12345 > 10.0.0.2.12345: UDP, length 16
13:16:05.569930 IP 10.0.0.9.12345 > 10.0.0.2.12345: UDP, length 16
13:16:05.570511 IP 10.0.0.9.12345 > 10.0.0.2.12345: UDP, length 16
13:16:05.571091 IP 10.0.0.9.12345 > 10.0.0.2.12345: UDP, length 16
13:16:05.571679 IP 10.0.0.9.12345 > 10.0.0.2.12345: UDP, length 16
13:16:05.572302 IP 10.0.0.9.12345 > 10.0.0.2.12345: UDP, length 16
13:16:05.572923 IP 10.0.0.9.12345 > 10.0.0.2.12345: UDP, length 16
13:16:05.573516 IP 10.0.0.9.12345 > 10.0.0.2.12345: UDP, length 16
13:16:05.574094 IP 10.0.0.9.12345 > 10.0.0.2.12345: UDP, length 16
13:16:05.574671 IP 10.0.0.9.12345 > 10.0.0.2.12345: UDP, length 16
13:16:05.575244 IP 10.0.0.9.12345 > 10.0.0.2.12345: UDP, length 16
13:16:05.575822 IP 10.0.0.9.12345 > 10.0.0.2.12345: UDP, length 16
13:16:05.576394 IP 10.0.0.9.12345 > 10.0.0.2.12345: UDP, length 16
13:16:05.576957 IP 10.0.0.9.12345 > 10.0.0.2.12345: UDP, length 16
13:16:05.577532 IP 10.0.0.9.12345 > 10.0.0.2.12345: UDP, length 16
13:16:05.578100 IP 10.0.0.9.12345 > 10.0.0.2.12345: UDP, length 16
13:16:05.578670 IP 10.0.0.9.12345 > 10.0.0.2.12345: UDP, length 16
13:16:05.579247 IP 10.0.0.9.12345 > 10.0.0.2.12345: UDP, length 16
13:16:05.579815 IP 10.0.0.9.12345 > 10.0.0.2.12345: UDP, length 16
13:16:05.580382 IP 10.0.0.9.12345 > 10.0.0.2.12345: UDP, length 16
13:16:05.580959 IP 10.0.0.9.12345 > 10.0.0.2.12345: UDP, length 16
13:16:05.581541 IP 10.0.0.9.12345 > 10.0.0.2.12345: UDP, length 16
13:16:05.582112 IP 10.0.0.9.12345 > 10.0.0.2.12345: UDP, length 16
13:16:05.582707 IP 10.0.0.9.12345 > 10.0.0.2.12345: UDP, length 16
13:16:05.583295 IP 10.0.0.9.12345 > 10.0.0.2.12345: UDP, length 16
13:16:05.583873 IP 10.0.0.9.12345 > 10.0.0.2.12345: UDP, length 16
13:16:05.584466 IP 10.0.0.9.12345 > 10.0.0.2.12345: UDP, length 16
13:16:05.585044 IP 10.0.0.9.12345 > 10.0.0.2.12345: UDP, length 16
13:16:05.585622 IP 10.0.0.9.12345 > 10.0.0.2.12345: UDP, length 16
13:16:05.586197 IP 10.0.0.9.12345 > 10.0.0.2.12345: UDP, length 16
13:16:05.586785 IP 10.0.0.9.12345 > 10.0.0.2.12345: UDP, length 16
13:16:05.587366 IP 10.0.0.9.12345 > 10.0.0.2.12345: UDP, length 16
13:16:05.587940 IP 10.0.0.9.12345 > 10.0.0.2.12345: UDP, length 16
13:16:05.588509 IP 10.0.0.9.12345 > 10.0.0.2.12345: UDP, length 16
13:16:05.589088 IP 10.0.0.9.12345 > 10.0.0.2.12345: UDP, length 16
13:16:05.589667 IP 10.0.0.9.12345 > 10.0.0.2.12345: UDP, length 16
13:16:05.590236 IP 10.0.0.9.12345 > 10.0.0.2.12345: UDP, length 16
13:16:05.590797 IP 10.0.0.9.12345 > 10.0.0.2.12345: UDP, length 16
13:16:05.591363 IP 10.0.0.9.12345 > 10.0.0.2.12345: UDP, length 16
13:16:05.591929 IP 10.0.0.9.12345 > 10.0.0.2.12345: UDP, length 16
13:16:05.592497 IP 10.0.0.9.12345 > 10.0.0.2.12345: UDP, length 16
13:16:05.593078 IP 10.0.0.9.12345 > 10.0.0.2.12345: UDP, length 16
13:16:05.593655 IP 10.0.0.9.12345 > 10.0.0.2.12345: UDP, length 16
13:16:05.594230 IP 10.0.0.9.12345 > 10.0.0.2.12345: UDP, length 16
13:16:05.594799 IP 10.0.0.9.12345 > 10.0.0.2.12345: UDP, length 16
13:16:05.595374 IP 10.0.0.9.12345 > 10.0.0.2.12345: UDP, length 16
13:16:05.595943 IP 10.0.0.9.12345 > 10.0.0.2.12345: UDP, length 16
13:16:05.596535 IP 10.0.0.9.12345 > 10.0.0.2.12345: UDP, length 16
13:16:05.597128 IP 10.0.0.9.12345 > 10.0.0.2.12345: UDP, length 16
13:16:05.597706 IP 10.0.0.9.12345 > 10.0.0.2.12345: UDP, length 16
13:16:05.598276 IP 10.0.0.9.12345 > 10.0.0.2.12345: UDP, length 16
13:16:05.598841 IP 10.0.0.9.12345 > 10.0.0.2.12345: UDP, length 16
13:16:05.599403 IP 10.0.0.9.12345 > 10.0.0.2.12345: UDP, length 16
13:16:05.599970 IP 10.0.0.9.12345 > 10.0.0.2.12345: UDP, length 16
13:16:05.600564 IP 10.0.0.9.12345 > 10.0.0.2.12345: UDP, length 16
13:16:05.601146 IP 10.0.0.9.12345 > 10.0.0.2.12345: UDP, length 16
13:16:05.601729 IP 10.0.0.9.12345 > 10.0.0.2.12345: UDP, length 16
13:16:05.602321 IP 10.0.0.9.12345 > 10.0.0.2.12345: UDP, length 16
13:16:05.602902 IP 10.0.0.9.12345 > 10.0.0.2.12345: UDP, length 16
13:16:05.603482 IP 10.0.0.9.12345 > 10.0.0.2.12345: UDP, length 16
13:16:05.604053 IP 10.0.0.9.12345 > 10.0.0.2.12345: UDP, length 16
13:16:05.604626 IP 10.0.0.9.12345 > 10.0.0.2.12345: UDP, length 16
13:16:05.605203 IP 10.0.0.9.12345 > 10.0.0.2.12345: UDP, length 16
13:16:05.605775 IP 10.0.0.9.12345 > 10.0.0.2.12345: UDP, length 16
13:16:05.606340 IP 10.0.0.9.12345 > 10.0.0.2.12345: UDP, length 16
13:16:05.606916 IP 10.0.0.9.12345 > 10.0.0.2.12345: UDP, length 16
13:16:05.607489 IP 10.0.0.9.12345 > 10.0.0.2.12345: UDP, length 16
13:16:05.608071 IP 10.0.0.9.12345 > 10.0.0.2.12345: UDP, length 16
13:16:05.608635 IP 10.0.0.9.12345 > 10.0.0.2.12345: UDP, length 16
13:16:05.609211 IP 10.0.0.9.12345 > 10.0.0.2.12345: UDP, length 16
13:16:05.609781 IP 10.0.0.9.12345 > 10.0.0.2.12345: UDP, length 16
13:16:05.610352 IP 10.0.0.9.12345 > 10.0.0.2.12345: UDP, length 16
13:16:05.610947 IP 10.0.0.9.12345 > 10.0.0.2.12345: UDP, length 16
13:16:05.611528 IP 10.0.0.9.12345 > 10.0.0.2.12345: UDP, length 16
13:16:05.612106 IP 10.0.0.9.12345 > 10.0.0.2.12345: UDP, length 16
13:16:05.612674 IP 10.0.0.9.12345 > 10.0.0.2.12345: UDP, length 16
13:16:05.613253 IP 10.0.0.9.12345 > 10.0.0.2.12345: UDP, length 16
13:16:05.613830 IP 10.0.0.9.12345 > 10.0.0.2.12345: UDP, length 16
13:16:05.614395 IP 10.0.0.9.12345 > 10.0.0.2.12345: UDP, length 16
13:16:05.614974 IP 10.0.0.9.12345 > 10.0.0.2.12345: UDP, length 16
13:16:05.615560 IP 10.0.0.9.12345 > 10.0.0.2.12345: UDP, length 16
13:16:05.616148 IP 10.0.0.9.12345 > 10.0.0.2.12345: UDP, length 16
13:16:05.616752 IP 10.0.0.9.12345 > 10.0.0.2.12345: UDP, length 16
13:16:05.617357 IP 10.0.0.9.12345 > 10.0.0.2.12345: UDP, length 16
13:16:05.617963 IP 10.0.0.9.12345 > 10.0.0.2.12345: UDP, length 16
13:16:05.618559 IP 10.0.0.9.12345 > 10.0.0.2.12345: UDP, length 16
13:16:05.619145 IP 10.0.0.9.12345 > 10.0.0.2.12345: UDP, length 16
13:16:05.619725 IP 10.0.0.9.12345 > 10.0.0.2.12345: UDP, length 16
13:16:05.620316 IP 10.0.0.9.12345 > 10.0.0.2.12345: UDP, length 16
13:16:05.620920 IP 10.0.0.9.12345 > 10.0.0.2.12345: UDP, length 16
13:16:05.621527 IP 10.0.0.9.12345 > 10.0.0.2.12345: UDP, length 16
13:16:05.622134 IP 10.0.0.9.12345 > 10.0.0.2.12345: UDP, length 16
13:16:05.622742 IP 10.0.0.9.12345 > 10.0.0.2.12345: UDP, length 16
13:16:05.623348 IP 10.0.0.9.12345 > 10.0.0.2.12345: UDP, length 16
13:16:05.623944 IP 10.0.0.9.12345 > 10.0.0.2.12345: UDP, length 16
13:16:05.624555 IP 10.0.0.9.12345 > 10.0.0.2.12345: UDP, length 16
13:16:05.625169 IP 10.0.0.9.12345 > 10.0.0.2.12345: UDP, length 16
13:16:05.625768 IP 10.0.0.9.12345 > 10.0.0.2.12345: UDP, length 16
13:16:05.626373 IP 10.0.0.9.12345 > 10.0.0.2.12345: UDP, length 16
13:16:05.626998 IP 10.0.0.9.12345 > 10.0.0.2.12345: UDP, length 16
13:16:05.627584 IP 10.0.0.9.12345 > 10.0.0.2.12345: UDP, length 16
13:16:05.628165 IP 10.0.0.9.12345 > 10.0.0.2.12345: UDP, length 16
13:16:05.628743 IP 10.0.0.9.12345 > 10.0.0.2.12345: UDP, length 16
13:16:05.629326 IP 10.0.0.9.12345 > 10.0.0.2.12345: UDP, length 16
13:16:05.629923 IP 10.0.0.9.12345 > 10.0.0.2.12345: UDP, length 16
13:16:05.630531 IP 10.0.0.9.12345 > 10.0.0.2.12345: UDP, length 16
13:16:05.631138 IP 10.0.0.9.12345 > 10.0.0.2.12345: UDP, length 16
13:16:05.631743 IP 10.0.0.9.12345 > 10.0.0.2.12345: UDP, length 16
13:16:05.632342 IP 10.0.0.9.12345 > 10.0.0.2.12345: UDP, length 16
13:16:05.632936 IP 10.0.0.9.12345 > 10.0.0.2.12345: UDP, length 16
13:16:05.633529 IP 10.0.0.9.12345 > 10.0.0.2.12345: UDP, length 16
13:16:05.634121 IP 10.0.0.9.12345 > 10.0.0.2.12345: UDP, length 16
13:16:05.634711 IP 10.0.0.9.12345 > 10.0.0.2.12345: UDP, length 16
13:16:05.635301 IP 10.0.0.9.12345 > 10.0.0.2.12345: UDP, length 16
13:16:05.635878 IP 10.0.0.9.12345 > 10.0.0.2.12345: UDP, length 16
13:16:05.636478 IP 10.0.0.9.12345 > 10.0.0.2.12345: UDP, length 16
13:16:05.637074 IP 10.0.0.9.12345 > 10.0.0.2.12345: UDP, length 16
13:16:05.637669 IP 10.0.0.9.12345 > 10.0.0.2.12345: UDP, length 16
13:16:05.638267 IP 10.0.0.9.12345 > 10.0.0.2.12345: UDP, length 16
13:16:05.638864 IP 10.0.0.9.12345 > 10.0.0.2.12345: UDP, length 16
13:16:05.639460 IP 10.0.0.9.12345 > 10.0.0.2.12345: UDP, length 16
13:16:05.640056 IP 10.0.0.9.12345 > 10.0.0.2.12345: UDP, length 16
13:16:05.640652 IP 10.0.0.9.12345 > 10.0.0.2.12345: UDP, length 16
13:16:05.641247 IP 10.0.0.9.12345 > 10.0.0.2.12345: UDP, length 16
13:16:05.641844 IP 10.0.0.9.12345 > 10.0.0.2.12345: UDP, length 16
13:16:05.642426 IP 10.0.0.9.12345 > 10.0.0.2.12345: UDP, length 16
13:16:05.643011 IP 10.0.0.9.12345 > 10.0.0.2.12345: UDP, length 16
13:16:05.643621 IP 10.0.0.9.12345 > 10.0.0.2.12345: UDP, length 16
13:16:05.644209 IP 10.0.0.9.12345 > 10.0.0.2.12345: UDP, length 16
13:16:05.644821 IP 10.0.0.9.12345 > 10.0.0.2.12345: UDP, length 16
13:16:05.645433 IP 10.0.0.9.12345 > 10.0.0.2.12345: UDP, length 16
13:16:05.646019 IP 10.0.0.9.12345 > 10.0.0.2.12345: UDP, length 16
13:16:05.646618 IP 10.0.0.9.12345 > 10.0.0.2.12345: UDP, length 16
13:16:05.647220 IP 10.0.0.9.12345 > 10.0.0.2.12345: UDP, length 16
13:16:05.647803 IP 10.0.0.9.12345 > 10.0.0.2.12345: UDP, length 16
13:16:05.648382 IP 10.0.0.9.12345 > 10.0.0.2.12345: UDP, length 16
13:16:05.648968 IP 10.0.0.9.12345 > 10.0.0.2.12345: UDP, length 16
13:16:05.649551 IP 10.0.0.9.12345 > 10.0.0.2.12345: UDP, length 16
13:16:05.650135 IP 10.0.0.9.12345 > 10.0.0.2.12345: UDP, length 16
13:16:05.650751 IP 10.0.0.9.12345 > 10.0.0.2.12345: UDP, length 16
13:16:05.651371 IP 10.0.0.9.12345 > 10.0.0.2.12345: UDP, length 16
13:16:05.651969 IP 10.0.0.9.12345 > 10.0.0.2.12345: UDP, length 16
13:16:05.652585 IP 10.0.0.9.12345 > 10.0.0.2.12345: UDP, length 16
13:16:05.653203 IP 10.0.0.9.12345 > 10.0.0.2.12345: UDP, length 16
13:16:05.653837 IP 10.0.0.9.12345 > 10.0.0.2.12345: UDP, length 16
13:16:05.654472 IP 10.0.0.9.12345 > 10.0.0.2.12345: UDP, length 16
13:16:05.655106 IP 10.0.0.9.12345 > 10.0.0.2.12345: UDP, length 16
13:16:05.655778 IP 10.0.0.9.12345 > 10.0.0.2.12345: UDP, length 16
13:16:05.656415 IP 10.0.0.9.12345 > 10.0.0.2.12345: UDP, length 16
13:16:05.657049 IP 10.0.0.9.12345 > 10.0.0.2.12345: UDP, length 16
13:16:05.657685 IP 10.0.0.9.12345 > 10.0.0.2.12345: UDP, length 16
13:16:05.658332 IP 10.0.0.9.12345 > 10.0.0.2.12345: UDP, length 16
13:16:05.658936 IP 10.0.0.9.12345 > 10.0.0.2.12345: UDP, length 16
13:16:05.659560 IP 10.0.0.9.12345 > 10.0.0.2.12345: UDP, length 16
13:16:05.660185 IP 10.0.0.9.12345 > 10.0.0.2.12345: UDP, length 16
13:16:05.660811 IP 10.0.0.9.12345 > 10.0.0.2.12345: UDP, length 16
13:16:05.661433 IP 10.0.0.9.12345 > 10.0.0.2.12345: UDP, length 16
13:16:05.662053 IP 10.0.0.9.12345 > 10.0.0.2.12345: UDP, length 16
13:16:05.662674 IP 10.0.0.9.12345 > 10.0.0.2.12345: UDP, length 16
13:16:05.663295 IP 10.0.0.9.12345 > 10.0.0.2.12345: UDP, length 16
13:16:05.663903 IP 10.0.0.9.12345 > 10.0.0.2.12345: UDP, length 16
13:16:05.664534 IP 10.0.0.9.12345 > 10.0.0.2.12345: UDP, length 16
13:16:05.665165 IP 10.0.0.9.12345 > 10.0.0.2.12345: UDP, length 16
13:16:05.665771 IP 10.0.0.9.12345 > 10.0.0.2.12345: UDP, length 16
13:16:05.666403 IP 10.0.0.9.12345 > 10.0.0.2.12345: UDP, length 16
13:16:05.667010 IP 10.0.0.9.12345 > 10.0.0.2.12345: UDP, length 16
13:16:05.667609 IP 10.0.0.9.12345 > 10.0.0.2.12345: UDP, length 16
13:16:05.668209 IP 10.0.0.9.12345 > 10.0.0.2.12345: UDP, length 16
13:16:05.668802 IP 10.0.0.9.12345 > 10.0.0.2.12345: UDP, length 16
13:16:05.669389 IP 10.0.0.9.12345 > 10.0.0.2.12345: UDP, length 16
13:16:05.669995 IP 10.0.0.9.12345 > 10.0.0.2.12345: UDP, length 16
13:16:05.670599 IP 10.0.0.9.12345 > 10.0.0.2.12345: UDP, length 16
13:16:05.671204 IP 10.0.0.9.12345 > 10.0.0.2.12345: UDP, length 16
13:16:05.671823 IP 10.0.0.9.12345 > 10.0.0.2.12345: UDP, length 16
13:16:05.672427 IP 10.0.0.9.12345 > 10.0.0.2.12345: UDP, length 16
13:16:05.673031 IP 10.0.0.9.12345 > 10.0.0.2.12345: UDP, length 16
13:16:05.673636 IP 10.0.0.9.12345 > 10.0.0.2.12345: UDP, length 16
13:16:05.674242 IP 10.0.0.9.12345 > 10.0.0.2.12345: UDP, length 16
13:16:05.674841 IP 10.0.0.9.12345 > 10.0.0.2.12345: UDP, length 16
13:16:05.675446 IP 10.0.0.9.12345 > 10.0.0.2.12345: UDP, length 16
13:16:05.676081 IP 10.0.0.9.12345 > 10.0.0.2.12345: UDP, length 16
13:16:05.676705 IP 10.0.0.9.12345 > 10.0.0.2.12345: UDP, length 16
13:16:05.677348 IP 10.0.0.9.12345 > 10.0.0.2.12345: UDP, length 16
13:16:05.677987 IP 10.0.0.9.12345 > 10.0.0.2.12345: UDP, length 16
13:16:05.678627 IP 10.0.0.9.12345 > 10.0.0.2.12345: UDP, length 16
13:16:05.679261 IP 10.0.0.9.12345 > 10.0.0.2.12345: UDP, length 16
13:16:05.679861 IP 10.0.0.9.12345 > 10.0.0.2.12345: UDP, length 16
13:16:05.680473 IP 10.0.0.9.12345 > 10.0.0.2.12345: UDP, length 16
13:16:05.681070 IP 10.0.0.9.12345 > 10.0.0.2.12345: UDP, length 16
13:16:05.681703 IP 10.0.0.9.12345 > 10.0.0.2.12345: UDP, length 16
13:16:05.682339 IP 10.0.0.9.12345 > 10.0.0.2.12345: UDP, length 16
13:16:05.682974 IP 10.0.0.9.12345 > 10.0.0.2.12345: UDP, length 16
13:16:05.683599 IP 10.0.0.9.12345 > 10.0.0.2.12345: UDP, length 16
13:16:05.684197 IP 10.0.0.9.12345 > 10.0.0.2.12345: UDP, length 16
13:16:05.684848 IP 10.0.0.9.12345 > 10.0.0.2.12345: UDP, length 16
13:16:05.685500 IP 10.0.0.9.12345 > 10.0.0.2.12345: UDP, length 16
13:16:05.686153 IP 10.0.0.9.12345 > 10.0.0.2.12345: UDP, length 16
13:16:05.686807 IP 10.0.0.9.12345 > 10.0.0.2.12345: UDP, length 16
13:16:05.687463 IP 10.0.0.9.12345 > 10.0.0.2.12345: UDP, length 16
13:16:05.688077 IP 10.0.0.9.12345 > 10.0.0.2.12345: UDP, length 16
13:16:05.688730 IP 10.0.0.9.12345 > 10.0.0.2.12345: UDP, length 16
13:16:05.689385 IP 10.0.0.9.12345 > 10.0.0.2.12345: UDP, length 16
13:16:05.690040 IP 10.0.0.9.12345 > 10.0.0.2.12345: UDP, length 16
13:16:05.690695 IP 10.0.0.9.12345 > 10.0.0.2.12345: UDP, length 16
13:16:05.691301 IP 10.0.0.9.12345 > 10.0.0.2.12345: UDP, length 16
13:16:05.691898 IP 10.0.0.9.12345 > 10.0.0.2.12345: UDP, length 16
13:16:05.692495 IP 10.0.0.9.12345 > 10.0.0.2.12345: UDP, length 16
13:16:05.693093 IP 10.0.0.9.12345 > 10.0.0.2.12345: UDP, length 16
13:16:05.693696 IP 10.0.0.9.12345 > 10.0.0.2.12345: UDP, length 16
13:16:05.694286 IP 10.0.0.9.12345 > 10.0.0.2.12345: UDP, length 16
13:16:05.694881 IP 10.0.0.9.12345 > 10.0.0.2.12345: UDP, length 16
13:16:05.695496 IP 10.0.0.9.12345 > 10.0.0.2.12345: UDP, length 16
13:16:05.696086 IP 10.0.0.9.12345 > 10.0.0.2.12345: UDP, length 16
13:16:05.696698 IP 10.0.0.9.12345 > 10.0.0.2.12345: UDP, length 16
13:16:05.697314 IP 10.0.0.9.12345 > 10.0.0.2.12345: UDP, length 16
13:16:05.697928 IP 10.0.0.9.12345 > 10.0.0.2.12345: UDP, length 16
13:16:05.698526 IP 10.0.0.9.12345 > 10.0.0.2.12345: UDP, length 16
13:16:05.699120 IP 10.0.0.9.12345 > 10.0.0.2.12345: UDP, length 16
13:16:05.699748 IP 10.0.0.9.12345 > 10.0.0.2.12345: UDP, length 16
13:16:05.700362 IP 10.0.0.9.12345 > 10.0.0.2.12345: UDP, length 16
13:16:05.700976 IP 10.0.0.9.12345 > 10.0.0.2.12345: UDP, length 16
13:16:05.701589 IP 10.0.0.9.12345 > 10.0.0.2.12345: UDP, length 16
13:16:05.702204 IP 10.0.0.9.12345 > 10.0.0.2.12345: UDP, length 16
13:16:05.702818 IP 10.0.0.9.12345 > 10.0.0.2.12345: UDP, length 16
13:16:05.703431 IP 10.0.0.9.12345 > 10.0.0.2.12345: UDP, length 16
13:16:05.704023 IP 10.0.0.9.12345 > 10.0.0.2.12345: UDP, length 16
13:16:05.704649 IP 10.0.0.9.12345 > 10.0.0.2.12345: UDP, length 16
13:16:05.705276 IP 10.0.0.9.12345 > 10.0.0.2.12345: UDP, length 16
13:16:05.705903 IP 10.0.0.9.12345 > 10.0.0.2.12345: UDP, length 16
13:16:05.706517 IP 10.0.0.9.12345 > 10.0.0.2.12345: UDP, length 16
13:16:05.707156 IP 10.0.0.9.12345 > 10.0.0.2.12345: UDP, length 16
13:16:05.707754 IP 10.0.0.9.12345 > 10.0.0.2.12345: UDP, length 16
13:16:05.708349 IP 10.0.0.9.12345 > 10.0.0.2.12345: UDP, length 16
13:16:05.708951 IP 10.0.0.9.12345 > 10.0.0.2.12345: UDP, length 16
13:16:05.709553 IP 10.0.0.9.12345 > 10.0.0.2.12345: UDP, length 16
13:16:05.710184 IP 10.0.0.9.12345 > 10.0.0.2.12345: UDP, length 16
13:16:05.710802 IP 10.0.0.9.12345 > 10.0.0.2.12345: UDP, length 16
13:16:05.711415 IP 10.0.0.9.12345 > 10.0.0.2.12345: UDP, length 16
13:16:05.712019 IP 10.0.0.9.12345 > 10.0.0.2.12345: UDP, length 16
13:16:05.712647 IP 10.0.0.9.12345 > 10.0.0.2.12345: UDP, length 16
13:16:05.713280 IP 10.0.0.9.12345 > 10.0.0.2.12345: UDP, length 16
13:16:05.713899 IP 10.0.0.9.12345 > 10.0.0.2.12345: UDP, length 16
13:16:05.714498 IP 10.0.0.9.12345 > 10.0.0.2.12345: UDP, length 16
13:16:05.715088 IP 10.0.0.9.12345 > 10.0.0.2.12345: UDP, length 16
13:16:05.715745 IP 10.0.0.9.12345 > 10.0.0.2.12345: UDP, length 16
13:16:05.716337 IP 10.0.0.9.12345 > 10.0.0.2.12345: UDP, length 16
13:16:05.716939 IP 10.0.0.9.12345 > 10.0.0.2.12345: UDP, length 16
13:16:05.717530 IP 10.0.0.9.12345 > 10.0.0.2.12345: UDP, length 16
13:16:05.718118 IP 10.0.0.9.12345 > 10.0.0.2.12345: UDP, length 16
13:16:05.718706 IP 10.0.0.9.12345 > 10.0.0.2.12345: UDP, length 16
13:16:05.719295 IP 10.0.0.9.12345 > 10.0.0.2.12345: UDP, length 16
13:16:05.719924 IP 10.0.0.9.12345 > 10.0.0.2.12345: UDP, length 16
13:16:05.720554 IP 10.0.0.9.12345 > 10.0.0.2.12345: UDP, length 16
13:16:05.721182 IP 10.0.0.9.12345 > 10.0.0.2.12345: UDP, length 16
13:16:05.721811 IP 10.0.0.9.12345 > 10.0.0.2.12345: UDP, length 16
13:16:05.722428 IP 10.0.0.9.12345 > 10.0.0.2.12345: UDP, length 16
13:16:05.723024 IP 10.0.0.9.12345 > 10.0.0.2.12345: UDP, length 16
13:16:05.723620 IP 10.0.0.9.12345 > 10.0.0.2.12345: UDP, length 16
13:16:05.724212 IP 10.0.0.9.12345 > 10.0.0.2.12345: UDP, length 16
13:16:05.724805 IP 10.0.0.9.12345 > 10.0.0.2.12345: UDP, length 16
13:16:05.725438 IP 10.0.0.9.12345 > 10.0.0.2.12345: UDP, length 16
13:16:05.726075 IP 10.0.0.9.12345 > 10.0.0.2.12345: UDP, length 16
13:16:05.726712 IP 10.0.0.9.12345 > 10.0.0.2.12345: UDP, length 16
13:16:05.727356 IP 10.0.0.9.12345 > 10.0.0.2.12345: UDP, length 16
13:16:05.727994 IP 10.0.0.9.12345 > 10.0.0.2.12345: UDP, length 16
13:16:05.728631 IP 10.0.0.9.12345 > 10.0.0.2.12345: UDP, length 16
13:16:05.729269 IP 10.0.0.9.12345 > 10.0.0.2.12345: UDP, length 16
13:16:05.729927 IP 10.0.0.9.12345 > 10.0.0.2.12345: UDP, length 16
13:16:05.730553 IP 10.0.0.9.12345 > 10.0.0.2.12345: UDP, length 16
13:16:05.731175 IP 10.0.0.9.12345 > 10.0.0.2.12345: UDP, length 16
13:16:05.731780 IP 10.0.0.9.12345 > 10.0.0.2.12345: UDP, length 16
13:16:05.732400 IP 10.0.0.9.12345 > 10.0.0.2.12345: UDP, length 16
13:16:05.733014 IP 10.0.0.9.12345 > 10.0.0.2.12345: UDP, length 16
13:16:05.733612 IP 10.0.0.9.12345 > 10.0.0.2.12345: UDP, length 16
13:16:05.734208 IP 10.0.0.9.12345 > 10.0.0.2.12345: UDP, length 16
13:16:05.734802 IP 10.0.0.9.12345 > 10.0.0.2.12345: UDP, length 16
13:16:05.735393 IP 10.0.0.9.12345 > 10.0.0.2.12345: UDP, length 16
13:16:05.736023 IP 10.0.0.9.12345 > 10.0.0.2.12345: UDP, length 16
13:16:05.736652 IP 10.0.0.9.12345 > 10.0.0.2.12345: UDP, length 16
13:16:05.737284 IP 10.0.0.9.12345 > 10.0.0.2.12345: UDP, length 16
13:16:05.737912 IP 10.0.0.9.12345 > 10.0.0.2.12345: UDP, length 16
13:16:05.738554 IP 10.0.0.9.12345 > 10.0.0.2.12345: UDP, length 16
13:16:05.739197 IP 10.0.0.9.12345 > 10.0.0.2.12345: UDP, length 16
13:16:05.739794 IP 10.0.0.9.12345 > 10.0.0.2.12345: UDP, length 16
13:16:05.740406 IP 10.0.0.9.12345 > 10.0.0.2.12345: UDP, length 16
13:16:05.741001 IP 10.0.0.9.12345 > 10.0.0.2.12345: UDP, length 16
13:16:05.741592 IP 10.0.0.9.12345 > 10.0.0.2.12345: UDP, length 16
13:16:05.742220 IP 10.0.0.9.12345 > 10.0.0.2.12345: UDP, length 16
13:16:05.742850 IP 10.0.0.9.12345 > 10.0.0.2.12345: UDP, length 16
13:16:05.743486 IP 10.0.0.9.12345 > 10.0.0.2.12345: UDP, length 16
13:16:05.744119 IP 10.0.0.9.12345 > 10.0.0.2.12345: UDP, length 16
13:16:05.744750 IP 10.0.0.9.12345 > 10.0.0.2.12345: UDP, length 16
13:16:05.745381 IP 10.0.0.9.12345 > 10.0.0.2.12345: UDP, length 16
13:16:05.746012 IP 10.0.0.9.12345 > 10.0.0.2.12345: UDP, length 16
13:16:05.746616 IP 10.0.0.9.12345 > 10.0.0.2.12345: UDP, length 16
13:16:05.747226 IP 10.0.0.9.12345 > 10.0.0.2.12345: UDP, length 16
13:16:05.747846 IP 10.0.0.9.12345 > 10.0.0.2.12345: UDP, length 16
13:16:05.748454 IP 10.0.0.9.12345 > 10.0.0.2.12345: UDP, length 16
13:16:05.749083 IP 10.0.0.9.12345 > 10.0.0.2.12345: UDP, length 16
13:16:05.749715 IP 10.0.0.9.12345 > 10.0.0.2.12345: UDP, length 16
13:16:05.750347 IP 10.0.0.9.12345 > 10.0.0.2.12345: UDP, length 16
13:16:05.750957 IP 10.0.0.9.12345 > 10.0.0.2.12345: UDP, length 16
13:16:05.751609 IP 10.0.0.9.12345 > 10.0.0.2.12345: UDP, length 16
13:16:05.752262 IP 10.0.0.9.12345 > 10.0.0.2.12345: UDP, length 16
13:16:05.752914 IP 10.0.0.9.12345 > 10.0.0.2.12345: UDP, length 16
13:16:05.753566 IP 10.0.0.9.12345 > 10.0.0.2.12345: UDP, length 16
13:16:05.754218 IP 10.0.0.9.12345 > 10.0.0.2.12345: UDP, length 16
13:16:05.754824 IP 10.0.0.9.12345 > 10.0.0.2.12345: UDP, length 16
13:16:05.755456 IP 10.0.0.9.12345 > 10.0.0.2.12345: UDP, length 16
13:16:05.756067 IP 10.0.0.9.12345 > 10.0.0.2.12345: UDP, length 16
13:16:05.756696 IP 10.0.0.9.12345 > 10.0.0.2.12345: UDP, length 16
13:16:05.757327 IP 10.0.0.9.12345 > 10.0.0.2.12345: UDP, length 16
13:16:05.757958 IP 10.0.0.9.12345 > 10.0.0.2.12345: UDP, length 16
13:16:05.758587 IP 10.0.0.9.12345 > 10.0.0.2.12345: UDP, length 16
13:16:05.759225 IP 10.0.0.9.12345 > 10.0.0.2.12345: UDP, length 16
13:16:05.759865 IP 10.0.0.9.12345 > 10.0.0.2.12345: UDP, length 16
13:16:05.760504 IP 10.0.0.9.12345 > 10.0.0.2.12345: UDP, length 16
13:16:05.761141 IP 10.0.0.9.12345 > 10.0.0.2.12345: UDP, length 16
13:16:05.761777 IP 10.0.0.9.12345 > 10.0.0.2.12345: UDP, length 16
13:16:05.762400 IP 10.0.0.9.12345 > 10.0.0.2.12345: UDP, length 16
13:16:05.763012 IP 10.0.0.9.12345 > 10.0.0.2.12345: UDP, length 16
13:16:05.763623 IP 10.0.0.9.12345 > 10.0.0.2.12345: UDP, length 16
13:16:05.764273 IP 10.0.0.9.12345 > 10.0.0.2.12345: UDP, length 16
13:16:05.764882 IP 10.0.0.9.12345 > 10.0.0.2.12345: UDP, length 16
13:16:05.765491 IP 10.0.0.9.12345 > 10.0.0.2.12345: UDP, length 16
13:16:05.766086 IP 10.0.0.9.12345 > 10.0.0.2.12345: UDP, length 16
13:16:05.766681 IP 10.0.0.9.12345 > 10.0.0.2.12345: UDP, length 16
13:16:05.767263 IP 10.0.0.9.12345 > 10.0.0.2.12345: UDP, length 16
13:16:05.767847 IP 10.0.0.9.12345 > 10.0.0.2.12345: UDP, length 16
13:16:05.768427 IP 10.0.0.9.12345 > 10.0.0.2.12345: UDP, length 16
13:16:05.769013 IP 10.0.0.9.12345 > 10.0.0.2.12345: UDP, length 16
13:16:05.769600 IP 10.0.0.9.12345 > 10.0.0.2.12345: UDP, length 16
13:16:05.770187 IP 10.0.0.9.12345 > 10.0.0.2.12345: UDP, length 16
13:16:05.770770 IP 10.0.0.9.12345 > 10.0.0.2.12345: UDP, length 16
13:16:05.771364 IP 10.0.0.9.12345 > 10.0.0.2.12345: UDP, length 16
13:16:05.771979 IP 10.0.0.9.12345 > 10.0.0.2.12345: UDP, length 16
13:16:05.772599 IP 10.0.0.9.12345 > 10.0.0.2.12345: UDP, length 16
13:16:05.773218 IP 10.0.0.9.12345 > 10.0.0.2.12345: UDP, length 16
13:16:05.773837 IP 10.0.0.9.12345 > 10.0.0.2.12345: UDP, length 16
13:16:05.774455 IP 10.0.0.9.12345 > 10.0.0.2.12345: UDP, length 16
13:16:05.775074 IP 10.0.0.9.12345 > 10.0.0.2.12345: UDP, length 16
13:16:05.775738 IP 10.0.0.9.12345 > 10.0.0.2.12345: UDP, length 16
13:16:05.776335 IP 10.0.0.9.12345 > 10.0.0.2.12345: UDP, length 16
13:16:05.776920 IP 10.0.0.9.12345 > 10.0.0.2.12345: UDP, length 16
13:16:05.777545 IP 10.0.0.9.12345 > 10.0.0.2.12345: UDP, length 16
13:16:05.778142 IP 10.0.0.9.12345 > 10.0.0.2.12345: UDP, length 16
13:16:05.778736 IP 10.0.0.9.12345 > 10.0.0.2.12345: UDP, length 16
13:16:05.779336 IP 10.0.0.9.12345 > 10.0.0.2.12345: UDP, length 16
13:16:05.779919 IP 10.0.0.9.12345 > 10.0.0.2.12345: UDP, length 16
13:16:05.780536 IP 10.0.0.9.12345 > 10.0.0.2.12345: UDP, length 16
13:16:05.781133 IP 10.0.0.9.12345 > 10.0.0.2.12345: UDP, length 16
13:16:05.781751 IP 10.0.0.9.12345 > 10.0.0.2.12345: UDP, length 16
13:16:05.782374 IP 10.0.0.9.12345 > 10.0.0.2.12345: UDP, length 16
13:16:05.783003 IP 10.0.0.9.12345 > 10.0.0.2.12345: UDP, length 16
13:16:05.783621 IP 10.0.0.9.12345 > 10.0.0.2.12345: UDP, length 16
13:16:05.784219 IP 10.0.0.9.12345 > 10.0.0.2.12345: UDP, length 16
13:16:05.784827 IP 10.0.0.9.12345 > 10.0.0.2.12345: UDP, length 16
13:16:05.785437 IP 10.0.0.9.12345 > 10.0.0.2.12345: UDP, length 16
13:16:05.786043 IP 10.0.0.9.12345 > 10.0.0.2.12345: UDP, length 16
13:16:05.786653 IP 10.0.0.9.12345 > 10.0.0.2.12345: UDP, length 16
13:16:05.787246 IP 10.0.0.9.12345 > 10.0.0.2.12345: UDP, length 16
13:16:05.787829 IP 10.0.0.9.12345 > 10.0.0.2.12345: UDP, length 16
13:16:05.788426 IP 10.0.0.9.12345 > 10.0.0.2.12345: UDP, length 16
13:16:05.789015 IP 10.0.0.9.12345 > 10.0.0.2.12345: UDP, length 16
13:16:05.789604 IP 10.0.0.9.12345 > 10.0.0.2.12345: UDP, length 16
13:16:05.790192 IP 10.0.0.9.12345 > 10.0.0.2.12345: UDP, length 16
13:16:05.790823 IP 10.0.0.9.12345 > 10.0.0.2.12345: UDP, length 16
13:16:05.791457 IP 10.0.0.9.12345 > 10.0.0.2.12345: UDP, length 16
13:16:05.792054 IP 10.0.0.9.12345 > 10.0.0.2.12345: UDP, length 16
13:16:05.792681 IP 10.0.0.9.12345 > 10.0.0.2.12345: UDP, length 16
13:16:05.793310 IP 10.0.0.9.12345 > 10.0.0.2.12345: UDP, length 16
13:16:05.793940 IP 10.0.0.9.12345 > 10.0.0.2.12345: UDP, length 16
13:16:05.794568 IP 10.0.0.9.12345 > 10.0.0.2.12345: UDP, length 16
13:16:05.795167 IP 10.0.0.9.12345 > 10.0.0.2.12345: UDP, length 16
13:16:05.795758 IP 10.0.0.9.12345 > 10.0.0.2.12345: UDP, length 16
13:16:05.796387 IP 10.0.0.9.12345 > 10.0.0.2.12345: UDP, length 16
13:16:05.797020 IP 10.0.0.9.12345 > 10.0.0.2.12345: UDP, length 16
13:16:05.797636 IP 10.0.0.9.12345 > 10.0.0.2.12345: UDP, length 16
13:16:05.798238 IP 10.0.0.9.12345 > 10.0.0.2.12345: UDP, length 16
13:16:05.798845 IP 10.0.0.9.12345 > 10.0.0.2.12345: UDP, length 16
13:16:05.799449 IP 10.0.0.9.12345 > 10.0.0.2.12345: UDP, length 16
13:16:05.800054 IP 10.0.0.9.12345 > 10.0.0.2.12345: UDP, length 16
13:16:05.800670 IP 10.0.0.9.12345 > 10.0.0.2.12345: UDP, length 16
13:16:05.801304 IP 10.0.0.9.12345 > 10.0.0.2.12345: UDP, length 16
13:16:05.801934 IP 10.0.0.9.12345 > 10.0.0.2.12345: UDP, length 16
13:16:05.802540 IP 10.0.0.9.12345 > 10.0.0.2.12345: UDP, length 16
13:16:05.803143 IP 10.0.0.9.12345 > 10.0.0.2.12345: UDP, length 16
13:16:05.803742 IP 10.0.0.9.12345 > 10.0.0.2.12345: UDP, length 16
13:16:05.804370 IP 10.0.0.9.12345 > 10.0.0.2.12345: UDP, length 16
13:16:05.804998 IP 10.0.0.9.12345 > 10.0.0.2.12345: UDP, length 16
13:16:05.805679 IP 10.0.0.9.12345 > 10.0.0.2.12345: UDP, length 16
13:16:05.806308 IP 10.0.0.9.12345 > 10.0.0.2.12345: UDP, length 16
13:16:05.806937 IP 10.0.0.9.12345 > 10.0.0.2.12345: UDP, length 16
13:16:05.807566 IP 10.0.0.9.12345 > 10.0.0.2.12345: UDP, length 16
13:16:05.808196 IP 10.0.0.9.12345 > 10.0.0.2.12345: UDP, length 16
13:16:05.808812 IP 10.0.0.9.12345 > 10.0.0.2.12345: UDP, length 16
13:16:05.809445 IP 10.0.0.9.12345 > 10.0.0.2.12345: UDP, length 16
13:16:05.810074 IP 10.0.0.9.12345 > 10.0.0.2.12345: UDP, length 16
13:16:05.810696 IP 10.0.0.9.12345 > 10.0.0.2.12345: UDP, length 16
13:16:05.811293 IP 10.0.0.9.12345 > 10.0.0.2.12345: UDP, length 16
13:16:05.811903 IP 10.0.0.9.12345 > 10.0.0.2.12345: UDP, length 16
13:16:05.812546 IP 10.0.0.9.12345 > 10.0.0.2.12345: UDP, length 16
13:16:05.813180 IP 10.0.0.9.12345 > 10.0.0.2.12345: UDP, length 16
13:16:05.813813 IP 10.0.0.9.12345 > 10.0.0.2.12345: UDP, length 16
13:16:05.814437 IP 10.0.0.9.12345 > 10.0.0.2.12345: UDP, length 16
13:16:05.815074 IP 10.0.0.9.12345 > 10.0.0.2.12345: UDP, length 16
13:16:05.815721 IP 10.0.0.9.12345 > 10.0.0.2.12345: UDP, length 16
13:16:05.816351 IP 10.0.0.9.12345 > 10.0.0.2.12345: UDP, length 16
13:16:05.816982 IP 10.0.0.9.12345 > 10.0.0.2.12345: UDP, length 16
13:16:05.817614 IP 10.0.0.9.12345 > 10.0.0.2.12345: UDP, length 16
13:16:05.818246 IP 10.0.0.9.12345 > 10.0.0.2.12345: UDP, length 16
13:16:05.818862 IP 10.0.0.9.12345 > 10.0.0.2.12345: UDP, length 16
13:16:05.819455 IP 10.0.0.9.12345 > 10.0.0.2.12345: UDP, length 16
13:16:05.820072 IP 10.0.0.9.12345 > 10.0.0.2.12345: UDP, length 16
13:16:05.820684 IP 10.0.0.9.12345 > 10.0.0.2.12345: UDP, length 16
13:16:05.821298 IP 10.0.0.9.12345 > 10.0.0.2.12345: UDP, length 16
13:16:05.821910 IP 10.0.0.9.12345 > 10.0.0.2.12345: UDP, length 16
13:16:05.822520 IP 10.0.0.9.12345 > 10.0.0.2.12345: UDP, length 16
13:16:05.823131 IP 10.0.0.9.12345 > 10.0.0.2.12345: UDP, length 16
13:16:05.823748 IP 10.0.0.9.12345 > 10.0.0.2.12345: UDP, length 16
13:16:05.824364 IP 10.0.0.9.12345 > 10.0.0.2.12345: UDP, length 16
13:16:05.824974 IP 10.0.0.9.12345 > 10.0.0.2.12345: UDP, length 16
13:16:05.825607 IP 10.0.0.9.12345 > 10.0.0.2.12345: UDP, length 16
13:16:05.826221 IP 10.0.0.9.12345 > 10.0.0.2.12345: UDP, length 16
13:16:05.826811 IP 10.0.0.9.12345 > 10.0.0.2.12345: UDP, length 16
13:16:05.827397 IP 10.0.0.9.12345 > 10.0.0.2.12345: UDP, length 16
13:16:05.827975 IP 10.0.0.9.12345 > 10.0.0.2.12345: UDP, length 16
13:16:05.828542 IP 10.0.0.9.12345 > 10.0.0.2.12345: UDP, length 16
13:16:05.829124 IP 10.0.0.9.12345 > 10.0.0.2.12345: UDP, length 16
13:16:05.829729 IP 10.0.0.9.12345 > 10.0.0.2.12345: UDP, length 16
13:16:05.830357 IP 10.0.0.9.12345 > 10.0.0.2.12345: UDP, length 16
13:16:05.830983 IP 10.0.0.9.12345 > 10.0.0.2.12345: UDP, length 16
13:16:05.831583 IP 10.0.0.9.12345 > 10.0.0.2.12345: UDP, length 16
13:16:05.832204 IP 10.0.0.9.12345 > 10.0.0.2.12345: UDP, length 16
13:16:05.832825 IP 10.0.0.9.12345 > 10.0.0.2.12345: UDP, length 16
13:16:05.833447 IP 10.0.0.9.12345 > 10.0.0.2.12345: UDP, length 16
13:16:05.834069 IP 10.0.0.9.12345 > 10.0.0.2.12345: UDP, length 16
13:16:05.834700 IP 10.0.0.9.12345 > 10.0.0.2.12345: UDP, length 16
13:16:05.835297 IP 10.0.0.9.12345 > 10.0.0.2.12345: UDP, length 16
13:16:05.835906 IP 10.0.0.9.12345 > 10.0.0.2.12345: UDP, length 16
13:16:05.836532 IP 10.0.0.9.12345 > 10.0.0.2.12345: UDP, length 16
13:16:05.837151 IP 10.0.0.9.12345 > 10.0.0.2.12345: UDP, length 16
13:16:05.837771 IP 10.0.0.9.12345 > 10.0.0.2.12345: UDP, length 16
13:16:05.838390 IP 10.0.0.9.12345 > 10.0.0.2.12345: UDP, length 16
13:16:05.839010 IP 10.0.0.9.12345 > 10.0.0.2.12345: UDP, length 16
13:16:05.839628 IP 10.0.0.9.12345 > 10.0.0.2.12345: UDP, length 16
13:16:05.840248 IP 10.0.0.9.12345 > 10.0.0.2.12345: UDP, length 16
13:16:05.840868 IP 10.0.0.9.12345 > 10.0.0.2.12345: UDP, length 16
13:16:05.841489 IP 10.0.0.9.12345 > 10.0.0.2.12345: UDP, length 16
13:16:05.842110 IP 10.0.0.9.12345 > 10.0.0.2.12345: UDP, length 16
13:16:05.842718 IP 10.0.0.9.12345 > 10.0.0.2.12345: UDP, length 16
13:16:05.843326 IP 10.0.0.9.12345 > 10.0.0.2.12345: UDP, length 16
13:16:05.843935 IP 10.0.0.9.12345 > 10.0.0.2.12345: UDP, length 16
13:16:05.844543 IP 10.0.0.9.12345 > 10.0.0.2.12345: UDP, length 16
13:16:05.845152 IP 10.0.0.9.12345 > 10.0.0.2.12345: UDP, length 16
13:16:05.845761 IP 10.0.0.9.12345 > 10.0.0.2.12345: UDP, length 16
13:16:05.846363 IP 10.0.0.9.12345 > 10.0.0.2.12345: UDP, length 16
13:16:05.846964 IP 10.0.0.9.12345 > 10.0.0.2.12345: UDP, length 16
13:16:05.847566 IP 10.0.0.9.12345 > 10.0.0.2.12345: UDP, length 16
13:16:05.848158 IP 10.0.0.9.12345 > 10.0.0.2.12345: UDP, length 16
13:16:05.848746 IP 10.0.0.9.12345 > 10.0.0.2.12345: UDP, length 16
13:16:05.849351 IP 10.0.0.9.12345 > 10.0.0.2.12345: UDP, length 16
13:16:05.849977 IP 10.0.0.9.12345 > 10.0.0.2.12345: UDP, length 16
13:16:05.850573 IP 10.0.0.9.12345 > 10.0.0.2.12345: UDP, length 16
13:16:05.851169 IP 10.0.0.9.12345 > 10.0.0.2.12345: UDP, length 16
13:16:05.851766 IP 10.0.0.9.12345 > 10.0.0.2.12345: UDP, length 16
13:16:05.852366 IP 10.0.0.9.12345 > 10.0.0.2.12345: UDP, length 16
13:16:05.852991 IP 10.0.0.9.12345 > 10.0.0.2.12345: UDP, length 16
13:16:05.853615 IP 10.0.0.9.12345 > 10.0.0.2.12345: UDP, length 16
13:16:05.854250 IP 10.0.0.9.12345 > 10.0.0.2.12345: UDP, length 16
13:16:05.854892 IP 10.0.0.9.12345 > 10.0.0.2.12345: UDP, length 16
13:16:05.855534 IP 10.0.0.9.12345 > 10.0.0.2.12345: UDP, length 16
13:16:05.856176 IP 10.0.0.9.12345 > 10.0.0.2.12345: UDP, length 16
13:16:05.856826 IP 10.0.0.9.12345 > 10.0.0.2.12345: UDP, length 16
13:16:05.857467 IP 10.0.0.9.12345 > 10.0.0.2.12345: UDP, length 16
13:16:05.858114 IP 10.0.0.9.12345 > 10.0.0.2.12345: UDP, length 16
13:16:05.858734 IP 10.0.0.9.12345 > 10.0.0.2.12345: UDP, length 16
13:16:05.859353 IP 10.0.0.9.12345 > 10.0.0.2.12345: UDP, length 16
13:16:05.859958 IP 10.0.0.9.12345 > 10.0.0.2.12345: UDP, length 16
13:16:05.860550 IP 10.0.0.9.12345 > 10.0.0.2.12345: UDP, length 16
