12:53:29.105601 IP6 asus.mdns > ff02::fb.mdns: 0 [9q] PTR (QM)? _ipps._tcp.local. PTR (QM)? _ftp._tcp.local. PTR (QM)? _webdav._tcp.local. PTR (QM)? _webdavs._tcp.local. PTR (QM)? _sftp-ssh._tcp.local. PTR (QM)? _smb._tcp.local. PTR (QM)? _afpovertcp._tcp.local. PTR (QM)? _nfs._tcp.local. PTR (QM)? _ipp._tcp.local. (141)
12:55:25.221127 IP 10.0.0.1.12345 > 10.0.0.2.12345: UDP, length 16
12:55:25.221639 IP 10.0.0.1.12345 > 10.0.0.2.12345: UDP, length 16
12:55:25.222210 IP 10.0.0.1.12345 > 10.0.0.2.12345: UDP, length 16
12:55:25.222783 IP 10.0.0.1.12345 > 10.0.0.2.12345: UDP, length 16
12:55:25.223356 IP 10.0.0.1.12345 > 10.0.0.2.12345: UDP, length 16
12:55:25.223924 IP 10.0.0.1.12345 > 10.0.0.2.12345: UDP, length 16
12:55:25.224501 IP 10.0.0.1.12345 > 10.0.0.2.12345: UDP, length 16
12:55:25.225075 IP 10.0.0.1.12345 > 10.0.0.2.12345: UDP, length 16
12:55:25.225648 IP 10.0.0.1.12345 > 10.0.0.2.12345: UDP, length 16
12:55:25.226217 IP 10.0.0.1.12345 > 10.0.0.2.12345: UDP, length 16
12:55:25.226794 IP 10.0.0.1.12345 > 10.0.0.2.12345: UDP, length 16
12:55:25.227380 IP 10.0.0.1.12345 > 10.0.0.2.12345: UDP, length 16
12:55:25.227958 IP 10.0.0.1.12345 > 10.0.0.2.12345: UDP, length 16
12:55:25.228553 IP 10.0.0.1.12345 > 10.0.0.2.12345: UDP, length 16
12:55:25.229140 IP 10.0.0.1.12345 > 10.0.0.2.12345: UDP, length 16
12:55:25.229708 IP 10.0.0.1.12345 > 10.0.0.2.12345: UDP, length 16
12:55:25.230279 IP 10.0.0.1.12345 > 10.0.0.2.12345: UDP, length 16
12:55:25.230852 IP 10.0.0.1.12345 > 10.0.0.2.12345: UDP, length 16
12:55:25.231424 IP 10.0.0.1.12345 > 10.0.0.2.12345: UDP, length 16
12:55:25.231997 IP 10.0.0.1.12345 > 10.0.0.2.12345: UDP, length 16
12:55:25.232569 IP 10.0.0.1.12345 > 10.0.0.2.12345: UDP, length 16
12:55:25.233141 IP 10.0.0.1.12345 > 10.0.0.2.12345: UDP, length 16
12:55:25.233712 IP 10.0.0.1.12345 > 10.0.0.2.12345: UDP, length 16
12:55:25.234287 IP 10.0.0.1.12345 > 10.0.0.2.12345: UDP, length 16
12:55:25.234874 IP 10.0.0.1.12345 > 10.0.0.2.12345: UDP, length 16
12:55:25.235460 IP 10.0.0.1.12345 > 10.0.0.2.12345: UDP, length 16
12:55:25.236026 IP 10.0.0.1.12345 > 10.0.0.2.12345: UDP, length 16
12:55:25.236611 IP 10.0.0.1.12345 > 10.0.0.2.12345: UDP, length 16
12:55:25.237194 IP 10.0.0.1.12345 > 10.0.0.2.12345: UDP, length 16
12:55:25.237778 IP 10.0.0.1.12345 > 10.0.0.2.12345: UDP, length 16
12:55:25.238356 IP 10.0.0.1.12345 > 10.0.0.2.12345: UDP, length 16
12:55:25.238930 IP 10.0.0.1.12345 > 10.0.0.2.12345: UDP, length 16
12:55:25.239501 IP 10.0.0.1.12345 > 10.0.0.2.12345: UDP, length 16
12:55:25.240073 IP 10.0.0.1.12345 > 10.0.0.2.12345: UDP, length 16
12:55:25.240655 IP 10.0.0.1.12345 > 10.0.0.2.12345: UDP, length 16
12:55:25.241238 IP 10.0.0.1.12345 > 10.0.0.2.12345: UDP, length 16
12:55:25.241820 IP 10.0.0.1.12345 > 10.0.0.2.12345: UDP, length 16
12:55:25.242404 IP 10.0.0.1.12345 > 10.0.0.2.12345: UDP, length 16
12:55:25.242983 IP 10.0.0.1.12345 > 10.0.0.2.12345: UDP, length 16
12:55:25.243587 IP 10.0.0.1.12345 > 10.0.0.2.12345: UDP, length 16
12:55:25.244221 IP 10.0.0.1.12345 > 10.0.0.2.12345: UDP, length 16
12:55:25.244813 IP 10.0.0.1.12345 > 10.0.0.2.12345: UDP, length 16
12:55:25.245394 IP 10.0.0.1.12345 > 10.0.0.2.12345: UDP, length 16
12:55:25.245974 IP 10.0.0.1.12345 > 10.0.0.2.12345: UDP, length 16
12:55:25.246553 IP 10.0.0.1.12345 > 10.0.0.2.12345: UDP, length 16
12:55:25.247130 IP 10.0.0.1.12345 > 10.0.0.2.12345: UDP, length 16
12:55:25.247734 IP 10.0.0.1.12345 > 10.0.0.2.12345: UDP, length 16
12:55:25.248331 IP 10.0.0.1.12345 > 10.0.0.2.12345: UDP, length 16
12:55:25.248907 IP 10.0.0.1.12345 > 10.0.0.2.12345: UDP, length 16
12:55:25.249479 IP 10.0.0.1.12345 > 10.0.0.2.12345: UDP, length 16
12:55:25.250048 IP 10.0.0.1.12345 > 10.0.0.2.12345: UDP, length 16
12:55:25.250619 IP 10.0.0.1.12345 > 10.0.0.2.12345: UDP, length 16
12:55:25.251188 IP 10.0.0.1.12345 > 10.0.0.2.12345: UDP, length 16
12:55:25.251767 IP 10.0.0.1.12345 > 10.0.0.2.12345: UDP, length 16
12:55:25.252337 IP 10.0.0.1.12345 > 10.0.0.2.12345: UDP, length 16
12:55:25.252912 IP 10.0.0.1.12345 > 10.0.0.2.12345: UDP, length 16
12:55:25.253491 IP 10.0.0.1.12345 > 10.0.0.2.12345: UDP, length 16
12:55:25.254066 IP 10.0.0.1.12345 > 10.0.0.2.12345: UDP, length 16
12:55:25.254642 IP 10.0.0.1.12345 > 10.0.0.2.12345: UDP, length 16
12:55:25.255232 IP 10.0.0.1.12345 > 10.0.0.2.12345: UDP, length 16
12:55:25.255818 IP 10.0.0.1.12345 > 10.0.0.2.12345: UDP, length 16
12:55:25.256411 IP 10.0.0.1.12345 > 10.0.0.2.12345: UDP, length 16
12:55:25.257003 IP 10.0.0.1.12345 > 10.0.0.2.12345: UDP, length 16
12:55:25.257592 IP 10.0.0.1.12345 > 10.0.0.2.12345: UDP, length 16
12:55:25.258162 IP 10.0.0.1.12345 > 10.0.0.2.12345: UDP, length 16
12:55:25.258741 IP 10.0.0.1.12345 > 10.0.0.2.12345: UDP, length 16
12:55:25.259313 IP 10.0.0.1.12345 > 10.0.0.2.12345: UDP, length 16
12:55:25.259902 IP 10.0.0.1.12345 > 10.0.0.2.12345: UDP, length 16
12:55:25.260492 IP 10.0.0.1.12345 > 10.0.0.2.12345: UDP, length 16
12:55:25.261083 IP 10.0.0.1.12345 > 10.0.0.2.12345: UDP, length 16
12:55:25.261675 IP 10.0.0.1.12345 > 10.0.0.2.12345: UDP, length 16
12:55:25.262267 IP 10.0.0.1.12345 > 10.0.0.2.12345: UDP, length 16
12:55:25.262849 IP 10.0.0.1.12345 > 10.0.0.2.12345: UDP, length 16
12:55:25.263426 IP 10.0.0.1.12345 > 10.0.0.2.12345: UDP, length 16
12:55:25.264014 IP 10.0.0.1.12345 > 10.0.0.2.12345: UDP, length 16
12:55:25.264602 IP 10.0.0.1.12345 > 10.0.0.2.12345: UDP, length 16
12:55:25.265173 IP 10.0.0.1.12345 > 10.0.0.2.12345: UDP, length 16
12:55:25.265754 IP 10.0.0.1.12345 > 10.0.0.2.12345: UDP, length 16
12:55:25.266319 IP 10.0.0.1.12345 > 10.0.0.2.12345: UDP, length 16
12:55:25.266894 IP 10.0.0.1.12345 > 10.0.0.2.12345: UDP, length 16
12:55:25.267480 IP 10.0.0.1.12345 > 10.0.0.2.12345: UDP, length 16
12:55:25.268054 IP 10.0.0.1.12345 > 10.0.0.2.12345: UDP, length 16
12:55:25.268618 IP 10.0.0.1.12345 > 10.0.0.2.12345: UDP, length 16
12:55:25.269182 IP 10.0.0.1.12345 > 10.0.0.2.12345: UDP, length 16
12:55:25.269754 IP 10.0.0.1.12345 > 10.0.0.2.12345: UDP, length 16
12:55:25.270337 IP 10.0.0.1.12345 > 10.0.0.2.12345: UDP, length 16
12:55:25.270924 IP 10.0.0.1.12345 > 10.0.0.2.12345: UDP, length 16
12:55:25.271508 IP 10.0.0.1.12345 > 10.0.0.2.12345: UDP, length 16
12:55:25.272086 IP 10.0.0.1.12345 > 10.0.0.2.12345: UDP, length 16
12:55:25.272664 IP 10.0.0.1.12345 > 10.0.0.2.12345: UDP, length 16
12:55:25.273271 IP 10.0.0.1.12345 > 10.0.0.2.12345: UDP, length 16
12:55:25.273863 IP 10.0.0.1.12345 > 10.0.0.2.12345: UDP, length 16
12:55:25.274700 IP 10.0.0.1.12345 > 10.0.0.2.12345: UDP, length 16
12:55:25.275286 IP 10.0.0.1.12345 > 10.0.0.2.12345: UDP, length 16
12:55:25.275888 IP 10.0.0.1.12345 > 10.0.0.2.12345: UDP, length 16
12:55:25.276473 IP 10.0.0.1.12345 > 10.0.0.2.12345: UDP, length 16
12:55:25.277051 IP 10.0.0.1.12345 > 10.0.0.2.12345: UDP, length 16
12:55:25.277622 IP 10.0.0.1.12345 > 10.0.0.2.12345: UDP, length 16
12:55:25.278196 IP 10.0.0.1.12345 > 10.0.0.2.12345: UDP, length 16
12:55:25.278784 IP 10.0.0.1.12345 > 10.0.0.2.12345: UDP, length 16
12:55:25.279371 IP 10.0.0.1.12345 > 10.0.0.2.12345: UDP, length 16
12:55:25.279957 IP 10.0.0.1.12345 > 10.0.0.2.12345: UDP, length 16
12:55:25.280536 IP 10.0.0.1.12345 > 10.0.0.2.12345: UDP, length 16
12:55:25.281108 IP 10.0.0.1.12345 > 10.0.0.2.12345: UDP, length 16
12:55:25.281690 IP 10.0.0.1.12345 > 10.0.0.2.12345: UDP, length 16
12:55:25.282268 IP 10.0.0.1.12345 > 10.0.0.2.12345: UDP, length 16
12:55:25.282854 IP 10.0.0.1.12345 > 10.0.0.2.12345: UDP, length 16
12:55:25.283433 IP 10.0.0.1.12345 > 10.0.0.2.12345: UDP, length 16
12:55:25.284009 IP 10.0.0.1.12345 > 10.0.0.2.12345: UDP, length 16
12:55:25.284590 IP 10.0.0.1.12345 > 10.0.0.2.12345: UDP, length 16
12:55:25.285179 IP 10.0.0.1.12345 > 10.0.0.2.12345: UDP, length 16
12:55:25.285759 IP 10.0.0.1.12345 > 10.0.0.2.12345: UDP, length 16
12:55:25.286331 IP 10.0.0.1.12345 > 10.0.0.2.12345: UDP, length 16
12:55:25.286903 IP 10.0.0.1.12345 > 10.0.0.2.12345: UDP, length 16
12:55:25.287468 IP 10.0.0.1.12345 > 10.0.0.2.12345: UDP, length 16
12:55:25.288036 IP 10.0.0.1.12345 > 10.0.0.2.12345: UDP, length 16
12:55:25.288612 IP 10.0.0.1.12345 > 10.0.0.2.12345: UDP, length 16
12:55:25.289189 IP 10.0.0.1.12345 > 10.0.0.2.12345: UDP, length 16
12:55:25.289774 IP 10.0.0.1.12345 > 10.0.0.2.12345: UDP, length 16
12:55:25.290348 IP 10.0.0.1.12345 > 10.0.0.2.12345: UDP, length 16
12:55:25.290920 IP 10.0.0.1.12345 > 10.0.0.2.12345: UDP, length 16
12:55:25.291482 IP 10.0.0.1.12345 > 10.0.0.2.12345: UDP, length 16
12:55:25.292057 IP 10.0.0.1.12345 > 10.0.0.2.12345: UDP, length 16
12:55:25.292648 IP 10.0.0.1.12345 > 10.0.0.2.12345: UDP, length 16
12:55:25.293246 IP 10.0.0.1.12345 > 10.0.0.2.12345: UDP, length 16
12:55:25.293824 IP 10.0.0.1.12345 > 10.0.0.2.12345: UDP, length 16
12:55:25.294395 IP 10.0.0.1.12345 > 10.0.0.2.12345: UDP, length 16
12:55:25.294973 IP 10.0.0.1.12345 > 10.0.0.2.12345: UDP, length 16
12:55:25.295548 IP 10.0.0.1.12345 > 10.0.0.2.12345: UDP, length 16
12:55:25.296122 IP 10.0.0.1.12345 > 10.0.0.2.12345: UDP, length 16
12:55:25.296686 IP 10.0.0.1.12345 > 10.0.0.2.12345: UDP, length 16
12:55:25.297265 IP 10.0.0.1.12345 > 10.0.0.2.12345: UDP, length 16
12:55:25.297835 IP 10.0.0.1.12345 > 10.0.0.2.12345: UDP, length 16
12:55:25.298427 IP 10.0.0.1.12345 > 10.0.0.2.12345: UDP, length 16
12:55:25.299007 IP 10.0.0.1.12345 > 10.0.0.2.12345: UDP, length 16
12:55:25.299593 IP 10.0.0.1.12345 > 10.0.0.2.12345: UDP, length 16
12:55:25.300186 IP 10.0.0.1.12345 > 10.0.0.2.12345: UDP, length 16
12:55:25.300781 IP 10.0.0.1.12345 > 10.0.0.2.12345: UDP, length 16
12:55:25.301354 IP 10.0.0.1.12345 > 10.0.0.2.12345: UDP, length 16
12:55:25.301939 IP 10.0.0.1.12345 > 10.0.0.2.12345: UDP, length 16
12:55:25.302518 IP 10.0.0.1.12345 > 10.0.0.2.12345: UDP, length 16
12:55:25.303098 IP 10.0.0.1.12345 > 10.0.0.2.12345: UDP, length 16
12:55:25.303737 IP 10.0.0.1.12345 > 10.0.0.2.12345: UDP, length 16
12:55:25.304306 IP 10.0.0.1.12345 > 10.0.0.2.12345: UDP, length 16
12:55:25.304872 IP 10.0.0.1.12345 > 10.0.0.2.12345: UDP, length 16
12:55:25.305438 IP 10.0.0.1.12345 > 10.0.0.2.12345: UDP, length 16
12:55:25.306032 IP 10.0.0.1.12345 > 10.0.0.2.12345: UDP, length 16
12:55:25.306605 IP 10.0.0.1.12345 > 10.0.0.2.12345: UDP, length 16
12:55:25.307190 IP 10.0.0.1.12345 > 10.0.0.2.12345: UDP, length 16
12:55:25.307761 IP 10.0.0.1.12345 > 10.0.0.2.12345: UDP, length 16
12:55:25.308355 IP 10.0.0.1.12345 > 10.0.0.2.12345: UDP, length 16
12:55:25.308942 IP 10.0.0.1.12345 > 10.0.0.2.12345: UDP, length 16
12:55:25.309505 IP 10.0.0.1.12345 > 10.0.0.2.12345: UDP, length 16
12:55:25.310091 IP 10.0.0.1.12345 > 10.0.0.2.12345: UDP, length 16
12:55:25.310693 IP 10.0.0.1.12345 > 10.0.0.2.12345: UDP, length 16
12:55:25.311269 IP 10.0.0.1.12345 > 10.0.0.2.12345: UDP, length 16
12:55:25.311875 IP 10.0.0.1.12345 > 10.0.0.2.12345: UDP, length 16
12:55:25.312460 IP 10.0.0.1.12345 > 10.0.0.2.12345: UDP, length 16
12:55:25.313038 IP 10.0.0.1.12345 > 10.0.0.2.12345: UDP, length 16
12:55:25.313621 IP 10.0.0.1.12345 > 10.0.0.2.12345: UDP, length 16
12:55:25.314209 IP 10.0.0.1.12345 > 10.0.0.2.12345: UDP, length 16
12:55:25.314803 IP 10.0.0.1.12345 > 10.0.0.2.12345: UDP, length 16
12:55:25.315392 IP 10.0.0.1.12345 > 10.0.0.2.12345: UDP, length 16
12:55:25.315986 IP 10.0.0.1.12345 > 10.0.0.2.12345: UDP, length 16
12:55:25.316578 IP 10.0.0.1.12345 > 10.0.0.2.12345: UDP, length 16
12:55:25.317167 IP 10.0.0.1.12345 > 10.0.0.2.12345: UDP, length 16
12:55:25.317759 IP 10.0.0.1.12345 > 10.0.0.2.12345: UDP, length 16
12:55:25.318347 IP 10.0.0.1.12345 > 10.0.0.2.12345: UDP, length 16
12:55:25.318934 IP 10.0.0.1.12345 > 10.0.0.2.12345: UDP, length 16
12:55:25.319521 IP 10.0.0.1.12345 > 10.0.0.2.12345: UDP, length 16
12:55:25.320109 IP 10.0.0.1.12345 > 10.0.0.2.12345: UDP, length 16
12:55:25.320716 IP 10.0.0.1.12345 > 10.0.0.2.12345: UDP, length 16
12:55:25.321324 IP 10.0.0.1.12345 > 10.0.0.2.12345: UDP, length 16
12:55:25.321931 IP 10.0.0.1.12345 > 10.0.0.2.12345: UDP, length 16
12:55:25.322507 IP 10.0.0.1.12345 > 10.0.0.2.12345: UDP, length 16
12:55:25.323089 IP 10.0.0.1.12345 > 10.0.0.2.12345: UDP, length 16
12:55:25.323671 IP 10.0.0.1.12345 > 10.0.0.2.12345: UDP, length 16
12:55:25.324289 IP 10.0.0.1.12345 > 10.0.0.2.12345: UDP, length 16
12:55:25.324878 IP 10.0.0.1.12345 > 10.0.0.2.12345: UDP, length 16
12:55:25.325485 IP 10.0.0.1.12345 > 10.0.0.2.12345: UDP, length 16
12:55:25.326093 IP 10.0.0.1.12345 > 10.0.0.2.12345: UDP, length 16
12:55:25.326703 IP 10.0.0.1.12345 > 10.0.0.2.12345: UDP, length 16
12:55:25.327310 IP 10.0.0.1.12345 > 10.0.0.2.12345: UDP, length 16
12:55:25.327888 IP 10.0.0.1.12345 > 10.0.0.2.12345: UDP, length 16
12:55:25.328481 IP 10.0.0.1.12345 > 10.0.0.2.12345: UDP, length 16
12:55:25.329057 IP 10.0.0.1.12345 > 10.0.0.2.12345: UDP, length 16
12:55:25.329642 IP 10.0.0.1.12345 > 10.0.0.2.12345: UDP, length 16
12:55:25.330244 IP 10.0.0.1.12345 > 10.0.0.2.12345: UDP, length 16
12:55:25.330848 IP 10.0.0.1.12345 > 10.0.0.2.12345: UDP, length 16
12:55:25.331433 IP 10.0.0.1.12345 > 10.0.0.2.12345: UDP, length 16
12:55:25.332020 IP 10.0.0.1.12345 > 10.0.0.2.12345: UDP, length 16
12:55:25.332607 IP 10.0.0.1.12345 > 10.0.0.2.12345: UDP, length 16
12:55:25.333214 IP 10.0.0.1.12345 > 10.0.0.2.12345: UDP, length 16
12:55:25.333814 IP 10.0.0.1.12345 > 10.0.0.2.12345: UDP, length 16
12:55:25.334405 IP 10.0.0.1.12345 > 10.0.0.2.12345: UDP, length 16
12:55:25.334998 IP 10.0.0.1.12345 > 10.0.0.2.12345: UDP, length 16
12:55:25.335611 IP 10.0.0.1.12345 > 10.0.0.2.12345: UDP, length 16
12:55:25.336227 IP 10.0.0.1.12345 > 10.0.0.2.12345: UDP, length 16
12:55:25.336840 IP 10.0.0.1.12345 > 10.0.0.2.12345: UDP, length 16
12:55:25.337457 IP 10.0.0.1.12345 > 10.0.0.2.12345: UDP, length 16
12:55:25.338074 IP 10.0.0.1.12345 > 10.0.0.2.12345: UDP, length 16
12:55:25.338680 IP 10.0.0.1.12345 > 10.0.0.2.12345: UDP, length 16
12:55:25.339285 IP 10.0.0.1.12345 > 10.0.0.2.12345: UDP, length 16
12:55:25.339898 IP 10.0.0.1.12345 > 10.0.0.2.12345: UDP, length 16
12:55:25.340511 IP 10.0.0.1.12345 > 10.0.0.2.12345: UDP, length 16
12:55:25.341122 IP 10.0.0.1.12345 > 10.0.0.2.12345: UDP, length 16
12:55:25.341736 IP 10.0.0.1.12345 > 10.0.0.2.12345: UDP, length 16
12:55:25.342349 IP 10.0.0.1.12345 > 10.0.0.2.12345: UDP, length 16
12:55:25.342961 IP 10.0.0.1.12345 > 10.0.0.2.12345: UDP, length 16
12:55:25.343574 IP 10.0.0.1.12345 > 10.0.0.2.12345: UDP, length 16
12:55:25.344187 IP 10.0.0.1.12345 > 10.0.0.2.12345: UDP, length 16
12:55:25.344805 IP 10.0.0.1.12345 > 10.0.0.2.12345: UDP, length 16
12:55:25.345439 IP 10.0.0.1.12345 > 10.0.0.2.12345: UDP, length 16
12:55:25.346044 IP 10.0.0.1.12345 > 10.0.0.2.12345: UDP, length 16
12:55:25.346650 IP 10.0.0.1.12345 > 10.0.0.2.12345: UDP, length 16
12:55:25.347254 IP 10.0.0.1.12345 > 10.0.0.2.12345: UDP, length 16
12:55:25.347860 IP 10.0.0.1.12345 > 10.0.0.2.12345: UDP, length 16
12:55:25.348461 IP 10.0.0.1.12345 > 10.0.0.2.12345: UDP, length 16
12:55:25.349050 IP 10.0.0.1.12345 > 10.0.0.2.12345: UDP, length 16
12:55:25.349636 IP 10.0.0.1.12345 > 10.0.0.2.12345: UDP, length 16
12:55:25.350225 IP 10.0.0.1.12345 > 10.0.0.2.12345: UDP, length 16
12:55:25.350824 IP 10.0.0.1.12345 > 10.0.0.2.12345: UDP, length 16
12:55:25.351417 IP 10.0.0.1.12345 > 10.0.0.2.12345: UDP, length 16
12:55:25.352014 IP 10.0.0.1.12345 > 10.0.0.2.12345: UDP, length 16
12:55:25.352606 IP 10.0.0.1.12345 > 10.0.0.2.12345: UDP, length 16
12:55:25.353222 IP 10.0.0.1.12345 > 10.0.0.2.12345: UDP, length 16
12:55:25.353839 IP 10.0.0.1.12345 > 10.0.0.2.12345: UDP, length 16
12:55:25.354432 IP 10.0.0.1.12345 > 10.0.0.2.12345: UDP, length 16
12:55:25.355039 IP 10.0.0.1.12345 > 10.0.0.2.12345: UDP, length 16
12:55:25.355623 IP 10.0.0.1.12345 > 10.0.0.2.12345: UDP, length 16
12:55:25.356239 IP 10.0.0.1.12345 > 10.0.0.2.12345: UDP, length 16
12:55:25.356855 IP 10.0.0.1.12345 > 10.0.0.2.12345: UDP, length 16
12:55:25.357471 IP 10.0.0.1.12345 > 10.0.0.2.12345: UDP, length 16
12:55:25.358086 IP 10.0.0.1.12345 > 10.0.0.2.12345: UDP, length 16
12:55:25.358700 IP 10.0.0.1.12345 > 10.0.0.2.12345: UDP, length 16
12:55:25.359315 IP 10.0.0.1.12345 > 10.0.0.2.12345: UDP, length 16
12:55:25.359929 IP 10.0.0.1.12345 > 10.0.0.2.12345: UDP, length 16
12:55:25.360524 IP 10.0.0.1.12345 > 10.0.0.2.12345: UDP, length 16
12:55:25.361128 IP 10.0.0.1.12345 > 10.0.0.2.12345: UDP, length 16
12:55:25.361745 IP 10.0.0.1.12345 > 10.0.0.2.12345: UDP, length 16
12:55:25.362336 IP 10.0.0.1.12345 > 10.0.0.2.12345: UDP, length 16
12:55:25.362931 IP 10.0.0.1.12345 > 10.0.0.2.12345: UDP, length 16
12:55:25.363534 IP 10.0.0.1.12345 > 10.0.0.2.12345: UDP, length 16
12:55:25.364144 IP 10.0.0.1.12345 > 10.0.0.2.12345: UDP, length 16
12:55:25.364727 IP 10.0.0.1.12345 > 10.0.0.2.12345: UDP, length 16
12:55:25.365358 IP 10.0.0.1.12345 > 10.0.0.2.12345: UDP, length 16
12:55:25.365987 IP 10.0.0.1.12345 > 10.0.0.2.12345: UDP, length 16
12:55:25.366584 IP 10.0.0.1.12345 > 10.0.0.2.12345: UDP, length 16
12:55:25.367171 IP 10.0.0.1.12345 > 10.0.0.2.12345: UDP, length 16
12:55:25.367761 IP 10.0.0.1.12345 > 10.0.0.2.12345: UDP, length 16
12:55:25.368366 IP 10.0.0.1.12345 > 10.0.0.2.12345: UDP, length 16
12:55:25.368968 IP 10.0.0.1.12345 > 10.0.0.2.12345: UDP, length 16
12:55:25.369569 IP 10.0.0.1.12345 > 10.0.0.2.12345: UDP, length 16
12:55:25.370151 IP 10.0.0.1.12345 > 10.0.0.2.12345: UDP, length 16
12:55:25.370769 IP 10.0.0.1.12345 > 10.0.0.2.12345: UDP, length 16
12:55:25.371386 IP 10.0.0.1.12345 > 10.0.0.2.12345: UDP, length 16
12:55:25.372003 IP 10.0.0.1.12345 > 10.0.0.2.12345: UDP, length 16
12:55:25.372619 IP 10.0.0.1.12345 > 10.0.0.2.12345: UDP, length 16
12:55:25.373234 IP 10.0.0.1.12345 > 10.0.0.2.12345: UDP, length 16
12:55:25.373850 IP 10.0.0.1.12345 > 10.0.0.2.12345: UDP, length 16
12:55:25.374464 IP 10.0.0.1.12345 > 10.0.0.2.12345: UDP, length 16
12:55:25.375080 IP 10.0.0.1.12345 > 10.0.0.2.12345: UDP, length 16
12:55:25.375732 IP 10.0.0.1.12345 > 10.0.0.2.12345: UDP, length 16
12:55:25.376350 IP 10.0.0.1.12345 > 10.0.0.2.12345: UDP, length 16
12:55:25.376966 IP 10.0.0.1.12345 > 10.0.0.2.12345: UDP, length 16
12:55:25.377596 IP 10.0.0.1.12345 > 10.0.0.2.12345: UDP, length 16
12:55:25.378198 IP 10.0.0.1.12345 > 10.0.0.2.12345: UDP, length 16
12:55:25.378819 IP 10.0.0.1.12345 > 10.0.0.2.12345: UDP, length 16
12:55:25.379441 IP 10.0.0.1.12345 > 10.0.0.2.12345: UDP, length 16
12:55:25.380063 IP 10.0.0.1.12345 > 10.0.0.2.12345: UDP, length 16
12:55:25.380685 IP 10.0.0.1.12345 > 10.0.0.2.12345: UDP, length 16
12:55:25.381297 IP 10.0.0.1.12345 > 10.0.0.2.12345: UDP, length 16
12:55:25.381909 IP 10.0.0.1.12345 > 10.0.0.2.12345: UDP, length 16
12:55:25.382516 IP 10.0.0.1.12345 > 10.0.0.2.12345: UDP, length 16
12:55:25.383112 IP 10.0.0.1.12345 > 10.0.0.2.12345: UDP, length 16
12:55:25.383736 IP 10.0.0.1.12345 > 10.0.0.2.12345: UDP, length 16
12:55:25.384357 IP 10.0.0.1.12345 > 10.0.0.2.12345: UDP, length 16
12:55:25.384949 IP 10.0.0.1.12345 > 10.0.0.2.12345: UDP, length 16
12:55:25.385569 IP 10.0.0.1.12345 > 10.0.0.2.12345: UDP, length 16
12:55:25.386173 IP 10.0.0.1.12345 > 10.0.0.2.12345: UDP, length 16
12:55:25.386797 IP 10.0.0.1.12345 > 10.0.0.2.12345: UDP, length 16
12:55:25.387407 IP 10.0.0.1.12345 > 10.0.0.2.12345: UDP, length 16
12:55:25.388020 IP 10.0.0.1.12345 > 10.0.0.2.12345: UDP, length 16
12:55:25.388634 IP 10.0.0.1.12345 > 10.0.0.2.12345: UDP, length 16
12:55:25.389217 IP 10.0.0.1.12345 > 10.0.0.2.12345: UDP, length 16
12:55:25.389802 IP 10.0.0.1.12345 > 10.0.0.2.12345: UDP, length 16
12:55:25.390386 IP 10.0.0.1.12345 > 10.0.0.2.12345: UDP, length 16
12:55:25.390988 IP 10.0.0.1.12345 > 10.0.0.2.12345: UDP, length 16
12:55:25.391568 IP 10.0.0.1.12345 > 10.0.0.2.12345: UDP, length 16
12:55:25.392174 IP 10.0.0.1.12345 > 10.0.0.2.12345: UDP, length 16
12:55:25.392783 IP 10.0.0.1.12345 > 10.0.0.2.12345: UDP, length 16
12:55:25.393392 IP 10.0.0.1.12345 > 10.0.0.2.12345: UDP, length 16
12:55:25.394001 IP 10.0.0.1.12345 > 10.0.0.2.12345: UDP, length 16
12:55:25.394581 IP 10.0.0.1.12345 > 10.0.0.2.12345: UDP, length 16
12:55:25.395180 IP 10.0.0.1.12345 > 10.0.0.2.12345: UDP, length 16
12:55:25.395761 IP 10.0.0.1.12345 > 10.0.0.2.12345: UDP, length 16
12:55:25.396352 IP 10.0.0.1.12345 > 10.0.0.2.12345: UDP, length 16
12:55:25.396950 IP 10.0.0.1.12345 > 10.0.0.2.12345: UDP, length 16
12:55:25.397541 IP 10.0.0.1.12345 > 10.0.0.2.12345: UDP, length 16
12:55:25.398127 IP 10.0.0.1.12345 > 10.0.0.2.12345: UDP, length 16
12:55:25.398712 IP 10.0.0.1.12345 > 10.0.0.2.12345: UDP, length 16
12:55:25.399306 IP 10.0.0.1.12345 > 10.0.0.2.12345: UDP, length 16
12:55:25.399919 IP 10.0.0.1.12345 > 10.0.0.2.12345: UDP, length 16
12:55:25.400534 IP 10.0.0.1.12345 > 10.0.0.2.12345: UDP, length 16
12:55:25.401146 IP 10.0.0.1.12345 > 10.0.0.2.12345: UDP, length 16
12:55:25.401758 IP 10.0.0.1.12345 > 10.0.0.2.12345: UDP, length 16
12:55:25.402363 IP 10.0.0.1.12345 > 10.0.0.2.12345: UDP, length 16
12:55:25.402955 IP 10.0.0.1.12345 > 10.0.0.2.12345: UDP, length 16
12:55:25.403546 IP 10.0.0.1.12345 > 10.0.0.2.12345: UDP, length 16
12:55:25.404157 IP 10.0.0.1.12345 > 10.0.0.2.12345: UDP, length 16
12:55:25.404769 IP 10.0.0.1.12345 > 10.0.0.2.12345: UDP, length 16
12:55:25.405382 IP 10.0.0.1.12345 > 10.0.0.2.12345: UDP, length 16
12:55:25.405993 IP 10.0.0.1.12345 > 10.0.0.2.12345: UDP, length 16
12:55:25.406608 IP 10.0.0.1.12345 > 10.0.0.2.12345: UDP, length 16
12:55:25.407220 IP 10.0.0.1.12345 > 10.0.0.2.12345: UDP, length 16
12:55:25.407832 IP 10.0.0.1.12345 > 10.0.0.2.12345: UDP, length 16
12:55:25.408444 IP 10.0.0.1.12345 > 10.0.0.2.12345: UDP, length 16
12:55:25.409055 IP 10.0.0.1.12345 > 10.0.0.2.12345: UDP, length 16
12:55:25.409668 IP 10.0.0.1.12345 > 10.0.0.2.12345: UDP, length 16
12:55:25.410281 IP 10.0.0.1.12345 > 10.0.0.2.12345: UDP, length 16
12:55:25.410885 IP 10.0.0.1.12345 > 10.0.0.2.12345: UDP, length 16
12:55:25.411493 IP 10.0.0.1.12345 > 10.0.0.2.12345: UDP, length 16
12:55:25.412095 IP 10.0.0.1.12345 > 10.0.0.2.12345: UDP, length 16
12:55:25.412698 IP 10.0.0.1.12345 > 10.0.0.2.12345: UDP, length 16
12:55:25.413298 IP 10.0.0.1.12345 > 10.0.0.2.12345: UDP, length 16
12:55:25.413918 IP 10.0.0.1.12345 > 10.0.0.2.12345: UDP, length 16
12:55:25.414521 IP 10.0.0.1.12345 > 10.0.0.2.12345: UDP, length 16
12:55:25.415122 IP 10.0.0.1.12345 > 10.0.0.2.12345: UDP, length 16
12:55:25.415752 IP 10.0.0.1.12345 > 10.0.0.2.12345: UDP, length 16
12:55:25.416340 IP 10.0.0.1.12345 > 10.0.0.2.12345: UDP, length 16
12:55:25.416925 IP 10.0.0.1.12345 > 10.0.0.2.12345: UDP, length 16
12:55:25.417515 IP 10.0.0.1.12345 > 10.0.0.2.12345: UDP, length 16
12:55:25.418134 IP 10.0.0.1.12345 > 10.0.0.2.12345: UDP, length 16
12:55:25.418735 IP 10.0.0.1.12345 > 10.0.0.2.12345: UDP, length 16
12:55:25.419337 IP 10.0.0.1.12345 > 10.0.0.2.12345: UDP, length 16
12:55:25.419923 IP 10.0.0.1.12345 > 10.0.0.2.12345: UDP, length 16
12:55:25.420507 IP 10.0.0.1.12345 > 10.0.0.2.12345: UDP, length 16
12:55:25.421124 IP 10.0.0.1.12345 > 10.0.0.2.12345: UDP, length 16
12:55:25.421742 IP 10.0.0.1.12345 > 10.0.0.2.12345: UDP, length 16
12:55:25.422360 IP 10.0.0.1.12345 > 10.0.0.2.12345: UDP, length 16
12:55:25.422978 IP 10.0.0.1.12345 > 10.0.0.2.12345: UDP, length 16
12:55:25.423595 IP 10.0.0.1.12345 > 10.0.0.2.12345: UDP, length 16
12:55:25.424184 IP 10.0.0.1.12345 > 10.0.0.2.12345: UDP, length 16
12:55:25.424798 IP 10.0.0.1.12345 > 10.0.0.2.12345: UDP, length 16
12:55:25.425418 IP 10.0.0.1.12345 > 10.0.0.2.12345: UDP, length 16
12:55:25.426035 IP 10.0.0.1.12345 > 10.0.0.2.12345: UDP, length 16
12:55:25.426664 IP 10.0.0.1.12345 > 10.0.0.2.12345: UDP, length 16
12:55:25.427261 IP 10.0.0.1.12345 > 10.0.0.2.12345: UDP, length 16
12:55:25.427845 IP 10.0.0.1.12345 > 10.0.0.2.12345: UDP, length 16
12:55:25.428436 IP 10.0.0.1.12345 > 10.0.0.2.12345: UDP, length 16
12:55:25.429041 IP 10.0.0.1.12345 > 10.0.0.2.12345: UDP, length 16
12:55:25.429638 IP 10.0.0.1.12345 > 10.0.0.2.12345: UDP, length 16
12:55:25.430259 IP 10.0.0.1.12345 > 10.0.0.2.12345: UDP, length 16
12:55:25.430882 IP 10.0.0.1.12345 > 10.0.0.2.12345: UDP, length 16
12:55:25.431481 IP 10.0.0.1.12345 > 10.0.0.2.12345: UDP, length 16
12:55:25.432071 IP 10.0.0.1.12345 > 10.0.0.2.12345: UDP, length 16
12:55:25.432659 IP 10.0.0.1.12345 > 10.0.0.2.12345: UDP, length 16
12:55:25.433250 IP 10.0.0.1.12345 > 10.0.0.2.12345: UDP, length 16
12:55:25.433830 IP 10.0.0.1.12345 > 10.0.0.2.12345: UDP, length 16
12:55:25.434417 IP 10.0.0.1.12345 > 10.0.0.2.12345: UDP, length 16
12:55:25.435007 IP 10.0.0.1.12345 > 10.0.0.2.12345: UDP, length 16
12:55:25.435600 IP 10.0.0.1.12345 > 10.0.0.2.12345: UDP, length 16
12:55:25.436192 IP 10.0.0.1.12345 > 10.0.0.2.12345: UDP, length 16
12:55:25.436778 IP 10.0.0.1.12345 > 10.0.0.2.12345: UDP, length 16
12:55:25.437367 IP 10.0.0.1.12345 > 10.0.0.2.12345: UDP, length 16
12:55:25.437956 IP 10.0.0.1.12345 > 10.0.0.2.12345: UDP, length 16
12:55:25.438575 IP 10.0.0.1.12345 > 10.0.0.2.12345: UDP, length 16
12:55:25.439196 IP 10.0.0.1.12345 > 10.0.0.2.12345: UDP, length 16
12:55:25.439795 IP 10.0.0.1.12345 > 10.0.0.2.12345: UDP, length 16
12:55:25.440414 IP 10.0.0.1.12345 > 10.0.0.2.12345: UDP, length 16
12:55:25.441034 IP 10.0.0.1.12345 > 10.0.0.2.12345: UDP, length 16
12:55:25.441654 IP 10.0.0.1.12345 > 10.0.0.2.12345: UDP, length 16
12:55:25.442275 IP 10.0.0.1.12345 > 10.0.0.2.12345: UDP, length 16
12:55:25.442883 IP 10.0.0.1.12345 > 10.0.0.2.12345: UDP, length 16
12:55:25.443505 IP 10.0.0.1.12345 > 10.0.0.2.12345: UDP, length 16
12:55:25.444118 IP 10.0.0.1.12345 > 10.0.0.2.12345: UDP, length 16
12:55:25.444720 IP 10.0.0.1.12345 > 10.0.0.2.12345: UDP, length 16
12:55:25.445318 IP 10.0.0.1.12345 > 10.0.0.2.12345: UDP, length 16
12:55:25.445938 IP 10.0.0.1.12345 > 10.0.0.2.12345: UDP, length 16
12:55:25.446559 IP 10.0.0.1.12345 > 10.0.0.2.12345: UDP, length 16
12:55:25.447179 IP 10.0.0.1.12345 > 10.0.0.2.12345: UDP, length 16
12:55:25.447844 IP 10.0.0.1.12345 > 10.0.0.2.12345: UDP, length 16
12:55:25.448473 IP 10.0.0.1.12345 > 10.0.0.2.12345: UDP, length 16
12:55:25.449085 IP 10.0.0.1.12345 > 10.0.0.2.12345: UDP, length 16
12:55:25.449686 IP 10.0.0.1.12345 > 10.0.0.2.12345: UDP, length 16
12:55:25.450315 IP 10.0.0.1.12345 > 10.0.0.2.12345: UDP, length 16
12:55:25.450916 IP 10.0.0.1.12345 > 10.0.0.2.12345: UDP, length 16
12:55:25.451523 IP 10.0.0.1.12345 > 10.0.0.2.12345: UDP, length 16
12:55:25.452131 IP 10.0.0.1.12345 > 10.0.0.2.12345: UDP, length 16
12:55:25.452723 IP 10.0.0.1.12345 > 10.0.0.2.12345: UDP, length 16
12:55:25.453312 IP 10.0.0.1.12345 > 10.0.0.2.12345: UDP, length 16
12:55:25.453901 IP 10.0.0.1.12345 > 10.0.0.2.12345: UDP, length 16
12:55:25.454491 IP 10.0.0.1.12345 > 10.0.0.2.12345: UDP, length 16
12:55:25.455118 IP 10.0.0.1.12345 > 10.0.0.2.12345: UDP, length 16
12:55:25.455756 IP 10.0.0.1.12345 > 10.0.0.2.12345: UDP, length 16
12:55:25.456388 IP 10.0.0.1.12345 > 10.0.0.2.12345: UDP, length 16
12:55:25.457018 IP 10.0.0.1.12345 > 10.0.0.2.12345: UDP, length 16
12:55:25.457647 IP 10.0.0.1.12345 > 10.0.0.2.12345: UDP, length 16
12:55:25.458276 IP 10.0.0.1.12345 > 10.0.0.2.12345: UDP, length 16
12:55:25.458877 IP 10.0.0.1.12345 > 10.0.0.2.12345: UDP, length 16
12:55:25.459479 IP 10.0.0.1.12345 > 10.0.0.2.12345: UDP, length 16
12:55:25.460080 IP 10.0.0.1.12345 > 10.0.0.2.12345: UDP, length 16
12:55:25.460689 IP 10.0.0.1.12345 > 10.0.0.2.12345: UDP, length 16
12:55:25.461330 IP 10.0.0.1.12345 > 10.0.0.2.12345: UDP, length 16
12:55:25.461936 IP 10.0.0.1.12345 > 10.0.0.2.12345: UDP, length 16
12:55:25.462538 IP 10.0.0.1.12345 > 10.0.0.2.12345: UDP, length 16
12:55:25.463132 IP 10.0.0.1.12345 > 10.0.0.2.12345: UDP, length 16
12:55:25.463799 IP 10.0.0.1.12345 > 10.0.0.2.12345: UDP, length 16
12:55:25.464396 IP 10.0.0.1.12345 > 10.0.0.2.12345: UDP, length 16
12:55:25.464999 IP 10.0.0.1.12345 > 10.0.0.2.12345: UDP, length 16
12:55:25.465630 IP 10.0.0.1.12345 > 10.0.0.2.12345: UDP, length 16
12:55:25.466249 IP 10.0.0.1.12345 > 10.0.0.2.12345: UDP, length 16
12:55:25.466882 IP 10.0.0.1.12345 > 10.0.0.2.12345: UDP, length 16
12:55:25.467486 IP 10.0.0.1.12345 > 10.0.0.2.12345: UDP, length 16
12:55:25.468083 IP 10.0.0.1.12345 > 10.0.0.2.12345: UDP, length 16
12:55:25.468672 IP 10.0.0.1.12345 > 10.0.0.2.12345: UDP, length 16
12:55:25.469262 IP 10.0.0.1.12345 > 10.0.0.2.12345: UDP, length 16
12:55:25.469850 IP 10.0.0.1.12345 > 10.0.0.2.12345: UDP, length 16
12:55:25.470440 IP 10.0.0.1.12345 > 10.0.0.2.12345: UDP, length 16
12:55:25.471027 IP 10.0.0.1.12345 > 10.0.0.2.12345: UDP, length 16
12:55:25.471613 IP 10.0.0.1.12345 > 10.0.0.2.12345: UDP, length 16
12:55:25.472203 IP 10.0.0.1.12345 > 10.0.0.2.12345: UDP, length 16
12:55:25.472791 IP 10.0.0.1.12345 > 10.0.0.2.12345: UDP, length 16
12:55:25.473416 IP 10.0.0.1.12345 > 10.0.0.2.12345: UDP, length 16
12:55:25.474060 IP 10.0.0.1.12345 > 10.0.0.2.12345: UDP, length 16
12:55:25.474672 IP 10.0.0.1.12345 > 10.0.0.2.12345: UDP, length 16
12:55:25.475272 IP 10.0.0.1.12345 > 10.0.0.2.12345: UDP, length 16
12:55:25.475857 IP 10.0.0.1.12345 > 10.0.0.2.12345: UDP, length 16
12:55:25.476479 IP 10.0.0.1.12345 > 10.0.0.2.12345: UDP, length 16
12:55:25.477099 IP 10.0.0.1.12345 > 10.0.0.2.12345: UDP, length 16
12:55:25.477699 IP 10.0.0.1.12345 > 10.0.0.2.12345: UDP, length 16
12:55:25.478296 IP 10.0.0.1.12345 > 10.0.0.2.12345: UDP, length 16
12:55:25.478917 IP 10.0.0.1.12345 > 10.0.0.2.12345: UDP, length 16
12:55:25.479508 IP 10.0.0.1.12345 > 10.0.0.2.12345: UDP, length 16
12:55:25.480099 IP 10.0.0.1.12345 > 10.0.0.2.12345: UDP, length 16
12:55:25.480707 IP 10.0.0.1.12345 > 10.0.0.2.12345: UDP, length 16
12:55:25.481318 IP 10.0.0.1.12345 > 10.0.0.2.12345: UDP, length 16
12:55:25.481933 IP 10.0.0.1.12345 > 10.0.0.2.12345: UDP, length 16
12:55:25.482545 IP 10.0.0.1.12345 > 10.0.0.2.12345: UDP, length 16
12:55:25.483133 IP 10.0.0.1.12345 > 10.0.0.2.12345: UDP, length 16
12:55:25.483741 IP 10.0.0.1.12345 > 10.0.0.2.12345: UDP, length 16
12:55:25.484331 IP 10.0.0.1.12345 > 10.0.0.2.12345: UDP, length 16
12:55:25.484916 IP 10.0.0.1.12345 > 10.0.0.2.12345: UDP, length 16
12:55:25.485502 IP 10.0.0.1.12345 > 10.0.0.2.12345: UDP, length 16
12:55:25.486104 IP 10.0.0.1.12345 > 10.0.0.2.12345: UDP, length 16
12:55:25.486707 IP 10.0.0.1.12345 > 10.0.0.2.12345: UDP, length 16
12:55:25.487310 IP 10.0.0.1.12345 > 10.0.0.2.12345: UDP, length 16
12:55:25.487898 IP 10.0.0.1.12345 > 10.0.0.2.12345: UDP, length 16
12:55:25.488503 IP 10.0.0.1.12345 > 10.0.0.2.12345: UDP, length 16
12:55:25.489147 IP 10.0.0.1.12345 > 10.0.0.2.12345: UDP, length 16
12:55:25.489803 IP 10.0.0.1.12345 > 10.0.0.2.12345: UDP, length 16
12:55:25.490409 IP 10.0.0.1.12345 > 10.0.0.2.12345: UDP, length 16
12:55:25.491009 IP 10.0.0.1.12345 > 10.0.0.2.12345: UDP, length 16
12:55:25.491600 IP 10.0.0.1.12345 > 10.0.0.2.12345: UDP, length 16
12:55:25.492190 IP 10.0.0.1.12345 > 10.0.0.2.12345: UDP, length 16
12:55:25.492778 IP 10.0.0.1.12345 > 10.0.0.2.12345: UDP, length 16
12:55:25.493389 IP 10.0.0.1.12345 > 10.0.0.2.12345: UDP, length 16
12:55:25.493991 IP 10.0.0.1.12345 > 10.0.0.2.12345: UDP, length 16
12:55:25.494583 IP 10.0.0.1.12345 > 10.0.0.2.12345: UDP, length 16
12:55:25.495175 IP 10.0.0.1.12345 > 10.0.0.2.12345: UDP, length 16
12:55:25.495798 IP 10.0.0.1.12345 > 10.0.0.2.12345: UDP, length 16
12:55:25.496418 IP 10.0.0.1.12345 > 10.0.0.2.12345: UDP, length 16
12:55:25.497015 IP 10.0.0.1.12345 > 10.0.0.2.12345: UDP, length 16
12:55:25.497625 IP 10.0.0.1.12345 > 10.0.0.2.12345: UDP, length 16
12:55:25.498256 IP 10.0.0.1.12345 > 10.0.0.2.12345: UDP, length 16
12:55:25.498856 IP 10.0.0.1.12345 > 10.0.0.2.12345: UDP, length 16
12:55:25.499448 IP 10.0.0.1.12345 > 10.0.0.2.12345: UDP, length 16
12:55:25.500044 IP 10.0.0.1.12345 > 10.0.0.2.12345: UDP, length 16
12:55:25.500634 IP 10.0.0.1.12345 > 10.0.0.2.12345: UDP, length 16
12:55:25.501229 IP 10.0.0.1.12345 > 10.0.0.2.12345: UDP, length 16
12:55:25.501827 IP 10.0.0.1.12345 > 10.0.0.2.12345: UDP, length 16
12:55:25.502414 IP 10.0.0.1.12345 > 10.0.0.2.12345: UDP, length 16
12:55:25.503000 IP 10.0.0.1.12345 > 10.0.0.2.12345: UDP, length 16
12:55:25.503607 IP 10.0.0.1.12345 > 10.0.0.2.12345: UDP, length 16
12:55:25.504228 IP 10.0.0.1.12345 > 10.0.0.2.12345: UDP, length 16
12:55:25.504851 IP 10.0.0.1.12345 > 10.0.0.2.12345: UDP, length 16
12:55:25.505469 IP 10.0.0.1.12345 > 10.0.0.2.12345: UDP, length 16
12:55:25.506113 IP 10.0.0.1.12345 > 10.0.0.2.12345: UDP, length 16
12:55:25.506768 IP 10.0.0.1.12345 > 10.0.0.2.12345: UDP, length 16
12:55:25.507395 IP 10.0.0.1.12345 > 10.0.0.2.12345: UDP, length 16
12:55:25.508040 IP 10.0.0.1.12345 > 10.0.0.2.12345: UDP, length 16
12:55:25.508678 IP 10.0.0.1.12345 > 10.0.0.2.12345: UDP, length 16
12:55:25.509282 IP 10.0.0.1.12345 > 10.0.0.2.12345: UDP, length 16
12:55:25.509909 IP 10.0.0.1.12345 > 10.0.0.2.12345: UDP, length 16
12:55:25.510526 IP 10.0.0.1.12345 > 10.0.0.2.12345: UDP, length 16
12:55:25.511133 IP 10.0.0.1.12345 > 10.0.0.2.12345: UDP, length 16
12:55:25.511724 IP 10.0.0.1.12345 > 10.0.0.2.12345: UDP, length 16
12:55:25.512359 IP 10.0.0.1.12345 > 10.0.0.2.12345: UDP, length 16
12:55:25.512999 IP 10.0.0.1.12345 > 10.0.0.2.12345: UDP, length 16
12:55:25.513590 IP 10.0.0.1.12345 > 10.0.0.2.12345: UDP, length 16
12:55:25.514180 IP 10.0.0.1.12345 > 10.0.0.2.12345: UDP, length 16
12:55:25.514821 IP 10.0.0.1.12345 > 10.0.0.2.12345: UDP, length 16
12:55:25.515437 IP 10.0.0.1.12345 > 10.0.0.2.12345: UDP, length 16
12:55:25.516040 IP 10.0.0.1.12345 > 10.0.0.2.12345: UDP, length 16
12:55:25.516671 IP 10.0.0.1.12345 > 10.0.0.2.12345: UDP, length 16
12:55:25.517304 IP 10.0.0.1.12345 > 10.0.0.2.12345: UDP, length 16
12:55:25.517926 IP 10.0.0.1.12345 > 10.0.0.2.12345: UDP, length 16
12:55:25.518541 IP 10.0.0.1.12345 > 10.0.0.2.12345: UDP, length 16
12:55:25.519154 IP 10.0.0.1.12345 > 10.0.0.2.12345: UDP, length 16
12:55:25.519751 IP 10.0.0.1.12345 > 10.0.0.2.12345: UDP, length 16
12:55:25.520344 IP 10.0.0.1.12345 > 10.0.0.2.12345: UDP, length 16
12:55:25.520959 IP 10.0.0.1.12345 > 10.0.0.2.12345: UDP, length 16
12:55:25.521573 IP 10.0.0.1.12345 > 10.0.0.2.12345: UDP, length 16
12:55:25.522193 IP 10.0.0.1.12345 > 10.0.0.2.12345: UDP, length 16
12:55:25.522808 IP 10.0.0.1.12345 > 10.0.0.2.12345: UDP, length 16
12:55:25.523401 IP 10.0.0.1.12345 > 10.0.0.2.12345: UDP, length 16
12:55:25.523993 IP 10.0.0.1.12345 > 10.0.0.2.12345: UDP, length 16
12:55:25.524584 IP 10.0.0.1.12345 > 10.0.0.2.12345: UDP, length 16
12:55:25.525200 IP 10.0.0.1.12345 > 10.0.0.2.12345: UDP, length 16
12:55:25.525803 IP 10.0.0.1.12345 > 10.0.0.2.12345: UDP, length 16
12:55:25.526404 IP 10.0.0.1.12345 > 10.0.0.2.12345: UDP, length 16
12:55:25.527006 IP 10.0.0.1.12345 > 10.0.0.2.12345: UDP, length 16
12:55:25.527636 IP 10.0.0.1.12345 > 10.0.0.2.12345: UDP, length 16
12:55:25.528251 IP 10.0.0.1.12345 > 10.0.0.2.12345: UDP, length 16
12:55:25.528855 IP 10.0.0.1.12345 > 10.0.0.2.12345: UDP, length 16
12:55:25.529484 IP 10.0.0.1.12345 > 10.0.0.2.12345: UDP, length 16
12:55:25.530102 IP 10.0.0.1.12345 > 10.0.0.2.12345: UDP, length 16
12:55:25.530706 IP 10.0.0.1.12345 > 10.0.0.2.12345: UDP, length 16
12:55:25.531305 IP 10.0.0.1.12345 > 10.0.0.2.12345: UDP, length 16
12:55:25.531913 IP 10.0.0.1.12345 > 10.0.0.2.12345: UDP, length 16
12:55:25.532550 IP 10.0.0.1.12345 > 10.0.0.2.12345: UDP, length 16
12:55:25.533146 IP 10.0.0.1.12345 > 10.0.0.2.12345: UDP, length 16
12:55:25.533731 IP 10.0.0.1.12345 > 10.0.0.2.12345: UDP, length 16
12:55:25.534316 IP 10.0.0.1.12345 > 10.0.0.2.12345: UDP, length 16
12:55:25.534909 IP 10.0.0.1.12345 > 10.0.0.2.12345: UDP, length 16
12:55:25.535510 IP 10.0.0.1.12345 > 10.0.0.2.12345: UDP, length 16
12:55:25.536095 IP 10.0.0.1.12345 > 10.0.0.2.12345: UDP, length 16
12:55:25.536712 IP 10.0.0.1.12345 > 10.0.0.2.12345: UDP, length 16
12:55:25.537317 IP 10.0.0.1.12345 > 10.0.0.2.12345: UDP, length 16
12:55:25.537906 IP 10.0.0.1.12345 > 10.0.0.2.12345: UDP, length 16
12:55:25.538523 IP 10.0.0.1.12345 > 10.0.0.2.12345: UDP, length 16
12:55:25.539141 IP 10.0.0.1.12345 > 10.0.0.2.12345: UDP, length 16
12:55:25.539755 IP 10.0.0.1.12345 > 10.0.0.2.12345: UDP, length 16
12:55:25.540386 IP 10.0.0.1.12345 > 10.0.0.2.12345: UDP, length 16
12:55:25.541022 IP 10.0.0.1.12345 > 10.0.0.2.12345: UDP, length 16
12:55:25.541657 IP 10.0.0.1.12345 > 10.0.0.2.12345: UDP, length 16
12:55:25.542253 IP 10.0.0.1.12345 > 10.0.0.2.12345: UDP, length 16
12:55:25.542861 IP 10.0.0.1.12345 > 10.0.0.2.12345: UDP, length 16
12:55:25.543495 IP 10.0.0.1.12345 > 10.0.0.2.12345: UDP, length 16
12:55:25.544076 IP 10.0.0.1.12345 > 10.0.0.2.12345: UDP, length 16
12:55:25.544693 IP 10.0.0.1.12345 > 10.0.0.2.12345: UDP, length 16
12:55:25.545316 IP 10.0.0.1.12345 > 10.0.0.2.12345: UDP, length 16
12:55:25.545927 IP 10.0.0.1.12345 > 10.0.0.2.12345: UDP, length 16
12:55:25.546523 IP 10.0.0.1.12345 > 10.0.0.2.12345: UDP, length 16
12:55:25.547120 IP 10.0.0.1.12345 > 10.0.0.2.12345: UDP, length 16
12:55:25.547762 IP 10.0.0.1.12345 > 10.0.0.2.12345: UDP, length 16
12:55:25.548366 IP 10.0.0.1.12345 > 10.0.0.2.12345: UDP, length 16
12:55:25.548968 IP 10.0.0.1.12345 > 10.0.0.2.12345: UDP, length 16
12:55:25.549568 IP 10.0.0.1.12345 > 10.0.0.2.12345: UDP, length 16
12:55:25.550201 IP 10.0.0.1.12345 > 10.0.0.2.12345: UDP, length 16
12:55:25.550821 IP 10.0.0.1.12345 > 10.0.0.2.12345: UDP, length 16
12:55:25.551420 IP 10.0.0.1.12345 > 10.0.0.2.12345: UDP, length 16
12:55:25.552022 IP 10.0.0.1.12345 > 10.0.0.2.12345: UDP, length 16
12:55:25.552655 IP 10.0.0.1.12345 > 10.0.0.2.12345: UDP, length 16
12:55:25.553294 IP 10.0.0.1.12345 > 10.0.0.2.12345: UDP, length 16
12:55:25.553931 IP 10.0.0.1.12345 > 10.0.0.2.12345: UDP, length 16
12:55:25.554567 IP 10.0.0.1.12345 > 10.0.0.2.12345: UDP, length 16
12:55:25.555204 IP 10.0.0.1.12345 > 10.0.0.2.12345: UDP, length 16
12:55:25.555871 IP 10.0.0.1.12345 > 10.0.0.2.12345: UDP, length 16
12:55:25.556529 IP 10.0.0.1.12345 > 10.0.0.2.12345: UDP, length 16
12:55:25.557183 IP 10.0.0.1.12345 > 10.0.0.2.12345: UDP, length 16
12:55:25.557837 IP 10.0.0.1.12345 > 10.0.0.2.12345: UDP, length 16
12:55:25.558492 IP 10.0.0.1.12345 > 10.0.0.2.12345: UDP, length 16
12:55:25.559146 IP 10.0.0.1.12345 > 10.0.0.2.12345: UDP, length 16
12:55:25.559776 IP 10.0.0.1.12345 > 10.0.0.2.12345: UDP, length 16
12:55:25.560434 IP 10.0.0.1.12345 > 10.0.0.2.12345: UDP, length 16
12:55:25.561060 IP 10.0.0.1.12345 > 10.0.0.2.12345: UDP, length 16
12:55:25.561671 IP 10.0.0.1.12345 > 10.0.0.2.12345: UDP, length 16
12:55:25.562324 IP 10.0.0.1.12345 > 10.0.0.2.12345: UDP, length 16
12:55:25.562966 IP 10.0.0.1.12345 > 10.0.0.2.12345: UDP, length 16
12:55:25.563606 IP 10.0.0.1.12345 > 10.0.0.2.12345: UDP, length 16
12:55:25.564225 IP 10.0.0.1.12345 > 10.0.0.2.12345: UDP, length 16
12:55:25.564860 IP 10.0.0.1.12345 > 10.0.0.2.12345: UDP, length 16
12:55:25.565491 IP 10.0.0.1.12345 > 10.0.0.2.12345: UDP, length 16
12:55:25.566114 IP 10.0.0.1.12345 > 10.0.0.2.12345: UDP, length 16
12:55:25.566763 IP 10.0.0.1.12345 > 10.0.0.2.12345: UDP, length 16
12:55:25.567409 IP 10.0.0.1.12345 > 10.0.0.2.12345: UDP, length 16
12:55:25.568058 IP 10.0.0.1.12345 > 10.0.0.2.12345: UDP, length 16
12:55:25.568702 IP 10.0.0.1.12345 > 10.0.0.2.12345: UDP, length 16
12:55:25.569347 IP 10.0.0.1.12345 > 10.0.0.2.12345: UDP, length 16
12:55:25.569982 IP 10.0.0.1.12345 > 10.0.0.2.12345: UDP, length 16
12:55:25.570624 IP 10.0.0.1.12345 > 10.0.0.2.12345: UDP, length 16
12:55:25.571278 IP 10.0.0.1.12345 > 10.0.0.2.12345: UDP, length 16
12:55:25.571918 IP 10.0.0.1.12345 > 10.0.0.2.12345: UDP, length 16
12:55:25.572572 IP 10.0.0.1.12345 > 10.0.0.2.12345: UDP, length 16
12:55:25.573210 IP 10.0.0.1.12345 > 10.0.0.2.12345: UDP, length 16
12:55:25.573866 IP 10.0.0.1.12345 > 10.0.0.2.12345: UDP, length 16
12:55:25.574523 IP 10.0.0.1.12345 > 10.0.0.2.12345: UDP, length 16
12:55:25.575180 IP 10.0.0.1.12345 > 10.0.0.2.12345: UDP, length 16
12:55:25.575802 IP 10.0.0.1.12345 > 10.0.0.2.12345: UDP, length 16
12:55:25.576461 IP 10.0.0.1.12345 > 10.0.0.2.12345: UDP, length 16
12:55:25.577117 IP 10.0.0.1.12345 > 10.0.0.2.12345: UDP, length 16
