16:39:56.680377 IP 10.0.0.1.12345 > 10.0.0.2.12345: UDP, length 16
16:39:56.681077 IP 10.0.0.1.12345 > 10.0.0.2.12345: UDP, length 16
16:39:56.681748 IP 10.0.0.1.12345 > 10.0.0.2.12345: UDP, length 16
16:39:56.682368 IP 10.0.0.1.12345 > 10.0.0.2.12345: UDP, length 16
16:39:56.682982 IP 10.0.0.1.12345 > 10.0.0.2.12345: UDP, length 16
16:39:56.683647 IP 10.0.0.1.12345 > 10.0.0.2.12345: UDP, length 16
16:39:56.684311 IP 10.0.0.1.12345 > 10.0.0.2.12345: UDP, length 16
16:39:56.684960 IP 10.0.0.1.12345 > 10.0.0.2.12345: UDP, length 16
16:39:56.685608 IP 10.0.0.1.12345 > 10.0.0.2.12345: UDP, length 16
16:39:56.686291 IP 10.0.0.1.12345 > 10.0.0.2.12345: UDP, length 16
16:39:56.686951 IP 10.0.0.1.12345 > 10.0.0.2.12345: UDP, length 16
16:39:56.687569 IP 10.0.0.1.12345 > 10.0.0.2.12345: UDP, length 16
16:39:56.688187 IP 10.0.0.1.12345 > 10.0.0.2.12345: UDP, length 16
16:39:56.688791 IP 10.0.0.1.12345 > 10.0.0.2.12345: UDP, length 16
16:39:56.689406 IP 10.0.0.1.12345 > 10.0.0.2.12345: UDP, length 16
16:39:56.690026 IP 10.0.0.1.12345 > 10.0.0.2.12345: UDP, length 16
16:39:56.690646 IP 10.0.0.1.12345 > 10.0.0.2.12345: UDP, length 16
16:39:56.691263 IP 10.0.0.1.12345 > 10.0.0.2.12345: UDP, length 16
16:39:56.691882 IP 10.0.0.1.12345 > 10.0.0.2.12345: UDP, length 16
16:39:56.692486 IP 10.0.0.1.12345 > 10.0.0.2.12345: UDP, length 16
16:39:56.693102 IP 10.0.0.1.12345 > 10.0.0.2.12345: UDP, length 16
16:39:56.693723 IP 10.0.0.1.12345 > 10.0.0.2.12345: UDP, length 16
16:39:56.694341 IP 10.0.0.1.12345 > 10.0.0.2.12345: UDP, length 16
16:39:56.694945 IP 10.0.0.1.12345 > 10.0.0.2.12345: UDP, length 16
16:39:56.695563 IP 10.0.0.1.12345 > 10.0.0.2.12345: UDP, length 16
16:39:56.696182 IP 10.0.0.1.12345 > 10.0.0.2.12345: UDP, length 16
16:39:56.696787 IP 10.0.0.1.12345 > 10.0.0.2.12345: UDP, length 16
16:39:56.697424 IP 10.0.0.1.12345 > 10.0.0.2.12345: UDP, length 16
16:39:56.698068 IP 10.0.0.1.12345 > 10.0.0.2.12345: UDP, length 16
16:39:56.698709 IP 10.0.0.1.12345 > 10.0.0.2.12345: UDP, length 16
16:39:56.699352 IP 10.0.0.1.12345 > 10.0.0.2.12345: UDP, length 16
16:39:56.699995 IP 10.0.0.1.12345 > 10.0.0.2.12345: UDP, length 16
16:39:56.700620 IP 10.0.0.1.12345 > 10.0.0.2.12345: UDP, length 16
16:39:56.701262 IP 10.0.0.1.12345 > 10.0.0.2.12345: UDP, length 16
16:39:56.701905 IP 10.0.0.1.12345 > 10.0.0.2.12345: UDP, length 16
16:39:56.702548 IP 10.0.0.1.12345 > 10.0.0.2.12345: UDP, length 16
16:39:56.703189 IP 10.0.0.1.12345 > 10.0.0.2.12345: UDP, length 16
16:39:56.703831 IP 10.0.0.1.12345 > 10.0.0.2.12345: UDP, length 16
16:39:56.704420 IP 10.0.0.1.12345 > 10.0.0.2.12345: UDP, length 16
16:39:56.705059 IP 10.0.0.1.12345 > 10.0.0.2.12345: UDP, length 16
16:39:56.705700 IP 10.0.0.1.12345 > 10.0.0.2.12345: UDP, length 16
16:39:56.706342 IP 10.0.0.1.12345 > 10.0.0.2.12345: UDP, length 16
16:39:56.706985 IP 10.0.0.1.12345 > 10.0.0.2.12345: UDP, length 16
16:39:56.707630 IP 10.0.0.1.12345 > 10.0.0.2.12345: UDP, length 16
16:39:56.708318 IP 10.0.0.1.12345 > 10.0.0.2.12345: UDP, length 16
16:39:56.708963 IP 10.0.0.1.12345 > 10.0.0.2.12345: UDP, length 16
16:39:56.709608 IP 10.0.0.1.12345 > 10.0.0.2.12345: UDP, length 16
16:39:56.710252 IP 10.0.0.1.12345 > 10.0.0.2.12345: UDP, length 16
16:39:56.710883 IP 10.0.0.1.12345 > 10.0.0.2.12345: UDP, length 16
16:39:56.711538 IP 10.0.0.1.12345 > 10.0.0.2.12345: UDP, length 16
16:39:56.712182 IP 10.0.0.1.12345 > 10.0.0.2.12345: UDP, length 16
16:39:56.712828 IP 10.0.0.1.12345 > 10.0.0.2.12345: UDP, length 16
16:39:56.713472 IP 10.0.0.1.12345 > 10.0.0.2.12345: UDP, length 16
16:39:56.714117 IP 10.0.0.1.12345 > 10.0.0.2.12345: UDP, length 16
16:39:56.714761 IP 10.0.0.1.12345 > 10.0.0.2.12345: UDP, length 16
16:39:56.715404 IP 10.0.0.1.12345 > 10.0.0.2.12345: UDP, length 16
16:39:56.716048 IP 10.0.0.1.12345 > 10.0.0.2.12345: UDP, length 16
16:39:56.716692 IP 10.0.0.1.12345 > 10.0.0.2.12345: UDP, length 16
16:39:56.717350 IP 10.0.0.1.12345 > 10.0.0.2.12345: UDP, length 16
16:39:56.717996 IP 10.0.0.1.12345 > 10.0.0.2.12345: UDP, length 16
16:39:56.718642 IP 10.0.0.1.12345 > 10.0.0.2.12345: UDP, length 16
16:39:56.719286 IP 10.0.0.1.12345 > 10.0.0.2.12345: UDP, length 16
16:39:56.719931 IP 10.0.0.1.12345 > 10.0.0.2.12345: UDP, length 16
16:39:56.720575 IP 10.0.0.1.12345 > 10.0.0.2.12345: UDP, length 16
16:39:56.721220 IP 10.0.0.1.12345 > 10.0.0.2.12345: UDP, length 16
16:39:56.721867 IP 10.0.0.1.12345 > 10.0.0.2.12345: UDP, length 16
16:39:56.722511 IP 10.0.0.1.12345 > 10.0.0.2.12345: UDP, length 16
16:39:56.723155 IP 10.0.0.1.12345 > 10.0.0.2.12345: UDP, length 16
16:39:56.723802 IP 10.0.0.1.12345 > 10.0.0.2.12345: UDP, length 16
16:39:56.724447 IP 10.0.0.1.12345 > 10.0.0.2.12345: UDP, length 16
16:39:56.725091 IP 10.0.0.1.12345 > 10.0.0.2.12345: UDP, length 16
16:39:56.725734 IP 10.0.0.1.12345 > 10.0.0.2.12345: UDP, length 16
16:39:56.726380 IP 10.0.0.1.12345 > 10.0.0.2.12345: UDP, length 16
16:39:56.727032 IP 10.0.0.1.12345 > 10.0.0.2.12345: UDP, length 16
16:39:56.727676 IP 10.0.0.1.12345 > 10.0.0.2.12345: UDP, length 16
16:39:56.728315 IP 10.0.0.1.12345 > 10.0.0.2.12345: UDP, length 16
16:39:56.728960 IP 10.0.0.1.12345 > 10.0.0.2.12345: UDP, length 16
16:39:56.729604 IP 10.0.0.1.12345 > 10.0.0.2.12345: UDP, length 16
16:39:56.730249 IP 10.0.0.1.12345 > 10.0.0.2.12345: UDP, length 16
16:39:56.730893 IP 10.0.0.1.12345 > 10.0.0.2.12345: UDP, length 16
16:39:56.731537 IP 10.0.0.1.12345 > 10.0.0.2.12345: UDP, length 16
16:39:56.732181 IP 10.0.0.1.12345 > 10.0.0.2.12345: UDP, length 16
16:39:56.732827 IP 10.0.0.1.12345 > 10.0.0.2.12345: UDP, length 16
16:39:56.733471 IP 10.0.0.1.12345 > 10.0.0.2.12345: UDP, length 16
16:39:56.734114 IP 10.0.0.1.12345 > 10.0.0.2.12345: UDP, length 16
16:39:56.734758 IP 10.0.0.1.12345 > 10.0.0.2.12345: UDP, length 16
16:39:56.735402 IP 10.0.0.1.12345 > 10.0.0.2.12345: UDP, length 16
16:39:56.736045 IP 10.0.0.1.12345 > 10.0.0.2.12345: UDP, length 16
16:39:56.736691 IP 10.0.0.1.12345 > 10.0.0.2.12345: UDP, length 16
16:39:56.737335 IP 10.0.0.1.12345 > 10.0.0.2.12345: UDP, length 16
16:39:56.737980 IP 10.0.0.1.12345 > 10.0.0.2.12345: UDP, length 16
16:39:56.738624 IP 10.0.0.1.12345 > 10.0.0.2.12345: UDP, length 16
16:39:56.739270 IP 10.0.0.1.12345 > 10.0.0.2.12345: UDP, length 16
16:39:56.739914 IP 10.0.0.1.12345 > 10.0.0.2.12345: UDP, length 16
16:39:56.740559 IP 10.0.0.1.12345 > 10.0.0.2.12345: UDP, length 16
16:39:56.741203 IP 10.0.0.1.12345 > 10.0.0.2.12345: UDP, length 16
16:39:56.741849 IP 10.0.0.1.12345 > 10.0.0.2.12345: UDP, length 16
16:39:56.742494 IP 10.0.0.1.12345 > 10.0.0.2.12345: UDP, length 16
16:39:56.743140 IP 10.0.0.1.12345 > 10.0.0.2.12345: UDP, length 16
16:39:56.743784 IP 10.0.0.1.12345 > 10.0.0.2.12345: UDP, length 16
16:39:56.744430 IP 10.0.0.1.12345 > 10.0.0.2.12345: UDP, length 16
16:39:56.745074 IP 10.0.0.1.12345 > 10.0.0.2.12345: UDP, length 16
16:39:56.745719 IP 10.0.0.1.12345 > 10.0.0.2.12345: UDP, length 16
16:39:56.746363 IP 10.0.0.1.12345 > 10.0.0.2.12345: UDP, length 16
16:39:56.747007 IP 10.0.0.1.12345 > 10.0.0.2.12345: UDP, length 16
16:39:56.747651 IP 10.0.0.1.12345 > 10.0.0.2.12345: UDP, length 16
16:39:56.748299 IP 10.0.0.1.12345 > 10.0.0.2.12345: UDP, length 16
16:39:56.748944 IP 10.0.0.1.12345 > 10.0.0.2.12345: UDP, length 16
16:39:56.749589 IP 10.0.0.1.12345 > 10.0.0.2.12345: UDP, length 16
16:39:56.750232 IP 10.0.0.1.12345 > 10.0.0.2.12345: UDP, length 16
16:39:56.750880 IP 10.0.0.1.12345 > 10.0.0.2.12345: UDP, length 16
16:39:56.751525 IP 10.0.0.1.12345 > 10.0.0.2.12345: UDP, length 16
16:39:56.752169 IP 10.0.0.1.12345 > 10.0.0.2.12345: UDP, length 16
16:39:56.752814 IP 10.0.0.1.12345 > 10.0.0.2.12345: UDP, length 16
16:39:56.753458 IP 10.0.0.1.12345 > 10.0.0.2.12345: UDP, length 16
16:39:56.754102 IP 10.0.0.1.12345 > 10.0.0.2.12345: UDP, length 16
16:39:56.754746 IP 10.0.0.1.12345 > 10.0.0.2.12345: UDP, length 16
16:39:56.755391 IP 10.0.0.1.12345 > 10.0.0.2.12345: UDP, length 16
16:39:56.756035 IP 10.0.0.1.12345 > 10.0.0.2.12345: UDP, length 16
16:39:56.756681 IP 10.0.0.1.12345 > 10.0.0.2.12345: UDP, length 16
16:39:56.757324 IP 10.0.0.1.12345 > 10.0.0.2.12345: UDP, length 16
16:39:56.757968 IP 10.0.0.1.12345 > 10.0.0.2.12345: UDP, length 16
16:39:56.758611 IP 10.0.0.1.12345 > 10.0.0.2.12345: UDP, length 16
16:39:56.759255 IP 10.0.0.1.12345 > 10.0.0.2.12345: UDP, length 16
16:39:56.759901 IP 10.0.0.1.12345 > 10.0.0.2.12345: UDP, length 16
16:39:56.760546 IP 10.0.0.1.12345 > 10.0.0.2.12345: UDP, length 16
16:39:56.761186 IP 10.0.0.1.12345 > 10.0.0.2.12345: UDP, length 16
16:39:56.761811 IP 10.0.0.1.12345 > 10.0.0.2.12345: UDP, length 16
16:39:56.762456 IP 10.0.0.1.12345 > 10.0.0.2.12345: UDP, length 16
16:39:56.763100 IP 10.0.0.1.12345 > 10.0.0.2.12345: UDP, length 16
16:39:56.763745 IP 10.0.0.1.12345 > 10.0.0.2.12345: UDP, length 16
16:39:56.764353 IP 10.0.0.1.12345 > 10.0.0.2.12345: UDP, length 16
16:39:56.764996 IP 10.0.0.1.12345 > 10.0.0.2.12345: UDP, length 16
16:39:56.765640 IP 10.0.0.1.12345 > 10.0.0.2.12345: UDP, length 16
16:39:56.766285 IP 10.0.0.1.12345 > 10.0.0.2.12345: UDP, length 16
16:39:56.766931 IP 10.0.0.1.12345 > 10.0.0.2.12345: UDP, length 16
16:39:56.767575 IP 10.0.0.1.12345 > 10.0.0.2.12345: UDP, length 16
16:39:56.768276 IP 10.0.0.1.12345 > 10.0.0.2.12345: UDP, length 16
16:39:56.768914 IP 10.0.0.1.12345 > 10.0.0.2.12345: UDP, length 16
16:39:56.769574 IP 10.0.0.1.12345 > 10.0.0.2.12345: UDP, length 16
16:39:56.770240 IP 10.0.0.1.12345 > 10.0.0.2.12345: UDP, length 16
16:39:56.770907 IP 10.0.0.1.12345 > 10.0.0.2.12345: UDP, length 16
16:39:56.771572 IP 10.0.0.1.12345 > 10.0.0.2.12345: UDP, length 16
16:39:56.772290 IP 10.0.0.1.12345 > 10.0.0.2.12345: UDP, length 16
16:39:56.772958 IP 10.0.0.1.12345 > 10.0.0.2.12345: UDP, length 16
16:39:56.773624 IP 10.0.0.1.12345 > 10.0.0.2.12345: UDP, length 16
16:39:56.774288 IP 10.0.0.1.12345 > 10.0.0.2.12345: UDP, length 16
16:39:56.774946 IP 10.0.0.1.12345 > 10.0.0.2.12345: UDP, length 16
16:39:56.775575 IP 10.0.0.1.12345 > 10.0.0.2.12345: UDP, length 16
16:39:56.776197 IP 10.0.0.1.12345 > 10.0.0.2.12345: UDP, length 16
16:39:56.776817 IP 10.0.0.1.12345 > 10.0.0.2.12345: UDP, length 16
16:39:56.777476 IP 10.0.0.1.12345 > 10.0.0.2.12345: UDP, length 16
16:39:56.778143 IP 10.0.0.1.12345 > 10.0.0.2.12345: UDP, length 16
16:39:56.778811 IP 10.0.0.1.12345 > 10.0.0.2.12345: UDP, length 16
16:39:56.779477 IP 10.0.0.1.12345 > 10.0.0.2.12345: UDP, length 16
16:39:56.780142 IP 10.0.0.1.12345 > 10.0.0.2.12345: UDP, length 16
16:39:56.780809 IP 10.0.0.1.12345 > 10.0.0.2.12345: UDP, length 16
16:39:56.781476 IP 10.0.0.1.12345 > 10.0.0.2.12345: UDP, length 16
16:39:56.782141 IP 10.0.0.1.12345 > 10.0.0.2.12345: UDP, length 16
16:39:56.782807 IP 10.0.0.1.12345 > 10.0.0.2.12345: UDP, length 16
16:39:56.783472 IP 10.0.0.1.12345 > 10.0.0.2.12345: UDP, length 16
16:39:56.784138 IP 10.0.0.1.12345 > 10.0.0.2.12345: UDP, length 16
16:39:56.784804 IP 10.0.0.1.12345 > 10.0.0.2.12345: UDP, length 16
16:39:56.785470 IP 10.0.0.1.12345 > 10.0.0.2.12345: UDP, length 16
16:39:56.786138 IP 10.0.0.1.12345 > 10.0.0.2.12345: UDP, length 16
16:39:56.786803 IP 10.0.0.1.12345 > 10.0.0.2.12345: UDP, length 16
16:39:56.787470 IP 10.0.0.1.12345 > 10.0.0.2.12345: UDP, length 16
16:39:56.788136 IP 10.0.0.1.12345 > 10.0.0.2.12345: UDP, length 16
16:39:56.788803 IP 10.0.0.1.12345 > 10.0.0.2.12345: UDP, length 16
16:39:56.789469 IP 10.0.0.1.12345 > 10.0.0.2.12345: UDP, length 16
16:39:56.790136 IP 10.0.0.1.12345 > 10.0.0.2.12345: UDP, length 16
16:39:56.790824 IP 10.0.0.1.12345 > 10.0.0.2.12345: UDP, length 16
16:39:56.791490 IP 10.0.0.1.12345 > 10.0.0.2.12345: UDP, length 16
16:39:56.792157 IP 10.0.0.1.12345 > 10.0.0.2.12345: UDP, length 16
16:39:56.792824 IP 10.0.0.1.12345 > 10.0.0.2.12345: UDP, length 16
16:39:56.793491 IP 10.0.0.1.12345 > 10.0.0.2.12345: UDP, length 16
16:39:56.794157 IP 10.0.0.1.12345 > 10.0.0.2.12345: UDP, length 16
16:39:56.794824 IP 10.0.0.1.12345 > 10.0.0.2.12345: UDP, length 16
16:39:56.795491 IP 10.0.0.1.12345 > 10.0.0.2.12345: UDP, length 16
16:39:56.796158 IP 10.0.0.1.12345 > 10.0.0.2.12345: UDP, length 16
16:39:56.796825 IP 10.0.0.1.12345 > 10.0.0.2.12345: UDP, length 16
16:39:56.797490 IP 10.0.0.1.12345 > 10.0.0.2.12345: UDP, length 16
16:39:56.798157 IP 10.0.0.1.12345 > 10.0.0.2.12345: UDP, length 16
16:39:56.798823 IP 10.0.0.1.12345 > 10.0.0.2.12345: UDP, length 16
16:39:56.799490 IP 10.0.0.1.12345 > 10.0.0.2.12345: UDP, length 16
16:39:56.800158 IP 10.0.0.1.12345 > 10.0.0.2.12345: UDP, length 16
16:39:56.800815 IP 10.0.0.1.12345 > 10.0.0.2.12345: UDP, length 16
16:39:56.801448 IP 10.0.0.1.12345 > 10.0.0.2.12345: UDP, length 16
16:39:56.802080 IP 10.0.0.1.12345 > 10.0.0.2.12345: UDP, length 16
16:39:56.802712 IP 10.0.0.1.12345 > 10.0.0.2.12345: UDP, length 16
16:39:56.803344 IP 10.0.0.1.12345 > 10.0.0.2.12345: UDP, length 16
16:39:56.803979 IP 10.0.0.1.12345 > 10.0.0.2.12345: UDP, length 16
16:39:56.804616 IP 10.0.0.1.12345 > 10.0.0.2.12345: UDP, length 16
16:39:56.805248 IP 10.0.0.1.12345 > 10.0.0.2.12345: UDP, length 16
16:39:56.805880 IP 10.0.0.1.12345 > 10.0.0.2.12345: UDP, length 16
16:39:56.806513 IP 10.0.0.1.12345 > 10.0.0.2.12345: UDP, length 16
16:39:56.807150 IP 10.0.0.1.12345 > 10.0.0.2.12345: UDP, length 16
16:39:56.807819 IP 10.0.0.1.12345 > 10.0.0.2.12345: UDP, length 16
16:39:56.808448 IP 10.0.0.1.12345 > 10.0.0.2.12345: UDP, length 16
16:39:56.809095 IP 10.0.0.1.12345 > 10.0.0.2.12345: UDP, length 16
16:39:56.809747 IP 10.0.0.1.12345 > 10.0.0.2.12345: UDP, length 16
16:39:56.810398 IP 10.0.0.1.12345 > 10.0.0.2.12345: UDP, length 16
16:39:56.811035 IP 10.0.0.1.12345 > 10.0.0.2.12345: UDP, length 16
16:39:56.811669 IP 10.0.0.1.12345 > 10.0.0.2.12345: UDP, length 16
16:39:56.812274 IP 10.0.0.1.12345 > 10.0.0.2.12345: UDP, length 16
16:39:56.812889 IP 10.0.0.1.12345 > 10.0.0.2.12345: UDP, length 16
16:39:56.813503 IP 10.0.0.1.12345 > 10.0.0.2.12345: UDP, length 16
16:39:56.814115 IP 10.0.0.1.12345 > 10.0.0.2.12345: UDP, length 16
16:39:56.814727 IP 10.0.0.1.12345 > 10.0.0.2.12345: UDP, length 16
16:39:56.815340 IP 10.0.0.1.12345 > 10.0.0.2.12345: UDP, length 16
16:39:56.815952 IP 10.0.0.1.12345 > 10.0.0.2.12345: UDP, length 16
16:39:56.816565 IP 10.0.0.1.12345 > 10.0.0.2.12345: UDP, length 16
16:39:56.817177 IP 10.0.0.1.12345 > 10.0.0.2.12345: UDP, length 16
16:39:56.817789 IP 10.0.0.1.12345 > 10.0.0.2.12345: UDP, length 16
16:39:56.818403 IP 10.0.0.1.12345 > 10.0.0.2.12345: UDP, length 16
16:39:56.819018 IP 10.0.0.1.12345 > 10.0.0.2.12345: UDP, length 16
16:39:56.819631 IP 10.0.0.1.12345 > 10.0.0.2.12345: UDP, length 16
16:39:56.820247 IP 10.0.0.1.12345 > 10.0.0.2.12345: UDP, length 16
16:39:56.820848 IP 10.0.0.1.12345 > 10.0.0.2.12345: UDP, length 16
16:39:56.821444 IP 10.0.0.1.12345 > 10.0.0.2.12345: UDP, length 16
16:39:56.822038 IP 10.0.0.1.12345 > 10.0.0.2.12345: UDP, length 16
16:39:56.822630 IP 10.0.0.1.12345 > 10.0.0.2.12345: UDP, length 16
16:39:56.823222 IP 10.0.0.1.12345 > 10.0.0.2.12345: UDP, length 16
16:39:56.823815 IP 10.0.0.1.12345 > 10.0.0.2.12345: UDP, length 16
16:39:56.824418 IP 10.0.0.1.12345 > 10.0.0.2.12345: UDP, length 16
16:39:56.825020 IP 10.0.0.1.12345 > 10.0.0.2.12345: UDP, length 16
16:39:56.825634 IP 10.0.0.1.12345 > 10.0.0.2.12345: UDP, length 16
16:39:56.826254 IP 10.0.0.1.12345 > 10.0.0.2.12345: UDP, length 16
16:39:56.826874 IP 10.0.0.1.12345 > 10.0.0.2.12345: UDP, length 16
16:39:56.827493 IP 10.0.0.1.12345 > 10.0.0.2.12345: UDP, length 16
16:39:56.828113 IP 10.0.0.1.12345 > 10.0.0.2.12345: UDP, length 16
16:39:56.828733 IP 10.0.0.1.12345 > 10.0.0.2.12345: UDP, length 16
16:39:56.829354 IP 10.0.0.1.12345 > 10.0.0.2.12345: UDP, length 16
16:39:56.829974 IP 10.0.0.1.12345 > 10.0.0.2.12345: UDP, length 16
16:39:56.830594 IP 10.0.0.1.12345 > 10.0.0.2.12345: UDP, length 16
16:39:56.831214 IP 10.0.0.1.12345 > 10.0.0.2.12345: UDP, length 16
16:39:56.831835 IP 10.0.0.1.12345 > 10.0.0.2.12345: UDP, length 16
16:39:56.832455 IP 10.0.0.1.12345 > 10.0.0.2.12345: UDP, length 16
16:39:56.833075 IP 10.0.0.1.12345 > 10.0.0.2.12345: UDP, length 16
16:39:56.833694 IP 10.0.0.1.12345 > 10.0.0.2.12345: UDP, length 16
16:39:56.834300 IP 10.0.0.1.12345 > 10.0.0.2.12345: UDP, length 16
16:39:56.834898 IP 10.0.0.1.12345 > 10.0.0.2.12345: UDP, length 16
16:39:56.835517 IP 10.0.0.1.12345 > 10.0.0.2.12345: UDP, length 16
16:39:56.836137 IP 10.0.0.1.12345 > 10.0.0.2.12345: UDP, length 16
16:39:56.836757 IP 10.0.0.1.12345 > 10.0.0.2.12345: UDP, length 16
16:39:56.837377 IP 10.0.0.1.12345 > 10.0.0.2.12345: UDP, length 16
16:39:56.837996 IP 10.0.0.1.12345 > 10.0.0.2.12345: UDP, length 16
16:39:56.838616 IP 10.0.0.1.12345 > 10.0.0.2.12345: UDP, length 16
16:39:56.839236 IP 10.0.0.1.12345 > 10.0.0.2.12345: UDP, length 16
16:39:56.839857 IP 10.0.0.1.12345 > 10.0.0.2.12345: UDP, length 16
16:39:56.840478 IP 10.0.0.1.12345 > 10.0.0.2.12345: UDP, length 16
16:39:56.841099 IP 10.0.0.1.12345 > 10.0.0.2.12345: UDP, length 16
16:39:56.841720 IP 10.0.0.1.12345 > 10.0.0.2.12345: UDP, length 16
16:39:56.842339 IP 10.0.0.1.12345 > 10.0.0.2.12345: UDP, length 16
16:39:56.842959 IP 10.0.0.1.12345 > 10.0.0.2.12345: UDP, length 16
16:39:56.843579 IP 10.0.0.1.12345 > 10.0.0.2.12345: UDP, length 16
16:39:56.844185 IP 10.0.0.1.12345 > 10.0.0.2.12345: UDP, length 16
16:39:56.844805 IP 10.0.0.1.12345 > 10.0.0.2.12345: UDP, length 16
16:39:56.845425 IP 10.0.0.1.12345 > 10.0.0.2.12345: UDP, length 16
16:39:56.846048 IP 10.0.0.1.12345 > 10.0.0.2.12345: UDP, length 16
16:39:56.846668 IP 10.0.0.1.12345 > 10.0.0.2.12345: UDP, length 16
16:39:56.847288 IP 10.0.0.1.12345 > 10.0.0.2.12345: UDP, length 16
16:39:56.847908 IP 10.0.0.1.12345 > 10.0.0.2.12345: UDP, length 16
16:39:56.848530 IP 10.0.0.1.12345 > 10.0.0.2.12345: UDP, length 16
16:39:56.849150 IP 10.0.0.1.12345 > 10.0.0.2.12345: UDP, length 16
16:39:56.849770 IP 10.0.0.1.12345 > 10.0.0.2.12345: UDP, length 16
16:39:56.850391 IP 10.0.0.1.12345 > 10.0.0.2.12345: UDP, length 16
16:39:56.851012 IP 10.0.0.1.12345 > 10.0.0.2.12345: UDP, length 16
16:39:56.851632 IP 10.0.0.1.12345 > 10.0.0.2.12345: UDP, length 16
16:39:56.852259 IP 10.0.0.1.12345 > 10.0.0.2.12345: UDP, length 16
16:39:56.852881 IP 10.0.0.1.12345 > 10.0.0.2.12345: UDP, length 16
16:39:56.853501 IP 10.0.0.1.12345 > 10.0.0.2.12345: UDP, length 16
16:39:56.854120 IP 10.0.0.1.12345 > 10.0.0.2.12345: UDP, length 16
16:39:56.854741 IP 10.0.0.1.12345 > 10.0.0.2.12345: UDP, length 16
16:39:56.855361 IP 10.0.0.1.12345 > 10.0.0.2.12345: UDP, length 16
16:39:56.855980 IP 10.0.0.1.12345 > 10.0.0.2.12345: UDP, length 16
16:39:56.856600 IP 10.0.0.1.12345 > 10.0.0.2.12345: UDP, length 16
16:39:56.857220 IP 10.0.0.1.12345 > 10.0.0.2.12345: UDP, length 16
16:39:56.857839 IP 10.0.0.1.12345 > 10.0.0.2.12345: UDP, length 16
16:39:56.858461 IP 10.0.0.1.12345 > 10.0.0.2.12345: UDP, length 16
16:39:56.859085 IP 10.0.0.1.12345 > 10.0.0.2.12345: UDP, length 16
16:39:56.859705 IP 10.0.0.1.12345 > 10.0.0.2.12345: UDP, length 16
16:39:56.860298 IP 10.0.0.1.12345 > 10.0.0.2.12345: UDP, length 16
16:39:56.860924 IP 10.0.0.1.12345 > 10.0.0.2.12345: UDP, length 16
16:39:56.861544 IP 10.0.0.1.12345 > 10.0.0.2.12345: UDP, length 16
16:39:56.862167 IP 10.0.0.1.12345 > 10.0.0.2.12345: UDP, length 16
16:39:56.862786 IP 10.0.0.1.12345 > 10.0.0.2.12345: UDP, length 16
16:39:56.863405 IP 10.0.0.1.12345 > 10.0.0.2.12345: UDP, length 16
16:39:56.864025 IP 10.0.0.1.12345 > 10.0.0.2.12345: UDP, length 16
16:39:56.864646 IP 10.0.0.1.12345 > 10.0.0.2.12345: UDP, length 16
16:39:56.865266 IP 10.0.0.1.12345 > 10.0.0.2.12345: UDP, length 16
16:39:56.865886 IP 10.0.0.1.12345 > 10.0.0.2.12345: UDP, length 16
16:39:56.866505 IP 10.0.0.1.12345 > 10.0.0.2.12345: UDP, length 16
16:39:56.867125 IP 10.0.0.1.12345 > 10.0.0.2.12345: UDP, length 16
16:39:56.867744 IP 10.0.0.1.12345 > 10.0.0.2.12345: UDP, length 16
16:39:56.868345 IP 10.0.0.1.12345 > 10.0.0.2.12345: UDP, length 16
16:39:56.868966 IP 10.0.0.1.12345 > 10.0.0.2.12345: UDP, length 16
16:39:56.869586 IP 10.0.0.1.12345 > 10.0.0.2.12345: UDP, length 16
16:39:56.870206 IP 10.0.0.1.12345 > 10.0.0.2.12345: UDP, length 16
16:39:56.870833 IP 10.0.0.1.12345 > 10.0.0.2.12345: UDP, length 16
16:39:56.871454 IP 10.0.0.1.12345 > 10.0.0.2.12345: UDP, length 16
16:39:56.872074 IP 10.0.0.1.12345 > 10.0.0.2.12345: UDP, length 16
16:39:56.872695 IP 10.0.0.1.12345 > 10.0.0.2.12345: UDP, length 16
16:39:56.873315 IP 10.0.0.1.12345 > 10.0.0.2.12345: UDP, length 16
16:39:56.873935 IP 10.0.0.1.12345 > 10.0.0.2.12345: UDP, length 16
16:39:56.874554 IP 10.0.0.1.12345 > 10.0.0.2.12345: UDP, length 16
16:39:56.875175 IP 10.0.0.1.12345 > 10.0.0.2.12345: UDP, length 16
16:39:56.875796 IP 10.0.0.1.12345 > 10.0.0.2.12345: UDP, length 16
16:39:56.876416 IP 10.0.0.1.12345 > 10.0.0.2.12345: UDP, length 16
16:39:56.877035 IP 10.0.0.1.12345 > 10.0.0.2.12345: UDP, length 16
16:39:56.877654 IP 10.0.0.1.12345 > 10.0.0.2.12345: UDP, length 16
16:39:56.878274 IP 10.0.0.1.12345 > 10.0.0.2.12345: UDP, length 16
16:39:56.878894 IP 10.0.0.1.12345 > 10.0.0.2.12345: UDP, length 16
16:39:56.879514 IP 10.0.0.1.12345 > 10.0.0.2.12345: UDP, length 16
16:39:56.880138 IP 10.0.0.1.12345 > 10.0.0.2.12345: UDP, length 16
16:39:56.880758 IP 10.0.0.1.12345 > 10.0.0.2.12345: UDP, length 16
16:39:56.881377 IP 10.0.0.1.12345 > 10.0.0.2.12345: UDP, length 16
16:39:56.881997 IP 10.0.0.1.12345 > 10.0.0.2.12345: UDP, length 16
16:39:56.882617 IP 10.0.0.1.12345 > 10.0.0.2.12345: UDP, length 16
16:39:56.883237 IP 10.0.0.1.12345 > 10.0.0.2.12345: UDP, length 16
16:39:56.883857 IP 10.0.0.1.12345 > 10.0.0.2.12345: UDP, length 16
16:39:56.884478 IP 10.0.0.1.12345 > 10.0.0.2.12345: UDP, length 16
16:39:56.885098 IP 10.0.0.1.12345 > 10.0.0.2.12345: UDP, length 16
16:39:56.885718 IP 10.0.0.1.12345 > 10.0.0.2.12345: UDP, length 16
16:39:56.886337 IP 10.0.0.1.12345 > 10.0.0.2.12345: UDP, length 16
16:39:56.886943 IP 10.0.0.1.12345 > 10.0.0.2.12345: UDP, length 16
16:39:56.887564 IP 10.0.0.1.12345 > 10.0.0.2.12345: UDP, length 16
16:39:56.888185 IP 10.0.0.1.12345 > 10.0.0.2.12345: UDP, length 16
16:39:56.888801 IP 10.0.0.1.12345 > 10.0.0.2.12345: UDP, length 16
16:39:56.889417 IP 10.0.0.1.12345 > 10.0.0.2.12345: UDP, length 16
16:39:56.890033 IP 10.0.0.1.12345 > 10.0.0.2.12345: UDP, length 16
16:39:56.890652 IP 10.0.0.1.12345 > 10.0.0.2.12345: UDP, length 16
16:39:56.891272 IP 10.0.0.1.12345 > 10.0.0.2.12345: UDP, length 16
16:39:56.891891 IP 10.0.0.1.12345 > 10.0.0.2.12345: UDP, length 16
16:39:56.892511 IP 10.0.0.1.12345 > 10.0.0.2.12345: UDP, length 16
16:39:56.893131 IP 10.0.0.1.12345 > 10.0.0.2.12345: UDP, length 16
16:39:56.893751 IP 10.0.0.1.12345 > 10.0.0.2.12345: UDP, length 16
16:39:56.894371 IP 10.0.0.1.12345 > 10.0.0.2.12345: UDP, length 16
16:39:56.894990 IP 10.0.0.1.12345 > 10.0.0.2.12345: UDP, length 16
16:39:56.895610 IP 10.0.0.1.12345 > 10.0.0.2.12345: UDP, length 16
16:39:56.896295 IP 10.0.0.1.12345 > 10.0.0.2.12345: UDP, length 16
16:39:56.896934 IP 10.0.0.1.12345 > 10.0.0.2.12345: UDP, length 16
16:39:56.897573 IP 10.0.0.1.12345 > 10.0.0.2.12345: UDP, length 16
16:39:56.898212 IP 10.0.0.1.12345 > 10.0.0.2.12345: UDP, length 16
16:39:56.898851 IP 10.0.0.1.12345 > 10.0.0.2.12345: UDP, length 16
16:39:56.899490 IP 10.0.0.1.12345 > 10.0.0.2.12345: UDP, length 16
16:39:56.900130 IP 10.0.0.1.12345 > 10.0.0.2.12345: UDP, length 16
16:39:56.900769 IP 10.0.0.1.12345 > 10.0.0.2.12345: UDP, length 16
16:39:56.901409 IP 10.0.0.1.12345 > 10.0.0.2.12345: UDP, length 16
16:39:56.902048 IP 10.0.0.1.12345 > 10.0.0.2.12345: UDP, length 16
16:39:56.902689 IP 10.0.0.1.12345 > 10.0.0.2.12345: UDP, length 16
16:39:56.903328 IP 10.0.0.1.12345 > 10.0.0.2.12345: UDP, length 16
16:39:56.903967 IP 10.0.0.1.12345 > 10.0.0.2.12345: UDP, length 16
16:39:56.904609 IP 10.0.0.1.12345 > 10.0.0.2.12345: UDP, length 16
16:39:56.905242 IP 10.0.0.1.12345 > 10.0.0.2.12345: UDP, length 16
16:39:56.905883 IP 10.0.0.1.12345 > 10.0.0.2.12345: UDP, length 16
16:39:56.906522 IP 10.0.0.1.12345 > 10.0.0.2.12345: UDP, length 16
16:39:56.907160 IP 10.0.0.1.12345 > 10.0.0.2.12345: UDP, length 16
16:39:56.907800 IP 10.0.0.1.12345 > 10.0.0.2.12345: UDP, length 16
16:39:56.908441 IP 10.0.0.1.12345 > 10.0.0.2.12345: UDP, length 16
16:39:56.909080 IP 10.0.0.1.12345 > 10.0.0.2.12345: UDP, length 16
16:39:56.909719 IP 10.0.0.1.12345 > 10.0.0.2.12345: UDP, length 16
16:39:56.910359 IP 10.0.0.1.12345 > 10.0.0.2.12345: UDP, length 16
16:39:56.910998 IP 10.0.0.1.12345 > 10.0.0.2.12345: UDP, length 16
16:39:56.911637 IP 10.0.0.1.12345 > 10.0.0.2.12345: UDP, length 16
16:39:56.912278 IP 10.0.0.1.12345 > 10.0.0.2.12345: UDP, length 16
16:39:56.912916 IP 10.0.0.1.12345 > 10.0.0.2.12345: UDP, length 16
16:39:56.913556 IP 10.0.0.1.12345 > 10.0.0.2.12345: UDP, length 16
16:39:56.914195 IP 10.0.0.1.12345 > 10.0.0.2.12345: UDP, length 16
16:39:56.914833 IP 10.0.0.1.12345 > 10.0.0.2.12345: UDP, length 16
16:39:56.915473 IP 10.0.0.1.12345 > 10.0.0.2.12345: UDP, length 16
16:39:56.916112 IP 10.0.0.1.12345 > 10.0.0.2.12345: UDP, length 16
16:39:56.916751 IP 10.0.0.1.12345 > 10.0.0.2.12345: UDP, length 16
16:39:56.917388 IP 10.0.0.1.12345 > 10.0.0.2.12345: UDP, length 16
16:39:56.918025 IP 10.0.0.1.12345 > 10.0.0.2.12345: UDP, length 16
16:39:56.918663 IP 10.0.0.1.12345 > 10.0.0.2.12345: UDP, length 16
16:39:56.919302 IP 10.0.0.1.12345 > 10.0.0.2.12345: UDP, length 16
16:39:56.919939 IP 10.0.0.1.12345 > 10.0.0.2.12345: UDP, length 16
16:39:56.920554 IP 10.0.0.1.12345 > 10.0.0.2.12345: UDP, length 16
16:39:56.921188 IP 10.0.0.1.12345 > 10.0.0.2.12345: UDP, length 16
16:39:56.921828 IP 10.0.0.1.12345 > 10.0.0.2.12345: UDP, length 16
16:39:56.922468 IP 10.0.0.1.12345 > 10.0.0.2.12345: UDP, length 16
16:39:56.923107 IP 10.0.0.1.12345 > 10.0.0.2.12345: UDP, length 16
16:39:56.923746 IP 10.0.0.1.12345 > 10.0.0.2.12345: UDP, length 16
16:39:56.924387 IP 10.0.0.1.12345 > 10.0.0.2.12345: UDP, length 16
16:39:56.925027 IP 10.0.0.1.12345 > 10.0.0.2.12345: UDP, length 16
16:39:56.925666 IP 10.0.0.1.12345 > 10.0.0.2.12345: UDP, length 16
16:39:56.926306 IP 10.0.0.1.12345 > 10.0.0.2.12345: UDP, length 16
16:39:56.926945 IP 10.0.0.1.12345 > 10.0.0.2.12345: UDP, length 16
16:39:56.927584 IP 10.0.0.1.12345 > 10.0.0.2.12345: UDP, length 16
16:39:56.928250 IP 10.0.0.1.12345 > 10.0.0.2.12345: UDP, length 16
16:39:56.928891 IP 10.0.0.1.12345 > 10.0.0.2.12345: UDP, length 16
16:39:56.929529 IP 10.0.0.1.12345 > 10.0.0.2.12345: UDP, length 16
16:39:56.930168 IP 10.0.0.1.12345 > 10.0.0.2.12345: UDP, length 16
16:39:56.930807 IP 10.0.0.1.12345 > 10.0.0.2.12345: UDP, length 16
16:39:56.931446 IP 10.0.0.1.12345 > 10.0.0.2.12345: UDP, length 16
16:39:56.932085 IP 10.0.0.1.12345 > 10.0.0.2.12345: UDP, length 16
16:39:56.932727 IP 10.0.0.1.12345 > 10.0.0.2.12345: UDP, length 16
16:39:56.933367 IP 10.0.0.1.12345 > 10.0.0.2.12345: UDP, length 16
16:39:56.934007 IP 10.0.0.1.12345 > 10.0.0.2.12345: UDP, length 16
16:39:56.934646 IP 10.0.0.1.12345 > 10.0.0.2.12345: UDP, length 16
16:39:56.935287 IP 10.0.0.1.12345 > 10.0.0.2.12345: UDP, length 16
16:39:56.935926 IP 10.0.0.1.12345 > 10.0.0.2.12345: UDP, length 16
16:39:56.936566 IP 10.0.0.1.12345 > 10.0.0.2.12345: UDP, length 16
16:39:56.937205 IP 10.0.0.1.12345 > 10.0.0.2.12345: UDP, length 16
16:39:56.937843 IP 10.0.0.1.12345 > 10.0.0.2.12345: UDP, length 16
16:39:56.938482 IP 10.0.0.1.12345 > 10.0.0.2.12345: UDP, length 16
16:39:56.939096 IP 10.0.0.1.12345 > 10.0.0.2.12345: UDP, length 16
16:39:56.939732 IP 10.0.0.1.12345 > 10.0.0.2.12345: UDP, length 16
16:39:56.940374 IP 10.0.0.1.12345 > 10.0.0.2.12345: UDP, length 16
16:39:56.941012 IP 10.0.0.1.12345 > 10.0.0.2.12345: UDP, length 16
16:39:56.941651 IP 10.0.0.1.12345 > 10.0.0.2.12345: UDP, length 16
16:39:56.942293 IP 10.0.0.1.12345 > 10.0.0.2.12345: UDP, length 16
16:39:56.942931 IP 10.0.0.1.12345 > 10.0.0.2.12345: UDP, length 16
16:39:56.943570 IP 10.0.0.1.12345 > 10.0.0.2.12345: UDP, length 16
16:39:56.944209 IP 10.0.0.1.12345 > 10.0.0.2.12345: UDP, length 16
16:39:56.944890 IP 10.0.0.1.12345 > 10.0.0.2.12345: UDP, length 16
16:39:56.945530 IP 10.0.0.1.12345 > 10.0.0.2.12345: UDP, length 16
16:39:56.946169 IP 10.0.0.1.12345 > 10.0.0.2.12345: UDP, length 16
16:39:56.946807 IP 10.0.0.1.12345 > 10.0.0.2.12345: UDP, length 16
16:39:56.947448 IP 10.0.0.1.12345 > 10.0.0.2.12345: UDP, length 16
16:39:56.948086 IP 10.0.0.1.12345 > 10.0.0.2.12345: UDP, length 16
16:39:56.948728 IP 10.0.0.1.12345 > 10.0.0.2.12345: UDP, length 16
16:39:56.949368 IP 10.0.0.1.12345 > 10.0.0.2.12345: UDP, length 16
16:39:56.950007 IP 10.0.0.1.12345 > 10.0.0.2.12345: UDP, length 16
16:39:56.950645 IP 10.0.0.1.12345 > 10.0.0.2.12345: UDP, length 16
16:39:56.951285 IP 10.0.0.1.12345 > 10.0.0.2.12345: UDP, length 16
16:39:56.951925 IP 10.0.0.1.12345 > 10.0.0.2.12345: UDP, length 16
16:39:56.952566 IP 10.0.0.1.12345 > 10.0.0.2.12345: UDP, length 16
16:39:56.953205 IP 10.0.0.1.12345 > 10.0.0.2.12345: UDP, length 16
16:39:56.953843 IP 10.0.0.1.12345 > 10.0.0.2.12345: UDP, length 16
16:39:56.954483 IP 10.0.0.1.12345 > 10.0.0.2.12345: UDP, length 16
16:39:56.955122 IP 10.0.0.1.12345 > 10.0.0.2.12345: UDP, length 16
16:39:56.955760 IP 10.0.0.1.12345 > 10.0.0.2.12345: UDP, length 16
16:39:56.956401 IP 10.0.0.1.12345 > 10.0.0.2.12345: UDP, length 16
16:39:56.957041 IP 10.0.0.1.12345 > 10.0.0.2.12345: UDP, length 16
16:39:56.957682 IP 10.0.0.1.12345 > 10.0.0.2.12345: UDP, length 16
16:39:56.958320 IP 10.0.0.1.12345 > 10.0.0.2.12345: UDP, length 16
16:39:56.958959 IP 10.0.0.1.12345 > 10.0.0.2.12345: UDP, length 16
16:39:56.959599 IP 10.0.0.1.12345 > 10.0.0.2.12345: UDP, length 16
16:39:56.960268 IP 10.0.0.1.12345 > 10.0.0.2.12345: UDP, length 16
16:39:56.960909 IP 10.0.0.1.12345 > 10.0.0.2.12345: UDP, length 16
16:39:56.961548 IP 10.0.0.1.12345 > 10.0.0.2.12345: UDP, length 16
16:39:56.962186 IP 10.0.0.1.12345 > 10.0.0.2.12345: UDP, length 16
16:39:56.962824 IP 10.0.0.1.12345 > 10.0.0.2.12345: UDP, length 16
16:39:56.963462 IP 10.0.0.1.12345 > 10.0.0.2.12345: UDP, length 16
16:39:56.964101 IP 10.0.0.1.12345 > 10.0.0.2.12345: UDP, length 16
16:39:56.964740 IP 10.0.0.1.12345 > 10.0.0.2.12345: UDP, length 16
16:39:56.965382 IP 10.0.0.1.12345 > 10.0.0.2.12345: UDP, length 16
16:39:56.966021 IP 10.0.0.1.12345 > 10.0.0.2.12345: UDP, length 16
16:39:56.966660 IP 10.0.0.1.12345 > 10.0.0.2.12345: UDP, length 16
16:39:56.967299 IP 10.0.0.1.12345 > 10.0.0.2.12345: UDP, length 16
16:39:56.967938 IP 10.0.0.1.12345 > 10.0.0.2.12345: UDP, length 16
16:39:56.968578 IP 10.0.0.1.12345 > 10.0.0.2.12345: UDP, length 16
16:39:56.969217 IP 10.0.0.1.12345 > 10.0.0.2.12345: UDP, length 16
16:39:56.969855 IP 10.0.0.1.12345 > 10.0.0.2.12345: UDP, length 16
16:39:56.970495 IP 10.0.0.1.12345 > 10.0.0.2.12345: UDP, length 16
16:39:56.971133 IP 10.0.0.1.12345 > 10.0.0.2.12345: UDP, length 16
16:39:56.971773 IP 10.0.0.1.12345 > 10.0.0.2.12345: UDP, length 16
16:39:56.972414 IP 10.0.0.1.12345 > 10.0.0.2.12345: UDP, length 16
16:39:56.973053 IP 10.0.0.1.12345 > 10.0.0.2.12345: UDP, length 16
16:39:56.973692 IP 10.0.0.1.12345 > 10.0.0.2.12345: UDP, length 16
16:39:56.974332 IP 10.0.0.1.12345 > 10.0.0.2.12345: UDP, length 16
16:39:56.974974 IP 10.0.0.1.12345 > 10.0.0.2.12345: UDP, length 16
16:39:56.975613 IP 10.0.0.1.12345 > 10.0.0.2.12345: UDP, length 16
16:39:56.976254 IP 10.0.0.1.12345 > 10.0.0.2.12345: UDP, length 16
16:39:56.976893 IP 10.0.0.1.12345 > 10.0.0.2.12345: UDP, length 16
16:39:56.977532 IP 10.0.0.1.12345 > 10.0.0.2.12345: UDP, length 16
16:39:56.978171 IP 10.0.0.1.12345 > 10.0.0.2.12345: UDP, length 16
16:39:56.978810 IP 10.0.0.1.12345 > 10.0.0.2.12345: UDP, length 16
16:39:56.979450 IP 10.0.0.1.12345 > 10.0.0.2.12345: UDP, length 16
16:39:56.980090 IP 10.0.0.1.12345 > 10.0.0.2.12345: UDP, length 16
16:39:56.980731 IP 10.0.0.1.12345 > 10.0.0.2.12345: UDP, length 16
16:39:56.981371 IP 10.0.0.1.12345 > 10.0.0.2.12345: UDP, length 16
16:39:56.982009 IP 10.0.0.1.12345 > 10.0.0.2.12345: UDP, length 16
16:39:56.982648 IP 10.0.0.1.12345 > 10.0.0.2.12345: UDP, length 16
16:39:56.983288 IP 10.0.0.1.12345 > 10.0.0.2.12345: UDP, length 16
16:39:56.983926 IP 10.0.0.1.12345 > 10.0.0.2.12345: UDP, length 16
16:39:56.984568 IP 10.0.0.1.12345 > 10.0.0.2.12345: UDP, length 16
16:39:56.985207 IP 10.0.0.1.12345 > 10.0.0.2.12345: UDP, length 16
16:39:56.985845 IP 10.0.0.1.12345 > 10.0.0.2.12345: UDP, length 16
16:39:56.986485 IP 10.0.0.1.12345 > 10.0.0.2.12345: UDP, length 16
16:39:56.987124 IP 10.0.0.1.12345 > 10.0.0.2.12345: UDP, length 16
16:39:56.987763 IP 10.0.0.1.12345 > 10.0.0.2.12345: UDP, length 16
16:39:56.988408 IP 10.0.0.1.12345 > 10.0.0.2.12345: UDP, length 16
16:39:56.989047 IP 10.0.0.1.12345 > 10.0.0.2.12345: UDP, length 16
16:39:56.989686 IP 10.0.0.1.12345 > 10.0.0.2.12345: UDP, length 16
16:39:56.990326 IP 10.0.0.1.12345 > 10.0.0.2.12345: UDP, length 16
16:39:56.990965 IP 10.0.0.1.12345 > 10.0.0.2.12345: UDP, length 16
16:39:56.991605 IP 10.0.0.1.12345 > 10.0.0.2.12345: UDP, length 16
16:39:56.992273 IP 10.0.0.1.12345 > 10.0.0.2.12345: UDP, length 16
16:39:56.992912 IP 10.0.0.1.12345 > 10.0.0.2.12345: UDP, length 16
16:39:56.993550 IP 10.0.0.1.12345 > 10.0.0.2.12345: UDP, length 16
16:39:56.994189 IP 10.0.0.1.12345 > 10.0.0.2.12345: UDP, length 16
16:39:56.994829 IP 10.0.0.1.12345 > 10.0.0.2.12345: UDP, length 16
16:39:56.995468 IP 10.0.0.1.12345 > 10.0.0.2.12345: UDP, length 16
16:39:56.996106 IP 10.0.0.1.12345 > 10.0.0.2.12345: UDP, length 16
16:39:56.996745 IP 10.0.0.1.12345 > 10.0.0.2.12345: UDP, length 16
16:39:56.997384 IP 10.0.0.1.12345 > 10.0.0.2.12345: UDP, length 16
16:39:56.998023 IP 10.0.0.1.12345 > 10.0.0.2.12345: UDP, length 16

