16:39:49.530413 IP6 asus.mdns > ff02::fb.mdns: 0 [9q] PTR (QM)? _nfs._tcp.local. PTR (QM)? _ipp._tcp.local. PTR (QM)? _ipps._tcp.local. PTR (QM)? _ftp._tcp.local. PTR (QM)? _webdav._tcp.local. PTR (QM)? _webdavs._tcp.local. PTR (QM)? _sftp-ssh._tcp.local. PTR (QM)? _smb._tcp.local. PTR (QM)? _afpovertcp._tcp.local. (141)
16:39:56.681216 IP 10.0.0.1.12345 > 10.0.0.2.12345: UDP, length 16
16:39:56.681241 IP 10.0.0.1.12345 > 10.0.0.2.12345: UDP, length 16
16:39:56.681761 IP 10.0.0.1.12345 > 10.0.0.2.12345: UDP, length 16
16:39:56.682378 IP 10.0.0.1.12345 > 10.0.0.2.12345: UDP, length 16
16:39:56.682992 IP 10.0.0.1.12345 > 10.0.0.2.12345: UDP, length 16
16:39:56.683661 IP 10.0.0.1.12345 > 10.0.0.2.12345: UDP, length 16
16:39:56.684322 IP 10.0.0.1.12345 > 10.0.0.2.12345: UDP, length 16
16:39:56.684971 IP 10.0.0.1.12345 > 10.0.0.2.12345: UDP, length 16
16:39:56.685621 IP 10.0.0.1.12345 > 10.0.0.2.12345: UDP, length 16
16:39:56.686302 IP 10.0.0.1.12345 > 10.0.0.2.12345: UDP, length 16
16:39:56.686957 IP 10.0.0.1.12345 > 10.0.0.2.12345: UDP, length 16
16:39:56.687575 IP 10.0.0.1.12345 > 10.0.0.2.12345: UDP, length 16
16:39:56.688193 IP 10.0.0.1.12345 > 10.0.0.2.12345: UDP, length 16
16:39:56.688795 IP 10.0.0.1.12345 > 10.0.0.2.12345: UDP, length 16
16:39:56.689412 IP 10.0.0.1.12345 > 10.0.0.2.12345: UDP, length 16
16:39:56.690031 IP 10.0.0.1.12345 > 10.0.0.2.12345: UDP, length 16
16:39:56.690651 IP 10.0.0.1.12345 > 10.0.0.2.12345: UDP, length 16
16:39:56.691269 IP 10.0.0.1.12345 > 10.0.0.2.12345: UDP, length 16
16:39:56.691888 IP 10.0.0.1.12345 > 10.0.0.2.12345: UDP, length 16
16:39:56.692490 IP 10.0.0.1.12345 > 10.0.0.2.12345: UDP, length 16
16:39:56.693107 IP 10.0.0.1.12345 > 10.0.0.2.12345: UDP, length 16
16:39:56.693729 IP 10.0.0.1.12345 > 10.0.0.2.12345: UDP, length 16
16:39:56.694347 IP 10.0.0.1.12345 > 10.0.0.2.12345: UDP, length 16
16:39:56.694951 IP 10.0.0.1.12345 > 10.0.0.2.12345: UDP, length 16
16:39:56.695569 IP 10.0.0.1.12345 > 10.0.0.2.12345: UDP, length 16
16:39:56.696187 IP 10.0.0.1.12345 > 10.0.0.2.12345: UDP, length 16
16:39:56.696791 IP 10.0.0.1.12345 > 10.0.0.2.12345: UDP, length 16
16:39:56.697433 IP 10.0.0.1.12345 > 10.0.0.2.12345: UDP, length 16
16:39:56.698077 IP 10.0.0.1.12345 > 10.0.0.2.12345: UDP, length 16
16:39:56.698718 IP 10.0.0.1.12345 > 10.0.0.2.12345: UDP, length 16
16:39:56.699361 IP 10.0.0.1.12345 > 10.0.0.2.12345: UDP, length 16
16:39:56.700003 IP 10.0.0.1.12345 > 10.0.0.2.12345: UDP, length 16
16:39:56.700628 IP 10.0.0.1.12345 > 10.0.0.2.12345: UDP, length 16
16:39:56.701271 IP 10.0.0.1.12345 > 10.0.0.2.12345: UDP, length 16
16:39:56.701913 IP 10.0.0.1.12345 > 10.0.0.2.12345: UDP, length 16
16:39:56.702556 IP 10.0.0.1.12345 > 10.0.0.2.12345: UDP, length 16
16:39:56.703198 IP 10.0.0.1.12345 > 10.0.0.2.12345: UDP, length 16
16:39:56.703840 IP 10.0.0.1.12345 > 10.0.0.2.12345: UDP, length 16
16:39:56.704426 IP 10.0.0.1.12345 > 10.0.0.2.12345: UDP, length 16
16:39:56.705067 IP 10.0.0.1.12345 > 10.0.0.2.12345: UDP, length 16
16:39:56.705709 IP 10.0.0.1.12345 > 10.0.0.2.12345: UDP, length 16
16:39:56.706351 IP 10.0.0.1.12345 > 10.0.0.2.12345: UDP, length 16
16:39:56.706993 IP 10.0.0.1.12345 > 10.0.0.2.12345: UDP, length 16
16:39:56.707639 IP 10.0.0.1.12345 > 10.0.0.2.12345: UDP, length 16
16:39:56.708327 IP 10.0.0.1.12345 > 10.0.0.2.12345: UDP, length 16
16:39:56.708971 IP 10.0.0.1.12345 > 10.0.0.2.12345: UDP, length 16
16:39:56.709617 IP 10.0.0.1.12345 > 10.0.0.2.12345: UDP, length 16
16:39:56.710261 IP 10.0.0.1.12345 > 10.0.0.2.12345: UDP, length 16
16:39:56.710892 IP 10.0.0.1.12345 > 10.0.0.2.12345: UDP, length 16
16:39:56.711546 IP 10.0.0.1.12345 > 10.0.0.2.12345: UDP, length 16
16:39:56.712190 IP 10.0.0.1.12345 > 10.0.0.2.12345: UDP, length 16
16:39:56.712837 IP 10.0.0.1.12345 > 10.0.0.2.12345: UDP, length 16
16:39:56.713481 IP 10.0.0.1.12345 > 10.0.0.2.12345: UDP, length 16
16:39:56.714125 IP 10.0.0.1.12345 > 10.0.0.2.12345: UDP, length 16
16:39:56.714769 IP 10.0.0.1.12345 > 10.0.0.2.12345: UDP, length 16
16:39:56.715413 IP 10.0.0.1.12345 > 10.0.0.2.12345: UDP, length 16
16:39:56.716056 IP 10.0.0.1.12345 > 10.0.0.2.12345: UDP, length 16
16:39:56.716701 IP 10.0.0.1.12345 > 10.0.0.2.12345: UDP, length 16
16:39:56.717359 IP 10.0.0.1.12345 > 10.0.0.2.12345: UDP, length 16
16:39:56.718005 IP 10.0.0.1.12345 > 10.0.0.2.12345: UDP, length 16
16:39:56.718651 IP 10.0.0.1.12345 > 10.0.0.2.12345: UDP, length 16
16:39:56.719295 IP 10.0.0.1.12345 > 10.0.0.2.12345: UDP, length 16
16:39:56.719940 IP 10.0.0.1.12345 > 10.0.0.2.12345: UDP, length 16
16:39:56.720584 IP 10.0.0.1.12345 > 10.0.0.2.12345: UDP, length 16
16:39:56.721229 IP 10.0.0.1.12345 > 10.0.0.2.12345: UDP, length 16
16:39:56.721876 IP 10.0.0.1.12345 > 10.0.0.2.12345: UDP, length 16
16:39:56.722520 IP 10.0.0.1.12345 > 10.0.0.2.12345: UDP, length 16
16:39:56.723163 IP 10.0.0.1.12345 > 10.0.0.2.12345: UDP, length 16
16:39:56.723810 IP 10.0.0.1.12345 > 10.0.0.2.12345: UDP, length 16
16:39:56.724456 IP 10.0.0.1.12345 > 10.0.0.2.12345: UDP, length 16
16:39:56.725099 IP 10.0.0.1.12345 > 10.0.0.2.12345: UDP, length 16
16:39:56.725743 IP 10.0.0.1.12345 > 10.0.0.2.12345: UDP, length 16
16:39:56.726388 IP 10.0.0.1.12345 > 10.0.0.2.12345: UDP, length 16
16:39:56.727041 IP 10.0.0.1.12345 > 10.0.0.2.12345: UDP, length 16
16:39:56.727685 IP 10.0.0.1.12345 > 10.0.0.2.12345: UDP, length 16
16:39:56.728324 IP 10.0.0.1.12345 > 10.0.0.2.12345: UDP, length 16
16:39:56.728969 IP 10.0.0.1.12345 > 10.0.0.2.12345: UDP, length 16
16:39:56.729613 IP 10.0.0.1.12345 > 10.0.0.2.12345: UDP, length 16
16:39:56.730258 IP 10.0.0.1.12345 > 10.0.0.2.12345: UDP, length 16
16:39:56.730902 IP 10.0.0.1.12345 > 10.0.0.2.12345: UDP, length 16
16:39:56.731545 IP 10.0.0.1.12345 > 10.0.0.2.12345: UDP, length 16
16:39:56.732190 IP 10.0.0.1.12345 > 10.0.0.2.12345: UDP, length 16
16:39:56.732836 IP 10.0.0.1.12345 > 10.0.0.2.12345: UDP, length 16
16:39:56.733479 IP 10.0.0.1.12345 > 10.0.0.2.12345: UDP, length 16
16:39:56.734122 IP 10.0.0.1.12345 > 10.0.0.2.12345: UDP, length 16
16:39:56.734766 IP 10.0.0.1.12345 > 10.0.0.2.12345: UDP, length 16
16:39:56.735410 IP 10.0.0.1.12345 > 10.0.0.2.12345: UDP, length 16
16:39:56.736054 IP 10.0.0.1.12345 > 10.0.0.2.12345: UDP, length 16
16:39:56.736700 IP 10.0.0.1.12345 > 10.0.0.2.12345: UDP, length 16
16:39:56.737344 IP 10.0.0.1.12345 > 10.0.0.2.12345: UDP, length 16
16:39:56.737988 IP 10.0.0.1.12345 > 10.0.0.2.12345: UDP, length 16
16:39:56.738633 IP 10.0.0.1.12345 > 10.0.0.2.12345: UDP, length 16
16:39:56.739278 IP 10.0.0.1.12345 > 10.0.0.2.12345: UDP, length 16
16:39:56.739922 IP 10.0.0.1.12345 > 10.0.0.2.12345: UDP, length 16
16:39:56.740568 IP 10.0.0.1.12345 > 10.0.0.2.12345: UDP, length 16
16:39:56.741211 IP 10.0.0.1.12345 > 10.0.0.2.12345: UDP, length 16
16:39:56.741858 IP 10.0.0.1.12345 > 10.0.0.2.12345: UDP, length 16
16:39:56.742503 IP 10.0.0.1.12345 > 10.0.0.2.12345: UDP, length 16
16:39:56.743149 IP 10.0.0.1.12345 > 10.0.0.2.12345: UDP, length 16
16:39:56.743793 IP 10.0.0.1.12345 > 10.0.0.2.12345: UDP, length 16
16:39:56.744439 IP 10.0.0.1.12345 > 10.0.0.2.12345: UDP, length 16
16:39:56.745083 IP 10.0.0.1.12345 > 10.0.0.2.12345: UDP, length 16
16:39:56.745728 IP 10.0.0.1.12345 > 10.0.0.2.12345: UDP, length 16
16:39:56.746371 IP 10.0.0.1.12345 > 10.0.0.2.12345: UDP, length 16
16:39:56.747015 IP 10.0.0.1.12345 > 10.0.0.2.12345: UDP, length 16
16:39:56.747660 IP 10.0.0.1.12345 > 10.0.0.2.12345: UDP, length 16
16:39:56.748307 IP 10.0.0.1.12345 > 10.0.0.2.12345: UDP, length 16
16:39:56.748953 IP 10.0.0.1.12345 > 10.0.0.2.12345: UDP, length 16
16:39:56.749597 IP 10.0.0.1.12345 > 10.0.0.2.12345: UDP, length 16
16:39:56.750241 IP 10.0.0.1.12345 > 10.0.0.2.12345: UDP, length 16
16:39:56.750889 IP 10.0.0.1.12345 > 10.0.0.2.12345: UDP, length 16
16:39:56.751534 IP 10.0.0.1.12345 > 10.0.0.2.12345: UDP, length 16
16:39:56.752178 IP 10.0.0.1.12345 > 10.0.0.2.12345: UDP, length 16
16:39:56.752823 IP 10.0.0.1.12345 > 10.0.0.2.12345: UDP, length 16
16:39:56.753467 IP 10.0.0.1.12345 > 10.0.0.2.12345: UDP, length 16
16:39:56.754110 IP 10.0.0.1.12345 > 10.0.0.2.12345: UDP, length 16
16:39:56.754755 IP 10.0.0.1.12345 > 10.0.0.2.12345: UDP, length 16
16:39:56.755399 IP 10.0.0.1.12345 > 10.0.0.2.12345: UDP, length 16
16:39:56.756044 IP 10.0.0.1.12345 > 10.0.0.2.12345: UDP, length 16
16:39:56.756689 IP 10.0.0.1.12345 > 10.0.0.2.12345: UDP, length 16
16:39:56.757333 IP 10.0.0.1.12345 > 10.0.0.2.12345: UDP, length 16
16:39:56.757976 IP 10.0.0.1.12345 > 10.0.0.2.12345: UDP, length 16
16:39:56.758619 IP 10.0.0.1.12345 > 10.0.0.2.12345: UDP, length 16
16:39:56.759264 IP 10.0.0.1.12345 > 10.0.0.2.12345: UDP, length 16
16:39:56.759909 IP 10.0.0.1.12345 > 10.0.0.2.12345: UDP, length 16
16:39:56.760555 IP 10.0.0.1.12345 > 10.0.0.2.12345: UDP, length 16
16:39:56.761197 IP 10.0.0.1.12345 > 10.0.0.2.12345: UDP, length 16
16:39:56.761820 IP 10.0.0.1.12345 > 10.0.0.2.12345: UDP, length 16
16:39:56.762464 IP 10.0.0.1.12345 > 10.0.0.2.12345: UDP, length 16
16:39:56.763109 IP 10.0.0.1.12345 > 10.0.0.2.12345: UDP, length 16
16:39:56.763753 IP 10.0.0.1.12345 > 10.0.0.2.12345: UDP, length 16
16:39:56.764361 IP 10.0.0.1.12345 > 10.0.0.2.12345: UDP, length 16
16:39:56.765005 IP 10.0.0.1.12345 > 10.0.0.2.12345: UDP, length 16
16:39:56.765649 IP 10.0.0.1.12345 > 10.0.0.2.12345: UDP, length 16
16:39:56.766293 IP 10.0.0.1.12345 > 10.0.0.2.12345: UDP, length 16
16:39:56.766939 IP 10.0.0.1.12345 > 10.0.0.2.12345: UDP, length 16
16:39:56.767583 IP 10.0.0.1.12345 > 10.0.0.2.12345: UDP, length 16
16:39:56.768287 IP 10.0.0.1.12345 > 10.0.0.2.12345: UDP, length 16
16:39:56.768922 IP 10.0.0.1.12345 > 10.0.0.2.12345: UDP, length 16
16:39:56.769585 IP 10.0.0.1.12345 > 10.0.0.2.12345: UDP, length 16
16:39:56.770251 IP 10.0.0.1.12345 > 10.0.0.2.12345: UDP, length 16
16:39:56.770917 IP 10.0.0.1.12345 > 10.0.0.2.12345: UDP, length 16
16:39:56.771583 IP 10.0.0.1.12345 > 10.0.0.2.12345: UDP, length 16
16:39:56.772301 IP 10.0.0.1.12345 > 10.0.0.2.12345: UDP, length 16
16:39:56.772969 IP 10.0.0.1.12345 > 10.0.0.2.12345: UDP, length 16
16:39:56.773634 IP 10.0.0.1.12345 > 10.0.0.2.12345: UDP, length 16
16:39:56.774299 IP 10.0.0.1.12345 > 10.0.0.2.12345: UDP, length 16
16:39:56.774960 IP 10.0.0.1.12345 > 10.0.0.2.12345: UDP, length 16
16:39:56.775583 IP 10.0.0.1.12345 > 10.0.0.2.12345: UDP, length 16
16:39:56.776205 IP 10.0.0.1.12345 > 10.0.0.2.12345: UDP, length 16
16:39:56.776824 IP 10.0.0.1.12345 > 10.0.0.2.12345: UDP, length 16
16:39:56.777487 IP 10.0.0.1.12345 > 10.0.0.2.12345: UDP, length 16
16:39:56.778154 IP 10.0.0.1.12345 > 10.0.0.2.12345: UDP, length 16
16:39:56.778822 IP 10.0.0.1.12345 > 10.0.0.2.12345: UDP, length 16
16:39:56.779487 IP 10.0.0.1.12345 > 10.0.0.2.12345: UDP, length 16
16:39:56.780153 IP 10.0.0.1.12345 > 10.0.0.2.12345: UDP, length 16
16:39:56.780820 IP 10.0.0.1.12345 > 10.0.0.2.12345: UDP, length 16
16:39:56.781487 IP 10.0.0.1.12345 > 10.0.0.2.12345: UDP, length 16
16:39:56.782152 IP 10.0.0.1.12345 > 10.0.0.2.12345: UDP, length 16
16:39:56.782818 IP 10.0.0.1.12345 > 10.0.0.2.12345: UDP, length 16
16:39:56.783483 IP 10.0.0.1.12345 > 10.0.0.2.12345: UDP, length 16
16:39:56.784149 IP 10.0.0.1.12345 > 10.0.0.2.12345: UDP, length 16
16:39:56.784815 IP 10.0.0.1.12345 > 10.0.0.2.12345: UDP, length 16
16:39:56.785482 IP 10.0.0.1.12345 > 10.0.0.2.12345: UDP, length 16
16:39:56.786149 IP 10.0.0.1.12345 > 10.0.0.2.12345: UDP, length 16
16:39:56.786814 IP 10.0.0.1.12345 > 10.0.0.2.12345: UDP, length 16
16:39:56.787480 IP 10.0.0.1.12345 > 10.0.0.2.12345: UDP, length 16
16:39:56.788146 IP 10.0.0.1.12345 > 10.0.0.2.12345: UDP, length 16
16:39:56.788814 IP 10.0.0.1.12345 > 10.0.0.2.12345: UDP, length 16
16:39:56.789481 IP 10.0.0.1.12345 > 10.0.0.2.12345: UDP, length 16
16:39:56.790146 IP 10.0.0.1.12345 > 10.0.0.2.12345: UDP, length 16
16:39:56.790835 IP 10.0.0.1.12345 > 10.0.0.2.12345: UDP, length 16
16:39:56.791501 IP 10.0.0.1.12345 > 10.0.0.2.12345: UDP, length 16
16:39:56.792168 IP 10.0.0.1.12345 > 10.0.0.2.12345: UDP, length 16
16:39:56.792835 IP 10.0.0.1.12345 > 10.0.0.2.12345: UDP, length 16
16:39:56.793502 IP 10.0.0.1.12345 > 10.0.0.2.12345: UDP, length 16
16:39:56.794168 IP 10.0.0.1.12345 > 10.0.0.2.12345: UDP, length 16
16:39:56.794835 IP 10.0.0.1.12345 > 10.0.0.2.12345: UDP, length 16
16:39:56.795502 IP 10.0.0.1.12345 > 10.0.0.2.12345: UDP, length 16
16:39:56.796169 IP 10.0.0.1.12345 > 10.0.0.2.12345: UDP, length 16
16:39:56.796836 IP 10.0.0.1.12345 > 10.0.0.2.12345: UDP, length 16
16:39:56.797501 IP 10.0.0.1.12345 > 10.0.0.2.12345: UDP, length 16
16:39:56.798168 IP 10.0.0.1.12345 > 10.0.0.2.12345: UDP, length 16
16:39:56.798834 IP 10.0.0.1.12345 > 10.0.0.2.12345: UDP, length 16
16:39:56.799501 IP 10.0.0.1.12345 > 10.0.0.2.12345: UDP, length 16
16:39:56.800169 IP 10.0.0.1.12345 > 10.0.0.2.12345: UDP, length 16
16:39:56.800827 IP 10.0.0.1.12345 > 10.0.0.2.12345: UDP, length 16
16:39:56.801462 IP 10.0.0.1.12345 > 10.0.0.2.12345: UDP, length 16
16:39:56.802093 IP 10.0.0.1.12345 > 10.0.0.2.12345: UDP, length 16
16:39:56.802726 IP 10.0.0.1.12345 > 10.0.0.2.12345: UDP, length 16
16:39:56.803357 IP 10.0.0.1.12345 > 10.0.0.2.12345: UDP, length 16
16:39:56.803993 IP 10.0.0.1.12345 > 10.0.0.2.12345: UDP, length 16
16:39:56.804629 IP 10.0.0.1.12345 > 10.0.0.2.12345: UDP, length 16
16:39:56.805261 IP 10.0.0.1.12345 > 10.0.0.2.12345: UDP, length 16
16:39:56.805894 IP 10.0.0.1.12345 > 10.0.0.2.12345: UDP, length 16
16:39:56.806527 IP 10.0.0.1.12345 > 10.0.0.2.12345: UDP, length 16
16:39:56.807163 IP 10.0.0.1.12345 > 10.0.0.2.12345: UDP, length 16
16:39:56.807834 IP 10.0.0.1.12345 > 10.0.0.2.12345: UDP, length 16
16:39:56.808457 IP 10.0.0.1.12345 > 10.0.0.2.12345: UDP, length 16
16:39:56.809107 IP 10.0.0.1.12345 > 10.0.0.2.12345: UDP, length 16
16:39:56.809758 IP 10.0.0.1.12345 > 10.0.0.2.12345: UDP, length 16
16:39:56.810409 IP 10.0.0.1.12345 > 10.0.0.2.12345: UDP, length 16
16:39:56.811050 IP 10.0.0.1.12345 > 10.0.0.2.12345: UDP, length 16
16:39:56.811674 IP 10.0.0.1.12345 > 10.0.0.2.12345: UDP, length 16
16:39:56.812281 IP 10.0.0.1.12345 > 10.0.0.2.12345: UDP, length 16
16:39:56.812894 IP 10.0.0.1.12345 > 10.0.0.2.12345: UDP, length 16
16:39:56.813507 IP 10.0.0.1.12345 > 10.0.0.2.12345: UDP, length 16
16:39:56.814119 IP 10.0.0.1.12345 > 10.0.0.2.12345: UDP, length 16
16:39:56.814732 IP 10.0.0.1.12345 > 10.0.0.2.12345: UDP, length 16
16:39:56.815344 IP 10.0.0.1.12345 > 10.0.0.2.12345: UDP, length 16
16:39:56.815956 IP 10.0.0.1.12345 > 10.0.0.2.12345: UDP, length 16
16:39:56.816569 IP 10.0.0.1.12345 > 10.0.0.2.12345: UDP, length 16
16:39:56.817182 IP 10.0.0.1.12345 > 10.0.0.2.12345: UDP, length 16
16:39:56.817794 IP 10.0.0.1.12345 > 10.0.0.2.12345: UDP, length 16
16:39:56.818407 IP 10.0.0.1.12345 > 10.0.0.2.12345: UDP, length 16
16:39:56.819022 IP 10.0.0.1.12345 > 10.0.0.2.12345: UDP, length 16
16:39:56.819635 IP 10.0.0.1.12345 > 10.0.0.2.12345: UDP, length 16
16:39:56.820254 IP 10.0.0.1.12345 > 10.0.0.2.12345: UDP, length 16
16:39:56.820852 IP 10.0.0.1.12345 > 10.0.0.2.12345: UDP, length 16
16:39:56.821449 IP 10.0.0.1.12345 > 10.0.0.2.12345: UDP, length 16
16:39:56.822041 IP 10.0.0.1.12345 > 10.0.0.2.12345: UDP, length 16
16:39:56.822633 IP 10.0.0.1.12345 > 10.0.0.2.12345: UDP, length 16
16:39:56.823226 IP 10.0.0.1.12345 > 10.0.0.2.12345: UDP, length 16
16:39:56.823818 IP 10.0.0.1.12345 > 10.0.0.2.12345: UDP, length 16
16:39:56.824425 IP 10.0.0.1.12345 > 10.0.0.2.12345: UDP, length 16
16:39:56.825024 IP 10.0.0.1.12345 > 10.0.0.2.12345: UDP, length 16
16:39:56.825639 IP 10.0.0.1.12345 > 10.0.0.2.12345: UDP, length 16
16:39:56.826260 IP 10.0.0.1.12345 > 10.0.0.2.12345: UDP, length 16
16:39:56.826879 IP 10.0.0.1.12345 > 10.0.0.2.12345: UDP, length 16
16:39:56.827499 IP 10.0.0.1.12345 > 10.0.0.2.12345: UDP, length 16
16:39:56.828119 IP 10.0.0.1.12345 > 10.0.0.2.12345: UDP, length 16
16:39:56.828739 IP 10.0.0.1.12345 > 10.0.0.2.12345: UDP, length 16
16:39:56.829360 IP 10.0.0.1.12345 > 10.0.0.2.12345: UDP, length 16
16:39:56.829979 IP 10.0.0.1.12345 > 10.0.0.2.12345: UDP, length 16
16:39:56.830600 IP 10.0.0.1.12345 > 10.0.0.2.12345: UDP, length 16
16:39:56.831219 IP 10.0.0.1.12345 > 10.0.0.2.12345: UDP, length 16
16:39:56.831840 IP 10.0.0.1.12345 > 10.0.0.2.12345: UDP, length 16
16:39:56.832461 IP 10.0.0.1.12345 > 10.0.0.2.12345: UDP, length 16
16:39:56.833081 IP 10.0.0.1.12345 > 10.0.0.2.12345: UDP, length 16
16:39:56.833700 IP 10.0.0.1.12345 > 10.0.0.2.12345: UDP, length 16
16:39:56.834304 IP 10.0.0.1.12345 > 10.0.0.2.12345: UDP, length 16
16:39:56.834902 IP 10.0.0.1.12345 > 10.0.0.2.12345: UDP, length 16
16:39:56.835522 IP 10.0.0.1.12345 > 10.0.0.2.12345: UDP, length 16
16:39:56.836142 IP 10.0.0.1.12345 > 10.0.0.2.12345: UDP, length 16
16:39:56.836762 IP 10.0.0.1.12345 > 10.0.0.2.12345: UDP, length 16
16:39:56.837382 IP 10.0.0.1.12345 > 10.0.0.2.12345: UDP, length 16
16:39:56.838002 IP 10.0.0.1.12345 > 10.0.0.2.12345: UDP, length 16
16:39:56.838622 IP 10.0.0.1.12345 > 10.0.0.2.12345: UDP, length 16
16:39:56.839242 IP 10.0.0.1.12345 > 10.0.0.2.12345: UDP, length 16
16:39:56.839862 IP 10.0.0.1.12345 > 10.0.0.2.12345: UDP, length 16
16:39:56.840483 IP 10.0.0.1.12345 > 10.0.0.2.12345: UDP, length 16
16:39:56.841104 IP 10.0.0.1.12345 > 10.0.0.2.12345: UDP, length 16
16:39:56.841725 IP 10.0.0.1.12345 > 10.0.0.2.12345: UDP, length 16
16:39:56.842345 IP 10.0.0.1.12345 > 10.0.0.2.12345: UDP, length 16
16:39:56.842964 IP 10.0.0.1.12345 > 10.0.0.2.12345: UDP, length 16
16:39:56.843584 IP 10.0.0.1.12345 > 10.0.0.2.12345: UDP, length 16
16:39:56.844190 IP 10.0.0.1.12345 > 10.0.0.2.12345: UDP, length 16
16:39:56.844811 IP 10.0.0.1.12345 > 10.0.0.2.12345: UDP, length 16
16:39:56.845431 IP 10.0.0.1.12345 > 10.0.0.2.12345: UDP, length 16
16:39:56.846053 IP 10.0.0.1.12345 > 10.0.0.2.12345: UDP, length 16
16:39:56.846673 IP 10.0.0.1.12345 > 10.0.0.2.12345: UDP, length 16
16:39:56.847294 IP 10.0.0.1.12345 > 10.0.0.2.12345: UDP, length 16
16:39:56.847914 IP 10.0.0.1.12345 > 10.0.0.2.12345: UDP, length 16
16:39:56.848535 IP 10.0.0.1.12345 > 10.0.0.2.12345: UDP, length 16
16:39:56.849155 IP 10.0.0.1.12345 > 10.0.0.2.12345: UDP, length 16
16:39:56.849776 IP 10.0.0.1.12345 > 10.0.0.2.12345: UDP, length 16
16:39:56.850397 IP 10.0.0.1.12345 > 10.0.0.2.12345: UDP, length 16
16:39:56.851017 IP 10.0.0.1.12345 > 10.0.0.2.12345: UDP, length 16
16:39:56.851637 IP 10.0.0.1.12345 > 10.0.0.2.12345: UDP, length 16
16:39:56.852266 IP 10.0.0.1.12345 > 10.0.0.2.12345: UDP, length 16
16:39:56.852887 IP 10.0.0.1.12345 > 10.0.0.2.12345: UDP, length 16
16:39:56.853506 IP 10.0.0.1.12345 > 10.0.0.2.12345: UDP, length 16
16:39:56.854126 IP 10.0.0.1.12345 > 10.0.0.2.12345: UDP, length 16
16:39:56.854746 IP 10.0.0.1.12345 > 10.0.0.2.12345: UDP, length 16
16:39:56.855366 IP 10.0.0.1.12345 > 10.0.0.2.12345: UDP, length 16
16:39:56.855985 IP 10.0.0.1.12345 > 10.0.0.2.12345: UDP, length 16
16:39:56.856606 IP 10.0.0.1.12345 > 10.0.0.2.12345: UDP, length 16
16:39:56.857225 IP 10.0.0.1.12345 > 10.0.0.2.12345: UDP, length 16
16:39:56.857845 IP 10.0.0.1.12345 > 10.0.0.2.12345: UDP, length 16
16:39:56.858467 IP 10.0.0.1.12345 > 10.0.0.2.12345: UDP, length 16
16:39:56.859091 IP 10.0.0.1.12345 > 10.0.0.2.12345: UDP, length 16
16:39:56.859711 IP 10.0.0.1.12345 > 10.0.0.2.12345: UDP, length 16
16:39:56.860304 IP 10.0.0.1.12345 > 10.0.0.2.12345: UDP, length 16
16:39:56.860929 IP 10.0.0.1.12345 > 10.0.0.2.12345: UDP, length 16
16:39:56.861549 IP 10.0.0.1.12345 > 10.0.0.2.12345: UDP, length 16
16:39:56.862172 IP 10.0.0.1.12345 > 10.0.0.2.12345: UDP, length 16
16:39:56.862792 IP 10.0.0.1.12345 > 10.0.0.2.12345: UDP, length 16
16:39:56.863411 IP 10.0.0.1.12345 > 10.0.0.2.12345: UDP, length 16
16:39:56.864031 IP 10.0.0.1.12345 > 10.0.0.2.12345: UDP, length 16
16:39:56.864652 IP 10.0.0.1.12345 > 10.0.0.2.12345: UDP, length 16
16:39:56.865271 IP 10.0.0.1.12345 > 10.0.0.2.12345: UDP, length 16
16:39:56.865892 IP 10.0.0.1.12345 > 10.0.0.2.12345: UDP, length 16
16:39:56.866511 IP 10.0.0.1.12345 > 10.0.0.2.12345: UDP, length 16
16:39:56.867130 IP 10.0.0.1.12345 > 10.0.0.2.12345: UDP, length 16
16:39:56.867749 IP 10.0.0.1.12345 > 10.0.0.2.12345: UDP, length 16
16:39:56.868350 IP 10.0.0.1.12345 > 10.0.0.2.12345: UDP, length 16
16:39:56.868971 IP 10.0.0.1.12345 > 10.0.0.2.12345: UDP, length 16
16:39:56.869592 IP 10.0.0.1.12345 > 10.0.0.2.12345: UDP, length 16
16:39:56.870212 IP 10.0.0.1.12345 > 10.0.0.2.12345: UDP, length 16
16:39:56.870838 IP 10.0.0.1.12345 > 10.0.0.2.12345: UDP, length 16
16:39:56.871460 IP 10.0.0.1.12345 > 10.0.0.2.12345: UDP, length 16
16:39:56.872080 IP 10.0.0.1.12345 > 10.0.0.2.12345: UDP, length 16
16:39:56.872700 IP 10.0.0.1.12345 > 10.0.0.2.12345: UDP, length 16
16:39:56.873320 IP 10.0.0.1.12345 > 10.0.0.2.12345: UDP, length 16
16:39:56.873940 IP 10.0.0.1.12345 > 10.0.0.2.12345: UDP, length 16
16:39:56.874560 IP 10.0.0.1.12345 > 10.0.0.2.12345: UDP, length 16
16:39:56.875180 IP 10.0.0.1.12345 > 10.0.0.2.12345: UDP, length 16
16:39:56.875801 IP 10.0.0.1.12345 > 10.0.0.2.12345: UDP, length 16
16:39:56.876421 IP 10.0.0.1.12345 > 10.0.0.2.12345: UDP, length 16
16:39:56.877040 IP 10.0.0.1.12345 > 10.0.0.2.12345: UDP, length 16
16:39:56.877660 IP 10.0.0.1.12345 > 10.0.0.2.12345: UDP, length 16
16:39:56.878279 IP 10.0.0.1.12345 > 10.0.0.2.12345: UDP, length 16
16:39:56.878899 IP 10.0.0.1.12345 > 10.0.0.2.12345: UDP, length 16
16:39:56.879520 IP 10.0.0.1.12345 > 10.0.0.2.12345: UDP, length 16
16:39:56.880143 IP 10.0.0.1.12345 > 10.0.0.2.12345: UDP, length 16
16:39:56.880763 IP 10.0.0.1.12345 > 10.0.0.2.12345: UDP, length 16
16:39:56.881382 IP 10.0.0.1.12345 > 10.0.0.2.12345: UDP, length 16
16:39:56.882002 IP 10.0.0.1.12345 > 10.0.0.2.12345: UDP, length 16
16:39:56.882623 IP 10.0.0.1.12345 > 10.0.0.2.12345: UDP, length 16
16:39:56.883242 IP 10.0.0.1.12345 > 10.0.0.2.12345: UDP, length 16
16:39:56.883862 IP 10.0.0.1.12345 > 10.0.0.2.12345: UDP, length 16
16:39:56.884484 IP 10.0.0.1.12345 > 10.0.0.2.12345: UDP, length 16
16:39:56.885104 IP 10.0.0.1.12345 > 10.0.0.2.12345: UDP, length 16
16:39:56.885723 IP 10.0.0.1.12345 > 10.0.0.2.12345: UDP, length 16
16:39:56.886343 IP 10.0.0.1.12345 > 10.0.0.2.12345: UDP, length 16
16:39:56.886949 IP 10.0.0.1.12345 > 10.0.0.2.12345: UDP, length 16
16:39:56.887570 IP 10.0.0.1.12345 > 10.0.0.2.12345: UDP, length 16
16:39:56.888191 IP 10.0.0.1.12345 > 10.0.0.2.12345: UDP, length 16
16:39:56.888807 IP 10.0.0.1.12345 > 10.0.0.2.12345: UDP, length 16
16:39:56.889423 IP 10.0.0.1.12345 > 10.0.0.2.12345: UDP, length 16
16:39:56.890038 IP 10.0.0.1.12345 > 10.0.0.2.12345: UDP, length 16
16:39:56.890658 IP 10.0.0.1.12345 > 10.0.0.2.12345: UDP, length 16
16:39:56.891277 IP 10.0.0.1.12345 > 10.0.0.2.12345: UDP, length 16
16:39:56.891897 IP 10.0.0.1.12345 > 10.0.0.2.12345: UDP, length 16
16:39:56.892517 IP 10.0.0.1.12345 > 10.0.0.2.12345: UDP, length 16
16:39:56.893136 IP 10.0.0.1.12345 > 10.0.0.2.12345: UDP, length 16
16:39:56.893756 IP 10.0.0.1.12345 > 10.0.0.2.12345: UDP, length 16
16:39:56.894377 IP 10.0.0.1.12345 > 10.0.0.2.12345: UDP, length 16
16:39:56.894996 IP 10.0.0.1.12345 > 10.0.0.2.12345: UDP, length 16
16:39:56.895615 IP 10.0.0.1.12345 > 10.0.0.2.12345: UDP, length 16
16:39:56.896302 IP 10.0.0.1.12345 > 10.0.0.2.12345: UDP, length 16
16:39:56.896942 IP 10.0.0.1.12345 > 10.0.0.2.12345: UDP, length 16
16:39:56.897581 IP 10.0.0.1.12345 > 10.0.0.2.12345: UDP, length 16
16:39:56.898220 IP 10.0.0.1.12345 > 10.0.0.2.12345: UDP, length 16
16:39:56.898859 IP 10.0.0.1.12345 > 10.0.0.2.12345: UDP, length 16
16:39:56.899498 IP 10.0.0.1.12345 > 10.0.0.2.12345: UDP, length 16
16:39:56.900138 IP 10.0.0.1.12345 > 10.0.0.2.12345: UDP, length 16
16:39:56.900777 IP 10.0.0.1.12345 > 10.0.0.2.12345: UDP, length 16
16:39:56.901417 IP 10.0.0.1.12345 > 10.0.0.2.12345: UDP, length 16
16:39:56.902055 IP 10.0.0.1.12345 > 10.0.0.2.12345: UDP, length 16
16:39:56.902696 IP 10.0.0.1.12345 > 10.0.0.2.12345: UDP, length 16
16:39:56.903336 IP 10.0.0.1.12345 > 10.0.0.2.12345: UDP, length 16
16:39:56.903975 IP 10.0.0.1.12345 > 10.0.0.2.12345: UDP, length 16
16:39:56.904616 IP 10.0.0.1.12345 > 10.0.0.2.12345: UDP, length 16
16:39:56.905250 IP 10.0.0.1.12345 > 10.0.0.2.12345: UDP, length 16
16:39:56.905890 IP 10.0.0.1.12345 > 10.0.0.2.12345: UDP, length 16
16:39:56.906529 IP 10.0.0.1.12345 > 10.0.0.2.12345: UDP, length 16
16:39:56.907168 IP 10.0.0.1.12345 > 10.0.0.2.12345: UDP, length 16
16:39:56.907808 IP 10.0.0.1.12345 > 10.0.0.2.12345: UDP, length 16
16:39:56.908449 IP 10.0.0.1.12345 > 10.0.0.2.12345: UDP, length 16
16:39:56.909088 IP 10.0.0.1.12345 > 10.0.0.2.12345: UDP, length 16
16:39:56.909727 IP 10.0.0.1.12345 > 10.0.0.2.12345: UDP, length 16
16:39:56.910367 IP 10.0.0.1.12345 > 10.0.0.2.12345: UDP, length 16
16:39:56.911006 IP 10.0.0.1.12345 > 10.0.0.2.12345: UDP, length 16
16:39:56.911645 IP 10.0.0.1.12345 > 10.0.0.2.12345: UDP, length 16
16:39:56.912286 IP 10.0.0.1.12345 > 10.0.0.2.12345: UDP, length 16
16:39:56.912924 IP 10.0.0.1.12345 > 10.0.0.2.12345: UDP, length 16
16:39:56.913564 IP 10.0.0.1.12345 > 10.0.0.2.12345: UDP, length 16
16:39:56.914203 IP 10.0.0.1.12345 > 10.0.0.2.12345: UDP, length 16
16:39:56.914841 IP 10.0.0.1.12345 > 10.0.0.2.12345: UDP, length 16
16:39:56.915481 IP 10.0.0.1.12345 > 10.0.0.2.12345: UDP, length 16
16:39:56.916120 IP 10.0.0.1.12345 > 10.0.0.2.12345: UDP, length 16
16:39:56.916759 IP 10.0.0.1.12345 > 10.0.0.2.12345: UDP, length 16
16:39:56.917396 IP 10.0.0.1.12345 > 10.0.0.2.12345: UDP, length 16
16:39:56.918033 IP 10.0.0.1.12345 > 10.0.0.2.12345: UDP, length 16
16:39:56.918671 IP 10.0.0.1.12345 > 10.0.0.2.12345: UDP, length 16
16:39:56.919310 IP 10.0.0.1.12345 > 10.0.0.2.12345: UDP, length 16
16:39:56.919947 IP 10.0.0.1.12345 > 10.0.0.2.12345: UDP, length 16
16:39:56.920560 IP 10.0.0.1.12345 > 10.0.0.2.12345: UDP, length 16
16:39:56.921196 IP 10.0.0.1.12345 > 10.0.0.2.12345: UDP, length 16
16:39:56.921835 IP 10.0.0.1.12345 > 10.0.0.2.12345: UDP, length 16
16:39:56.922476 IP 10.0.0.1.12345 > 10.0.0.2.12345: UDP, length 16
16:39:56.923115 IP 10.0.0.1.12345 > 10.0.0.2.12345: UDP, length 16
16:39:56.923753 IP 10.0.0.1.12345 > 10.0.0.2.12345: UDP, length 16
16:39:56.924395 IP 10.0.0.1.12345 > 10.0.0.2.12345: UDP, length 16
16:39:56.925035 IP 10.0.0.1.12345 > 10.0.0.2.12345: UDP, length 16
16:39:56.925674 IP 10.0.0.1.12345 > 10.0.0.2.12345: UDP, length 16
16:39:56.926314 IP 10.0.0.1.12345 > 10.0.0.2.12345: UDP, length 16
16:39:56.926953 IP 10.0.0.1.12345 > 10.0.0.2.12345: UDP, length 16
16:39:56.927591 IP 10.0.0.1.12345 > 10.0.0.2.12345: UDP, length 16
16:39:56.928258 IP 10.0.0.1.12345 > 10.0.0.2.12345: UDP, length 16
16:39:56.928899 IP 10.0.0.1.12345 > 10.0.0.2.12345: UDP, length 16
16:39:56.929537 IP 10.0.0.1.12345 > 10.0.0.2.12345: UDP, length 16
16:39:56.930176 IP 10.0.0.1.12345 > 10.0.0.2.12345: UDP, length 16
16:39:56.930815 IP 10.0.0.1.12345 > 10.0.0.2.12345: UDP, length 16
16:39:56.931454 IP 10.0.0.1.12345 > 10.0.0.2.12345: UDP, length 16
16:39:56.932093 IP 10.0.0.1.12345 > 10.0.0.2.12345: UDP, length 16
16:39:56.932735 IP 10.0.0.1.12345 > 10.0.0.2.12345: UDP, length 16
16:39:56.933375 IP 10.0.0.1.12345 > 10.0.0.2.12345: UDP, length 16
16:39:56.934015 IP 10.0.0.1.12345 > 10.0.0.2.12345: UDP, length 16
16:39:56.934654 IP 10.0.0.1.12345 > 10.0.0.2.12345: UDP, length 16
16:39:56.935295 IP 10.0.0.1.12345 > 10.0.0.2.12345: UDP, length 16
16:39:56.935933 IP 10.0.0.1.12345 > 10.0.0.2.12345: UDP, length 16
16:39:56.936574 IP 10.0.0.1.12345 > 10.0.0.2.12345: UDP, length 16
16:39:56.937213 IP 10.0.0.1.12345 > 10.0.0.2.12345: UDP, length 16
16:39:56.937851 IP 10.0.0.1.12345 > 10.0.0.2.12345: UDP, length 16
16:39:56.938490 IP 10.0.0.1.12345 > 10.0.0.2.12345: UDP, length 16
16:39:56.939102 IP 10.0.0.1.12345 > 10.0.0.2.12345: UDP, length 16
16:39:56.939739 IP 10.0.0.1.12345 > 10.0.0.2.12345: UDP, length 16
16:39:56.940381 IP 10.0.0.1.12345 > 10.0.0.2.12345: UDP, length 16
16:39:56.941020 IP 10.0.0.1.12345 > 10.0.0.2.12345: UDP, length 16
16:39:56.941659 IP 10.0.0.1.12345 > 10.0.0.2.12345: UDP, length 16
16:39:56.942301 IP 10.0.0.1.12345 > 10.0.0.2.12345: UDP, length 16
16:39:56.942939 IP 10.0.0.1.12345 > 10.0.0.2.12345: UDP, length 16
16:39:56.943578 IP 10.0.0.1.12345 > 10.0.0.2.12345: UDP, length 16
16:39:56.944224 IP 10.0.0.1.12345 > 10.0.0.2.12345: UDP, length 16
16:39:56.944898 IP 10.0.0.1.12345 > 10.0.0.2.12345: UDP, length 16
16:39:56.945538 IP 10.0.0.1.12345 > 10.0.0.2.12345: UDP, length 16
16:39:56.946176 IP 10.0.0.1.12345 > 10.0.0.2.12345: UDP, length 16
16:39:56.946815 IP 10.0.0.1.12345 > 10.0.0.2.12345: UDP, length 16
16:39:56.947456 IP 10.0.0.1.12345 > 10.0.0.2.12345: UDP, length 16
16:39:56.948094 IP 10.0.0.1.12345 > 10.0.0.2.12345: UDP, length 16
16:39:56.948736 IP 10.0.0.1.12345 > 10.0.0.2.12345: UDP, length 16
16:39:56.949375 IP 10.0.0.1.12345 > 10.0.0.2.12345: UDP, length 16
16:39:56.950015 IP 10.0.0.1.12345 > 10.0.0.2.12345: UDP, length 16
16:39:56.950653 IP 10.0.0.1.12345 > 10.0.0.2.12345: UDP, length 16
16:39:56.951293 IP 10.0.0.1.12345 > 10.0.0.2.12345: UDP, length 16
16:39:56.951932 IP 10.0.0.1.12345 > 10.0.0.2.12345: UDP, length 16
16:39:56.952574 IP 10.0.0.1.12345 > 10.0.0.2.12345: UDP, length 16
16:39:56.953213 IP 10.0.0.1.12345 > 10.0.0.2.12345: UDP, length 16
16:39:56.953851 IP 10.0.0.1.12345 > 10.0.0.2.12345: UDP, length 16
16:39:56.954491 IP 10.0.0.1.12345 > 10.0.0.2.12345: UDP, length 16
16:39:56.955130 IP 10.0.0.1.12345 > 10.0.0.2.12345: UDP, length 16
16:39:56.955768 IP 10.0.0.1.12345 > 10.0.0.2.12345: UDP, length 16
16:39:56.956409 IP 10.0.0.1.12345 > 10.0.0.2.12345: UDP, length 16
16:39:56.957049 IP 10.0.0.1.12345 > 10.0.0.2.12345: UDP, length 16
16:39:56.957689 IP 10.0.0.1.12345 > 10.0.0.2.12345: UDP, length 16
16:39:56.958328 IP 10.0.0.1.12345 > 10.0.0.2.12345: UDP, length 16
16:39:56.958967 IP 10.0.0.1.12345 > 10.0.0.2.12345: UDP, length 16
16:39:56.959606 IP 10.0.0.1.12345 > 10.0.0.2.12345: UDP, length 16
16:39:56.960276 IP 10.0.0.1.12345 > 10.0.0.2.12345: UDP, length 16
16:39:56.960917 IP 10.0.0.1.12345 > 10.0.0.2.12345: UDP, length 16
16:39:56.961556 IP 10.0.0.1.12345 > 10.0.0.2.12345: UDP, length 16
16:39:56.962194 IP 10.0.0.1.12345 > 10.0.0.2.12345: UDP, length 16
16:39:56.962832 IP 10.0.0.1.12345 > 10.0.0.2.12345: UDP, length 16
16:39:56.963470 IP 10.0.0.1.12345 > 10.0.0.2.12345: UDP, length 16
16:39:56.964109 IP 10.0.0.1.12345 > 10.0.0.2.12345: UDP, length 16
16:39:56.964748 IP 10.0.0.1.12345 > 10.0.0.2.12345: UDP, length 16
16:39:56.965390 IP 10.0.0.1.12345 > 10.0.0.2.12345: UDP, length 16
16:39:56.966029 IP 10.0.0.1.12345 > 10.0.0.2.12345: UDP, length 16
16:39:56.966667 IP 10.0.0.1.12345 > 10.0.0.2.12345: UDP, length 16
16:39:56.967307 IP 10.0.0.1.12345 > 10.0.0.2.12345: UDP, length 16
16:39:56.967946 IP 10.0.0.1.12345 > 10.0.0.2.12345: UDP, length 16
16:39:56.968586 IP 10.0.0.1.12345 > 10.0.0.2.12345: UDP, length 16
16:39:56.969224 IP 10.0.0.1.12345 > 10.0.0.2.12345: UDP, length 16
16:39:56.969863 IP 10.0.0.1.12345 > 10.0.0.2.12345: UDP, length 16
16:39:56.970502 IP 10.0.0.1.12345 > 10.0.0.2.12345: UDP, length 16
16:39:56.971141 IP 10.0.0.1.12345 > 10.0.0.2.12345: UDP, length 16
16:39:56.971781 IP 10.0.0.1.12345 > 10.0.0.2.12345: UDP, length 16
16:39:56.972422 IP 10.0.0.1.12345 > 10.0.0.2.12345: UDP, length 16
16:39:56.973061 IP 10.0.0.1.12345 > 10.0.0.2.12345: UDP, length 16
16:39:56.973700 IP 10.0.0.1.12345 > 10.0.0.2.12345: UDP, length 16
16:39:56.974340 IP 10.0.0.1.12345 > 10.0.0.2.12345: UDP, length 16
16:39:56.974982 IP 10.0.0.1.12345 > 10.0.0.2.12345: UDP, length 16
16:39:56.975621 IP 10.0.0.1.12345 > 10.0.0.2.12345: UDP, length 16
16:39:56.976262 IP 10.0.0.1.12345 > 10.0.0.2.12345: UDP, length 16
16:39:56.976901 IP 10.0.0.1.12345 > 10.0.0.2.12345: UDP, length 16
16:39:56.977539 IP 10.0.0.1.12345 > 10.0.0.2.12345: UDP, length 16
16:39:56.978179 IP 10.0.0.1.12345 > 10.0.0.2.12345: UDP, length 16
16:39:56.978818 IP 10.0.0.1.12345 > 10.0.0.2.12345: UDP, length 16
16:39:56.979458 IP 10.0.0.1.12345 > 10.0.0.2.12345: UDP, length 16
16:39:56.980098 IP 10.0.0.1.12345 > 10.0.0.2.12345: UDP, length 16
16:39:56.980739 IP 10.0.0.1.12345 > 10.0.0.2.12345: UDP, length 16
16:39:56.981378 IP 10.0.0.1.12345 > 10.0.0.2.12345: UDP, length 16
16:39:56.982017 IP 10.0.0.1.12345 > 10.0.0.2.12345: UDP, length 16
16:39:56.982656 IP 10.0.0.1.12345 > 10.0.0.2.12345: UDP, length 16
16:39:56.983296 IP 10.0.0.1.12345 > 10.0.0.2.12345: UDP, length 16
16:39:56.983934 IP 10.0.0.1.12345 > 10.0.0.2.12345: UDP, length 16
16:39:56.984575 IP 10.0.0.1.12345 > 10.0.0.2.12345: UDP, length 16
16:39:56.985215 IP 10.0.0.1.12345 > 10.0.0.2.12345: UDP, length 16
16:39:56.985853 IP 10.0.0.1.12345 > 10.0.0.2.12345: UDP, length 16
16:39:56.986493 IP 10.0.0.1.12345 > 10.0.0.2.12345: UDP, length 16
16:39:56.987132 IP 10.0.0.1.12345 > 10.0.0.2.12345: UDP, length 16
16:39:56.987771 IP 10.0.0.1.12345 > 10.0.0.2.12345: UDP, length 16
16:39:56.988416 IP 10.0.0.1.12345 > 10.0.0.2.12345: UDP, length 16
16:39:56.989054 IP 10.0.0.1.12345 > 10.0.0.2.12345: UDP, length 16
16:39:56.989694 IP 10.0.0.1.12345 > 10.0.0.2.12345: UDP, length 16
16:39:56.990333 IP 10.0.0.1.12345 > 10.0.0.2.12345: UDP, length 16
16:39:56.990973 IP 10.0.0.1.12345 > 10.0.0.2.12345: UDP, length 16
16:39:56.991613 IP 10.0.0.1.12345 > 10.0.0.2.12345: UDP, length 16
16:39:56.992281 IP 10.0.0.1.12345 > 10.0.0.2.12345: UDP, length 16
16:39:56.992919 IP 10.0.0.1.12345 > 10.0.0.2.12345: UDP, length 16
16:39:56.993558 IP 10.0.0.1.12345 > 10.0.0.2.12345: UDP, length 16
16:39:56.994197 IP 10.0.0.1.12345 > 10.0.0.2.12345: UDP, length 16
16:39:56.994837 IP 10.0.0.1.12345 > 10.0.0.2.12345: UDP, length 16
16:39:56.995475 IP 10.0.0.1.12345 > 10.0.0.2.12345: UDP, length 16
16:39:56.996114 IP 10.0.0.1.12345 > 10.0.0.2.12345: UDP, length 16
16:39:56.996753 IP 10.0.0.1.12345 > 10.0.0.2.12345: UDP, length 16
16:39:56.997392 IP 10.0.0.1.12345 > 10.0.0.2.12345: UDP, length 16
16:39:56.998030 IP 10.0.0.1.12345 > 10.0.0.2.12345: UDP, length 16

