17:46:50.997431 IP 10.0.0.1.12345 > 10.0.0.2.12345: UDP, length 16
17:46:50.997945 IP 10.0.0.1.12345 > 10.0.0.2.12345: UDP, length 16
17:46:50.998549 IP 10.0.0.1.12345 > 10.0.0.2.12345: UDP, length 16
17:46:50.999151 IP 10.0.0.1.12345 > 10.0.0.2.12345: UDP, length 16
17:46:50.999776 IP 10.0.0.1.12345 > 10.0.0.2.12345: UDP, length 16
17:46:51.000356 IP 10.0.0.1.12345 > 10.0.0.2.12345: UDP, length 16
17:46:51.001000 IP 10.0.0.1.12345 > 10.0.0.2.12345: UDP, length 16
17:46:51.001632 IP 10.0.0.1.12345 > 10.0.0.2.12345: UDP, length 16
17:46:51.002264 IP 10.0.0.1.12345 > 10.0.0.2.12345: UDP, length 16
17:46:51.002897 IP 10.0.0.1.12345 > 10.0.0.2.12345: UDP, length 16
17:46:51.003522 IP 10.0.0.1.12345 > 10.0.0.2.12345: UDP, length 16
17:46:51.004163 IP 10.0.0.1.12345 > 10.0.0.2.12345: UDP, length 16
17:46:51.004781 IP 10.0.0.1.12345 > 10.0.0.2.12345: UDP, length 16
17:46:51.005425 IP 10.0.0.1.12345 > 10.0.0.2.12345: UDP, length 16
17:46:51.006072 IP 10.0.0.1.12345 > 10.0.0.2.12345: UDP, length 16
17:46:51.006721 IP 10.0.0.1.12345 > 10.0.0.2.12345: UDP, length 16
17:46:51.007368 IP 10.0.0.1.12345 > 10.0.0.2.12345: UDP, length 16
17:46:51.008016 IP 10.0.0.1.12345 > 10.0.0.2.12345: UDP, length 16
17:46:51.008633 IP 10.0.0.1.12345 > 10.0.0.2.12345: UDP, length 16
17:46:51.009283 IP 10.0.0.1.12345 > 10.0.0.2.12345: UDP, length 16
17:46:51.009898 IP 10.0.0.1.12345 > 10.0.0.2.12345: UDP, length 16
17:46:51.010536 IP 10.0.0.1.12345 > 10.0.0.2.12345: UDP, length 16
17:46:51.011171 IP 10.0.0.1.12345 > 10.0.0.2.12345: UDP, length 16
17:46:51.011804 IP 10.0.0.1.12345 > 10.0.0.2.12345: UDP, length 16
17:46:51.012403 IP 10.0.0.1.12345 > 10.0.0.2.12345: UDP, length 16
17:46:51.013013 IP 10.0.0.1.12345 > 10.0.0.2.12345: UDP, length 16
17:46:51.013642 IP 10.0.0.1.12345 > 10.0.0.2.12345: UDP, length 16
17:46:51.014271 IP 10.0.0.1.12345 > 10.0.0.2.12345: UDP, length 16
17:46:51.014902 IP 10.0.0.1.12345 > 10.0.0.2.12345: UDP, length 16
17:46:51.015532 IP 10.0.0.1.12345 > 10.0.0.2.12345: UDP, length 16
17:46:51.016162 IP 10.0.0.1.12345 > 10.0.0.2.12345: UDP, length 16
17:46:51.016761 IP 10.0.0.1.12345 > 10.0.0.2.12345: UDP, length 16
17:46:51.017390 IP 10.0.0.1.12345 > 10.0.0.2.12345: UDP, length 16
17:46:51.017989 IP 10.0.0.1.12345 > 10.0.0.2.12345: UDP, length 16
17:46:51.018616 IP 10.0.0.1.12345 > 10.0.0.2.12345: UDP, length 16
17:46:51.019245 IP 10.0.0.1.12345 > 10.0.0.2.12345: UDP, length 16
17:46:51.019875 IP 10.0.0.1.12345 > 10.0.0.2.12345: UDP, length 16
17:46:51.020493 IP 10.0.0.1.12345 > 10.0.0.2.12345: UDP, length 16
17:46:51.021137 IP 10.0.0.1.12345 > 10.0.0.2.12345: UDP, length 16
17:46:51.021785 IP 10.0.0.1.12345 > 10.0.0.2.12345: UDP, length 16
17:46:51.022433 IP 10.0.0.1.12345 > 10.0.0.2.12345: UDP, length 16
17:46:51.023081 IP 10.0.0.1.12345 > 10.0.0.2.12345: UDP, length 16
17:46:51.023727 IP 10.0.0.1.12345 > 10.0.0.2.12345: UDP, length 16
17:46:51.024324 IP 10.0.0.1.12345 > 10.0.0.2.12345: UDP, length 16
17:46:51.024969 IP 10.0.0.1.12345 > 10.0.0.2.12345: UDP, length 16
17:46:51.025615 IP 10.0.0.1.12345 > 10.0.0.2.12345: UDP, length 16
17:46:51.026280 IP 10.0.0.1.12345 > 10.0.0.2.12345: UDP, length 16
17:46:51.026940 IP 10.0.0.1.12345 > 10.0.0.2.12345: UDP, length 16
17:46:51.027605 IP 10.0.0.1.12345 > 10.0.0.2.12345: UDP, length 16
17:46:51.028329 IP 10.0.0.1.12345 > 10.0.0.2.12345: UDP, length 16
17:46:51.028991 IP 10.0.0.1.12345 > 10.0.0.2.12345: UDP, length 16
17:46:51.029653 IP 10.0.0.1.12345 > 10.0.0.2.12345: UDP, length 16
17:46:51.030315 IP 10.0.0.1.12345 > 10.0.0.2.12345: UDP, length 16
17:46:51.030962 IP 10.0.0.1.12345 > 10.0.0.2.12345: UDP, length 16
17:46:51.031624 IP 10.0.0.1.12345 > 10.0.0.2.12345: UDP, length 16
17:46:51.032329 IP 10.0.0.1.12345 > 10.0.0.2.12345: UDP, length 16
17:46:51.032973 IP 10.0.0.1.12345 > 10.0.0.2.12345: UDP, length 16
17:46:51.033635 IP 10.0.0.1.12345 > 10.0.0.2.12345: UDP, length 16
17:46:51.034296 IP 10.0.0.1.12345 > 10.0.0.2.12345: UDP, length 16
17:46:51.034959 IP 10.0.0.1.12345 > 10.0.0.2.12345: UDP, length 16
17:46:51.035621 IP 10.0.0.1.12345 > 10.0.0.2.12345: UDP, length 16
17:46:51.036355 IP 10.0.0.1.12345 > 10.0.0.2.12345: UDP, length 16
17:46:51.037021 IP 10.0.0.1.12345 > 10.0.0.2.12345: UDP, length 16
17:46:51.037693 IP 10.0.0.1.12345 > 10.0.0.2.12345: UDP, length 16
17:46:51.038358 IP 10.0.0.1.12345 > 10.0.0.2.12345: UDP, length 16
17:46:51.039023 IP 10.0.0.1.12345 > 10.0.0.2.12345: UDP, length 16
17:46:51.039689 IP 10.0.0.1.12345 > 10.0.0.2.12345: UDP, length 16
17:46:51.040335 IP 10.0.0.1.12345 > 10.0.0.2.12345: UDP, length 16
17:46:51.041000 IP 10.0.0.1.12345 > 10.0.0.2.12345: UDP, length 16
17:46:51.041665 IP 10.0.0.1.12345 > 10.0.0.2.12345: UDP, length 16
17:46:51.042330 IP 10.0.0.1.12345 > 10.0.0.2.12345: UDP, length 16
17:46:51.042994 IP 10.0.0.1.12345 > 10.0.0.2.12345: UDP, length 16
17:46:51.043657 IP 10.0.0.1.12345 > 10.0.0.2.12345: UDP, length 16
17:46:51.044335 IP 10.0.0.1.12345 > 10.0.0.2.12345: UDP, length 16
17:46:51.044968 IP 10.0.0.1.12345 > 10.0.0.2.12345: UDP, length 16
17:46:51.045629 IP 10.0.0.1.12345 > 10.0.0.2.12345: UDP, length 16
17:46:51.046292 IP 10.0.0.1.12345 > 10.0.0.2.12345: UDP, length 16
17:46:51.046942 IP 10.0.0.1.12345 > 10.0.0.2.12345: UDP, length 16
17:46:51.047591 IP 10.0.0.1.12345 > 10.0.0.2.12345: UDP, length 16
17:46:51.048281 IP 10.0.0.1.12345 > 10.0.0.2.12345: UDP, length 16
17:46:51.048911 IP 10.0.0.1.12345 > 10.0.0.2.12345: UDP, length 16
17:46:51.049567 IP 10.0.0.1.12345 > 10.0.0.2.12345: UDP, length 16
17:46:51.050221 IP 10.0.0.1.12345 > 10.0.0.2.12345: UDP, length 16
17:46:51.050876 IP 10.0.0.1.12345 > 10.0.0.2.12345: UDP, length 16
17:46:51.051531 IP 10.0.0.1.12345 > 10.0.0.2.12345: UDP, length 16
17:46:51.052184 IP 10.0.0.1.12345 > 10.0.0.2.12345: UDP, length 16
17:46:51.052802 IP 10.0.0.1.12345 > 10.0.0.2.12345: UDP, length 16
17:46:51.053456 IP 10.0.0.1.12345 > 10.0.0.2.12345: UDP, length 16
17:46:51.054112 IP 10.0.0.1.12345 > 10.0.0.2.12345: UDP, length 16
17:46:51.054767 IP 10.0.0.1.12345 > 10.0.0.2.12345: UDP, length 16
17:46:51.055420 IP 10.0.0.1.12345 > 10.0.0.2.12345: UDP, length 16
17:46:51.056075 IP 10.0.0.1.12345 > 10.0.0.2.12345: UDP, length 16
17:46:51.056735 IP 10.0.0.1.12345 > 10.0.0.2.12345: UDP, length 16
17:46:51.057393 IP 10.0.0.1.12345 > 10.0.0.2.12345: UDP, length 16
17:46:51.058054 IP 10.0.0.1.12345 > 10.0.0.2.12345: UDP, length 16
17:46:51.058713 IP 10.0.0.1.12345 > 10.0.0.2.12345: UDP, length 16
17:46:51.059372 IP 10.0.0.1.12345 > 10.0.0.2.12345: UDP, length 16
17:46:51.060034 IP 10.0.0.1.12345 > 10.0.0.2.12345: UDP, length 16
17:46:51.060655 IP 10.0.0.1.12345 > 10.0.0.2.12345: UDP, length 16
17:46:51.061261 IP 10.0.0.1.12345 > 10.0.0.2.12345: UDP, length 16
17:46:51.061865 IP 10.0.0.1.12345 > 10.0.0.2.12345: UDP, length 16
17:46:51.062464 IP 10.0.0.1.12345 > 10.0.0.2.12345: UDP, length 16
17:46:51.063053 IP 10.0.0.1.12345 > 10.0.0.2.12345: UDP, length 16
17:46:51.063667 IP 10.0.0.1.12345 > 10.0.0.2.12345: UDP, length 16
17:46:51.064279 IP 10.0.0.1.12345 > 10.0.0.2.12345: UDP, length 16
17:46:51.064864 IP 10.0.0.1.12345 > 10.0.0.2.12345: UDP, length 16
17:46:51.065450 IP 10.0.0.1.12345 > 10.0.0.2.12345: UDP, length 16
17:46:51.066037 IP 10.0.0.1.12345 > 10.0.0.2.12345: UDP, length 16
17:46:51.066626 IP 10.0.0.1.12345 > 10.0.0.2.12345: UDP, length 16
17:46:51.067237 IP 10.0.0.1.12345 > 10.0.0.2.12345: UDP, length 16
17:46:51.067851 IP 10.0.0.1.12345 > 10.0.0.2.12345: UDP, length 16
17:46:51.068436 IP 10.0.0.1.12345 > 10.0.0.2.12345: UDP, length 16
17:46:51.069034 IP 10.0.0.1.12345 > 10.0.0.2.12345: UDP, length 16
17:46:51.069634 IP 10.0.0.1.12345 > 10.0.0.2.12345: UDP, length 16
17:46:51.070228 IP 10.0.0.1.12345 > 10.0.0.2.12345: UDP, length 16
17:46:51.070838 IP 10.0.0.1.12345 > 10.0.0.2.12345: UDP, length 16
17:46:51.071449 IP 10.0.0.1.12345 > 10.0.0.2.12345: UDP, length 16
17:46:51.072058 IP 10.0.0.1.12345 > 10.0.0.2.12345: UDP, length 16
17:46:51.072653 IP 10.0.0.1.12345 > 10.0.0.2.12345: UDP, length 16
17:46:51.073225 IP 10.0.0.1.12345 > 10.0.0.2.12345: UDP, length 16
17:46:51.073834 IP 10.0.0.1.12345 > 10.0.0.2.12345: UDP, length 16
17:46:51.074445 IP 10.0.0.1.12345 > 10.0.0.2.12345: UDP, length 16
17:46:51.075056 IP 10.0.0.1.12345 > 10.0.0.2.12345: UDP, length 16
17:46:51.075666 IP 10.0.0.1.12345 > 10.0.0.2.12345: UDP, length 16
17:46:51.076268 IP 10.0.0.1.12345 > 10.0.0.2.12345: UDP, length 16
17:46:51.076878 IP 10.0.0.1.12345 > 10.0.0.2.12345: UDP, length 16
17:46:51.077488 IP 10.0.0.1.12345 > 10.0.0.2.12345: UDP, length 16
17:46:51.078101 IP 10.0.0.1.12345 > 10.0.0.2.12345: UDP, length 16
17:46:51.078710 IP 10.0.0.1.12345 > 10.0.0.2.12345: UDP, length 16
17:46:51.079306 IP 10.0.0.1.12345 > 10.0.0.2.12345: UDP, length 16
17:46:51.079916 IP 10.0.0.1.12345 > 10.0.0.2.12345: UDP, length 16
17:46:51.080513 IP 10.0.0.1.12345 > 10.0.0.2.12345: UDP, length 16
17:46:51.081089 IP 10.0.0.1.12345 > 10.0.0.2.12345: UDP, length 16
17:46:51.081699 IP 10.0.0.1.12345 > 10.0.0.2.12345: UDP, length 16
17:46:51.082288 IP 10.0.0.1.12345 > 10.0.0.2.12345: UDP, length 16
17:46:51.082882 IP 10.0.0.1.12345 > 10.0.0.2.12345: UDP, length 16
17:46:51.083477 IP 10.0.0.1.12345 > 10.0.0.2.12345: UDP, length 16
17:46:51.084069 IP 10.0.0.1.12345 > 10.0.0.2.12345: UDP, length 16
17:46:51.084648 IP 10.0.0.1.12345 > 10.0.0.2.12345: UDP, length 16
17:46:51.085236 IP 10.0.0.1.12345 > 10.0.0.2.12345: UDP, length 16
17:46:51.085826 IP 10.0.0.1.12345 > 10.0.0.2.12345: UDP, length 16
17:46:51.086411 IP 10.0.0.1.12345 > 10.0.0.2.12345: UDP, length 16
17:46:51.087012 IP 10.0.0.1.12345 > 10.0.0.2.12345: UDP, length 16
17:46:51.087623 IP 10.0.0.1.12345 > 10.0.0.2.12345: UDP, length 16
17:46:51.088253 IP 10.0.0.1.12345 > 10.0.0.2.12345: UDP, length 16
17:46:51.088865 IP 10.0.0.1.12345 > 10.0.0.2.12345: UDP, length 16
17:46:51.089476 IP 10.0.0.1.12345 > 10.0.0.2.12345: UDP, length 16
17:46:51.090089 IP 10.0.0.1.12345 > 10.0.0.2.12345: UDP, length 16
17:46:51.090700 IP 10.0.0.1.12345 > 10.0.0.2.12345: UDP, length 16
17:46:51.091311 IP 10.0.0.1.12345 > 10.0.0.2.12345: UDP, length 16
17:46:51.091923 IP 10.0.0.1.12345 > 10.0.0.2.12345: UDP, length 16
17:46:51.092535 IP 10.0.0.1.12345 > 10.0.0.2.12345: UDP, length 16
17:46:51.093148 IP 10.0.0.1.12345 > 10.0.0.2.12345: UDP, length 16
17:46:51.093759 IP 10.0.0.1.12345 > 10.0.0.2.12345: UDP, length 16
17:46:51.094372 IP 10.0.0.1.12345 > 10.0.0.2.12345: UDP, length 16
17:46:51.094987 IP 10.0.0.1.12345 > 10.0.0.2.12345: UDP, length 16
17:46:51.095600 IP 10.0.0.1.12345 > 10.0.0.2.12345: UDP, length 16
17:46:51.096211 IP 10.0.0.1.12345 > 10.0.0.2.12345: UDP, length 16
17:46:51.096823 IP 10.0.0.1.12345 > 10.0.0.2.12345: UDP, length 16
17:46:51.097434 IP 10.0.0.1.12345 > 10.0.0.2.12345: UDP, length 16
17:46:51.098062 IP 10.0.0.1.12345 > 10.0.0.2.12345: UDP, length 16
17:46:51.098680 IP 10.0.0.1.12345 > 10.0.0.2.12345: UDP, length 16
17:46:51.099299 IP 10.0.0.1.12345 > 10.0.0.2.12345: UDP, length 16
17:46:51.099917 IP 10.0.0.1.12345 > 10.0.0.2.12345: UDP, length 16
17:46:51.100536 IP 10.0.0.1.12345 > 10.0.0.2.12345: UDP, length 16
17:46:51.101159 IP 10.0.0.1.12345 > 10.0.0.2.12345: UDP, length 16
17:46:51.101777 IP 10.0.0.1.12345 > 10.0.0.2.12345: UDP, length 16
17:46:51.102397 IP 10.0.0.1.12345 > 10.0.0.2.12345: UDP, length 16
17:46:51.103016 IP 10.0.0.1.12345 > 10.0.0.2.12345: UDP, length 16
17:46:51.103634 IP 10.0.0.1.12345 > 10.0.0.2.12345: UDP, length 16
17:46:51.104255 IP 10.0.0.1.12345 > 10.0.0.2.12345: UDP, length 16
17:46:51.104874 IP 10.0.0.1.12345 > 10.0.0.2.12345: UDP, length 16
17:46:51.105496 IP 10.0.0.1.12345 > 10.0.0.2.12345: UDP, length 16
17:46:51.106116 IP 10.0.0.1.12345 > 10.0.0.2.12345: UDP, length 16
17:46:51.106734 IP 10.0.0.1.12345 > 10.0.0.2.12345: UDP, length 16
17:46:51.107338 IP 10.0.0.1.12345 > 10.0.0.2.12345: UDP, length 16
17:46:51.107941 IP 10.0.0.1.12345 > 10.0.0.2.12345: UDP, length 16
17:46:51.108560 IP 10.0.0.1.12345 > 10.0.0.2.12345: UDP, length 16
17:46:51.109182 IP 10.0.0.1.12345 > 10.0.0.2.12345: UDP, length 16
17:46:51.109800 IP 10.0.0.1.12345 > 10.0.0.2.12345: UDP, length 16
17:46:51.110419 IP 10.0.0.1.12345 > 10.0.0.2.12345: UDP, length 16
17:46:51.111038 IP 10.0.0.1.12345 > 10.0.0.2.12345: UDP, length 16
17:46:51.111656 IP 10.0.0.1.12345 > 10.0.0.2.12345: UDP, length 16
17:46:51.112282 IP 10.0.0.1.12345 > 10.0.0.2.12345: UDP, length 16
17:46:51.112902 IP 10.0.0.1.12345 > 10.0.0.2.12345: UDP, length 16
17:46:51.113520 IP 10.0.0.1.12345 > 10.0.0.2.12345: UDP, length 16
17:46:51.114139 IP 10.0.0.1.12345 > 10.0.0.2.12345: UDP, length 16
17:46:51.114757 IP 10.0.0.1.12345 > 10.0.0.2.12345: UDP, length 16
17:46:51.115361 IP 10.0.0.1.12345 > 10.0.0.2.12345: UDP, length 16
17:46:51.115980 IP 10.0.0.1.12345 > 10.0.0.2.12345: UDP, length 16
17:46:51.116610 IP 10.0.0.1.12345 > 10.0.0.2.12345: UDP, length 16
17:46:51.117240 IP 10.0.0.1.12345 > 10.0.0.2.12345: UDP, length 16
17:46:51.117869 IP 10.0.0.1.12345 > 10.0.0.2.12345: UDP, length 16
17:46:51.118500 IP 10.0.0.1.12345 > 10.0.0.2.12345: UDP, length 16
17:46:51.119130 IP 10.0.0.1.12345 > 10.0.0.2.12345: UDP, length 16
17:46:51.119761 IP 10.0.0.1.12345 > 10.0.0.2.12345: UDP, length 16
17:46:51.120394 IP 10.0.0.1.12345 > 10.0.0.2.12345: UDP, length 16
17:46:51.121023 IP 10.0.0.1.12345 > 10.0.0.2.12345: UDP, length 16
17:46:51.121655 IP 10.0.0.1.12345 > 10.0.0.2.12345: UDP, length 16
17:46:51.122285 IP 10.0.0.1.12345 > 10.0.0.2.12345: UDP, length 16
17:46:51.122914 IP 10.0.0.1.12345 > 10.0.0.2.12345: UDP, length 16
17:46:51.123545 IP 10.0.0.1.12345 > 10.0.0.2.12345: UDP, length 16
17:46:51.124174 IP 10.0.0.1.12345 > 10.0.0.2.12345: UDP, length 16
17:46:51.124805 IP 10.0.0.1.12345 > 10.0.0.2.12345: UDP, length 16
17:46:51.125433 IP 10.0.0.1.12345 > 10.0.0.2.12345: UDP, length 16
17:46:51.126063 IP 10.0.0.1.12345 > 10.0.0.2.12345: UDP, length 16
17:46:51.126691 IP 10.0.0.1.12345 > 10.0.0.2.12345: UDP, length 16
17:46:51.127319 IP 10.0.0.1.12345 > 10.0.0.2.12345: UDP, length 16
17:46:51.127947 IP 10.0.0.1.12345 > 10.0.0.2.12345: UDP, length 16
17:46:51.128550 IP 10.0.0.1.12345 > 10.0.0.2.12345: UDP, length 16
17:46:51.129177 IP 10.0.0.1.12345 > 10.0.0.2.12345: UDP, length 16
17:46:51.129805 IP 10.0.0.1.12345 > 10.0.0.2.12345: UDP, length 16
17:46:51.130433 IP 10.0.0.1.12345 > 10.0.0.2.12345: UDP, length 16
17:46:51.131061 IP 10.0.0.1.12345 > 10.0.0.2.12345: UDP, length 16
17:46:51.131690 IP 10.0.0.1.12345 > 10.0.0.2.12345: UDP, length 16
17:46:51.132322 IP 10.0.0.1.12345 > 10.0.0.2.12345: UDP, length 16
17:46:51.132947 IP 10.0.0.1.12345 > 10.0.0.2.12345: UDP, length 16
17:46:51.133577 IP 10.0.0.1.12345 > 10.0.0.2.12345: UDP, length 16
17:46:51.134207 IP 10.0.0.1.12345 > 10.0.0.2.12345: UDP, length 16
17:46:51.134839 IP 10.0.0.1.12345 > 10.0.0.2.12345: UDP, length 16
17:46:51.135471 IP 10.0.0.1.12345 > 10.0.0.2.12345: UDP, length 16
17:46:51.136100 IP 10.0.0.1.12345 > 10.0.0.2.12345: UDP, length 16
17:46:51.136728 IP 10.0.0.1.12345 > 10.0.0.2.12345: UDP, length 16
17:46:51.137358 IP 10.0.0.1.12345 > 10.0.0.2.12345: UDP, length 16
17:46:51.137987 IP 10.0.0.1.12345 > 10.0.0.2.12345: UDP, length 16
17:46:51.138617 IP 10.0.0.1.12345 > 10.0.0.2.12345: UDP, length 16
17:46:51.139247 IP 10.0.0.1.12345 > 10.0.0.2.12345: UDP, length 16
17:46:51.139876 IP 10.0.0.1.12345 > 10.0.0.2.12345: UDP, length 16
17:46:51.140506 IP 10.0.0.1.12345 > 10.0.0.2.12345: UDP, length 16
17:46:51.141136 IP 10.0.0.1.12345 > 10.0.0.2.12345: UDP, length 16
17:46:51.141765 IP 10.0.0.1.12345 > 10.0.0.2.12345: UDP, length 16
17:46:51.142395 IP 10.0.0.1.12345 > 10.0.0.2.12345: UDP, length 16
17:46:51.143024 IP 10.0.0.1.12345 > 10.0.0.2.12345: UDP, length 16
17:46:51.143654 IP 10.0.0.1.12345 > 10.0.0.2.12345: UDP, length 16
17:46:51.144293 IP 10.0.0.1.12345 > 10.0.0.2.12345: UDP, length 16
17:46:51.144924 IP 10.0.0.1.12345 > 10.0.0.2.12345: UDP, length 16
17:46:51.145553 IP 10.0.0.1.12345 > 10.0.0.2.12345: UDP, length 16
17:46:51.146182 IP 10.0.0.1.12345 > 10.0.0.2.12345: UDP, length 16
17:46:51.146810 IP 10.0.0.1.12345 > 10.0.0.2.12345: UDP, length 16
17:46:51.147453 IP 10.0.0.1.12345 > 10.0.0.2.12345: UDP, length 16
17:46:51.148082 IP 10.0.0.1.12345 > 10.0.0.2.12345: UDP, length 16
17:46:51.148713 IP 10.0.0.1.12345 > 10.0.0.2.12345: UDP, length 16
17:46:51.149342 IP 10.0.0.1.12345 > 10.0.0.2.12345: UDP, length 16
17:46:51.149971 IP 10.0.0.1.12345 > 10.0.0.2.12345: UDP, length 16
17:46:51.150600 IP 10.0.0.1.12345 > 10.0.0.2.12345: UDP, length 16
17:46:51.151230 IP 10.0.0.1.12345 > 10.0.0.2.12345: UDP, length 16
17:46:51.151859 IP 10.0.0.1.12345 > 10.0.0.2.12345: UDP, length 16
17:46:51.152489 IP 10.0.0.1.12345 > 10.0.0.2.12345: UDP, length 16
17:46:51.153118 IP 10.0.0.1.12345 > 10.0.0.2.12345: UDP, length 16
17:46:51.153748 IP 10.0.0.1.12345 > 10.0.0.2.12345: UDP, length 16
17:46:51.154378 IP 10.0.0.1.12345 > 10.0.0.2.12345: UDP, length 16
17:46:51.155008 IP 10.0.0.1.12345 > 10.0.0.2.12345: UDP, length 16
17:46:51.155638 IP 10.0.0.1.12345 > 10.0.0.2.12345: UDP, length 16
17:46:51.156278 IP 10.0.0.1.12345 > 10.0.0.2.12345: UDP, length 16
17:46:51.156909 IP 10.0.0.1.12345 > 10.0.0.2.12345: UDP, length 16
17:46:51.157540 IP 10.0.0.1.12345 > 10.0.0.2.12345: UDP, length 16
17:46:51.158169 IP 10.0.0.1.12345 > 10.0.0.2.12345: UDP, length 16
17:46:51.158799 IP 10.0.0.1.12345 > 10.0.0.2.12345: UDP, length 16
17:46:51.159429 IP 10.0.0.1.12345 > 10.0.0.2.12345: UDP, length 16
17:46:51.160058 IP 10.0.0.1.12345 > 10.0.0.2.12345: UDP, length 16
17:46:51.160688 IP 10.0.0.1.12345 > 10.0.0.2.12345: UDP, length 16
17:46:51.161320 IP 10.0.0.1.12345 > 10.0.0.2.12345: UDP, length 16
17:46:51.161949 IP 10.0.0.1.12345 > 10.0.0.2.12345: UDP, length 16
17:46:51.162579 IP 10.0.0.1.12345 > 10.0.0.2.12345: UDP, length 16
17:46:51.163208 IP 10.0.0.1.12345 > 10.0.0.2.12345: UDP, length 16
17:46:51.163840 IP 10.0.0.1.12345 > 10.0.0.2.12345: UDP, length 16
17:46:51.164470 IP 10.0.0.1.12345 > 10.0.0.2.12345: UDP, length 16
17:46:51.165099 IP 10.0.0.1.12345 > 10.0.0.2.12345: UDP, length 16
17:46:51.165728 IP 10.0.0.1.12345 > 10.0.0.2.12345: UDP, length 16
17:46:51.166360 IP 10.0.0.1.12345 > 10.0.0.2.12345: UDP, length 16
17:46:51.166990 IP 10.0.0.1.12345 > 10.0.0.2.12345: UDP, length 16
17:46:51.167605 IP 10.0.0.1.12345 > 10.0.0.2.12345: UDP, length 16
17:46:51.168264 IP 10.0.0.1.12345 > 10.0.0.2.12345: UDP, length 16
17:46:51.168894 IP 10.0.0.1.12345 > 10.0.0.2.12345: UDP, length 16
17:46:51.169525 IP 10.0.0.1.12345 > 10.0.0.2.12345: UDP, length 16
17:46:51.170155 IP 10.0.0.1.12345 > 10.0.0.2.12345: UDP, length 16
17:46:51.170786 IP 10.0.0.1.12345 > 10.0.0.2.12345: UDP, length 16
17:46:51.171417 IP 10.0.0.1.12345 > 10.0.0.2.12345: UDP, length 16
17:46:51.172046 IP 10.0.0.1.12345 > 10.0.0.2.12345: UDP, length 16
17:46:51.172676 IP 10.0.0.1.12345 > 10.0.0.2.12345: UDP, length 16
17:46:51.173306 IP 10.0.0.1.12345 > 10.0.0.2.12345: UDP, length 16
17:46:51.173937 IP 10.0.0.1.12345 > 10.0.0.2.12345: UDP, length 16
17:46:51.174566 IP 10.0.0.1.12345 > 10.0.0.2.12345: UDP, length 16
17:46:51.175195 IP 10.0.0.1.12345 > 10.0.0.2.12345: UDP, length 16
17:46:51.175823 IP 10.0.0.1.12345 > 10.0.0.2.12345: UDP, length 16
17:46:51.176453 IP 10.0.0.1.12345 > 10.0.0.2.12345: UDP, length 16
17:46:51.177083 IP 10.0.0.1.12345 > 10.0.0.2.12345: UDP, length 16
17:46:51.177712 IP 10.0.0.1.12345 > 10.0.0.2.12345: UDP, length 16
17:46:51.178342 IP 10.0.0.1.12345 > 10.0.0.2.12345: UDP, length 16
17:46:51.178972 IP 10.0.0.1.12345 > 10.0.0.2.12345: UDP, length 16
17:46:51.179601 IP 10.0.0.1.12345 > 10.0.0.2.12345: UDP, length 16
17:46:51.180255 IP 10.0.0.1.12345 > 10.0.0.2.12345: UDP, length 16
17:46:51.180884 IP 10.0.0.1.12345 > 10.0.0.2.12345: UDP, length 16
17:46:51.181513 IP 10.0.0.1.12345 > 10.0.0.2.12345: UDP, length 16
17:46:51.182146 IP 10.0.0.1.12345 > 10.0.0.2.12345: UDP, length 16
17:46:51.182763 IP 10.0.0.1.12345 > 10.0.0.2.12345: UDP, length 16
17:46:51.183380 IP 10.0.0.1.12345 > 10.0.0.2.12345: UDP, length 16
17:46:51.183994 IP 10.0.0.1.12345 > 10.0.0.2.12345: UDP, length 16
17:46:51.184610 IP 10.0.0.1.12345 > 10.0.0.2.12345: UDP, length 16
17:46:51.185224 IP 10.0.0.1.12345 > 10.0.0.2.12345: UDP, length 16
17:46:51.185824 IP 10.0.0.1.12345 > 10.0.0.2.12345: UDP, length 16
17:46:51.186438 IP 10.0.0.1.12345 > 10.0.0.2.12345: UDP, length 16
17:46:51.187053 IP 10.0.0.1.12345 > 10.0.0.2.12345: UDP, length 16
17:46:51.187668 IP 10.0.0.1.12345 > 10.0.0.2.12345: UDP, length 16
17:46:51.188283 IP 10.0.0.1.12345 > 10.0.0.2.12345: UDP, length 16
17:46:51.188898 IP 10.0.0.1.12345 > 10.0.0.2.12345: UDP, length 16
17:46:51.189509 IP 10.0.0.1.12345 > 10.0.0.2.12345: UDP, length 16
17:46:51.190109 IP 10.0.0.1.12345 > 10.0.0.2.12345: UDP, length 16
17:46:51.190734 IP 10.0.0.1.12345 > 10.0.0.2.12345: UDP, length 16
17:46:51.191361 IP 10.0.0.1.12345 > 10.0.0.2.12345: UDP, length 16
17:46:51.191990 IP 10.0.0.1.12345 > 10.0.0.2.12345: UDP, length 16
17:46:51.192620 IP 10.0.0.1.12345 > 10.0.0.2.12345: UDP, length 16
17:46:51.193248 IP 10.0.0.1.12345 > 10.0.0.2.12345: UDP, length 16
17:46:51.193877 IP 10.0.0.1.12345 > 10.0.0.2.12345: UDP, length 16
17:46:51.194502 IP 10.0.0.1.12345 > 10.0.0.2.12345: UDP, length 16
17:46:51.195114 IP 10.0.0.1.12345 > 10.0.0.2.12345: UDP, length 16
17:46:51.195726 IP 10.0.0.1.12345 > 10.0.0.2.12345: UDP, length 16
17:46:51.196336 IP 10.0.0.1.12345 > 10.0.0.2.12345: UDP, length 16
17:46:51.196948 IP 10.0.0.1.12345 > 10.0.0.2.12345: UDP, length 16
17:46:51.197560 IP 10.0.0.1.12345 > 10.0.0.2.12345: UDP, length 16
17:46:51.198170 IP 10.0.0.1.12345 > 10.0.0.2.12345: UDP, length 16
17:46:51.198781 IP 10.0.0.1.12345 > 10.0.0.2.12345: UDP, length 16
17:46:51.199396 IP 10.0.0.1.12345 > 10.0.0.2.12345: UDP, length 16
17:46:51.200008 IP 10.0.0.1.12345 > 10.0.0.2.12345: UDP, length 16
17:46:51.200626 IP 10.0.0.1.12345 > 10.0.0.2.12345: UDP, length 16
17:46:51.201238 IP 10.0.0.1.12345 > 10.0.0.2.12345: UDP, length 16
17:46:51.201849 IP 10.0.0.1.12345 > 10.0.0.2.12345: UDP, length 16
17:46:51.202465 IP 10.0.0.1.12345 > 10.0.0.2.12345: UDP, length 16
17:46:51.203076 IP 10.0.0.1.12345 > 10.0.0.2.12345: UDP, length 16
17:46:51.203687 IP 10.0.0.1.12345 > 10.0.0.2.12345: UDP, length 16
17:46:51.204288 IP 10.0.0.1.12345 > 10.0.0.2.12345: UDP, length 16
17:46:51.204899 IP 10.0.0.1.12345 > 10.0.0.2.12345: UDP, length 16
17:46:51.205510 IP 10.0.0.1.12345 > 10.0.0.2.12345: UDP, length 16
17:46:51.206114 IP 10.0.0.1.12345 > 10.0.0.2.12345: UDP, length 16
17:46:51.206709 IP 10.0.0.1.12345 > 10.0.0.2.12345: UDP, length 16
17:46:51.207306 IP 10.0.0.1.12345 > 10.0.0.2.12345: UDP, length 16
17:46:51.207905 IP 10.0.0.1.12345 > 10.0.0.2.12345: UDP, length 16
17:46:51.208517 IP 10.0.0.1.12345 > 10.0.0.2.12345: UDP, length 16
17:46:51.209132 IP 10.0.0.1.12345 > 10.0.0.2.12345: UDP, length 16
17:46:51.211019 IP 10.0.0.1.12345 > 10.0.0.2.12345: UDP, length 16
17:46:51.211629 IP 10.0.0.1.12345 > 10.0.0.2.12345: UDP, length 16
17:46:51.212224 IP 10.0.0.1.12345 > 10.0.0.2.12345: UDP, length 16
17:46:51.212844 IP 10.0.0.1.12345 > 10.0.0.2.12345: UDP, length 16
17:46:51.213457 IP 10.0.0.1.12345 > 10.0.0.2.12345: UDP, length 16
17:46:51.214072 IP 10.0.0.1.12345 > 10.0.0.2.12345: UDP, length 16
17:46:51.214687 IP 10.0.0.1.12345 > 10.0.0.2.12345: UDP, length 16
17:46:51.215330 IP 10.0.0.1.12345 > 10.0.0.2.12345: UDP, length 16
17:46:51.215942 IP 10.0.0.1.12345 > 10.0.0.2.12345: UDP, length 16
17:46:51.216563 IP 10.0.0.1.12345 > 10.0.0.2.12345: UDP, length 16
17:46:51.217173 IP 10.0.0.1.12345 > 10.0.0.2.12345: UDP, length 16
17:46:51.217784 IP 10.0.0.1.12345 > 10.0.0.2.12345: UDP, length 16
17:46:51.218396 IP 10.0.0.1.12345 > 10.0.0.2.12345: UDP, length 16
17:46:51.219007 IP 10.0.0.1.12345 > 10.0.0.2.12345: UDP, length 16
17:46:51.219618 IP 10.0.0.1.12345 > 10.0.0.2.12345: UDP, length 16
17:46:51.220246 IP 10.0.0.1.12345 > 10.0.0.2.12345: UDP, length 16
17:46:51.220858 IP 10.0.0.1.12345 > 10.0.0.2.12345: UDP, length 16
17:46:51.221454 IP 10.0.0.1.12345 > 10.0.0.2.12345: UDP, length 16
17:46:51.222066 IP 10.0.0.1.12345 > 10.0.0.2.12345: UDP, length 16
17:46:51.222677 IP 10.0.0.1.12345 > 10.0.0.2.12345: UDP, length 16
17:46:51.223289 IP 10.0.0.1.12345 > 10.0.0.2.12345: UDP, length 16
17:46:51.223900 IP 10.0.0.1.12345 > 10.0.0.2.12345: UDP, length 16
17:46:51.224512 IP 10.0.0.1.12345 > 10.0.0.2.12345: UDP, length 16
17:46:51.225123 IP 10.0.0.1.12345 > 10.0.0.2.12345: UDP, length 16
17:46:51.225734 IP 10.0.0.1.12345 > 10.0.0.2.12345: UDP, length 16
17:46:51.226345 IP 10.0.0.1.12345 > 10.0.0.2.12345: UDP, length 16
17:46:51.226956 IP 10.0.0.1.12345 > 10.0.0.2.12345: UDP, length 16
17:46:51.227553 IP 10.0.0.1.12345 > 10.0.0.2.12345: UDP, length 16
17:46:51.228164 IP 10.0.0.1.12345 > 10.0.0.2.12345: UDP, length 16
17:46:51.228777 IP 10.0.0.1.12345 > 10.0.0.2.12345: UDP, length 16
17:46:51.229387 IP 10.0.0.1.12345 > 10.0.0.2.12345: UDP, length 16
17:46:51.229999 IP 10.0.0.1.12345 > 10.0.0.2.12345: UDP, length 16
17:46:51.230611 IP 10.0.0.1.12345 > 10.0.0.2.12345: UDP, length 16
17:46:51.231221 IP 10.0.0.1.12345 > 10.0.0.2.12345: UDP, length 16
17:46:51.231832 IP 10.0.0.1.12345 > 10.0.0.2.12345: UDP, length 16
17:46:51.232462 IP 10.0.0.1.12345 > 10.0.0.2.12345: UDP, length 16
17:46:51.233091 IP 10.0.0.1.12345 > 10.0.0.2.12345: UDP, length 16
17:46:51.233722 IP 10.0.0.1.12345 > 10.0.0.2.12345: UDP, length 16
17:46:51.234352 IP 10.0.0.1.12345 > 10.0.0.2.12345: UDP, length 16
17:46:51.234982 IP 10.0.0.1.12345 > 10.0.0.2.12345: UDP, length 16
17:46:51.235611 IP 10.0.0.1.12345 > 10.0.0.2.12345: UDP, length 16
17:46:51.236268 IP 10.0.0.1.12345 > 10.0.0.2.12345: UDP, length 16
17:46:51.236901 IP 10.0.0.1.12345 > 10.0.0.2.12345: UDP, length 16
17:46:51.237530 IP 10.0.0.1.12345 > 10.0.0.2.12345: UDP, length 16
17:46:51.238159 IP 10.0.0.1.12345 > 10.0.0.2.12345: UDP, length 16
17:46:51.238787 IP 10.0.0.1.12345 > 10.0.0.2.12345: UDP, length 16
17:46:51.239417 IP 10.0.0.1.12345 > 10.0.0.2.12345: UDP, length 16
17:46:51.240047 IP 10.0.0.1.12345 > 10.0.0.2.12345: UDP, length 16
17:46:51.240680 IP 10.0.0.1.12345 > 10.0.0.2.12345: UDP, length 16
17:46:51.241313 IP 10.0.0.1.12345 > 10.0.0.2.12345: UDP, length 16
17:46:51.241946 IP 10.0.0.1.12345 > 10.0.0.2.12345: UDP, length 16
17:46:51.242582 IP 10.0.0.1.12345 > 10.0.0.2.12345: UDP, length 16
17:46:51.243216 IP 10.0.0.1.12345 > 10.0.0.2.12345: UDP, length 16
17:46:51.243849 IP 10.0.0.1.12345 > 10.0.0.2.12345: UDP, length 16
17:46:51.244483 IP 10.0.0.1.12345 > 10.0.0.2.12345: UDP, length 16
17:46:51.245116 IP 10.0.0.1.12345 > 10.0.0.2.12345: UDP, length 16
17:46:51.245750 IP 10.0.0.1.12345 > 10.0.0.2.12345: UDP, length 16
17:46:51.246382 IP 10.0.0.1.12345 > 10.0.0.2.12345: UDP, length 16
17:46:51.247017 IP 10.0.0.1.12345 > 10.0.0.2.12345: UDP, length 16
17:46:51.247649 IP 10.0.0.1.12345 > 10.0.0.2.12345: UDP, length 16
17:46:51.248290 IP 10.0.0.1.12345 > 10.0.0.2.12345: UDP, length 16
17:46:51.248924 IP 10.0.0.1.12345 > 10.0.0.2.12345: UDP, length 16
17:46:51.249556 IP 10.0.0.1.12345 > 10.0.0.2.12345: UDP, length 16
17:46:51.250189 IP 10.0.0.1.12345 > 10.0.0.2.12345: UDP, length 16
17:46:51.250824 IP 10.0.0.1.12345 > 10.0.0.2.12345: UDP, length 16
17:46:51.251457 IP 10.0.0.1.12345 > 10.0.0.2.12345: UDP, length 16
17:46:51.252090 IP 10.0.0.1.12345 > 10.0.0.2.12345: UDP, length 16
17:46:51.252723 IP 10.0.0.1.12345 > 10.0.0.2.12345: UDP, length 16
17:46:51.253357 IP 10.0.0.1.12345 > 10.0.0.2.12345: UDP, length 16
17:46:51.253978 IP 10.0.0.1.12345 > 10.0.0.2.12345: UDP, length 16
17:46:51.254614 IP 10.0.0.1.12345 > 10.0.0.2.12345: UDP, length 16
17:46:51.255248 IP 10.0.0.1.12345 > 10.0.0.2.12345: UDP, length 16
17:46:51.255891 IP 10.0.0.1.12345 > 10.0.0.2.12345: UDP, length 16
17:46:51.256525 IP 10.0.0.1.12345 > 10.0.0.2.12345: UDP, length 16
17:46:51.257160 IP 10.0.0.1.12345 > 10.0.0.2.12345: UDP, length 16
17:46:51.257794 IP 10.0.0.1.12345 > 10.0.0.2.12345: UDP, length 16
17:46:51.258427 IP 10.0.0.1.12345 > 10.0.0.2.12345: UDP, length 16
17:46:51.259070 IP 10.0.0.1.12345 > 10.0.0.2.12345: UDP, length 16
17:46:51.259712 IP 10.0.0.1.12345 > 10.0.0.2.12345: UDP, length 16
17:46:51.260341 IP 10.0.0.1.12345 > 10.0.0.2.12345: UDP, length 16
17:46:51.260984 IP 10.0.0.1.12345 > 10.0.0.2.12345: UDP, length 16
17:46:51.261628 IP 10.0.0.1.12345 > 10.0.0.2.12345: UDP, length 16
17:46:51.262271 IP 10.0.0.1.12345 > 10.0.0.2.12345: UDP, length 16
17:46:51.262913 IP 10.0.0.1.12345 > 10.0.0.2.12345: UDP, length 16
17:46:51.263558 IP 10.0.0.1.12345 > 10.0.0.2.12345: UDP, length 16
17:46:51.264200 IP 10.0.0.1.12345 > 10.0.0.2.12345: UDP, length 16
17:46:51.264843 IP 10.0.0.1.12345 > 10.0.0.2.12345: UDP, length 16
17:46:51.265486 IP 10.0.0.1.12345 > 10.0.0.2.12345: UDP, length 16
17:46:51.266129 IP 10.0.0.1.12345 > 10.0.0.2.12345: UDP, length 16
17:46:51.266757 IP 10.0.0.1.12345 > 10.0.0.2.12345: UDP, length 16
17:46:51.267400 IP 10.0.0.1.12345 > 10.0.0.2.12345: UDP, length 16
17:46:51.268042 IP 10.0.0.1.12345 > 10.0.0.2.12345: UDP, length 16
17:46:51.268687 IP 10.0.0.1.12345 > 10.0.0.2.12345: UDP, length 16
17:46:51.269328 IP 10.0.0.1.12345 > 10.0.0.2.12345: UDP, length 16
17:46:51.269981 IP 10.0.0.1.12345 > 10.0.0.2.12345: UDP, length 16
17:46:51.270623 IP 10.0.0.1.12345 > 10.0.0.2.12345: UDP, length 16
17:46:51.271266 IP 10.0.0.1.12345 > 10.0.0.2.12345: UDP, length 16
17:46:51.271909 IP 10.0.0.1.12345 > 10.0.0.2.12345: UDP, length 16
17:46:51.272552 IP 10.0.0.1.12345 > 10.0.0.2.12345: UDP, length 16
17:46:51.273173 IP 10.0.0.1.12345 > 10.0.0.2.12345: UDP, length 16
17:46:51.273787 IP 10.0.0.1.12345 > 10.0.0.2.12345: UDP, length 16
17:46:51.274412 IP 10.0.0.1.12345 > 10.0.0.2.12345: UDP, length 16
17:46:51.275021 IP 10.0.0.1.12345 > 10.0.0.2.12345: UDP, length 16
17:46:51.275629 IP 10.0.0.1.12345 > 10.0.0.2.12345: UDP, length 16
17:46:51.276287 IP 10.0.0.1.12345 > 10.0.0.2.12345: UDP, length 16
17:46:51.276941 IP 10.0.0.1.12345 > 10.0.0.2.12345: UDP, length 16
17:46:51.277591 IP 10.0.0.1.12345 > 10.0.0.2.12345: UDP, length 16
17:46:51.278240 IP 10.0.0.1.12345 > 10.0.0.2.12345: UDP, length 16
17:46:51.278889 IP 10.0.0.1.12345 > 10.0.0.2.12345: UDP, length 16
17:46:51.279538 IP 10.0.0.1.12345 > 10.0.0.2.12345: UDP, length 16
17:46:51.280188 IP 10.0.0.1.12345 > 10.0.0.2.12345: UDP, length 16
17:46:51.280840 IP 10.0.0.1.12345 > 10.0.0.2.12345: UDP, length 16
17:46:51.281488 IP 10.0.0.1.12345 > 10.0.0.2.12345: UDP, length 16
17:46:51.282138 IP 10.0.0.1.12345 > 10.0.0.2.12345: UDP, length 16
17:46:51.282788 IP 10.0.0.1.12345 > 10.0.0.2.12345: UDP, length 16
17:46:51.283438 IP 10.0.0.1.12345 > 10.0.0.2.12345: UDP, length 16
17:46:51.284051 IP 10.0.0.1.12345 > 10.0.0.2.12345: UDP, length 16
17:46:51.284720 IP 10.0.0.1.12345 > 10.0.0.2.12345: UDP, length 16
17:46:51.285377 IP 10.0.0.1.12345 > 10.0.0.2.12345: UDP, length 16
17:46:51.286034 IP 10.0.0.1.12345 > 10.0.0.2.12345: UDP, length 16
17:46:51.286690 IP 10.0.0.1.12345 > 10.0.0.2.12345: UDP, length 16
17:46:51.287345 IP 10.0.0.1.12345 > 10.0.0.2.12345: UDP, length 16
17:46:51.288002 IP 10.0.0.1.12345 > 10.0.0.2.12345: UDP, length 16
17:46:51.288659 IP 10.0.0.1.12345 > 10.0.0.2.12345: UDP, length 16
17:46:51.289316 IP 10.0.0.1.12345 > 10.0.0.2.12345: UDP, length 16
17:46:51.289971 IP 10.0.0.1.12345 > 10.0.0.2.12345: UDP, length 16
17:46:51.290630 IP 10.0.0.1.12345 > 10.0.0.2.12345: UDP, length 16
17:46:51.291286 IP 10.0.0.1.12345 > 10.0.0.2.12345: UDP, length 16
17:46:51.291942 IP 10.0.0.1.12345 > 10.0.0.2.12345: UDP, length 16
17:46:51.292599 IP 10.0.0.1.12345 > 10.0.0.2.12345: UDP, length 16
17:46:51.293255 IP 10.0.0.1.12345 > 10.0.0.2.12345: UDP, length 16
17:46:51.293911 IP 10.0.0.1.12345 > 10.0.0.2.12345: UDP, length 16
17:46:51.294567 IP 10.0.0.1.12345 > 10.0.0.2.12345: UDP, length 16
17:46:51.295227 IP 10.0.0.1.12345 > 10.0.0.2.12345: UDP, length 16
17:46:51.295883 IP 10.0.0.1.12345 > 10.0.0.2.12345: UDP, length 16
17:46:51.296540 IP 10.0.0.1.12345 > 10.0.0.2.12345: UDP, length 16
17:46:51.297197 IP 10.0.0.1.12345 > 10.0.0.2.12345: UDP, length 16
17:46:51.297852 IP 10.0.0.1.12345 > 10.0.0.2.12345: UDP, length 16
17:46:51.298507 IP 10.0.0.1.12345 > 10.0.0.2.12345: UDP, length 16
17:46:51.299163 IP 10.0.0.1.12345 > 10.0.0.2.12345: UDP, length 16
17:46:51.299819 IP 10.0.0.1.12345 > 10.0.0.2.12345: UDP, length 16
17:46:51.300476 IP 10.0.0.1.12345 > 10.0.0.2.12345: UDP, length 16
17:46:51.301132 IP 10.0.0.1.12345 > 10.0.0.2.12345: UDP, length 16
17:46:51.301788 IP 10.0.0.1.12345 > 10.0.0.2.12345: UDP, length 16
17:46:51.302443 IP 10.0.0.1.12345 > 10.0.0.2.12345: UDP, length 16
17:46:51.303099 IP 10.0.0.1.12345 > 10.0.0.2.12345: UDP, length 16
17:46:51.303755 IP 10.0.0.1.12345 > 10.0.0.2.12345: UDP, length 16
17:46:51.304414 IP 10.0.0.1.12345 > 10.0.0.2.12345: UDP, length 16
17:46:51.305077 IP 10.0.0.1.12345 > 10.0.0.2.12345: UDP, length 16
17:46:51.305743 IP 10.0.0.1.12345 > 10.0.0.2.12345: UDP, length 16
17:46:51.306380 IP 10.0.0.1.12345 > 10.0.0.2.12345: UDP, length 16
17:46:51.306976 IP 10.0.0.1.12345 > 10.0.0.2.12345: UDP, length 16
17:46:51.307601 IP 10.0.0.1.12345 > 10.0.0.2.12345: UDP, length 16
17:46:51.308207 IP 10.0.0.1.12345 > 10.0.0.2.12345: UDP, length 16
17:46:51.308810 IP 10.0.0.1.12345 > 10.0.0.2.12345: UDP, length 16
17:46:51.309409 IP 10.0.0.1.12345 > 10.0.0.2.12345: UDP, length 16
17:46:51.310054 IP 10.0.0.1.12345 > 10.0.0.2.12345: UDP, length 16
17:46:51.310706 IP 10.0.0.1.12345 > 10.0.0.2.12345: UDP, length 16
17:46:51.311355 IP 10.0.0.1.12345 > 10.0.0.2.12345: UDP, length 16
17:46:51.312005 IP 10.0.0.1.12345 > 10.0.0.2.12345: UDP, length 16
17:46:51.312655 IP 10.0.0.1.12345 > 10.0.0.2.12345: UDP, length 16

