09:51:03.832932 IP 10.44.249.169.12345 > 10.0.0.2.12345: UDP, length 16
09:51:04.833197 IP 10.36.33.34.12345 > 10.0.0.2.12345: UDP, length 16
09:51:05.833431 IP 10.127.219.63.12345 > 10.0.0.2.12345: UDP, length 16
09:51:06.833709 IP 10.34.128.203.12345 > 10.0.0.2.12345: UDP, length 16
09:51:07.834040 IP 10.66.233.38.12345 > 10.0.0.2.12345: UDP, length 16
09:51:08.834340 IP 10.46.212.146.12345 > 10.0.0.2.12345: UDP, length 16
09:51:09.834609 IP 10.9.66.119.12345 > 10.0.0.2.12345: UDP, length 16
09:51:10.834836 IP 10.49.15.95.12345 > 10.0.0.2.12345: UDP, length 16
09:51:11.835165 IP 10.37.139.74.12345 > 10.0.0.2.12345: UDP, length 16
09:51:12.835518 IP 10.35.69.78.12345 > 10.0.0.2.12345: UDP, length 16
09:51:13.835883 IP 10.2.48.199.12345 > 10.0.0.2.12345: UDP, length 16
09:51:14.836227 IP 10.40.80.36.12345 > 10.0.0.2.12345: UDP, length 16
09:51:15.836623 IP 10.100.103.138.12345 > 10.0.0.2.12345: UDP, length 16
09:51:16.836939 IP 10.91.235.253.12345 > 10.0.0.2.12345: UDP, length 16
09:51:17.837199 IP 10.82.81.254.12345 > 10.0.0.2.12345: UDP, length 16
09:51:18.837510 IP 10.83.178.61.12345 > 10.0.0.2.12345: UDP, length 16
09:51:19.837896 IP 10.80.240.197.12345 > 10.0.0.2.12345: UDP, length 16
09:51:20.838247 IP 10.75.140.0.12345 > 10.0.0.2.12345: UDP, length 16
09:51:21.838566 IP 10.80.207.30.12345 > 10.0.0.2.12345: UDP, length 16
09:51:22.838871 IP 10.34.242.125.12345 > 10.0.0.2.12345: UDP, length 16
09:51:23.839209 IP 10.52.206.173.12345 > 10.0.0.2.12345: UDP, length 16
09:51:24.839558 IP 10.49.231.66.12345 > 10.0.0.2.12345: UDP, length 16
09:51:25.839919 IP 10.83.70.187.12345 > 10.0.0.2.12345: UDP, length 16
09:51:26.840203 IP 10.47.117.107.12345 > 10.0.0.2.12345: UDP, length 16
09:51:27.840568 IP 10.43.131.228.12345 > 10.0.0.2.12345: UDP, length 16
09:51:28.840898 IP 10.62.164.83.12345 > 10.0.0.2.12345: UDP, length 16
09:51:29.841257 IP 10.123.159.66.12345 > 10.0.0.2.12345: UDP, length 16
09:51:30.841609 IP 10.99.15.191.12345 > 10.0.0.2.12345: UDP, length 16
09:51:31.841993 IP 10.98.97.227.12345 > 10.0.0.2.12345: UDP, length 16
09:51:32.842342 IP 10.3.33.170.12345 > 10.0.0.2.12345: UDP, length 16
09:51:33.842698 IP 10.61.153.122.12345 > 10.0.0.2.12345: UDP, length 16
09:51:34.843027 IP 10.49.112.134.12345 > 10.0.0.2.12345: UDP, length 16
09:51:35.843345 IP 10.42.210.11.12345 > 10.0.0.2.12345: UDP, length 16
09:51:36.843644 IP 10.6.25.98.12345 > 10.0.0.2.12345: UDP, length 16
09:51:37.844034 IP 10.84.163.24.12345 > 10.0.0.2.12345: UDP, length 16
09:51:38.844394 IP 10.14.54.245.12345 > 10.0.0.2.12345: UDP, length 16
09:51:39.844675 IP 10.102.238.38.12345 > 10.0.0.2.12345: UDP, length 16
09:51:40.844999 IP 10.7.69.227.12345 > 10.0.0.2.12345: UDP, length 16
09:51:41.845323 IP 10.34.174.43.12345 > 10.0.0.2.12345: UDP, length 16
09:51:42.845653 IP 10.118.136.221.12345 > 10.0.0.2.12345: UDP, length 16
09:51:43.846000 IP 10.88.214.210.12345 > 10.0.0.2.12345: UDP, length 16
09:51:44.846342 IP 10.102.132.28.12345 > 10.0.0.2.12345: UDP, length 16
09:51:45.846686 IP 10.24.136.149.12345 > 10.0.0.2.12345: UDP, length 16
09:51:46.846976 IP 10.114.9.249.12345 > 10.0.0.2.12345: UDP, length 16
09:51:47.847255 IP 10.32.99.104.12345 > 10.0.0.2.12345: UDP, length 16
09:51:48.847586 IP 10.41.35.231.12345 > 10.0.0.2.12345: UDP, length 16
09:51:49.847911 IP 10.84.143.7.12345 > 10.0.0.2.12345: UDP, length 16
09:51:50.848214 IP 10.93.144.251.12345 > 10.0.0.2.12345: UDP, length 16
09:51:51.848508 IP 10.112.74.247.12345 > 10.0.0.2.12345: UDP, length 16
09:51:52.848790 IP 10.39.194.74.12345 > 10.0.0.2.12345: UDP, length 16
09:51:53.849072 IP 10.59.91.192.12345 > 10.0.0.2.12345: UDP, length 16
09:51:54.849348 IP 10.123.103.76.12345 > 10.0.0.2.12345: UDP, length 16
09:51:55.849627 IP 10.19.30.38.12345 > 10.0.0.2.12345: UDP, length 16
09:51:56.849929 IP 10.102.65.161.12345 > 10.0.0.2.12345: UDP, length 16
09:51:57.850204 IP 10.25.62.194.12345 > 10.0.0.2.12345: UDP, length 16
09:51:58.850490 IP 10.23.118.132.12345 > 10.0.0.2.12345: UDP, length 16
09:51:59.850835 IP 10.2.174.60.12345 > 10.0.0.2.12345: UDP, length 16
09:52:00.851192 IP 10.0.251.145.12345 > 10.0.0.2.12345: UDP, length 16
09:52:01.851491 IP 10.96.8.228.12345 > 10.0.0.2.12345: UDP, length 16
09:52:02.851870 IP 10.6.48.78.12345 > 10.0.0.2.12345: UDP, length 16
09:52:03.852145 IP 10.64.230.217.12345 > 10.0.0.2.12345: UDP, length 16
09:52:04.852443 IP 10.112.244.130.12345 > 10.0.0.2.12345: UDP, length 16
09:52:05.852742 IP 10.40.40.245.12345 > 10.0.0.2.12345: UDP, length 16
09:52:06.853017 IP 10.32.35.155.12345 > 10.0.0.2.12345: UDP, length 16
09:52:07.853244 IP 10.71.215.155.12345 > 10.0.0.2.12345: UDP, length 16
09:52:08.853551 IP 10.1.195.75.12345 > 10.0.0.2.12345: UDP, length 16
09:52:09.853778 IP 10.12.213.117.12345 > 10.0.0.2.12345: UDP, length 16
09:52:10.853990 IP 10.2.197.226.12345 > 10.0.0.2.12345: UDP, length 16
09:52:11.854209 IP 10.50.209.242.12345 > 10.0.0.2.12345: UDP, length 16
09:52:12.854516 IP 10.37.223.40.12345 > 10.0.0.2.12345: UDP, length 16
09:52:13.854783 IP 10.114.130.84.12345 > 10.0.0.2.12345: UDP, length 16
09:52:14.855061 IP 10.98.230.14.12345 > 10.0.0.2.12345: UDP, length 16
09:52:15.855385 IP 10.39.142.244.12345 > 10.0.0.2.12345: UDP, length 16
09:52:16.855635 IP 10.1.102.108.12345 > 10.0.0.2.12345: UDP, length 16
09:52:17.855864 IP 10.113.240.113.12345 > 10.0.0.2.12345: UDP, length 16
09:52:18.856158 IP 10.89.156.170.12345 > 10.0.0.2.12345: UDP, length 16
09:52:19.856425 IP 10.106.88.194.12345 > 10.0.0.2.12345: UDP, length 16
09:52:20.856732 IP 10.25.168.5.12345 > 10.0.0.2.12345: UDP, length 16
09:52:21.856997 IP 10.97.41.193.12345 > 10.0.0.2.12345: UDP, length 16
09:52:22.857243 IP 10.13.202.20.12345 > 10.0.0.2.12345: UDP, length 16
09:52:23.857522 IP 10.36.183.73.12345 > 10.0.0.2.12345: UDP, length 16
09:52:24.857830 IP 10.68.5.190.12345 > 10.0.0.2.12345: UDP, length 16
09:52:25.858198 IP 10.11.82.247.12345 > 10.0.0.2.12345: UDP, length 16
09:52:26.858536 IP 10.105.86.130.12345 > 10.0.0.2.12345: UDP, length 16
09:52:27.858916 IP 10.39.144.220.12345 > 10.0.0.2.12345: UDP, length 16
09:52:28.859277 IP 10.11.95.238.12345 > 10.0.0.2.12345: UDP, length 16
09:52:29.859610 IP 10.126.232.244.12345 > 10.0.0.2.12345: UDP, length 16
09:52:30.860003 IP 10.37.255.99.12345 > 10.0.0.2.12345: UDP, length 16
09:52:31.860333 IP 10.88.89.52.12345 > 10.0.0.2.12345: UDP, length 16
09:52:32.860680 IP 10.100.100.59.12345 > 10.0.0.2.12345: UDP, length 16
09:52:33.861057 IP 10.21.42.229.12345 > 10.0.0.2.12345: UDP, length 16
09:52:34.861390 IP 10.73.20.173.12345 > 10.0.0.2.12345: UDP, length 16
09:52:35.861750 IP 10.39.37.153.12345 > 10.0.0.2.12345: UDP, length 16
09:52:36.862102 IP 10.11.71.47.12345 > 10.0.0.2.12345: UDP, length 16
09:52:37.862462 IP 10.106.186.220.12345 > 10.0.0.2.12345: UDP, length 16
09:52:38.862836 IP 10.17.248.30.12345 > 10.0.0.2.12345: UDP, length 16
09:52:39.863211 IP 10.51.104.2.12345 > 10.0.0.2.12345: UDP, length 16
09:52:40.863569 IP 10.90.165.39.12345 > 10.0.0.2.12345: UDP, length 16
09:52:41.863922 IP 10.34.193.91.12345 > 10.0.0.2.12345: UDP, length 16
09:52:42.864267 IP 10.85.153.210.12345 > 10.0.0.2.12345: UDP, length 16
09:52:43.864619 IP 10.43.218.179.12345 > 10.0.0.2.12345: UDP, length 16
09:52:44.864975 IP 10.50.54.177.12345 > 10.0.0.2.12345: UDP, length 16
09:52:45.865255 IP 10.90.226.188.12345 > 10.0.0.2.12345: UDP, length 16
09:52:46.865572 IP 10.17.204.169.12345 > 10.0.0.2.12345: UDP, length 16
09:52:47.865850 IP 10.102.218.23.12345 > 10.0.0.2.12345: UDP, length 16
09:52:48.866168 IP 10.113.148.144.12345 > 10.0.0.2.12345: UDP, length 16
09:52:49.866525 IP 10.117.197.37.12345 > 10.0.0.2.12345: UDP, length 16
09:52:50.866908 IP 10.118.159.74.12345 > 10.0.0.2.12345: UDP, length 16
09:52:51.867232 IP 10.46.125.160.12345 > 10.0.0.2.12345: UDP, length 16
09:52:52.867535 IP 10.101.202.1.12345 > 10.0.0.2.12345: UDP, length 16
09:52:53.867870 IP 10.114.16.111.12345 > 10.0.0.2.12345: UDP, length 16
09:52:54.868244 IP 10.51.110.139.12345 > 10.0.0.2.12345: UDP, length 16
09:52:55.868591 IP 10.107.207.202.12345 > 10.0.0.2.12345: UDP, length 16
09:52:56.868951 IP 10.25.235.110.12345 > 10.0.0.2.12345: UDP, length 16
09:52:57.869243 IP 10.8.41.16.12345 > 10.0.0.2.12345: UDP, length 16
09:52:58.869472 IP 10.23.71.196.12345 > 10.0.0.2.12345: UDP, length 16
09:52:59.869752 IP 10.127.49.203.12345 > 10.0.0.2.12345: UDP, length 16
09:53:00.870118 IP 10.107.46.244.12345 > 10.0.0.2.12345: UDP, length 16
09:53:01.870433 IP 10.30.67.163.12345 > 10.0.0.2.12345: UDP, length 16
09:53:02.870731 IP 10.29.113.71.12345 > 10.0.0.2.12345: UDP, length 16
09:53:03.871095 IP 10.30.45.179.12345 > 10.0.0.2.12345: UDP, length 16
09:53:04.871421 IP 10.117.53.45.12345 > 10.0.0.2.12345: UDP, length 16
09:53:05.871850 IP 10.29.195.47.12345 > 10.0.0.2.12345: UDP, length 16
09:53:06.872182 IP 10.68.105.116.12345 > 10.0.0.2.12345: UDP, length 16
09:53:07.872527 IP 10.91.162.247.12345 > 10.0.0.2.12345: UDP, length 16
09:53:08.872871 IP 10.102.117.135.12345 > 10.0.0.2.12345: UDP, length 16
09:53:09.873209 IP 10.109.149.110.12345 > 10.0.0.2.12345: UDP, length 16
09:53:10.873542 IP 10.50.97.220.12345 > 10.0.0.2.12345: UDP, length 16
09:53:11.873807 IP 10.113.168.57.12345 > 10.0.0.2.12345: UDP, length 16
09:53:12.874131 IP 10.104.70.2.12345 > 10.0.0.2.12345: UDP, length 16
09:53:13.874463 IP 10.49.52.166.12345 > 10.0.0.2.12345: UDP, length 16
09:53:14.874826 IP 10.34.226.226.12345 > 10.0.0.2.12345: UDP, length 16
09:53:15.875148 IP 10.19.59.248.12345 > 10.0.0.2.12345: UDP, length 16
09:53:16.875484 IP 10.100.133.206.12345 > 10.0.0.2.12345: UDP, length 16
09:53:17.875825 IP 10.90.83.245.12345 > 10.0.0.2.12345: UDP, length 16
09:53:18.876169 IP 10.11.80.32.12345 > 10.0.0.2.12345: UDP, length 16
09:53:19.876455 IP 10.62.61.214.12345 > 10.0.0.2.12345: UDP, length 16
09:53:20.876793 IP 10.81.47.238.12345 > 10.0.0.2.12345: UDP, length 16
09:53:21.877169 IP 10.9.10.77.12345 > 10.0.0.2.12345: UDP, length 16
09:53:22.877535 IP 10.44.203.19.12345 > 10.0.0.2.12345: UDP, length 16
09:53:23.877808 IP 10.123.7.37.12345 > 10.0.0.2.12345: UDP, length 16
09:53:24.878058 IP 10.0.209.213.12345 > 10.0.0.2.12345: UDP, length 16
09:53:25.878389 IP 10.10.104.220.12345 > 10.0.0.2.12345: UDP, length 16
09:53:26.878762 IP 10.70.96.120.12345 > 10.0.0.2.12345: UDP, length 16
09:53:27.879127 IP 10.63.211.207.12345 > 10.0.0.2.12345: UDP, length 16
09:53:28.879481 IP 10.45.9.72.12345 > 10.0.0.2.12345: UDP, length 16
09:53:29.879836 IP 10.84.210.190.12345 > 10.0.0.2.12345: UDP, length 16
09:53:30.880175 IP 10.25.205.52.12345 > 10.0.0.2.12345: UDP, length 16
09:53:31.880484 IP 10.95.161.237.12345 > 10.0.0.2.12345: UDP, length 16
09:53:32.880752 IP 10.3.121.215.12345 > 10.0.0.2.12345: UDP, length 16
09:53:33.881074 IP 10.70.187.104.12345 > 10.0.0.2.12345: UDP, length 16
09:53:34.881375 IP 10.8.36.23.12345 > 10.0.0.2.12345: UDP, length 16
09:53:35.881714 IP 10.78.218.37.12345 > 10.0.0.2.12345: UDP, length 16
09:53:36.882046 IP 10.77.103.68.12345 > 10.0.0.2.12345: UDP, length 16
09:53:37.882394 IP 10.118.112.91.12345 > 10.0.0.2.12345: UDP, length 16
09:53:38.882755 IP 10.76.255.95.12345 > 10.0.0.2.12345: UDP, length 16
09:53:39.883043 IP 10.14.184.146.12345 > 10.0.0.2.12345: UDP, length 16
09:53:40.883294 IP 10.81.26.158.12345 > 10.0.0.2.12345: UDP, length 16
09:53:41.883582 IP 10.71.207.167.12345 > 10.0.0.2.12345: UDP, length 16
09:53:42.883916 IP 10.85.184.29.12345 > 10.0.0.2.12345: UDP, length 16
09:53:43.884264 IP 10.7.55.155.12345 > 10.0.0.2.12345: UDP, length 16
09:53:44.884573 IP 10.48.84.136.12345 > 10.0.0.2.12345: UDP, length 16
09:53:45.884828 IP 10.26.112.241.12345 > 10.0.0.2.12345: UDP, length 16
09:53:46.885070 IP 10.29.199.74.12345 > 10.0.0.2.12345: UDP, length 16
09:53:47.885357 IP 10.52.9.184.12345 > 10.0.0.2.12345: UDP, length 16
09:53:48.885658 IP 10.77.245.5.12345 > 10.0.0.2.12345: UDP, length 16
09:53:49.885970 IP 10.118.185.88.12345 > 10.0.0.2.12345: UDP, length 16
09:53:50.886318 IP 10.84.187.75.12345 > 10.0.0.2.12345: UDP, length 16
09:53:51.886692 IP 10.49.65.105.12345 > 10.0.0.2.12345: UDP, length 16
09:53:52.886994 IP 10.81.43.157.12345 > 10.0.0.2.12345: UDP, length 16
09:53:53.887344 IP 10.100.180.112.12345 > 10.0.0.2.12345: UDP, length 16
09:53:54.887644 IP 10.50.147.151.12345 > 10.0.0.2.12345: UDP, length 16
09:53:55.888055 IP 10.93.178.122.12345 > 10.0.0.2.12345: UDP, length 16
09:53:56.888335 IP 10.24.137.101.12345 > 10.0.0.2.12345: UDP, length 16
09:53:57.888507 IP 10.78.64.204.12345 > 10.0.0.2.12345: UDP, length 16
09:53:58.888749 IP 10.113.92.74.12345 > 10.0.0.2.12345: UDP, length 16
09:53:59.889070 IP 10.28.109.162.12345 > 10.0.0.2.12345: UDP, length 16
09:54:00.889381 IP 10.7.5.125.12345 > 10.0.0.2.12345: UDP, length 16
09:54:01.889632 IP 10.106.122.10.12345 > 10.0.0.2.12345: UDP, length 16
09:54:02.889857 IP 10.80.103.116.12345 > 10.0.0.2.12345: UDP, length 16
09:54:03.890153 IP 10.89.68.79.12345 > 10.0.0.2.12345: UDP, length 16
09:54:04.890426 IP 10.108.253.77.12345 > 10.0.0.2.12345: UDP, length 16
09:54:05.890706 IP 10.61.104.245.12345 > 10.0.0.2.12345: UDP, length 16
09:54:06.890990 IP 10.26.202.17.12345 > 10.0.0.2.12345: UDP, length 16
09:54:07.891286 IP 10.109.192.95.12345 > 10.0.0.2.12345: UDP, length 16
09:54:08.891629 IP 10.61.200.23.12345 > 10.0.0.2.12345: UDP, length 16
09:54:09.891965 IP 10.79.56.195.12345 > 10.0.0.2.12345: UDP, length 16
09:54:10.892199 IP 10.87.35.70.12345 > 10.0.0.2.12345: UDP, length 16
09:54:11.892481 IP 10.65.239.125.12345 > 10.0.0.2.12345: UDP, length 16
09:54:12.892821 IP 10.72.13.205.12345 > 10.0.0.2.12345: UDP, length 16
09:54:13.893152 IP 10.112.210.140.12345 > 10.0.0.2.12345: UDP, length 16
09:54:14.893442 IP 10.123.54.47.12345 > 10.0.0.2.12345: UDP, length 16
09:54:15.893700 IP 10.3.159.207.12345 > 10.0.0.2.12345: UDP, length 16
09:54:16.893933 IP 10.11.143.47.12345 > 10.0.0.2.12345: UDP, length 16
09:54:17.894235 IP 10.104.110.59.12345 > 10.0.0.2.12345: UDP, length 16
09:54:18.894496 IP 10.27.218.172.12345 > 10.0.0.2.12345: UDP, length 16
09:54:19.894811 IP 10.71.49.84.12345 > 10.0.0.2.12345: UDP, length 16
09:54:20.895085 IP 10.96.27.218.12345 > 10.0.0.2.12345: UDP, length 16
09:54:21.895401 IP 10.38.55.193.12345 > 10.0.0.2.12345: UDP, length 16
09:54:22.895796 IP 10.75.41.106.12345 > 10.0.0.2.12345: UDP, length 16

