13:03:42.508481 IP 10.67.169.55.12345 > 10.0.0.2.12345: UDP, length 16
13:03:43.309695 IP 10.108.106.23.12345 > 10.0.0.2.12345: UDP, length 16
13:03:44.108852 IP 10.73.226.112.12345 > 10.0.0.2.12345: UDP, length 16
13:03:44.909461 IP 10.127.23.251.12345 > 10.0.0.2.12345: UDP, length 16
13:03:45.708169 IP 10.122.244.222.12345 > 10.0.0.2.12345: UDP, length 16
13:03:46.509797 IP 10.54.56.144.12345 > 10.0.0.2.12345: UDP, length 16
13:03:47.310763 IP 10.0.61.231.12345 > 10.0.0.2.12345: UDP, length 16
13:03:48.109026 IP 10.40.78.118.12345 > 10.0.0.2.12345: UDP, length 16
13:03:48.911216 IP 10.30.62.36.12345 > 10.0.0.2.12345: UDP, length 16
13:03:49.710449 IP 10.118.234.95.12345 > 10.0.0.2.12345: UDP, length 16
13:03:50.511329 IP 10.115.197.197.12345 > 10.0.0.2.12345: UDP, length 16
13:03:51.311533 IP 10.101.130.73.12345 > 10.0.0.2.12345: UDP, length 16
13:03:52.110994 IP 10.44.76.172.12345 > 10.0.0.2.12345: UDP, length 16
13:03:52.911964 IP 10.38.52.14.12345 > 10.0.0.2.12345: UDP, length 16
13:03:53.713291 IP 10.3.103.110.12345 > 10.0.0.2.12345: UDP, length 16
13:03:54.512870 IP 10.103.201.68.12345 > 10.0.0.2.12345: UDP, length 16
13:03:55.313736 IP 10.83.165.205.12345 > 10.0.0.2.12345: UDP, length 16
13:03:56.114295 IP 10.45.241.114.12345 > 10.0.0.2.12345: UDP, length 16
13:03:56.914531 IP 10.1.62.58.12345 > 10.0.0.2.12345: UDP, length 16
13:03:57.716143 IP 10.96.246.25.12345 > 10.0.0.2.12345: UDP, length 16
13:03:58.514273 IP 10.87.79.157.12345 > 10.0.0.2.12345: UDP, length 16
13:03:59.316385 IP 10.21.254.171.12345 > 10.0.0.2.12345: UDP, length 16
13:04:00.115384 IP 10.53.193.177.12345 > 10.0.0.2.12345: UDP, length 16
13:04:00.916168 IP 10.84.253.173.12345 > 10.0.0.2.12345: UDP, length 16
13:04:01.716102 IP 10.48.138.115.12345 > 10.0.0.2.12345: UDP, length 16
13:04:02.515075 IP 10.39.36.230.12345 > 10.0.0.2.12345: UDP, length 16
13:04:03.317183 IP 10.30.109.119.12345 > 10.0.0.2.12345: UDP, length 16
13:04:04.117589 IP 10.63.254.15.12345 > 10.0.0.2.12345: UDP, length 16
13:04:04.916920 IP 10.51.194.89.12345 > 10.0.0.2.12345: UDP, length 16
13:04:05.718448 IP 10.68.221.27.12345 > 10.0.0.2.12345: UDP, length 16
13:04:06.516813 IP 10.82.37.7.12345 > 10.0.0.2.12345: UDP, length 16
13:04:07.318802 IP 10.86.69.39.12345 > 10.0.0.2.12345: UDP, length 16
13:04:08.118238 IP 10.50.158.125.12345 > 10.0.0.2.12345: UDP, length 16
13:04:08.918518 IP 10.70.201.218.12345 > 10.0.0.2.12345: UDP, length 16
13:04:09.721170 IP 10.16.109.239.12345 > 10.0.0.2.12345: UDP, length 16
13:04:10.519111 IP 10.68.116.149.12345 > 10.0.0.2.12345: UDP, length 16
13:04:11.318564 IP 10.24.62.44.12345 > 10.0.0.2.12345: UDP, length 16
13:04:12.120649 IP 10.77.217.135.12345 > 10.0.0.2.12345: UDP, length 16
13:04:12.920570 IP 10.89.185.44.12345 > 10.0.0.2.12345: UDP, length 16
13:04:13.721268 IP 10.71.86.62.12345 > 10.0.0.2.12345: UDP, length 16
13:04:14.521826 IP 10.14.162.208.12345 > 10.0.0.2.12345: UDP, length 16
13:04:15.323271 IP 10.54.111.112.12345 > 10.0.0.2.12345: UDP, length 16
13:04:16.121858 IP 10.28.54.88.12345 > 10.0.0.2.12345: UDP, length 16
13:04:16.921175 IP 10.6.48.227.12345 > 10.0.0.2.12345: UDP, length 16
13:04:17.723017 IP 10.92.179.9.12345 > 10.0.0.2.12345: UDP, length 16
13:04:18.522825 IP 10.14.170.111.12345 > 10.0.0.2.12345: UDP, length 16
13:04:19.322997 IP 10.119.241.40.12345 > 10.0.0.2.12345: UDP, length 16
13:04:20.122870 IP 10.86.110.230.12345 > 10.0.0.2.12345: UDP, length 16
13:04:20.924088 IP 10.31.163.46.12345 > 10.0.0.2.12345: UDP, length 16
13:04:21.724367 IP 10.24.123.95.12345 > 10.0.0.2.12345: UDP, length 16
13:04:22.523823 IP 10.81.28.108.12345 > 10.0.0.2.12345: UDP, length 16
13:04:23.325274 IP 10.6.192.209.12345 > 10.0.0.2.12345: UDP, length 16
13:04:24.125661 IP 10.69.101.85.12345 > 10.0.0.2.12345: UDP, length 16
13:04:24.925408 IP 10.56.82.126.12345 > 10.0.0.2.12345: UDP, length 16
13:04:25.726025 IP 10.40.191.243.12345 > 10.0.0.2.12345: UDP, length 16
13:04:26.524919 IP 10.93.76.205.12345 > 10.0.0.2.12345: UDP, length 16
13:04:27.324912 IP 10.62.218.236.12345 > 10.0.0.2.12345: UDP, length 16
13:04:28.127156 IP 10.7.65.157.12345 > 10.0.0.2.12345: UDP, length 16
13:04:28.926798 IP 10.30.148.56.12345 > 10.0.0.2.12345: UDP, length 16
13:04:29.727508 IP 10.110.213.49.12345 > 10.0.0.2.12345: UDP, length 16
13:04:30.527133 IP 10.106.217.42.12345 > 10.0.0.2.12345: UDP, length 16
13:04:31.328003 IP 10.93.168.3.12345 > 10.0.0.2.12345: UDP, length 16
13:04:32.127957 IP 10.84.3.201.12345 > 10.0.0.2.12345: UDP, length 16
13:04:32.928401 IP 10.54.106.79.12345 > 10.0.0.2.12345: UDP, length 16
13:04:33.729293 IP 10.103.74.191.12345 > 10.0.0.2.12345: UDP, length 16
13:04:34.527090 IP 10.91.22.39.12345 > 10.0.0.2.12345: UDP, length 16
13:04:35.329071 IP 10.24.116.100.12345 > 10.0.0.2.12345: UDP, length 16
13:04:36.130168 IP 10.99.224.8.12345 > 10.0.0.2.12345: UDP, length 16
13:04:36.929109 IP 10.104.49.251.12345 > 10.0.0.2.12345: UDP, length 16
13:04:37.729139 IP 10.66.65.132.12345 > 10.0.0.2.12345: UDP, length 16
13:04:38.528644 IP 10.106.28.2.12345 > 10.0.0.2.12345: UDP, length 16
13:04:39.330723 IP 10.102.240.104.12345 > 10.0.0.2.12345: UDP, length 16
13:04:40.131449 IP 10.29.25.232.12345 > 10.0.0.2.12345: UDP, length 16
13:04:40.930016 IP 10.5.150.244.12345 > 10.0.0.2.12345: UDP, length 16
13:04:41.731137 IP 10.5.70.159.12345 > 10.0.0.2.12345: UDP, length 16
13:04:42.530031 IP 10.119.2.229.12345 > 10.0.0.2.12345: UDP, length 16
13:04:43.331562 IP 10.12.115.15.12345 > 10.0.0.2.12345: UDP, length 16
13:04:44.132028 IP 10.2.69.226.12345 > 10.0.0.2.12345: UDP, length 16
13:04:44.932844 IP 10.46.106.10.12345 > 10.0.0.2.12345: UDP, length 16
13:04:45.733479 IP 10.102.101.161.12345 > 10.0.0.2.12345: UDP, length 16
13:04:46.534239 IP 10.97.217.185.12345 > 10.0.0.2.12345: UDP, length 16
13:04:47.333743 IP 10.62.139.98.12345 > 10.0.0.2.12345: UDP, length 16
13:04:48.134452 IP 10.37.209.60.12345 > 10.0.0.2.12345: UDP, length 16
13:04:48.934952 IP 10.77.159.93.12345 > 10.0.0.2.12345: UDP, length 16
13:04:49.734984 IP 10.57.204.123.12345 > 10.0.0.2.12345: UDP, length 16
13:04:50.535614 IP 10.91.192.45.12345 > 10.0.0.2.12345: UDP, length 16
13:04:51.334809 IP 10.92.62.177.12345 > 10.0.0.2.12345: UDP, length 16
13:04:52.136311 IP 10.103.19.212.12345 > 10.0.0.2.12345: UDP, length 16
13:04:52.935522 IP 10.92.227.74.12345 > 10.0.0.2.12345: UDP, length 16
13:04:53.736673 IP 10.47.209.66.12345 > 10.0.0.2.12345: UDP, length 16
13:04:54.537283 IP 10.123.249.231.12345 > 10.0.0.2.12345: UDP, length 16
13:04:55.337591 IP 10.68.234.5.12345 > 10.0.0.2.12345: UDP, length 16
13:04:56.137660 IP 10.77.253.206.12345 > 10.0.0.2.12345: UDP, length 16
13:04:56.937285 IP 10.15.202.217.12345 > 10.0.0.2.12345: UDP, length 16
13:04:57.738460 IP 10.3.195.21.12345 > 10.0.0.2.12345: UDP, length 16
13:04:58.538372 IP 10.9.78.13.12345 > 10.0.0.2.12345: UDP, length 16
13:04:59.337226 IP 10.91.63.136.12345 > 10.0.0.2.12345: UDP, length 16
13:05:00.139388 IP 10.90.245.74.12345 > 10.0.0.2.12345: UDP, length 16
13:05:00.938284 IP 10.66.99.245.12345 > 10.0.0.2.12345: UDP, length 16
13:05:01.739805 IP 10.71.239.122.12345 > 10.0.0.2.12345: UDP, length 16
13:05:02.540466 IP 10.92.233.14.12345 > 10.0.0.2.12345: UDP, length 16
13:05:03.340163 IP 10.24.65.196.12345 > 10.0.0.2.12345: UDP, length 16
13:05:04.141175 IP 10.47.179.65.12345 > 10.0.0.2.12345: UDP, length 16
13:05:04.940791 IP 10.81.83.2.12345 > 10.0.0.2.12345: UDP, length 16
13:05:05.741669 IP 10.95.178.97.12345 > 10.0.0.2.12345: UDP, length 16
13:05:06.541646 IP 10.90.110.107.12345 > 10.0.0.2.12345: UDP, length 16
13:05:07.342330 IP 10.115.194.132.12345 > 10.0.0.2.12345: UDP, length 16
13:05:08.142719 IP 10.79.61.117.12345 > 10.0.0.2.12345: UDP, length 16
13:05:08.942302 IP 10.118.194.125.12345 > 10.0.0.2.12345: UDP, length 16
13:05:09.743182 IP 10.111.164.163.12345 > 10.0.0.2.12345: UDP, length 16
13:05:10.543611 IP 10.86.115.187.12345 > 10.0.0.2.12345: UDP, length 16
13:05:11.342680 IP 10.85.163.54.12345 > 10.0.0.2.12345: UDP, length 16
13:05:12.145486 IP 10.112.122.206.12345 > 10.0.0.2.12345: UDP, length 16
13:05:12.943783 IP 10.112.215.80.12345 > 10.0.0.2.12345: UDP, length 16
13:05:13.743826 IP 10.4.32.197.12345 > 10.0.0.2.12345: UDP, length 16
13:05:14.545234 IP 10.104.228.101.12345 > 10.0.0.2.12345: UDP, length 16
13:05:15.345067 IP 10.107.54.133.12345 > 10.0.0.2.12345: UDP, length 16
13:05:16.145957 IP 10.70.176.2.12345 > 10.0.0.2.12345: UDP, length 16
13:05:16.945179 IP 10.62.146.181.12345 > 10.0.0.2.12345: UDP, length 16
13:05:17.746496 IP 10.16.213.73.12345 > 10.0.0.2.12345: UDP, length 16
13:05:18.546363 IP 10.28.221.68.12345 > 10.0.0.2.12345: UDP, length 16
13:05:19.346715 IP 10.115.132.104.12345 > 10.0.0.2.12345: UDP, length 16
13:05:20.147218 IP 10.105.104.86.12345 > 10.0.0.2.12345: UDP, length 16
13:05:20.946728 IP 10.120.228.115.12345 > 10.0.0.2.12345: UDP, length 16
13:05:21.747926 IP 10.34.131.141.12345 > 10.0.0.2.12345: UDP, length 16
13:05:22.548507 IP 10.51.14.111.12345 > 10.0.0.2.12345: UDP, length 16
13:05:23.348161 IP 10.126.128.113.12345 > 10.0.0.2.12345: UDP, length 16
13:05:24.148897 IP 10.3.208.21.12345 > 10.0.0.2.12345: UDP, length 16
13:05:24.948080 IP 10.16.171.139.12345 > 10.0.0.2.12345: UDP, length 16
13:05:25.749649 IP 10.125.64.23.12345 > 10.0.0.2.12345: UDP, length 16
13:05:26.549934 IP 10.108.136.12.12345 > 10.0.0.2.12345: UDP, length 16
13:05:27.349469 IP 10.40.159.64.12345 > 10.0.0.2.12345: UDP, length 16
13:05:28.150950 IP 10.58.34.57.12345 > 10.0.0.2.12345: UDP, length 16
13:05:28.949258 IP 10.108.120.111.12345 > 10.0.0.2.12345: UDP, length 16
13:05:29.750496 IP 10.22.44.68.12345 > 10.0.0.2.12345: UDP, length 16
13:05:30.551626 IP 10.39.79.186.12345 > 10.0.0.2.12345: UDP, length 16
13:05:31.351205 IP 10.94.163.201.12345 > 10.0.0.2.12345: UDP, length 16
13:05:32.152073 IP 10.23.115.86.12345 > 10.0.0.2.12345: UDP, length 16
13:05:32.950483 IP 10.114.216.185.12345 > 10.0.0.2.12345: UDP, length 16
13:05:33.750712 IP 10.114.10.235.12345 > 10.0.0.2.12345: UDP, length 16
13:05:34.552890 IP 10.104.76.147.12345 > 10.0.0.2.12345: UDP, length 16
13:05:35.351711 IP 10.48.112.126.12345 > 10.0.0.2.12345: UDP, length 16
13:05:36.153890 IP 10.32.27.139.12345 > 10.0.0.2.12345: UDP, length 16
13:05:36.954108 IP 10.72.110.141.12345 > 10.0.0.2.12345: UDP, length 16
13:05:37.753999 IP 10.65.68.72.12345 > 10.0.0.2.12345: UDP, length 16
13:05:38.554915 IP 10.124.233.124.12345 > 10.0.0.2.12345: UDP, length 16
13:05:39.353645 IP 10.84.141.225.12345 > 10.0.0.2.12345: UDP, length 16
13:05:40.156725 IP 10.115.24.252.12345 > 10.0.0.2.12345: UDP, length 16
13:05:40.954169 IP 10.52.139.230.12345 > 10.0.0.2.12345: UDP, length 16
13:05:41.755043 IP 10.109.215.233.12345 > 10.0.0.2.12345: UDP, length 16
13:05:42.556130 IP 10.91.55.125.12345 > 10.0.0.2.12345: UDP, length 16
13:05:43.355666 IP 10.88.110.243.12345 > 10.0.0.2.12345: UDP, length 16
13:05:44.155048 IP 10.58.232.216.12345 > 10.0.0.2.12345: UDP, length 16
13:05:44.956460 IP 10.20.228.157.12345 > 10.0.0.2.12345: UDP, length 16
13:05:45.758242 IP 10.73.121.2.12345 > 10.0.0.2.12345: UDP, length 16
13:05:46.559035 IP 10.48.3.214.12345 > 10.0.0.2.12345: UDP, length 16
13:05:47.358191 IP 10.69.50.8.12345 > 10.0.0.2.12345: UDP, length 16
13:05:48.158460 IP 10.64.149.165.12345 > 10.0.0.2.12345: UDP, length 16
13:05:48.958882 IP 10.9.13.105.12345 > 10.0.0.2.12345: UDP, length 16
13:05:49.758724 IP 10.60.180.120.12345 > 10.0.0.2.12345: UDP, length 16
13:05:50.559524 IP 10.16.248.160.12345 > 10.0.0.2.12345: UDP, length 16
13:05:51.358596 IP 10.72.21.214.12345 > 10.0.0.2.12345: UDP, length 16
13:05:52.161497 IP 10.98.105.120.12345 > 10.0.0.2.12345: UDP, length 16
13:05:52.958515 IP 10.55.159.34.12345 > 10.0.0.2.12345: UDP, length 16
13:05:53.760209 IP 10.45.128.107.12345 > 10.0.0.2.12345: UDP, length 16
13:05:54.560906 IP 10.21.186.149.12345 > 10.0.0.2.12345: UDP, length 16
13:05:55.360769 IP 10.49.61.97.12345 > 10.0.0.2.12345: UDP, length 16
13:05:56.159451 IP 10.72.81.99.12345 > 10.0.0.2.12345: UDP, length 16
13:05:56.961477 IP 10.70.66.55.12345 > 10.0.0.2.12345: UDP, length 16
13:05:57.761610 IP 10.6.42.238.12345 > 10.0.0.2.12345: UDP, length 16
13:05:58.562508 IP 10.67.202.62.12345 > 10.0.0.2.12345: UDP, length 16
13:05:59.361170 IP 10.73.36.44.12345 > 10.0.0.2.12345: UDP, length 16
13:06:00.163050 IP 10.4.192.76.12345 > 10.0.0.2.12345: UDP, length 16
13:06:00.963510 IP 10.84.233.103.12345 > 10.0.0.2.12345: UDP, length 16
13:06:01.763725 IP 10.120.120.189.12345 > 10.0.0.2.12345: UDP, length 16
13:06:02.564344 IP 10.99.78.98.12345 > 10.0.0.2.12345: UDP, length 16
13:06:03.363451 IP 10.104.8.140.12345 > 10.0.0.2.12345: UDP, length 16
13:06:04.165061 IP 10.2.35.135.12345 > 10.0.0.2.12345: UDP, length 16
13:06:04.964969 IP 10.72.207.142.12345 > 10.0.0.2.12345: UDP, length 16
13:06:05.764906 IP 10.95.199.70.12345 > 10.0.0.2.12345: UDP, length 16
13:06:06.565537 IP 10.19.149.71.12345 > 10.0.0.2.12345: UDP, length 16
13:06:07.364670 IP 10.127.222.154.12345 > 10.0.0.2.12345: UDP, length 16
13:06:08.166336 IP 10.12.73.142.12345 > 10.0.0.2.12345: UDP, length 16
13:06:08.967027 IP 10.94.180.153.12345 > 10.0.0.2.12345: UDP, length 16
13:06:09.766119 IP 10.79.44.254.12345 > 10.0.0.2.12345: UDP, length 16
13:06:10.567436 IP 10.83.64.157.12345 > 10.0.0.2.12345: UDP, length 16
13:06:11.366950 IP 10.84.147.21.12345 > 10.0.0.2.12345: UDP, length 16
13:06:12.168383 IP 10.1.175.110.12345 > 10.0.0.2.12345: UDP, length 16
13:06:12.968857 IP 10.86.78.185.12345 > 10.0.0.2.12345: UDP, length 16
13:06:13.769053 IP 10.108.93.114.12345 > 10.0.0.2.12345: UDP, length 16
13:06:14.569653 IP 10.11.230.38.12345 > 10.0.0.2.12345: UDP, length 16
13:06:15.368568 IP 10.66.30.102.12345 > 10.0.0.2.12345: UDP, length 16
13:06:16.170115 IP 10.24.215.154.12345 > 10.0.0.2.12345: UDP, length 16
13:06:16.969610 IP 10.75.161.147.12345 > 10.0.0.2.12345: UDP, length 16
13:06:17.770788 IP 10.39.240.246.12345 > 10.0.0.2.12345: UDP, length 16
13:06:18.570896 IP 10.88.42.139.12345 > 10.0.0.2.12345: UDP, length 16
13:06:19.370815 IP 10.44.170.96.12345 > 10.0.0.2.12345: UDP, length 16
13:06:20.170702 IP 10.98.137.76.12345 > 10.0.0.2.12345: UDP, length 16
13:06:20.971766 IP 10.81.175.180.12345 > 10.0.0.2.12345: UDP, length 16
13:06:21.771785 IP 10.99.244.190.12345 > 10.0.0.2.12345: UDP, length 16
13:06:22.572599 IP 10.24.185.52.12345 > 10.0.0.2.12345: UDP, length 16
13:06:23.371769 IP 10.109.229.65.12345 > 10.0.0.2.12345: UDP, length 16
13:06:24.173314 IP 10.68.53.109.12345 > 10.0.0.2.12345: UDP, length 16
13:06:24.973549 IP 10.35.16.195.12345 > 10.0.0.2.12345: UDP, length 16
13:06:25.773125 IP 10.109.106.138.12345 > 10.0.0.2.12345: UDP, length 16
13:06:26.573904 IP 10.126.100.119.12345 > 10.0.0.2.12345: UDP, length 16
13:06:27.373745 IP 10.127.5.34.12345 > 10.0.0.2.12345: UDP, length 16
13:06:28.174911 IP 10.20.197.16.12345 > 10.0.0.2.12345: UDP, length 16
13:06:28.975313 IP 10.55.222.158.12345 > 10.0.0.2.12345: UDP, length 16
13:06:29.775543 IP 10.25.176.37.12345 > 10.0.0.2.12345: UDP, length 16
13:06:30.575460 IP 10.62.120.199.12345 > 10.0.0.2.12345: UDP, length 16
13:06:31.375772 IP 10.99.106.141.12345 > 10.0.0.2.12345: UDP, length 16
13:06:32.175952 IP 10.116.121.240.12345 > 10.0.0.2.12345: UDP, length 16
13:06:32.977209 IP 10.82.201.39.12345 > 10.0.0.2.12345: UDP, length 16
13:06:33.775928 IP 10.50.172.48.12345 > 10.0.0.2.12345: UDP, length 16
13:06:34.577771 IP 10.3.45.168.12345 > 10.0.0.2.12345: UDP, length 16
13:06:35.377049 IP 10.14.0.190.12345 > 10.0.0.2.12345: UDP, length 16
13:06:36.177584 IP 10.106.204.54.12345 > 10.0.0.2.12345: UDP, length 16
13:06:36.978759 IP 10.79.179.157.12345 > 10.0.0.2.12345: UDP, length 16
13:06:37.777553 IP 10.117.102.180.12345 > 10.0.0.2.12345: UDP, length 16
13:06:38.578502 IP 10.116.178.152.12345 > 10.0.0.2.12345: UDP, length 16
13:06:39.378639 IP 10.76.53.125.12345 > 10.0.0.2.12345: UDP, length 16
13:06:40.179459 IP 10.62.242.148.12345 > 10.0.0.2.12345: UDP, length 16
13:06:40.978800 IP 10.76.43.170.12345 > 10.0.0.2.12345: UDP, length 16
13:06:41.779271 IP 10.121.245.210.12345 > 10.0.0.2.12345: UDP, length 16
13:06:42.580912 IP 10.107.5.120.12345 > 10.0.0.2.12345: UDP, length 16
13:06:43.381383 IP 10.0.166.65.12345 > 10.0.0.2.12345: UDP, length 16
13:06:44.179737 IP 10.34.178.166.12345 > 10.0.0.2.12345: UDP, length 16
13:06:44.981976 IP 10.71.210.140.12345 > 10.0.0.2.12345: UDP, length 16
13:06:45.780568 IP 10.4.30.254.12345 > 10.0.0.2.12345: UDP, length 16
13:06:46.582839 IP 10.41.251.48.12345 > 10.0.0.2.12345: UDP, length 16
13:06:47.382123 IP 10.23.123.81.12345 > 10.0.0.2.12345: UDP, length 16
13:06:48.182272 IP 10.1.122.227.12345 > 10.0.0.2.12345: UDP, length 16
13:06:48.983629 IP 10.59.247.104.12345 > 10.0.0.2.12345: UDP, length 16
13:06:49.781563 IP 10.102.184.60.12345 > 10.0.0.2.12345: UDP, length 16
13:06:50.583790 IP 10.13.142.104.12345 > 10.0.0.2.12345: UDP, length 16
13:06:51.384475 IP 10.6.194.108.12345 > 10.0.0.2.12345: UDP, length 16
13:06:52.183079 IP 10.82.205.153.12345 > 10.0.0.2.12345: UDP, length 16
13:06:52.984676 IP 10.4.98.122.12345 > 10.0.0.2.12345: UDP, length 16
13:06:53.782981 IP 10.20.149.65.12345 > 10.0.0.2.12345: UDP, length 16
13:06:54.585549 IP 10.15.71.248.12345 > 10.0.0.2.12345: UDP, length 16
13:06:55.385472 IP 10.123.254.93.12345 > 10.0.0.2.12345: UDP, length 16
13:06:56.184704 IP 10.76.145.21.12345 > 10.0.0.2.12345: UDP, length 16
13:06:56.986692 IP 10.102.245.101.12345 > 10.0.0.2.12345: UDP, length 16
13:06:57.785205 IP 10.126.62.118.12345 > 10.0.0.2.12345: UDP, length 16
13:06:58.587338 IP 10.58.4.142.12345 > 10.0.0.2.12345: UDP, length 16
13:06:59.387036 IP 10.16.129.242.12345 > 10.0.0.2.12345: UDP, length 16
13:07:00.186359 IP 10.103.63.225.12345 > 10.0.0.2.12345: UDP, length 16
13:07:00.988317 IP 10.15.144.90.12345 > 10.0.0.2.12345: UDP, length 16
13:07:01.786696 IP 10.121.187.92.12345 > 10.0.0.2.12345: UDP, length 16
