09:27:28.743128 IP 10.0.0.1.12345 > 10.0.0.2.12345: UDP, length 16
09:27:29.743367 IP 10.0.0.1.12345 > 10.0.0.2.12345: UDP, length 16
09:27:30.743598 IP 10.0.0.1.12345 > 10.0.0.2.12345: UDP, length 16
09:27:31.743806 IP 10.0.0.1.12345 > 10.0.0.2.12345: UDP, length 16
09:27:32.744032 IP 10.0.0.1.12345 > 10.0.0.2.12345: UDP, length 16
09:27:33.744273 IP 10.0.0.1.12345 > 10.0.0.2.12345: UDP, length 16
09:27:34.744503 IP 10.0.0.1.12345 > 10.0.0.2.12345: UDP, length 16
09:27:35.744745 IP 10.0.0.1.12345 > 10.0.0.2.12345: UDP, length 16
09:27:36.744968 IP 10.0.0.1.12345 > 10.0.0.2.12345: UDP, length 16
09:27:37.745210 IP 10.0.0.1.12345 > 10.0.0.2.12345: UDP, length 16
09:27:38.745457 IP 10.0.0.1.12345 > 10.0.0.2.12345: UDP, length 16
09:27:39.745704 IP 10.0.0.1.12345 > 10.0.0.2.12345: UDP, length 16
09:27:40.745926 IP 10.0.0.1.12345 > 10.0.0.2.12345: UDP, length 16
09:27:41.746158 IP 10.0.0.1.12345 > 10.0.0.2.12345: UDP, length 16
09:27:42.746392 IP 10.0.0.1.12345 > 10.0.0.2.12345: UDP, length 16
09:27:43.746580 IP 10.0.0.1.12345 > 10.0.0.2.12345: UDP, length 16
09:27:44.746784 IP 10.0.0.1.12345 > 10.0.0.2.12345: UDP, length 16
09:27:45.746982 IP 10.0.0.1.12345 > 10.0.0.2.12345: UDP, length 16
09:27:46.747183 IP 10.0.0.1.12345 > 10.0.0.2.12345: UDP, length 16
09:27:47.747399 IP 10.0.0.1.12345 > 10.0.0.2.12345: UDP, length 16
09:27:48.747616 IP 10.0.0.1.12345 > 10.0.0.2.12345: UDP, length 16
09:27:49.747842 IP 10.0.0.1.12345 > 10.0.0.2.12345: UDP, length 16
09:27:50.748072 IP 10.0.0.1.12345 > 10.0.0.2.12345: UDP, length 16
09:27:51.748254 IP 10.0.0.1.12345 > 10.0.0.2.12345: UDP, length 16
09:27:52.748475 IP 10.0.0.1.12345 > 10.0.0.2.12345: UDP, length 16
09:27:53.748707 IP 10.0.0.1.12345 > 10.0.0.2.12345: UDP, length 16
09:27:54.748951 IP 10.0.0.1.12345 > 10.0.0.2.12345: UDP, length 16
09:27:55.749189 IP 10.0.0.1.12345 > 10.0.0.2.12345: UDP, length 16
09:27:56.749432 IP 10.0.0.1.12345 > 10.0.0.2.12345: UDP, length 16
09:27:57.749631 IP 10.0.0.1.12345 > 10.0.0.2.12345: UDP, length 16
09:27:58.749863 IP 10.0.0.1.12345 > 10.0.0.2.12345: UDP, length 16
09:27:59.750102 IP 10.0.0.1.12345 > 10.0.0.2.12345: UDP, length 16
09:28:00.750311 IP 10.0.0.1.12345 > 10.0.0.2.12345: UDP, length 16
09:28:01.750539 IP 10.0.0.1.12345 > 10.0.0.2.12345: UDP, length 16
09:28:02.750719 IP 10.0.0.1.12345 > 10.0.0.2.12345: UDP, length 16
09:28:03.750939 IP 10.0.0.1.12345 > 10.0.0.2.12345: UDP, length 16
09:28:04.751183 IP 10.0.0.1.12345 > 10.0.0.2.12345: UDP, length 16
09:28:05.751367 IP 10.0.0.1.12345 > 10.0.0.2.12345: UDP, length 16
09:28:06.751599 IP 10.0.0.1.12345 > 10.0.0.2.12345: UDP, length 16
09:28:07.751842 IP 10.0.0.1.12345 > 10.0.0.2.12345: UDP, length 16
09:28:08.752079 IP 10.0.0.1.12345 > 10.0.0.2.12345: UDP, length 16
09:28:09.752311 IP 10.0.0.1.12345 > 10.0.0.2.12345: UDP, length 16
09:28:10.752489 IP 10.0.0.1.12345 > 10.0.0.2.12345: UDP, length 16
09:28:11.752717 IP 10.0.0.1.12345 > 10.0.0.2.12345: UDP, length 16
09:28:12.752920 IP 10.0.0.1.12345 > 10.0.0.2.12345: UDP, length 16
09:28:13.753155 IP 10.0.0.1.12345 > 10.0.0.2.12345: UDP, length 16
09:28:14.753398 IP 10.0.0.1.12345 > 10.0.0.2.12345: UDP, length 16
09:28:15.753643 IP 10.0.0.1.12345 > 10.0.0.2.12345: UDP, length 16
09:28:16.753866 IP 10.0.0.1.12345 > 10.0.0.2.12345: UDP, length 16
09:28:17.754104 IP 10.0.0.1.12345 > 10.0.0.2.12345: UDP, length 16
09:28:18.754330 IP 10.0.0.1.12345 > 10.0.0.2.12345: UDP, length 16
09:28:19.754570 IP 10.0.0.1.12345 > 10.0.0.2.12345: UDP, length 16
09:28:20.754795 IP 10.0.0.1.12345 > 10.0.0.2.12345: UDP, length 16
09:28:21.755034 IP 10.0.0.1.12345 > 10.0.0.2.12345: UDP, length 16
09:28:22.755268 IP 10.0.0.1.12345 > 10.0.0.2.12345: UDP, length 16
09:28:23.755508 IP 10.0.0.1.12345 > 10.0.0.2.12345: UDP, length 16
09:28:24.755786 IP 10.0.0.1.12345 > 10.0.0.2.12345: UDP, length 16
09:28:25.756025 IP 10.0.0.1.12345 > 10.0.0.2.12345: UDP, length 16
09:28:26.756253 IP 10.0.0.1.12345 > 10.0.0.2.12345: UDP, length 16
09:28:27.756492 IP 10.0.0.1.12345 > 10.0.0.2.12345: UDP, length 16
09:28:28.756734 IP 10.0.0.1.12345 > 10.0.0.2.12345: UDP, length 16
09:28:29.756973 IP 10.0.0.1.12345 > 10.0.0.2.12345: UDP, length 16
09:28:30.757171 IP 10.0.0.1.12345 > 10.0.0.2.12345: UDP, length 16
09:28:31.757378 IP 10.0.0.1.12345 > 10.0.0.2.12345: UDP, length 16
09:28:32.757594 IP 10.0.0.1.12345 > 10.0.0.2.12345: UDP, length 16
09:28:33.757831 IP 10.0.0.1.12345 > 10.0.0.2.12345: UDP, length 16
09:28:34.758058 IP 10.0.0.1.12345 > 10.0.0.2.12345: UDP, length 16
09:28:35.758297 IP 10.0.0.1.12345 > 10.0.0.2.12345: UDP, length 16
09:28:36.758495 IP 10.0.0.1.12345 > 10.0.0.2.12345: UDP, length 16
09:28:37.758732 IP 10.0.0.1.12345 > 10.0.0.2.12345: UDP, length 16
09:28:38.758946 IP 10.0.0.1.12345 > 10.0.0.2.12345: UDP, length 16
09:28:39.759184 IP 10.0.0.1.12345 > 10.0.0.2.12345: UDP, length 16
09:28:40.759387 IP 10.0.0.1.12345 > 10.0.0.2.12345: UDP, length 16
09:28:41.759620 IP 10.0.0.1.12345 > 10.0.0.2.12345: UDP, length 16
09:28:42.759822 IP 10.0.0.1.12345 > 10.0.0.2.12345: UDP, length 16
09:28:43.760059 IP 10.0.0.1.12345 > 10.0.0.2.12345: UDP, length 16
09:28:44.760269 IP 10.0.0.1.12345 > 10.0.0.2.12345: UDP, length 16
09:28:45.760506 IP 10.0.0.1.12345 > 10.0.0.2.12345: UDP, length 16
09:28:46.760710 IP 10.0.0.1.12345 > 10.0.0.2.12345: UDP, length 16
09:28:47.760946 IP 10.0.0.1.12345 > 10.0.0.2.12345: UDP, length 16
09:28:48.761155 IP 10.0.0.1.12345 > 10.0.0.2.12345: UDP, length 16
09:28:49.761392 IP 10.0.0.1.12345 > 10.0.0.2.12345: UDP, length 16
09:28:50.761600 IP 10.0.0.1.12345 > 10.0.0.2.12345: UDP, length 16
09:28:51.761857 IP 10.0.0.1.12345 > 10.0.0.2.12345: UDP, length 16
09:28:52.762039 IP 10.0.0.1.12345 > 10.0.0.2.12345: UDP, length 16
09:28:53.762267 IP 10.0.0.1.12345 > 10.0.0.2.12345: UDP, length 16
09:28:54.762448 IP 10.0.0.1.12345 > 10.0.0.2.12345: UDP, length 16
09:28:55.762678 IP 10.0.0.1.12345 > 10.0.0.2.12345: UDP, length 16
09:28:56.762861 IP 10.0.0.1.12345 > 10.0.0.2.12345: UDP, length 16
09:28:57.763052 IP 10.0.0.1.12345 > 10.0.0.2.12345: UDP, length 16
09:28:58.763270 IP 10.0.0.1.12345 > 10.0.0.2.12345: UDP, length 16
09:28:59.763510 IP 10.0.0.1.12345 > 10.0.0.2.12345: UDP, length 16
09:29:00.763735 IP 10.0.0.1.12345 > 10.0.0.2.12345: UDP, length 16
09:29:01.763897 IP 10.0.0.1.12345 > 10.0.0.2.12345: UDP, length 16
09:29:02.764070 IP 10.0.0.1.12345 > 10.0.0.2.12345: UDP, length 16
09:29:03.764302 IP 10.0.0.1.12345 > 10.0.0.2.12345: UDP, length 16
09:29:04.764484 IP 10.0.0.1.12345 > 10.0.0.2.12345: UDP, length 16
09:29:05.764675 IP 10.0.0.1.12345 > 10.0.0.2.12345: UDP, length 16
09:29:06.764906 IP 10.0.0.1.12345 > 10.0.0.2.12345: UDP, length 16
09:29:07.765142 IP 10.0.0.1.12345 > 10.0.0.2.12345: UDP, length 16
09:29:08.765381 IP 10.0.0.1.12345 > 10.0.0.2.12345: UDP, length 16
09:29:09.765624 IP 10.0.0.1.12345 > 10.0.0.2.12345: UDP, length 16
09:29:10.765815 IP 10.0.0.1.12345 > 10.0.0.2.12345: UDP, length 16
09:29:11.766046 IP 10.0.0.1.12345 > 10.0.0.2.12345: UDP, length 16
09:29:12.766191 IP 10.0.0.1.12345 > 10.0.0.2.12345: UDP, length 16
09:29:13.766421 IP 10.0.0.1.12345 > 10.0.0.2.12345: UDP, length 16
09:29:14.766660 IP 10.0.0.1.12345 > 10.0.0.2.12345: UDP, length 16
09:29:15.766899 IP 10.0.0.1.12345 > 10.0.0.2.12345: UDP, length 16
09:29:16.767109 IP 10.0.0.1.12345 > 10.0.0.2.12345: UDP, length 16
09:29:17.767343 IP 10.0.0.1.12345 > 10.0.0.2.12345: UDP, length 16
09:29:18.767589 IP 10.0.0.1.12345 > 10.0.0.2.12345: UDP, length 16
09:29:19.767822 IP 10.0.0.1.12345 > 10.0.0.2.12345: UDP, length 16
09:29:20.768065 IP 10.0.0.1.12345 > 10.0.0.2.12345: UDP, length 16
09:29:21.768306 IP 10.0.0.1.12345 > 10.0.0.2.12345: UDP, length 16
09:29:22.768549 IP 10.0.0.1.12345 > 10.0.0.2.12345: UDP, length 16
09:29:23.768791 IP 10.0.0.1.12345 > 10.0.0.2.12345: UDP, length 16
09:29:24.769037 IP 10.0.0.1.12345 > 10.0.0.2.12345: UDP, length 16
09:29:25.769273 IP 10.0.0.1.12345 > 10.0.0.2.12345: UDP, length 16
09:29:26.769517 IP 10.0.0.1.12345 > 10.0.0.2.12345: UDP, length 16
09:29:27.769762 IP 10.0.0.1.12345 > 10.0.0.2.12345: UDP, length 16
09:29:28.770011 IP 10.0.0.1.12345 > 10.0.0.2.12345: UDP, length 16
09:29:29.770252 IP 10.0.0.1.12345 > 10.0.0.2.12345: UDP, length 16
09:29:30.770496 IP 10.0.0.1.12345 > 10.0.0.2.12345: UDP, length 16
09:29:31.770738 IP 10.0.0.1.12345 > 10.0.0.2.12345: UDP, length 16
09:29:32.770984 IP 10.0.0.1.12345 > 10.0.0.2.12345: UDP, length 16
09:29:33.771226 IP 10.0.0.1.12345 > 10.0.0.2.12345: UDP, length 16
09:29:34.771471 IP 10.0.0.1.12345 > 10.0.0.2.12345: UDP, length 16
09:29:35.771675 IP 10.0.0.1.12345 > 10.0.0.2.12345: UDP, length 16
09:29:36.771912 IP 10.0.0.1.12345 > 10.0.0.2.12345: UDP, length 16
09:29:37.772135 IP 10.0.0.1.12345 > 10.0.0.2.12345: UDP, length 16
09:29:38.772379 IP 10.0.0.1.12345 > 10.0.0.2.12345: UDP, length 16
09:29:39.772626 IP 10.0.0.1.12345 > 10.0.0.2.12345: UDP, length 16
09:29:40.772866 IP 10.0.0.1.12345 > 10.0.0.2.12345: UDP, length 16
09:29:41.773089 IP 10.0.0.1.12345 > 10.0.0.2.12345: UDP, length 16
09:29:42.773330 IP 10.0.0.1.12345 > 10.0.0.2.12345: UDP, length 16
09:29:43.773568 IP 10.0.0.1.12345 > 10.0.0.2.12345: UDP, length 16
09:29:44.773809 IP 10.0.0.1.12345 > 10.0.0.2.12345: UDP, length 16
09:29:45.774051 IP 10.0.0.1.12345 > 10.0.0.2.12345: UDP, length 16
09:29:46.774280 IP 10.0.0.1.12345 > 10.0.0.2.12345: UDP, length 16
09:29:47.774519 IP 10.0.0.1.12345 > 10.0.0.2.12345: UDP, length 16
09:29:48.774763 IP 10.0.0.1.12345 > 10.0.0.2.12345: UDP, length 16
09:29:49.774996 IP 10.0.0.1.12345 > 10.0.0.2.12345: UDP, length 16
09:29:50.775237 IP 10.0.0.1.12345 > 10.0.0.2.12345: UDP, length 16
09:29:51.775467 IP 10.0.0.1.12345 > 10.0.0.2.12345: UDP, length 16
09:29:52.775806 IP 10.0.0.1.12345 > 10.0.0.2.12345: UDP, length 16
09:29:53.776042 IP 10.0.0.1.12345 > 10.0.0.2.12345: UDP, length 16
09:29:54.776287 IP 10.0.0.1.12345 > 10.0.0.2.12345: UDP, length 16
09:29:55.776524 IP 10.0.0.1.12345 > 10.0.0.2.12345: UDP, length 16
09:29:56.776766 IP 10.0.0.1.12345 > 10.0.0.2.12345: UDP, length 16
09:29:57.776883 IP 10.0.0.1.12345 > 10.0.0.2.12345: UDP, length 16
09:29:58.777119 IP 10.0.0.1.12345 > 10.0.0.2.12345: UDP, length 16
09:29:59.777353 IP 10.0.0.1.12345 > 10.0.0.2.12345: UDP, length 16
09:30:00.777596 IP 10.0.0.1.12345 > 10.0.0.2.12345: UDP, length 16
09:30:01.777819 IP 10.0.0.1.12345 > 10.0.0.2.12345: UDP, length 16
09:30:02.778063 IP 10.0.0.1.12345 > 10.0.0.2.12345: UDP, length 16
09:30:03.778305 IP 10.0.0.1.12345 > 10.0.0.2.12345: UDP, length 16
09:30:04.778549 IP 10.0.0.1.12345 > 10.0.0.2.12345: UDP, length 16
09:30:05.778753 IP 10.0.0.1.12345 > 10.0.0.2.12345: UDP, length 16
09:30:06.778992 IP 10.0.0.1.12345 > 10.0.0.2.12345: UDP, length 16
09:30:07.779239 IP 10.0.0.1.12345 > 10.0.0.2.12345: UDP, length 16
09:30:08.779447 IP 10.0.0.1.12345 > 10.0.0.2.12345: UDP, length 16
09:30:09.779639 IP 10.0.0.1.12345 > 10.0.0.2.12345: UDP, length 16
09:30:10.779822 IP 10.0.0.1.12345 > 10.0.0.2.12345: UDP, length 16
09:30:11.780031 IP 10.0.0.1.12345 > 10.0.0.2.12345: UDP, length 16
09:30:12.780265 IP 10.0.0.1.12345 > 10.0.0.2.12345: UDP, length 16
09:30:13.780472 IP 10.0.0.1.12345 > 10.0.0.2.12345: UDP, length 16
09:30:14.780708 IP 10.0.0.1.12345 > 10.0.0.2.12345: UDP, length 16
09:30:15.780940 IP 10.0.0.1.12345 > 10.0.0.2.12345: UDP, length 16
09:30:16.781168 IP 10.0.0.1.12345 > 10.0.0.2.12345: UDP, length 16
09:30:17.781410 IP 10.0.0.1.12345 > 10.0.0.2.12345: UDP, length 16
09:30:18.781611 IP 10.0.0.1.12345 > 10.0.0.2.12345: UDP, length 16
09:30:19.781835 IP 10.0.0.1.12345 > 10.0.0.2.12345: UDP, length 16
09:30:20.782077 IP 10.0.0.1.12345 > 10.0.0.2.12345: UDP, length 16
09:30:21.782303 IP 10.0.0.1.12345 > 10.0.0.2.12345: UDP, length 16
09:30:22.782546 IP 10.0.0.1.12345 > 10.0.0.2.12345: UDP, length 16
09:30:23.782792 IP 10.0.0.1.12345 > 10.0.0.2.12345: UDP, length 16
09:30:24.783036 IP 10.0.0.1.12345 > 10.0.0.2.12345: UDP, length 16
09:30:25.783283 IP 10.0.0.1.12345 > 10.0.0.2.12345: UDP, length 16
09:30:26.783530 IP 10.0.0.1.12345 > 10.0.0.2.12345: UDP, length 16
09:30:27.783756 IP 10.0.0.1.12345 > 10.0.0.2.12345: UDP, length 16
09:30:28.783992 IP 10.0.0.1.12345 > 10.0.0.2.12345: UDP, length 16
09:30:29.784217 IP 10.0.0.1.12345 > 10.0.0.2.12345: UDP, length 16
09:30:30.784458 IP 10.0.0.1.12345 > 10.0.0.2.12345: UDP, length 16
09:30:31.784692 IP 10.0.0.1.12345 > 10.0.0.2.12345: UDP, length 16
09:30:32.784934 IP 10.0.0.1.12345 > 10.0.0.2.12345: UDP, length 16
09:30:33.785162 IP 10.0.0.1.12345 > 10.0.0.2.12345: UDP, length 16
09:30:34.785311 IP 10.0.0.1.12345 > 10.0.0.2.12345: UDP, length 16
09:30:35.785545 IP 10.0.0.1.12345 > 10.0.0.2.12345: UDP, length 16
09:30:36.785781 IP 10.0.0.1.12345 > 10.0.0.2.12345: UDP, length 16
09:30:37.786007 IP 10.0.0.1.12345 > 10.0.0.2.12345: UDP, length 16
09:30:38.786240 IP 10.0.0.1.12345 > 10.0.0.2.12345: UDP, length 16
09:30:39.786437 IP 10.0.0.1.12345 > 10.0.0.2.12345: UDP, length 16
09:30:40.786670 IP 10.0.0.1.12345 > 10.0.0.2.12345: UDP, length 16
09:30:41.786879 IP 10.0.0.1.12345 > 10.0.0.2.12345: UDP, length 16
09:30:42.787118 IP 10.0.0.1.12345 > 10.0.0.2.12345: UDP, length 16
09:30:43.787341 IP 10.0.0.1.12345 > 10.0.0.2.12345: UDP, length 16
09:30:44.787582 IP 10.0.0.1.12345 > 10.0.0.2.12345: UDP, length 16
09:30:45.787782 IP 10.0.0.1.12345 > 10.0.0.2.12345: UDP, length 16
09:30:46.788020 IP 10.0.0.1.12345 > 10.0.0.2.12345: UDP, length 16
09:30:47.788226 IP 10.0.0.1.12345 > 10.0.0.2.12345: UDP, length 16
09:30:48.788429 IP 10.0.0.1.12345 > 10.0.0.2.12345: UDP, length 16
09:30:49.788635 IP 10.0.0.1.12345 > 10.0.0.2.12345: UDP, length 16
09:30:50.788871 IP 10.0.0.1.12345 > 10.0.0.2.12345: UDP, length 16
09:30:51.789079 IP 10.0.0.1.12345 > 10.0.0.2.12345: UDP, length 16
09:30:52.789316 IP 10.0.0.1.12345 > 10.0.0.2.12345: UDP, length 16
09:30:53.789519 IP 10.0.0.1.12345 > 10.0.0.2.12345: UDP, length 16
09:30:54.789759 IP 10.0.0.1.12345 > 10.0.0.2.12345: UDP, length 16
09:30:55.789963 IP 10.0.0.1.12345 > 10.0.0.2.12345: UDP, length 16
09:30:56.790202 IP 10.0.0.1.12345 > 10.0.0.2.12345: UDP, length 16
09:30:57.790406 IP 10.0.0.1.12345 > 10.0.0.2.12345: UDP, length 16
09:30:58.790631 IP 10.0.0.1.12345 > 10.0.0.2.12345: UDP, length 16
09:30:59.790836 IP 10.0.0.1.12345 > 10.0.0.2.12345: UDP, length 16
09:31:00.791072 IP 10.0.0.1.12345 > 10.0.0.2.12345: UDP, length 16
09:31:01.791316 IP 10.0.0.1.12345 > 10.0.0.2.12345: UDP, length 16
09:31:02.791561 IP 10.0.0.1.12345 > 10.0.0.2.12345: UDP, length 16
09:31:03.791776 IP 10.0.0.1.12345 > 10.0.0.2.12345: UDP, length 16
09:31:04.792003 IP 10.0.0.1.12345 > 10.0.0.2.12345: UDP, length 16
09:31:05.792180 IP 10.0.0.1.12345 > 10.0.0.2.12345: UDP, length 16
09:31:06.792413 IP 10.0.0.1.12345 > 10.0.0.2.12345: UDP, length 16
09:31:07.792593 IP 10.0.0.1.12345 > 10.0.0.2.12345: UDP, length 16
09:31:08.792814 IP 10.0.0.1.12345 > 10.0.0.2.12345: UDP, length 16
09:31:09.792991 IP 10.0.0.1.12345 > 10.0.0.2.12345: UDP, length 16
09:31:10.793178 IP 10.0.0.1.12345 > 10.0.0.2.12345: UDP, length 16
09:31:11.793348 IP 10.0.0.1.12345 > 10.0.0.2.12345: UDP, length 16
09:31:12.793583 IP 10.0.0.1.12345 > 10.0.0.2.12345: UDP, length 16
09:31:13.793756 IP 10.0.0.1.12345 > 10.0.0.2.12345: UDP, length 16
09:31:14.793987 IP 10.0.0.1.12345 > 10.0.0.2.12345: UDP, length 16
09:31:15.794168 IP 10.0.0.1.12345 > 10.0.0.2.12345: UDP, length 16
09:31:16.794403 IP 10.0.0.1.12345 > 10.0.0.2.12345: UDP, length 16
09:31:17.794651 IP 10.0.0.1.12345 > 10.0.0.2.12345: UDP, length 16
09:31:18.794884 IP 10.0.0.1.12345 > 10.0.0.2.12345: UDP, length 16
09:31:19.795133 IP 10.0.0.1.12345 > 10.0.0.2.12345: UDP, length 16
09:31:20.795378 IP 10.0.0.1.12345 > 10.0.0.2.12345: UDP, length 16
09:31:21.795626 IP 10.0.0.1.12345 > 10.0.0.2.12345: UDP, length 16
09:31:22.795842 IP 10.0.0.1.12345 > 10.0.0.2.12345: UDP, length 16
09:31:23.796092 IP 10.0.0.1.12345 > 10.0.0.2.12345: UDP, length 16
09:31:24.796335 IP 10.0.0.1.12345 > 10.0.0.2.12345: UDP, length 16
09:31:25.796578 IP 10.0.0.1.12345 > 10.0.0.2.12345: UDP, length 16
09:31:26.796823 IP 10.0.0.1.12345 > 10.0.0.2.12345: UDP, length 16
09:31:27.797070 IP 10.0.0.1.12345 > 10.0.0.2.12345: UDP, length 16
09:31:28.797316 IP 10.0.0.1.12345 > 10.0.0.2.12345: UDP, length 16
09:31:29.797562 IP 10.0.0.1.12345 > 10.0.0.2.12345: UDP, length 16
09:31:30.797807 IP 10.0.0.1.12345 > 10.0.0.2.12345: UDP, length 16
09:31:31.798048 IP 10.0.0.1.12345 > 10.0.0.2.12345: UDP, length 16
09:31:32.798286 IP 10.0.0.1.12345 > 10.0.0.2.12345: UDP, length 16
09:31:33.798529 IP 10.0.0.1.12345 > 10.0.0.2.12345: UDP, length 16
09:31:34.798769 IP 10.0.0.1.12345 > 10.0.0.2.12345: UDP, length 16
09:31:35.799011 IP 10.0.0.1.12345 > 10.0.0.2.12345: UDP, length 16
09:31:36.799254 IP 10.0.0.1.12345 > 10.0.0.2.12345: UDP, length 16
09:31:37.799492 IP 10.0.0.1.12345 > 10.0.0.2.12345: UDP, length 16
09:31:38.799815 IP 10.0.0.1.12345 > 10.0.0.2.12345: UDP, length 16
09:31:39.800037 IP 10.0.0.1.12345 > 10.0.0.2.12345: UDP, length 16
09:31:40.800276 IP 10.0.0.1.12345 > 10.0.0.2.12345: UDP, length 16
09:31:41.800538 IP 10.0.0.1.12345 > 10.0.0.2.12345: UDP, length 16
09:31:42.800777 IP 10.0.0.1.12345 > 10.0.0.2.12345: UDP, length 16
09:31:43.801019 IP 10.0.0.1.12345 > 10.0.0.2.12345: UDP, length 16
09:31:44.801260 IP 10.0.0.1.12345 > 10.0.0.2.12345: UDP, length 16
09:31:45.801496 IP 10.0.0.1.12345 > 10.0.0.2.12345: UDP, length 16
09:31:46.801731 IP 10.0.0.1.12345 > 10.0.0.2.12345: UDP, length 16
09:31:47.801976 IP 10.0.0.1.12345 > 10.0.0.2.12345: UDP, length 16
09:31:48.802165 IP 10.0.0.1.12345 > 10.0.0.2.12345: UDP, length 16
09:31:49.802370 IP 10.0.0.1.12345 > 10.0.0.2.12345: UDP, length 16
09:31:50.802577 IP 10.0.0.1.12345 > 10.0.0.2.12345: UDP, length 16
09:31:51.802781 IP 10.0.0.1.12345 > 10.0.0.2.12345: UDP, length 16
09:31:52.803005 IP 10.0.0.1.12345 > 10.0.0.2.12345: UDP, length 16
09:31:53.803241 IP 10.0.0.1.12345 > 10.0.0.2.12345: UDP, length 16
09:31:54.803476 IP 10.0.0.1.12345 > 10.0.0.2.12345: UDP, length 16
09:31:55.803811 IP 10.0.0.1.12345 > 10.0.0.2.12345: UDP, length 16
09:31:56.804052 IP 10.0.0.1.12345 > 10.0.0.2.12345: UDP, length 16
09:31:57.804198 IP 10.0.0.1.12345 > 10.0.0.2.12345: UDP, length 16
09:31:58.804419 IP 10.0.0.1.12345 > 10.0.0.2.12345: UDP, length 16
09:31:59.804655 IP 10.0.0.1.12345 > 10.0.0.2.12345: UDP, length 16
09:32:00.804842 IP 10.0.0.1.12345 > 10.0.0.2.12345: UDP, length 16
09:32:01.805075 IP 10.0.0.1.12345 > 10.0.0.2.12345: UDP, length 16
09:32:02.805314 IP 10.0.0.1.12345 > 10.0.0.2.12345: UDP, length 16
09:32:03.805554 IP 10.0.0.1.12345 > 10.0.0.2.12345: UDP, length 16
09:32:04.805793 IP 10.0.0.1.12345 > 10.0.0.2.12345: UDP, length 16
09:32:05.806013 IP 10.0.0.1.12345 > 10.0.0.2.12345: UDP, length 16
09:32:06.806249 IP 10.0.0.1.12345 > 10.0.0.2.12345: UDP, length 16
09:32:07.806490 IP 10.0.0.1.12345 > 10.0.0.2.12345: UDP, length 16
09:32:08.806729 IP 10.0.0.1.12345 > 10.0.0.2.12345: UDP, length 16
09:32:09.806966 IP 10.0.0.1.12345 > 10.0.0.2.12345: UDP, length 16
09:32:10.807120 IP 10.0.0.1.12345 > 10.0.0.2.12345: UDP, length 16
09:32:11.807372 IP 10.0.0.1.12345 > 10.0.0.2.12345: UDP, length 16
09:32:12.807616 IP 10.0.0.1.12345 > 10.0.0.2.12345: UDP, length 16
09:32:13.807854 IP 10.0.0.1.12345 > 10.0.0.2.12345: UDP, length 16
09:32:14.808100 IP 10.0.0.1.12345 > 10.0.0.2.12345: UDP, length 16
09:32:15.808353 IP 10.0.0.1.12345 > 10.0.0.2.12345: UDP, length 16
09:32:16.808592 IP 10.0.0.1.12345 > 10.0.0.2.12345: UDP, length 16
09:32:17.808833 IP 10.0.0.1.12345 > 10.0.0.2.12345: UDP, length 16
09:32:18.809078 IP 10.0.0.1.12345 > 10.0.0.2.12345: UDP, length 16
09:32:19.809322 IP 10.0.0.1.12345 > 10.0.0.2.12345: UDP, length 16
09:32:20.809564 IP 10.0.0.1.12345 > 10.0.0.2.12345: UDP, length 16
09:32:21.809808 IP 10.0.0.1.12345 > 10.0.0.2.12345: UDP, length 16
09:32:22.810047 IP 10.0.0.1.12345 > 10.0.0.2.12345: UDP, length 16
09:32:23.810286 IP 10.0.0.1.12345 > 10.0.0.2.12345: UDP, length 16
09:32:24.810512 IP 10.0.0.1.12345 > 10.0.0.2.12345: UDP, length 16
09:32:25.810748 IP 10.0.0.1.12345 > 10.0.0.2.12345: UDP, length 16
09:32:26.810990 IP 10.0.0.1.12345 > 10.0.0.2.12345: UDP, length 16

