09:27:28.743138 IP 10.0.0.1.12345 > 10.0.0.2.12345: UDP, length 16
09:27:29.743379 IP 10.0.0.1.12345 > 10.0.0.2.12345: UDP, length 16
09:27:30.743609 IP 10.0.0.1.12345 > 10.0.0.2.12345: UDP, length 16
09:27:31.743815 IP 10.0.0.1.12345 > 10.0.0.2.12345: UDP, length 16
09:27:32.744043 IP 10.0.0.1.12345 > 10.0.0.2.12345: UDP, length 16
09:27:33.744286 IP 10.0.0.1.12345 > 10.0.0.2.12345: UDP, length 16
09:27:34.744513 IP 10.0.0.1.12345 > 10.0.0.2.12345: UDP, length 16
09:27:35.744757 IP 10.0.0.1.12345 > 10.0.0.2.12345: UDP, length 16
09:27:36.744979 IP 10.0.0.1.12345 > 10.0.0.2.12345: UDP, length 16
09:27:37.745223 IP 10.0.0.1.12345 > 10.0.0.2.12345: UDP, length 16
09:27:38.745472 IP 10.0.0.1.12345 > 10.0.0.2.12345: UDP, length 16
09:27:39.745717 IP 10.0.0.1.12345 > 10.0.0.2.12345: UDP, length 16
09:27:40.745936 IP 10.0.0.1.12345 > 10.0.0.2.12345: UDP, length 16
09:27:41.746169 IP 10.0.0.1.12345 > 10.0.0.2.12345: UDP, length 16
09:27:42.746403 IP 10.0.0.1.12345 > 10.0.0.2.12345: UDP, length 16
09:27:43.746587 IP 10.0.0.1.12345 > 10.0.0.2.12345: UDP, length 16
09:27:44.746793 IP 10.0.0.1.12345 > 10.0.0.2.12345: UDP, length 16
09:27:45.746991 IP 10.0.0.1.12345 > 10.0.0.2.12345: UDP, length 16
09:27:46.747192 IP 10.0.0.1.12345 > 10.0.0.2.12345: UDP, length 16
09:27:47.747410 IP 10.0.0.1.12345 > 10.0.0.2.12345: UDP, length 16
09:27:48.747628 IP 10.0.0.1.12345 > 10.0.0.2.12345: UDP, length 16
09:27:49.747856 IP 10.0.0.1.12345 > 10.0.0.2.12345: UDP, length 16
09:27:50.748083 IP 10.0.0.1.12345 > 10.0.0.2.12345: UDP, length 16
09:27:51.748267 IP 10.0.0.1.12345 > 10.0.0.2.12345: UDP, length 16
09:27:52.748486 IP 10.0.0.1.12345 > 10.0.0.2.12345: UDP, length 16
09:27:53.748721 IP 10.0.0.1.12345 > 10.0.0.2.12345: UDP, length 16
09:27:54.748964 IP 10.0.0.1.12345 > 10.0.0.2.12345: UDP, length 16
09:27:55.749203 IP 10.0.0.1.12345 > 10.0.0.2.12345: UDP, length 16
09:27:56.749445 IP 10.0.0.1.12345 > 10.0.0.2.12345: UDP, length 16
09:27:57.749640 IP 10.0.0.1.12345 > 10.0.0.2.12345: UDP, length 16
09:27:58.749877 IP 10.0.0.1.12345 > 10.0.0.2.12345: UDP, length 16
09:27:59.750117 IP 10.0.0.1.12345 > 10.0.0.2.12345: UDP, length 16
09:28:00.750320 IP 10.0.0.1.12345 > 10.0.0.2.12345: UDP, length 16
09:28:01.750552 IP 10.0.0.1.12345 > 10.0.0.2.12345: UDP, length 16
09:28:02.750726 IP 10.0.0.1.12345 > 10.0.0.2.12345: UDP, length 16
09:28:03.750950 IP 10.0.0.1.12345 > 10.0.0.2.12345: UDP, length 16
09:28:04.751198 IP 10.0.0.1.12345 > 10.0.0.2.12345: UDP, length 16
09:28:05.751374 IP 10.0.0.1.12345 > 10.0.0.2.12345: UDP, length 16
09:28:06.751612 IP 10.0.0.1.12345 > 10.0.0.2.12345: UDP, length 16
09:28:07.751857 IP 10.0.0.1.12345 > 10.0.0.2.12345: UDP, length 16
09:28:08.752091 IP 10.0.0.1.12345 > 10.0.0.2.12345: UDP, length 16
09:28:09.752323 IP 10.0.0.1.12345 > 10.0.0.2.12345: UDP, length 16
09:28:10.752495 IP 10.0.0.1.12345 > 10.0.0.2.12345: UDP, length 16
09:28:11.752729 IP 10.0.0.1.12345 > 10.0.0.2.12345: UDP, length 16
09:28:12.752928 IP 10.0.0.1.12345 > 10.0.0.2.12345: UDP, length 16
09:28:13.753168 IP 10.0.0.1.12345 > 10.0.0.2.12345: UDP, length 16
09:28:14.753411 IP 10.0.0.1.12345 > 10.0.0.2.12345: UDP, length 16
09:28:15.753656 IP 10.0.0.1.12345 > 10.0.0.2.12345: UDP, length 16
09:28:16.753877 IP 10.0.0.1.12345 > 10.0.0.2.12345: UDP, length 16
09:28:17.754116 IP 10.0.0.1.12345 > 10.0.0.2.12345: UDP, length 16
09:28:18.754341 IP 10.0.0.1.12345 > 10.0.0.2.12345: UDP, length 16
09:28:19.754584 IP 10.0.0.1.12345 > 10.0.0.2.12345: UDP, length 16
09:28:20.754805 IP 10.0.0.1.12345 > 10.0.0.2.12345: UDP, length 16
09:28:21.755047 IP 10.0.0.1.12345 > 10.0.0.2.12345: UDP, length 16
09:28:22.755279 IP 10.0.0.1.12345 > 10.0.0.2.12345: UDP, length 16
09:28:23.755522 IP 10.0.0.1.12345 > 10.0.0.2.12345: UDP, length 16
09:28:24.755795 IP 10.0.0.1.12345 > 10.0.0.2.12345: UDP, length 16
09:28:25.756039 IP 10.0.0.1.12345 > 10.0.0.2.12345: UDP, length 16
09:28:26.756264 IP 10.0.0.1.12345 > 10.0.0.2.12345: UDP, length 16
09:28:27.756505 IP 10.0.0.1.12345 > 10.0.0.2.12345: UDP, length 16
09:28:28.756746 IP 10.0.0.1.12345 > 10.0.0.2.12345: UDP, length 16
09:28:29.756986 IP 10.0.0.1.12345 > 10.0.0.2.12345: UDP, length 16
09:28:30.757179 IP 10.0.0.1.12345 > 10.0.0.2.12345: UDP, length 16
09:28:31.757388 IP 10.0.0.1.12345 > 10.0.0.2.12345: UDP, length 16
09:28:32.757604 IP 10.0.0.1.12345 > 10.0.0.2.12345: UDP, length 16
09:28:33.757844 IP 10.0.0.1.12345 > 10.0.0.2.12345: UDP, length 16
09:28:34.758068 IP 10.0.0.1.12345 > 10.0.0.2.12345: UDP, length 16
09:28:35.758310 IP 10.0.0.1.12345 > 10.0.0.2.12345: UDP, length 16
09:28:36.758502 IP 10.0.0.1.12345 > 10.0.0.2.12345: UDP, length 16
09:28:37.758746 IP 10.0.0.1.12345 > 10.0.0.2.12345: UDP, length 16
09:28:38.758955 IP 10.0.0.1.12345 > 10.0.0.2.12345: UDP, length 16
09:28:39.759197 IP 10.0.0.1.12345 > 10.0.0.2.12345: UDP, length 16
09:28:40.759395 IP 10.0.0.1.12345 > 10.0.0.2.12345: UDP, length 16
09:28:41.759632 IP 10.0.0.1.12345 > 10.0.0.2.12345: UDP, length 16
09:28:42.759830 IP 10.0.0.1.12345 > 10.0.0.2.12345: UDP, length 16
09:28:43.760073 IP 10.0.0.1.12345 > 10.0.0.2.12345: UDP, length 16
09:28:44.760278 IP 10.0.0.1.12345 > 10.0.0.2.12345: UDP, length 16
09:28:45.760520 IP 10.0.0.1.12345 > 10.0.0.2.12345: UDP, length 16
09:28:46.760719 IP 10.0.0.1.12345 > 10.0.0.2.12345: UDP, length 16
09:28:47.760959 IP 10.0.0.1.12345 > 10.0.0.2.12345: UDP, length 16
09:28:48.761165 IP 10.0.0.1.12345 > 10.0.0.2.12345: UDP, length 16
09:28:49.761406 IP 10.0.0.1.12345 > 10.0.0.2.12345: UDP, length 16
09:28:50.761609 IP 10.0.0.1.12345 > 10.0.0.2.12345: UDP, length 16
09:28:51.761871 IP 10.0.0.1.12345 > 10.0.0.2.12345: UDP, length 16
09:28:52.762046 IP 10.0.0.1.12345 > 10.0.0.2.12345: UDP, length 16
09:28:53.762281 IP 10.0.0.1.12345 > 10.0.0.2.12345: UDP, length 16
09:28:54.762455 IP 10.0.0.1.12345 > 10.0.0.2.12345: UDP, length 16
09:28:55.762692 IP 10.0.0.1.12345 > 10.0.0.2.12345: UDP, length 16
09:28:56.762867 IP 10.0.0.1.12345 > 10.0.0.2.12345: UDP, length 16
09:28:57.763062 IP 10.0.0.1.12345 > 10.0.0.2.12345: UDP, length 16
09:28:58.763280 IP 10.0.0.1.12345 > 10.0.0.2.12345: UDP, length 16
09:28:59.763523 IP 10.0.0.1.12345 > 10.0.0.2.12345: UDP, length 16
09:29:00.763741 IP 10.0.0.1.12345 > 10.0.0.2.12345: UDP, length 16
09:29:01.763907 IP 10.0.0.1.12345 > 10.0.0.2.12345: UDP, length 16
09:29:02.764077 IP 10.0.0.1.12345 > 10.0.0.2.12345: UDP, length 16
09:29:03.764317 IP 10.0.0.1.12345 > 10.0.0.2.12345: UDP, length 16
09:29:04.764491 IP 10.0.0.1.12345 > 10.0.0.2.12345: UDP, length 16
09:29:05.764684 IP 10.0.0.1.12345 > 10.0.0.2.12345: UDP, length 16
09:29:06.764921 IP 10.0.0.1.12345 > 10.0.0.2.12345: UDP, length 16
09:29:07.765154 IP 10.0.0.1.12345 > 10.0.0.2.12345: UDP, length 16
09:29:08.765394 IP 10.0.0.1.12345 > 10.0.0.2.12345: UDP, length 16
09:29:09.765639 IP 10.0.0.1.12345 > 10.0.0.2.12345: UDP, length 16
09:29:10.765823 IP 10.0.0.1.12345 > 10.0.0.2.12345: UDP, length 16
09:29:11.766059 IP 10.0.0.1.12345 > 10.0.0.2.12345: UDP, length 16
09:29:12.766197 IP 10.0.0.1.12345 > 10.0.0.2.12345: UDP, length 16
09:29:13.766433 IP 10.0.0.1.12345 > 10.0.0.2.12345: UDP, length 16
09:29:14.766672 IP 10.0.0.1.12345 > 10.0.0.2.12345: UDP, length 16
09:29:15.766910 IP 10.0.0.1.12345 > 10.0.0.2.12345: UDP, length 16
09:29:16.767118 IP 10.0.0.1.12345 > 10.0.0.2.12345: UDP, length 16
09:29:17.767355 IP 10.0.0.1.12345 > 10.0.0.2.12345: UDP, length 16
09:29:18.767603 IP 10.0.0.1.12345 > 10.0.0.2.12345: UDP, length 16
09:29:19.767833 IP 10.0.0.1.12345 > 10.0.0.2.12345: UDP, length 16
09:29:20.768079 IP 10.0.0.1.12345 > 10.0.0.2.12345: UDP, length 16
09:29:21.768318 IP 10.0.0.1.12345 > 10.0.0.2.12345: UDP, length 16
09:29:22.768562 IP 10.0.0.1.12345 > 10.0.0.2.12345: UDP, length 16
09:29:23.768803 IP 10.0.0.1.12345 > 10.0.0.2.12345: UDP, length 16
09:29:24.769050 IP 10.0.0.1.12345 > 10.0.0.2.12345: UDP, length 16
09:29:25.769284 IP 10.0.0.1.12345 > 10.0.0.2.12345: UDP, length 16
09:29:26.769530 IP 10.0.0.1.12345 > 10.0.0.2.12345: UDP, length 16
09:29:27.769775 IP 10.0.0.1.12345 > 10.0.0.2.12345: UDP, length 16
09:29:28.770025 IP 10.0.0.1.12345 > 10.0.0.2.12345: UDP, length 16
09:29:29.770265 IP 10.0.0.1.12345 > 10.0.0.2.12345: UDP, length 16
09:29:30.770510 IP 10.0.0.1.12345 > 10.0.0.2.12345: UDP, length 16
09:29:31.770750 IP 10.0.0.1.12345 > 10.0.0.2.12345: UDP, length 16
09:29:32.770997 IP 10.0.0.1.12345 > 10.0.0.2.12345: UDP, length 16
09:29:33.771240 IP 10.0.0.1.12345 > 10.0.0.2.12345: UDP, length 16
09:29:34.771484 IP 10.0.0.1.12345 > 10.0.0.2.12345: UDP, length 16
09:29:35.771682 IP 10.0.0.1.12345 > 10.0.0.2.12345: UDP, length 16
09:29:36.771924 IP 10.0.0.1.12345 > 10.0.0.2.12345: UDP, length 16
09:29:37.772145 IP 10.0.0.1.12345 > 10.0.0.2.12345: UDP, length 16
09:29:38.772393 IP 10.0.0.1.12345 > 10.0.0.2.12345: UDP, length 16
09:29:39.772638 IP 10.0.0.1.12345 > 10.0.0.2.12345: UDP, length 16
09:29:40.772879 IP 10.0.0.1.12345 > 10.0.0.2.12345: UDP, length 16
09:29:41.773099 IP 10.0.0.1.12345 > 10.0.0.2.12345: UDP, length 16
09:29:42.773343 IP 10.0.0.1.12345 > 10.0.0.2.12345: UDP, length 16
09:29:43.773581 IP 10.0.0.1.12345 > 10.0.0.2.12345: UDP, length 16
09:29:44.773822 IP 10.0.0.1.12345 > 10.0.0.2.12345: UDP, length 16
09:29:45.774063 IP 10.0.0.1.12345 > 10.0.0.2.12345: UDP, length 16
09:29:46.774291 IP 10.0.0.1.12345 > 10.0.0.2.12345: UDP, length 16
09:29:47.774532 IP 10.0.0.1.12345 > 10.0.0.2.12345: UDP, length 16
09:29:48.774777 IP 10.0.0.1.12345 > 10.0.0.2.12345: UDP, length 16
09:29:49.775007 IP 10.0.0.1.12345 > 10.0.0.2.12345: UDP, length 16
09:29:50.775251 IP 10.0.0.1.12345 > 10.0.0.2.12345: UDP, length 16
09:29:51.775478 IP 10.0.0.1.12345 > 10.0.0.2.12345: UDP, length 16
09:29:52.775820 IP 10.0.0.1.12345 > 10.0.0.2.12345: UDP, length 16
09:29:53.776054 IP 10.0.0.1.12345 > 10.0.0.2.12345: UDP, length 16
09:29:54.776300 IP 10.0.0.1.12345 > 10.0.0.2.12345: UDP, length 16
09:29:55.776535 IP 10.0.0.1.12345 > 10.0.0.2.12345: UDP, length 16
09:29:56.776779 IP 10.0.0.1.12345 > 10.0.0.2.12345: UDP, length 16
09:29:57.776889 IP 10.0.0.1.12345 > 10.0.0.2.12345: UDP, length 16
09:29:58.777133 IP 10.0.0.1.12345 > 10.0.0.2.12345: UDP, length 16
09:29:59.777364 IP 10.0.0.1.12345 > 10.0.0.2.12345: UDP, length 16
09:30:00.777609 IP 10.0.0.1.12345 > 10.0.0.2.12345: UDP, length 16
09:30:01.777830 IP 10.0.0.1.12345 > 10.0.0.2.12345: UDP, length 16
09:30:02.778076 IP 10.0.0.1.12345 > 10.0.0.2.12345: UDP, length 16
09:30:03.778317 IP 10.0.0.1.12345 > 10.0.0.2.12345: UDP, length 16
09:30:04.778563 IP 10.0.0.1.12345 > 10.0.0.2.12345: UDP, length 16
09:30:05.778762 IP 10.0.0.1.12345 > 10.0.0.2.12345: UDP, length 16
09:30:06.779006 IP 10.0.0.1.12345 > 10.0.0.2.12345: UDP, length 16
09:30:07.779251 IP 10.0.0.1.12345 > 10.0.0.2.12345: UDP, length 16
09:30:08.779456 IP 10.0.0.1.12345 > 10.0.0.2.12345: UDP, length 16
09:30:09.779648 IP 10.0.0.1.12345 > 10.0.0.2.12345: UDP, length 16
09:30:10.779829 IP 10.0.0.1.12345 > 10.0.0.2.12345: UDP, length 16
09:30:11.780041 IP 10.0.0.1.12345 > 10.0.0.2.12345: UDP, length 16
09:30:12.780277 IP 10.0.0.1.12345 > 10.0.0.2.12345: UDP, length 16
09:30:13.780480 IP 10.0.0.1.12345 > 10.0.0.2.12345: UDP, length 16
09:30:14.780721 IP 10.0.0.1.12345 > 10.0.0.2.12345: UDP, length 16
09:30:15.780951 IP 10.0.0.1.12345 > 10.0.0.2.12345: UDP, length 16
09:30:16.781179 IP 10.0.0.1.12345 > 10.0.0.2.12345: UDP, length 16
09:30:17.781424 IP 10.0.0.1.12345 > 10.0.0.2.12345: UDP, length 16
09:30:18.781624 IP 10.0.0.1.12345 > 10.0.0.2.12345: UDP, length 16
09:30:19.781846 IP 10.0.0.1.12345 > 10.0.0.2.12345: UDP, length 16
09:30:20.782090 IP 10.0.0.1.12345 > 10.0.0.2.12345: UDP, length 16
09:30:21.782314 IP 10.0.0.1.12345 > 10.0.0.2.12345: UDP, length 16
09:30:22.782559 IP 10.0.0.1.12345 > 10.0.0.2.12345: UDP, length 16
09:30:23.782806 IP 10.0.0.1.12345 > 10.0.0.2.12345: UDP, length 16
09:30:24.783049 IP 10.0.0.1.12345 > 10.0.0.2.12345: UDP, length 16
09:30:25.783295 IP 10.0.0.1.12345 > 10.0.0.2.12345: UDP, length 16
09:30:26.783544 IP 10.0.0.1.12345 > 10.0.0.2.12345: UDP, length 16
09:30:27.783767 IP 10.0.0.1.12345 > 10.0.0.2.12345: UDP, length 16
09:30:28.784005 IP 10.0.0.1.12345 > 10.0.0.2.12345: UDP, length 16
09:30:29.784227 IP 10.0.0.1.12345 > 10.0.0.2.12345: UDP, length 16
09:30:30.784471 IP 10.0.0.1.12345 > 10.0.0.2.12345: UDP, length 16
09:30:31.784703 IP 10.0.0.1.12345 > 10.0.0.2.12345: UDP, length 16
09:30:32.784947 IP 10.0.0.1.12345 > 10.0.0.2.12345: UDP, length 16
09:30:33.785172 IP 10.0.0.1.12345 > 10.0.0.2.12345: UDP, length 16
09:30:34.785323 IP 10.0.0.1.12345 > 10.0.0.2.12345: UDP, length 16
09:30:35.785556 IP 10.0.0.1.12345 > 10.0.0.2.12345: UDP, length 16
09:30:36.785795 IP 10.0.0.1.12345 > 10.0.0.2.12345: UDP, length 16
09:30:37.786018 IP 10.0.0.1.12345 > 10.0.0.2.12345: UDP, length 16
09:30:38.786253 IP 10.0.0.1.12345 > 10.0.0.2.12345: UDP, length 16
09:30:39.786445 IP 10.0.0.1.12345 > 10.0.0.2.12345: UDP, length 16
09:30:40.786684 IP 10.0.0.1.12345 > 10.0.0.2.12345: UDP, length 16
09:30:41.786889 IP 10.0.0.1.12345 > 10.0.0.2.12345: UDP, length 16
09:30:42.787133 IP 10.0.0.1.12345 > 10.0.0.2.12345: UDP, length 16
09:30:43.787352 IP 10.0.0.1.12345 > 10.0.0.2.12345: UDP, length 16
09:30:44.787595 IP 10.0.0.1.12345 > 10.0.0.2.12345: UDP, length 16
09:30:45.787791 IP 10.0.0.1.12345 > 10.0.0.2.12345: UDP, length 16
09:30:46.788033 IP 10.0.0.1.12345 > 10.0.0.2.12345: UDP, length 16
09:30:47.788236 IP 10.0.0.1.12345 > 10.0.0.2.12345: UDP, length 16
09:30:48.788442 IP 10.0.0.1.12345 > 10.0.0.2.12345: UDP, length 16
09:30:49.788644 IP 10.0.0.1.12345 > 10.0.0.2.12345: UDP, length 16
09:30:50.788885 IP 10.0.0.1.12345 > 10.0.0.2.12345: UDP, length 16
09:30:51.789088 IP 10.0.0.1.12345 > 10.0.0.2.12345: UDP, length 16
09:30:52.789330 IP 10.0.0.1.12345 > 10.0.0.2.12345: UDP, length 16
09:30:53.789528 IP 10.0.0.1.12345 > 10.0.0.2.12345: UDP, length 16
09:30:54.789772 IP 10.0.0.1.12345 > 10.0.0.2.12345: UDP, length 16
09:30:55.789972 IP 10.0.0.1.12345 > 10.0.0.2.12345: UDP, length 16
09:30:56.790215 IP 10.0.0.1.12345 > 10.0.0.2.12345: UDP, length 16
09:30:57.790414 IP 10.0.0.1.12345 > 10.0.0.2.12345: UDP, length 16
09:30:58.790645 IP 10.0.0.1.12345 > 10.0.0.2.12345: UDP, length 16
09:30:59.790845 IP 10.0.0.1.12345 > 10.0.0.2.12345: UDP, length 16
09:31:00.791084 IP 10.0.0.1.12345 > 10.0.0.2.12345: UDP, length 16
09:31:01.791328 IP 10.0.0.1.12345 > 10.0.0.2.12345: UDP, length 16
09:31:02.791574 IP 10.0.0.1.12345 > 10.0.0.2.12345: UDP, length 16
09:31:03.791782 IP 10.0.0.1.12345 > 10.0.0.2.12345: UDP, length 16
09:31:04.792015 IP 10.0.0.1.12345 > 10.0.0.2.12345: UDP, length 16
09:31:05.792186 IP 10.0.0.1.12345 > 10.0.0.2.12345: UDP, length 16
09:31:06.792426 IP 10.0.0.1.12345 > 10.0.0.2.12345: UDP, length 16
09:31:07.792599 IP 10.0.0.1.12345 > 10.0.0.2.12345: UDP, length 16
09:31:08.792826 IP 10.0.0.1.12345 > 10.0.0.2.12345: UDP, length 16
09:31:09.792998 IP 10.0.0.1.12345 > 10.0.0.2.12345: UDP, length 16
09:31:10.793185 IP 10.0.0.1.12345 > 10.0.0.2.12345: UDP, length 16
09:31:11.793355 IP 10.0.0.1.12345 > 10.0.0.2.12345: UDP, length 16
09:31:12.793595 IP 10.0.0.1.12345 > 10.0.0.2.12345: UDP, length 16
09:31:13.793763 IP 10.0.0.1.12345 > 10.0.0.2.12345: UDP, length 16
09:31:14.794001 IP 10.0.0.1.12345 > 10.0.0.2.12345: UDP, length 16
09:31:15.794175 IP 10.0.0.1.12345 > 10.0.0.2.12345: UDP, length 16
09:31:16.794416 IP 10.0.0.1.12345 > 10.0.0.2.12345: UDP, length 16
09:31:17.794664 IP 10.0.0.1.12345 > 10.0.0.2.12345: UDP, length 16
09:31:18.794898 IP 10.0.0.1.12345 > 10.0.0.2.12345: UDP, length 16
09:31:19.795147 IP 10.0.0.1.12345 > 10.0.0.2.12345: UDP, length 16
09:31:20.795392 IP 10.0.0.1.12345 > 10.0.0.2.12345: UDP, length 16
09:31:21.795640 IP 10.0.0.1.12345 > 10.0.0.2.12345: UDP, length 16
09:31:22.795855 IP 10.0.0.1.12345 > 10.0.0.2.12345: UDP, length 16
09:31:23.796106 IP 10.0.0.1.12345 > 10.0.0.2.12345: UDP, length 16
09:31:24.796346 IP 10.0.0.1.12345 > 10.0.0.2.12345: UDP, length 16
09:31:25.796592 IP 10.0.0.1.12345 > 10.0.0.2.12345: UDP, length 16
09:31:26.796835 IP 10.0.0.1.12345 > 10.0.0.2.12345: UDP, length 16
09:31:27.797083 IP 10.0.0.1.12345 > 10.0.0.2.12345: UDP, length 16
09:31:28.797329 IP 10.0.0.1.12345 > 10.0.0.2.12345: UDP, length 16
09:31:29.797576 IP 10.0.0.1.12345 > 10.0.0.2.12345: UDP, length 16
09:31:30.797821 IP 10.0.0.1.12345 > 10.0.0.2.12345: UDP, length 16
09:31:31.798060 IP 10.0.0.1.12345 > 10.0.0.2.12345: UDP, length 16
09:31:32.798298 IP 10.0.0.1.12345 > 10.0.0.2.12345: UDP, length 16
09:31:33.798542 IP 10.0.0.1.12345 > 10.0.0.2.12345: UDP, length 16
09:31:34.798782 IP 10.0.0.1.12345 > 10.0.0.2.12345: UDP, length 16
09:31:35.799024 IP 10.0.0.1.12345 > 10.0.0.2.12345: UDP, length 16
09:31:36.799266 IP 10.0.0.1.12345 > 10.0.0.2.12345: UDP, length 16
09:31:37.799506 IP 10.0.0.1.12345 > 10.0.0.2.12345: UDP, length 16
09:31:38.799827 IP 10.0.0.1.12345 > 10.0.0.2.12345: UDP, length 16
09:31:39.800050 IP 10.0.0.1.12345 > 10.0.0.2.12345: UDP, length 16
09:31:40.800289 IP 10.0.0.1.12345 > 10.0.0.2.12345: UDP, length 16
09:31:41.800551 IP 10.0.0.1.12345 > 10.0.0.2.12345: UDP, length 16
09:31:42.800791 IP 10.0.0.1.12345 > 10.0.0.2.12345: UDP, length 16
09:31:43.801033 IP 10.0.0.1.12345 > 10.0.0.2.12345: UDP, length 16
09:31:44.801273 IP 10.0.0.1.12345 > 10.0.0.2.12345: UDP, length 16
09:31:45.801506 IP 10.0.0.1.12345 > 10.0.0.2.12345: UDP, length 16
09:31:46.801745 IP 10.0.0.1.12345 > 10.0.0.2.12345: UDP, length 16
09:31:47.801989 IP 10.0.0.1.12345 > 10.0.0.2.12345: UDP, length 16
09:31:48.802176 IP 10.0.0.1.12345 > 10.0.0.2.12345: UDP, length 16
09:31:49.802382 IP 10.0.0.1.12345 > 10.0.0.2.12345: UDP, length 16
09:31:50.802591 IP 10.0.0.1.12345 > 10.0.0.2.12345: UDP, length 16
09:31:51.802794 IP 10.0.0.1.12345 > 10.0.0.2.12345: UDP, length 16
09:31:52.803017 IP 10.0.0.1.12345 > 10.0.0.2.12345: UDP, length 16
09:31:53.803255 IP 10.0.0.1.12345 > 10.0.0.2.12345: UDP, length 16
09:31:54.803488 IP 10.0.0.1.12345 > 10.0.0.2.12345: UDP, length 16
09:31:55.803824 IP 10.0.0.1.12345 > 10.0.0.2.12345: UDP, length 16
09:31:56.804065 IP 10.0.0.1.12345 > 10.0.0.2.12345: UDP, length 16
09:31:57.804206 IP 10.0.0.1.12345 > 10.0.0.2.12345: UDP, length 16
09:31:58.804430 IP 10.0.0.1.12345 > 10.0.0.2.12345: UDP, length 16
09:31:59.804667 IP 10.0.0.1.12345 > 10.0.0.2.12345: UDP, length 16
09:32:00.804849 IP 10.0.0.1.12345 > 10.0.0.2.12345: UDP, length 16
09:32:01.805088 IP 10.0.0.1.12345 > 10.0.0.2.12345: UDP, length 16
09:32:02.805326 IP 10.0.0.1.12345 > 10.0.0.2.12345: UDP, length 16
09:32:03.805568 IP 10.0.0.1.12345 > 10.0.0.2.12345: UDP, length 16
09:32:04.805805 IP 10.0.0.1.12345 > 10.0.0.2.12345: UDP, length 16
09:32:05.806024 IP 10.0.0.1.12345 > 10.0.0.2.12345: UDP, length 16
09:32:06.806263 IP 10.0.0.1.12345 > 10.0.0.2.12345: UDP, length 16
09:32:07.806504 IP 10.0.0.1.12345 > 10.0.0.2.12345: UDP, length 16
09:32:08.806741 IP 10.0.0.1.12345 > 10.0.0.2.12345: UDP, length 16
09:32:09.806980 IP 10.0.0.1.12345 > 10.0.0.2.12345: UDP, length 16
09:32:10.807128 IP 10.0.0.1.12345 > 10.0.0.2.12345: UDP, length 16
09:32:11.807386 IP 10.0.0.1.12345 > 10.0.0.2.12345: UDP, length 16
09:32:12.807627 IP 10.0.0.1.12345 > 10.0.0.2.12345: UDP, length 16
09:32:13.807868 IP 10.0.0.1.12345 > 10.0.0.2.12345: UDP, length 16
09:32:14.808113 IP 10.0.0.1.12345 > 10.0.0.2.12345: UDP, length 16
09:32:15.808365 IP 10.0.0.1.12345 > 10.0.0.2.12345: UDP, length 16
09:32:16.808603 IP 10.0.0.1.12345 > 10.0.0.2.12345: UDP, length 16
09:32:17.808847 IP 10.0.0.1.12345 > 10.0.0.2.12345: UDP, length 16
09:32:18.809092 IP 10.0.0.1.12345 > 10.0.0.2.12345: UDP, length 16
09:32:19.809335 IP 10.0.0.1.12345 > 10.0.0.2.12345: UDP, length 16
09:32:20.809577 IP 10.0.0.1.12345 > 10.0.0.2.12345: UDP, length 16
09:32:21.809821 IP 10.0.0.1.12345 > 10.0.0.2.12345: UDP, length 16
09:32:22.810059 IP 10.0.0.1.12345 > 10.0.0.2.12345: UDP, length 16
09:32:23.810300 IP 10.0.0.1.12345 > 10.0.0.2.12345: UDP, length 16
09:32:24.810523 IP 10.0.0.1.12345 > 10.0.0.2.12345: UDP, length 16
09:32:25.810761 IP 10.0.0.1.12345 > 10.0.0.2.12345: UDP, length 16
09:32:26.811003 IP 10.0.0.1.12345 > 10.0.0.2.12345: UDP, length 16
