13:22:56.601292 IP 10.38.176.117.12345 > 10.0.0.2.12345: UDP, length 16
13:22:57.401551 IP 10.45.21.235.12345 > 10.0.0.2.12345: UDP, length 16
13:22:58.201762 IP 10.36.106.229.12345 > 10.0.0.2.12345: UDP, length 16
13:22:59.002030 IP 10.26.216.248.12345 > 10.0.0.2.12345: UDP, length 16
13:22:59.802222 IP 10.45.113.1.12345 > 10.0.0.2.12345: UDP, length 16
13:23:00.602426 IP 10.116.79.111.12345 > 10.0.0.2.12345: UDP, length 16
13:23:01.402652 IP 10.43.157.210.12345 > 10.0.0.2.12345: UDP, length 16
13:23:02.202917 IP 10.16.34.42.12345 > 10.0.0.2.12345: UDP, length 16
13:23:03.003171 IP 10.44.88.13.12345 > 10.0.0.2.12345: UDP, length 16
13:23:03.803457 IP 10.79.220.158.12345 > 10.0.0.2.12345: UDP, length 16
13:23:04.603756 IP 10.97.208.135.12345 > 10.0.0.2.12345: UDP, length 16
13:23:05.404028 IP 10.93.138.215.12345 > 10.0.0.2.12345: UDP, length 16
13:23:06.204326 IP 10.53.236.65.12345 > 10.0.0.2.12345: UDP, length 16
13:23:07.004554 IP 10.68.54.88.12345 > 10.0.0.2.12345: UDP, length 16
13:23:07.804801 IP 10.76.39.210.12345 > 10.0.0.2.12345: UDP, length 16
13:23:08.605146 IP 10.73.185.84.12345 > 10.0.0.2.12345: UDP, length 16
13:23:09.405483 IP 10.121.101.147.12345 > 10.0.0.2.12345: UDP, length 16
13:23:10.205797 IP 10.109.88.135.12345 > 10.0.0.2.12345: UDP, length 16
13:23:11.006105 IP 10.126.19.66.12345 > 10.0.0.2.12345: UDP, length 16
13:23:11.806408 IP 10.111.253.83.12345 > 10.0.0.2.12345: UDP, length 16
13:23:12.606757 IP 10.78.22.0.12345 > 10.0.0.2.12345: UDP, length 16
13:23:13.407063 IP 10.61.181.216.12345 > 10.0.0.2.12345: UDP, length 16
13:23:14.207391 IP 10.7.23.237.12345 > 10.0.0.2.12345: UDP, length 16
13:23:15.007729 IP 10.87.76.64.12345 > 10.0.0.2.12345: UDP, length 16
13:23:15.808088 IP 10.101.163.45.12345 > 10.0.0.2.12345: UDP, length 16
13:23:16.608432 IP 10.86.58.199.12345 > 10.0.0.2.12345: UDP, length 16
13:23:17.408726 IP 10.11.156.251.12345 > 10.0.0.2.12345: UDP, length 16
13:23:18.209043 IP 10.112.92.49.12345 > 10.0.0.2.12345: UDP, length 16
13:23:19.009412 IP 10.100.171.119.12345 > 10.0.0.2.12345: UDP, length 16
13:23:19.809682 IP 10.13.243.126.12345 > 10.0.0.2.12345: UDP, length 16
13:23:20.610016 IP 10.32.65.30.12345 > 10.0.0.2.12345: UDP, length 16
13:23:21.410274 IP 10.25.35.19.12345 > 10.0.0.2.12345: UDP, length 16
13:23:22.210551 IP 10.127.179.131.12345 > 10.0.0.2.12345: UDP, length 16
13:23:23.010853 IP 10.57.196.147.12345 > 10.0.0.2.12345: UDP, length 16
13:23:23.811162 IP 10.58.183.118.12345 > 10.0.0.2.12345: UDP, length 16
13:23:24.611426 IP 10.86.91.206.12345 > 10.0.0.2.12345: UDP, length 16
13:23:25.411732 IP 10.127.65.46.12345 > 10.0.0.2.12345: UDP, length 16
13:23:26.212066 IP 10.119.158.243.12345 > 10.0.0.2.12345: UDP, length 16
13:23:27.012388 IP 10.12.30.0.12345 > 10.0.0.2.12345: UDP, length 16
13:23:27.812685 IP 10.25.18.185.12345 > 10.0.0.2.12345: UDP, length 16
13:23:28.613020 IP 10.14.131.251.12345 > 10.0.0.2.12345: UDP, length 16
13:23:29.413376 IP 10.36.251.159.12345 > 10.0.0.2.12345: UDP, length 16
13:23:30.213668 IP 10.63.161.211.12345 > 10.0.0.2.12345: UDP, length 16
13:23:31.013911 IP 10.3.42.206.12345 > 10.0.0.2.12345: UDP, length 16
13:23:31.814137 IP 10.37.79.204.12345 > 10.0.0.2.12345: UDP, length 16
13:23:32.614330 IP 10.90.182.204.12345 > 10.0.0.2.12345: UDP, length 16
13:23:33.414500 IP 10.0.154.81.12345 > 10.0.0.2.12345: UDP, length 16
13:23:34.214753 IP 10.41.200.255.12345 > 10.0.0.2.12345: UDP, length 16
13:23:35.014949 IP 10.122.27.105.12345 > 10.0.0.2.12345: UDP, length 16
13:23:35.815212 IP 10.19.199.213.12345 > 10.0.0.2.12345: UDP, length 16
13:23:36.615539 IP 10.85.137.37.12345 > 10.0.0.2.12345: UDP, length 16
13:23:37.415873 IP 10.107.54.179.12345 > 10.0.0.2.12345: UDP, length 16
13:23:38.216160 IP 10.108.132.69.12345 > 10.0.0.2.12345: UDP, length 16
13:23:39.016436 IP 10.91.48.222.12345 > 10.0.0.2.12345: UDP, length 16
13:23:39.816681 IP 10.32.80.11.12345 > 10.0.0.2.12345: UDP, length 16
13:23:40.617013 IP 10.11.25.124.12345 > 10.0.0.2.12345: UDP, length 16
13:23:41.417207 IP 10.50.95.240.12345 > 10.0.0.2.12345: UDP, length 16
13:23:42.217448 IP 10.79.35.23.12345 > 10.0.0.2.12345: UDP, length 16
13:23:43.017651 IP 10.37.225.254.12345 > 10.0.0.2.12345: UDP, length 16
13:23:43.817849 IP 10.41.215.116.12345 > 10.0.0.2.12345: UDP, length 16
13:23:44.618008 IP 10.75.144.232.12345 > 10.0.0.2.12345: UDP, length 16
13:23:45.418156 IP 10.94.140.156.12345 > 10.0.0.2.12345: UDP, length 16
13:23:46.218315 IP 10.76.224.73.12345 > 10.0.0.2.12345: UDP, length 16
13:23:47.018467 IP 10.113.135.163.12345 > 10.0.0.2.12345: UDP, length 16
13:23:47.818625 IP 10.63.184.216.12345 > 10.0.0.2.12345: UDP, length 16
13:23:48.618799 IP 10.36.22.20.12345 > 10.0.0.2.12345: UDP, length 16
13:23:49.419024 IP 10.123.81.86.12345 > 10.0.0.2.12345: UDP, length 16
13:23:50.219311 IP 10.30.104.201.12345 > 10.0.0.2.12345: UDP, length 16
13:23:51.019644 IP 10.29.251.173.12345 > 10.0.0.2.12345: UDP, length 16
13:23:51.819855 IP 10.120.196.132.12345 > 10.0.0.2.12345: UDP, length 16
13:23:52.620073 IP 10.10.6.51.12345 > 10.0.0.2.12345: UDP, length 16
13:23:53.420334 IP 10.109.237.3.12345 > 10.0.0.2.12345: UDP, length 16
13:23:54.220605 IP 10.46.53.97.12345 > 10.0.0.2.12345: UDP, length 16
13:23:55.020936 IP 10.87.77.142.12345 > 10.0.0.2.12345: UDP, length 16
13:23:55.821113 IP 10.73.190.54.12345 > 10.0.0.2.12345: UDP, length 16
13:23:56.621340 IP 10.60.39.118.12345 > 10.0.0.2.12345: UDP, length 16
13:23:57.421641 IP 10.28.112.227.12345 > 10.0.0.2.12345: UDP, length 16
13:23:58.221960 IP 10.112.105.0.12345 > 10.0.0.2.12345: UDP, length 16
13:23:59.022279 IP 10.39.49.106.12345 > 10.0.0.2.12345: UDP, length 16
13:23:59.822587 IP 10.109.214.98.12345 > 10.0.0.2.12345: UDP, length 16
13:24:00.622932 IP 10.119.176.164.12345 > 10.0.0.2.12345: UDP, length 16
13:24:01.423208 IP 10.3.186.95.12345 > 10.0.0.2.12345: UDP, length 16
13:24:02.223559 IP 10.88.1.193.12345 > 10.0.0.2.12345: UDP, length 16
13:24:03.023895 IP 10.16.36.149.12345 > 10.0.0.2.12345: UDP, length 16
13:24:03.824160 IP 10.21.135.88.12345 > 10.0.0.2.12345: UDP, length 16
13:24:04.624451 IP 10.30.132.28.12345 > 10.0.0.2.12345: UDP, length 16
13:24:05.424810 IP 10.13.113.71.12345 > 10.0.0.2.12345: UDP, length 16
13:24:06.225152 IP 10.103.175.214.12345 > 10.0.0.2.12345: UDP, length 16
13:24:07.025464 IP 10.45.239.72.12345 > 10.0.0.2.12345: UDP, length 16
13:24:07.825658 IP 10.71.136.252.12345 > 10.0.0.2.12345: UDP, length 16
13:24:08.625833 IP 10.33.188.6.12345 > 10.0.0.2.12345: UDP, length 16
13:24:09.426141 IP 10.62.0.147.12345 > 10.0.0.2.12345: UDP, length 16
13:24:10.226421 IP 10.52.111.67.12345 > 10.0.0.2.12345: UDP, length 16
13:24:11.026689 IP 10.82.158.44.12345 > 10.0.0.2.12345: UDP, length 16
13:24:11.826937 IP 10.102.159.146.12345 > 10.0.0.2.12345: UDP, length 16
13:24:12.627253 IP 10.81.14.93.12345 > 10.0.0.2.12345: UDP, length 16
13:24:13.427588 IP 10.19.177.59.12345 > 10.0.0.2.12345: UDP, length 16
13:24:14.227831 IP 10.123.31.134.12345 > 10.0.0.2.12345: UDP, length 16
13:24:15.028122 IP 10.98.115.81.12345 > 10.0.0.2.12345: UDP, length 16
13:24:15.828462 IP 10.78.17.255.12345 > 10.0.0.2.12345: UDP, length 16
13:24:16.628803 IP 10.47.40.65.12345 > 10.0.0.2.12345: UDP, length 16
13:24:17.429139 IP 10.33.139.133.12345 > 10.0.0.2.12345: UDP, length 16
13:24:18.229464 IP 10.21.106.177.12345 > 10.0.0.2.12345: UDP, length 16
13:24:19.029812 IP 10.80.58.130.12345 > 10.0.0.2.12345: UDP, length 16
13:24:19.830113 IP 10.73.196.183.12345 > 10.0.0.2.12345: UDP, length 16
13:24:20.630378 IP 10.5.59.74.12345 > 10.0.0.2.12345: UDP, length 16
13:24:21.430693 IP 10.103.81.113.12345 > 10.0.0.2.12345: UDP, length 16
13:24:22.231016 IP 10.25.45.66.12345 > 10.0.0.2.12345: UDP, length 16
13:24:23.031348 IP 10.90.210.73.12345 > 10.0.0.2.12345: UDP, length 16
13:24:23.831695 IP 10.108.47.53.12345 > 10.0.0.2.12345: UDP, length 16
13:24:24.631890 IP 10.60.27.203.12345 > 10.0.0.2.12345: UDP, length 16
13:24:25.432176 IP 10.15.102.141.12345 > 10.0.0.2.12345: UDP, length 16
13:24:26.232509 IP 10.57.121.227.12345 > 10.0.0.2.12345: UDP, length 16
13:24:27.032835 IP 10.46.114.149.12345 > 10.0.0.2.12345: UDP, length 16
13:24:27.833083 IP 10.83.204.212.12345 > 10.0.0.2.12345: UDP, length 16
13:24:28.633348 IP 10.110.60.36.12345 > 10.0.0.2.12345: UDP, length 16
13:24:29.433608 IP 10.22.172.224.12345 > 10.0.0.2.12345: UDP, length 16
13:24:30.233915 IP 10.115.193.138.12345 > 10.0.0.2.12345: UDP, length 16
13:24:31.034245 IP 10.92.36.8.12345 > 10.0.0.2.12345: UDP, length 16
13:24:31.834489 IP 10.4.97.87.12345 > 10.0.0.2.12345: UDP, length 16
13:24:32.634778 IP 10.68.162.113.12345 > 10.0.0.2.12345: UDP, length 16
13:24:33.435102 IP 10.66.96.245.12345 > 10.0.0.2.12345: UDP, length 16
13:24:34.235355 IP 10.41.216.56.12345 > 10.0.0.2.12345: UDP, length 16
13:24:35.035626 IP 10.111.129.206.12345 > 10.0.0.2.12345: UDP, length 16
13:24:35.835949 IP 10.47.132.75.12345 > 10.0.0.2.12345: UDP, length 16
13:24:36.636277 IP 10.84.22.34.12345 > 10.0.0.2.12345: UDP, length 16
13:24:37.436484 IP 10.15.247.78.12345 > 10.0.0.2.12345: UDP, length 16
13:24:38.236711 IP 10.53.154.0.12345 > 10.0.0.2.12345: UDP, length 16
13:24:39.037017 IP 10.75.125.114.12345 > 10.0.0.2.12345: UDP, length 16
13:24:39.837372 IP 10.126.126.69.12345 > 10.0.0.2.12345: UDP, length 16
13:24:40.637691 IP 10.84.229.179.12345 > 10.0.0.2.12345: UDP, length 16
13:24:41.437999 IP 10.64.195.56.12345 > 10.0.0.2.12345: UDP, length 16
13:24:42.238270 IP 10.122.133.228.12345 > 10.0.0.2.12345: UDP, length 16
13:24:43.038492 IP 10.98.56.238.12345 > 10.0.0.2.12345: UDP, length 16
13:24:43.838684 IP 10.11.160.19.12345 > 10.0.0.2.12345: UDP, length 16
13:24:44.638871 IP 10.60.162.156.12345 > 10.0.0.2.12345: UDP, length 16
13:24:45.439170 IP 10.81.83.6.12345 > 10.0.0.2.12345: UDP, length 16
13:24:46.239460 IP 10.46.220.70.12345 > 10.0.0.2.12345: UDP, length 16
13:24:47.039704 IP 10.15.77.231.12345 > 10.0.0.2.12345: UDP, length 16
13:24:47.839946 IP 10.28.168.0.12345 > 10.0.0.2.12345: UDP, length 16
13:24:48.640126 IP 10.3.0.248.12345 > 10.0.0.2.12345: UDP, length 16
13:24:49.440425 IP 10.70.166.173.12345 > 10.0.0.2.12345: UDP, length 16
13:24:50.240656 IP 10.102.237.192.12345 > 10.0.0.2.12345: UDP, length 16
13:24:51.040878 IP 10.51.207.201.12345 > 10.0.0.2.12345: UDP, length 16
13:24:51.841149 IP 10.16.243.224.12345 > 10.0.0.2.12345: UDP, length 16
13:24:52.641416 IP 10.50.169.228.12345 > 10.0.0.2.12345: UDP, length 16
13:24:53.441674 IP 10.81.232.215.12345 > 10.0.0.2.12345: UDP, length 16
13:24:54.241953 IP 10.111.126.67.12345 > 10.0.0.2.12345: UDP, length 16
13:24:55.042200 IP 10.12.128.230.12345 > 10.0.0.2.12345: UDP, length 16
13:24:55.842425 IP 10.32.57.69.12345 > 10.0.0.2.12345: UDP, length 16
13:24:56.642772 IP 10.85.151.232.12345 > 10.0.0.2.12345: UDP, length 16
13:24:57.443091 IP 10.25.200.233.12345 > 10.0.0.2.12345: UDP, length 16
13:24:58.243404 IP 10.54.114.248.12345 > 10.0.0.2.12345: UDP, length 16
13:24:59.043714 IP 10.93.75.215.12345 > 10.0.0.2.12345: UDP, length 16
13:24:59.844047 IP 10.103.226.213.12345 > 10.0.0.2.12345: UDP, length 16
13:25:00.644403 IP 10.67.207.169.12345 > 10.0.0.2.12345: UDP, length 16
13:25:01.444704 IP 10.66.184.59.12345 > 10.0.0.2.12345: UDP, length 16
13:25:02.244986 IP 10.89.12.166.12345 > 10.0.0.2.12345: UDP, length 16
13:25:03.045261 IP 10.25.56.57.12345 > 10.0.0.2.12345: UDP, length 16
13:25:03.845503 IP 10.69.107.188.12345 > 10.0.0.2.12345: UDP, length 16
13:25:04.645740 IP 10.30.30.102.12345 > 10.0.0.2.12345: UDP, length 16
13:25:05.445935 IP 10.87.186.61.12345 > 10.0.0.2.12345: UDP, length 16
13:25:06.246179 IP 10.82.209.101.12345 > 10.0.0.2.12345: UDP, length 16
13:25:07.046418 IP 10.11.172.235.12345 > 10.0.0.2.12345: UDP, length 16
13:25:07.846698 IP 10.99.36.211.12345 > 10.0.0.2.12345: UDP, length 16
13:25:08.646886 IP 10.3.152.232.12345 > 10.0.0.2.12345: UDP, length 16
13:25:09.447138 IP 10.82.63.6.12345 > 10.0.0.2.12345: UDP, length 16
13:25:10.247384 IP 10.35.176.129.12345 > 10.0.0.2.12345: UDP, length 16
13:25:11.047665 IP 10.78.36.152.12345 > 10.0.0.2.12345: UDP, length 16
13:25:11.847959 IP 10.75.239.134.12345 > 10.0.0.2.12345: UDP, length 16
13:25:12.648321 IP 10.69.246.71.12345 > 10.0.0.2.12345: UDP, length 16
13:25:13.448576 IP 10.7.72.137.12345 > 10.0.0.2.12345: UDP, length 16
13:25:14.248860 IP 10.15.182.130.12345 > 10.0.0.2.12345: UDP, length 16
13:25:15.049039 IP 10.92.238.247.12345 > 10.0.0.2.12345: UDP, length 16
13:25:15.849293 IP 10.55.179.110.12345 > 10.0.0.2.12345: UDP, length 16
13:25:16.649535 IP 10.96.73.236.12345 > 10.0.0.2.12345: UDP, length 16
13:25:17.449826 IP 10.8.120.236.12345 > 10.0.0.2.12345: UDP, length 16
13:25:18.250110 IP 10.63.71.5.12345 > 10.0.0.2.12345: UDP, length 16
13:25:19.050438 IP 10.97.222.200.12345 > 10.0.0.2.12345: UDP, length 16
13:25:19.850720 IP 10.32.242.135.12345 > 10.0.0.2.12345: UDP, length 16
13:25:20.651030 IP 10.26.237.111.12345 > 10.0.0.2.12345: UDP, length 16
13:25:21.451330 IP 10.103.109.247.12345 > 10.0.0.2.12345: UDP, length 16
13:25:22.251557 IP 10.3.208.91.12345 > 10.0.0.2.12345: UDP, length 16
13:25:23.051747 IP 10.125.6.83.12345 > 10.0.0.2.12345: UDP, length 16
13:25:23.851992 IP 10.4.242.131.12345 > 10.0.0.2.12345: UDP, length 16
13:25:24.652183 IP 10.108.72.222.12345 > 10.0.0.2.12345: UDP, length 16
13:25:25.452420 IP 10.19.180.49.12345 > 10.0.0.2.12345: UDP, length 16
13:25:26.252680 IP 10.22.7.149.12345 > 10.0.0.2.12345: UDP, length 16
13:25:27.052877 IP 10.119.14.120.12345 > 10.0.0.2.12345: UDP, length 16
13:25:27.853158 IP 10.65.39.124.12345 > 10.0.0.2.12345: UDP, length 16
13:25:28.653388 IP 10.73.111.22.12345 > 10.0.0.2.12345: UDP, length 16
13:25:29.453698 IP 10.92.136.8.12345 > 10.0.0.2.12345: UDP, length 16
13:25:30.254061 IP 10.115.227.55.12345 > 10.0.0.2.12345: UDP, length 16
13:25:31.054425 IP 10.51.171.178.12345 > 10.0.0.2.12345: UDP, length 16
13:25:31.854722 IP 10.121.35.43.12345 > 10.0.0.2.12345: UDP, length 16
13:25:32.654986 IP 10.56.150.167.12345 > 10.0.0.2.12345: UDP, length 16
13:25:33.455318 IP 10.93.135.15.12345 > 10.0.0.2.12345: UDP, length 16
13:25:34.255647 IP 10.44.199.253.12345 > 10.0.0.2.12345: UDP, length 16
13:25:35.055937 IP 10.88.4.220.12345 > 10.0.0.2.12345: UDP, length 16
13:25:35.856392 IP 10.0.163.231.12345 > 10.0.0.2.12345: UDP, length 16

