17:46:50.997287 IP 10.0.0.1.12345 > 10.0.0.2.12345: UDP, length 16
17:46:50.997941 IP 10.0.0.1.12345 > 10.0.0.2.12345: UDP, length 16
17:46:50.998546 IP 10.0.0.1.12345 > 10.0.0.2.12345: UDP, length 16
17:46:50.999149 IP 10.0.0.1.12345 > 10.0.0.2.12345: UDP, length 16
17:46:50.999772 IP 10.0.0.1.12345 > 10.0.0.2.12345: UDP, length 16
17:46:51.000353 IP 10.0.0.1.12345 > 10.0.0.2.12345: UDP, length 16
17:46:51.000996 IP 10.0.0.1.12345 > 10.0.0.2.12345: UDP, length 16
17:46:51.001628 IP 10.0.0.1.12345 > 10.0.0.2.12345: UDP, length 16
17:46:51.002260 IP 10.0.0.1.12345 > 10.0.0.2.12345: UDP, length 16
17:46:51.002893 IP 10.0.0.1.12345 > 10.0.0.2.12345: UDP, length 16
17:46:51.003517 IP 10.0.0.1.12345 > 10.0.0.2.12345: UDP, length 16
17:46:51.004158 IP 10.0.0.1.12345 > 10.0.0.2.12345: UDP, length 16
17:46:51.004777 IP 10.0.0.1.12345 > 10.0.0.2.12345: UDP, length 16
17:46:51.005419 IP 10.0.0.1.12345 > 10.0.0.2.12345: UDP, length 16
17:46:51.006067 IP 10.0.0.1.12345 > 10.0.0.2.12345: UDP, length 16
17:46:51.006716 IP 10.0.0.1.12345 > 10.0.0.2.12345: UDP, length 16
17:46:51.007363 IP 10.0.0.1.12345 > 10.0.0.2.12345: UDP, length 16
17:46:51.008010 IP 10.0.0.1.12345 > 10.0.0.2.12345: UDP, length 16
17:46:51.008628 IP 10.0.0.1.12345 > 10.0.0.2.12345: UDP, length 16
17:46:51.009277 IP 10.0.0.1.12345 > 10.0.0.2.12345: UDP, length 16
17:46:51.009892 IP 10.0.0.1.12345 > 10.0.0.2.12345: UDP, length 16
17:46:51.010529 IP 10.0.0.1.12345 > 10.0.0.2.12345: UDP, length 16
17:46:51.011165 IP 10.0.0.1.12345 > 10.0.0.2.12345: UDP, length 16
17:46:51.011798 IP 10.0.0.1.12345 > 10.0.0.2.12345: UDP, length 16
17:46:51.012399 IP 10.0.0.1.12345 > 10.0.0.2.12345: UDP, length 16
17:46:51.013008 IP 10.0.0.1.12345 > 10.0.0.2.12345: UDP, length 16
17:46:51.013636 IP 10.0.0.1.12345 > 10.0.0.2.12345: UDP, length 16
17:46:51.014266 IP 10.0.0.1.12345 > 10.0.0.2.12345: UDP, length 16
17:46:51.014897 IP 10.0.0.1.12345 > 10.0.0.2.12345: UDP, length 16
17:46:51.015527 IP 10.0.0.1.12345 > 10.0.0.2.12345: UDP, length 16
17:46:51.016157 IP 10.0.0.1.12345 > 10.0.0.2.12345: UDP, length 16
17:46:51.016758 IP 10.0.0.1.12345 > 10.0.0.2.12345: UDP, length 16
17:46:51.017384 IP 10.0.0.1.12345 > 10.0.0.2.12345: UDP, length 16
17:46:51.017985 IP 10.0.0.1.12345 > 10.0.0.2.12345: UDP, length 16
17:46:51.018611 IP 10.0.0.1.12345 > 10.0.0.2.12345: UDP, length 16
17:46:51.019240 IP 10.0.0.1.12345 > 10.0.0.2.12345: UDP, length 16
17:46:51.019869 IP 10.0.0.1.12345 > 10.0.0.2.12345: UDP, length 16
17:46:51.020488 IP 10.0.0.1.12345 > 10.0.0.2.12345: UDP, length 16
17:46:51.021132 IP 10.0.0.1.12345 > 10.0.0.2.12345: UDP, length 16
17:46:51.021780 IP 10.0.0.1.12345 > 10.0.0.2.12345: UDP, length 16
17:46:51.022428 IP 10.0.0.1.12345 > 10.0.0.2.12345: UDP, length 16
17:46:51.023075 IP 10.0.0.1.12345 > 10.0.0.2.12345: UDP, length 16
17:46:51.023722 IP 10.0.0.1.12345 > 10.0.0.2.12345: UDP, length 16
17:46:51.024320 IP 10.0.0.1.12345 > 10.0.0.2.12345: UDP, length 16
17:46:51.024964 IP 10.0.0.1.12345 > 10.0.0.2.12345: UDP, length 16
17:46:51.025610 IP 10.0.0.1.12345 > 10.0.0.2.12345: UDP, length 16
17:46:51.026274 IP 10.0.0.1.12345 > 10.0.0.2.12345: UDP, length 16
17:46:51.026933 IP 10.0.0.1.12345 > 10.0.0.2.12345: UDP, length 16
17:46:51.027598 IP 10.0.0.1.12345 > 10.0.0.2.12345: UDP, length 16
17:46:51.028322 IP 10.0.0.1.12345 > 10.0.0.2.12345: UDP, length 16
17:46:51.028985 IP 10.0.0.1.12345 > 10.0.0.2.12345: UDP, length 16
17:46:51.029647 IP 10.0.0.1.12345 > 10.0.0.2.12345: UDP, length 16
17:46:51.030309 IP 10.0.0.1.12345 > 10.0.0.2.12345: UDP, length 16
17:46:51.030956 IP 10.0.0.1.12345 > 10.0.0.2.12345: UDP, length 16
17:46:51.031617 IP 10.0.0.1.12345 > 10.0.0.2.12345: UDP, length 16
17:46:51.032322 IP 10.0.0.1.12345 > 10.0.0.2.12345: UDP, length 16
17:46:51.032966 IP 10.0.0.1.12345 > 10.0.0.2.12345: UDP, length 16
17:46:51.033628 IP 10.0.0.1.12345 > 10.0.0.2.12345: UDP, length 16
17:46:51.034289 IP 10.0.0.1.12345 > 10.0.0.2.12345: UDP, length 16
17:46:51.034953 IP 10.0.0.1.12345 > 10.0.0.2.12345: UDP, length 16
17:46:51.035614 IP 10.0.0.1.12345 > 10.0.0.2.12345: UDP, length 16
17:46:51.036349 IP 10.0.0.1.12345 > 10.0.0.2.12345: UDP, length 16
17:46:51.037014 IP 10.0.0.1.12345 > 10.0.0.2.12345: UDP, length 16
17:46:51.037686 IP 10.0.0.1.12345 > 10.0.0.2.12345: UDP, length 16
17:46:51.038352 IP 10.0.0.1.12345 > 10.0.0.2.12345: UDP, length 16
17:46:51.039016 IP 10.0.0.1.12345 > 10.0.0.2.12345: UDP, length 16
17:46:51.039682 IP 10.0.0.1.12345 > 10.0.0.2.12345: UDP, length 16
17:46:51.040328 IP 10.0.0.1.12345 > 10.0.0.2.12345: UDP, length 16
17:46:51.040993 IP 10.0.0.1.12345 > 10.0.0.2.12345: UDP, length 16
17:46:51.041658 IP 10.0.0.1.12345 > 10.0.0.2.12345: UDP, length 16
17:46:51.042323 IP 10.0.0.1.12345 > 10.0.0.2.12345: UDP, length 16
17:46:51.042987 IP 10.0.0.1.12345 > 10.0.0.2.12345: UDP, length 16
17:46:51.043650 IP 10.0.0.1.12345 > 10.0.0.2.12345: UDP, length 16
17:46:51.044327 IP 10.0.0.1.12345 > 10.0.0.2.12345: UDP, length 16
17:46:51.044963 IP 10.0.0.1.12345 > 10.0.0.2.12345: UDP, length 16
17:46:51.045623 IP 10.0.0.1.12345 > 10.0.0.2.12345: UDP, length 16
17:46:51.046285 IP 10.0.0.1.12345 > 10.0.0.2.12345: UDP, length 16
17:46:51.046935 IP 10.0.0.1.12345 > 10.0.0.2.12345: UDP, length 16
17:46:51.047584 IP 10.0.0.1.12345 > 10.0.0.2.12345: UDP, length 16
17:46:51.048274 IP 10.0.0.1.12345 > 10.0.0.2.12345: UDP, length 16
17:46:51.048904 IP 10.0.0.1.12345 > 10.0.0.2.12345: UDP, length 16
17:46:51.049560 IP 10.0.0.1.12345 > 10.0.0.2.12345: UDP, length 16
17:46:51.050214 IP 10.0.0.1.12345 > 10.0.0.2.12345: UDP, length 16
17:46:51.050869 IP 10.0.0.1.12345 > 10.0.0.2.12345: UDP, length 16
17:46:51.051524 IP 10.0.0.1.12345 > 10.0.0.2.12345: UDP, length 16
17:46:51.052177 IP 10.0.0.1.12345 > 10.0.0.2.12345: UDP, length 16
17:46:51.052796 IP 10.0.0.1.12345 > 10.0.0.2.12345: UDP, length 16
17:46:51.053449 IP 10.0.0.1.12345 > 10.0.0.2.12345: UDP, length 16
17:46:51.054105 IP 10.0.0.1.12345 > 10.0.0.2.12345: UDP, length 16
17:46:51.054760 IP 10.0.0.1.12345 > 10.0.0.2.12345: UDP, length 16
17:46:51.055413 IP 10.0.0.1.12345 > 10.0.0.2.12345: UDP, length 16
17:46:51.056068 IP 10.0.0.1.12345 > 10.0.0.2.12345: UDP, length 16
17:46:51.056727 IP 10.0.0.1.12345 > 10.0.0.2.12345: UDP, length 16
17:46:51.057386 IP 10.0.0.1.12345 > 10.0.0.2.12345: UDP, length 16
17:46:51.058046 IP 10.0.0.1.12345 > 10.0.0.2.12345: UDP, length 16
17:46:51.058706 IP 10.0.0.1.12345 > 10.0.0.2.12345: UDP, length 16
17:46:51.059365 IP 10.0.0.1.12345 > 10.0.0.2.12345: UDP, length 16
17:46:51.060027 IP 10.0.0.1.12345 > 10.0.0.2.12345: UDP, length 16
17:46:51.060651 IP 10.0.0.1.12345 > 10.0.0.2.12345: UDP, length 16
17:46:51.061257 IP 10.0.0.1.12345 > 10.0.0.2.12345: UDP, length 16
17:46:51.061858 IP 10.0.0.1.12345 > 10.0.0.2.12345: UDP, length 16
17:46:51.062459 IP 10.0.0.1.12345 > 10.0.0.2.12345: UDP, length 16
17:46:51.063049 IP 10.0.0.1.12345 > 10.0.0.2.12345: UDP, length 16
17:46:51.063662 IP 10.0.0.1.12345 > 10.0.0.2.12345: UDP, length 16
17:46:51.064276 IP 10.0.0.1.12345 > 10.0.0.2.12345: UDP, length 16
17:46:51.064861 IP 10.0.0.1.12345 > 10.0.0.2.12345: UDP, length 16
17:46:51.065448 IP 10.0.0.1.12345 > 10.0.0.2.12345: UDP, length 16
17:46:51.066035 IP 10.0.0.1.12345 > 10.0.0.2.12345: UDP, length 16
17:46:51.066624 IP 10.0.0.1.12345 > 10.0.0.2.12345: UDP, length 16
17:46:51.067233 IP 10.0.0.1.12345 > 10.0.0.2.12345: UDP, length 16
17:46:51.067847 IP 10.0.0.1.12345 > 10.0.0.2.12345: UDP, length 16
17:46:51.068434 IP 10.0.0.1.12345 > 10.0.0.2.12345: UDP, length 16
17:46:51.069031 IP 10.0.0.1.12345 > 10.0.0.2.12345: UDP, length 16
17:46:51.069631 IP 10.0.0.1.12345 > 10.0.0.2.12345: UDP, length 16
17:46:51.070225 IP 10.0.0.1.12345 > 10.0.0.2.12345: UDP, length 16
17:46:51.070835 IP 10.0.0.1.12345 > 10.0.0.2.12345: UDP, length 16
17:46:51.071446 IP 10.0.0.1.12345 > 10.0.0.2.12345: UDP, length 16
17:46:51.072056 IP 10.0.0.1.12345 > 10.0.0.2.12345: UDP, length 16
17:46:51.072652 IP 10.0.0.1.12345 > 10.0.0.2.12345: UDP, length 16
17:46:51.073222 IP 10.0.0.1.12345 > 10.0.0.2.12345: UDP, length 16
17:46:51.073831 IP 10.0.0.1.12345 > 10.0.0.2.12345: UDP, length 16
17:46:51.074443 IP 10.0.0.1.12345 > 10.0.0.2.12345: UDP, length 16
17:46:51.075053 IP 10.0.0.1.12345 > 10.0.0.2.12345: UDP, length 16
17:46:51.075663 IP 10.0.0.1.12345 > 10.0.0.2.12345: UDP, length 16
17:46:51.076265 IP 10.0.0.1.12345 > 10.0.0.2.12345: UDP, length 16
17:46:51.076875 IP 10.0.0.1.12345 > 10.0.0.2.12345: UDP, length 16
17:46:51.077486 IP 10.0.0.1.12345 > 10.0.0.2.12345: UDP, length 16
17:46:51.078098 IP 10.0.0.1.12345 > 10.0.0.2.12345: UDP, length 16
17:46:51.078708 IP 10.0.0.1.12345 > 10.0.0.2.12345: UDP, length 16
17:46:51.079304 IP 10.0.0.1.12345 > 10.0.0.2.12345: UDP, length 16
17:46:51.079914 IP 10.0.0.1.12345 > 10.0.0.2.12345: UDP, length 16
17:46:51.080511 IP 10.0.0.1.12345 > 10.0.0.2.12345: UDP, length 16
17:46:51.081087 IP 10.0.0.1.12345 > 10.0.0.2.12345: UDP, length 16
17:46:51.081697 IP 10.0.0.1.12345 > 10.0.0.2.12345: UDP, length 16
17:46:51.082285 IP 10.0.0.1.12345 > 10.0.0.2.12345: UDP, length 16
17:46:51.082879 IP 10.0.0.1.12345 > 10.0.0.2.12345: UDP, length 16
17:46:51.083474 IP 10.0.0.1.12345 > 10.0.0.2.12345: UDP, length 16
17:46:51.084067 IP 10.0.0.1.12345 > 10.0.0.2.12345: UDP, length 16
17:46:51.084647 IP 10.0.0.1.12345 > 10.0.0.2.12345: UDP, length 16
17:46:51.085234 IP 10.0.0.1.12345 > 10.0.0.2.12345: UDP, length 16
17:46:51.085824 IP 10.0.0.1.12345 > 10.0.0.2.12345: UDP, length 16
17:46:51.086409 IP 10.0.0.1.12345 > 10.0.0.2.12345: UDP, length 16
17:46:51.087010 IP 10.0.0.1.12345 > 10.0.0.2.12345: UDP, length 16
17:46:51.087611 IP 10.0.0.1.12345 > 10.0.0.2.12345: UDP, length 16
17:46:51.088250 IP 10.0.0.1.12345 > 10.0.0.2.12345: UDP, length 16
17:46:51.088862 IP 10.0.0.1.12345 > 10.0.0.2.12345: UDP, length 16
17:46:51.089474 IP 10.0.0.1.12345 > 10.0.0.2.12345: UDP, length 16
17:46:51.090086 IP 10.0.0.1.12345 > 10.0.0.2.12345: UDP, length 16
17:46:51.090697 IP 10.0.0.1.12345 > 10.0.0.2.12345: UDP, length 16
17:46:51.091309 IP 10.0.0.1.12345 > 10.0.0.2.12345: UDP, length 16
17:46:51.091920 IP 10.0.0.1.12345 > 10.0.0.2.12345: UDP, length 16
17:46:51.092532 IP 10.0.0.1.12345 > 10.0.0.2.12345: UDP, length 16
17:46:51.093146 IP 10.0.0.1.12345 > 10.0.0.2.12345: UDP, length 16
17:46:51.093756 IP 10.0.0.1.12345 > 10.0.0.2.12345: UDP, length 16
17:46:51.094369 IP 10.0.0.1.12345 > 10.0.0.2.12345: UDP, length 16
17:46:51.094985 IP 10.0.0.1.12345 > 10.0.0.2.12345: UDP, length 16
17:46:51.095597 IP 10.0.0.1.12345 > 10.0.0.2.12345: UDP, length 16
17:46:51.096208 IP 10.0.0.1.12345 > 10.0.0.2.12345: UDP, length 16
17:46:51.096820 IP 10.0.0.1.12345 > 10.0.0.2.12345: UDP, length 16
17:46:51.097431 IP 10.0.0.1.12345 > 10.0.0.2.12345: UDP, length 16
17:46:51.098059 IP 10.0.0.1.12345 > 10.0.0.2.12345: UDP, length 16
17:46:51.098677 IP 10.0.0.1.12345 > 10.0.0.2.12345: UDP, length 16
17:46:51.099296 IP 10.0.0.1.12345 > 10.0.0.2.12345: UDP, length 16
17:46:51.099914 IP 10.0.0.1.12345 > 10.0.0.2.12345: UDP, length 16
17:46:51.100533 IP 10.0.0.1.12345 > 10.0.0.2.12345: UDP, length 16
17:46:51.101156 IP 10.0.0.1.12345 > 10.0.0.2.12345: UDP, length 16
17:46:51.101774 IP 10.0.0.1.12345 > 10.0.0.2.12345: UDP, length 16
17:46:51.102394 IP 10.0.0.1.12345 > 10.0.0.2.12345: UDP, length 16
17:46:51.103012 IP 10.0.0.1.12345 > 10.0.0.2.12345: UDP, length 16
17:46:51.103631 IP 10.0.0.1.12345 > 10.0.0.2.12345: UDP, length 16
17:46:51.104252 IP 10.0.0.1.12345 > 10.0.0.2.12345: UDP, length 16
17:46:51.104871 IP 10.0.0.1.12345 > 10.0.0.2.12345: UDP, length 16
17:46:51.105493 IP 10.0.0.1.12345 > 10.0.0.2.12345: UDP, length 16
17:46:51.106113 IP 10.0.0.1.12345 > 10.0.0.2.12345: UDP, length 16
17:46:51.106731 IP 10.0.0.1.12345 > 10.0.0.2.12345: UDP, length 16
17:46:51.107334 IP 10.0.0.1.12345 > 10.0.0.2.12345: UDP, length 16
17:46:51.107938 IP 10.0.0.1.12345 > 10.0.0.2.12345: UDP, length 16
17:46:51.108557 IP 10.0.0.1.12345 > 10.0.0.2.12345: UDP, length 16
17:46:51.109179 IP 10.0.0.1.12345 > 10.0.0.2.12345: UDP, length 16
17:46:51.109797 IP 10.0.0.1.12345 > 10.0.0.2.12345: UDP, length 16
17:46:51.110416 IP 10.0.0.1.12345 > 10.0.0.2.12345: UDP, length 16
17:46:51.111035 IP 10.0.0.1.12345 > 10.0.0.2.12345: UDP, length 16
17:46:51.111653 IP 10.0.0.1.12345 > 10.0.0.2.12345: UDP, length 16
17:46:51.112279 IP 10.0.0.1.12345 > 10.0.0.2.12345: UDP, length 16
17:46:51.112898 IP 10.0.0.1.12345 > 10.0.0.2.12345: UDP, length 16
17:46:51.113517 IP 10.0.0.1.12345 > 10.0.0.2.12345: UDP, length 16
17:46:51.114136 IP 10.0.0.1.12345 > 10.0.0.2.12345: UDP, length 16
17:46:51.114754 IP 10.0.0.1.12345 > 10.0.0.2.12345: UDP, length 16
17:46:51.115358 IP 10.0.0.1.12345 > 10.0.0.2.12345: UDP, length 16
17:46:51.115977 IP 10.0.0.1.12345 > 10.0.0.2.12345: UDP, length 16
17:46:51.116606 IP 10.0.0.1.12345 > 10.0.0.2.12345: UDP, length 16
17:46:51.117236 IP 10.0.0.1.12345 > 10.0.0.2.12345: UDP, length 16
17:46:51.117865 IP 10.0.0.1.12345 > 10.0.0.2.12345: UDP, length 16
17:46:51.118496 IP 10.0.0.1.12345 > 10.0.0.2.12345: UDP, length 16
17:46:51.119126 IP 10.0.0.1.12345 > 10.0.0.2.12345: UDP, length 16
17:46:51.119757 IP 10.0.0.1.12345 > 10.0.0.2.12345: UDP, length 16
17:46:51.120390 IP 10.0.0.1.12345 > 10.0.0.2.12345: UDP, length 16
17:46:51.121019 IP 10.0.0.1.12345 > 10.0.0.2.12345: UDP, length 16
17:46:51.121651 IP 10.0.0.1.12345 > 10.0.0.2.12345: UDP, length 16
17:46:51.122281 IP 10.0.0.1.12345 > 10.0.0.2.12345: UDP, length 16
17:46:51.122911 IP 10.0.0.1.12345 > 10.0.0.2.12345: UDP, length 16
17:46:51.123541 IP 10.0.0.1.12345 > 10.0.0.2.12345: UDP, length 16
17:46:51.124170 IP 10.0.0.1.12345 > 10.0.0.2.12345: UDP, length 16
17:46:51.124801 IP 10.0.0.1.12345 > 10.0.0.2.12345: UDP, length 16
17:46:51.125429 IP 10.0.0.1.12345 > 10.0.0.2.12345: UDP, length 16
17:46:51.126059 IP 10.0.0.1.12345 > 10.0.0.2.12345: UDP, length 16
17:46:51.126687 IP 10.0.0.1.12345 > 10.0.0.2.12345: UDP, length 16
17:46:51.127315 IP 10.0.0.1.12345 > 10.0.0.2.12345: UDP, length 16
17:46:51.127943 IP 10.0.0.1.12345 > 10.0.0.2.12345: UDP, length 16
17:46:51.128548 IP 10.0.0.1.12345 > 10.0.0.2.12345: UDP, length 16
17:46:51.129173 IP 10.0.0.1.12345 > 10.0.0.2.12345: UDP, length 16
17:46:51.129802 IP 10.0.0.1.12345 > 10.0.0.2.12345: UDP, length 16
17:46:51.130430 IP 10.0.0.1.12345 > 10.0.0.2.12345: UDP, length 16
17:46:51.131057 IP 10.0.0.1.12345 > 10.0.0.2.12345: UDP, length 16
17:46:51.131686 IP 10.0.0.1.12345 > 10.0.0.2.12345: UDP, length 16
17:46:51.132317 IP 10.0.0.1.12345 > 10.0.0.2.12345: UDP, length 16
17:46:51.132943 IP 10.0.0.1.12345 > 10.0.0.2.12345: UDP, length 16
17:46:51.133573 IP 10.0.0.1.12345 > 10.0.0.2.12345: UDP, length 16
17:46:51.134203 IP 10.0.0.1.12345 > 10.0.0.2.12345: UDP, length 16
17:46:51.134835 IP 10.0.0.1.12345 > 10.0.0.2.12345: UDP, length 16
17:46:51.135467 IP 10.0.0.1.12345 > 10.0.0.2.12345: UDP, length 16
17:46:51.136096 IP 10.0.0.1.12345 > 10.0.0.2.12345: UDP, length 16
17:46:51.136724 IP 10.0.0.1.12345 > 10.0.0.2.12345: UDP, length 16
17:46:51.137354 IP 10.0.0.1.12345 > 10.0.0.2.12345: UDP, length 16
17:46:51.137983 IP 10.0.0.1.12345 > 10.0.0.2.12345: UDP, length 16
17:46:51.138613 IP 10.0.0.1.12345 > 10.0.0.2.12345: UDP, length 16
17:46:51.139243 IP 10.0.0.1.12345 > 10.0.0.2.12345: UDP, length 16
17:46:51.139872 IP 10.0.0.1.12345 > 10.0.0.2.12345: UDP, length 16
17:46:51.140502 IP 10.0.0.1.12345 > 10.0.0.2.12345: UDP, length 16
17:46:51.141132 IP 10.0.0.1.12345 > 10.0.0.2.12345: UDP, length 16
17:46:51.141761 IP 10.0.0.1.12345 > 10.0.0.2.12345: UDP, length 16
17:46:51.142391 IP 10.0.0.1.12345 > 10.0.0.2.12345: UDP, length 16
17:46:51.143020 IP 10.0.0.1.12345 > 10.0.0.2.12345: UDP, length 16
17:46:51.143650 IP 10.0.0.1.12345 > 10.0.0.2.12345: UDP, length 16
17:46:51.144289 IP 10.0.0.1.12345 > 10.0.0.2.12345: UDP, length 16
17:46:51.144920 IP 10.0.0.1.12345 > 10.0.0.2.12345: UDP, length 16
17:46:51.145549 IP 10.0.0.1.12345 > 10.0.0.2.12345: UDP, length 16
17:46:51.146178 IP 10.0.0.1.12345 > 10.0.0.2.12345: UDP, length 16
17:46:51.146807 IP 10.0.0.1.12345 > 10.0.0.2.12345: UDP, length 16
17:46:51.147449 IP 10.0.0.1.12345 > 10.0.0.2.12345: UDP, length 16
17:46:51.148078 IP 10.0.0.1.12345 > 10.0.0.2.12345: UDP, length 16
17:46:51.148709 IP 10.0.0.1.12345 > 10.0.0.2.12345: UDP, length 16
17:46:51.149338 IP 10.0.0.1.12345 > 10.0.0.2.12345: UDP, length 16
17:46:51.149967 IP 10.0.0.1.12345 > 10.0.0.2.12345: UDP, length 16
17:46:51.150596 IP 10.0.0.1.12345 > 10.0.0.2.12345: UDP, length 16
17:46:51.151226 IP 10.0.0.1.12345 > 10.0.0.2.12345: UDP, length 16
17:46:51.151856 IP 10.0.0.1.12345 > 10.0.0.2.12345: UDP, length 16
17:46:51.152485 IP 10.0.0.1.12345 > 10.0.0.2.12345: UDP, length 16
17:46:51.153114 IP 10.0.0.1.12345 > 10.0.0.2.12345: UDP, length 16
17:46:51.153744 IP 10.0.0.1.12345 > 10.0.0.2.12345: UDP, length 16
17:46:51.154375 IP 10.0.0.1.12345 > 10.0.0.2.12345: UDP, length 16
17:46:51.155004 IP 10.0.0.1.12345 > 10.0.0.2.12345: UDP, length 16
17:46:51.155634 IP 10.0.0.1.12345 > 10.0.0.2.12345: UDP, length 16
17:46:51.156274 IP 10.0.0.1.12345 > 10.0.0.2.12345: UDP, length 16
17:46:51.156905 IP 10.0.0.1.12345 > 10.0.0.2.12345: UDP, length 16
17:46:51.157536 IP 10.0.0.1.12345 > 10.0.0.2.12345: UDP, length 16
17:46:51.158165 IP 10.0.0.1.12345 > 10.0.0.2.12345: UDP, length 16
17:46:51.158795 IP 10.0.0.1.12345 > 10.0.0.2.12345: UDP, length 16
17:46:51.159425 IP 10.0.0.1.12345 > 10.0.0.2.12345: UDP, length 16
17:46:51.160054 IP 10.0.0.1.12345 > 10.0.0.2.12345: UDP, length 16
17:46:51.160684 IP 10.0.0.1.12345 > 10.0.0.2.12345: UDP, length 16
17:46:51.161316 IP 10.0.0.1.12345 > 10.0.0.2.12345: UDP, length 16
17:46:51.161945 IP 10.0.0.1.12345 > 10.0.0.2.12345: UDP, length 16
17:46:51.162575 IP 10.0.0.1.12345 > 10.0.0.2.12345: UDP, length 16
17:46:51.163204 IP 10.0.0.1.12345 > 10.0.0.2.12345: UDP, length 16
17:46:51.163836 IP 10.0.0.1.12345 > 10.0.0.2.12345: UDP, length 16
17:46:51.164466 IP 10.0.0.1.12345 > 10.0.0.2.12345: UDP, length 16
17:46:51.165095 IP 10.0.0.1.12345 > 10.0.0.2.12345: UDP, length 16
17:46:51.165724 IP 10.0.0.1.12345 > 10.0.0.2.12345: UDP, length 16
17:46:51.166356 IP 10.0.0.1.12345 > 10.0.0.2.12345: UDP, length 16
17:46:51.166987 IP 10.0.0.1.12345 > 10.0.0.2.12345: UDP, length 16
17:46:51.167601 IP 10.0.0.1.12345 > 10.0.0.2.12345: UDP, length 16
17:46:51.168260 IP 10.0.0.1.12345 > 10.0.0.2.12345: UDP, length 16
17:46:51.168890 IP 10.0.0.1.12345 > 10.0.0.2.12345: UDP, length 16
17:46:51.169521 IP 10.0.0.1.12345 > 10.0.0.2.12345: UDP, length 16
17:46:51.170151 IP 10.0.0.1.12345 > 10.0.0.2.12345: UDP, length 16
17:46:51.170782 IP 10.0.0.1.12345 > 10.0.0.2.12345: UDP, length 16
17:46:51.171413 IP 10.0.0.1.12345 > 10.0.0.2.12345: UDP, length 16
17:46:51.172042 IP 10.0.0.1.12345 > 10.0.0.2.12345: UDP, length 16
17:46:51.172672 IP 10.0.0.1.12345 > 10.0.0.2.12345: UDP, length 16
17:46:51.173302 IP 10.0.0.1.12345 > 10.0.0.2.12345: UDP, length 16
17:46:51.173933 IP 10.0.0.1.12345 > 10.0.0.2.12345: UDP, length 16
17:46:51.174562 IP 10.0.0.1.12345 > 10.0.0.2.12345: UDP, length 16
17:46:51.175191 IP 10.0.0.1.12345 > 10.0.0.2.12345: UDP, length 16
17:46:51.175820 IP 10.0.0.1.12345 > 10.0.0.2.12345: UDP, length 16
17:46:51.176450 IP 10.0.0.1.12345 > 10.0.0.2.12345: UDP, length 16
17:46:51.177079 IP 10.0.0.1.12345 > 10.0.0.2.12345: UDP, length 16
17:46:51.177709 IP 10.0.0.1.12345 > 10.0.0.2.12345: UDP, length 16
17:46:51.178338 IP 10.0.0.1.12345 > 10.0.0.2.12345: UDP, length 16
17:46:51.178968 IP 10.0.0.1.12345 > 10.0.0.2.12345: UDP, length 16
17:46:51.179597 IP 10.0.0.1.12345 > 10.0.0.2.12345: UDP, length 16
17:46:51.180251 IP 10.0.0.1.12345 > 10.0.0.2.12345: UDP, length 16
17:46:51.180880 IP 10.0.0.1.12345 > 10.0.0.2.12345: UDP, length 16
17:46:51.181509 IP 10.0.0.1.12345 > 10.0.0.2.12345: UDP, length 16
17:46:51.182142 IP 10.0.0.1.12345 > 10.0.0.2.12345: UDP, length 16
17:46:51.182759 IP 10.0.0.1.12345 > 10.0.0.2.12345: UDP, length 16
17:46:51.183376 IP 10.0.0.1.12345 > 10.0.0.2.12345: UDP, length 16
17:46:51.183990 IP 10.0.0.1.12345 > 10.0.0.2.12345: UDP, length 16
17:46:51.184606 IP 10.0.0.1.12345 > 10.0.0.2.12345: UDP, length 16
17:46:51.185220 IP 10.0.0.1.12345 > 10.0.0.2.12345: UDP, length 16
17:46:51.185821 IP 10.0.0.1.12345 > 10.0.0.2.12345: UDP, length 16
17:46:51.186434 IP 10.0.0.1.12345 > 10.0.0.2.12345: UDP, length 16
17:46:51.187049 IP 10.0.0.1.12345 > 10.0.0.2.12345: UDP, length 16
17:46:51.187664 IP 10.0.0.1.12345 > 10.0.0.2.12345: UDP, length 16
17:46:51.188279 IP 10.0.0.1.12345 > 10.0.0.2.12345: UDP, length 16
17:46:51.188894 IP 10.0.0.1.12345 > 10.0.0.2.12345: UDP, length 16
17:46:51.189504 IP 10.0.0.1.12345 > 10.0.0.2.12345: UDP, length 16
17:46:51.190106 IP 10.0.0.1.12345 > 10.0.0.2.12345: UDP, length 16
17:46:51.190729 IP 10.0.0.1.12345 > 10.0.0.2.12345: UDP, length 16
17:46:51.191356 IP 10.0.0.1.12345 > 10.0.0.2.12345: UDP, length 16
17:46:51.191985 IP 10.0.0.1.12345 > 10.0.0.2.12345: UDP, length 16
17:46:51.192615 IP 10.0.0.1.12345 > 10.0.0.2.12345: UDP, length 16
17:46:51.193243 IP 10.0.0.1.12345 > 10.0.0.2.12345: UDP, length 16
17:46:51.193872 IP 10.0.0.1.12345 > 10.0.0.2.12345: UDP, length 16
17:46:51.194500 IP 10.0.0.1.12345 > 10.0.0.2.12345: UDP, length 16
17:46:51.195112 IP 10.0.0.1.12345 > 10.0.0.2.12345: UDP, length 16
17:46:51.195723 IP 10.0.0.1.12345 > 10.0.0.2.12345: UDP, length 16
17:46:51.196333 IP 10.0.0.1.12345 > 10.0.0.2.12345: UDP, length 16
17:46:51.196946 IP 10.0.0.1.12345 > 10.0.0.2.12345: UDP, length 16
17:46:51.197557 IP 10.0.0.1.12345 > 10.0.0.2.12345: UDP, length 16
17:46:51.198168 IP 10.0.0.1.12345 > 10.0.0.2.12345: UDP, length 16
17:46:51.198778 IP 10.0.0.1.12345 > 10.0.0.2.12345: UDP, length 16
17:46:51.199393 IP 10.0.0.1.12345 > 10.0.0.2.12345: UDP, length 16
17:46:51.200005 IP 10.0.0.1.12345 > 10.0.0.2.12345: UDP, length 16
17:46:51.200624 IP 10.0.0.1.12345 > 10.0.0.2.12345: UDP, length 16
17:46:51.201235 IP 10.0.0.1.12345 > 10.0.0.2.12345: UDP, length 16
17:46:51.201846 IP 10.0.0.1.12345 > 10.0.0.2.12345: UDP, length 16
17:46:51.202462 IP 10.0.0.1.12345 > 10.0.0.2.12345: UDP, length 16
17:46:51.203073 IP 10.0.0.1.12345 > 10.0.0.2.12345: UDP, length 16
17:46:51.203685 IP 10.0.0.1.12345 > 10.0.0.2.12345: UDP, length 16
17:46:51.204285 IP 10.0.0.1.12345 > 10.0.0.2.12345: UDP, length 16
17:46:51.204896 IP 10.0.0.1.12345 > 10.0.0.2.12345: UDP, length 16
17:46:51.205508 IP 10.0.0.1.12345 > 10.0.0.2.12345: UDP, length 16
17:46:51.206111 IP 10.0.0.1.12345 > 10.0.0.2.12345: UDP, length 16
17:46:51.206707 IP 10.0.0.1.12345 > 10.0.0.2.12345: UDP, length 16
17:46:51.207303 IP 10.0.0.1.12345 > 10.0.0.2.12345: UDP, length 16
17:46:51.207904 IP 10.0.0.1.12345 > 10.0.0.2.12345: UDP, length 16
17:46:51.208513 IP 10.0.0.1.12345 > 10.0.0.2.12345: UDP, length 16
17:46:51.209128 IP 10.0.0.1.12345 > 10.0.0.2.12345: UDP, length 16
17:46:51.211013 IP 10.0.0.1.12345 > 10.0.0.2.12345: UDP, length 16
17:46:51.211625 IP 10.0.0.1.12345 > 10.0.0.2.12345: UDP, length 16
17:46:51.212221 IP 10.0.0.1.12345 > 10.0.0.2.12345: UDP, length 16
17:46:51.212842 IP 10.0.0.1.12345 > 10.0.0.2.12345: UDP, length 16
17:46:51.213453 IP 10.0.0.1.12345 > 10.0.0.2.12345: UDP, length 16
17:46:51.214068 IP 10.0.0.1.12345 > 10.0.0.2.12345: UDP, length 16
17:46:51.214683 IP 10.0.0.1.12345 > 10.0.0.2.12345: UDP, length 16
17:46:51.215327 IP 10.0.0.1.12345 > 10.0.0.2.12345: UDP, length 16
17:46:51.215940 IP 10.0.0.1.12345 > 10.0.0.2.12345: UDP, length 16
17:46:51.216560 IP 10.0.0.1.12345 > 10.0.0.2.12345: UDP, length 16
17:46:51.217170 IP 10.0.0.1.12345 > 10.0.0.2.12345: UDP, length 16
17:46:51.217781 IP 10.0.0.1.12345 > 10.0.0.2.12345: UDP, length 16
17:46:51.218393 IP 10.0.0.1.12345 > 10.0.0.2.12345: UDP, length 16
17:46:51.219004 IP 10.0.0.1.12345 > 10.0.0.2.12345: UDP, length 16
17:46:51.219615 IP 10.0.0.1.12345 > 10.0.0.2.12345: UDP, length 16
17:46:51.220243 IP 10.0.0.1.12345 > 10.0.0.2.12345: UDP, length 16
17:46:51.220855 IP 10.0.0.1.12345 > 10.0.0.2.12345: UDP, length 16
17:46:51.221452 IP 10.0.0.1.12345 > 10.0.0.2.12345: UDP, length 16
17:46:51.222063 IP 10.0.0.1.12345 > 10.0.0.2.12345: UDP, length 16
17:46:51.222674 IP 10.0.0.1.12345 > 10.0.0.2.12345: UDP, length 16
17:46:51.223286 IP 10.0.0.1.12345 > 10.0.0.2.12345: UDP, length 16
17:46:51.223897 IP 10.0.0.1.12345 > 10.0.0.2.12345: UDP, length 16
17:46:51.224509 IP 10.0.0.1.12345 > 10.0.0.2.12345: UDP, length 16
17:46:51.225121 IP 10.0.0.1.12345 > 10.0.0.2.12345: UDP, length 16
17:46:51.225732 IP 10.0.0.1.12345 > 10.0.0.2.12345: UDP, length 16
17:46:51.226342 IP 10.0.0.1.12345 > 10.0.0.2.12345: UDP, length 16
17:46:51.226953 IP 10.0.0.1.12345 > 10.0.0.2.12345: UDP, length 16
17:46:51.227550 IP 10.0.0.1.12345 > 10.0.0.2.12345: UDP, length 16
17:46:51.228162 IP 10.0.0.1.12345 > 10.0.0.2.12345: UDP, length 16
17:46:51.228774 IP 10.0.0.1.12345 > 10.0.0.2.12345: UDP, length 16
17:46:51.229385 IP 10.0.0.1.12345 > 10.0.0.2.12345: UDP, length 16
17:46:51.229997 IP 10.0.0.1.12345 > 10.0.0.2.12345: UDP, length 16
17:46:51.230608 IP 10.0.0.1.12345 > 10.0.0.2.12345: UDP, length 16
17:46:51.231219 IP 10.0.0.1.12345 > 10.0.0.2.12345: UDP, length 16
17:46:51.231830 IP 10.0.0.1.12345 > 10.0.0.2.12345: UDP, length 16
17:46:51.232458 IP 10.0.0.1.12345 > 10.0.0.2.12345: UDP, length 16
17:46:51.233087 IP 10.0.0.1.12345 > 10.0.0.2.12345: UDP, length 16
17:46:51.233718 IP 10.0.0.1.12345 > 10.0.0.2.12345: UDP, length 16
17:46:51.234348 IP 10.0.0.1.12345 > 10.0.0.2.12345: UDP, length 16
17:46:51.234978 IP 10.0.0.1.12345 > 10.0.0.2.12345: UDP, length 16
17:46:51.235607 IP 10.0.0.1.12345 > 10.0.0.2.12345: UDP, length 16
17:46:51.236264 IP 10.0.0.1.12345 > 10.0.0.2.12345: UDP, length 16
17:46:51.236897 IP 10.0.0.1.12345 > 10.0.0.2.12345: UDP, length 16
17:46:51.237526 IP 10.0.0.1.12345 > 10.0.0.2.12345: UDP, length 16
17:46:51.238155 IP 10.0.0.1.12345 > 10.0.0.2.12345: UDP, length 16
17:46:51.238783 IP 10.0.0.1.12345 > 10.0.0.2.12345: UDP, length 16
17:46:51.239413 IP 10.0.0.1.12345 > 10.0.0.2.12345: UDP, length 16
17:46:51.240043 IP 10.0.0.1.12345 > 10.0.0.2.12345: UDP, length 16
17:46:51.240676 IP 10.0.0.1.12345 > 10.0.0.2.12345: UDP, length 16
17:46:51.241309 IP 10.0.0.1.12345 > 10.0.0.2.12345: UDP, length 16
17:46:51.241942 IP 10.0.0.1.12345 > 10.0.0.2.12345: UDP, length 16
17:46:51.242578 IP 10.0.0.1.12345 > 10.0.0.2.12345: UDP, length 16
17:46:51.243211 IP 10.0.0.1.12345 > 10.0.0.2.12345: UDP, length 16
17:46:51.243845 IP 10.0.0.1.12345 > 10.0.0.2.12345: UDP, length 16
17:46:51.244478 IP 10.0.0.1.12345 > 10.0.0.2.12345: UDP, length 16
17:46:51.245112 IP 10.0.0.1.12345 > 10.0.0.2.12345: UDP, length 16
17:46:51.245746 IP 10.0.0.1.12345 > 10.0.0.2.12345: UDP, length 16
17:46:51.246378 IP 10.0.0.1.12345 > 10.0.0.2.12345: UDP, length 16
17:46:51.247012 IP 10.0.0.1.12345 > 10.0.0.2.12345: UDP, length 16
17:46:51.247645 IP 10.0.0.1.12345 > 10.0.0.2.12345: UDP, length 16
17:46:51.248286 IP 10.0.0.1.12345 > 10.0.0.2.12345: UDP, length 16
17:46:51.248919 IP 10.0.0.1.12345 > 10.0.0.2.12345: UDP, length 16
17:46:51.249552 IP 10.0.0.1.12345 > 10.0.0.2.12345: UDP, length 16
17:46:51.250185 IP 10.0.0.1.12345 > 10.0.0.2.12345: UDP, length 16
17:46:51.250819 IP 10.0.0.1.12345 > 10.0.0.2.12345: UDP, length 16
17:46:51.251452 IP 10.0.0.1.12345 > 10.0.0.2.12345: UDP, length 16
17:46:51.252086 IP 10.0.0.1.12345 > 10.0.0.2.12345: UDP, length 16
17:46:51.252719 IP 10.0.0.1.12345 > 10.0.0.2.12345: UDP, length 16
17:46:51.253353 IP 10.0.0.1.12345 > 10.0.0.2.12345: UDP, length 16
17:46:51.253973 IP 10.0.0.1.12345 > 10.0.0.2.12345: UDP, length 16
17:46:51.254609 IP 10.0.0.1.12345 > 10.0.0.2.12345: UDP, length 16
17:46:51.255243 IP 10.0.0.1.12345 > 10.0.0.2.12345: UDP, length 16
17:46:51.255887 IP 10.0.0.1.12345 > 10.0.0.2.12345: UDP, length 16
17:46:51.256521 IP 10.0.0.1.12345 > 10.0.0.2.12345: UDP, length 16
17:46:51.257156 IP 10.0.0.1.12345 > 10.0.0.2.12345: UDP, length 16
17:46:51.257789 IP 10.0.0.1.12345 > 10.0.0.2.12345: UDP, length 16
17:46:51.258423 IP 10.0.0.1.12345 > 10.0.0.2.12345: UDP, length 16
17:46:51.259066 IP 10.0.0.1.12345 > 10.0.0.2.12345: UDP, length 16
17:46:51.259707 IP 10.0.0.1.12345 > 10.0.0.2.12345: UDP, length 16
17:46:51.260337 IP 10.0.0.1.12345 > 10.0.0.2.12345: UDP, length 16
17:46:51.260980 IP 10.0.0.1.12345 > 10.0.0.2.12345: UDP, length 16
17:46:51.261623 IP 10.0.0.1.12345 > 10.0.0.2.12345: UDP, length 16
17:46:51.262266 IP 10.0.0.1.12345 > 10.0.0.2.12345: UDP, length 16
17:46:51.262909 IP 10.0.0.1.12345 > 10.0.0.2.12345: UDP, length 16
17:46:51.263553 IP 10.0.0.1.12345 > 10.0.0.2.12345: UDP, length 16
17:46:51.264195 IP 10.0.0.1.12345 > 10.0.0.2.12345: UDP, length 16
17:46:51.264838 IP 10.0.0.1.12345 > 10.0.0.2.12345: UDP, length 16
17:46:51.265481 IP 10.0.0.1.12345 > 10.0.0.2.12345: UDP, length 16
17:46:51.266124 IP 10.0.0.1.12345 > 10.0.0.2.12345: UDP, length 16
17:46:51.266752 IP 10.0.0.1.12345 > 10.0.0.2.12345: UDP, length 16
17:46:51.267395 IP 10.0.0.1.12345 > 10.0.0.2.12345: UDP, length 16
17:46:51.268037 IP 10.0.0.1.12345 > 10.0.0.2.12345: UDP, length 16
17:46:51.268682 IP 10.0.0.1.12345 > 10.0.0.2.12345: UDP, length 16
17:46:51.269324 IP 10.0.0.1.12345 > 10.0.0.2.12345: UDP, length 16
17:46:51.269976 IP 10.0.0.1.12345 > 10.0.0.2.12345: UDP, length 16
17:46:51.270619 IP 10.0.0.1.12345 > 10.0.0.2.12345: UDP, length 16
17:46:51.271261 IP 10.0.0.1.12345 > 10.0.0.2.12345: UDP, length 16
17:46:51.271904 IP 10.0.0.1.12345 > 10.0.0.2.12345: UDP, length 16
17:46:51.272547 IP 10.0.0.1.12345 > 10.0.0.2.12345: UDP, length 16
17:46:51.273167 IP 10.0.0.1.12345 > 10.0.0.2.12345: UDP, length 16
17:46:51.273783 IP 10.0.0.1.12345 > 10.0.0.2.12345: UDP, length 16
17:46:51.274408 IP 10.0.0.1.12345 > 10.0.0.2.12345: UDP, length 16
17:46:51.275018 IP 10.0.0.1.12345 > 10.0.0.2.12345: UDP, length 16
17:46:51.275626 IP 10.0.0.1.12345 > 10.0.0.2.12345: UDP, length 16
17:46:51.276280 IP 10.0.0.1.12345 > 10.0.0.2.12345: UDP, length 16
17:46:51.276935 IP 10.0.0.1.12345 > 10.0.0.2.12345: UDP, length 16
17:46:51.277586 IP 10.0.0.1.12345 > 10.0.0.2.12345: UDP, length 16
17:46:51.278235 IP 10.0.0.1.12345 > 10.0.0.2.12345: UDP, length 16
17:46:51.278884 IP 10.0.0.1.12345 > 10.0.0.2.12345: UDP, length 16
17:46:51.279533 IP 10.0.0.1.12345 > 10.0.0.2.12345: UDP, length 16
17:46:51.280183 IP 10.0.0.1.12345 > 10.0.0.2.12345: UDP, length 16
17:46:51.280834 IP 10.0.0.1.12345 > 10.0.0.2.12345: UDP, length 16
17:46:51.281483 IP 10.0.0.1.12345 > 10.0.0.2.12345: UDP, length 16
17:46:51.282132 IP 10.0.0.1.12345 > 10.0.0.2.12345: UDP, length 16
17:46:51.282782 IP 10.0.0.1.12345 > 10.0.0.2.12345: UDP, length 16
17:46:51.283432 IP 10.0.0.1.12345 > 10.0.0.2.12345: UDP, length 16
17:46:51.284046 IP 10.0.0.1.12345 > 10.0.0.2.12345: UDP, length 16
17:46:51.284714 IP 10.0.0.1.12345 > 10.0.0.2.12345: UDP, length 16
17:46:51.285371 IP 10.0.0.1.12345 > 10.0.0.2.12345: UDP, length 16
17:46:51.286028 IP 10.0.0.1.12345 > 10.0.0.2.12345: UDP, length 16
17:46:51.286684 IP 10.0.0.1.12345 > 10.0.0.2.12345: UDP, length 16
17:46:51.287339 IP 10.0.0.1.12345 > 10.0.0.2.12345: UDP, length 16
17:46:51.287996 IP 10.0.0.1.12345 > 10.0.0.2.12345: UDP, length 16
17:46:51.288654 IP 10.0.0.1.12345 > 10.0.0.2.12345: UDP, length 16
17:46:51.289310 IP 10.0.0.1.12345 > 10.0.0.2.12345: UDP, length 16
17:46:51.289966 IP 10.0.0.1.12345 > 10.0.0.2.12345: UDP, length 16
17:46:51.290624 IP 10.0.0.1.12345 > 10.0.0.2.12345: UDP, length 16
17:46:51.291280 IP 10.0.0.1.12345 > 10.0.0.2.12345: UDP, length 16
17:46:51.291936 IP 10.0.0.1.12345 > 10.0.0.2.12345: UDP, length 16
17:46:51.292593 IP 10.0.0.1.12345 > 10.0.0.2.12345: UDP, length 16
17:46:51.293249 IP 10.0.0.1.12345 > 10.0.0.2.12345: UDP, length 16
17:46:51.293905 IP 10.0.0.1.12345 > 10.0.0.2.12345: UDP, length 16
17:46:51.294562 IP 10.0.0.1.12345 > 10.0.0.2.12345: UDP, length 16
17:46:51.295221 IP 10.0.0.1.12345 > 10.0.0.2.12345: UDP, length 16
17:46:51.295877 IP 10.0.0.1.12345 > 10.0.0.2.12345: UDP, length 16
17:46:51.296534 IP 10.0.0.1.12345 > 10.0.0.2.12345: UDP, length 16
17:46:51.297191 IP 10.0.0.1.12345 > 10.0.0.2.12345: UDP, length 16
17:46:51.297846 IP 10.0.0.1.12345 > 10.0.0.2.12345: UDP, length 16
17:46:51.298502 IP 10.0.0.1.12345 > 10.0.0.2.12345: UDP, length 16
17:46:51.299157 IP 10.0.0.1.12345 > 10.0.0.2.12345: UDP, length 16
17:46:51.299813 IP 10.0.0.1.12345 > 10.0.0.2.12345: UDP, length 16
17:46:51.300470 IP 10.0.0.1.12345 > 10.0.0.2.12345: UDP, length 16
17:46:51.301126 IP 10.0.0.1.12345 > 10.0.0.2.12345: UDP, length 16
17:46:51.301782 IP 10.0.0.1.12345 > 10.0.0.2.12345: UDP, length 16
17:46:51.302437 IP 10.0.0.1.12345 > 10.0.0.2.12345: UDP, length 16
17:46:51.303093 IP 10.0.0.1.12345 > 10.0.0.2.12345: UDP, length 16
17:46:51.303749 IP 10.0.0.1.12345 > 10.0.0.2.12345: UDP, length 16
17:46:51.304408 IP 10.0.0.1.12345 > 10.0.0.2.12345: UDP, length 16
17:46:51.305071 IP 10.0.0.1.12345 > 10.0.0.2.12345: UDP, length 16
17:46:51.305737 IP 10.0.0.1.12345 > 10.0.0.2.12345: UDP, length 16
17:46:51.306371 IP 10.0.0.1.12345 > 10.0.0.2.12345: UDP, length 16
17:46:51.306971 IP 10.0.0.1.12345 > 10.0.0.2.12345: UDP, length 16
17:46:51.307595 IP 10.0.0.1.12345 > 10.0.0.2.12345: UDP, length 16
17:46:51.308203 IP 10.0.0.1.12345 > 10.0.0.2.12345: UDP, length 16
17:46:51.308806 IP 10.0.0.1.12345 > 10.0.0.2.12345: UDP, length 16
17:46:51.309405 IP 10.0.0.1.12345 > 10.0.0.2.12345: UDP, length 16
17:46:51.310048 IP 10.0.0.1.12345 > 10.0.0.2.12345: UDP, length 16
17:46:51.310700 IP 10.0.0.1.12345 > 10.0.0.2.12345: UDP, length 16
17:46:51.311348 IP 10.0.0.1.12345 > 10.0.0.2.12345: UDP, length 16
17:46:51.311999 IP 10.0.0.1.12345 > 10.0.0.2.12345: UDP, length 16
17:46:51.312649 IP 10.0.0.1.12345 > 10.0.0.2.12345: UDP, length 16

