10:52:47.421971 IP 10.0.0.1.12345 > 10.0.0.2.12345: UDP, length 16
10:52:48.422231 IP 10.0.0.1.12345 > 10.0.0.2.12345: UDP, length 16
10:52:49.422452 IP 10.0.0.1.12345 > 10.0.0.2.12345: UDP, length 16
10:52:50.422702 IP 10.0.0.1.12345 > 10.0.0.2.12345: UDP, length 16
10:52:51.422961 IP 10.0.0.1.12345 > 10.0.0.2.12345: UDP, length 16
10:52:52.423209 IP 10.0.0.1.12345 > 10.0.0.2.12345: UDP, length 16
10:52:53.423453 IP 10.0.0.1.12345 > 10.0.0.2.12345: UDP, length 16
10:52:54.423802 IP 10.0.0.1.12345 > 10.0.0.2.12345: UDP, length 16
10:52:55.424051 IP 10.0.0.1.12345 > 10.0.0.2.12345: UDP, length 16
10:52:56.424301 IP 10.0.0.1.12345 > 10.0.0.2.12345: UDP, length 16
10:52:57.424557 IP 10.0.0.1.12345 > 10.0.0.2.12345: UDP, length 16
10:52:58.424750 IP 10.0.0.1.12345 > 10.0.0.2.12345: UDP, length 16
10:52:59.424969 IP 10.0.0.1.12345 > 10.0.0.2.12345: UDP, length 16
10:53:00.425220 IP 10.0.0.1.12345 > 10.0.0.2.12345: UDP, length 16
10:53:01.425479 IP 10.0.0.1.12345 > 10.0.0.2.12345: UDP, length 16
10:53:02.425736 IP 10.0.0.1.12345 > 10.0.0.2.12345: UDP, length 16
10:53:03.425889 IP 10.0.0.1.12345 > 10.0.0.2.12345: UDP, length 16
10:53:04.426136 IP 10.0.0.1.12345 > 10.0.0.2.12345: UDP, length 16
10:53:05.426327 IP 10.0.0.1.12345 > 10.0.0.2.12345: UDP, length 16
10:53:06.426548 IP 10.0.0.1.12345 > 10.0.0.2.12345: UDP, length 16
10:53:07.426764 IP 10.0.0.1.12345 > 10.0.0.2.12345: UDP, length 16
10:53:08.426966 IP 10.0.0.1.12345 > 10.0.0.2.12345: UDP, length 16
10:53:09.427226 IP 10.0.0.1.12345 > 10.0.0.2.12345: UDP, length 16
10:53:10.427450 IP 10.0.0.1.12345 > 10.0.0.2.12345: UDP, length 16
10:53:11.427756 IP 10.0.0.1.12345 > 10.0.0.2.12345: UDP, length 16
10:53:12.427978 IP 10.0.0.1.12345 > 10.0.0.2.12345: UDP, length 16
10:53:13.428201 IP 10.0.0.1.12345 > 10.0.0.2.12345: UDP, length 16
10:53:14.428452 IP 10.0.0.1.12345 > 10.0.0.2.12345: UDP, length 16
10:53:15.428697 IP 10.0.0.1.12345 > 10.0.0.2.12345: UDP, length 16
10:53:16.428934 IP 10.0.0.1.12345 > 10.0.0.2.12345: UDP, length 16
10:53:17.429178 IP 10.0.0.1.12345 > 10.0.0.2.12345: UDP, length 16
10:53:18.429432 IP 10.0.0.1.12345 > 10.0.0.2.12345: UDP, length 16
10:53:19.429659 IP 10.0.0.1.12345 > 10.0.0.2.12345: UDP, length 16
10:53:20.429919 IP 10.0.0.1.12345 > 10.0.0.2.12345: UDP, length 16
10:53:21.430184 IP 10.0.0.1.12345 > 10.0.0.2.12345: UDP, length 16
10:53:22.430423 IP 10.0.0.1.12345 > 10.0.0.2.12345: UDP, length 16
10:53:23.430665 IP 10.0.0.1.12345 > 10.0.0.2.12345: UDP, length 16
10:53:24.430919 IP 10.0.0.1.12345 > 10.0.0.2.12345: UDP, length 16
10:53:25.431177 IP 10.0.0.1.12345 > 10.0.0.2.12345: UDP, length 16
10:53:26.431426 IP 10.0.0.1.12345 > 10.0.0.2.12345: UDP, length 16
10:53:27.431636 IP 10.0.0.1.12345 > 10.0.0.2.12345: UDP, length 16
10:53:28.431777 IP 10.0.0.1.12345 > 10.0.0.2.12345: UDP, length 16
10:53:29.431939 IP 10.0.0.1.12345 > 10.0.0.2.12345: UDP, length 16
10:53:30.432207 IP 10.0.0.1.12345 > 10.0.0.2.12345: UDP, length 16
10:53:31.432347 IP 10.0.0.1.12345 > 10.0.0.2.12345: UDP, length 16
10:53:32.432518 IP 10.0.0.1.12345 > 10.0.0.2.12345: UDP, length 16
10:53:33.432657 IP 10.0.0.1.12345 > 10.0.0.2.12345: UDP, length 16
10:53:34.432859 IP 10.0.0.1.12345 > 10.0.0.2.12345: UDP, length 16
10:53:35.433057 IP 10.0.0.1.12345 > 10.0.0.2.12345: UDP, length 16
10:53:36.433244 IP 10.0.0.1.12345 > 10.0.0.2.12345: UDP, length 16
10:53:37.433494 IP 10.0.0.1.12345 > 10.0.0.2.12345: UDP, length 16
10:53:38.433691 IP 10.0.0.1.12345 > 10.0.0.2.12345: UDP, length 16
10:53:39.433893 IP 10.0.0.1.12345 > 10.0.0.2.12345: UDP, length 16
10:53:40.434040 IP 10.0.0.1.12345 > 10.0.0.2.12345: UDP, length 16
10:53:41.434243 IP 10.0.0.1.12345 > 10.0.0.2.12345: UDP, length 16
10:53:42.434457 IP 10.0.0.1.12345 > 10.0.0.2.12345: UDP, length 16
10:53:43.434610 IP 10.0.0.1.12345 > 10.0.0.2.12345: UDP, length 16
10:53:44.434792 IP 10.0.0.1.12345 > 10.0.0.2.12345: UDP, length 16
10:53:45.434996 IP 10.0.0.1.12345 > 10.0.0.2.12345: UDP, length 16
10:53:46.435217 IP 10.0.0.1.12345 > 10.0.0.2.12345: UDP, length 16
10:53:47.435448 IP 10.0.0.1.12345 > 10.0.0.2.12345: UDP, length 16
10:53:48.435644 IP 10.0.0.1.12345 > 10.0.0.2.12345: UDP, length 16
10:53:49.435810 IP 10.0.0.1.12345 > 10.0.0.2.12345: UDP, length 16
10:53:50.436066 IP 10.0.0.1.12345 > 10.0.0.2.12345: UDP, length 16
10:53:51.436341 IP 10.0.0.1.12345 > 10.0.0.2.12345: UDP, length 16
10:53:52.436564 IP 10.0.0.1.12345 > 10.0.0.2.12345: UDP, length 16
10:53:53.436804 IP 10.0.0.1.12345 > 10.0.0.2.12345: UDP, length 16
10:53:54.437024 IP 10.0.0.1.12345 > 10.0.0.2.12345: UDP, length 16
10:53:55.437256 IP 10.0.0.1.12345 > 10.0.0.2.12345: UDP, length 16
10:53:56.437514 IP 10.0.0.1.12345 > 10.0.0.2.12345: UDP, length 16
10:53:57.437765 IP 10.0.0.1.12345 > 10.0.0.2.12345: UDP, length 16
10:53:58.437994 IP 10.0.0.1.12345 > 10.0.0.2.12345: UDP, length 16
10:53:59.438242 IP 10.0.0.1.12345 > 10.0.0.2.12345: UDP, length 16
10:54:00.438500 IP 10.0.0.1.12345 > 10.0.0.2.12345: UDP, length 16
10:54:01.438723 IP 10.0.0.1.12345 > 10.0.0.2.12345: UDP, length 16
10:54:02.438975 IP 10.0.0.1.12345 > 10.0.0.2.12345: UDP, length 16
10:54:03.439222 IP 10.0.0.1.12345 > 10.0.0.2.12345: UDP, length 16
10:54:04.439443 IP 10.0.0.1.12345 > 10.0.0.2.12345: UDP, length 16
10:54:05.439690 IP 10.0.0.1.12345 > 10.0.0.2.12345: UDP, length 16
10:54:06.440011 IP 10.0.0.1.12345 > 10.0.0.2.12345: UDP, length 16
10:54:07.440236 IP 10.0.0.1.12345 > 10.0.0.2.12345: UDP, length 16
10:54:08.440480 IP 10.0.0.1.12345 > 10.0.0.2.12345: UDP, length 16
10:54:09.440705 IP 10.0.0.1.12345 > 10.0.0.2.12345: UDP, length 16
10:54:10.440893 IP 10.0.0.1.12345 > 10.0.0.2.12345: UDP, length 16
10:54:11.441103 IP 10.0.0.1.12345 > 10.0.0.2.12345: UDP, length 16
10:54:12.441360 IP 10.0.0.1.12345 > 10.0.0.2.12345: UDP, length 16
10:54:13.441560 IP 10.0.0.1.12345 > 10.0.0.2.12345: UDP, length 16
10:54:14.441802 IP 10.0.0.1.12345 > 10.0.0.2.12345: UDP, length 16
10:54:15.442040 IP 10.0.0.1.12345 > 10.0.0.2.12345: UDP, length 16
10:54:16.442249 IP 10.0.0.1.12345 > 10.0.0.2.12345: UDP, length 16
10:54:17.442434 IP 10.0.0.1.12345 > 10.0.0.2.12345: UDP, length 16
10:54:18.442649 IP 10.0.0.1.12345 > 10.0.0.2.12345: UDP, length 16
10:54:19.442860 IP 10.0.0.1.12345 > 10.0.0.2.12345: UDP, length 16
10:54:20.443110 IP 10.0.0.1.12345 > 10.0.0.2.12345: UDP, length 16
10:54:21.443314 IP 10.0.0.1.12345 > 10.0.0.2.12345: UDP, length 16
10:54:22.443531 IP 10.0.0.1.12345 > 10.0.0.2.12345: UDP, length 16
10:54:23.443752 IP 10.0.0.1.12345 > 10.0.0.2.12345: UDP, length 16
10:54:24.444002 IP 10.0.0.1.12345 > 10.0.0.2.12345: UDP, length 16
10:54:25.444222 IP 10.0.0.1.12345 > 10.0.0.2.12345: UDP, length 16
10:54:26.444471 IP 10.0.0.1.12345 > 10.0.0.2.12345: UDP, length 16
10:54:27.444669 IP 10.0.0.1.12345 > 10.0.0.2.12345: UDP, length 16
10:54:28.444878 IP 10.0.0.1.12345 > 10.0.0.2.12345: UDP, length 16
10:54:29.445067 IP 10.0.0.1.12345 > 10.0.0.2.12345: UDP, length 16
10:54:30.445311 IP 10.0.0.1.12345 > 10.0.0.2.12345: UDP, length 16
10:54:31.445511 IP 10.0.0.1.12345 > 10.0.0.2.12345: UDP, length 16
10:54:32.445753 IP 10.0.0.1.12345 > 10.0.0.2.12345: UDP, length 16
10:54:33.445989 IP 10.0.0.1.12345 > 10.0.0.2.12345: UDP, length 16
10:54:34.446212 IP 10.0.0.1.12345 > 10.0.0.2.12345: UDP, length 16
10:54:35.446463 IP 10.0.0.1.12345 > 10.0.0.2.12345: UDP, length 16
10:54:36.446729 IP 10.0.0.1.12345 > 10.0.0.2.12345: UDP, length 16
10:54:37.446956 IP 10.0.0.1.12345 > 10.0.0.2.12345: UDP, length 16
10:54:38.447196 IP 10.0.0.1.12345 > 10.0.0.2.12345: UDP, length 16
10:54:39.447461 IP 10.0.0.1.12345 > 10.0.0.2.12345: UDP, length 16
10:54:40.447665 IP 10.0.0.1.12345 > 10.0.0.2.12345: UDP, length 16
10:54:41.447917 IP 10.0.0.1.12345 > 10.0.0.2.12345: UDP, length 16
10:54:42.448182 IP 10.0.0.1.12345 > 10.0.0.2.12345: UDP, length 16
10:54:43.448346 IP 10.0.0.1.12345 > 10.0.0.2.12345: UDP, length 16
10:54:44.448591 IP 10.0.0.1.12345 > 10.0.0.2.12345: UDP, length 16
10:54:45.448746 IP 10.0.0.1.12345 > 10.0.0.2.12345: UDP, length 16
10:54:46.448969 IP 10.0.0.1.12345 > 10.0.0.2.12345: UDP, length 16
10:54:47.449231 IP 10.0.0.1.12345 > 10.0.0.2.12345: UDP, length 16
10:54:48.449445 IP 10.0.0.1.12345 > 10.0.0.2.12345: UDP, length 16
10:54:49.449702 IP 10.0.0.1.12345 > 10.0.0.2.12345: UDP, length 16
10:54:50.449973 IP 10.0.0.1.12345 > 10.0.0.2.12345: UDP, length 16
10:54:51.450252 IP 10.0.0.1.12345 > 10.0.0.2.12345: UDP, length 16
10:54:52.450519 IP 10.0.0.1.12345 > 10.0.0.2.12345: UDP, length 16
10:54:53.450738 IP 10.0.0.1.12345 > 10.0.0.2.12345: UDP, length 16
10:54:54.450996 IP 10.0.0.1.12345 > 10.0.0.2.12345: UDP, length 16
10:54:55.451257 IP 10.0.0.1.12345 > 10.0.0.2.12345: UDP, length 16
10:54:56.451451 IP 10.0.0.1.12345 > 10.0.0.2.12345: UDP, length 16
10:54:57.451814 IP 10.0.0.1.12345 > 10.0.0.2.12345: UDP, length 16
10:54:58.452025 IP 10.0.0.1.12345 > 10.0.0.2.12345: UDP, length 16
10:54:59.452262 IP 10.0.0.1.12345 > 10.0.0.2.12345: UDP, length 16
10:55:00.452514 IP 10.0.0.1.12345 > 10.0.0.2.12345: UDP, length 16
10:55:01.452772 IP 10.0.0.1.12345 > 10.0.0.2.12345: UDP, length 16
10:55:02.453027 IP 10.0.0.1.12345 > 10.0.0.2.12345: UDP, length 16
10:55:03.453280 IP 10.0.0.1.12345 > 10.0.0.2.12345: UDP, length 16
10:55:04.453530 IP 10.0.0.1.12345 > 10.0.0.2.12345: UDP, length 16
10:55:05.453790 IP 10.0.0.1.12345 > 10.0.0.2.12345: UDP, length 16
10:55:06.454053 IP 10.0.0.1.12345 > 10.0.0.2.12345: UDP, length 16
10:55:07.454313 IP 10.0.0.1.12345 > 10.0.0.2.12345: UDP, length 16
10:55:08.454573 IP 10.0.0.1.12345 > 10.0.0.2.12345: UDP, length 16
10:55:09.454835 IP 10.0.0.1.12345 > 10.0.0.2.12345: UDP, length 16
10:55:10.455033 IP 10.0.0.1.12345 > 10.0.0.2.12345: UDP, length 16
10:55:11.455265 IP 10.0.0.1.12345 > 10.0.0.2.12345: UDP, length 16
10:55:12.455506 IP 10.0.0.1.12345 > 10.0.0.2.12345: UDP, length 16
10:55:13.455743 IP 10.0.0.1.12345 > 10.0.0.2.12345: UDP, length 16
10:55:14.455999 IP 10.0.0.1.12345 > 10.0.0.2.12345: UDP, length 16
10:55:15.456263 IP 10.0.0.1.12345 > 10.0.0.2.12345: UDP, length 16
10:55:16.456490 IP 10.0.0.1.12345 > 10.0.0.2.12345: UDP, length 16
10:55:17.456746 IP 10.0.0.1.12345 > 10.0.0.2.12345: UDP, length 16
10:55:18.456991 IP 10.0.0.1.12345 > 10.0.0.2.12345: UDP, length 16
10:55:19.457215 IP 10.0.0.1.12345 > 10.0.0.2.12345: UDP, length 16
10:55:20.457443 IP 10.0.0.1.12345 > 10.0.0.2.12345: UDP, length 16
10:55:21.457701 IP 10.0.0.1.12345 > 10.0.0.2.12345: UDP, length 16
10:55:22.457880 IP 10.0.0.1.12345 > 10.0.0.2.12345: UDP, length 16
10:55:23.458129 IP 10.0.0.1.12345 > 10.0.0.2.12345: UDP, length 16
10:55:24.458383 IP 10.0.0.1.12345 > 10.0.0.2.12345: UDP, length 16
10:55:25.458587 IP 10.0.0.1.12345 > 10.0.0.2.12345: UDP, length 16
10:55:26.458829 IP 10.0.0.1.12345 > 10.0.0.2.12345: UDP, length 16
10:55:27.459088 IP 10.0.0.1.12345 > 10.0.0.2.12345: UDP, length 16
10:55:28.459298 IP 10.0.0.1.12345 > 10.0.0.2.12345: UDP, length 16
10:55:29.459552 IP 10.0.0.1.12345 > 10.0.0.2.12345: UDP, length 16
10:55:30.459801 IP 10.0.0.1.12345 > 10.0.0.2.12345: UDP, length 16
10:55:31.460040 IP 10.0.0.1.12345 > 10.0.0.2.12345: UDP, length 16
10:55:32.460275 IP 10.0.0.1.12345 > 10.0.0.2.12345: UDP, length 16
10:55:33.460530 IP 10.0.0.1.12345 > 10.0.0.2.12345: UDP, length 16
10:55:34.460777 IP 10.0.0.1.12345 > 10.0.0.2.12345: UDP, length 16
10:55:35.461036 IP 10.0.0.1.12345 > 10.0.0.2.12345: UDP, length 16
10:55:36.461302 IP 10.0.0.1.12345 > 10.0.0.2.12345: UDP, length 16
10:55:37.461554 IP 10.0.0.1.12345 > 10.0.0.2.12345: UDP, length 16
10:55:38.461800 IP 10.0.0.1.12345 > 10.0.0.2.12345: UDP, length 16
10:55:39.462063 IP 10.0.0.1.12345 > 10.0.0.2.12345: UDP, length 16
10:55:40.462292 IP 10.0.0.1.12345 > 10.0.0.2.12345: UDP, length 16
10:55:41.462550 IP 10.0.0.1.12345 > 10.0.0.2.12345: UDP, length 16
10:55:42.462812 IP 10.0.0.1.12345 > 10.0.0.2.12345: UDP, length 16
10:55:43.463054 IP 10.0.0.1.12345 > 10.0.0.2.12345: UDP, length 16
10:55:44.463312 IP 10.0.0.1.12345 > 10.0.0.2.12345: UDP, length 16
10:55:45.463576 IP 10.0.0.1.12345 > 10.0.0.2.12345: UDP, length 16
10:55:46.463778 IP 10.0.0.1.12345 > 10.0.0.2.12345: UDP, length 16
10:55:47.464026 IP 10.0.0.1.12345 > 10.0.0.2.12345: UDP, length 16
10:55:48.464268 IP 10.0.0.1.12345 > 10.0.0.2.12345: UDP, length 16
10:55:49.464512 IP 10.0.0.1.12345 > 10.0.0.2.12345: UDP, length 16
10:55:50.464752 IP 10.0.0.1.12345 > 10.0.0.2.12345: UDP, length 16
10:55:51.465008 IP 10.0.0.1.12345 > 10.0.0.2.12345: UDP, length 16
10:55:52.465251 IP 10.0.0.1.12345 > 10.0.0.2.12345: UDP, length 16
10:55:53.465507 IP 10.0.0.1.12345 > 10.0.0.2.12345: UDP, length 16
10:55:54.465753 IP 10.0.0.1.12345 > 10.0.0.2.12345: UDP, length 16
10:55:55.465999 IP 10.0.0.1.12345 > 10.0.0.2.12345: UDP, length 16
10:55:56.466190 IP 10.0.0.1.12345 > 10.0.0.2.12345: UDP, length 16
10:55:57.466412 IP 10.0.0.1.12345 > 10.0.0.2.12345: UDP, length 16
10:55:58.466649 IP 10.0.0.1.12345 > 10.0.0.2.12345: UDP, length 16
10:55:59.466894 IP 10.0.0.1.12345 > 10.0.0.2.12345: UDP, length 16
10:56:00.467084 IP 10.0.0.1.12345 > 10.0.0.2.12345: UDP, length 16
10:56:01.467316 IP 10.0.0.1.12345 > 10.0.0.2.12345: UDP, length 16
10:56:02.467552 IP 10.0.0.1.12345 > 10.0.0.2.12345: UDP, length 16
10:56:03.467806 IP 10.0.0.1.12345 > 10.0.0.2.12345: UDP, length 16
10:56:04.467958 IP 10.0.0.1.12345 > 10.0.0.2.12345: UDP, length 16
10:56:05.468205 IP 10.0.0.1.12345 > 10.0.0.2.12345: UDP, length 16
10:56:06.468457 IP 10.0.0.1.12345 > 10.0.0.2.12345: UDP, length 16
10:56:07.468705 IP 10.0.0.1.12345 > 10.0.0.2.12345: UDP, length 16
10:56:08.468963 IP 10.0.0.1.12345 > 10.0.0.2.12345: UDP, length 16
10:56:09.469148 IP 10.0.0.1.12345 > 10.0.0.2.12345: UDP, length 16
10:56:10.469346 IP 10.0.0.1.12345 > 10.0.0.2.12345: UDP, length 16
10:56:11.469597 IP 10.0.0.1.12345 > 10.0.0.2.12345: UDP, length 16
10:56:12.469766 IP 10.0.0.1.12345 > 10.0.0.2.12345: UDP, length 16
10:56:13.469977 IP 10.0.0.1.12345 > 10.0.0.2.12345: UDP, length 16
10:56:14.470197 IP 10.0.0.1.12345 > 10.0.0.2.12345: UDP, length 16
10:56:15.470377 IP 10.0.0.1.12345 > 10.0.0.2.12345: UDP, length 16
10:56:16.470609 IP 10.0.0.1.12345 > 10.0.0.2.12345: UDP, length 16
10:56:17.470864 IP 10.0.0.1.12345 > 10.0.0.2.12345: UDP, length 16
10:56:18.471110 IP 10.0.0.1.12345 > 10.0.0.2.12345: UDP, length 16
10:56:19.471321 IP 10.0.0.1.12345 > 10.0.0.2.12345: UDP, length 16
10:56:20.471524 IP 10.0.0.1.12345 > 10.0.0.2.12345: UDP, length 16
10:56:21.471773 IP 10.0.0.1.12345 > 10.0.0.2.12345: UDP, length 16
10:56:22.471974 IP 10.0.0.1.12345 > 10.0.0.2.12345: UDP, length 16
10:56:23.472228 IP 10.0.0.1.12345 > 10.0.0.2.12345: UDP, length 16
10:56:24.472430 IP 10.0.0.1.12345 > 10.0.0.2.12345: UDP, length 16
10:56:25.472655 IP 10.0.0.1.12345 > 10.0.0.2.12345: UDP, length 16
10:56:26.472849 IP 10.0.0.1.12345 > 10.0.0.2.12345: UDP, length 16
10:56:27.473095 IP 10.0.0.1.12345 > 10.0.0.2.12345: UDP, length 16
10:56:28.473316 IP 10.0.0.1.12345 > 10.0.0.2.12345: UDP, length 16
10:56:29.473525 IP 10.0.0.1.12345 > 10.0.0.2.12345: UDP, length 16
10:56:30.473713 IP 10.0.0.1.12345 > 10.0.0.2.12345: UDP, length 16
10:56:31.473854 IP 10.0.0.1.12345 > 10.0.0.2.12345: UDP, length 16
10:56:32.474085 IP 10.0.0.1.12345 > 10.0.0.2.12345: UDP, length 16
10:56:33.474354 IP 10.0.0.1.12345 > 10.0.0.2.12345: UDP, length 16
10:56:34.474547 IP 10.0.0.1.12345 > 10.0.0.2.12345: UDP, length 16
10:56:35.474792 IP 10.0.0.1.12345 > 10.0.0.2.12345: UDP, length 16
10:56:36.474992 IP 10.0.0.1.12345 > 10.0.0.2.12345: UDP, length 16
10:56:37.475234 IP 10.0.0.1.12345 > 10.0.0.2.12345: UDP, length 16
10:56:38.475451 IP 10.0.0.1.12345 > 10.0.0.2.12345: UDP, length 16
10:56:39.475802 IP 10.0.0.1.12345 > 10.0.0.2.12345: UDP, length 16
10:56:40.475961 IP 10.0.0.1.12345 > 10.0.0.2.12345: UDP, length 16
10:56:41.476214 IP 10.0.0.1.12345 > 10.0.0.2.12345: UDP, length 16
10:56:42.476449 IP 10.0.0.1.12345 > 10.0.0.2.12345: UDP, length 16
10:56:43.476681 IP 10.0.0.1.12345 > 10.0.0.2.12345: UDP, length 16
10:56:44.476866 IP 10.0.0.1.12345 > 10.0.0.2.12345: UDP, length 16
10:56:45.477105 IP 10.0.0.1.12345 > 10.0.0.2.12345: UDP, length 16
10:56:46.477333 IP 10.0.0.1.12345 > 10.0.0.2.12345: UDP, length 16
10:56:47.477589 IP 10.0.0.1.12345 > 10.0.0.2.12345: UDP, length 16
10:56:48.477856 IP 10.0.0.1.12345 > 10.0.0.2.12345: UDP, length 16
10:56:49.478123 IP 10.0.0.1.12345 > 10.0.0.2.12345: UDP, length 16
10:56:50.478381 IP 10.0.0.1.12345 > 10.0.0.2.12345: UDP, length 16
10:56:51.478646 IP 10.0.0.1.12345 > 10.0.0.2.12345: UDP, length 16
10:56:52.478876 IP 10.0.0.1.12345 > 10.0.0.2.12345: UDP, length 16
10:56:53.479125 IP 10.0.0.1.12345 > 10.0.0.2.12345: UDP, length 16
10:56:54.479388 IP 10.0.0.1.12345 > 10.0.0.2.12345: UDP, length 16
10:56:55.479626 IP 10.0.0.1.12345 > 10.0.0.2.12345: UDP, length 16
10:56:56.479883 IP 10.0.0.1.12345 > 10.0.0.2.12345: UDP, length 16
10:56:57.480148 IP 10.0.0.1.12345 > 10.0.0.2.12345: UDP, length 16
10:56:58.480388 IP 10.0.0.1.12345 > 10.0.0.2.12345: UDP, length 16
10:56:59.480627 IP 10.0.0.1.12345 > 10.0.0.2.12345: UDP, length 16
10:57:00.480864 IP 10.0.0.1.12345 > 10.0.0.2.12345: UDP, length 16
10:57:01.481120 IP 10.0.0.1.12345 > 10.0.0.2.12345: UDP, length 16
10:57:02.481382 IP 10.0.0.1.12345 > 10.0.0.2.12345: UDP, length 16
10:57:03.481637 IP 10.0.0.1.12345 > 10.0.0.2.12345: UDP, length 16
10:57:04.481895 IP 10.0.0.1.12345 > 10.0.0.2.12345: UDP, length 16
10:57:05.482155 IP 10.0.0.1.12345 > 10.0.0.2.12345: UDP, length 16
10:57:06.482417 IP 10.0.0.1.12345 > 10.0.0.2.12345: UDP, length 16
10:57:07.482664 IP 10.0.0.1.12345 > 10.0.0.2.12345: UDP, length 16
10:57:08.482921 IP 10.0.0.1.12345 > 10.0.0.2.12345: UDP, length 16
10:57:09.483192 IP 10.0.0.1.12345 > 10.0.0.2.12345: UDP, length 16
10:57:10.483387 IP 10.0.0.1.12345 > 10.0.0.2.12345: UDP, length 16
10:57:11.483637 IP 10.0.0.1.12345 > 10.0.0.2.12345: UDP, length 16
10:57:12.483869 IP 10.0.0.1.12345 > 10.0.0.2.12345: UDP, length 16
10:57:13.484051 IP 10.0.0.1.12345 > 10.0.0.2.12345: UDP, length 16
10:57:14.484296 IP 10.0.0.1.12345 > 10.0.0.2.12345: UDP, length 16
10:57:15.484550 IP 10.0.0.1.12345 > 10.0.0.2.12345: UDP, length 16
10:57:16.484744 IP 10.0.0.1.12345 > 10.0.0.2.12345: UDP, length 16
10:57:17.484961 IP 10.0.0.1.12345 > 10.0.0.2.12345: UDP, length 16
10:57:18.485216 IP 10.0.0.1.12345 > 10.0.0.2.12345: UDP, length 16
10:57:19.485454 IP 10.0.0.1.12345 > 10.0.0.2.12345: UDP, length 16
10:57:20.485708 IP 10.0.0.1.12345 > 10.0.0.2.12345: UDP, length 16
10:57:21.485941 IP 10.0.0.1.12345 > 10.0.0.2.12345: UDP, length 16
10:57:22.486167 IP 10.0.0.1.12345 > 10.0.0.2.12345: UDP, length 16
10:57:23.486430 IP 10.0.0.1.12345 > 10.0.0.2.12345: UDP, length 16
10:57:24.486694 IP 10.0.0.1.12345 > 10.0.0.2.12345: UDP, length 16
10:57:25.486929 IP 10.0.0.1.12345 > 10.0.0.2.12345: UDP, length 16
10:57:26.487178 IP 10.0.0.1.12345 > 10.0.0.2.12345: UDP, length 16
10:57:27.487448 IP 10.0.0.1.12345 > 10.0.0.2.12345: UDP, length 16
10:57:28.487749 IP 10.0.0.1.12345 > 10.0.0.2.12345: UDP, length 16
10:57:29.487972 IP 10.0.0.1.12345 > 10.0.0.2.12345: UDP, length 16
10:57:30.488164 IP 10.0.0.1.12345 > 10.0.0.2.12345: UDP, length 16
10:57:31.488385 IP 10.0.0.1.12345 > 10.0.0.2.12345: UDP, length 16
10:57:32.488633 IP 10.0.0.1.12345 > 10.0.0.2.12345: UDP, length 16
10:57:33.488884 IP 10.0.0.1.12345 > 10.0.0.2.12345: UDP, length 16
10:57:34.489128 IP 10.0.0.1.12345 > 10.0.0.2.12345: UDP, length 16
10:57:35.489387 IP 10.0.0.1.12345 > 10.0.0.2.12345: UDP, length 16
10:57:36.489651 IP 10.0.0.1.12345 > 10.0.0.2.12345: UDP, length 16
10:57:37.489894 IP 10.0.0.1.12345 > 10.0.0.2.12345: UDP, length 16
10:57:38.490144 IP 10.0.0.1.12345 > 10.0.0.2.12345: UDP, length 16
10:57:39.490401 IP 10.0.0.1.12345 > 10.0.0.2.12345: UDP, length 16
10:57:40.490634 IP 10.0.0.1.12345 > 10.0.0.2.12345: UDP, length 16
10:57:41.490886 IP 10.0.0.1.12345 > 10.0.0.2.12345: UDP, length 16
10:57:42.491142 IP 10.0.0.1.12345 > 10.0.0.2.12345: UDP, length 16
10:57:43.491376 IP 10.0.0.1.12345 > 10.0.0.2.12345: UDP, length 16
10:57:44.491627 IP 10.0.0.1.12345 > 10.0.0.2.12345: UDP, length 16
10:57:45.491965 IP 10.0.0.1.12345 > 10.0.0.2.12345: UDP, length 16
10:57:46.492159 IP 10.0.0.1.12345 > 10.0.0.2.12345: UDP, length 16

