10:52:47.422431 IP 10.0.0.1.12345 > 10.0.0.2.12345: UDP, length 16
10:52:48.422256 IP 10.0.0.1.12345 > 10.0.0.2.12345: UDP, length 16
10:52:49.422473 IP 10.0.0.1.12345 > 10.0.0.2.12345: UDP, length 16
10:52:50.422730 IP 10.0.0.1.12345 > 10.0.0.2.12345: UDP, length 16
10:52:51.422988 IP 10.0.0.1.12345 > 10.0.0.2.12345: UDP, length 16
10:52:52.423236 IP 10.0.0.1.12345 > 10.0.0.2.12345: UDP, length 16
10:52:53.423478 IP 10.0.0.1.12345 > 10.0.0.2.12345: UDP, length 16
10:52:54.423832 IP 10.0.0.1.12345 > 10.0.0.2.12345: UDP, length 16
10:52:55.424075 IP 10.0.0.1.12345 > 10.0.0.2.12345: UDP, length 16
10:52:56.424329 IP 10.0.0.1.12345 > 10.0.0.2.12345: UDP, length 16
10:52:57.424584 IP 10.0.0.1.12345 > 10.0.0.2.12345: UDP, length 16
10:52:58.424764 IP 10.0.0.1.12345 > 10.0.0.2.12345: UDP, length 16
10:52:59.424993 IP 10.0.0.1.12345 > 10.0.0.2.12345: UDP, length 16
10:53:00.425247 IP 10.0.0.1.12345 > 10.0.0.2.12345: UDP, length 16
10:53:01.425507 IP 10.0.0.1.12345 > 10.0.0.2.12345: UDP, length 16
10:53:02.425767 IP 10.0.0.1.12345 > 10.0.0.2.12345: UDP, length 16
10:53:03.425910 IP 10.0.0.1.12345 > 10.0.0.2.12345: UDP, length 16
10:53:04.426162 IP 10.0.0.1.12345 > 10.0.0.2.12345: UDP, length 16
10:53:05.426341 IP 10.0.0.1.12345 > 10.0.0.2.12345: UDP, length 16
10:53:06.426572 IP 10.0.0.1.12345 > 10.0.0.2.12345: UDP, length 16
10:53:07.426785 IP 10.0.0.1.12345 > 10.0.0.2.12345: UDP, length 16
10:53:08.426992 IP 10.0.0.1.12345 > 10.0.0.2.12345: UDP, length 16
10:53:09.427256 IP 10.0.0.1.12345 > 10.0.0.2.12345: UDP, length 16
10:53:10.427470 IP 10.0.0.1.12345 > 10.0.0.2.12345: UDP, length 16
10:53:11.427779 IP 10.0.0.1.12345 > 10.0.0.2.12345: UDP, length 16
10:53:12.428008 IP 10.0.0.1.12345 > 10.0.0.2.12345: UDP, length 16
10:53:13.428221 IP 10.0.0.1.12345 > 10.0.0.2.12345: UDP, length 16
10:53:14.428483 IP 10.0.0.1.12345 > 10.0.0.2.12345: UDP, length 16
10:53:15.428721 IP 10.0.0.1.12345 > 10.0.0.2.12345: UDP, length 16
10:53:16.428958 IP 10.0.0.1.12345 > 10.0.0.2.12345: UDP, length 16
10:53:17.429203 IP 10.0.0.1.12345 > 10.0.0.2.12345: UDP, length 16
10:53:18.429462 IP 10.0.0.1.12345 > 10.0.0.2.12345: UDP, length 16
10:53:19.429681 IP 10.0.0.1.12345 > 10.0.0.2.12345: UDP, length 16
10:53:20.429950 IP 10.0.0.1.12345 > 10.0.0.2.12345: UDP, length 16
10:53:21.430214 IP 10.0.0.1.12345 > 10.0.0.2.12345: UDP, length 16
10:53:22.430447 IP 10.0.0.1.12345 > 10.0.0.2.12345: UDP, length 16
10:53:23.430692 IP 10.0.0.1.12345 > 10.0.0.2.12345: UDP, length 16
10:53:24.430949 IP 10.0.0.1.12345 > 10.0.0.2.12345: UDP, length 16
10:53:25.431204 IP 10.0.0.1.12345 > 10.0.0.2.12345: UDP, length 16
10:53:26.431457 IP 10.0.0.1.12345 > 10.0.0.2.12345: UDP, length 16
10:53:27.431684 IP 10.0.0.1.12345 > 10.0.0.2.12345: UDP, length 16
10:53:28.431789 IP 10.0.0.1.12345 > 10.0.0.2.12345: UDP, length 16
10:53:29.431982 IP 10.0.0.1.12345 > 10.0.0.2.12345: UDP, length 16
10:53:30.432234 IP 10.0.0.1.12345 > 10.0.0.2.12345: UDP, length 16
10:53:31.432364 IP 10.0.0.1.12345 > 10.0.0.2.12345: UDP, length 16
10:53:32.432542 IP 10.0.0.1.12345 > 10.0.0.2.12345: UDP, length 16
10:53:33.432678 IP 10.0.0.1.12345 > 10.0.0.2.12345: UDP, length 16
10:53:34.432876 IP 10.0.0.1.12345 > 10.0.0.2.12345: UDP, length 16
10:53:35.433074 IP 10.0.0.1.12345 > 10.0.0.2.12345: UDP, length 16
10:53:36.433284 IP 10.0.0.1.12345 > 10.0.0.2.12345: UDP, length 16
10:53:37.433518 IP 10.0.0.1.12345 > 10.0.0.2.12345: UDP, length 16
10:53:38.433707 IP 10.0.0.1.12345 > 10.0.0.2.12345: UDP, length 16
10:53:39.433913 IP 10.0.0.1.12345 > 10.0.0.2.12345: UDP, length 16
10:53:40.434055 IP 10.0.0.1.12345 > 10.0.0.2.12345: UDP, length 16
10:53:41.434281 IP 10.0.0.1.12345 > 10.0.0.2.12345: UDP, length 16
10:53:42.434495 IP 10.0.0.1.12345 > 10.0.0.2.12345: UDP, length 16
10:53:43.434625 IP 10.0.0.1.12345 > 10.0.0.2.12345: UDP, length 16
10:53:44.434808 IP 10.0.0.1.12345 > 10.0.0.2.12345: UDP, length 16
10:53:45.435039 IP 10.0.0.1.12345 > 10.0.0.2.12345: UDP, length 16
10:53:46.435237 IP 10.0.0.1.12345 > 10.0.0.2.12345: UDP, length 16
10:53:47.435475 IP 10.0.0.1.12345 > 10.0.0.2.12345: UDP, length 16
10:53:48.435660 IP 10.0.0.1.12345 > 10.0.0.2.12345: UDP, length 16
10:53:49.435834 IP 10.0.0.1.12345 > 10.0.0.2.12345: UDP, length 16
10:53:50.436100 IP 10.0.0.1.12345 > 10.0.0.2.12345: UDP, length 16
10:53:51.436370 IP 10.0.0.1.12345 > 10.0.0.2.12345: UDP, length 16
10:53:52.436586 IP 10.0.0.1.12345 > 10.0.0.2.12345: UDP, length 16
10:53:53.436832 IP 10.0.0.1.12345 > 10.0.0.2.12345: UDP, length 16
10:53:54.437045 IP 10.0.0.1.12345 > 10.0.0.2.12345: UDP, length 16
10:53:55.437282 IP 10.0.0.1.12345 > 10.0.0.2.12345: UDP, length 16
10:53:56.437547 IP 10.0.0.1.12345 > 10.0.0.2.12345: UDP, length 16
10:53:57.437794 IP 10.0.0.1.12345 > 10.0.0.2.12345: UDP, length 16
10:53:58.438021 IP 10.0.0.1.12345 > 10.0.0.2.12345: UDP, length 16
10:53:59.438270 IP 10.0.0.1.12345 > 10.0.0.2.12345: UDP, length 16
10:54:00.438531 IP 10.0.0.1.12345 > 10.0.0.2.12345: UDP, length 16
10:54:01.438745 IP 10.0.0.1.12345 > 10.0.0.2.12345: UDP, length 16
10:54:02.439010 IP 10.0.0.1.12345 > 10.0.0.2.12345: UDP, length 16
10:54:03.439250 IP 10.0.0.1.12345 > 10.0.0.2.12345: UDP, length 16
10:54:04.439466 IP 10.0.0.1.12345 > 10.0.0.2.12345: UDP, length 16
10:54:05.439716 IP 10.0.0.1.12345 > 10.0.0.2.12345: UDP, length 16
10:54:06.440042 IP 10.0.0.1.12345 > 10.0.0.2.12345: UDP, length 16
10:54:07.440258 IP 10.0.0.1.12345 > 10.0.0.2.12345: UDP, length 16
10:54:08.440512 IP 10.0.0.1.12345 > 10.0.0.2.12345: UDP, length 16
10:54:09.440727 IP 10.0.0.1.12345 > 10.0.0.2.12345: UDP, length 16
10:54:10.440909 IP 10.0.0.1.12345 > 10.0.0.2.12345: UDP, length 16
10:54:11.441128 IP 10.0.0.1.12345 > 10.0.0.2.12345: UDP, length 16
10:54:12.441395 IP 10.0.0.1.12345 > 10.0.0.2.12345: UDP, length 16
10:54:13.441576 IP 10.0.0.1.12345 > 10.0.0.2.12345: UDP, length 16
10:54:14.441833 IP 10.0.0.1.12345 > 10.0.0.2.12345: UDP, length 16
10:54:15.442066 IP 10.0.0.1.12345 > 10.0.0.2.12345: UDP, length 16
10:54:16.442269 IP 10.0.0.1.12345 > 10.0.0.2.12345: UDP, length 16
10:54:17.442450 IP 10.0.0.1.12345 > 10.0.0.2.12345: UDP, length 16
10:54:18.442675 IP 10.0.0.1.12345 > 10.0.0.2.12345: UDP, length 16
10:54:19.442879 IP 10.0.0.1.12345 > 10.0.0.2.12345: UDP, length 16
10:54:20.443143 IP 10.0.0.1.12345 > 10.0.0.2.12345: UDP, length 16
10:54:21.443330 IP 10.0.0.1.12345 > 10.0.0.2.12345: UDP, length 16
10:54:22.443554 IP 10.0.0.1.12345 > 10.0.0.2.12345: UDP, length 16
10:54:23.443772 IP 10.0.0.1.12345 > 10.0.0.2.12345: UDP, length 16
10:54:24.444033 IP 10.0.0.1.12345 > 10.0.0.2.12345: UDP, length 16
10:54:25.444240 IP 10.0.0.1.12345 > 10.0.0.2.12345: UDP, length 16
10:54:26.444501 IP 10.0.0.1.12345 > 10.0.0.2.12345: UDP, length 16
10:54:27.444684 IP 10.0.0.1.12345 > 10.0.0.2.12345: UDP, length 16
10:54:28.444901 IP 10.0.0.1.12345 > 10.0.0.2.12345: UDP, length 16
10:54:29.445081 IP 10.0.0.1.12345 > 10.0.0.2.12345: UDP, length 16
10:54:30.445342 IP 10.0.0.1.12345 > 10.0.0.2.12345: UDP, length 16
10:54:31.445526 IP 10.0.0.1.12345 > 10.0.0.2.12345: UDP, length 16
10:54:32.445780 IP 10.0.0.1.12345 > 10.0.0.2.12345: UDP, length 16
10:54:33.446015 IP 10.0.0.1.12345 > 10.0.0.2.12345: UDP, length 16
10:54:34.446232 IP 10.0.0.1.12345 > 10.0.0.2.12345: UDP, length 16
10:54:35.446494 IP 10.0.0.1.12345 > 10.0.0.2.12345: UDP, length 16
10:54:36.446760 IP 10.0.0.1.12345 > 10.0.0.2.12345: UDP, length 16
10:54:37.446977 IP 10.0.0.1.12345 > 10.0.0.2.12345: UDP, length 16
10:54:38.447226 IP 10.0.0.1.12345 > 10.0.0.2.12345: UDP, length 16
10:54:39.447491 IP 10.0.0.1.12345 > 10.0.0.2.12345: UDP, length 16
10:54:40.447688 IP 10.0.0.1.12345 > 10.0.0.2.12345: UDP, length 16
10:54:41.447947 IP 10.0.0.1.12345 > 10.0.0.2.12345: UDP, length 16
10:54:42.448209 IP 10.0.0.1.12345 > 10.0.0.2.12345: UDP, length 16
10:54:43.448361 IP 10.0.0.1.12345 > 10.0.0.2.12345: UDP, length 16
10:54:44.448622 IP 10.0.0.1.12345 > 10.0.0.2.12345: UDP, length 16
10:54:45.448759 IP 10.0.0.1.12345 > 10.0.0.2.12345: UDP, length 16
10:54:46.448993 IP 10.0.0.1.12345 > 10.0.0.2.12345: UDP, length 16
10:54:47.449266 IP 10.0.0.1.12345 > 10.0.0.2.12345: UDP, length 16
10:54:48.449470 IP 10.0.0.1.12345 > 10.0.0.2.12345: UDP, length 16
10:54:49.449730 IP 10.0.0.1.12345 > 10.0.0.2.12345: UDP, length 16
10:54:50.450005 IP 10.0.0.1.12345 > 10.0.0.2.12345: UDP, length 16
10:54:51.450283 IP 10.0.0.1.12345 > 10.0.0.2.12345: UDP, length 16
10:54:52.450547 IP 10.0.0.1.12345 > 10.0.0.2.12345: UDP, length 16
10:54:53.450767 IP 10.0.0.1.12345 > 10.0.0.2.12345: UDP, length 16
10:54:54.451024 IP 10.0.0.1.12345 > 10.0.0.2.12345: UDP, length 16
10:54:55.451284 IP 10.0.0.1.12345 > 10.0.0.2.12345: UDP, length 16
10:54:56.451466 IP 10.0.0.1.12345 > 10.0.0.2.12345: UDP, length 16
10:54:57.451845 IP 10.0.0.1.12345 > 10.0.0.2.12345: UDP, length 16
10:54:58.452048 IP 10.0.0.1.12345 > 10.0.0.2.12345: UDP, length 16
10:54:59.452287 IP 10.0.0.1.12345 > 10.0.0.2.12345: UDP, length 16
10:55:00.452542 IP 10.0.0.1.12345 > 10.0.0.2.12345: UDP, length 16
10:55:01.452799 IP 10.0.0.1.12345 > 10.0.0.2.12345: UDP, length 16
10:55:02.453054 IP 10.0.0.1.12345 > 10.0.0.2.12345: UDP, length 16
10:55:03.453305 IP 10.0.0.1.12345 > 10.0.0.2.12345: UDP, length 16
10:55:04.453556 IP 10.0.0.1.12345 > 10.0.0.2.12345: UDP, length 16
10:55:05.453820 IP 10.0.0.1.12345 > 10.0.0.2.12345: UDP, length 16
10:55:06.454080 IP 10.0.0.1.12345 > 10.0.0.2.12345: UDP, length 16
10:55:07.454343 IP 10.0.0.1.12345 > 10.0.0.2.12345: UDP, length 16
10:55:08.454601 IP 10.0.0.1.12345 > 10.0.0.2.12345: UDP, length 16
10:55:09.454866 IP 10.0.0.1.12345 > 10.0.0.2.12345: UDP, length 16
10:55:10.455047 IP 10.0.0.1.12345 > 10.0.0.2.12345: UDP, length 16
10:55:11.455291 IP 10.0.0.1.12345 > 10.0.0.2.12345: UDP, length 16
10:55:12.455529 IP 10.0.0.1.12345 > 10.0.0.2.12345: UDP, length 16
10:55:13.455767 IP 10.0.0.1.12345 > 10.0.0.2.12345: UDP, length 16
10:55:14.456028 IP 10.0.0.1.12345 > 10.0.0.2.12345: UDP, length 16
10:55:15.456293 IP 10.0.0.1.12345 > 10.0.0.2.12345: UDP, length 16
10:55:16.456511 IP 10.0.0.1.12345 > 10.0.0.2.12345: UDP, length 16
10:55:17.456776 IP 10.0.0.1.12345 > 10.0.0.2.12345: UDP, length 16
10:55:18.457015 IP 10.0.0.1.12345 > 10.0.0.2.12345: UDP, length 16
10:55:19.457238 IP 10.0.0.1.12345 > 10.0.0.2.12345: UDP, length 16
10:55:20.457466 IP 10.0.0.1.12345 > 10.0.0.2.12345: UDP, length 16
10:55:21.457732 IP 10.0.0.1.12345 > 10.0.0.2.12345: UDP, length 16
10:55:22.457900 IP 10.0.0.1.12345 > 10.0.0.2.12345: UDP, length 16
10:55:23.458159 IP 10.0.0.1.12345 > 10.0.0.2.12345: UDP, length 16
10:55:24.458408 IP 10.0.0.1.12345 > 10.0.0.2.12345: UDP, length 16
10:55:25.458604 IP 10.0.0.1.12345 > 10.0.0.2.12345: UDP, length 16
10:55:26.458855 IP 10.0.0.1.12345 > 10.0.0.2.12345: UDP, length 16
10:55:27.459117 IP 10.0.0.1.12345 > 10.0.0.2.12345: UDP, length 16
10:55:28.459315 IP 10.0.0.1.12345 > 10.0.0.2.12345: UDP, length 16
10:55:29.459582 IP 10.0.0.1.12345 > 10.0.0.2.12345: UDP, length 16
10:55:30.459825 IP 10.0.0.1.12345 > 10.0.0.2.12345: UDP, length 16
10:55:31.460064 IP 10.0.0.1.12345 > 10.0.0.2.12345: UDP, length 16
10:55:32.460299 IP 10.0.0.1.12345 > 10.0.0.2.12345: UDP, length 16
10:55:33.460561 IP 10.0.0.1.12345 > 10.0.0.2.12345: UDP, length 16
10:55:34.460801 IP 10.0.0.1.12345 > 10.0.0.2.12345: UDP, length 16
10:55:35.461067 IP 10.0.0.1.12345 > 10.0.0.2.12345: UDP, length 16
10:55:36.461329 IP 10.0.0.1.12345 > 10.0.0.2.12345: UDP, length 16
10:55:37.461580 IP 10.0.0.1.12345 > 10.0.0.2.12345: UDP, length 16
10:55:38.461825 IP 10.0.0.1.12345 > 10.0.0.2.12345: UDP, length 16
10:55:39.462094 IP 10.0.0.1.12345 > 10.0.0.2.12345: UDP, length 16
10:55:40.462315 IP 10.0.0.1.12345 > 10.0.0.2.12345: UDP, length 16
10:55:41.462583 IP 10.0.0.1.12345 > 10.0.0.2.12345: UDP, length 16
10:55:42.462842 IP 10.0.0.1.12345 > 10.0.0.2.12345: UDP, length 16
10:55:43.463081 IP 10.0.0.1.12345 > 10.0.0.2.12345: UDP, length 16
10:55:44.463342 IP 10.0.0.1.12345 > 10.0.0.2.12345: UDP, length 16
10:55:45.463608 IP 10.0.0.1.12345 > 10.0.0.2.12345: UDP, length 16
10:55:46.463794 IP 10.0.0.1.12345 > 10.0.0.2.12345: UDP, length 16
10:55:47.464055 IP 10.0.0.1.12345 > 10.0.0.2.12345: UDP, length 16
10:55:48.464295 IP 10.0.0.1.12345 > 10.0.0.2.12345: UDP, length 16
10:55:49.464540 IP 10.0.0.1.12345 > 10.0.0.2.12345: UDP, length 16
10:55:50.464776 IP 10.0.0.1.12345 > 10.0.0.2.12345: UDP, length 16
10:55:51.465038 IP 10.0.0.1.12345 > 10.0.0.2.12345: UDP, length 16
10:55:52.465277 IP 10.0.0.1.12345 > 10.0.0.2.12345: UDP, length 16
10:55:53.465539 IP 10.0.0.1.12345 > 10.0.0.2.12345: UDP, length 16
10:55:54.465779 IP 10.0.0.1.12345 > 10.0.0.2.12345: UDP, length 16
10:55:55.466026 IP 10.0.0.1.12345 > 10.0.0.2.12345: UDP, length 16
10:55:56.466205 IP 10.0.0.1.12345 > 10.0.0.2.12345: UDP, length 16
10:55:57.466438 IP 10.0.0.1.12345 > 10.0.0.2.12345: UDP, length 16
10:55:58.466675 IP 10.0.0.1.12345 > 10.0.0.2.12345: UDP, length 16
10:55:59.466922 IP 10.0.0.1.12345 > 10.0.0.2.12345: UDP, length 16
10:56:00.467109 IP 10.0.0.1.12345 > 10.0.0.2.12345: UDP, length 16
10:56:01.467341 IP 10.0.0.1.12345 > 10.0.0.2.12345: UDP, length 16
10:56:02.467577 IP 10.0.0.1.12345 > 10.0.0.2.12345: UDP, length 16
10:56:03.467839 IP 10.0.0.1.12345 > 10.0.0.2.12345: UDP, length 16
10:56:04.467979 IP 10.0.0.1.12345 > 10.0.0.2.12345: UDP, length 16
10:56:05.468235 IP 10.0.0.1.12345 > 10.0.0.2.12345: UDP, length 16
10:56:06.468486 IP 10.0.0.1.12345 > 10.0.0.2.12345: UDP, length 16
10:56:07.468733 IP 10.0.0.1.12345 > 10.0.0.2.12345: UDP, length 16
10:56:08.468992 IP 10.0.0.1.12345 > 10.0.0.2.12345: UDP, length 16
10:56:09.469178 IP 10.0.0.1.12345 > 10.0.0.2.12345: UDP, length 16
10:56:10.469362 IP 10.0.0.1.12345 > 10.0.0.2.12345: UDP, length 16
10:56:11.469627 IP 10.0.0.1.12345 > 10.0.0.2.12345: UDP, length 16
10:56:12.469790 IP 10.0.0.1.12345 > 10.0.0.2.12345: UDP, length 16
10:56:13.469998 IP 10.0.0.1.12345 > 10.0.0.2.12345: UDP, length 16
10:56:14.470220 IP 10.0.0.1.12345 > 10.0.0.2.12345: UDP, length 16
10:56:15.470410 IP 10.0.0.1.12345 > 10.0.0.2.12345: UDP, length 16
10:56:16.470631 IP 10.0.0.1.12345 > 10.0.0.2.12345: UDP, length 16
10:56:17.470892 IP 10.0.0.1.12345 > 10.0.0.2.12345: UDP, length 16
10:56:18.471135 IP 10.0.0.1.12345 > 10.0.0.2.12345: UDP, length 16
10:56:19.471339 IP 10.0.0.1.12345 > 10.0.0.2.12345: UDP, length 16
10:56:20.471542 IP 10.0.0.1.12345 > 10.0.0.2.12345: UDP, length 16
10:56:21.471807 IP 10.0.0.1.12345 > 10.0.0.2.12345: UDP, length 16
10:56:22.471993 IP 10.0.0.1.12345 > 10.0.0.2.12345: UDP, length 16
10:56:23.472261 IP 10.0.0.1.12345 > 10.0.0.2.12345: UDP, length 16
10:56:24.472446 IP 10.0.0.1.12345 > 10.0.0.2.12345: UDP, length 16
10:56:25.472681 IP 10.0.0.1.12345 > 10.0.0.2.12345: UDP, length 16
10:56:26.472864 IP 10.0.0.1.12345 > 10.0.0.2.12345: UDP, length 16
10:56:27.473128 IP 10.0.0.1.12345 > 10.0.0.2.12345: UDP, length 16
10:56:28.473336 IP 10.0.0.1.12345 > 10.0.0.2.12345: UDP, length 16
10:56:29.473547 IP 10.0.0.1.12345 > 10.0.0.2.12345: UDP, length 16
10:56:30.473729 IP 10.0.0.1.12345 > 10.0.0.2.12345: UDP, length 16
10:56:31.473876 IP 10.0.0.1.12345 > 10.0.0.2.12345: UDP, length 16
10:56:32.474109 IP 10.0.0.1.12345 > 10.0.0.2.12345: UDP, length 16
10:56:33.474381 IP 10.0.0.1.12345 > 10.0.0.2.12345: UDP, length 16
10:56:34.474561 IP 10.0.0.1.12345 > 10.0.0.2.12345: UDP, length 16
10:56:35.474823 IP 10.0.0.1.12345 > 10.0.0.2.12345: UDP, length 16
10:56:36.475006 IP 10.0.0.1.12345 > 10.0.0.2.12345: UDP, length 16
10:56:37.475263 IP 10.0.0.1.12345 > 10.0.0.2.12345: UDP, length 16
10:56:38.475470 IP 10.0.0.1.12345 > 10.0.0.2.12345: UDP, length 16
10:56:39.475835 IP 10.0.0.1.12345 > 10.0.0.2.12345: UDP, length 16
10:56:40.475978 IP 10.0.0.1.12345 > 10.0.0.2.12345: UDP, length 16
10:56:41.476247 IP 10.0.0.1.12345 > 10.0.0.2.12345: UDP, length 16
10:56:42.476482 IP 10.0.0.1.12345 > 10.0.0.2.12345: UDP, length 16
10:56:43.476703 IP 10.0.0.1.12345 > 10.0.0.2.12345: UDP, length 16
10:56:44.476882 IP 10.0.0.1.12345 > 10.0.0.2.12345: UDP, length 16
10:56:45.477133 IP 10.0.0.1.12345 > 10.0.0.2.12345: UDP, length 16
10:56:46.477356 IP 10.0.0.1.12345 > 10.0.0.2.12345: UDP, length 16
10:56:47.477622 IP 10.0.0.1.12345 > 10.0.0.2.12345: UDP, length 16
10:56:48.477883 IP 10.0.0.1.12345 > 10.0.0.2.12345: UDP, length 16
10:56:49.478151 IP 10.0.0.1.12345 > 10.0.0.2.12345: UDP, length 16
10:56:50.478411 IP 10.0.0.1.12345 > 10.0.0.2.12345: UDP, length 16
10:56:51.478676 IP 10.0.0.1.12345 > 10.0.0.2.12345: UDP, length 16
10:56:52.478898 IP 10.0.0.1.12345 > 10.0.0.2.12345: UDP, length 16
10:56:53.479155 IP 10.0.0.1.12345 > 10.0.0.2.12345: UDP, length 16
10:56:54.479418 IP 10.0.0.1.12345 > 10.0.0.2.12345: UDP, length 16
10:56:55.479649 IP 10.0.0.1.12345 > 10.0.0.2.12345: UDP, length 16
10:56:56.479913 IP 10.0.0.1.12345 > 10.0.0.2.12345: UDP, length 16
10:56:57.480178 IP 10.0.0.1.12345 > 10.0.0.2.12345: UDP, length 16
10:56:58.480411 IP 10.0.0.1.12345 > 10.0.0.2.12345: UDP, length 16
10:56:59.480651 IP 10.0.0.1.12345 > 10.0.0.2.12345: UDP, length 16
10:57:00.480888 IP 10.0.0.1.12345 > 10.0.0.2.12345: UDP, length 16
10:57:01.481149 IP 10.0.0.1.12345 > 10.0.0.2.12345: UDP, length 16
10:57:02.481413 IP 10.0.0.1.12345 > 10.0.0.2.12345: UDP, length 16
10:57:03.481662 IP 10.0.0.1.12345 > 10.0.0.2.12345: UDP, length 16
10:57:04.481922 IP 10.0.0.1.12345 > 10.0.0.2.12345: UDP, length 16
10:57:05.482183 IP 10.0.0.1.12345 > 10.0.0.2.12345: UDP, length 16
10:57:06.482448 IP 10.0.0.1.12345 > 10.0.0.2.12345: UDP, length 16
10:57:07.482688 IP 10.0.0.1.12345 > 10.0.0.2.12345: UDP, length 16
10:57:08.482951 IP 10.0.0.1.12345 > 10.0.0.2.12345: UDP, length 16
10:57:09.483219 IP 10.0.0.1.12345 > 10.0.0.2.12345: UDP, length 16
10:57:10.483401 IP 10.0.0.1.12345 > 10.0.0.2.12345: UDP, length 16
10:57:11.483664 IP 10.0.0.1.12345 > 10.0.0.2.12345: UDP, length 16
10:57:12.483900 IP 10.0.0.1.12345 > 10.0.0.2.12345: UDP, length 16
10:57:13.484070 IP 10.0.0.1.12345 > 10.0.0.2.12345: UDP, length 16
10:57:14.484326 IP 10.0.0.1.12345 > 10.0.0.2.12345: UDP, length 16
10:57:15.484576 IP 10.0.0.1.12345 > 10.0.0.2.12345: UDP, length 16
10:57:16.484758 IP 10.0.0.1.12345 > 10.0.0.2.12345: UDP, length 16
10:57:17.484985 IP 10.0.0.1.12345 > 10.0.0.2.12345: UDP, length 16
10:57:18.485247 IP 10.0.0.1.12345 > 10.0.0.2.12345: UDP, length 16
10:57:19.485477 IP 10.0.0.1.12345 > 10.0.0.2.12345: UDP, length 16
10:57:20.485739 IP 10.0.0.1.12345 > 10.0.0.2.12345: UDP, length 16
10:57:21.485963 IP 10.0.0.1.12345 > 10.0.0.2.12345: UDP, length 16
10:57:22.486189 IP 10.0.0.1.12345 > 10.0.0.2.12345: UDP, length 16
10:57:23.486457 IP 10.0.0.1.12345 > 10.0.0.2.12345: UDP, length 16
10:57:24.486724 IP 10.0.0.1.12345 > 10.0.0.2.12345: UDP, length 16
10:57:25.486952 IP 10.0.0.1.12345 > 10.0.0.2.12345: UDP, length 16
10:57:26.487209 IP 10.0.0.1.12345 > 10.0.0.2.12345: UDP, length 16
10:57:27.487475 IP 10.0.0.1.12345 > 10.0.0.2.12345: UDP, length 16
10:57:28.487771 IP 10.0.0.1.12345 > 10.0.0.2.12345: UDP, length 16
10:57:29.487995 IP 10.0.0.1.12345 > 10.0.0.2.12345: UDP, length 16
10:57:30.488199 IP 10.0.0.1.12345 > 10.0.0.2.12345: UDP, length 16
10:57:31.488401 IP 10.0.0.1.12345 > 10.0.0.2.12345: UDP, length 16
10:57:32.488663 IP 10.0.0.1.12345 > 10.0.0.2.12345: UDP, length 16
10:57:33.488910 IP 10.0.0.1.12345 > 10.0.0.2.12345: UDP, length 16
10:57:34.489154 IP 10.0.0.1.12345 > 10.0.0.2.12345: UDP, length 16
10:57:35.489415 IP 10.0.0.1.12345 > 10.0.0.2.12345: UDP, length 16
10:57:36.489682 IP 10.0.0.1.12345 > 10.0.0.2.12345: UDP, length 16
10:57:37.489918 IP 10.0.0.1.12345 > 10.0.0.2.12345: UDP, length 16
10:57:38.490174 IP 10.0.0.1.12345 > 10.0.0.2.12345: UDP, length 16
10:57:39.490427 IP 10.0.0.1.12345 > 10.0.0.2.12345: UDP, length 16
10:57:40.490658 IP 10.0.0.1.12345 > 10.0.0.2.12345: UDP, length 16
10:57:41.490915 IP 10.0.0.1.12345 > 10.0.0.2.12345: UDP, length 16
10:57:42.491172 IP 10.0.0.1.12345 > 10.0.0.2.12345: UDP, length 16
10:57:43.491398 IP 10.0.0.1.12345 > 10.0.0.2.12345: UDP, length 16
10:57:44.491657 IP 10.0.0.1.12345 > 10.0.0.2.12345: UDP, length 16
10:57:45.491990 IP 10.0.0.1.12345 > 10.0.0.2.12345: UDP, length 16
10:57:46.492181 IP 10.0.0.1.12345 > 10.0.0.2.12345: UDP, length 16

