17:54:43.977021 IP 10.0.0.1.12345 > 10.0.0.4.12345: UDP, length 16
17:54:43.977716 IP 10.0.0.1.12345 > 10.0.0.4.12345: UDP, length 16
17:54:43.978370 IP 10.0.0.1.12345 > 10.0.0.4.12345: UDP, length 16
17:54:43.979010 IP 10.0.0.1.12345 > 10.0.0.4.12345: UDP, length 16
17:54:43.979646 IP 10.0.0.1.12345 > 10.0.0.4.12345: UDP, length 16
17:54:43.980276 IP 10.0.0.1.12345 > 10.0.0.4.12345: UDP, length 16
17:54:43.980924 IP 10.0.0.1.12345 > 10.0.0.4.12345: UDP, length 16
17:54:43.981540 IP 10.0.0.1.12345 > 10.0.0.4.12345: UDP, length 16
17:54:43.982152 IP 10.0.0.1.12345 > 10.0.0.4.12345: UDP, length 16
17:54:43.982784 IP 10.0.0.1.12345 > 10.0.0.4.12345: UDP, length 16
17:54:43.983401 IP 10.0.0.1.12345 > 10.0.0.4.12345: UDP, length 16
17:54:43.983996 IP 10.0.0.1.12345 > 10.0.0.4.12345: UDP, length 16
17:54:43.984604 IP 10.0.0.1.12345 > 10.0.0.4.12345: UDP, length 16
17:54:43.985207 IP 10.0.0.1.12345 > 10.0.0.4.12345: UDP, length 16
17:54:43.985813 IP 10.0.0.1.12345 > 10.0.0.4.12345: UDP, length 16
17:54:43.986417 IP 10.0.0.1.12345 > 10.0.0.4.12345: UDP, length 16
17:54:43.987021 IP 10.0.0.1.12345 > 10.0.0.4.12345: UDP, length 16
17:54:43.987627 IP 10.0.0.1.12345 > 10.0.0.4.12345: UDP, length 16
17:54:43.988203 IP 10.0.0.1.12345 > 10.0.0.4.12345: UDP, length 16
17:54:43.988808 IP 10.0.0.1.12345 > 10.0.0.4.12345: UDP, length 16
17:54:43.989412 IP 10.0.0.1.12345 > 10.0.0.4.12345: UDP, length 16
17:54:43.990017 IP 10.0.0.1.12345 > 10.0.0.4.12345: UDP, length 16
17:54:43.990619 IP 10.0.0.1.12345 > 10.0.0.4.12345: UDP, length 16
17:54:43.991195 IP 10.0.0.1.12345 > 10.0.0.4.12345: UDP, length 16
17:54:43.991810 IP 10.0.0.1.12345 > 10.0.0.4.12345: UDP, length 16
17:54:43.992417 IP 10.0.0.1.12345 > 10.0.0.4.12345: UDP, length 16
17:54:43.993021 IP 10.0.0.1.12345 > 10.0.0.4.12345: UDP, length 16
17:54:43.993628 IP 10.0.0.1.12345 > 10.0.0.4.12345: UDP, length 16
17:54:43.994231 IP 10.0.0.1.12345 > 10.0.0.4.12345: UDP, length 16
17:54:43.994835 IP 10.0.0.1.12345 > 10.0.0.4.12345: UDP, length 16
17:54:43.995437 IP 10.0.0.1.12345 > 10.0.0.4.12345: UDP, length 16
17:54:43.996041 IP 10.0.0.1.12345 > 10.0.0.4.12345: UDP, length 16
17:54:43.996646 IP 10.0.0.1.12345 > 10.0.0.4.12345: UDP, length 16
17:54:43.997249 IP 10.0.0.1.12345 > 10.0.0.4.12345: UDP, length 16
17:54:43.997851 IP 10.0.0.1.12345 > 10.0.0.4.12345: UDP, length 16
17:54:43.998439 IP 10.0.0.1.12345 > 10.0.0.4.12345: UDP, length 16
17:54:43.999045 IP 10.0.0.1.12345 > 10.0.0.4.12345: UDP, length 16
17:54:43.999649 IP 10.0.0.1.12345 > 10.0.0.4.12345: UDP, length 16
17:54:44.000236 IP 10.0.0.1.12345 > 10.0.0.4.12345: UDP, length 16
17:54:44.000839 IP 10.0.0.1.12345 > 10.0.0.4.12345: UDP, length 16
17:54:44.001443 IP 10.0.0.1.12345 > 10.0.0.4.12345: UDP, length 16
17:54:44.002047 IP 10.0.0.1.12345 > 10.0.0.4.12345: UDP, length 16
17:54:44.002652 IP 10.0.0.1.12345 > 10.0.0.4.12345: UDP, length 16
17:54:44.003255 IP 10.0.0.1.12345 > 10.0.0.4.12345: UDP, length 16
17:54:44.003833 IP 10.0.0.1.12345 > 10.0.0.4.12345: UDP, length 16
17:54:44.004444 IP 10.0.0.1.12345 > 10.0.0.4.12345: UDP, length 16
17:54:44.005055 IP 10.0.0.1.12345 > 10.0.0.4.12345: UDP, length 16
17:54:44.005650 IP 10.0.0.1.12345 > 10.0.0.4.12345: UDP, length 16
17:54:44.006259 IP 10.0.0.1.12345 > 10.0.0.4.12345: UDP, length 16
17:54:44.006870 IP 10.0.0.1.12345 > 10.0.0.4.12345: UDP, length 16
17:54:44.007481 IP 10.0.0.1.12345 > 10.0.0.4.12345: UDP, length 16
17:54:44.008082 IP 10.0.0.1.12345 > 10.0.0.4.12345: UDP, length 16
17:54:44.008679 IP 10.0.0.1.12345 > 10.0.0.4.12345: UDP, length 16
17:54:44.009266 IP 10.0.0.1.12345 > 10.0.0.4.12345: UDP, length 16
17:54:44.009854 IP 10.0.0.1.12345 > 10.0.0.4.12345: UDP, length 16
17:54:44.010440 IP 10.0.0.1.12345 > 10.0.0.4.12345: UDP, length 16
17:54:44.011027 IP 10.0.0.1.12345 > 10.0.0.4.12345: UDP, length 16
17:54:44.011614 IP 10.0.0.1.12345 > 10.0.0.4.12345: UDP, length 16
17:54:44.012200 IP 10.0.0.1.12345 > 10.0.0.4.12345: UDP, length 16
17:54:44.012787 IP 10.0.0.1.12345 > 10.0.0.4.12345: UDP, length 16
17:54:44.013372 IP 10.0.0.1.12345 > 10.0.0.4.12345: UDP, length 16
17:54:44.013958 IP 10.0.0.1.12345 > 10.0.0.4.12345: UDP, length 16
17:54:44.014540 IP 10.0.0.1.12345 > 10.0.0.4.12345: UDP, length 16
17:54:44.015148 IP 10.0.0.1.12345 > 10.0.0.4.12345: UDP, length 16
17:54:44.015783 IP 10.0.0.1.12345 > 10.0.0.4.12345: UDP, length 16
17:54:44.016366 IP 10.0.0.1.12345 > 10.0.0.4.12345: UDP, length 16
17:54:44.016975 IP 10.0.0.1.12345 > 10.0.0.4.12345: UDP, length 16
17:54:44.017582 IP 10.0.0.1.12345 > 10.0.0.4.12345: UDP, length 16
17:54:44.018164 IP 10.0.0.1.12345 > 10.0.0.4.12345: UDP, length 16
17:54:44.018744 IP 10.0.0.1.12345 > 10.0.0.4.12345: UDP, length 16
17:54:44.019352 IP 10.0.0.1.12345 > 10.0.0.4.12345: UDP, length 16
17:54:44.019932 IP 10.0.0.1.12345 > 10.0.0.4.12345: UDP, length 16
17:54:44.020540 IP 10.0.0.1.12345 > 10.0.0.4.12345: UDP, length 16
17:54:44.021150 IP 10.0.0.1.12345 > 10.0.0.4.12345: UDP, length 16
17:54:44.021757 IP 10.0.0.1.12345 > 10.0.0.4.12345: UDP, length 16
17:54:44.022337 IP 10.0.0.1.12345 > 10.0.0.4.12345: UDP, length 16
17:54:44.022945 IP 10.0.0.1.12345 > 10.0.0.4.12345: UDP, length 16
17:54:44.023554 IP 10.0.0.1.12345 > 10.0.0.4.12345: UDP, length 16
17:54:44.024160 IP 10.0.0.1.12345 > 10.0.0.4.12345: UDP, length 16
17:54:44.024781 IP 10.0.0.1.12345 > 10.0.0.4.12345: UDP, length 16
17:54:44.025365 IP 10.0.0.1.12345 > 10.0.0.4.12345: UDP, length 16
17:54:44.025949 IP 10.0.0.1.12345 > 10.0.0.4.12345: UDP, length 16
17:54:44.026534 IP 10.0.0.1.12345 > 10.0.0.4.12345: UDP, length 16
17:54:44.027145 IP 10.0.0.1.12345 > 10.0.0.4.12345: UDP, length 16
17:54:44.027729 IP 10.0.0.1.12345 > 10.0.0.4.12345: UDP, length 16
17:54:44.028340 IP 10.0.0.1.12345 > 10.0.0.4.12345: UDP, length 16
17:54:44.028925 IP 10.0.0.1.12345 > 10.0.0.4.12345: UDP, length 16
17:54:44.029511 IP 10.0.0.1.12345 > 10.0.0.4.12345: UDP, length 16
17:54:44.030095 IP 10.0.0.1.12345 > 10.0.0.4.12345: UDP, length 16
17:54:44.030708 IP 10.0.0.1.12345 > 10.0.0.4.12345: UDP, length 16
17:54:44.031292 IP 10.0.0.1.12345 > 10.0.0.4.12345: UDP, length 16
17:54:44.031877 IP 10.0.0.1.12345 > 10.0.0.4.12345: UDP, length 16
17:54:44.032461 IP 10.0.0.1.12345 > 10.0.0.4.12345: UDP, length 16
17:54:44.033046 IP 10.0.0.1.12345 > 10.0.0.4.12345: UDP, length 16
17:54:44.033631 IP 10.0.0.1.12345 > 10.0.0.4.12345: UDP, length 16
17:54:44.034215 IP 10.0.0.1.12345 > 10.0.0.4.12345: UDP, length 16
17:54:44.034800 IP 10.0.0.1.12345 > 10.0.0.4.12345: UDP, length 16
17:54:44.035408 IP 10.0.0.1.12345 > 10.0.0.4.12345: UDP, length 16
17:54:44.035989 IP 10.0.0.1.12345 > 10.0.0.4.12345: UDP, length 16
17:54:44.036596 IP 10.0.0.1.12345 > 10.0.0.4.12345: UDP, length 16
17:54:44.037177 IP 10.0.0.1.12345 > 10.0.0.4.12345: UDP, length 16
17:54:44.037757 IP 10.0.0.1.12345 > 10.0.0.4.12345: UDP, length 16
17:54:44.038367 IP 10.0.0.1.12345 > 10.0.0.4.12345: UDP, length 16
17:54:44.038975 IP 10.0.0.1.12345 > 10.0.0.4.12345: UDP, length 16
17:54:44.039582 IP 10.0.0.1.12345 > 10.0.0.4.12345: UDP, length 16
17:54:44.040191 IP 10.0.0.1.12345 > 10.0.0.4.12345: UDP, length 16
17:54:44.040800 IP 10.0.0.1.12345 > 10.0.0.4.12345: UDP, length 16
17:54:44.041408 IP 10.0.0.1.12345 > 10.0.0.4.12345: UDP, length 16
17:54:44.042015 IP 10.0.0.1.12345 > 10.0.0.4.12345: UDP, length 16
17:54:44.042622 IP 10.0.0.1.12345 > 10.0.0.4.12345: UDP, length 16
17:54:44.043230 IP 10.0.0.1.12345 > 10.0.0.4.12345: UDP, length 16
17:54:44.043784 IP 10.0.0.1.12345 > 10.0.0.4.12345: UDP, length 16
17:54:44.044353 IP 10.0.0.1.12345 > 10.0.0.4.12345: UDP, length 16
17:54:44.044960 IP 10.0.0.1.12345 > 10.0.0.4.12345: UDP, length 16
17:54:44.045543 IP 10.0.0.1.12345 > 10.0.0.4.12345: UDP, length 16
17:54:44.046124 IP 10.0.0.1.12345 > 10.0.0.4.12345: UDP, length 16
17:54:44.046746 IP 10.0.0.1.12345 > 10.0.0.4.12345: UDP, length 16
17:54:44.047335 IP 10.0.0.1.12345 > 10.0.0.4.12345: UDP, length 16
17:54:44.047953 IP 10.0.0.1.12345 > 10.0.0.4.12345: UDP, length 16
17:54:44.048564 IP 10.0.0.1.12345 > 10.0.0.4.12345: UDP, length 16
17:54:44.049172 IP 10.0.0.1.12345 > 10.0.0.4.12345: UDP, length 16
17:54:44.049784 IP 10.0.0.1.12345 > 10.0.0.4.12345: UDP, length 16
17:54:44.050391 IP 10.0.0.1.12345 > 10.0.0.4.12345: UDP, length 16
17:54:44.050983 IP 10.0.0.1.12345 > 10.0.0.4.12345: UDP, length 16
17:54:44.051591 IP 10.0.0.1.12345 > 10.0.0.4.12345: UDP, length 16
17:54:44.052199 IP 10.0.0.1.12345 > 10.0.0.4.12345: UDP, length 16
17:54:44.052809 IP 10.0.0.1.12345 > 10.0.0.4.12345: UDP, length 16
17:54:44.053417 IP 10.0.0.1.12345 > 10.0.0.4.12345: UDP, length 16
17:54:44.054026 IP 10.0.0.1.12345 > 10.0.0.4.12345: UDP, length 16
17:54:44.054634 IP 10.0.0.1.12345 > 10.0.0.4.12345: UDP, length 16
17:54:44.055242 IP 10.0.0.1.12345 > 10.0.0.4.12345: UDP, length 16
17:54:44.055864 IP 10.0.0.1.12345 > 10.0.0.4.12345: UDP, length 16
17:54:44.056489 IP 10.0.0.1.12345 > 10.0.0.4.12345: UDP, length 16
17:54:44.057116 IP 10.0.0.1.12345 > 10.0.0.4.12345: UDP, length 16
17:54:44.057741 IP 10.0.0.1.12345 > 10.0.0.4.12345: UDP, length 16
17:54:44.058366 IP 10.0.0.1.12345 > 10.0.0.4.12345: UDP, length 16
17:54:44.058992 IP 10.0.0.1.12345 > 10.0.0.4.12345: UDP, length 16
17:54:44.059617 IP 10.0.0.1.12345 > 10.0.0.4.12345: UDP, length 16
17:54:44.060240 IP 10.0.0.1.12345 > 10.0.0.4.12345: UDP, length 16
17:54:44.060855 IP 10.0.0.1.12345 > 10.0.0.4.12345: UDP, length 16
17:54:44.061466 IP 10.0.0.1.12345 > 10.0.0.4.12345: UDP, length 16
17:54:44.062078 IP 10.0.0.1.12345 > 10.0.0.4.12345: UDP, length 16
17:54:44.062689 IP 10.0.0.1.12345 > 10.0.0.4.12345: UDP, length 16
17:54:44.063299 IP 10.0.0.1.12345 > 10.0.0.4.12345: UDP, length 16
17:54:44.063909 IP 10.0.0.1.12345 > 10.0.0.4.12345: UDP, length 16
17:54:44.064513 IP 10.0.0.1.12345 > 10.0.0.4.12345: UDP, length 16
17:54:44.065133 IP 10.0.0.1.12345 > 10.0.0.4.12345: UDP, length 16
17:54:44.065758 IP 10.0.0.1.12345 > 10.0.0.4.12345: UDP, length 16
17:54:44.066387 IP 10.0.0.1.12345 > 10.0.0.4.12345: UDP, length 16
17:54:44.067013 IP 10.0.0.1.12345 > 10.0.0.4.12345: UDP, length 16
17:54:44.067643 IP 10.0.0.1.12345 > 10.0.0.4.12345: UDP, length 16
17:54:44.068268 IP 10.0.0.1.12345 > 10.0.0.4.12345: UDP, length 16
17:54:44.068885 IP 10.0.0.1.12345 > 10.0.0.4.12345: UDP, length 16
17:54:44.069512 IP 10.0.0.1.12345 > 10.0.0.4.12345: UDP, length 16
17:54:44.070138 IP 10.0.0.1.12345 > 10.0.0.4.12345: UDP, length 16
17:54:44.070767 IP 10.0.0.1.12345 > 10.0.0.4.12345: UDP, length 16
17:54:44.071393 IP 10.0.0.1.12345 > 10.0.0.4.12345: UDP, length 16
17:54:44.072020 IP 10.0.0.1.12345 > 10.0.0.4.12345: UDP, length 16
17:54:44.072649 IP 10.0.0.1.12345 > 10.0.0.4.12345: UDP, length 16
17:54:44.073275 IP 10.0.0.1.12345 > 10.0.0.4.12345: UDP, length 16
17:54:44.073902 IP 10.0.0.1.12345 > 10.0.0.4.12345: UDP, length 16
17:54:44.074528 IP 10.0.0.1.12345 > 10.0.0.4.12345: UDP, length 16
17:54:44.075153 IP 10.0.0.1.12345 > 10.0.0.4.12345: UDP, length 16
17:54:44.075799 IP 10.0.0.1.12345 > 10.0.0.4.12345: UDP, length 16
17:54:44.076426 IP 10.0.0.1.12345 > 10.0.0.4.12345: UDP, length 16
17:54:44.077053 IP 10.0.0.1.12345 > 10.0.0.4.12345: UDP, length 16
17:54:44.077679 IP 10.0.0.1.12345 > 10.0.0.4.12345: UDP, length 16
17:54:44.078271 IP 10.0.0.1.12345 > 10.0.0.4.12345: UDP, length 16
17:54:44.078899 IP 10.0.0.1.12345 > 10.0.0.4.12345: UDP, length 16
17:54:44.079525 IP 10.0.0.1.12345 > 10.0.0.4.12345: UDP, length 16
17:54:44.080140 IP 10.0.0.1.12345 > 10.0.0.4.12345: UDP, length 16
17:54:44.080765 IP 10.0.0.1.12345 > 10.0.0.4.12345: UDP, length 16
17:54:44.081397 IP 10.0.0.1.12345 > 10.0.0.4.12345: UDP, length 16
17:54:44.082027 IP 10.0.0.1.12345 > 10.0.0.4.12345: UDP, length 16
17:54:44.082656 IP 10.0.0.1.12345 > 10.0.0.4.12345: UDP, length 16
17:54:44.083288 IP 10.0.0.1.12345 > 10.0.0.4.12345: UDP, length 16
17:54:44.083919 IP 10.0.0.1.12345 > 10.0.0.4.12345: UDP, length 16
17:54:44.084539 IP 10.0.0.1.12345 > 10.0.0.4.12345: UDP, length 16
17:54:44.085168 IP 10.0.0.1.12345 > 10.0.0.4.12345: UDP, length 16
17:54:44.085798 IP 10.0.0.1.12345 > 10.0.0.4.12345: UDP, length 16
17:54:44.086429 IP 10.0.0.1.12345 > 10.0.0.4.12345: UDP, length 16
17:54:44.087045 IP 10.0.0.1.12345 > 10.0.0.4.12345: UDP, length 16
17:54:44.087674 IP 10.0.0.1.12345 > 10.0.0.4.12345: UDP, length 16
17:54:44.088292 IP 10.0.0.1.12345 > 10.0.0.4.12345: UDP, length 16
17:54:44.088922 IP 10.0.0.1.12345 > 10.0.0.4.12345: UDP, length 16
17:54:44.089550 IP 10.0.0.1.12345 > 10.0.0.4.12345: UDP, length 16
17:54:44.090177 IP 10.0.0.1.12345 > 10.0.0.4.12345: UDP, length 16
17:54:44.090810 IP 10.0.0.1.12345 > 10.0.0.4.12345: UDP, length 16
17:54:44.091428 IP 10.0.0.1.12345 > 10.0.0.4.12345: UDP, length 16
17:54:44.092055 IP 10.0.0.1.12345 > 10.0.0.4.12345: UDP, length 16
17:54:44.092675 IP 10.0.0.1.12345 > 10.0.0.4.12345: UDP, length 16
17:54:44.093300 IP 10.0.0.1.12345 > 10.0.0.4.12345: UDP, length 16
17:54:44.093918 IP 10.0.0.1.12345 > 10.0.0.4.12345: UDP, length 16
17:54:44.094544 IP 10.0.0.1.12345 > 10.0.0.4.12345: UDP, length 16
17:54:44.095157 IP 10.0.0.1.12345 > 10.0.0.4.12345: UDP, length 16
17:54:44.095786 IP 10.0.0.1.12345 > 10.0.0.4.12345: UDP, length 16
17:54:44.096400 IP 10.0.0.1.12345 > 10.0.0.4.12345: UDP, length 16
17:54:44.097026 IP 10.0.0.1.12345 > 10.0.0.4.12345: UDP, length 16
17:54:44.097655 IP 10.0.0.1.12345 > 10.0.0.4.12345: UDP, length 16
17:54:44.098266 IP 10.0.0.1.12345 > 10.0.0.4.12345: UDP, length 16
17:54:44.098893 IP 10.0.0.1.12345 > 10.0.0.4.12345: UDP, length 16
17:54:44.099506 IP 10.0.0.1.12345 > 10.0.0.4.12345: UDP, length 16
17:54:44.100118 IP 10.0.0.1.12345 > 10.0.0.4.12345: UDP, length 16
17:54:44.100728 IP 10.0.0.1.12345 > 10.0.0.4.12345: UDP, length 16
17:54:44.101337 IP 10.0.0.1.12345 > 10.0.0.4.12345: UDP, length 16
17:54:44.101949 IP 10.0.0.1.12345 > 10.0.0.4.12345: UDP, length 16
17:54:44.102557 IP 10.0.0.1.12345 > 10.0.0.4.12345: UDP, length 16
17:54:44.103169 IP 10.0.0.1.12345 > 10.0.0.4.12345: UDP, length 16
17:54:44.103789 IP 10.0.0.1.12345 > 10.0.0.4.12345: UDP, length 16
17:54:44.104380 IP 10.0.0.1.12345 > 10.0.0.4.12345: UDP, length 16
17:54:44.104971 IP 10.0.0.1.12345 > 10.0.0.4.12345: UDP, length 16
17:54:44.105560 IP 10.0.0.1.12345 > 10.0.0.4.12345: UDP, length 16
17:54:44.106152 IP 10.0.0.1.12345 > 10.0.0.4.12345: UDP, length 16
17:54:44.106740 IP 10.0.0.1.12345 > 10.0.0.4.12345: UDP, length 16
17:54:44.107331 IP 10.0.0.1.12345 > 10.0.0.4.12345: UDP, length 16
17:54:44.107918 IP 10.0.0.1.12345 > 10.0.0.4.12345: UDP, length 16
17:54:44.108509 IP 10.0.0.1.12345 > 10.0.0.4.12345: UDP, length 16
17:54:44.109097 IP 10.0.0.1.12345 > 10.0.0.4.12345: UDP, length 16
17:54:44.109686 IP 10.0.0.1.12345 > 10.0.0.4.12345: UDP, length 16
17:54:44.110276 IP 10.0.0.1.12345 > 10.0.0.4.12345: UDP, length 16
17:54:44.110864 IP 10.0.0.1.12345 > 10.0.0.4.12345: UDP, length 16
17:54:44.111456 IP 10.0.0.1.12345 > 10.0.0.4.12345: UDP, length 16
17:54:44.112044 IP 10.0.0.1.12345 > 10.0.0.4.12345: UDP, length 16
17:54:44.112636 IP 10.0.0.1.12345 > 10.0.0.4.12345: UDP, length 16
17:54:44.113225 IP 10.0.0.1.12345 > 10.0.0.4.12345: UDP, length 16
17:54:44.113816 IP 10.0.0.1.12345 > 10.0.0.4.12345: UDP, length 16
17:54:44.114407 IP 10.0.0.1.12345 > 10.0.0.4.12345: UDP, length 16
17:54:44.114997 IP 10.0.0.1.12345 > 10.0.0.4.12345: UDP, length 16
17:54:44.115588 IP 10.0.0.1.12345 > 10.0.0.4.12345: UDP, length 16
17:54:44.116171 IP 10.0.0.1.12345 > 10.0.0.4.12345: UDP, length 16
17:54:44.116778 IP 10.0.0.1.12345 > 10.0.0.4.12345: UDP, length 16
17:54:44.117384 IP 10.0.0.1.12345 > 10.0.0.4.12345: UDP, length 16
17:54:44.117991 IP 10.0.0.1.12345 > 10.0.0.4.12345: UDP, length 16
17:54:44.118598 IP 10.0.0.1.12345 > 10.0.0.4.12345: UDP, length 16
17:54:44.119204 IP 10.0.0.1.12345 > 10.0.0.4.12345: UDP, length 16
17:54:44.119807 IP 10.0.0.1.12345 > 10.0.0.4.12345: UDP, length 16
17:54:44.120413 IP 10.0.0.1.12345 > 10.0.0.4.12345: UDP, length 16
17:54:44.121021 IP 10.0.0.1.12345 > 10.0.0.4.12345: UDP, length 16
17:54:44.121626 IP 10.0.0.1.12345 > 10.0.0.4.12345: UDP, length 16
17:54:44.122235 IP 10.0.0.1.12345 > 10.0.0.4.12345: UDP, length 16
17:54:44.122842 IP 10.0.0.1.12345 > 10.0.0.4.12345: UDP, length 16
17:54:44.123448 IP 10.0.0.1.12345 > 10.0.0.4.12345: UDP, length 16
17:54:44.124055 IP 10.0.0.1.12345 > 10.0.0.4.12345: UDP, length 16
17:54:44.124661 IP 10.0.0.1.12345 > 10.0.0.4.12345: UDP, length 16
17:54:44.125268 IP 10.0.0.1.12345 > 10.0.0.4.12345: UDP, length 16
17:54:44.125873 IP 10.0.0.1.12345 > 10.0.0.4.12345: UDP, length 16
17:54:44.126493 IP 10.0.0.1.12345 > 10.0.0.4.12345: UDP, length 16
17:54:44.127108 IP 10.0.0.1.12345 > 10.0.0.4.12345: UDP, length 16
17:54:44.127692 IP 10.0.0.1.12345 > 10.0.0.4.12345: UDP, length 16
17:54:44.128278 IP 10.0.0.1.12345 > 10.0.0.4.12345: UDP, length 16
17:54:44.128863 IP 10.0.0.1.12345 > 10.0.0.4.12345: UDP, length 16
17:54:44.129450 IP 10.0.0.1.12345 > 10.0.0.4.12345: UDP, length 16
17:54:44.130035 IP 10.0.0.1.12345 > 10.0.0.4.12345: UDP, length 16
17:54:44.130650 IP 10.0.0.1.12345 > 10.0.0.4.12345: UDP, length 16
17:54:44.131237 IP 10.0.0.1.12345 > 10.0.0.4.12345: UDP, length 16
17:54:44.131821 IP 10.0.0.1.12345 > 10.0.0.4.12345: UDP, length 16
17:54:44.132407 IP 10.0.0.1.12345 > 10.0.0.4.12345: UDP, length 16
17:54:44.132992 IP 10.0.0.1.12345 > 10.0.0.4.12345: UDP, length 16
17:54:44.133578 IP 10.0.0.1.12345 > 10.0.0.4.12345: UDP, length 16
17:54:44.134164 IP 10.0.0.1.12345 > 10.0.0.4.12345: UDP, length 16
17:54:44.134751 IP 10.0.0.1.12345 > 10.0.0.4.12345: UDP, length 16
17:54:44.135364 IP 10.0.0.1.12345 > 10.0.0.4.12345: UDP, length 16
17:54:44.135948 IP 10.0.0.1.12345 > 10.0.0.4.12345: UDP, length 16
17:54:44.136535 IP 10.0.0.1.12345 > 10.0.0.4.12345: UDP, length 16
17:54:44.137118 IP 10.0.0.1.12345 > 10.0.0.4.12345: UDP, length 16
17:54:44.137726 IP 10.0.0.1.12345 > 10.0.0.4.12345: UDP, length 16
17:54:44.138334 IP 10.0.0.1.12345 > 10.0.0.4.12345: UDP, length 16
17:54:44.138943 IP 10.0.0.1.12345 > 10.0.0.4.12345: UDP, length 16
17:54:44.139552 IP 10.0.0.1.12345 > 10.0.0.4.12345: UDP, length 16
17:54:44.140160 IP 10.0.0.1.12345 > 10.0.0.4.12345: UDP, length 16
17:54:44.140770 IP 10.0.0.1.12345 > 10.0.0.4.12345: UDP, length 16
17:54:44.141377 IP 10.0.0.1.12345 > 10.0.0.4.12345: UDP, length 16
17:54:44.141988 IP 10.0.0.1.12345 > 10.0.0.4.12345: UDP, length 16
17:54:44.142595 IP 10.0.0.1.12345 > 10.0.0.4.12345: UDP, length 16
17:54:44.143207 IP 10.0.0.1.12345 > 10.0.0.4.12345: UDP, length 16
17:54:44.143809 IP 10.0.0.1.12345 > 10.0.0.4.12345: UDP, length 16
17:54:44.144421 IP 10.0.0.1.12345 > 10.0.0.4.12345: UDP, length 16
17:54:44.145033 IP 10.0.0.1.12345 > 10.0.0.4.12345: UDP, length 16
17:54:44.145642 IP 10.0.0.1.12345 > 10.0.0.4.12345: UDP, length 16
17:54:44.146252 IP 10.0.0.1.12345 > 10.0.0.4.12345: UDP, length 16
17:54:44.146860 IP 10.0.0.1.12345 > 10.0.0.4.12345: UDP, length 16
17:54:44.147481 IP 10.0.0.1.12345 > 10.0.0.4.12345: UDP, length 16
17:54:44.148067 IP 10.0.0.1.12345 > 10.0.0.4.12345: UDP, length 16
17:54:44.148653 IP 10.0.0.1.12345 > 10.0.0.4.12345: UDP, length 16
17:54:44.149239 IP 10.0.0.1.12345 > 10.0.0.4.12345: UDP, length 16
17:54:44.149824 IP 10.0.0.1.12345 > 10.0.0.4.12345: UDP, length 16
17:54:44.150439 IP 10.0.0.1.12345 > 10.0.0.4.12345: UDP, length 16
17:54:44.151052 IP 10.0.0.1.12345 > 10.0.0.4.12345: UDP, length 16
17:54:44.151638 IP 10.0.0.1.12345 > 10.0.0.4.12345: UDP, length 16
17:54:44.152252 IP 10.0.0.1.12345 > 10.0.0.4.12345: UDP, length 16
17:54:44.152836 IP 10.0.0.1.12345 > 10.0.0.4.12345: UDP, length 16
17:54:44.153450 IP 10.0.0.1.12345 > 10.0.0.4.12345: UDP, length 16
17:54:44.154062 IP 10.0.0.1.12345 > 10.0.0.4.12345: UDP, length 16
17:54:44.154676 IP 10.0.0.1.12345 > 10.0.0.4.12345: UDP, length 16
17:54:44.155263 IP 10.0.0.1.12345 > 10.0.0.4.12345: UDP, length 16
17:54:44.155846 IP 10.0.0.1.12345 > 10.0.0.4.12345: UDP, length 16
17:54:44.156433 IP 10.0.0.1.12345 > 10.0.0.4.12345: UDP, length 16
17:54:44.157047 IP 10.0.0.1.12345 > 10.0.0.4.12345: UDP, length 16
17:54:44.157633 IP 10.0.0.1.12345 > 10.0.0.4.12345: UDP, length 16
17:54:44.158216 IP 10.0.0.1.12345 > 10.0.0.4.12345: UDP, length 16
17:54:44.158827 IP 10.0.0.1.12345 > 10.0.0.4.12345: UDP, length 16
17:54:44.159435 IP 10.0.0.1.12345 > 10.0.0.4.12345: UDP, length 16
17:54:44.160046 IP 10.0.0.1.12345 > 10.0.0.4.12345: UDP, length 16
17:54:44.160656 IP 10.0.0.1.12345 > 10.0.0.4.12345: UDP, length 16
17:54:44.161264 IP 10.0.0.1.12345 > 10.0.0.4.12345: UDP, length 16
17:54:44.161874 IP 10.0.0.1.12345 > 10.0.0.4.12345: UDP, length 16
17:54:44.162481 IP 10.0.0.1.12345 > 10.0.0.4.12345: UDP, length 16
17:54:44.163091 IP 10.0.0.1.12345 > 10.0.0.4.12345: UDP, length 16
17:54:44.163700 IP 10.0.0.1.12345 > 10.0.0.4.12345: UDP, length 16
17:54:44.164308 IP 10.0.0.1.12345 > 10.0.0.4.12345: UDP, length 16
17:54:44.164912 IP 10.0.0.1.12345 > 10.0.0.4.12345: UDP, length 16
17:54:44.165499 IP 10.0.0.1.12345 > 10.0.0.4.12345: UDP, length 16
17:54:44.166104 IP 10.0.0.1.12345 > 10.0.0.4.12345: UDP, length 16
17:54:44.166708 IP 10.0.0.1.12345 > 10.0.0.4.12345: UDP, length 16
17:54:44.167311 IP 10.0.0.1.12345 > 10.0.0.4.12345: UDP, length 16
17:54:44.167888 IP 10.0.0.1.12345 > 10.0.0.4.12345: UDP, length 16
17:54:44.168503 IP 10.0.0.1.12345 > 10.0.0.4.12345: UDP, length 16
17:54:44.169112 IP 10.0.0.1.12345 > 10.0.0.4.12345: UDP, length 16
17:54:44.169719 IP 10.0.0.1.12345 > 10.0.0.4.12345: UDP, length 16
17:54:44.170328 IP 10.0.0.1.12345 > 10.0.0.4.12345: UDP, length 16
17:54:44.170937 IP 10.0.0.1.12345 > 10.0.0.4.12345: UDP, length 16
17:54:44.171517 IP 10.0.0.1.12345 > 10.0.0.4.12345: UDP, length 16
17:54:44.172127 IP 10.0.0.1.12345 > 10.0.0.4.12345: UDP, length 16
17:54:44.172736 IP 10.0.0.1.12345 > 10.0.0.4.12345: UDP, length 16
17:54:44.173345 IP 10.0.0.1.12345 > 10.0.0.4.12345: UDP, length 16
17:54:44.173953 IP 10.0.0.1.12345 > 10.0.0.4.12345: UDP, length 16
17:54:44.174562 IP 10.0.0.1.12345 > 10.0.0.4.12345: UDP, length 16
17:54:44.175171 IP 10.0.0.1.12345 > 10.0.0.4.12345: UDP, length 16
17:54:44.175790 IP 10.0.0.1.12345 > 10.0.0.4.12345: UDP, length 16
17:54:44.176401 IP 10.0.0.1.12345 > 10.0.0.4.12345: UDP, length 16
17:54:44.177007 IP 10.0.0.1.12345 > 10.0.0.4.12345: UDP, length 16
17:54:44.177611 IP 10.0.0.1.12345 > 10.0.0.4.12345: UDP, length 16
17:54:44.178226 IP 10.0.0.1.12345 > 10.0.0.4.12345: UDP, length 16
17:54:44.178845 IP 10.0.0.1.12345 > 10.0.0.4.12345: UDP, length 16
17:54:44.179461 IP 10.0.0.1.12345 > 10.0.0.4.12345: UDP, length 16
17:54:44.180047 IP 10.0.0.1.12345 > 10.0.0.4.12345: UDP, length 16
17:54:44.180667 IP 10.0.0.1.12345 > 10.0.0.4.12345: UDP, length 16
17:54:44.181283 IP 10.0.0.1.12345 > 10.0.0.4.12345: UDP, length 16
17:54:44.181870 IP 10.0.0.1.12345 > 10.0.0.4.12345: UDP, length 16
17:54:44.182456 IP 10.0.0.1.12345 > 10.0.0.4.12345: UDP, length 16
17:54:44.183044 IP 10.0.0.1.12345 > 10.0.0.4.12345: UDP, length 16
17:54:44.183659 IP 10.0.0.1.12345 > 10.0.0.4.12345: UDP, length 16
17:54:44.184272 IP 10.0.0.1.12345 > 10.0.0.4.12345: UDP, length 16
17:54:44.184888 IP 10.0.0.1.12345 > 10.0.0.4.12345: UDP, length 16
17:54:44.185501 IP 10.0.0.1.12345 > 10.0.0.4.12345: UDP, length 16
17:54:44.186117 IP 10.0.0.1.12345 > 10.0.0.4.12345: UDP, length 16
17:54:44.186704 IP 10.0.0.1.12345 > 10.0.0.4.12345: UDP, length 16
17:54:44.187300 IP 10.0.0.1.12345 > 10.0.0.4.12345: UDP, length 16
17:54:44.187883 IP 10.0.0.1.12345 > 10.0.0.4.12345: UDP, length 16
17:54:44.188466 IP 10.0.0.1.12345 > 10.0.0.4.12345: UDP, length 16
17:54:44.189079 IP 10.0.0.1.12345 > 10.0.0.4.12345: UDP, length 16
17:54:44.189687 IP 10.0.0.1.12345 > 10.0.0.4.12345: UDP, length 16
17:54:44.190298 IP 10.0.0.1.12345 > 10.0.0.4.12345: UDP, length 16
17:54:44.190908 IP 10.0.0.1.12345 > 10.0.0.4.12345: UDP, length 16
17:54:44.191517 IP 10.0.0.1.12345 > 10.0.0.4.12345: UDP, length 16
17:54:44.192129 IP 10.0.0.1.12345 > 10.0.0.4.12345: UDP, length 16
17:54:44.192739 IP 10.0.0.1.12345 > 10.0.0.4.12345: UDP, length 16
17:54:44.193349 IP 10.0.0.1.12345 > 10.0.0.4.12345: UDP, length 16
17:54:44.193958 IP 10.0.0.1.12345 > 10.0.0.4.12345: UDP, length 16
17:54:44.194569 IP 10.0.0.1.12345 > 10.0.0.4.12345: UDP, length 16
17:54:44.195179 IP 10.0.0.1.12345 > 10.0.0.4.12345: UDP, length 16
17:54:44.195814 IP 10.0.0.1.12345 > 10.0.0.4.12345: UDP, length 16
17:54:44.196383 IP 10.0.0.1.12345 > 10.0.0.4.12345: UDP, length 16
17:54:44.196993 IP 10.0.0.1.12345 > 10.0.0.4.12345: UDP, length 16
17:54:44.197603 IP 10.0.0.1.12345 > 10.0.0.4.12345: UDP, length 16
17:54:44.198212 IP 10.0.0.1.12345 > 10.0.0.4.12345: UDP, length 16
17:54:44.198835 IP 10.0.0.1.12345 > 10.0.0.4.12345: UDP, length 16
17:54:44.199449 IP 10.0.0.1.12345 > 10.0.0.4.12345: UDP, length 16
17:54:44.200034 IP 10.0.0.1.12345 > 10.0.0.4.12345: UDP, length 16
17:54:44.200620 IP 10.0.0.1.12345 > 10.0.0.4.12345: UDP, length 16
17:54:44.201206 IP 10.0.0.1.12345 > 10.0.0.4.12345: UDP, length 16
17:54:44.201794 IP 10.0.0.1.12345 > 10.0.0.4.12345: UDP, length 16
17:54:44.202379 IP 10.0.0.1.12345 > 10.0.0.4.12345: UDP, length 16
17:54:44.202967 IP 10.0.0.1.12345 > 10.0.0.4.12345: UDP, length 16
17:54:44.203554 IP 10.0.0.1.12345 > 10.0.0.4.12345: UDP, length 16
17:54:44.204136 IP 10.0.0.1.12345 > 10.0.0.4.12345: UDP, length 16
17:54:44.204737 IP 10.0.0.1.12345 > 10.0.0.4.12345: UDP, length 16
17:54:44.205348 IP 10.0.0.1.12345 > 10.0.0.4.12345: UDP, length 16
17:54:44.205958 IP 10.0.0.1.12345 > 10.0.0.4.12345: UDP, length 16
17:54:44.206565 IP 10.0.0.1.12345 > 10.0.0.4.12345: UDP, length 16
17:54:44.207177 IP 10.0.0.1.12345 > 10.0.0.4.12345: UDP, length 16
17:54:44.207812 IP 10.0.0.1.12345 > 10.0.0.4.12345: UDP, length 16
17:54:44.208421 IP 10.0.0.1.12345 > 10.0.0.4.12345: UDP, length 16
17:54:44.209030 IP 10.0.0.1.12345 > 10.0.0.4.12345: UDP, length 16
17:54:44.209650 IP 10.0.0.1.12345 > 10.0.0.4.12345: UDP, length 16
17:54:44.210265 IP 10.0.0.1.12345 > 10.0.0.4.12345: UDP, length 16
17:54:44.210881 IP 10.0.0.1.12345 > 10.0.0.4.12345: UDP, length 16
17:54:44.211495 IP 10.0.0.1.12345 > 10.0.0.4.12345: UDP, length 16
17:54:44.212111 IP 10.0.0.1.12345 > 10.0.0.4.12345: UDP, length 16
17:54:44.212725 IP 10.0.0.1.12345 > 10.0.0.4.12345: UDP, length 16
17:54:44.213340 IP 10.0.0.1.12345 > 10.0.0.4.12345: UDP, length 16
17:54:44.213955 IP 10.0.0.1.12345 > 10.0.0.4.12345: UDP, length 16
17:54:44.214571 IP 10.0.0.1.12345 > 10.0.0.4.12345: UDP, length 16
17:54:44.215188 IP 10.0.0.1.12345 > 10.0.0.4.12345: UDP, length 16
17:54:44.215802 IP 10.0.0.1.12345 > 10.0.0.4.12345: UDP, length 16
17:54:44.216418 IP 10.0.0.1.12345 > 10.0.0.4.12345: UDP, length 16
17:54:44.217031 IP 10.0.0.1.12345 > 10.0.0.4.12345: UDP, length 16
17:54:44.217647 IP 10.0.0.1.12345 > 10.0.0.4.12345: UDP, length 16
17:54:44.218262 IP 10.0.0.1.12345 > 10.0.0.4.12345: UDP, length 16
17:54:44.218877 IP 10.0.0.1.12345 > 10.0.0.4.12345: UDP, length 16
17:54:44.219492 IP 10.0.0.1.12345 > 10.0.0.4.12345: UDP, length 16
17:54:44.220106 IP 10.0.0.1.12345 > 10.0.0.4.12345: UDP, length 16
17:54:44.220724 IP 10.0.0.1.12345 > 10.0.0.4.12345: UDP, length 16
17:54:44.221342 IP 10.0.0.1.12345 > 10.0.0.4.12345: UDP, length 16
17:54:44.221957 IP 10.0.0.1.12345 > 10.0.0.4.12345: UDP, length 16
17:54:44.222575 IP 10.0.0.1.12345 > 10.0.0.4.12345: UDP, length 16
17:54:44.223185 IP 10.0.0.1.12345 > 10.0.0.4.12345: UDP, length 16
17:54:44.223808 IP 10.0.0.1.12345 > 10.0.0.4.12345: UDP, length 16
17:54:44.224415 IP 10.0.0.1.12345 > 10.0.0.4.12345: UDP, length 16
17:54:44.225023 IP 10.0.0.1.12345 > 10.0.0.4.12345: UDP, length 16
17:54:44.225631 IP 10.0.0.1.12345 > 10.0.0.4.12345: UDP, length 16
17:54:44.226237 IP 10.0.0.1.12345 > 10.0.0.4.12345: UDP, length 16
17:54:44.226844 IP 10.0.0.1.12345 > 10.0.0.4.12345: UDP, length 16
17:54:44.227449 IP 10.0.0.1.12345 > 10.0.0.4.12345: UDP, length 16
17:54:44.228056 IP 10.0.0.1.12345 > 10.0.0.4.12345: UDP, length 16
17:54:44.228661 IP 10.0.0.1.12345 > 10.0.0.4.12345: UDP, length 16
17:54:44.229267 IP 10.0.0.1.12345 > 10.0.0.4.12345: UDP, length 16
17:54:44.229874 IP 10.0.0.1.12345 > 10.0.0.4.12345: UDP, length 16
17:54:44.230480 IP 10.0.0.1.12345 > 10.0.0.4.12345: UDP, length 16
17:54:44.231087 IP 10.0.0.1.12345 > 10.0.0.4.12345: UDP, length 16
17:54:44.231691 IP 10.0.0.1.12345 > 10.0.0.4.12345: UDP, length 16
17:54:44.232298 IP 10.0.0.1.12345 > 10.0.0.4.12345: UDP, length 16
17:54:44.232905 IP 10.0.0.1.12345 > 10.0.0.4.12345: UDP, length 16
17:54:44.233511 IP 10.0.0.1.12345 > 10.0.0.4.12345: UDP, length 16
17:54:44.234117 IP 10.0.0.1.12345 > 10.0.0.4.12345: UDP, length 16
17:54:44.234726 IP 10.0.0.1.12345 > 10.0.0.4.12345: UDP, length 16
17:54:44.235337 IP 10.0.0.1.12345 > 10.0.0.4.12345: UDP, length 16
17:54:44.235919 IP 10.0.0.1.12345 > 10.0.0.4.12345: UDP, length 16
17:54:44.236531 IP 10.0.0.1.12345 > 10.0.0.4.12345: UDP, length 16
17:54:44.237141 IP 10.0.0.1.12345 > 10.0.0.4.12345: UDP, length 16
17:54:44.237751 IP 10.0.0.1.12345 > 10.0.0.4.12345: UDP, length 16
17:54:44.238362 IP 10.0.0.1.12345 > 10.0.0.4.12345: UDP, length 16
17:54:44.238971 IP 10.0.0.1.12345 > 10.0.0.4.12345: UDP, length 16
17:54:44.239582 IP 10.0.0.1.12345 > 10.0.0.4.12345: UDP, length 16
17:54:44.240193 IP 10.0.0.1.12345 > 10.0.0.4.12345: UDP, length 16
17:54:44.240803 IP 10.0.0.1.12345 > 10.0.0.4.12345: UDP, length 16
17:54:44.241413 IP 10.0.0.1.12345 > 10.0.0.4.12345: UDP, length 16
17:54:44.242022 IP 10.0.0.1.12345 > 10.0.0.4.12345: UDP, length 16
17:54:44.242634 IP 10.0.0.1.12345 > 10.0.0.4.12345: UDP, length 16
17:54:44.243245 IP 10.0.0.1.12345 > 10.0.0.4.12345: UDP, length 16
17:54:44.243830 IP 10.0.0.1.12345 > 10.0.0.4.12345: UDP, length 16
17:54:44.244441 IP 10.0.0.1.12345 > 10.0.0.4.12345: UDP, length 16
17:54:44.245050 IP 10.0.0.1.12345 > 10.0.0.4.12345: UDP, length 16
17:54:44.245661 IP 10.0.0.1.12345 > 10.0.0.4.12345: UDP, length 16
17:54:44.246271 IP 10.0.0.1.12345 > 10.0.0.4.12345: UDP, length 16
17:54:44.246882 IP 10.0.0.1.12345 > 10.0.0.4.12345: UDP, length 16
17:54:44.247490 IP 10.0.0.1.12345 > 10.0.0.4.12345: UDP, length 16
17:54:44.248100 IP 10.0.0.1.12345 > 10.0.0.4.12345: UDP, length 16
17:54:44.248711 IP 10.0.0.1.12345 > 10.0.0.4.12345: UDP, length 16
17:54:44.249322 IP 10.0.0.1.12345 > 10.0.0.4.12345: UDP, length 16
17:54:44.249932 IP 10.0.0.1.12345 > 10.0.0.4.12345: UDP, length 16
17:54:44.250543 IP 10.0.0.1.12345 > 10.0.0.4.12345: UDP, length 16
17:54:44.251153 IP 10.0.0.1.12345 > 10.0.0.4.12345: UDP, length 16
17:54:44.251795 IP 10.0.0.1.12345 > 10.0.0.4.12345: UDP, length 16
17:54:44.252406 IP 10.0.0.1.12345 > 10.0.0.4.12345: UDP, length 16
17:54:44.253017 IP 10.0.0.1.12345 > 10.0.0.4.12345: UDP, length 16
17:54:44.253626 IP 10.0.0.1.12345 > 10.0.0.4.12345: UDP, length 16
17:54:44.254238 IP 10.0.0.1.12345 > 10.0.0.4.12345: UDP, length 16
17:54:44.254847 IP 10.0.0.1.12345 > 10.0.0.4.12345: UDP, length 16
17:54:44.255460 IP 10.0.0.1.12345 > 10.0.0.4.12345: UDP, length 16
17:54:44.256070 IP 10.0.0.1.12345 > 10.0.0.4.12345: UDP, length 16
17:54:44.256681 IP 10.0.0.1.12345 > 10.0.0.4.12345: UDP, length 16
17:54:44.257292 IP 10.0.0.1.12345 > 10.0.0.4.12345: UDP, length 16
17:54:44.257901 IP 10.0.0.1.12345 > 10.0.0.4.12345: UDP, length 16
17:54:44.258513 IP 10.0.0.1.12345 > 10.0.0.4.12345: UDP, length 16
17:54:44.259123 IP 10.0.0.1.12345 > 10.0.0.4.12345: UDP, length 16
17:54:44.259734 IP 10.0.0.1.12345 > 10.0.0.4.12345: UDP, length 16
17:54:44.260387 IP 10.0.0.1.12345 > 10.0.0.4.12345: UDP, length 16
17:54:44.260996 IP 10.0.0.1.12345 > 10.0.0.4.12345: UDP, length 16
17:54:44.261605 IP 10.0.0.1.12345 > 10.0.0.4.12345: UDP, length 16
17:54:44.262212 IP 10.0.0.1.12345 > 10.0.0.4.12345: UDP, length 16
17:54:44.262804 IP 10.0.0.1.12345 > 10.0.0.4.12345: UDP, length 16
17:54:44.263429 IP 10.0.0.1.12345 > 10.0.0.4.12345: UDP, length 16
17:54:44.264027 IP 10.0.0.1.12345 > 10.0.0.4.12345: UDP, length 16
17:54:44.264652 IP 10.0.0.1.12345 > 10.0.0.4.12345: UDP, length 16
17:54:44.265282 IP 10.0.0.1.12345 > 10.0.0.4.12345: UDP, length 16
17:54:44.265910 IP 10.0.0.1.12345 > 10.0.0.4.12345: UDP, length 16
17:54:44.266538 IP 10.0.0.1.12345 > 10.0.0.4.12345: UDP, length 16
17:54:44.267165 IP 10.0.0.1.12345 > 10.0.0.4.12345: UDP, length 16
17:54:44.267797 IP 10.0.0.1.12345 > 10.0.0.4.12345: UDP, length 16
17:54:44.268435 IP 10.0.0.1.12345 > 10.0.0.4.12345: UDP, length 16
17:54:44.269083 IP 10.0.0.1.12345 > 10.0.0.4.12345: UDP, length 16
17:54:44.269730 IP 10.0.0.1.12345 > 10.0.0.4.12345: UDP, length 16
17:54:44.270360 IP 10.0.0.1.12345 > 10.0.0.4.12345: UDP, length 16
17:54:44.271008 IP 10.0.0.1.12345 > 10.0.0.4.12345: UDP, length 16
17:54:44.271637 IP 10.0.0.1.12345 > 10.0.0.4.12345: UDP, length 16
17:54:44.272233 IP 10.0.0.1.12345 > 10.0.0.4.12345: UDP, length 16
17:54:44.272855 IP 10.0.0.1.12345 > 10.0.0.4.12345: UDP, length 16
17:54:44.273476 IP 10.0.0.1.12345 > 10.0.0.4.12345: UDP, length 16
17:54:44.274084 IP 10.0.0.1.12345 > 10.0.0.4.12345: UDP, length 16
17:54:44.274691 IP 10.0.0.1.12345 > 10.0.0.4.12345: UDP, length 16
17:54:44.275318 IP 10.0.0.1.12345 > 10.0.0.4.12345: UDP, length 16
17:54:44.275902 IP 10.0.0.1.12345 > 10.0.0.4.12345: UDP, length 16
17:54:44.276521 IP 10.0.0.1.12345 > 10.0.0.4.12345: UDP, length 16
17:54:44.277143 IP 10.0.0.1.12345 > 10.0.0.4.12345: UDP, length 16
17:54:44.277764 IP 10.0.0.1.12345 > 10.0.0.4.12345: UDP, length 16
17:54:44.278372 IP 10.0.0.1.12345 > 10.0.0.4.12345: UDP, length 16
17:54:44.278980 IP 10.0.0.1.12345 > 10.0.0.4.12345: UDP, length 16
17:54:44.279589 IP 10.0.0.1.12345 > 10.0.0.4.12345: UDP, length 16
17:54:44.280196 IP 10.0.0.1.12345 > 10.0.0.4.12345: UDP, length 16
17:54:44.280801 IP 10.0.0.1.12345 > 10.0.0.4.12345: UDP, length 16
17:54:44.281423 IP 10.0.0.1.12345 > 10.0.0.4.12345: UDP, length 16
17:54:44.282048 IP 10.0.0.1.12345 > 10.0.0.4.12345: UDP, length 16
17:54:44.282650 IP 10.0.0.1.12345 > 10.0.0.4.12345: UDP, length 16
17:54:44.283275 IP 10.0.0.1.12345 > 10.0.0.4.12345: UDP, length 16
17:54:44.283860 IP 10.0.0.1.12345 > 10.0.0.4.12345: UDP, length 16
17:54:44.284484 IP 10.0.0.1.12345 > 10.0.0.4.12345: UDP, length 16
17:54:44.285097 IP 10.0.0.1.12345 > 10.0.0.4.12345: UDP, length 16
17:54:44.285722 IP 10.0.0.1.12345 > 10.0.0.4.12345: UDP, length 16
17:54:44.286319 IP 10.0.0.1.12345 > 10.0.0.4.12345: UDP, length 16
17:54:44.286913 IP 10.0.0.1.12345 > 10.0.0.4.12345: UDP, length 16
17:54:44.287539 IP 10.0.0.1.12345 > 10.0.0.4.12345: UDP, length 16
17:54:44.288153 IP 10.0.0.1.12345 > 10.0.0.4.12345: UDP, length 16
17:54:44.288766 IP 10.0.0.1.12345 > 10.0.0.4.12345: UDP, length 16
17:54:44.289391 IP 10.0.0.1.12345 > 10.0.0.4.12345: UDP, length 16
17:54:44.290007 IP 10.0.0.1.12345 > 10.0.0.4.12345: UDP, length 16
17:54:44.290619 IP 10.0.0.1.12345 > 10.0.0.4.12345: UDP, length 16
17:54:44.291235 IP 10.0.0.1.12345 > 10.0.0.4.12345: UDP, length 16
17:54:44.291858 IP 10.0.0.1.12345 > 10.0.0.4.12345: UDP, length 16
17:54:44.292465 IP 10.0.0.1.12345 > 10.0.0.4.12345: UDP, length 16
17:54:44.293070 IP 10.0.0.1.12345 > 10.0.0.4.12345: UDP, length 16
17:54:44.293687 IP 10.0.0.1.12345 > 10.0.0.4.12345: UDP, length 16
17:54:44.294280 IP 10.0.0.1.12345 > 10.0.0.4.12345: UDP, length 16
17:54:44.294871 IP 10.0.0.1.12345 > 10.0.0.4.12345: UDP, length 16
17:54:44.295475 IP 10.0.0.1.12345 > 10.0.0.4.12345: UDP, length 16
17:54:44.296082 IP 10.0.0.1.12345 > 10.0.0.4.12345: UDP, length 16
17:54:44.296686 IP 10.0.0.1.12345 > 10.0.0.4.12345: UDP, length 16
17:54:44.297292 IP 10.0.0.1.12345 > 10.0.0.4.12345: UDP, length 16
17:54:44.297898 IP 10.0.0.1.12345 > 10.0.0.4.12345: UDP, length 16
17:54:44.298501 IP 10.0.0.1.12345 > 10.0.0.4.12345: UDP, length 16
17:54:44.299123 IP 10.0.0.1.12345 > 10.0.0.4.12345: UDP, length 16
17:54:44.299729 IP 10.0.0.1.12345 > 10.0.0.4.12345: UDP, length 16
17:54:44.300365 IP 10.0.0.1.12345 > 10.0.0.4.12345: UDP, length 16
17:54:44.300972 IP 10.0.0.1.12345 > 10.0.0.4.12345: UDP, length 16
17:54:44.301578 IP 10.0.0.1.12345 > 10.0.0.4.12345: UDP, length 16
17:54:44.302185 IP 10.0.0.1.12345 > 10.0.0.4.12345: UDP, length 16
17:54:44.302804 IP 10.0.0.1.12345 > 10.0.0.4.12345: UDP, length 16
17:54:44.303415 IP 10.0.0.1.12345 > 10.0.0.4.12345: UDP, length 16
17:54:44.304021 IP 10.0.0.1.12345 > 10.0.0.4.12345: UDP, length 16
17:54:44.304632 IP 10.0.0.1.12345 > 10.0.0.4.12345: UDP, length 16
17:54:44.305244 IP 10.0.0.1.12345 > 10.0.0.4.12345: UDP, length 16
17:54:44.305854 IP 10.0.0.1.12345 > 10.0.0.4.12345: UDP, length 16
17:54:44.306449 IP 10.0.0.1.12345 > 10.0.0.4.12345: UDP, length 16
17:54:44.307059 IP 10.0.0.1.12345 > 10.0.0.4.12345: UDP, length 16
17:54:44.307655 IP 10.0.0.1.12345 > 10.0.0.4.12345: UDP, length 16
17:54:44.308266 IP 10.0.0.1.12345 > 10.0.0.4.12345: UDP, length 16
17:54:44.308879 IP 10.0.0.1.12345 > 10.0.0.4.12345: UDP, length 16
17:54:44.309492 IP 10.0.0.1.12345 > 10.0.0.4.12345: UDP, length 16
17:54:44.310103 IP 10.0.0.1.12345 > 10.0.0.4.12345: UDP, length 16
17:54:44.310698 IP 10.0.0.1.12345 > 10.0.0.4.12345: UDP, length 16
17:54:44.311309 IP 10.0.0.1.12345 > 10.0.0.4.12345: UDP, length 16
17:54:44.311892 IP 10.0.0.1.12345 > 10.0.0.4.12345: UDP, length 16
17:54:44.312503 IP 10.0.0.1.12345 > 10.0.0.4.12345: UDP, length 16
17:54:44.313115 IP 10.0.0.1.12345 > 10.0.0.4.12345: UDP, length 16
17:54:44.313727 IP 10.0.0.1.12345 > 10.0.0.4.12345: UDP, length 16
17:54:44.314325 IP 10.0.0.1.12345 > 10.0.0.4.12345: UDP, length 16
17:54:44.314913 IP 10.0.0.1.12345 > 10.0.0.4.12345: UDP, length 16
17:54:44.315531 IP 10.0.0.1.12345 > 10.0.0.4.12345: UDP, length 16
17:54:44.316140 IP 10.0.0.1.12345 > 10.0.0.4.12345: UDP, length 16
17:54:44.316748 IP 10.0.0.1.12345 > 10.0.0.4.12345: UDP, length 16
17:54:44.317357 IP 10.0.0.1.12345 > 10.0.0.4.12345: UDP, length 16
17:54:44.317964 IP 10.0.0.1.12345 > 10.0.0.4.12345: UDP, length 16
17:54:44.318555 IP 10.0.0.1.12345 > 10.0.0.4.12345: UDP, length 16
17:54:44.319163 IP 10.0.0.1.12345 > 10.0.0.4.12345: UDP, length 16
17:54:44.319773 IP 10.0.0.1.12345 > 10.0.0.4.12345: UDP, length 16
17:54:44.320384 IP 10.0.0.1.12345 > 10.0.0.4.12345: UDP, length 16
17:54:44.320992 IP 10.0.0.1.12345 > 10.0.0.4.12345: UDP, length 16
17:54:44.321582 IP 10.0.0.1.12345 > 10.0.0.4.12345: UDP, length 16
17:54:44.322175 IP 10.0.0.1.12345 > 10.0.0.4.12345: UDP, length 16
17:54:44.322766 IP 10.0.0.1.12345 > 10.0.0.4.12345: UDP, length 16
17:54:44.323373 IP 10.0.0.1.12345 > 10.0.0.4.12345: UDP, length 16
17:54:44.323952 IP 10.0.0.1.12345 > 10.0.0.4.12345: UDP, length 16
17:54:44.324561 IP 10.0.0.1.12345 > 10.0.0.4.12345: UDP, length 16
17:54:44.325156 IP 10.0.0.1.12345 > 10.0.0.4.12345: UDP, length 16
17:54:44.325750 IP 10.0.0.1.12345 > 10.0.0.4.12345: UDP, length 16
17:54:44.326344 IP 10.0.0.1.12345 > 10.0.0.4.12345: UDP, length 16
17:54:44.326932 IP 10.0.0.1.12345 > 10.0.0.4.12345: UDP, length 16
17:54:44.327535 IP 10.0.0.1.12345 > 10.0.0.4.12345: UDP, length 16
17:54:44.328137 IP 10.0.0.1.12345 > 10.0.0.4.12345: UDP, length 16
17:54:44.328739 IP 10.0.0.1.12345 > 10.0.0.4.12345: UDP, length 16
17:54:44.329341 IP 10.0.0.1.12345 > 10.0.0.4.12345: UDP, length 16
17:54:44.329942 IP 10.0.0.1.12345 > 10.0.0.4.12345: UDP, length 16
17:54:44.330529 IP 10.0.0.1.12345 > 10.0.0.4.12345: UDP, length 16
17:54:44.331131 IP 10.0.0.1.12345 > 10.0.0.4.12345: UDP, length 16
17:54:44.331717 IP 10.0.0.1.12345 > 10.0.0.4.12345: UDP, length 16
17:54:44.332321 IP 10.0.0.1.12345 > 10.0.0.4.12345: UDP, length 16
17:54:44.332924 IP 10.0.0.1.12345 > 10.0.0.4.12345: UDP, length 16
17:54:44.333527 IP 10.0.0.1.12345 > 10.0.0.4.12345: UDP, length 16
17:54:44.334112 IP 10.0.0.1.12345 > 10.0.0.4.12345: UDP, length 16
17:54:44.334731 IP 10.0.0.1.12345 > 10.0.0.4.12345: UDP, length 16
17:54:44.335334 IP 10.0.0.1.12345 > 10.0.0.4.12345: UDP, length 16
17:54:44.335910 IP 10.0.0.1.12345 > 10.0.0.4.12345: UDP, length 16
17:54:44.336513 IP 10.0.0.1.12345 > 10.0.0.4.12345: UDP, length 16
17:54:44.337099 IP 10.0.0.1.12345 > 10.0.0.4.12345: UDP, length 16
17:54:44.337702 IP 10.0.0.1.12345 > 10.0.0.4.12345: UDP, length 16
17:54:44.338291 IP 10.0.0.1.12345 > 10.0.0.4.12345: UDP, length 16
17:54:44.338882 IP 10.0.0.1.12345 > 10.0.0.4.12345: UDP, length 16
