09:40:01.012435 IP 10.2.208.116.12345 > 10.0.0.2.12345: UDP, length 16
09:40:02.012733 IP 10.113.159.208.12345 > 10.0.0.2.12345: UDP, length 16
09:40:03.013054 IP 10.71.154.154.12345 > 10.0.0.2.12345: UDP, length 16
09:40:04.013317 IP 10.112.229.148.12345 > 10.0.0.2.12345: UDP, length 16
09:40:05.013482 IP 10.5.185.230.12345 > 10.0.0.2.12345: UDP, length 16
09:40:06.013719 IP 10.40.67.241.12345 > 10.0.0.2.12345: UDP, length 16
09:40:07.013962 IP 10.9.153.66.12345 > 10.0.0.2.12345: UDP, length 16
09:40:08.014168 IP 10.5.202.3.12345 > 10.0.0.2.12345: UDP, length 16
09:40:09.014511 IP 10.19.80.95.12345 > 10.0.0.2.12345: UDP, length 16
09:40:10.014769 IP 10.91.61.64.12345 > 10.0.0.2.12345: UDP, length 16
09:40:11.014952 IP 10.35.34.32.12345 > 10.0.0.2.12345: UDP, length 16
09:40:12.015231 IP 10.9.106.176.12345 > 10.0.0.2.12345: UDP, length 16
09:40:13.015476 IP 10.98.37.234.12345 > 10.0.0.2.12345: UDP, length 16
09:40:14.015881 IP 10.17.208.25.12345 > 10.0.0.2.12345: UDP, length 16
09:40:15.016250 IP 10.14.86.118.12345 > 10.0.0.2.12345: UDP, length 16
09:40:16.016577 IP 10.37.90.168.12345 > 10.0.0.2.12345: UDP, length 16
09:40:17.016882 IP 10.31.208.69.12345 > 10.0.0.2.12345: UDP, length 16
09:40:18.017212 IP 10.7.217.59.12345 > 10.0.0.2.12345: UDP, length 16
09:40:19.017528 IP 10.32.19.252.12345 > 10.0.0.2.12345: UDP, length 16
09:40:20.017827 IP 10.31.199.235.12345 > 10.0.0.2.12345: UDP, length 16
09:40:21.018187 IP 10.8.159.173.12345 > 10.0.0.2.12345: UDP, length 16
09:40:22.018485 IP 10.126.90.78.12345 > 10.0.0.2.12345: UDP, length 16
09:40:23.018786 IP 10.50.214.98.12345 > 10.0.0.2.12345: UDP, length 16
09:40:24.019157 IP 10.92.1.26.12345 > 10.0.0.2.12345: UDP, length 16
09:40:25.019517 IP 10.81.167.55.12345 > 10.0.0.2.12345: UDP, length 16
09:40:26.019871 IP 10.116.115.125.12345 > 10.0.0.2.12345: UDP, length 16
09:40:27.020147 IP 10.31.233.85.12345 > 10.0.0.2.12345: UDP, length 16
09:40:28.020432 IP 10.44.135.219.12345 > 10.0.0.2.12345: UDP, length 16
09:40:29.020753 IP 10.3.216.100.12345 > 10.0.0.2.12345: UDP, length 16
09:40:30.021106 IP 10.64.93.51.12345 > 10.0.0.2.12345: UDP, length 16
09:40:31.021497 IP 10.75.188.45.12345 > 10.0.0.2.12345: UDP, length 16
09:40:32.021832 IP 10.1.52.218.12345 > 10.0.0.2.12345: UDP, length 16
09:40:33.022192 IP 10.45.152.29.12345 > 10.0.0.2.12345: UDP, length 16
09:40:34.022562 IP 10.98.36.120.12345 > 10.0.0.2.12345: UDP, length 16
09:40:35.022902 IP 10.36.143.182.12345 > 10.0.0.2.12345: UDP, length 16
09:40:36.023253 IP 10.124.118.0.12345 > 10.0.0.2.12345: UDP, length 16
09:40:37.023563 IP 10.108.134.161.12345 > 10.0.0.2.12345: UDP, length 16
09:40:38.023889 IP 10.85.145.79.12345 > 10.0.0.2.12345: UDP, length 16
09:40:39.024250 IP 10.86.31.113.12345 > 10.0.0.2.12345: UDP, length 16
09:40:40.024618 IP 10.105.100.175.12345 > 10.0.0.2.12345: UDP, length 16
09:40:41.024980 IP 10.99.230.241.12345 > 10.0.0.2.12345: UDP, length 16
09:40:42.025297 IP 10.102.157.16.12345 > 10.0.0.2.12345: UDP, length 16
09:40:43.025657 IP 10.25.4.68.12345 > 10.0.0.2.12345: UDP, length 16
09:40:44.026000 IP 10.20.205.137.12345 > 10.0.0.2.12345: UDP, length 16
09:40:45.026375 IP 10.78.39.171.12345 > 10.0.0.2.12345: UDP, length 16
09:40:46.026755 IP 10.126.164.58.12345 > 10.0.0.2.12345: UDP, length 16
09:40:47.027079 IP 10.10.82.251.12345 > 10.0.0.2.12345: UDP, length 16
09:40:48.027392 IP 10.112.12.11.12345 > 10.0.0.2.12345: UDP, length 16
09:40:49.027783 IP 10.124.0.145.12345 > 10.0.0.2.12345: UDP, length 16
09:40:50.028101 IP 10.81.155.106.12345 > 10.0.0.2.12345: UDP, length 16
09:40:51.028470 IP 10.102.169.93.12345 > 10.0.0.2.12345: UDP, length 16
09:40:52.028834 IP 10.108.78.28.12345 > 10.0.0.2.12345: UDP, length 16
09:40:53.029166 IP 10.61.133.175.12345 > 10.0.0.2.12345: UDP, length 16
09:40:54.029517 IP 10.34.157.251.12345 > 10.0.0.2.12345: UDP, length 16
09:40:55.029872 IP 10.7.96.228.12345 > 10.0.0.2.12345: UDP, length 16
09:40:56.030237 IP 10.36.124.23.12345 > 10.0.0.2.12345: UDP, length 16
09:40:57.030608 IP 10.10.59.58.12345 > 10.0.0.2.12345: UDP, length 16
09:40:58.030934 IP 10.96.73.167.12345 > 10.0.0.2.12345: UDP, length 16
09:40:59.031266 IP 10.117.41.153.12345 > 10.0.0.2.12345: UDP, length 16
09:41:00.031547 IP 10.31.230.5.12345 > 10.0.0.2.12345: UDP, length 16
09:41:01.031879 IP 10.58.76.170.12345 > 10.0.0.2.12345: UDP, length 16
09:41:02.032254 IP 10.82.70.46.12345 > 10.0.0.2.12345: UDP, length 16
09:41:03.032578 IP 10.42.174.162.12345 > 10.0.0.2.12345: UDP, length 16
09:41:04.032915 IP 10.30.252.60.12345 > 10.0.0.2.12345: UDP, length 16
09:41:05.033266 IP 10.62.64.8.12345 > 10.0.0.2.12345: UDP, length 16
09:41:06.033599 IP 10.53.246.112.12345 > 10.0.0.2.12345: UDP, length 16
09:41:07.033950 IP 10.32.222.183.12345 > 10.0.0.2.12345: UDP, length 16
09:41:08.034222 IP 10.45.187.154.12345 > 10.0.0.2.12345: UDP, length 16
09:41:09.034529 IP 10.54.102.223.12345 > 10.0.0.2.12345: UDP, length 16
09:41:10.034879 IP 10.9.69.42.12345 > 10.0.0.2.12345: UDP, length 16
09:41:11.035186 IP 10.16.96.197.12345 > 10.0.0.2.12345: UDP, length 16
09:41:12.035467 IP 10.80.178.92.12345 > 10.0.0.2.12345: UDP, length 16
09:41:13.035841 IP 10.82.157.42.12345 > 10.0.0.2.12345: UDP, length 16
09:41:14.036204 IP 10.105.228.132.12345 > 10.0.0.2.12345: UDP, length 16
09:41:15.036555 IP 10.66.91.145.12345 > 10.0.0.2.12345: UDP, length 16
09:41:16.036910 IP 10.98.98.96.12345 > 10.0.0.2.12345: UDP, length 16
09:41:17.037256 IP 10.9.236.11.12345 > 10.0.0.2.12345: UDP, length 16
09:41:18.037595 IP 10.14.40.153.12345 > 10.0.0.2.12345: UDP, length 16
09:41:19.037922 IP 10.96.101.224.12345 > 10.0.0.2.12345: UDP, length 16
09:41:20.038254 IP 10.90.212.58.12345 > 10.0.0.2.12345: UDP, length 16
09:41:21.038611 IP 10.123.228.197.12345 > 10.0.0.2.12345: UDP, length 16
09:41:22.038963 IP 10.42.207.112.12345 > 10.0.0.2.12345: UDP, length 16
09:41:23.039328 IP 10.79.69.92.12345 > 10.0.0.2.12345: UDP, length 16
09:41:24.039764 IP 10.51.141.128.12345 > 10.0.0.2.12345: UDP, length 16
09:41:25.040098 IP 10.105.111.39.12345 > 10.0.0.2.12345: UDP, length 16
09:41:26.040481 IP 10.62.175.249.12345 > 10.0.0.2.12345: UDP, length 16
09:41:27.040833 IP 10.73.58.145.12345 > 10.0.0.2.12345: UDP, length 16
09:41:28.041188 IP 10.41.169.102.12345 > 10.0.0.2.12345: UDP, length 16
09:41:29.041530 IP 10.92.113.207.12345 > 10.0.0.2.12345: UDP, length 16
09:41:30.041848 IP 10.74.158.205.12345 > 10.0.0.2.12345: UDP, length 16
09:41:31.042118 IP 10.5.19.48.12345 > 10.0.0.2.12345: UDP, length 16
09:41:32.042378 IP 10.51.3.169.12345 > 10.0.0.2.12345: UDP, length 16
09:41:33.042651 IP 10.116.219.216.12345 > 10.0.0.2.12345: UDP, length 16
09:41:34.042976 IP 10.1.7.37.12345 > 10.0.0.2.12345: UDP, length 16
09:41:35.043263 IP 10.2.182.185.12345 > 10.0.0.2.12345: UDP, length 16
09:41:36.043552 IP 10.54.105.110.12345 > 10.0.0.2.12345: UDP, length 16
09:41:37.043855 IP 10.118.96.35.12345 > 10.0.0.2.12345: UDP, length 16
09:41:38.044182 IP 10.117.178.111.12345 > 10.0.0.2.12345: UDP, length 16
09:41:39.044491 IP 10.19.153.54.12345 > 10.0.0.2.12345: UDP, length 16
09:41:40.044744 IP 10.23.94.62.12345 > 10.0.0.2.12345: UDP, length 16
