12:55:54.495444 IP 10.3.30.53.12345 > 10.0.0.2.12345: UDP, length 16
12:55:55.295108 IP 10.111.234.101.12345 > 10.0.0.2.12345: UDP, length 16
12:55:56.095206 IP 10.98.95.70.12345 > 10.0.0.2.12345: UDP, length 16
12:55:56.896785 IP 10.121.186.153.12345 > 10.0.0.2.12345: UDP, length 16
12:55:57.698069 IP 10.43.204.145.12345 > 10.0.0.2.12345: UDP, length 16
12:55:58.497008 IP 10.82.1.6.12345 > 10.0.0.2.12345: UDP, length 16
12:55:59.297907 IP 10.93.22.233.12345 > 10.0.0.2.12345: UDP, length 16
12:56:00.098188 IP 10.72.231.138.12345 > 10.0.0.2.12345: UDP, length 16
12:56:00.897844 IP 10.11.8.110.12345 > 10.0.0.2.12345: UDP, length 16
12:56:01.699488 IP 10.13.52.204.12345 > 10.0.0.2.12345: UDP, length 16
12:56:02.498753 IP 10.33.108.233.12345 > 10.0.0.2.12345: UDP, length 16
12:56:03.300056 IP 10.74.94.159.12345 > 10.0.0.2.12345: UDP, length 16
12:56:04.100496 IP 10.7.180.47.12345 > 10.0.0.2.12345: UDP, length 16
12:56:04.899770 IP 10.86.149.197.12345 > 10.0.0.2.12345: UDP, length 16
12:56:05.700090 IP 10.65.71.1.12345 > 10.0.0.2.12345: UDP, length 16
12:56:06.499589 IP 10.29.110.201.12345 > 10.0.0.2.12345: UDP, length 16
12:56:07.301716 IP 10.111.107.119.12345 > 10.0.0.2.12345: UDP, length 16
12:56:08.101441 IP 10.17.202.87.12345 > 10.0.0.2.12345: UDP, length 16
12:56:08.901607 IP 10.6.239.15.12345 > 10.0.0.2.12345: UDP, length 16
12:56:09.702726 IP 10.108.141.100.12345 > 10.0.0.2.12345: UDP, length 16
12:56:10.501207 IP 10.6.223.221.12345 > 10.0.0.2.12345: UDP, length 16
12:56:11.302892 IP 10.126.177.25.12345 > 10.0.0.2.12345: UDP, length 16
12:56:12.103757 IP 10.94.228.121.12345 > 10.0.0.2.12345: UDP, length 16
12:56:12.903968 IP 10.35.187.203.12345 > 10.0.0.2.12345: UDP, length 16
12:56:13.704357 IP 10.116.132.20.12345 > 10.0.0.2.12345: UDP, length 16
12:56:14.502740 IP 10.77.161.190.12345 > 10.0.0.2.12345: UDP, length 16
12:56:15.304955 IP 10.112.185.94.12345 > 10.0.0.2.12345: UDP, length 16
12:56:16.104388 IP 10.112.69.44.12345 > 10.0.0.2.12345: UDP, length 16
12:56:16.904024 IP 10.95.89.248.12345 > 10.0.0.2.12345: UDP, length 16
12:56:17.705972 IP 10.55.98.69.12345 > 10.0.0.2.12345: UDP, length 16
12:56:18.506223 IP 10.35.253.181.12345 > 10.0.0.2.12345: UDP, length 16
12:56:19.306382 IP 10.57.228.151.12345 > 10.0.0.2.12345: UDP, length 16
12:56:20.106192 IP 10.45.58.66.12345 > 10.0.0.2.12345: UDP, length 16
12:56:20.906452 IP 10.30.88.168.12345 > 10.0.0.2.12345: UDP, length 16
12:56:21.707179 IP 10.78.86.163.12345 > 10.0.0.2.12345: UDP, length 16
12:56:22.507877 IP 10.11.164.155.12345 > 10.0.0.2.12345: UDP, length 16
12:56:23.307536 IP 10.48.197.177.12345 > 10.0.0.2.12345: UDP, length 16
12:56:24.108375 IP 10.19.147.39.12345 > 10.0.0.2.12345: UDP, length 16
12:56:24.908192 IP 10.83.117.154.12345 > 10.0.0.2.12345: UDP, length 16
12:56:25.709454 IP 10.71.107.199.12345 > 10.0.0.2.12345: UDP, length 16
12:56:26.508781 IP 10.32.110.151.12345 > 10.0.0.2.12345: UDP, length 16
12:56:27.308700 IP 10.114.223.78.12345 > 10.0.0.2.12345: UDP, length 16
12:56:28.110226 IP 10.98.90.3.12345 > 10.0.0.2.12345: UDP, length 16
12:56:28.909505 IP 10.53.126.253.12345 > 10.0.0.2.12345: UDP, length 16
12:56:29.710952 IP 10.121.233.8.12345 > 10.0.0.2.12345: UDP, length 16
12:56:30.511198 IP 10.103.96.191.12345 > 10.0.0.2.12345: UDP, length 16
12:56:31.311059 IP 10.53.66.129.12345 > 10.0.0.2.12345: UDP, length 16
12:56:32.111519 IP 10.103.139.15.12345 > 10.0.0.2.12345: UDP, length 16
12:56:32.911487 IP 10.11.101.142.12345 > 10.0.0.2.12345: UDP, length 16
12:56:33.712742 IP 10.10.19.161.12345 > 10.0.0.2.12345: UDP, length 16
12:56:34.513130 IP 10.125.89.78.12345 > 10.0.0.2.12345: UDP, length 16
12:56:35.312319 IP 10.34.12.160.12345 > 10.0.0.2.12345: UDP, length 16
12:56:36.113770 IP 10.127.242.68.12345 > 10.0.0.2.12345: UDP, length 16
12:56:36.913438 IP 10.29.128.60.12345 > 10.0.0.2.12345: UDP, length 16
12:56:37.715540 IP 10.10.168.202.12345 > 10.0.0.2.12345: UDP, length 16
12:56:38.513975 IP 10.26.85.47.12345 > 10.0.0.2.12345: UDP, length 16
12:56:39.314110 IP 10.8.22.11.12345 > 10.0.0.2.12345: UDP, length 16
12:56:40.115305 IP 10.20.153.252.12345 > 10.0.0.2.12345: UDP, length 16
12:56:40.915056 IP 10.34.39.178.12345 > 10.0.0.2.12345: UDP, length 16
12:56:41.714909 IP 10.74.252.29.12345 > 10.0.0.2.12345: UDP, length 16
12:56:42.516134 IP 10.36.121.173.12345 > 10.0.0.2.12345: UDP, length 16
12:56:43.315947 IP 10.127.184.26.12345 > 10.0.0.2.12345: UDP, length 16
12:56:44.115890 IP 10.26.45.157.12345 > 10.0.0.2.12345: UDP, length 16
12:56:44.917430 IP 10.33.4.23.12345 > 10.0.0.2.12345: UDP, length 16
12:56:45.717792 IP 10.39.97.78.12345 > 10.0.0.2.12345: UDP, length 16
12:56:46.518099 IP 10.75.128.37.12345 > 10.0.0.2.12345: UDP, length 16
12:56:47.319063 IP 10.97.49.182.12345 > 10.0.0.2.12345: UDP, length 16
12:56:48.118816 IP 10.92.157.176.12345 > 10.0.0.2.12345: UDP, length 16
12:56:48.918343 IP 10.34.231.91.12345 > 10.0.0.2.12345: UDP, length 16
12:56:49.719524 IP 10.53.17.249.12345 > 10.0.0.2.12345: UDP, length 16
12:56:50.519527 IP 10.75.38.85.12345 > 10.0.0.2.12345: UDP, length 16
12:56:51.319387 IP 10.112.219.103.12345 > 10.0.0.2.12345: UDP, length 16
12:56:52.119825 IP 10.102.141.241.12345 > 10.0.0.2.12345: UDP, length 16
12:56:52.919513 IP 10.28.182.8.12345 > 10.0.0.2.12345: UDP, length 16
12:56:53.720171 IP 10.83.207.132.12345 > 10.0.0.2.12345: UDP, length 16
12:56:54.521345 IP 10.98.28.0.12345 > 10.0.0.2.12345: UDP, length 16
12:56:55.321711 IP 10.34.250.136.12345 > 10.0.0.2.12345: UDP, length 16
12:56:56.121204 IP 10.8.174.66.12345 > 10.0.0.2.12345: UDP, length 16
12:56:56.921087 IP 10.115.47.10.12345 > 10.0.0.2.12345: UDP, length 16
12:56:57.722593 IP 10.118.48.109.12345 > 10.0.0.2.12345: UDP, length 16
12:56:58.522461 IP 10.88.117.232.12345 > 10.0.0.2.12345: UDP, length 16
12:56:59.322339 IP 10.87.16.48.12345 > 10.0.0.2.12345: UDP, length 16
12:57:00.122076 IP 10.39.220.159.12345 > 10.0.0.2.12345: UDP, length 16
12:57:00.922828 IP 10.15.167.8.12345 > 10.0.0.2.12345: UDP, length 16
12:57:01.723921 IP 10.93.105.46.12345 > 10.0.0.2.12345: UDP, length 16
12:57:02.524462 IP 10.123.62.65.12345 > 10.0.0.2.12345: UDP, length 16
12:57:03.324896 IP 10.26.243.219.12345 > 10.0.0.2.12345: UDP, length 16
12:57:04.125152 IP 10.124.99.252.12345 > 10.0.0.2.12345: UDP, length 16
12:57:04.923130 IP 10.57.103.150.12345 > 10.0.0.2.12345: UDP, length 16
12:57:05.725374 IP 10.77.69.191.12345 > 10.0.0.2.12345: UDP, length 16
12:57:06.525774 IP 10.95.139.47.12345 > 10.0.0.2.12345: UDP, length 16
12:57:07.326331 IP 10.16.205.239.12345 > 10.0.0.2.12345: UDP, length 16
12:57:08.125810 IP 10.5.109.57.12345 > 10.0.0.2.12345: UDP, length 16
12:57:08.926167 IP 10.104.236.125.12345 > 10.0.0.2.12345: UDP, length 16
12:57:09.727258 IP 10.68.34.157.12345 > 10.0.0.2.12345: UDP, length 16
12:57:10.526965 IP 10.15.218.245.12345 > 10.0.0.2.12345: UDP, length 16
12:57:11.326969 IP 10.82.56.112.12345 > 10.0.0.2.12345: UDP, length 16
12:57:12.128438 IP 10.126.52.199.12345 > 10.0.0.2.12345: UDP, length 16
12:57:12.928647 IP 10.6.52.153.12345 > 10.0.0.2.12345: UDP, length 16
12:57:13.728434 IP 10.113.222.129.12345 > 10.0.0.2.12345: UDP, length 16
12:57:14.529884 IP 10.71.175.133.12345 > 10.0.0.2.12345: UDP, length 16
12:57:15.328040 IP 10.118.70.41.12345 > 10.0.0.2.12345: UDP, length 16
12:57:16.131071 IP 10.56.240.37.12345 > 10.0.0.2.12345: UDP, length 16
12:57:16.929131 IP 10.42.124.246.12345 > 10.0.0.2.12345: UDP, length 16
12:57:17.730827 IP 10.36.184.192.12345 > 10.0.0.2.12345: UDP, length 16
12:57:18.531950 IP 10.83.131.32.12345 > 10.0.0.2.12345: UDP, length 16
12:57:19.330752 IP 10.117.254.61.12345 > 10.0.0.2.12345: UDP, length 16
12:57:20.131389 IP 10.98.127.97.12345 > 10.0.0.2.12345: UDP, length 16
12:57:20.931294 IP 10.105.104.30.12345 > 10.0.0.2.12345: UDP, length 16
12:57:21.730970 IP 10.11.26.46.12345 > 10.0.0.2.12345: UDP, length 16
12:57:22.531293 IP 10.52.42.155.12345 > 10.0.0.2.12345: UDP, length 16
12:57:23.331143 IP 10.8.63.207.12345 > 10.0.0.2.12345: UDP, length 16
12:57:24.133037 IP 10.65.149.69.12345 > 10.0.0.2.12345: UDP, length 16
12:57:24.933327 IP 10.31.87.38.12345 > 10.0.0.2.12345: UDP, length 16
12:57:25.732750 IP 10.71.221.99.12345 > 10.0.0.2.12345: UDP, length 16
12:57:26.533510 IP 10.26.242.225.12345 > 10.0.0.2.12345: UDP, length 16
12:57:27.332554 IP 10.62.156.226.12345 > 10.0.0.2.12345: UDP, length 16
12:57:28.134410 IP 10.13.188.139.12345 > 10.0.0.2.12345: UDP, length 16
12:57:28.934889 IP 10.5.154.35.12345 > 10.0.0.2.12345: UDP, length 16
12:57:29.734295 IP 10.18.3.137.12345 > 10.0.0.2.12345: UDP, length 16
12:57:30.535691 IP 10.53.136.90.12345 > 10.0.0.2.12345: UDP, length 16
12:57:31.334441 IP 10.53.231.130.12345 > 10.0.0.2.12345: UDP, length 16
12:57:32.135514 IP 10.24.221.237.12345 > 10.0.0.2.12345: UDP, length 16
12:57:32.935592 IP 10.119.165.1.12345 > 10.0.0.2.12345: UDP, length 16
12:57:33.736731 IP 10.88.215.88.12345 > 10.0.0.2.12345: UDP, length 16
12:57:34.537218 IP 10.53.48.176.12345 > 10.0.0.2.12345: UDP, length 16
12:57:35.336382 IP 10.78.226.53.12345 > 10.0.0.2.12345: UDP, length 16
12:57:36.137785 IP 10.111.84.17.12345 > 10.0.0.2.12345: UDP, length 16
12:57:36.937975 IP 10.21.146.53.12345 > 10.0.0.2.12345: UDP, length 16
12:57:37.737651 IP 10.1.138.112.12345 > 10.0.0.2.12345: UDP, length 16
12:57:38.538185 IP 10.97.138.148.12345 > 10.0.0.2.12345: UDP, length 16
12:57:39.337210 IP 10.20.14.13.12345 > 10.0.0.2.12345: UDP, length 16
12:57:40.139268 IP 10.121.120.233.12345 > 10.0.0.2.12345: UDP, length 16
12:57:40.938889 IP 10.83.220.182.12345 > 10.0.0.2.12345: UDP, length 16
12:57:41.738879 IP 10.14.74.249.12345 > 10.0.0.2.12345: UDP, length 16
12:57:42.540214 IP 10.5.46.18.12345 > 10.0.0.2.12345: UDP, length 16
12:57:43.338310 IP 10.33.99.231.12345 > 10.0.0.2.12345: UDP, length 16
12:57:44.140214 IP 10.34.247.97.12345 > 10.0.0.2.12345: UDP, length 16
12:57:44.941501 IP 10.65.216.183.12345 > 10.0.0.2.12345: UDP, length 16
12:57:45.740714 IP 10.68.76.181.12345 > 10.0.0.2.12345: UDP, length 16
12:57:46.542061 IP 10.38.40.125.12345 > 10.0.0.2.12345: UDP, length 16
12:57:47.340970 IP 10.124.181.73.12345 > 10.0.0.2.12345: UDP, length 16
12:57:48.141065 IP 10.67.250.95.12345 > 10.0.0.2.12345: UDP, length 16
12:57:48.943097 IP 10.9.46.224.12345 > 10.0.0.2.12345: UDP, length 16
12:57:49.742273 IP 10.4.115.36.12345 > 10.0.0.2.12345: UDP, length 16
12:57:50.542971 IP 10.56.121.165.12345 > 10.0.0.2.12345: UDP, length 16
12:57:51.342471 IP 10.71.215.207.12345 > 10.0.0.2.12345: UDP, length 16
12:57:52.144605 IP 10.116.27.212.12345 > 10.0.0.2.12345: UDP, length 16
12:57:52.943633 IP 10.57.171.73.12345 > 10.0.0.2.12345: UDP, length 16
12:57:53.743697 IP 10.114.218.197.12345 > 10.0.0.2.12345: UDP, length 16
