10:26:35.694546 IP 10.0.0.1.12345 > 10.0.0.2.12345: UDP, length 16
10:26:36.694817 IP 10.0.0.1.12345 > 10.0.0.2.12345: UDP, length 16
10:26:37.695024 IP 10.0.0.1.12345 > 10.0.0.2.12345: UDP, length 16
10:26:38.695248 IP 10.0.0.1.12345 > 10.0.0.2.12345: UDP, length 16
10:26:39.695494 IP 10.0.0.1.12345 > 10.0.0.2.12345: UDP, length 16
10:26:40.695754 IP 10.0.0.1.12345 > 10.0.0.2.12345: UDP, length 16
10:26:41.695985 IP 10.0.0.1.12345 > 10.0.0.2.12345: UDP, length 16
10:26:42.696185 IP 10.0.0.1.12345 > 10.0.0.2.12345: UDP, length 16
10:26:43.696422 IP 10.0.0.1.12345 > 10.0.0.2.12345: UDP, length 16
10:26:44.696654 IP 10.0.0.1.12345 > 10.0.0.2.12345: UDP, length 16
10:26:45.696891 IP 10.0.0.1.12345 > 10.0.0.2.12345: UDP, length 16
10:26:46.697101 IP 10.0.0.1.12345 > 10.0.0.2.12345: UDP, length 16
10:26:47.697325 IP 10.0.0.1.12345 > 10.0.0.2.12345: UDP, length 16
10:26:48.697528 IP 10.0.0.1.12345 > 10.0.0.2.12345: UDP, length 16
10:26:49.697773 IP 10.0.0.1.12345 > 10.0.0.2.12345: UDP, length 16
10:26:50.697994 IP 10.0.0.1.12345 > 10.0.0.2.12345: UDP, length 16
10:26:51.698244 IP 10.0.0.1.12345 > 10.0.0.2.12345: UDP, length 16
10:26:52.698452 IP 10.0.0.1.12345 > 10.0.0.2.12345: UDP, length 16
10:26:53.698674 IP 10.0.0.1.12345 > 10.0.0.2.12345: UDP, length 16
10:26:54.698837 IP 10.0.0.1.12345 > 10.0.0.2.12345: UDP, length 16
10:26:55.699075 IP 10.0.0.1.12345 > 10.0.0.2.12345: UDP, length 16
10:26:56.699303 IP 10.0.0.1.12345 > 10.0.0.2.12345: UDP, length 16
10:26:57.699549 IP 10.0.0.1.12345 > 10.0.0.2.12345: UDP, length 16
10:26:58.699773 IP 10.0.0.1.12345 > 10.0.0.2.12345: UDP, length 16
10:26:59.700019 IP 10.0.0.1.12345 > 10.0.0.2.12345: UDP, length 16
10:27:00.700219 IP 10.0.0.1.12345 > 10.0.0.2.12345: UDP, length 16
10:27:01.700436 IP 10.0.0.1.12345 > 10.0.0.2.12345: UDP, length 16
10:27:02.700673 IP 10.0.0.1.12345 > 10.0.0.2.12345: UDP, length 16
10:27:03.700920 IP 10.0.0.1.12345 > 10.0.0.2.12345: UDP, length 16
10:27:04.701132 IP 10.0.0.1.12345 > 10.0.0.2.12345: UDP, length 16
10:27:05.701375 IP 10.0.0.1.12345 > 10.0.0.2.12345: UDP, length 16
10:27:06.701601 IP 10.0.0.1.12345 > 10.0.0.2.12345: UDP, length 16
10:27:07.701845 IP 10.0.0.1.12345 > 10.0.0.2.12345: UDP, length 16
10:27:08.702095 IP 10.0.0.1.12345 > 10.0.0.2.12345: UDP, length 16
10:27:09.702348 IP 10.0.0.1.12345 > 10.0.0.2.12345: UDP, length 16
10:27:10.702556 IP 10.0.0.1.12345 > 10.0.0.2.12345: UDP, length 16
10:27:11.702797 IP 10.0.0.1.12345 > 10.0.0.2.12345: UDP, length 16
10:27:12.702969 IP 10.0.0.1.12345 > 10.0.0.2.12345: UDP, length 16
10:27:13.703176 IP 10.0.0.1.12345 > 10.0.0.2.12345: UDP, length 16
10:27:14.703396 IP 10.0.0.1.12345 > 10.0.0.2.12345: UDP, length 16
10:27:15.703638 IP 10.0.0.1.12345 > 10.0.0.2.12345: UDP, length 16
10:27:16.703834 IP 10.0.0.1.12345 > 10.0.0.2.12345: UDP, length 16
10:27:17.704047 IP 10.0.0.1.12345 > 10.0.0.2.12345: UDP, length 16
10:27:18.704270 IP 10.0.0.1.12345 > 10.0.0.2.12345: UDP, length 16
10:27:19.704513 IP 10.0.0.1.12345 > 10.0.0.2.12345: UDP, length 16
10:27:20.704763 IP 10.0.0.1.12345 > 10.0.0.2.12345: UDP, length 16
10:27:21.705007 IP 10.0.0.1.12345 > 10.0.0.2.12345: UDP, length 16
10:27:22.705210 IP 10.0.0.1.12345 > 10.0.0.2.12345: UDP, length 16
10:27:23.705444 IP 10.0.0.1.12345 > 10.0.0.2.12345: UDP, length 16
10:27:24.705642 IP 10.0.0.1.12345 > 10.0.0.2.12345: UDP, length 16
10:27:25.705880 IP 10.0.0.1.12345 > 10.0.0.2.12345: UDP, length 16
10:27:26.706087 IP 10.0.0.1.12345 > 10.0.0.2.12345: UDP, length 16
10:27:27.706325 IP 10.0.0.1.12345 > 10.0.0.2.12345: UDP, length 16
10:27:28.706528 IP 10.0.0.1.12345 > 10.0.0.2.12345: UDP, length 16
10:27:29.706767 IP 10.0.0.1.12345 > 10.0.0.2.12345: UDP, length 16
10:27:30.706969 IP 10.0.0.1.12345 > 10.0.0.2.12345: UDP, length 16
10:27:31.707208 IP 10.0.0.1.12345 > 10.0.0.2.12345: UDP, length 16
10:27:32.707412 IP 10.0.0.1.12345 > 10.0.0.2.12345: UDP, length 16
10:27:33.707609 IP 10.0.0.1.12345 > 10.0.0.2.12345: UDP, length 16
10:27:34.707792 IP 10.0.0.1.12345 > 10.0.0.2.12345: UDP, length 16
10:27:35.707999 IP 10.0.0.1.12345 > 10.0.0.2.12345: UDP, length 16
10:27:36.708212 IP 10.0.0.1.12345 > 10.0.0.2.12345: UDP, length 16
10:27:37.708453 IP 10.0.0.1.12345 > 10.0.0.2.12345: UDP, length 16
10:27:38.708668 IP 10.0.0.1.12345 > 10.0.0.2.12345: UDP, length 16
10:27:39.708906 IP 10.0.0.1.12345 > 10.0.0.2.12345: UDP, length 16
10:27:40.709120 IP 10.0.0.1.12345 > 10.0.0.2.12345: UDP, length 16
10:27:41.709358 IP 10.0.0.1.12345 > 10.0.0.2.12345: UDP, length 16
10:27:42.709561 IP 10.0.0.1.12345 > 10.0.0.2.12345: UDP, length 16
10:27:43.709765 IP 10.0.0.1.12345 > 10.0.0.2.12345: UDP, length 16
10:27:44.709972 IP 10.0.0.1.12345 > 10.0.0.2.12345: UDP, length 16
10:27:45.710203 IP 10.0.0.1.12345 > 10.0.0.2.12345: UDP, length 16
10:27:46.710385 IP 10.0.0.1.12345 > 10.0.0.2.12345: UDP, length 16
10:27:47.710597 IP 10.0.0.1.12345 > 10.0.0.2.12345: UDP, length 16
10:27:48.710824 IP 10.0.0.1.12345 > 10.0.0.2.12345: UDP, length 16
10:27:49.711069 IP 10.0.0.1.12345 > 10.0.0.2.12345: UDP, length 16
10:27:50.711323 IP 10.0.0.1.12345 > 10.0.0.2.12345: UDP, length 16
10:27:51.711573 IP 10.0.0.1.12345 > 10.0.0.2.12345: UDP, length 16
10:27:52.711824 IP 10.0.0.1.12345 > 10.0.0.2.12345: UDP, length 16
10:27:53.712059 IP 10.0.0.1.12345 > 10.0.0.2.12345: UDP, length 16
10:27:54.712310 IP 10.0.0.1.12345 > 10.0.0.2.12345: UDP, length 16
10:27:55.712561 IP 10.0.0.1.12345 > 10.0.0.2.12345: UDP, length 16
10:27:56.712813 IP 10.0.0.1.12345 > 10.0.0.2.12345: UDP, length 16
10:27:57.713063 IP 10.0.0.1.12345 > 10.0.0.2.12345: UDP, length 16
10:27:58.713312 IP 10.0.0.1.12345 > 10.0.0.2.12345: UDP, length 16
10:27:59.713518 IP 10.0.0.1.12345 > 10.0.0.2.12345: UDP, length 16
10:28:00.713712 IP 10.0.0.1.12345 > 10.0.0.2.12345: UDP, length 16
10:28:01.713929 IP 10.0.0.1.12345 > 10.0.0.2.12345: UDP, length 16
10:28:02.714117 IP 10.0.0.1.12345 > 10.0.0.2.12345: UDP, length 16
10:28:03.714334 IP 10.0.0.1.12345 > 10.0.0.2.12345: UDP, length 16
10:28:04.714569 IP 10.0.0.1.12345 > 10.0.0.2.12345: UDP, length 16
10:28:05.714818 IP 10.0.0.1.12345 > 10.0.0.2.12345: UDP, length 16
10:28:06.715067 IP 10.0.0.1.12345 > 10.0.0.2.12345: UDP, length 16
10:28:07.715318 IP 10.0.0.1.12345 > 10.0.0.2.12345: UDP, length 16
10:28:08.715567 IP 10.0.0.1.12345 > 10.0.0.2.12345: UDP, length 16
10:28:09.715801 IP 10.0.0.1.12345 > 10.0.0.2.12345: UDP, length 16
10:28:10.715998 IP 10.0.0.1.12345 > 10.0.0.2.12345: UDP, length 16
10:28:11.716225 IP 10.0.0.1.12345 > 10.0.0.2.12345: UDP, length 16
10:28:12.716475 IP 10.0.0.1.12345 > 10.0.0.2.12345: UDP, length 16
10:28:13.716708 IP 10.0.0.1.12345 > 10.0.0.2.12345: UDP, length 16
10:28:14.716950 IP 10.0.0.1.12345 > 10.0.0.2.12345: UDP, length 16
10:28:15.717175 IP 10.0.0.1.12345 > 10.0.0.2.12345: UDP, length 16
10:28:16.717416 IP 10.0.0.1.12345 > 10.0.0.2.12345: UDP, length 16
10:28:17.717649 IP 10.0.0.1.12345 > 10.0.0.2.12345: UDP, length 16
10:28:18.717894 IP 10.0.0.1.12345 > 10.0.0.2.12345: UDP, length 16
10:28:19.718168 IP 10.0.0.1.12345 > 10.0.0.2.12345: UDP, length 16
10:28:20.718423 IP 10.0.0.1.12345 > 10.0.0.2.12345: UDP, length 16
10:28:21.718618 IP 10.0.0.1.12345 > 10.0.0.2.12345: UDP, length 16
10:28:22.718855 IP 10.0.0.1.12345 > 10.0.0.2.12345: UDP, length 16
10:28:23.719104 IP 10.0.0.1.12345 > 10.0.0.2.12345: UDP, length 16
10:28:24.719325 IP 10.0.0.1.12345 > 10.0.0.2.12345: UDP, length 16
10:28:25.719556 IP 10.0.0.1.12345 > 10.0.0.2.12345: UDP, length 16
10:28:26.719807 IP 10.0.0.1.12345 > 10.0.0.2.12345: UDP, length 16
10:28:27.720018 IP 10.0.0.1.12345 > 10.0.0.2.12345: UDP, length 16
10:28:28.720264 IP 10.0.0.1.12345 > 10.0.0.2.12345: UDP, length 16
10:28:29.720498 IP 10.0.0.1.12345 > 10.0.0.2.12345: UDP, length 16
10:28:30.720746 IP 10.0.0.1.12345 > 10.0.0.2.12345: UDP, length 16
10:28:31.720958 IP 10.0.0.1.12345 > 10.0.0.2.12345: UDP, length 16
10:28:32.721191 IP 10.0.0.1.12345 > 10.0.0.2.12345: UDP, length 16
10:28:33.721416 IP 10.0.0.1.12345 > 10.0.0.2.12345: UDP, length 16
10:28:34.721620 IP 10.0.0.1.12345 > 10.0.0.2.12345: UDP, length 16
10:28:35.721840 IP 10.0.0.1.12345 > 10.0.0.2.12345: UDP, length 16
10:28:36.722083 IP 10.0.0.1.12345 > 10.0.0.2.12345: UDP, length 16
10:28:37.722308 IP 10.0.0.1.12345 > 10.0.0.2.12345: UDP, length 16
10:28:38.722554 IP 10.0.0.1.12345 > 10.0.0.2.12345: UDP, length 16
10:28:39.722763 IP 10.0.0.1.12345 > 10.0.0.2.12345: UDP, length 16
10:28:40.723006 IP 10.0.0.1.12345 > 10.0.0.2.12345: UDP, length 16
10:28:41.723235 IP 10.0.0.1.12345 > 10.0.0.2.12345: UDP, length 16
10:28:42.723479 IP 10.0.0.1.12345 > 10.0.0.2.12345: UDP, length 16
10:28:43.723681 IP 10.0.0.1.12345 > 10.0.0.2.12345: UDP, length 16
10:28:44.723920 IP 10.0.0.1.12345 > 10.0.0.2.12345: UDP, length 16
10:28:45.724162 IP 10.0.0.1.12345 > 10.0.0.2.12345: UDP, length 16
10:28:46.724379 IP 10.0.0.1.12345 > 10.0.0.2.12345: UDP, length 16
10:28:47.724605 IP 10.0.0.1.12345 > 10.0.0.2.12345: UDP, length 16
10:28:48.724851 IP 10.0.0.1.12345 > 10.0.0.2.12345: UDP, length 16
10:28:49.725062 IP 10.0.0.1.12345 > 10.0.0.2.12345: UDP, length 16
10:28:50.725306 IP 10.0.0.1.12345 > 10.0.0.2.12345: UDP, length 16
10:28:51.725523 IP 10.0.0.1.12345 > 10.0.0.2.12345: UDP, length 16
10:28:52.725767 IP 10.0.0.1.12345 > 10.0.0.2.12345: UDP, length 16
10:28:53.725997 IP 10.0.0.1.12345 > 10.0.0.2.12345: UDP, length 16
10:28:54.726247 IP 10.0.0.1.12345 > 10.0.0.2.12345: UDP, length 16
10:28:55.726458 IP 10.0.0.1.12345 > 10.0.0.2.12345: UDP, length 16
10:28:56.726697 IP 10.0.0.1.12345 > 10.0.0.2.12345: UDP, length 16
10:28:57.726924 IP 10.0.0.1.12345 > 10.0.0.2.12345: UDP, length 16
10:28:58.727131 IP 10.0.0.1.12345 > 10.0.0.2.12345: UDP, length 16
10:28:59.727353 IP 10.0.0.1.12345 > 10.0.0.2.12345: UDP, length 16
10:29:00.727551 IP 10.0.0.1.12345 > 10.0.0.2.12345: UDP, length 16
10:29:01.727764 IP 10.0.0.1.12345 > 10.0.0.2.12345: UDP, length 16
10:29:02.728004 IP 10.0.0.1.12345 > 10.0.0.2.12345: UDP, length 16
10:29:03.728226 IP 10.0.0.1.12345 > 10.0.0.2.12345: UDP, length 16
10:29:04.728430 IP 10.0.0.1.12345 > 10.0.0.2.12345: UDP, length 16
10:29:05.728654 IP 10.0.0.1.12345 > 10.0.0.2.12345: UDP, length 16
10:29:06.728902 IP 10.0.0.1.12345 > 10.0.0.2.12345: UDP, length 16
10:29:07.729142 IP 10.0.0.1.12345 > 10.0.0.2.12345: UDP, length 16
10:29:08.729388 IP 10.0.0.1.12345 > 10.0.0.2.12345: UDP, length 16
10:29:09.729594 IP 10.0.0.1.12345 > 10.0.0.2.12345: UDP, length 16
10:29:10.729780 IP 10.0.0.1.12345 > 10.0.0.2.12345: UDP, length 16
10:29:11.729972 IP 10.0.0.1.12345 > 10.0.0.2.12345: UDP, length 16
10:29:12.730215 IP 10.0.0.1.12345 > 10.0.0.2.12345: UDP, length 16
10:29:13.730450 IP 10.0.0.1.12345 > 10.0.0.2.12345: UDP, length 16
10:29:14.730686 IP 10.0.0.1.12345 > 10.0.0.2.12345: UDP, length 16
10:29:15.730884 IP 10.0.0.1.12345 > 10.0.0.2.12345: UDP, length 16
10:29:16.731121 IP 10.0.0.1.12345 > 10.0.0.2.12345: UDP, length 16
10:29:17.731340 IP 10.0.0.1.12345 > 10.0.0.2.12345: UDP, length 16
10:29:18.731584 IP 10.0.0.1.12345 > 10.0.0.2.12345: UDP, length 16
10:29:19.731801 IP 10.0.0.1.12345 > 10.0.0.2.12345: UDP, length 16
10:29:20.731977 IP 10.0.0.1.12345 > 10.0.0.2.12345: UDP, length 16
10:29:21.732161 IP 10.0.0.1.12345 > 10.0.0.2.12345: UDP, length 16
10:29:22.732394 IP 10.0.0.1.12345 > 10.0.0.2.12345: UDP, length 16
10:29:23.732601 IP 10.0.0.1.12345 > 10.0.0.2.12345: UDP, length 16
10:29:24.732838 IP 10.0.0.1.12345 > 10.0.0.2.12345: UDP, length 16
10:29:25.733049 IP 10.0.0.1.12345 > 10.0.0.2.12345: UDP, length 16
10:29:26.733287 IP 10.0.0.1.12345 > 10.0.0.2.12345: UDP, length 16
10:29:27.733497 IP 10.0.0.1.12345 > 10.0.0.2.12345: UDP, length 16
10:29:28.733727 IP 10.0.0.1.12345 > 10.0.0.2.12345: UDP, length 16
10:29:29.733971 IP 10.0.0.1.12345 > 10.0.0.2.12345: UDP, length 16
10:29:30.734219 IP 10.0.0.1.12345 > 10.0.0.2.12345: UDP, length 16
10:29:31.734430 IP 10.0.0.1.12345 > 10.0.0.2.12345: UDP, length 16
10:29:32.734645 IP 10.0.0.1.12345 > 10.0.0.2.12345: UDP, length 16
10:29:33.734824 IP 10.0.0.1.12345 > 10.0.0.2.12345: UDP, length 16
10:29:34.735061 IP 10.0.0.1.12345 > 10.0.0.2.12345: UDP, length 16
10:29:35.735246 IP 10.0.0.1.12345 > 10.0.0.2.12345: UDP, length 16
10:29:36.735484 IP 10.0.0.1.12345 > 10.0.0.2.12345: UDP, length 16
10:29:37.735681 IP 10.0.0.1.12345 > 10.0.0.2.12345: UDP, length 16
10:29:38.735959 IP 10.0.0.1.12345 > 10.0.0.2.12345: UDP, length 16
10:29:39.736146 IP 10.0.0.1.12345 > 10.0.0.2.12345: UDP, length 16
10:29:40.736366 IP 10.0.0.1.12345 > 10.0.0.2.12345: UDP, length 16
10:29:41.736548 IP 10.0.0.1.12345 > 10.0.0.2.12345: UDP, length 16
10:29:42.736792 IP 10.0.0.1.12345 > 10.0.0.2.12345: UDP, length 16
10:29:43.736978 IP 10.0.0.1.12345 > 10.0.0.2.12345: UDP, length 16
10:29:44.737209 IP 10.0.0.1.12345 > 10.0.0.2.12345: UDP, length 16
10:29:45.737393 IP 10.0.0.1.12345 > 10.0.0.2.12345: UDP, length 16
10:29:46.737631 IP 10.0.0.1.12345 > 10.0.0.2.12345: UDP, length 16
10:29:47.737839 IP 10.0.0.1.12345 > 10.0.0.2.12345: UDP, length 16
10:29:48.738083 IP 10.0.0.1.12345 > 10.0.0.2.12345: UDP, length 16
10:29:49.738268 IP 10.0.0.1.12345 > 10.0.0.2.12345: UDP, length 16
10:29:50.738507 IP 10.0.0.1.12345 > 10.0.0.2.12345: UDP, length 16
10:29:51.738641 IP 10.0.0.1.12345 > 10.0.0.2.12345: UDP, length 16
10:29:52.738860 IP 10.0.0.1.12345 > 10.0.0.2.12345: UDP, length 16
10:29:53.739043 IP 10.0.0.1.12345 > 10.0.0.2.12345: UDP, length 16
10:29:54.739281 IP 10.0.0.1.12345 > 10.0.0.2.12345: UDP, length 16
10:29:55.739471 IP 10.0.0.1.12345 > 10.0.0.2.12345: UDP, length 16
10:29:56.739795 IP 10.0.0.1.12345 > 10.0.0.2.12345: UDP, length 16
10:29:57.740017 IP 10.0.0.1.12345 > 10.0.0.2.12345: UDP, length 16
10:29:58.740239 IP 10.0.0.1.12345 > 10.0.0.2.12345: UDP, length 16
10:29:59.740484 IP 10.0.0.1.12345 > 10.0.0.2.12345: UDP, length 16
10:30:00.740689 IP 10.0.0.1.12345 > 10.0.0.2.12345: UDP, length 16
10:30:01.740932 IP 10.0.0.1.12345 > 10.0.0.2.12345: UDP, length 16
10:30:02.741188 IP 10.0.0.1.12345 > 10.0.0.2.12345: UDP, length 16
10:30:03.741390 IP 10.0.0.1.12345 > 10.0.0.2.12345: UDP, length 16
10:30:04.741619 IP 10.0.0.1.12345 > 10.0.0.2.12345: UDP, length 16
10:30:05.741869 IP 10.0.0.1.12345 > 10.0.0.2.12345: UDP, length 16
10:30:06.742113 IP 10.0.0.1.12345 > 10.0.0.2.12345: UDP, length 16
10:30:07.742355 IP 10.0.0.1.12345 > 10.0.0.2.12345: UDP, length 16
10:30:08.742599 IP 10.0.0.1.12345 > 10.0.0.2.12345: UDP, length 16
10:30:09.742801 IP 10.0.0.1.12345 > 10.0.0.2.12345: UDP, length 16
10:30:10.743012 IP 10.0.0.1.12345 > 10.0.0.2.12345: UDP, length 16
10:30:11.743256 IP 10.0.0.1.12345 > 10.0.0.2.12345: UDP, length 16
10:30:12.743504 IP 10.0.0.1.12345 > 10.0.0.2.12345: UDP, length 16
10:30:13.743839 IP 10.0.0.1.12345 > 10.0.0.2.12345: UDP, length 16
10:30:14.744094 IP 10.0.0.1.12345 > 10.0.0.2.12345: UDP, length 16
10:30:15.744351 IP 10.0.0.1.12345 > 10.0.0.2.12345: UDP, length 16
10:30:16.744587 IP 10.0.0.1.12345 > 10.0.0.2.12345: UDP, length 16
10:30:17.744838 IP 10.0.0.1.12345 > 10.0.0.2.12345: UDP, length 16
10:30:18.745034 IP 10.0.0.1.12345 > 10.0.0.2.12345: UDP, length 16
10:30:19.745249 IP 10.0.0.1.12345 > 10.0.0.2.12345: UDP, length 16
10:30:20.745492 IP 10.0.0.1.12345 > 10.0.0.2.12345: UDP, length 16
10:30:21.745742 IP 10.0.0.1.12345 > 10.0.0.2.12345: UDP, length 16
10:30:22.745998 IP 10.0.0.1.12345 > 10.0.0.2.12345: UDP, length 16
10:30:23.746250 IP 10.0.0.1.12345 > 10.0.0.2.12345: UDP, length 16
10:30:24.746481 IP 10.0.0.1.12345 > 10.0.0.2.12345: UDP, length 16
10:30:25.746733 IP 10.0.0.1.12345 > 10.0.0.2.12345: UDP, length 16
10:30:26.746982 IP 10.0.0.1.12345 > 10.0.0.2.12345: UDP, length 16
10:30:27.747241 IP 10.0.0.1.12345 > 10.0.0.2.12345: UDP, length 16
10:30:28.747488 IP 10.0.0.1.12345 > 10.0.0.2.12345: UDP, length 16
10:30:29.747838 IP 10.0.0.1.12345 > 10.0.0.2.12345: UDP, length 16
10:30:30.748099 IP 10.0.0.1.12345 > 10.0.0.2.12345: UDP, length 16
10:30:31.748333 IP 10.0.0.1.12345 > 10.0.0.2.12345: UDP, length 16
10:30:32.748583 IP 10.0.0.1.12345 > 10.0.0.2.12345: UDP, length 16
10:30:33.748836 IP 10.0.0.1.12345 > 10.0.0.2.12345: UDP, length 16
10:30:34.749090 IP 10.0.0.1.12345 > 10.0.0.2.12345: UDP, length 16
10:30:35.749342 IP 10.0.0.1.12345 > 10.0.0.2.12345: UDP, length 16
10:30:36.749589 IP 10.0.0.1.12345 > 10.0.0.2.12345: UDP, length 16
10:30:37.749843 IP 10.0.0.1.12345 > 10.0.0.2.12345: UDP, length 16
10:30:38.750096 IP 10.0.0.1.12345 > 10.0.0.2.12345: UDP, length 16
10:30:39.750345 IP 10.0.0.1.12345 > 10.0.0.2.12345: UDP, length 16
10:30:40.750548 IP 10.0.0.1.12345 > 10.0.0.2.12345: UDP, length 16
10:30:41.750792 IP 10.0.0.1.12345 > 10.0.0.2.12345: UDP, length 16
10:30:42.751013 IP 10.0.0.1.12345 > 10.0.0.2.12345: UDP, length 16
10:30:43.751259 IP 10.0.0.1.12345 > 10.0.0.2.12345: UDP, length 16
10:30:44.751495 IP 10.0.0.1.12345 > 10.0.0.2.12345: UDP, length 16
10:30:45.751783 IP 10.0.0.1.12345 > 10.0.0.2.12345: UDP, length 16
10:30:46.752031 IP 10.0.0.1.12345 > 10.0.0.2.12345: UDP, length 16
10:30:47.752287 IP 10.0.0.1.12345 > 10.0.0.2.12345: UDP, length 16
10:30:48.752492 IP 10.0.0.1.12345 > 10.0.0.2.12345: UDP, length 16
10:30:49.752733 IP 10.0.0.1.12345 > 10.0.0.2.12345: UDP, length 16
10:30:50.752921 IP 10.0.0.1.12345 > 10.0.0.2.12345: UDP, length 16
10:30:51.753139 IP 10.0.0.1.12345 > 10.0.0.2.12345: UDP, length 16
10:30:52.753338 IP 10.0.0.1.12345 > 10.0.0.2.12345: UDP, length 16
10:30:53.753577 IP 10.0.0.1.12345 > 10.0.0.2.12345: UDP, length 16
10:30:54.753803 IP 10.0.0.1.12345 > 10.0.0.2.12345: UDP, length 16
10:30:55.754053 IP 10.0.0.1.12345 > 10.0.0.2.12345: UDP, length 16
10:30:56.754288 IP 10.0.0.1.12345 > 10.0.0.2.12345: UDP, length 16
10:30:57.754537 IP 10.0.0.1.12345 > 10.0.0.2.12345: UDP, length 16
10:30:58.754765 IP 10.0.0.1.12345 > 10.0.0.2.12345: UDP, length 16
10:30:59.754968 IP 10.0.0.1.12345 > 10.0.0.2.12345: UDP, length 16
10:31:00.755171 IP 10.0.0.1.12345 > 10.0.0.2.12345: UDP, length 16
10:31:01.755412 IP 10.0.0.1.12345 > 10.0.0.2.12345: UDP, length 16
10:31:02.755662 IP 10.0.0.1.12345 > 10.0.0.2.12345: UDP, length 16
10:31:03.755884 IP 10.0.0.1.12345 > 10.0.0.2.12345: UDP, length 16
10:31:04.756076 IP 10.0.0.1.12345 > 10.0.0.2.12345: UDP, length 16
10:31:05.756319 IP 10.0.0.1.12345 > 10.0.0.2.12345: UDP, length 16
10:31:06.756541 IP 10.0.0.1.12345 > 10.0.0.2.12345: UDP, length 16
10:31:07.756790 IP 10.0.0.1.12345 > 10.0.0.2.12345: UDP, length 16
10:31:08.757031 IP 10.0.0.1.12345 > 10.0.0.2.12345: UDP, length 16
10:31:09.757281 IP 10.0.0.1.12345 > 10.0.0.2.12345: UDP, length 16
10:31:10.757481 IP 10.0.0.1.12345 > 10.0.0.2.12345: UDP, length 16
10:31:11.757724 IP 10.0.0.1.12345 > 10.0.0.2.12345: UDP, length 16
10:31:12.757942 IP 10.0.0.1.12345 > 10.0.0.2.12345: UDP, length 16
10:31:13.758188 IP 10.0.0.1.12345 > 10.0.0.2.12345: UDP, length 16
10:31:14.758420 IP 10.0.0.1.12345 > 10.0.0.2.12345: UDP, length 16
10:31:15.758664 IP 10.0.0.1.12345 > 10.0.0.2.12345: UDP, length 16
10:31:16.758907 IP 10.0.0.1.12345 > 10.0.0.2.12345: UDP, length 16
10:31:17.759157 IP 10.0.0.1.12345 > 10.0.0.2.12345: UDP, length 16
10:31:18.759386 IP 10.0.0.1.12345 > 10.0.0.2.12345: UDP, length 16
10:31:19.759626 IP 10.0.0.1.12345 > 10.0.0.2.12345: UDP, length 16
10:31:20.759845 IP 10.0.0.1.12345 > 10.0.0.2.12345: UDP, length 16
10:31:21.760091 IP 10.0.0.1.12345 > 10.0.0.2.12345: UDP, length 16
10:31:22.760314 IP 10.0.0.1.12345 > 10.0.0.2.12345: UDP, length 16
10:31:23.760561 IP 10.0.0.1.12345 > 10.0.0.2.12345: UDP, length 16
10:31:24.760772 IP 10.0.0.1.12345 > 10.0.0.2.12345: UDP, length 16
10:31:25.761016 IP 10.0.0.1.12345 > 10.0.0.2.12345: UDP, length 16
10:31:26.761246 IP 10.0.0.1.12345 > 10.0.0.2.12345: UDP, length 16
10:31:27.761467 IP 10.0.0.1.12345 > 10.0.0.2.12345: UDP, length 16
10:31:28.761674 IP 10.0.0.1.12345 > 10.0.0.2.12345: UDP, length 16
10:31:29.761918 IP 10.0.0.1.12345 > 10.0.0.2.12345: UDP, length 16
10:31:30.762137 IP 10.0.0.1.12345 > 10.0.0.2.12345: UDP, length 16
10:31:31.762383 IP 10.0.0.1.12345 > 10.0.0.2.12345: UDP, length 16
10:31:32.762594 IP 10.0.0.1.12345 > 10.0.0.2.12345: UDP, length 16
10:31:33.762817 IP 10.0.0.1.12345 > 10.0.0.2.12345: UDP, length 16
10:31:34.763038 IP 10.0.0.1.12345 > 10.0.0.2.12345: UDP, length 16

