10:26:35.694898 IP 10.0.0.1.12345 > 10.0.0.2.12345: UDP, length 16
10:26:36.694831 IP 10.0.0.1.12345 > 10.0.0.2.12345: UDP, length 16
10:26:37.695036 IP 10.0.0.1.12345 > 10.0.0.2.12345: UDP, length 16
10:26:38.695263 IP 10.0.0.1.12345 > 10.0.0.2.12345: UDP, length 16
10:26:39.695512 IP 10.0.0.1.12345 > 10.0.0.2.12345: UDP, length 16
10:26:40.695764 IP 10.0.0.1.12345 > 10.0.0.2.12345: UDP, length 16
10:26:41.696001 IP 10.0.0.1.12345 > 10.0.0.2.12345: UDP, length 16
10:26:42.696197 IP 10.0.0.1.12345 > 10.0.0.2.12345: UDP, length 16
10:26:43.696441 IP 10.0.0.1.12345 > 10.0.0.2.12345: UDP, length 16
10:26:44.696669 IP 10.0.0.1.12345 > 10.0.0.2.12345: UDP, length 16
10:26:45.696907 IP 10.0.0.1.12345 > 10.0.0.2.12345: UDP, length 16
10:26:46.697114 IP 10.0.0.1.12345 > 10.0.0.2.12345: UDP, length 16
10:26:47.697341 IP 10.0.0.1.12345 > 10.0.0.2.12345: UDP, length 16
10:26:48.697540 IP 10.0.0.1.12345 > 10.0.0.2.12345: UDP, length 16
10:26:49.697791 IP 10.0.0.1.12345 > 10.0.0.2.12345: UDP, length 16
10:26:50.698008 IP 10.0.0.1.12345 > 10.0.0.2.12345: UDP, length 16
10:26:51.698262 IP 10.0.0.1.12345 > 10.0.0.2.12345: UDP, length 16
10:26:52.698464 IP 10.0.0.1.12345 > 10.0.0.2.12345: UDP, length 16
10:26:53.698690 IP 10.0.0.1.12345 > 10.0.0.2.12345: UDP, length 16
10:26:54.698851 IP 10.0.0.1.12345 > 10.0.0.2.12345: UDP, length 16
10:26:55.699094 IP 10.0.0.1.12345 > 10.0.0.2.12345: UDP, length 16
10:26:56.699318 IP 10.0.0.1.12345 > 10.0.0.2.12345: UDP, length 16
10:26:57.699570 IP 10.0.0.1.12345 > 10.0.0.2.12345: UDP, length 16
10:26:58.699788 IP 10.0.0.1.12345 > 10.0.0.2.12345: UDP, length 16
10:26:59.700037 IP 10.0.0.1.12345 > 10.0.0.2.12345: UDP, length 16
10:27:00.700230 IP 10.0.0.1.12345 > 10.0.0.2.12345: UDP, length 16
10:27:01.700451 IP 10.0.0.1.12345 > 10.0.0.2.12345: UDP, length 16
10:27:02.700690 IP 10.0.0.1.12345 > 10.0.0.2.12345: UDP, length 16
10:27:03.700941 IP 10.0.0.1.12345 > 10.0.0.2.12345: UDP, length 16
10:27:04.701146 IP 10.0.0.1.12345 > 10.0.0.2.12345: UDP, length 16
10:27:05.701393 IP 10.0.0.1.12345 > 10.0.0.2.12345: UDP, length 16
10:27:06.701616 IP 10.0.0.1.12345 > 10.0.0.2.12345: UDP, length 16
10:27:07.701866 IP 10.0.0.1.12345 > 10.0.0.2.12345: UDP, length 16
10:27:08.702114 IP 10.0.0.1.12345 > 10.0.0.2.12345: UDP, length 16
10:27:09.702368 IP 10.0.0.1.12345 > 10.0.0.2.12345: UDP, length 16
10:27:10.702569 IP 10.0.0.1.12345 > 10.0.0.2.12345: UDP, length 16
10:27:11.702815 IP 10.0.0.1.12345 > 10.0.0.2.12345: UDP, length 16
10:27:12.702982 IP 10.0.0.1.12345 > 10.0.0.2.12345: UDP, length 16
10:27:13.703197 IP 10.0.0.1.12345 > 10.0.0.2.12345: UDP, length 16
10:27:14.703410 IP 10.0.0.1.12345 > 10.0.0.2.12345: UDP, length 16
10:27:15.703659 IP 10.0.0.1.12345 > 10.0.0.2.12345: UDP, length 16
10:27:16.703846 IP 10.0.0.1.12345 > 10.0.0.2.12345: UDP, length 16
10:27:17.704063 IP 10.0.0.1.12345 > 10.0.0.2.12345: UDP, length 16
10:27:18.704284 IP 10.0.0.1.12345 > 10.0.0.2.12345: UDP, length 16
10:27:19.704532 IP 10.0.0.1.12345 > 10.0.0.2.12345: UDP, length 16
10:27:20.704779 IP 10.0.0.1.12345 > 10.0.0.2.12345: UDP, length 16
10:27:21.705026 IP 10.0.0.1.12345 > 10.0.0.2.12345: UDP, length 16
10:27:22.705222 IP 10.0.0.1.12345 > 10.0.0.2.12345: UDP, length 16
10:27:23.705460 IP 10.0.0.1.12345 > 10.0.0.2.12345: UDP, length 16
10:27:24.705653 IP 10.0.0.1.12345 > 10.0.0.2.12345: UDP, length 16
10:27:25.705899 IP 10.0.0.1.12345 > 10.0.0.2.12345: UDP, length 16
10:27:26.706098 IP 10.0.0.1.12345 > 10.0.0.2.12345: UDP, length 16
10:27:27.706344 IP 10.0.0.1.12345 > 10.0.0.2.12345: UDP, length 16
10:27:28.706540 IP 10.0.0.1.12345 > 10.0.0.2.12345: UDP, length 16
10:27:29.706786 IP 10.0.0.1.12345 > 10.0.0.2.12345: UDP, length 16
10:27:30.706980 IP 10.0.0.1.12345 > 10.0.0.2.12345: UDP, length 16
10:27:31.707226 IP 10.0.0.1.12345 > 10.0.0.2.12345: UDP, length 16
10:27:32.707423 IP 10.0.0.1.12345 > 10.0.0.2.12345: UDP, length 16
10:27:33.707621 IP 10.0.0.1.12345 > 10.0.0.2.12345: UDP, length 16
10:27:34.707802 IP 10.0.0.1.12345 > 10.0.0.2.12345: UDP, length 16
10:27:35.708017 IP 10.0.0.1.12345 > 10.0.0.2.12345: UDP, length 16
10:27:36.708226 IP 10.0.0.1.12345 > 10.0.0.2.12345: UDP, length 16
10:27:37.708472 IP 10.0.0.1.12345 > 10.0.0.2.12345: UDP, length 16
10:27:38.708681 IP 10.0.0.1.12345 > 10.0.0.2.12345: UDP, length 16
10:27:39.708926 IP 10.0.0.1.12345 > 10.0.0.2.12345: UDP, length 16
10:27:40.709132 IP 10.0.0.1.12345 > 10.0.0.2.12345: UDP, length 16
10:27:41.709376 IP 10.0.0.1.12345 > 10.0.0.2.12345: UDP, length 16
10:27:42.709573 IP 10.0.0.1.12345 > 10.0.0.2.12345: UDP, length 16
10:27:43.709778 IP 10.0.0.1.12345 > 10.0.0.2.12345: UDP, length 16
10:27:44.709985 IP 10.0.0.1.12345 > 10.0.0.2.12345: UDP, length 16
10:27:45.710220 IP 10.0.0.1.12345 > 10.0.0.2.12345: UDP, length 16
10:27:46.710395 IP 10.0.0.1.12345 > 10.0.0.2.12345: UDP, length 16
10:27:47.710612 IP 10.0.0.1.12345 > 10.0.0.2.12345: UDP, length 16
10:27:48.710839 IP 10.0.0.1.12345 > 10.0.0.2.12345: UDP, length 16
10:27:49.711089 IP 10.0.0.1.12345 > 10.0.0.2.12345: UDP, length 16
10:27:50.711344 IP 10.0.0.1.12345 > 10.0.0.2.12345: UDP, length 16
10:27:51.711591 IP 10.0.0.1.12345 > 10.0.0.2.12345: UDP, length 16
10:27:52.711845 IP 10.0.0.1.12345 > 10.0.0.2.12345: UDP, length 16
10:27:53.712079 IP 10.0.0.1.12345 > 10.0.0.2.12345: UDP, length 16
10:27:54.712330 IP 10.0.0.1.12345 > 10.0.0.2.12345: UDP, length 16
10:27:55.712581 IP 10.0.0.1.12345 > 10.0.0.2.12345: UDP, length 16
10:27:56.712831 IP 10.0.0.1.12345 > 10.0.0.2.12345: UDP, length 16
10:27:57.713081 IP 10.0.0.1.12345 > 10.0.0.2.12345: UDP, length 16
10:27:58.713330 IP 10.0.0.1.12345 > 10.0.0.2.12345: UDP, length 16
10:27:59.713537 IP 10.0.0.1.12345 > 10.0.0.2.12345: UDP, length 16
10:28:00.713723 IP 10.0.0.1.12345 > 10.0.0.2.12345: UDP, length 16
10:28:01.713945 IP 10.0.0.1.12345 > 10.0.0.2.12345: UDP, length 16
10:28:02.714128 IP 10.0.0.1.12345 > 10.0.0.2.12345: UDP, length 16
10:28:03.714349 IP 10.0.0.1.12345 > 10.0.0.2.12345: UDP, length 16
10:28:04.714586 IP 10.0.0.1.12345 > 10.0.0.2.12345: UDP, length 16
10:28:05.714838 IP 10.0.0.1.12345 > 10.0.0.2.12345: UDP, length 16
10:28:06.715087 IP 10.0.0.1.12345 > 10.0.0.2.12345: UDP, length 16
10:28:07.715336 IP 10.0.0.1.12345 > 10.0.0.2.12345: UDP, length 16
10:28:08.715585 IP 10.0.0.1.12345 > 10.0.0.2.12345: UDP, length 16
10:28:09.715818 IP 10.0.0.1.12345 > 10.0.0.2.12345: UDP, length 16
10:28:10.716009 IP 10.0.0.1.12345 > 10.0.0.2.12345: UDP, length 16
10:28:11.716243 IP 10.0.0.1.12345 > 10.0.0.2.12345: UDP, length 16
10:28:12.716495 IP 10.0.0.1.12345 > 10.0.0.2.12345: UDP, length 16
10:28:13.716723 IP 10.0.0.1.12345 > 10.0.0.2.12345: UDP, length 16
10:28:14.716969 IP 10.0.0.1.12345 > 10.0.0.2.12345: UDP, length 16
10:28:15.717189 IP 10.0.0.1.12345 > 10.0.0.2.12345: UDP, length 16
10:28:16.717434 IP 10.0.0.1.12345 > 10.0.0.2.12345: UDP, length 16
10:28:17.717664 IP 10.0.0.1.12345 > 10.0.0.2.12345: UDP, length 16
10:28:18.717913 IP 10.0.0.1.12345 > 10.0.0.2.12345: UDP, length 16
10:28:19.718188 IP 10.0.0.1.12345 > 10.0.0.2.12345: UDP, length 16
10:28:20.718443 IP 10.0.0.1.12345 > 10.0.0.2.12345: UDP, length 16
10:28:21.718629 IP 10.0.0.1.12345 > 10.0.0.2.12345: UDP, length 16
10:28:22.718876 IP 10.0.0.1.12345 > 10.0.0.2.12345: UDP, length 16
10:28:23.719126 IP 10.0.0.1.12345 > 10.0.0.2.12345: UDP, length 16
10:28:24.719346 IP 10.0.0.1.12345 > 10.0.0.2.12345: UDP, length 16
10:28:25.719572 IP 10.0.0.1.12345 > 10.0.0.2.12345: UDP, length 16
10:28:26.719828 IP 10.0.0.1.12345 > 10.0.0.2.12345: UDP, length 16
10:28:27.720033 IP 10.0.0.1.12345 > 10.0.0.2.12345: UDP, length 16
10:28:28.720285 IP 10.0.0.1.12345 > 10.0.0.2.12345: UDP, length 16
10:28:29.720515 IP 10.0.0.1.12345 > 10.0.0.2.12345: UDP, length 16
10:28:30.720765 IP 10.0.0.1.12345 > 10.0.0.2.12345: UDP, length 16
10:28:31.720971 IP 10.0.0.1.12345 > 10.0.0.2.12345: UDP, length 16
10:28:32.721207 IP 10.0.0.1.12345 > 10.0.0.2.12345: UDP, length 16
10:28:33.721431 IP 10.0.0.1.12345 > 10.0.0.2.12345: UDP, length 16
10:28:34.721632 IP 10.0.0.1.12345 > 10.0.0.2.12345: UDP, length 16
10:28:35.721855 IP 10.0.0.1.12345 > 10.0.0.2.12345: UDP, length 16
10:28:36.722102 IP 10.0.0.1.12345 > 10.0.0.2.12345: UDP, length 16
10:28:37.722322 IP 10.0.0.1.12345 > 10.0.0.2.12345: UDP, length 16
10:28:38.722573 IP 10.0.0.1.12345 > 10.0.0.2.12345: UDP, length 16
10:28:39.722776 IP 10.0.0.1.12345 > 10.0.0.2.12345: UDP, length 16
10:28:40.723025 IP 10.0.0.1.12345 > 10.0.0.2.12345: UDP, length 16
10:28:41.723250 IP 10.0.0.1.12345 > 10.0.0.2.12345: UDP, length 16
10:28:42.723498 IP 10.0.0.1.12345 > 10.0.0.2.12345: UDP, length 16
10:28:43.723694 IP 10.0.0.1.12345 > 10.0.0.2.12345: UDP, length 16
10:28:44.723939 IP 10.0.0.1.12345 > 10.0.0.2.12345: UDP, length 16
10:28:45.724178 IP 10.0.0.1.12345 > 10.0.0.2.12345: UDP, length 16
10:28:46.724398 IP 10.0.0.1.12345 > 10.0.0.2.12345: UDP, length 16
10:28:47.724619 IP 10.0.0.1.12345 > 10.0.0.2.12345: UDP, length 16
10:28:48.724868 IP 10.0.0.1.12345 > 10.0.0.2.12345: UDP, length 16
10:28:49.725075 IP 10.0.0.1.12345 > 10.0.0.2.12345: UDP, length 16
10:28:50.725324 IP 10.0.0.1.12345 > 10.0.0.2.12345: UDP, length 16
10:28:51.725536 IP 10.0.0.1.12345 > 10.0.0.2.12345: UDP, length 16
10:28:52.725785 IP 10.0.0.1.12345 > 10.0.0.2.12345: UDP, length 16
10:28:53.726012 IP 10.0.0.1.12345 > 10.0.0.2.12345: UDP, length 16
10:28:54.726266 IP 10.0.0.1.12345 > 10.0.0.2.12345: UDP, length 16
10:28:55.726471 IP 10.0.0.1.12345 > 10.0.0.2.12345: UDP, length 16
10:28:56.726716 IP 10.0.0.1.12345 > 10.0.0.2.12345: UDP, length 16
10:28:57.726938 IP 10.0.0.1.12345 > 10.0.0.2.12345: UDP, length 16
10:28:58.727144 IP 10.0.0.1.12345 > 10.0.0.2.12345: UDP, length 16
10:28:59.727368 IP 10.0.0.1.12345 > 10.0.0.2.12345: UDP, length 16
10:29:00.727562 IP 10.0.0.1.12345 > 10.0.0.2.12345: UDP, length 16
10:29:01.727778 IP 10.0.0.1.12345 > 10.0.0.2.12345: UDP, length 16
10:29:02.728020 IP 10.0.0.1.12345 > 10.0.0.2.12345: UDP, length 16
10:29:03.728240 IP 10.0.0.1.12345 > 10.0.0.2.12345: UDP, length 16
10:29:04.728443 IP 10.0.0.1.12345 > 10.0.0.2.12345: UDP, length 16
10:29:05.728669 IP 10.0.0.1.12345 > 10.0.0.2.12345: UDP, length 16
10:29:06.728921 IP 10.0.0.1.12345 > 10.0.0.2.12345: UDP, length 16
10:29:07.729158 IP 10.0.0.1.12345 > 10.0.0.2.12345: UDP, length 16
10:29:08.729405 IP 10.0.0.1.12345 > 10.0.0.2.12345: UDP, length 16
10:29:09.729607 IP 10.0.0.1.12345 > 10.0.0.2.12345: UDP, length 16
10:29:10.729790 IP 10.0.0.1.12345 > 10.0.0.2.12345: UDP, length 16
10:29:11.729984 IP 10.0.0.1.12345 > 10.0.0.2.12345: UDP, length 16
10:29:12.730231 IP 10.0.0.1.12345 > 10.0.0.2.12345: UDP, length 16
10:29:13.730466 IP 10.0.0.1.12345 > 10.0.0.2.12345: UDP, length 16
10:29:14.730702 IP 10.0.0.1.12345 > 10.0.0.2.12345: UDP, length 16
10:29:15.730895 IP 10.0.0.1.12345 > 10.0.0.2.12345: UDP, length 16
10:29:16.731139 IP 10.0.0.1.12345 > 10.0.0.2.12345: UDP, length 16
10:29:17.731354 IP 10.0.0.1.12345 > 10.0.0.2.12345: UDP, length 16
10:29:18.731603 IP 10.0.0.1.12345 > 10.0.0.2.12345: UDP, length 16
10:29:19.731812 IP 10.0.0.1.12345 > 10.0.0.2.12345: UDP, length 16
10:29:20.731995 IP 10.0.0.1.12345 > 10.0.0.2.12345: UDP, length 16
10:29:21.732169 IP 10.0.0.1.12345 > 10.0.0.2.12345: UDP, length 16
10:29:22.732411 IP 10.0.0.1.12345 > 10.0.0.2.12345: UDP, length 16
10:29:23.732613 IP 10.0.0.1.12345 > 10.0.0.2.12345: UDP, length 16
10:29:24.732855 IP 10.0.0.1.12345 > 10.0.0.2.12345: UDP, length 16
10:29:25.733061 IP 10.0.0.1.12345 > 10.0.0.2.12345: UDP, length 16
10:29:26.733304 IP 10.0.0.1.12345 > 10.0.0.2.12345: UDP, length 16
10:29:27.733509 IP 10.0.0.1.12345 > 10.0.0.2.12345: UDP, length 16
10:29:28.733743 IP 10.0.0.1.12345 > 10.0.0.2.12345: UDP, length 16
10:29:29.733987 IP 10.0.0.1.12345 > 10.0.0.2.12345: UDP, length 16
10:29:30.734237 IP 10.0.0.1.12345 > 10.0.0.2.12345: UDP, length 16
10:29:31.734443 IP 10.0.0.1.12345 > 10.0.0.2.12345: UDP, length 16
10:29:32.734659 IP 10.0.0.1.12345 > 10.0.0.2.12345: UDP, length 16
10:29:33.734834 IP 10.0.0.1.12345 > 10.0.0.2.12345: UDP, length 16
10:29:34.735078 IP 10.0.0.1.12345 > 10.0.0.2.12345: UDP, length 16
10:29:35.735255 IP 10.0.0.1.12345 > 10.0.0.2.12345: UDP, length 16
10:29:36.735502 IP 10.0.0.1.12345 > 10.0.0.2.12345: UDP, length 16
10:29:37.735691 IP 10.0.0.1.12345 > 10.0.0.2.12345: UDP, length 16
10:29:38.735977 IP 10.0.0.1.12345 > 10.0.0.2.12345: UDP, length 16
10:29:39.736155 IP 10.0.0.1.12345 > 10.0.0.2.12345: UDP, length 16
10:29:40.736383 IP 10.0.0.1.12345 > 10.0.0.2.12345: UDP, length 16
10:29:41.736557 IP 10.0.0.1.12345 > 10.0.0.2.12345: UDP, length 16
10:29:42.736810 IP 10.0.0.1.12345 > 10.0.0.2.12345: UDP, length 16
10:29:43.736987 IP 10.0.0.1.12345 > 10.0.0.2.12345: UDP, length 16
10:29:44.737226 IP 10.0.0.1.12345 > 10.0.0.2.12345: UDP, length 16
10:29:45.737402 IP 10.0.0.1.12345 > 10.0.0.2.12345: UDP, length 16
10:29:46.737649 IP 10.0.0.1.12345 > 10.0.0.2.12345: UDP, length 16
10:29:47.737853 IP 10.0.0.1.12345 > 10.0.0.2.12345: UDP, length 16
10:29:48.738101 IP 10.0.0.1.12345 > 10.0.0.2.12345: UDP, length 16
10:29:49.738278 IP 10.0.0.1.12345 > 10.0.0.2.12345: UDP, length 16
10:29:50.738526 IP 10.0.0.1.12345 > 10.0.0.2.12345: UDP, length 16
10:29:51.738649 IP 10.0.0.1.12345 > 10.0.0.2.12345: UDP, length 16
10:29:52.738877 IP 10.0.0.1.12345 > 10.0.0.2.12345: UDP, length 16
10:29:53.739053 IP 10.0.0.1.12345 > 10.0.0.2.12345: UDP, length 16
10:29:54.739302 IP 10.0.0.1.12345 > 10.0.0.2.12345: UDP, length 16
10:29:55.739480 IP 10.0.0.1.12345 > 10.0.0.2.12345: UDP, length 16
10:29:56.739815 IP 10.0.0.1.12345 > 10.0.0.2.12345: UDP, length 16
10:29:57.740036 IP 10.0.0.1.12345 > 10.0.0.2.12345: UDP, length 16
10:29:58.740253 IP 10.0.0.1.12345 > 10.0.0.2.12345: UDP, length 16
10:29:59.740503 IP 10.0.0.1.12345 > 10.0.0.2.12345: UDP, length 16
10:30:00.740700 IP 10.0.0.1.12345 > 10.0.0.2.12345: UDP, length 16
10:30:01.740951 IP 10.0.0.1.12345 > 10.0.0.2.12345: UDP, length 16
10:30:02.741204 IP 10.0.0.1.12345 > 10.0.0.2.12345: UDP, length 16
10:30:03.741405 IP 10.0.0.1.12345 > 10.0.0.2.12345: UDP, length 16
10:30:04.741634 IP 10.0.0.1.12345 > 10.0.0.2.12345: UDP, length 16
10:30:05.741888 IP 10.0.0.1.12345 > 10.0.0.2.12345: UDP, length 16
10:30:06.742128 IP 10.0.0.1.12345 > 10.0.0.2.12345: UDP, length 16
10:30:07.742375 IP 10.0.0.1.12345 > 10.0.0.2.12345: UDP, length 16
10:30:08.742615 IP 10.0.0.1.12345 > 10.0.0.2.12345: UDP, length 16
10:30:09.742817 IP 10.0.0.1.12345 > 10.0.0.2.12345: UDP, length 16
10:30:10.743025 IP 10.0.0.1.12345 > 10.0.0.2.12345: UDP, length 16
10:30:11.743276 IP 10.0.0.1.12345 > 10.0.0.2.12345: UDP, length 16
10:30:12.743521 IP 10.0.0.1.12345 > 10.0.0.2.12345: UDP, length 16
10:30:13.743859 IP 10.0.0.1.12345 > 10.0.0.2.12345: UDP, length 16
10:30:14.744115 IP 10.0.0.1.12345 > 10.0.0.2.12345: UDP, length 16
10:30:15.744371 IP 10.0.0.1.12345 > 10.0.0.2.12345: UDP, length 16
10:30:16.744602 IP 10.0.0.1.12345 > 10.0.0.2.12345: UDP, length 16
10:30:17.744858 IP 10.0.0.1.12345 > 10.0.0.2.12345: UDP, length 16
10:30:18.745049 IP 10.0.0.1.12345 > 10.0.0.2.12345: UDP, length 16
10:30:19.745268 IP 10.0.0.1.12345 > 10.0.0.2.12345: UDP, length 16
10:30:20.745508 IP 10.0.0.1.12345 > 10.0.0.2.12345: UDP, length 16
10:30:21.745762 IP 10.0.0.1.12345 > 10.0.0.2.12345: UDP, length 16
10:30:22.746016 IP 10.0.0.1.12345 > 10.0.0.2.12345: UDP, length 16
10:30:23.746269 IP 10.0.0.1.12345 > 10.0.0.2.12345: UDP, length 16
10:30:24.746497 IP 10.0.0.1.12345 > 10.0.0.2.12345: UDP, length 16
10:30:25.746753 IP 10.0.0.1.12345 > 10.0.0.2.12345: UDP, length 16
10:30:26.747003 IP 10.0.0.1.12345 > 10.0.0.2.12345: UDP, length 16
10:30:27.747261 IP 10.0.0.1.12345 > 10.0.0.2.12345: UDP, length 16
10:30:28.747505 IP 10.0.0.1.12345 > 10.0.0.2.12345: UDP, length 16
10:30:29.747858 IP 10.0.0.1.12345 > 10.0.0.2.12345: UDP, length 16
10:30:30.748117 IP 10.0.0.1.12345 > 10.0.0.2.12345: UDP, length 16
10:30:31.748349 IP 10.0.0.1.12345 > 10.0.0.2.12345: UDP, length 16
10:30:32.748602 IP 10.0.0.1.12345 > 10.0.0.2.12345: UDP, length 16
10:30:33.748856 IP 10.0.0.1.12345 > 10.0.0.2.12345: UDP, length 16
10:30:34.749107 IP 10.0.0.1.12345 > 10.0.0.2.12345: UDP, length 16
10:30:35.749360 IP 10.0.0.1.12345 > 10.0.0.2.12345: UDP, length 16
10:30:36.749606 IP 10.0.0.1.12345 > 10.0.0.2.12345: UDP, length 16
10:30:37.749861 IP 10.0.0.1.12345 > 10.0.0.2.12345: UDP, length 16
10:30:38.750113 IP 10.0.0.1.12345 > 10.0.0.2.12345: UDP, length 16
10:30:39.750363 IP 10.0.0.1.12345 > 10.0.0.2.12345: UDP, length 16
10:30:40.750560 IP 10.0.0.1.12345 > 10.0.0.2.12345: UDP, length 16
10:30:41.750810 IP 10.0.0.1.12345 > 10.0.0.2.12345: UDP, length 16
10:30:42.751026 IP 10.0.0.1.12345 > 10.0.0.2.12345: UDP, length 16
10:30:43.751276 IP 10.0.0.1.12345 > 10.0.0.2.12345: UDP, length 16
10:30:44.751510 IP 10.0.0.1.12345 > 10.0.0.2.12345: UDP, length 16
10:30:45.751797 IP 10.0.0.1.12345 > 10.0.0.2.12345: UDP, length 16
10:30:46.752048 IP 10.0.0.1.12345 > 10.0.0.2.12345: UDP, length 16
10:30:47.752306 IP 10.0.0.1.12345 > 10.0.0.2.12345: UDP, length 16
10:30:48.752503 IP 10.0.0.1.12345 > 10.0.0.2.12345: UDP, length 16
10:30:49.752750 IP 10.0.0.1.12345 > 10.0.0.2.12345: UDP, length 16
10:30:50.752930 IP 10.0.0.1.12345 > 10.0.0.2.12345: UDP, length 16
10:30:51.753153 IP 10.0.0.1.12345 > 10.0.0.2.12345: UDP, length 16
10:30:52.753349 IP 10.0.0.1.12345 > 10.0.0.2.12345: UDP, length 16
10:30:53.753596 IP 10.0.0.1.12345 > 10.0.0.2.12345: UDP, length 16
10:30:54.753817 IP 10.0.0.1.12345 > 10.0.0.2.12345: UDP, length 16
10:30:55.754072 IP 10.0.0.1.12345 > 10.0.0.2.12345: UDP, length 16
10:30:56.754303 IP 10.0.0.1.12345 > 10.0.0.2.12345: UDP, length 16
10:30:57.754557 IP 10.0.0.1.12345 > 10.0.0.2.12345: UDP, length 16
10:30:58.754780 IP 10.0.0.1.12345 > 10.0.0.2.12345: UDP, length 16
10:30:59.754987 IP 10.0.0.1.12345 > 10.0.0.2.12345: UDP, length 16
10:31:00.755183 IP 10.0.0.1.12345 > 10.0.0.2.12345: UDP, length 16
10:31:01.755429 IP 10.0.0.1.12345 > 10.0.0.2.12345: UDP, length 16
10:31:02.755693 IP 10.0.0.1.12345 > 10.0.0.2.12345: UDP, length 16
10:31:03.755896 IP 10.0.0.1.12345 > 10.0.0.2.12345: UDP, length 16
10:31:04.756088 IP 10.0.0.1.12345 > 10.0.0.2.12345: UDP, length 16
10:31:05.756338 IP 10.0.0.1.12345 > 10.0.0.2.12345: UDP, length 16
10:31:06.756556 IP 10.0.0.1.12345 > 10.0.0.2.12345: UDP, length 16
10:31:07.756808 IP 10.0.0.1.12345 > 10.0.0.2.12345: UDP, length 16
10:31:08.757046 IP 10.0.0.1.12345 > 10.0.0.2.12345: UDP, length 16
10:31:09.757299 IP 10.0.0.1.12345 > 10.0.0.2.12345: UDP, length 16
10:31:10.757492 IP 10.0.0.1.12345 > 10.0.0.2.12345: UDP, length 16
10:31:11.757742 IP 10.0.0.1.12345 > 10.0.0.2.12345: UDP, length 16
10:31:12.757955 IP 10.0.0.1.12345 > 10.0.0.2.12345: UDP, length 16
10:31:13.758207 IP 10.0.0.1.12345 > 10.0.0.2.12345: UDP, length 16
10:31:14.758435 IP 10.0.0.1.12345 > 10.0.0.2.12345: UDP, length 16
10:31:15.758683 IP 10.0.0.1.12345 > 10.0.0.2.12345: UDP, length 16
10:31:16.758923 IP 10.0.0.1.12345 > 10.0.0.2.12345: UDP, length 16
10:31:17.759176 IP 10.0.0.1.12345 > 10.0.0.2.12345: UDP, length 16
10:31:18.759400 IP 10.0.0.1.12345 > 10.0.0.2.12345: UDP, length 16
10:31:19.759645 IP 10.0.0.1.12345 > 10.0.0.2.12345: UDP, length 16
10:31:20.759859 IP 10.0.0.1.12345 > 10.0.0.2.12345: UDP, length 16
10:31:21.760110 IP 10.0.0.1.12345 > 10.0.0.2.12345: UDP, length 16
10:31:22.760327 IP 10.0.0.1.12345 > 10.0.0.2.12345: UDP, length 16
10:31:23.760579 IP 10.0.0.1.12345 > 10.0.0.2.12345: UDP, length 16
10:31:24.760784 IP 10.0.0.1.12345 > 10.0.0.2.12345: UDP, length 16
10:31:25.761033 IP 10.0.0.1.12345 > 10.0.0.2.12345: UDP, length 16
10:31:26.761261 IP 10.0.0.1.12345 > 10.0.0.2.12345: UDP, length 16
10:31:27.761482 IP 10.0.0.1.12345 > 10.0.0.2.12345: UDP, length 16
10:31:28.761686 IP 10.0.0.1.12345 > 10.0.0.2.12345: UDP, length 16
10:31:29.761938 IP 10.0.0.1.12345 > 10.0.0.2.12345: UDP, length 16
10:31:30.762149 IP 10.0.0.1.12345 > 10.0.0.2.12345: UDP, length 16
10:31:31.762400 IP 10.0.0.1.12345 > 10.0.0.2.12345: UDP, length 16
10:31:32.762606 IP 10.0.0.1.12345 > 10.0.0.2.12345: UDP, length 16
10:31:33.762832 IP 10.0.0.1.12345 > 10.0.0.2.12345: UDP, length 16
10:31:34.763052 IP 10.0.0.1.12345 > 10.0.0.2.12345: UDP, length 16

